,controversiality,parent_id,body,subreddit,id,score,subreddit_id
2321314,0,t1_clyffwf,May need to figure some way out after I pick up my copies from the Wesley Chapel  to head to the usf gamestop,eonticket,clymmrc,1,t5_34fuy
2383507,0,t3_2mp657,Chicago here if someone has the eon  ticket Ill go!,eonticket,cm6b5o2,1,t5_34fuy
2407651,0,t3_2lrwto,Fort Collins here commenting in case Denver gets the goods! ,eonticket,cm9am86,1,t5_34fuy
2437313,0,t3_2ne0tx,lel,eonticket,cmcyheo,1,t5_34fuy
2449943,0,t3_2nkwiw,Not sure if youre a student or not up there. Are you headed to milwaukee at all for thanksgiving today? If so Id drive by that house to get me some eon ticket,eonticket,cmeilx3,1,t5_34fuy
2470194,0,t3_2nul8a,Im not even getting any streetpasses anymore let alone any with Eon Tickets. On the  one now.,eonticket,cmh0jra,1,t5_34fuy
2476583,0,t1_cmhtqmc,i did,eonticket,cmhtr95,1,t5_34fuy
2485335,0,t1_cmiyy7a,Great! Have fun and good luck catching Latis!,eonticket,cmiyzmv,2,t5_34fuy
2486418,0,t3_2nwu3i,Hi are you talking about UH main?,eonticket,cmj433l,1,t5_34fuy
2497714,0,t3_2o7l5u,Bump ,eonticket,cmkl8d5,1,t5_34fuy
2505564,0,t1_cmllxfr,In your computer you went to change adapter settings right? and changed the adapter with your wireless underneath it?I have ATTUverse so I dont know how easily theyll let me change the router SSID,eonticket,cmlm65u,1,t5_34fuy
2507284,0,t1_cmlpffw,This sounds the most promising place to give the Eon code so far. But Im not sure that it will work with US DS. Ive noticed that these codes have the same  character at the beginning like the European Gengar and Diancie codes.,eonticket,cmlu9ld,1,t5_34fuy
2526428,0,t3_2oc5rp,I will be in EP this Thursday for the holidays can I keep in contact with you amp let you know when I can meet somewhere around then?,eonticket,cmoca6r,1,t5_34fuy
2571665,0,t3_2ojpsc,Hey Im on Staten Island where could I pass you for the ticket?,eonticket,cmu96w2,1,t5_34fuy
2572449,0,t3_2otmdx,Hi I live in Raleigh not Charlotte.  I also commute to Greensboro.  I was wondering if you ever are east of Charlotte?,eonticket,cmucvqm,1,t5_34fuy
2640805,0,t3_2pwkq9,Nice where in OC? Im in Costa Mesa,eonticket,cn3aa0l,1,t5_34fuy
2697956,0,t1_cnaqnoi,Perfect Im free all day. ,eonticket,cnaqpfu,1,t5_34fuy
2722730,0,t1_cndk5er,Im getting ready right now. I think my ride wants to go to Walmart first so Ill let you know once Im in the car. Just to confirm the GameStop by tacobell and condom since right?,eonticket,cndk9kq,1,t5_34fuy
