,controversiality,parent_id,body,subreddit,id,score,subreddit_id
674049,0,t1_cggu0ea,Transferring almost everything from the sub to the Twitter. Specifically anything mod related and anything that is becoming popular. As well as generally spreading awareness of the sub.,luckystar,cggw141,1,t5_2trfi
830775,0,t3_239s3t,I would personally like to take credit for this dramatic turn of events! Surely my love and passion for Konatachan has caused this sub to get noticed!,luckystar,cgyplr4,1,t5_2trfi
1025986,0,t3_25uqps,deleted,luckystar,chkwt0y,1,t5_2trfi
1179797,0,t3_27mvib,Up until they head to college. I think volume .,luckystar,ci2ci9a,1,t5_2trfi
1855833,0,t3_2fuflz,I am having a sick day. I put some effort into this installment of When I feel like it Misao.This source...is...SAFE FOR WORK!!A Healthy Link,luckystar,ckctmv0,3,t5_2trfi
1919690,0,t1_ckki96b,I did make a workinprogress Steam Group.See?HoweverWe need a square picture that represents all of this subreddit.,luckystar,ckkicuk,3,t5_2trfi
2534705,0,t1_cmp621s,Sorry I didnt get around to it sooner. Here are the Fan AnnotationsgtShe is saying cos tai incredibly sleepily. While there are several translations shes basically saying I want to fuck with Konata in subtext. Other subbers have that as the subtitle here.andgtKxK Fan Service? The actual subtitle from that clip says gtI want us to join our bodiesand the final annotationgtI think Tsukasas reaction was the funniest part of the whole OVAI dont know if Ive actually watched my physical OVA disk so I dont know how they have it subtitled. As for the version I originally watched it is subtitled as gtI want to    with Konata.so pretty close to watch the annotation implies.,luckystar,cmpf7sj,2,t5_2trfi
2555592,0,t3_2oubqo,Konata gt chibikko gt ShimakazeI lold Also Kagami lol,luckystar,cms5ixb,2,t5_2trfi
2569214,0,t1_cmtxmsf,I dont know if I should regret helping you...,luckystar,cmtxn9u,3,t5_2trfi
3070451,0,t3_2sl2ka,paint? ,luckystar,cog8z5a,1,t5_2trfi
3209624,0,t1_counl7h,Haha honestly  as soon as you posted I watched her points climb pretty fast! Edit lol  her current upvotes,luckystar,couodbw,2,t5_2trfi
3293887,0,t3_2xtvmo,Konata,luckystar,cp3q9x3,1,t5_2trfi
3475286,0,t3_301t8u,Its not over yet!,luckystar,cpoepfx,2,t5_2trfi
3792857,0,t3_33v1wg,upenguinbond is busy today so Im covering for him today.Also how many people thought this was a picture of Konata and Kanata before looking at it or the thumbnail p,luckystar,cqom6qp,1,t5_2trfi
3991007,0,t1_crb6qvu,Cheers for this! Shame about the source being deleted. However Im a grown man and can click what I want lewd,luckystar,crb7j57,2,t5_2trfi
4261555,0,t1_cs5s0jv,Hey it may not stop the most determined but if itll stop some then I consider it a success,luckystar,cs5zv6q,3,t5_2trfi
4461218,0,t3_3c7ste, I mean like... this is pretty and all. But with this one and the Kagami one from earlier like there is another sub for this sort of Lucky Star stuff I think.,luckystar,cst0let,2,t5_2trfi
4522113,0,t1_csyv7a8,Id rather a telekinesis I keep seeing it in my dreams and it feels so cool. Lazy mans superpower.,luckystar,ct0nilj,0,t5_2trfi
5211494,0,t3_3ma62t,insert deafening fanboy cheers here,luckystar,cve6ep0,3,t5_2trfi
5353799,0,t1_cvvtvrf,Oh goddamnit I didnt even notice lt ,luckystar,cvw0b56,1,t5_2trfi
6084464,0,t3_3yvug5,Sure am looking forward to learning Japanese so I can understand the things I can read. ,luckystar,cyh5jg6,2,t5_2trfi
6271197,0,t3_41hpnl,Still wondering what kind of food that is...,luckystar,cz2gqwh,2,t5_2trfi
6396117,0,t1_czglqge,adorable,luckystar,czgo88u,1,t5_2trfi
6458364,0,t1_cznc30v,deleted,luckystar,cznc6mt,2,t5_2trfi
6776949,0,t3_48kuys,no thats the most effiecient way!,luckystar,d0kg8pp,4,t5_2trfi
7241094,0,t3_4ejwkr,I wonder where the application form is?,luckystar,d219cx3,3,t5_2trfi
7407594,0,t3_4gkzz0,A counter to Mervs argument  I bet Kuroi gets hammered and goes arcadehopping all the time.,luckystar,d2k71au,3,t5_2trfi
8496815,0,t1_d63mwar,Just looking around since she just moved out. ,luckystar,d63nitd,3,t5_2trfi
8547204,0,t3_4wu8np,Kagami the Frankensteins Monster Tsukasa the Cursed Black Cat and Miyuki the evil witch! Watch out Konata theyre all going to get you!!!Source,luckystar,d69z09r,3,t5_2trfi
8849248,0,t3_51cpid,rmeirl,luckystar,d7bjy8o,3,t5_2trfi
9123644,0,t3_557uoq,Lets have some fun!,luckystar,d88ih9p,2,t5_2trfi
9225972,0,t3_56q6x7,Source,luckystar,d8lgk7v,2,t5_2trfi
9998732,0,t1_dbapj1c,Oh so like parasyte!,luckystar,dbav394,2,t5_2trfi
10109294,0,t1_dbou5t0,If you want an invite link,luckystar,dbp92me,2,t5_2trfi
10163497,0,t1_dbu0guw,gtrepliesgtstill doesnt postp,luckystar,dbw378p,1,t5_2trfi
10678799,0,t1_ddfs42w,there were no survivors,luckystar,ddhfr2n,2,t5_2trfi
