,controversiality,parent_id,body,subreddit,id,score,subreddit_id
6485377,0,t3_44h52c,Donkey Kong,Kappa,czq4wsg,-1,t5_2tjsd
6485401,0,t3_44h52c,Super Mario Bros ,Kappa,czq500t,0,t5_2tjsd
6487311,0,t3_44fjc6,Im  and I still live with my parents mostly because they need my help with their Mini Market. They say they dont but I moved out once when I started going to college in the States I was living in Tijuana and asked me to comeback. I got kicked out of my parents home and I was doing well on my own and they asked me to comeback. The two times that I came back it was because they needed my help with the store. After this years Evo Im going to start looking for a job in the States again so I can move over there and start doing my own thing. Plus crossing the border just to go to work or school is a fucking bitch. Wait times are out of control.,Kappa,czqc3z4,1,t5_2tjsd
6487462,0,t1_czo8d6d,this                ,Kappa,czqco7q,1,t5_2tjsd
6488349,0,t3_44iknd,i support gay people being homophobic,Kappa,czqfz9o,4,t5_2tjsd
6488589,0,t1_czqgm01,i dont fuckin know dude im just some autist that posts pictures of his cat on an internet forumdo you see how retarded asking rkappa for help is now?,Kappa,czqgvgu,33,t5_2tjsd
6488945,0,t1_czqfvpb,The short cuts let you set more than just put back to middle. It is just a nice simple little thing the feature isnt useless just not hugely important. And anyway on the madcatz site that chun TE costs as much as a TE plus anyway so really it doesnt be extra money,Kappa,czqi7ab,3,t5_2tjsd
6490408,0,t1_czqhgch,How does he even know what EMP is?,Kappa,czqnncq,1,t5_2tjsd
6491430,0,t3_44jgn1,in all honesty the only  things people give a shit about here are thick asians and pets,Kappa,czqrggf,1,t5_2tjsd
6495177,0,t3_44l5lh,Ill follow him for a bag of weed..  Kappa,Kappa,czr5dwk,-1,t5_2tjsd
6497905,0,t3_44lqke,I approve the Game of Thrones Tech,Kappa,czrfk56,3,t5_2tjsd
6498343,0,t1_czrh4y2,No not really but I think people who want to look into your integrity as a TO or whatever you claim to be will see that and be reluctant to deal with it. ,Kappa,czrh6wk,8,t5_2tjsd
6498499,0,t1_czrhk0y,The HRAP v kai is the one with massive lag the hrap v is the same as the madcatz TEEdit and the deal is for the kai so nevermind,Kappa,czrhrvt,1,t5_2tjsd
6501131,0,t1_czrnsop,Can confirm XO on Eddie made  yr old me feel like the best in the world.,Kappa,czrrl2t,2,t5_2tjsd
6502864,0,t3_44nry7,I want to see Fchamp lose. The reaction to that would be far greater than if KBR lost. Theyre both shitty people though so it doesnt really matter who wins.,Kappa,czry1h8,25,t5_2tjsd
6509780,0,t3_44sdsk,Rip sf ,Kappa,czsnt9a,1,t5_2tjsd
6510991,0,t1_czss70m,faggot,Kappa,czssbug,-1,t5_2tjsd
6511842,0,t1_czst6gq,Its just another rKappa circlejerk now over top people at MadCatz bailing before seeing the latest financial numbers possibly meaning that MCZ might be going out of business soon.,Kappa,czsvi9y,6,t5_2tjsd
6517153,0,t3_44wqq0,this was the best one by far,Kappa,cztfaag,0,t5_2tjsd
6517534,0,t3_44wkyz,Damn i feel bad for spending  euros on brook converter ,Kappa,cztgpce,4,t5_2tjsd
6518360,0,t3_44wkyz,Good thing Im lazy and didnt buy that brook converter yet.,Kappa,cztjs83,2,t5_2tjsd
6518791,0,t3_44wl7c,Shit I forgot about those ugly fucking shoes.,Kappa,cztle4m,7,t5_2tjsd
6520569,1,t1_cztrmg4,OP made the link because Aris is sponsored by madcatz and markman is ariss friend. Why are you bitter though? Its a joke dude get laid once in a while.,Kappa,czts0mi,4,t5_2tjsd
6520856,0,t1_cztodlr,VOICE IS MAD,Kappa,cztt378,-4,t5_2tjsd
6521852,0,t1_cztw9ri,my life is a shit post good as hell,Kappa,cztwsxr,-3,t5_2tjsd
6523712,0,t1_czu0wn1,Please dont remind me BibleThump,Kappa,czu3qnl,1,t5_2tjsd
6527572,0,t1_czugpuu,Rude.,Kappa,czui4ao,18,t5_2tjsd
6528578,0,t3_450uun,I hope Daigo is getting paid because I wouldnt fly across the world to body a ShinBlankatier player,Kappa,czulusk,11,t5_2tjsd
6530264,0,t3_452u49,Was never really alive to begin with,Kappa,czus4et,5,t5_2tjsd
6531534,0,t1_czuws19,personally boredom and tired of seeing some loser trying to make fun of fat people or students when hes just a shitty troll who got destroyed on a debate against jamessmk,Kappa,czuwuso,7,t5_2tjsd
6533161,0,t3_4548yi,Looks like she orgasms as it breaks i like this more than i should,Kappa,czv2xc6,39,t5_2tjsd
6535395,0,t3_454lxz,So play it.Show us pics of the game working.,Kappa,czvb90s,2,t5_2tjsd
6536340,0,t3_455a75,HUNREN PERCENTER,Kappa,czverwc,2,t5_2tjsd
6539068,0,t3_456yqu,New Onimusha too...maybe,Kappa,czvoyco,0,t5_2tjsd
6542722,1,t3_4596if,another voice alt another downvote,Kappa,czw2jql,1,t5_2tjsd
6543564,1,t1_czw5jp8,HES FROM LOUISIANA,Kappa,czw5oqw,1,t5_2tjsd
6543661,0,t1_czw5yop,im sorry i dont live on the reddit forums like you do.,Kappa,czw61r6,-3,t5_2tjsd
6543716,0,t1_czw43xd,DestiSenpai,Kappa,czw694c,1,t5_2tjsd
6545107,0,t3_4576bj,Great piece.,Kappa,czwbfg5,4,t5_2tjsd
6546606,0,t3_45aaj4,With a humada neck thing and a flick of da wrist,Kappa,czwh0jk,5,t5_2tjsd
6547318,0,t1_czw3uv0,I know I was just fucking with you. I completely agree. I wish they went with the CVS Capcom style of art. That art was godlike. ,Kappa,czwjo6d,1,t5_2tjsd
6548371,0,t1_czwj5da,,Kappa,czwnlh1,3,t5_2tjsd
6552218,0,t1_czwd8nt,casuals will have moved on to the next flavor of the month game by the time the story mode gets patched in.most of them will not even know it exists or care to come back at that point,Kappa,czx1xdi,2,t5_2tjsd
6552785,0,t1_czx3d81,evoMindBlown,Kappa,czx415k,2,t5_2tjsd
6556611,0,t3_45fqag,,Kappa,czxi9z1,3,t5_2tjsd
6557124,0,t3_45fvdy,Yup,Kappa,czxk6tj,11,t5_2tjsd
6558860,0,t1_czxphoe,and this is a less stereotipical one. Im not saying it is vaporwave just that it reminds me of it,Kappa,czxqnxo,-1,t5_2tjsd
6559417,0,t3_45ganb,no one likes you lpnor maybe im just projecting my insecurities onto youeither way fuck you,Kappa,czxsqoo,20,t5_2tjsd
6560001,0,t3_45fxe2,This seem pretty obsolete since  BB Central Fiction is the lastest one,Kappa,czxuwy7,-4,t5_2tjsd
6564489,0,t3_45jegn,uMarkMan dats one good ass quality Madcuckz producks  LOZ EleGiggle  EleGiggle  EleGiggle  Head,Kappa,czybmsg,70,t5_2tjsd
6564971,0,t1_czycf9l,gtdont actually smack mequickly puts away paddle,Kappa,czydf7x,1,t5_2tjsd
6565215,0,t1_czybmsg,hes not posting again til sf comes out,Kappa,czyebtd,5,t5_2tjsd
6565634,0,t3_45gvxk,So this is really Daigos twitter account? Whos posting in ENG for him then?,Kappa,czyfvtm,1,t5_2tjsd
6566979,0,t3_45kzpm,or you cud make  new account as the real name dlc characters. so u now what character is which account and finish the story mode gives u  right Kappa,Kappa,czykw4e,0,t5_2tjsd
6567433,0,t3_45kstf,Lame,Kappa,czymkvz,3,t5_2tjsd
6569914,0,t3_45mugc,lol shadowbanned,Kappa,czyvtbg,0,t5_2tjsd
6570967,0,t3_45mfx5,cute kitty ,Kappa,czyzqmk,1,t5_2tjsd
6572486,0,t3_45o4et,damn what a waste. that could have been poongkokazunoko,Kappa,czz5e6r,-11,t5_2tjsd
6572738,0,t3_45obil,GIFV link  FAQ,Kappa,czz6byo,4,t5_2tjsd
6573677,0,t3_45okqg,Nice tits ,Kappa,czz9tvz,1,t5_2tjsd
6574564,0,t3_45owk0,Valles esports cocaine palace should be opening shortly,Kappa,czzd4lf,70,t5_2tjsd
6575323,0,t3_45ovbg,thats weird that it would happen since that would mean when he presses right the silicon membrane has a perfect vacuum between the membrane and the circuit board. this shouldnt happen as every membrane needs to have an air gappath to the outside. i cant imagine mad catz engineers are that incredibly incompetent to have forgotten this principle.for example ,Kappa,czzfy2c,6,t5_2tjsd
6575343,0,t3_45obil,See me at streetfighter    PogChamp,Kappa,czzg0qk,8,t5_2tjsd
6575451,0,t1_czzg730,Nah it plays like Tera but faster. Id recommend it if you like wuxia and thick elf legs.,Kappa,czzgf5k,8,t5_2tjsd
6575553,0,t1_czz0l8u,Shut up stoner,Kappa,czzgssd,2,t5_2tjsd
6576620,0,t1_czzgi6a, PogChamp,Kappa,czzkrd1,1,t5_2tjsd
6577174,0,t3_45qr5w,Greatest of ease. What a way to go out though. GGs amazing set of videos,Kappa,czzmtjf,26,t5_2tjsd
6577252,0,t3_45qcw1,too eatsporks for me,Kappa,czzn3za,3,t5_2tjsd
6578313,0,t1_czzhcti,Handouts or reacharounds?,Kappa,czzr25z,2,t5_2tjsd
6582310,0,t1_d005tn0,This post is dripping with autism and butthurt.,Kappa,d005xrt,11,t5_2tjsd
6583858,0,t3_45us7s,This aint d tho,Kappa,d00bpo1,0,t5_2tjsd
6585646,0,t3_45us7z,I played SFV last Friday with a PS stick and didnt feel any lag. Hell out of the  players that were playing SFV that night no one complained about lag when using a PS. Evo should just say that they are sucking Mad Catz dick to get that discount on the Daigo appearance fee if they make people buy Mad Catz PS sticks.,Kappa,d00iczm,10,t5_2tjsd
6586040,0,t3_45voks,No tits.ampnbspLong face.ampnbspSuperhero Jaw.ampnbsp... Id still fuck though because Im a pathetic excuse of a man  ,Kappa,d00jtkz,3,t5_2tjsd
6588069,1,t1_d00in82,gtI think this title is slowly but surely going towards CEO. Its funny how people in Kappa constantly try to parrot this bullshit but dont realize that Jebailey wants to do exactly the same thing EVO does. The thing is he cant because his event is not even  of what EVO is.If you think Jebailey wont support Smash or charge for floor seats  or any other thing you dont like about EVO you are being really clueless. Smash is already the main event at CEO.You think Jebailey wont start cutting off titles once the event has multilple games having  players?He can now run everything because he gets maybe  players at the most per game. Its a childs play when compared to EVO.Also. Final Round shits all over CEO.I swear only this sub will you see people claiming that a  people event is better and more supported than a  people fully fledged world championship.,Kappa,d00rdk0,3,t5_2tjsd
6588521,0,t1_d00su66,Its not in the article but SonicFox won k at ESL Season   at EVO  and another k at ESL Season . Hes at over k even if you exclude all the other tourneys he won outside of those three.,Kappa,d00t23o,3,t5_2tjsd
6590657,0,t3_45vzha, minutes. Just  minutes.,Kappa,d0110hk,3,t5_2tjsd
6591049,0,t1_d00yg98,He will be second Infiltration. ,Kappa,d012h2q,3,t5_2tjsd
6592153,0,t1_d00wxct,do you believe everything you hear...?,Kappa,d016l65,2,t5_2tjsd
6592770,0,t3_45vmx1,WHAT AN ANSWERMrDestructoid,Kappa,d018vxp,0,t5_2tjsd
6594387,0,t1_d00xvyi,Very well put together. ,Kappa,d01ewly,1,t5_2tjsd
6595292,0,t3_460lu3,Kreygasm,Kappa,d01i9xm,2,t5_2tjsd
6595555,0,t3_460mxh,Daigo cant antiair totally free got bodied legit,Kappa,d01j97o,13,t5_2tjsd
6595758,0,t3_460suh,LAST PLACE NOBODY,Kappa,d01k0f9,2,t5_2tjsd
6596234,0,t1_d01j8gs,How would it not be sticky after Daigo touched it?,Kappa,d01ls9s,1,t5_2tjsd
6597509,0,t3_45zmzc,Theres no way this is accidental it has to be a design choice to help readability and give a spritebased aesthetic.,Kappa,d01qis6,6,t5_2tjsd
6597794,0,t3_461c2l,mfw people talk about the struggle here but preorder for full price  OMGScootsanybody who paid more than  first day for this deserves to miss out on his daily ravioli for a while,Kappa,d01rkuv,28,t5_2tjsd
6599566,0,t3_462vyr,deleted,Kappa,d01y66u,1,t5_2tjsd
6599982,0,t3_463343,fuggedaboutit,Kappa,d01zq3g,3,t5_2tjsd
6601867,0,t3_463gvo,Good thing I play default Ryu. ,Kappa,d026rbx,1,t5_2tjsd
6601874,0,t1_d020prn,why dont you ask for wire frames and non animated life bars too?that should prep things for your pentium  to chug right along.,Kappa,d026s9t,2,t5_2tjsd
6603756,0,t1_d02d616,Yeah Im coming to that conclusion too. Not good.,Kappa,d02dsws,2,t5_2tjsd
6604219,0,t3_464vc2,DOTesportsgt  UTCgt hours out until Best of III goes live with TheComboFiend ampamp fubarduck to celebrate SFV twitch.tv pic.twitter.com ImgurMistake?messagecompose?toTweetPosterampsubjectErrorReportampmessagevcAAPlease leave above link unaltered.Suggestionmessagecompose?toTweetPosterampsubjectSuggestionFAQrTweetPostercommentsrelkCodeIssues,Kappa,d02fj3r,0,t5_2tjsd
6605781,0,t3_46429s,i wouldnt have logged on today if i didnt find this out cheers gcs,Kappa,d02lcpy,1,t5_2tjsd
6606241,0,t1_d02lb8j,I would wait a little before saying that. They might as well add some features with different versions of the game.  definitively see valle make a short comeback tho,Kappa,d02n2jy,2,t5_2tjsd
6609647,0,t3_4672r5,jiyuDaigasm,Kappa,d02zruu,1,t5_2tjsd
6611667,0,t1_d033q9y,deleted,Kappa,d037aju,1,t5_2tjsd
6612569,0,t3_468ypp,You had to buy full priced dlc hyper fighting ,Kappa,d03anj6,28,t5_2tjsd
6613163,0,t3_469g01,You mean youve actually been able to find matches? ,Kappa,d03cv6g,42,t5_2tjsd
6613526,0,t1_d038wj2,Says hes on PS so... Head,Kappa,d03e7x2,45,t5_2tjsd
6615755,0,t3_46a5or,i have not had a bad match once connection wise in this game and ive  played it for  hours,Kappa,d03mj0l,2,t5_2tjsd
6616689,0,t1_d033q9y,thats the wtf thing to me. The online issues wouldnt have been such a issue if new folks were grinding out trials or at least trying to beat arcade mode. ,Kappa,d03q0bn,1,t5_2tjsd
6617256,0,t3_46bbgp,It truly is the best emote tho ,Kappa,d03s4fz,7,t5_2tjsd
6618273,0,t3_46avj4,punish? this is more like a blessing to the world,Kappa,d03vwz0,1,t5_2tjsd
6619511,0,t1_d040fte,ur missing ur flair bud,Kappa,d040j3j,2,t5_2tjsd
6622936,0,t3_46dwtm,we are looking at SF.  here we come.,Kappa,d04d9w3,1,t5_2tjsd
6625577,0,t1_d04ezk2,,Kappa,d04n41h,0,t5_2tjsd
6625860,0,t3_46e48a,Especially when Rip makes his ms Doubtfire OOOHHHH!!! every  mins. ,Kappa,d04o61n,10,t5_2tjsd
6626166,0,t1_d04p73l,stmmer det?,Kappa,d04pb45,-2,t5_2tjsd
6630566,0,t1_d04vv27,gt She looks like a waitress at some trendy resteraunt for assholesand... thats a bad thing? Oh well Kappa  poverty confirmed again who the fuck eats at trendy restaurants when you gots MacRibs!,Kappa,d055oku,2,t5_2tjsd
6631420,0,t3_46hjwn,Hey I wonder why Makoto is so weak in SF.Oh right. Thats why.,Kappa,d058v98,25,t5_2tjsd
6632164,0,t3_46i7zm,floe doesnt travel because hes a fat jew,Kappa,d05bn4x,27,t5_2tjsd
6633537,1,t1_d05ghjs,good. more room for me and my autistic  year old smash friends,Kappa,d05gr1m,1,t5_2tjsd
6633649,0,t3_46id94,She chunky but funky,Kappa,d05h620,9,t5_2tjsd
6633883,0,t1_d05hzkd,Eh I admit I havent been here all that long but it looks like this is just an abuse of power hate ban.,Kappa,d05i1d6,3,t5_2tjsd
6634771,0,t1_d05l1cc,ToS probably have a paragraph about tool assisted gameplay being a bannable offense tho ,Kappa,d05lc7s,4,t5_2tjsd
6635580,0,t3_46jn18,wtf is this about?,Kappa,d05ocbn,11,t5_2tjsd
6635934,0,t1_d054pot,He needs to do a lot more than admit he was wrong once before I respect him.,Kappa,d05pnmi,2,t5_2tjsd
6636984,0,t1_d05t932,uhesfromlouisiana you know what to do next bud!,Kappa,d05tk7q,0,t5_2tjsd
6637887,0,t1_d05w83v,Do people still dislike Perfect Legend?  I know all about  and that he got exposed for not being able to back up his trash talk but has he saiddone stupid stuff since then?  I dont follow MK so I dont really know.  He seems like a normal guy to me that got blown up one time and hasnt been able to live it down.,Kappa,d05wxbp,0,t5_2tjsd
6638459,0,t3_46lb3j,lol yeah hes a fukin bitch. Im banned from his chat for telling him to git gud.,Kappa,d05z2dv,16,t5_2tjsd
6639782,0,t3_46logw,you losers jack off to fictional characters?,Kappa,d06405x,-35,t5_2tjsd
6641150,0,t3_46mhrg,yeah,Kappa,d0693lx,-3,t5_2tjsd
6641310,0,t1_d05wfgn,daily reminder dude if youre pro or even neutral GCS youre my altits the life you were born into but youre better for it. ,Kappa,d069p0j,-7,t5_2tjsd
6642785,0,t3_46muj6,Is that  lp lmao,Kappa,d06f6jv,0,t5_2tjsd
6645171,0,t3_46nvpp,Im a bot bleep bloop. Someone has linked to this thread from another place on reddit rkappa Lol everyone getting triggered because Justin has a well paying job. People still dont understand Its Not What You Know Its Who You KnowfooterIf you follow any of the above links please respect the rules of reddit and dont vote in the other threads. InforTotesMessenger  Contactmessagecompose?torTotesMessengerbot,Kappa,d06o2ni,0,t5_2tjsd
6646971,0,t3_46p49x,uSnoozeDoggyDog stop being a bitch nigga look at the subs you post and the shit you watch on youtube. ,Kappa,d06us6o,5,t5_2tjsd
6647766,0,t1_d06r5ew,On Limewire if you were stupid enough to download and run REALLYCOOLMP!!!!!!!!!!!!!!!!!!!!!!!!.exe you deserved your computer to get fucked tbh,Kappa,d06xqf6,1,t5_2tjsd
6647956,0,t1_d06saw7,Definitely not new my first jobs  years ago had engineer in the title. Its still totally fraudulent to call yourself or someone else in a position like this a straight up engineer without clarification. ,Kappa,d06yftd,1,t5_2tjsd
6648882,0,t3_46oewg,ESPORT ROCKS.,Kappa,d071vq1,2,t5_2tjsd
6649315,0,t1_d0732p0,here umaikky. do your job,Kappa,d073hr5,0,t5_2tjsd
6650782,0,t3_46rahj,BibleThump,Kappa,d078y6q,-2,t5_2tjsd
6653324,0,t1_d07h664,the fightstick Im building isnt ready and Im anxious so I made this.note the string holding the stick in place.,Kappa,d07if0n,3,t5_2tjsd
6654893,0,t1_d07bf1m,Maybe he just means by the time you can beat Hell survival you probably have a basic execution ability and know what your character does.But still lmao,Kappa,d07o9go,1,t5_2tjsd
6655090,0,t3_46t7he,wahhh its not what I wanted nor was it made for me wahhhhhhhhhh BabyRage,Kappa,d07oztz,3,t5_2tjsd
6655711,0,t1_d07pzcx,deleted,Kappa,d07rb36,2,t5_2tjsd
6660720,0,t1_d089mto, Awful and cringeworthy kappanga commentator,Kappa,d089xo0,0,t5_2tjsd
6664313,0,t1_d08ikf2,No thats the point. Rayray is famous for getting bodied by fanatiq . While kbr has a evo title. Rayray just being salty.,Kappa,d08nbek,3,t5_2tjsd
6665453,0,t1_d08cycc,contractions always take apostrophe priority nigga missing letters are important.  never forget.whos  who iswhose  possessiveyoure  you areyour  possessiveits  it isits  possessivethere  a placetheyre  they aretheir  possessiveconsider yourself learned,Kappa,d08rkkl,-4,t5_2tjsd
6666053,0,t3_46xqtu,Im still not convinced ToolAssisted is a human. In my imagination hes just a very intelligent computer that can mimic human behavior. Thats it.ToolAssisted is misunderstood. Give him another chance please.,Kappa,d08tt10,15,t5_2tjsd
6666268,0,t1_d08uhwq,Or real tits either apparently.,Kappa,d08ulxe,20,t5_2tjsd
6668841,0,t1_d08uhwq,Theyre real you cunt.,Kappa,d094680,6,t5_2tjsd
6669033,0,t3_46zpb0,more like BETAR,Kappa,d094vvd,1,t5_2tjsd
6670467,0,t1_d096ly0,Been to Sega arcade center in Tokyo. Packed with all ages of folks. ,Kappa,d09a842,7,t5_2tjsd
6670747,0,t1_d08kyet,Listen here man the fact of the matter is if you got this sent to you for free no one is in your house you are alone and no one will ever know you had this there is no doubt in my mind you would tear this shit up.,Kappa,d09b9mv,2,t5_2tjsd
6671809,0,t3_471gn3,Better question why dont deodorant companies sponsor Combo Breaker?  Ive seen the staff kick people out until they put some deodorant on.,Kappa,d09f82e,33,t5_2tjsd
6674099,0,t1_d09ldsa,deleted,Kappa,d09nr9q,1,t5_2tjsd
6675842,0,t1_d09rdsy,Worse adding SFxT Megaman in SFV. ,Kappa,d09u93r,6,t5_2tjsd
6676714,0,t3_473i8j,Whats really funny is you have to link to a post you made  days ago that noone responded to,Kappa,d09xi12,3,t5_2tjsd
6677303,0,t3_471uup,Lets not forget all the lore posts about whether Cody could beat Oro or whatever dumb shit. I dont know why I go there half the time but yeah its like  shitposts that dont even know theyre shitposts.,Kappa,d09zp2r,5,t5_2tjsd
6679460,0,t3_474ttb,Like Im going to trust this shit.,Kappa,d0a7qxx,0,t5_2tjsd
6681067,0,t3_475lbb,So at least Gill and Necro are confirmed for Season . Neat. ,Kappa,d0adqa8,21,t5_2tjsd
6682331,0,t3_475hkz,this is the only LTG related thing that has ever made me laugh. hoooooooly fuck that was funny. every single time he said bbc or cuckhold i thought i was gonna wake up my roommates with the laughter,Kappa,d0aiffi,9,t5_2tjsd
6683301,0,t1_d09xdgf,How do other games handle RQs?  XRD KOF BB Tekken for example? Am actually curious as I dont play many other FGs other than SF. ,Kappa,d0am19r,1,t5_2tjsd
6684556,0,t1_d0apxvf,Dont forget Sabins video as well.,Kappa,d0aqpjx,1,t5_2tjsd
6689011,0,t3_4796te,wub wub wub,Kappa,d0b7alc,1,t5_2tjsd
6689322,0,t3_478e0m,It appears that whoever posted that isnt tonsgrapes or potsplitter may be shadowbanned.,Kappa,d0b8gak,0,t5_2tjsd
6689653,0,t1_d0b094s,TJ Combo had RESURRECTION! in KI and no one complained. Gill could have it provided that its balanced. And it would be hype as shit too. ,Kappa,d0b9oo8,0,t5_2tjsd
6690279,0,t3_479dk5,looks just like how an incestuous inbred gay retard should look.,Kappa,d0bc0mw,0,t5_2tjsd
6690937,0,t1_d0be89r,He just wanted Floe to agree that they both agreed he was burnt out and not winning as much. He was also trying to establish that fLoe himself kinda sorta wanted out of the contract.He played himself.,Kappa,d0begtm,14,t5_2tjsd
6692962,0,t3_47a6a6,Im a bot bleep bloop. Someone has linked to this thread from another place on reddit rkappa Hey umaikky care to explain this?footerIf you follow any of the above links please respect the rules of reddit and dont vote in the other threads. InforTotesMessenger  Contactmessagecompose?torTotesMessengerbot,Kappa,d0blzzm,1,t5_2tjsd
6694239,0,t3_47bfjn,Dayum,Kappa,d0bqqpz,21,t5_2tjsd
6695142,0,t1_d0bu1tg,deleted,Kappa,d0bu3fb,1,t5_2tjsd
6695622,0,t3_47c2h5,yeah thats what I thought too. I dont even want to get into either one of the chats group because there is already a platform to shit talk  here. Theres no need to create another group to circle jerk but ended up dividing us even further and it creates an entitled no name troll version . who think their opinions matter more because they are member of that group and suck mods dick on daily basis.I seriously suggesting that we ban all the stupid chat group and just post everything in here so there is no stupid misunderstanding and unnecessary drama like this.,Kappa,d0bvvqo,14,t5_2tjsd
6696739,0,t1_d0bzpcv,I dont follow smash at all its not a game I like. I just knew of the name of Apex just like Im sure most other gaming communities at least know of Evo.,Kappa,d0c01b5,4,t5_2tjsd
6696767,0,t1_d0bxwdi,You need to tap into your genius gene to answer that question.  TriHard,Kappa,d0c0529,2,t5_2tjsd
6697035,0,t1_d0c13l4,But you are cdelongo! And you got blown up good! Cant deny that OnlyOverheads,Kappa,d0c14yt,-3,t5_2tjsd
6697388,0,t1_d0btgcn,maikky actually used to come to slack for the first couple months or sohe left because everyone made fun of him for constantly trying to get other people to do all the work for the ideas he comes up with ,Kappa,d0c2g82,13,t5_2tjsd
6698104,1,t1_d0bz3tf,having a private chat that brings together the most autistic drama queens of Kappa is the thing that intensifies the high school drama dont you think?,Kappa,d0c547l,0,t5_2tjsd
6698430,0,t1_d0c5t29,No this debate is about whether or not Smash is a fighting game. Traditional or nontraditional are classifications within the genre like caffienated and noncaffienated are for soda. So good Im glad we agree that Smash is a fighting game albeit classified as nontraditional and thus there is no issue with it being at events labeled as fighting game tournaments.,Kappa,d0c6bw2,-1,t5_2tjsd
6703657,0,t1_d0ckzm5,information available through google sonic hurricane guide is much ebtter for new player,Kappa,d0cpsef,6,t5_2tjsd
6704184,0,t3_47ghyg,Weather is also nasty today ... always makes for lower numbers.,Kappa,d0crr1v,4,t5_2tjsd
6704533,0,t3_47g0on,How awesome would it be if Capcom banned all the rage quitters from the online qualifiers for CPT?,Kappa,d0ct1wm,26,t5_2tjsd
