,controversiality,parent_id,body,subreddit,id,score,subreddit_id
2608244,0,t3_2pp6ee,Star Trek the Next Generation Captain Picard sensually begins the episode explaining Today we are exploring the exotic PM me your boobs systempossible  They visit the exotic Putin is a dickhead system so named by the Ukrainian astronomers.,EverythingScience,cmz19mt,1,t5_2zlwp
2645630,0,t3_2q85c6,Well hes not wrong. He says the undeniable manmade climate change is overpowering a tendency towards an ice age not perfectly countering said tendency to produce no net change as the title implies.,EverythingScience,cn3wzok,5,t5_2zlwp
2646779,0,t3_2q718i,Body cameras dont mean anything if citizens are no longer allowed to video tape police. We dont need new technology the technology has existed for decades now we need new laws. There has to be laws in place to put police in jail when they kill people unjustifiably or when they tamper with the body cameras. And there has to be laws protecting the st amendment right to video tape police in public to video tape anything in public. Otherwise theres no point in spending millions of dollars buying something that wont prevent anything in future. Maybe they prevent unacceptable use of force for now but I dont think that will work in the long run. Eventually ways around the cameras will be found unless laws are put in place to stop that. There are plenty of videos of police killing people and shooting people on camera and nothing happens to them. ,EverythingScience,cn42dxj,1,t5_2zlwp
2661086,0,t3_2qgar5,The internet ruined the word bait for me,EverythingScience,cn5xjrw,-5,t5_2zlwp
2679077,0,t3_2qpfze,deleted,EverythingScience,cn89y6k,1,t5_2zlwp
2680228,0,t3_2qp5t8,deleted,EverythingScience,cn8fd4v,1,t5_2zlwp
2683198,0,t1_cn8dm9o,Yes it was never a secret that Google uses used? captchas to help transcribe books and door numbers automatically,EverythingScience,cn8tbob,1,t5_2zlwp
2683939,0,t1_cn8jz35,Are you the content creator? ,EverythingScience,cn8wsyd,2,t5_2zlwp
2686771,0,t3_2qsxya,Science is knowledge based on testable ideas. Neither the existence nor the nonexistence of God is testable so belief in the existence or nonexistence of God has nothing to do with Science. Anyone who says otherwise either doesnt understand the concept of Science or the concept of God.,EverythingScience,cn9a48r,2,t5_2zlwp
2686786,0,t3_2qr0d8,I bet the Supersymmetry guys are excited to have more of their predictions fail. A totally cool theory totally getting demolished by the LHC. Science is hard sometimes. Somewhere the th century aether theorists are nodding their heads.,EverythingScience,cn9a6ry,1,t5_2zlwp
2689282,0,t1_cn9h9op,They wont be able to use that land for  years. That is the minimum guess before they have enough money pooled to cover the costs of cleanup.,EverythingScience,cn9lxf9,3,t5_2zlwp
2713052,0,t1_cnaco0e,The problem is that nicotine vapor have nanoparticles in them that cause inflammation deep down in your lungs. The devices themselves shed metals that end up in the atomized vapor that can cause direct damage to your lung tissue. Im glad you managed to quit using ecigs truly thats great work! Unfortunately this dont seem like the prevailing trend with ecigs. Its worrying that so many young people are trying this new technology youths were ecigs are their first contact with an addictive drug. ,EverythingScience,cncgopy,1,t5_2zlwp
2717903,0,t1_cnczd5v,Yes.,EverythingScience,cnd0iua,18,t5_2zlwp
2718684,0,t1_cnczd5v,Yes.It is the other way around though. Those who represent science tend to become pop science celebrities. Those who represent group X which engage in activity Y tend to play a less active role in activity Y while playing a more active role in telling people about what those in group X do while engaging in activity Y. Talking heads tend to spend their time talking instead of doing.Much in the same way that actors actors are rarely on the red carpet. Those actors who are admired for their skill by other actors are rarely the most popular actors. They tend to focus on roles that they find interesting. They tend to focus on roles which will tend to challenge them.Much in the same way that artists artists are rarely the most popular artists. Those artists who are admired for their skill by other artists are generally poorly understood by non artists.Much in the same way that the president is rarely found to be the most powerful entity in an organisation when you do an actual power analysis. Its always the grand visier or some other senior advisor. When last did President Obama write an actual opinion piece on constitutional law rather than decide which report prepared by others to read?Figureheads mainly serve as the public face of a group of individuals.,EverythingScience,cnd3pmr,7,t5_2zlwp
2746440,0,t1_cng30ou,That keyboard youre typing on isnt made out of wood is it?,EverythingScience,cng9bpu,-1,t5_2zlwp
2757819,0,t1_cnhc4du,Buying it from Doug down the way is the worst idea though because it could be just about anything that he sells you. ,EverythingScience,cnhjx6c,1,t5_2zlwp
2825587,0,t1_cnoqgpu,No he very well understands all of it. And he understands all the money hes getting from pretending to be an idiot and pushing all the climate crap. ,EverythingScience,cnp9ieg,2,t5_2zlwp
2843869,0,t1_cnrb66c,deleted,EverythingScience,cnrch8v,1,t5_2zlwp
2891204,0,t1_cnwlp4m,and my point is that doctors need to refuse to prescribe the antibiotics in this situation.,EverythingScience,cnwqf2b,13,t5_2zlwp
2896279,0,t3_2t85qg,ht to ,EverythingScience,cnxb7u0,1,t5_2zlwp
2921955,0,t1_co01icd,Well youre right to be skeptical of the GNC part I definitely dont trust a manufacturerseller to certify their own products! But I hadnt thought of looking into thirdparty certification so I was happy for the suggestion.,EverythingScience,co08h71,1,t5_2zlwp
2922146,0,t1_co01bma,How do we know the lab is credible?,EverythingScience,co099ce,5,t5_2zlwp
2951113,0,t1_co3ihui,And from what I remember reading the most likely way to get it is for you to do a cannon ball into a lake and the water gets up your nostrils. So taking a normal shower wont really allow for you to get it. ,EverythingScience,co3k026,5,t5_2zlwp
2962885,0,t3_2u2gas,deleted,EverythingScience,co4w851,1,t5_2zlwp
2964631,0,t3_2u4gi8,Does anyone know if the crosstabs for breaking up responses by DemocraticRepublican affiliation are available? They mention three in the Pew text describing the article but they arent available as part of the main data.,EverythingScience,co53e0v,1,t5_2zlwp
2967472,0,t1_co5dvbz,,EverythingScience,co5f0l1,2,t5_2zlwp
3007461,0,t1_co9iz1k,The scenario demonstrated assumes the observer accelerates then decelerates.  Its not looking at light per se.,EverythingScience,co9pyjo,2,t5_2zlwp
3014182,0,t3_2u41an,This comment from Derek Lowe      gt But before making too much of this  or indeed any poll at all  I would recommend reading from Dan Kahan at Yale Law Schools Cultural Cognition Project. His point is that the general public has demonstrated by both word and action that it does not actually understand whats going on with GMOs. So asking a broad question like the Pew Surveys is pretty much meaningless. It would be like taking a nationwide poll on what the American public thought about the usefulness of rhodanines as screening hits in drug discovery or asking everyone what their opinions were on cell penetration of stapled peptides.,EverythingScience,coaf2jr,1,t5_2zlwp
3027815,0,t3_2utji8,This is like the zombie test kits from Feed by Mira Grant.,EverythingScience,cobtx6f,3,t5_2zlwp
3049812,0,t1_coe0fw3,In addition the insane amounts of kinetic energy and friction when it strikes the metal plates its going through will actually melt the iron and send it splattering away.,EverythingScience,coe40sd,2,t5_2zlwp
3051896,0,t1_coe83e0,Yes.Copper kills.  And we love it for that fact.  Copper kills which is why it is in marine paint for boats.  Its in brass and that kills microbes.  Dont assume that it wont affect you over  or  years.,EverythingScience,coebseh,2,t5_2zlwp
3053555,0,t1_coeguy8,Its not about the tracking its about moving the gun fast enough to aim it at a fast moving target and the railgun is way to long and heavy to do that. ,EverythingScience,coehz1y,0,t5_2zlwp
3061296,0,t1_cof9x1t,Have fun on rconspiracy. Giving a source is the simplest possible thing to do and you cant even do that. I dont believe you because you cant and wont provide proof. This shouldnt be a problem but you want to make something as simple as a link difficult. Thats just so stupid. Its main purpose is as a standoff and defensive weapon. It doesnt need guidance. Whether projectiles are being developed that have guidance is irrelevant. They arent a necessity for this weapon to be effective. Propaganda? Have you heard of the Manhattan Project and the following destruction of Hiroshima and Nagasaki? Or maybe the Cold War? You must have heard of the Space Race. Theyre the same thing. Whats more astounding is that I say in the works because all I have is your regurgitation of information you refuse to Source and you imply its not. From your previous logic the fact that there is no information on it being in the works is a good thing. Stop agenda pushing and go join your foil hat brethren. ,EverythingScience,cofatnr,1,t5_2zlwp
3119550,0,t3_2vv2i4, would not flowchart again,EverythingScience,colc9x4,7,t5_2zlwp
3145997,0,t1_coo2qe2,Thats actually decent thank you.,EverythingScience,coo2v4e,1,t5_2zlwp
3187542,0,t1_corwz29,Im not super well versed on it but in the original discussions of this many objected to eagleworks being referred to as NASA. Its sortof like NASAs DARPA  its supposed to be off the deep end type stuff. The point is that the people who build and maintain the space shuttle  the people with the reputation of being on top of shit or things explode  are not the people who worked on these systems. I cant speak to their abilities just that if I see a great deal of not really nasa type comments coming out clearly there is a certain level of disrespect involved. ,EverythingScience,cose0ej,2,t5_2zlwp
3237632,0,t3_2x7fgs,gtFour GM crops account for almost  percent of worldwide GM crop acreage and all four have been developed for largescale industrial farming systems and are used as cash crops for export to produce fuel or for processed food and animal feed.If people are not even eating these crops as you claim then what is your concern?,EverythingScience,coxl5rl,5,t5_2zlwp
3243703,0,t1_coxrosn,Yep although I reckon its be fairly important during puberty for instance. Probably also menopause.,EverythingScience,coy7ucr,1,t5_2zlwp
3250483,0,t1_coyqlh8,Have you ever wondered how they got like that in the first place?  I used to volunteer at the local animal shelter. The place was crawling with humans who were unable to function in regular society so they gravitate towards a cause to make friends who will judge them less for being weird awkward or filled with shitty ideas. Animals wont reject you for being ugly smelly or being a hoarder. People who love animals will tolerate you if you share their beliefs even if you look like a homeless person.  ,EverythingScience,coyx65k,2,t5_2zlwp
3271513,0,t1_cp14l71,deleted,EverythingScience,cp16gdm,-6,t5_2zlwp
3286018,0,t3_2xqz9t,How dead would we be in each of these?,EverythingScience,cp2tyy1,11,t5_2zlwp
3295626,0,t1_cp3cifk,Sounds like a likely factor,EverythingScience,cp3xezd,1,t5_2zlwp
3304780,0,t1_cp4y1s1,Youre right its not a great source. I chose it because its succinct. For this blog post I was trying to split my audience between some more scienceliterate people and also just casual readers. A general goal Im setting for my blog is to make science accessible to nonscience types so I avoided anything too wordy or detailed. My background is in physics but I have broad interests. As I say Im not a career scientist.Ok Ill draw you an analogy that I think gets at what Im angling for.Im assuming your familiar with the phenomenon of kin selection. If not heres the wikipedia page  So say your topic of interest was emotional attachment to siblings. I find that there are two directions of study you might take on this . is the specific development of emotional attachment to siblings in humans and . is the general principle that causes that emotional attachment to siblings to be an adaptation at all.So for . youre necessarily going to make an argument involving the past and our ancestors. Perhaps along the lines of as early humans began to live in larger groups offering greater protection and stability the average number of offspring began to rise. Therefore there were more siblings and thus we evolved the emotional attachment as one would expect from kin selection. ltltIm not claiming thats true I just made that up as an exampleFor . however youre more interested in why the emotional attachment to siblings is an adaptation at all. Of course this obviously does depend on the actual historical development of our species but you are nonetheless able to abstract back from it to say something like emotional attachment to siblings is likely to cause acts of altruism towards siblings which in accordance with Hamiltons rule is likely to benefit the gene that causes it because that gene has a certain probability of also being carried by the sibling to whom the altruism is directed.Topic . is a plausible mechanism for how to get from a world where humans dont have an emotional attachment to our siblings to a world where humans do. Topic . is a general explanation of why such attachment is likely to come to be across many species and circumstances.My point is that I am interested in the abstract rule if there is one which I believe there is rather than the historical circumstances. Although youre right that they are entailed necessarily in actuality that does not stop us from studying them separately.  My apologies if I didnt make that clear in my original post.So for music an example of topic . would be your suggestion about soothing sounds. It is a plausible mechanism for how to get from a world with no music to a world with music. What I am more interested in though is . why is music an adaptation in general potentially across species and circumstances?In doing this Im implicitly stating that music is currently an adaptation which continues to have survival value and be selected for rather than purely a result of specific historical circumstances. A species of bird having wings is a result of its specific evolutionary circumstances while kin selection applies to a whole range of species across time. In my argument rather than saying that love of music is like that birds wings specific to its circumstances Im claiming that its likely to exist in any animal which has a sufficiently developed brain.,EverythingScience,cp4yzb2,1,t5_2zlwp
3335811,0,t1_cp89jvj,There is lots of money to be made in confronting climate change I would argue more then denying it if you dont use a wildly discounted rate for future economic returns. The people and institutions making the money are not always the same however.,EverythingScience,cp8ib0m,5,t5_2zlwp
3335844,0,t3_2yd5gp,Also may explain bronies. ,EverythingScience,cp8ifvx,1,t5_2zlwp
3340604,0,t1_cp89jvj,No its selfishness and yes there is a difference. You would do more to save the environment from global warming by going vegetarian than getting a Prius. But how many people in this thread mocking the climate deniers would even consider that as an option?,EverythingScience,cp91xhn,1,t5_2zlwp
3352667,0,t1_cpacxhb,I have trouble cutting up a whole chicken thats already been beheaded plucked and packed in a vacuum bag.  I cant imagine that I would eat much meat if I had to track it all down and kill it myself.Meat is fuckin tasty though so Im at an impasse.,EverythingScience,cpafg29,7,t5_2zlwp
3386130,0,t3_2yxe1u,I think its absurd that household consumers are the target for water conservation efforts when its the agricultural sector siphoning off all the water. Every single household could stop using water tomorrow and wed still run out in practically the same amount of time.Were going to have to stop growing waterintensive crops and Americans are going to have to develop a taste for foods that can be grown in salt or brackish water... and were going to have to reinin meat consumption massively since livestock production is a major source of water use. And almonds... I love almonds but fuck almonds they currently are sucking up as much as  of the states water usage.Anyway its going to take a massive shift in consumer culture at the grocery store to fix this problem. Simply turning off the faucet when you brush your teeth will not accomplish much.,EverythingScience,cpe8uod,34,t5_2zlwp
3417383,0,t1_cphnl1n,While I think this is all kinds of wrong the weight of the ice on the continent is pushing the landmass down. When the ice melts the land will move upwards which could also make the sea level rise. ,EverythingScience,cpht17h,1,t5_2zlwp
3424680,0,t1_cpimrkf,The way I interpret this that if CO levels remain consistently above  ppm his ocean acidification threshold will be crossed not that the current levels are . gt.,EverythingScience,cpimzvy,13,t5_2zlwp
3427685,0,t3_2zgg6s,OK I think Im done with this sub. ,EverythingScience,cpizcjh,5,t5_2zlwp
3439663,0,t3_2zkikq,Id love to watch this. Too bad I dont have cable any more,EverythingScience,cpkcikm,1,t5_2zlwp
3444352,0,t1_cpgnwjm,Hah youre a good sport about it. That is not really what I meant though. I remember reading usage of is and are differ in the US and the UK. e.g Manchester are going to win this weekends match and Manchester is going to win this weekends match where in the first example Manchester the football club is seen a composition of individuals and in the second the group is seen as a singular entity. I remember learning that this way of conceptualizing groups is more common in the English language. But in all honesty I dont even remember where I read this so it may very well be whatever. ,EverythingScience,cpkvqou,2,t5_2zlwp
3447492,0,t1_cpkuoxk,Yet she seems to have searched the literature for some evidence. Are you aware of evidence that she missed?,EverythingScience,cpl8nsa,2,t5_2zlwp
3453951,0,t1_cplz0es,Well for what its worth I didnt downvote you.  As you said the scales are relative.  The fact that the whole planet uses one scale should be enough to change especially in this age of globalisation.  I am in Canada we went through this.  After a few years you adjust and forget about it.,EverythingScience,cplz69h,2,t5_2zlwp
3458290,0,t1_cpmdhjw,This has little to do with ideology. Its more about sciencedeniers and ignorance.,EverythingScience,cpmgy8d,-1,t5_2zlwp
3499266,0,t3_30cgiy,deleted,EverythingScience,cpr542f,1,t5_2zlwp
3514249,0,t3_30fgj6,The issue with this study is that although the petroleum use of the UK vs the U.S. Is roughly . per capita it doesnt take into account the land mass of the U.S. Vs the land Mass of the UK. While technically accurate dangerously misleading towards ones opinion and horrible attempt at taking a shot at American petroleum use vs a lower populated country. ,EverythingScience,cpsulwy,1,t5_2zlwp
3568004,0,t3_317bbe,Id argue that curiousity is an important component of intelligence.  Sure google may make you seem smarter than you actually are but at least that person was willing to go looking for an answer?,EverythingScience,cpyz9s3,1,t5_2zlwp
3580445,0,t1_cq0cuis,deleted,EverythingScience,cq0edmk,0,t5_2zlwp
3679897,0,t3_32gtjz,Im shadowbanned.,EverythingScience,cqbqdib,3,t5_2zlwp
3686918,0,t1_cqcei5x,Hey! Ive found the not intelligent one!  Sorry,EverythingScience,cqcj7i1,3,t5_2zlwp
3737849,0,t1_cqi9070,FTFAgt killed the victims within  hours of their falling ill he said.That means they could have been infected or whatevers going on a long time before these obvious  hours started.,EverythingScience,cqic7m0,7,t5_2zlwp
3750416,0,t1_cqjkmm3,deleted,EverythingScience,cqjrudg,1,t5_2zlwp
3774865,0,t1_cqmce5p,Well he did give a few tips that he said do actually help.,EverythingScience,cqmk99c,1,t5_2zlwp
3781834,0,t1_cqn917e,You dont know their life. ,EverythingScience,cqncvhx,2,t5_2zlwp
3783478,0,t3_33q9cq,Its because of stories like this that Canada abolished the death penalty years ago.,EverythingScience,cqnjmyi,2,t5_2zlwp
3798739,0,t1_cqpa0mc,This is very true. There is also the Bird Counts conducted by volunteers for Cornell University. So much data is collected every year about migratory birds by citizen scientists. They can be invaluable to our data collection.,EverythingScience,cqpab49,2,t5_2zlwp
3809133,0,t1_cqqedjv,Well I once more would say they are the same thing. As air molecules move past and touch the surface of the object some of the kinetic energy of the object is transferred to them as well. The difference between this and molecules directly in front of the object is that only part of the energy is transferred by the contact.,EverythingScience,cqqgzgj,1,t5_2zlwp
3844349,0,t3_34gjvs,Why do I find this so sad? Its an inanimate object yet the thought of it out there doing its job serving humans makes it seem like a greater loss.I once saw a cartoon of Curiosity ? wanting to come home and I teared up!With thoughts like this maybe I dont belong on a science subreddit!,EverythingScience,cquhn5y,14,t5_2zlwp
3848681,0,t1_cquphez,deleted,EverythingScience,cquzffa,5,t5_2zlwp
3906992,1,t1_cr1mgi5,Blocking the hormones your body naturally produces is in itself a radical hormone treatment. Kids bodies dont make hormones just for shits and giggles.,EverythingScience,cr1mqyy,1,t5_2zlwp
3921164,0,t3_35am2f,my favorite living person ,EverythingScience,cr38yx8,4,t5_2zlwp
3939861,0,t3_35k6pv,Did he freestyle too?,EverythingScience,cr5dm7i,3,t5_2zlwp
3966298,0,t1_cr7ljnn,The treatment is a cream which burns the skin and causes the growth of new healthy skin underneath. Usually its used on  yr olds not young adults. ,EverythingScience,cr8e47i,1,t5_2zlwp
3995996,0,t1_crbrrgb,No one said the world was fair. Im sorry how cynical that sounds but its true. We came first into power at least this time around and we used that power. And we abused that power. And now the earth is reaching some limits. And the local populations must grow up and organize themselves and learn how to use the ressources they have left. Moaning about fairness wont help.And its not as if developed countries dont make an effort towards sustainable and green. And our govenrments spend millions on development and the research into new technologies to help these people. But the solution must come from them. They must be responsible for themselves.,EverythingScience,crbrywb,1,t5_2zlwp
4018608,0,t1_cre935g,This is a very common method used by spiders all across the world to disperse their young including Central amp South America and the US.,EverythingScience,crecob5,6,t5_2zlwp
4018631,0,t1_crecg0z,deleted,EverythingScience,crecrpp,0,t5_2zlwp
4026490,0,t1_crf8yd0,deleted,EverythingScience,crf8zw3,1,t5_2zlwp
4045689,0,t1_crha3v1,The current evidence sort of points to neonicotinoids as a potential factor in CCD. Which is unrelated to GMOs ,EverythingScience,crhft7b,0,t5_2zlwp
4129782,0,t3_37z82o,deleted,EverythingScience,crr0p4h,1,t5_2zlwp
4134630,0,t3_381l4g,Meh as Ive always understood it we know these problems already and why you must have more than one type of energy generation.... Not that good of a read ,EverythingScience,crrkhqk,1,t5_2zlwp
4156066,0,t1_cru04mn,  ,EverythingScience,cru057c,1,t5_2zlwp
4197375,0,t1_cryosuk,Im not siding with either of you all I was referring to was your inaccurate description of his points. You made it sound like he was a vaccine fearing nut case who didnt believe in the prevention of death lol,EverythingScience,cryp3af,2,t5_2zlwp
4216825,0,t1_cs0s4ks,gtI would offer up the idea that attempting to exercise new rights over crops thereby making farmers contractually subservient to Monsanto is mischievous. Just that simple activity is enough to define them as evil.Even though the article I posted refutes both those points.Also why are just Monsanto evil? Theyre just one of many big agricultural companies who work the same way. I dont see that theyre any more evil than any other large medium to large corporation,EverythingScience,cs0wgu3,1,t5_2zlwp
4242283,0,t1_cs3pr0q,deleted,EverythingScience,cs3t8m8,6,t5_2zlwp
4284971,0,t1_cs8metr,I think it has something to do with how its being pushed up on both sides rather than one sliding beneath the other. So dont quote me on this but since one isnt passing below the other I dont think its technically a subduction zone. gt If the same kind of crust collides such as continentcontinent the plates may crash together without subducting and crumple together like crashing cars. The massive Himalaya mountain chain was created this way when India slammed into Asia.More info ,EverythingScience,cs8mx7u,1,t5_2zlwp
4286575,0,t1_cs8tdkx,Right. Im pointing out that in this case it is in fact the correct word and not handwaving for public intellectuals. Then I just kind of went on a rant.,EverythingScience,cs8tgfa,7,t5_2zlwp
4288217,0,t1_cs8uz1p,deleted,EverythingScience,cs904o2,2,t5_2zlwp
4288403,0,t1_cs90nk4,He made an illadvised joke. Youre taking what he said far too seriously. And thats the root of this problem taking an offhand remark made by a socially awkward person trying and admittedly failing to be funny and applying malicious intent to it.,EverythingScience,cs90vw9,3,t5_2zlwp
