,controversiality,parent_id,body,subreddit,id,score,subreddit_id
4614,0,t1_ceeyklv,it was the prophecy that attracted attention to him though his survival was attributable to his mother.  I didnt think his survival was much of a thing though. The world thought he was special because he had lived but the author didnt  it was just backstory. Now the fact that he had a prophecy about him or only one other person made him previously special but that is separate from the wizard making him special.  Im not arguing that there were not external factors just that his wizardhood didnt matter any more than the fact that Im a human is special though it too gives me superpowers over most creatures I might meet.,rational,ceeynuf,1,t5_2rdak
30905,0,t1_cehwztr,Ookay well that sounds good.,rational,cehy84v,2,t5_2rdak
54590,0,t1_cekk97p,Heyyy nobodys submitted that I dont think,rational,cekn8a0,1,t5_2rdak
93311,0,t3_1v621j,I read this recently and thought that it might appeal to this crowd. The rules are laid out pretty clearly and lots of the implications of those rules are explored by intelligent characters with the central conflict mostly coming down to values and some pretty intelligent explorations of the values of the characters. There are probably a few quibbles here and there but it hits most of the bonus points in the sidebar. The blurbgt At an exclusive school somewhere outside of Arlington Virginia students arent taught history geography or mathematicsthey are taught to persuade. Students learn to use language to manipulate minds wielding words as weapons. The very best graduate as poets and enter a nameless organization of unknown purpose.gt Whipsmart runaway Emily Ruff is making a living from threecard Monte on the streets of San Francisco when she attracts the attention of the organizations recruiters. Drawn in to their strage world which is populated by people named Bront and Eliot she learns their key rule That every person can be classified by personality type his mind segmented and ultimately unlocked by the skilful application of words. For this reason she must never allow another person to truly know her lest she herself be coerced. Adapting quickly Emily becomes the schools most talented prodigy until she makes a catastrophic mistake She falls in love. gt Meanwhile a seemingly innocent man named Wil Parke is brutally ambushed by two men in an airport bathroom. They claim he is the key to a secret war he knows nothing about that he is an outlier immune to segmentation. Attempting to stay one step ahead of the organization and its mindbending poets Wil and his captors seek salvation in the toxically decimated town of Broken Hill Australia which if ancient stories are true sits above an ancient glyph of frightening power. gt A brilliant thriller that traverses very modern questions of privacy identity and the rising obsession of datacollection connecting them to centuriesold ideas about the power of language and coercion Lexicon is Max Barrys most ambitious and spellbinding novel yet.,rational,cep1xki,2,t5_2rdak
254390,0,t1_cf6mfl6,gtNever forget I am not this silver body Mahrai. I am not an animal brain I am not even some attempt to produce an AI through software running on a computer. I am a Culture Mind. We are close to gods and on the far side. The Mind of Lasting Damage Look to WindwardIm not sure if you dont know what the capabilities of a culture mind are or if we have different ideas of fun.,rational,cf74eyn,3,t5_2rdak
300681,0,t1_cfbwmfm,Over three upvotes in less than half an hour? I sense lurkers. You make a good point with the opening. The magic academy was more of an excuse to get over the initial worldbuilding hump little if any of the story would take place there past the first chapter or two. I dont think Id directly make it an actual Twilight Princess fanfic. Everything would moreorless have to be original content. Unless...Maybe the fic could true to the series introduce a new magic mechanic along with the new plot. Something to quickly travel between existing dungeons and their continuities? A planeswalking Link could turn very interesting indeed.,rational,cfbxjjw,1,t5_2rdak
361478,0,t3_1wwcjx,Neal Ashers Cowl has an interesting model of time travel. I couldnt even begin to summarise it but it was fun.,rational,cfi8ee2,1,t5_2rdak
424542,0,t1_cfoqzp2,Are there any specific parts that you felt were particularly a chore to get through?  Were the characters not interesting or was it more the setting they were in?,rational,cforomm,1,t5_2rdak
426331,0,t1_cfop66m,I like it! I think it was a good way to zoom out sort of and show the outside view of events that our protagonists may be encountering from the inside soon.edit Also Mr. Fuji In the games he wass held hostage by everybodys favorite villains Good Ole Team Rocket.edit Obligatory plug for my RSS feed,rational,cfoydb2,2,t5_2rdak
436596,0,t1_cfq04zi,Keeping those things still would be a different issue completely though no?  Even among inert room temperature matter the atoms and electrons are still moving.,rational,cfq0o10,1,t5_2rdak
842472,0,t1_cgzz4tq,gt Isnt that basically psychopathy?Not if you love robots.,rational,ch01ikp,2,t5_2rdak
854044,0,t1_ch0tejb,Based on the first few chapters Embers is as much rational fiction as anything else on this sub. I mean that in a good way.,rational,ch1cz56,1,t5_2rdak
922022,0,t1_ch8rcf9,Feel free to organise all of this!,rational,ch938j0,1,t5_2rdak
971712,0,t1_cheo07c,Dreamcrusher. I just wanted to be uploaded into a robot instead of dying.,rational,cheqrdu,2,t5_2rdak
1006049,0,t3_25hbpa,I would watch this so fast.,rational,chin925,1,t5_2rdak
1007870,0,t3_25n73u,In DC verse you need to figure out if Lex will stoop to using magic. Because that isnt something a lone Sups can deal with. Like. At all. Lots of good s era mystic stuff that would be period too and could be explained as more advanced alien science with a bit of twisting.And that is only if you dont want some wild South American or Egyptian pith helmet action to have Lex procure his own honest controllable Earth god to fight the alien menace. Maybe they are aliens too or of alien manufacture originally but they are part of our cultural melting pot now. And are easy to control with the right systems administrator physical key and password I mean golden star head piece and mystic words of power. Ancient gods were all designed with two factor authentication of course.In my book scientific magic is the easiest answer. It is a force multiplier. If one alien is on Earth then why not more? And what is magic but...If not that radiation and gravity are good plot keywords even without the special sauce. How much hard radiation can the alien take? Can I get xray images of his internal structure? If so then why cant I do more and kill him with them? If not guess what? Ive got a van and a portable machine and all week to hunt hidden aliens on the busy streets of the city. Now is the Man of Steel immune to being trapped in a superstrong artificial gravity well or looped higher space constructs? That might work if you have access to madlevel science.Figuring out hes weirdly solar powered might be a straight shot from working on his crime fighting schedule especially compared to other darker crime fighters just starting up in other crime riddled cities. Coughbatmancough.If all else fails thematically use mind control. Not fantasy shit but directly attacking Supermans ability to think clearly through plots that induce sleep dep horrible scarring emotional shocks and paranoia inducing double crosses that drive him into depression and isolation. That should buy some time at least. Attack the mind not the absurd illogical body.,rational,chiupaw,12,t5_2rdak
1072681,0,t1_chpk0lv,Waaaaiiiit... thats a bloody great idea.If you had enough space in your mind to hold other minds you would be able to carry other people with you through the loopreset thus actually alleviating the whole oh fuck I cant do anything and Im so alone problem.Note this is the only scenario in which I endorse creating selfimproving AI willynilly as a timeloop reset will inevitably destroy anything thats not you.,rational,chq7uyc,1,t5_2rdak
1112595,0,t1_chulf0f,I would have to argue that Dumbledore orchestrated his schemes effectively considering he didnt trust himself with power.  Celestia comes across as quite a competent ruler if you accept that the writers peg her with the Idiot Ball twice a year.Voldemorts an utter moron though.,rational,churds5,3,t5_2rdak
1233502,0,t1_ci8c8xh,Thank you as always  all those should be fixed now.,rational,ci8dwna,1,t5_2rdak
1315062,0,t3_29583j,Before going further you need to be aware that the ending of Permutation City made absolutely no sense. Read this fanfic,rational,cihk7v4,6,t5_2rdak
1335380,0,t1_cijksgc,Youd still need the technology to harness that energy though.  Our current problem with things like solar panels isnt that we cant get enough sunlight directed at them. Having more sunlight certainly helps but when considering efficiency translating electric energy is probably the easiest way to go I think. I could be wrong as Im not an engineer.,rational,cijuhm8,1,t5_2rdak
1351789,0,t1_cilq8bv,This gives me a wonderful idea for a story a slightly below average human paperclipper. So he goes to city council meetings and argues in favor of the school district buying more paper clips and in general just goes about maximizing paper clips in all the ways you would if you just didnt have the intelligence to start buying up factories.Oh or maybe Flowers for Algernon but with paperclips so you could see the progression.,rational,cilql4l,10,t5_2rdak
1434223,0,t1_civjsyi,I am pretty sure that most of the things that most people buy are things that they find useful in some way. Hey lets spend money on this useless junk! is not the modal shopping experience. Externalities are another question but people do spend money to get things that they can use for some end or that are an end in themselves.It is easy to mock consumers for being hoodwinked and suckered by flashy advertising and so people often do but when you reach the point where you are doubting that people even want to buy useful things unless you mean something very specific by useful it is worth taking a step back and asking just what kinds of predictions your theory generates and whether they really seem to match your experiences.Status competitions imperfect information etc. etc. but people are constrained optimizers if imperfectly so. It is the pony way to look upon people with the utmost dignity and respect and to be charitable in your thoughts and dealings with them.,rational,ciw21s1,1,t5_2rdak
1467593,0,t3_2azceb,Two new chapters. Looks like the story is changing gears again..For the folks seeing it for the first time heres a link to the last post. This was recommended by Eliezer Yudkowsky a while back.,rational,cj08l0a,1,t5_2rdak
1493380,0,t1_cj10bjo,As I understand it stardestroyer.net is notorious for deliberately inflating figures and claims among people who like to discuss these figures and theories online.They have some sort of political thesis caught up in this along with a tiny but heated feud with some other fans from a longdead mailing list.I dont actually know much about the topic but I would suggest doing your a Fermi estimate from scratch.,rational,cj3gxku,1,t5_2rdak
1580379,0,t1_cje60qm,gtPolitics is Spiders. Avoid using political examples in nonpolitical discussions and tread very carefully if attempting to discuss politics. change I lt Spiders,rational,cjedone,2,t5_2rdak
1584480,0,t1_cjelv0i,The bunker would be useful but the information probably wont. The books are massive and apparently very wordy. He probably wont be able to read them in a useful amount of time. Unless he can use a trick like adjusting the microscope being a free action,rational,cjew9pj,1,t5_2rdak
1588024,0,t1_cjfaz3k,Hey!  Ill have you know that I make excellent eggs!  Scrambled omelettes...any way you like em I can do em and theyll be fantastic!  So there nyah!,rational,cjfcb7l,2,t5_2rdak
1619061,0,t3_2crqh0,That chapter  twist...,rational,cjj8yvs,1,t5_2rdak
1640486,0,t1_cjlub7s,Ice Assassins are not temporary.  Until they kill their target they are just as permanent and as real as any other creature.  Since Afi is both their target and their creator he was able to order them to Never harm or kill me and always act in my best interest and they are forced to obey.  As such the Ice Assassins can never complete their mission and so they are completely permanent.They are separate beings from Afi and as such their sacrifices are just as valid as his would be.,rational,cjly54t,1,t5_2rdak
1745019,0,t1_cjz2r1b,Neat thanks for the reply.The RT tag is just fine worlds are allowed to be rational too. Just feel free to up the competence porn.,rational,cjz4cve,2,t5_2rdak
1752187,0,t3_2eiyi0,Oh man. I was planning on doing some very similar things with the psychics in the pokemon fanfic and it was great to read someone elses take on what sharinglosing identity might feel like. Thank you for sharing this!,rational,ck00s02,3,t5_2rdak
1756739,0,t3_2el9lr,Awesome!  Im writing a rational fantasy piece with my wife and figured I couldnt post it here because none of the characters are rationalists.  Glad to know this sub is open to that!,rational,ck0leu0,12,t5_2rdak
1758208,0,t1_ck0g8qw,And they completely ignore that intelligence enhancements might enable them to think of a solution to their problems. ,rational,ck0s23f,2,t5_2rdak
1788358,0,t1_ck4kjmv,Heh.,rational,ck4kow3,1,t5_2rdak
1834112,0,t1_cka05pd,gt So multiclassing means you get the spell slots for all of the classes?Yep. gt If you multiclassed wizard and sorceror would you get  th level spell slots a day? Indeed. Although  of them could only be used for casting spells that your sorceror side knew. gt And as sorceror appears to have way more spell slots balanced by learning very few very slowly and it shares the wizard spells list could you cast the spells you learn as a wizard in your sorceror slots?Nope. Your spell casting is effectively compartmentalized between the classes. You cast just like a th level wizard. You also cast just like a th level sorceror. Never the twain shall meet. gt And could you use mindscrape to learn the spells someone has memorised?Nope. Mindscrape is totally broken on fluff but quite weak on crunch. As to fluff you learn everything the target knows so all troop dispositions passwords etc. As to crunch you know all the words spelling and grammar that they know and you have years of memories on how to speak French...yet you have no skill ranks in LanguageFrench so you cant speak French. Learning spells is the same thing. Theres rules for how to do it and how long it takes and those rules trump the idea that just have detailed memories of actually casting the spell should be enough. Theres actually some sense to this one a prepared spell isnt just words committed to memory its a ritual which you started in the morning and left only a few word left unsaid. Since the person using Mindscrape didnt do the ritual they cant cast the spell that it presages. ,rational,cka7ef0,2,t5_2rdak
1834387,0,t3_2fksk7,HELL FUCKING YES.  MECHA FOR THE MECHA GODS!  DRILLS FOR THE DRILL THRONE!,rational,cka8lm7,13,t5_2rdak
1966769,0,t3_2h7zyb,I figured this would be appropriate content for this sub. It might be a bit simplistic for the people whove already spend time thinking about it but some people including me learn better through video than through text and the description box has links to more resources.,rational,ckq73hz,2,t5_2rdak
1969451,0,t1_ckqhheo,Sorry you dont like it.  Maybe you should stop reading?,rational,ckqipye,2,t5_2rdak
2013893,0,t3_2hmzzz,The original misbegotten attemptedFAI story.  Now with more ultraviolence and much less philosophical exploration!,rational,ckvvcy1,3,t5_2rdak
2043423,0,t3_2i6iz1,Id vote in with maybe  if you do it in some sensibly managed way Kickstarter or Patreon would be ideal. ,rational,ckzkbow,4,t5_2rdak
2052327,0,t1_cl0kx15,So I dont know whether this is deliberate but there is literally no such thing as simultaneous events in relativity. What is simultaneous for you is not simultaneous for someone moving at high speed relative to you. So Ill assume that the return is instantaneous is from your POV. You could use this to make a time machine but to send one bit to the past youd need to do a relativistic flyby of the Earth so not very practical.Using the  degrees you could heat or cool something to  degrees. Or rather you now have a theoretically perfect heat bath. Stave off the heat death of the universe destroy some entropy!You could create a reactionless drive by firing out the coin and resummoning it. This could help you with the time machine above. A rail gun could fire the coin quite fast at the cost of excess heat but we do have an infinite heat reservoir.Also what happens to things in the way when it returns? Do the just disappear? What happens when you melt a normal coin and your coin together and then summon your coin back? Youd be left with a piece of metal with  vacancy spread evenly I suspect that this would be like nanoporous carbon except with metal and be quite good at storing gasses. Though it may be better to mix it with something already used like metal hydrides.,rational,cl0p2q2,8,t5_2rdak
2063273,0,t3_2igzm1,gtIt was a small bit of a mindnumb reading but nothing too bad until I started the second volume and threw the container where the digital copy was across the room is disgust.I mean... were you not expecting romance novel tropes? Because SAO is much more so a romance than a scifi or adventure story. ,rational,cl235ev,3,t5_2rdak
2096808,0,t3_2ivpjj,Hmm. Having read your comments about how the ritual is used Im having trouble coming up with something that would both be uncommon and morally defensible to most people. If  of people are willing to do it all the babies will die or society will get restructured around protecting babies unless there is some limiting factor. Also will this be the only magic ritual possible or are there others? That might affect it too.,rational,cl6cn1f,6,t5_2rdak
2109159,0,t1_cl7x00c,How is th?  I havent played th but what Ive heard about me makes me not want to play.  Everything Ive heard says that its taking a fullround Run action towards being a video game instead of the RPG that I grew up on.,rational,cl7x446,1,t5_2rdak
2114760,0,t3_2j5q53,gtforce them to make an Oath not to lie to you ask them whatever questions youd like then test their benefit again to make sure that they kept that OathThis makes having an Oath a major weakness. By forcing an Oath someone can permanently threaten to take away your superpowers which took years of denied desire to cultivate unless you swear slavelike obedience to them. Blackmail aint got nuttin on this. Either society would have to make forcing an Oath as illegal and strongly prosecuted as kidnapping someones children or else very few people will ever take Oaths. Only A those who can hide it or B those who are already very powerful and thus not in significant danger of being forced to make Oaths they dont want to make.,rational,cl8mr4w,4,t5_2rdak
2136543,0,t1_clbe9ns,Oh. Sorry misread that.,rational,clbegqp,1,t5_2rdak
2178652,0,t1_clf2sln,Works fine for me on Linux using firefox same on Windows. Try opening a new private tab disabling all your extensions and accessing the page. ,rational,clgrcwc,1,t5_2rdak
2201711,0,t1_cljjeng,Thank you very much thats really great of you.Im glad to hear that you ended up liking YE.  Out of curiosity do you remember what you didnt like about the first few chapters?,rational,cljowgj,3,t5_2rdak
2257001,0,t1_clqd6nw,Not yet.  They need to invent neoreaction first to explain how their entire societal structure is actually a perversion designed to destroy their bloodpurity so that Dementors can Kiss them all.,rational,clqoq03,2,t5_2rdak
2257546,0,t3_2l13p1,  Infinite speed of light.This means that light cannot be a wave or a particle it is a mathematical ray. So none of electromagnetic theory works  no radio relativity QM etc. Chemistry and electromagnetics may work but theyd only be superficially similar the equations would be different. Electrostatics and simple models of magnetism work without any changes.Infinite speed of light also means a privileged times reference. I.e. everyone anywhere moving at any speed can agree on whether two events happen at the same time or not in theory. So Newtonian mechanics works relativity doesnt.Basically take the scientific discoveries up to Lord Kelvinish era and they might be explainable in a universe with a limitless speed of light. When you join electrics and magnetics with Maxwells equations the speed of light pops out because light is an electromagnetic wave. So anything built on this and most physics since then is cannot hold true.,rational,clqr5bk,3,t5_2rdak
2272288,0,t1_clsjm72,On a personal level I do agree with you and Id like to be as smart as I can be but Im not sure its selfevident that this is a good thing or a meaningful pursuit. Even if you look at our society one that emphasizes growth a lot more than the Culture you find that a lot of people value things like friends family shared experiences and those sorts of things above pure mental selfimprovement and studying by yourself in the library. And whos to say thats a bad thing? I think its a false dichotomy to say that you must engage in exponential selfimprovement to lead a meaningful existence and labeling the alternative as solipsistic masturbation. Its very telling that death is an accepted part of Culture society even though immortality is easily attained because that sort of thing would be unthinkable to a society that values progress and improvement above all.To me selfimprovement is more of a means to an end and you hope that the increased understanding you attain by becoming more intelligent helps you find a pursuit that is meaningful. Otherwise whats the point? You convert all matter in the universe into computing hardware for your ginormous brain and then what? Its just as meaningless as the human who lives and dies a human. I think youd end up a lot like a Culture Mind and most of your vast intelligence goes towards thinking up things to do to occupy your vast intelligence. Whether or not you buy that lets pretend for a moment you did and set aside the goal of intelligence for its own sake. What value would a Culture citizen derive from massively upgrading his or her mind? Any question that requires superhuman brainpower to solve can be answered immediately through neural lace by a Mind. Personal danger is immediately recognized and deflected or undone by the Mind. You already get a vote worth as much as a Minds so what else is there to be gained? On the other hand your personality and everything thats you is nearly indestructible because its small enough that you can have nighunlimited backups and versatile because you can insert it into just about any sort of physical form and you can indulge in very human things like falling completely in love and not have to worry about the effect that might have on your sanity. As a Mind the stakes are much higher because if you mess up theres no one to rescue you. And people might die or worse. To me its the difference between being an adult and being a kid... and I bet there are a lot of adults who wish they could be kids again.Regarding the earthworm thing its not a technical challenge its the fact that in order to make a human brain you need to fill it up with something. There just isnt enough stuff in an earthworms brain to fill a human brain so the majority of this humans personality will have to be created on the spot or derived from some other source.  I mean what kind of movies does an earthworm like? Who does this earthworm vote for? And at this point the brain is that of a human even if you remove the original tiny earthworm bit from it so if you downgrade by discarding the stuff you added you are essentially killing a human.gt The Culture seemingly falls on the side of letting the addict drug himself into a coma as long as its his personal choice. I think that kind of freedom works only when you have a society of truly rational agents otherwise it really is sometimes better to force things on individuals for their own good.Ooh boy... not sure I wanna touch this one. Although... if youre going to force him to decide according to an algorithm why dont you just run the algorithm for him and tell him the answer?Lastly Im as interested as you in reading a book that does superhuman intelligence well. Unfortunately it might be asking the impossible. Many people have tried and not just with AI but with superheroes aliens etc. and I dont know if Ive ever seen one thats really convincing because well human writers. And would you really recognize it when you see it?I hope you do read the books. Im glad you value my opinion but I make no promises that anything I wrote even resembles anything written by Banks and even if it does hes a far better writer than I am.,rational,clsko12,2,t5_2rdak
2311031,0,t1_clxbt2e,gt If he can think he is dangerous. It would be simpler to just subject him to noise tortureMakes sense. Or drug him. Or just kill him. ,rational,clxcxy6,1,t5_2rdak
2318310,0,t1_cly7jus,OK good to know.,rational,cly9aah,1,t5_2rdak
