,controversiality,parent_id,body,subreddit,id,score,subreddit_id
10609502,0,t1_dda9679,Hahahah Im on my phone give me some slack...,RoversMorningGlory,ddaaeyn,0,t5_31h09
10612787,0,t1_ddam6av,Youre a complete hack.So is that one of your alternative facts?,RoversMorningGlory,ddammef,1,t5_31h09
10663427,0,t1_ddfun40,just gonna leave this here rLadyGagasAss ,RoversMorningGlory,ddfungy,2,t5_31h09
10678586,0,t1_ddhebtj,hang in there Nadz,RoversMorningGlory,ddheylq,5,t5_31h09
10681663,0,t1_ddhjc6p,Well years ago she agreed to be tazed then backed out at the last second like a total fucking pussy bitch and instead wanted to put JLRs balls on her forehead so I say she still has it coming to her.By the way thats where the clip of her saying I want Jeffreys balls comes from.,RoversMorningGlory,ddhqdxy,9,t5_31h09
10690153,0,t1_ddilyjy,people that are here live do.,RoversMorningGlory,ddilzh4,1,t5_31h09
10702237,0,t1_ddjbcpf,How do you guys know youre blocking the right guy and not a legit new user?,RoversMorningGlory,ddjuu3v,0,t5_31h09
10769178,0,t3_5ty36a,Fuck you you stupid cunt,RoversMorningGlory,ddqremj,4,t5_31h09
10781295,0,t1_ddrs4tj,Its cuz youre using the homepage to watch not the watch page nub,RoversMorningGlory,dds0g5d,1,t5_31h09
10797365,0,t1_ddtnh1z,The theory is Trumps team is uncovering something big no Im not talking talking pizza gate. One theory I heard is why Flynn was told to resign even though he didnt technically do anything wrong is because then he can press charges as a private citizen for being wire tapped which will then expose other instances of things like this. Just a theory no clue if its true time will tell of course.  I dont doubt our government does all kinds of shady shit. I understand being nervous about the one state thing but I kind of get what he was saying. We are trying to bring peace between these two nations who hate each other so much. If we can give BOTH what they want why wouldnt you if it means peace. I dont think ultimately thats what will happen but I think thats what the idea was meant to be. Trump said very specifically if its what both countries want let them. Again I understand what that could mean I find it hard to believe it would ACTUALLY work that way but if something can bring peace cool.Edit a typo,RoversMorningGlory,ddto63y,1,t5_31h09
10802673,0,t1_ddu4zz1,Right I only cited it because it had the department of education linked in it. Their exact release. I specifically said I was citing the department of education that was IN the article. Of course the article is an opinion it doesnt make the source IN the article wrong. Its still the department of education stating it failed. I dont see an issue with the source. I didnt say take what the writer said as gospel I said look at the source which is again the department of education. I fail to see where the problem is. Again if you actually read what I say instead of glossy over it and reading what you WANT to hear which is I must be an uneducated hick because Im a Trump supporter you might learn that we are not in fact all morons. ,RoversMorningGlory,ddu7wpe,3,t5_31h09
10850607,0,t1_ddz5v82,removed,RoversMorningGlory,ddz5w14,1,t5_31h09
10864877,0,t1_de0mncy,During the phone screening process Nadz has to pick the dumbest people ever for Rover to argue with. Either that or they are paid callers in order to make Rover sound smart. ,RoversMorningGlory,de0mvfg,7,t5_31h09
10885619,0,t1_de2cri2,HAHA. I mentioned this before but that lady HAS to be the owners wife.,RoversMorningGlory,de2rvnc,2,t5_31h09
10889996,0,t1_de2oofi,she thicc tho,RoversMorningGlory,de384wh,2,t5_31h09
10901655,1,t1_de47d13,Walmart is just an example of the type of policies and corporate greed that created our situation. You say people should just work somewhere else well Im sorry to say that there are not enough jobs for that. Manufacturing is dying and unless you learn a skilled trade which you mentioned retail level is about all we have. The most recent data I could find says the US has some  million retail employees. You dont think they deserve to earn enough to live on if they work  hours a week? Well youre wrong and a dick for thinking so.I would LOVE expanded vocational training straight out of high school and retraining programs for say coalminers but that would be a government program so SOCIALISM!!!!Right now most people do have to go into student debt to get a higher paying career but you are wrong about me. Im  with  in debt I worked hard and got scholarships and make k with no kids. Im fine thanks.,RoversMorningGlory,de4ffd1,-1,t5_31h09
11048246,0,t1_dekacvh,Its hard to read when it is one long sentence.  Its called being literate. We arent  anymore commas and periods are good to use.,RoversMorningGlory,dekastj,13,t5_31h09
11145669,0,t1_devbrel,He really has trimmed it down a bit.,RoversMorningGlory,devclpr,3,t5_31h09
11172621,0,t1_deye16q,Im a proud liberal but fuck that was retarded last night. Ifwhen something serious actually comes out people are going to be desensitized from crying wolf bullshit like this. I hate Rachel Maddow even more than I already did.,RoversMorningGlory,deyeke3,9,t5_31h09
11254559,0,t1_df7n70o,Yes it is hahaha,RoversMorningGlory,df7or3h,6,t5_31h09
11256182,0,t1_df7r9cf,I dont recall ,RoversMorningGlory,df7vdgp,3,t5_31h09
11283298,0,t1_dfav9gi,Which place was he talking about now? Memphis Louisville Dayton Columbus? I cant keep track of them all hahaha,RoversMorningGlory,dfay15u,3,t5_31h09
11290055,0,t1_df1vmji,Does anybody remember the date where duji tried on diamonds and tried to decide if they were fake or real?,RoversMorningGlory,dfbpme7,1,t5_31h09
11302992,0,t1_dfd5j51,Pics? Pics of what? I never mentioned anything about pink poop.PinkPoopGate. Never Forget.,RoversMorningGlory,dfd6eb8,4,t5_31h09
11305948,0,t3_61c4aj,Worst part of the show always has been. Nothing is worse than dumbass yr old chicks that have nothing to say yesterday was horrid. ,RoversMorningGlory,dfdiga0,8,t5_31h09
11317876,0,t1_dfeumvg,Flip Rover and Duji and this is my list. ,RoversMorningGlory,dfev2dm,3,t5_31h09
11351450,0,t1_dfig4vo,Got it it was just a caller who gave there name and went on the air.,RoversMorningGlory,dfinzh0,2,t5_31h09
11391788,0,t3_62kbrr,removed,RoversMorningGlory,dfn8qdp,1,t5_31h09
11393639,0,t1_dfned1b,JLR has like  stock reactions to a video. Everytime he whistles into the headset mic I feel like my eardrums are about to explode.,RoversMorningGlory,dfngbdj,3,t5_31h09
11446049,0,t1_dft6ypz,Where do you get the idea that that Obama golfed everyday? He didnt go golfing until mid April his first year in office. Trump has went once a week almost.Also even if Obama golfed everyday the comparison is moot because all Trump did for  years is complain about Obama golfing and taking trips on tax payers dime! And what has he done the first  weeks? Taken at least  trips to a tune of about  mil a piece. I mean at some point any intelligent person would stop defending this hypocrisy.,RoversMorningGlory,dftee88,14,t5_31h09
11462120,0,t3_63km60,I lt Mama Nadz!!!!,RoversMorningGlory,dfv82uz,4,t5_31h09
11477312,0,t1_dfwspyz,Good looking man!,RoversMorningGlory,dfwy6mv,1,t5_31h09
11543042,0,t1_dg49qc5,haha very true.  Rover does know his tech stuff though.  credit where credit is due.,RoversMorningGlory,dg4elv2,3,t5_31h09
11562709,0,t1_dg67p15,Until it turns into the fake Dieter and Charlie fight where Dieter got suspended.,RoversMorningGlory,dg6mz4m,2,t5_31h09
11595268,0,t1_dg84559,I didnt know Charlie had a sister,RoversMorningGlory,dgabyqz,3,t5_31h09
11651071,0,t3_668287,I feel like this is addressed all of the time. Snitz is finally done with it and Rover just needs to do whatever it is he does with it. ,RoversMorningGlory,dggnvu3,7,t5_31h09
11654477,0,t3_6699k3,The show was pretty damn good today!,RoversMorningGlory,dgh1sil,4,t5_31h09
11666576,0,t1_dgidu0w,You have no idea what youre talking about and youre just trying to start an argument. Did I not just say I am willing to pay my share of universal healthcare? ,RoversMorningGlory,dgif6s2,2,t5_31h09
11680756,0,t3_66o9p7,removed,RoversMorningGlory,dgk13qh,1,t5_31h09
11683394,0,t1_dgk9iz7,I sure hope so! In Nadz defense he was doing exactly what everyone wanted him to do to get the audio ,RoversMorningGlory,dgkbvu7,4,t5_31h09
11723260,0,t1_dgorg1h,Lmao  flips to backwards ,RoversMorningGlory,dgov16z,4,t5_31h09
11734393,0,t1_dgq3z8d,Haha I thought thats what it was called. ,RoversMorningGlory,dgq4g3d,3,t5_31h09
11763408,0,t3_67unrz,I hate when they go to bestof shows but goddamn I miss Robs trolling laughter. ,RoversMorningGlory,dgtett1,8,t5_31h09
11767134,0,t1_dgtg6fb,DLH was part of it too wasnt she?,RoversMorningGlory,dgtu2m9,1,t5_31h09
