,controversiality,parent_id,body,subreddit,id,score,subreddit_id
288064,0,t1_cfahh9x,I just learned about her last night! I found out about her through Claire Sinclairs Facebook page D I hope Ill be able to see her at a CO show sometime soon. Edit also immensely jealous you got to see her live.,Burlesque,cfamema,3,t5_2qv5u
382898,0,t3_1yg1xb,Hartford CT Beat City Beauties,Burlesque,cfkgav4,2,t5_2qv5u
702242,0,t3_227kor,thelalas burlesque  Baseball Burlesque Solo!,Burlesque,cgk3ipu,1,t5_2qv5u
3150241,0,t3_2w8dg9,Wear your persona inside and out. The confidence you display outside is only as real as the confidence you feel inside. Granted I perform on stage in other arenas but I feel the sentiment is analogous. ,Burlesque,cooipmy,4,t5_2qv5u
5913859,0,t3_3w9so7,I was expecting to see a lot of ink...,Burlesque,cxuu86y,4,t5_2qv5u
6230335,0,t1_cyxgrya,lt,Burlesque,cyxtkf5,1,t5_2qv5u
6856768,0,t1_d0ssvom,Like they fell off while you performed or you lost them?,Burlesque,d0tiui5,2,t5_2qv5u
8589972,0,t1_d6fc1wi,Please do!! ,Burlesque,d6fc3tw,3,t5_2qv5u
8953578,0,t1_d7o1uf8,Love this idea! Thank you!,Burlesque,d7o34hf,1,t5_2qv5u
