,controversiality,parent_id,body,subreddit,id,score,subreddit_id
9533651,0,t3_5b3dp1,I think it represents an existential crisis it first appears in the end of A Night on the Town in which he drinks with the halfbrothers friends  and they think he is the half brother and after having some issues not recognizing them he sees Ms. Leading again. He realises that becoming the halfbrother and dismissing his past life would be harder than he thought.The second time the theme appears of course is Wait which is Hunter and Ms. Leading pretty much saying we are awful people.The third time is between The Haves Have Naught and Light this is the time Hunter decides to send his wife and son back to the lake because he is concerned for their safety after meeting Mr. Usher.The fourth time the theme appears is in The March The Pimp and Priest sends everyone after Hunter and he has to decide whether he would give in to the Pimp and Priest and the crowd or just end it all which he does by killing the Pimp and Priest and then himself.Its just my opinion based mostly on the info released from the story time answers hope you like it.,TheDearHunter,d9o8032,3,t5_2st9u
9542404,0,t1_d9o8032,please pardon my poor ear but when does it appear in a night on the town? is that what the oboe and whatnot are doing?,TheDearHunter,d9pas6n,1,t5_2st9u
9554074,0,t3_5bqell,Bravo best post on this sub right here,TheDearHunter,d9qqj8u,1,t5_2st9u
9562217,0,t3_5a1o11,I was traveling in California and missed this show by  days and the LA show by a day. SOOO bummed!,TheDearHunter,d9rqmek,1,t5_2st9u
9604167,0,t1_d9wbc7s,Thanks man  Everybodys been having it rough. I have friends who reluctantly voted for Trump just like I and other friends reluctantly voted for Hillary. Hopefully instead of apathy we can get a bit more empathy in our country understand where people are coming from and try to stay civil. And in the meantime we can listen to some good ass Dear Hunter music to make us feel better B,TheDearHunter,d9wwrt8,3,t5_2st9u
9630275,0,t1_d9zzxjg,im hoping they were confused and voted for their favorite instead. if not... that makes me sad,TheDearHunter,da04nxt,4,t5_2st9u
9632816,0,t1_da0ds5d,I honestly wouldnt mind doing that if op doesnt mind  note that I have terrible editing skills ,TheDearHunter,da0fy0b,3,t5_2st9u
9662837,0,t3_5ded5f,deleted,TheDearHunter,da45aw0,1,t5_2st9u
9667826,0,t3_5dh8ok,Casey do you like pineapple on your pizza. Casey do you like pineapple on your pizza.Casey do you like pineapple on your pizza.Casey do you like pineapple on your pizza.Casey do you like pineapple on your pizza.Casey do you like pineapple on your pizza.Casey do you like pineapple on your pizza.Casey do you like pineapple on your pizza.Casey do you like pineapple on your pizza.Casey do you like pineapple on your pizza.Casey do you like pineapple on your pizza.,TheDearHunter,da4rfwx,11,t5_2st9u
9675018,0,t1_da5miun,That line makes me think of Roland and Susan from The Dark Tower. Not sure why.,TheDearHunter,da5ndba,6,t5_2st9u
9735896,0,t1_dad20lg,more like top  of the kill list,TheDearHunter,dad5tq5,4,t5_2st9u
9738944,0,t3_5ejmku,Holy shit! Ive been a fan of Sheet Happenss output for a while  great quality books  so this is great news! Apparently theyre also coming with downloads of the complete guitar pro transcriptions as well which is doubly exciting!,TheDearHunter,dadjcyj,1,t5_2st9u
9931329,0,t3_5hmpe7,Do you still need the demos? ,TheDearHunter,db22sfc,3,t5_2st9u
9958641,0,t3_5i0tvt,Theyre a great band yes. Absolutely top tier. The best though? There are so many good bands that I would be reluctant to go that far.One of my favourites though!,TheDearHunter,db5mxdq,1,t5_2st9u
9982008,0,t3_5ijklp,This is wonderful. The photographs for The Dead Dont Starve and What You Said are my favourite.,TheDearHunter,db8omsi,4,t5_2st9u
10025035,0,t3_5j8yvr,damn for a grand its a bit steep. cut the price in half and i will sleep on the ground and bring my own food though ahha.,TheDearHunter,dbeag3l,8,t5_2st9u
10217453,0,t3_5m7d5w,Just about every time I hear the line Damned if I didnt demand that they sing such a sensible baring of your mystery from Remembered I get a bit teary eyed.,TheDearHunter,dc27f8x,4,t5_2st9u
10226783,0,t1_dc2ixik,I tried to get into her but it just sounds too much like generic pop music to me I like Cryings Beyond the Fleeting Gale more if I want adorable music w pop sensibilities. Im really glad that Kero Kero is so successful tho.,TheDearHunter,dc39hca,1,t5_2st9u
10278481,0,t1_dc80qhg,Life and Death Acoustic  Christmas Song  ,TheDearHunter,dc94ejf,1,t5_2st9u
10296890,0,t1_dcazl0i,The Tank IS the best song on the album. Join Team Tank brother.,TheDearHunter,dcb7iby,6,t5_2st9u
10310156,0,t3_5nmu28,This isnt the whole song yet but I wanted to share what I had so far.  My vocal range isnt high enough to sing the second and third choruses the high belting part.  If any singers on here can hit those notes without using falsetto Id love to potentially include your voice for those parts.   This was recorded at  bpm.,TheDearHunter,dccpnab,4,t5_2st9u
10389234,0,t1_dclmxmq,Im not too familiar with reddit and formatting etc. Id rather someone else post it lol,TheDearHunter,dclonuc,1,t5_2st9u
10452240,0,t1_dcrtacz,I respectfully disagree. Sure there are exceptions to this but on the whole I dont think you can consider certain songs to objectively be better than others.,TheDearHunter,dcsv1ve,3,t5_2st9u
10468437,0,t1_dcumony,Good point,TheDearHunter,dcupd9t,5,t5_2st9u
10501331,0,t3_5pwz5w,Here are a couple of albums that I havent seen mentionedsome of which Casey was involved in the makingForgive Durdens  Razias ShadowThe Woods Brothers  The Woods BrothersThe Brobecks  Violent ThingsThe Age Of Rockets  AdultsSilverchair  MelioramaPortugal The Man  Censored ColoursHotel And The Laughing Tree  Terror And Everything AfterElbow  The Seldom Seen KidMaybe if you havent already more mainstream guys like Muse The Mars Volta RadioheadOk Computer. I could get into more specific styles since the dear hunter is so diverse let me know if ya want more.,TheDearHunter,dcyfqlv,3,t5_2st9u
10502457,0,t1_dcyjz9w,Not enough considering how this is by far the most info on the EP in existence. XD I really loved all three songs. Isabella has a lot more power than Is There Anybody Here? to me seeing as how it feels like youve sung the chorus with an amazing amount of angst for the lack of a better word. And I actually like Owls in a silly but in keeping company sort of way. Its funny but so is King of Swords Reversed and both arent halfbad at all. So long to those other tracks I suppose. Though those crowds you played for werent the greatest I do encourage you to revisit the EP. Like a diamond in the rough. And if something similar happens in this Neverender tour just remember that Claudio can use his helicopterhair to fly down next to you and take a swing or two at the audience with his Welcome Home guitar. I do encourage you to revisit the songs that youve met similar ire with so you can overcome such memories. Believe it or not this EP has actually been praised in this sub in your absence. Those are the fans whom you shouldve played B. Linus for. Thanks for the EP even if it wasnt intended for the rest of us. Ill still listen to it. Sorry for talking too much. Because someone like me does that.,TheDearHunter,dcykc9k,3,t5_2st9u
10522244,0,t3_5qkrh5,More closure in Moscow which is no insult! Nice tunes buds.,TheDearHunter,dd0t65f,4,t5_2st9u
10558433,0,t1_dd362c6,Oddly enough the vinyls are dirt cheap compared to the CD. I think they go for . Honestly the cover art for the Triple Crown Vinyls are off putting to me. Like its a silly thing to gripe about but I just cant bring myself to get them. ,TheDearHunter,dd4x1sf,2,t5_2st9u
10612328,0,t1_dd9ctec,Yes!!!,TheDearHunter,ddakwz9,1,t5_2st9u
10613007,0,t3_5rvur5,A Night on the Town in its entirety is easily my favorite after that is Rebirth Oracles The Tank The Old Haunt The Lake and the River and definitely many more Im not remembering in no particular order,TheDearHunter,ddanfui,3,t5_2st9u
10619416,0,t1_ddaqbk6,Also you fooled me for a minute you bastard,TheDearHunter,ddbb9fu,2,t5_2st9u
10645262,0,t1_ddc8fu0,This is the correct answer.,TheDearHunter,dddz6kl,1,t5_2st9u
10686670,0,t3_5sntlx,Hey everyone!First seeing the excitement for this is AWESOME.Second  we are fixing the issue with the incomplete orchestration  and everyone who purchased will be contacted with a new download that includes the missing bits.Thanks yall ,TheDearHunter,ddi90iu,15,t5_2st9u
10772808,0,t3_5tx6mk,lol digustingI mean what the hell is Is there anybody here? still doing here? ,TheDearHunter,ddr4xil,4,t5_2st9u
10825229,0,t1_ddwca3h,Always haha but the dear hunter hasnt... Its sort of the joke because people always ask Casey to play those two and he hates it and refuses. He will never play red hands live ,TheDearHunter,ddwjo2p,2,t5_2st9u
10832046,0,t3_5uuus9,wait a minute i thought we didnt know if the boy was english or not. i thought that he was american and served in the american expeditionary force for WWI and that the city was NYC,TheDearHunter,ddx8ze3,4,t5_2st9u
10978366,0,t1_debk99a, agree. Its easily the best closing track theyve ever had.,TheDearHunter,decd9c2,3,t5_2st9u
11055713,0,t3_5xv477,With  sons its going to be hard for me to vote for Light although I have to be in a sentimental mood to enjoy the song.,TheDearHunter,del5aap,3,t5_2st9u
11203322,0,t3_5zxstm,I think it is a mix up.  The album cover says Dear Hunter not THE Dear Hunter,TheDearHunter,df1vrm2,10,t5_2st9u
11250576,0,t3_60id69,oh man. i hope The MoonAwake makes it through to the end.,TheDearHunter,df78inj,3,t5_2st9u
11259083,0,t1_df7wfsj,Im a  year old woman with two kids and every time I hear The March I suddenly become a slimy skeezy yet very skillful and manipulative orator.For me the line is Now the mimic is a cynic who laughs while the house of God is REDUCED TO ASH!,TheDearHunter,df877v8,20,t5_2st9u
11279593,0,t1_dfabhus,Act VI?... come again? Has he said anything at all about it? ,TheDearHunter,dfaixba,1,t5_2st9u
11297759,0,t3_615wm8,Got the first  acts on amazon I think they were second pressing but still great. Edit just checked Act  and  are on amazon not act  unless you want to spend . ,TheDearHunter,dfcl19s,2,t5_2st9u
11560743,0,t3_650eq2,Beautiful! What city is this in?,TheDearHunter,dg6exue,4,t5_2st9u
11566945,0,t1_dg72z06,Typical Casey lol,TheDearHunter,dg74a2w,6,t5_2st9u
11581690,0,t1_dg7w47h,My interpretation is actually kinda similar. The only thing is I think Hunter barricades himself at home and I think he kills himself with a lethal dose of morphinewhatever opiate hes hooked on. Also Id be surprised if Hunter ever planned on negotiating. I think he wanted to kill TPP no matter what and the parley was a good way to separate him from the crowd.,TheDearHunter,dg8si0f,1,t5_2st9u
11608371,0,t3_65naxr,They were so fucking good tonight! The bass was pounding in my chest and Caseys solos were nasty as shit!,TheDearHunter,dgbtho2,2,t5_2st9u
11645203,0,t1_dgfwyq5,OMG YES!!!!!!!!!!!!!!!!!!,TheDearHunter,dgfzx6x,1,t5_2st9u
11751514,0,t1_dgs1raj,ok cool ill scoop it if they have it. still have your details in my PMs,TheDearHunter,dgs2au3,1,t5_2st9u
