,controversiality,parent_id,body,subreddit,id,score,subreddit_id
6479417,0,t3_44dpfi,subscribed!,RebeccaStilles69,czpipdh,2,t5_3c02v
6480311,0,t3_44dpfi,Awe I missed out. Your so beautiful ,RebeccaStilles69,czpm1g2,2,t5_3c02v
7468620,0,t1_d2r4in0,This is a great one! I fucking love food porn! ,RebeccaStilles69,d2r4x20,2,t5_3c02v
7490446,0,t3_4hxpda,Thank you for being so incredibly sexy!!!,RebeccaStilles69,d2tmfyo,2,t5_3c02v
7519323,0,t1_d2wwntj,Anything for you  ,RebeccaStilles69,d2wwrrt,2,t5_3c02v
7714317,0,t3_4kr24c,youre unbelievably pretty!,RebeccaStilles69,d3j2cny,2,t5_3c02v
7760187,0,t3_4llbhu,My word you are so so hot youre absolutely sexy as all hell thank you,RebeccaStilles69,d3o9umz,2,t5_3c02v
7840475,0,t3_4mp2by,I was already a fan but that album made me say naughty things aloud. Tremendous!,RebeccaStilles69,d3xc5ny,2,t5_3c02v
7867466,0,t1_d40dij4,Well thank you kindly xoxoxo,RebeccaStilles69,d40djqe,2,t5_3c02v
8620646,0,t1_d6j64d2,I sang happy birthday to you and didnt get a response ,RebeccaStilles69,d6j6jle,0,t5_3c02v
8728789,0,t3_4zgmob,Love this. Super cute. ,RebeccaStilles69,d6wqq9d,1,t5_3c02v
8918206,0,t3_52b8kd,Thank you!!! ,RebeccaStilles69,d7ju67i,2,t5_3c02v
9213546,0,t1_d8jup2s,It will be done ,RebeccaStilles69,d8jvvt5,3,t5_3c02v
9364973,0,t3_58qpll,Helllooooo nurse!,RebeccaStilles69,d932sq9,2,t5_3c02v
9504899,0,t3_5azsj9,Damn Rebecca! Id be standing to attention....providing you sit on it wink,RebeccaStilles69,d9kojbs,2,t5_3c02v
9761416,0,t3_5evmrx,Im so freaking hard!!!,RebeccaStilles69,dagb926,2,t5_3c02v
9895458,0,t3_5h4ic1,Please let your little bush grow out  ,RebeccaStilles69,daxeh6e,2,t5_3c02v
9916967,0,t3_5hgzrw,I dont think its odd ,RebeccaStilles69,db07ego,2,t5_3c02v
10003761,0,t3_5iwr9z,All of them? ,RebeccaStilles69,dbbiomz,4,t5_3c02v
10352995,0,t1_dch5zs7,It doesnt block the view if its trimmed up even a little. Some of us like seeing a little hair ,RebeccaStilles69,dchkmdd,3,t5_3c02v
10845726,0,t3_5v20qn,deleted,RebeccaStilles69,ddynsb9,3,t5_3c02v
11266167,0,t3_60sc1m,ILY. My second my favourite girl. Well at least you still post so perhaps youre my ! ,RebeccaStilles69,df9053z,-1,t5_3c02v
11701192,0,t3_66tyyn,What I would do to be gagged with your sock.,RebeccaStilles69,dgmckhb,1,t5_3c02v
