,controversiality,parent_id,body,subreddit,id,score,subreddit_id
825050,0,t1_cgeri5o,Not his girlfriend. This is a repost.,BHOPorn,cgy25t2,1,t5_2vwsi
1595704,0,t1_cjg8agk,I dont understand your comment. If made right it can not be as potent?,BHOPorn,cjgb3vy,3,t5_2vwsi
1956601,0,t3_2h31i3,Heres a link to the original post  ,BHOPorn,ckoz1wf,4,t5_2vwsi
3954858,0,t1_cr720lh,Word much love and dont stop posting those killer vids!,BHOPorn,cr735wu,2,t5_2vwsi
5828592,0,t3_3uybrj,deleted,BHOPorn,cxjnk86,1,t5_2vwsi
6495933,0,t1_czr5rb1,Hopefully Ill see your stuff down in the Springs. Ill be sure to keep an eye out for it. I know one place that always has Venom nug run on their weedmaps menu so I might go there.,BHOPorn,czr874t,1,t5_2vwsi
6909480,0,t1_d0zaiyz,Theres definitely worse rap out there.. that song is definitely different from mainstream rap but that isnt a bad thing.  If you really dont like the music on these videos just turn it off lol,BHOPorn,d0zicwz,1,t5_2vwsi
7002137,0,t1_d19wg60,Lol I just saw your username. Thats pretty fuckin fire.,BHOPorn,d1a1c4p,2,t5_2vwsi
8925097,0,t1_d7knkuf,Agreed. Depending upon the dispensary they may blow their own and thats usually a let down. ,BHOPorn,d7knzc3,1,t5_2vwsi
9613955,0,t3_5cn6d9,I thought this was a troll post at first with it being rBHOPorn and all haha,BHOPorn,d9y48nt,2,t5_2vwsi
9753580,0,t1_dafbyay,I liked it too my only complaint is there might be some kind of residual sugar or something in it. I noticed a day or two after my buddy and I had dabbed some that there was a few small specks of what appeared to be mold growing in some spots on the glass as well as in the water. I dont know for sure that the distillate caused it but the other wax I had at the time I had been dabbing for a few weeks with no issues.,BHOPorn,dafchfq,1,t5_2vwsi
9759442,0,t1_dafucu2,Its an amazing strain has a great smell too.,BHOPorn,dag2ikb,2,t5_2vwsi
10096083,0,t1_dbniys4,Ah almost thought you moved just for him ,BHOPorn,dbnj90o,1,t5_2vwsi
