,controversiality,parent_id,body,subreddit,id,score,subreddit_id
4171232,0,t1_crvk0g8,Ill do both for ,blizzardcodes,crvq7v5,0,t5_38gwu
4263811,0,t3_39p64x,How much you offering?,blizzardcodes,cs68zxp,1,t5_38gwu
4462329,0,t1_cst54q2,idk what u want but i can give u something on steam for it. its better than for free at least.,blizzardcodes,cst5m3b,0,t5_38gwu
4595619,0,t1_ct9v5qj,deleted,blizzardcodes,ct9vb69,1,t5_38gwu
4623913,0,t3_3eblyo,golden tiger for kaijo diablo,blizzardcodes,ctdf2br,1,t5_38gwu
5193031,0,t1_cvby8zw,Im accepting offers close to what they are going for on eBay. You can check the completed listings there if you want. ,blizzardcodes,cvbycon,1,t5_38gwu
5285611,0,t3_3nayw7,PRICE IS NEGOTIABLE!!!!!PM MEHH JUST WANT TO GET RID OF THIS CODE ,blizzardcodes,cvnarje,1,t5_38gwu
5512118,0,t1_cwg7pa2,ok how would you like to trade?,blizzardcodes,cwg81ij,1,t5_38gwu
6405329,0,t1_czhh9ok,Trade settled enjoy your Kerrigan and good luck with perfect combos! ,blizzardcodes,czhpyg6,1,t5_38gwu
7246410,0,t3_4eakne,I have a steam bundle code with LIMBO Amnesia Sword and Sworcery and Psychonauts if interested,blizzardcodes,d21v5pf,1,t5_38gwu
7270832,0,t1_d24mk3l,i live korean and our region did many events ,blizzardcodes,d24n7g4,1,t5_38gwu
7271711,0,t3_4euhsv,Would American USD work?,blizzardcodes,d24qt9u,1,t5_38gwu
7301140,0,t3_4f7mih,I got a perfect trade for an Azmodunk  with him paid instantly.I recommend trading with him.,blizzardcodes,d283927,1,t5_38gwu
7350325,0,t1_d2dnu3t,not interested,blizzardcodes,d2dojww,1,t5_38gwu
7365090,0,t3_4g7nvm,PMed,blizzardcodes,d2fcyyd,1,t5_38gwu
7390898,0,t1_d2iakoz,yes I had the same very unfortunate I wanted Kerrigan ,blizzardcodes,d2iamhi,1,t5_38gwu
7455353,0,t1_d2plw48,You have tassadar or you want tassadar? Im confused by your message.,blizzardcodes,d2pmk73,1,t5_38gwu
7618963,0,t1_d367t4p,sounds good to me lmk when you want to link up,blizzardcodes,d388iyd,1,t5_38gwu
7686017,0,t3_4jjtxw,Traded the TeSPA Hearthstone Cardback with Nickism today  really chill guy. Fast and reliable delivery!,blizzardcodes,d3fup33,1,t5_38gwu
7692813,0,t1_d3gmb2b,Youre welcome ,blizzardcodes,d3gmgd5,1,t5_38gwu
7893400,0,t1_d4348so,sent,blizzardcodes,d43aipu,2,t5_38gwu
7985914,0,t1_d4doqa1,thank you for the reply but you should check your price. you are asking way to much for it.cheers and good luck with the selling,blizzardcodes,d4doxtx,1,t5_38gwu
8052237,0,t3_4pibz2, NOTICE  Please consult the List of Scammers before trading. If someone contacts you via PMs and they have not responded to your thread be aware that the user may already be banned from the subreddit for being a scammer. Consider taking screenshots of all parts of your trade to use as evidence if the need arises.I am a bot and this action was performed automatically. Please contact the moderators of this subredditmessagecompose?torblizzardcodes if you have any questions or concerns.,blizzardcodes,d4l5ays,1,t5_38gwu
8104771,0,t1_d4r0rnd,thanks,blizzardcodes,d4r1rpo,1,t5_38gwu
8688637,0,t3_4z00a2, NOTICE  Please consult the List of Scammers before trading. If someone contacts you via PMs and they have not responded to your thread be aware that the user may already be banned from the subreddit for being a scammer. Consider taking screenshots of all parts of your trade to use as evidence if the need arises.I am a bot and this action was performed automatically. Please contact the moderators of this subredditmessagecompose?torblizzardcodes if you have any questions or concerns.,blizzardcodes,d6rpgwr,1,t5_38gwu
8788157,0,t3_50i6ji, NOTICE  Please consult the List of Scammers before trading. If someone contacts you via PMs and they have not responded to your thread be aware that the user may already be banned from the subreddit for being a scammer. Consider taking screenshots of all parts of your trade to use as evidence if the need arises.I am a bot and this action was performed automatically. Please contact the moderators of this subredditmessagecompose?torblizzardcodes if you have any questions or concerns.,blizzardcodes,d746zcw,1,t5_38gwu
8948025,0,t3_51tqrk,Just curious what other skins are there to offer? That looks like all of them aside from Beach Party Stitches and Lumberjack Uther.,blizzardcodes,d7nf552,1,t5_38gwu
9095669,0,t3_54ty9x, for a card back? You could buy Overwatch with half of that!,blizzardcodes,d855jap,0,t5_38gwu
9262523,0,t3_579oxi, NOTICE  Please consult the List of Scammers before trading. If someone contacts you via PMs and they have not responded to your thread be aware that the user may already be banned from the subreddit for being a scammer. Consider taking screenshots of all parts of your trade to use as evidence if the need arises.I am a bot and this action was performed automatically. Please contact the moderators of this subredditmessagecompose?torblizzardcodes if you have any questions or concerns.,blizzardcodes,d8q3amf,1,t5_38gwu
9273227,0,t1_d8rfxij, I dont exactly understand what you are after but pm sent,blizzardcodes,d8rg51n,1,t5_38gwu
9286635,0,t1_d8suh89,I see. I read through the sticky on the sidebar about avoiding scammers. One thing it says we can do to feel more comfortable is to add each other on Steam andor Battle.net. If you still decide to trade with me I am very interested in buying this code from you. I can send the money to your PayPal right now. You can add me on Steam. I have the same screen name there. On my main profile page there are multiple people confirming my trade reputation in Steam. Kismayaz If you want to add me on Battle.net I also have the same screen name. My Battletag is KismayazFeel free to add me on both if youd like. You can see I have thousands of hours of game time on both platforms. This link from the sidebar here says that scammers are not likely to share their public account info here in the open for everyone to read and see who they are.My only hesitation with going first as I said is your account history on here. It is the only information I have from you at this time. I looked through the threads you have posted on here to show that you are reputable. Only one of the posters in those  threads gave you rep.I am trying to be easy to deal with and also I am trying to be safe for both of us. With this post almost anyone on Reddit can look at all  of my major profiles on the platforms that I use the most online.If my  year Reddit account history with rep from trades my even longer Steam history with rep from trades and my Battle.net account all with many years of active use do not make you feel any more comfortable with this deal. I do not know what else I can do.,blizzardcodes,d8t5c7a,1,t5_38gwu
9387570,0,t1_d95xk72,Paypal seems ok.  dollars is the price.,blizzardcodes,d95xvmk,1,t5_38gwu
9403214,0,t3_4oomoe,Are you interested to trade your Azmidunk for Zarya thunderguard bundle ?,blizzardcodes,d97xa0l,1,t5_38gwu
9452538,0,t1_d9dx1ua,removed,blizzardcodes,d9e6ckn,1,t5_38gwu
9484870,0,t3_5angtj,deleted,blizzardcodes,d9i7pkq,1,t5_38gwu
10075101,0,t3_5itvn2,Just got scammed by Kirito This confirmed for me I wont go first ever again. I dont care if I pay  or like  as long as I really receive the cardback.Greets!,blizzardcodes,dbkt2mg,1,t5_38gwu
10736273,0,t3_5tl8ct,sonya! i would like to play her! thanks for giveaway!,blizzardcodes,ddnd6fg,1,t5_38gwu
10896180,0,t3_5vios0,Still up ?,blizzardcodes,de3v3tr,1,t5_38gwu
11071797,0,t3_5xbcw7,Gul Dan for  codes ?,blizzardcodes,demz7q2,1,t5_38gwu
11249524,0,t3_60gu90,Please try and remove duplicate trade posts when possible.   This got reported as spam.   Ive gone ahead and removed your older post and left this one up.,blizzardcodes,df7484z,1,t5_38gwu
11368150,0,t3_605c4p,Price  euro. BUMP,blizzardcodes,dfkk3br,1,t5_38gwu
