,controversiality,parent_id,body,subreddit,id,score,subreddit_id
7655800,0,t1_d3cf5nt,yeah,tempFNAFofficial,d3cf720,1,t5_3eoqw
7655832,0,t3_4k6047,He did say something.,tempFNAFofficial,d3cfbrq,1,t5_3eoqw
7656080,0,t1_d3cfqco,no wonder they banned yous,tempFNAFofficial,d3cgcax,1,t5_3eoqw
7656212,0,t1_d3cgupq,wat,tempFNAFofficial,d3cgvs2,1,t5_3eoqw
7656307,0,t1_d3cgwzb,I can confirm he is.,tempFNAFofficial,d3ch9sg,2,t5_3eoqw
7656354,0,t3_4k69al,That would be a great name for this sub I just hope its not taken. I wonder what purpose this sub will serve after the main comes back on?,tempFNAFofficial,d3chgpy,1,t5_3eoqw
7656445,0,t3_4k6abv,We need as many people as we can just in case anything else major happens. Last time  of the  mods just... dissappeared. They need to be prepared for the worst. Also they need people to feel safe. The more mods the safer people feel.,tempFNAFofficial,d3chu5m,1,t5_3eoqw
7656809,0,t3_4k6gz3,Im sorry. Rule Number . ,tempFNAFofficial,d3cjbpm,1,t5_3eoqw
