,controversiality,parent_id,body,subreddit,id,score,subreddit_id
2328450,0,t3_2lzbiw,uwubalubadubdub it looks like your post does not contain one of the approved tags. rIncest requires all posts to include a tag at the beginning of the title. Please click here to view our tagging guidelines and resubmit with the proper tag.I am a botrAutoModeratorcommentsqpuwhatisautomoderator and this action was performed automatically. Please contact the moderators of this subredditmessagecompose?toFrFincest if you have any questions or concerns.,incest,clzickw,1,t5_2qx19
2344851,0,t3_2m5lgf,It sounds like your wife is very much into being watched exhibitionism while you are into incest.So when her sister is watching you are both getting turned on but for different reasons.,incest,cm1ja19,1,t5_2qx19
2344861,0,t1_cm1j8xo,deleted,incest,cm1jbmy,-1,t5_2qx19
2360440,0,t3_2mdbi8,Yep. That made me hard so I give your erotic writing an A. Love how the two of you got to taste each other. How did it feel taking his tongue in your mouth for the first time? To passionately kiss your own son? Hopefully that wasnt as much of a blur so you could remember your first kiss with your new lover.  ,incest,cm3gly0,3,t5_2qx19
2367461,0,t1_cm4bpzh,deleted,incest,cm4bs8i,1,t5_2qx19
2371308,0,t1_cm2pqrt,We talked about it the next day. And I have kept in better contact with her since then. In our conversation the next day...we discussed what happened and she indicated to me her reaction was more about being ashamed that she did that with me and she was ashamed that she was attracted to me and would probably have done more if I stayed. I apologized to her about trying to take it farther and pushing it...but she said not to worry about it and that she really wanted me inside her...but felt it was wrong. I told her that while it may have been wrong...we can think of it as  adults enjoying each others bodies...we arent in love or planning to start a family...so who cares that we are related? She seemed to agree with that sentiment. ,incest,cm4svpj,1,t5_2qx19
2393508,0,t3_2mtkpl,What a sweet story!  Im glad things are working out for you both!,incest,cm7jmpy,1,t5_2qx19
2401534,0,t1_cm8hlui,I agree that the text certainly lends itself to that interpretation.,incest,cm8je2a,1,t5_2qx19
2406516,0,t3_2mzzml,I dont care if you post the intimate details.  Real life stories of love and luster are about so much more than the exchange of bodily fluids.  As to your update..... you did fine.  Its the small things that add up over time.  Keep up the personal contact.  Talk to him.  Become his confidant.   Earn his trust and he will be yours.,incest,cm95kh6,2,t5_2qx19
2407103,0,t3_2n0jlb,Your post has been removed for containing fewer than  characters.I am a botrAutoModeratorcommentsqpuwhatisautomoderator and this action was performed automatically. Please contact the moderators of this subredditmessagecompose?toFrFincest if you have any questions or concerns.,incest,cm986iy,1,t5_2qx19
2413863,0,t3_2n2fx6,Yeah  to the opinion What an asshole.  Sounds like hes got an issue and just wanted to cause some damage.  Did what he say have any impact on your sister?There was a guy back when I was in High School who had a crush on my sister but she thought he was a creep.  We werent a couple at the time but we had fooled around a bit.  I stepped in only because she asked me to get rid of him because he wasnt getting the message.  When I confronted him he made some comment about keeping her for myself and made a scene.  His comment about incest was quite close to home but we thought she was adopted.  Luckily my sister wasnt there and I didnt say anything to implicate us but it was embarrassing for us at the time and really pissed her off.  The point is the guy did more damage to himself by upsetting my sister.,incest,cma298u,0,t5_2qx19
2417440,0,t3_2n1vpw,Nice,incest,cmai5x5,3,t5_2qx19
2425662,0,t1_cm9sm9p,deleted,incest,cmbip9u,2,t5_2qx19
2439026,0,t3_2nbt5w,Dont go from ass to pussy.... ,incest,cmd63m1,1,t5_2qx19
2459581,0,t1_cmfpcmm,I thank you for it all.  Your story is both emotionally touching and arousing. I cannot wait for the next one. ,incest,cmfpfes,2,t5_2qx19
2467771,0,t3_2nqjlo,I only know of the wiki. Good luck though ,incest,cmgpsr1,1,t5_2qx19
2474095,0,t3_2nvv6j,.,incest,cmhi2lg,-5,t5_2qx19
2479150,0,t3_2nyyrv,Shes deleted her account and cleared her threads for reasons that were never explained sadly.,incest,cmi5v8g,1,t5_2qx19
2480785,0,t1_cmidabt,I dont think that in my s I would be in the mindset that being with him made any sense.Him being my brother does not make it any more loving at all.Doe it make it hotter? It might. There are times I think that what were doing is wrong but we do it anyway. I suppose on some level it adds to the excitement level.,incest,cmidkva,1,t5_2qx19
2484184,0,t1_cmin8h4,Wow sincerely thank you very very much. That is actually one of the nicest things Ive ever been told. Thank you X,incest,cmitkdc,2,t5_2qx19
2498498,0,t3_2nyi29,I was wondering do you and your husband still have sex ever?,incest,cmkox77,2,t5_2qx19
2507638,0,t1_cmlu5gn,Each collar speaks it says a lot about the relationship. My friends like them subtle and one color so they can wear them in public. The literal doggy collar with a paw print on it says shes your puppy. Youll lock her in a cage with a doggy mat take her doggy style and spank her ass with a newspaper when she wets the floor. Im sure there are plenty of people who would be into that Im just doubting youre one of them. I just want you to be aware of the theme you are implying. My solution? Custom design your own.,incest,cmlvxbp,-7,t5_2qx19
2508813,0,t3_2oc1q0,What happened while she was doing it? Do you think she knows you like it? What did you say afterward and during? Did you shift your position to show you wanted it? When your mom made you cum did you make any noises? Did she lick her fingers when she was done?This is really awesome by the way!,incest,cmm1g4d,-5,t5_2qx19
2508825,0,t3_2od9uz,deleted,incest,cmm1i5r,5,t5_2qx19
2511065,0,t3_2oecxa,I wish you the best of luck.  One little point of order though..... Marines are not soldiers.  It is considered an insult.  Marines are Marines.  Love your Marine yell oohrah and tell him youll bend for his thrust.  Good luck.,incest,cmmc1zk,-7,t5_2qx19
2516259,0,t3_2ofsrc,You can introduce the idea rather innocently at the beginning. When you first see her all smiles say something like Wow its so good to see you. Look at you youre gorgeous! And with a smile and a hug say If you werent my sister....Before anything else is said follow up with Im so happy to see you sis. As you are hugging and kissing her when you first meet. Its fairly innocent sounding playful and yet inserts the idea into the mix.,incest,cmn0h6t,2,t5_2qx19
2524656,0,t3_2oktbl,Ive never been in this boat so any advice I give you isnt going to be great and should not be taken seriously.Personally I think you should wait a couple of years and put in a lot of effort to meet other girls. There are plenty of ladies that match your sisters description.But at the end of the day stay free. Do what you want no matter what people or society would say or think.,incest,cmo3yfa,1,t5_2qx19
2532560,0,t3_2oongw,To me sending dick pics to your step mom in hopes of making something happen as dicey as that is is one thing. Soliciting others to do that to your step mom too just seems incredibly disrespectful. Its like youre kinda whoring pimping her out to your friends in an exhibitionist sorta way. Comes across as very immature and potentially hurtful.  Edited,incest,cmp54bm,12,t5_2qx19
2544975,0,t3_2ota3v,Youre having fun so is she. Enjoy and dont overthink it.,incest,cmqrjn0,2,t5_2qx19
2568733,0,t1_cmtv815,If its so nice why are you always fretting on here though?My point is that if fast truly is nice and natural thered be no real questions and youd just go with the flow without even noticing it questioning it.If fast really was nice to you in this case you wouldnt effectively be asking Is this too muchtoo soontoo forward? to every little twist and turn within your relationship.,incest,cmtvdv7,1,t5_2qx19
2570580,0,t3_2owy9q,Update plz!,incest,cmu42yj,3,t5_2qx19
2584913,0,t1_cmvzflu,Just because she knows you found her toys doesnt mean shell have any interest in fucking you. Are you prepared to ruin and alienate her if things dont go like you hope in your little fantasy world? Because that is a very real possibility. ,incest,cmvzi1w,3,t5_2qx19
2635959,0,t1_cn2mlgn,Yes. DL GB you have to Upload GB. ,incest,cn2nipc,2,t5_2qx19
2640296,0,t3_2q675k,Your post has been removed for containing fewer than  characters.I am a botrAutoModeratorcommentsqpuwhatisautomoderator and this action was performed automatically. Please contact the moderators of this subredditmessagecompose?toFrFincest if you have any questions or concerns.,incest,cn37vrs,1,t5_2qx19
2645891,0,t3_2q8wo6,deleted,incest,cn3y7qg,10,t5_2qx19
2646184,0,t1_cmuegtb,I was wondering the same thing... If anyone happened to save it tell us!,incest,cn3zl7s,1,t5_2qx19
2646447,0,t1_cn3tadh,Youre not saying you deserve to break the rules?Because you come across as crying about not being allowed to break the rules.,incest,cn40tqk,2,t5_2qx19
2648986,0,t3_2py9j8,I see youve played beyond  souls ,incest,cn4cr5l,1,t5_2qx19
2658110,0,t3_2qdnge,wait uh u are her niece?  is she a lesiban?,incest,cn5jlhz,-2,t5_2qx19
2662835,0,t1_cn64uvc,Oh my childhood,incest,cn65r4l,16,t5_2qx19
2666726,0,t1_cn6nwyw,That would be against the rules so Id not bother.,incest,cn6nzmn,-1,t5_2qx19
2679637,0,t3_2qpq1c,Whats happened since then?,incest,cn8cl2o,2,t5_2qx19
2685961,0,t1_cn8wmco,You guys are wild lol. I wish I had something so exciting. ,incest,cn96b94,2,t5_2qx19
2692503,0,t3_2qjoyj,Wow! Keep it up! Youve found out that incest sex is the hottest sex.,incest,cna12rw,1,t5_2qx19
2722985,0,t3_2r93zt,uOrion it looks like your post does not contain one of the approved tags. Please click here to view our tagging guidelines and resubmit with the correct tag. If your post features siblingscousins that are the same age and thus warrant tags of the same capitalisation then message the moderators with a link to your post.I am a botrAutoModeratorcommentsqpuwhatisautomoderator and this action was performed automatically. Please contact the moderators of this subredditmessagecompose?toFrFincest if you have any questions or concerns.,incest,cndlb8n,1,t5_2qx19
2740219,0,t3_2rfqio,Well that was something i should not have read in the tea room at work.. i now have very wet panties,incest,cnfjux3,43,t5_2qx19
2740955,0,t3_2paenj,Comeon update us dude please!,incest,cnfmviz,2,t5_2qx19
2755695,0,t1_cngxtad,No I used the word I meant to use real. Look it up in the dictionary. Real is not the same as believable... If I wanted believable fiction I would have asked for believable fiction. I wanted real stories so thats what I asked for. ,incest,cnhb78g,-4,t5_2qx19
2757034,0,t3_2ri3x9,Just read all of your posts and goddamn youre the real deal. So glad and jelaous must say of your relationship wiht your mother and Jess. And cant wait to see how Jess look like! And obviously for more update!,incest,cnhgp1s,3,t5_2qx19
2773211,0,t1_cnj58cd,I thought we were in the safety tree? Are we no longer in the safety tree? ,incest,cnjay4c,-4,t5_2qx19
2781282,0,t1_cnk6h2c,You only get better by practicing. Says this nerdy guy who used to be shitty at it but got better.Pestering a girl who isnt interested sister or not isnt the way to go about things.,incest,cnk80mv,4,t5_2qx19
2782273,0,t3_2ri3x9,Achievement Unlocked From Whence You Came!,incest,cnkc2ja,2,t5_2qx19
2795126,0,t1_cnhqyc6,Once again didnt ask anyone for proof of anything... Next time you order fries dont ask for real ketchup just believable ketchup.,incest,cnlsn5m,0,t5_2qx19
2804347,0,t1_cnmiksh,legal in Sweden  ,incest,cnmuf1i,7,t5_2qx19
2807461,0,t1_cnmsspu,This guy is smart.,incest,cnn77ci,1,t5_2qx19
2816553,0,t1_cno8eki,merr.,incest,cno8gxu,1,t5_2qx19
2818020,0,t3_2sc6o7,How exactly do you grope your moms breasts while shes blowing you as you are on a stepladder?  Are you plastic man?,incest,cnoehb9,17,t5_2qx19
2824601,0,t3_2s5d5e,I love you story but could you please lengthen it really good ,incest,cnp5ghj,1,t5_2qx19
2854477,0,t3_2srg2n,Unless your sister has exhibited signs of being attracted to you I would caution against pursuing a relationship.  Shes probably in a very emotionally vulnerable state right now and the added pressure would not help her situation.However you might want to consider letting her know that you are having trouble seeing her as your sister not in the sense that you dont see her as a woman but as that you dont perceive her as a sibling the same way you did when she was your brother.  You feel conflicted by the fact that youre constantly in the presence of someone your body is telling you is an attractive woman but you arent feeling the psychological familial relationship with as you would with a sister you grew up with.  Not unlike meeting a sister you were raised separately from.Let her know that you arent telling her this to upset her or because you expect her to reciprocate but because you want her to know that if you are standoffish around her it is not because you are repulsed by her or object to her decision to pursue becoming her true inner self.On the other hand...If she has exhibited signs of being attracted to you then I will offer you the same advice that I gave to uOmegaSlut when he was in an extremely similar circumstance with his newly transgender sister linked below for your future reading.  If your sister is acting at all flirtatious with you she may be doing the same thing that adolescent girls do as they go through puberty which is to flirt with male relatives that the perceive as safe so as to experiment with their burgeoning sexuality.,incest,cnsjzan,6,t5_2qx19
2872775,0,t3_2srbbv,Would love a play by play about your first time. How it progressed to the bedroom who took what off fore play and the like.,incest,cnumvr5,1,t5_2qx19
2890897,0,t1_cnuqyeu,TIL bisexual people cant get married.,incest,cnwp5p1,2,t5_2qx19
2936756,0,t3_2trfza,Psychological research supports the view that once men and women are aroused they are willing to do sexual acts they would normally find disgusting or morally wrong.This can only be taken so far however.so this makes me wonder if he had fantasized before about her....too bad we will never know. But in general this was a pretty awful way to get off. Not that it matters...these are just words on a screen who knows if this is real.,incest,co1x6zp,3,t5_2qx19
2947506,0,t1_co354go,I wasnt insinuating I want an abortion but given my current circumstances that is likely the decision I would make.  It will likely change when I get married later this year and finish school.,incest,co35906,2,t5_2qx19
2957771,0,t1_co3rdgn,they might not sure. i havent talked to them since my mom threatened to sue us so im not sure how theyd know unless my aunt told them,incest,co4bads,3,t5_2qx19
2960840,0,t1_co4fxj0,ditto,incest,co4nu3r,2,t5_2qx19
2969030,0,t1_co5h56j,I just dont even know what to say anymore Im trying to be honest and clear but nothing I can say even matters. Im sorry okay Im so sorry I ever even bothered you people Im sorry,incest,co5ldku,1,t5_2qx19
2969252,0,t1_co5l4t3,,incest,co5ma6y,1,t5_2qx19
2980710,0,t3_2ua8c5,deleted,incest,co6x7mw,2,t5_2qx19
2987069,0,t3_2epk3t,Ty for updating cant wait to hear more,incest,co7luwo,1,t5_2qx19
2990094,0,t1_co7x2rf,Milk is the fastest liquid on earth. Its pasteurized before you even see it.,incest,co7x5ls,1,t5_2qx19
2997219,0,t3_2uidgu,Im  and she is almost ,incest,co8nqv9,1,t5_2qx19
3012751,0,t3_2uo0xb, What kind of porn are your mom and sister into? Anyone into shemales?    Any one of you share a favorite porn star? Or better yet watch when your favorite stars go at it together?   Do you guys bookmark porn videos and recommend them to each other?   Have you and your sister ever watched brothersister incest porn together? How about momson porn with your mom? Guyguy with your dad? Solo masturbation by yourself? lol   Ever ask your sister to hook you up with one of her friends?   Do you think your sister gets particularly riled up about your father in the same way you do about your mother or is your mom pretty much the star of the show? Does dad like fucking his little girl or is she just another mature adult who he happens to have a genetic relation with?    Ever get into a deep conversation with your sister and fantasize about your mom together?   Do you ever just get careless with your sister because shes a sibling and you just know each other too well to find anything exciting in each other? Or do you two tell each other how much you love one other? Is it just during sex?   Besides sex how is your family closer now that youre all intimiate?   What are your guys religious views?   Ever tried pot?  I want to let you know that just reading about how close you guys are makes my heart skip a beat. I dont know how you landed such an awesome family but we need to know more about how to make this kind of family more popular. Its a life I feel deprived almost cheated out of due to social norms. ,incest,coa9q00,4,t5_2qx19
3017436,0,t3_2ul8lr,Ok well because everyone else is getting sidetracked I dont know what happened with Amber but it was super sweet of you to take her in like you did and Im sorry for your fianc. In the way your situation is set up to be pretty much Amber is your daughter on paper but whoever you want her to be in reality i guess you could say so it doesnt really make it incestuous.....I hope this made sense. And yes you should update!,incest,coar72r,2,t5_2qx19
3036054,0,t1_cocn577,I came here to say basically the same   He seems interested I hope everything works out just fine for you both   Aaand I cant hardly wait for the next update,incest,cocopvx,7,t5_2qx19
3041228,0,t3_2uzy94,Do you talk to her about sex and stuff?Do you and her drink alcohol?,incest,cod80kb,2,t5_2qx19
3054022,0,t3_2v4cx5,gtThis is a long post and I dont expect many people to read the whole thing.You must be new here.,incest,coejpwa,61,t5_2qx19
3064199,0,t3_2v9b8g,Sounds to me like she knows what you are doing and ignored it.I dont know if its normal I have never done it. For me used underwear was as exciting as used socks not really. ,incest,coflnr6,1,t5_2qx19
3065632,0,t3_2v5cgy,When your mom started banging you did she stop banging your friends?,incest,cofqzzq,4,t5_2qx19
3069849,0,t3_2v8z6l,You could even offer to wash her back or ask her to wash yours.,incest,cog6q0f,1,t5_2qx19
3078287,0,t3_2vdalu,You know how dirty coins are? gtmy cock stabbed me in the nuts. Wat,incest,coh28o8,18,t5_2qx19
3080817,0,t1_cohbknf,Thank you  it seems many are hating at the moment but people always tend to hate much more when others are happy or have things that they do not ,incest,cohbp7a,2,t5_2qx19
3086737,0,t1_cohpn8j,and penis touching but only a little. ,incest,cohxswn,6,t5_2qx19
3093145,0,t3_2vl06r,Personally I find it kinda hard to believe that you feel that is hot watching your parents fuck and you even masturbate while you do it but at the same time you dont find them sexually attractive. So I call bullshit.,incest,coilpze,-15,t5_2qx19
3093399,0,t1_coils9n,Already did Im afraid.,incest,coimo2i,2,t5_2qx19
3098846,0,t3_2vncyz,Are you planning on having sex with her ?,incest,coj6zuk,2,t5_2qx19
3105900,0,t1_cojv421,Coming from someone who was adopted because his mom was even less prepared then you are.  Adoption is a option that can work out really well if you ask around and try to find a good family the child could have a great life.  As long as you dont say that its yours no one will know it is im  at college and i know my birth moms name and have no idea who my dad is.,incest,cojxbni,3,t5_2qx19
3106180,0,t1_cojvncu,I hope she can get it. Cant wait for the next update!! You are one lucky dude!,incest,cojydd0,-1,t5_2qx19
3112434,0,t3_2vquyn,how your mom looks like?,incest,coklpil,1,t5_2qx19
3122068,0,t3_2uxm91,Been on reddit for  years and it only just occurred to me that there might be a rnfl LOL,incest,collnlt,1,t5_2qx19
3139698,0,t3_2w31wb,All users must be  at time of posting.,incest,confd4z,0,t5_2qx19
3144095,0,t1_conlxfc,gt If you dont mind the length I highly recommend it Best pickup line yet.,incest,convs8t,8,t5_2qx19
3157581,0,t3_2u0nkg,More please!,incest,copa4k2,1,t5_2qx19
3163444,0,t1_copna60,This. Set some rules and give him an audition he does something for you and if its enjoyable you return the favor. Take it from there. ... Play it loose see how it goes Sterling Archer,incest,copw1c2,-1,t5_2qx19
3181573,0,t1_corqkc6,I completely agree.However I dont treat everyone like theyre lying. When someone is asking for advice I treat it like they are telling the truth because otherwise why engage them at all?,incest,corrpbm,2,t5_2qx19
3181580,0,t3_2folph,Hi Maria  I recently read your AMA and Im just sooo delighted by it... Im really not sure why. I havent been to rincest before and only stumbled upon it. To be blunt I was pretty shocked by this subreddit. I couldnt help being interested though so I decided to stick around for a little bit. I love your post. Not only is it just way way hot but its also just generally lovely. I also just wanted to say that I think youre a beautiful person.I also have questions lol P Sorry in advanced if you already covered this somewhere in your AMA. You said you sometimes have sex with your dad solo. Can you talk a bit about that?How often with just him vs with everyone.. Do you have sex with just him more often or less often?Do the two of you like having the time separate from the group dynamic?Do you guys always let your mom know or is it more casual?How is it arranged? Like does it happen when your mom goes out? When shes at work?Does it also happen while she is around? Will she notice and not join in? Sounds like an odd question but I have this fantasy in my head of you and him together on a bed or couch with a TV on and she walks by with some laundry or something and just like smiles maybe. Lol would something like that happen?Do you and your dad go out together ever? Wouldhave you fooled around with him while out?How long does he last when its just the two of you? Are you satisfied with how long that is?How often do you guys have anal sex? Do you do that more when its just you and him? Are you at your max when it comes to that or could you go more if he wanted it? Do you like when he cums in your ass?Do you sleep the night in their room usually or your room? Do you sleep over after sex?And if theres any other neat details you wanna share.Thanks youre so cool ,incest,corrq9o,1,t5_2qx19
3186344,0,t1_cos9fvn,Okay so you fetishize your cousin because shes your cousin not because you actually are attracted to her.Youre happy with your SO but still making plans on what youre going to do when you dump her or she breaks up with you.Thats not healthy dude.Having someone you know in your spank bank isnt so bad but jesus fuckin christ. This post comes off like the only reason you havent fucked the cousin is because shes unattractive right now.Fantasize away though but the post came off strange and unclear as to what youre asking for advice on. If youre asking for someone to help you fap to a fantasy about your cousin maybe you should go to rincestroleplay or rincestpersonals or something? Not that plenty of folks wont PM you from here the other two subreddits though seem more appropriate.,incest,cos9jnq,1,t5_2qx19
3194665,0,t1_cot3bz6,Haha cmon man...,incest,cot4kve,2,t5_2qx19
3215029,0,t1_cov1pnx,Ive asked what the nightmares are about and she says they arent really scary but she doesnt like sleeping alone.She hasnt been wearing her pjs just crawling in bed in a tshirt and panties.  A few times she has come in with just her panties and put on one of my tshirts.  I saw her quite clearly she wasnt hiding or anything and Im pretty sure she knew I was watching her.She asked me if I thought she was attractive and asked if her friend was prettier than her.  When we fought about about me sleeping with her friend who is several years older than her not the same age.  Im pretty sure I heard her say why not me but she was crying walking away.  When I agreed to not see her friend again she started coming into my bedroom.Im not uncomfortable with her being in my bed I like it.  I get very aroused.  Im sure she wants to sleep with me but Im terrified of being wrong.,incest,cov8mpe,3,t5_2qx19
3215840,0,t1_couvml1,Judge not lest you be judged,incest,covbnzf,1,t5_2qx19
3248711,0,t1_coyiogn,Removed gtDo not ask for pictures. ,incest,coyqk5j,3,t5_2qx19
3253604,0,t1_coz7dz4,I asked if she wanted my bed but she said the couch was fine that could be why...,incest,coz8vn4,2,t5_2qx19
3261532,0,t3_2x9j8i,If you couldve gone back and stopped your porn career from happening assuming you still met all your friends your wife and anything else you hold dear would you do it?,incest,cp02hxy,1,t5_2qx19
3263432,0,t1_coz6bjf,Lol at some point Ill probably post the full steamy details.,incest,cp09lli,3,t5_2qx19
3263893,0,t1_cp0a9pj,Uhhh I dont think we are ready for that... Maybe in the next few years not planning on getting her pregnant only days after starting our relationship,incest,cp0bblc,2,t5_2qx19
3307106,0,t3_2xzpjn,I had almost the same thing!  Start texting her go from fun to flirty by complimenting her and she says she is shopping tell her you want a pic of what she buys clothes wise. ,incest,cp58jhc,0,t5_2qx19
3314717,0,t1_cp63mpt,Did that start anything between you guys?,incest,cp63tcb,2,t5_2qx19
