,controversiality,parent_id,body,subreddit,id,score,subreddit_id
2293049,0,t3_2lgwex,Source video,EarthPornGifs,clv4y8q,1,t5_31bk9
2305605,0,t3_2logno,wiccki wiccki wick... play it again dj!,EarthPornGifs,clwotu8,1,t5_31bk9
3644394,0,t3_2sx8n3,One of these days I will make my way out to MT.  Seems to be one of the most beautiful unknown spots in the US.  And its fucking massive.,EarthPornGifs,cq7orn3,2,t5_31bk9
3968743,0,t1_cr8hdo4,Denver County is actually pretty big. There isnt a lot going on between the main city and the airport. This could easily be in that area.,EarthPornGifs,cr8o57b,3,t5_31bk9
4639696,0,t3_3eip5f,Wrong sub buddy,EarthPornGifs,ctfeg3w,1,t5_31bk9
