,controversiality,parent_id,body,subreddit,id,score,subreddit_id
338355,0,t3_1xvozu,Try the BuySwapSell Facebook group. I also keep tabs on ebay and when something tagged with Black Milk or Black Milk Clothing I get a push notification letting me know something new with those keywords has been posted.,blackmilk,cffu9zx,1,t5_2u28q
756787,0,t1_cgatrjt,Its still for sale.  ,blackmilk,cgqaxnf,1,t5_2u28q
1564773,0,t3_2c2lr8,I got the wallpaper pink zip dress wallpaper blue crop and the pvc sky blue cheerleader skirt!  this is the most Ive ever grabbed in one release I think... I got everything on the US site and Im so glad I did!  I think it will be a lot more busy next release though now that everyone else realized that the stock lasts longer!,blackmilk,cjcf145,1,t5_2u28q
2548299,0,t3_2otm7z,Is she a hard medium?  I wear smalls in the mermaids because of how stretchy that particular fabric is.  Im tall so as they relaxed after a few wears they would lose the vertical shape so they looked like capris.  Take that into consideration I guess as a small might work better in the long run.,blackmilk,cmr777w,2,t5_2u28q
10578337,0,t3_5rghji,Go with a large for sure!! My hips are  in the widest part and I have the matte pocket leggings in a large and theyre faaaabulous.,blackmilk,dd72n6r,4,t5_2u28q
