,controversiality,parent_id,body,subreddit,id,score,subreddit_id
252693,0,t3_1wy79z,this is the shawl I have planned for it! ,yarnporn,cf6y2hr,2,t5_2suzj
256811,0,t3_1x1g4u,Oh wow the Finito is absolutely gorgeous. I love grey tones.,yarnporn,cf7dhmf,2,t5_2suzj
349819,0,t3_1y0vyv,Those neutrals are just lovely,yarnporn,cfh0yny,2,t5_2suzj
487303,0,t1_cfuz0do,Its Discobaby knits. Double rainbow on twisted merino. ,yarnporn,cfvnrps,1,t5_2suzj
908213,0,t3_24hzwq,I love the hummingbird colorway... even though the ones out here are red D,yarnporn,ch7ipqb,1,t5_2suzj
2041685,0,t1_ckzbosh,Nghhhhhh dat sockVery impressive work though projects I dont feel qualified to start quite yet. Im on my fifth pair of vanilla ankle socks haha! Ive knit socks fingerless mitts with my own handspuntheyre my goto gift. Spin yarn and make into fingerless mittens made to the persons size after I measure their hands lmao scarvescowls two hats and Ive made a blanket I currently have way too much projects on my hands too TT sigh the life of a knitting addict right?,yarnporn,ckzcd7x,1,t5_2suzj
2504415,0,t1_cml542i,Its like I can spend a couple dollars on yarn.  Only so many dollars until free shipping!?  I can do that.,yarnporn,cmlgreq,1,t5_2suzj
2961321,0,t3_2tzzfs,Im DROOLING. The only yarn stores around me are small and hard to get to!,yarnporn,co4pt6f,1,t5_2suzj
4451903,0,t3_3c23gg,The Buffalo Wool Co!! Buffalo fiber is just about as truly American as you can get too!,yarnporn,csrui17,2,t5_2suzj
5459148,0,t3_3ppbrd,I gotta look for them! Hopefully I can find them in MTL!,yarnporn,cw9ghwk,1,t5_2suzj
5544010,0,t1_cwka7v1,Depth of Shade  how much dye per fiber you use. So if you use g of dye powder for g of yarn thats a Depth of Shade of .,yarnporn,cwkaag3,3,t5_2suzj
6800044,0,t3_48cv80,That is the most beautiful thing I have seen all week.,yarnporn,d0n2t84,1,t5_2suzj
9928877,0,t1_db08qj6,Im OP and yep thats the pattern. Its so easy! You just need to know knit and purl not pattern author so not making any ,yarnporn,db1rapf,2,t5_2suzj
11392294,0,t3_62jl8s,How did you get the tonal look? Were the skeins twisted when they were dunked?,yarnporn,dfnat1u,2,t5_2suzj
