,controversiality,parent_id,body,subreddit,id,score,subreddit_id
1642671,0,t1_cjm80bb,You already are impressive you dont have to go to all that trouble just for me.,HogwartsRP,cjm81kw,1,t5_2ygix
1642903,0,t1_cjm926o,He runs to where he hears the crying.Amanda please Im sorry dont hate me...,HogwartsRP,cjm93ct,1,t5_2ygix
1643775,0,t1_cjmbq2l,Have fun!,HogwartsRP,cjmd1h9,1,t5_2ygix
1647847,0,t1_cjmv4qb,Three!He tensed his arm putting as much strength as possible.,HogwartsRP,cjmvhxg,1,t5_2ygix
1648912,0,t1_cjn0b4g,She blushes. No you are.,HogwartsRP,cjn0bq1,1,t5_2ygix
1656641,0,t1_cjnqt01,She still sleeps,HogwartsRP,cjnze3k,1,t5_2ygix
1658840,0,t1_cjo9akf,Id forgotten about Katherine.,HogwartsRP,cjo9cxr,1,t5_2ygix
1658973,0,t1_cjo9qy5,Well be okay. Sure. Yep!,HogwartsRP,cjo9ymq,1,t5_2ygix
1659320,0,t1_cjo8kep,It is? I bite my lip nervously.,HogwartsRP,cjobj4t,1,t5_2ygix
1668313,0,t1_cjpga0k,Hey...can I see your room?,HogwartsRP,cjpgawu,1,t5_2ygix
1672147,0,t1_cjpxnd2,After taking a drink from his mug he turns back to you. So Lucifer. Mind tellin me a bit bout yourself?I sigh and mutter behind him. Oh boy...,HogwartsRP,cjpxpdk,1,t5_2ygix
1680055,0,t1_cjqxlav,he shrugsMy brother always steals my food.,HogwartsRP,cjqxm8u,1,t5_2ygix
1680069,0,t1_cjqxhey,Grinning I start to move in time with your thrusts again. As I do I let my hands wander to every part of you I can reach.,HogwartsRP,cjqxojh,1,t5_2ygix
1681841,0,t1_cjr5msn,Cant stay under there forever!,HogwartsRP,cjr5qcm,1,t5_2ygix
1683038,0,t1_cjrb4m9,Its sort of uncomfortable for me.,HogwartsRP,cjrb5yg,1,t5_2ygix
1683221,0,t1_cjrbxde,I smile and kiss your noseThey are nice. Alright lets cuddle.,HogwartsRP,cjrbzu5,1,t5_2ygix
1684240,0,t1_cjrgfcz,I pull away for a second. Of course Im just improvising.,HogwartsRP,cjrgmq6,1,t5_2ygix
1685957,0,t1_cjroeas,Even with this cane Ill win the cup for my house.What about you? Ill assume youre going to say Ravenclaw correct?,HogwartsRP,cjrogot,1,t5_2ygix
1687129,0,t1_cjrserl,Yeah but youre pretty smart I think.,HogwartsRP,cjrts2i,1,t5_2ygix
1687261,0,t1_cjruc4z,He smiles.Maybe. What about you?OOC Neither did I honestly. I figured youd made a mistake so I waited till you corrected it.,HogwartsRP,cjrudlf,1,t5_2ygix
1687468,0,t1_cjrv3id,How do you have that kind of patience?,HogwartsRP,cjrvbcj,1,t5_2ygix
1688431,0,t1_cjrz2wj,As soon as youre distracted I start to tickle your feet.,HogwartsRP,cjrzokh,1,t5_2ygix
1690250,0,t1_cjs7b0k,Huh i guess my readings need a little practice. So you in gryffindor? ,HogwartsRP,cjs7x9k,1,t5_2ygix
1693497,0,t1_cjsml9y,Im sure it will be.He says as they go up the slide.,HogwartsRP,cjsmn9d,1,t5_2ygix
1694554,0,t1_cjsr01d,Oh. Sorry.,HogwartsRP,cjsrg85,1,t5_2ygix
1694742,0,t1_cjss7gg,Not always.,HogwartsRP,cjssatg,1,t5_2ygix
1696059,0,t1_cjsy7uk,Would you like to? We dont have to.,HogwartsRP,cjsy9nh,1,t5_2ygix
1696614,0,t1_cjsy9lb,Thats good. I smile.,HogwartsRP,cjt0s84,1,t5_2ygix
1700909,0,t1_cjtk758,My giggles soon turn to laughter as you assault my ticklish body,HogwartsRP,cjtk8rg,1,t5_2ygix
1701659,0,t1_cjtlo0h,Erm .... I think rule number one shoukd be that I am awesome.,HogwartsRP,cjtnndh,1,t5_2ygix
1703625,0,t3_2dwg7p,OOC Shipping him and Elsa Mayburt already.,HogwartsRP,cjtwjwp,1,t5_2ygix
1704635,0,t1_cju10tl,Well how about some chess?,HogwartsRP,cju14uh,1,t5_2ygix
1707940,0,t1_cjufya3,Whos the new person?,HogwartsRP,cjug4fc,1,t5_2ygix
1709920,0,t1_cjumv7i,Well now that you mention that...just between the two of us Im not yet sure I want to be an auror. Im not sure whether Im cut out for a world of magic maybe its the muggle blood in me. BlushesIm sorry for saying too much! What about you do you want to be an auror too?,HogwartsRP,cjup45t,1,t5_2ygix
1711524,0,t1_cjuwch1,she shakes her head Dangerous...,HogwartsRP,cjuwear,1,t5_2ygix
1711613,0,t1_cjuwec2,I lean up and kiss your lips.,HogwartsRP,cjuwsvi,1,t5_2ygix
1711988,0,t1_cjuygnp,He starts laughing.I meant it literally. I am the Son of Satan!,HogwartsRP,cjuyi8x,1,t5_2ygix
1712041,0,t1_cjuylid,Thank you for everything.,HogwartsRP,cjuyqwu,1,t5_2ygix
1712052,0,t1_cjuynw5,Then why pick it?,HogwartsRP,cjuysp8,1,t5_2ygix
1715005,0,t1_cjvc4wb,I stroke the side of his face leaning into the kiss.,HogwartsRP,cjvc745,1,t5_2ygix
1716016,0,t1_cjvgds0,He looks up wiping his mouth.Eugh... I have no idea what that was...,HogwartsRP,cjvgsh7,1,t5_2ygix
1716541,0,t1_cjvj41n,What did you knock over?,HogwartsRP,cjvj6jc,1,t5_2ygix
1719472,0,t1_cjvwfz5,Its next to the Three Broomsticks. And where different lingerie under your clothes and Ill send the rest to my dorm.,HogwartsRP,cjvwi5p,1,t5_2ygix
1723362,0,t1_cjwdsie,he blushesWant to go somewhere private?,HogwartsRP,cjwe6xi,1,t5_2ygix
1724777,0,t1_cjwkl08,I love you too.,HogwartsRP,cjwkmgv,1,t5_2ygix
1726190,0,t1_cjwqwvw,Dont worry about it babe.,HogwartsRP,cjwr1k2,1,t5_2ygix
1726730,0,t1_cjwff3j,Dunno. Use your tits.,HogwartsRP,cjwthvs,1,t5_2ygix
1729763,0,t1_cjx771r,Moans. Ohh... Yes sir.,HogwartsRP,cjx79cp,1,t5_2ygix
1730997,0,t1_cjx9wrb,Julia Luctuosa my most perfect fiance tell me whats wrong.,HogwartsRP,cjxcuu5,1,t5_2ygix
1738201,0,t1_cjy9he7,And have you explored much of Hogwarts yet?,HogwartsRP,cjy9ivz,1,t5_2ygix
1738223,0,t1_cjy9iah,I turn my head and kiss you.,HogwartsRP,cjy9mha,1,t5_2ygix
1738614,0,t1_cjybaiq,I want to clean off first.,HogwartsRP,cjybeai,1,t5_2ygix
1738802,0,t1_cjyc5p2,I scream with laughter.,HogwartsRP,cjyc8y8,1,t5_2ygix
1739511,0,t1_cjyffu5,she decides to just start walking,HogwartsRP,cjyfgj9,1,t5_2ygix
1740190,0,t1_cjyiigp,My grandma.,HogwartsRP,cjyij1d,1,t5_2ygix
1740491,0,t1_cjyjs5c,Strange... Ya dont have any idea who he was?,HogwartsRP,cjyjvy6,1,t5_2ygix
1740719,0,t1_cjykwb8,Still they are parents.,HogwartsRP,cjykx1l,1,t5_2ygix
1744876,0,t1_cjz2t2d,Uh huh ...So you can apparate?,HogwartsRP,cjz3pmy,1,t5_2ygix
1745040,0,t1_cjz4f2t,And they let you take the test?,HogwartsRP,cjz4gap,1,t5_2ygix
1746909,0,t1_cjzcikd,OOC Thats why she did it p,HogwartsRP,cjzcwgv,1,t5_2ygix
1751390,0,t1_cjzx438,he waves his wandAccio Kaoris missin panties!,HogwartsRP,cjzx5w9,1,t5_2ygix
1751560,0,t1_cjzxbao,I do ... My eyes drift shut.,HogwartsRP,cjzxxm2,1,t5_2ygix
1753066,0,t1_ck02p22,Shaun sits beside his with a sketchpad.,HogwartsRP,ck04rgn,1,t5_2ygix
1753641,0,t1_ck05rwh,Why?,HogwartsRP,ck07dc0,1,t5_2ygix
1755038,0,t1_ck0dj7b,I turn and kiss your cheek. The little girl looks at you. Who are you?,HogwartsRP,ck0dp9n,1,t5_2ygix
1755425,0,t1_ck0fclj,It was.I smileDespite being banged up I still got on one knee when I proposed.,HogwartsRP,ck0fggq,1,t5_2ygix
1755432,0,t1_ck0fas2,Can you blame me?,HogwartsRP,ck0fhlv,1,t5_2ygix
1755866,0,t1_ck0hf4w,Its been a long time since I had sex with a woman.,HogwartsRP,ck0hgh8,1,t5_2ygix
1761091,0,t1_ck14ywl,It really was.,HogwartsRP,ck15511,1,t5_2ygix
1761373,0,t1_ck164qp,And accepted the gifts?,HogwartsRP,ck16ex4,1,t5_2ygix
1762434,0,t1_ck1b1aa,And now?,HogwartsRP,ck1b81l,1,t5_2ygix
1762696,0,t1_ck1cd73,Cold?,HogwartsRP,ck1cerm,1,t5_2ygix
1764219,0,t3_26i8oh,Adalira Radish Professor Radish is fine HUFFLEPUFF.,HogwartsRP,ck1jbdm,1,t5_2ygix
1777201,0,t1_ck35v2x,I whisper between kisses as well. I love you too more than anything...I break away from your lips long enough to start kissing your neck...oh God Isabella I missed you so much...I resume kissing your neck. ,HogwartsRP,ck365y6,1,t5_2ygix
1779579,0,t1_ck3gvf2,she stares at it Is the rock alive?,HogwartsRP,ck3gy3y,1,t5_2ygix
1791344,0,t1_ck48qjh,ooc it would be interesting if she were to just appear,HogwartsRP,ck4y78j,1,t5_2ygix
1796441,0,t3_2f36o3,Smiles brightly bounding around to say hi to her fellow Prefects,HogwartsRP,ck5l8ym,1,t5_2ygix
1797042,0,t1_ck5nyf6,Confidentially I prefer French. Is my English okay?,HogwartsRP,ck5nyvx,1,t5_2ygix
1797254,0,t1_ck5ovf9,He begins walking faster with the plate whistling inconspicuously.,HogwartsRP,ck5oxfv,1,t5_2ygix
1797630,0,t1_ck5orzf,Whats the matter?,HogwartsRP,ck5qn9k,1,t5_2ygix
1799462,0,t1_ck5z4po,Smiles as he looks down at himselfThank you. Its my preferred outfit for soirees such as this. Silver is my family color and my personal favorite.,HogwartsRP,ck5z5pz,1,t5_2ygix
1800725,0,t1_ck64ylz,I nod quickly covering my pained expression.,HogwartsRP,ck64zii,1,t5_2ygix
1800782,0,t1_ck655ay,He doesnt understand sign language but finally cottons on that maybe she doesnt talk. sorry I err... Dont understand.,HogwartsRP,ck658pk,1,t5_2ygix
1801361,0,t1_ck6779l,I tilt my head back so you can reach better.,HogwartsRP,ck67sxy,1,t5_2ygix
1801698,0,t1_ck6970m,she smiles Ive found one here.,HogwartsRP,ck69as3,1,t5_2ygix
1804330,0,t1_ck6kstu,Smiles at herWell we mightve just handicapped our Houses by  points for the start of the term but hey...Walks up and wraps his arms around her waist smiling charminglyStill gonna be a great year.,HogwartsRP,ck6kz2b,1,t5_2ygix
1804695,0,t1_ck6mii1,Pretty much the same. Excited for school to start?,HogwartsRP,ck6mm7p,1,t5_2ygix
1808053,0,t1_ck71hj6,Kind of boring.,HogwartsRP,ck71ke5,1,t5_2ygix
1812250,0,t1_ck7ju43,She nods and smiles,HogwartsRP,ck7jy46,1,t5_2ygix
1816556,0,t1_ck81qkj,I should probably go ...,HogwartsRP,ck82tjt,1,t5_2ygix
1816585,0,t3_2fcbmw,Well unbeknownst to her Michaels quite fond of the spot as well. It lets him take walks in peace. He stops taken by surprise when he sees someone in the usually deserted spot.,HogwartsRP,ck82y34,1,t5_2ygix
1816591,0,t1_ck82x96,I think they deserved it. They were beating up first years over the summer. I dont think theyll do that anymore.,HogwartsRP,ck82z11,1,t5_2ygix
1818860,0,t1_ck8bum0,i kiss you back,HogwartsRP,ck8cviz,1,t5_2ygix
1819808,0,t1_ck8gw08,Okay. Well just bounce straight there then. I take your hand gently in mine and start to walk there with you.OOC Here you go. D,HogwartsRP,ck8h0ce,1,t5_2ygix
1820684,0,t1_ck8kmqd,How though?,HogwartsRP,ck8kujq,1,t5_2ygix
1822125,0,t1_ck8qqe2,I thought you might,HogwartsRP,ck8r5jo,1,t5_2ygix
1823907,0,t1_ck8yx1r,For a future job,HogwartsRP,ck8yybb,1,t5_2ygix
1824746,0,t1_ck90r86,We dont have to rush things..your powers make me rush...,HogwartsRP,ck92lpn,1,t5_2ygix
1825489,0,t1_ck95o85,Shame. Although I think the Gryffindor team is full anyway. Every team besides Slytherin I think. And I agree muggle books are my favourite.,HogwartsRP,ck95u9f,1,t5_2ygix
1826447,0,t1_ck99wnu,You are my everything and you are already perfect.,HogwartsRP,ck9a0ci,1,t5_2ygix
1827706,0,t1_ck9f3ey,Too much butterbeer man. Too. Much. Butterbeer.,HogwartsRP,ck9fi1w,1,t5_2ygix
1828145,0,t1_ck9g34r,She groans chewing on bacon. Suddenly Elfie flops her head on the table and says in a muffled voice Im not ready for class.,HogwartsRP,ck9hf0e,1,t5_2ygix
1828378,0,t1_ck9ibho,Meanwhile an elderly and somewhat old fashioned professor sitting nearby quietly grumbles something about dignity and privacy but never mind that because even he thinks this is all kind of adorable and he internally admits to himself that this was something he did literally all the time with his own wife.,HogwartsRP,ck9ifj8,1,t5_2ygix
1828830,0,t1_ck9iz0n,she shakes her head Ill let the others tell the story. I got there after they did. Lets just say Raziel would be the best.,HogwartsRP,ck9keec,1,t5_2ygix
1833904,0,t1_ck9pzrl,I watch you leave before going back to eating feeling a bit better now and make a mental note to find you later.,HogwartsRP,cka6hst,1,t5_2ygix
1837557,0,t1_ckalpel,I shrug.,HogwartsRP,ckameex,1,t5_2ygix
1838703,0,t1_ckaqrdn,After signing out I walk over with my hands in my pockets.Smiles. Afternoon.,HogwartsRP,ckardh5,1,t5_2ygix
1839787,0,t1_ckavzhh,She pauses Well...I was planning on when I got discharged coming down to your office maam to apologize for missing class this week. Ill try not to let it happen again.,HogwartsRP,ckaw2vu,1,t5_2ygix
1841375,0,t1_ckb2wyp,Yeah sure.Stands from the bench and begins wandering the store looking like a child left to his own devices in a toy store. He hums various tunes and softly sings various lyrics in various languages as he browses. He collects a number of sheet music pieces and scores.Oh wow they have a Les Miserables score! Thats so cool!,HogwartsRP,ckb2yzt,1,t5_2ygix
1841956,0,t1_ckb4zb3,she takes off her shoes slowly and drops them on the floor and then scoots back giggling slightly Big bed for you Doctor.,HogwartsRP,ckb5hrw,1,t5_2ygix
1847678,0,t1_ckbu26s,You are a Professor though act as such.,HogwartsRP,ckbu9wb,1,t5_2ygix
1850440,0,t1_ckc65sw,Nods in agreement. I see. Waits until hes out of earshot.So should we head to the dungeons?,HogwartsRP,ckc69fa,1,t5_2ygix
1854152,0,t1_ckcltgg,curses are heard from the hallway as Amiera tries to find Shaun. Shes also shaking her hand which is swelling.,HogwartsRP,ckcmcpp,1,t5_2ygix
1857163,0,t1_ckcz5wj,deleted,HogwartsRP,ckczeot,2,t5_2ygix
1857399,0,t1_ckcwtc5,She smiles shyly and continues looking through the telescope. Named him Charlie,HogwartsRP,ckd0fjt,1,t5_2ygix
1857568,0,t1_ckd0wb9,Kisses him on the cheek. I will.,HogwartsRP,ckd15y1,1,t5_2ygix
1857637,0,t1_ckd0i9l,Walks with you out of the dungeons and when it comes to the point where you have to split up to get to your dorms he kisses youGo on back to your dorm. I dont want Arcturus getting uppity. Ill see you later.SmilesAnd well pick up where we left off next time we get the chance.,HogwartsRP,ckd1gpf,1,t5_2ygix
1860589,0,t1_ckcfwh0,She peers at you for a momentYes muggles AND pureblood families exist...,HogwartsRP,ckde96s,1,t5_2ygix
1861059,0,t3_2fw952,Shaun sets to work on making the potion smiling the entire time. Over the summer he discovered that potion making is quite fun. Especially when youre making something that has the potential to KO a dragon.,HogwartsRP,ckdgahx,1,t5_2ygix
1862823,0,t1_ckdnx24,OOC lt,HogwartsRP,ckdnxxw,1,t5_2ygix
1864237,0,t1_ckdt8dk,she looks over Yep. Of course.,HogwartsRP,ckdu2tg,1,t5_2ygix
1864584,0,t1_ckduinn,Sounds good to me.,HogwartsRP,ckdvkvf,1,t5_2ygix
1872109,0,t1_ckerggj,I grin but dont follow her down. I kiss your cheekReady to go to Honeydukes?,HogwartsRP,ckes6f7,1,t5_2ygix
1876387,0,t1_ckf7fuz,Done!,HogwartsRP,ckfaq98,1,t5_2ygix
1876905,0,t1_ckfcyiv,Okay then. Have you flown at all before? Have you handled a broom?,HogwartsRP,ckfcz73,1,t5_2ygix
1877432,0,t1_ckff6wj,You are. I kiss you softly.,HogwartsRP,ckff9je,1,t5_2ygix
1879104,0,t1_ckfm9p8,Feel free to grab a broom. she smiles,HogwartsRP,ckfmil7,1,t5_2ygix
1879762,0,t1_ckfoqlf,She shakes her head No I didnt know people actually flew in them.,HogwartsRP,ckfpdbb,1,t5_2ygix
1890747,0,t1_ckgq6o0,I wasnt done.,HogwartsRP,ckh0yz8,1,t5_2ygix
1892473,0,t1_ckh7dsa,Scarlett not knowing whats going on seems just as cheerful. She hangs onto your hand to not get lost repeatedly stepping on peoples feet.,HogwartsRP,ckh8foc,1,t5_2ygix
1894589,0,t1_ckhhiiw,Cmon.. You can tell me. I smile encouragingly.,HogwartsRP,ckhhl6s,1,t5_2ygix
1894923,0,t1_ckhiy3g,I want us to be friends as well but when you feel like that... I dont know.,HogwartsRP,ckhj1dm,1,t5_2ygix
1896295,0,t1_ckhoopq,Sometimes I come down here to practice spells.,HogwartsRP,ckhozux,1,t5_2ygix
1898350,0,t1_ckhq46v,she scratches her head I dont really know. i could see something with the moon.  SHES A WEREWOLF lttoothandclawreferencegt,HogwartsRP,ckhxvu3,1,t5_2ygix
1899853,0,t1_ckh9ha5,Done,HogwartsRP,cki4dzv,1,t5_2ygix
1902133,0,t1_ckie7wx,The grin widens as my fingers slowly descend upon your body taking their place under your arms tickling wildly when they get there,HogwartsRP,ckie9b4,1,t5_2ygix
1902510,0,t1_ckifr5d,deleted,HogwartsRP,ckifw4c,1,t5_2ygix
1908105,0,t1_ckj362w,I dont hear.,HogwartsRP,ckj44rv,1,t5_2ygix
1908133,0,t1_ckj44j6,OOC comforts with a hug Ill make sure youre still invited.,HogwartsRP,ckj494w,1,t5_2ygix
1908833,0,t1_ckj75k8,That would be cool.,HogwartsRP,ckj7aeg,1,t5_2ygix
1914557,0,t1_ckjvklv,Erm ... Hi.OOC Trying to do banking via phone is scary especially when you cant understand the accent and dont know if you made the right choice ....,HogwartsRP,ckjw3o7,1,t5_2ygix
1922940,0,t1_ckkw1gv,Not extremely. About half a meter high. Im basing this on the assumption that its a spell affected by strong emotion...,HogwartsRP,ckkwfo2,1,t5_2ygix
1923718,0,t1_ckkzgcj,The flames erupt from his wand consuming the parchment completely. Ashes gently fall to the ground Wes looks at his own doingWhoa,HogwartsRP,ckkzt2l,1,t5_2ygix
1926806,0,t1_ckld43m,I take the quaffle. How are your keeping skills?,HogwartsRP,ckld6uq,1,t5_2ygix
1927003,0,t1_cklduzb,Hard to say. Weve only seen Gryffindor against Ravenclaw.,HogwartsRP,ckle1mu,1,t5_2ygix
1927357,0,t1_ckldsa9,I whimper and try to shield myself with my book.,HogwartsRP,cklfktu,1,t5_2ygix
1932283,0,t1_ckm05m3,The nicest? Really? Cool! She gets to the edge of the forest and picks the two nastiest looking dolls sticking them straight up in the dirt facing the forestThat should do it. Well put them in pairs its good to have a buddy. ,HogwartsRP,ckm0yb4,1,t5_2ygix
1932625,0,t1_ckm2bfj,I continue screaming in ultra hysterical laughter trying not to buck about,HogwartsRP,ckm2fwr,1,t5_2ygix
1932647,0,t1_ckm2bnl,I draw a hand to your belly slowly tickling you,HogwartsRP,ckm2jcn,1,t5_2ygix
1932659,0,t1_ckm2ejg,Some know. But they dont give a shit. They moved on from the middle ages.Disgusted I walk to the other end of the class.,HogwartsRP,ckm2l88,1,t5_2ygix
1935489,0,t1_ckl56eh,Ravenclaw!!!The Ravenclaw crest dawns on your robes as they outline in blue and bronze.Welcome to Hogwarts and to Ravenclaw house!,HogwartsRP,ckmex5m,1,t5_2ygix
1941783,0,t1_ckn6hml,Um... sorry who?,HogwartsRP,ckn6lmx,1,t5_2ygix
1942080,0,t1_ckn7sg0,I hiccup as I begin laughing hysterical from the beginning but the pleasure quickly becomes too much as I feel my release comingOoohohhohohoho gods! Juuhuhulia! Im gohohohonna cum!,HogwartsRP,ckn7wvd,1,t5_2ygix
1945028,0,t1_cknfsa5,OOC much appreciated just overriding what the professor says thanks for that,HogwartsRP,cknks8o,1,t5_2ygix
1945327,0,t1_cknh41s,The feather continues gong up and down your poor little soles. After a bit I slide it in between your toes sawing it back and forth letting the feathers tickle like mad,HogwartsRP,cknm36t,1,t5_2ygix
1947466,0,t1_cknsfc0,Fair enough.,HogwartsRP,cknvesn,1,t5_2ygix
1949564,0,t1_cko4hq0,It makes no sense.,HogwartsRP,cko4jo3,1,t5_2ygix
1952120,0,t1_ckof8s8,I take a swig from the mug of Butterbeer.Youre damn right I am!,HogwartsRP,ckofn6d,1,t5_2ygix
1952581,0,t1_ckohkoa,A good friend of mine. He locked himself inside a room with her and I didnt take the potion because I couldnt find it,HogwartsRP,ckohn0t,1,t5_2ygix
1957845,0,t1_ckp4cbq,Rubs my neck.So I cant really hold my liquor...,HogwartsRP,ckp4fnv,1,t5_2ygix
1962963,0,t1_ckpl8ob,She calls out from her new position at her deskYes if everyone could just leave their papers on my desk youre dismissed.,HogwartsRP,ckpqluz,1,t5_2ygix
1970175,0,t1_ckqkqw1,I love your odd sayings.,HogwartsRP,ckqluu2,1,t5_2ygix
1973093,0,t1_ckqyeue,Absoluwait how Professor? Is anybody sick?,HogwartsRP,ckqyi3u,1,t5_2ygix
1975019,0,t1_ckr5tw9,OhmygodIamsososorryareyouokay?,HogwartsRP,ckr6u4s,1,t5_2ygix
1984378,0,t1_cksanxj,Its okay. Youll do better. Well have this course periodically throughout the year.,HogwartsRP,cksbgjz,1,t5_2ygix
1993715,0,t1_cktfn8j,Im actually a mudblood so I dont really know much of this stuff.,HogwartsRP,cktfylv,1,t5_2ygix
1995910,0,t1_cktpflj,Nice to meet you. she smiles,HogwartsRP,cktphgb,1,t5_2ygix
2001134,0,t1_cku9t72,We apparated. And this is my flat here in Tottenham.,HogwartsRP,ckuc3u5,1,t5_2ygix
2012066,0,t1_ckvnc9b,He glances over at whoever poked him smiling when he sees who it is.Hey Amanda.,HogwartsRP,ckvng0y,1,t5_2ygix
2012698,0,t1_ckvq4d0,she lays out the chart and points excitedly to the eastsoutheast side of thingsCan you move the telescope over there?,HogwartsRP,ckvq6k6,1,t5_2ygix
2014659,0,t1_ckvynj7,We have met before... Was it you who was in the woods?,HogwartsRP,ckvyoms,1,t5_2ygix
2014807,0,t1_ckvza43,Yeah I am,HogwartsRP,ckvzbp1,1,t5_2ygix
2016901,0,t1_ckw8bvv,Oh my. Thats rather mad.,HogwartsRP,ckw8eg4,2,t5_2ygix
2017011,0,t1_ckw8myz,I grin and kiss you quicklyAnd I love it.,HogwartsRP,ckw8vms,1,t5_2ygix
2017069,0,t1_ckw8vms,she smiles So what else do you have here?,HogwartsRP,ckw94q2,1,t5_2ygix
2020320,0,t1_ckwm8e8,Sure of course. she blushes slightly hoping he cant tell.,HogwartsRP,ckwn8bw,1,t5_2ygix
2022059,0,t1_ckwgjj4,Ah. Thats interesting.,HogwartsRP,ckwus34,1,t5_2ygix
2022219,0,t1_ckwpfgq,Miss Cromwell is an Auror. So youre already out of luck. I however.. am not.,HogwartsRP,ckwvh22,1,t5_2ygix
2024640,0,t1_ckx641x,Youre very welcome Amiera.,HogwartsRP,ckx6avt,1,t5_2ygix
2027366,0,t1_ckxfuao,You cant promise that.,HogwartsRP,ckxistm,1,t5_2ygix
2029295,0,t1_ckxj99e,If you dont let me go I will never have anything to do with you again. Im doing my best to sound like I mean it but my voice is shaking a little and I still look terrified.,HogwartsRP,ckxrmvp,1,t5_2ygix
2031377,0,t3_2i15qj,After flipping a coin and getting head to determine how well I do I tap the snail and it disappears,HogwartsRP,cky16o6,1,t5_2ygix
2038382,0,t1_ckywigd,ooc clears throatHow is it that a fifth year is running the Hospital Wing when hes just got here today? Its unrealistic. You didnt run it past the mods whether you could even be in such a position. You have no reason or permission to be there.,HogwartsRP,ckyx9li,3,t5_2ygix
2038783,0,t1_ckyz06r,Both.,HogwartsRP,ckyz3ob,1,t5_2ygix
2051938,0,t1_cl0n8jk,Really? Of course I am... when are tryouts?,HogwartsRP,cl0nalc,1,t5_2ygix
2052355,0,t1_ckzmc2q,Each and every thrust has a lustful power behind it. I hold you down so you cant move but my hips crash into yours as I pound you,HogwartsRP,cl0p7bl,1,t5_2ygix
2054535,0,t1_cl0z1c9,she waves hugging her books tightly,HogwartsRP,cl0z62u,1,t5_2ygix
2054541,0,t1_cl0q46j,Grins. Wicked! Cmon.,HogwartsRP,cl0z72c,1,t5_2ygix
2058896,0,t1_cl1ivk6,shortly Your mother is a muggle she cant be prosecuted unless she did in fact try to kill you then she should be.she takes them and puts them in a box which she then waves her wand over locking it.Id rather no harm come to you right now.,HogwartsRP,cl1j49h,1,t5_2ygix
2059200,0,t1_cl1kcwf,Wes abruptly stopped his broom.Man I suck at lying. He then hought about what Ari said maybe he should at least say hello after practice.,HogwartsRP,cl1kiab,1,t5_2ygix
2061917,0,t1_cl1wwhs,Thanks,HogwartsRP,cl1wxvt,1,t5_2ygix
2063880,0,t1_cl25qf5,His eyes widen and he grows even more shy but doesnt say anything.,HogwartsRP,cl25xil,1,t5_2ygix
2064437,0,t1_cl280r0,OOC Hehe I think I saw that whilst I was being eaten.,HogwartsRP,cl28hak,1,t5_2ygix
2065492,0,t1_cl2d833,OocIs it really that bad?,HogwartsRP,cl2dbag,1,t5_2ygix
2066001,0,t1_cl2f3ws,I motion to an open telescope,HogwartsRP,cl2fnft,1,t5_2ygix
2067455,0,t1_cl2cmdl,Huh? Im not holding anything back.,HogwartsRP,cl2mawu,1,t5_2ygix
2068783,0,t1_cl2rqc2,ooc Just saw your post and thats something youd have to discuss with the actual mods in modmail.... and.. youre going to pretty much have to have a good  and i mean GOOD  story lined up if you want that.,HogwartsRP,cl2sdd0,1,t5_2ygix
2070256,0,t1_cl2yqre,Ok.Looks into her eyesWow such beautiful eyes. Did John bother you again?,HogwartsRP,cl2z43g,1,t5_2ygix
2071794,0,t1_cl3648p,Sorry..,HogwartsRP,cl365g3,1,t5_2ygix
2072524,0,t1_cl39ekl,He cups her face his lips gently brushing against hers.,HogwartsRP,cl39hm4,1,t5_2ygix
2074487,0,t1_cl3i40i,She responds haughtily.I agree it is pretty. Now do tell why do you want me to walk with you where are we going and how long will we be gone?,HogwartsRP,cl3igrb,1,t5_2ygix
2077537,0,t1_cl3tibh,Doesnt it? How high do you think we are?,HogwartsRP,cl3wf0i,1,t5_2ygix
2080846,0,t1_cl4b41i,Whimpers,HogwartsRP,cl4bkmg,1,t5_2ygix
2081137,0,t1_cl4cvib,Into the morning she goes back to him OOC you cant kill him ,HogwartsRP,cl4cwmj,1,t5_2ygix
2084375,0,t1_cl4rowu,Gives a small nod understanding,HogwartsRP,cl4rq17,1,t5_2ygix
2085076,0,t3_2irgta,deleted,HogwartsRP,cl4uxhq,1,t5_2ygix
2091303,0,t1_cl5mxy5,I look thoughtful for a while.If .. if we have to pick someone to temporarily take his place I suggest a vote among the teachers since theres nothing set in place already.OOC Is this plot or does he just want to leave?,HogwartsRP,cl5nfh7,1,t5_2ygix
2097533,0,t1_cl6fxt9,He smiles wryly.I havent got a professional quidditch player for a father.,HogwartsRP,cl6fy7i,1,t5_2ygix
2098730,0,t1_cl6kumj,The same really. Good to see you again.He maintains a polite smile.,HogwartsRP,cl6lfh0,1,t5_2ygix
2099017,0,t1_cl6mj8n,He curses loudly and jams his wand back into his robesI shouldnt have failed that! That was the first spell I had ever seen its second nature to me now.,HogwartsRP,cl6mqn0,1,t5_2ygix
2099640,0,t1_cl6pb38,What makes you say that?,HogwartsRP,cl6pl55,1,t5_2ygix
2101633,0,t1_cl6szu0,OOC Damien as in on of the ones on Xmen rp? Are you them too?,HogwartsRP,cl6yoxj,1,t5_2ygix
2105040,0,t1_cl7e1bw,she smiles  I would hope so. Are you here to help me get candy?,HogwartsRP,cl7ea08,1,t5_2ygix
2105211,0,t1_cl7eg8a,Kisses him,HogwartsRP,cl7f29h,1,t5_2ygix
2107080,0,t1_cl7mwet,it is not a bad thing,HogwartsRP,cl7nluy,1,t5_2ygix
2107538,0,t1_cl7pml2,Oh? That sounds like fun.,HogwartsRP,cl7pp7p,1,t5_2ygix
2114122,0,t1_cl8f6b1,she yawns Already tired.,HogwartsRP,cl8jtqi,1,t5_2ygix
2114722,0,t1_cl8misd,We should probably get going.,HogwartsRP,cl8mkvq,1,t5_2ygix
2119818,0,t1_cl99trw,I grin and wait for a stop that sounds familiar before getting off.,HogwartsRP,cl99wpt,1,t5_2ygix
2121584,0,t1_cl9gyfv,It really is.,HogwartsRP,cl9hzu2,1,t5_2ygix
2122453,0,t1_cl9lp8m,Yeah?I begin tickling your ribs and sidesOr what?,HogwartsRP,cl9lz2w,1,t5_2ygix
