,controversiality,parent_id,body,subreddit,id,score,subreddit_id
26947,0,t3_1uetbg,This is so stupid. CoD and Battlefield are modern military shooters with a focus on competitive multiplayer. And STALKER well the STALKER is STALKER. Why would compare them?Also none of those games are developed in the countries these leaders are from.,stalker,cehi0o7,3,t5_2r74m
106089,0,t3_1v9ckd,deleted,stalker,ceqicsc,9,t5_2r74m
303478,0,t1_cfc7x1m,Good idea Ill try that now.Edit Well it worked and I hope I wont crash during all the emissions in the game. That would suck since they are really awesome.,stalker,cfc806t,2,t5_2r74m
330939,0,t1_cff2bfy,What is it with you and fucking kickstarter?,stalker,cff2mod,2,t5_2r74m
363925,0,t1_cfi954v,There you go a change of name and direction was revealed a few weeks ago. Updates are fairly regular for pics and some info. Though some of them still seem to be on moddb... So Im not sure where the best place for coverage is at the moment DEDIT StalCry is also mentioned in this video for what its worth. Ive seen a couple different Crysisbased Stalker games from different Russian sites o,stalker,cfihisj,2,t5_2r74m
378696,0,t3_1ye1pc,It wasnt as bad as I remembered but it was still horrible. ,stalker,cfk0mx3,1,t5_2r74m
379392,0,t1_cfk2y3e,Yes and you get to fight those soldiers on the winding stairs going downwards instead of upwards which is also a lot less annoying.,stalker,cfk38bo,2,t5_2r74m
420274,0,t3_1yvucl,Try keeping a tree between you and it the chimera either jumps at the tree or to a better position giving you time to pump some lead and reposition.,stalker,cfobs62,3,t5_2r74m
428087,0,t3_1yr1ai,Izloms,stalker,cfp4xal,2,t5_2r74m
458712,0,t3_1zcbh9,Damn newb get out of the zone,stalker,cfsel72,10,t5_2r74m
464616,0,t1_cfrvug2,feels like the game tell you to GET OUT OF HERE STALKER with this mod.,stalker,cft2tsm,5,t5_2r74m
465479,0,t3_1zf37y,What mod is it? Looks nice,stalker,cft6d5q,2,t5_2r74m
466719,0,t1_cftbb3a,Arrogant piece of shit name for those tweaks pack.,stalker,cftbfv2,-6,t5_2r74m
467130,0,t3_1zcn3o,Both of these mods are doing exciting things for Clear Sky and are still in development but with playable builds,stalker,cftd4em,2,t5_2r74m
505941,0,t3_1zwlrd,no clue......whenever I had looked at the ltx or other files always went to a wiki like this,stalker,cfxs148,1,t5_2r74m
544109,0,t1_cg1w7vo,Thanks that seems to help.,stalker,cg24e4h,1,t5_2r74m
570305,0,t1_cg4esf2,...Were gonna need a faster hard drive...p HDD bandwidth MBs maxp HDD bandwidth MBs max  HDD cant keep up FPS stutters sucks up RAMGB SSD is on the way...,stalker,cg53k9j,1,t5_2r74m
579176,0,t3_20qwm8,Ahh I saw movement right as he was going into his inventory... WHAT ARE YOU DOING STALKER?,stalker,cg63uo7,8,t5_2r74m
648909,0,t1_cgdyi1b,Does it use some sort of PvE? Kind of like Frostfall for skyrim?,stalker,cge14ng,1,t5_2r74m
649064,0,t3_21j9t6,There was a KSVK .x mm sniper rifle in the Prometheus movie theater in Pripyat in the . beta so that would be worth checking out. One of my favorite guns in the game really does hole in one shots. D Because its so good I even forgot to get the fixed Gauss rifle from Cardan so far...,stalker,cge1rgp,3,t5_2r74m
729569,0,t1_cgn70fl,I hardly ever use grenades against NPCs out of habit I guess because they damage dropped guns if Im not mistaken. I used grenades especially rifle grenades quite a lot against mutants though especially pseudogiants.Protip when you find thermite grenades save them to use them against Chimaerae  instant kill! o They make a huge ball of fire and liquid metal.,stalker,cgn7f0s,1,t5_2r74m
735836,0,t3_22i504,So as someone who hasnt finished their vanilla play through of cop Im curious how will this compare to the misery mod? Will it accomplish different things?,stalker,cgnx2m4,2,t5_2r74m
759181,0,t1_cgqkhc4,I have ... Damn this is discouraging!  For me its everytime that they wont talk to me at the warehouse. Any advice? ,stalker,cgqkq62,1,t5_2r74m
888275,0,t1_ch4ii2m,Reload your game repeatedly this refreshes NPC inventories. Ive used that to cheese my way to  Veles for the Scientists in CoP a ton of times its a quirk of the engine.,stalker,ch590se,2,t5_2r74m
894246,0,t1_ch5rscc,Well for one everybody got paid like shit. I mean out of the  cars in their parking lot  were epics and all owned by Sergei he pocketed most of it. There were gang ties as well because there was almost no choice in who would pay you to make games in s Ukraine and I think they were paid back but who knows. The reason why GSC shut down is most likely but nobody knows for sure not even the employees Sergei not paying his dues to the government i.e. bribes and bam shut down.Actually heres a really good article about this Linky,stalker,ch5xhkw,4,t5_2r74m
902919,0,t1_ch6wn7r,Already have! Played the shit out of Misery on the Rift,stalker,ch6x0u2,2,t5_2r74m
907949,0,t1_ch7h9jz,Which direction and where do I follow it to?,stalker,ch7hmwj,1,t5_2r74m
916885,0,t1_ch8e5jj,File wont download. Anyone got a mirror link?,stalker,ch8i7yh,1,t5_2r74m
941161,0,t1_chb80a3,You can fix that in the .ltx files.,stalker,chb9kyz,2,t5_2r74m
943337,0,t1_chbe60v,I didnt kill the guards out front no.The foot bone error should be from having actor body on in the options menu iirc. Make sure when you look down ingame you cant see your own body just your shadow. Has something to do with the new rat enemies I think.,stalker,chbiies,1,t5_2r74m
948236,0,t1_chbu7pv,thank you.,stalker,chc2lky,2,t5_2r74m
949917,0,t1_chc8jyt,Not a solution because I know better than to install things into C. STALKER always goes into DGAMESGSC World Publishing and the builds are in GSTALKER extrasbuilds. Its OpenAL not liking my computer at all so theres an error with one of its files. Reinstalling does nothing getting another version of OpenAL does nothing either no idea dont care.,stalker,chc9hq1,1,t5_2r74m
957092,0,t1_chd0oad,Its kind of like the big NS modit takes areas from all the games and adds lots of new quests items weapons rewards and other like things. Consider it a very heavy mod ,stalker,chd2vyj,1,t5_2r74m
960786,0,t1_chbrgyi,Well.. it seems at least one other quest is bugged too i cant return the guitar amp weed  ..guess ill have to start over,stalker,chdi0w8,1,t5_2r74m
965254,0,t1_chdtiop,It crashes about  times an hour for me.,stalker,che0bfk,1,t5_2r74m
972095,0,t3_258nsb,You could try the HD Project! It changes textures obviously and comes with AtmosFear . If your PC cant handle it it has also a pack with smaller textures. About CoP Complete I played the game both vanilla and complete and personally i didnt have the impression that it was way too easy. Just try it out it has some nice features. And i didnt experience more CTDs or savegamecorruptions than with vanilla.,stalker,chesbri,3,t5_2r74m
979190,0,t1_chfkeeu,The mod is in dire need of a rebalance. I understand that the weapons and armors came from several different peoplemods but were never integrated as much as they were thrown in. So some guns might for example use the same exact caliber but have wildly different damage output. Now compound this issue with the same for armors and artefacts and there is a very wide area of useless to masochistic weaponry and armors.Laughably weak man I still remember Pripyats knife hunting... I did not find them weak then DThe Autumn Aurora mod author has recently posted pics of him merging AA with Secret Trails . Im hoping its more than an aesthetic copypaste job not only because any of use could do that but more because the game really does need a good bit of balancing. There might be one such balancing patch hiding away on the GSC threads for the mod ,stalker,chflc1k,3,t5_2r74m
982501,0,t1_chftrpp,Install elsewhere. Probably the same problem that people had with Lost Alpha. Program files folder doesnt allow setting saves and such.,stalker,chfyvgl,2,t5_2r74m
994052,0,t1_chh8msq,Just find some good cover and youre fine,stalker,chha4e8,1,t5_2r74m
1013877,0,t3_24tsgt,I have the same issue but I cant play with dynamic lighting cos my FPS drops too much...,stalker,chjj9nd,1,t5_2r74m
1021677,0,t1_chkbufk,Sorry about that man ill go through the scorcher and reupload the save. Is there anything from your old save file youd like on this one?Here it is,stalker,chkf6lc,1,t5_2r74m
1036718,0,t3_25z2o8,gt P.S. I didnt like Complete for SHoC so I guess Complete for CS is pretty much the same thing .Yeah basically. Complete for CS is nice because it gets rid of the really nasty progressionstopping bugs and pretties the game up a bit but really its still got the same problems as all the other Completes. Thing is there arent very many particularly good alternatives for Clear Sky so youre kind of just settling with CS Complete. I hear good things about Faction War but Ive never tried it.,stalker,chm4oqh,5,t5_2r74m
1038172,0,t1_chm9y7p,Complete mods make the game a lot easier . Which for me is a big deal breaker . Im installing mods to get a more hardcore experience from the game . The thing is  if you have the possibility to teleportfast travel in a game like stalker you are already making it a lot easier .Im playing SHoC with Autumn Aurora  now and I just finished the XX lab and Im about to enter Pripyat . I went back to the bar to get some ammo and what not . I bought around  rounds extra rounds just in case I meet some enemies on my trip BarPripyat entrance . I went out during the night and I met loads of dogs  some militaries and bloodsuckers  . I used almost  rounds and  Army medkits for this trip . With fast travel I wouldnt do that . Also  I dont like the graphics style of Complete . I find it way more bright . This ruins the immersion for me . I mean  you are in the Zone  not in Disney Land .This is what I experienced with SHoC Complete . I didnt finish it but I didnt really like the mod .Im pretty sure someone can give you a better and detailed answer but this is pretty much what I think about Complete mods .,stalker,chmampy,0,t5_2r74m
1067225,0,t1_cho9m1p,Link for the lazy and hopeful?,stalker,chpljef,1,t5_2r74m
1072560,0,t3_26dyab,My first time at the NPP. I was playing LURK . when the blowout timer began. There I was by the blown out APC by the road. I had brought a FAMAS with me which was a foolish move considering I had little experience with it. I brought it thinking I needed a top tier NATO gat. The things iron sights were shit so I was having a hard time fighting all of the Monolith troops.I hit the wall  of the NPP and started booking it. I had about  minute left and thats a really long wall if you guys who made it there remember. I ran under  heavy fire popping the soldiers to the left as I could. I could see the door ahead of me but I was just over weight my stam was going fast. I ended up shooting a soldier with my . and in an act of desperation threw my pistol to lose some weight. I made it inside barely. My heart was racing. That was some intense shit.Im that guy who does those shitty Stalker rap songs OG Stalker and Straight Outta Cordon. I was thinking of mentioning this story in my next track. I think its going to be Naughty by Natures OPP but itll be Ghost Fang and our boy Marked One coming at you with NPP,stalker,chq7d5m,17,t5_2r74m
1216050,0,t3_27z1hc,Wed end up with something like this I think.,stalker,ci6f9xy,3,t5_2r74m
1239734,0,t3_281scm,,stalker,ci9346n,1,t5_2r74m
1252596,0,t1_cia94y6,Okay let me try and answer all your questions. Greben Duty leader over at Lake Yantar will not let me turn in the bandit quest neither by phone nor talking to him. I will test this when I get a chance and finally make my way to Lake Yantar again. Will update you then!. Hash will not let me turn in anything to him.. Im getting the feeling that there could be something wrong with your gamedata dir.... The military is somehow not hostile to me anymore despite how many times I kill them.. This could be story related as you do have to converse with military quite a bit. However this could also be a messed up relation system.. Somehow all of my contacts have changed to military personnel. This could be related to the area that you are currently in? Many bugs have been found in the PDA section. So there is a potential that this has already been fixed. However if I do find this bug. I will report it.. Bloodsuckers just run around and dont attack me.. This is peculiar indeed. Ill keep my eyes peeled for this.. Clicking on the Downloads section of my PDA will Crash to Desktop. sometimes with other buttons as well. Yes well aware of this issue. It looks like it has been sorted out. Ill keep my eyes on the PDA though.. Rats Mice and other small animals have no cooldown between attacks a single rat hits constantly with no chance for escape.. I have never experienced this with the rats or rodents. Okay once again it sounds like something could be messed up in your gamedata dir. Try a reinstall. If this does not fix it then please inform me. Ill investigate this in the mean time.Thanks for your input!,stalker,ciaj6er,4,t5_2r74m
1298786,0,t1_cifnzvg,Ah thank you do you happen to know if I would have to start a new game for it to work or can I install it and keep playing from where I left?,stalker,cifqapq,1,t5_2r74m
1301238,0,t1_cifyt5w,We have to be careful not to get too hyped up as is the case with stuff like this.,stalker,cig082k,5,t5_2r74m
1302088,0,t1_cig1tif,STALKER never went console AFAIK so dont keep your hopes up.,stalker,cig3nvp,3,t5_2r74m
1305540,0,t3_291ahn,Thanks for the update.  I was going to throw in some money but now I want to see how this pans out.,stalker,cighnea,2,t5_2r74m
1305805,0,t3_291ahn,As someone said in the thread you linked to there really is no proof that it is fraudulent. A lot of people are jumping to conclusions. Like how theyre using art that happens to also be on some russian artists site whos to say they didnt ask if they could use it?The kickstarter has a list of all the devs working on it and I seriously doubt a fraudulent company would have the balls to use someone elses names.EDIT Regarding the art from the russian writer the game is BASED ON THE HIS BOOK he himself said that it was okay to use the art. Put away the pitchforks people.,stalker,cigiq0d,0,t5_2r74m
1321237,0,t1_cii973g,Ohhh badass I should!,stalker,cii98er,1,t5_2r74m
1328379,1,t1_cij1w9i,Have fun with that. Ive not seen an actual post by vostok saying its all good. And all Im going by are the facts which is a the Kickstart shows basically nothing. All it shows is old stalker stuff b the domain was registered by some random dude in Vegas and c not only do half the people on the company list not actually exist but half are stock photos and the ones that arent? Have said they arent part of it. Add to that the fact that k is nowhere near enough to make a game like what theyre promising and also that they said once we hit k well hire more artists to make the vegetation better  which is not something that needs either more people for or more money for. Its one of the easiest things to do. The whole thing is shoddy badly put together and in general just sets off all sorts of alarm bells in my head and in others. I really really want another stalker like game. If these guys turn out to be legit I will eat all the hats I own and a few pairs of socks too for good measure. But as it stands I see no evidence supporting them and an awful lot against them. ,stalker,cij260f,0,t5_2r74m
1329223,0,t1_cij5b2n,hmm I tried putting the files of the mod straight into my folder   and I tried putting all the files into a gamedata folder  but both of them did nothing... ,stalker,cij5l81,1,t5_2r74m
1329384,0,t3_2964w8,SO much hate being thrown around. people who are hating on them just need to shutup.. if people are smart they will hold off. some people wont think twice before opening wallets tho.,stalker,cij68om,1,t5_2r74m
1341771,0,t1_cikheme,I just started a Misery run. I thought I was safe up in the cement factory with the Freedom boys. Then as Im about to leave I see a pseudogiant climbing up the stairs towards us.I am not ashamed that I hid behind the other guys and let them take the brunt. Im not even ashamed about looting the giant. I did feel a little bad about looting the Freedom corpses right in front of their buddies though.,stalker,cikkccr,3,t5_2r74m
1348229,0,t3_29igd2,I saw the Hugh Fuller post on here last night.  I was wondering how this would turn out. I also thought that maybe they have commissioned or paid him to use the imagelevel he made.  But there was also the other option of them just grabbing it for their own uses of concept art. Just facepalm,stalker,cilajft,3,t5_2r74m
1355283,0,t1_cim69ql,For GSC there is a reason since he says that its GSC opinion on Areal.And Vostok already reacted when West Games claimed that Vostok were related to Nuclear Union before Survarium.,stalker,cim6bsp,1,t5_2r74m
1356601,0,t3_29md8p,The other idea should be TO FIX THE REDDIT BANNER. ITS MISSING ITS LAST ENDSTOP. ITS BEEN MISSING FOREVER,stalker,cimc9ni,12,t5_2r74m
1384868,0,t3_29w7wg,The feeling that the world around me is alive which is achieved by the dynamic events I see while traveling the zone. Loners fighting bandits faction patrols animal attacks random campfires. Even the remains of conflict maybe findings a dead stalker with a few dead dogs around him. The knowledge that things happen without my causing them. Upgrading and maintaining my weapon felt cool. In game of thrones the weapons of the characters have personalities they have names and histories. There is something special in stalker about finding a sweet gun repairing it upgrading it getting attachments and getting to know it. I think a good stalker table top would have a weapon maintenance and upgrade system. Chilling out by the fire with stalkers waiting for the night to pass. Very atmospheric. If you could brainstorm personalities of loners the players could meet and interact with it would add to the immersion. ,stalker,cipvjnm,2,t5_2r74m
1457812,0,t1_ciyz1zx,gt GSC has already infuriated me to the point of throwing things like a child.And talking like one and acting like one.... Bahahaha!,stalker,ciz0fvm,1,t5_2r74m
1462991,0,t1_cip856q,i need to try this gotta get all dem good endings!,stalker,ciznu14,1,t5_2r74m
1490984,0,t1_cj35thw,Looks good.  Thirdperson camera makes for some nice screenshots since it removes HUD.  Go to user.ltx in your STALKER directory and typegt bind cam kFgt bind cam kFgt bind cam kFgt bind camzoomin kADDgt bind camzoomout kSUBTRACTif youd like.,stalker,cj364e6,2,t5_2r74m
1643526,0,t3_2d5q8i,Share on the sweetfx database! sweetfx is a godsend in our modern age of blurry and instagram filter games.,stalker,cjmbwut,1,t5_2r74m
1648476,0,t3_2d7szr,Im not quite sure if youre only talking about DutyFreedom or every faction in the game.Concerning DutyFreedom the choice is about your idea of what the Zone is. If the Zone is a threat that can only be eliminated by disciplined and motivated soldiers then Duty is for you  btw they have a use for artifacts they systematicaly hand them over to ecologists for research purposes .If on the other hand you believe that the Zone is a gift to mankind and an unique opportunity for technological progress and that it should be accessible to all who seek their fortune then Freedom is where you belong.When it comes to the attitude fo the factions its more of a personal choice. I find Freedom to be annoying hippies Freedom think Duty are butthurts fascists...That being said if you know the story of the Zone  How it was created and what it truly is  turns out that Duty is right about the Zone being a danger. Thats what motivated my choice. Freedom sure are nicer to hang out with and constant discipline can be exhausting....but theyre just wrong. Duty may not be pleasant to deal with but they are doing the right thing.,stalker,cjmych3,6,t5_2r74m
1705343,0,t3_2dwrsn,The XRay Game Asset Converter will unpack the gamedata archives that contain the sound files ,stalker,cju4cmw,1,t5_2r74m
1726362,0,t3_2e75bo,Oh that scientist.,stalker,cjwrtni,9,t5_2r74m
1793571,0,t3_2f25pw,I just downloaded Arsenal Overhaul . Ive heard its pretty good. Its basically a weapon overhaul but also comes with Atmosfear Absolute Nature . Not sure if it makes any gameplay changes or balances anything. Theres always Misery as well. I really like Misery even as a Stalker noob.,stalker,ck589pl,2,t5_2r74m
1795711,0,t1_ck5goc3,Exactly you get the drift of the two mods. Misery changes too much for it to feel like a real COP experience but some people like the ballkicking difficulty and the added survival.AO is foremost a visual and gun mod although Misery also adds a whole bunch of new guns but also a lot of other thingse.g classes.So my pick would be AO if I hadnt played COP for a while and wanted another stab at it with a bit of a different feeling. Misery is more suited for those that has played through the game a couple of times in the last months.,stalker,ck5hy81,2,t5_2r74m
1812439,0,t1_ck7jg8m,Did it work? my solution from the above,stalker,ck7ks35,2,t5_2r74m
1814589,0,t1_ck7twz8,I know music can be disabled from the menu I generally play with music because it adds up to the game but this time it was detracting. There were several other things that I wanted to change before doing a NS playthrough cant remember them now but I will definetely go at least once through it. StalkerSoup is a big nono I heard way too many bad things about the balance to even bother.Photographer is another mod that Ive been considering for a while but like may other awesome russian mods I just dont know if its translated entirely and reasonably. I stopped playing Lost Alpha when some guy in Rostock called me a noob so Im guessing I wouldnt enjoy a google translation.On SGM it sounds like I made a bad choice when choosing the branch to play but its probably out of the question for me theres not enough sense of dangerprogression...I was wondering how did I miss Winter of Death and then I realized that its another translated mod. I need to actually start looking into them most of them probably have more than decent translations by now.,stalker,ck7u8bn,2,t5_2r74m
1855497,0,t3_2ftwvz,Stop waving that gun you got my attention!We might have a conversation if you hide that weapon.,stalker,ckcs6e8,8,t5_2r74m
1899987,0,t1_ckhckr7,Cool Ill keep this in mind though Ive got  other old and new games waiting on pc and Xbox...,stalker,cki4yvf,1,t5_2r74m
1902357,0,t1_ckiafxp,Ive seen a bandit in a cloth jacket take  shots from an AKu and survive. You will on average see many enemies flinch from bullets and do their damage animations but will seem like they do this three or four times before dying making it feel very artificialuncanny.The complete mod will try to make guns less scaled and more like actual guns no artificial weakness early on. Bullet sponge is slightly better but still around the same ballpark. There is an optional addon to increase lethality of bulletsgun damage to mitigate this if you want gunplay closer to a Metro kind of game.,stalker,ckif895,0,t5_2r74m
1985643,0,t3_2hgbw7,uazlef check my reply to uThGlitch for a potential solution. Also your sickness may be exacerbated because of the games somewhat low FOV. You can get an FOV modifer to increase the games FOV. Check out google for a download ,stalker,cksgy0n,2,t5_2r74m
1997073,0,t3_2f24ct, This was made a while back,stalker,cktuiln,1,t5_2r74m
2038405,0,t3_2i3tj0,Have you heard of planting trees via shotgunWell kruglov figured out a way to create an entire ecosystem via rpg bombardment in under  minutes.....the man is a genius!,stalker,ckyxddq,12,t5_2r74m
2040128,0,t1_ckz550r,Ohh okay. That sounds interesting though honestly wouldnt it be cheaper to just shoot sand filtered through a strainer?,stalker,ckz58y3,1,t5_2r74m
2050317,0,t3_2iat3q,I dont think its as creepy. Theres really only one lab to delve into. CoP makes for a much better and nonlinear adventure though. Theres way more of the game that one can access right from the getgo and it requires you to pay attention to your environment. Theres also more options regarding interaction with other Stalkers and customization of gear.Misery was mentioned and Ill call that mod intense instead of just creepy even lowlevel mutants can rip you apart if youre not careful and the economy is very demanding.Theyre just different games with slightly different approaches.,stalker,cl0fvcp,13,t5_2r74m
2131927,0,t3_2ja7qb,deleted,stalker,clatcd4,1,t5_2r74m
2172452,0,t3_2jwys6,Do you have sun detailsgrass shadows enabled? Its a very intensive setting afaik. Also worth a try is setting your games processor affinity to cores  and  to make the multithreading work better.,stalker,clfyxyo,3,t5_2r74m
2181357,0,t1_clh3krp,I vividly remember my first poltergeist encounter. When I was in the labs I noticed all the crates and shit were floating and I though that this was just some cheeki shit. But then a fucking crate smacked me right in the face and I just frantically paused the game trying to catch my breath. The rookie experience in STALKER is simply the best cause the unexpected manifests itself well in this universe.,stalker,clh3qdb,6,t5_2r74m
2220835,0,t1_clm42oi,Hay spoilers for OP. Get a critical NPC mod or something then,stalker,clm4dqn,2,t5_2r74m
2224408,0,t1_clkavcr,Yeah! Sorry about the delayed reply but OP delivers!Here you go.Might throw them up as a new post too. Though the guy did ask me not to spread them around too much since this is lessthanlegal.,stalker,clmkqpb,4,t5_2r74m
2228173,0,t1_clmpvp5,Why is it using DivX??,stalker,cln1y8f,1,t5_2r74m
