,controversiality,parent_id,body,subreddit,id,score,subreddit_id
7384763,0,t3_43dl6z,so you like bbw and ddlg im with you on those  also have a foot fetish huge bonus if they are a big girl cause fat feet i like anal giving and receiving and public sex acts,fetishes,d2hlih5,1,t5_2rbky
9020744,0,t3_51fqrs,PM me I have so much leather clothing and can make a photoset for you if youre interested!,fetishes,d7w5hjh,1,t5_2rbky
10125655,0,t3_572gjq,Sounds like you just need to come over to mine. ,fetishes,dbrdntm,1,t5_2rbky
10888416,0,t3_57ejwq,deleted,fetishes,de329jb,1,t5_2rbky
11097627,0,t3_5q73dl,removed,fetishes,depwn1d,1,t5_2rbky
11358342,0,t1_dfjg1mf,uh oh really? lol is it that weird?,fetishes,dfjg3y6,1,t5_2rbky
