,controversiality,parent_id,body,subreddit,id,score,subreddit_id
7944022,0,t3_4ntyan,Love her thickness,CelebrityJOMaterial,d48zddc,1,t5_3eod8
7951984,0,t3_4o56tg,deleted,CelebrityJOMaterial,d49vmtl,1,t5_3eod8
7955820,0,t1_d4a0hgd,I cant tell if your serious or not,CelebrityJOMaterial,d4ab4qq,1,t5_3eod8
7988486,0,t3_4omgz4,damn she really has. then again she was always hot. and if she ever needs her pussy pumped full of cum my dicks open for her to sit on ,CelebrityJOMaterial,d4dzdbx,4,t5_3eod8
8011555,0,t3_4owyqo,Amazing boobs and DSLs,CelebrityJOMaterial,d4gkngv,5,t5_3eod8
8073519,0,t3_4pss6j,That bikini pix made me jerk  straight days back then. She got great titsass and you just know she is great at giving headswallowing cum and taking cock in the ass.Enjoy this wankable Rita pix as well,CelebrityJOMaterial,d4njfnu,3,t5_3eod8
8090318,0,t1_d4pfavr,Same here and shes so hot and seems fairly kinky too.,CelebrityJOMaterial,d4pfbyr,2,t5_3eod8
8092700,0,t3_4q1hto,too bad greyworm cant do this,CelebrityJOMaterial,d4poxxc,3,t5_3eod8
8098602,0,t3_4q5kwf,Wish shed just do porn already!,CelebrityJOMaterial,d4qctgo,1,t5_3eod8
8099847,0,t3_4q3jat,removed,CelebrityJOMaterial,d4qhuuh,1,t5_3eod8
8126387,0,t1_d4tgjkj,deleted,CelebrityJOMaterial,d4th9qd,3,t5_3eod8
8132566,0,t1_d4u64m8,Well ideally one in my mouth and one in my hands ,CelebrityJOMaterial,d4u69gw,1,t5_3eod8
8147602,0,t1_d4vuls2,all she needs now is to be squatting on the shaft while bathed in babyoil... so it makes that tight little frame look stunning as she rides the meat.,CelebrityJOMaterial,d4vzwte,2,t5_3eod8
8147904,0,t3_4qufjr,I know Dodie. Not personally. Shes a smallish YouTuber. I did NOT know about these pics. Hottie!!!,CelebrityJOMaterial,d4w19tl,2,t5_3eod8
8157283,0,t3_4qtowk,A,CelebrityJOMaterial,d4x7ij3,1,t5_3eod8
8177360,0,t3_4r9kt1,Imagine getting sucked off by her!,CelebrityJOMaterial,d4zpx7o,6,t5_3eod8
8202122,0,t3_4rojch,My three favourite celebrities are Ariana Grande Nicki Minaj and Kim Kardashian so my answer would be them.,CelebrityJOMaterial,d52thuq,3,t5_3eod8
8211220,0,t3_4rt6ep,She looks amazing painted in your cum,CelebrityJOMaterial,d53yhb3,2,t5_3eod8
8213689,0,t3_4rthl0,Would really like to use Ariana Grandes adorable face. ,CelebrityJOMaterial,d549klu,9,t5_3eod8
8232510,0,t3_4s5b23,Im loving this post because Ive never got off to any of them so I might use this to get myself into them all,CelebrityJOMaterial,d56mbjj,1,t5_3eod8
8258655,0,t3_4sk0lx,Christina Hendricks trying on different outfits and clothes.Taylor Swift blowing her boyfriend of the day.Eva Green spreading her legs and rubbing her clit.,CelebrityJOMaterial,d59w0kh,6,t5_3eod8
8266099,0,t3_4sltu6,yup,CelebrityJOMaterial,d5atj1w,2,t5_3eod8
8286269,0,t3_4swsja,This is insanely hot,CelebrityJOMaterial,d5dcc2j,2,t5_3eod8
8287646,0,t1_d5cvyeu,Addison...some of the best tits in TV! She got so many loads from me.,CelebrityJOMaterial,d5dijex,3,t5_3eod8
8294786,0,t3_4t1jhd,Camila doggy all night long,CelebrityJOMaterial,d5eeo08,2,t5_3eod8
8299918,0,t1_d5e8cw4,I misread your comment as blow chunks on her legs as in vomit and thought thats a weird fetish Now Ive read it properly I agree. Theres something very erotic about cumming on a girls thighs and then rubbing it in. Which is also perhaps a weird fetish but not as weird as leg puking.,CelebrityJOMaterial,d5f1q4r,1,t5_3eod8
8314023,0,t3_4tcd1t,What i wouldnt give to fuck her ass balls deep!,CelebrityJOMaterial,d5gt59j,3,t5_3eod8
8387557,0,t3_4udtcd,Natalies face and Alexandras tits.,CelebrityJOMaterial,d5pzqer,6,t5_3eod8
8437045,0,t1_d5vmblb,LOL ... Jack off to it the few times then watch it again to take notes. ,CelebrityJOMaterial,d5w64vb,1,t5_3eod8
8454688,0,t3_4ve7ng,,CelebrityJOMaterial,d5yddjc,3,t5_3eod8
8466606,0,t1_d5za5xp,I swear I put tailor. I guess it auto corrected for some reason. My bad.,CelebrityJOMaterial,d5zv3wz,1,t5_3eod8
8481675,0,t3_4vte0b,Oh god her legs look wonderful ,CelebrityJOMaterial,d61r4w7,3,t5_3eod8
8506498,0,t3_4w75rb,Face Ashley BensonTits Julianne HoughAss Sara Jean UnderwoodLegs Eva GreenActually is really good.,CelebrityJOMaterial,d64v8i3,2,t5_3eod8
8518763,0,t3_4wbaz4,Eating out her pussy Kendall Jenner Tonguing her asshole Ivana Baquero Getting a blowjob Emilia Clarke Getting a handjob Cara Delevigne Getting a facesitting Nicki MinajSuck her tits and tit fuck Eva GreenFuck her pussy raw Sophie Turner Fuck her ass raw Beyonc Facial Taylor Swift ,CelebrityJOMaterial,d66emm8,1,t5_3eod8
8548685,0,t3_4wt8we,ooo fuck this looks amazing,CelebrityJOMaterial,d6a5ojz,2,t5_3eod8
8562104,0,t3_4x2g3y,UNDERRATED???? Quick! Notify the rating board!I am a bot and this action was performed automatically. Please contact the moderators of this subredditmessagecompose?torCelebrityJOMaterial if you have any questions or concerns.,CelebrityJOMaterial,d6bu9og,1,t5_3eod8
8626486,0,t3_4xzju3,fuckin nice!,CelebrityJOMaterial,d6jwx12,2,t5_3eod8
8645010,0,t3_4y9i69,Id love to be her fuck toy,CelebrityJOMaterial,d6m8k4g,7,t5_3eod8
8662839,0,t3_4yisvb,Shay is a pure goddess. ,CelebrityJOMaterial,d6oh0zv,3,t5_3eod8
8691408,0,t3_4yzzt8,Kristens got her shoes off so I would probably be worshipping them,CelebrityJOMaterial,d6s1z4r,5,t5_3eod8
8715228,0,t3_4zdc12,I love her lt,CelebrityJOMaterial,d6v1ie0,2,t5_3eod8
8761389,0,t3_4xz1cj,Most likely to take it up the ass.,CelebrityJOMaterial,d70u25d,1,t5_3eod8
8761540,0,t1_d70hx6b,Amazing outfit ,CelebrityJOMaterial,d70uqoq,2,t5_3eod8
8773950,0,t3_50acjh,Album,CelebrityJOMaterial,d72es89,1,t5_3eod8
8779192,0,t3_50caet,What is this from?? I need to know...,CelebrityJOMaterial,d732hjg,1,t5_3eod8
8798156,0,t3_50n84k,deleted,CelebrityJOMaterial,d75f2cv,1,t5_3eod8
8831598,0,t3_514zwa,If anyone wants to chat about her PM me. ,CelebrityJOMaterial,d79fnhe,3,t5_3eod8
8857437,0,t1_d7c9b8c,that sounds pretty much exactly like Id expect,CelebrityJOMaterial,d7cjer4,2,t5_3eod8
8871229,0,t3_51qvzp,I bet shes had several already,CelebrityJOMaterial,d7e73c9,11,t5_3eod8
8872542,0,t3_51qvzp,um... anyone with a cock,CelebrityJOMaterial,d7ecrsy,6,t5_3eod8
8877459,0,t1_d7es7d4,Fuck this got me so hard. Emily is in my top ,CelebrityJOMaterial,d7ey1s6,2,t5_3eod8
8879787,0,t3_51qty5,deleted,CelebrityJOMaterial,d7f84k1,1,t5_3eod8
8904747,0,t1_d7i7usk,Because you post more than anyone in this sub and its the same ass worshipping shit over and over again with laughable titles. Its fucking annoying.,CelebrityJOMaterial,d7i7zun,-14,t5_3eod8
8909958,0,t1_d7ihrus,that is correct. ,CelebrityJOMaterial,d7iui9j,1,t5_3eod8
8920957,0,t3_52gt4m,deleted,CelebrityJOMaterial,d7k62o5,1,t5_3eod8
8932512,0,t1_d7ljuw0,Of course who hasnt?,CelebrityJOMaterial,d7lk0x7,1,t5_3eod8
8935202,0,t1_d7lvipt,Plastic doesnt go down easy at all.,CelebrityJOMaterial,d7lvnso,1,t5_3eod8
8938180,0,t3_52mm3a, votes in  day! Taylor Swift with a slight edge so far over Alison Brie. Keep voting. I believe you can vote daily so if you voted yesterday feel free to vote again!,CelebrityJOMaterial,d7m8js5,1,t5_3eod8
8944559,0,t1_d7mzq0i,love your dedication to the need to pump.  an older forum i used to go to for many many many... ya... had a lot of them but searching for in my place didnt bring up a whole fuck lot.  searching again w esquire place  did it.  i got  results of threads.   let me see if i can link you a few,CelebrityJOMaterial,d7n05s8,2,t5_3eod8
8961794,0,t3_53058x,Would love those tits in my face while she rides me!,CelebrityJOMaterial,d7p2msv,2,t5_3eod8
8970088,0,t1_d7q2fo3,deleted,CelebrityJOMaterial,d7q2h5n,1,t5_3eod8
9016609,0,t3_53k1vi,Actually Ariel needs to get gangbanged.,CelebrityJOMaterial,d7vnmo4,1,t5_3eod8
9029107,0,t1_d7wdji4,Nah not my thing!,CelebrityJOMaterial,d7x5n3p,1,t5_3eod8
9072488,0,t1_d815cug,Shes got perfect cocksucking lips and great tits even if theyre not that big. Not that I mind. I kinda like small tits.,CelebrityJOMaterial,d82d6ir,2,t5_3eod8
9076318,0,t3_54l4zz,beautiful teen titties!,CelebrityJOMaterial,d82tr4k,5,t5_3eod8
9079533,0,t1_d837k41,I like her eyes. Looks like she is freak in bed. U know  the type who would love analfacials cum swallowing etc...,CelebrityJOMaterial,d837noz,2,t5_3eod8
9084506,0,t1_d83rg8b,Use her pussy and fill her with your cum while she begs for more,CelebrityJOMaterial,d83t5rk,8,t5_3eod8
9114891,0,t3_553b2r,hard to focus over that amazing firm butt of hers... but the package behind her says bootea... i think she used that as reference to her amazing ass.  slobber love,CelebrityJOMaterial,d87gnxg,2,t5_3eod8
