,controversiality,parent_id,body,subreddit,id,score,subreddit_id
3725434,0,t3_32ife8,Thats hot!,MalesMasturbating,cqgxb3t,2,t5_31itx
3831304,0,t3_348i5e,Nope. But trying is the fun part ,MalesMasturbating,cqt026k,3,t5_31itx
4492799,0,t3_3cmp2p,  if you want to see more of me you can go on my subreddit rgbuttn,MalesMasturbating,cswz6jv,1,t5_31itx
5184759,0,t3_3aofbb,is this what you did in the bunk bed we shared ,MalesMasturbating,cvayck5,1,t5_31itx
7003663,0,t3_4a8z6k,Great video. Come over to rforeskin and share there too. ,MalesMasturbating,d1a7kdv,1,t5_31itx
7581837,0,t1_d2wcz8v,Thank you Im glad you enjoyed yourself!,MalesMasturbating,d340ndw,1,t5_31itx
7615442,0,t1_d37td7p,Like that?,MalesMasturbating,d37u3vi,2,t5_31itx
7997154,0,t3_4oqk4d,Or my face when you slide it in me,MalesMasturbating,d4eyftw,2,t5_31itx
8065955,0,t3_4plq4g,beautiful ass man!,MalesMasturbating,d4mou5s,2,t5_31itx
8184740,0,t1_d50mtn5,Thank you!,MalesMasturbating,d50n5tt,1,t5_31itx
8392819,0,t3_4ul0d0,Best thing Ive seen all day.,MalesMasturbating,d5qne92,2,t5_31itx
8895294,0,t3_520n4e,Mmmmm definitely....want to jack off watching you,MalesMasturbating,d7h35ik,1,t5_31itx
9006987,0,t1_d7uhmu2,agreed ,MalesMasturbating,d7uhyto,1,t5_31itx
9365785,0,t3_58ost9,Great physique!  I love the way you hold your chest when you get closer.,MalesMasturbating,d936i5l,2,t5_31itx
9772054,0,t1_dahltnu,Well thats very nice of you to say...,MalesMasturbating,dahmej8,2,t5_31itx
9805259,0,t3_5fo0vt,GIFV linkI am a bot. FAQ  code,MalesMasturbating,dalpj7z,1,t5_31itx
10038235,0,t3_5jgp2o,GIFV linkI am a bot. FAQ  code,MalesMasturbating,dbg0b6b,1,t5_31itx
10095449,0,t3_5kc7mh,Yes I would ,MalesMasturbating,dbnga87,1,t5_31itx
10300424,0,t3_5ne1jb,So much cum I couldve swallowed... Beautiful cock,MalesMasturbating,dcblxe4,1,t5_31itx
10573694,0,t1_dd59kfa,How about you hold my head still and hump that beautiful dick into my mouth!,MalesMasturbating,dd6ldwy,2,t5_31itx
10816409,0,t3_5ujyha,impressive,MalesMasturbating,ddvmx0j,2,t5_31itx
10896273,0,t3_5vl0wd,Feel free to pm if you have requests or anything else ,MalesMasturbating,de3vg8c,1,t5_31itx
