,controversiality,parent_id,body,subreddit,id,score,subreddit_id
639,0,t1_ceeibr8,I close my eyes and continue to sway my hips in a circle slowly lifting my shirt up,HogwartsRP,ceeif4y,1,t5_2ygix
769,0,t1_ceehwr3,nods laughing. Very! keeps dancing,HogwartsRP,ceeiy8e,1,t5_2ygix
3862,0,t1_ceevf1n,My face falls slightly. Oh. He never seemed that nasty when I spoke to him. I smile brightly At least it can get better though.,HogwartsRP,ceevlbl,1,t5_2ygix
5913,0,t1_cef3vam,OOC Im always either really late or really early p,HogwartsRP,cef3yxg,1,t5_2ygix
11638,0,t1_cefr8vd,Still whispering. Since Richard proposed I havent been the slightest bit tempted. I let go of you laughing.,HogwartsRP,cefrcs6,1,t5_2ygix
12149,0,t1_ceft84j,I poutWhy are you doing this?,HogwartsRP,ceftg2z,1,t5_2ygix
12398,0,t1_cefu6ir,I shudder at your touch pulling away only long enough to kiss your neck.,HogwartsRP,cefugro,1,t5_2ygix
16409,0,t1_cegacs3,Oh. I blush slightly. Sorry ...,HogwartsRP,cegavts,1,t5_2ygix
19665,0,t3_1uci73,Hello there! Welcome back.OOC Yes this is me Rom Archie Quintus Danny Erue... Maybe more. XD,HogwartsRP,cego751,1,t5_2ygix
26670,0,t1_cehgpnr,blinks and continues.OOC Oh good. ,HogwartsRP,cehgvuz,1,t5_2ygix
28355,0,t1_cehnikl,laughs what can I say? I call it like I see it you know that. smiles And youre perfect in every possible aspect of the word. ,HogwartsRP,cehnsf6,1,t5_2ygix
30668,0,t1_cehx7fo,Whwhat hhhappened?,HogwartsRP,cehx97q,1,t5_2ygix
33447,0,t1_cei8ku5,Its mine to share aswell.,HogwartsRP,cei8mo8,1,t5_2ygix
34439,0,t1_ceicnu6,My reading voice becomes softer when I notice this but no less enthusiastic. More than anything Im trying to lull you to sleep.,HogwartsRP,ceicp06,1,t5_2ygix
35818,0,t1_ceii80p,She giggles and takes an apple of her own putting a face on it first. She turns the apple to you with a huge smile and then takes a huge bite.,HogwartsRP,ceiicps,1,t5_2ygix
37316,0,t1_ceiof2i,It will be. What do you want to do?,HogwartsRP,ceioheq,1,t5_2ygix
46454,0,t3_1ulw78,In tiny tiny writing The Arctic was named to mean the bear and the Antarctic to mean opposite the bear by the Ancient Greeks because of the Great Bear constellation appearing above the North Pole.,HogwartsRP,cejpwsq,1,t5_2ygix
47580,0,t1_cejue0i,I shrug Anyone gets hurt majorly by your doing Mr. King and Ravenclaw house is to blame.,HogwartsRP,cejuik3,1,t5_2ygix
49362,0,t1_cek1iwa,OOCBecause Im trying to figure out how to land without muggles seeing him xD oh to hell withIC as theyre nearing london he pulls out his wand and casts disillutionment charm on you the broom and himself,HogwartsRP,cek1t6z,1,t5_2ygix
50082,0,t1_cek4q62,takes it thank you.,HogwartsRP,cek4rk7,1,t5_2ygix
51631,0,t1_cekb2zm,Well i am older and given my training...,HogwartsRP,cekb49j,1,t5_2ygix
52148,0,t1_cekd6ts,makes face,HogwartsRP,cekd8ev,1,t5_2ygix
59078,0,t1_cel5gd4,I kiss you back wrapping my arms around your waist and pulling you closer to me.,HogwartsRP,cel5nk9,1,t5_2ygix
62681,0,t1_celk5vl,The misunderstanding. I just...since the whole London fight thing Ive been worried about you all to the point of paranoia. ,HogwartsRP,celkdy2,1,t5_2ygix
71290,0,t1_cemjkwx,Same with you. I nudge you.,HogwartsRP,cemjn3k,1,t5_2ygix
71775,0,t1_cemlhjq,I didnt mean it that way Im sorry that you thought I meant it that way.,HogwartsRP,cemlmne,1,t5_2ygix
71787,0,t1_cemllmt,OOC And Ryans going to be a Ravenclaw and work through it logicly. On another note why is thunder pissed?,HogwartsRP,cemloev,1,t5_2ygix
75054,0,t1_cemz1es,I nodI can understand that. Dont want to use it all the time. ,HogwartsRP,cemz2ku,1,t5_2ygix
76254,0,t1_cen3xy2,I pounce next to you laying my head on your shoulder.,HogwartsRP,cen3z30,1,t5_2ygix
77842,0,t1_cen9w7h,I smirkHow was that?OOC Heh P,HogwartsRP,cenahiu,1,t5_2ygix
78405,0,t1_cencooj,blinks. The game? Oh you mean the quidditch match?,HogwartsRP,cencsl8,1,t5_2ygix
79189,0,t1_cenftci,he says softly Thunder...,HogwartsRP,ceng08b,1,t5_2ygix
83729,0,t1_cenyd56,Fine! I walk in the right direction until Im out of sight.,HogwartsRP,cenym56,1,t5_2ygix
86654,0,t1_ceo149a,I smile back Im sure youre brilliant at helping.,HogwartsRP,ceoam7k,1,t5_2ygix
89538,0,t1_ceomduh,I do my best to catch you.,HogwartsRP,ceomfi4,1,t5_2ygix
90084,0,t1_ceoojjo,What are friends for?,HogwartsRP,ceooo0k,1,t5_2ygix
90223,0,t1_ceop2h5,Good we are too young for that.ooc no bad. get away from that,HogwartsRP,ceop8k1,1,t5_2ygix
94373,0,t1_cep68xq,Seriously.,HogwartsRP,cep6aie,1,t5_2ygix
96540,0,t1_cepeyh5,I nodLet me go pack. Ill be right back ok?I kiss you quickly and run off,HogwartsRP,cepf5t5,1,t5_2ygix
99509,0,t1_cepr6fm,Bbut it iis a tthing sso its aall gggood!,HogwartsRP,ceprclk,1,t5_2ygix
100917,0,t1_cepwugt,Oh... Yeah that was kinda obvious... ,HogwartsRP,cepx519,1,t5_2ygix
107633,0,t1_cepw2kt,I laugh slightly So.. remember when you said if I was up to something before? I smirk slightly,HogwartsRP,ceqop2j,1,t5_2ygix
109556,0,t1_ceqwkpu,Still.. laughs ,HogwartsRP,ceqwlny,1,t5_2ygix
110026,0,t1_ceqyfut,laughs lightly Okay. Ah.. what else.. a dog? rat? lizard? crocodile? dinosaur?,HogwartsRP,ceqyjdl,1,t5_2ygix
116232,0,t1_cernzf6,Oh noes now everyone will know you have been pranked,HogwartsRP,cernzzu,1,t5_2ygix
125565,0,t1_cesq1k0,You want to head to Hogsmead.,HogwartsRP,cesqaok,1,t5_2ygix
125596,0,t1_cespynl,laughs softly. You shoved a crazy man. Expect revenge!,HogwartsRP,cesqf92,1,t5_2ygix
127989,0,t1_cet06y2,I shake my head. No. I shiver again. Okay maybe a little ...,HogwartsRP,cet08ix,1,t5_2ygix
129099,0,t1_cet4q3y,OOC Oh. I think it wouldnt sort on your mood though.,HogwartsRP,cet4sta,2,t5_2ygix
129478,0,t1_ceszh2q,The Snitch appears into view near one of the spectator towers,HogwartsRP,cet6ct4,2,t5_2ygix
131858,0,t1_cetg3x1,I giggle. Then why dont you do something?,HogwartsRP,cetg4od,1,t5_2ygix
132958,0,t1_cetkmhb,Well..Bad example then cookie dough is edibule but bread dough is not.,HogwartsRP,cetkns4,1,t5_2ygix
133043,0,t1_cetkyi2,Its beautiful.,HogwartsRP,cetl0ax,1,t5_2ygix
133946,0,t1_cetomqd,I shake my head.,HogwartsRP,cetopkb,1,t5_2ygix
134595,0,t1_cetr91f,Hazel is a sixth year? I thought she was so small because she was about ?So why is it so complicated?OOC He likes Hazel?,HogwartsRP,cetrddx,1,t5_2ygix
135583,0,t1_cetvcih,Im in Ravenclaw as well. Prefect. smiles And believe it or not you three Alexs are in Ravenclaw.,HogwartsRP,cetvfj3,1,t5_2ygix
140409,0,t1_ceuf6yt,You were a good person. You are a good person.,HogwartsRP,ceuf7xx,1,t5_2ygix
141020,0,t1_ceuhmm5,I am. just trying not to say much as to not make things awkward again,HogwartsRP,ceuhq83,1,t5_2ygix
144534,0,t1_ceukwep,Isnt that stealing?,HogwartsRP,ceuw67g,1,t5_2ygix
147802,0,t1_cev9k1c,that is no good grins you are getting too tame,HogwartsRP,cev9km7,1,t5_2ygix
148859,0,t3_1oj15a,deleted,HogwartsRP,cevdwfg,1,t5_2ygix
151258,0,t1_cevnplf,She shakes her head I dont just like what I see I like what I know. I really do. I dont know how I can prove that to you...but I hope I can someday. ,HogwartsRP,cevnr4s,1,t5_2ygix
152420,0,t1_cevshqo,yeah,HogwartsRP,cevsixi,1,t5_2ygix
154575,0,t1_cew10am,looks at you youre quite shy arent you? You shouldnt be. Youre really cool Hazel,HogwartsRP,cew1d1p,1,t5_2ygix
154812,0,t3_1vugcx,Eeeverything... I mumble sadly.,HogwartsRP,cew2c40,1,t5_2ygix
155661,0,t1_cew5dff,Not much IS fair Dearie.,HogwartsRP,cew5tfe,1,t5_2ygix
157050,0,t1_cewb9gk,OOC if Liam turned up now Id be like Whaaaat?,HogwartsRP,cewbio3,1,t5_2ygix
163092,0,t1_cewzqfe,Slightky more distant. th.,HogwartsRP,cex0bnw,1,t5_2ygix
167834,0,t1_cex7ut9,Sure. So what do you and your boyfriend even do then?,HogwartsRP,cexjso4,1,t5_2ygix
170254,0,t1_cextleq,I er looks around nervously I should go say hello to more people. See ya walks off,HogwartsRP,cextpeo,1,t5_2ygix
173773,0,t1_cey8452,my expression falls. Oh god...dude...Im so sorry...,HogwartsRP,cey84vb,2,t5_2ygix
174025,0,t1_cey8yrh,I stretch for the Snitch and nearly fall off my broom doing soOOC Whos going to catch the Snitch lol,HogwartsRP,cey969u,1,t5_2ygix
174352,0,t3_1ps9c0,Allen Banner Gryffindor,HogwartsRP,ceyairf,1,t5_2ygix
174686,0,t1_ceybohr,OOC Alrighty. Sounds good. IC As Doctor Brown disapparates she walks out from the potion room holding a small leather bag of vials.Here. As Doctor suggests you have to drink these twice a day. Never forget okay? And you better come here from time to time to be checked.She holds out to you the bag of draught.,HogwartsRP,ceybwee,2,t5_2ygix
176992,0,t1_ceyld80,Smiles Hows your memory?,HogwartsRP,ceyldwt,1,t5_2ygix
181807,0,t1_cez4tzi,Ill miss you Ruby. And youre...cat.OOC Im up at  AM trying to finish a  word chapter of a fanfiction that nobody read. Im with you. ,HogwartsRP,cez57qo,1,t5_2ygix
189158,0,t1_cezzewh,She smiles and gets herself a cup tea.You want?,HogwartsRP,cezzgmx,1,t5_2ygix
196944,0,t1_cf0vgc5,I dunno. If he is muggleborn he would,HogwartsRP,cf0vh4u,1,t5_2ygix
197959,0,t1_cf0zlun,OOC laughs No one will figure it out.,HogwartsRP,cf0zn50,1,t5_2ygix
199207,0,t1_cf13a3t,Well i try to stay rational about my fears,HogwartsRP,cf14rda,2,t5_2ygix
199292,0,t1_cf14y33,Smiles Im so glad were friends,HogwartsRP,cf153wb,1,t5_2ygix
199694,0,t1_cf16ohs,I wave my hand dismissivly. Not a big deal I just crashed with a weird hippy commune for a few weeks.,HogwartsRP,cf16r5w,1,t5_2ygix
200740,0,t1_cf191sq,Being born with an intense hatred of the light and all things good like a Morlock? Morlocks hate Crocodile Dundee Ill bet.,HogwartsRP,cf1b1rb,1,t5_2ygix
200798,0,t1_cf1b74t,laughs awkwardly and shakes her head i uhh yeah. Sorry. Word vomit. Ooc ohhhh i get it now haha. Its cool! ,HogwartsRP,cf1badd,1,t5_2ygix
200901,0,t1_cf0z5uu,laughs Its fine. ,HogwartsRP,cf1bpmi,2,t5_2ygix
201639,0,t1_cf1ek4y,OOC Hehe D,HogwartsRP,cf1er1e,1,t5_2ygix
202394,0,t1_cf1gqbe,She strides in fairly delicately with a large rolled up piece of paper in her hand I have a request or more likely an idea. Ive gotten some interest from fellow students about a type of swimming club or possible social gathering at the lake. She looks out the window then back to the professor However obviously I wouldnt wish to trounce about the grounds and seeing as its the dead of winter Id need to use some magic and a tent to make it a fun occasion. But as you are the grounds keeper I wished to have you blessing on the idea first.She nodded and held her oversized parchment intently.,HogwartsRP,cf1huzw,1,t5_2ygix
205113,0,t1_cf1t0of,I nod.,HogwartsRP,cf1t12e,1,t5_2ygix
205219,0,t1_cf1tcdh,Is there any way I can make you feel better?,HogwartsRP,cf1tgol,1,t5_2ygix
209131,0,t1_cf29dza,i grin and take a hold of my wand and cast a dissilusionment charm on myself then come sit next to you,HogwartsRP,cf29hzm,1,t5_2ygix
209183,0,t1_cf29li2,Well it depends on what we study,HogwartsRP,cf29ppc,1,t5_2ygix
209290,0,t1_cf2a2wi,I produce a bottle of alcohol. Want to be less bored?,HogwartsRP,cf2a5kd,1,t5_2ygix
209547,0,t1_cf2b35n,Accio Clothes,HogwartsRP,cf2b7nu,2,t5_2ygix
209628,0,t1_cf261kw,i believe that she was caught  different times in  different disguises,HogwartsRP,cf2bjoq,1,t5_2ygix
214982,0,t1_cf2eia5,I nod curtly. Good work Mister Quinn.,HogwartsRP,cf2xiw9,1,t5_2ygix
226059,0,t1_cf46c2w,As Fed up as locking them in a room with a knife in the center next to a note that says The last one alive gets out the lights go out for five minutes every hour. Begin. and when the last one does come out there will be a banner saying Congrats you killed your friends now you can die too! in that exit room there will be triggered explosives giving them just enough time to read it? I think not...,HogwartsRP,cf46f1l,2,t5_2ygix
227259,0,t1_cf4aw7m,Well at least you are not i wink,HogwartsRP,cf4ax1t,1,t5_2ygix
227564,0,t1_cf4bx4d,I help you before pulling yours off quickly.,HogwartsRP,cf4c29c,1,t5_2ygix
228135,0,t1_cf4aofg,What what feels like?,HogwartsRP,cf4e6vn,1,t5_2ygix
228740,0,t1_cf4gead,He zooms toward the ball barely missing it and throwing it back,HogwartsRP,cf4gg7j,2,t5_2ygix
228807,0,t1_cf4gmne,OOC Will do.IC Tosses it below you in a curve.,HogwartsRP,cf4gp7f,1,t5_2ygix
229500,0,t1_cf4i2gz,looks at the bowl to check how it is,HogwartsRP,cf4jabx,1,t5_2ygix
229682,0,t3_1m4jd5,comes in and sets a ton of books down and whispers to herself why am I so stupid?,HogwartsRP,cf4jypn,1,t5_2ygix
230535,0,t1_cf4mukw,smiles youre welcome. And I glad you like it. I er.. I also got you something else,HogwartsRP,cf4n5j9,1,t5_2ygix
233220,0,t1_cf4tybc,So you said you would like to see France.,HogwartsRP,cf4x7tq,1,t5_2ygix
237629,0,t1_cf5dl9q,Smiles YES SIR RE Im FEELING FAAAANTASTIC,HogwartsRP,cf5dp8l,1,t5_2ygix
238759,0,t1_cf5hxvu,I am thank you.,HogwartsRP,cf5hy61,1,t5_2ygix
238829,0,t1_cf5i5w2,shakes firmly Hi there,HogwartsRP,cf5i7lu,1,t5_2ygix
239020,0,t3_1wuo22,I extend my hand and smile Jason Merridew Gryffindor. Hi.,HogwartsRP,cf5ixec,1,t5_2ygix
242371,0,t1_cf5vg34,I do but it is kinda impossible to do,HogwartsRP,cf5vgw6,1,t5_2ygix
242879,0,t1_cf5sskc,Thats so sweet.,HogwartsRP,cf5xd0l,1,t5_2ygix
244076,0,t1_cf61c7e,Feels good to say it too. ,HogwartsRP,cf61u0b,1,t5_2ygix
244913,0,t3_1wwtop,Did I even.. sort you?,HogwartsRP,cf64yo5,1,t5_2ygix
246057,0,t1_cf696hn,he smiles Cool.,HogwartsRP,cf698pk,2,t5_2ygix
246500,0,t1_cf64jmc,OOC What a shame I cant walk in here. I just ruined a smut scene in the dungeons. XD,HogwartsRP,cf6awhm,1,t5_2ygix
247562,0,t1_cf6eqb3,But...,HogwartsRP,cf6evq1,1,t5_2ygix
249887,0,t1_cf6nji5,I dont think i do. I am pretty realistic when it comes to it.,HogwartsRP,cf6nl4a,1,t5_2ygix
251918,0,t1_cf6v4zc,nods and the portrait clears her throat There is a story that a man and not a manSaw and did not see a bird and not a birdPerched on a branch and not a branchAnd hit him and did not hit him with a rock and not a rock.How is this possible?,HogwartsRP,cf6v6c8,1,t5_2ygix
253667,0,t1_cf71mor,Grunting and panting more his length pulses awaiting to release its load.,HogwartsRP,cf71pdu,1,t5_2ygix
256076,0,t1_cf7afpw,he thinks for a second before saying Youre scottish right? Its not that you have an accent but your name sounds celtic.OOC Percy Jacksons cool too D,HogwartsRP,cf7aqik,1,t5_2ygix
256219,0,t1_cf7b8g3,nods Yeah all the time.,HogwartsRP,cf7b9sh,1,t5_2ygix
261768,0,t3_1x2x48,he jots down notes throught the lecture and raises his hand thoughtfully after,HogwartsRP,cf7w3fd,1,t5_2ygix
262349,0,t1_cf7y7q1,Its fine. I smile.,HogwartsRP,cf7y9gh,1,t5_2ygix
262878,0,t1_cf805nf,I pull away again. Im going to keep doing this. I grin. Beg for me.,HogwartsRP,cf808pk,1,t5_2ygix
262982,0,t1_cf80l6x,chuckles Thats what Im going for. ,HogwartsRP,cf80moz,1,t5_2ygix
264699,0,t1_cf815l6,Why is it that wizards only get this choice?,HogwartsRP,cf87237,1,t5_2ygix
267926,0,t3_1x6bkn,She sits in the Ravenclaw table takes a cup of coffee and starts to read her copy of the Daily Prophet.,HogwartsRP,cf8j41j,1,t5_2ygix
267970,0,t1_cf8j8jd,nods nice to meet you Oliver.,HogwartsRP,cf8j9zj,1,t5_2ygix
270934,0,t1_cf8ua7y,I smile brighter. Is it bad that I really like when you call me that?,HogwartsRP,cf8ucgb,1,t5_2ygix
271418,0,t1_cf8w2x6,Kissing each one I suck on each with a grin.,HogwartsRP,cf8w5kp,1,t5_2ygix
273075,0,t1_cf91s44,Yeah. I sit down in the lake shore.,HogwartsRP,cf92d8a,1,t5_2ygix
280466,0,t3_1xbcwf,takes a seat in the hall and eats some lasagne setting aside some tiramisu for afterwards,HogwartsRP,cf9u03y,1,t5_2ygix
280746,0,t1_cf9uvue,I let out a happy sigh as you kiss my collarbone God I love you.. I hold myself as close as possible to you my breathing quick ,HogwartsRP,cf9v1tv,1,t5_2ygix
284297,0,t1_cfa7z45,it was fun c,HogwartsRP,cfa8cdq,1,t5_2ygix
285162,0,t1_cfabija,You taste amazing by the way. I grin. Want another one?,HogwartsRP,cfabkng,1,t5_2ygix
287651,0,t1_cfak3mq,Thanks! she hollers as she flies around racing with the Snitch,HogwartsRP,cfakv0s,1,t5_2ygix
288343,0,t1_cfanffg,OOC FFS grumbles,HogwartsRP,cfang67,1,t5_2ygix
290327,0,t1_cfautu9,Same it has been pretty dull lately,HogwartsRP,cfauuyl,1,t5_2ygix
291050,0,t1_cfaxhvg,Awesome! So... Do you know which way we came in? I ask chuckling.,HogwartsRP,cfaxk8e,1,t5_2ygix
291873,0,t1_cfb0jfv,Youre amazing you know that? I start to walk again.OOC Its not exactly the first time shes been rejected she can handle it p,HogwartsRP,cfb0mp4,1,t5_2ygix
291891,0,t1_cfb0n01,Well want to do something then? Like explore maybe? ,HogwartsRP,cfb0p45,1,t5_2ygix
292484,0,t1_cfb2qyb,I moan quietly very enthusiastic in what Im doing.OOC What was he going to say?,HogwartsRP,cfb2x4a,1,t5_2ygix
292486,0,t1_cfb2rzv,I sure did. I grin.,HogwartsRP,cfb2xe1,1,t5_2ygix
292628,0,t1_cfb3ck5,I kiss you back deliberately not answering.,HogwartsRP,cfb3gk0,1,t5_2ygix
311026,0,t1_cfd04rp,he smiles Cool.,HogwartsRP,cfd08g0,2,t5_2ygix
311186,0,t1_cfd0ijl,I smile sympathetically Yeah. Its like you appreciate their concern but its your future not theres.,HogwartsRP,cfd0tzt,1,t5_2ygix
320347,0,t1_cfdz0tg,Yea he isnt that bad,HogwartsRP,cfdz258,1,t5_2ygix
324574,0,t1_cfeeuqh,knows you arent,HogwartsRP,cfeev9a,1,t5_2ygix
328571,0,t1_cfetnui,Youd think I sucked at potions for the amount of explosions I cause I laugh recalling some of the recent ones if you want I could show you some tricks and in trade if youre any good at charms divination or herbology Im all ears.,HogwartsRP,cfetslo,1,t5_2ygix
328614,0,t1_cfetxsb,continues to focus on potionYou should probably do something about it dimwit,HogwartsRP,cfetyel,1,t5_2ygix
330415,0,t1_cfehqqo,Are you new?,HogwartsRP,cff0oiw,1,t5_2ygix
337971,0,t1_cffsovy,the note saysHey love! Youre doing great. Youre getting there dont worry. In two of these cakes are your gifts. Yes in the cakes. How you get them out is up to you. Dont hate me!P.S. youre probably going to need to use scourgify to clean up.,HogwartsRP,cffsujo,1,t5_2ygix
339606,0,t1_cffyto1,Great Ill change into my street clothes and meet you in the dungeons I smile and swing my legs outOOC lets move this conversation to the dungeons page and then to the Knockturn alley page,HogwartsRP,cffyxyn,1,t5_2ygix
341099,0,t1_cfg4fqz,I make a few rounds around the place then turn to youWhat do you want to get?OOC Helpful Rian is helpful,HogwartsRP,cfg4i15,1,t5_2ygix
341422,0,t1_cffu5mx,I smile brightly and walk over to a table off to the side of the room fiddling for a minute before walking over with your plate and drink. I place it in front of you its a few baconwrapped steaks  and baked potato with all the fixings. I know how much you love bacon so I had to incorporate it somehow.,HogwartsRP,cfg5pbr,1,t5_2ygix
343505,0,t1_cfgdcls,I can do ddecent sssschoolwork and read aagainnnn! I grin doing a funny little dance absolutely delighted and oh so excited.,HogwartsRP,cfgdgp7,1,t5_2ygix
376517,0,t1_cfjsevh,OOC runs away Mommy mommy its not my fault I swear!,HogwartsRP,cfjshyg,2,t5_2ygix
376744,0,t1_cfjr3x0,Effectively winning the arguement.,HogwartsRP,cfjtcfr,1,t5_2ygix
379464,0,t1_cfk3ctd,what is the matter ,HogwartsRP,cfk3hz8,1,t5_2ygix
379728,0,t1_cfk4gpl,So much. I cant wait to go pro and play until Im too broken to keep playing grins,HogwartsRP,cfk4heq,1,t5_2ygix
387424,0,t3_1yfpu8,Dances through the bathroom.,HogwartsRP,cfkx7j1,3,t5_2ygix
387556,0,t1_cfkxn4u,Thank you for forgiving me Im unfortunately able to make mistakes unlike some people. I smirk and wink. ,HogwartsRP,cfkxp7e,1,t5_2ygix
396481,0,t1_cflurig,Let that be a prize after you get all the clothes you want,HogwartsRP,cflv0lp,1,t5_2ygix
396858,0,t1_cflwcti,I wrap my arms around you and pull us both further onto the decking Hmm...Id agree with that cousin Emerald I give you an overstated wink and laughOOC should we mark this thread as nsfw or something?,HogwartsRP,cflwf4d,1,t5_2ygix
397458,0,t1_cflo6gd,I look over and see you watching me and turn a bright shade of red.,HogwartsRP,cflynok,1,t5_2ygix
398467,0,t1_cfm1vxt,Your wish is my command...I smile and move down your body until my knees touch the floor tapping at your panties they fall away as if cut and then reconnect on the bed. Moving my hand I tenderly touch using my magic hands to make every touch and motion feel like a thousand volts of pleasure running through your body.OOC sorry for the late reply,HogwartsRP,cfm2f1p,1,t5_2ygix
400040,0,t1_cfm85xv,he shrugs I couldnt do it.,HogwartsRP,cfm8a3z,2,t5_2ygix
403137,0,t1_cfmjtiu,thinks and smiles How bout them daleks?,HogwartsRP,cfmjv32,1,t5_2ygix
403822,0,t1_cfmm48a,he picks you up chuckling I think you should sit down for a bit.,HogwartsRP,cfmmf2q,2,t5_2ygix
404339,0,t1_cfmoadi,he smiles And I look like I just came back from taking a walk. he laughs,HogwartsRP,cfmocj8,2,t5_2ygix
404709,0,t1_cfmpp5y,Bella! I turn around and hug you back.,HogwartsRP,cfmpq67,2,t5_2ygix
404716,0,t1_cfmpedr,upon the sight of the dark mark i look shocked then my face goes solemn That is a very powerful and fiendish piece of magic. unable to tear his eyes away from the mark You said this curse prevents others from aiding you directly with magic right? lost in thought for a moment then tears his eyes away and back to Masons face What about indirect or non magical help?,HogwartsRP,cfmpr3v,1,t5_2ygix
404901,0,t1_cfmqc5b,Smiles and dances Any second now.,HogwartsRP,cfmqfxz,1,t5_2ygix
405678,0,t1_cfmt7ui,Shrink it then make it bigger again.,HogwartsRP,cfmtcbl,1,t5_2ygix
406072,0,t1_cfmulba,Nice lets go slowly towards there i take your hand again,HogwartsRP,cfmutfz,1,t5_2ygix
406636,0,t1_cfmnj8o,she walks a little forward to look out as well I.. I havent realized I walked this far Professor. I am just wandering around..,HogwartsRP,cfmwxd2,1,t5_2ygix
412497,0,t1_cfnhz34,I slide on top of you never breaking the kiss as I straddle you.,HogwartsRP,cfnirx3,1,t5_2ygix
423998,0,t1_cfo7jrg,No Professor. I used he generally. she looks at you I.. I believe you. Its not Professor Matthews.,HogwartsRP,cfopnji,1,t5_2ygix
424398,0,t1_cfol5vz,Yes Mister...?,HogwartsRP,cfor588,2,t5_2ygix
434985,0,t1_cfpuk6b,I laugh. Im sure. I whisper in your ear so softly YOU can barely hear me. You do look really hot still. Honestly? Id hit it. I wink and grin mischievously before kissing your cheek. I love you.,HogwartsRP,cfpunh1,1,t5_2ygix
446383,0,t1_cfr0y3i,I wave and smile at you before turning back to my own meal,HogwartsRP,cfr16pe,1,t5_2ygix
448753,0,t1_cfr9r2n,laughsI used to be a Beater until I suffered an incident.,HogwartsRP,cfra0uj,1,t5_2ygix
448877,0,t1_cfrag8d,You dont want to see me with other people  same as i dont want to see you with others,HogwartsRP,cfrahhs,1,t5_2ygix
448952,0,t1_cfraoo6,Agreed I reply with a happy smile,HogwartsRP,cfrarkk,1,t5_2ygix
455865,0,t1_cfs2vxa,Zephyr Dracon. Total asshole.OOC EVER. DO NOT FIGHT THE WICKED ,HogwartsRP,cfs2x24,1,t5_2ygix
457829,0,t1_cfsayf2,I nod. Of course.,HogwartsRP,cfsayt7,1,t5_2ygix
459430,0,t1_cfsh575,Wow!,HogwartsRP,cfshj7f,1,t5_2ygix
460284,0,t1_cfsl0dv,I can understand where youre coming from. I smile.,HogwartsRP,cfsl1iv,1,t5_2ygix
461105,0,t1_cfsg1ak,I attempt to sneak up on you and peep on what youre writing,HogwartsRP,cfsoeri,1,t5_2ygix
463554,0,t1_cfsyfsg,I slide my hands down your back,HogwartsRP,cfsyh8p,1,t5_2ygix
464826,0,t1_cft3ntz,I dont know what clue to give you then. December th.,HogwartsRP,cft3osg,1,t5_2ygix
466979,0,t1_cftbvg4,I bite along your neck.,HogwartsRP,cftci6b,1,t5_2ygix
467767,0,t1_cftf7og,i see you left and follow you still eating some toast along the way,HogwartsRP,cftfqbq,1,t5_2ygix
470671,0,t1_cftrkge,This what?,HogwartsRP,cftrmf5,1,t5_2ygix
471486,0,t1_cftuski,I smile and take a slice of cake for myself. What do you want?,HogwartsRP,cftuz5x,1,t5_2ygix
478783,0,t1_cfuotw6,I kiss you back then pull away and smile Wanna play  Q?,HogwartsRP,cfuovgk,1,t5_2ygix
480385,0,t1_cfuv35o,You too. I smile back. Enjoy your day.,HogwartsRP,cfuvfmp,1,t5_2ygix
480884,0,t3_1zkrxy,Pleasure to meet you Professor Dee. I smile brightly. I am Demetria Lewis the Deputy and Head of Hufflepuff.I offer a handshake.,HogwartsRP,cfuxh6x,3,t5_2ygix
481016,0,t1_cfuwj04,It is. I am just surprised.,HogwartsRP,cfuy0ob,1,t5_2ygix
481767,0,t3_1zl1bb,,HogwartsRP,cfv13bx,1,t5_2ygix
482357,0,t1_cfv3au8,They would be wrong.,HogwartsRP,cfv3idi,1,t5_2ygix
482798,0,t1_cfv597n,That is why I love it so much. I live the crowds and the business.,HogwartsRP,cfv5bgl,1,t5_2ygix
482823,0,t1_cfv5a7e,well that is good isnt it?,HogwartsRP,cfv5f52,1,t5_2ygix
483001,0,t1_cfv63t3,Yes...you see I know why I cant cast charms plants hate me animals avoid me and I cant cast levitation spells to save my life...Im cursed.,HogwartsRP,cfv65d9,1,t5_2ygix
484771,0,t3_1zmgfw,I grab a stack of pancakes and eat.,HogwartsRP,cfvdec4,1,t5_2ygix
486847,0,t1_cfvluq3,I kiss back matching your passion,HogwartsRP,cfvlwlx,1,t5_2ygix
492338,0,t1_cfw7fws,I smile and nod. They really were. They were really long and detailed not in a bad way like you actually put in effort. I remember you writing about how youd been drinking and you were writing in pen.. You said something about what you were doing and then wrote and missing you. But you crossed it out and wrote that you meant everyone. When I read that I felt like my heart skipped too many beats to be healthy.,HogwartsRP,cfw8dfb,1,t5_2ygix
492932,0,t1_cfwarbt,Are you sure? Looking up I mutter and perform the Alchemy with ease turning the feather jet black Ill come with you its been a while.,HogwartsRP,cfwat64,1,t5_2ygix
493223,0,t1_cfwbs72,Okay...OOC maybe,HogwartsRP,cfwc05y,1,t5_2ygix
495642,0,t1_cfwl8sk,I thought you didnt want to?,HogwartsRP,cfwlwqr,1,t5_2ygix
497910,0,t1_cfwv5jj,I grin back. It is.,HogwartsRP,cfwv6m8,1,t5_2ygix
498794,0,t1_cfwyqt1,I brush your hair back,HogwartsRP,cfwyssf,1,t5_2ygix
499055,0,t1_cfwzpfi,Aster.,HogwartsRP,cfwzv7v,1,t5_2ygix
