,controversiality,parent_id,body,subreddit,id,score,subreddit_id
5703072,0,t3_3t7vy1,Thought on it?,MaddenMobileH2H,cx40shb,1,t5_3aqo5
5730586,0,t3_3tibob,No Results Found when entering Hampton Heat.,MaddenMobileH2H,cx7foca,1,t5_3aqo5
5757965,0,t3_3tp4qh,Pm me the name of the league?  overall team.,MaddenMobileH2H,cxatwfg,1,t5_3aqo5
5785689,0,t1_cxe9jte,So? Whats your decision. Im fine with either decision,MaddenMobileH2H,cxe9q5y,1,t5_3aqo5
5785851,0,t1_cxe9qwq,Not really as much as King Nation,MaddenMobileH2H,cxeag8d,1,t5_3aqo5
5835453,0,t3_3v385a,deleted,MaddenMobileH2H,cxkjzeh,1,t5_3aqo5
5839925,0,t3_3v7466,Applied,MaddenMobileH2H,cxl538d,1,t5_3aqo5
5856920,0,t1_cxnd0eb,Do you think you can change your team to the Steelers? I already have a Dolphins game in progress. ,MaddenMobileH2H,cxndcoi,1,t5_3aqo5
5886296,0,t3_3vlmgz,join space jam,MaddenMobileH2H,cxr86hf,1,t5_3aqo5
5921242,0,t1_cxvn7b6,Hey man sorry I happened to comment right before classes started. Ill have to check and Ill look for you,MaddenMobileH2H,cxvt18f,1,t5_3aqo5
5977391,0,t1_cy31qa6,Name of league?,MaddenMobileH2H,cy3612k,1,t5_3aqo5
6022524,0,t3_3xu1co,removed,MaddenMobileH2H,cy92qsh,1,t5_3aqo5
6025059,0,t1_cy9cskg,lt nah just kidding I TOTALLY believe that u have a hack,MaddenMobileH2H,cy9eo88,1,t5_3aqo5
6135744,0,t3_3zl8xs,Join my league if you want tier  respectively.  The name is Fargo and has the wizard logo. say you were sent from reddit,MaddenMobileH2H,cyn2ihv,1,t5_3aqo5
6143957,0,t1_cynzze1,im down,MaddenMobileH2H,cyo04ok,1,t5_3aqo5
6278039,0,t3_41jitg,Still got any slots open? ,MaddenMobileH2H,cz38qid,1,t5_3aqo5
6280117,0,t3_41jitg, overall....best grinder you will find....ign is yellid,MaddenMobileH2H,cz3h96l,1,t5_3aqo5
6320273,0,t3_42237c,My ign is Cramos with a frozen logo  overall team are the ers k fans still same tier,MaddenMobileH2H,cz81nbu,1,t5_3aqo5
6357366,0,t3_42md01,Hey if you can make a spot my ign is  Carson  overall active heavy grinder,MaddenMobileH2H,czc9gk9,1,t5_3aqo5
6382677,0,t1_czf50hh,We are k away so still some grinding to do we are only a few hundred away from Hester tho and if youre on ah Ill take coins but if not Ill take TOTY packs,MaddenMobileH2H,czf544t,1,t5_3aqo5
6414408,0,t3_43jkfc,footballcaleb  OVR and . mil fans,MaddenMobileH2H,czir4n4,1,t5_3aqo5
6545511,0,t1_czw9kia,SAM,MaddenMobileH2H,czwcxn0,1,t5_3aqo5
6617630,0,t1_d038s5a,tier  for all of them which we got in a couple of days,MaddenMobileH2H,d03tiot,1,t5_3aqo5
6715117,0,t3_47luex,My name is Geekhearted on there. I been looking for a league to be active with. Ill find you and apply,MaddenMobileH2H,d0dwg2p,1,t5_3aqo5
6761783,0,t3_48cplg,We are attempting to get those players now Join Big Dogs! use this filter to help ,MaddenMobileH2H,d0iq593,1,t5_3aqo5
6849660,0,t3_49kixc,Ill take it.  Pm me the info.,MaddenMobileH2H,d0spspg,1,t5_3aqo5
6918182,0,t1_d10cnw8,I will add you to the waiting list. Did you have any questions for me about my original post? I want to be clear about the situation.,MaddenMobileH2H,d10hz7h,1,t5_3aqo5
6925085,0,t3_4ae0gi,Or check out We Wont Kick You.  Only  away!,MaddenMobileH2H,d11a787,0,t5_3aqo5
6969731,0,t3_4b5wnb,Check my league  We Wont Kick You.   from Hester.  Signature pak to Pumpkin,MaddenMobileH2H,d16ct6p,1,t5_3aqo5
6976217,0,t3_4b979i,Hey bro its me Emiliano from the league they kicked like  of us right now. Idk who the admin is but hes kicking people and adding a bunch of his friends or something because a ton of low overalls are joining the second somebody is kicked. I complained as soon as they kicked somebody and added a  overall and got kicked  minutes later. If anybody is reading this dont join the league  Grind theyll probably kick you as soon as they get close to Hester.,MaddenMobileH2H,d173bil,1,t5_3aqo5
6989975,0,t3_4bd8qs,Check out We Wont Kick You.  We finished the LAs and are now concentrating on the next season tourney event.  Current record is   in seasons.  Average OVR is .,MaddenMobileH2H,d18nlwp,1,t5_3aqo5
6996911,0,t3_4b8en4,NWO is who I play for. We are tier  on all achievements and will also be very active in tournaments. Whats you madden name,MaddenMobileH2H,d19fyqn,1,t5_3aqo5
6997270,0,t1_d19bq5v,were still rating out inactive sorry well be done by Wednesday night,MaddenMobileH2H,d19hfkf,1,t5_3aqo5
7218138,0,t3_4dvbd1,Applied. My name is peace  ovr  m fans,MaddenMobileH2H,d1ynacw,1,t5_3aqo5
7244177,0,t3_4eerof,Haha very funny Sam ,MaddenMobileH2H,d21lzpz,1,t5_3aqo5
7389450,0,t3_4gilwn,deleted,MaddenMobileH2H,d2i4owd,1,t5_3aqo5
7650500,0,t3_4jyy38,Still looking for anyone?,MaddenMobileH2H,d3bti9x,1,t5_3aqo5
7663605,0,t3_4k9xbi,I prefer to grind for Emmit...thanks though! ,MaddenMobileH2H,d3db3vh,1,t5_3aqo5
7865804,0,t3_4mm4t0,Apply to Eskimo Brothers Database. Were pretty close to getting Hester and we could always use more members.,MaddenMobileH2H,d406t0r,1,t5_3aqo5
8228620,0,t3_4q9pkf,Have u guys done Emmitt and Rice yet?Edit Just applied name is Frunguper ,MaddenMobileH2H,d564tsg,1,t5_3aqo5
8717930,0,t3_4zfd40,Sounds exactly what my league is looking for. Name is cashed out started again. We currently have  members and are expanding and we grind hard and play our drives ,MaddenMobileH2H,d6vdpoi,1,t5_3aqo5
8926653,0,t3_52ihn6,Newly created Bombsquad MM will get DiMarco in a matter of days and we started the league a day ago. We currently need pass grinders and good tourney players. We would love having a player like you.,MaddenMobileH2H,d7kuoyz,1,t5_3aqo5
9101861,0,t3_54ut1y,deleted,MaddenMobileH2H,d85wbxn,1,t5_3aqo5
9217643,0,t3_5651ix,Sorry I realized I work to much to be consistent as I want and as consistent as your league would want. I will peacefully leave thank you for letting me in though! ,MaddenMobileH2H,d8kek4m,1,t5_3aqo5
9525767,0,t3_5bavyc,I want in,MaddenMobileH2H,d9n938x,1,t5_3aqo5
9751524,0,t3_5eredu,Join me but be active Hillsdale Killas,MaddenMobileH2H,daf3b1s,1,t5_3aqo5
9882188,0,t1_dave72t,Just applied!,MaddenMobileH2H,davo84s,1,t5_3aqo5
10009981,0,t1_dbcbknj,Nothing to do with me. If you want to be a scumbag go ahead. Im not your Dad,MaddenMobileH2H,dbcbvdf,1,t5_3aqo5
10194803,0,t1_dbzih80,Found a league yet? I seen some others proposition you for a spot in their leagues.,MaddenMobileH2H,dbzmxva,1,t5_3aqo5
10203540,0,t1_dc09csc,Pls respond if you can get me in,MaddenMobileH2H,dc0mmpw,1,t5_3aqo5
10255620,0,t3_5mtdb4,Eskimo brothers database  rank ,MaddenMobileH2H,dc6j41h,2,t5_3aqo5
10257567,0,t3_5mtdb4,Touchdown Trojans  ranked  talented group with many spots open. Will get admins to invite if reqs cannot be opened at the moment.,MaddenMobileH2H,dc6r2dw,1,t5_3aqo5
10279406,0,t1_dc714um,What are you at for Sherman?,MaddenMobileH2H,dc986id,1,t5_3aqo5
10433270,0,t3_5o97ev,Were a little over half way thru tier  for dimarco and  thru for Eifert with active players and daily tournaments if you wanna join. League name National champions league Its the one with the NFC logoSend a request!,MaddenMobileH2H,dcqoie1,1,t5_3aqo5
10671642,0,t1_ddgkzw1,No worries...we have  spots open still,MaddenMobileH2H,ddgp6a8,1,t5_3aqo5
10771054,0,t3_5tyh12,Americas Elite about  to Sherman ,MaddenMobileH2H,ddqydnd,1,t5_3aqo5
10797462,0,t1_ddlr53q,But we already have Sherman. To be honest though there are much better CBs available so I wouldnt worry about Sherman so much. If you want the  AWR roll with Gilmore.  ,MaddenMobileH2H,ddtoj1w,1,t5_3aqo5
10986249,0,t3_5whnkp,deleted,MaddenMobileH2H,ded98rl,1,t5_3aqo5
11373919,0,t3_60gh3l,Did you already get him? Any spots left?,MaddenMobileH2H,dfl7p02,1,t5_3aqo5
11731007,0,t3_647h8o,STEEL CURTAIN. We arent super close maybe halfway. But we need people that will play,MaddenMobileH2H,dgpqnkj,1,t5_3aqo5
11748296,0,t1_dgr6tbh,appyied,MaddenMobileH2H,dgrp5uy,1,t5_3aqo5
