,controversiality,parent_id,body,subreddit,id,score,subreddit_id
6796731,0,t1_d0m9q96,I will.  exp with happy hour? Thats worth it if you get a good spawn,TibiaMMO,d0mp8a7,1,t5_2s3sk
6800343,0,t3_48r5ow,RP here aiming for  or more. Will try to get Grims on my hh pretty insane exp. If its taken Ill just go around until I find an open spawn. Even an INQ seal will do lmao.Also Ill be activating voucher and I just recently got back to playing again will it stack with the x exp and make x? Or will it be x?,TibiaMMO,d0n41ef,1,t5_2s3sk
6824039,0,t1_d0ps7g8,When youre saying that my hitchance is pretty low at this level do you mean my level or my distance level?,TibiaMMO,d0psxv2,2,t5_2s3sk
6824348,0,t1_d0pn71c,Done ,TibiaMMO,d0pu7bo,2,t5_2s3sk
6825782,0,t1_d0pxdi2,I dont think theirs much loot to pick up but you could pick up the creature products. They drop lots of lumps of earth,TibiaMMO,d0q02my,1,t5_2s3sk
6831748,0,t1_d0nu6ye,That is exactly it it is always bot free probably because no one wants to invest in scripting or buying a script for a spot that only accepts levels ...You should try it out and after  try Krailos...,TibiaMMO,d0qoglt,1,t5_2s3sk
6834040,0,t1_d0qx2wa,If you are not healing on spells it should beManamanaexorimanamanaexori icomanamanaexori granrepeatAt lvl  on chosen you might want to start off with berserk though.,TibiaMMO,d0qxu9q,2,t5_2s3sk
6854043,0,t3_49n4ao,Gratz mate! Thats some sweet exp without hh!,TibiaMMO,d0t7pp6,2,t5_2s3sk
6898880,0,t1_d0y5vsb,Now with the bonus XP till level  its extremely easy. Sit  on Darashia rotworms then either Laguna Islands Zombies or Dark Pyramid Minos with stealth rings till   to  on Darashia Dragons. Takes very little time and is quite pleasent. Theres no excuse in spoiling the fun of others by botting.,TibiaMMO,d0yb1n0,3,t5_2s3sk
6993033,0,t3_4b9jfv,Sold  demonic essences for  gpea. By mistake...,TibiaMMO,d190443,1,t5_2s3sk
7006860,0,t1_d1akglk,Ill be on in about  hours damn work ill msg u if ur still online!,TibiaMMO,d1akmiw,1,t5_2s3sk
7010802,0,t1_d1aq32f,Alright thanks! ,TibiaMMO,d1b0ro3,1,t5_2s3sk
7017788,0,t3_4bjiwm,GL hope u get it going!!,TibiaMMO,d1btc9p,1,t5_2s3sk
7025061,0,t3_4bu2ia,I have a mage and a paladin offline training in Dolera i cant wait to join you guys in the next few weeks ,TibiaMMO,d1cn5zc,1,t5_2s3sk
7027930,0,t1_d1cvgt9,I am always on the lookout for more active respectable and skilled people to hunt with.What is your nickname and what huntinggrounds do you have experience with?,TibiaMMO,d1cywbt,1,t5_2s3sk
7038486,0,t1_d1e5scw,Nice thanks! when should i start making runes? and what spells are usefull to learn? sorry if im asking alot of questions but it was such a long time ago since I played this game. ,TibiaMMO,d1e632o,1,t5_2s3sk
7045151,0,t1_cy805zj,where should i hunt  ms,TibiaMMO,d1exc49,1,t5_2s3sk
7066365,0,t1_d1go3wh,Yes its still me Just changed server and char name but still same guy from Menera.,TibiaMMO,d1hc2fx,1,t5_2s3sk
7079777,0,t1_d1iu8x7,I could go for a NPvP world aswell focus on friendship community and development then go for guild wars etc although my beliefs are that when you play on a openpvp server you make stronger bonds to your friends as they are your allies when you get attacked trapped or harrassed. Its like an old days tribe where you help eachother out from other humans although the game is so old today that one player  can wipe us all out but still I guess you get my point. Ill send out a message when I get some more people with interest,TibiaMMO,d1iuvt0,1,t5_2s3sk
7138534,0,t1_d1pdxmg,Dont trust guild chat either a word to the wise...,TibiaMMO,d1pko5e,1,t5_2s3sk
7140834,0,t3_4dbmg3,I think a second promotion is highly more likely than new client type of things.I personally hope its a lot to buy and not a huge boost. Games too easy as is.,TibiaMMO,d1pu406,2,t5_2s3sk
7141417,0,t1_d1pwcol,I think the correct response is you would love death spells. Since there arent really any in the game at the moment. There is a rune though. p,TibiaMMO,d1pwie2,1,t5_2s3sk
7155991,0,t3_4dekya,when you hit hp i litterally yelled holy shit and startled my girlfriend. lmao,TibiaMMO,d1rke44,2,t5_2s3sk
7162684,0,t3_4dlzwd,I want my tibializer to look like yours how do I do that?,TibiaMMO,d1sbu0d,2,t5_2s3sk
7164014,0,t1_d1sh7ez,Sounds like alot of us have similar prework rituals haha.,TibiaMMO,d1shab2,1,t5_2s3sk
7164559,0,t3_4dn0ls,I currently play in Pacera but a school mate has been talking wonders of Harmonia.,TibiaMMO,d1sjio0,1,t5_2s3sk
7168743,0,t3_4dnmx0,Amazing job reminded me of the Doom OST.,TibiaMMO,d1t0old,1,t5_2s3sk
7172837,0,t1_d1th2ru,deleted,TibiaMMO,d1thfs4,1,t5_2s3sk
7175811,0,t1_d1tsc02,Yeah we have a pretty solid group of guys to do ther ferumbras ascendant quest with and  voc team hunts! Many of us use Skype while hunting as well if thats something youd want to do! ,TibiaMMO,d1ttnwt,1,t5_2s3sk
7195926,0,t1_d1w48xv,removed,TibiaMMO,d1w4923,-22,t5_2s3sk
7226205,0,t1_d1zhbpd,Same here and I love it too! I basically have like  hotkeys that I dont use on my mouse which are hotkeys that I rarely have to use anyway ,TibiaMMO,d1zkdbr,2,t5_2s3sk
7232762,0,t1_d2084bl,Im sure thats what everyone thought when they release great manas and ultimate hps...lol,TibiaMMO,d20b8v9,1,t5_2s3sk
7238059,0,t1_d20ru33,Botters gonna win win win.,TibiaMMO,d20wxy8,3,t5_2s3sk
7238303,0,t1_d20xwu5,Thats my point that their communication is doing them harm because theyre addressing a sensitive subject in a vague manner.It would be smarter of them to either make a hard decision or go full valve and not say anything at all.,TibiaMMO,d20xxse,2,t5_2s3sk
7239464,0,t1_d212mjn, UMP   GMP cost wise. UMP  Roughly GMP mana gain wise.  They weigh the same but cost x more.  They are about as cost efficient as hunting using UHP full time and i just dont see a point other then to bring profit down so i dont have to hit my mana hotkey as much its not like i was hurting for mana before these came out.,TibiaMMO,d212ooq,1,t5_2s3sk
7248476,0,t3_4eo4ip,I havent really logged on since the update  too busy getting high n playing rust with my gf,TibiaMMO,d223mec,1,t5_2s3sk
7251692,0,t1_d22d1ql,Each step removes one item. So for the two leftmost steps the upper step removes the phoenix egg and the lower step the k or vice versa Im not sure.Anyway there is no way to trick it into only removing one item. You will have to walk on at least to steps to get to the chests and there are no adjacent steps that removes the same item neither straight nor diagonally.,TibiaMMO,d22grm9,2,t5_2s3sk
7277626,0,t3_4f2vk8, Channel participants King Eks.I cant play much on weekdays but on weekends I can put in a little more time. Been a bit inactive these past  weeks Ill try to stay more active now. Id love to teamhunt or do something together with a group  ,TibiaMMO,d25f1ia,2,t5_2s3sk
7296348,0,t1_d27hgk0,Exactly.  Realistically knights already do really good damage.  Theyre just annoying as hell because you have to spam potions nonstop to do it.Cant please everyone though.  I want the health of knight mana of a mage potions of all kinds cap of a knight and the combined damage of all .  Shit I want to be a GM.,TibiaMMO,d27jmws,1,t5_2s3sk
7297339,0,t1_d27gnrh,Knights get higher exp in higher lvl than rps solo,TibiaMMO,d27nozn,1,t5_2s3sk
7311185,0,t1_d28my1v,Nah its less than a year old. I trained from  and got about  towards  during double exp. The rest is just always using up soulpoints and hunting with a lot of mas sans.,TibiaMMO,d298d5d,1,t5_2s3sk
7322301,0,t3_4fnt6d,Another item id like to see buffed  Thunder Hammer Its so rare and so expensive and its not even good.  Mycological Mace is what.. k?  And its better. Solution  Add Energy damage to it aka Thunder.  Why not?  Sword has impaler of the igniter fire axe has plague bite earth club has... ????...enchanted clerical mace?!  Spice that Weapon of the Gods up a bit and make it usable for those select few that own em.,TibiaMMO,d2ahudp,8,t5_2s3sk
7397837,0,t1_d2irtlt,,TibiaMMO,d2j3306,1,t5_2s3sk
7398950,0,t3_4gmqrj,Shock Head  Warrior for maximum style,TibiaMMO,d2j7mum,4,t5_2s3sk
7425892,0,t1_d2lx9sd,how much would it cost now? i got one but in main o,TibiaMMO,d2m9y08,1,t5_2s3sk
7427752,0,t3_4h0v1q,Cyclops spawn of your choice ,TibiaMMO,d2mhkn1,1,t5_2s3sk
7447409,0,t1_d2nldnh,Lol cry me a river. Tibialyzer has been verified by Cipsoft as being legal btw. Youre a botter and you got deleted and now youre crying salty tears. Get over it you deserved it. And your excuse of not botting on that specific account is moot because Cipsoft tracks IP. Get rekt.,TibiaMMO,d2oq1p1,2,t5_2s3sk
7457108,0,t3_4h41ay,Or getting scared because there was a dragonlord in DP utevo res ina D,TibiaMMO,d2ptr5y,1,t5_2s3sk
7465621,0,t3_4hjnrt,RP can make profit without giving away much XP.EK can make the same amount of profit but will suffer in XP and will need a higher level.Mages only sure way to profit is to hunt with someone else mainly as EDEK.,TibiaMMO,d2qsml1,2,t5_2s3sk
7480317,0,t1_d2sg3ce,Because they scale on mlvl which knights are low on. Quick test on tibiastats using a standard template of level  knight and  mlvl shows that UH gives on av  hprune compared to pots thats nothing. Scale the mlvl up to  and it heals  on average. Using mlvl  but scaling level to  shows it heals  on average. This means it scales  hp levels compared to  hpmagic level.,TibiaMMO,d2sgx7e,2,t5_2s3sk
7493438,0,t1_d2tkkfw,any chance you can actually show us where Mirade said this instead of keep saying mirade said?  Mirade actually saying it and you saying Mirade said it are two VERY different things.,TibiaMMO,d2typ8l,1,t5_2s3sk
7506810,0,t3_4i5f87,Made me laugh.  I think you just cant have a question as part of your name.  Im Ron Burgendy?,TibiaMMO,d2vhi3k,1,t5_2s3sk
7574085,0,t1_d32r4i9,Lion Rock is good. When I first came back I gained quite a few levels there. Then I went to krailos GS cave and nightmare cave after that for tasks. Never really left krailos after that. It is empty most of the time on my server.,TibiaMMO,d334xb1,1,t5_2s3sk
7586538,0,t1_d34jlxx,Yup all depends on level.  I also went with burst arrows just because they are available at level  vs  for enchant spear.,TibiaMMO,d34jwbc,1,t5_2s3sk
7619692,0,t3_4jo3eo,Is thunder hammer still super rare?,TibiaMMO,d38bidp,1,t5_2s3sk
7635891,0,t1_d3a5lma,o yea LOL. i was already hunted so I needed protection but it meant shit all in Antonios crappy guild.plus all that bullshit cockiness he posted on the forums woulda just made u hunted by both sides so I left asap.,TibiaMMO,d3a5pex,1,t5_2s3sk
7637786,0,t3_4jwa1f,Lvl  paladin on Dolera here! Id like to enter the contest ,TibiaMMO,d3adge7,1,t5_2s3sk
7638256,0,t1_d39wpss,Thanks! I made my account in  and have been taking year long breaks in between so I dont really know what the hell is going on most of the time now lol,TibiaMMO,d3afdq1,1,t5_2s3sk
7640288,0,t3_4jyl9a,All in all probably around  fever and terrorsleeps took about min to clear the whole thing because all the normal monsters were in the area as well. When running through I was really really caught off guard by all the sudden having  upper rosh monsters and then also haveing  feversleeps and terrorsleeps on my screen. Really was a ton of fun though! ,TibiaMMO,d3anpm2,3,t5_2s3sk
7652624,0,t1_d3c1cao,How are they not? One has a speed of  the other of . Or do you think those numbers are similar to one another? sarcasm no need to reply with a condescending attitude ass.,TibiaMMO,d3c272m,-3,t5_2s3sk
7660214,0,t1_d3cx4zh,Yep even on a  I can tell the spawn gets a little slower as I keep going. I cant manage to break kk no matter how hard I try lol.,TibiaMMO,d3cx8bf,2,t5_2s3sk
7710147,0,t1_d3ihh5p,I have to agree with himIf youre hunting without skills you can sustain yourself with just the regen coming from the soft boots. Early on I used to also hunt with life rings just so I could ignore pots altogether hunting dragons  by .However if Im mobbing I rather use BoHwhen low level or drake. Simply because slow regeneration is not the goal. The goal is fast regen.You are right the soft boots will still recover the same amount per second either way but thats not what makes it less effective.It is the fact that you are already wasting pots to kill stuff and that generates A LOT more mana FASTER than soft boots ever will.Just consider thisSoft boots would take almost  days to generate .m mana.Mana potions would take only  hours to generate the same amount of mana.So yes if youre chugging down pots the amount of recovery from the soft boots pale in comparison to the pots regeneration.So theres little point in using it if youre spamming shit. However if youre not using anything and not taking that much damage a slow steady recovery will be much more efficient.,TibiaMMO,d3ilbu9,2,t5_2s3sk
7713302,0,t1_d3ixhv9,Hmm yeah that sure is important,TibiaMMO,d3iy7d8,1,t5_2s3sk
7773266,0,t3_4lqqvm,Yay! congrats  ,TibiaMMO,d3pra8n,2,t5_2s3sk
7781500,0,t1_d3qlvpn,Yeah thats what I asked if you want to be a rooker. I tought you wanted a set to get yourself level  and go to mainland hahathis dawnportrookgaard still confuses me,TibiaMMO,d3qox45,1,t5_2s3sk
7787589,0,t1_d3r2lwo,open pvp is not so much pvp as skull bashing. if you want a true pvp experience you need to play hardcore. only two servers in that case inferna or dolera. ,TibiaMMO,d3rdqx4,1,t5_2s3sk
7790266,0,t1_d3rm0p3,I found it was worth it just so I wouldnt lose more expcash when I died. Blessings are an investment in hardcore especially if youre team hunting because you typically die and only lose twist I died and got compensated about a month ago and have yet to use the blessing charms,TibiaMMO,d3rol1r,2,t5_2s3sk
7790346,0,t1_d3ro2jp,Yeah thats the main problem. Even with good skills Im limited to  kill at once whereas a mage can easily kill  mobs using AoE runes.,TibiaMMO,d3rowqy,1,t5_2s3sk
7812362,0,t1_d3tn007,Thats great!,TibiaMMO,d3u6a1z,1,t5_2s3sk
7841387,0,t3_4mpqgt,Back in the days soloing a demon was so much harder than soloing a dragon. Of course it is still today harder to kill a demon than a dragn but none of them are really that hard looking at how fast you can level and autoequip items that may save your life. For me it was also the dragon running with a crossbow and bolts at the lair northeast of dwarven bridge. It was scary but I did it. ,TibiaMMO,d3xfut6,1,t5_2s3sk
7842235,0,t3_4mooku,I thought Roxuous got a doll?,TibiaMMO,d3xjadm,1,t5_2s3sk
7849406,0,t1_d3xy6h6,Assign a hotkey so that you can equip an item by just pressing the said hotkey.Before you had to pull the stuff into the slots of the inventory making everything very much harder.,TibiaMMO,d3ycctf,1,t5_2s3sk
7853540,0,t1_d3y97tu,I should have clarified that was the profit after all waste paid for everyone and split  ways. So we looted X amount of gold paid everyones waste and ended up with k that was split  ways into k each. ,TibiaMMO,d3yt3zz,1,t5_2s3sk
7858955,0,t1_d3ym74m,Whats the level recommendation for it?,TibiaMMO,d3zf1a9,1,t5_2s3sk
7895681,0,t3_4nfwbg,super waste but great exp SD Oramond minos entrance I get anywhere from kkhr on happy hour solo depending on how fast I go I only loot rares to maximize exp if you have another mage buddy you can tag team the east Oramond minos but its a tad bit more dangerous for maybe khr more,TibiaMMO,d43jqdv,1,t5_2s3sk
7901945,0,t3_4nin19,Nice one! D,TibiaMMO,d4494lr,2,t5_2s3sk
7913619,0,t1_d45f04n,like that stupid gs in ghostlands ,TibiaMMO,d45kdmi,4,t5_2s3sk
7936080,0,t3_4nyqmf,I went a bit over board with the event this month.  I traded in  seeds for  plants x.x,TibiaMMO,d4839k0,1,t5_2s3sk
7949109,0,t1_d49j6ie,Thanks good tip. I kinda wanted to stick with weapons though. I wish Earth enchanted weapons didnt look so mossy,TibiaMMO,d49jzmz,1,t5_2s3sk
7955648,0,t1_d4a4dtk,I tried the gs and brimstone bug holeAnd didnt get any good loot in the hour and a bit I was thereIll look into the grimvale place,TibiaMMO,d4aafoe,1,t5_2s3sk
8010779,0,t3_4nvutz,Huggebugge,TibiaMMO,d4ghih1,1,t5_2s3sk
8023088,0,t1_d4hv6dz,UMC?,TibiaMMO,d4hvc4c,1,t5_2s3sk
8037280,0,t3_4p8hqx,what a legend,TibiaMMO,d4jgrnl,2,t5_2s3sk
8045589,0,t3_4oyrhl,Dont travel to weird places for a trade even if youre compensated for your travels.Long story short was selling some soft boots got offered an extra k to meet a guy in a weird part of town.  accounts logged in on me somehow tricked me into using an ava rune was right after they changed the colors of UHs I think got me redskulled instantly died and lost like .kk. This was quite a few years ago.,TibiaMMO,d4kefbo,1,t5_2s3sk
8114076,0,t3_4qaxii,My personal goal is to do POI. ,TibiaMMO,d4s3gbi,1,t5_2s3sk
8119831,0,t1_d4se6ox,There is really nice community to join. Just open english chat. Im planning to put my druid to the reddit guild there once i play more with him. Atm leveling rp there.,TibiaMMO,d4sqptm,1,t5_2s3sk
8127470,0,t1_cz7k1fe,Adrianb Deserves an award for calling the BS on tibiawiki having walk through quests back then. The game was reaching its peak in those days and had many secrets that few knew. Friendships and feuds were booming sadly during this period there was not much innovation or real customer satisfaction measures going on which was probably Cipsofts prime time for innovating but they jumped on board a few years to late and didnt hit the real peak potential they could have had as a business. ,TibiaMMO,d4tlnii,1,t5_2s3sk
8130849,0,t3_4qlkwa,First of all dont use sds if you want to profit. In addition to other replies sunken quarter is also ok exp and money. Remember to use ue and ewave to get some mlvl since rune hunts can kill mlvl advance.,TibiaMMO,d4tzb3t,1,t5_2s3sk
8149315,0,t1_d4v9zry,My pally is just above  now. Ive never been to this place though. Would it be possible for me to try it out at this level?,TibiaMMO,d4w7mzz,1,t5_2s3sk
8170809,0,t3_4r7rgg,Not having to carry cash and inq blessings at least..,TibiaMMO,d4ywfhz,13,t5_2s3sk
8175887,0,t1_d4xust5,I havent touched rl tibia in about  years. And after reading up about massive botters and how its pp Ill continue staying away for good,TibiaMMO,d4zjakr,1,t5_2s3sk
8215575,0,t1_d54cgfp,I dont lag as long as its not  maximized thats not the issue I know windowed lags more but my pc isnt shitty enough to lag because I have tibia open if its windowed covering  of my screen I have no fps issues at all.,TibiaMMO,d54i2n5,1,t5_2s3sk
8241490,0,t1_d57q0fe,Thats amazing because the character I have is a  ek I started a couple weeks ago,TibiaMMO,d57qpxr,1,t5_2s3sk
8319724,0,t3_4t5iww,im down to hunt too  RP and  EKChrysippus Zeft Dalis,TibiaMMO,d5hisde,1,t5_2s3sk
8390125,0,t3_4ujgta,Found one of myself and my guild The Unit killing Orshabaal,TibiaMMO,d5qbabo,3,t5_2s3sk
8406083,0,t3_4upecc,Dwarven Armor This armor can block the same physical damage as Magic Plate Armor but only if you get physical hits of  or more for that the monster max melee should be x   or more wearing shield and other armors will reduce that damage so... you will have to fight stronger monsters to make your armor block as good as magic plate armor.TibiaWiki,TibiaMMO,d5sb0tw,0,t5_2s3sk
8425950,0,t3_4ue85h,thay dude Falcao is a douche Ive killed him before xD,TibiaMMO,d5usa1i,1,t5_2s3sk
8460381,0,t1_d5z2wx3,Its not kharsek just someone leeching off his success I think.,TibiaMMO,d5z2zz9,4,t5_2s3sk
8461825,0,t1_d5z9bzg,If reaching  is his milestone then I can understand it what if he went through the door and something messed up happened causing him to die or something. Wouldnt that mess his  milestone?,TibiaMMO,d5z9it7,8,t5_2s3sk
8476512,0,t1_d60zuce,Only he knows. ,TibiaMMO,d613to3,3,t5_2s3sk
8479359,0,t1_d61fbfv,There is a web attack vector that can bypass the authenticator and Tibia is actually vulnerable to it. And if your machine is compromised then the attacker can simply mitm it.But yeah the authenticator makes it way harder for a hacker to gain access to your account.,TibiaMMO,d61go6u,1,t5_2s3sk
8481609,0,t1_d61qbnj,You talk like every Tibia player is able to pay for the premium account anytime they want but let me tell you something this is not that perfect world where everyone has a good job and can afford anything they want whenever they want many players in Tibia cant actually pay for premium whether its because they have more important things to pay for or because they dont even have a job or do you think everyone on Tibia is  and employed? Thats a fact that a lot of people out there CAN NOT pay for premium account even if they want so guess what? UNFAIR deserves ban .,TibiaMMO,d61qu5a,1,t5_2s3sk
8482793,0,t1_d61pi87,gt serpentine towerProbably... the game just isnt popular enough.I dont play any more because I personally cant stand being hounded by the BR masses in that game...,TibiaMMO,d61w6yx,4,t5_2s3sk
8484129,0,t1_d61ukv4,Oh wow thats great to know! Thank you so much for responding and the link ,TibiaMMO,d6228ee,2,t5_2s3sk
8550775,0,t1_d6a989d,You should stop using fucking offensive language,TibiaMMO,d6af3wd,1,t5_2s3sk
8550933,0,t3_4wv810,If I were you I would go and spam all around thais dp that youre a bot ,TibiaMMO,d6aftn9,1,t5_2s3sk
8555173,0,t3_4wxl0n,Im definitely in on this! So excited! ,TibiaMMO,d6ayz88,3,t5_2s3sk
8581757,0,t3_4x7yae,lol  sweet baby jesus XD,TibiaMMO,d6eazuy,1,t5_2s3sk
8583024,0,t3_4xdaur,Hi there! sorry about the missing pm! I was without wifi for a while and didnt see your pm thanks to the new mobil version of reddit its hard to keep track of all pms.... Anyway! You are welcome to send an application to House Redd through our subreddit rHouseRedd,TibiaMMO,d6egpjr,3,t5_2s3sk
8591821,0,t3_4xguxj,I completely agree I been back and just running around kaz with my pally its nice finding my old spots I use to train on slopes and just going deeper and deeper not knowing what to expect ,TibiaMMO,d6fkggn,3,t5_2s3sk
8594802,0,t1_d5hsvde,distance sqm does in fact affect hit. source,TibiaMMO,d6fxw97,1,t5_2s3sk
8598168,0,t3_4xjt10,try mutated rats task at alchemist quarter with the towers works fine and they are not botted. at  go to lions rock in darashia exori and exori min you should get khr  and its profit,TibiaMMO,d6gd34v,1,t5_2s3sk
8601249,0,t1_d6gpod2,deleted,TibiaMMO,d6gr01h,-3,t5_2s3sk
8602424,0,t3_4xe0we,As seankennede said the cave becomes a lot bigger if you can find the hidden switch. I still clearly remember exploring these caves for the first time many years ago.You are above a giant maze called the maze of lost souls. To make the hole appear that leads down to this maze you need to find a ladder down hidden on the troll level down there is a switch that will open the hole.In this maze you will find treasure and creatures that can be a lot stronger than trolls! So becareful exploring one of my favorite spots in Tibia! ,TibiaMMO,d6gwavw,1,t5_2s3sk
8614025,0,t1_d6htrk8,Yeah people do that quest in our guild....same with paradox....most people cant be bothered to spend so much time on a low level.,TibiaMMO,d6icmqs,1,t5_2s3sk
8621111,0,t3_4xw7u7,You can make khr solo at worker golems running and making thunderstorm runeswaves just going as many holes as you can before they respawn. Im leveling up my Druid there at the moment since level  is currently  after like  days. It would just be a lot easier as a sorcerer ,TibiaMMO,d6j8n8s,3,t5_2s3sk
8623222,0,t1_d6jfeek,Exactly. The oldies like me want to play the game and finish through the content in peace. We have no time for pests!,TibiaMMO,d6ji63w,1,t5_2s3sk
8626934,0,t3_4y0rwa,hey thats me in the leftP!,TibiaMMO,d6jyxxj,3,t5_2s3sk
8628662,0,t1_d6k350f,CIP has done that LONG ago when they got rid of GMs. And bots evolved. They now read only and emulate human action to act They emulate keyboard mouse clicks and even wait believable reaction times before they act.,TibiaMMO,d6k6r1x,1,t5_2s3sk
8634575,0,t1_d6kimbz,Unfortunately Wyrms walk over all fields so the only thing you can do is to either just run them all or wait until theres only a few. Try hopping down and immediately running southwest so you arent right in the middle of the spawn. If you keep yourself against a wall you wont have to worry about running into more. ,TibiaMMO,d6kxgid,1,t5_2s3sk
8635377,0,t3_4y4crw,Congrats Dragonslayer!  gold coins are one hell of a drop especially for an Iron! D,TibiaMMO,d6l12ln,2,t5_2s3sk
8650292,0,t3_4ydoyg,Congrats all! What a huge achievement in only a little after a week!,TibiaMMO,d6mwdxb,2,t5_2s3sk
8658118,0,t1_d6nt66l,Have you got an adventurers stone in your inventory? I think you can fast travel with that otherwise its a  minute walk at level . ,TibiaMMO,d6nvou9,1,t5_2s3sk
8690209,0,t3_4z04ab,Bright sword quest also!,TibiaMMO,d6rwk9t,2,t5_2s3sk
8701493,0,t3_4z6uj0,Sorry but isnt Dolera PvPE? Why would you want to play neutral on that server? Lol maybe Im crazy but isnt the whole point to go player kill with friends or solo for fun? ,TibiaMMO,d6tbi3c,1,t5_2s3sk
8713170,0,t1_d6us2j2,Im not the one screaming and insulting on a subreddit about a videogame xD,TibiaMMO,d6us7i0,1,t5_2s3sk
8714228,1,t3_4za6p8,No its hard to find a game where the developers have activley destroyed a beautiful game over  years time. I dont think youll find anything.,TibiaMMO,d6uwznn,0,t5_2s3sk
8730188,0,t1_d6w391y,gtOk fine I concede. Botters wont abuse this at all it wont make dominando guilds any worse and this will only help the little guy.kek,TibiaMMO,d6wx2dr,1,t5_2s3sk
8747544,0,t3_4zv51v,Love it. ,TibiaMMO,d6z3ir9,2,t5_2s3sk
8795149,0,t3_50lk95,Bonus pic,TibiaMMO,d7523as,6,t5_2s3sk
