,controversiality,parent_id,body,subreddit,id,score,subreddit_id
2121921,0,t1_cl9j154,Funny to laugh at yeah for sure. But his humor was usually just... mean hearted. Everyone picks on JLR but Rob was just cruel.,RoversMorningGlory,cl9jje0,1,t5_31h09
2122936,0,t1_cl9nvhk,So true. Shell do anything to sound like she knows what she is talking about. ,RoversMorningGlory,cl9o6o4,1,t5_31h09
2192903,0,t1_clikec7,probably twitter the most hardcore fans of the show have really gotten things going on there. edit although he mentioned the sub on the show one time and it tripled in activity,RoversMorningGlory,cliklq4,1,t5_31h09
2405291,0,t3_2ms8iq,Glad they chose this guy. ,RoversMorningGlory,cm903so,1,t5_31h09
2937250,0,t1_co1yi39,No the stupid stuff you do in public or reveal off air is fair game. Talking about his drunken shenanigans okay. But the cast knows if they press him he will say anything to contribute and fit in. They need to be responsible and decent. Anyone should have the right to choose when or if to reveal personal details such as mental health. Helping would be making him comfortable and discussing the medications and alcohol off air treating him like an adult. What they did today was not constructive or helpful everyone should be able to see that.,RoversMorningGlory,co1z83s,1,t5_31h09
2946688,0,t1_co31iu7,Lol he really does,RoversMorningGlory,co31w8a,1,t5_31h09
2961924,0,t1_co4s6y4,If Im not mistaken they straight up said that he still works there and Jeffrey even commented about how he sees him at work and Dumb seems like hes happy and doing fine.,RoversMorningGlory,co4saah,2,t5_31h09
2981516,0,t3_2ub24t,Yes Duji is annoying and she irritates me too but I will defend her on one point... How is it fair for people to expect her to dress nicely and wear makeup and a pushup bra every day just because shes a chick? No one gives the guys shit because they wear hoodies and hats. If I had to wake up at am to talk on the radio where most people dont see you Id be wearing a hoodie too. Also correction she didnt get fake boobs she got a breast reduction amp lift.,RoversMorningGlory,co70igo,2,t5_31h09
3088994,0,t3_2vdzvt,Hes a spoiled little bitch you can tell that when he was picked on his parents pretty much got him whatever he wanted just to make him feel better. I think he feels entitled more than anything and getting this job probably doesnt help with that along with him telling himself hes sexy and shit. GET THE HELL OUTTA HERE! really havent laughed at the show all that much lately its getting stale they need to get jeffrey a mic that seems to be the only time I perk and give the show my full attention. ,RoversMorningGlory,coi680w,2,t5_31h09
3093607,0,t3_2v35iz,Rover sounded like Vince McMahon with that antimillennial rant.Older generations throughout time have always looked down upon younger generations. Someday millennials will be saying the same about the generation behind them.,RoversMorningGlory,coing11,2,t5_31h09
3278470,0,t1_cp0vhea,I heard them say awhile back that they were waiting to hire a replacement for Rob to redo the show open. So perhaps hell finally be in there soon.,RoversMorningGlory,cp1z013,1,t5_31h09
3324230,0,t1_cp740sb,A bet is a bet.,RoversMorningGlory,cp76ukh,2,t5_31h09
3421655,0,t3_2zdsm8,I havent listened to the episode yet. Did he do anything special for Jeffrey? I was hoping one last parody song would have been created. Maybe Aerosmiths Dont Want to Miss a Thing except it would be like Id still miss you Jeffrey but Im not gonna miss your stains..edit just skipped to it. That was perfect.,RoversMorningGlory,cpiakzb,1,t5_31h09
3426081,0,t1_cpir5rp,thanks laroque,RoversMorningGlory,cpisrau,2,t5_31h09
3429943,0,t1_cpj55w5,yea browser I can watch video clips just not the live show or replay. Have you been able to get it to work?  Yes to GTA,RoversMorningGlory,cpj8mfv,1,t5_31h09
3712302,0,t3_32unge,deleted,RoversMorningGlory,cqffeks,1,t5_31h09
3781395,0,t1_cqn44jx,These were my thoughts exactly.  Noticed they didnt touch that at all.  ,RoversMorningGlory,cqnb2j8,1,t5_31h09
3874023,0,t1_cqxnklc,He did say it will be eventually so when you watch rmg TV on roku it will be an option on the start menu but its not set up for that yet. Hopefully by the time the reality show starts. I would rather watch that on my TV then my laptop.,RoversMorningGlory,cqxve4v,1,t5_31h09
3877150,0,t3_34pqrj,anyone know when the aftermath replay will go up? or when todays show will go up?,RoversMorningGlory,cqy88mh,0,t5_31h09
3907680,0,t3_356uc2,At some point theyre going to have to cut her loose because of her age.  A radio personality thats pushing  simply doesnt appeal to a somewhat hip  YO demographic.,RoversMorningGlory,cr1pks5,-1,t5_31h09
4025897,0,t3_36ly70,Well looks like the show is going to suck for the rest of the week. ,RoversMorningGlory,crf6k6k,5,t5_31h09
4032205,0,t3_36njsy,welcome glad you subed,RoversMorningGlory,crfwhz5,1,t5_31h09
4105053,0,t3_37n8q8,Fuck JLR how long til he shits his pants on the aftermath?,RoversMorningGlory,cro78fm,4,t5_31h09
4114180,0,t1_crp6r7s,Yeah its for sale right now,RoversMorningGlory,crp8qgt,1,t5_31h09
4136448,0,t1_crpu8g3,I havent shopped at Pac Sun in a decade and a half. Im  years younger than this guy.,RoversMorningGlory,crrrvhq,2,t5_31h09
4170702,0,t1_crvm343,But to be fair isnt the fact that its awkward and unfunny kind of funny in its own? Some of my favorite parts of the show are when they bust on Jeffery and make things weird and uncomfortable. Plus Dan seems to have original thoughts and is at least functional. ,RoversMorningGlory,crvo1sx,2,t5_31h09
4214481,0,t1_crypbhl,My boss use to work with her at his last company. Shes definitely only . ,RoversMorningGlory,cs0mvtk,1,t5_31h09
4278601,1,t1_cs7r8yu,Because he thinks being assaulted at work is something he should not have to deal with? First Dieter battered him then verbally threatened to beat and kill him on air. Would you want to go to work with that guy? Charlie could press charges but is choosing not to Dieter should be thankful that he may only lose his job.,RoversMorningGlory,cs7x173,2,t5_31h09
4303375,0,t1_csam6ha,Rover kinda came outright and said it even though it was against the deal.  I guess Charlie made a deal with management that they pay him more and Dieter gets to come back.,RoversMorningGlory,csapr81,2,t5_31h09
4309192,0,t1_csbd33c,Charlie can take it the same way he gives it out,RoversMorningGlory,csbdedg,3,t5_31h09
4342774,0,t1_csf4h44,Yeah that seems possible. The other idea I was leaning towards is make it similar to the format of Friday leftovers with discussing video clips or something. It seems like Charlie is the one submitting clips for it Friday leftovers.,RoversMorningGlory,csf5tr5,1,t5_31h09
4431171,0,t3_3bsr8p,Its just something hes done forever. Its more or less a tradition I guess.,RoversMorningGlory,csp8l20,2,t5_31h09
4467306,0,t3_3c7t3x,If someone walked in your restaurant wearing a conederate flag jacket that also says All Blacks should be Slaves would you still provide service?,RoversMorningGlory,csts36d,2,t5_31h09
4467833,0,t1_csts8uv,Kush just got plowedThats fineGlad the dog is well taken care of,RoversMorningGlory,cstugx3,4,t5_31h09
4497479,0,t1_csxk55s,ill give you  bucks to burn them in front of me. Can you make it to Port Clinton this afternoon? ,RoversMorningGlory,csxka78,7,t5_31h09
4505221,0,t3_3csazi,Obligatory cant wait til roverfest is over. So sick of hearing about it Is Andrew W. K.s music actually good? Any time Ive heard his music it comes off as boring and generic to me. ,RoversMorningGlory,csyj85h,2,t5_31h09
4513442,0,t3_3cva4h,I thought he said yesterday that it was back up,RoversMorningGlory,cszkdxe,1,t5_31h09
4543271,0,t1_ct2b3u6,I fully plan to bring my flask in with some vodka or something just to give all my beers an extra kick,RoversMorningGlory,ct3b1fv,1,t5_31h09
4558617,0,t3_3dhqi4,deleted,RoversMorningGlory,ct58d70,2,t5_31h09
4583130,0,t1_ct8ax32,Back up,RoversMorningGlory,ct8b05j,5,t5_31h09
4613469,0,t1_ctbzqzp,I havent been getting the autoreplies either. ,RoversMorningGlory,ctc3wm3,1,t5_31h09
4615017,0,t1_ctah4dz,The reality show doesnt look that good. Looks really corny. ,RoversMorningGlory,ctcawbo,1,t5_31h09
4650813,0,t3_3emhlq,The cast of Rovers Morning Glory isnt known for their compassion and empathy and so where being decent human beings is concerned its probably best to keep your expectations extremely low.,RoversMorningGlory,ctgsorq,3,t5_31h09
4742074,0,t1_cts9xzc,yeah but cant they do it after the show...RMG subscribers get screwed again,RoversMorningGlory,ctsa773,4,t5_31h09
4825638,0,t1_cu2t283,Thats what the emailer said. Im not a subscriber but yes I believe so.,RoversMorningGlory,cu2t7fr,1,t5_31h09
4852965,0,t1_cu639j7,Yes a shitty era.  Shes not going to last long if she cant do the producers job booking guest and also doesnt add ANYthing entertaining to the show.  Shell be back in promotions slinging Tshirts and bumperstickers at Autozone on Saturday mornings if she doesnt step up her game.  ,RoversMorningGlory,cu693gz,2,t5_31h09
4985676,0,t1_cumxt9j,They have to find the segment where the girl talked about kissing Hoppe.  Might not be ready til tomorrow.  Depends on how good Charlie is.,RoversMorningGlory,cumyife,1,t5_31h09
5000773,0,t1_cuoo10x,removed,RoversMorningGlory,cuos438,-1,t5_31h09
5013825,0,t3_3jkmw4,Someone needs to email the show about this.,RoversMorningGlory,cuqcsuf,1,t5_31h09
5047071,0,t1_cuubyt3,removed,RoversMorningGlory,cuud31v,2,t5_31h09
5050886,0,t1_cuuezjx,Oh hes ok?  Wow what a relief said Rover sarcastically.  Fucked up...,RoversMorningGlory,cuutna0,3,t5_31h09
5073409,0,t3_3kdyfq,To be honest the Thursday hookup is a terrible segment. I havent listened to it in years but I bet I could name all the questions. Creamer size why are you single back door action and some terrible variations of would you rather. If anything good actually happens you can catch the highlights. They say its one of the highest rated segments but I dont believe it. Its usually just mind numbingly dull. ,RoversMorningGlory,cuxjdd4,3,t5_31h09
5103923,0,t3_3kwz5k,Ya whats the scoop.  I thought the interview was boring and I changed the channel.   Did she get blasted by Rover for booking such a lame guest? ,RoversMorningGlory,cv17of9,1,t5_31h09
5104543,0,t1_cv14ib4,Nice what did he say about it? I havent started the replay yet.,RoversMorningGlory,cv1adcr,1,t5_31h09
5115609,0,t1_cv2kfdz,Bottom line is Rover does a lot of shady stuff to sell things to his audience.  He is the biggest salesman in radio and will do anything to get you to buy stuff.  Ive never seen a radio show that hypes things up so much to get people to buy.  Wait until the calendar comes out here shortly and all his shwag in time for the holidays.  They will pimp the crap out of it and say its the best stuff theyve ever had and of course it will sell out quickly so go to RoverRadio.com now.  Its the same crap every year.,RoversMorningGlory,cv2meru,0,t5_31h09
5117905,0,t1_cup6oux,thanks im trying to step it up,RoversMorningGlory,cv2wdm4,2,t5_31h09
5130556,0,t1_cu10s39,did you ever find the episode?,RoversMorningGlory,cv4fa0h,1,t5_31h09
5141303,0,t3_3lbna1,Those walls.... Thats the Cleveland courthouse right? He wore that to court? At least the shirt has buttons I guess. ,RoversMorningGlory,cv5pw4c,3,t5_31h09
5153422,0,t1_cv76599,Not saying that Nadzs issues with drugs and alcohol are fake.  By no stretch of the imagination.  I fully believe everything he said.  He has no reason to lie.However the cast is instructed in certain ways to speak and behave on the air.  One in particular is if they ever get in legal trouble for something they said or did online or if they ever get caught in their personal life not matching up with their persona on the radio they are instructed to say its all entertainment.  Therefore they arent lying to fans... or if it is some sort of legal action they can go to court and produce documentationrecords that its all entertainment and what they saiddid was a character not their real life.,RoversMorningGlory,cv76hbe,1,t5_31h09
5156781,0,t3_3lidjo,so rover and b are swinging with mitch and wifey right?,RoversMorningGlory,cv7l1xv,1,t5_31h09
5169355,0,t1_cv7wc7h,ShaCAWgoh.,RoversMorningGlory,cv93iuj,1,t5_31h09
5187086,0,t1_cvb7x1b,That happened to me when I tried signing up I tried again a couple days later and it worked. The whole website blows. ,RoversMorningGlory,cvb8fn5,1,t5_31h09
5233058,0,t1_cve9vza,removed,RoversMorningGlory,cvgrvgj,1,t5_31h09
5246955,1,t3_3mtz7f,What can we do to help Rover here?I dont want this to just go away. I want that fucking faggot Jason nailed to a god damn cross begging for forgiveness. Hes the worst kind of scum.,RoversMorningGlory,cvig3nm,-2,t5_31h09
5259063,0,t3_3mwi7n,Baby food and cheese on the doorstep... ?No clue what date that could have happened.,RoversMorningGlory,cvjwlmu,1,t5_31h09
5271827,0,t1_cvks79b,I havent listened for a week or  and reading what you just wrote makes me happy I stopped and reminds me why I dont mind if I miss the show anymore. I cant stand when he always says his opinion is the right one no matter what.,RoversMorningGlory,cvlja0j,1,t5_31h09
5328521,0,t1_cvsojtj,Im not talking about Oh he said he got a chicken burrito but it was really steak burrito.  Im talking major things... lifechanging sort of things.  A fib is different than a flat out fabricationfallacy.  When it comes to the fireworks... He has never been a partier.  He claims he is but he isnt... he never was.  Just like the threesomes with girls... he may have had one... never confirmed... but no where near the  or  he claims.When it comes to B someone called him out on it and he said You dont think after a year she may start to genuinely like me? And everyone on the phone and on the cast was like no there is no way she likes you for who you are.  He was steadfast in saying that B is with him for other things besides his money.,RoversMorningGlory,cvss35j,1,t5_31h09
5380722,0,t3_3opirr,I feel sick for Jeffery. I hope this isnt true about ME but it wouldnt surprise me if it is. Also as weird as that MLP porn is little boys will crank it to anything hahaha. ,RoversMorningGlory,cvzg4tn,3,t5_31h09
5435563,0,t1_cw6fzgt,Trust me the mods will agree with stuff like this. ,RoversMorningGlory,cw6g4lo,2,t5_31h09
5448495,0,t1_cw81i5e,removed,RoversMorningGlory,cw83j4t,2,t5_31h09
5482810,0,t1_cwcdqe4,I know that fuckers here. He has to be.  SKAT Just PM the mods already and well give you a cool custom name overlay like we have for automod gt PMJ and you can whore your stupid skatpack shit.,RoversMorningGlory,cwchag3,6,t5_31h09
5490960,0,t1_cwdegbo,nah me and my partner are the same way. spend all week together but often have random weekend plans that may or may not include each other. living together will do that. ,RoversMorningGlory,cwdis1h,1,t5_31h09
5495115,0,t1_cwd8y20,I cant wait to see.. Everyone has a skeleton.. lol,RoversMorningGlory,cwe1x39,1,t5_31h09
5522077,0,t1_cwh5fyg,Eww...,RoversMorningGlory,cwhhtz0,1,t5_31h09
5527918,0,t1_cwi8kjz,Maybe he owns a lot Apple stock?,RoversMorningGlory,cwi8nxf,1,t5_31h09
5530939,0,t1_cwi8mo2,Loved it when JLR was trying to defend himself when they accused him of hanging out by the sales girls during the breaks.  As he was talking into the mic Charle and Nadz were both massaging their MLP penises and putting them in JLRs face. Funny stuff.,RoversMorningGlory,cwimjpk,2,t5_31h09
5579316,0,t1_cwogvut,The iheart radio app is free..,RoversMorningGlory,cwonziy,2,t5_31h09
5598405,0,t1_cwqmw13,Yes they key is ROVERs DNA.  So you want the DNA of a nonathletic chubby bald red headed pale introverted knowitall with a speech impediment and droopy eye to be passed onto your child?  That literally goes against EVERYTHING that Darwin evolution and social sciences has taught us.That was kind of mean.,RoversMorningGlory,cwr1aft,4,t5_31h09
5630174,0,t1_cwuxi9l,wouldnt be the first or fifth time hes cancelled over a stupid cat.,RoversMorningGlory,cwuz66j,10,t5_31h09
5641811,0,t3_3scr6y,They first started filming over a year ago.  Theres no way it should take this long to put out a few episodes.  I have a feeling the production company had a few episodes ready Rover watched some of it didnt like it and decided to scrap it.  He mentioned last week that they were going to start filming again soon so I bet they are just going to start over with it.  I bet it wont be out til nd quarter of next year.,RoversMorningGlory,cwwf5xu,2,t5_31h09
5642148,0,t1_cwwgmxj,Yeah a caller tells him hes a jerk and Rover denies it and then immediately goes into attacking Nadz...come on.,RoversMorningGlory,cwwgo5q,6,t5_31h09
5683503,0,t3_3sv4w0,Its awesome ,RoversMorningGlory,cx1le98,1,t5_31h09
5684587,0,t3_3sq4bj,Howard Stern made fun of challenged people. He just did it better ,RoversMorningGlory,cx1q80o,2,t5_31h09
5699332,0,t1_cx3jtba,All sports talk radio? Theyre not really the same format.,RoversMorningGlory,cx3k2lq,1,t5_31h09
5716608,0,t1_cx5og0z,Plus Duji gets life insurance money? Why?Oh to support their child probably. ,RoversMorningGlory,cx5p952,4,t5_31h09
5793705,0,t1_cxf6zny,That is definitely not Andrea Vecchio,RoversMorningGlory,cxf9icx,3,t5_31h09
5810995,0,t1_cxa641s,Once he marries her there is no way she will keep being his slave its all an act to get him to marry her,RoversMorningGlory,cxheqkq,1,t5_31h09
5834110,0,t1_cxkc0ob,Im sorry sometimes I forget its an actual person on the other end of the screen. I hope you the best of luck. ,RoversMorningGlory,cxkdn7t,1,t5_31h09
5834256,0,t1_cxkcotj,I have a few tricks up my sleeve. I just hope they dont crash and burn!,RoversMorningGlory,cxkec0u,2,t5_31h09
5838270,0,t3_3uv9ir,Okay why is no one else noticing that he looks just like the pirate in the movie Dodgeball? At the end when he showed up in normal clothes?I feel like Im taking crazy pills..,RoversMorningGlory,cxkxa5n,1,t5_31h09
5839582,0,t3_3v4ntb,My skin is starting to crawl every time Rover says Moooslims,RoversMorningGlory,cxl3gxr,4,t5_31h09
5848036,0,t3_3v9nos,RMG theoryRover knows B is a gold digger and they have an understanding about their relationship. This is why Rover will never tell B he loves her you dont tell your ho you love her she is there for a fair exchange of household chores and rover buying her expensive gifts. This is also why B never says anything about Duji at the end of the day Rover can do what he wants as long as he is still showering B with whatever she wants. Rover didnt really propose to B in Paris he just can never let go of his shock jock past and said that on air to have a big surprise when he came back.,RoversMorningGlory,cxm7f64,0,t5_31h09
5862526,0,t1_cxo0myn,I must have struck a nerve. So youre clearly noticing that every time the ban comes up or you delete a post people complain yet you continue to do it. I dont give this subreddit long unless the leadership changes.Also to be clear I like this subreddit. I simply dont like you or your leadership style. ,RoversMorningGlory,cxo3vgk,1,t5_31h09
5865273,0,t1_cxogsqd,hes not gone...  Look at this fucking PM. The dude  knows exactly what hes doing. ,RoversMorningGlory,cxogv0d,1,t5_31h09
5916870,0,t3_3wd1wl,The Great TriCaster Fiasco. What happened with that? Is the TriCaster guy still there working with Anthony?,RoversMorningGlory,cxv8edw,5,t5_31h09
5921337,0,t3_3wffa9,Ive never really listened for Rover. His always being right got old pretty quick. He knows what hes doing in the radio and business sense and knows how to surround himself with good people. But he is one of the best interviewers out there.,RoversMorningGlory,cxvthdp,4,t5_31h09
5921593,0,t3_3wffa9,I listen for everyone except him and Duji. His show is just lazy now. They do no show prep at all. The Thursday hookup is a disaster the Shizzy is old etc. His constant bragging about being the best is hilarious because the sports station does really well and people listen to WTAM and . too.,RoversMorningGlory,cxvuoun,6,t5_31h09
5922595,0,t1_cxvz2r9,i guess.. what ever floats your boat,RoversMorningGlory,cxvzeyr,-5,t5_31h09
5923063,0,t3_3wffa9,I feel like when dumb and rob on the show he was a lot different. Am I wrong on this? Just seems like he has changed the last year or so ,RoversMorningGlory,cxw1mi6,5,t5_31h09
5963987,0,t1_cy1crq7,So you think his best radio days are behind him?,RoversMorningGlory,cy1er5p,3,t5_31h09
6087010,0,t3_3yom9a,removed,RoversMorningGlory,cyhhhvx,1,t5_31h09
6105231,0,t3_3z2s2t,It appears that Amanda Berry made an appearance at...RRoverfest.  What the fuck is Roverfest?  Over to you Kristen.Thanks Leon unfortunately we could not finish taping this interview soon after we arrived in studio the Cleveland shock jock had me seated on a feces encrusted couch and began asking me questions about anal.,RoversMorningGlory,cyjlp46,8,t5_31h09
6123702,0,t3_3zfpxu,This is a project Ive been working on during the break. If you check it out let me know what you think. Also leave a message! I posted the link in the title but here is a another link,RoversMorningGlory,cylp95j,1,t5_31h09
6124907,0,t1_cylkyjk,His girlfriend sounds like a money grubber always taking his money and stuff. Last week Rover talked about never getting married and I dont blame him with a girl like that. Id never marry her either.,RoversMorningGlory,cylu6n4,3,t5_31h09
6143632,0,t3_3zpcqi,Rover and Duji were discussing them fighting when they were in a relationship... Duji said they didnt fight and Rover said yes they did then Duji said... for the show we did.Was that her admitting its not  reality?,RoversMorningGlory,cynyswd,3,t5_31h09
6147094,0,t3_3zpq0c,Thank you! This show is a great way to focus on something other than my mundane work...and it works. I dont care if all of it is fake I love a lot about it either way.,RoversMorningGlory,cyocz4t,2,t5_31h09
6230943,0,t1_cyxuxp8,Love Harry Potter.  Pregnancy hormones confirmed been crying all morning. ,RoversMorningGlory,cyxw206,0,t5_31h09
6264177,1,t3_416n6j,I think nomorewhitegirl was just saying what everyone has been thinking.. Only difference is he or she put it in writing... No matter the age you can still tell if that person is cute or not.,RoversMorningGlory,cz1o0u3,2,t5_31h09
6295715,0,t1_cz0jiij,The show is beyond saving. We need a fresh new morning show in Cleveland. Let me know when to turn off the Snooze button. ,RoversMorningGlory,cz592al,0,t5_31h09
6296042,0,t1_cz58sy7,Also had the horrific story of being molested at  and raped at !,RoversMorningGlory,cz5aefm,3,t5_31h09
6320092,0,t1_cz7ov7o,I dont think you have to be the father to be pissed that a little girl you have watched grow up from birth was raped..,RoversMorningGlory,cz80wod,12,t5_31h09
6370753,0,t1_czdrrpm,Fuck Cervantas,RoversMorningGlory,czds90k,5,t5_31h09
6373190,0,t1_czdx9do,gt and shes a little crazy A little? gt She wouldnt give Rover the time of day. I wouldnt give that cunt the time of day either shed probably try to wear my watch then throw shit out of my car.,RoversMorningGlory,cze286i,0,t5_31h09
6382916,0,t1_czf54a6,oh his real name is hadz? ,RoversMorningGlory,czf63dt,1,t5_31h09
6435502,0,t3_43trgp,Where would you hide a dead body gee lets see if they give the same answers they did last time they had this discussion,RoversMorningGlory,czkyw4v,3,t5_31h09
6439140,0,t1_czlbxe0,Wow I must have missed some shows. And I didnt know she dry humping JLR either.  No wonder she quit!,RoversMorningGlory,czlcgfc,2,t5_31h09
6451634,0,t1_czmm2ye,Tell me what is the actual reason my shit was deleted?,RoversMorningGlory,czmn26b,2,t5_31h09
6461734,0,t3_444tdq,I believe that JLR is actually gay. How come he wasnt able to get it up dry humping Kaitlin watching VR porn or the first time he watched porn in Rochester? Could he be trying to hide what actually turns him on? Duji mentioned that JLRs unit started to show some life when the news guy or whatever walked in and JLR was cranking it behind him.Also JLR always tries so hard to not do anything that could be perceived as gay going so far as to request a female to wax his ass. Could he be overcompensating for something?Probably not but its fun to speculate regardless.,RoversMorningGlory,cznoqdj,9,t5_31h09
6474824,0,t1_czmr5a9,you must not listen to the show rover doesnt have money. he is a normal guy and NOT rich. hes just a great negotiator. thats how he got that  boat.,RoversMorningGlory,czp1k8k,2,t5_31h09
6478849,0,t1_czpadwu,Persistence breaks down resistance,RoversMorningGlory,czpgl2i,1,t5_31h09
6516932,0,t1_czte0sd,Totally agree. He was correct on this.,RoversMorningGlory,cztegns,1,t5_31h09
6517330,0,t3_44w68d,Is Beyonce on crack? This song makes no sense.,RoversMorningGlory,cztfxzv,-5,t5_31h09
6524266,0,t1_czu4mfc,the audio only is up it sounds like they were having all kinds of problems with the live streams.  Im guessing that is what is causing the delay.Theres a vid segment that I am really interested in seeing too,RoversMorningGlory,czu5t0m,2,t5_31h09
6541046,0,t3_4589pw,This isnt technically Thursdays show but Im listening to the replay from Wednesday before Thursdays show starts because I missed Wednesdays and I have a question. How can Duji get away with throwing that marker at Rovers face?  If I recall correctly on the Disney trip Dumb pushed Rob and Duji was on a tirade about suspendingfiring Dumb for pushing Rob.  Now I know that Duji didnt like Dumb so every opportunity that showed itself Duji would hone in on it.  Deiter got suspended for pushing Charlie over the summer also.Now Duji throws a marker at Rovers face with video evidence and witness testimony and she is proud of it. Are there going to be no repercussions?  I know it may currently be too soon to tell but wouldnt people agree there should be some consequence?,RoversMorningGlory,czvwb3c,7,t5_31h09
