,controversiality,parent_id,body,subreddit,id,score,subreddit_id
275157,0,t1_cf995mm,Bill.. ,scottishproblems,cf9a6e6,4,t5_2v2w4
2795362,0,t3_2s0l71,Reporters do this all the time. They also get caught out all the time. P,scottishproblems,cnltlw2,8,t5_2v2w4
4513722,0,t3_3ctxoe,and then when its done you try to watch Chewin the fat. But its not the same. ,scottishproblems,cszlnak,2,t5_2v2w4
5715459,0,t1_cx5jzjq,Leave it up to the younger crowd ahm off tae the pub!,scottishproblems,cx5k418,2,t5_2v2w4
7016317,0,t3_4bqsoz,Your voice is horrible pal like a shrieking cat been flung at a wall,scottishproblems,d1bnbqf,11,t5_2v2w4
