,controversiality,parent_id,body,subreddit,id,score,subreddit_id
541230,0,t1_cg1r13n,Wow this is awesome! Thanks for contributing it!,LeagueConnect,cg1sltg,1,t5_30v2b
554048,0,t3_20goef,As i mentioned in my post some days ago Ice and Fire would be the best for  teams I think...,LeagueConnect,cg392ve,1,t5_30v2b
603638,0,t3_2101ur,NA Eastern Stand Time mostly at night and during the weekends. ,LeagueConnect,cg8vy31,1,t5_30v2b
666082,0,t1_cgfz4xc,Oh coolio I was wondering why so many people spoke with emotes lel. I like it here. I feel like wikibot filling people in on histroy and terms and stuff.,LeagueConnect,cgfze0a,1,t5_30v2b
689243,0,t3_221tzn,I love skins!! But I also hate having to buy them so I try not. Most of the skins I have because friends gifted them to me and if I paid money it was probably to gift my friends skins. I was a total sucker for the mystery gift and limited edition skins from Christmas. I really want to get more. You should post about the free skin thing as a separate thread! Thats really good to know!,LeagueConnect,cgim9zq,1,t5_30v2b
801170,0,t1_cgvc9wz,Hi I assume so! ukikithewitch is in charge of the LCFrost but I hope theyll be on!,LeagueConnect,cgvch4r,1,t5_30v2b
1102739,0,t3_26j7hc,Heim for sure. Simply because I can never really do anything in lane against him. Its annoying to use most of my mana just destroying the stupid mini turrets and sitting on my ass under tower while he pushes and isnt a safe gank. So lane phase heim is feared simply due to annoyance!!!,LeagueConnect,chtmyrh,0,t5_30v2b
1371753,0,t3_29s6ku,Wanted to be your adc then saw you were in plat.  Im not good enough for that yet.,LeagueConnect,cio8k58,1,t5_30v2b
1509328,0,t3_2bho6d,Hey dude i havent entered ranked yet but im  games in an main support im around same age and will add u later! Ign imflippingcrap ,LeagueConnect,cj5gx75,1,t5_30v2b
1655911,0,t3_2dbetd,hi! Id be up for it I could make a low level account to join you so were not matched against ranked people haha,LeagueConnect,cjnw301,1,t5_30v2b
1805537,0,t3_2ex100,deleted,LeagueConnect,ck6qe3k,1,t5_30v2b
2000613,0,t3_2hlui2,I added you summoner name ThatOneGuy,LeagueConnect,cku9ujd,2,t5_30v2b
2022778,0,t3_2hv9si,MY IGN is tankwilly im always looking to play with new people as long as they dont rage P ,LeagueConnect,ckwxwer,1,t5_30v2b
2140347,0,t3_2je5fl,My ign is supaman. Im always up for chill games.,LeagueConnect,clbvvyi,1,t5_30v2b
2147987,0,t3_2j908d,What is IGN im a pure noob level  need someone to help me learn the basics and have fun  m NA Canada eh id GoldenLionIVEDIT added username,LeagueConnect,clcuwdp,1,t5_30v2b
2164995,0,t1_clezn1k,deleted,LeagueConnect,clf0rhm,1,t5_30v2b
2173136,0,t3_2jhhy9,ill play D IGN xxdaverdxxalso is your name from one piece ?,LeagueConnect,clg234h,1,t5_30v2b
2299789,0,t3_2lgy2b,I cant turn down someone with that IGN. Hope to play with you. Sincerely EndangeredKoala,LeagueConnect,clvyxz7,1,t5_30v2b
2588466,0,t3_2pfefg,If you have money to burn I say do it. I moved to China last year and had to level up a whole new account. Was fucking horrible and the fact that I had none of the characters I was used too and their system is different for purchasing made it a big hassle.If I was able to transfer my account from NA to China and back would of done that in a heartbeat.,LeagueConnect,cmwg74r,1,t5_30v2b
2618016,0,t3_2pv0ku,deleted,LeagueConnect,cn0ba61,0,t5_30v2b
2623723,0,t3_2pvmqn,deleted,LeagueConnect,cn1234j,1,t5_30v2b
2682852,0,t3_2qpuuo,IGN Code Gold.,LeagueConnect,cn8rp25,1,t5_30v2b
2704404,0,t3_2r1c3x,On EUW. Forgot to put that,LeagueConnect,cnbhb34,1,t5_30v2b
2729958,0,t3_2r8uxg,My IGN is iWrecktum. I can play every role decent but I prefer mid. My main goal is to have fun but I will tryhard when its needed lol. Feel free to add me Im available almost every day. ,LeagueConnect,cneduw2,1,t5_30v2b
2774136,0,t3_2rufaz,You should check out konvictgaming.com we are a gaming community with over  active league players. We have a mentor system hosts weekly tournaments and inhouses. Hosts our own unlimited teamspeak and have a website. We have been around for  years and have around  k members total.Want to know more? Check the site out or pm me!,LeagueConnect,cnjepva,1,t5_30v2b
2833411,0,t3_2s8qyc,IGN ExpanicHDill add u too. Primarily play normals cuz i hate ranked for some unknown reason Land i do play with a couple of friends. join anytime.,LeagueConnect,cnq5kex,1,t5_30v2b
2878975,0,t3_2t3cfn,Konvictgaming.com is your answer friendWe actually have over  people online right now just for league that play EUwesthop on ts.konvictgaming.com to talk with us more ,LeagueConnect,cnvcaqy,2,t5_30v2b
2923538,0,t3_2tlk7o,Check out konvictgaming.com we are a community with over  active league players a day. We host our own teamspeak. We offer a free mentor system and host daily inhouse games. We also do event with RP prizes. Join in on the fun!Check out the site or pm me for more info!,LeagueConnect,co0eyq2,1,t5_30v2b
3076096,0,t3_2vdhw6,IGN UnlimitedBias,LeagueConnect,cogu2vs,1,t5_30v2b
3152294,0,t3_2vhnly,hola in bronze  lol  my ign is GamingFreek,LeagueConnect,cooqe97,1,t5_30v2b
3192256,0,t3_2wos9a,Im Silver III atm but I consider myself a pretty good ADC. IGN Praecursor.,LeagueConnect,cosvl9d,1,t5_30v2b
3201281,0,t3_2wjfzw,Hello there  Im not high rank as you are. But if you want to play I send you a invite. My name is To Seek.,LeagueConnect,cott915,1,t5_30v2b
3303833,0,t3_2xr3pk,added bighitbandit,LeagueConnect,cp4v3ik,1,t5_30v2b
3335458,0,t3_2yc1p4,What role to you play?,LeagueConnect,cp8guw9,1,t5_30v2b
3389525,0,t3_2yfrqc,M GER IGN ATS Theseus. Feel free to add me and invite me to whatever gamemode when you see Im online,LeagueConnect,cpemsez,1,t5_30v2b
3449118,0,t3_2zqq5o,Come intlgaming.com cya,LeagueConnect,cplfc9k,-1,t5_30v2b
3497467,0,t3_30a5wd,mostly shaco hmu im only silver cuz i only play shacotroll ranked was plat last  seasons can play any role,LeagueConnect,cpqxqa7,1,t5_30v2b
3671577,0,t3_32fr26,Hi! If youre looking for people to play with join us at The Chaos Vanguard.Essentially the Chaos Vanguard CV is a multigaming community for Europe and NA that aims to provide a fun and safe environment for players. We have a large website and teamspeak and we try to host daily events for you to be able to play with people such as aram inhouses hide and seek defend soraka bot etc. Obviously we play normal games as well  Weve also got tournaments with giveaways as well as organized ranked teams. If you ever get bored of league you could just jump down to one of our different sections for games such as counter strike heroes of the storm warframe and smite. Competitive teams also get their own channels on our teamspeak.If you have questions you can add me ingame CV AyakooYou can find us atWebsite  TeamSpeak ts.thechaosvanguard.co.uk,LeagueConnect,cqas80d,2,t5_30v2b
3690457,0,t3_32fvru,Ditto Ill play! Goose,LeagueConnect,cqcxptu,1,t5_30v2b
3708843,0,t3_32vk3t,deleted,LeagueConnect,cqf17uc,1,t5_30v2b
3796810,0,t3_33w61e,I dont usually have people around to play with stressfree so Id really like to play with youwhatever group youre in. If theres still room on your friends list feel free to add me. mNA summ name Minamimoto Sho,LeagueConnect,cqp2ekj,0,t5_30v2b
3870085,0,t3_34rg19,At first glance I thought you were saying you were a  year old male. ,LeagueConnect,cqxf98y,2,t5_30v2b
3904221,0,t3_354xq5,deleted,LeagueConnect,cr1bcp9,1,t5_30v2b
3923899,0,t3_35ds93,I added you I was also put in bronze IV and made it to silver II. looking to get to gold asap. ADC main can sup and jg.,LeagueConnect,cr3k6pb,1,t5_30v2b
3939035,0,t3_32rvw2,add meeeees ign Fizzinsidemyashe,LeagueConnect,cr5a8et,1,t5_30v2b
3947673,0,t3_35jsye,Well I have Netflix and play mostly normals and Aram games so feel free to add me  IGN HybridWolf,LeagueConnect,cr69p1s,1,t5_30v2b
3951714,0,t3_35ol0e,add meeee ign fizzinsidemyashe,LeagueConnect,cr6q9i0,1,t5_30v2b
3986180,0,t3_363s15,add me IGN Jinenken,LeagueConnect,cranrqm,1,t5_30v2b
4022897,0,t3_36jx99,Hikorro add mee  m NA,LeagueConnect,creu9t4,1,t5_30v2b
4048993,0,t3_36thf9,IGN  x coast x,LeagueConnect,crhtej5,1,t5_30v2b
4058140,0,t3_371g9f,NA? Im Smurfing in the silvergold areas rn add wrath of okala,LeagueConnect,criuwly,1,t5_30v2b
4059658,0,t3_371g9f,Voice.gameservers.comStop by always friendly people to duo with,LeagueConnect,crj14t7,1,t5_30v2b
4068472,0,t3_37401u,deleted,LeagueConnect,crk18lm,1,t5_30v2b
4081911,0,t3_37aohq,I play a lot of adc and Im always looking to learn more about support.Onimeno Regal,LeagueConnect,crlkaox,2,t5_30v2b
4095086,0,t3_37ao2p,IGN xSqwishyx,LeagueConnect,crn2cxu,1,t5_30v2b
4098975,0,t3_37aqjs,Hey SupFox! Have you ever considered joining a community? If youre looking for people to play with I highly recommend the Chaos Vanguard.The Chaos Vanguard CV is a multigaming community for Europe and NA that aims to provide a fun and safe environment for players. The EUW section of our community for League is highly populated where theres always friendly members to play with and many members looking to climb the ladder like yourself. We have a large website and teamspeak and we try to host daily events for you to be able to play with other members such as inhouse ARAMsSR hide and seek defend Soraka bot etc. We also host tournaments with giveaways and organised ranked teams.Since we are a multigaming community you arent obligated to just play League  if you ever get bored or fancy a change youre more than welcome to take part in any other games such as Counter Strike Heroes of the Storm Warframe and Smite plus many more. If youre interested in ranked there are dedicated channels on our teamspeak for Duo Queues where you cant be disturbed and can focus on getting that win!If youre interested you can add me IGN Uhh respond to me on here visit our website or join our friendly teamspeak server where you can ask more questions.Much love McZanderson.You can find us atWebsite  TeamSpeak ts.thechaosvanguard.co.uk,LeagueConnect,crnib62,1,t5_30v2b
4115108,0,t3_37rub5,eeh fuck it i guess i could try a duo or two if you want. currently a Dia  LP supp main.Add me ingame if you want to ratsauce,LeagueConnect,crpcjn9,1,t5_30v2b
4191754,0,t1_cry1s93,deleted,LeagueConnect,cry24sd,1,t5_30v2b
4217097,0,t3_392e56,If you want you can add me also. I mained ADC also. ING mdigruber,LeagueConnect,cs0xkxh,1,t5_30v2b
4222032,0,t3_3990h5,Ign  shallow soulLooking to play with people who have a higher mmr and mindset. Feel free to add can kick knowledge back and forth on the game and hopefully learn something new .,LeagueConnect,cs1hpv5,1,t5_30v2b
4230401,0,t3_39ci7t,deleted,LeagueConnect,cs2g6so,1,t5_30v2b
4239714,0,t1_cs36196,Add me Ign Deewizard Im also lvl  and as good as a silver,LeagueConnect,cs3ipbz,1,t5_30v2b
4259610,0,t3_39qnuw,IGN Rynxus added you up.,LeagueConnect,cs5ryyd,1,t5_30v2b
4318429,0,t3_39de9e,Hey whats Up. My IGN is Savz. Im a really laid back and chill Leagueer. Ive been playing for a while and my rank is G. I ususally Play Mid Jungle or ADC. But Im definitely down to play norms or ranked.. But Im at work atm so I cant add ya.,LeagueConnect,csceyit,1,t5_30v2b
4330142,0,t3_3a52ey,what the fuck is wrong with you. have some self respect.,LeagueConnect,csdqiim,1,t5_30v2b
4356976,0,t3_3awbnm,Master Lord Pandarius,LeagueConnect,csgrj14,0,t5_30v2b
4413024,0,t3_3bfnmb,IGN MiguelOwns,LeagueConnect,csn2zd4,1,t5_30v2b
4413645,0,t1_csm9lpc,Added,LeagueConnect,csn5i5d,1,t5_30v2b
4433226,0,t3_3btq1r,deleted,LeagueConnect,csphvar,1,t5_30v2b
4443487,0,t1_csqlbyd,deleted,LeagueConnect,csqscqt,1,t5_30v2b
4448904,0,t3_3c0sm7,added ign pookiebear ,LeagueConnect,csrgxgz,1,t5_30v2b
4453522,0,t3_3c41k1,I added you Im bronze though not sure what level you are looking to coach.  Ive been playing for a year and a half and I watch videos and follow the pro games but I seem to be missing something.  I feel like I have a whole somewhere in my playing maybe you can help,LeagueConnect,css1tfz,1,t5_30v2b
4481310,0,t3_3cewc9,.,LeagueConnect,csvjb4n,1,t5_30v2b
4504883,0,t3_3cmj40,hyphy o,LeagueConnect,csyhp6w,1,t5_30v2b
4513747,0,t3_3cwf7k,I am online euw?,LeagueConnect,cszlrct,1,t5_30v2b
4578352,0,t3_3dei64,hi my IGN is Iceyhackr. this season i have not played ranked but was placed in silver. im looking to play any mode. add me!,LeagueConnect,ct7pgmo,1,t5_30v2b
4580947,0,t3_3dorf5,Thanks for the replies I will send out requests if you guys havent yet. Thanks!,LeagueConnect,ct815lm,1,t5_30v2b
4595152,0,t3_3dy3dy,I was gold last season and currently Silver  after not playing that much this season.. I main ADC and Top but Im decent in all roles Id say! My ranking may be a little too low for you lol but Id love to play if you want!,LeagueConnect,ct9t70e,1,t5_30v2b
4675750,0,t3_3edlq0,I can  help  you  if you  want  too,LeagueConnect,ctjxfb9,1,t5_30v2b
4680834,0,t1_ctk1t4l,addmeh ,LeagueConnect,ctkke1a,1,t5_30v2b
4690854,0,t1_ctlsix4,Dunnodont really like gaming communitiesmore like a lone warriorbut thanks for the offer.,LeagueConnect,ctltp3i,1,t5_30v2b
4752485,0,t1_ctst974,deleted,LeagueConnect,cttlgke,1,t5_30v2b
4811729,0,t3_3gs60c,IGN ZezIam,LeagueConnect,cu12445,1,t5_30v2b
4831381,0,t1_cu1mn28,added,LeagueConnect,cu3ja8v,1,t5_30v2b
4850590,0,t3_3haktm,I can play some games not today though tomorrow. Im Pimpossibly on EUW,LeagueConnect,cu5yb6q,1,t5_30v2b
4894314,0,t3_3hwzl4,hey! add me on ign LmpLing,LeagueConnect,cubguan,1,t5_30v2b
4937840,0,t3_3ijecf,Oh Im a yr old female maybe we can play sometime! IGNcruelalec dont worry Im using my brothers account he gave it to me when he went to college .,LeagueConnect,cugyd4h,1,t5_30v2b
4964893,0,t3_3ilmg2,Hey! If youre looking for people to play with and you are over  I recommend joining a community called the Chaos Vanguard.Essentially the Chaos Vanguard CV is a multigaming community for Europe and NA that aims to provide a fun and safe environment for players. We have recently expanded to EUNE.We have a large website and teamspeak. Competitive teams also get their own channels on our teamspeak. Also we have separate channels for people who duoQ so they wont be disturbed in the middle of the match!If you ever get bored of league you could just jump down to one of our different sections for games such as Counter Strike Heroes of the Storm Warframe Smite and many more. Good luck with your search!You can find us atWebsite TeamSpeak ts.thechaosvanguard.co.uk,LeagueConnect,cukd3e1,1,t5_30v2b
4967037,0,t3_3iwi9r,cool name,LeagueConnect,cukmslf,1,t5_30v2b
4972752,0,t3_3j0y2u,I just added you im down to play rn ,LeagueConnect,culcp4e,1,t5_30v2b
4972837,0,t3_3j0mv7,deleted,LeagueConnect,culd30h,-3,t5_30v2b
5010961,0,t1_cuq07nr,Alrighty! Currently in a game. Will add you after. C,LeagueConnect,cuq0dy2,1,t5_30v2b
5040735,0,t3_3jx3y9,IGN PanAchy,LeagueConnect,cutllgx,1,t5_30v2b
5052783,0,t3_3k4gt4,Hey Im currently G...i play support mainly...add me IGN Bubblecakes,LeagueConnect,cuv1vqv,1,t5_30v2b
5106248,0,t3_3kvb2b,Ign Karma Mechanics,LeagueConnect,cv1hs7v,1,t5_30v2b
5112998,0,t3_3kylsw,Why not come check us out.  You can also add me Ingame if you have any questions! IGN CA xStacke,LeagueConnect,cv2b2t1,-1,t5_30v2b
5159131,0,t3_3lmmqf,IGN Murkasaurus   I reached Diamond V last season. And this season i got demoted from not playing games. if you would like to duo ,LeagueConnect,cv7v89l,1,t5_30v2b
5177505,0,t1_cva0men,deleted,LeagueConnect,cva2v0f,1,t5_30v2b
5177520,0,t3_3lv6ec,Friend request sent c,LeagueConnect,cva2xck,1,t5_30v2b
5213165,0,t1_cvdj6ae,added ya P,LeagueConnect,cvedo7l,1,t5_30v2b
5219471,0,t3_3mfnz6,Been playing with the same group of folks for a few years now feel free to add Duraken on NA! ,LeagueConnect,cvf4znz,1,t5_30v2b
5222764,0,t3_3mfcl5,xMeijin Plat .,LeagueConnect,cvfj9ny,1,t5_30v2b
5230135,0,t3_3mjwyw,ign titytots G smurf looking for casual duo partner,LeagueConnect,cvgf7v3,1,t5_30v2b
5235685,0,t3_3mmzq6,I got a decent group of guys who dont mind low level players we busy Eachothers balls a bit but its all in fun add Duraken on NA if youre interested!,LeagueConnect,cvh39f4,1,t5_30v2b
5251888,0,t1_cvj105k,Yea just add me and ill accept when im home c,LeagueConnect,cvj1hvt,1,t5_30v2b
5261471,0,t3_3n2emc,Omg im so tired ive become dumb.username is theasianguy,LeagueConnect,cvk7m2p,1,t5_30v2b
5278060,0,t3_3mylrj,Im undecided X G midadc main but make a mean support i think...always room for improvement lolIGN  Jumberi,LeagueConnect,cvmbzt2,1,t5_30v2b
5285410,0,t1_cvn9cdz,i did add u ingame ,LeagueConnect,cvn9u5a,1,t5_30v2b
5292049,0,t1_cvnwe78,at what times do yuo usually play?,LeagueConnect,cvo4d74,1,t5_30v2b
5297091,0,t3_3nf7c6,Im plat  and want to get to diamond as well.Ign joipoi,LeagueConnect,cvoriuc,1,t5_30v2b
5307033,0,t3_3noqpt,raida Aru,LeagueConnect,cvq19p0,1,t5_30v2b
5338578,0,t1_cvtiot6,Lol u were in my friend list we played a v Annie vs Azir for fun u lost and then removed me ,LeagueConnect,cvu2944,1,t5_30v2b
5342121,0,t3_3o63m8,all added,LeagueConnect,cvuijko,1,t5_30v2b
5378639,0,t3_3okpdt,As always double the comments on any post that belongs to a girl... Anyway on Sunday me and some of the other girls who are all part of the gaming community Cerberus Assault will have a girls night. With gaming and talk together on teamspeak no males allowed! Wanna come say hi then add me. IGN CA Aniqua,LeagueConnect,cvz6jqk,0,t5_30v2b
5417828,0,t3_3p82ti,sent u a fr,LeagueConnect,cw46ozt,1,t5_30v2b
5436002,0,t3_3pg2fm,TheRubyEmperor ,LeagueConnect,cw6i542,1,t5_30v2b
5456553,0,t3_3pqxnq,Mr Dinsmore,LeagueConnect,cw94k1o,1,t5_30v2b
5465843,0,t3_3p99g9,Old post but it looks like you havent had much luck yet.MGold IVADC MainIGN Rudeby,LeagueConnect,cwaba4c,1,t5_30v2b
5488434,0,t1_cwd6z7v,deleted,LeagueConnect,cwd74xt,1,t5_30v2b
5504215,0,t3_3qfy77,Add me . ign Genetrixe,LeagueConnect,cwf7qw6,1,t5_30v2b
5532004,0,t3_3q9mcb,deleted,LeagueConnect,cwirfub,1,t5_30v2b
5539933,0,t3_3qxkbu,ign xpvtxpiercex,LeagueConnect,cwjrwq1,1,t5_30v2b
5547980,0,t3_3r3czl,Hey!  Check out The Chaos Vanguard...weve got lots of folks who love to play all the different gameplays D ,LeagueConnect,cwks0uo,1,t5_30v2b
5562320,0,t3_3r751r,IGN mortrend. they call me grape,LeagueConnect,cwmk1ef,1,t5_30v2b
5597005,0,t3_3qpxvk,kiwi dude in netherlands IGN WomboWarior,LeagueConnect,cwqv19q,1,t5_30v2b
5653122,0,t1_cwxgkkl,I see London I see France I see a cat disguised as a cake. Also you decline my invites all the time. xD,LeagueConnect,cwxtpqa,1,t5_30v2b
5673384,0,t3_3slx8t,King silver mUS. I play with a group of a few people and we use Teamspeak. We do Arams and normals regularly Feel free to add me if you wanna know more.,LeagueConnect,cx0c89q,1,t5_30v2b
5760417,0,t3_3u0dbm,I did one on Sunday for all ELOs hosted by Peak Gaming. You can find similar events here ,LeagueConnect,cxb4tii,1,t5_30v2b
5802886,0,t1_cxg19cx,No and our sincere apologies. We have removed the post as we do not allow threads only aimed towards the opposite gender. Im sorry and hope our sub will be to your liking for finding friends. ,LeagueConnect,cxgeis0,-1,t5_30v2b
5853270,0,t1_cxmeznn,Accepted ,LeagueConnect,cxmw47k,1,t5_30v2b
5855956,0,t1_cxn892o,it can be a gold player,LeagueConnect,cxn8suj,1,t5_30v2b
5860169,0,t3_3vd87i,Hey! My ign is Chimes and Meeps if you would like to add me!,LeagueConnect,cxnsq2m,1,t5_30v2b
5862770,0,t3_3vj10b,MasterSnipes is my name D Usually a very aggressive adc,LeagueConnect,cxo5118,1,t5_30v2b
5898801,0,t3_3vzo46,Plat  bot lane main I have a couple smurf we could play on sometime. IGNLnfernal Alistar,LeagueConnect,cxsv7ex,1,t5_30v2b
5911097,0,t3_3w7t3s,hey if you want i would like to play with you but i have a lot of work. also since its christmas i will be spending time with my family but i try to play almost every day. last season i was rank plat IGN Newmy Write back here if you are interested ,LeagueConnect,cxuh78p,1,t5_30v2b
5925098,0,t3_3w5ipm,Plat  here! IGN Mars Djinn  I may slip into Korean as well haha,LeagueConnect,cxwb7xy,1,t5_30v2b
5925978,0,t3_3wid17,EarlyFinger  pretty high elo considered i got out of bronze!,LeagueConnect,cxwfdhe,1,t5_30v2b
5930239,0,t3_3wjb4m,IGN is JediMasterWoody I mainly play a lot of jungle.,LeagueConnect,cxwzhm5,1,t5_30v2b
5942184,0,t3_3wrh2h,ign silentslayer,LeagueConnect,cxyjtjb,-1,t5_30v2b
5980647,0,t3_3xc7nr,Ign TKC Blitz im S and really bored i need ppl to play with.,LeagueConnect,cy3leli,1,t5_30v2b
5985202,0,t1_cy399v2,mooo,LeagueConnect,cy46whh,1,t5_30v2b
5985622,0,t3_3xfk1c,Uh sure Toronto???IGNxMeijin,LeagueConnect,cy48vvl,1,t5_30v2b
6011245,0,t1_cy6vy55,Ive sent a request so check you when you get on ,LeagueConnect,cy7lr4l,1,t5_30v2b
6012732,0,t3_3xu32s,I wish to join! if you would have me.IGN GAT XMains adcmidsupp I can also play abit of top but I cant jg,LeagueConnect,cy7sq8n,1,t5_30v2b
6018886,0,t3_3xx2hm, Hey IGN is JediMasterWoody I have Skype and ill be playing for a bit tonight.,LeagueConnect,cy8lni4,1,t5_30v2b
6044005,0,t3_3y93bb,toprenekonly,LeagueConnect,cybvkxd,1,t5_30v2b
6058478,0,t3_3yirv4,IGN howlorquickly now the night grows short,LeagueConnect,cydrgp9,1,t5_30v2b
6062478,0,t3_3y020p,hey im always online and ready for increasing my lol friends my IGN is my username. IGN IspamCTRLuQQ,LeagueConnect,cyea8ti,1,t5_30v2b
6072002,0,t3_3yo4i6,IGNMcToasterz hit me up whenever always looking for more people to play with.,LeagueConnect,cyfizd6,1,t5_30v2b
6077563,0,t3_3yq1k9,Ign sisu,LeagueConnect,cyg93z8,1,t5_30v2b
6113375,0,t3_3z9s7q,added you D,LeagueConnect,cykj0ga,1,t5_30v2b
6116708,0,t3_3zc4ye,lmao im silver if you cant find anyone to play ranked rn you can add me we can play norms. i main adc i dont think im that bad. add me Tmanpro,LeagueConnect,cykwmyp,1,t5_30v2b
6124250,0,t3_3zcqfu,Hey Id going to add you. I main Supp and adc. This is the first time I want to take ranked seriously and try to climb. after being placed in silver  and making my way to silver  i decided to play other roles thinking i could carry more and quickly dropped to silver  haha. im now back in silver  sticking to my mains P The names Aaron IGN is Badmagick m EST,LeagueConnect,cylrhun,1,t5_30v2b
6153024,0,t3_3xtrcl,Im a Gold V support main looking for more people to play with. Add me if youd like! Ign Sandworm,LeagueConnect,cyp19m0,1,t5_30v2b
6160911,0,t3_3zuv1f,deleted,LeagueConnect,cypxkd6,0,t5_30v2b
6192510,0,t3_40djel,Ign Baka Desu Ka  tried adding you earlier but dunno if you got it or missed it. ,LeagueConnect,cytiude,1,t5_30v2b
6218780,0,t1_cyvg4hb,Illaoi now.,LeagueConnect,cywiavv,1,t5_30v2b
6222857,0,t1_cywiash,id say id help you out but I took breaks at some point too my accounts are only in plat atm might go higher next season but right now just chilling. ,LeagueConnect,cywyzd4,1,t5_30v2b
6228165,0,t3_40vlmi,IGN TMC Payne In order most support gt jungle gt mid gt top gt ADC least Im Platinum If you add me please shoot me a message back so I know who you are.,LeagueConnect,cyxkpg1,1,t5_30v2b
6244497,0,t3_413t8m,IGN Katlyn. Ill be on all day if u wanna play,LeagueConnect,cyzfjjm,1,t5_30v2b
6245006,0,t3_412sjt,I find this intimidating but it would be interesting to see someone of that skill level play if Im honest. Curiosity gets the best of meI have a smurf that is lvl  named Galedria that I should level. I made it just to play with low level friends and work on roles I dont usually play I just havent really done much with it sinceMy main account is Gold and I want to improve so I typically try my best. Im a support main working on jungle as my second role and ADC as third.,LeagueConnect,cyzhmma,1,t5_30v2b
6263745,0,t3_41e0wn,I added you I main support,LeagueConnect,cz1m97i,2,t5_30v2b
6266775,0,t3_41fosl,Hi umattz unfortunately we have to remove your submission because the title did not include one of the required tags.Server tags currently supported are NA EUW EUNE OCE BR TR RU KR LAN LAS SEA CHN JAP PBEInclude the tag somewhere in your title you can find your server by clicking hereexample NA Looking for friends NA Looking for friends Wanna duo? EUW etc.ampnbsp Discussion Add this tag to the title of your post if you want to have LoL related discussions.example Discussion Need some jungling tips Discussion Should Fiora be nerfed? etc.ampnbspWarning All type of advertisements must go in our Weekly Community Promotion Thread.Please read our posting rules and community guidelines and feel free to resubmit by clicking hereI am a bot and this action was performed automatically. Please contact the moderators of this subredditmessagecompose?torLeagueConnect if you have any questions or concerns.,LeagueConnect,cz1yo14,1,t5_30v2b
6340075,0,t3_42hds0,Hi uDupak unfortunately we have to remove your submission because the title did not include one of the required tags.Server tags currently supported are NA EUW EUNE OCE BR TR RU KR LAN LAS SEA CHN JAP PBEInclude the tag somewhere in your title you can find your server by clicking hereexample NA Looking for friends NA Looking for friends Wanna duo? EUW etc.ampnbsp Discussion Add this tag to the title of your post if you want to have LoL related discussions.example Discussion Need some jungling tips Discussion Should Fiora be nerfed? etc.ampnbspWarning All type of advertisements must go in our Weekly Community Promotion Thread.Please read our posting rules and community guidelines and feel free to resubmit by clicking hereI am a bot and this action was performed automatically. Please contact the moderators of this subredditmessagecompose?torLeagueConnect if you have any questions or concerns.,LeagueConnect,czaao4l,1,t5_30v2b
