,controversiality,parent_id,body,subreddit,id,score,subreddit_id
121464,0,t3_1vh9vr,I dont know about anyone else but I find that fartleks really help for this.,BarefootRunning,ces9gfm,4,t5_2rp0r
199433,0,t3_1vevm9,I run in VFFs in warmer weather and bought a pair of Merrell Trail Gloves  for the winter.  I am able to wear wool socks with them and run in anything I live in MN and weve had a brutally cold winter... my feet have been just fine in these.Good luck!,BarefootRunning,cf15onb,1,t5_2rp0r
368155,0,t1_cfijpv1,Its reaffirming to see two people holding the same opinion. I wasnt able to try different models so my baseline starts with the Aqua Lites. The Ra and Gobi have essentially the same setup.,BarefootRunning,cfixauc,1,t5_2rp0r
388988,0,t1_cfkfwts,Ive had some primal  for  months now they are really awesome no complaints at all.,BarefootRunning,cfl31pc,1,t5_2rp0r
503771,0,t1_cfx92od,Could probably use the midfoot if youre strong enough.,BarefootRunning,cfxj5yx,2,t5_2rp0r
524382,0,t3_203x8e,I dont run barefoot often but ironically enough given your location I used to walk barefoot in SF all the time.,BarefootRunning,cfzvm73,1,t5_2rp0r
566511,0,t3_1zb2zb,Look into Merrell for day to day wear I have a pair of Merrell I wear at my hospital and there is no drop in them.,BarefootRunning,cg4o1nk,2,t5_2rp0r
704285,0,t3_228cyy,Ya a question I actually have a good answer for. If your looking for minimalist foot wait for martial arts I would recommend looking into tabi. Tabi are  the split toe shoes you see in ninja and samurai wairing. You can get them on amazon for about  the are for the most part just a thin rubber sole and canvas. If thats not your fancy take a look at wrestling shoes more padding and cushion but boy are they comfy.,BarefootRunning,cgkbw4o,5,t5_2rp0r
730242,0,t3_22imb4,Is the price of the Luna sandal or Vivobarefoot really worth it?  I ordered a pair of Xero Shoes Sensori Venture for  last Friday which I will provide my full review on after a few weeks of use or so!,BarefootRunning,cgna6d2,1,t5_2rp0r
758411,0,t1_cgqa8fl,I feel like your calves would be at least a little sore after running  miles barefoot or no. ,BarefootRunning,cgqhkul,1,t5_2rp0r
897702,0,t1_ch6b98j,Oh fack.  Ignore me I thought this was a different TED talk by him.  Ive never seen this one so my earlier comment is completely unfounded.  ,BarefootRunning,ch6bnjx,1,t5_2rp0r
916539,0,t1_ch80bzo,If you already walk barefoot a lot you can skip through the preliminary stages. Doing some leg and foot strength exercises first is still a good idea though.,BarefootRunning,ch8gt1a,1,t5_2rp0r
917875,0,t1_ch8h352,I personally dont like combining ck with learning to barefoot for a couple of reasons. First its almost impossible to sustain a heelfirst foot fall when you are completely unshod and on hard surfaces. This means that for the vast majority of people  you are learning a new stride and therefore using new muscles increasing your potential for injury. Second the fact that it is a fixed schedule means there is a disincentive to stop when it hurts.Do one or the other not both.,BarefootRunning,ch8m9oh,1,t5_2rp0r
932459,0,t1_cha70ej,You nailed it.  OP heres a great link on tying them for you,BarefootRunning,cha9x4l,1,t5_2rp0r
955927,0,t1_chcxpn9,LOL. Damn that does seem pretty serious. I will set up an appointment soon. What did the doctor advise you to do with your hand? Surgery or anything like that? Thanks for the reply.,BarefootRunning,chcy48x,1,t5_2rp0r
1008469,0,t1_chipl0z,Also water shoes at Walmart will cost about .,BarefootRunning,chix5lw,1,t5_2rp0r
1223252,0,t3_2825jz,I love them too. I have stealths for running and sneakers ras for work and now even ulysses for flip flops but finally without the flop ,BarefootRunning,ci78fyw,1,t5_2rp0r
1230996,0,t3_2855t7,Also both barefoot and shoe wearing runners get hurt. Too many people get hurt while barefoot running and instantly blame the fact that they were barefoot and not that running can hurt you regardless.,BarefootRunning,ci83rpk,1,t5_2rp0r
1265642,0,t1_cibles4,Arch is callused as well? Not a likelihood but is a possibility worth being aware of.,BarefootRunning,cic01ab,1,t5_2rp0r
1331216,0,t1_cijc3ga,Theyre quick laces. They have a locking mechanism on them. My Bikila LSs have the same lace system as Ive never once had to stop because they came undone. They work great for me because I have a wide foot as well. ,BarefootRunning,cijdn6x,4,t5_2rp0r
1366962,0,t1_cinlyw2,I cant find any info on this. Can you provide an article or something?,BarefootRunning,cinmyst,1,t5_2rp0r
1379251,0,t3_29va41,Probably not a stress fracture. Those suckers develop over time and theres usually warning signals before they happen. Its when you ignore complaints from muscles tendons and beatenup skin that you get stress fractures. Its probably an inflamed tendon sheath or something like that. Ice it rest it drop some NSAIDs if you cant bear it but if you do absolutely no running and rest it like you would if the pain was still there and let this be a lesson dont run more than you know you can until you have developed a solid running form because when you run barefoot running form is the only thing that protects you from injuries.,BarefootRunning,cip6a1t,4,t5_2rp0r
1430114,0,t3_2aimqb,The xeroshoes are my choice for barefoot wear. They are simply a strip of rubber tied to my feet. It lets my feet breathe and doesnt make them feel cut off entirely from the world. But Im also sensory seeking and the more contact I make with the world is usually a good thing. But it offers protection from hot pavement and disgruntled managers so I keep them in my backpack now that I have a pair. Originally thought that would be to much of a cut off but for me they are temporary measures. ,BarefootRunning,civjii3,3,t5_2rp0r
1468295,0,t3_2aygk3,I bought some Zemgear Playas last year for around  because my school wouldnt let me go barefoot liabilities and whatnot.  They were the thinnest lightest shoes ive ever worn. I could feel the pebbles on the ground but not in a painful way. It was almost as good as going barefoot but safer since I mostly wore them for running at night. I tried on a pair of someone elses vibrams to see how they felt they felt significantly thicker than the zemgears.Unfortunately they were too thin for running. I just bought them off Amazon and later realized that the pair I bought were meant for beach running and walking. The sole started forming holes after a few months and the seam around the sole started to rip. Im certain that they fixed these issues and released newer models of that shoe but ive already transitioned to full barefoot.They were great shoes while they lasted and extremely comfortable. Theyre a tight fit for a few minutes but mold to fit your feet because its like an elastic material. People often asked why I was wearing socks which got annoying quickly. The grip on slippery surfaces wasnt the greatest but forefoot striking provides a lot of control so you shouldnt slip often. Also dont get them wet. They feel like wet socks when wet. At least they dry quickly.If youre looking to transition to complete barefoot Zemgear makes some good shoes for that. I dont know about the durability of other pairs so someone else will have to touch on that. Most of the shoes should be unisex. All shoes are unisex if you really think about it. Feet are all the same. Female barefoot shoes just use a different sizing system. You just have to adjust the sizing and youre good. Not sure if Amazon uses the same sizing system as zemgear does but you should try using the inchescm measurement instead. Theyre also really fun to run in because youre essentially running the same way you would if youre barefoot. Stepping on big rocks too hard will hurt a lot.,BarefootRunning,cj0br9f,2,t5_2rp0r
1597625,0,t1_cjg9qqe,Its not the standing leg that takes the main beating when you skate barefoot its the kicking leg.  Massive blisters.,BarefootRunning,cjgjstn,3,t5_2rp0r
1599117,0,t3_2cl6vs,Did you purchase them from Vibram directly? Ive always had better luck taking them back to the store to do warranty exchanges citysports in my case,BarefootRunning,cjgqkfp,1,t5_2rp0r
1664983,0,t1_cjp0nsg,Hmmm that escalated quickly...Plantar Fasciitis in a week ?!,BarefootRunning,cjp16x0,1,t5_2rp0r
1670972,0,t3_2dg0x9,So not a runner myself but...Yeah I walk barefoot as many afternoons as I can and my path of choice takes me over a fairly urban route.  Ive dug out chunks of glass and pulled out chunks of wire from my feet. Im constantly dodging debris. No regrets I wont stop walking barefoot.  The feeling of comfort and safety are just that feelings.  Even dodging debris barefoot is so much more comfortable for me and the safety of not stepping on things has to be weighed against not being able to use your foot properly.,BarefootRunning,cjpsdk3,1,t5_2rp0r
1792519,0,t1_ck53e34,Wow that was a close call. I dont think I couldve been able to react that fast.,BarefootRunning,ck53ild,1,t5_2rp0r
1848903,0,t1_ckb55tp,gt if you cant trust your body to freaking walk without hurting yourself you might as well kill yourself now.I agreed with everything except this point. Considering theres the elderly war veterans people with diseasesinjuries etc. Theres alot of progress made with artificial limbs. I understand it was a lighthearted joke but it still came across a bit morbid,BarefootRunning,ckbzl3k,1,t5_2rp0r
2026747,0,t1_ckxclyq,Yeah! The soles looked great even though the rest of the shoes got trashed. It was really impressive.,BarefootRunning,ckxfy6x,3,t5_2rp0r
2062561,0,t3_2iglur,Made these the other day. A bit tight around the toes. Would stuff them tighter with plastic bags next time so that the bottom side and toe areas are looser after the rubber hardens. Gonna try running in them tomorrow evening. Possibly the closest thing to barefoot running with a minimal amount of protection. ,BarefootRunning,cl1zvyv,8,t5_2rp0r
2115874,0,t3_2j372p,I wear any type of aqua socks type footwear I can find on sale.  Ive never bothered to try to find a specific manufacturer.  I normally get a few hundred miles out of a pair before having to replace them.  Ive owned a couple pair of vibrams and they were OK but not as convient or comfortable as any of my sale bought aqua socks.Personally Id go find something cheap to run with and just try out minimalist running first before you go out and spend big money on minimalist shoes.  Expensive minimalist shoes doesnt anyone else see that as an oxymoron?,BarefootRunning,cl8rv55,2,t5_2rp0r
2174613,0,t1_clftg9b,So its in front of your Achilles?  I havent felt that myself though I sometimes get some pain on the sides of my ankles during warmup.  ,BarefootRunning,clg8v1p,1,t5_2rp0r
2461791,0,t3_2n63g2,Small strides bend your knees foretomid foot strike directly below the knee and aim  steps per minute.,BarefootRunning,cmfz8k7,2,t5_2rp0r
2495934,0,t1_cmk9jto,Thank you!,BarefootRunning,cmkcugn,1,t5_2rp0r
2625237,0,t1_cn1944i,Thanks,BarefootRunning,cn196of,2,t5_2rp0r
2727497,0,t1_cndmpqt,Thanks. What pace were you running at when you started VFFs and have you increased the pace since starting? If so by how much and how long did it take you to get there?,BarefootRunning,cne3sbt,1,t5_2rp0r
2742440,0,t3_2re8us,Where specifically is the blister? This might actually be a weight placement problem more than anything else. Your weight should be mostly on the outside of the foot. You should be pushing off if you mean what I think you mean of the bone behind the pinkie toe not off of the big toe.,BarefootRunning,cnfsydd,1,t5_2rp0r
2778223,0,t3_2rv3p9,I used to do this with football boots Id have a sore ankle all season long. It was when I was slowing down Id stop sprinting and would lose all my form,BarefootRunning,cnjvhs2,2,t5_2rp0r
2888768,0,t3_2t7ceb,That is strange as others have used on pair for  miles with the KMDs new EVOs etc without issue.If you live in the USA  Canada SkoraRunning is a small company but people seem to love their shoes. I just ordered a pair to try so I can wear thicker warmer socks in the winter.Are they big enough are your toes hitting the end?,BarefootRunning,cnwgfjk,7,t5_2rp0r
2909167,0,t3_2teofq,Maybe you want to try running unshod to get better feedback.,BarefootRunning,cnys2o8,2,t5_2rp0r
3105967,0,t3_2vq3t4,Higher cadence helps faster smaller steps. Bigger steps typically means more impact forces. If my cadence starts to slow as I get fatigued sometimes my feet will start to get sore. You have to acclimate to it dont do more than you find comfortable it sounds like youre overdoing it and if youre like me youll start to like it. It feels more efficient than soft surfaces. FWIW Ive worked up to mpw all on asphaltcement and my feet always feel fine.Edit Also if you feel like your feet are banging into the ground you might want to strengthen the muscles on your shin that stops your feet from slapping the ground by doing this resistance band exercise,BarefootRunning,cojxko2,8,t5_2rp0r
3121288,0,t1_coli4n9,Ah I wish I lived near one of their stores. None of the nonMerrell stores near me carry the VGs either  Im just going to have to roll the dice and wait  weeks for them to arrive in the mail. ,BarefootRunning,coliqw6,1,t5_2rp0r
3201648,0,t1_cotu48m,thanks. I have loads of Icebreaker clothing  it keeps my core nice and toast  its my little toes that have problems...lol..my feet are fine just the tips of my toesWPs  Waterproof EVOs,BarefootRunning,cotumby,1,t5_2rp0r
3280877,0,t3_2xp9kk,Agree with all that apart from VFFs being a fad  theyve been around too long now to fit that term.,BarefootRunning,cp28w51,4,t5_2rp0r
3295415,0,t3_2xvlg0,Walking barefoot  running barefoot. The biomechanics are different. I find myself heelstriking while walking. While this may have strengthened your feet I doubt this prepared your calves.If its calf soreness youre feeling its normal. Ease into it. If youre doing  minutes now cut down to  or until soreness is manageable. Then work your way up.Also you meant VFFs right?,BarefootRunning,cp3wjx9,5,t5_2rp0r
3324279,0,t1_cp72gsz,The gortex around the ankle may feel a bit tight restrict plantar flexion but it loosens up a bit with wear. Another guy recommended because it felt a bit tight over top of my arch to get rid of the laces inside  he cut them out and that helped me too. Im usually a  and had to go up one size. Any thick socks and it would feel a bit tight for my toes.,BarefootRunning,cp771t4,1,t5_2rp0r
3355398,0,t3_2yjdew,Youre going to need to try a hydrophobic product you can spray or rub on there I would think.Depending on how soft the ground is maybe some cleats like yaktrax?,BarefootRunning,cpaqnek,1,t5_2rp0r
3403532,0,t3_2z6uyn,Due to the way that VFFs are designed the toes sort of expand to account for length. If I recall correctly the sizes are from the length of the foot in centimeters but dont quote me on that bit.,BarefootRunning,cpg880n,2,t5_2rp0r
3787230,0,t1_cqnf2jr,OP this is what I was trying to say in my other comment.  I dont want to presume to know all about your biomechanics but my gait looks pretty stiff like yours and lack of hip extension is the problem.This article and the book Anatomy for Runners by one of the experts mentioned was very helpful in diagnosing my gait disfunctions.edit forgot to link the article. here it is ,BarefootRunning,cqnz33l,1,t5_2rp0r
3788856,0,t1_cqo46e1,Thanks! Im still working hard to improve my splay its not a simple task. Will be seeing a podiatrist soon too. Thanks for the response.,BarefootRunning,cqo5rc5,1,t5_2rp0r
3888104,0,t1_cqzdnh5,The entire analysis was done on those two picturesneither of which show the whole motion either player is going through. But from the looks of it Lebron is accelerating so hes on his toes and leaning forward. Whereas Wade is decelerating or changing direction so hes on his heels and leaning back.If they want to make an argument about running form do it on a video. Its like arguing LeBron his a heel striker based on this photo  Furthermore basketball players spend at most  of the game jogging slowly enough to even debate this which neither player was doing in either of those photos. So IMO the forefoot vs heelstriking debate is virtually inconsequential when it comes to player health. ,BarefootRunning,cqzh7a1,4,t5_2rp0r
3928594,0,t3_35es0u, miles in a pair of the original Merrell Trail Gloves.,BarefootRunning,cr43fnm,1,t5_2rp0r
3938342,0,t3_350o2t,I work at walgreens so im hurrying along on hard floors all day and I recommend five fingers. I wear classic vans as well as I favor zero drop over really wide toe boxes. Vans dont really squeeze my toes too badly either. Also check out merrel vapor gloves ,BarefootRunning,cr57eb6,1,t5_2rp0r
4025672,0,t3_35uzdj,When I started running barefoot I did it everyday mostly on a grass football field. Generally I would limit myself one day to be able to run the next or I would just run a mile on the sore days. I definitely remember calf and achilles soreness as being terrible during the first month.,BarefootRunning,crf5mvr,1,t5_2rp0r
4026569,0,t3_36ltvx,A lacrosse ball or fitness peanut great to roll on the arch itself is a painful but effective way to relieve that pain.,BarefootRunning,crf9bk3,1,t5_2rp0r
4263254,0,t3_39stvc,TLDW. Vibrams of course. NB Minimus. Merrells in general,BarefootRunning,cs66qnw,5,t5_2rp0r
4272156,0,t1_cs76qef,Well the main goal according the the RD is to get people out running and enjoying the trails. They did have awards for most loops in the time frame malefemale and then fastest loop. I male winner had  loops and the female winner had  loops. ,BarefootRunning,cs76tn9,1,t5_2rp0r
4300024,0,t1_cs97156,As it turns out according to reviews for Spenco Rx Comfort Insoles seems like these are exactly what Im looking for. Ill probably purchase them and see how it goes.,BarefootRunning,csac51a,2,t5_2rp0r
4324515,0,t3_3aifcq,When I was training for my first ultra I drove about hrs away into the Pennsylvania Appalachian trail and when I got there I realized my vibrams werent in the car. So all I had were havainas flip flops and some shoe string. I did exactly what you did and the thing held together for  miles. Had some toe blisters but it wasnt bad.,BarefootRunning,csd3o53,2,t5_2rp0r
4407262,0,t3_3bgb31,Theres a narrow temperature range that I wear my Gobi sockless anything above like  is a sweaty mess.,BarefootRunning,csmflkk,1,t5_2rp0r
4442119,0,t3_3bxbp4,Your knees and back should take less abuse barefoot because you will have to change your stride so its less jarring.  If you hit your feet hard enough on the ground with no padding to damage your knees your feet are going to be a huge mess.  Shoes are really foot protection and your form protects the rest of your body.  Wearing shoes allows for bad form and possible injury.  You can have good form with shoes but it is harder to tell what your form should be.  Run smooth and listen to your body.  ,BarefootRunning,csqm45b,4,t5_2rp0r
4550025,0,t3_3ddtrr,I play flag football ultimate frisbee and basketball in various minimal shoes or unshod if I trust the field to be free of stabby things and havent had problems with my body.,BarefootRunning,ct45k93,1,t5_2rp0r
4557710,0,t3_3dge7a,Rest Ice Compression and Elevation. ,BarefootRunning,ct54a7d,2,t5_2rp0r
4710599,0,t1_ctob55p,Mouseover to view the metric conversion for this comment lbs  . kg  lbs  . kgPost feedback in rToMetric,BarefootRunning,ctob5fy,3,t5_2rp0r
4779593,0,t3_3g9btf,You could take your old pair and improve it with an iron saw like I did P.S. Did the same thing with my one year olds shoes. She was heel striking in her new shoes which probably would have done no good to her little feet. Now she can walk properly in them I used a belt sander here as it was finer work than on the old work boots.,BarefootRunning,ctx0bi5,2,t5_2rp0r
4828650,0,t1_cu32hlt,Remove as in the insole or I have to take it to a shoemaker?,BarefootRunning,cu36w9l,1,t5_2rp0r
4921166,0,t1_cuecyuv,I guess you are right. My feet are anatomically flat. I never had arches even when I was a little kid.But isnt that a problem? When squatting heavy weight my knees tend to go inwards and I think thats what is causing me knee pain. ,BarefootRunning,cueunuw,1,t5_2rp0r
4998617,0,t3_3jctbq,Get whatever has the thinnest sole. I run trails in  sandals. I also have a pair of KMDs and hate them because the sole is so thick. ,BarefootRunning,cuoiqok,1,t5_2rp0r
5021902,0,t1_cur7094,The material is very stretchy so its not nearly as restrictive as it might look. I find them very comfortable but then again I dont generally have issues with toe space.,BarefootRunning,curbx72,2,t5_2rp0r
5106708,0,t3_3kau0a,Whelp I just decided to give the Camper Peu a shot theyll arrive thursday and I can let you know how barefoot they turn out to be as long as they fit. ,BarefootRunning,cv1js7u,2,t5_2rp0r
5155192,0,t1_cv7cial,I just replied on a different thread so copy and paste.  In response to the question about swapping shoes Ive read about people doing that so they can gradually shift over.  Its all about strengthening your calves and feet for the forefoot strike while not pushing hard enough to injure yourself.PasteEveryone is different but heres what I did.  I was a runner had some chronic injuries and had just finished a marathon.  Then I got lazy for a year and needed to get running again.I started with lots of barefoot and VFF walking.  A km or two each day then a bit further.  I bought Converse Chucks for my daily casual shoe so no padding or support there too.After a couple of months I went for very short runs alternating between VFFs and barefoot.  I took it REALLY slow and listened to my body a lot and my muscles took a while to adapt.  No injury though and my shinsplints knee pain and hip issues never came back.Eventually I felt my legs change.  One day it felt awkward and then the next it all clicked.  I started running a bit further each day and ramped it up to my previous pace.  This took  or  months total and I probably couldve done it faster but I really didnt want to hurt myself.Good luck and take it slow.   Its worth it ,BarefootRunning,cv7e5mq,3,t5_2rp0r
5235705,0,t3_3mncxx,Give Merrel Train Gloves a shot. VIVOBAREFOOT also makes some great shoes.,BarefootRunning,cvh3cjm,1,t5_2rp0r
5371267,0,t1_cvy83sy,Hard not to agree but Feiyues are almost too disposable to be a good value. I have burned out the soles of Feiyues in  weeks. At  a pair the  Trail Gloves only have to last  months or so to be a better value. And meanwhile you have a better shoe in all the other ways...,BarefootRunning,cvy8n3f,3,t5_2rp0r
5372585,0,t3_3olh9f,indoor soccer shoes ,BarefootRunning,cvyepit,4,t5_2rp0r
5379852,0,t3_3olh9f,I wore Otomix Stingrays for about  months.  Great shoes but i found they were too expensive for the lifespn.   Since Ive been using the standard Fieyus and they have been fine.  If they wear out dropping  rather than  really makes them the most value of all the shoes Ive tried.  ,BarefootRunning,cvzc4m9,1,t5_2rp0r
5458075,0,t1_cw9bbjj,No its not.  It starts after about km running the longer I run the more intense it gets.  It subsides about h later. Im really bad at pacing still not running too long but I think it depends more on speed than on distance.  Thanks  ,BarefootRunning,cw9bk5h,1,t5_2rp0r
5461752,0,t3_3pv3rm,My IT band used to bother me when I ran in traditional running shoes. Now with zero drop minimalist shoes its no longer an issue. Five years and no IT band issues. Hope your IT band issues are also in the past. Make sure you fully recover. Dont push it too soon and setback your recovery. Happy trails!,BarefootRunning,cw9sgxv,1,t5_2rp0r
5463494,0,t1_cw8eie8,I still do most of my running in shoes with less than mm of stack height but for a long time ran barefoot or in classic vibrams. I never got injured or anything but it took me a couple thousand miles to realize Im simply a bit more comfortable back in shoes with a little protection. ,BarefootRunning,cwa0gyo,1,t5_2rp0r
5507917,0,t1_cwf186v,This might be the best solution yet. I might get some strange looks on the court but my health should be worth it right? The problem with the other shoes mentioned here Dunlops Vivobarefoot is that they dont have the flat profileless sole needed to play tennis on a carpet. I just wouldnt be allowed to play in them.  ,BarefootRunning,cwfoqjd,1,t5_2rp0r
5517289,0,t3_3qm8h5,Im a fan of Sseko Designs ribbon sandals  there is a slight drop from the heel to the toe maybe mm but theyre great. You get one base and can buy tons of different ribbons to tie them on and tie them different ways so they go with everything I havent tried any of their other styles but they might work. And they support a good cause. I do own four or five pairs of Lindsay Phillips ballet flats as well and theyre fun to wear. Would the black ones work for you? ,BarefootRunning,cwgvtfl,2,t5_2rp0r
5568470,0,t1_cwn83cz,If it makes any difference itll be a runwalk thing. Ill be going at the pace of my wife nonrunner and two kids  amp  years old. ,BarefootRunning,cwnbimg,1,t5_2rp0r
5583382,0,t3_3rip5k,Im happiest in Luna Monos,BarefootRunning,cwp651v,1,t5_2rp0r
5678218,0,t3_3qm8h5,Primal Professional  ultrathinlight sole pretty flexible though apparently not as much as the Lems NineFive flat hollow heel that looks raised on the outside thin toebox so you dont look like you have a fat clown foot,BarefootRunning,cx0xtb3,1,t5_2rp0r
5713949,0,t1_cx56ejp,Im confused. What is the difference between zero drop and sole thickness? I thought they were one in the same? ,BarefootRunning,cx5ddgj,1,t5_2rp0r
