,controversiality,parent_id,body,subreddit,id,score,subreddit_id
8436563,0,t1_d5w3f88,Ill definitely have to try adding it off the heat and covering. I also wonder about milkfat content and what effect it might have on absorption of flavorspice. A small crack of black pepper goes a long way. ,IndianFood,d5w3yt0,1,t5_2s65y
8494195,0,t1_d639gye,I am not a big fan of nonfat products. I think they greatly influence the outcome of food and taste. As is suggested dilution is a much better idea. I personally get some middleeastern Yoghurt so yum. A good regular Greek Yoghurt is pretty darn good too!,IndianFood,d63bop0,3,t5_2s65y
8520948,0,t1_d66myfv,Looks good thank you.,IndianFood,d66ogw6,2,t5_2s65y
8568212,0,t1_d6c9kni,Good to know. I too will use a whole wheat tortilla when necessary nearest Indian market is several times as far as nearest store with tortillas. This may sound weird but have you tried it at room temperature?,IndianFood,d6cluxn,1,t5_2s65y
8764483,0,t3_502kbs,How about using fine cheese cloth over the plate. . .?  Oil free idlis,IndianFood,d7180cr,3,t5_2s65y
9008946,0,t1_d7uo42g,Its its own thing. ,IndianFood,d7uqg3a,2,t5_2s65y
9053606,0,t3_54062u,Chinese samosa paneer starters and some live counter e.g. dosa uttapam mesub dhokla.Been very long I went to some marriageparty.,IndianFood,d803klc,1,t5_2s65y
9243298,0,t1_d8nmtye,Could you differentiate the two for me? My initial response to that is Im making butter and infusing the garam into it to use later as a flavor enhancer in my tikka. ,IndianFood,d8nnlhw,-1,t5_2s65y
9336195,0,t3_5879nt,Fellow Indian DFW resident herepersonally I do not like any of the resuarants I have been to so far they are too americazised for meBut if I had to. Taj Chaat House for chat and dosa planoindependadnt parkway. Hyderbad house order ala carte I stick with spicy version of gonghura biryani and their curries located on preston and SRT. Udipi for the south indian staple  and beltline near alamo draft house veg only. Chennai Cafe really good for the traditional thali go during the festivals totally worth it during the wait multiple location but I prefer the Frisco one. Their Pepper fry chicken is amazballs.. Kumars is another good one  its more regional from one of the southern cuisine love it when Onam is on for their thali specials! Its on Custer and th in plano.. Pasand on belt line and  in irving good buffet.. Flavors on Beltline and midway in Addison. Good food I hate their overly enthusiastic host but food is good. Let me know if you ever come here I live  Min away. Bombay Sizzlers in Las Colinas my favorite for indian style chinese usually stick to their triple schwezan.. Mughlai on Alpha is also suppose to be good been there once but wanna visit again to make a better judgement. Chameli in richardson near indo pak cafe on greenville good biryani.. Tawa Cafe a hole in the wall place ran by some pakistani love their biryani! I always pay him in cash.. kalachandji in downtown is good too! veg onlyNot a restaurant but the IndoPak cafe in Richardson has these marinated ground chicken and beef that are amazing on the grill. you can buy by the pound in kebob shape or burger patties.Lastly if we are good friends my place. I cook a mean chicken tikka butter chicken pav bhaji masala pav palak paneer chole even a nice gujju spicy kadi! hell recently me and my buddy we are both from mumbai made some good mumbai style street food which was sev puri and pani puri from scratch. All I request is to bring or pay for the meat and without saying some beer rest I can provide! Currently busy with some personal stuff but for a while I use to invite friends over almost daily. Not exclusively indian but any food I love cooking.,IndianFood,d8zfixj,3,t5_2s65y
9475260,0,t1_d9h0ycn,Yeah but it was old. I had made the previous batch and it came out perfect. ,IndianFood,d9h13k2,1,t5_2s65y
9529404,0,t3_5bcfqo,Heres a slightly involved idea echoing other posts mentioning Southernfried okra fried pickled okra. Most people dont like okra because of the slime and both pickling and deep frying cut the slime factor down to an almost imperceptible level. Boil equal parts water and vinegar with salt to taste and whole spices of your choice coriander cumin black pepper and mustard seeds might be nice pour the mixture over okra and plenty of chilies and refrigerate indefinitely. Once theyre pickled to your liking you could fry them in a batter of chick pea flour corn starch water salt turmeric and maybe a little baking powder for lightness. Maybe serve with a sweet chutney to complement the sourness of the okra. And of course whatever pickled okra is left over would be great for use in stews fried rice or as a side dish on their own.,IndianFood,d9np7jw,4,t5_2s65y
9767829,0,t1_dah3mrn,Uncooked from a bag. I like chana dal because its got a bit more body than red lentils but you can use whatever.,IndianFood,dah3o3l,4,t5_2s65y
9803713,0,t3_5fmdtp,This post makes me want to travel because there is no way I can taste any of these things. The brain one looks interesting. I thought that was parm at first but I think its ginger matchsticks. I wonder what that tastes like. ,IndianFood,dalioj6,3,t5_2s65y
9830869,0,t1_d9hldiq,I store the hing in the box it comes in the small plastic ones that are like table shakers. Only a slit is open when you want to use it so no odor problem,IndianFood,daozfc8,1,t5_2s65y
9946516,0,t3_5hx1cv,gtI had to spit it outwhy would you eat it raw like that? thats like biting off a piece of tumeric root and saying it tastes awful and questioning why we use it to cook with.,IndianFood,db4219g,22,t5_2s65y
9982691,0,t3_5gxj99,It sounds like chili powder but be aware that chili powder can mean many different things Chili Powder in an Indian grocery refers to powdered dry red chilis. This is a seasoning used to provide capsaicin heat to a dish. It usually comes in two varieties  regular and extra hot. Unless you are used to Indian food you will find both to be quite hot. Use sparingly. Chili Powder in an American grocery is a spice mix used for making chili a meatbean stew. This is not a single spice its a mixture of many spices in different proportions. It has absolutely nothing to do with Indian food. But you need to be aware it exists because if you go to grocery store in the US and pick up a jar of chili powder in the spice aisle this is what you will get. Kashmiri Chili Powder is a specific type of Indian chili powder which has a very mild taste. Most Indians wouldnt even call it hot though if you are used to bland foods you will detect some heat in it. It does have a rich earthy flavor which goes great with some dishes and provides a deep red color to the gravy. Paprika is also a kind of chili powder since its made of bell peppers which belong to the chili family. They have next to no heat and are used for color and flavor alone in European cooking specially around Hungary and the Balkans.Since youre asking in rIndianfood Im assuming you have an Indian context for your question in which case chances are high that the red powder is just dry red chili powder used for heat.,IndianFood,db8ru0d,1,t5_2s65y
10038587,0,t1_dbfzmct,This sounds delicious. ,IndianFood,dbg1ymk,1,t5_2s65y
10063967,0,t3_5jvqy3,How to Prepare Burnt Eggplant Chutney Ingredients Tamarind  Little Oil    tsp Ginger amp Garlic   Few Dried Chillies   Salt  As required Cumming seed   tsp Roasted Burnt Brinjal    Direction. Step one is add tsp of oil in pan and then add cumming seed red chillies. Then add garlic and ginger in it and saute it for a minute and then add tamarind in it.. Switch off the stove and allow it to cool for   minutes.. Next roast brinjal in flame and peel its skin.. Grind brinjal salt and roasted ginger garlic tamarind chili cumming seeds in it.Brinjal Chutney is ready now.,IndianFood,dbjcx6x,2,t5_2s65y
10075851,0,t3_5jzmgd,Ive had a few attempts at doing this and by far the best one was with turnip as the main ingredient and using a half and half mix of almond and pistachio. ,IndianFood,dbkwkwx,2,t5_2s65y
10121345,0,t3_5kuwwj,I often make turkey sandwiches with mango or cranberry chutney. Theyre delicious.,IndianFood,dbqth3f,3,t5_2s65y
10160620,0,t3_5lhqoo,If you watch take note of around  that is ginger shes mashing right?  Thats a lot of ginger!And then at about the five minute mark you see her grab a huge handful of the pastebut it cuts before you see her put it in.I commented about this on the original post and someone else pointed out theres another video on the same channel of her preparing a goat leg and at the fifteen second mark she pulls a bowl full of mashed ginger intially I thought it was four or five mashed potatoes but then I saw the fibers indicative of ginger and uses a ton of it.Is this normal?  Is it regional? Is there such a thing as too much ginger?  Also could it possibly be galangal much milder cousin of ginger used in Indonesian cooking?,IndianFood,dbvrgxo,3,t5_2s65y
10171604,0,t1_dbwcn4r,Aamti needs a sourtangy flavouring. Goda masala is entirely optional.,IndianFood,dbx09xb,1,t5_2s65y
10324539,0,t1_dcdxzbd,I have done it from scratch many times but I live in a large  multicultural city and theres a Pakistan restaurant that makes Biryani that will make you want to hug the cook  So when I have the calories to spare I just go get takeaway.At home I use recipes from a couple of blogs Sailusfood is one  to cook from scratch and if in a hurry Shan is perfectly fine. ,IndianFood,dcecdpc,1,t5_2s65y
10349359,0,t3_5o4apz,Only ?,IndianFood,dch5rfq,0,t5_2s65y
10502844,0,t3_5qc3b1,www.manjulaskitchen.comManjulas videos are great!,IndianFood,dcylx4f,2,t5_2s65y
10522479,0,t1_dd0tods,If they seem like good and unique recipes why not support the author? ,IndianFood,dd0u4on,8,t5_2s65y
10542672,0,t1_dd32jcp,OK so what they do is British Curry which is different than traditional Indian food. While I enjoy their food its not something I get often when I want Indian food. Plus I tend to stop going to restaurants once they have more than  locations...,IndianFood,dd34o5j,8,t5_2s65y
10543687,0,t1_dd2y736,agreed i remember the indian and sri lankan food in toronto being amazing. i also had some really good french food in ottawa in general i had uniformly lucky restaurant experiences when i visited canada,IndianFood,dd38tdq,2,t5_2s65y
10672675,0,t3_5smeeo,Well the full range of daal recipes are available to you.Dishes with achaari flavor are also available  chicken achari achari gobi achari paneer etcThere are many meat based dishes you can make without tomatoes too using lemon juice and yoghurt for acidity.Tandoori chicken fish tikka seekh kebabs etc.Loads of recipes really,IndianFood,ddgt0dz,2,t5_2s65y
10720843,0,t1_ddlqmn7,Please... NO... dont buy anything that is prepackaged with masala in it. It will be nasty and palate numbing... buy a strong loose black tea ask your shop or use two bags of PG tips. Instead do what the post below says... boil  Cup milk and  cup water reduce heat add  heaped tsp tea or two tea bags of PG tips or Tetley a smidge cardamom pdr less than  spoon  tsp grated ginger   cinnamon stick sugar to taste. Boil till tea is a golden orange. Taste. Add additional spices as needed. Some people like a hint of clove or black pepper. I dont. Play with substituting condensed milk instead of milksugar...Tea in India varies quite a bit. And ultimately it is a personal preference. I find tea served in Indian restaurants much too sweet and milky. But you can adjust that of course ,IndianFood,ddlrxoa,26,t5_2s65y
10777115,0,t3_5u4o7m,I use exactly this kind and sieve a can of chopped tomatoes for the sauce I just dont add any water and dont skimp on the marinade step ,IndianFood,ddrky8w,1,t5_2s65y
10857478,0,t1_ddzujgp,Thank you for your answer! As I said its a modified recipe. They call it kashmiri pulao but it doesnt look like a traditional kashmiri pulao. It has green peas cardamom comin and what they call fruit cocktail.The basmati rice is white and there isnt much fruit in it just some pieces. It doesnt contain raisins nor cashew only what I said.I will try to take a picture of it next time I buy it.,IndianFood,ddzvet6,2,t5_2s65y
10863241,0,t1_de0gt3j,Youre welcome.,IndianFood,de0gt52,2,t5_2s65y
10866721,0,t3_5v9d45,Malai Kofta and Rogan Gosht are probably my favorites at the moment.  Also remember getting these puff pastries filled with yogurt and chicpeas and such which was amazing but i cant remember the name of it.,IndianFood,de0tpq4,2,t5_2s65y
10872950,0,t3_5v9d45,Semolina Halwa and Carrot Halwa. I like sweets alright and these really stood out to me especially the one time I got semolina halwa at a restaurant which was more like a sweet porridge with some crumbled nuts on top than a pudding like I expected. I want to try making carrot halwa for a group gathering though as I have an easier time finding recipes for it and have more experience with how it tastes and its consistency so I know what to look for in the end product.,IndianFood,de1gu5d,3,t5_2s65y
10995555,0,t1_deeb1ce,Thank you thats exactly what it is!And I eat it every time its delicious.Almost every thing there is!,IndianFood,deeb8rh,3,t5_2s65y
11025338,0,t3_5xexog,You could try a South African dish called babootjie its a baked curry mince. So good. I have used lean mince before just drop the final bake times or it can go a bit rubbery. If that happens dont fret put it in the fridge then slice it for Sandwiches with chutney ,IndianFood,dehoymn,3,t5_2s65y
11375783,0,t1_dfkk47f,Yes. Enjoys  ,IndianFood,dflfbx0,1,t5_2s65y
11554620,0,t3_64g638,I make it pretty much the same way .... its really unique and crunchy!,IndianFood,dg5pxi6,3,t5_2s65y
11572781,0,t3_65496b,A few days is more than fine up to a week in the fridge. Use a toaster oven instead of a microwave for MUCH better results. ,IndianFood,dg7s4ay,2,t5_2s65y
11626792,0,t1_dgdq6oe,I think that I bought that and it was glutenfree. It was horrible! I actually posted on this. ,IndianFood,dgdwqk3,1,t5_2s65y
11765179,0,t3_65u0mq,you can make spicy mango slice dry them in air. cut mango slice add red pepper flakessaltblack peppermix them leave in the sun for  days and enjoy them.,IndianFood,dgtm2uf,1,t5_2s65y
