,controversiality,parent_id,body,subreddit,id,score,subreddit_id
3077678,0,t3_2vd40u,Im just hoping seasons  will be the original broadcast versions not the cut up syndicated versions with the missing music. I never bought season  because of that.,Cheers,cogzyrt,1,t5_2riu0
4693256,0,t3_3f7brc,Probably pictured taking a breath between puking spasms.,Cheers,ctm4k69,2,t5_2riu0
7898925,0,t1_d43jt1f,As good as the beer that goes into my stomach. ,Cheers,d43wvnj,8,t5_2riu0
10859279,0,t3_5v613p,Im a dude but suspect Im pregnant because this made me want to hug you.,Cheers,de023qq,2,t5_2riu0
11049555,0,t1_dekd8z4,He had good hardy quick laughs but Woody brought a wellrounded character that never failed to produce some quality humor. ,Cheers,dekg4zu,1,t5_2riu0
