,controversiality,parent_id,body,subreddit,id,score,subreddit_id
1035645,0,t3_25xg8l,God shave the Queen.,metaquebec,chm0aeb,3,t5_2u89m
1110218,0,t3_26u5vc,... et bien sur tenir les gens responsables de leurs actes cest de la haine oppressive de rhodsien,metaquebec,chuhnaq,1,t5_2u89m
1246801,0,t1_ci9jo01,Sors dici sale librl,metaquebec,ci9vpqy,2,t5_2u89m
1976911,0,t1_ckrbg91,Le front Mtaqubcois commence donc son recrutement ?,metaquebec,ckrf1wf,3,t5_2u89m
2342089,0,t3_2m55af,haut de gamme,metaquebec,cm170im,2,t5_2u89m
2579621,0,t3_2pb973,Jai jamais eu dor...jdis ca comme ca...,metaquebec,cmvalmm,3,t5_2u89m
