,controversiality,parent_id,body,subreddit,id,score,subreddit_id
8845794,1,t1_d7b4z0q,Its not better than prostitution imo but to each their own And like with Twitch bitches I dont just blame the females. The thirsty idiots that give them money are just as much to blame ,Kappa,d7b50oc,-3,t5_2tjsd
8847853,0,t1_d7auiad,also you dont need to know matchups fighting Ryu,Kappa,d7bdww2,3,t5_2tjsd
8848990,0,t3_51fbp9,Why not? c,Kappa,d7bitzx,5,t5_2tjsd
8849040,0,t1_d7bixc8,Thats not true.  Hed just travel to south america,Kappa,d7bj1se,45,t5_2tjsd
8852594,0,t3_51doyd,If I had his body and wasnt afraid of girls I would so be getting laid right now ,Kappa,d7byfwh,1,t5_2tjsd
8854503,0,t3_51edw9,But smash players are fugly.,Kappa,d7c6pdj,2,t5_2tjsd
8856063,0,t1_d7ccdkt,I feel this way too,Kappa,d7cdgi9,1,t5_2tjsd
8857648,0,t3_51jz86,Hes been making music for years. Youre pretty late on this guy.,Kappa,d7ckbln,5,t5_2tjsd
8859846,0,t1_d7cs2ou,Its pretty cringy man.,Kappa,d7cttv1,5,t5_2tjsd
8861934,0,t3_51m7cl,Rashidoooooooo,Kappa,d7d2vq7,1,t5_2tjsd
8864161,0,t3_51nnrq,I dont see a point in the PS Pro unless you have a K capable TV. I just hope that future games wont be intentionally gimped for the older PS systems just to sell Pros. ,Kappa,d7dciu7,2,t5_2tjsd
8864595,0,t1_d7d20kt,Fighting games have always been centered around educated guesses.  Even if you are fishing for a whiff punish you are guessing that they will throw out a poke at that baited spacing and your guess can be baited by a whiffed light attack which makes your whiff punish whiff and you get punished instead.The difference now is the foundational level of commitment that the game demands from its players.  Shuffling around to bait a whiff punish is very little commitment compared to tossing out a counterpoke crush counter.Its simply not possible to play the footsies game so safely anymore.  You can still bait and punish whiffs but the issue is that MOST attacks are just plain hard to whiff punish based on how normals have been designed in SFV.  Most good pokes are safe on block and when they whiff its hard to reach their lower hurtbox with a sweep.You have to take greater risks to gain an advantage in the neutral game.  Its certainly different but not necessarily a bad thing.  I really like the aggressive pace and the big risks that are encouraged.  Also to be honest this formula works really well for playing online too.This is why Chun is top tier.  She requires the least amount of commitment for a sizable return when compared to anyone else.  Other high tier characters like Ken Ryu Necalli and Cammy all get a seemingly above average reward off their commitment high damage.  Lower tier characters have to stick their neck out more often and generally get less for it Bison FANG.,Kappa,d7deeib,8,t5_2tjsd
8864809,0,t1_d7cxwok,what is nani,Kappa,d7dfbul,-8,t5_2tjsd
8866699,0,t1_d7dnf3e,GCS alt trying to muddy the waters? Downvote ! ! Head,Kappa,d7dnigg,8,t5_2tjsd
8867243,0,t1_d7dlw3h,Its his throw lol getting downvoted by ers that never even played the game.  This is what his Vskill looks like,Kappa,d7dpv8k,25,t5_2tjsd
8868999,0,t3_51pyjt,Bianca Bree is hella gorgeous,Kappa,d7dxggd,13,t5_2tjsd
8869085,0,t1_d7du5k2,yes please one of my favorite games I used to play when I was shitty kid,Kappa,d7dxtu3,4,t5_2tjsd
8872041,0,t1_d7dzosp,Thanks now This is all I can think about.,Kappa,d7ealq3,0,t5_2tjsd
8872359,0,t3_51rs7u,everything above the waist is perfect. whats going on with her ass and legs?i still would... obviously. but i got nothing else to complain about D,Kappa,d7ebza0,20,t5_2tjsd
8876975,0,t1_d7eqlow,Dont worry Im pretty sure youre better off than Wolfkrone at life.,Kappa,d7evy8j,18,t5_2tjsd
8878067,0,t1_d7f0nns,nah half life sucks dicks,Kappa,d7f0ol1,1,t5_2tjsd
8878809,0,t1_d7evowg,How can people say this? I dont get it. Is the gameplay salvagable? Sure. Its got all the fighting game components necessary to not suck but it needs more than it has  not only from a player point of view but definitely from a spectator point of view.,Kappa,d7f3w7z,-12,t5_2tjsd
8878913,0,t1_d7f3u01,gtshoot inside her sweet walls.wtf does that mean,Kappa,d7f4cfx,-1,t5_2tjsd
8881998,0,t3_51u14z,The ultimate fighting game Hearthstone. ,Kappa,d7fho5d,2,t5_2tjsd
8889853,0,t1_d7gc1a1,This. The game suck because I suck lol,Kappa,d7gfncv,-1,t5_2tjsd
8896454,0,t1_d7h83dn,guess GTAV is our Road Rash for now... or forever depending on when EA remembers about this franchise,Kappa,d7h861u,4,t5_2tjsd
8909198,0,t3_5281jq,Very smart color palette only Elena feels off in terms of style probably due to her face feeling a little flat. ,Kappa,d7ir86n,1,t5_2tjsd
8909966,0,t1_d7iui68,You make multiple reddit accounts and you argue with yourself on a subbreddit.... Theres nothing else that can be said. Im done. ,Kappa,d7iuji9,3,t5_2tjsd
8910112,0,t3_52b8mo,She be looking like Gabe from The Office,Kappa,d7iv674,1,t5_2tjsd
8911191,0,t3_52b2ee,Ken because lol mainstream media. ,Kappa,d7iztxv,-1,t5_2tjsd
8913266,0,t1_d7j8rwq,,Kappa,d7j8sqw,1,t5_2tjsd
8915031,0,t3_52d3jy,Americans vs anyone else,Kappa,d7jgfgm,0,t5_2tjsd
8922327,0,t3_52hp2h,If you have to ask the answer is already clear. ,Kappa,d7kbzse,1,t5_2tjsd
8923129,0,t1_d7kf23r,,Kappa,d7kfgnj,22,t5_2tjsd
8924487,0,t3_52ie7k,Character is Danua from Granblue Fantasy btw,Kappa,d7klc7j,7,t5_2tjsd
8927214,0,t1_d7kmvjj,It isnt straightforward enough? Starts at  left to right always.,Kappa,d7kx49a,1,t5_2tjsd
8928591,0,t3_52j1gc,now this is dat autism i been hearing about ,Kappa,d7l32lu,2,t5_2tjsd
8933921,0,t1_d7lpc2s,bogo rips are buns L,Kappa,d7lq4aq,1,t5_2tjsd
8935142,0,t3_52jco6,Heres the link for you ers ,Kappa,d7lveg6,2,t5_2tjsd
8944001,0,t3_52pvpb,Oh shit this was hilarious.,Kappa,d7mxqzc,4,t5_2tjsd
8947809,0,t1_d7n0p9w,ive learned so much more about urine and female ejaculate from rkappa than i ever thought i wouldthanks guys,Kappa,d7ne7jq,5,t5_2tjsd
8950139,0,t3_52vqv8,Also check out this hot as fuck combo video for the gameAir Juggles  super jumps cross unders air supers air dashes block dashes jesus christ. Maybe the game was broken as fuck I dont really know but goddamn it was fun.,Kappa,d7no9d8,5,t5_2tjsd
8955207,0,t3_52xb30,Sanford hated Marvel .,Kappa,d7oa5q2,3,t5_2tjsd
8955652,0,t1_d7ob7oc,Akuma being able to combo into his Super was awesome,Kappa,d7oc2x6,6,t5_2tjsd
8960977,0,t3_530san,This nigga think hes Hollywood ,Kappa,d7oz3p1,3,t5_2tjsd
8962320,0,t1_d7oiji0,pics amp GTFO,Kappa,d7p4wm0,3,t5_2tjsd
8962488,0,t3_530m03,SNK always giving me reason to fuck with their games.Still one of the best companies for gaming around regardless of bad releases.,Kappa,d7p5mra,4,t5_2tjsd
8962538,0,t1_d7p34av,Who?,Kappa,d7p5ujl,6,t5_2tjsd
8965713,0,t3_530z04,This man doesnt think black lives matter. Get him!,Kappa,d7pjky1,3,t5_2tjsd
8970321,0,t3_535cq5,This looks pretty great Im digging the stage transitions.,Kappa,d7q3hf8,17,t5_2tjsd
8971335,0,t1_d7q5001,Akuma,Kappa,d7q7vux,6,t5_2tjsd
8971680,0,t1_d7pjvni,LTG said it CONSTANTLY. Max accidentally slipped up. He was near the point of tears tonight because everyones attacking him. Hes a good dude. But LTG kept saying it and saying it and saying it and saying it. Telling his girlfriend to shut the fuck up on stream talkin mad shit and trying to cover it up. LTG is way worse than Max. ,Kappa,d7q9dqr,5,t5_2tjsd
8972774,0,t1_d7qbwek,I just thought it was funny ,Kappa,d7qe3yd,20,t5_2tjsd
8973583,0,t3_536g27,Daaamn this is so guud!,Kappa,d7qhm4w,5,t5_2tjsd
8974127,0,t3_536mnt,Ill play you man. I have both steam and PSN and Im unemployed.,Kappa,d7qjysn,44,t5_2tjsd
8976622,0,t3_53766z,Is this what mindbreak doujins are like?,Kappa,d7quqy3,8,t5_2tjsd
8976985,0,t1_d7qhsf3,Apparently you must have missed the memo? ,Kappa,d7qwbex,1,t5_2tjsd
8977751,0,t1_d7qylq2,It was a joke but everyone took it so seriously. BibleThump Evangelion for Christsake! c,Kappa,d7qzmfp,0,t5_2tjsd
8979635,0,t1_d7qal3d,Its  episodes of a guy who studies really hard gets a bunch of jobs hes completely unqualified for and wants to get laid leading to suitably insane anime situations.  Its actually pretty funny coming from someone that doesnt watch a lot of anime.  You can crush the whole thing out in a few hours.,Kappa,d7r7raa,4,t5_2tjsd
8982719,0,t1_d7rl15d,Random super? You really think that was a random super? You actually think there was absolutely no thought behind that super even though you literally described the setup in that first comment? Jesus christ...,Kappa,d7rl2p1,24,t5_2tjsd
8982798,0,t1_d7ql13x,Subbing I can understand.  But these three figure donations and two figure donations honestly are nuts.,Kappa,d7rlezb,3,t5_2tjsd
8986242,0,t3_53baxd,Ive seen this pic so many times and never noticed the MUSIC BAND written on the shirt lmao ,Kappa,d7s0b6q,1,t5_2tjsd
8986692,0,t1_d7s1twh,Cool and once again Do you really think the US is doing this out of the kindess of their heart? ,Kappa,d7s296q,2,t5_2tjsd
8993313,0,t3_53d8u3,hes given up on life and the quest for vag once u enter the deep web for that cheese pizza there is no returning.  Just compare Justin Pedo Wongs food pics to filipino champs and u will see the diff,Kappa,d7suv2j,1,t5_2tjsd
8996523,0,t3_53gxhe,K Brad is probably the only American that keeps it real. When hes not acting like a black Mike Ross he spits the truth. Homeboy has even said AE Cammy carried him.,Kappa,d7t8qtk,23,t5_2tjsd
8997641,0,t1_d7tcdbs,Yeah youre right. The mistake was giving the islamic terrorists a new home. Bush had it right. Turn the whole region into glass.,Kappa,d7tdkzn,-6,t5_2tjsd
8998140,0,t1_d7tfkfy,Read the full thing. ,Kappa,d7tfqp8,8,t5_2tjsd
8998159,0,t1_d7tdkzn,The mistake was the US not minding its own business and entering a region it had no business being in.  The only thing our intervention has done is create more fucking terrorists.  Clinton didnt help either when it came to Libya.  Gaddafi had a lot of those big name terrorists locked in a cell and our private mercenaries let them all loose.  Even Sadam had his country on lock even though he was a piece of shit.  Its extremely arrogant for us to think we can go to someone elses backyard and tell them how to run shit.  But we all know that our interventionist policies are not for the betterment of others i.e. spread democracy.  This is just an excuse used by politicians to line their filthy pockets.  Now we have a completely unstable region but also a never ending vortex of  that has been created.  We dont even manufacture shit in this country anymore.  All we make is fucking bombs.  The media can spin it any way they like but we are responsible for the chaos happening there now.,Kappa,d7tftni,13,t5_2tjsd
8998728,0,t1_d7thee2,If were talking about first world countries then yes that is something i can agree on.  But to be fair NYC has always been this way much like most of our major cities in this country.  Granted its definitely not as bad as what it use to be but danger still exists out there.  And we cant stop thuggery if our government enables it.  Yelling out gun control and stomping your feet wont stop the poverty and the war on drugs that has enabled this type of breeding ground for criminals to exist.  I guess its easier for the private sector to gentrify thuggery than to actually fix the real issues.,Kappa,d7tia9e,3,t5_2tjsd
8999360,0,t3_53h4cw,implying anyone from kappa would ever get that swole,Kappa,d7tl0pz,18,t5_2tjsd
9000330,0,t1_d7tnjz5,So US players are godlike too but they end up eliminating themselves in a US tournament?,Kappa,d7tp7uj,-2,t5_2tjsd
9001092,0,t1_d7szoi1,Youre forgetting KOF. Koreans and Mexicans dominate that game.,Kappa,d7tsihu,1,t5_2tjsd
9001659,0,t1_d7tt8ng,Thats only at the character select screen. Ingame he looks fine. ,Kappa,d7tuytc,1,t5_2tjsd
9001777,0,t3_53gle9,Nerf this dudes crush counter,Kappa,d7tvh6j,2,t5_2tjsd
9006320,0,t1_d7u8mre,Asians lack the ability to add the hard R that makes it offensive. Infiltration can never offend you. ,Kappa,d7uf388,2,t5_2tjsd
9008420,0,t3_53n68r,Imagine taking time to shop that. Yall are trying so hard to make this a thing so much jealousy its pathetic ,Kappa,d7uo61q,-34,t5_2tjsd
9008652,0,t1_d7ujjl5,Looks like Yung valle face,Kappa,d7up671,30,t5_2tjsd
9011044,0,t1_d7uor6e,If you listen real closely he isnt even saying chinger or changer. First sounds more like Chinder second part sounds more like Chanker.,Kappa,d7uzjjg,-8,t5_2tjsd
9011155,1,t1_d7uzl0j,Yeah i call bs. I know japs like traps but I do not believe they know who gllty is.,Kappa,d7v00ue,-2,t5_2tjsd
9016072,0,t3_53flxo,SleepFighter,Kappa,d7vlb5q,1,t5_2tjsd
9016304,0,t1_d7uo0g2,Even in life he exits early what a joke Head,Kappa,d7vmb8f,8,t5_2tjsd
9020402,0,t1_d7w0tay,Im not taking any decisions without asking you guys right now haha. Im no mod or anything like that ,Kappa,d7w40ag,1,t5_2tjsd
9020625,0,t1_d7w4gbl,For a long time the best American players in sf were  american just not white. ,Kappa,d7w4z0c,-8,t5_2tjsd
9023603,0,t3_53u2pf,Now this is some news rkappa needs next to John going to the next event D ,Kappa,d7whuxy,2,t5_2tjsd
9026583,0,t3_53uajv,well clearly the solution is to trash your own neighborhood and call it protesting  ,Kappa,d7wuqiy,2,t5_2tjsd
9027697,0,t3_53nxt8,Im a bit late to the party but here my two cents.I only heard of her through other post of her calling people out and picking fits and all and all she does seem sorta crazy but who isnt a little but blaming someone of domestic abuse with barely any sufficient evidence is sorta insane. I just dont want Mango to lose custody of his kid because of this because I dont think hell get over that,Kappa,d7wzjvp,1,t5_2tjsd
9028587,0,t3_53x0y2,must be a lady boy thing ,Kappa,d7x3eaa,24,t5_2tjsd
9030122,0,t3_53whss,more like cow,Kappa,d7xa0qi,3,t5_2tjsd
9030534,0,t1_d7woptg,Weak American Damage.,Kappa,d7xbstf,1,t5_2tjsd
9031521,0,t1_d7xexij,Ninja raccoonCoon  nwordNinjerDaggerTheres at least  levels to this sick ass reference bro,Kappa,d7xg2a2,59,t5_2tjsd
9034005,0,t3_53zmzk,Sticky pls,Kappa,d7xqt2o,8,t5_2tjsd
9038415,0,t3_54236j,That I disagree with if anyone gives a shit unless you main Bison its not a jump fest. If anything the JabLight AAs and stupidly GDLK pokes by top tier like KenNecallis HK and Chuns everything makes the footsie game boring. ,Kappa,d7y9vc1,-19,t5_2tjsd
9038667,0,t1_d7xn32f,Oh man if its anything similar to fourze Ill love it.,Kappa,d7yayl6,1,t5_2tjsd
9041200,0,t1_d7ygpa3,ive only interacted with her at alt meetings as she lives about two hours away from me in the same prefecture. that said my few interactions have been very negative. ,Kappa,d7ylwi8,1,t5_2tjsd
9044910,0,t3_54236j,footsies are the most boring thing in sfv,Kappa,d7z1xrh,1,t5_2tjsd
9045069,0,t3_545ghr,is there any good waifu in this game cuz it looks like mostly ripped dudes in trenchcoats and some bitch with weird hair,Kappa,d7z2mir,12,t5_2tjsd
9047830,0,t3_5471iy,doesnt he work for nvidia or something?,Kappa,d7zekph,3,t5_2tjsd
9048514,0,t3_547a7u,I wish that was my mouth tbhaf fam. ,Kappa,d7zhjev,3,t5_2tjsd
9050121,0,t3_547tn3,congats to all the winners,Kappa,d7zoi8m,2,t5_2tjsd
9051956,0,t3_549062,Because companies fuck up. They fuck up real bad some times too. Some people are blind and will keep sucking these companies cocks no matter what. Other people just have faith that some day theyll produce a quality product or make their shit product better. Tekken IV was hot fucking garbage Tekken V had Steve Soul Calibur III and IV were not good and SCV suffered from a slew of problems as well Guilty Gear had Isuka but people kept giving those companies chances. People still do give those companies chances when they fuck up. SFIV fucked up pretty much every iteration all the way up until Ultra and even Ultra wasnt perfect but it was an overall solid product. I think people are willing to keep playing the game and give it a chance to see if Capcom improves and they are willing to play the game in its shit state because they are fanboys or because they want to stay good at the game while hoping that it will eventually improve. If Capcom cant improve the game by next season though its over. On the other hand I feel your pain. Capcom was so proud about how they talked to the community about this game and how it was going to be what the community wanted. Now that the game is out they wont respond to anyone almost ever and only make fixes if the game breaks completely. Why are people willing to let them do that?,Kappa,d7zwfvc,2,t5_2tjsd
9053313,0,t1_d7zmucg,Yea  is challenging but investigations are really linear.,Kappa,d802axv,1,t5_2tjsd
9053366,0,t3_547ogy,Did they fix the piral arrow for Cammys tutorial?,Kappa,d802j72,1,t5_2tjsd
9054906,0,t3_54aqlc,He never added my cute emote either. BibleThump,Kappa,d8096z6,-1,t5_2tjsd
9057402,0,t3_54aqc4,ga ergens anders shitposten pls,Kappa,d80jz6d,2,t5_2tjsd
9057510,0,t1_d80f8cw,Im still not sure how Primal got the green light everyone knew Primal was going to be shit from the moment they announced it was a Far Cry with no guns. Im not the least bit concerned about a FC being disappointing. I wish wed get a FC Part  but the  template  new environment would be really hard to fuck up even if Ubisoft and Capcom joint developed it.,Kappa,d80kfys,1,t5_2tjsd
9059359,0,t1_d80ozbk,being social is for normies,Kappa,d80sfjp,21,t5_2tjsd
9060701,0,t1_d80epjm,Big E isnt really any better.,Kappa,d80y8cg,3,t5_2tjsd
9061172,0,t3_54dqcn,Still doesnt necessitate VIP Rooms. That guy should simply be banned  no more no less. Doesnt mean Zero needs a fucking play room all to himself. Its this autistic sense of entitlement thats a real cancer in the trsh scene. ,Kappa,d8109ly,11,t5_2tjsd
9061251,0,t3_54dqcn,deleted,Kappa,d810lv8,6,t5_2tjsd
9061292,0,t3_54c2jv,I fucking hated sf with the core of my being and as shitty as some of sfv is Im still enjoying it more than I ever did . Fucking history revisionists piss me off you cant just say you hate  one year and then say its gods gift to man the next. I vividly remember people complaining about sleep fighter and they were right.,Kappa,d810s8l,0,t5_2tjsd
9063183,0,t1_d813pbw,GO TO HELL,Kappa,d818y5r,2,t5_2tjsd
9063838,0,t3_54fctm,U P V O T E D,Kappa,d81bs2g,-2,t5_2tjsd
9066582,0,t3_54dqaq,Would it be considered broken if it simply negated Billys attack instead of doing damage?,Kappa,d81nn8z,1,t5_2tjsd
9070037,0,t1_d81jpn7,sticky white stuff everywhere,Kappa,d822l7e,3,t5_2tjsd
9073346,0,t3_54hv8f,Max would kill this nigger with his dagger than creampie the slope.,Kappa,d82gwcl,-4,t5_2tjsd
9073882,0,t1_d82i95s,Heh. You couldve just said its not your thing or just ignore it. But no you just had to be the one who is acting like a  year old Head,Kappa,d82j7sz,8,t5_2tjsd
9075601,0,t3_54keoj,LMAOOOOOOO,Kappa,d82qnfd,3,t5_2tjsd
9076062,0,t3_54l7bp,Shameless repostDidnt even bother to change the title smh,Kappa,d82sn9i,8,t5_2tjsd
9079350,0,t1_d8360o5,If people are making alts of you youre doing something wrong,Kappa,d836v7l,1,t5_2tjsd
9079613,0,t3_54lm7q,PES Battlefield  was on sale and I still need to finish Dragon Age,Kappa,d83806e,1,t5_2tjsd
9080944,0,t1_d83dkrq,He also says its a dantier announcement,Kappa,d83drer,4,t5_2tjsd
9084150,0,t3_54mnzh,Where did you find that video? . is ancient history.,Kappa,d83rm84,1,t5_2tjsd
9085313,0,t3_54owyh,I am just happy if he PREVENTS somebody from getting enough points to make CPT top .  I hope he ruins somebodies dreams,Kappa,d83wnug,1,t5_2tjsd
9089031,0,t3_54qogh,I see he prefers older women,Kappa,d84cs8a,1,t5_2tjsd
9089200,0,t1_d84aaxs,whats bigger your wifes nose or your dick?who weighs more too?,Kappa,d84dim3,1,t5_2tjsd
9089754,1,t3_54qr1d,Threads that have professional players finally voicing why SFV is junk is just packed to the brim with Defence Force Bingo replies. Meme that is  truth.,Kappa,d84fwut,3,t5_2tjsd
9091606,0,t1_d84lx75,You can get a  hit loop on most characters with no meter pretty neat if you can actually get the spacing right,Kappa,d84nx7t,10,t5_2tjsd
9092083,0,t3_54so50,now not even fity  dmg..,Kappa,d84pziq,8,t5_2tjsd
9093054,0,t3_54tjgu,ushenglong uwormed uscrubfighterv uloligrabber ufgcdrmike umaikky ujurisfootslave uxamdouother notable top pros that say SF is not a good game or its boringXians AMANuki amp daigo confirms SF is boring and only played it because daigo was sponsored and the competition was large,Kappa,d84u7ue,-5,t5_2tjsd
9093573,0,t1_d84pt45,Well its  down to . now. There also arent any one frame links in this game so outside of that everything should theorhetivally be fine.,Kappa,d84wgrs,1,t5_2tjsd
9093940,0,t1_d83nxwq,deleted,Kappa,d84y23n,0,t5_2tjsd
9094729,0,t3_54rruu,Still hungover from last nights debate.,Kappa,d851gzm,1,t5_2tjsd
9096398,0,t1_d853mn8,Yeah but he has a point that the steam charts dont account for the console players.In the same breath Footslave is right about sample size. So probably not much better. Not much to go off of but I have a friend who didnt even know Urien came out.,Kappa,d858oho,2,t5_2tjsd
9097583,0,t1_d857zjd,Barely.,Kappa,d85dseb,-2,t5_2tjsd
9100628,0,t3_54wlqe,Thats awesome we can have a  hour intermission with the Megas!,Kappa,d85qzcf,11,t5_2tjsd
9103465,0,t3_54yqw8,That all depends on what was found in his nose and what he did with it. ,Kappa,d8639i4,10,t5_2tjsd
9106624,1,t3_54zr9m,Dumb ass  year old memesters in my kappa?,Kappa,d86gxhz,4,t5_2tjsd
9108379,0,t1_d85qq8l,Youre a fucking legend panking,Kappa,d86oi7d,2,t5_2tjsd
9110828,0,t3_551of8,Fuck yeah! Samitto! I cannot wait for this. ,Kappa,d86z2t4,7,t5_2tjsd
9111193,0,t3_552klv,yes,Kappa,d870nlk,4,t5_2tjsd
9112072,0,t1_d8747bb, months is still petty good. Thats still almost the whole fucking year of support that most fighting game non top tier players cant enjoy. ,Kappa,d874gft,9,t5_2tjsd
9112650,0,t3_54x6su,Sfxt was a lot of fun after the update. Shame Capcom had to ruin it with their on disk dlc bull shit and pay to win model ,Kappa,d876yh3,3,t5_2tjsd
9112669,0,t3_552klv,yes,Kappa,d8771g5,6,t5_2tjsd
9113823,0,t1_d87bwl2,No I talked to you yesterday and said I would carry you to some wins and let you figure out why you cant get over me as long as you dont act creepy in voice chat.Pretty clear on who you are and who I invited.So leave that BNET and we can all enjoy the cringe you will be on voice chat and not hiding behind alts. Dont be a bitch man.,Kappa,d87c1sm,3,t5_2tjsd
9114590,0,t3_5535l2,k ,Kappa,d87fd58,5,t5_2tjsd
9114937,0,t3_5545f6,This is great news but dont mind any bone the company might throw at us you reverse weeaboos. You keep being a bunch of fucking dickwads over the lack of an english dub even when the people that actually play the game wont give a shit about it DansGame,Kappa,d87gv2m,3,t5_2tjsd
9121076,0,t3_557e77,She is using that burger king nugget offer well,Kappa,d887ddd,3,t5_2tjsd
9123373,0,t3_558rir,To say nothing of other more recognizable and better groups of players that have gaming careers beyond the last  months.,Kappa,d88hb0i,0,t5_2tjsd
9125245,0,t3_557ncu,right on pal,Kappa,d88peyt,2,t5_2tjsd
9126605,0,t3_55a2w7,damn so cute name?,Kappa,d88vatj,5,t5_2tjsd
9128019,0,t1_d88s54m,So...is Akuma smashing that or nah?,Kappa,d891j06,3,t5_2tjsd
9134404,0,t1_d89tovi,Money.,Kappa,d89uoas,6,t5_2tjsd
9135298,0,t1_d89c9xv,Also requires the counter hit after the super which really wouldnt happen here. As well as the sim holding super to fullStill cool tho and some variation of this could definitely happen,Kappa,d89yrho,1,t5_2tjsd
9135716,0,t3_55fa8p,What was random about that tho.,Kappa,d8a0o6m,12,t5_2tjsd
9136557,0,t1_d8a4gzu,Mago,Kappa,d8a4ib1,2,t5_2tjsd
9136900,0,t1_d8a5yvg,he got permission,Kappa,d8a62q0,28,t5_2tjsd
9145308,0,t1_d8ardw4,Watch an Anri Okita titfuck theyre obviously real.,Kappa,d8b8ex7,1,t5_2tjsd
9145425,0,t3_55k6j3,Because SF players are so much better.,Kappa,d8b8y51,2,t5_2tjsd
9150108,0,t1_d8bu06v,Ah excuse me the Peoples Republic of China. Tomato tomatoe chinger changer Kappa,Kappa,d8buc7z,7,t5_2tjsd
9153797,0,t3_55lcwv,deleted,Kappa,d8cb5zr,1,t5_2tjsd
9153955,0,t3_55omwl,Dead game,Kappa,d8cbvxy,-1,t5_2tjsd
9154216,0,t1_d8c6cri,I think most fighting games are improved by coop I know sfxtekken was a terrible spectator game because of all the time outs but playing with four people is one of the most fun ways to play a fighting game Ive ever tried,Kappa,d8cd2tq,6,t5_2tjsd
9154589,0,t3_55orxp,when fgc majors host smash nobody big turns out anyway. its kind of a waste to get an inventory of consoles and crts youll only use on one game for a tournament thatll get lt entrants,Kappa,d8ces41,36,t5_2tjsd
9156085,0,t1_d8clha6,They could use sand too to put out the fire. ,Kappa,d8cllx9,1,t5_2tjsd
9157401,0,t3_55q8d1,The reason he never stopped eating is because he wanted to be a thicc trap? PogChamp,Kappa,d8crmy3,65,t5_2tjsd
9161835,0,t3_55sacg,Chinger changer ninjer dagger,Kappa,d8dbvpb,0,t5_2tjsd
9165413,0,t1_d8bqk6l,Oh you,Kappa,d8ds79f,1,t5_2tjsd
9173974,0,t3_55x1ok,lmaoanyway good on jwong.  hopefully shine does well,Kappa,d8evaf1,6,t5_2tjsd
