,controversiality,parent_id,body,subreddit,id,score,subreddit_id
9787433,0,t3_5ewaaz,what a fucking slut I love that,TaraBabcock,dajiilf,4,t5_2ze3e
10022866,0,t3_5j0q6y,Is this from her old FSF? Or after she got the bigger implants?,TaraBabcock,dbe09u1,1,t5_2ze3e
10983580,0,t1_de84ngz,I think its more were mad shes even charging for this shit content. She says she wont do extreme sexual content because she wants to keep her respects yet she charges for... sexual content?Shes a dumb bitch who stopped caring about her supporters midway. I used to pledge  because she used to be a dedicated gamer now shes just a sellout.,TaraBabcock,decycql,5,t5_2ze3e
11620860,0,t3_65tlwx,This is her profile I dont know if this will help ,TaraBabcock,dgd8hcv,1,t5_2ze3e
11673825,0,t3_66j6fw,removed,TaraBabcock,dgj8szj,0,t5_2ze3e
11684769,0,t1_dgkgv9e,deleted,TaraBabcock,dgkhi49,1,t5_2ze3e
11789643,0,t1_dgwdzcj,what kind of question is that?of course is political you dumb sack of shit the word itself is politically correct,TaraBabcock,dgwe981,1,t5_2ze3e
