,controversiality,parent_id,body,subreddit,id,score,subreddit_id
1731709,0,t3_2dd964,Pmed!,CanadianHardwareSwap,cjxg32y,1,t5_32st9
2897277,0,t3_2tak1i,How much would you take for the ?,CanadianHardwareSwap,cnxfbkg,1,t5_32st9
3132052,0,t1_commt1o,Wait....OHHH I thought you were selling!!!,CanadianHardwareSwap,commvlr,1,t5_32st9
3164519,0,t3_2we12v,dayum sweet deal,CanadianHardwareSwap,coq021u,0,t5_32st9
3216576,0,t3_2wq25q,will take for ,CanadianHardwareSwap,coveesk,1,t5_32st9
3238289,0,t3_2wsftz,deleted,CanadianHardwareSwap,coxnlxg,1,t5_32st9
3330499,0,t1_cp7vkko,Ill have to think about it. Mostly Im looking at local reference cards and trying to hit around the  mark on one since Ive already got a G bracket and CLC waiting to go on it. ,CanadianHardwareSwap,cp7wjfk,1,t5_32st9
4123933,0,t3_36bpwn,xgb Kingston HyperX Fury RED DDRmhz for  delivered downtown or  if you meet near brampton.,CanadianHardwareSwap,crqcqb2,1,t5_32st9
4173862,0,t1_crw0rpb,I honestly dont understand why its so hard to read the rules. You just read them apparently and still didnt see what I told you to read.,CanadianHardwareSwap,crw0zk7,1,t5_32st9
4334453,0,t1_cse7oz6,How late do you think youll be up tonight? ,CanadianHardwareSwap,cse80i5,1,t5_32st9
4492704,0,t3_3cma38, for a i and a MoBo. Great price! Im still rocking an i and its still not bottle necking on most new AAA titles. GLWS!,CanadianHardwareSwap,cswyr4z,2,t5_32st9
4699917,0,t1_ctmavd2,Thanks for the offer but lll pass.,CanadianHardwareSwap,ctmyp9i,1,t5_32st9
4719829,0,t1_ctpfvae,Yeah thats the bigger problem Id have.,CanadianHardwareSwap,ctph21g,1,t5_32st9
4881867,0,t3_3hn28b,Where are you located?,CanadianHardwareSwap,cu9wb2r,1,t5_32st9
4997163,0,t1_cuoavb7,sold one recently for cad actually .. Toronto kijiji is highly overpriced. I suggest trying to get it from rhardwareswap,CanadianHardwareSwap,cuocf5u,2,t5_32st9
5137967,0,t1_cv2wm10,Sold!,CanadianHardwareSwap,cv5bfbx,1,t5_32st9
5139335,0,t3_3latqm,Would you ship to BC? Without the case ,CanadianHardwareSwap,cv5hdcj,1,t5_32st9
5373607,0,t1_cvycd3s,Id say closer to ,CanadianHardwareSwap,cvyjetj,1,t5_32st9
5459649,0,t1_cw93txr,Actually I do have a TB I can give up,CanadianHardwareSwap,cw9isxw,1,t5_32st9
5481566,0,t1_cwcb8hi,Alright sounds good.I actually work in Mississauga MF so we dont have to try to catch each other on Friday.Ill PM you my number so we can figure something out for the coming week.,CanadianHardwareSwap,cwcbkyf,1,t5_32st9
5592011,0,t1_cwpvvq9,This was a scam in case any of you were silly enough to fall for it.Im replying this to everyone in this thread in hopes to let whoever sent this clown money know.,CanadianHardwareSwap,cwq8pcu,1,t5_32st9
5592012,0,t1_cwpt2eu,This was a scam in case any of you were silly enough to fall for it.Im replying this to everyone in this thread in hopes to let whoever sent this clown money know.,CanadianHardwareSwap,cwq8pil,1,t5_32st9
5658858,0,t1_cwyap1g,still available ?,CanadianHardwareSwap,cwyjba0,1,t5_32st9
5757190,0,t3_3tzbjg,.GB for the ram The other stuff just depends on who youre selling to I guess.,CanadianHardwareSwap,cxaqfzq,1,t5_32st9
5778578,0,t1_cxcsnlb,ah thanks ,CanadianHardwareSwap,cxddxy2,1,t5_32st9
5863045,0,t1_cxo68hp,Lady on the phone said they wouldnt but Ill give live chat a shot.,CanadianHardwareSwap,cxo6bp6,1,t5_32st9
6017994,0,t1_cy8gws3,It really comes down to your asking price I do not want to go over ,CanadianHardwareSwap,cy8hgnk,1,t5_32st9
6147219,0,t3_3zraqc,Timestamp missing... and the price.. sigh.,CanadianHardwareSwap,cyodhlu,4,t5_32st9
6156262,0,t1_cypeaa1,Ten key less. A bit like FTFY is for fixed that for you.,CanadianHardwareSwap,cypei05,1,t5_32st9
6237623,0,t3_40yris,I die a little inside every time i see pictures of video cards or motherboards placed on carpet Im interested though PMd.,CanadianHardwareSwap,cyynf3j,2,t5_32st9
6431023,0,t3_43gkfk,Newspaper is NOT a good packing material for ANYTHING that has any weight to it at all. During transit if an item is heavy at all it will shift and compact the newspaper making a void that allows the item to shift inside the packaging which is the exact thing you want to avoid when shipping.If you have any heavy items use bubble wrap foam or other non compacting material to fill voids.,CanadianHardwareSwap,czki8ck,1,t5_32st9
6481579,0,t3_44e8ax,Prices? Interested in the . ,CanadianHardwareSwap,czpqrzz,1,t5_32st9
6488275,0,t1_czqcfat,I guess well have to see what the almighty mods decree in the coming weeks...,CanadianHardwareSwap,czqfpcn,1,t5_32st9
6489537,0,t1_czo97zb,Your post is confusing. What exactly are you looking for?,CanadianHardwareSwap,czqkepa,1,t5_32st9
6619478,0,t3_46bp37,deleted,CanadianHardwareSwap,d040eod,1,t5_32st9
6699912,0,t3_47d0on,Ive got a few. Pm for more info.Time stamp ,CanadianHardwareSwap,d0cbuo3,1,t5_32st9
6726268,0,t1_d0f0mdi,Yeah thats why Im trying to do it on the cheap. Do one with a proper cooler and then cut up the leftover ref cooler and slap a spare AIO I have in it the one I have wont fit any of the brackets. I just cant stand the noise anymore.,CanadianHardwareSwap,d0f1zam,1,t5_32st9
6759412,0,t1_d0igfyx,Postal code is lc v. And I am not PayPal verified because I dont like having to give them my bank account information  ,CanadianHardwareSwap,d0iha5b,1,t5_32st9
6839877,0,t3_494566,I would be interested in the cpumobo if you were interested in parting out,CanadianHardwareSwap,d0rlrav,1,t5_32st9
6945668,0,t3_4arhev,Any particular variety of Core  Quad youre looking for? Ive got a Q lying around.,CanadianHardwareSwap,d13meam,1,t5_32st9
6950957,0,t3_4awy97,deleted,CanadianHardwareSwap,d1481sg,1,t5_32st9
6957664,0,t1_d14z7dk,True. Probably ref but still.,CanadianHardwareSwap,d14zh9v,1,t5_32st9
7031712,0,t3_4bxsku,PMd,CanadianHardwareSwap,d1dedrx,-1,t5_32st9
7060015,0,t1_d1gl9um,Honestly nothing. Aslong as it is is a working  socket itx motherboard that would be great. Hopefully it would have integrated graphics quite a few  based motherboards have this.Im going to be using it for a pfsense router. I have the case and the ram cpu just dont have a motherboard.Thanks ,CanadianHardwareSwap,d1gm34a,1,t5_32st9
7182282,0,t3_4dtw7h,I have a corsair cx  if your interested,CanadianHardwareSwap,d1uk9fq,1,t5_32st9
7341958,0,t3_4fwoku,s for CAD?WHAT.If I can grab a second MSI Gaming edition  for  CAD I would without any hesitation. Normally with our Canadian monopoly maple money prices only go up.Edit Are you sure this guy didnt steal these GPUsA  price drop is pretty huge. This almost feels to good to be true.,CanadianHardwareSwap,d2cqb3q,3,t5_32st9
7442311,0,t1_d2o3s64,what drives are you looking for. i have TB TB HDD GB SSD GB SSD,CanadianHardwareSwap,d2o56ak,1,t5_32st9
7444961,0,t3_4h5jny,Is this still available if so pm me,CanadianHardwareSwap,d2og0pi,1,t5_32st9
7485364,0,t1_d2t1e1i,removed,CanadianHardwareSwap,d2t1mjy,1,t5_32st9
7590097,0,t1_d34pn3n,Your prices not mine.,CanadianHardwareSwap,d34ygc3,1,t5_32st9
7628011,0,t3_4jsta8,I want to sell my Gigabyte GeForce GTX  GB WINDFORCE. For a reasonable price.,CanadianHardwareSwap,d399iaa,1,t5_32st9
7658872,0,t3_4k6hq1,deleted,CanadianHardwareSwap,d3crqoo,1,t5_32st9
7660051,0,t3_4k7p2j,Brand preference?  Amount willing to pay?  Bezel size important? ,CanadianHardwareSwap,d3cwk9i,1,t5_32st9
7760702,0,t3_4ll0t6,I thought local only wasnt allowed. ,CanadianHardwareSwap,d3obya4,2,t5_32st9
7790442,0,t1_d3rmz2z,Average Kijiji seller but.. BUT I PAYED  A YEAR AGO?? Therefore I should be selling it for  OBO.  ,CanadianHardwareSwap,d3rpart,7,t5_32st9
7810904,0,t1_d3tzcfd,You only put the city. No province. You also missed the Keep in mind that its your responsibility to follow the rules when you post. ,CanadianHardwareSwap,d3u0diw,1,t5_32st9
7814581,0,t1_d3u06bj,dunno      ,CanadianHardwareSwap,d3uf8p2,1,t5_32st9
7901653,0,t1_d447p1f,i dunno. theyre not even  months old and give titan x performance. you have to remember pascal cards right now are a lower bit bus. and a  ti ocd will always outperform a ,CanadianHardwareSwap,d447xxy,-3,t5_32st9
7949589,0,t1_d48nnz3,Buy that shit. The gap is too close between the  and the titan to avoid a deal like that especially with current canadian pricing on the  series.,CanadianHardwareSwap,d49lxo9,1,t5_32st9
7984224,0,t3_4ogdue,gtNew threads can be made every  hours.This is your second thread in  hours. I have removed this post,CanadianHardwareSwap,d4di3bl,2,t5_32st9
8028563,0,t1_d4igdo9,I listed it on local kijiji for  If you are interested let me know. I should be able to cover shipping and insurance at that price original box and fan included. If required I can get new pics with time stamps I got it in a nd computer right now but will be doing a tear down when I get a little free time.,CanadianHardwareSwap,d4ihhu5,1,t5_32st9
8062009,0,t1_d4m7kso,Yeah it kinda sucks for used parts sellers. Soon the s will even be below  per norm.,CanadianHardwareSwap,d4m8u9x,1,t5_32st9
8131398,0,t1_d4tk255,If their dated to within  days of the day you post.,CanadianHardwareSwap,d4u1j5t,1,t5_32st9
8276985,0,t3_4stgz9,Interested in mouse but price is high. Current sale for that mouse on NCIX is .  FS.  USD is  CAD  shipping for open box.,CanadianHardwareSwap,d5c6jwh,2,t5_32st9
8381406,0,t3_4ue8ul,Good luck m ,CanadianHardwareSwap,d5p82ur,1,t5_32st9
8479251,0,t3_4vpr29,You need to provide what you want W in the title of your post. I have removed your post please review the rules before posting again.,CanadianHardwareSwap,d61g6mp,1,t5_32st9
8495620,0,t3_4v1g5m,I got a . Ill do  usd plus shipping. Shipping should be like  usd max. ,CanadianHardwareSwap,d63i4vc,1,t5_32st9
8517251,0,t1_d6672yl,Ill have to get back to you on the price for shipping since Im mobile and the site is not cooperating.Warranty is for  years and its yours cause I havent registered it yet. XFX has the best warranty FYI check their website for details.,CanadianHardwareSwap,d667snx,1,t5_32st9
8656835,0,t1_d6n71ud,what time do you think you could be available to pick it up. pm me tomorrow and well work something out.,CanadianHardwareSwap,d6npwxt,1,t5_32st9
8693719,0,t1_d6saa3n,That is also an option.,CanadianHardwareSwap,d6scf3b,1,t5_32st9
8936499,0,t3_51cu6h,I just upgraded should I resell my  TI on here  locally or should I just build something like thisType|Item|Price||CPU | Intel Pentium G .GHz DualCore Processor | .  PC Canada Motherboard | Gigabyte GAHMA Micro ATX LGA Motherboard | .  NCIX Memory | Crucial GB  x GB DDR Memory | .  NCIX Storage | AData Premier SP GB . Solid State Drive | .  NCIX Case | Corsair SPEC RED ATX Mid Tower Case | .  PC Canada Power Supply | EVGA W  Certified ATX Power Supply | .  Memory Express Other| MY PNY  TI| Added Value of .  | Prices include shipping taxes rebates and discounts | | Total | . | Generated by PCPartPicker   EDT |   And try to resell it for ?  List at  haggle to .    Am located in NWO.  ,CanadianHardwareSwap,d7m19wy,1,t5_32st9
8964513,0,t1_d7pbmhb,Ahh they have it indeed for  beautiful. Forgive my ignorance but would a lower clock speed have any significant impact on performance?,CanadianHardwareSwap,d7pee6l,1,t5_32st9
8971104,0,t1_d7q6m1j,Yea thats in pretty good condition.  Can you also give me a shot of the other side with a piece of paper with your name on it? Sorry but you can never be too careful. ,CanadianHardwareSwap,d7q6vv0,1,t5_32st9
9020166,0,t1_d7vx4g7,Yeah thats what I have now. They require specific modems for the  connection. Otherwise youre limited to mbits per second at the same price as the  connection. Which is scandalous.,CanadianHardwareSwap,d7w2zhl,1,t5_32st9
9043956,0,t3_5431q5,Tablet does not have a timestamp. I have removed your post.,CanadianHardwareSwap,d7yxt03,1,t5_32st9
9365844,0,t3_58rksw,Canada computers has the EVGA  ftw for  right now,CanadianHardwareSwap,d936rue,1,t5_32st9
9381812,0,t1_d956gfo,not parting out sorry,CanadianHardwareSwap,d957m7c,1,t5_32st9
9395747,0,t1_d96yeaw,Yeah thats definitely a real concern. Always gotta do a thorough cleaning of any used keyboards.,CanadianHardwareSwap,d96z6k9,1,t5_32st9
9436517,0,t1_d9c2gca,Well pm me an offer then,CanadianHardwareSwap,d9c57ni,1,t5_32st9
9554524,0,t3_5bqu2a,Pm sent.,CanadianHardwareSwap,d9qsixm,1,t5_32st9
9612505,0,t1_d9sa6kh,Was about to message you today for it but it sold! I shouldnt have been so slow P,CanadianHardwareSwap,d9xxs3e,1,t5_32st9
9643029,1,t1_da1m1k6,Yeah same crack a funny in an askreddit massive agree with some people and suddenly youve got thousands of karma to spare. And thats just so you dont get blocked from posting in places with karma requirements for the most part it doesnt matter at all. ,CanadianHardwareSwap,da1pal3,0,t5_32st9
9674863,0,t1_da5fo2o,sure thing!,CanadianHardwareSwap,da5mojz,1,t5_32st9
9709701,0,t1_da9th6g,I would also be willing to throw in a LGA  Intel stock cooler aluminum core andor a cheap no name gtwatt psu for a further discount if you would like these parts or I would offer just one of these if you are willing to sell the  for ,CanadianHardwareSwap,da9xgv3,1,t5_32st9
9730996,0,t1_dacjyzc,Oh shoot! Sorry it is actually for a total of  drives sorry I cant count! haha And  SSD slots. ,CanadianHardwareSwap,dack33k,2,t5_32st9
9776299,0,t1_dai3wqw,Sorry rules are rules. I cant make an exception just for you.,CanadianHardwareSwap,dai57we,1,t5_32st9
9891187,0,t1_dawtxiy,They are likely mining cards. All his posts on reddit are mining threads..,CanadianHardwareSwap,dawuf6f,3,t5_32st9
9914216,0,t3_5hf2en,Removed. Sorry timestamps must be of the items themselves and not just the boxes unless theyre sealed then you take the picture of the seal. Please respond here once youre done and Ill approve the post.,CanadianHardwareSwap,dazugt7,1,t5_32st9
9926540,0,t3_5hm8uk,What i? ,CanadianHardwareSwap,db1gbqe,1,t5_32st9
9986377,0,t3_5im35e,I just upgraded to an EVGA P so Im selling my Antec TruePower w. Im also in Ottawa if youre interested in the PSU.,CanadianHardwareSwap,db994ai,1,t5_32st9
10014143,0,t1_dbcunar,gt MRW dollars  days pretty tight and  dollars  days. These estimates are from canada post website.,CanadianHardwareSwap,dbcvdxq,1,t5_32st9
10255331,0,t3_5muojl,Clarify whether or not thats  for all or  each since its kind of ambiguous.,CanadianHardwareSwap,dc6hxm2,1,t5_32st9
10297138,0,t1_dcayn3o,Do R s have low power consumption?,CanadianHardwareSwap,dcb8iq4,1,t5_32st9
10385077,0,t3_5o27fy,I have a GTX X for sale at ,CanadianHardwareSwap,dcl7o5k,1,t5_32st9
10529852,0,t1_dd1l4mq,shipping,CanadianHardwareSwap,dd1o99f,1,t5_32st9
10649276,0,t1_dda7k1t,An RX  GB was listed here last week for  shipped and sold very fast with tons of replies.,CanadianHardwareSwap,ddee2pr,1,t5_32st9
10796617,0,t1_ddtgd2n,Thanks for the offer. We can afford it but it takes a big bite out of our savings for sure so just trying to get rid of some things. ,CanadianHardwareSwap,ddtle8b,1,t5_32st9
10802400,0,t1_ddu62wc,Yes just the plastic. The pins are all there.,CanadianHardwareSwap,ddu6w7t,1,t5_32st9
10930360,0,t3_5rasa1,k z itx xgb itx case. How much would these sell for?is     in that order reasonable?,CanadianHardwareSwap,de7e1dy,1,t5_32st9
10962509,0,t1_deao1o1,Those motherboards arent in the same class. Take a look at the the pricing history on ca.pcpartpicker.com,CanadianHardwareSwap,deapep6,2,t5_32st9
10972642,0,t1_debqrog,either works fine just looking for a decent deal D,CanadianHardwareSwap,debr1eh,1,t5_32st9
10986767,0,t1_ded4epo,Done. Thank you ,CanadianHardwareSwap,dedbcx8,1,t5_32st9
11029661,0,t3_5x8mbf,FYI Theyve already started to drop. ,CanadianHardwareSwap,dei6qrr,1,t5_32st9
11162003,0,t3_5nfirw,gb DDR  Mhz and a rog viii impact both used for roughly a month stressed for  days straight and not a single hiccup.PM me and we can discuss and send timestamps,CanadianHardwareSwap,dex793a,1,t5_32st9
11174415,0,t1_deyd8tg,Exactly I see s on ebay selling for CAD used in under a day.,CanadianHardwareSwap,deylvpu,1,t5_32st9
11230068,0,t1_df4vmmk,Ya i dont know how i wrote  instead of  little slow today,CanadianHardwareSwap,df4wvzy,1,t5_32st9
11315079,0,t1_dfej4l8,do you have any tb one  ?,CanadianHardwareSwap,dfejo6p,1,t5_32st9
11363753,0,t1_dfjzsif,No because it would be devalued since it would no longer retain its sealed status.,CanadianHardwareSwap,dfk25uw,1,t5_32st9
11384008,0,t1_dfa69ov,hey buddy I got the new processor all installed so the i is now available. Pics are on my post but I would still do what we had agreed if you wanted to do it.,CanadianHardwareSwap,dfmcwcw,1,t5_32st9
11423599,0,t1_dfqujhn,How did you color the shroud without affecting the existing text on it?  ,CanadianHardwareSwap,dfquqm5,1,t5_32st9
11605684,0,t1_dgbdy0e,Picture needs your username and current date,CanadianHardwareSwap,dgbiiij,1,t5_32st9
11726946,0,t3_672tgq,Just looked at your build! Would you be willing to part your ik mobo and memory? Gimme a shout with a price and we can negotiate. In Ottawa as well btw. Can travel to pick up as well.,CanadianHardwareSwap,dgpa32u,0,t5_32st9
11770014,0,t1_dgu4puj,I looked at others posting and it looks like most people just say shipping at cost of buyer.  So I have removed local only flair and removed local pickup info from the notations. Should I create a new post or will you just approve this one?Thanks again sorry for being a pain. I have sold tons of stuff online but never here but thought I would give it a try.,CanadianHardwareSwap,dgu5ukj,1,t5_32st9
11780008,0,t1_dgv96kl,Good to know! Thank you and have fun with the new card!,CanadianHardwareSwap,dgvav7x,1,t5_32st9
11795800,0,t3_683vfk,Pmd,CanadianHardwareSwap,dgx3e7u,1,t5_32st9
