,controversiality,parent_id,body,subreddit,id,score,subreddit_id
83735,0,t3_1v24qh,Scanning for Agent QOPH.  . positive  Marking archived,GetEmployed,cenyn14,0,t5_2uagc
191857,0,t3_1wathx,Watching tv. I spend between  hours on my laptop a day. Weekdays and weekends just blend into nothing. Occasionally I will wake up with a guilty feeling and apply to a string of jobs. And make lists to keep on track. And then fall into the same pattern again. Im glad my husband is here so there is some discipline in my life. If he wasnt around I doubt I would get up from bed.,GetEmployed,cf0ajcm,9,t5_2uagc
192150,0,t3_1wathx,I did a bet on myselfon Stickk.com to get myself to complete at least  applications per week with a Friday deadline  thats a basic way to prevent myself from giving up and it works.  Also it enables me to structure my week somewhat  my weekend are weekends!    Also I make sure to keep some regular social interactions volunteer activities some dates some hanging out with friends and housemates and some minimal physical activities cycling walking light jogging and at least I appreciate that Ive used that free time to learn how to cook frugal and healthy foods.  I love also being able to take a nap everyday!    But yeah its tough and often scary and often lonely and often boring and often painful especially rejections following interviews which I thought went well....  I sure look forward to having a regular income again.,GetEmployed,cf0bqq7,5,t5_2uagc
230851,0,t1_cf4mz0h,Thanks. I will keep thinking about it.,GetEmployed,cf4oc1r,1,t5_2uagc
313654,0,t3_1xm3en,Do a quick search for the average in your area and nationally. Also figure out the cost of living in your local area will also help. ,GetEmployed,cfda2bq,1,t5_2uagc
315445,0,t1_cfdd0j5,Just remember that if you say youll follow up you better do so. If you dont youre throwing yourself under a bus,GetEmployed,cfdgr58,2,t5_2uagc
344305,0,t3_1y16cx,Applicant OutsourcedThis poem to Reddit.com.Its not that good.,GetEmployed,cfggfuj,12,t5_2uagc
388981,0,t3_1yhmn2,Is this a sales position?Does the company have substantial number of employees?  Have the employees been there for a while?Just trying to determine if the company is legit ,GetEmployed,cfl30r8,2,t5_2uagc
491160,0,t1_cfvxrfe,I never understood why people dont just do this. It works every time for me and is always more fun since its at a bar or restaurant. ,GetEmployed,cfw3jpj,1,t5_2uagc
587938,0,t1_cg70clg,I check linkedin  he doesnt have a profile that I could find. There are some industry articles I found and forwarded to him ,GetEmployed,cg73pdx,1,t5_2uagc
599695,0,t1_cfus7cm,Sorry for the late response havent logged into this account in a while.  Did you end up hearing from them?For future reference just simply say that youre following up to see if theyve made a hiring decision and reiterate that youre very interested in the opportunity.  Thats it.I have candidates that will call me every day to followup and that gets old but calling me once a week because youre eager to work is perfectly fine.  If I tell someone Ill call them by X and dont get to for some reason I would expect theyd call me to followup.,GetEmployed,cg8ft2y,1,t5_2uagc
613477,0,t1_cg9xdkh,Yeah my bad. I meant a hyperlink over internship.Also rephrase the part about advance my career. Cant think of something good right now but you get the idea.Good luck!,GetEmployed,cga05ks,1,t5_2uagc
630603,0,t1_cgbgq2r,Yeah I emailed them and more addressed it in the way of just making sure that nothing went wrong with my submission. They are a very large company with dedicated HR but I can understand it taking a long time as they seem very personal and thorough in regards to applicants the last time I emailed an enquiry they took the time to call me to address it. ,GetEmployed,cgby7wg,1,t5_2uagc
741518,0,t1_cgoglv6,First you should scour the Internet and figure out what figure you should request. Then phrasing is just this job usually gets X amount  Id like to start there. ,GetEmployed,cgokdh5,1,t5_2uagc
786655,0,t1_cgthtdo,Thanks for clarifying. Although companies will rarely use snailmail Ive been reading that many recruiters automatically eliminate you if your address is out of the area because they dont want to pay relocation costs and deal with having to fly you in for interviews. Good suggestion on using a friends address and po box.,GetEmployed,cgtp3g3,1,t5_2uagc
789720,0,t3_23714f,You are making up shit to be worried about.,GetEmployed,cgu1mwl,6,t5_2uagc
805703,0,t1_cgvp25r,Sorry to hear that man but yeah you gotta do something else or move if the teaching gig ant working. Or you could work at a Title I school lol. But programming is a motherfucker to learn if your bad with computers and basic logic so I would recommend obtaining your CCNA. You could get this without a degree as long as you pass the test but I would suggest taking  online classes a semester at the local community college cost you like semester and you can qualify for loansaid. You would need around  courses in networking before you would feel comfortable with the material. Also the job opportunities for network engineers are HUGE so is the pay ,GetEmployed,cgvv1xq,2,t5_2uagc
825900,0,t3_23kdxm,Apply and go in and try to follow up in person with a manager directly instead of waiting for a call back. Dont call go in personally. Half of getting hired in a bar is appearance the other half is personality. Neither of those come through in an application.,GetEmployed,cgy5mzr,1,t5_2uagc
1038918,0,t1_chm9zi4,Well in my experiences they would likely contact you after they have already seen your resume. Its likely that they are aware of the absence of these skills on your resume but have contacted you anyway. They may not even talk about those skills much. Ifwhen they ask if you have any experience in those areas say something like unfortunately no I do not have any experience with this but I am definitely willing to learn. Thats what I say when asked. In fact I just got hired to a job where I dont fulfill all the required skills... odds are they will want to know more about what you do have experienceskills in. They probably wouldnt bother contacting you if it were truly pertinent and they had already seen your resume.Hope this is somewhat helpful...,GetEmployed,chmdod9,1,t5_2uagc
1043378,0,t1_chmoggb,You should crosspost this to rchemistry theyd be able to offer more specific advice on where to look and resume tailoring.,GetEmployed,chmvxj7,1,t5_2uagc
1062684,0,t3_2621yx,University bureaucracies can be pretty slow moving so two months dangling in the wind might not be very unusual. Still it wouldnt be out of line to send an inquiry to HR about the progress of your application. I wouldnt try emailing someone personally unless the general email doesnt get you anywhere. Theres no telling if the person you found on LinkedIn would be able to help but they might be annoyedcreeped out at a personal contact in a way that hurts your application without gaining anything.,GetEmployed,chp2yfp,2,t5_2uagc
1065581,0,t3_2689ha,You should never work with a recruiting agency that makes you pay for their services.  EVER.,GetEmployed,chpetj1,2,t5_2uagc
1096568,0,t3_26n1mt,Relax. Be yourself. Firm handshake dont have a weak handshake our youll come off as unassertive even if its a woman. You dont have to squeeze the shit out of the other persons hand though just make your hand firm. Hold eye contact. Smile and show enthusiasm. Personality will win you the job. Oh and dont act all broey or douchie like you got a chip on your shoulder even if your previous job was x harder than this one.Key thing here is to show ambition. In the workplace theres nothing sexier than an ambitious young man...or woman.,GetEmployed,chsxn30,0,t5_2uagc
1161058,0,t3_27ejhy,Temping at companies as an admin and then flexing your IT muscles in front of the right people. I started out with half a degree and a temp job as a male secretary. Not ideal. But I started finding issues in their processes and making nice little MS Access solutions. This was great experience and after  temp jobs the right person noticed and I was hired into IT as a hardware procurement account manager. After a year of that I was programming for them and that led to more programming jobs.  ,GetEmployed,ci08k1a,4,t5_2uagc
1312565,0,t1_cih92ar,Yeesh... that bad huh? Not that Im rejecting your suggestion but damn. I didnt think I was THAT far gone. Ill see what I can do. But Im not sure I have a friend who could pass off as manger material. ,GetEmployed,ciha3rm,2,t5_2uagc
1324749,0,t3_297w25,The more qualified candidate will not always win. Some places like fresh hires they can train them up the way they want to. Dont keep from applying bc you knowthink someone more qualified has applied. You might screw yourself out of a job. For instance the company that hired me recently  did so through their college hire program  they knew that I have no experience and only a bachellors degree. BUT  Id say that since you have  year experience your chances are better than most others who do not. Good luck!,GetEmployed,ciingej,2,t5_2uagc
1378839,0,t3_29vvqu,Do some Google searches as to what the average pay for that position is for someone with your experienceskillseducation.  Glassdoor and Indeed and most other sites will give you a range for what that particular position pays for where you live.  BLS.gov will also give pay ranges for positions.  ,GetEmployed,cip4fgt,3,t5_2uagc
1490357,0,t3_2b7oeh,First look in the job description to pick out key words and make sure you absolutely use those key words on your rsum.Second I asked my friend who works for the government for advice on this. She says that the usajobs.gov website puts your rsum through a tough filter looking for key words. Her advice was to list literally everything that youve ever done that is related to this job. Even if you only worked on a specific project for two hours and that was five years ago. She says you can throw out your onepage rsum it can be as long as it needs to be.,GetEmployed,cj33aky,2,t5_2uagc
1582514,0,t3_2cdrp8,id like to hear some tips as well. I have some experience but not a lot,GetEmployed,cjendcb,1,t5_2uagc
1986210,0,t3_2hfxbo,Try to take something positive away from those interviews ok they might not have gone good but that gives you the opportunity to build off them! Take learned lessons and apply them to your next interview! Remember these companies that you are applying to arent the ones that rejected you they are a new exciting opportunity! You have to get stoked on these places if you dont it shows in the cover letter and eventually in the interview.Why do you say the last interviews did not go well? What exactly happened? Were you not prepared for them? Ive done far too many interviews no I wasnt offered a job for all of them. Just means I wasnt the right fit maybe not the right experience. Its nothing personal and it cant be taken that way. I treat an interview as if I were meeting a client or potential client. Its a chance to sit down to get to know this person the company and really connect with the person. Try to feed off what they are asking or telling you. Small things can go a long way. Lastly keep that chin up! Two interviews really isnt that many in the big scope of things brush it off and keep going! Edit Also fuck them its their loss by not hiring you.,GetEmployed,cksjens,3,t5_2uagc
2022381,0,t3_2hwo50,deleted,GetEmployed,ckww6e4,2,t5_2uagc
2075950,0,t3_2in8uh,deleted,GetEmployed,cl3p5kc,5,t5_2uagc
2158670,0,t1_cldle31,Thats great well done and good luck with it ,GetEmployed,cle7sxe,1,t5_2uagc
2325618,0,t3_2lxe24,. Ask for the manger. If they are not available ask when a better time would be. If they are available move to step . . Hand them your resume. Briefly describe what interests you about this place of work. Should only take a minute or so.. Briefly describe what makes you right for the role ie relevant experience. Should also only take a minute or so.. Thank them for your time and tell them the information on your resume is the best way to reach you.If there is an application involved hand it to them at step ,GetEmployed,clz5rr9,5,t5_2uagc
2330183,0,t1_clzpyr6,Evenings and weekends  the day job takes priority  oh snap Im going to a small town where shops close at . Well at least that narrows down the employment possibilities. Cheers. ,GetEmployed,clzq22s,2,t5_2uagc
2393850,0,t1_cm7imyn,Negotiable and carry on.Benefits  k match time off expected work type of work all goes into  salary range.  Whenever I get asked whats my minimum I ask back whats the budget and it usually goes onto the job descriptionPlay the game,GetEmployed,cm7l5ni,1,t5_2uagc
2548248,0,t1_cmr5utt,Mkay thanks thats what I was thinking.,GetEmployed,cmr6yki,2,t5_2uagc
2831184,0,t1_cnpwemw,deleted,GetEmployed,cnpwft9,1,t5_2uagc
2839616,0,t3_2sj8x4,deleted,GetEmployed,cnquzqh,1,t5_2uagc
2956102,0,t3_2tylc3,Call them and ask for the email of someone who can do something. ,GetEmployed,co44gaa,1,t5_2uagc
2958747,0,t1_co4ecj8,I havent personally came across any spammers! Many ask for an email which I would use as a cover letter and a resume so it may be a collector or a phone call. I only reply to ads that mention a specific company and a pay rate.If Im tempted to apply but iffy on whether a job is legitimate or not Ill look up the number name of the recruiter sometimes Ill find a LinkedIn which is great if I get an interview with them! or name of the company. If it hooks up with a legit site Ill usually shoot them an application!,GetEmployed,co4f9za,1,t5_2uagc
3040007,0,t3_2uxlws,Dont turn down the k matching donations...unless maybe the opportunity cost of delaying access to your money is a problem perhaps.,GetEmployed,cod3fqv,1,t5_2uagc
3099653,0,t1_coj9l83,I wouldnt hire you. Id report you to the IRS. ,GetEmployed,coja07c,3,t5_2uagc
3100162,0,t1_cojb9ss,deleted,GetEmployed,cojbwmp,1,t5_2uagc
3429644,0,t1_cpity8z,gtlike dress codeAnswered by opening your eyes and looking around.gt and what type of benefits the organization offersDoesnt matter. As long as theres money.gtthen indicated that your questions have already been answered. This shows that you at least had questions.This is what I do.,GetEmployed,cpj7e90,4,t5_2uagc
3457965,0,t1_cpm5vx1,Well that is good to hear,GetEmployed,cpmfmds,2,t5_2uagc
3602250,0,t3_31lj5h,Eitheror.  My wifes previous employer would receive so many applications for every job posting that they typically only kept them posted for a week tops.  Then they began weeding.  ,GetEmployed,cq2vrmt,3,t5_2uagc
3830786,0,t1_cqsuep9,Agreed.  Since this all happened so recently I am sure theyd be more interested in hiring you than going through the process of interviewing people all over again.  The only issue is that they may realize that youd bounce for a better offer as soon as it came around.,GetEmployed,cqsxxh4,9,t5_2uagc
3964072,0,t1_cr7c8ip,Yeah this is true thats something Ill keep in mind. I heard porn is hiring editors...,GetEmployed,cr84ymt,1,t5_2uagc
3990659,0,t3_366119,since you are in US here are some contacts,GetEmployed,crb63vo,1,t5_2uagc
4561565,0,t3_3dfzrc,Howd you get in it the first time? Can you just do that again?,GetEmployed,ct5lo97,2,t5_2uagc
4954370,0,t1_cuj0w1p,Hey thanks for your input! That is the right idea. To have positionrelated templates. Cheers.,GetEmployed,cuj1e3w,2,t5_2uagc
5045243,0,t3_3jzjdo,I run into an issue of Wanting to chase down every last detail in interviews when I get them. I also feel I look terrible on paper since I have had to take the first job that came along since graduation. So it looks spotty and the employers havent exactly been... a positive influence on me. But I feel the same way you seem to with the whole search thing. But heres some suggestions on how to break out of the analysis paralysisCome up with  answers that you want to give in the interview.  Accomplishments ideas.. whatever. Come up with  and work them into the interview as best you can. Find a way to meditate for about  min. before the interview. Just let your mind be free and still. Sit in your car in the parking lot or even in the restroom if you have to. Put your focus on the interviewer during the interviewer and stay present with the interviewer. You can analyze the data afterward the interview itself is just data collection. You need to know what the interviewer expects. Dont worry about selling. You know who worries about selling? Shitty Salesmen. Good salesmen dont sell you anything they just provide information. You mention being a biologist... if youre good enough to publish a paper youre good at providing information. The only pressure you have is to get the job... thats an external pressure that you ultimately have no control over. There is no need to worry about things you have no control over. All you can do is provide clear accurate information and gather the best data you can on what they will expect of you. ,GetEmployed,cuu568z,1,t5_2uagc
5045342,0,t3_3j8uzl,I just got off the job market and apparently had a firecracker of a resume. I wouldnt spend a cent on a resume writing service unless you can meet the person whos helping facetoface. Absolutely dont use an online service.  Staffing and recruiting agencies will also help you tailor your resume to the position youre applying for and they charge the employer rather than you so thats the route I would go. Even my resume had some notes that the recruiters coached me on.  I would be interested in seeing his resume. I bought a whole book on resume writing when I was on the job hunt and was disappointed that I only got to write one resume using what I learned from it so Id be happy to help.,GetEmployed,cuu5lp6,2,t5_2uagc
5167489,0,t3_3kybim,Its important to remember that every interview is a twoway street. You should be interviewing the employer just as much as theyre interviewing you because you both need to walk away convinced that the job would be a great fit.So when the tables are turned and the interviewer asks Do you have any questions for me? take advantage of this opportunity. Its the best way to determine if youd be happy working for this employer and whether your goals are aligned with theirs.Here are  questions you should consider asking in a job interview if they werent already answered to help you get a better sense of the role and the company and to help you prepare for the next steps. Who do you think would be the ideal candidate for this position and how do I compare?. Who held this position previously? Why is heshe leaving the role?. What do you like most about working for this company?. Can you walk me through the typical day of someone in this role?. How do you evaluate success here?. How would you describe the companys culture?. Will I have an opportunity to meet those who would be part of my staffmy manager during the interview process?. Can you tell me what steps need to be completed before your company can generate an offer?. What distinguishes this company from its competitors?. Is there anyone else I need to meet with?Is there anyone else you would like me to meet with?. Is there anything we havent covered that you think is important to know about working here?. Is there anything else I can provide to help you make your decision?. What can I do to show you Im a great fit for this job?. Beyond the hard skills required to successfully perform this job what soft skills would serve the company and position best?. Whats your timeline for making a decision and when can I expect to hear back from you?Source  Business Insider,GetEmployed,cv8vfox,2,t5_2uagc
5248577,0,t1_cvil6om,Cool thank you for the kind words advice and encouragement.,GetEmployed,cvin4x4,1,t5_2uagc
5281283,0,t3_3nbqn1,Im in the same boat. In the last year of a post doc grant and my PI decided to move the lab. Im married and have a child on the way. Ive been applying for everything and anything. Most people say well you have nice credentials but this is a totally different field. Its been an uphill battle. So I am pretty much just carpet bombing the Internet until someone takes a chance on me. ,GetEmployed,cvmquh5,1,t5_2uagc
5622006,0,t3_3s29rm,People always recommend Excel. I dont know how close it can be to your field but I think almost every place uses some form of Excel. Advanced Excel tools I hear is where its at.,GetEmployed,cwtyp1w,3,t5_2uagc
5804699,0,t3_3uod87, applications per is a really low amount. Hit the applications harder. Also network with alumni of your school in each of your desired industries by requesting an informational interview. Tell them you are interested in what they do and would like to hear more about it. You can be honest about where you are in the job search but dont beg them for a job. ,GetEmployed,cxgmlo4,9,t5_2uagc
5864128,0,t1_cxmxoe9,I like this guide. I usually have a brief introduction and some bullets as to why Im exceptionally well suited for the role. Your dad is right. People spend very little time scanning through resumes and will spend even less time on a cover letter. Imagine you have a pile to look at very little time to review each one as you proof read yours. Put yourself in the mind of the hiring manager.,GetEmployed,cxobg4v,2,t5_2uagc
5987590,0,t3_3xev61,deleted,GetEmployed,cy4i64e,2,t5_2uagc
6521004,0,t3_44ww4s,THIS there are a lot of unscrupulous companies preying on the naive hardworking and desperate college grads. ,GetEmployed,czttn3l,11,t5_2uagc
6552059,0,t3_451xbx,Congrats on getting an interview! Ive always been pretty good at interviews and then worked for a tech company conducting interviews for a bit over a year so Ive been exposed to some great and bad interviews.First of all be mindful of your social media presence. Especially considering you will be working with kids.I always learn everything I can about the company and the position. Know their goals and vision and try to communicate how hiring you will help them achieve it. Learn about their company culture and values. Sometimes with a little research you can figure out what they value. An example my company valued honestly and the ability to admit and learning from your mistakes. We looked for reasonable people who understood nobody is perfect but you always try harder next time. When we asked about a candidates failures and their response was sincere and honest we knew they would fit well culturally.I would also study interview questions. Try googling the company websites like interviewcake and glassdoor will have posts from employees which will often include specific questions. Additionally I review commonly asked interview questions. Its a good exercise to have some answers in mind so you arent stumped.That is a good resource.At the end they will ask you if you have any questions. this seems like a pretty good resource. Try to ask at least  questions. I personally refrain from asking about money.And finally the best advice I was given  embrace the silence. Once they ask you a question try to give a direct and concise answer. As the interviewer I would need a minute to document the response. Silence can make you uneasy or make you start questioning your response. Be confident in your answers and you will do great!,GetEmployed,czx1c3d,1,t5_2uagc
6640947,0,t3_46beir,Yes just ask to see if they are able to accommodate what you want.,GetEmployed,d068cfi,1,t5_2uagc
6641855,0,t3_46ld0y,I may be wrong but as I understand most jobs must legally be listed on the website if the company is looking. ,GetEmployed,d06bq0q,1,t5_2uagc
7276013,0,t1_d2587cm,Got it. Thanks for the feedback.Will fix the things you have mentioned.Agreed the company names do no make sense under some common questions. Thanks again!,GetEmployed,d258ffg,1,t5_2uagc
7495973,0,t1_d2u7mgw,From my experience the interviews with the Senior VP is usually to see if youll fit well with the team mainly. Usually the Senior VP is not very technical depends what youre applying for. Ive had some where we just chatted about the industry and how the company is performing. What Id recommend is read up on some behavioral questions explain a time where you had difficulty with a coworker and such look up the company for recent actives in the news so youll be able to ask Oh I see the company has acquired  how do you think this will affect the company and if the company has a glassdoor page do some research if they ask some brain teasers if so then look some up! Practice these discussions out loud like talking to yourself it helped me TREMENDOUSLY since it allowed me frame some of my answers before the interview.Hopefully this helps! Smile be happy and try to turn it into a conversation like fitting your question while just talking. Good luck!!,GetEmployed,d2u943a,2,t5_2uagc
7585777,0,t3_4j7hzw,I dont see many situations where youd need a CV or a cover letter for a part time job. To answer your question though open cover letters by directly addressing the person with power to hire you. The body of the letter should serve as a personal narrative providing the humanelement complement to your CV. Tie yourself to the job show that youre the puzzle piece with exactly the edges theyre looking for and perhaps request an interview.Really though dont do that for a part time job. Just fill out their application and be charming when you hand it to them. If you cant be charming at least make sure theyll remember your name. Good luck!,GetEmployed,d34gs1s,1,t5_2uagc
7719620,0,t1_d3jgx7v,I agree on the with the certifications.I disagree on certifications being necessarily always shunted intowith the education section. There are times when such things can be included in the skills section near the top.,GetEmployed,d3jo1x3,1,t5_2uagc
8428037,0,t1_d5u51kj,Skip it then.,GetEmployed,d5v1nsh,2,t5_2uagc
8602827,0,t3_4xndpa,People still have objectives on resumes?,GetEmployed,d6gy499,1,t5_2uagc
