,controversiality,parent_id,body,subreddit,id,score,subreddit_id
6246842,0,t1_cyzlu8i,Ted Cruz and other republicans are seeking to abolish the Department of Energy the single largest source of research funding for all kinds of energy from solar to nuclear.,EverythingScience,cyzp5dr,2,t5_2zlwp
6256750,0,t1_cz0nqcr,I have in all the time Ive been on facebook posted one nonprofile pic of myself to my timeline and that photo included my new sisterinlaw. About  of my profile pics feature me and another person.I use photoshop to mask blemishes because I often have big pimples Im sure no one wants to look at.,EverythingScience,cz0toad,3,t5_2zlwp
6265946,0,t1_cz1nnp6,gt There are reasonable arguments for monogamous relationships but the ones that lean on emotions like jealousy always bug me.Isnt this the main reason for monogamous relationships?,EverythingScience,cz1v9q8,5,t5_2zlwp
6328597,0,t1_cz8ai3x,Thats what my students have deduced.,EverythingScience,cz8zq6w,1,t5_2zlwp
6365517,0,t1_czd5f8h,Or Florida Kid dies of overdose in school officials are blaming the incident on the theft of drugs by Florida Man.,EverythingScience,czd6tga,2,t5_2zlwp
6370994,0,t3_42x2az,It wasnt possible to fake the video in . It was actually easier to land on the moon than to fake the video with technology that didnt exist yet,EverythingScience,czdt8ji,20,t5_2zlwp
6408159,1,t3_43gnmp,I saw this posted elsewhere and would appreciate a look from the folks here.,EverythingScience,czi1jqk,1,t5_2zlwp
6421209,0,t1_czjfzu2,I will credit that he is using it correctly but people really really really need to stop saying this when they are referencing empirical papers in economics or for that matter any social or natural science that takes their statistics seriously. The phrase correlation is not causation is undergrad level statistics and no well published paper is failing to recognize that fact. These papers are very often completely wrong but it is not because the authors dont realize that correlation is not causation.,EverythingScience,czjhmvk,3,t5_2zlwp
6462085,0,t1_cznpt9t,They are planning for  million degrees celsius.,EverythingScience,cznq1j2,1,t5_2zlwp
6491816,0,t1_czqrbol,You cant patent things that are already published.  Yes there are weasels and trolls who sometimes win but people are working on that problem too.,EverythingScience,czqsw91,3,t5_2zlwp
6520025,0,t3_44w8lb,Results are in    Hes just fucking creepy.  Not too much science needed.  Sociopaths tend to give off a creepy vibe when they are pretending to be human and have feelings.    ,EverythingScience,cztpzlv,4,t5_2zlwp
6530681,0,t3_4531fc,Very interesting. gtdefensivenessstonewalling the silent treatmentcriticism andcontemptI could deal with the first three. The last one was the deal breaker for me. I would completely shut down and shut out anyone who ever expressed such an emotion toward me. Every time. ,EverythingScience,czutoci,6,t5_2zlwp
6532942,0,t3_4531fc,deleted,EverythingScience,czv23wx,-7,t5_2zlwp
6574648,0,t1_czzcz2k,Holy crap really? I was always under the impression that there was some small monetary compensation by the publisher for your expertise.Well then sounds like the scenario I gave is even more likely to work.,EverythingScience,czzdftw,11,t5_2zlwp
6575159,0,t1_czzbqg2,gt This movement is about making published science available to everyman and everywoman. For the most part at least in the first world working scientists do have access to most papers in our disciplinary fields.This is a rather blithe dismissal of scientists working at poorer institutions. If researchers cant access the literature because they work at an institute that cant afford the subscription packages that the big publishers force you to buy then it actively holds back scientific progress. Even well funded universities cant afford to subscribe to everything as Im sure you know. Giving scientists access to the research they need isnt a happy bonus to open access it should be one of its core goals.I dont think anyone doubts that publishing research costs money but the big publishing houses not society journals have obscene profit margins of around  that are maintained by operating practices that bleed money from the public purse. This all on top of the fact that they get the content and editing for free and actively hamper the progress of research.I dont think the situation with APCs is as dire as you say and many open access journals like PLOS have APC waivers or assistance programs for researchers who dont have funds available to pay them. Im not sure if theyre the right way to solve the problem of access but the bizarre situation we currently have where publicly funded research is being given away and published under lock and key in privately owned forprofit magazines needs to end.,EverythingScience,czzfc4e,2,t5_2zlwp
6580553,0,t3_45ta0b,Please do not submit Wikipedia pages.I am a bot and this action was performed automatically. Please contact the moderators of this subredditmessagecompose?torEverythingScience if you have any questions or concerns.,EverythingScience,czzze8i,1,t5_2zlwp
6611702,0,t3_462lsa,Why is this in a science sub? Gtfo with your fearmongering bs,EverythingScience,d037f8h,-1,t5_2zlwp
6637579,0,t1_d05vau8,True but most people like me can get off of them with altering diet andor surgery to fix the actually problem. Fixing the cause instead of masking. Theres a good chance the original cause is what is leading to dementia and not necessarily the meds. If youre masking the cause with meds you never take care of the real problem.,EverythingScience,d05vs24,-2,t5_2zlwp
6650603,0,t1_d072ul7,Gene drives currently seem to hold the most promise. ,EverythingScience,d078a8j,1,t5_2zlwp
6725581,0,t3_47piau,This video is private,EverythingScience,d0ezf1s,3,t5_2zlwp
6735427,0,t3_47wzap,This best video I have seen on how encryption works on the iPhone. Then explaining what the FBI wants to do and why Apple wont do it.,EverythingScience,d0g02mw,2,t5_2zlwp
6764165,0,t1_d0it105,Excellent point thank you.,EverythingScience,d0izwuj,1,t5_2zlwp
6773950,0,t1_d0k24k3,Yeah you would think this would fascinate and thrill the mind but we take some of the incredible knowledge we have earned for granted sometimes. ,EverythingScience,d0k3z2c,3,t5_2zlwp
6779802,0,t3_48mmjm,I hope this submission is acceptable under Rule gt Educational videos are encouraged as long as they are from a reputable source.Disclaimer I work for CMS and wrote the script for this video.,EverythingScience,d0krwc4,1,t5_2zlwp
6782970,0,t3_48k7po,Cuba has a similar vaccine for lung cancer...Not sure about the details but its been around since .,EverythingScience,d0l4vnz,1,t5_2zlwp
6787194,0,t1_d0ll7uc,Shit and dynamite,EverythingScience,d0lm6x6,2,t5_2zlwp
6808133,1,t3_48zaec,rtrypophobia with that first image.,EverythingScience,d0nzy1i,-1,t5_2zlwp
6825018,0,t3_496uqi,I used to write software for surgeons to plan operations for doing DBS on Parkinsons patients. Learnt a fair bit about it and Ive seen plenty of videos and surgeries  although sadly I never got to speak to anyone in person. If youve got any questions about this sorta thing Id be happy to try to answer any. Im a software engineer not a brain surgeon though!,EverythingScience,d0pwy2z,3,t5_2zlwp
6862172,0,t3_49r9jh,Ive been working with scientists to help them communicate more effectively for about a decade. This video is one that scientists across disciplines love analyzing and I thought the folks who follow this subReddit might find it interesting too! Hope its cool to share.,EverythingScience,d0u4xyh,2,t5_2zlwp
6877787,0,t1_d0vmn33,I guess the question is do we have the right to let cows and other livestock go extinct just because we dont need them any more?,EverythingScience,d0vwsoh,1,t5_2zlwp
6912235,0,t3_4ad0f4,Shit Im headed up there in April for work...,EverythingScience,d0ztmya,1,t5_2zlwp
6946989,0,t3_4atcei,Good work,EverythingScience,d13rsub,3,t5_2zlwp
6974978,0,t1_d16y0ck,Willful ignorance absolutely is. Denial when youre simply overwhelmed is forgivable unless youre the one empowered to do something about whats happening before its too late and you refuse to budge because you insist nothings wrong then you need to step aside or be removed.,EverythingScience,d16y9bu,4,t5_2zlwp
7040472,0,t1_d1ecm9r,Other things that could be solved with additional patient will power STDs Obesity Smoking induced illnesses etc. In practice research sited in the article says that education on the patient end is only providing a small improvement. Your suggestion was tried and didnt help that much. Not a reason not to keep trying it but its not solving it by itself and physicians are the gatekeepers here. Its not obesity  the doctor doesnt need to sign something for a patient to eat a donut.,EverythingScience,d1ee7fa,4,t5_2zlwp
7047498,0,t1_d1f6lrc,Buttonholes are pretty good too. Actually invented much later than the button itself.,EverythingScience,d1f6wte,3,t5_2zlwp
7048958,0,t1_d1fctt3,Thanks ,EverythingScience,d1fcveb,1,t5_2zlwp
7104336,0,t1_d1lif2r,Some have suggested that a preemptive strike will immediately follow any extraterrestrial contact because of the relative ease of manual asteroid bombardment. ,EverythingScience,d1lndz3,1,t5_2zlwp
7105960,0,t1_d1laez1,How quaint!,EverythingScience,d1lu1xs,1,t5_2zlwp
7128638,0,t1_d1o7k1m,removed,EverythingScience,d1og1ya,1,t5_2zlwp
7131003,0,t1_d1opf0g,Well I wasnt deriving that assertion from this article at all. I was talking about the B studies not the fatty acid studies. And I qualified it with possible that because I think we would have to be sure that those people actually need the B to be healthy rather than just assume. Its likely but not certain. ,EverythingScience,d1oprjw,1,t5_2zlwp
7140109,0,t3_4dc9h8,When shoemakerlevy struck jupiter  of the  resulting impacts caused explosions larger than our planet.Makes one wonder why we are wasting our potential squabbling over pretend wealth instead of protecting our future.,EverythingScience,d1pr4tc,7,t5_2zlwp
7145839,0,t3_4dbybr,My monkey brain wants symmetry. It wants to think of black holes like the nucleus of an atom and of the stars as electrons spinning and creating a field we cant see because of our size and the way we experience time.,EverythingScience,d1qenqe,3,t5_2zlwp
7164768,0,t3_4dkyta,Hopefully for every one you see there are a few more hidden. Hopefully  ,EverythingScience,d1skdhk,5,t5_2zlwp
7176443,0,t1_d1tkwbl,which scandals?,EverythingScience,d1tw9gb,4,t5_2zlwp
7188318,0,t1_d1v8vyz,I agree.,EverythingScience,d1v90lq,1,t5_2zlwp
7193281,0,t1_d1vt3kr,I never knew...,EverythingScience,d1vtewb,2,t5_2zlwp
7193514,0,t3_4dzapo,removed,EverythingScience,d1vudaw,1,t5_2zlwp
7193660,0,t3_4dzapo,deleted,EverythingScience,d1vuyuj,1,t5_2zlwp
7194140,0,t1_d1vu2qb,Then whats proven? Nothing?,EverythingScience,d1vwxr7,2,t5_2zlwp
7194182,0,t3_4dzapo,How is OCD not on this list? The number of people who use that term to indicate someone who is anal andor detail oriented is absurd.As an actual sufferer of OCD I die a little inside every time someone posts a picture of a wellorganized DVD shelf or something similar with the caption lol look how OCD I am. Bitch you aint OCD youre an asshole. Walk in my shoes of inexplicably repetitive thoughts and actions you have zero control over and then tell me how it merits an lol.,EverythingScience,d1vx3ym,2,t5_2zlwp
7194458,0,t1_d1vx8y3,deleted,EverythingScience,d1vy8nr,1,t5_2zlwp
7195663,0,t1_d1vrhyb,deleted,EverythingScience,d1w369m,1,t5_2zlwp
7195983,0,t1_d1vr4da,I edit prepublication articles for secondlanguage English speakers mostly submitting to psychology journals. I see p  . all the time and I have a nice canned comment that I insert every time to ensure it never happens again.,EverythingScience,d1w4hh3,2,t5_2zlwp
7197224,0,t1_d1w32k8,gt  you probably did have some extant internal destabilization How would you know?  How would anyone but her him?  probably her on account of the cheerleading and figure skating know or be able to judge this?  I realize youre not trying to be offensive but this sentence reeks of the paternalism that can be quite prevalent in the medical profession.,EverythingScience,d1w9ksb,1,t5_2zlwp
7204863,0,t1_d1wkuaf,Thank you so much and thank you so much for taking an interest in general public healthcare. Again the thing that gets me those kids in the outreach program were only there because they had health insurance. To get into that outreach program you must have been displaying some kind of behaviour to get you pulled from school. So what happens to the kids who are acting out because of mental disease or problems at home when they dont have health insurance? How many kids who end up in juvenile hall arent acting out because of forces either beyond their control or forces they cant control? Ive been told that the side effects I got from the medicines sounded a lot like what bi polar itself feels like. Imagine thats only a tiny tiny facsimile of what these people feel every day of their lives. After three months I had fought with everyone around me for no discernible reason. After four months I was so tired of being constantly sad or angry and never knowing why I felt like I was going mad like my mind was being torn in two. It was a living waking hell. And there are people who go through this every single day. That blows my mind. I couldnt stand six months of it how can they stand a lifetime having their mind basically at war with itself? Having thoughts you cant control? Feelings you dont understand because they come out of the clear blue? And powerful feelings too I never felt anything like that ever again even at the saddest moments in my life. Like this massive catastrophic panic or immense fear. It blows my mind that people are capable of feeling that every day or every other day or every week and that theyre capable of surviving that. Again we underestimate human tenacity to an incredible degree. We talk a lot about the victims of depression and bi polar when they succumb to it but the ones who survive it? Every day? Holy shit. Thats incredible to me. That shows a strength that is just I dont know superhuman. The therapy the medicine everything a person is willing to go to just to keep on living to be happy. I cant imagine how they do it. You always hear the tragic stories of how bi polar or schizophrenia tear families apart but you never hear the stories of the people who live with it and find their happiness. A dear friend of mine in the outreach program had paranoid schizophrenia but had responded well to the medicine. But as she explained it to me it wasnt that it made the hallucinations go away it just made her aware of them being hallucinations. Once I finally asked her what that was like and she calmly explained to me that as she and I stood there talking by the bus stop she could see a thing watching us from a nearby light pole. And that was how it was every day. If I hadnt asked her I would have never known. She was outgoing she was very social and personable. She was living her life as normally as you could imagine. Youd never know unless she told you. That girl was all of fifteen years old. I still think back on this and Im completely staggered. But without help no one can be expected to survive like this. Our treatment of people who suffer from mental conditions is absurd. You see them out in Skid Row in LA and in the streets of Orange County too. Nevada was recently caught simply gathering up their mentally ill homeless and putting them on a bus to LA. Just a couple of days ago there was this tiny old man walking in the middle of traffic bewildered talking at random having absolutely no notion that he was in the middle of moving traffic. Another time in a really cold rainy day there was another old homeless man pushing a shopping cart and screaming and ranting at random alone in the cold in soaking wet clothes. How is this humane?,EverythingScience,d1x4vse,3,t5_2zlwp
7215693,0,t1_d1y8u4u,A lot of people live in the Bronx. ,EverythingScience,d1yd9jo,1,t5_2zlwp
7231440,0,t1_d205on1,removed,EverythingScience,d205trw,3,t5_2zlwp
7234170,0,t1_d208e32,Youre right. NOAANWS has and may still have contracts with some of these companies. ,EverythingScience,d20h0mb,1,t5_2zlwp
7280089,0,t3_4f2wou,Well he made a fair stab at it. He wasnt quite correct but points for trying.,EverythingScience,d25p4fq,8,t5_2zlwp
7326896,0,t3_4fozmt,removed,EverythingScience,d2b0ns6,2,t5_2zlwp
7369092,0,t1_d2fqiu0,I dont think this is generally true at all  all the PIs in my department had to spend their own grant money on submissions. Its still government money but thats money thats coming out of their grants.I agree that it might be easier for governments to subsidize journals but then you run into the problem of how do new journals start up? You also run into the problem of journal staff editors etc needing to be paid and government positions tend to not be particularly lucrative. ,EverythingScience,d2ftc8b,2,t5_2zlwp
7436242,0,t1_d2nainy,Ive had norovirus twice. Its the only time in my life Ive thought Id be OK if I just died right now. Fucking miserable.Talked to the on call nurses they knew exactly what it was knew it was going around. No question they were aware.,EverythingScience,d2ngbgl,8,t5_2zlwp
7468502,0,t3_4hm20x,That anomalously hard round stable carbon molecule shape youre looking for? err... ever seen a soccer ball?,EverythingScience,d2r4fns,1,t5_2zlwp
7521175,0,t1_d2x1lqr,gt The problem with biology is that everything can change based on the lighting of the room what day it is and what mood youre in.I mean this is genuinely true. How sunny it is can affect happiness research. Humans be complicated.,EverythingScience,d2x4cwx,12,t5_2zlwp
7522966,0,t3_4i9njc,Im rooting for the grizzlies.,EverythingScience,d2xboi2,0,t5_2zlwp
7523405,0,t1_d2x4cwx,Thats the point of proper randomized control samples in the same conditions ideally in the same room at the same time.,EverythingScience,d2xdh4i,1,t5_2zlwp
7543437,0,t1_d2zn9zz,removed,EverythingScience,d2znhlx,-3,t5_2zlwp
7544340,0,t1_d2zgw52,He was actually singing it backwards in the lipsync though if you watch the making of you can see him doing everything backwards and also vocalising it but in the final cut he obviously overlaid the proper audio. ,EverythingScience,d2zr6ei,3,t5_2zlwp
7568857,0,t1_d328sfd,You want to use GMO to wipe out a species and use that to tell people its safe for food? ,EverythingScience,d32jixo,0,t5_2zlwp
7597252,0,t1_d35dtf2,Youre posting anecdotes and posing them as legitimate evidence... on a sub called rEverythingScience...Right well Ill just unsub now if this is the best I can expect from this population.,EverythingScience,d35rpea,2,t5_2zlwp
7598677,0,t1_d35a2oq,Most banks also now require two forms of identification to even cash a check drawn from that bank one of which can no longer be a social security card. Here are some acceptable forms of secondary identification few poor people have access to college ID military ID and credit card.,EverythingScience,d35xjlf,1,t5_2zlwp
7624103,0,t1_d38nml6,Yeah but there are also troves of anecdotal evidence that suggest this effect. It certainly helped me with anxieties. Granted its a very bad idea of you have family history of delusions or schizophrenia and the like or latent mental illness but how could you know?. Its not a miracle drug but you would be foolish to dismiss it. This conclusion isnt founded on nothing. ,EverythingScience,d38tiym,2,t5_2zlwp
7624166,0,t1_d38nml6,I wonder how it would impact the amount cured if they included a therapy aspect similar to MDMA assisted PTSD therapy thats got like  cure rate for PTSD.Interesting to think,EverythingScience,d38ts7m,6,t5_2zlwp
7638036,0,t3_4jxky4,The editorial that sparked this discussion can be found here,EverythingScience,d3aeh9x,1,t5_2zlwp
7752248,0,t3_4lhc44,I used to work in a restaurant and would process a lot of avocados. Wed treat it with lemon or lime juice to keep it from going brown. Something about the citric acid prevents the avocado from oxidizing. You can also do the same thing with apple slices.,EverythingScience,d3ndfkz,2,t5_2zlwp
7760859,0,t1_d3oc5g2,removed,EverythingScience,d3oclda,0,t5_2zlwp
7766649,0,t3_4lklqb,deleted,EverythingScience,d3p08r6,1,t5_2zlwp
7806425,0,t1_d3tguz4,But that applies to everything. Im sure you drive a car that could be more economical. Perhaps you could ride a bike or get a job that doesnt require a commute even if it meant lower pay or you didnt like it as much. You could live in a  sg ft houseapt. Get some roommates andor perhaps just live in a tent. Youre on the Internet wasting time. Burning up resources. Whats up with that!?Im not trying to be a prick Im making a point. The point is we all have some level of luxury in our lives that we want and...well...that we deserve. We are hard working humans on the most part. We are here to live and thrive. And in the grand scheme of things giving this and that up is really not going to save the planet. Even if everyone slimmed down we still have  billion people on the planet that need heat and food and shelter. That will always be a lot of energy. Even if you cut off . What someones drives down the road is really no one elses business. Perhaps its a hybrid or they offset it in other ways. Perhaps the live in a small home or they grow all their own foods. Perhaps they just waste  more energy than the Honda sitting next to them or decided that it made more sense than the negative effects of purchasing a new Tesla or Prius. Lastly some people just need big SUVs and trucks. Even if you see them as a single occupant it might be a work truck or perhaps they have  or  kids. Or whatever.  Bottom line when we bitch about the energy use of others and when we cry and whine about climate change we are all just hypocrites. ,EverythingScience,d3ti60n,1,t5_2zlwp
7836075,0,t1_d3wu44d,Not necessarily. A lot of people really want kids but dont have them because its a huge financial burdenedit tnx. One might argue that people who are burdenededit augh by their kids might end up regretting having them.,EverythingScience,d3wuc12,18,t5_2zlwp
7883859,0,t3_4na67b,All that technology to fool you into thinking youre seeing the scenery as you zip by...Seems like they should just make the tube and pods out of transparent aluminum.,EverythingScience,d427vpk,1,t5_2zlwp
7933375,0,t1_d47r9fw,gtThis invention involves a cloning or expression vector comprising a gene which encodes enolpyruvylshikimatephosphate synthase EPSPS polypeptide which when expressed in a plant cell contains a chloroplast transit peptide which allows the polypeptide or an enzymatically active portion thereof to be transported from the cytoplasm of the plant cell into a chloroplast in the plant cell and confers a substantial degree of glyphosate resistance upon the plant cell and plants regenerated therefrom.gtThe EPSPS coding sequence may be ligated to a strong promoter such as the S promoter from cauliflower mosaic virus to create a chimeric gene. Such genes can be inserted into plant transformation vectors and subsequently introduced into plant cells. Plant cells transformed using such genes and plants regenerated therefrom have been shown to exhibit a substantial degree of glyphosate resistance.Does that look like a plant patent?For reference heres your yam patent ,EverythingScience,d47sb2e,0,t5_2zlwp
7935114,0,t1_d47xjqk,deleted,EverythingScience,d47zcje,1,t5_2zlwp
7964001,0,t1_d4aywju,Im really not trying to be preachy but thats why I latched onto Bernie. There are A LOT of people who honestly think they have the same chance as a Clinton or Bush to be president. Whether Bernies solutions are correct or not I think his assessment is true. ,EverythingScience,d4b8a4w,2,t5_2zlwp
7966019,0,t3_4ob0k8,Interesting. Now if only this was from a nonUSA Today source so I could share it without shame.,EverythingScience,d4bgffr,4,t5_2zlwp
7973492,0,t1_d4bsgbz,Oh honey. ,EverythingScience,d4canu6,6,t5_2zlwp
7986612,0,t3_4ok0v1,This is some really awesome work cant wait to see how it progresses.,EverythingScience,d4drrp9,1,t5_2zlwp
7993716,0,t1_d4ebogr,Yeah. Proprietary publishing is awesome. Theyve covered all the bases for us. No need to fix anything because scientific publishing is perfect ,EverythingScience,d4ekioa,-11,t5_2zlwp
8023607,0,t1_d4hjyf0,You are familiar with the extensive research that big tobacco funded to push a political agenda for decades right? Performing research can definitely be pushing an agenda. I have no reason to believe that it is in this case but its disingenuous to act as if there can never be overlap between the two.Edit autocorrect,EverythingScience,d4hxfru,2,t5_2zlwp
8047462,0,t3_4pd2wm,Reminds me of Andrew Crosses experiments that apparently produced insects,EverythingScience,d4klzjl,1,t5_2zlwp
8052522,0,t3_4pgryq,Wouldnt that just mean that only the  reproduces and soon after all the bacteria will be resistant to drugs and this stuff?,EverythingScience,d4l6gj5,8,t5_2zlwp
