,controversiality,parent_id,body,subreddit,id,score,subreddit_id
4444,0,t3_1u6abv,Always wanted to run DoA but I was never in a guild that wanted to. I can pick up the other Mesmer role if we get people.IGN Newland I X,GuildWars,ceexywn,1,t5_2quyl
13249,0,t1_cefx3ng,I do not have Steam although I guess they have it for Linux now so I should install it just to support them ... but I only play Guild Wars.  Caliban has been my email address one of them at least since .  I got my account when I was in college.  Caliban is a character from The Tempest by Shakespeare.  One time when I was at the school library I came across an edition that was written in the s.  It described caliban simply as A retarded savage.  I myself being a retarded savage decided at that time it was an appropriate name for an email address ,GuildWars,cefxy3a,2,t5_2quyl
54521,0,t1_ceklf77,deleted,GuildWars,cekmy3u,1,t5_2quyl
68541,0,t1_celrev4,You know how I do! And yea it will be nice to give people hope rather than disappointment. ,GuildWars,cem8e0h,1,t5_2quyl
102458,0,t1_ceps888,p ftw Dhurts my eyes!,GuildWars,ceq3gsy,2,t5_2quyl
110019,0,t3_1vc844,deleted,GuildWars,ceqyicb,1,t5_2quyl
113945,0,t1_cera1pn, This. Anyone is able to join. Can only have  people maximum in the run however.,GuildWars,cerelef,1,t5_2quyl
134770,0,t1_cetqv0b,Or during RA week!  Which is next week.,GuildWars,cets37c,5,t5_2quyl
141407,0,t3_1vnydx, sets general to start with.Protection Staff HSR Half skill recharge HCT Half cast time enchantments.Healing Wand and Healing Offhand Your  set HSR Half skill recharge and  HCT Half cast time on both items.Spear and a Shield use this to cast with if taking some damage so you are hit for lesse and  enchantment Spear is best but swordaxe will do Armour vs  damage Shield ideally you would have a shield for vs each of the  physical damages and the  elementals but just get one to start with it isnt a huge dealand Spear and a Shield this is your set to die one and hp Spear this matters less than the other one Armour vs  damage ShieldbHigh energy set wand and offhand Not highly recommended if you are new to monking people get reliant go into negative energy and get stuck being able to do nothing nice for PvE thoughe energy regeneration on both with HSR amp HCT of your choosing either  on all or  on a specific attribute across the two items.All of this is pretty cheap and will be great in PvE also check the wiki for places to get cheap  sets I remember there is a way to get a blue set easyIf you make this on a PvP character make sure to use Warrior STRENGTH shields unless you are taking  in tactics because there is a bug that gives you  armour base from pvp strength shields that doesnt occur with other when you dont reach the requirement Not reaching a requirement for a shield allows you half the stats they give for base armour value so a normally  armour shield would give .Dont know why I wrote all this but god I miss this game...,GuildWars,ceujbgt,7,t5_2quyl
186123,0,t1_cez3upv,I have to admit I like the second and third one.  But Id like to see HL get away from black as nice as black is.,GuildWars,cezmyta,1,t5_2quyl
240019,0,t1_cf50d6o,Did they ever unban your account Blackness?,GuildWars,cf5mo6a,2,t5_2quyl
243826,0,t1_cf5w3ch,I got like a  xD,GuildWars,cf60wbx,1,t5_2quyl
276732,0,t3_1x9gp4,Assassin. For dash.,GuildWars,cf9g2bs,5,t5_2quyl
295673,0,t1_cfbesu3,deleted,GuildWars,cfbeuvb,1,t5_2quyl
337320,0,t3_1xy4bj,Its still possible to finish your HoM and theres more people playing than you think! Jump on in.As to ascended in gw dont believe the whine its a minimal stat increase you can easily ignore. Anet added it because exotics were way easier to get than they wanted. Its only as grindy as you make it theyve added several ways to attain it and the dungeons are actually incredibly fun. Did you even try it or just quit?,GuildWars,cffqf0p,5,t5_2quyl
388178,0,t1_cfkzp7m,deleted,GuildWars,cfl00s2,1,t5_2quyl
397364,0,t3_1ymr9q,would the  hero support be good enough to run most HM missions or vanquish?,GuildWars,cflyb3w,1,t5_2quyl
410429,0,t3_1yqrj7,Piken Square is a weird one  its actually completely avoidable in the core story line. If you actually want to progress do the primary quests the krytan ambassador followed by defend the wall  this will take you to The Great Northern Wall a mission and from there its pretty straightforward how to progress each mission drops you off at the next. ,GuildWars,cfnb2ml,2,t5_2quyl
495736,0,t1_cfwm6ia,deleted,GuildWars,cfwmakm,1,t5_2quyl
502981,0,t3_1z0x25,is soosc ever ran anymore,GuildWars,cfxfxnb,1,t5_2quyl
692034,0,t3_223005,Not noticing any odd drops in Elona. Granted Ive only killed about  enemies but still nothing.,GuildWars,cgixpqr,2,t5_2quyl
727772,0,t1_cgmzpqc,If I play the trilogies first then get EotN do I still get HoM points? ,GuildWars,cgn0230,2,t5_2quyl
812955,0,t3_23g3f2,I think rift is similar,GuildWars,cgwoqqc,1,t5_2quyl
849008,0,t1_ch0sacj,nvm figured it out!people told me to use the pvx wiki but its hella confusing if you dont know what youre doing thanks again,GuildWars,ch0sbi1,1,t5_2quyl
851455,0,t3_23l6ax,My preferred team is Discordway duo mes and duo rit. Go panicesurge on domination mes and piinep on illusion. For the rits I go SoS and STSoGM. Works for  of the things Ive tried. ,GuildWars,ch12cse,1,t5_2quyl
873022,0,t1_ch3i40r,Haha yeah oddly after i purchased it and linked it to my Gw account my account name got removed from the original NCsoft name and migrated to my guild wars  login details I guess ArenaNet did that to increase security?,GuildWars,ch3ilu2,1,t5_2quyl
1140443,0,t1_chxul9j,You dont have your name tagged but if Im ever on at the same time as you feel free to message me.  Id be glad to help you over any tricky missions or help you get to tough Elite skills if you want.,GuildWars,chxwsky,2,t5_2quyl
1147688,0,t3_276up5,The real fun for me in this fame was doing speed clears and solo farming. Best feeling in the world obliterating groups solo with a good bar and items ,GuildWars,chyq7j8,1,t5_2quyl
1336234,0,t3_298vmw,Two things that werent mentioned yet first you can use this list to find Elites that you have access to already no need to wait until you get the best elites grab some that look good and make some simple builds based on those.Secondly you may have your heroes set to avoid combat and for the most part you want them set to defensive until you get more comfortable with the content.  Inside a mission open the party list P by default and click the numberbuttons next to each Hero to bring up their skill bar they have a dove shield and sword icon also that represent their AI stances.  Set them all to the shield maybe set your healer to dove avoid combat but I find they can be set to help out until much harder content.Thirdly I just thought of this you could try and give your self and your heroes Perfect Weapons  If you dont need the gold text and fancy skins you can get lots of statperfect weapons very easily and they make a huge difference in your wholeparty damage output.Also remember to identify and salvage Runes those help heaps.,GuildWars,cijxxyd,4,t5_2quyl
1666884,0,t1_cjp3alr,The outdated graphics are the only reason its playable on my old laptop. I get up to  fps with vsync on but only about  fps in GW with the lowest possible settings. ,GuildWars,cjp9tm1,1,t5_2quyl
1671984,0,t3_2dh8hj,If you find lore to be an important thing it is imperative you purchase or atleast play the campaigns in order of which they happen according to the GW timeline which is in the following orderProphecies and Factions first they happen at the same timeNightfall it reveals a lot of additional information about the plots of both Prophecies and FactionsEye of the North this will reference the other campaigns on occasion but mostly serves as a bridge between GW and GWAlso important to understand is the gameplay differences. Prophecies allows for a selection between  professions Warrior Ranger Monk Mesmer Necromancer Elementalist whereas Factions and Nightfall each allow for  Factions adds the Assassin and Ritualist and Nightfall adds the Paragon and Dervish. So you may want to pick your starting campaign according if you should wish to play the assassin ritualist paragon or dervish. Another key difference is that Nightfall was the first campaign to introduce heroes customizable NPC party members so if you plan on using a lot of heroes youre pretty much required to take Nightfall along aswell EOTN also introduces heroes but fewer than in NF aswell as EOTN beginning at level . Bear in mind that youll always be able to take along real people if you can find them and noncustomizable NPCs known as henchmen.Personally Id say purchase Prophecies and Factions to begin with Guild Wars is the most fun if you explore the world yourself and in the beginning youll have no idea what builds are effective and what not thus making the customizable NPCs worthless anyway. After youve completed atleast one of these campaigns you should recognize enough skills to be able to build your own heroes which is much more fun and rewarding than pulling builds off of the interwebs. It will also give you the most in terms of lore to start with these.EOTN really should be purchased last it provides no new professions no new elite skills and generally the least amount of usable content. It also occurs latest in the timeline and is a level exclusive area. Its main use is to add some form of bridge to GW aswell as ofcourse the Hall of Monuments.EDIT As for a place to buy Id recommend ga.com its currently unfortunately out of trilogy packs but it does sell the campaigns seperately for a mere . each and EOTN is even cheaper.,GuildWars,cjpwypz,1,t5_2quyl
1680049,0,t3_2dlkmc,Thats really nice of you Nr IGN Elena Garnet,GuildWars,cjqxl9n,1,t5_2quyl
1782102,0,t1_ck1uor2,Pretty sure I did that at least once in the past. Must have changed it or theres other flags being set.,GuildWars,ck3sdns,1,t5_2quyl
1815128,0,t3_2fbvez,Do you have a guild? If not PM me in game BB.,GuildWars,ck7wl71,1,t5_2quyl
1870067,0,t3_2g0bt9,Where were you when I played  years ago?,GuildWars,ckejbmf,5,t5_2quyl
1983969,0,t3_2fdzgl,Im looking for a laid back guild that does some pvp mainly gvg without it going to serious. Ive got and so full time job among other things that takes a lot of my time so gw isnt my first priority. PM me here if youve got what im looking for andor want to know about my experience and ignIm euro btw ,GuildWars,cks9oq9,1,t5_2quyl
1994992,0,t1_ckt48kx,invite sent!,GuildWars,cktli3j,1,t5_2quyl
2135558,0,t1_clb8afz,deleted,GuildWars,clb9ydm,1,t5_2quyl
2157061,0,t1_cle07a8,Yes I agree! Although believe it or not I just got a very very lucky drop of Superior Vigor so maybe I could just min max this ele and then have a PVP character with her  we will see though! The rune is only a tiny part!,GuildWars,cle0frr,1,t5_2quyl
2167746,0,t3_2jn5gp,What are you there for primarily? I used to have a pre searing character a few years ago for dye hunting there was a rumour at the time that dyes had a higher drop rate there but I think on reflection they probably didnt its just that you get  of the loot . The run I used to do was through the catacombs. As such I took a monk as my primary profession for the smiting skills as they do double damage. I think that levelling up to  takes a silly amount of time. I wonder if maybe going warrior would be best as your armour might be slightly higher but then again very low mana...hmmm....Fire magic does a lot of damage but does it do the most? hmm.....Another thing you could consider doing is never handing in the secondary profession quest as then you could swap them out whenever you wanted. ,GuildWars,clfdddl,2,t5_2quyl
2236697,0,t1_clo4ouz,DOH  no missed it not nearly enough coffee yet today.   Homers brain not working yet. ,GuildWars,clo4z10,1,t5_2quyl
2277457,0,t1_clsz2zv,I thought the master of north will be kinda hard cuz the dungeon not much ppl doing it. ,GuildWars,clt7nfj,1,t5_2quyl
2334602,0,t3_2m29f8,Guild Wars Corner Ep.   Mad King Mayhem Mad King Mayhem Elite and Space Sims Redux Guild Wars and No Promise,GuildWars,cm09pi7,1,t5_2quyl
2430551,0,t3_2namch,Hard to say whats best since folks have lotsa different opinions.  I like Proph best but I know passionate advocates for Factions and Nightfall and Eye.  The price for all four is very low especially as there is no sub fee ever.  As the King says very gravely in Alice in Wonderland Begin at the beginning  and go on till you come to the end then stop. Happy Wintersday!,GuildWars,cmc4fy6,2,t5_2quyl
2656334,0,t1_cn5b8gb,Haha they are!  MMs is hilarious though. I think with the right setup you can have  minions running around,GuildWars,cn5b96b,1,t5_2quyl
2714005,0,t3_2r56a1,Yes.,GuildWars,cnckl80,3,t5_2quyl
2765438,0,t1_cnc1yof,What other titles do you have left?  The best way to farm them was during Wintersday other holidays too to a smaller extent.I got a lot of goods by farming in presearing.  Get five Gifts of The Huntsman every day have a friendsecond account take them to post searing.  ,GuildWars,cnif45o,1,t5_2quyl
2801907,0,t3_2s3bsl,Buy a character slot. Let it be her character and let her run with it. This however wont be as much fun as if she has a separate copy on her computer and you can run together. Thats what got my wife interested. If you buy a single game get Nightfall. I would have said Prophecies but then I agree with jblok Nightfall is an easier startup. ,GuildWars,cnmkenh,2,t5_2quyl
2803053,0,t1_cnmnvjn,i know that feel. AB always was full of real players back then and it was tons of fun.. miss it.,GuildWars,cnmp3yr,1,t5_2quyl
2821013,0,t3_2sehsp,e sounds about right for the th year at least. Probably a bit less for the .,GuildWars,cnoqql1,1,t5_2quyl
2839504,0,t1_cnqa1e9,Alright small calculation regarding whether or not GW is still financially viable.Blizzard uses a  per month subscription plan for WoW this resulted in a profit of about  million per year across .M users.This results in a yearly money gain of .B of which only M was profit. So they have about B in server and developer costs across .M users which boils down to a cost of  dollars per year per customer in costs.Now obviously WoW is open world still has active developers an active support and generally is harder to maintain. Obviously this is also a very crude estimate because some people dont pay  per month but rather buy subscriptions each year ofcourse theres also the initial purchase and the ingamestore to consider.Now the question is how much easier is GW to maintain? The most accurate and easy test I can think off without needing knowledge of Anets inner workings is as followsWoW is GB GW is GB. The amount of data in a game is roughly proportional to how hard it is to maintain.Now obviously GW also has no more active development so lets round WoW up to GB and GW down to GB more or less fair. This means GWs operational costs per customer are  times lower resulting in  dollars per year per customer in costs.The purchase of a full set of Guild Wars costs  dollars meaning the break even point is approximately  years for a customer assuming the average person will spend an additional  dollars in the ingame store we end up with approximately  years til breakeven.All in all I think youre right. They probably are still making money out of it. Obviously this is just a ballpark estimate but yeah turns out I was wrong. I stand corrected.,GuildWars,cnquj6u,1,t5_2quyl
2861245,0,t1_cnpue04,I remember that there was an amazing plot twist in the end of the original campaign that was cool.,GuildWars,cntbpqq,1,t5_2quyl
2916387,0,t3_2sxp2r,Death to bots.,GuildWars,cnzlnb0,1,t5_2quyl
2987031,0,t3_2ucs2l,Yay for you!! D,GuildWars,co7lptb,2,t5_2quyl
2998986,0,t3_2uj4rk,g,GuildWars,co8ucpv,1,t5_2quyl
3013928,0,t1_coaczey,Ive personally found four stacks to be plentiful  tickets.As far as rings go they all average out to give about the same amount of tickets in the long run. Corner ones lose more often but they give more tickets while the center ring wins more often but gets fewer tickets.Pick your ring depending on whether you need more LuckyUnlucky points.,GuildWars,coae4ds,1,t5_2quyl
3032611,0,t3_2uwjvc,Id love one! My ign is spirit wut and I can give you an ecto or something ,GuildWars,cocbtvj,1,t5_2quyl
3048392,0,t3_2v2f9p,I will be up for Tyrian Vanquisher been putting it off for too long because I cant stand playing long enough with just Heroes.Ill stick around for some difficult bosses for Skill Hunter as well or whatever your miscellaneous tasks are.You can message me if I dont hit you up first.ltAny Professiongt Zuphix in Guild WarsZuphix. in Guild Wars ,GuildWars,codyqm4,2,t5_2quyl
3048666,0,t3_2v2mjc,The builds arent trash and dont work. You are trash and dont work.not s,GuildWars,codzr8d,-4,t5_2quyl
3062841,0,t3_2v8rax,What is your current team build?You want to kill undead in this order Cavalier two ressurect skills Acolyte primary healer one resurrect skill and then Thought Leeches and Carvers.A Communing Ritualist hero with Soul Twisting is very helpful in Hard Mode you can also bring Edge of Extinction to speed things up damagewise or Frozen Soil to prevent resurrection by enemies. Ray of Judgment and other Smiting Prayers skills can help you kill undead faster double damage.I can help you Wednesday night maybe if you still havent been able to get them done.,GuildWars,cofgl4d,2,t5_2quyl
3091214,0,t3_2vk23b,Let me know when the apprentice  becomes a master. I hope you like it.,GuildWars,coieijo,19,t5_2quyl
3120410,0,t1_colc08r,Well the final expansion to the original game was entirely PvE.,GuildWars,colfh7u,1,t5_2quyl
3135776,0,t3_2w1wit,Added you my IGN is Wriggles The SpriteGot back into the game a week ago and been playing pretty much nothing but RA. Never got a high rank in PvP but would love to play some HA and GvG again will definitely need some teaching ,GuildWars,con0q89,2,t5_2quyl
3195457,0,t3_2wnxkt,Hey there Im unfamiliar with the deep and got only so far in urgoz before my  hero team died. Id be interested in running eitherboth if youre willing to do some light teaching. I added you in game. My IGN Kashim The Reaper,GuildWars,cot7jd3,1,t5_2quyl
3237621,0,t1_cnklrhg,The feels buddy...I am with you on this one.Began at the age of  and now . Hitting the  and wanna be buddies,GuildWars,coxl4ag,1,t5_2quyl
3266731,0,t3_2xh0x0,I love the Shiverpeaks  the way the snow shakes down from the trees and the clear clean snows and skies.  I love Shing Jea Islands cherry blossoms.  The flowers in the meadows around the Tarnished Coast are another favorite place for me.  And the Kodash Bazaar with its clean tiles and blue fountains.  I really like that place!  I keep an LDoA in pre just so i can go sit there in the music and the trees.  How to pick a favorite place?  Hard to do!,GuildWars,cp0mu12,2,t5_2quyl
3279939,0,t1_cp24uax,Yeah. But the place people congregate is kama. When there are not enough people in a pug group and guildalliancefriends cant come then kama is the place to go.Running is done entirely through kama.Both have their purpose and both will work.,GuildWars,cp251az,2,t5_2quyl
3291334,0,t3_2xqmd4,I would honestly forget Jennurs Horde. Its a mess. For nundu bay you can clear the groups beforehand but more importantly charge towards them to keep them away from Jonah. This should keep him safe in the far backline,GuildWars,cp3fsvx,1,t5_2quyl
3322936,0,t1_cp6vymd,nah Im an ele. dont have a paragon,GuildWars,cp71k05,1,t5_2quyl
3436583,0,t3_2zjz15,If you enjoy deckbuilding Id suggest The Secret World buy to play an mmo set in the modern world.  You get an active and a passive deck.  Active deck depends on currently equipped weapons passives can come from any weapon and you can change your weapons at any time as long as you unlock them and purchase the corresponding abilities.  You can change your build at any time right out in the field as long as youre out of combat. Good explanation of the deck system if you want to read more about it Also if you enjoy stories and questing...it is light years ahead of all mmos in that department.  The games got warts but its worth a look imo.  And like GW the game can roll you pretty hard from the beginning even with the nerfs if you dont pay attention to your environs and simply herp derp your way through mobs with a terrible build.  Its not a game for some one who cant or dont want to adapt their builds. Someone who has a low tolerance for challenge and gets frustrated easily will wash out here.  TSW gives you a fair amount of freedom in terms of how you can build your character but the flip side of that is...if you want to shoot yourself in the foot with an all over the place nonsense build it will load the gun for you.I also second the suggestion for Path of Exile.  It surprised me in terms of quality.  I thought it would be like Torchlight instead it was something with much more depth.  The passive tree and weapon socketing system deal is insane.  I unfortunately didnt get deep into it due to being distracted with other games but as other have said you do have to have an eye for building for the long haul and it is a very fun well made game.   Its got a good free to play model cash shop is cosmetic only no pay to win and at the least worth a look over a weekend.,GuildWars,cpjzv3f,3,t5_2quyl
3504836,0,t1_cprp3n6,Yeah thought about that while checking the ranger farm. Ive been farming beach on my sin and it isnt that profitable unless shards or a ton of gloom seeds drop when youve to pay for scrolls.,GuildWars,cprry72,1,t5_2quyl
3510123,0,t1_cprdovx,It shouldnt take another ticket. ,GuildWars,cpsdmlh,1,t5_2quyl
3522180,0,t3_30lwtf,I just downloaded the client again today and Im so excited!!! I havent played in a couple years but this is hands down the game Ive spent the most time in. Of course I forgot my password and now I have to wait for support to respond to my ticket  thats alright though the menu music has me very excited! haha. ,GuildWars,cptr5oy,2,t5_2quyl
3585519,0,t1_cq0lx5h,Oh... Then you cant do Hard Mode missions. And if you are to create a new toon or transfer a toon youd still have to run between to the missions... STo do hard mode content you have to complete all missions of Prophecies in Normal Mode on any character.But you can still PM me as I need some NM missions too I plan on doing all bonuses too.,GuildWars,cq0z72t,1,t5_2quyl
3680231,0,t3_32hbiu,Asuran Scan is great in any physical damage build  it goes through blind and water magic hexes as well as blockevade.,GuildWars,cqbrqut,5,t5_2quyl
3733052,0,t1_cqhnb1d,thanks for the info! haha yeah we expressly decided to look for an mmo none of us had any real experience with unlike gw. we figured that gw was enough of a mechanical difference that it fit the bill.,GuildWars,cqhsiv2,1,t5_2quyl
3734694,0,t3_336hca,Not sure if this will address the issue but try talking to Kimmes the Historian in your Hall of Monuments tell him to display your accounts accomplishments instead of personal ones and try to dedicate the miniature again.,GuildWars,cqhza59,1,t5_2quyl
3753817,0,t3_33camt,Codex Henchies is pretty interesting. Might get some people into the format which would be nice. Could also give new players a slightly easier PvP title.,GuildWars,cqk5uq3,4,t5_2quyl
3764208,0,t1_cql74k1,Nah. Its one per mission region check the notes. So if Im interpreting this correctly. You can earn  Proofs doing one mission in each of these geographic regions per character. Tyria Ascalon Shiverpeaks Kryta Maguuma Jungle Crystal Desert Ring of Fire Cantha Shing Jea Island Kaineng City Jade Sea Echovald Forest Raisu Palace Elona Istan Kourna Vabbi Desolation Realm of TormentEye of the North Far Shiverpeaks Charr Homelands Tarnished Coast Depths of Tyria,GuildWars,cqlcjes,2,t5_2quyl
3780013,0,t1_cqimura,Ditto! Im more than happy to help out if I can. I miss playing through with a good group. IGN is Enelya Telrunya but messaging me here will certainly get my attention! ,GuildWars,cqn5dbf,1,t5_2quyl
3842614,0,t3_34f14m,If you still need help Im willing to hop on. IGN P L U R Live By It ,GuildWars,cquaimx,1,t5_2quyl
4036953,0,t1_crg76fp,It worked for me I got the title like this. I might have changed something in the setup though.,GuildWars,crgfyoa,1,t5_2quyl
4049363,0,t3_36wwlw,You wont have a bad experience but you will miss some content reserved for native campaign characters.  Its possible to play all the campaigns on a single character so long as you have them unlocked on your account. The main reason people prefer Factions and Nightfall is because theyre a little faster paced in that they get you to level  more quickly than Prophecies.  Getting to level  is the tutorial its something that anyone can do given time and modest effort.  Heroes are preferred to Henchmen as well because you have much more control over their builds and their overall strategysynergy with your team. GW doesnt do a particularly good job of preparing players for GW the inverse is true too.  Your merits in GW really dont mean anything in GW.  Largely and moreover as difficult as it may be to believe GW is actually the more difficult and challenging game. Some minor advice I want to give Play cautiously until you know your limits  Use the wiki to avoid getting lost.  Always have energy management in your build.  Condition removal is helpful as well.  Learn how to play around your heroeshenchmen. Do not carelessly slot in runes or insignia to your armor.   Salvage everything and store it in your Xunlai Account.  Make sure your armor is uptodate.  Armor is crafted at Armor NPCs not dropped.  Joining a strong populated Guild is almost required to get your bearing as a new player. ,GuildWars,crhux7m,2,t5_2quyl
