,controversiality,parent_id,body,subreddit,id,score,subreddit_id
6379203,0,t1_czeqd8m,Well thats not comparable though. Its true the only way out is to win and climb Easier with friends or apparently to support main Which screws over players who dont learn mechanics and fall off in the next division up since all they can do is support. In Bronze  youre simply surrounded by the worst of the worst. A child born into a poor family in a bad area CAN in fact do their absolute best to climb out of poverty and make a good life for themselves. Statistically marginally few will not because they werent talented hardworking or smart enough but because external factors such as poor resources increased hardships and poor financial supports early on will bar them from doing anything meaningful with their lives.The easiest way to climb out of bronze is not get placed there in the first place or have diamond skill awareness and mechanics. But its absolutely fair to suggest a large majority of silver players are stuck in bronze due to winrates being out of their control.Dont get me wrong Im bronze two and climbing myself but the only way Im getting out of here is to consistently win every single game before my mmr gets too low and I start losing LP more than I win while getting bogged down by bad games. Is it doable? Of course. Is it so ridiculously daunting and easy to fail? Definitely. I think its fair to assume too many people dont think they can get out because of poor teammates and in reality its true.  ,LeagueConnect,czeqw9f,0,t5_30v2b
6439957,0,t3_43vy7v,Added you ign Meester Yi,LeagueConnect,czlfi26,1,t5_30v2b
6507674,0,t1_czsfi4h,add me on one of my smurfs in that elo range and Ill hit you back up Inquisitor SiroAhuei,LeagueConnect,czsfyao,1,t5_30v2b
6531024,0,t1_czutcj7,Sorry did not know about this community thread new in reddit ,LeagueConnect,czuuybc,1,t5_30v2b
6553310,0,t3_4560j0,ign yukinaga,LeagueConnect,czx5z8d,1,t5_30v2b
6600081,0,t3_45ocw8,Here we go  EyS Zambe,LeagueConnect,d0203dv,1,t5_30v2b
6610589,0,t3_466p3r,SynthesizzlerAdd me Ill play D,LeagueConnect,d0339t9,1,t5_30v2b
6638313,0,t1_d05xzhb,added,LeagueConnect,d05yil2,1,t5_30v2b
6657406,0,t3_46tqo3,Im pretty bad at the game but always down to make new friends! IGN Mira Says,LeagueConnect,d07xm8z,1,t5_30v2b
6663165,0,t3_42lgcu,Summoner Name malizServer EUNEWilling to Get adopted I would really like some tips on how to keep motivated to play and how to deal with teammates tilting.Division last season Silver II.,LeagueConnect,d08j1c4,1,t5_30v2b
6687916,0,t3_478m7k,Very needy...,LeagueConnect,d0b37pi,4,t5_30v2b
6757218,0,t3_48bai0,Hey whats going on Ive been playing for awhile I recently started playing and having fun again been gold  season  placed silver season  and quit playing and now Im back ranking up  silver  at the moment  I main midsuptop add me if feel like gantz getting on now ,LeagueConnect,d0i9489,1,t5_30v2b
6757267,0,t3_48aw3o,They say I sound like imaqtpie which is close enuf right? P IGN Xaunter,LeagueConnect,d0i9asf,1,t5_30v2b
6763853,0,t3_48eczb,Hi ummmmmmmbbbbbb unfortunately we have to remove your submission because the title did not include one of the required tags.Server tags currently supported are NA EUW EUNE OCE BR TR RU KR LAN LAS SEA CHN JAP PBEInclude the tag somewhere in your title you can find your server by clicking hereexample NA Looking for friends NA Looking for friends Wanna duo? EUW etc.ampnbsp Discussion Add this tag to the title of your post if you want to have LoL related discussions.example Discussion Need some jungling tips Discussion Should Fiora be nerfed? etc.ampnbspWarning  All type of advertisements must go in our Weekly Community Promotion Thread.Warning  Dont include your gender in the title or body of your post.Please read our posting rules and community guidelines and feel free to resubmit by clicking hereI am a bot and this action was performed automatically. Please contact the moderators of this subredditmessagecompose?torLeagueConnect if you have any questions or concerns.,LeagueConnect,d0iymrk,1,t5_30v2b
6764795,0,t3_48etul,Hi unessasaurus please make sure your post doesnt include your gender announced.gtNo gender in title or body of your post allowed it will be removed.Please take some time and read up on our posting rules. You can resubmit your post by clicking hererLeagueConnectsubmit?selftexttrue. If this was done by mistake you can send us a message and well fix it for you. Pinging uXGSleepWalker for statistical purposes.I am a bot and this action was performed automatically. Please contact the moderators of this subredditmessagecompose?torLeagueConnect if you have any questions or concerns.,LeagueConnect,d0j2ht4,1,t5_30v2b
6764848,0,t3_48aw3o,Hit me up for some fun dawg ign Johncloaked,LeagueConnect,d0j2pma,1,t5_30v2b
6764941,0,t3_48ev7k,dont even know how to pm on reddit  ign princewaymon  i gots skype and other voice chats lol let play now,LeagueConnect,d0j33bj,1,t5_30v2b
6769451,0,t3_48hq6l,Hi uSpatialSeason unfortunately we have to remove your submission because the title did not include one of the required tags.Server tags currently supported are NA EUW EUNE OCE BR TR RU KR LAN LAS SEA CHN JAP PBEInclude the tag somewhere in your title you can find your server by clicking hereexample NA Looking for friends NA Looking for friends Wanna duo? EUW etc.ampnbsp Discussion Add this tag to the title of your post if you want to have LoL related discussions.example Discussion Need some jungling tips Discussion Should Fiora be nerfed? etc.ampnbspWarning  All type of advertisements must go in our Weekly Community Promotion Thread.Warning  Dont include your gender in the title or body of your post.Please read our posting rules and community guidelines and feel free to resubmit by clicking hereI am a bot and this action was performed automatically. Please contact the moderators of this subredditmessagecompose?torLeagueConnect if you have any questions or concerns.,LeagueConnect,d0jljg0,1,t5_30v2b
6770497,0,t3_48i3w3,A form with  questions.. seems sketchy as hell.,LeagueConnect,d0jpti1,1,t5_30v2b
6785099,0,t3_48p0lk,I play Lucian and Corki mostly. recently changed to adc late last season. I am bronze  right now. IGN  taterswag,LeagueConnect,d0ldlga,2,t5_30v2b
6786701,0,t3_48pug6,deleted,LeagueConnect,d0lk64s,1,t5_30v2b
6787196,0,t3_48pz70,IGN Ninjacnidariacow platV currently diamond a while ago just lookin to chill.,LeagueConnect,d0lm77v,1,t5_30v2b
6793402,0,t3_48rs8e,Feel free to add me man Ive just discovered this sub recently and met a some cool people already Username sTRUMMYYFYI If youre down for an ARAM dont forget to invite Im always down for ARAMs.Everyone else Feel free to add me aswell ,LeagueConnect,d0mbl6w,1,t5_30v2b
6798868,0,t3_48spp0,Black was better  add me Jehriko,LeagueConnect,d0mxzy3,1,t5_30v2b
6801754,0,t3_48mtx1,Crap if you added me I might have turned it down because I didnt know the name and forgot about this!,LeagueConnect,d0n9sk4,1,t5_30v2b
6804086,0,t3_48rm5s,Added also Dutch casual aram and normal player cya on the riftDyre Wolf,LeagueConnect,d0njcl3,1,t5_30v2b
6815471,0,t3_48vzp7,similar situation here. ign BlueMoonRizingI am bronze  mostly mid and jgl but can play anything,LeagueConnect,d0otxj0,1,t5_30v2b
6840389,0,t1_d0qqzlh,cool man added D where you from?,LeagueConnect,d0rnv5c,1,t5_30v2b
6841116,0,t3_49bxvy,Yo shoot me a requestIGN BrkenEngish,LeagueConnect,d0rqupc,1,t5_30v2b
6851126,0,t1_d0suos6,its me when people have said its happened to them and my friendsits not me if i can stream games fine then my internet is not the problem LOL,LeagueConnect,d0svsn2,0,t5_30v2b
6881241,0,t3_49zzfw,IGN Old Ben Kenobi,LeagueConnect,d0wayc4,1,t5_30v2b
6936048,0,t1_d128t6k,Thank you!,LeagueConnect,d12j0py,1,t5_30v2b
6948628,0,t1_d12zg1j,The name seems very very familiar. We mightve played a game in the past D. Anyhow as I said in the thread added you accept when you can.. Ill be online sunday night.  cya,LeagueConnect,d13yiiz,1,t5_30v2b
6955404,0,t3_4aysxe,Heyy ign is Xun add me to talk.,LeagueConnect,d14q8fj,1,t5_30v2b
6972185,0,t3_49bgq0,    Summoner Name C Togetic    Server EUW    Willing to Get adopted    Division Dia     What I want to learnI will teach The majestic ways of toplane and jungle. I always feel limited by the pressure I can make whilst playing jungle and top but any other role I kinda tend to feed. Toplane I play mostly tanks and jungle I play amumu udyr and volibear. I would like to learn how to pressure and when to pressure what and better shotcalling. ,LeagueConnect,d16mul1,1,t5_30v2b
6975670,0,t3_4b8vea,Sent you a request. My IGN is Burtininkas,LeagueConnect,d17135s,1,t5_30v2b
7004494,0,t3_4b917m,i understand banter do all the time but im on the Na sever,LeagueConnect,d1aay8v,1,t5_30v2b
7006727,0,t3_4bmrdb,deleted,LeagueConnect,d1ak2x5,1,t5_30v2b
7008430,0,t1_d1af0t3,I just added you if you want you can invite me to a game any time Im online too ,LeagueConnect,d1ar1tx,1,t5_30v2b
7027940,0,t3_4bwb60,ign grepa,LeagueConnect,d1cyxsv,1,t5_30v2b
7053992,0,t3_4c7xf4,Id love to play. NA PotatoBrethren.Im silverlow gold if that matters and usually play SionGnar that kind of stuff.,LeagueConnect,d1fxgao,1,t5_30v2b
7054366,0,t3_4c8eok,Added!,LeagueConnect,d1fyzb3,1,t5_30v2b
7056366,0,t3_4c915l,Add me on FrozenVegetables. I wont be on as much this week but Ill be back next week for sure.,LeagueConnect,d1g75cp,1,t5_30v2b
7074213,0,t1_d1hy96v,I will send you a friend request too ,LeagueConnect,d1i84j7,1,t5_30v2b
7085355,0,t3_4cklna,still looking for people to play with im down,LeagueConnect,d1jhpq4,1,t5_30v2b
7112672,0,t1_d1mlh95,im on my smurf right now playing if u wanna join,LeagueConnect,d1mm3it,1,t5_30v2b
7119316,0,t1_d1ncxvj,added,LeagueConnect,d1ndouq,1,t5_30v2b
7120795,0,t3_4d24g2,IGN Naovath,LeagueConnect,d1njs1p,1,t5_30v2b
7123126,0,t3_4d5130,Hey I saw you posted two threads in a row. This one is pretty much the same as the other one but you have your name in this one so I assume thats why you reposted. Just to let you know you can always just edit your text posts. If you really wanted to repost you couldve deleted the other one too. Dont want spam in the sub so I removed the first one for you.,LeagueConnect,d1nte5x,1,t5_30v2b
7146919,0,t3_4dcrur,I main support. IGN LOLmiket,LeagueConnect,d1qj3q0,1,t5_30v2b
7148061,0,t3_4dcp98,my IGN Litae,LeagueConnect,d1qnt33,1,t5_30v2b
7151404,0,t3_4df5a6,removed,LeagueConnect,d1r1k0e,1,t5_30v2b
7163858,0,t3_4daano,removed,LeagueConnect,d1sgna9,1,t5_30v2b
7163884,0,t3_4dn16x,Hey my ign is  LWSH and Im unranked.,LeagueConnect,d1sgr49,1,t5_30v2b
7166497,0,t3_4do1z1,added you ign The SS Shadow ,LeagueConnect,d1srgp6,1,t5_30v2b
7171276,0,t1_d1ssmqq,Opss wrong name .Its actually aleex.Sorry for the inconvenience.,LeagueConnect,d1tb1ro,1,t5_30v2b
7212848,0,t3_4e8znv,Hi uMobileSuitVoliBot unfortunately we have to remove your submission because the title did not include one of the required tags.Server tags currently supported are NA EUW EUNE OCE BR TR RU KR JP LAN LAS SEA CHN PBEInclude the tag somewhere in your title you can find your server by clicking hereexample NA Looking for friends NA Looking for friends Wanna duo? EUW etc.If your server is one of these Taiwan TW Singapore  Malaysia SGMY Thailand TH Indonesia ID Philippines PH and Vietnam VN please use the tag SEA.ampnbsp General Add this tag to LoL related discussions or topics.example General Need some jungling tips General Should Fiora be nerfed? etc.ampnbspWarning  All type of advertisements must go in our Weekly Community Promotion Thread.Warning  Dont include your gender in the title or body of your post.Please read our posting rules and community guidelines and feel free to resubmit by clicking hereI am a bot and this action was performed automatically. Please contact the moderators of this subredditmessagecompose?torLeagueConnect if you have any questions or concerns.,LeagueConnect,d1y1mca,1,t5_30v2b
7224886,0,t1_d1zek1k,Oops forgot I changed the Smurf. It is now Poppy Yer Cherry,LeagueConnect,d1zez4c,1,t5_30v2b
7257771,0,t3_4elxad,Plat  support main last season. Currently in silver  looking to climb. Add me Quit Typing,LeagueConnect,d235nqn,1,t5_30v2b
7265045,0,t3_4ewjnc,Hey! Support main on NA. Would love to play user is thederpqueen,LeagueConnect,d23zg31,1,t5_30v2b
7279758,0,t3_4f1qtd,Hi my lol name is Nadxz,LeagueConnect,d25nrlr,1,t5_30v2b
7284479,0,t3_4f45cs,add meh IGN peanutbdrrr currently level  not that good at the game ,LeagueConnect,d26732r,1,t5_30v2b
7294047,0,t3_4f9u6m,I can support you DIgns FrozenVegetables,LeagueConnect,d27a8b5,1,t5_30v2b
7316215,0,t3_4fl5sc,Added Enemaroberts sumname,LeagueConnect,d29syi1,1,t5_30v2b
7375735,0,t3_4gdber,deleted,LeagueConnect,d2gkiqw,1,t5_30v2b
7394577,0,t3_4gly9a,Oh Ill JG mid or adc.,LeagueConnect,d2ipqg2,1,t5_30v2b
7426172,0,t3_4gz52a,Ign I Morde I if your main is plat or above. started bronze  silver  atm in  days,LeagueConnect,d2mb3di,1,t5_30v2b
7484768,0,t3_4hwnhu,Hi ukaladynIm pretty sure you just tried to joke around and be funny but we dont allow titles of such nature on our sub and in violation of our posting rule . For more information read our subreddit rulesrleagueconnectwrules.Would you please be as kind to remake your post as none of us can edit your title. Thanks!Regardsuxiaolii,LeagueConnect,d2sz6j3,1,t5_30v2b
7487310,0,t3_4ht6mc,Ixzlazuzuixz  D,LeagueConnect,d2t9m1u,1,t5_30v2b
7501510,0,t3_4i43al,Hi uRomiRainLOL please make sure your post doesnt include your gender announced.gtNo gender in title or body of your post allowed it will be removed.Please take some time and read up on our Subreddit Rulesrleagueconnectwrules. You can resubmit your post by clicking hererLeagueConnectsubmit?selftexttrue. If this was done by mistake you can send us a message and well fix it for you. Pinging uXGSleepWalker for statistical purposes.I am a bot and this action was performed automatically. Please contact the moderators of this subredditmessagecompose?torLeagueConnect if you have any questions or concerns.,LeagueConnect,d2uvsdc,1,t5_30v2b
7510764,0,t3_4i852c,Hey Im also B! Im Falcon. Add me or Ill add you once I can get on league.,LeagueConnect,d2vxpxs,1,t5_30v2b
7530891,0,t1_d2y75mq,deleted,LeagueConnect,d2y84ro,1,t5_30v2b
7531443,0,t3_4ii7ch,me ,LeagueConnect,d2yae3b,1,t5_30v2b
7555140,0,t1_d2o9ckk,Ign EyeNvrKnoServer NAWilling to Get AdoptedWhat I want to learn I was Bronze for the past Season and I have finally made my way up to Silver. I made an Oath to make it above Gold and games are getting easier to carry as I switched my main from Support to Jungle. I jungle Maokai before any other then AmumuRammus depending on if our team needs a tank or Master Yi if my team could use some damage. I would just like to know if I am doing a good enough job to deserve Gold or Higher. I know it will take time and I would truly appreciate anyone helping me achieve it. I will be willing to work hard listen to you criticism and learn from my mistakes.,LeagueConnect,d30zev4,1,t5_30v2b
7601839,0,t3_4jg3uv,add me LordTomb,LeagueConnect,d36aghh,1,t5_30v2b
7621042,0,t3_4jmcpz,Hi add me insidiouscat ,LeagueConnect,d38h10w,1,t5_30v2b
7638752,0,t1_d3afzlw,well... apparently my mmr is so fucked that they just want me out weirdly when i picked something and didnt care now i win.. uff i hate league.,LeagueConnect,d3ahewj,1,t5_30v2b
7687859,0,t3_4kkyhi,me and my friends need a th man to play with i added you. my ign is Trumpet,LeagueConnect,d3g27pj,1,t5_30v2b
7712666,0,t3_4kyuin,Hi ucelailinda unfortunately we have to remove your submission because the title did not include one of the required tags.Server tags currently supported are NA EUW EUNE OCE BR TR RU KR JP LAN LAS SEA CHN PBEInclude the tag somewhere in your title you can find your server by clicking hereexample NA Looking for friends NA Looking for friends Wanna duo? EUW etc.If your server is one of these Taiwan TW Singapore  Malaysia SGMY Thailand TH Indonesia ID Philippines PH and Vietnam VN please use the tag SEA.ampnbsp General Add this tag to LoL related discussions or topics.example General Need some jungling tips General Should Fiora be nerfed? etc.ampnbspWarning  Any type of advertisements must go in our Weekly Community Promotion Thread.Warning  Dont announce your gender in posts.Please read our Subreddit Rulesrleagueconnectwrules and feel free to resubmit after by clicking hereI am a bot and this action was performed automatically. Please contact the moderators of this subredditmessagecompose?torLeagueConnect if you have any questions or concerns.,LeagueConnect,d3ivlya,1,t5_30v2b
7733766,0,t3_4l6fhi,My name is JamesDragon on League but only JamesDragon Skype and Discord.,LeagueConnect,d3l9w0w,1,t5_30v2b
7743881,0,t3_4lbysb,I can help you out aswell add me Annying,LeagueConnect,d3mf8ji,1,t5_30v2b
7766646,0,t3_4lnlz9,In game name is the same as my username here. Feel free to add me.,LeagueConnect,d3p08bb,1,t5_30v2b
7802851,0,t1_d3t2thd,removed,LeagueConnect,d3t3nlt,1,t5_30v2b
7840286,0,t1_d3x1pro,Ive told you this before but you need to clarify for people that this is your IGN.,LeagueConnect,d3xbe3v,1,t5_30v2b
7843983,0,t1_d3xpwlt,Wooh add me. Im bored.,LeagueConnect,d3xqe78,1,t5_30v2b
7874342,0,t3_4muk54,Hey as long as its gaming and chill and seeing people respond here to this thread unlike a lot of others.IGN Akeno HmejmaAge if that matters to anyone else Feel free to add me to have some fun games no pressure or anything just enjoying the game together.,LeagueConnect,d415cz3,1,t5_30v2b
7904886,0,t3_4nk49j,Hey uAvannessa!Sorry for the interruption but we dont allow mention of gender in postsfor reasons that you can probably guess. Ive had to take down your post for now so please edit out gender and Ill get it right back up. Asking for  is fine just dont mention gender. If you have any other questions let me know.Frosty Regardsumaora,LeagueConnect,d44l25s,1,t5_30v2b
7934825,0,t3_4ny8df,IGN Mortrend,LeagueConnect,d47y6ct,1,t5_30v2b
7963952,0,t3_4obkmx,add me FinickyJellyfish,LeagueConnect,d4b82z4,1,t5_30v2b
8011481,0,t1_d4fs8vz,Yes. There is  of us sorry for any confusion xD We usually play ranked. But I play normals when the mid friend is offline.,LeagueConnect,d4gkcou,1,t5_30v2b
8038657,0,t3_4pa20o,Hey man Im not home right now but add me silknw.,LeagueConnect,d4jmcdb,1,t5_30v2b
8097105,0,t1_d4q3rli,If youre willing to grind hard and are a positive and reliable support player trying to improve Id like to duo with you. Ive gotten multiple accounts to platinum and am working on ranking up an unranked account to that was silver last season to platinum this week ign inorixegoistxshu. ,LeagueConnect,d4q6rcb,1,t5_30v2b
8132245,0,t1_d4u4ubb,LeagueConnect does have a fairly active multiregion Discord server and an unfortunately not so active Club as most of our users dont seem too interested in that particular feature of League.,LeagueConnect,d4u4yon,1,t5_30v2b
8169089,0,t1_d4yd66p,Thanks!,LeagueConnect,d4yoot4,1,t5_30v2b
8184253,0,t1_d4v4tb9,Summoner Name amirkatWilling to Get adoptedDivision Bronze IIIWhat I want to learn How to improve my game mechanics so i can play smarter and better with my teamI main ADC but can play jg and am working on midi use curse and discord,LeagueConnect,d50kyuq,1,t5_30v2b
8359338,0,t3_4t9a8c,Im looking for some boddies to play with im gold  smurfing from platt . id like you you add me on skype first skype name etabala.,LeagueConnect,d5mgwrb,1,t5_30v2b
8365900,0,t3_4u6i7q,In a Game i went  with TeemoIGN ApexHunter or ApexHunter,LeagueConnect,d5naesb,1,t5_30v2b
8367031,0,t3_4u778d,deleted,LeagueConnect,d5nfhjq,1,t5_30v2b
8413819,0,t3_4uvszl,Im  and gold  if you want to play sometimes. Just recently started back up on ranked  and I prefer mid and top! ign kyuubigan,LeagueConnect,d5t9rla,1,t5_30v2b
8439079,0,t3_4v8ts4,What lvl are u? Add tpgreen. Im s support,LeagueConnect,d5wf9s9,1,t5_30v2b
8441250,0,t3_4v9zlf,i will i added you it Flunkie,LeagueConnect,d5wp162,1,t5_30v2b
8442982,0,t3_4v8pkn,Ign LabatronuxAdc main,LeagueConnect,d5wwtos,1,t5_30v2b
8459500,0,t3_4vjw82,i can give it a try il i can play every day thereticaly whats you ign,LeagueConnect,d5yz0nc,1,t5_30v2b
8498887,0,t3_4vpyug,If you want you can add me as well IGN is felixx on EUW,LeagueConnect,d63wuu5,1,t5_30v2b
8522453,0,t3_4wgjhx,added you IG  NightWing ,LeagueConnect,d66v9e0,1,t5_30v2b
8528114,0,t3_4wil98,sick meme,LeagueConnect,d67kt90,1,t5_30v2b
8545938,0,t1_d5zdupv,Summoner Name BestSuppordleNAWilling to AdoptDivision Gold What I want to learnI will teach I mostly play bot lane so it would be centered on bot lane decision making and team fighting.,LeagueConnect,d69tagj,1,t5_30v2b
8557439,0,t1_d6977br,added,LeagueConnect,d6b97qu,1,t5_30v2b
8558727,0,t1_d6beq7j,I main mid and can play adc or top,LeagueConnect,d6bf1fr,1,t5_30v2b
8625030,0,t3_4xz3n8,Sir Angus McFife,LeagueConnect,d6jqc46,1,t5_30v2b
8633799,0,t3_4y46tt,Hi uYaBoyKim your post was removed because the title did not include one of the required tags.Server tags currently supported are NA EUW EUNE OCE BR TR RU KR JP LAN LAS SEA CHN PBEInclude the tag somewhere in your title you can find your server by clicking hereexample NA Looking for friends NA Looking for friends Wanna duo? EUW etc.If your server is one of these Taiwan TW Singapore  Malaysia SGMY Thailand TH Indonesia ID Philippines PH and Vietnam VN please use the tag SEA.ampnbsp General Add this tag to LoL related discussions or topics.example General Need some jungling tips General Should Fiora be nerfed? etc.ampnbspWarning  Any type of advertisements must go in our Weekly Community Promotion Thread.Warning  Dont announce your gender in posts.Please get familiar with our subreddit rulesrleagueconnectwrules before posting again.I am a bot and this action was performed automatically. Please contact the moderators of this subredditmessagecompose?torLeagueConnect if you have any questions or concerns.,LeagueConnect,d6ktysx,1,t5_30v2b
8657118,0,t1_d6npxcc,username?,LeagueConnect,d6nr6t1,1,t5_30v2b
8673570,0,t1_d6pt3sf,Cool man where u from ?,LeagueConnect,d6ptgt6,1,t5_30v2b
8738937,0,t3_4vllex,removed,LeagueConnect,d6y0mi7,1,t5_30v2b
8751764,0,t3_4zwkmr,Heya! Id like to play a few games  IGN Someone Like You,LeagueConnect,d6zmlg9,1,t5_30v2b
8804910,0,t3_50o8aa,Thurman,LeagueConnect,d768bmj,1,t5_30v2b
8872581,0,t3_51rnun,btw if its still week ofc still add me i m still playing D,LeagueConnect,d7ecxvl,1,t5_30v2b
8890580,0,t3_520qci,ign magicbans should be fun!,LeagueConnect,d7gisjg,0,t5_30v2b
8948191,0,t3_52uao3,deleted,LeagueConnect,d7nfuxn,1,t5_30v2b
8955974,0,t3_52ye54,Add it up homie SKT T,LeagueConnect,d7odh0p,1,t5_30v2b
8990752,0,t1_d7si6oi,Alrighty Ill add you. curlyspice is my IGN,LeagueConnect,d7sjt6f,1,t5_30v2b
9003152,0,t3_53l4jk,Similarly abandoned and its no fun feeding alone. IGN Sherbet Lemon sent an add.,LeagueConnect,d7u1f41,2,t5_30v2b
9009576,0,t3_53m2fy,deleted,LeagueConnect,d7ut6jz,1,t5_30v2b
9070430,0,t3_54dbo7,IGN MortemKat I can play any role that is needed and have a good grasp of at least three champs per role. I mainly enjoy playing Katarina Leona Darius Ashe Lux and Yi. Those are also my best champs more or less. ,LeagueConnect,d824ag7,1,t5_30v2b
9088011,0,t3_54g9pv,HMU ign Vexioz,LeagueConnect,d848de5,1,t5_30v2b
9102599,0,t3_54t8su,Hi my summoner name is Notoro um I main support but a also like to jungle will mid if I have to but other wise I stick to supportlevel  Janna and lulu one trick want more friends lmao,LeagueConnect,d85zitx,1,t5_30v2b
9140698,0,t3_55hskn,IGN TaraBabcck Currently retwatching worlds so we can play in like an hour if youre down,LeagueConnect,d8andwi,1,t5_30v2b
9180312,0,t3_55yaf9,ayyy LOL seaotter,LeagueConnect,d8fo6w1,1,t5_30v2b
9184693,0,t3_564jgf,Hi uSkiab your post was removed because the title did not include one of the required tags.Server tags currently supported are NA EUW EUNE OCE BR TR RU KR JP LAN LAS SEA CHN PBEInclude the tag somewhere in your title you can find your server by clicking hereexample NA Looking for friends NA Looking for friends Wanna duo? EUW etc.If your server is one of these Taiwan TW Singapore  Malaysia SGMY Thailand TH Indonesia ID Philippines PH and Vietnam VN please use the tag SEA.ampnbsp General Add this tag to LoL related discussions or topics.example General Need some jungling tips General Should Fiora be nerfed? etc.ampnbspWarning  Any type of advertisements must go in our Weekly Community Promotion Thread.Warning  Dont announce your gender in posts.Please get familiar with our subreddit rulesrleagueconnectwrules before posting again.I am a bot and this action was performed automatically. Please contact the moderators of this subredditmessagecompose?torLeagueConnect if you have any questions or concerns.,LeagueConnect,d8g86tf,1,t5_30v2b
9210444,0,t3_56gm1p,Currently at my parents maybe back tomorrow or monday,LeagueConnect,d8jhqp1,1,t5_30v2b
9213206,0,t3_56jr18,You can add Gosupro ! I have a few who would be interested in s as well.,LeagueConnect,d8jubw0,1,t5_30v2b
