,controversiality,parent_id,body,subreddit,id,score,subreddit_id
6394089,0,t1_czejpvl,Agreed. You didnt ask for a free drug lawyer just a drug lawyer. As long as Mr. Green money shows up criminal defense lawyers will help out. If money isnt available and depending on the charge and the persons finances a free lawyer will generally be provided at arraignment and after. But Lawyers for Burners will likely know the drill pretty well in terms of expected outcomes to the possible charge.,BurningMan,czgfwsg,1,t5_2qj68
6438141,0,t3_43vg7n,Wait a week or a couple days now. Then instead of speculating we will have a definitive answer to  tickets.,BurningMan,czl8qed,2,t5_2qj68
6455001,0,t1_czm73j3,They did.  The debauchery continued...,BurningMan,czmzmpy,1,t5_2qj68
6490062,0,t3_44340e,Does anyone have any insight into how the number of invitations for the DGS are calculated?  Last year was my first year running a theme camp and I got the email that were going to be allocated some invitations for the DGS this time around.  For people who have done this before how closely does the number of invitations you get correlate with your previous years camp size?  We were a small camp about  people so does anyone have any idea how many invitations I should expect?  Im just trying to get everything lined up with my campmates as smoothly as possible and dont want to overpromise.  Any insight is appreciated!,BurningMan,czqmczo,2,t5_2qj68
6508999,0,t1_czr8svp,I love this plan. If enough burners were on board would definitely make a statement.,BurningMan,czskwe2,1,t5_2qj68
6510772,0,t1_czs1y6u,Its seriously worth the timemoney investment. Last year was my first year and thanks to heavy research I went with a yurt. It took me like  weekends to build but it was a palace. Combined with my swamp cooler led lighting and solar panel and it was more comfortable than some RVs I was in.,BurningMan,czsrifb,2,t5_2qj68
6535310,0,t1_czu4zpu,of course people wanting to set up a stage will say the sound curfew has been lifted. thats not surprising at all.,BurningMan,czvaxln,1,t5_2qj68
6557246,0,t1_czxf2wx,Thats really great  and I do know a few people who did similar things  I also know a TON of what Id stereotype as party people from my local rave scene who now go to burning man to chase down Diplo and Skrillex and their contribution to their next burn was figuring out how to have more AC to sleep through the day better. Let alone a ton of my local burner scene whos contribution as theme camps is some tired jokes LED rope lights and an open mostly untended bar. its great that some people get really inspired. One of the reason folks like me talk about the culture so much is we really were hooked by that part more than the shiny things it was being a part of a social movement something larger than ourselves and when new people choose not to embrace that or actively ignore it it feels bad. ,BurningMan,czxkn7t,2,t5_2qj68
6599496,0,t3_459vav,Stagetype fixtures have more punch on playa than they do on a stage.  Every year I bring about a dozen IP rated LED fixtures which range in output from watts.  Even the w LEDs punch through the background levels of countless  strings EL wire etc with ease.  In terms of surviveability IP rating or better for your fixtures is pretty important if you expect to use anything for more than one year.  If you really want a moonflower be ready to tear it apart after each year and clean it really well.  Keep it bagged when not in use.For entrylevel DMX control I recommend QLC running on an old toughbook outputting from an openDMX USB device.  You can use a cheap DJ style DMX board but expect the faders to die almost instantly.  Monoprice AESEBU cables are about the cheapest way to move DMX over XLR.Some example linksWashFloodHighPower WashQLCOpen DMX InterfaceExample of cheap usable toughbook,BurningMan,d01xwt8,2,t5_2qj68
6601356,0,t1_d00c8nx,Yeah the rectangular sheets are the capacitive film.  I dont think the acrylic affected them too much.  You can actually put the sensor in a sort of proximity mode and they can detect a hand a few inches away which makes me think that the acrylic doesnt do much to decrease performance.  The film itself is a pretty flimsy too.  Id hate to have it exposed to the elements directly.And yes the edges of the acrylic are totally badass edgelit with addressable LEDs.  That worked really well with the etched acrylic ,BurningMan,d024upv,2,t5_2qj68
6616922,0,t3_46bbyd,Weve been getting a lot of spam from brand new accounts so were autodeleting anything posted by an account that is less than an hour old.  You can post here with this account once it is at least one hour old.  Please wait until then and resubmit your post. In the meantime have a look at our intro thread theres a tonne of info about the burn and this sub that you should have a look through before you post. It may even answer the question you were asking here.I am a bot and this action was performed automatically. Please contact the moderators of this subredditmessagecompose?torBurningMan if you have any questions or concerns.,BurningMan,d03qvlj,1,t5_2qj68
6642625,0,t3_46g97a,love footage from s playa its all so raw and DIY fun movie,BurningMan,d06el4h,1,t5_2qj68
6781177,0,t1_d0kvr4i,,BurningMan,d0kxj4d,2,t5_2qj68
6809398,0,t1_d0nztem,Oh man...,BurningMan,d0o54bs,1,t5_2qj68
6838476,0,t1_d0rfeml,gt Bolt it. You bolts. Heads up. Use  or  size bolts cus everyone has those.  course thread.gt Why? Because as you build it you may change your mind and bolt together is easy to chance. You can always weld it in for a permanent setup later.gt The third time you build it will be your best. Three times. Thats the rule. Just the way it goes.Thanks. I really appreciate you sharing what youve learned through experience.,BurningMan,d0rg09q,1,t5_2qj68
6848181,0,t1_d0sjnqy,I absolutely hate it. He was a virgin so I guess didnt know better tried to tell him to not do that but I cant tell him what to do. I might try to come up with a plan to keep my camp mates unplugged.,BurningMan,d0sjr00,4,t5_2qj68
6875873,0,t1_d0voq8l,Definitely true! Just wondered if it was a known waste of time like I suspect or not. I suppose Ill be torturing myself either way! ,BurningMan,d0vozir,1,t5_2qj68
6933414,0,t1_d11cf4v,Yah that never happened. Bad jokes were rewarded with double pours ,BurningMan,d1288li,3,t5_2qj68
6939817,0,t1_d12xn60,Googling for Burning Man Hash House Harriers found this ,BurningMan,d12yhg8,1,t5_2qj68
7006126,0,t1_d1a15t3,How exactly will this reward unprepared idiots? If you registered for the sale and you are here to press a button on time... I mean thats all there is to it.Are you more prepared to press the button?,BurningMan,d1ahmb7,2,t5_2qj68
7009288,0,t1_d1auesr,The dress is white and gold.,BurningMan,d1aukgu,1,t5_2qj68
7009495,0,t3_4bbghc,Got my tickets. Easy as pie ,BurningMan,d1avey9,3,t5_2qj68
7009946,0,t3_4bbghc,wow  in our camp got tix. Everyones first burn as well.,BurningMan,d1ax9fa,8,t5_2qj68
7010019,0,t1_d1ax2dw,Ah  I guess just keep trying at the other sales then? ,BurningMan,d1axk7j,1,t5_2qj68
7011489,0,t1_d1awilh,Its hard enough to transport food and water for  days. Forget about ,BurningMan,d1b3kyk,1,t5_2qj68
7014656,0,t3_4bo83n,Report them. Heres how,BurningMan,d1bgjuq,2,t5_2qj68
7025864,0,t1_d1cltby,gt just showing up one day to be a greeterJust for my future reference... where would one show up to do that?,BurningMan,d1cqgmn,1,t5_2qj68
7039779,0,t1_d1eayd6,You made me picture umarkday saying it. ,BurningMan,d1ebdcy,3,t5_2qj68
7050104,0,t1_d1f91sj,Buy a PAX,BurningMan,d1fhjzm,1,t5_2qj68
7059239,0,t3_4caxcu,One sneaked through our camp last year it looked dusty thirsty tired and scared. It wouldnt let anyone near and ran away before we could get it some water. You dont see cats roaming the desert in nature they dont belong out there so dont bring them.,BurningMan,d1giwqy,47,t5_2qj68
7105440,0,t1_d1l08nl,Or use  and then double what she says to bring. For a friend.,BurningMan,d1lrx0u,2,t5_2qj68
7110020,0,t1_d1masgy,Ermagerd internet points ,BurningMan,d1mawsj,-1,t5_2qj68
7159616,0,t3_4diztu,Very introverted. Have a ton of fun. ,BurningMan,d1rz8zv,1,t5_2qj68
7194187,0,t1_d1vsdi8,Ill allow it!  ,BurningMan,d1vx4p5,1,t5_2qj68
7228940,0,t3_4ee876,Tip Dont bring your laptop or tablet and keep your phone off in the car. ,BurningMan,d1zvki7,6,t5_2qj68
7230131,0,t1_d1zxf6c,I did the same.  The Otterbox works quite well!,BurningMan,d200gcv,2,t5_2qj68
7242943,0,t1_d20qlbz,Not getting tickets in the main sale is merely a setback. Keep planning your camp as if you have tickets and go read this I started a camp last year. We got just  tickets in the main sale but we forged ahead and got the rest of the tickets and vehicle passes through other sources  craigslist burner friends a conversation at a regional event etc. We lost a couple people in the process but we still ended up with a great camp. We worked out butts off to impress placement and get DGS this year.I feel like BMOrg is shifting the priority back to participants and I personally applaud this decision. Participation is the foundation of our community and it is being eroded by this spike of nonparticipating Coachellaesque spectators. ,BurningMan,d21gxjt,6,t5_2qj68
7257335,0,t1_d232sd2,reasons i hate EL wireLEDs exist.theyre hard to fix when they break.mine were never bright enough.the inverters always ate batteries while whining loudly about not having enough batteries to eat.one color? really?hope you enjoy displaying an illuminated tangle.sorry your  inches short to finishing your design.as far as im concerned EL wire can sit next to optical discs on my shelf of things no longer needed.    .EL panels are pretty cool tho  ,BurningMan,d233vjh,12,t5_2qj68
7300244,0,t1_d27vttl,Sometimes you just gotta put you first. Weddings are nice an all but they can get annoying. Just politely decline and do the burn ,BurningMan,d27zkwk,4,t5_2qj68
7302493,0,t3_4fe4uj,So I have a roundabout idea that is somewhat ironic on multiple levels but potentially awesomeI make my Sextant Stickers at StickerMule They are extremely high quality and with great customer service.They also do custom outline cutaways for the stickers if you want.You could have small debaucherous stickers made that both cover up the logo and put something funny on there P,BurningMan,d288srf,2,t5_2qj68
7317321,0,t3_4fk8u7, drop tabs erryday,BurningMan,d29xhbd,2,t5_2qj68
7468911,0,t3_4hn9v3,Was wondering if this would end up here at all. Stefanie was a good friend. She had been heavily involved in the past  effigies and was an amazing asset to the burn world. She was a kind amazingly bright happy soul who genuinely cared about the wellbeing of everyone around her. Last years Alchemy effigy ended up being built in my back yard due to extenuating circumstances and last minute changes and she was such a positive influence on the whole team. My dog loved her because she gave him potato chips.,BurningMan,d2r640e,22,t5_2qj68
7514709,0,t3_4i9smd,Fuck Yeah man. This was great. Excellent music choice as well.,BurningMan,d2wdvc5,5,t5_2qj68
7541789,0,t1_d2zdb1l,This is a better idea than one might assume. ,BurningMan,d2zgr1v,1,t5_2qj68
7548053,0,t3_4inan1,And if  isnt enough.... ,BurningMan,d306e12,3,t5_2qj68
7550215,0,t1_d30bi4x,Thanks! Sounds smooth enough.,BurningMan,d30f8rr,1,t5_2qj68
7559467,0,t1_d31euvz,Huh. I thought water fill ups were one of the few exceptions like greyblack water pumps outs that can be flagged and paid for with cash on playa. If anything Id have thought that getting a random clean water refill would be more ok than a random black water pump out which I know have been happening for years. ,BurningMan,d31h3tq,1,t5_2qj68
7566671,0,t3_4iyq4m,Im a virgin so I dont know all that much about BRC bike specifics but there are some XL sized seats Ive seen. Even some with back support.  Just search extra large bike seat on google.,BurningMan,d32al9s,1,t5_2qj68
7589681,0,t1_d31i0dl,Invokes full rage,BurningMan,d34wr2h,2,t5_2qj68
7638732,0,t3_4jvn44,I celebrated my birthday on Burn Day last year. It was the single most incredible birthday party ever. I also happened to share the day with a camp mate. We ran into one another at Distrikt and realized it was both of our birthdays. Then some lovely people poured liquor down our throats from atop the bar. I didnt set out to do anything in particular aside from dance see amazing art watch the burn and swim in a sea of love. I was relatively quiet about it too though. It was special to me but the event is special to everyone regardless of whether its their birthday. ,BurningMan,d3ahbyl,0,t5_2qj68
7692495,0,t3_4koylv,You can never get it all off. Try a sponge damp with water and vinegar.,BurningMan,d3gl5kj,5,t5_2qj68
7706330,0,t1_d3hwhh6,Wow so basically Im not going to get one. bummer man. I just sighned up on STEP today.Hopefully I can get on one the OMG sale. ,BurningMan,d3i5ply,2,t5_2qj68
7722742,0,t1_d3k0m76,Right behind center camp. Party at  then volunteering begins shortly after. ,BurningMan,d3k0tyj,1,t5_2qj68
7723537,0,t1_d3jxjef,What are the relative advantagesdisadvantages?,BurningMan,d3k42v7,1,t5_2qj68
7724604,0,t1_d3jcfas,Universal in Florida? The Wizarding World of HP?,BurningMan,d3k8fcl,1,t5_2qj68
7772488,0,t1_d346rrg,Also my second year. My first year I was encouraged to wander with my eyes by walking towards interesting lights or art. This year I will wander more with my ears. Im much pickier about music. The art will all be amazing so Ill plan to ear wander more. Besides I love how burners follow the hottest sounds around the playa its part of the magic thats so hard to explain. I plan to bring more gifts this year. I plan to volunteer more... Pretty sure that will just increase with every year. ,BurningMan,d3po3ts,1,t5_2qj68
7773328,0,t1_d3pr6nk,are you guys H or A? taking anyone for legion for leveling fun? ,BurningMan,d3prjcj,1,t5_2qj68
7781825,0,t1_d3h171k,what with like a cloth or something?,BurningMan,d3qq8xz,1,t5_2qj68
7802810,0,t3_4m5gyf,dont feel pressured to dress right. comfort is key but just do it with some personal flair. look around at pix of burners online to get some ideas and then be creative and make an outfit in your own style as simple or as wild as you want to be.,BurningMan,d3t3hmq,4,t5_2qj68
7818961,0,t3_4mek9r,BLM folks are great. They fed me birthday cake last year. ,BurningMan,d3uwzs9,3,t5_2qj68
7882634,0,t3_4n8475,A polaroid photo it was of me and my buddy sitting right in front of our first camp. Dude was cutting through our theme camp stopped and snapped the photo handed it to us and kept walking. I didnt take nany photos that year and everytine I open my burner stuff it hits me in the feels plus with all he wear it looks like it was taken in the s. ,BurningMan,d422xot,7,t5_2qj68
7888129,0,t1_d42di16,I think its propane bubbled up through water with a little soap.  The result is flammable foam that doesnt do much to hurt wet hands.,BurningMan,d42p5wo,5,t5_2qj68
7930610,0,t1_d47dpqx,There are charter airlines that fly in regularly already into BRC airport in particular   These companies already fly many people in and are familiar with how to run a medium scale operation into NV.  My guess is that bmorg is looking into a more formal contract with them though this is pure speculation.  I have always had a great experience working with the Advantage Air people at the airport.,BurningMan,d47h4gc,5,t5_2qj68
7946149,0,t1_d49568a,deleted,BurningMan,d497zmc,1,t5_2qj68
7952453,0,t3_4o484q,Art cars get in the way of everyone trying to watch every burn. Leave it in camp. ,BurningMan,d49xitq,3,t5_2qj68
7959630,0,t1_d4aooz9,OK thats a pretty cool idea  using the PNG line by line to run the strip.  Very very clean and effective way to make some really neat effects without a lot of complex algorithms.,BurningMan,d4aqk4v,6,t5_2qj68
7960537,0,t1_d4as3is,They arent moving to Utah. They made that pretty clear with the Fly Ranch purchase.,BurningMan,d4au8fn,4,t5_2qj68
7961187,0,t1_d4aq9mi,Bus Plus I think is what its called is new this year theyre selling  BM tickets in a package with Burner Express tix. You MUST ride the bus to get the BM ticket.,BurningMan,d4awvc2,2,t5_2qj68
7961320,0,t3_4o95nj,Ive seen that thing out there its really impressive. I hope they get more than k they invested k. ,BurningMan,d4axeqg,2,t5_2qj68
8033649,0,t1_d4j1vwo,deleted,BurningMan,d4j23o4,1,t5_2qj68
8045039,0,t3_4pen4v,Maybe get yourself to a portopotty first?,BurningMan,d4kc79j,9,t5_2qj68
8052915,0,t1_d4kgext,At a certain point Im going to equate Pajamas shilling for Lamplighters like Huck Finn and painting his white fence.,BurningMan,d4l81xb,1,t5_2qj68
8053607,0,t3_4phx8p,Great job! Pumped about my bike as well been working on it since December.  Bike enthusiasts unite! hehe,BurningMan,d4lauxu,1,t5_2qj68
8093222,0,t3_4q2hv7,I very rarely drink or anything at burns.,BurningMan,d4pr1qc,3,t5_2qj68
8102527,0,t3_4q44bl,Cinderella story. Outta nowhere. A former greenskeeper now about to become the Masters champion. It looks like a mirac..,BurningMan,d4qspha,2,t5_2qj68
8103762,0,t1_d4qv4in,Phil me up buttercup.,BurningMan,d4qxp7h,2,t5_2qj68
8114721,0,t1_d4s5wq2,U R A PLAYA FRIEND I ONLY SEE ONCE A YEAR WHY WOULD I JUDGE U. ,BurningMan,d4s62bi,2,t5_2qj68
8115267,0,t3_4qb6a9,Ace Monster Toys in Oakland has a tool that you could use ,BurningMan,d4s89tz,1,t5_2qj68
8125852,0,t3_4qj4oa,deleted,BurningMan,d4tf3if,-5,t5_2qj68
8163074,0,t1_d4xw104,The poles have held up fine. They are all attached at the top center of the tent which makes it work like an ez up when opening it. I think that helps reinforce them a bit. ,BurningMan,d4xxks1,1,t5_2qj68
8168276,0,t1_d4ykxpt,Ha. If you want to share them man,BurningMan,d4yl1ez,-33,t5_2qj68
8193408,0,t3_4rixes,Worse than the dust for a rash or two is the sore ass a lot of folks from riding a bike one week out of the year.  Camp walk like a cowboy gets pretty full at the end of week.People react differently.  I go for two weeks rarely wear shoes and have no issues for the past eleven years.  other than having to listen to people explain how sorry Im going to be  Small cuts I bandage like I cut a finger off.  I still have first year scars.,BurningMan,d51q7gi,3,t5_2qj68
8197058,0,t3_4rixws,Clearly a horse size dog needs to be named SparklePony. Get him a glitter collar or ten. Hes never going to bring his own water might as well embrace it. ,BurningMan,d526o7x,8,t5_2qj68
8206159,0,t3_4rq66r,rlegaladvice is probably the best sub for this.,BurningMan,d53boxc,1,t5_2qj68
8207432,0,t3_4qd8ro,Palm Tree Country Club  G and A performance art project brought to you by Team Palm Tree.Relax during a tasting of the finest boxed wines perfectly paired with delicate processed cheeses served to you by our friendly and silly staff members. You may also enjoy our fabulous puttputt course while you taste!,BurningMan,d53hf6l,4,t5_2qj68
8209072,0,t3_4rpqdy,Cutting out ice cream. I love ice cream...,BurningMan,d53ot6m,1,t5_2qj68
8218135,0,t1_d54fl3b,That must have been a different one. Its like wizard franchises. Theres a few out there based on an internet post a few years ago. My group is based out of Seattle and has only does regionals as a camp.,BurningMan,d54tmd5,2,t5_2qj68
8224761,0,t1_d55c5am,They have. Its called fly ranch it is something like  acres and they already bought it. This is the beginning of rattling the hornets nest and it has nothing to do with the fees themselves. They will push the BLM will push back. At which point they will use BLMs push back as justification for moving the entire event to land they own.  And it is a good thing. Once BM is on private land this limits the BLMs power. It also gives them a long term plan for the land itself. They can trench in fibre and power. They could even strike a deal to connect the local rail lines. Rail is the only realistic means to expand the event at this point.  Assuming they can lease a passenger train to make daily trips in and out. A freight train would be handy too.Edit look at the topography  train tracks would be hard to drop,BurningMan,d55ngng,6,t5_2qj68
8225952,0,t1_d55sjo4,The BLM and the org got along just fine before that single person took over things dealing with burning man. That single person has since been reassigned by the BLM to someplace far away from having anything to do with burning man based on his absurd actions see Choco tacos et al. Im not splitting hairs Im smacking you upside the head with some perspective. ,BurningMan,d55stm3,8,t5_2qj68
8230640,0,t3_4s2mu6,This year will be my first burn. Im going with Mace the Face. Its the knick name my dad gave me.,BurningMan,d56dx6f,2,t5_2qj68
8230715,0,t1_d56e8jr,Whatever Naked Pancakes.,BurningMan,d56e9bl,6,t5_2qj68
8245487,0,t1_d585bxp,Drive a lag partially in put the rib over top of it. The ribs have to sit on top of something. Still I see zero reason to use lags for this instead of rebar  the major issues with rebar sharp stickoutofground etc are not a problem using it to secure a rib.,BurningMan,d588pdb,1,t5_2qj68
8281241,0,t1_d5cpbs3,Even with a strict ramen diet youve still got ticket  flight  burner bus which is gonna be more like .,BurningMan,d5cppy8,1,t5_2qj68
8283254,0,t1_d5cxpv6,Praise. ,BurningMan,d5cysen,8,t5_2qj68
8298069,0,t3_4t3mhj,No. And you dont want to either.The whole by bike or by foot thing is simply to keep you more engaged with the immediate experience  where you are right now  and not about going to the whoopie dome to see DJ monkeynuts spin.It is antisocial to be on anything other than foot or bike. Plain and simple. Just dont be That Guy. Because That Guy is a douche.Itll make more sense once you are there. Burning Man is just a completely different environment where you interact differently with everyone and everything around you. Embrace that.,BurningMan,d5eteto,6,t5_2qj68
8306774,0,t1_d5frfbi,Ive got a small LiIon in there right now which seems to be working really well.,BurningMan,d5fwj6y,1,t5_2qj68
8336471,0,t1_d5it5zp,If you plan on going barefoot a good portion of the burn... use a pumice stone and get rid of your foot calluses. Clean your feet daily lots of moisturizer.  If you see any cracking then start wearing shoes!,BurningMan,d5jm38x,2,t5_2qj68
8353221,0,t1_d5l3e6e,I mean really... its a brilliant fucking idea.,BurningMan,d5lpevo,1,t5_2qj68
8376005,0,t3_4ub4pz,zebra,BurningMan,d5ojtmg,2,t5_2qj68
8422941,0,t3_4v0p01,Is anyone by chance gifting an orgy with me and  other women fueled by mdma and boner pills? Ive always wanted to experience the city elbows deep in flesh and gain a whole new perspective of it.Im going alone this year  if someone could gift that to me that  would make it that much more special. What are the chances of someone doing Brazilian scat porn out there?,BurningMan,d5uer2y,32,t5_2qj68
8435240,0,t1_d5u2o0b,PS Also glutenfree. Save me some pizza! Though I cant have dairy either so Im not even gonna bother requesting any for my camp. ,BurningMan,d5vy05j,2,t5_2qj68
8451801,0,t1_d5y0283,ESD.   Looking forward to your next one!,BurningMan,d5y0f7y,1,t5_2qj68
8459181,0,t3_4vjqy2,Weve been getting a lot of spam from brand new accounts so were autodeleting anything posted by an account that is less than an hour old.  You can post here with this account once it is at least one hour old.  Please wait until then and resubmit your post. In the meantime have a look at our intro thread theres a tonne of info about the burn and this sub that you should have a look through before you post. It may even answer the question you were asking here.I am a bot and this action was performed automatically. Please contact the moderators of this subredditmessagecompose?torBurningMan if you have any questions or concerns.,BurningMan,d5yxkkq,1,t5_2qj68
8468058,0,t1_d5zmm42,fight me,BurningMan,d601o1w,2,t5_2qj68
8470353,0,t3_4vpjmb,What on earth makes you think you need a camp to stay with? Build a monkey hut for shade. Dont cook food.  Pack a cup each and lots of booze and water done. ,BurningMan,d60c1af,11,t5_2qj68
8472765,0,t1_d60m16w,I dont have a vehicle to haul a Uhaul rental box.  I know my civic wont be able to pull it nor do I want to take it back out there. Now I feel like Im in a pickle because I dont want to ruin the rentals paint. I had thought about lying a blanket down to avoid friction but apparently this may backfire. ,BurningMan,d60mxlw,1,t5_2qj68
8476568,0,t1_d5zw5be,It seems like they are trying to get people to join a theme camp more and more each year.,BurningMan,d6142rx,0,t5_2qj68
8490928,0,t1_d62w3at,yep same.,BurningMan,d62wx8z,1,t5_2qj68
8490935,0,t3_4w0aqm,Its my understanding that more tickets are sold than the actual population cap of the city. Because of that theres probably some fluidity in the number of tickets sold. They also probably have a good idea what the rate is for purchases. So they open up enough slots to get approximately as many final sales as they hope for and if they sell a few extra its no big deal. There are other ways to do it but they seem more difficult. ,BurningMan,d62wydx,2,t5_2qj68
8512124,0,t3_4wb7ml,Requesting one ticket at face value! I live locally in the Bay Area absolutely serious!,BurningMan,d65kmua,2,t5_2qj68
8513884,0,t1_d65qy2o,deleted,BurningMan,d65sl12,1,t5_2qj68
8541665,0,t1_d6995os,This is not the case for most camps ,BurningMan,d699zf9,3,t5_2qj68
8542674,0,t3_4w1kmr,i wanna use a  x  ez up to shade my tent. If I secure it with rebar I should be alright right? ,BurningMan,d69ejj7,1,t5_2qj68
8545871,0,t1_d69s44p,Im just going to have to take a page out of pajamas book and agree to disagree here.  Apologies if I got heated Im just going to drop it and get back to prep work that needs doing.,BurningMan,d69szkz,0,t5_2qj68
