,controversiality,parent_id,body,subreddit,id,score,subreddit_id
10575490,0,t1_dd6rpt2,But theyre not elastics either lol,badwomensanatomy,dd6s1wy,15,t5_2zlzd
10580461,0,t1_dd727z2,Isnt he lucky?,badwomensanatomy,dd7ajpi,10,t5_2zlzd
10595977,0,t3_5r7yex,Anyone who refers to something as complex as childbirth as pooping out a baby has no room to speak about intelligence and lacks basic decency. What an ass.,badwomensanatomy,dd8w6c0,1,t5_2zlzd
10597483,0,t1_dd91ieq,True.,badwomensanatomy,dd91rr3,3,t5_2zlzd
10605320,0,t1_dd96o1a,gt It is. The vagina is elastic and goes back to its regular size after sex and after childbirth but that may take a bit longer but it will go back. What looks loose to these men is the size of the labia. Some womens are naturally large and it has nothing to do with sex. So yes it is a myth.When people say loosetight theyre not talking about the appearance of the labia or how anything looks. But how it feels around the mans penis when they have sex. From what most guys tell me there are differences person to person but its usually pretty minor.,badwomensanatomy,dd9uw2z,6,t5_2zlzd
10610183,0,t3_5rph9w,removed,badwomensanatomy,ddacy4i,1,t5_2zlzd
10610514,0,t3_5rrd4z,I dont know about you lot but my clit is so wide open that entire universes have been known to disappear into its deep dark void...,badwomensanatomy,ddae6eo,11,t5_2zlzd
10611442,0,t3_5rrd4z,I wish redpillers would give up women.,badwomensanatomy,ddahmkf,16,t5_2zlzd
10621172,0,t1_dd6vi74,Which the human body does anyway on a small scale through aging. But you can counter that effect through strengthening activities to a degree. ,badwomensanatomy,ddbhru4,2,t5_2zlzd
10661637,0,t1_ddfnaac,Yeah I kind of wanted to burn my phone as soon as I hit send haha,badwomensanatomy,ddfo0fz,11,t5_2zlzd
10662516,0,t1_ddf653m,Oh god I bet someone probably could market a modified snorkel as a g spot suction device.,badwomensanatomy,ddfr9rx,2,t5_2zlzd
10670595,0,t1_ddgebjk,David Avocado Wolfe says gravity is a toxin but when you turn upside down it turns into medicine.,badwomensanatomy,ddglaee,49,t5_2zlzd
10676385,0,t1_ddgsod9,gt Im  sure the person in the picture has no idea what she is talking aboutIf its posted to this sub its safe to assume the other  too.,badwomensanatomy,ddh6srl,13,t5_2zlzd
10678028,0,t1_ddgupqw,Its a broadsheet just a more centreleft broadsheet. The opinion pieces tend to be further left the actual articles are pretty centreish. Its the telegraphs opposite twin. ,badwomensanatomy,ddhcw3t,3,t5_2zlzd
10680924,0,t1_ddfrzp5,Isnt massaging your abdomen supposed to help with cramps too? Are they worried youre gonna squeeze all the blood out like squishing a toothpaste tube?,badwomensanatomy,ddhnn38,3,t5_2zlzd
10684430,0,t3_5sq6qk,Wild animals eat natural plantbased diets and they have mating seasons called heats during which the female animals ovulate in preparation for fertilization.So either carnivores arent wild animals or they dont reproduce in the normal way for mammals.That alone shows you what kind of logic were dealing with here.,badwomensanatomy,ddi0nu2,10,t5_2zlzd
10684700,0,t3_5su58x,You can even be opposed to abortion and still accept that you simply cant just legislate it away women will always need abortions and contraceptive. People will always have sex. You cant stop it.,badwomensanatomy,ddi1nxc,114,t5_2zlzd
10700127,0,t1_ddjbw9d,Possibly or theyve seen porn where that happens and dont seek out another video  months after only to see the Porn stars genitals at exactly the same size.One of the most fascinating things is how guys dont seem to actually like raw unfiltered women just the idea of women. The perfectly perfumed smells like mangos and strawberries vajayjay the woman who eats but not too much takes care of herself but isnt too prissy and doesnt take too long to get ready makes money but not more than him and is willing to drop everything to make him happy idea. Guys like that. They dont like anything deviating from that including the idea that a woman might enjoy having sex as much as him and have had a lot of sex before she met him.,badwomensanatomy,ddjmzza,34,t5_2zlzd
10718238,1,t1_ddlbikq,Actually my periods are lighter and less crampy with cloth pads vs disposable one.,badwomensanatomy,ddli972,6,t5_2zlzd
10718780,0,t1_ddj4kee,I teach ESL and will about once a semester get an email saying an Asian student cant come to class because theyre on their period.  I feel for them prior to birth control I had to miss my first day of every period because my cramps were so God awful but I have to explain  TMI and  Thats not a valid excuse in the US.,badwomensanatomy,ddlk9o5,1,t5_2zlzd
10723819,0,t1_ddlzxeq,I understand that some people who eat it have it dehydrated and put into capsules. No taste.,badwomensanatomy,ddm2z2c,6,t5_2zlzd
10731855,0,t3_5th0oq,Better not show my missis this,badwomensanatomy,ddmwsik,1,t5_2zlzd
10740887,0,t1_ddnn746,I had an awesome male obstetrician. He treated me with more respect than any other doctor of any type Id seen including the rotating staff of female OBs I saw with my other pregnancy and he was generally laid back and just a decent guy. I mean Im not denying theres a general cultural problem but there are good ones out there too. ,badwomensanatomy,ddnuatr,30,t5_2zlzd
10749172,0,t1_ddooojc,Only if youre Anna too!,badwomensanatomy,ddop0wd,26,t5_2zlzd
10751145,0,t1_ddotehf,I know you already got corrected several times but heres another. Youre saying Do vaginas sweat like balls sweat? then claiming you were using vagina colloquially. Thats just not a thing. If someone called your dick balls Im fairly sure youd correct them. Lady business V Bermuda trianglethose are colloquialisms. Vagina is an anatomical term. ,badwomensanatomy,ddowcfo,30,t5_2zlzd
10771671,0,t3_5u2b83,Yet I would probably take a good donut over a dick. Mmm.,badwomensanatomy,ddr0o82,27,t5_2zlzd
10778776,0,t1_ddre5ob,I tap out woman please throw me a bone!FTFY,badwomensanatomy,ddrr3ph,8,t5_2zlzd
10790114,0,t1_ddss8eq,He must be having some shitty sex if women would choose days of feeling bloated crampy and gross while blood seeps out of them. ,badwomensanatomy,ddsx9yc,16,t5_2zlzd
10797508,0,t1_ddsoysf,Pour some lukewarm water over your bits whilst your weeing and it wont sting ,badwomensanatomy,ddtop74,2,t5_2zlzd
10801117,0,t1_ddu1v4k,Something something extra virgin.,badwomensanatomy,ddu24gx,20,t5_2zlzd
10807383,0,t3_5ug77f,My mother apparently never experienced menstrual cramps or any other discomfort related to periods. She always said that mood changes werent real just an excuse for women to be bitchy and get away with it. When I was a teen my cramps were so bad that I even fainted a few times usually at school my mother never believed me! i once went to her bedroom to ask her if she had any pain killer I could take because the pain was really bad she told me to just lay down and wait for the pain to go by itself Im sure I was crying bot because of the pain and  her indifference.  years ago she got the menopause and just a few months  before her periods got so bad once she almost bled out  and fainted on the street. Her attitude completely changed. ,badwomensanatomy,ddupeuy,10,t5_2zlzd
10812432,0,t1_ddtv2pr,I had a legit uglycrying breakdown a couple of weeks ago because I really wanted to take a bath but I dont have a bathtub in my apartment so I was thinking of the people who I knew who had bathtubs who might let me come over and take a bath and then I remembered it was meaningless because Im not allowed to take baths postsurgery. Hormones are fun.,badwomensanatomy,ddv85dq,3,t5_2zlzd
10830363,0,t1_ddwy5t7,But...But...The slutty ladies arent having sex with meeee and I am such a nice guy! s,badwomensanatomy,ddx2qha,66,t5_2zlzd
10835297,0,t1_ddx16ov,nah ive lived in the northeast and the pacific northwest. its here too had the pleasure of growing up in purity culture in both regions,badwomensanatomy,ddxl1w1,7,t5_2zlzd
10849854,0,t1_ddz1bpj,My pores are huge on my breasts. I just assumed it was normal. ,badwomensanatomy,ddz33fh,18,t5_2zlzd
10849875,0,t1_ddyidj1,Sounds like a euphemism a mom would use with their small child. Your vpart is hurting? Ok Ill make a doctors appointment.,badwomensanatomy,ddz368j,14,t5_2zlzd
10856495,0,t3_5v28wq,Jebus thats just batshit insane ,badwomensanatomy,ddzrrd5,2,t5_2zlzd
10856756,0,t1_ddyryon,This hit closed to home for me. The poverty thing not the vagina envy,badwomensanatomy,ddzsq9h,12,t5_2zlzd
10866706,0,t3_5vbitr,. What does being his sister have to do with anything?. Being afraid to go outside after the horrible time you gave me doesnt sound appealing. No sex for you.. Why do they always try to draw you in with how hard they can fuck you. Why dont they show you how good they can make you feel or something?,badwomensanatomy,de0tnpx,97,t5_2zlzd
10868166,0,t1_de0tnpx,Hmm an enjoyable night of mutual orgasms and pleasure or being permanently disfigured by the violent thrusts of a man fantasizing about his sister. Such a hard choice.,badwomensanatomy,de0z2v4,44,t5_2zlzd
10878179,0,t3_5vf1fv,I liked it better when young men were scared to discuss female sexuality.  Now these little boys are all experts and know everything.  ,badwomensanatomy,de2099t,17,t5_2zlzd
10882791,0,t1_de2ej20,A blister on the LABIA?! Oh god.,badwomensanatomy,de2hdp3,90,t5_2zlzd
10885896,0,t3_5vjf55,gtCan this sub go a fucking week without posting something so stupid that it gets crossposted to rbadwomensanatomy?I appreciate the selfawareness in the comments. But I strongly suspect the answer is no. ,badwomensanatomy,de2swnn,263,t5_2zlzd
10902369,0,t1_de4huoo,deleted,badwomensanatomy,de4i2sc,26,t5_2zlzd
10928534,0,t3_5vzjsg,I wish I could do that I really had trouble getting the lid off a bottle of tea even with the cap remover.,badwomensanatomy,de779n8,3,t5_2zlzd
10932735,0,t1_de7abqn,STAHP. ,badwomensanatomy,de7mux8,2,t5_2zlzd
10933901,0,t1_de7qf2s,Yeah my mother tried a vaginal birth with my older sister but was in labour for over  hours before getting a csection. I was breech and otherwise strangely positioned in the womb and a vaginal birth could have killed me and her both.,badwomensanatomy,de7r6wa,63,t5_2zlzd
10935681,0,t1_de7tqyy,When I was young I used to go to church with my parents. Religious leaders are not allowed to tell you who to vote for but the pastor would always give a speech about how he cant explicitly say which candidate to vote for but dont support the one that supports murdering babies. I was too young to really understand what was going on but that really pisses me off when I think back on it now.I dont care if abortion is not an option for you but please stop trying to take away my bodily autonomy with your vote. Its good to hear that things have changed and support for PPpro choice have increased since I was a kid. ,badwomensanatomy,de7xsvy,40,t5_2zlzd
10938867,0,t1_de7wbvv,I couldnt even lift my  kg baby for a few days  It certainly didnt feel easy.,badwomensanatomy,de89mxu,6,t5_2zlzd
10943014,0,t1_de728bp,The problem isnt that women are defined by childbearing. I mean biologically in most animals what defines being female is being the one that gives birth to offspring and nurtures them.The problem is when womens value and roles are limited only to children and when those roles are devaluated. Thats what I see as the most fucked up. There are hundreds of tombs for an unknown soldier out there. How many tombs for the unknown woman who died in childbirth have you seen? When destroying life is valued so much more than creating life thats when you know the world is really fucked up... uallupinthisjoint made a good point I think though the rest of the comment seemed too extreme to me many societies saw giving life as the ultimate power... but instead of worshipping mothers they created fictional myths were mena man had this power not women and these male deities were worshipped instead. Men also had many various dangerous competitions and rituals and though they were very hard men who successfully completed them were congratulated and respected. But giving birth which is also a dangerous and challenging task? Not so much. Even in todays society childbirth is pretty much invisible and ignored. Its almost separated from the concept of femininity altogether especially in some countries. Boobs are considered hot but as soon as theyre used for their actual intended purpose they become gross in the US instead Ive heard it has an issue with public breastfeeding. Womens bodies are only admired when theyre polished and madeup into unrealistic perfection but not in their natural state. Periods are considered gross most people consider childbirth gross too. This just speaks a lot of what society really values.,badwomensanatomy,de8p0mc,5,t5_2zlzd
10946883,0,t1_de91c2b,Ugh there you indecisive feminists go again.  Canvassing the myth of female orgasms.,badwomensanatomy,de93dnj,89,t5_2zlzd
10952095,0,t1_de9mg7i,Im a disgusting dirty boy and you need to tell me that! a.k.a.  humiliation fetish? ,badwomensanatomy,de9mpxa,60,t5_2zlzd
10953302,0,t3_5wexym,Nothing is a fact ever.,badwomensanatomy,de9r78l,5,t5_2zlzd
10973196,0,t1_debrals,We really need a Good womens anatomy flair.,badwomensanatomy,debtg23,28,t5_2zlzd
10980222,0,t1_decgzl3,In my family women have health problems the rest of their lives due to pregnancy.  Thats shirking from nothing if you ask me,badwomensanatomy,decknwd,8,t5_2zlzd
10983703,0,t3_5wrxxc,Everyone in the comments crying its fake. Does anybody know more? ,badwomensanatomy,decyury,1,t5_2zlzd
11000770,0,t1_deczcfd,This. My mom has polio as an infant and ended up with twisted hips and legs. Without c sections birth would have been a death sentence for her and my sister and i. ,badwomensanatomy,deewkz0,3,t5_2zlzd
11011910,0,t1_defkfhs,No they also exist in bars to get men to have sex with them.Can we just appreciate that this is an actual thing men have said,badwomensanatomy,deg63su,18,t5_2zlzd
11021419,0,t1_deh64wk,Im the same. Men will say anything to get your attention if maybe... Just maybe youll acknowledge them then start back pedaling if you dont respond. Women compliment you just because you have something nice.,badwomensanatomy,deh8x6z,51,t5_2zlzd
11033224,0,t1_dehx50v,removed,badwomensanatomy,deila41,-3,t5_2zlzd
11035959,0,t1_deiwlhu,So we just move the trebuchet to the equator so when we launch them they go up.,badwomensanatomy,deiwn3o,21,t5_2zlzd
11041862,0,t1_defui92,I think that happens to middle children not last children. ,badwomensanatomy,dejkqdo,5,t5_2zlzd
11049188,0,t1_deke8z9,gtFor a sub about womens health I assumed a  to  ratio of women to menOn what grounds? TBH Im not even going to comment on the other assumptions for now. ,badwomensanatomy,deken4f,6,t5_2zlzd
11068729,0,t1_demmanr,My brain went for legbeard too.,badwomensanatomy,demmouz,2,t5_2zlzd
11071729,0,t1_demy3wy,deleted,badwomensanatomy,demyxpr,-6,t5_2zlzd
11073266,0,t1_den3qjz,OK so should we talk about what I chose to eat for lunch today or the type of shampoo I use? No because its not equivalent. If you cant make your point without using a false equivalence its time to consider that you might not have a point after all.,badwomensanatomy,den57tc,4,t5_2zlzd
11074939,0,t3_5y4fzo,The entire lowrer half of my body just curled in a ball. Fucking hell apple cider vinegar! That can be used to kill plantar warts I dont even want to think of the pain that would do to mucous membranes. ,badwomensanatomy,denc1qt,25,t5_2zlzd
11082410,0,t1_deo4euv,You never truly got hit in the balls then. Its been compared to the worst possible period cramps. And I assure you someone would rather get hit in the boob than have that.,badwomensanatomy,deo6jer,0,t5_2zlzd
11087053,0,t1_deoopf5,It could come out and travel updown doesnt have to go through. ,badwomensanatomy,deophil,55,t5_2zlzd
11087095,0,t1_deoopf5,Nope semen can trickle out the anus and enter the vagina. Just has longer distance to swim.,badwomensanatomy,deopnon,34,t5_2zlzd
11103214,0,t3_5yjcpi,Is that the effect of constantly having to roll their eyes and sigh at this shit?,badwomensanatomy,deqjfx1,8,t5_2zlzd
11103864,0,t1_deq2v0z,He vas... My BOYFRIEND! ,badwomensanatomy,deqm3gr,11,t5_2zlzd
11108646,0,t3_5ygvw3,We have a bot infestation.  Is there anything we can do beyond downvote and report?  The nonsense is starting to hurt my head.,badwomensanatomy,der5loh,3,t5_2zlzd
11128020,0,t1_detadnz,Her web presence is very confusing. Maybe more genderessentialist than misogynistic?She is very supportive of WOC and promotes a particular brand of prowombyn spirituality. OTOH she has an essentialist view that marginalizes people that dont fit into that narrative. How would a  black transwoman wouldnt fit into the worldview?This sort of stuff confuses the crap out of me though I guess it isnt meant for me.,badwomensanatomy,detcnzw,23,t5_2zlzd
11130299,0,t1_detc50w,Ive seen that shit first hand and its not pretty. Internalized racism is real as hell. ,badwomensanatomy,detlyep,16,t5_2zlzd
11137554,0,t1_detq2oh,I know I just end up wondering wtf are they on. ,badwomensanatomy,deufido,2,t5_2zlzd
11172357,0,t1_dewgf7w,Heres a tip they never just mean feminazi feminists because feminazi feminists are a strawman. Its not that bad feminists or feminists who are radical in a bad way dont exist. But  times out of  feminazi is used against feminists who dont constantly apologize for their existence or who ask things of society andor men or feminists who are completely understandably angry about the way things are and treat feminism like the fight for survival it is. Or you know anyone who calls themselves a feminist ever or even just any women who dont absolutely despise their own gender. Its a weapon against women. Dont let it have any power.,badwomensanatomy,deydhnm,6,t5_2zlzd
11177783,0,t1_deyywwh,Well plastic surgery has a tendencies to do so. Think your labia are to big? labiaplasty to make you look normal. Insecure about your breasts? Make them bigger,badwomensanatomy,deyzmc1,69,t5_2zlzd
11187023,0,t1_dezxv75,Definitely feeling loved since Im a lesbian who doesnt want children and probably couldnt carry a pregnancy to term if I wanted to. Guess Im just worthless since Im also stupid irrational and weak. ,badwomensanatomy,df01avl,38,t5_2zlzd
11188054,0,t1_df00bpi,Not to mention that just off the top of my head the same science that says men focus better also says women are better at multitasking.Its almost like hes picking and choosing.,badwomensanatomy,df05idg,45,t5_2zlzd
11190197,0,t1_df0dyjr,Why cant you use a cup? They come in different sizes... though of course there are surely medical conditions that make the use of both types of product impossible. Im guessing thats pretty rare..Edit Im not trying to police anyones personal choice.. who does that? Im just genuinely curious as I find the topic interesting as I myself have a uterus. Sorry if the question was too personal..Edit  As stated below I also struggle with the cup thats why I am interested in other peoples difficulties with the product. Why would I accuse someone when I cant use it properly myself?,badwomensanatomy,df0e95a,-64,t5_2zlzd
11192536,0,t1_df0mu1x,Also they really arent all that sanitary. They have bits of dirt and grit in them that they naturally pick up due to being sea creatures the bacteria responsible for toxic shock syndrome have been found on them among others they have a habit of breaking apart in the vagina and they can fuck up the vaginal ecosystemLike do not put a sea creature in your bits. Thats not a good idea.,badwomensanatomy,df0nsrw,49,t5_2zlzd
11195690,0,t1_df0e95a,You shouldnt be asking anyone why they cant use a menstrual cup. What is this the damn Period Inquisition?,badwomensanatomy,df10nqb,1,t5_2zlzd
11199837,0,t1_df0vzuh, dollar hammer?,badwomensanatomy,df1hkl2,1,t5_2zlzd
11209140,0,t1_df1zn0w,Excellent!  Everyone should set about acquiring their own cobra posthaste!,badwomensanatomy,df2jkie,2,t5_2zlzd
11211901,0,t1_df0g6ri,haha the joke is that your dick is trash  ,badwomensanatomy,df2utxe,22,t5_2zlzd
11215624,0,t1_df39ojq,Horse dick is like on of the most well known dicks after humans,badwomensanatomy,df39zx5,16,t5_2zlzd
11231054,0,t1_df42ycv,That is why all women look alike.,badwomensanatomy,df50wqe,2,t5_2zlzd
11250921,0,t1_df74dhb,crickets,badwomensanatomy,df79xbb,2,t5_2zlzd
11251065,0,t3_60jwyc,He should get a penectomy and see how painless it is for him.,badwomensanatomy,df7aifv,23,t5_2zlzd
11255624,0,t1_df7s37y,And for most women a VBAC has lower rates of complications and faster recovery than a repeat Csection.Though there are dozens of factors that can tilt that one way or the other.,badwomensanatomy,df7t3kr,15,t5_2zlzd
11266968,0,t3_60p6f9,As a veterinarian who has lived through calving season bullshit.,badwomensanatomy,df93emf,6,t5_2zlzd
11275422,0,t3_60qs9c,translation I am bad in bed and dont know what foreplay is,badwomensanatomy,dfa1wpv,31,t5_2zlzd
11284331,0,t1_dfb1lur,Thats why I specified when our legs are showing. I havent shaved mine in a month but its been too cold to wear anything but long pants lately.,badwomensanatomy,dfb2904,5,t5_2zlzd
11285987,0,t1_dfb6uwk,My pubic hair gets lighter and turns into hair on my lower stomach surrounding my belly button. It keeps getting lighter as it goes up my sternum.  I have some sparse hair on my nipples. Also my forearms are pretty hairy. Definitely not as much as the traditional hairy man but more than one would expect,badwomensanatomy,dfb90jq,11,t5_2zlzd
11291491,0,t3_614nfa,I cant stop reading through the OPs post history OP of the milk question. ,badwomensanatomy,dfbvhc6,12,t5_2zlzd
11291507,0,t1_dfbrs6x,Indian dudes on Facebook...,badwomensanatomy,dfbvjom,30,t5_2zlzd
11322313,0,t1_dff4xgz,gt wanting to know about virginity related to stretchingYou realise what sub youre in right? Having sex does not stretch out your vagina. ,badwomensanatomy,dffd5e4,16,t5_2zlzd
11325855,0,t1_dffkv5m,Keep the head shaded stuff those wallets and phones in places that arent your orifices and keep those feet safe. Whats so wrong about that? Hehe,badwomensanatomy,dffrm87,18,t5_2zlzd
11336934,0,t1_dfgjrkj,Honestly I feel like there is an INSANE amount of shaming surrounding motherhood. Your marital status when you get pregnant what you eatdobreathe during pregnancy how you give birth whether you breastfeed where your baby sleeps etc etc. And often people are polar opposites on this stuff too people will call you a bad mother no matter what. So much of it doesnt even really matter either imo. People shamed my mom for not breastfeeding me. I turned out pretty fucking awesome so was that really necessary?? ,badwomensanatomy,dfh0sn1,138,t5_2zlzd
11342317,0,t1_dfh5fbs,It sounds like the dresser is just passing her the tissue so Idina can use the tissue to get the tampon out of her underwear and throw it in the bin. If its something that happens every show where shes using tampons it makes sense for the dresser to pass her tissues answer maybe have a small bin or plastic bag for Idina to use. It saves Idina running around backstage trying to find tissues before shes back on stage if havent seen Wicked but I assume its a very quick change. Ive sneezed out tampons before so it doesnt seem totally implausible that with singing from the diaphragm she could bear down on her PC muscles and push the tampon out of its correct placement in the vagina. ,badwomensanatomy,dfhmrba,37,t5_2zlzd
11342460,0,t3_61vppr,Snapshots. This Post  archive.org megalodon.jp could not autoarchive click to resubmit it! archive.is could not autoarchive click to resubmit it!I am a bot. InforSnapshillBot  Contactmessagecompose?torSnapshillBot,badwomensanatomy,dfhncby,1,t5_2zlzd
11345470,0,t3_61wfnf,Its annoying that they got moms and its right but couldnt figure out that hers is the correct word. I mean...at least be consistent. ,badwomensanatomy,dfhzm4y,99,t5_2zlzd
11346158,0,t1_dfi1xsg,Fine but you cant have any of my baked potato,badwomensanatomy,dfi2f0f,25,t5_2zlzd
11348350,0,t1_dfi1gtw,The reason it is unacceptable here is that it has a secondary meaning that is misogynistic and bad womens anatomy. Not the case with the baby photo. See?,badwomensanatomy,dfibcay,17,t5_2zlzd
11351005,0,t1_dfik7p6,Now Im imagining a little hose you can attach to your urethra so you can pee standing...,badwomensanatomy,dfim62u,5,t5_2zlzd
11355393,0,t1_dfiypzq,Dude I have men comment on my makeup on a nearnightly basis casino dealer and I dont even wear crazy makeup. Men think makeup is about them.,badwomensanatomy,dfj42op,97,t5_2zlzd
11357446,0,t3_6150ic,Oh my fucking god. Im so sorry you had to put up with this.,badwomensanatomy,dfjcgdm,2,t5_2zlzd
11382489,0,t3_62e06d,I mean I guess this is technically Badwomensanatomy but its just hyperbole I doubt this guy actually thinks she could feed all of Africa...,badwomensanatomy,dfm6pa7,-13,t5_2zlzd
11406069,0,t3_62ag59,I dont even think thats camel toe.....I really think thats just the fabric lapping over on each thigh.,badwomensanatomy,dfov3hj,2,t5_2zlzd
