,controversiality,parent_id,body,subreddit,id,score,subreddit_id
2258347,0,t1_clq1m2y,Ayy you lookin for a son in law anytime soon just hit me up ,Halfbull,clqupmt,1,t5_34ajd
2271319,0,t1_clsfl5c,Dat last credential.. i know nobody important..,Halfbull,clsgdba,2,t5_34ajd
2296994,0,t1_clv9687,I hate the term hard gainer.I really just want to show people everything they have ate during the day and then lay it next to what I have with the total calories labelled next to them just to try and get it through their skulls!!,Halfbull,clvmh7u,2,t5_34ajd
2306632,0,t1_clwslxi,deleted,Halfbull,clwtebn,2,t5_34ajd
2323515,0,t1_clywe2e,That sounds glorious,Halfbull,clywf0g,1,t5_34ajd
2349029,0,t1_cm1f94f,deleted,Halfbull,cm21uqo,2,t5_34ajd
2349524,0,t1_cm23gsn,Harcoreme,Halfbull,cm241t9,2,t5_34ajd
2382728,0,t1_cm5frao,You underestimate how unfit rfitness really is,Halfbull,cm67oyo,3,t5_34ajd
2408200,0,t1_cm9cngv,deleted,Halfbull,cm9d234,2,t5_34ajd
2426893,0,t1_cmbd7s8,It took me ages to get my ex to let me have period sex with her ,Halfbull,cmbo66j,2,t5_34ajd
2435686,0,t1_cmcr7jz,Ill think up a list! ,Halfbull,cmcr8xs,1,t5_34ajd
2448753,0,t1_cmecqnd,Sounds good mate ,Halfbull,cmedbof,1,t5_34ajd
2466327,0,t1_cmgj29v,deleted,Halfbull,cmgjdz7,2,t5_34ajd
2548620,0,t1_cmr82pj,Ah yes the marriage sex. Been married  years now at least it hasnt gotten worse lol...  My wife gets zero pleasure from penatration and it still hurts her but Ive gotten real good with my face haha so theres that. Its funny how people always tell you that the sex fades but nooooo we dont listen haha. My dad just said son theres  hours in a day. You sleep for  work  and you have sex for . You better like this woman because youve got  more hours in a day with each other and marriage is going to suck if you two dont get along anywhere but the bed. He neglected to mention that you dont get sexy times every day so theres  extra hours some days haha,Halfbull,cmr8pqm,2,t5_34ajd
2599455,0,t1_cmxuvsm,Every dick pic is perfect,Halfbull,cmxvwg1,2,t5_34ajd
2602395,0,t3_2pmzo5,juice gets to all of us in the best way possible,Halfbull,cmy9rfy,1,t5_34ajd
2632769,0,t3_2q26ci,Go.,Halfbull,cn28j0x,5,t5_34ajd
2634864,0,t1_cn2hwpa,Pretty fucking sweet. Oh and BTW if you dont cruise yet we will in February. mg per week with mg deca. Havent planned our blasts yet though,Halfbull,cn2idtk,1,t5_34ajd
2636097,0,t3_2q3zj1,deleted,Halfbull,cn2o61n,1,t5_34ajd
2647743,0,t1_cn3a548,Depends on goals right?   weeks seems fitting to me.,Halfbull,cn46wt5,1,t5_34ajd
2683508,0,t3_2qrkbi,I refuse to use it lol... If sources ever stop taking other means of payment Im screwed haha,Halfbull,cn8us3j,3,t5_34ajd
2688222,0,t1_cn8sww0,D,Halfbull,cn9gxuh,1,t5_34ajd
2741120,0,t1_cnfn3ud,deleted,Halfbull,cnfnjw4,2,t5_34ajd
2742737,0,t3_2qw3va,Come to my gym! Im the only young male  that lifts at the time I train Anytime between am and pm. Everyone else is older or has kidsfamily. Go after  and its a death sentence. Everyone is a dick and judges.,Halfbull,cnfu61x,1,t5_34ajd
2771602,0,t1_cnj2mnk,Haha Im not doing much helping my dad hang a projector screen somewhere then going over to a buddies house for wings and good times his sons friend thats a girl that he is interested in is gonna be there so I get to fuck with the poor kid haha,Halfbull,cnj4db5,1,t5_34ajd
2774967,0,t1_cnjhu9n,deleted,Halfbull,cnji4iu,1,t5_34ajd
2782914,0,t1_cnk9u7b,I may or may not have downloaded it to listen in a few. The risk of having it  hit you mid squat.,Halfbull,cnkeoqn,1,t5_34ajd
2788902,0,t1_cnl338o,Ima wake up tomorrow and avoid mirrors like the fucking plague. The jellyfish syndrome will be real. ,Halfbull,cnl370m,2,t5_34ajd
2806857,0,t1_cnn412r,Wait curse too thick or thin?,Halfbull,cnn4q1y,1,t5_34ajd
2816065,0,t3_2scg32,Ive actually heard really good things about it. Your sins are forgiven,Halfbull,cno6gtt,1,t5_34ajd
2816239,0,t3_2s5xw6,Hows the trap? L,Halfbull,cno76jp,1,t5_34ajd
2837035,0,t1_cnqjymc,Nah he should just get a vape. It helps kill appetitel,Halfbull,cnqkfqk,2,t5_34ajd
2849742,0,t1_cnrv0zc,Best perk of having a home gym you can use Viagra as a preworkout without getting some really awkward looks.,Halfbull,cns0ju1,2,t5_34ajd
2853050,0,t1_cnsdurl,gt am not hotyou cant lie weve seen your face lol,Halfbull,cnse4s1,3,t5_34ajd
2858190,0,t1_cnsr705,Why isnt this loading? I need to know what this red head looks like. Edit I just got the joke...  Red heads are hot. Rottis are awesome. Youre doin Albright ,Halfbull,cnsz6b5,1,t5_34ajd
2867295,0,t1_cnu09js,Your husband needs all the help he can get. ,Halfbull,cnu0gd6,3,t5_34ajd
2867472,0,t1_cnu10wt,Hahaha tequila is the fucking devil,Halfbull,cnu16ft,3,t5_34ajd
2891462,0,t1_cnwr306,Tried to use it but couldnt. My diet is restricted enough I can count my macroes by head everyday. Its more of a mental thing I need to listen to that youtube guy and up mah carbs.,Halfbull,cnwrh5q,1,t5_34ajd
2894482,0,t1_cnx177x,Idk for me it is. I dont use it too much. Few scoops a week.  I also get a pretty good discount because I work at a supplement store. Only a few bucks over cost. ,Halfbull,cnx3u6o,1,t5_34ajd
2920011,0,t3_2tjxrn,No idea you and I are in the same boat. I think bodybuilders just scare  of people away. Never had a problem getting girls though. So idk man go make chick friends. ,Halfbull,co00isi,1,t5_34ajd
2935022,0,t1_co1pxv7,Seppuku was a close thought for a few minutes hahaha... The worst part was when the icy part stopped I was like oh thank god... Wait a second what the fuck! Its getting hot! Lmao ,Halfbull,co1q368,1,t5_34ajd
2952870,0,t3_2tyv1k,I usually train with macrocycles that are  months long focusing on whatever I think needs to be worked on now. Strength lagging? Doing a powerlifting routine. Not wide enough? Hypertrophy. Trouble catching breath? Endurance and conditioning.Mobility is worked on all the time because Im always unhappy about it.Although Id like to be a Jack Of All Trades I have to say that powerlifting routines suit me best so it may be what I will stick with after summer to see where it will take me.,Halfbull,co3r757,1,t5_34ajd
2966130,0,t1_co59fnr,You dont say? Apparently they mean something. Eh. ,Halfbull,co59izo,1,t5_34ajd
2967018,0,t1_co5d3wf,Triception wears short shorts in daily life.... Hes Lt. Dangle.I havent seen Tritone Tony,Halfbull,co5d5qq,1,t5_34ajd
3047215,0,t1_coduayk,It was to test your reading comprehension. The leg extensions followed the leg press which followed the barbell squats.In this class I give you a D. You only getone shot to make up for this. Do not miss your chance to blow. This opportunity comes once in a life time yo.Ask Mother if you can have a new flair.,Halfbull,coducyn,1,t5_34ajd
3121053,0,t1_colhng2,Haha thats awesome... My mail person is a dick didnt even hit the brakes while driving past my house,Halfbull,colhvea,2,t5_34ajd
3302064,0,t1_cp4nc6r,Then why dont you provide a fucking link?,Halfbull,cp4nua2,2,t5_34ajd
3435778,0,t1_cpjtmd5,The best way to go...,Halfbull,cpjwka1,1,t5_34ajd
