,controversiality,parent_id,body,subreddit,id,score,subreddit_id
2945,0,t1_ceeng1n,Couldnt disagree more. His corniness is charming.,Kappa,ceeruj3,13,t5_2tjsd
4973,0,t3_1u52hp,Why are people hating on James Chen and giving Magus praise? This is an odd world.,Kappa,cef04jz,4,t5_2tjsd
28880,0,t1_cegtxqw,Real Capcom City Gs,Kappa,cehpxsw,2,t5_2tjsd
39013,0,t1_ceitd26,Ive heard good things about Knives and Snakeeyes seems like a cool dude. But yeah Flash more than cancels that out with his shit.,Kappa,ceivf47,22,t5_2tjsd
47208,0,t3_1un3k6,The full Super Street Fighter  is on DS.,Kappa,cejszrr,3,t5_2tjsd
52657,0,t3_1upkma,,Kappa,cekfbej,3,t5_2tjsd
88552,0,t1_ceocaly,I love how you say you only know him via the internet then tell people to go read his forum postings for better judgment.   Troll harder.  ,Kappa,ceoie1j,9,t5_2tjsd
89098,0,t1_ceojqyg,Flux vs CjShowstopper FT grudge match should be the opener to Nemo vs FChamps MM at ECT.,Kappa,ceokmjp,11,t5_2tjsd
140769,0,t3_1vlzny,yoaaa,Kappa,ceugp3s,1,t5_2tjsd
141084,0,t3_1vpbqf,My fear is that looking at all sorts of other peoples tweets the bystander effect will come in to play. I see so many Someone go check up on DiNyce tweets.No one taking charge and actually doing something  ,Kappa,ceuhzp5,7,t5_2tjsd
142697,0,t1_ceuho76,If we are including winning in Japan we should include winning in the USA in which case at least Justin and ChrisG should have made the list.,Kappa,ceuom9n,-3,t5_2tjsd
143540,0,t3_1vpsam,Fuck kotaku,Kappa,ceus37g,11,t5_2tjsd
149960,0,t3_1vt08b,It was about time. The only people that were repping it were Chris G. Fanatiq just sits at home playing a trash MOBA at a low skill level.,Kappa,cevif1w,33,t5_2tjsd
159925,0,t1_cevnev3,gt Thanks also for satiating the sexual appetites of many males and therefore appeasing the FGC gods like Cabin in the Woods. LMAO now I gotta watch this movie,Kappa,cewnczu,0,t5_2tjsd
167565,0,t3_1w0cm5,All he had to do was tweet out no I will not MM him. But instead he inflates it to a Three thousand word essay. Fuck PL!,Kappa,cexip2b,16,t5_2tjsd
167989,0,t3_1w0cm5,Not as low as his Mike Ross rant on this cross assault audition video lol ,Kappa,cexkfhw,5,t5_2tjsd
176457,0,t1_ceyfqux,At this rate the injustice community could probably fit,Kappa,ceyj6vb,3,t5_2tjsd
191233,0,t3_1wage9,Maybe got with another man maybe one of nelsons homies? Regardless not sure why Chris is giving the internet fuel but this is Chris so why am i even questioning it btw someone should inform chris that contrary to popular belief twitter doesnt filter the word fuck,Kappa,cf07z4v,11,t5_2tjsd
221119,0,t1_cf3i12w,Agree. Sponsors events and marketing bring the money and players not tourney payouts. No idea why the OP would insinuate otherwise. Johnny er isnt going OMG a K EVO payout I need to enter I might win! The payouts dont come first they come last. When this scene grows up and learns to respect the people putting in the money and hard work THEN the money will follow. Pro players and the community need to stop disrespecting the people who bring money into this scene. If an event has Xbox One sponsorship morons spamming Kinect sucks balls! Kinect sucks balls over and over in chat during a grand finals match where the finalists random pick teams and split the pot in the grand finals does nothing to help the scene. The FGC is toxic its that incredibly talented musician that would probably make it big if only hed curb his substance abuse. Nothing will save it and these payouts will remain low. Thats just how its going to be.,Kappa,cf3mq3r,6,t5_2tjsd
222989,0,t1_cf3rwam,gtSo what are we discussing? This is so stupid and redundant lol. I rest my case.Heres a scenario. A hooker gets paid for fucking right? Lets say the more attractive you are the more people a hooker gets. Who in their right mind is going to pay a hooker to look pretty?I agree this is stupid. I rest my case you either dont understand the point or refuse to accept it either way Ive said my piece.,Kappa,cf3udsh,1,t5_2tjsd
231742,0,t3_1wriv8,What kind of camera is that? Makes everyone look so pretty. ,Kappa,cf4ro3a,16,t5_2tjsd
232709,0,t1_cf4phh2,Ill have you know that people say my shirt is really comfortable to wear. .,Kappa,cf4vaqv,11,t5_2tjsd
236819,0,t3_1wtslz,isnt that only because they have strict laws regarding winning money? Anyways thats the life Kane commited too lol,Kappa,cf5ao4d,7,t5_2tjsd
244527,0,t3_1wwllq,EMP | FChamp Kappa,Kappa,cf63iqb,5,t5_2tjsd
248038,0,t1_cf69k79,,Kappa,cf6go03,4,t5_2tjsd
248880,0,t3_1wriv8,deleted,Kappa,cf6jtkw,1,t5_2tjsd
256571,0,t3_1x01ks,deleted,Kappa,cf7cl86,1,t5_2tjsd
262936,0,t3_1x4fdp,edgyme,Kappa,cf80gi2,0,t5_2tjsd
273643,0,t3_1x8r1a,Tekken also dead RIP,Kappa,cf94i7b,5,t5_2tjsd
275730,0,t1_cf9ahi2,Smash set the record. Marvel broke the record that same night.,Kappa,cf9cbkb,3,t5_2tjsd
275779,0,t1_cf97u2m,gtDo we really need to expose the WB  coming in to bribe Tekkens termination?You mean the WB money that goes straight into the pot unlike every other fighting game company out there that does not support their game at EVO?,Kappa,cf9ci6q,5,t5_2tjsd
286689,0,t3_1xdpne,but I put a kappa face as the esports police carry him away,Kappa,cfah9pf,19,t5_2tjsd
290460,0,t3_1xdy8e,Viscant used to be a professional gambler until the year he won evo which was also the year online poker was banned in the US. Now according to his AMA he does online bookkeeping right now in addition to betting on sports and writingI know Valle works with Level Up last time their site was updated was in early  but it still lists streaming work for a TedTalk a church and a marriage. So Id say their streaming operations are going beyond FGC.Kayane works an event organization business. She also is a promoter for FGC things in europe is an esports presenter for Game One TV  a satellite TV channel in France.,Kappa,cfavcvo,13,t5_2tjsd
293138,0,t1_cfb5664,For your own good it would be best to just ignore it all and stay away from social media for a while. No i dont think anything will happen to you as long as you dont cross the boarder anyways. But it was sort of shitty of you to keep continuing this you and her both. Immutaury on both sides. You for the threatstrolling her for bringing people who didnt need to be involved into this Justin wong and mr wizard really? Theyre not fucking cops or fit to be ones last time I checked. And I do understand you want to make your position clear but once again thats a suicide mission to do on reddit especially this subreddit Its just best like I said for you to apologize personally to her and get off the net for a while. ,Kappa,cfb5d64,-15,t5_2tjsd
320187,0,t3_1xrd2g,Daigo gonna be beasting that.,Kappa,cfdygjy,5,t5_2tjsd
328074,0,t3_1xuiyp,fgc in a nutshell,Kappa,cferxpf,20,t5_2tjsd
334713,0,t1_cff2n6a,stop being such a viking bro,Kappa,cffgosb,3,t5_2tjsd
340781,0,t1_cffsu2s,Washed UP you fucking idiot Kappa,Kappa,cfg3bfo,3,t5_2tjsd
353139,0,t3_1y4ud5, problems is literally a decade old. topical humor lololol,Kappa,cfhdc1j,33,t5_2tjsd
359177,0,t3_1y1hmm,if you look at onos face it looks like hes saying oh no,Kappa,cfhztpe,2,t5_2tjsd
384267,0,t3_1yh1nk,I hope this isnt legit dude was aging well,Kappa,cfkleum,3,t5_2tjsd
395355,0,t3_1yjy1o,My favorite thing ever  Chris g losing.,Kappa,cflqt65,-2,t5_2tjsd
407699,0,t3_1yqnny,Ill just leave this here,Kappa,cfn0we6,7,t5_2tjsd
410681,0,t1_cfn9suo,Thats a terrible response Spooky and Im very disappointed in you. It looks to me like you didnt spend a fucking minute to read shit in here but instead decided to skim through assume people are trolling and took  seconds to type a poorly thought response showing you simply do not give a rats ass about any of us.Well I guess enjoy being butt buddies with DMS since he sucked your cock long enough for you to allow him to do whatever the fuck he wants in your stream even if that means ruining the chat experience for the   viewers tuning in by banning anybody that disagrees with his garbage personal opinion.Thanks Spooky. Youve lost any respect that I had for you.,Kappa,cfnc0e4,11,t5_2tjsd
411407,0,t1_cfn9tpg,Vic dude enough with the fucking strawman arguments. If you at least read anything in this thread you would know that the trolling is going up because of your inability to see the ridiculous things that DMS does. The guys name is Devilmaysperm. It isnt teamspookysperm. Open your eyes man and stop with the overly defensive answers. This thread has one of the most highest post counts on this subreddit ever. It isnt a coincidence dude...,Kappa,cfnepqt,10,t5_2tjsd
445237,0,t3_1z4r52,deleted,Kappa,cfqwwul,2,t5_2tjsd
451285,0,t3_1z8rpn,deleted,Kappa,cfrk5mr,1,t5_2tjsd
462871,0,t1_cfsquvh,Thats apologyman for you. Later in the stream I think he actually said sorry to the commentators for that from off mic...,Kappa,cfsvo5u,6,t5_2tjsd
464139,0,t3_1zei6i,Vanilla Sagat vs AE Yun were fucked.,Kappa,cft0vk4,9,t5_2tjsd
468557,0,t3_1zfm1t,That look on his face is hilarious ,Kappa,cftiyrt,3,t5_2tjsd
471716,1,t1_cftuovh,At least those combos look cool and have some variety to them. No such luck in SFxT. All the combos and boring and look the exact same. ,Kappa,cftvx73,-3,t5_2tjsd
473456,0,t1_cftyecr,Its probably for the best that he didnt understand what this fat greasy uneducated turd spewed out. The man flew out all the way from Korea just to be at his shitty almostforeclosed arcade and this is his response? Keeping it classy as always Mike. ,Kappa,cfu31xs,29,t5_2tjsd
480683,0,t3_1zm9b6,deleted,Kappa,cfuwnje,2,t5_2tjsd
487483,0,t1_cfux7d9,Watching them race m would be hilarious,Kappa,cfvoiat,1,t5_2tjsd
489078,0,t3_1zn7hl,can we get spring green names,Kappa,cfvv15x,3,t5_2tjsd
489646,0,t1_cfvfz2o,Oh? You get results? Congratulations! That means you can act like a total asshole in the crowd!The logic it is not present.,Kappa,cfvxcr6,7,t5_2tjsd
490176,0,t1_cfveus0,Yeah I was gonna say this. Maybe capcom can let combofiend go take a trip to promote the game though and let him bring a usf set up for after hours stuff.,Kappa,cfvzit0,1,t5_2tjsd
500348,0,t1_cfx4stu,too poverty for esports,Kappa,cfx55ue,1,t5_2tjsd
505025,0,t3_1zvnv9,OP is dms confirmed,Kappa,cfxoag7,1,t5_2tjsd
510140,0,t1_cfy7rco,,Kappa,cfy97qy,11,t5_2tjsd
517936,0,t1_cfz0cjg,They would if it was worthwhile but Tekken is kind of ded atm especially in the USA.,Kappa,cfz55xu,3,t5_2tjsd
524379,0,t3_203vu4,My Dark Souls II preorder was waiting for me sorry. ,Kappa,cfzvlr0,2,t5_2tjsd
528226,0,t1_cg09ark,Sitting next to Dieminion,Kappa,cg0bdr6,31,t5_2tjsd
530862,1,t1_cg0b4h9,its a joke being a fat cunt and needing a silly amounts of money for food.  facepalm,Kappa,cg0m6rj,-2,t5_2tjsd
550957,0,t1_cg2v1vz,The crippling low blow,Kappa,cg2weyo,24,t5_2tjsd
551198,0,t3_20g7dm,Noel Brown is the FGCs Dante Stallworth.  Or Ray Lewis.Or Milton Bradley. Or Brett Meyers.So I guess FGC and sports are really analogous because they tolerate scumbag criminals too.,Kappa,cg2xei7,6,t5_2tjsd
553019,1,t3_20g7dm,Wow Im surprised Sagat is not in here putting her opinion in. ,Kappa,cg34vbb,1,t5_2tjsd
553415,0,t3_20gd9o,so I guess vergil running out of devil trigger caused this combo drop. MAAAAAAAHHVEEEEEEEEEEEELLLLL!,Kappa,cg36hmq,2,t5_2tjsd
559826,0,t1_cg3tjvr,I agree.  Especially when if he had known beforehand he could have separated the  buttons into  leftupright and it would have been legal by the standards that theyre now setting by disallowing it.  It would have had the exact same result for him.  Only difference now is that this likely fucks his chances at this tourney because he cant play the way he has for the last year and half.,Kappa,cg3wq3n,1,t5_2tjsd
560077,0,t1_cg3vexi,Only the finest of pizzas for Dante.,Kappa,cg3xr0l,17,t5_2tjsd
562915,0,t1_cg49bsf,deleted,Kappa,cg49cfl,2,t5_2tjsd
563511,0,t3_20l33c,Bowl of soul?,Kappa,cg4bs10,8,t5_2tjsd
570387,0,t1_cg53d8u,Yeah it seems our definitions are different.  I know how much easier certain things are with those inputs despite the simplicity of what those buttons actually do and feel it would not be fair to judge whether a mod is kosher simply on how easy it is to implement.It also wouldnt do to only allow officially licensed products since sticks are modded and created from scratch so widely in the first place.The best example about players being sneaky with their mods that I can think of is select plinking in SF.  If it were easy at all to enforce a ban on this I most certainly would consider doing so however since its incredibly difficult to even know someone is doing it  like people splitting a pot  theres just no reason to try banning it.Once things become more overt and obvious measures can be taken against them.  Remember the whole collusion fiasco?  Its not as if people didnt pot split before then but throwing it in peoples faces so blatantly made it easy to detect and rectify.  Thats where it becomes easier to try to control the button situation theres no question about their benefit while disallowing them would take minimal resources.  I would be that villain and ban them  tournament organizers get ripped on for so many things anyway that trying to be politically correct or fair to that kind of mod really serves no purpose imo.I mean I can tell Im not in the majority with my opinion and it doesnt sound nice and sugar coated but FS really pulled a fast one here.  Theres all the reason in the world to decide what is too beneficial and decide on a case by case basis whether it should be allowed  that is why we can use the p and k buttons on stock sticks but cannot use the turbo functions on stock sticks.The community can handle having to address each situation like that.,Kappa,cg53wbu,-1,t5_2tjsd
570606,0,t1_cg4urtw,They were sold a new character? How much did they pay? ,Kappa,cg54skt,-2,t5_2tjsd
572334,0,t1_cg5bkdy,DansGameDansGameDansGameDansGameDansGameDansGame,Kappa,cg5bv47,14,t5_2tjsd
573456,0,t3_20mjw1,Its too bad that all of the players that bitched about this dont attend Keits tournaments. They will all just use this as an excuse to not go again this year.,Kappa,cg5ggd0,3,t5_2tjsd
582994,0,t1_cg4pcy0,You sir   capcom ,Kappa,cg6jh3r,1,t5_2tjsd
586157,0,t1_cg5wih0,Chris is sponsored by gamester gear and champ by revolution gaming,Kappa,cg6weyx,1,t5_2tjsd
596743,0,t1_cg81n0o,gt  but I think TOs cant help but be involved in the latest twitter drivel.its not stupidity its passion!,Kappa,cg83qi9,4,t5_2tjsd
598729,0,t3_20zq17,deleted,Kappa,cg8busk,15,t5_2tjsd
600404,0,t3_20zq17,deleted,Kappa,cg8ipif,1,t5_2tjsd
603291,0,t1_cg8tk7a,Why the fuck would Magus respect that?! Magus dick rides Norcal too much,Kappa,cg8uiuy,34,t5_2tjsd
608068,0,t1_cg9aqr0,deleted,Kappa,cg9e1ym,1,t5_2tjsd
608099,0,t3_212c7v,When I saw this live I thought Sanford was joking because the look on his face is so exaggerated its the kind of salty yet playful look mike ross gives to the camera after he loses a  match on excellent adventures.  I didnt know Sanford was super salty until I saw him Blake Griffin the stick.,Kappa,cg9e6iv,8,t5_2tjsd
608162,0,t1_cg9bs73,deleted,Kappa,cg9efs4,2,t5_2tjsd
609182,0,t1_cg9g9xl,This isnt finals. This was for fourth place.,Kappa,cg9ilwz,8,t5_2tjsd
628779,0,t1_cgbohpn,deleted,Kappa,cgbqrfr,2,t5_2tjsd
635934,0,t3_21fjv2,i will literally watch this everyday this clip is just too funny ,Kappa,cgck10r,7,t5_2tjsd
645291,0,t1_cgdkztj,And DSR  MvCO have the best console netcode of any fighting game ever period.They know how to do netcode.,Kappa,cgdmbmz,7,t5_2tjsd
649151,0,t1_cgdx4zl,THAT FORMATTING  PogChamp,Kappa,cge249r,11,t5_2tjsd
678634,0,t1_cggw809,I thought the community would get over it but theyre still on it.  Some people in the community just want to laugh at others and kick guys when theyre down.  I wont let it get to me though.  I have come out of this experience a stronger person.,Kappa,cghet6w,12,t5_2tjsd
687109,0,t1_cgibf17,Give me all your hype and you can take all my nickles.,Kappa,cgidjg7,8,t5_2tjsd
687796,0,t3_220ldv,I would buy it but the damn pivotshare keeps giving me an error on payment .. Oh well guess i have to wait like everyone else ltlt,Kappa,cgigcqm,8,t5_2tjsd
694775,0,t1_cgj6p00,and thats how remy was bornEDIT and i guess how abel saw that move before,Kappa,cgj8xn1,3,t5_2tjsd
694963,0,t1_cgj8cwg,Dammit. Beat me to it!,Kappa,cgj9pbu,10,t5_2tjsd
701631,0,t1_cgjvo1m,He waves money in his face ,Kappa,cgk10ot,1,t5_2tjsd
702218,0,t3_2276zz,FailFish,Kappa,cgk3f6l,1,t5_2tjsd
703701,0,t3_227usx,so hes withering away because some random internet users trolled him every now and then because hes such a crybaby? ,Kappa,cgk9htc,11,t5_2tjsd
706004,0,t3_225tic,hopefully the community shows up and makes tekken extra hype. ,Kappa,cgkiy3q,1,t5_2tjsd
712897,0,t3_22bu5r,Gamerbees tweet is too good,Kappa,cglb57z,20,t5_2tjsd
714146,0,t3_2293j4,so anyone know the name of the short mike ross did way back in the day? i dont remember the name but i can recall it had something to do with killing a man for taking his hat,Kappa,cglga5d,1,t5_2tjsd
722502,0,t3_22fkn0,That  Daigo Umehara air though. This is GDLK,Kappa,cgmehaf,6,t5_2tjsd
727583,0,t1_cgmq283,deleted,Kappa,cgmza8d,1,t5_2tjsd
728024,0,t3_22fkn0,I got  am I the best stick chucker now?,Kappa,cgn1353,2,t5_2tjsd
735490,0,t3_22kw4h,Capcom can you please just give Megaman to Nintendo already...,Kappa,cgnvnpr,39,t5_2tjsd
737028,0,t1_cgo0hgo,That sounds like you have the ability to do it so if you just ran commercials... ,Kappa,cgo1yb9,2,t5_2tjsd
738642,0,t1_cgo4yh5,Its a Mazda you can get that car working as a fgc commentator.,Kappa,cgo8koh,1,t5_2tjsd
741365,0,t1_cgojqbm,deleted,Kappa,cgojqxi,1,t5_2tjsd
741717,0,t3_22ldcs,Has anyone tried using a VPN?,Kappa,cgol6rm,1,t5_2tjsd
749511,0,t3_22qft3,Sanford said hes stepping away from the scene....    again.,Kappa,cgph54z,3,t5_2tjsd
751313,0,t1_cgpogm3,dont complain,Kappa,cgpoikv,1,t5_2tjsd
754440,0,t1_cgq0cho,gt Best Rog and people regard him as the best player in the USA.Come again?,Kappa,cgq1bol,-8,t5_2tjsd
754799,0,t1_cgq1bol, KappaI didnt say he is the UNQUESTIONED BESS PLAYER I said some people think he is and when it comes to best SF player in the USA PR Rog has to be in the discussion.,Kappa,cgq2smc,6,t5_2tjsd
755680,0,t1_cgpsx1g,But dat poverty is .,Kappa,cgq6ehr,5,t5_2tjsd
772568,0,t3_22zpnb,I missed most of civil war but the early matches werent all that hype and it seemed like it had poor attendancelooked like it would be been a good tourny for amateur players though. I suspect pax pulled a lot of people away.I dunno about evo though I thought it was pretty hype. This year should be really good with Ultra dropping lot of good players will be showing up to be the first at being first place. I suspect Daigo will be hungry this year. Tekken should be pretty hype too I wish people would show that game more support its really fun to play and watch. ,Kappa,cgs3g3a,1,t5_2tjsd
773702,0,t3_22ysmt,This is soooo stupid lol,Kappa,cgs837x,5,t5_2tjsd
778316,0,t1_cgsples,deleted,Kappa,cgsqysi,12,t5_2tjsd
780929,0,t3_232ty7,   ,Kappa,cgt1n9l,6,t5_2tjsd
782068,0,t1_cgt4pd6,Youre the one who didnt get laid and was texting another man wanting to fuck ,Kappa,cgt6b2x,3,t5_2tjsd
798219,0,t3_23a9uw,What could have been,Kappa,cgv0e25,3,t5_2tjsd
799259,0,t3_23ahkc,Keep it as simple as it drops.,Kappa,cgv4n1y,4,t5_2tjsd
801112,0,t3_23b1b4,Got Yellow Fever so bad that Im delirious and dated a  and am currently dating a  even though I could easily get s or s with low selfesteems.,Kappa,cgvc8l5,17,t5_2tjsd
807077,0,t1_cgvp8zh,TELL EM! ,Kappa,cgw0ouw,2,t5_2tjsd
808151,0,t3_23dthu,Damn Bruces Adon got me into the FGC....,Kappa,cgw53fb,3,t5_2tjsd
814001,0,t1_cgwqc7m,The real stigma is that stupid people play.video.games and you dont have any problems proving that one.,Kappa,cgwt0fz,-6,t5_2tjsd
816905,0,t3_23hovz,That tigers....Hot.,Kappa,cgx4vbl,2,t5_2tjsd
817373,0,t1_cgx6qu0,And now weve got criminal charges being written up as we type and watch.,Kappa,cgx6sbk,7,t5_2tjsd
821684,1,t3_23j5n0,Im sure at one point he was skinny and didnt smell like he spent all day in a toilet too ,Kappa,cgxoeak,-1,t5_2tjsd
826774,0,t1_cgxxf2z,I play Dudley so the there isnt that much thats different. The stuff that he has just got better.,Kappa,cgy97up,2,t5_2tjsd
829167,0,t1_cgyinkp,NCR is one of the largest in the country.  Topanga League dwarfs any single US payout.  Let Infiltration make his own excuses for finishing last.,Kappa,cgyj0qs,0,t5_2tjsd
843075,0,t3_239x8u,Elenabros gt Poisonhos,Kappa,ch03zsf,1,t5_2tjsd
844215,0,t3_23qpe5,OP needs to turn that User Account Control bullshit off.Control Panel gt System and Security gt Action Center gt Change UAC gt Never notify,Kappa,ch08oha,0,t5_2tjsd
846008,0,t3_23swok,This reminds me of Rose ball lol,Kappa,ch0g1a3,3,t5_2tjsd
848198,0,t3_23u9lt,Maybe people thought it was lagging cause of all those levels of HyResidentSleeper,Kappa,ch0p04j,4,t5_2tjsd
855865,0,t1_ch1k17l,Thank you based bag of dicks.,Kappa,ch1kf76,13,t5_2tjsd
859608,0,t3_23tr0t,deleted,Kappa,ch1zqhr,1,t5_2tjsd
860611,0,t3_23xyki,deleted,Kappa,ch23ulo,1,t5_2tjsd
861216,1,t3_23zi0l,nice top player circle jerk in that twitter convo,Kappa,ch26bvv,5,t5_2tjsd
863451,0,t1_ch25x1o,I major in cl.fierce    ,Kappa,ch2fhft,7,t5_2tjsd
868699,0,t1_ch30rdi,I dont think triforce even has an apartment at least not his own that hes paying for or if sharing paying anything for that matter. The arc has been shutdown for a year and theres no way he has a job right now. How hes paying for his hotel room is beyond me. ,Kappa,ch30xrx,5,t5_2tjsd
878784,0,t1_ch45ru2,Im not sure what video youre referring to but if you mean the arrows coming up the screen were spinning thats the Dizzy mod. Its not as bad as it looks,Kappa,ch466cy,1,t5_2tjsd
889971,0,t3_24becp,I have a feeling this will be popular among the FGC in the next week.,Kappa,ch5fzbn,5,t5_2tjsd
899062,0,t3_24elx7,autocorrect is the dumbest thing ever.  just reward people for being bad.,Kappa,ch6h87f,17,t5_2tjsd
910036,0,t1_ch7k2p7,deleted,Kappa,ch7q6ek,1,t5_2tjsd
915593,0,t1_ch80y6t,fuck markman why show your shitty promo codes for madcatz on stream then? scumbag,Kappa,ch8cxpt,3,t5_2tjsd
922103,0,t1_ch91345,cock,Kappa,ch93kf3,3,t5_2tjsd
933080,0,t1_chac1qu,ill do just that but im gonna need to know who he scam and proof of it.,Kappa,chacgpq,3,t5_2tjsd
942759,0,t1_chbe5q3,I believe the french bakery was based in New York. So he didnt need to know. I think he does know a little french though cause Ive heard him on some of the streams. ,Kappa,chbg54h,1,t5_2tjsd
949089,0,t1_chc5k9f,I think you will be very lucky if he does not go into a long incoherent rant that goes nowhere answers nothing and involves lots of shouting.,Kappa,chc63g1,9,t5_2tjsd
950191,0,t1_chcadc5,its not even that special for him.  he says shit like that every month,Kappa,chcam6d,1,t5_2tjsd
951220,0,t1_chcedqb,he went in on Triforce at times but I dont think he really wanted to crucify him honestly. Slasher is cutthroat he definitely could have ripped Triforce apart if he wanted to. but he didnt and I assume its because for some reason he didnt want to.,Kappa,chcetwy,9,t5_2tjsd
952344,0,t3_250pt8,Respect. I followed you on Twitter!,Kappa,chcjfqy,7,t5_2tjsd
959551,0,t3_253emb,giftwrap available we should all pitch in and send some to triforce or dieminion and have amazon wrap it up all nice and sweet for them they deserve a reward for all the entertainment they bring us intentional or not.,Kappa,chdcyvx,10,t5_2tjsd
959704,0,t3_253cq2,Yall should see how Smash community is reacting. A bunch of the big streamers are saying its all made up that Triforce does a lot for MK that Triforce pays MK a large salary more than any other sponsorship would. Its absolutely ridiculous. Why do people defend Triforce so much? Can someone explain this? I was involved in the Street Fighter community up until Super came out and am just now getting back into it. Triforce was a cancer back then. Did I miss something? Why is Triforce still around? Why do people have his back so hard?,Kappa,chddle2,33,t5_2tjsd
960459,0,t1_chdgo52,gt Dexter James Enough was enough when he was asked last night if the players on EMP were salaried. His response wasgt Yesgt The point of me stating every thing Ive done wasnt to make it seem like I was extremely valuable but rather that I wasnt on EMP at any point and time simple because I thought it was a sponsorship. I was never in the Arc. He was never my daddy at any point and time. He didnt cook for me and pay my bills. So even just the implication that I was just one of those players trying to enjoy the free ride is insulting. I dont have to rehearse the things I type or curb what I say because I am speaking truth. This is all flowing right off the top of the dome freely.gt The best thing about telling the truth is that you dont have to remember shit. hrs  Like  ,Kappa,chdgoma,4,t5_2tjsd
960964,0,t3_253c71,deleted,Kappa,chdir4h,3,t5_2tjsd
965704,0,t3_254jyp,guardcrushspecial.. why you drop that world war  bomb on him like this??,Kappa,che25s3,0,t5_2tjsd
966938,0,t3_255z7e,So does EMPtriforce keep their players trophies? ,Kappa,che786b,5,t5_2tjsd
967417,0,t3_256qkb,Triforce is all bark no bite,Kappa,che96yl,9,t5_2tjsd
970368,1,t1_cheguwz,Nobody here gives a shit about sfxt TB placed very well in AE at APEX and some other tourney this year though. ,Kappa,chel9kg,0,t5_2tjsd
971189,0,t1_cheoe4y,Triforce has yipes dieminion and sanford all sucking his dick simultaneously theyre all good players therefore he believes that he walks on water the only way things will change will be everyone leaves emp and hes left with no team at which point hell hopefully jump off the Brooklyn bridge and do us all a favor ,Kappa,cheomey,9,t5_2tjsd
