,controversiality,parent_id,body,subreddit,id,score,subreddit_id
7833369,0,t3_4mm20d,Source  because it literally shows up nowhere else and I somehow dont feel the inspiration to find this particular artist...Entrance Musicscene!You were expecting music but it was me GHOST STORIES!  I jest actual weab music for a bit,Yuism,d3wje9w,3,t5_3eidt
8082127,0,t3_4pxbnk,gtSource gtGreen text!  Whoo!  Cardinal and Yui are being included in the promos so much because someone thought it would be a good idea to have the game control system have the same expectation as the players at least in my head.The above is a message from udotdash. I will be posting the Yuisms while he is being reassembled.,Yuism,d4oi7pq,4,t5_3eidt
8140472,0,t3_4qqnkw,Source Some time I want to try and see if I can get this foldable to be folded on a computer and maybe D print it.  Or machine it.  Im not sure yet.Also Ill let you all in on a little secret I did the last  Yuisms at midnight the nigtht before I left.  Hehe that was some horrible planning.I guess this is Exit music since its so far down oh well!,Yuism,d4v3ruh,2,t5_3eidt
8357032,0,t1_d5m3itz,You said the magic word man! Can you guess what word that is?Also have a Trump wrestling gif in celebration of his official nomination,Yuism,d5m6j5h,2,t5_3eidt
8647789,0,t1_d6mhe2v,Yeah it is.  It was just late af when I went to sleep....,Yuism,d6ml2zz,2,t5_3eidt
9161087,0,t3_55s81f,Source  image I think this set is a little self contained story but darned if Im going to try and enter it in Google translate by hand i.e. drawing in characters with my mouse.  Also I can imagine Sugou laughing at all these sad parents with dead kids.  Not a pretty sight.,Yuism,d8d8gzu,2,t5_3eidt
11409076,0,t1_dfovis4,A little bit Im trying to get my jokes all in order still.,Yuism,dfp7ezf,2,t5_3eidt
