,controversiality,parent_id,body,subreddit,id,score,subreddit_id
305243,0,t3_1x1yhc,Anyone else not getting the video to load at all? Just a black screen saying its playing.,JapaneseASMR,cfcem5z,2,t5_2z527
3201100,0,t1_corb1v5,,JapaneseASMR,cotskno,2,t5_2z527
5113625,0,t3_3kzmm6,I kinda feel the same way butwouldnt a separate threadsticky be enough?,JapaneseASMR,cv2dssh,3,t5_2z527
5288586,0,t3_3ncyi3,I think its part of the cookingfrying asmr that was posted before on here and quickly removed for copyright. Great ASMR.,JapaneseASMR,cvnogp9,1,t5_2z527
5776666,0,t3_3u9lru,I usually go through the chan voice threads. Thats where i get the ones I find really great ,JapaneseASMR,cxd5eki,3,t5_2z527
6728780,0,t1_d0fb10a,Thanks brother! I plan to upload rather frequently if i get a positive response. Feel free to spread the love! D,JapaneseASMR,d0fbc5e,1,t5_2z527
7974704,0,t1_d4bcpid,Im already a VR fan and as long as the binaural audio accurately tracks head movement and positionally renders this could be absolutely AMAZING. I also got a few tingles just from the trailer!Cant wait for more VR with positional binaural audio. Only a matter of time...,JapaneseASMR,d4cfkty,1,t5_2z527
11276086,0,t3_603601,deleted,JapaneseASMR,dfa4man,1,t5_2z527
