,controversiality,parent_id,body,subreddit,id,score,subreddit_id
10142416,0,t3_5l7nil,Theres also this tweet which implies this Twitter account is supposed to take place after the game ends,Tattletail,dbtk7ki,1,t5_3i76k
10250810,0,t1_dc5zfeu,It shines brighter and takes longer to die. Thats about it though. Maybe it has some hidden use that I dont know about.,Tattletail,dc5zhtb,3,t5_3i76k
10256621,0,t1_dc6cveb,Yes.,Tattletail,dc6n78p,7,t5_3i76k
10284534,0,t3_5n96q2,I think its certainly part of it but Im assuming that we arent the only one who has a Mama. There are probably many murderous Mamas out there.,Tattletail,dc9t493,6,t5_3i76k
10469574,0,t1_dcuqwuc,This however isnt the model taken from the game its a fanmade model. Also it probably arent the developers who are putting DMCA claims but a very salty person. A lot of fnaf models have been claimed yesterday so its probably the same person.,Tattletail,dcuu0j7,9,t5_3i76k
10522031,0,t1_dd0r0df,gtVery badIll like to see you draw a better Tattletail and well see which one is very bad.,Tattletail,dd0saux,1,t5_3i76k
10547248,0,t3_5ptunz,AAAAH ITS SO GOOD!I love it,Tattletail,dd3ncrz,1,t5_3i76k
10613963,0,t1_ddaqcm7,Also it would work like the HandUnit and be more like a Virtual Pet. Like a tomodachi. ,Tattletail,ddaqzn6,1,t5_3i76k
10833078,0,t3_5ustc7,That last pic doe,Tattletail,ddxctf5,1,t5_3i76k
11011029,0,t3_5w7lhv,gabbygriffon    Once upon a time in the magical world of Equestria...    TURN THE PAGE.,Tattletail,deg2igx,4,t5_3i76k
11123409,0,t1_des9o8q,Ikr its a struggle.,Tattletail,destv16,1,t5_3i76k
11180713,0,t3_5zljry,deleted,Tattletail,dezbkr4,1,t5_3i76k
11208804,0,t1_df2g4nb,How did you get rid of all this pointy fur?,Tattletail,df2i764,1,t5_3i76k
