,controversiality,parent_id,body,subreddit,id,score,subreddit_id
2122501,0,t1_cl9m5dr,I grab your hand and whisperRun.I take off down the street,HogwartsRP,cl9m6z8,1,t5_2ygix
2132679,0,t1_clawkvb,OOC But that just doesnt make sense ...,HogwartsRP,claws7k,1,t5_2ygix
2133362,0,t1_clay6l8,What do you mean?,HogwartsRP,clazwn3,1,t5_2ygix
2133771,0,t1_clajujr,Ravenclaw!!!The Ravenclaw crest dawns on your robes as they outline in blue and bronze.Welcome to Hogwarts and to Ravenclaw house!,HogwartsRP,clb1s1t,1,t5_2ygix
2134095,0,t3_2jevmi,He walks into the Great Hall and first sees the cake thinking his name would look cool on it too.,HogwartsRP,clb39gy,1,t5_2ygix
2138078,0,t1_clbl4i9,Almost too quietly for you to hear and if Im pushed?,HogwartsRP,clblhum,1,t5_2ygix
2142475,0,t1_clc5jy2,Oh putain ... Cela se sent ssi bon I cant seem to keep back a small scream as Im halfway through bon ... Je veux jouir monsieur ...,HogwartsRP,clc5nbq,1,t5_2ygix
2143825,0,t3_2jgst1,You new?,HogwartsRP,clcbtz7,1,t5_2ygix
2144025,0,t1_clcc27e,Im fine,HogwartsRP,clccqyh,1,t5_2ygix
2150585,0,t1_cld6eie,Do you want..to hold her? ,HogwartsRP,cld6s8b,1,t5_2ygix
2151278,0,t1_cld9q4e,she looks at you curiously Umm she shrugs It doesnt matter to me. ,HogwartsRP,cld9ych,1,t5_2ygix
2151770,0,t1_cldc5cr,My laughter never stops not even for a second,HogwartsRP,cldc7ej,1,t5_2ygix
2152448,0,t1_cldf7dj,Then thats where we should go. Since youre the tour guide Id imagine that I would benefit most from seeing a place that you enjoy. I smile. If you dont mind showing me of course.,HogwartsRP,cldfb0v,1,t5_2ygix
2152793,0,t1_cldgtz4,Jordan watched as Wes pulled up and still not touch the ground while the bludger hit the grass in a muffled thump. Classic Wronski Feint not bad Wes. Not bad at all.,HogwartsRP,cldgvua,1,t5_2ygix
2152919,0,t1_cldhepn,I see. Its strange isnt it?,HogwartsRP,cldhglq,1,t5_2ygix
2158693,0,t1_cle7tzw,He was flying when he saw Ari dodge the bludger and hoped Tashia didnt see that.,HogwartsRP,cle7wq0,1,t5_2ygix
2158911,0,t1_cle8txr,Do you have any pets?,HogwartsRP,cle8wo0,1,t5_2ygix
2162835,0,t1_cleqt7w,Absolutely not. You know I love cuddling with you.,HogwartsRP,cleqv3b,1,t5_2ygix
2163538,0,t1_cletrg3,OOC What do you mean? As in I should make it deliberately more confusing lr these are things I do that make it hard for people to tell?,HogwartsRP,cleu32h,1,t5_2ygix
2164307,0,t1_clexa9e,I love it so much.My fingers reach your sides which they slowly begin tickling,HogwartsRP,clexm1s,1,t5_2ygix
2164897,0,t1_clf05fk,I snuggle closer. Sometimes its nice to just sit and talk. I like to hear about your day.,HogwartsRP,clf0bc6,1,t5_2ygix
2165066,0,t1_clf0yph,I shake my head and get up putting a bit more force into hitting the table than I may have meant toNothings going to be achieved by moping around Munt.And with that I leave,HogwartsRP,clf138d,1,t5_2ygix
2166376,0,t3_2jtx9z,Eleanor comes up and watches them then goes to the teacherHello Professor my name is Eleanor Carolina and Im a th year. And Prefect of Ravenclaw house.,HogwartsRP,clf73f0,1,t5_2ygix
2170277,0,t1_clfoicb,So? Tests arent bad if you study.,HogwartsRP,clfoymm,1,t5_2ygix
2172232,0,t1_clfxq33,You are met with a wink and a grin,HogwartsRP,clfxxj0,1,t5_2ygix
2172862,0,t1_clg0prd,She nods Very well you are both dismissed. She hands back the magazine with two study guides tucked inside. They read as follows Potions we have coveredSwelling solutionSleeping draughtAntidote to uncommon poisonsWide eye solutionBeautification potionYou will be expected to know what it looks and smells like what its effects are and a counterpotion if one exists. You will be expected to know their ingredients and how to brew them.You will be expected to understand and tell me how the individual ingredients interact with each other. SafetyDress codeBurner operationHygiene and cleanupproper labeling Ethicsthere will be one short answer question regarding what youve discussed today.,HogwartsRP,clg0trz,1,t5_2ygix
2173181,0,t3_2jxfdm,He begins taking notes on every other paragraph he reads but there wasnt much that he found interesting besides early Quidditch games and the usual unfortunate reactions to sightings of magic in the th Century.,HogwartsRP,clg2ajo,1,t5_2ygix
2176159,0,t1_clgfro7,I would help me.,HogwartsRP,clgfxti,1,t5_2ygix
2177571,0,t1_clgltot,OOC MFW this post.,HogwartsRP,clgmezr,1,t5_2ygix
2178214,0,t1_clgp62x,So how does it work?,HogwartsRP,clgpcv2,1,t5_2ygix
2182421,0,t1_clh8ifm,I thought we would be leaving after that class. The thought of being expelled seems really scary now since I realized that I have a lot to lose.,HogwartsRP,clh8lo7,1,t5_2ygix
2187132,0,t1_clhtuah,Sounds like fun. she giggles.,HogwartsRP,clhu5oy,1,t5_2ygix
2188836,0,t1_cli1ql0,What would happen if I just didnt stop tickling you?,HogwartsRP,cli1yy3,1,t5_2ygix
2189157,0,t1_cli3djs,Oh okay. So you have some idea of how I play.,HogwartsRP,cli3fz5,1,t5_2ygix
2189896,0,t1_cli6a32,Well as Ive just arrived. I actually am wondering what areas we will be quizzed over in the exam. ,HogwartsRP,cli6tps,1,t5_2ygix
2198483,0,t3_2k906m,Miss noones taught us a knockback jinx yet.,HogwartsRP,clja552,1,t5_2ygix
2199329,0,t1_cljbhp8,OOC It probably is.,HogwartsRP,clje0gb,1,t5_2ygix
2203296,0,t1_cljw09f,I pull my hand back wincing a little as some of the scratches are still raw. I flex my fingers and return the cat to under my arm.Yeah... I guess it kinda is. I say suddenly aware of my own accent.,HogwartsRP,cljw5c4,1,t5_2ygix
2205198,0,t1_clk287c,As he steadied his broom he let out deep breath he didnt know he had and beamedThank you Sir it was very intense.,HogwartsRP,clk4ugv,1,t5_2ygix
2206227,0,t1_clk9al4,Done ,HogwartsRP,clk9k0m,1,t5_2ygix
2210860,0,t1_clkuoo7,Oh! Alright. I smile and pull out a textbook. Is there a class here dedicated to it? Or is their just defense against?,HogwartsRP,clkur32,1,t5_2ygix
2216871,0,t1_cllld39,I turn around the corner to head outside.,HogwartsRP,cllm8kr,1,t5_2ygix
2232059,0,t3_2kpgr0,I listen carefully to the instructions and seem intruiged by the interesting teaching methods in place.,HogwartsRP,clnjqgd,1,t5_2ygix
2232955,0,t1_clnnbdw,He takes the bottle and downs it in several swigsOkay I think we done here.,HogwartsRP,clnnube,1,t5_2ygix
2236959,0,t1_clo622b,Erm... Dont really have any. Most of my time is spent studying and drawing. Theres not an awful lot of time for much else really.,HogwartsRP,clo6680,1,t5_2ygix
2240218,0,t1_clol0v7,People buy these.,HogwartsRP,clol2rg,1,t5_2ygix
2248638,0,t1_clpl9s1,You too! Thank you.I open the thing of sweets.,HogwartsRP,clpnjvx,1,t5_2ygix
2248879,0,t1_clpoh25,Yeah shes very impressive. In such short time too!,HogwartsRP,clpomj5,1,t5_2ygix
2251274,0,t1_clpypq1,Yes?,HogwartsRP,clpz9ds,1,t5_2ygix
2254725,0,t1_clqegfa,...In my quidditch uniform yeah.,HogwartsRP,clqemmh,1,t5_2ygix
2257616,0,t1_clqr14k,She finishes off her firewhiskey thinking,HogwartsRP,clqrgjl,1,t5_2ygix
2266154,0,t1_clrtb3e,I smile. Now Ill have to think of a name for her. Is that something you would be willing to help me with?,HogwartsRP,clrtei3,1,t5_2ygix
2266562,0,t1_clrtfue,She smirksWe were doing this She grabs your head and gives you the most passionate kiss she can give with her current skills,HogwartsRP,clrv7v0,1,t5_2ygix
2268528,0,t1_cls3r45,Yeah no need to question yourself so much though.,HogwartsRP,cls3yt3,1,t5_2ygix
2269673,0,t1_cls7pzv,When are you gonna tell him?,HogwartsRP,cls924v,1,t5_2ygix
2276410,0,t1_clt2orr,its okay.. im just jumpy...,HogwartsRP,clt2zsj,1,t5_2ygix
2276605,0,t1_clsrpj0,Is that what its about then? Me not being around? I go out to keep myself bloody functioning and when I come back I cant even expect my bloody girlfriend not to sleep with another guy?,HogwartsRP,clt3v0i,1,t5_2ygix
2281644,0,t1_cltpz9y,People. Whoever wants one goes through the Ministry to order one.,HogwartsRP,cltq8sj,1,t5_2ygix
2281938,0,t1_cltr71y,Never thought to ask honestly.,HogwartsRP,cltrjua,1,t5_2ygix
2284375,0,t1_clu24qa,Not really.,HogwartsRP,clu2dhw,1,t5_2ygix
2290956,0,t1_cluviiy,The two of us make it near to the common room entranceI really shouldnt go in with you so are you fine making it to your room on your own? I promise ill meet you again this evening.,HogwartsRP,cluvmqw,1,t5_2ygix
2291563,0,t1_cluogrc,I laugh. I can see him looking into a puddle and sobbing Who am I?,HogwartsRP,cluybxx,1,t5_2ygix
2293093,0,t1_clv4pfr,I roll my eyes at yet aNOTHER mention of your dealings with the Ministry and go back to practicing,HogwartsRP,clv55aa,1,t5_2ygix
2294209,0,t1_clv9zxu,she tosses up a snitch and nods,HogwartsRP,clva3uv,1,t5_2ygix
2301957,0,t1_clw8j66,You really want me to come home with you?,HogwartsRP,clw8lix,1,t5_2ygix
2309370,0,t1_clwual7,I dont care about a date. Honestly I just kind of want it to be soonish.,HogwartsRP,clx5kgp,1,t5_2ygix
2309613,0,t1_clx6ii4,He rolls his eyes at the awordYeah thats what she said. Im still pissed and Im going to take it out on them tomorrow.,HogwartsRP,clx6ncc,1,t5_2ygix
2316070,0,t1_clxzbc2,No he cant hes only a th year not a trained healer and this is serious as it can involve internal organs.Yes.,HogwartsRP,clxzccy,1,t5_2ygix
2321544,0,t1_clyn1pb,And within seconds Michael has bolted out the door all the way back to the castle.,HogwartsRP,clynnjf,1,t5_2ygix
2321792,0,t1_clyooz9,That is...too cool.,HogwartsRP,clyor7c,1,t5_2ygix
2322193,0,t1_clyqdrz,I return the kiss wrapping my arms around you to pull you close,HogwartsRP,clyqje4,1,t5_2ygix
2323914,0,t1_clyy60u,I start begging you to fuck me in very rapid French.,HogwartsRP,clyy6yb,1,t5_2ygix
2329941,0,t1_clzoo7m,So how did he meet your parents? I imagine he isnt a wizard?,HogwartsRP,clzoz9b,1,t5_2ygix
2330717,0,t1_clzsbaa,The fear quickly leaves her eyes and turns into something more sensual... Lust perhaps? Amanda isnt quite sure herself,HogwartsRP,clzsfqy,1,t5_2ygix
2331404,0,t3_2lsngv,Wednesday Dinner pls. Unless other people want it.,HogwartsRP,clzvi08,1,t5_2ygix
2331969,0,t1_clzxxr8,Scowls.Hes a git.,HogwartsRP,clzy0lb,1,t5_2ygix
2341383,0,t1_cm13pcj,ooc congratulations you have wet ashes p,HogwartsRP,cm13vqj,1,t5_2ygix
2343150,0,t1_cm1abtr,Hopefully it wont ever come into play.Say.. Katherine.. who was it you wanted to play for?,HogwartsRP,cm1bpzz,1,t5_2ygix
2343286,0,t1_cm1bj1x,His face is constant change and feeling like its full of fluid wi every suck. There are no signs of protest just his trying to adjust to this as much as possible.,HogwartsRP,cm1cbsk,1,t5_2ygix
2343758,0,t1_cm1e6em,Sleeping is boring,HogwartsRP,cm1ef6e,1,t5_2ygix
2343912,0,t1_cm1f1pz,I hug you tight. I want to believe you but its hard. And it feels kind of nice having you reassure me like this.,HogwartsRP,cm1f3su,1,t5_2ygix
2345195,0,t1_cm1kc09,theres canon American teams so well just go with one of thoseNicely done.,HogwartsRP,cm1ksy5,1,t5_2ygix
2346198,0,t3_2m6oyf,He looks at his pile of letters there are five of them. He doesnt touch them he just stands there and stares at them.,HogwartsRP,cm1p9h3,1,t5_2ygix
2346359,0,t1_cm1pvye,Mum We would love to sweetie.,HogwartsRP,cm1pzav,1,t5_2ygix
2353794,0,t1_cm2m4qd,Noooo! I try to twist away but you can tell Im loving it.,HogwartsRP,cm2n1lf,1,t5_2ygix
2353967,0,t1_cm2nq5q,No! I say probably a bit too forcefully.,HogwartsRP,cm2nt94,1,t5_2ygix
2359948,0,t1_cm38c6y,I walk up with JuliaMistress? Julia is having a surgery today and needs to go to St. Mungos.,HogwartsRP,cm3eeys,1,t5_2ygix
2365498,0,t3_2mgyu5,I walk out onto the pitch even though Ive been told many times that I shouldnt come today.,HogwartsRP,cm4327d,1,t5_2ygix
2365774,0,t1_cm443zj,Mounts my broom.Sounds good professor.,HogwartsRP,cm44ahh,1,t5_2ygix
2367189,0,t1_cm4ahjt,I grin as I lead a trail of kisses up your body to just below your lips teasing you before I answerRavish me. Make my eyes go cross with pleasure any method you want.,HogwartsRP,cm4aks3,1,t5_2ygix
2384101,0,t1_cm6dod5,I lie wide awake for hours thinking about how my future has changed.,HogwartsRP,cm6dsrm,1,t5_2ygix
2384771,0,t1_cm6gndb,Blushes.You could if ya want to...,HogwartsRP,cm6gsfv,1,t5_2ygix
2385051,0,t1_cm6htnr,I grin and tickle my fingers up and down your sides as the feathers torture your armpits,HogwartsRP,cm6i1av,1,t5_2ygix
2385320,0,t1_cm6j45p,You are?,HogwartsRP,cm6j8er,1,t5_2ygix
2388645,0,t1_cm6m910,she squeals and starts thrashing around on his bed underneath himJohn Smith you InsuffAGGGHH.,HogwartsRP,cm6xzlv,1,t5_2ygix
2402733,0,t1_cm8on44,She nods despite already resolving to not send any of the more honest letters shed been wanting to send for the longest while.,HogwartsRP,cm8oq4f,1,t5_2ygix
2413511,0,t1_cm9jf2t,Unfortunately they dont get far. Eleanor threatening Elsa into going with her to Cromwells office. Shed rather walk thank you very much.,HogwartsRP,cma0ox5,1,t5_2ygix
2419909,0,t1_cmah70y,Radical. I squeeze your hand and start walking in that direction. So um...how are you today?,HogwartsRP,cmat5oq,1,t5_2ygix
2420823,0,t1_cmawwwu,Je ne vois rien  envier. Je cherche pour le plaisir et aspire  une vie moins ordinaire. La seule bonne peu de mariages est les robes. Et la nuit de poule.,HogwartsRP,cmax7u1,1,t5_2ygix
2431408,0,t1_cmc8824,The only good thing about this class is you but I still come here everyday rather than meet you somewhere else. At the same time everybody else here I think actually enjoys this class.,HogwartsRP,cmc897h,1,t5_2ygix
2437126,0,t1_cmcxle8,I slip the condom off of his member and slowly lick along the side before taking the tip into my mouth.,HogwartsRP,cmcxnig,1,t5_2ygix
2443631,0,t1_cmdqhy2,I know it will bella.,HogwartsRP,cmdqk1p,1,t5_2ygix
2451160,0,t3_2nl6a4,He practices the spell a couple times even though he was pretty familiar with it and soon approaches the professor.,HogwartsRP,cmeo0i1,1,t5_2ygix
2462817,0,t1_cmg2i7a,He soon joins her on the table with an arm around her.,HogwartsRP,cmg3shh,1,t5_2ygix
2467291,0,t1_cmgmf54,I instinctively deepen the kiss a little holding you tighter. ,HogwartsRP,cmgnnx4,1,t5_2ygix
2471856,0,t1_cmh7p4i,Yeah Elsas been helping me with potions. But Im still dead awful wjth muggle studies and history of magic. Not so good in herbology either.,HogwartsRP,cmh7xqz,1,t5_2ygix
2475717,0,t1_cmhpdbb,Interesting.,HogwartsRP,cmhpozf,1,t5_2ygix
2478388,0,t1_cmi08n2,Hmm well I guess thats... Reassuring. But I cant help but feel guilty. She just well pushes my buttons and l... SighI get annoyed easily. Funny really I like to avoid trouble but always get myself in it...,HogwartsRP,cmi29yv,1,t5_2ygix
2479243,0,t1_cmi61p7,What are you talking about?,HogwartsRP,cmi6b0b,1,t5_2ygix
2479564,0,t1_cmi6aep,As Ajax looks around the room he spots you,HogwartsRP,cmi7tia,1,t5_2ygix
2480328,0,t1_cmibdm6,Bust it more!Tony shut up.,HogwartsRP,cmibf53,1,t5_2ygix
2482048,0,t1_cmii5ha,Ooh..but what did the other creatures do?,HogwartsRP,cmijirv,1,t5_2ygix
2482271,0,t1_cmikhde,I smile and place my hands on his chest.Right about... Here.,HogwartsRP,cmikkng,1,t5_2ygix
2493924,0,t1_cmk3bhx,He smirks and pulls you into him for a kiss,HogwartsRP,cmk3e1u,1,t5_2ygix
2503058,0,t1_cml8z8k,I smirk and kiss you,HogwartsRP,cmladdy,1,t5_2ygix
2508894,0,t1_cmlxkwr,She nods and sits down. She feels a little bad for Tashia but figures any condolences would sound pretty stupid coming from her. She watches Jordan aim bludgers at Wesley.,HogwartsRP,cmm1tux,1,t5_2ygix
2511105,0,t1_cmmc26b,I have had enough of your nonsense Ms. Mayburt. You may not think this class is worth your time but its a class here for a reason. And as I understand it your prefect gave this speech once before.I hold up the first note the one from the day Eleanor busted youCare to tell me exactly what you said?,HogwartsRP,cmmc8rl,1,t5_2ygix
2511555,0,t1_cmmbdfu,Hes not sure what shes saying but assumes its some very dirty things that he should be hearing.,HogwartsRP,cmmed1r,1,t5_2ygix
2517163,0,t1_cmn4ey1,I nodOkay I will admit that comment was a bit unprovoked. But everything else has been in response to your...preformed attitude.,HogwartsRP,cmn4q9a,1,t5_2ygix
2520087,0,t1_cmnhk40,He then moves across your chest and starts on the opposite nipple.,HogwartsRP,cmnii25,1,t5_2ygix
2524315,0,t1_cmo29cz,Awww. I like when you blush.,HogwartsRP,cmo2cs1,1,t5_2ygix
2525970,0,t1_cmo9mal,I dont care how fast just... Not too high? She has a death grip on him.,HogwartsRP,cmoa4px,1,t5_2ygix
2555989,0,t1_cms76y6,I smile and take your hand in mine leading you out of the tent. I flick my wand at it collapsing it and making it float into my pocket,HogwartsRP,cms7e8r,1,t5_2ygix
2566492,0,t1_cmtktcx,She sighs and says nothing this time.,HogwartsRP,cmtkuo7,1,t5_2ygix
2570983,0,t1_cmtmy2d,He smilesYoure very welcome Shaun.,HogwartsRP,cmu5zc9,1,t5_2ygix
2577338,0,t1_cmuz83f,Why?I sound worried,HogwartsRP,cmuzvhw,1,t5_2ygix
2577842,0,t1_cmv27cr,Well I still have the grounds unlike some people here apparantly.,HogwartsRP,cmv28uy,1,t5_2ygix
2578607,0,t1_cmv5oyl,I scream.How master?,HogwartsRP,cmv5u8q,1,t5_2ygix
2585272,0,t1_cmw13gp,Ah yes Amiera. He laughs and looks over at Amiera smiles at her blows a kiss to her just to rub it in Nevilles face and then looks back over at the Merpeople.,HogwartsRP,cmw16xe,1,t5_2ygix
2586118,0,t1_cmw55w8,ooc No just in the future. I appreciate you clarifying things. ,HogwartsRP,cmw56ba,1,t5_2ygix
2595503,0,t1_cmxd0ng,But we didnt.,HogwartsRP,cmxdb30,1,t5_2ygix
2598967,0,t1_cmxt8q5,ooc no biggie.,HogwartsRP,cmxtlq1,1,t5_2ygix
2600459,0,t1_cmy0iqa,He chucklesYeah you might want to get through all of that before the term ends.,HogwartsRP,cmy0muy,1,t5_2ygix
2611147,0,t1_cmyv86p,Yes I know. He seemed to have not gotten along very well with a boy from Gryffindor and they decided to literally take it outside.,HogwartsRP,cmzex9b,1,t5_2ygix
2617486,0,t1_cn08g9i,Ooc. But she needs to behave for the rest of the school year.,HogwartsRP,cn08sgo,1,t5_2ygix
2622121,0,t1_cn0tf63,deleted,HogwartsRP,cn0ukjt,1,t5_2ygix
2630152,0,t3_2q0p9n,I look around for some friends to sit by after the speech.,HogwartsRP,cn1w8on,1,t5_2ygix
2632734,0,t1_cn28byx,Shaun nods and grins.Oooohh yes we do.,HogwartsRP,cn28d3i,1,t5_2ygix
2633958,0,t1_cn2dw8w,She chucklesYoull have to do something on your own next term.,HogwartsRP,cn2e4ly,1,t5_2ygix
2636656,0,t1_cn2puat,She kisses himI suppose not. But lets hang onto it.,HogwartsRP,cn2qsmc,1,t5_2ygix
2639779,0,t1_cn35bgq,She breaks the kiss and sucks in a breath gripping down hot and slick around his fingers,HogwartsRP,cn35gho,1,t5_2ygix
2640744,0,t1_cn39usv,It isnt enough to wipe the smirk off my faceGive it to me!,HogwartsRP,cn39zmn,1,t5_2ygix
2643113,0,t1_cn39q62,Hufflepuff!!!The Hufflepuff crest dawns on your robes as they outline in black and yellow.Welcome to Hogwarts and to Hufflepuff house!,HogwartsRP,cn3l5gt,1,t5_2ygix
2650553,0,t1_cn4jxoj,That was some atrocious writing on my partWhat? Its clever original and makes you smile when you say it out loud.,HogwartsRP,cn4k43m,2,t5_2ygix
2662398,0,t1_cn63ljo,I shake my head. Nope all the boring classes you have to take.,HogwartsRP,cn63p9q,1,t5_2ygix
2663693,0,t1_cn69i2e,Thank you. Ill see you around.she levitates her trunks and starts heading that direction.,HogwartsRP,cn69rz6,1,t5_2ygix
2667464,0,t1_cn6rd92,She blinks as she ceases her leglimensNo. Just thought I saw something on your face a trick of the shadows made it seem as if something was crawling on the side of your forehead.,HogwartsRP,cn6rg4b,1,t5_2ygix
2674105,0,t1_cn7mkys,Furrows my eyebrows still drunk and confused.What bullshit?,HogwartsRP,cn7mlrs,1,t5_2ygix
2688603,0,t1_cn9ip28,Her jaw dropsSeriously? No to all of them?,HogwartsRP,cn9iqe0,1,t5_2ygix
2708276,0,t3_2qy91a,I wander by and see that a new inhabitant resides in this office. I smile brightly. You must be the new professor!,HogwartsRP,cnbx5d0,1,t5_2ygix
2714749,0,t1_cncnk8j,Thank you.,HogwartsRP,cncnmue,1,t5_2ygix
2716034,0,t1_cncr3i0,Oh.. okay. she smiles and gets up,HogwartsRP,cncsw4w,1,t5_2ygix
2720228,0,t1_cnd9stx,Classes start on Monday so yeah. Wes Jordan everyone else.,HogwartsRP,cnda0xi,1,t5_2ygix
2724793,0,t1_cndsnak,Shrugs.Itll be nice to start up a routine.,HogwartsRP,cndsq61,1,t5_2ygix
2725070,0,t1_cndkm3u,Hey hey.She holds you close your head in her chestshoulder areaTash its okay.She begins rocking back and forth gently kissing your forehead,HogwartsRP,cndtv06,2,t5_2ygix
2728880,0,t1_cne9b85,Good.I grin and poke your sideNow get in the sky and practice.,HogwartsRP,cne9g7h,1,t5_2ygix
2732510,0,t1_cneo17t,She scratches his head and tells Kate his parents would have sent me a letter if something happened right? Or maybe they dont like me...Then she turns to ParkerMaybe not me but would they have told someone else?,HogwartsRP,cneoaxn,1,t5_2ygix
2735906,0,t3_2rcx6s,Other way.She says in the corner her hood is up and her arms crossed,HogwartsRP,cnf26iu,1,t5_2ygix
2740823,0,t1_cnfmak4,Nnnnnnnnnnnnn yyeeeeahhh...She grinds your face you can feel the heat pouring from her wet little slitNnnn again baby...oohhh it feels so good.,HogwartsRP,cnfmc26,1,t5_2ygix
2741778,0,t1_cnfpeip,Do you know any stars in it?,HogwartsRP,cnfq8w6,1,t5_2ygix
2742750,0,t1_cnfu4n9,Well I cant tell him that and you were close to him. Really close I... Thought youd need support.,HogwartsRP,cnfu7z3,1,t5_2ygix
2749385,0,t1_cngje3t,Thats a scary thought.,HogwartsRP,cngldhr,1,t5_2ygix
2752653,0,t3_2rkkai,After being introduced she looks out over the students with a mild curiosity during dinner. She watches their antics and mannerisms. Keeping an eye out for anyone that may pose a problem in class.,HogwartsRP,cngyre7,2,t5_2ygix
2759251,0,t1_cnhp48y,You were chosen for the team captain because youre the best Slytherin has.He drops his voice down and grabs your handAnd I chose you because I really care about you. Youre beautiful and smart and awesome to be around.He kisses the side of your neck gently,HogwartsRP,cnhpsgl,1,t5_2ygix
2759702,0,t3_2rkkai,She likes the idea of a drama club. She reaches to get some food wondering if theyd let her work on sets.,HogwartsRP,cnhrmya,1,t5_2ygix
2760618,0,t1_cnhv9i5,In it is a pile of chocolate and a stack of Galleons,HogwartsRP,cnhve03,1,t5_2ygix
2761900,0,t1_cnhpxn1,she frowns Why not?,HogwartsRP,cni0n3h,1,t5_2ygix
2771382,0,t1_cnj2put,She taunts you by spinning and moving up and down in big wavesNa na na na naaaa naaaaa! Katie cant get me!,HogwartsRP,cnj3guf,1,t5_2ygix
2771733,0,t1_cnj4szk,Well Cromwell doesnt want me outside so that strikes the rest of my time here and then as soon as I get home mum...she stops smiling and looks downI guess I forgot.,HogwartsRP,cnj4wmv,1,t5_2ygix
2772039,0,t1_cnj621v,First off dont make presumptions like that I have no issues taking points from my own house for insubordination.Secondly your actions earlier in the semester disqualified you. I told you earlier this year before youve gone that every action has a reaction or consequence.,HogwartsRP,cnj65rz,1,t5_2ygix
2775220,0,t1_cnj7rhp,Thats quite alright. Ill have to find a pair that fits better.Anyway that was some tremendous work.,HogwartsRP,cnjj5u0,1,t5_2ygix
2778204,0,t3_2rv6na,Ari asks Professor MadiganCan my owl aid my search?,HogwartsRP,cnjveyu,1,t5_2ygix
2779977,0,t1_cnk20mp,She smiles backMmhmm. And Jordan. And your new friend.,HogwartsRP,cnk2oaf,1,t5_2ygix
2781793,0,t1_cnk8xbi,How about I take you to bed then hm? Sleep is important for such a talented athlete.,HogwartsRP,cnka3wn,1,t5_2ygix
2782016,0,t1_cnkavkp,she evenly staresWhat about that sexy Muggle you were hot and heavy with?,HogwartsRP,cnkb0ou,1,t5_2ygix
2782090,0,t3_2f2vns,She approaches your door smiling slightly her fingers dance along the wood before curling in a loose fist. How long had it been since she walked through these halls? Oh well such thoughts are best put away for now. She knocks on your door. Its a strange knock one that conveys both a delicate touch and a firm hand.,HogwartsRP,cnkbbl9,1,t5_2ygix
2785426,0,t1_cnknxs0,OOC The thing?,HogwartsRP,cnkoyev,1,t5_2ygix
2798299,0,t1_cnm5h2d,You are? Is Slytherin that much better?,HogwartsRP,cnm5n22,1,t5_2ygix
2798888,0,t1_cnm801y,Ooc okie just checking thank you. Didnt want to put words in her mouth XD,HogwartsRP,cnm81qk,1,t5_2ygix
2852863,0,t1_cnsd63o,She chucklesI may have called her clothes ugly right before that.,HogwartsRP,cnsdd8o,1,t5_2ygix
2855010,0,t1_cnskxbd,she puts the gloves on awkwardly as she listensNo.. I can do it I promise. Im very very good with plants.she reaches for the plant takes a deep breath and carefully pulls it out of the ground.,HogwartsRP,cnsm5qd,1,t5_2ygix
2858488,0,t1_cnsrkwp,He accidentally almost walks into her and darts his hands out to prevent her from fallingAre you okay?He cant see her face because of the Prophet,HogwartsRP,cnt0ear,1,t5_2ygix
2859405,0,t1_cnt2rgx,He nods with a laughChildren are scary at the best of times let alone when they see us like that.Offers his armShall we?,HogwartsRP,cnt461k,0,t5_2ygix
2863625,0,t1_cntl9aj,She looks defeated crestfallen as she turns to her own food...now in silence,HogwartsRP,cntlfzm,1,t5_2ygix
2871934,0,t1_cnuje5b,...Shouldve know what?,HogwartsRP,cnujfvx,1,t5_2ygix
2877408,0,t1_cnuxydi,I wait for imaginary people to turn up.,HogwartsRP,cnv5vel,1,t5_2ygix
2880396,0,t1_cnvew3y,Umm yes professor. I think we found it. And the dates are  May June. ,HogwartsRP,cnvi4t1,1,t5_2ygix
2882497,0,t1_cnvqp4q,She whispers in your earIll bring myself. Good enough for ya?She giggles in a breathless voice as she pulls away,HogwartsRP,cnvqquy,1,t5_2ygix
2891761,0,t1_cnwsepo,She blinks and looks at her coollyThere is no need. I did not feel wronged in any way however you seemed rather upset. My apologies.,HogwartsRP,cnwspay,1,t5_2ygix
2915967,0,t1_cnzbjf7,He smirks and shakes his head. Oh the fun he will have,HogwartsRP,cnzjx8l,1,t5_2ygix
