,controversiality,parent_id,body,subreddit,id,score,subreddit_id
7602971,0,t1_d36e01o,If you are a Republican you have no heart if you are a Liberal you have no brain Winston ChurchillIm not stupid you are. However I apologize for not wanting to pay for someone elses food not wanting gays to get married and keeping a gun under my bed.,incest,d36f2tf,-4,t5_2qx19
7608975,1,t1_d373f3s,you are right but i think i will just ignore it. and let it eat me up to punishment. i can not talk to my boyfriend. i am sorry. nope nope nope,incest,d373neg,3,t5_2qx19
7617838,0,t3_4jnmwy,Is he older? By get out of things do you mean black mail or just to stop and argument? How long has it been since this? After the orgasm and realizing you werent dying did it make you more ok with it? ,incest,d383x6l,1,t5_2qx19
7631578,0,t1_d39msip,deleted,incest,d39o3f0,2,t5_2qx19
7639050,0,t3_4jq7on,If her husband treats her so badly why does she stay with him?  Sounds like an abusive marriage to me.,incest,d3ain18,2,t5_2qx19
7665036,0,t1_d3dgcif,She doesnt want to.  Some people say you can never trust a girl.  But... I definitely know.  Plus she is NOT smarter than me lol.  We been together for  years I know her.  What do you mean how would she make it happen?,incest,d3dgysd,0,t5_2qx19
7694928,0,t1_d3gs7b9,Most of us here dont think its wrong but beyond being wrong or not is it something that you would really enjoy? Will you not regret it?,incest,d3gv3ie,1,t5_2qx19
7729325,0,t3_4kwuc2,...and was a great wife when I was with my husband.Mhmm suuure you were. ,incest,d3krpmw,11,t5_2qx19
7730265,0,t1_d3kfg27,Some girls are just more outwardly affectionate with siblings than others man. I agree with the others its not that theres essentially nothing there its just that the bond you have is so dominantly brother and sister that any risky move on your part can and will send this whole shit skyhigh. Please man you have everything together. She seems happy with her husband. If you truly believe you owe her everything sacrifice something now and dont gamble your relationship with her over a hunch. She means a lot to you right? Is the large chance of losing her worth the incredibly small chance of upgrading the relationship especially given that itll have to stay a secret? I dont think so.Ce la vie. And there are more fish in the sea. Take the gift of sobriety and success and channel it into finding someone else right for you because there are billions of girls out there the notion that there can only one soulmate for everyone is pure nonsense.,incest,d3kvjy6,1,t5_2qx19
7735736,0,t1_d3kplk8,I want other people to think that I am normal.Let me put it this way In school I have always had very good grades only exception sports. And I always felt that something was still holding me back and that I needed to be less like my funloving mother with her Berlinaccent who always had new plans in live an switched jobs and sexual partners all the time.,incest,d3lhxl3,3,t5_2qx19
7735746,0,t3_4l0o5z,There was a story from a while back of a family of  where the fathers widowed. The father was lonely or something and took out an ad in the paper and very matteroffactly theres a new stepmom in the picture. Theres tension between the stepmom and the son but the son and youngest sister develop a thing the other sister goes off to school and theres an aunt Rachel or something. The stepmom and aunt encourage the kids to go at it and eventually everyone gets a piece.A hot tub figures promenantly. It was very long and each pairing off kind of had their own arc. At one point there was a photo shoot on a yacht where the brother and younger sister discover the elder sister father and stepmom going at it.,incest,d3lhz1z,1,t5_2qx19
7744252,0,t3_4l7tfv,Good story keep it up the names are kinda odd though.,incest,d3mgr8l,3,t5_2qx19
7791979,0,t1_d3r8err,Thing is hes probably at least as confused as you are about this.  So you should be the one to set the limits on what you will let him do.  Do you just want kissing for now?  Do you want him to feel you up?  Do you want to feel him up?  Do you want his fingers inside you?  His tongue?  His cock?  Are you willing to give him a hand job?  A blow job?  Do you want to fuck him?,incest,d3rvjme,6,t5_2qx19
7803290,0,t1_d3t564b,Yes he supports it and does know about it. Weve had multiple conversations  it wasnt easy to bring it up obviously. ,incest,d3t5fp3,12,t5_2qx19
7814519,0,t3_4mblt7,There is some missing information and I suspect the reason for the omission is your father in the picture? Im all for doing your own thing just dont mess it up for others.,incest,d3uezne,0,t5_2qx19
7815835,0,t3_4mdf58,umarcusino it looks like your post does not contain one of the approved tags. Please click here to view our tagging guidelines and resubmit with the correct tag.I am a bot and this action was performed automatically. Please contact the moderators of this subredditmessagecompose?torincest if you have any questions or concerns.,incest,d3ukbq3,1,t5_2qx19
7815981,0,t3_4mblt7,Spooning with a hard on is a way to get things moving.After a while you can use the hard on instead of your fingers.,incest,d3ukx0k,2,t5_2qx19
7927894,0,t3_4nqpg7,Double engineering major and a minor?First of all there is no need for that level of masochism. Jobs wont care and youre killing yourself.Second of all the second most important aspect of college is the social life and youre killing it with this level of academic devotion. I learned at least as much from my time outside the classroom in college as I did inside it!,incest,d4764k0,1,t5_2qx19
7974077,0,t3_4ofy1c, little lady!  You look a lot like my little sister when she was !  Thanks from a dirty old dad.,incest,d4cd19c,4,t5_2qx19
8000881,0,t1_d4eke8n,If thats true why is it so hard to find incest porn in dutch? Do you know of a dutch incest forum like kindred spirits or full marriage equality?,incest,d4fdifq,1,t5_2qx19
8034838,0,t3_4p9v1z,removed,incest,d4j6wen,1,t5_2qx19
8042101,0,t3_4pd7ny,Maybe start by opening up to her and talking about sex. Perhaps even wear less clothes maybe nothing at all say you want to try the nudist lifestyle. This will get her to be more comfortable around you concerning sex. ,incest,d4k0ab7,5,t5_2qx19
8047274,0,t3_4pehpq,Why do you still share a bed if the somewhat inevitable results are still awkward? Alternative sleeping arrangements are not that expensive.,incest,d4kl8a7,4,t5_2qx19
8065885,0,t3_4pbqdx,Im looking for a brother sister story it starts with him and her in the bathroom he shows her how to mastuiurbait and ends with them and her friends in a lockerroom at a pool.,incest,d4mojzb,1,t5_2qx19
8066260,0,t1_d4m5f6n,Thank you for your reply! I understand I made a big mistake but not that I didnt wanted do something. Im simply very shy and Im not sure what my next move should be. What kind of signal I should give her,incest,d4mq2ko,15,t5_2qx19
8099983,0,t1_d4qi4ij,Yeah I have some progress with him already which I will post tomorrow. But I think its looking likely that I will be naked and have a small towel when he begins massaging me. ,incest,d4qieol,3,t5_2qx19
8136082,0,t3_4qmy8t,thx. like story waiting for update ,incest,d4ukija,2,t5_2qx19
8155925,0,t3_4qx7jt,DO not,incest,d4x1eh6,9,t5_2qx19
8199494,0,t3_4rjpdl,Man u got to try to write a book cause this is golden ,incest,d52ho38,2,t5_2qx19
8217385,0,t1_d54q24t,Thanks.,incest,d54q8kj,3,t5_2qx19
8232976,0,t1_d559gjj,Thanks for the help! I will work on Part  and I guess have it be the conversation following the morning ,incest,d56oexm,2,t5_2qx19
8233671,0,t1_d56rfx7,Doesnt matter if theyre family studio portraits ya just dont go around posting pics of people without their full knowledge and permission.  I dont even know why this is a question  this is fundamental common courtesy ,incest,d56rj8t,3,t5_2qx19
8269608,0,t3_4ow3a3,Benbrook almost another month.  Any more updates,incest,d5b9ciu,1,t5_2qx19
8273815,0,t3_4srnvf,Let the dude cum already cmon,incest,d5bsajv,8,t5_2qx19
8313259,0,t1_d5go3un,No she doesnt,incest,d5gppo0,5,t5_2qx19
8328701,0,t3_4tlshc,Congratulations!  It sounds like you two are having a great time.  If both of you are enjoying this discreetly there is no shame in it.  Sex is a part of life and when you find a partner to enjoy it with it is awesome especially a family member.  Enjoy!,incest,d5in5gn,6,t5_2qx19
8376644,0,t3_4u89q3,And it might be better to explain sooner rather than later because shes stewing in hurt until then.,incest,d5omorn,1,t5_2qx19
8376821,0,t3_4uccjv,The drunk thing might impact her memory but unless she was completely wasted I doubt it especially since it was only like  years ago. Id recommend talking to her on a regular basis daily if possible. After a week or two maybe throw some hints out there about said memory. If she doesnt pick up on it right away just say something like Man I really enjoyed insert trips name here. Id love to spend some time with you again if youre interested. Something along those lines. If by chance she doesnt remember that time at all she wont freak out like she might if you said Hey remember when we had sex?,incest,d5onhci,5,t5_2qx19
8380323,0,t3_4ue9ge,I understand as a mother you want to protect your children but the reality is they are now adults. They could have a temporary friends with benefits relationship or it may be a lifetime commitment.There is little you can do to stop them and any attempt could well alienate them from you. This is especially true if they feel you are judging them. Forcing them to break up could have lifelong repercussions as many stories here and on rincestrelationships attest.I get how hard it may be to accept but they need your support now and in the future. ,incest,d5p37o5,87,t5_2qx19
8410009,0,t1_d5rh1vt,Haha sorry I must have missed of forgot your response but good luck man! ,incest,d5ssnos,2,t5_2qx19
8450208,0,t1_d5vx5nf,gt Covertly taking risqu photos and jerking off to them is bad moron. Stop violating her privacy. Jesus.ftfy,incest,d5xt9j6,2,t5_2qx19
8466701,0,t1_d5zvbhs,Yes exactly. Then more people may attempt to have a loving incestuous relationship if they see such movies.,incest,d5zvjdx,2,t5_2qx19
8468484,0,t3_4vge0y,Based on the fantasies youre having of her it sounds like youre still torn between treating your sister as a lovable person and thinking of her doing sick things like sleeping with her father. Like your brain cant resolve the cognitive dissonance so it imagines similar scenarios instead.But theyre both adults that obviously gave consent to each other. Treat them like that and ignore the fact that theyre related. Would you still object to the relationship if that were the case?That answer should inform you better than anything else.,incest,d603lax,1,t5_2qx19
8484423,0,t3_4vud5d,Every entry just leaves us desperately waiting for your next update. Bravo Sir! You are the Redditor this Sub deserves!!!!!!!,incest,d623k93,5,t5_2qx19
8521137,0,t3_4gbkcx,Be honest....It will never be the same with another man for him or another woman for him.What if he decides he wants you as his life partner?I mean he can never get that double love that incest with your own mother provides.iam sure that sex with him is incredible...,incest,d66pbky,1,t5_2qx19
8537050,0,t3_4wondb,It appears that youve made an advice post in rincest. We recommend reading the following submissions for more general incestbased advice General Tips on Seduction of Family Members Common Questions amp Outcomes to ConsiderIf you would prefer serious responses only then you may find your post is better suited to rIncestRelationships.I am a bot and this action was performed automatically. Please contact the moderators of this subredditmessagecompose?torincest if you have any questions or concerns.,incest,d68p4z0,-10,t5_2qx19
8539492,0,t1_d68xpsj,Interesting.  While looking it up stumbled across this  gtthere are several countries where the act of adult consensual incest is not punished as a crime Belgium France The Netherlands Portugal Spain Luxembourg Turkey Russia India Israel Brazil and Japan do not punish consensual adult incest. In Italy incest is punished as a criminal offense Art.  Penal Code if and apparently only if it causes public scandal. Romania and Switzerland have considered repealing their incest laws. Rhode Island repealed its criminal incest statute in  Ohio only targets parental figures and New Jersey does not apply any penalties for incest to anyone over the age of .,incest,d6905my,2,t5_2qx19
8552255,0,t1_d69gx83,I have been around long enough to know what a box  vagina is.  I just dont see how your comment could be useful to this thread.,incest,d6alsme,-2,t5_2qx19
8557976,0,t3_4wxtdz,I am available for adoption ,incest,d6bbn68,64,t5_2qx19
8571459,0,t1_d6clcw4,Maybe I need to start thinking of it more like just sex than sex with my brother... do you think that will help?,incest,d6d0ipo,2,t5_2qx19
8577154,0,t3_4x6xne,now you can be a sister wife with your mom!,incest,d6dq7fr,6,t5_2qx19
8578251,0,t3_4x7g3p,and I want to watch! D,incest,d6dv5qb,1,t5_2qx19
8592263,0,t1_d6fm84p,As soon as I can. Probably tomorrow.,incest,d6fmgd1,3,t5_2qx19
8618832,0,t3_4q7xc9,Thank you silentwitnessit for sharing your secret here. You say that you dont know when your mother and brother became lovers have you considered the idea due to the difference in your ages that your brother is theoretically old enough to be your father and the possibility that he might actually be your real father?  ,incest,d6iycev,1,t5_2qx19
8626781,0,t1_d6jt3fb,Im sure he is   Doesnt mean hes not hot for you ,incest,d6jy920,2,t5_2qx19
8654152,0,t3_4ydmpc,I love stories that the whole family is part of. Ms daddaughter dadson md mdaughter ss bs. I even        love ones with grandmothera,incest,d6ndt9s,1,t5_2qx19
8667958,0,t1_d6onmic,Yep,incest,d6p45d5,1,t5_2qx19
8677597,0,t3_4ysj2l,Dude you should have just went and given her a hug while you were wearing that. haha. Im sure youd get your answer pretty quick.,incest,d6qbncz,6,t5_2qx19
8697874,0,t3_4z4brw,Have you done any more femdom type shit? I LOVED that story,incest,d6sv6j0,4,t5_2qx19
8702967,0,t3_4z6u73,removed,incest,d6ti5qu,6,t5_2qx19
8704636,0,t1_d6tp69d,I see.  Kiss on the lips or French kiss?,incest,d6tpp27,3,t5_2qx19
8710919,0,t3_4z6u73,Disgusting.You are a terrible person.Stop doing this apologize and go seek therapy.,incest,d6ui1rl,5,t5_2qx19
8730126,0,t3_4zku56,Nice like the story keep it up ,incest,d6wws9b,2,t5_2qx19
8743494,0,t3_4zt9c5,It appears that youve made an advice post in rincest. We recommend reading the following submissions for more general incestbased advice General Tips on Seduction of Family Members Common Questions amp Outcomes to ConsiderIf you would prefer serious responses only then you may find your post is better suited to rIncestRelationships.I am a bot and this action was performed automatically. Please contact the moderators of this subredditmessagecompose?torincest if you have any questions or concerns.,incest,d6yl8qj,-3,t5_2qx19
8754800,0,t3_4zvlbp,So she found out her Uncle was sniffing her panties and jerking off on her bed...And she still goes out with him to the park to play ball on a hot summers day? And goes for ice cream? And doesnt tell any adults?Mixed messages much? sarcasm,incest,d700aic,19,t5_2qx19
8795621,0,t3_50i8sk,Looking for an archived version of this post before it was deleted... ,incest,d7544kj,1,t5_2qx19
8838220,0,t3_50q2p3,maybe she wanted you to find nudes? ,incest,d7a89a4,3,t5_2qx19
8854389,0,t1_d7c5fe1,You seem to be under some kind of assumption that He couldnt just say Im making him uncomfortable and Id stop which I would.Or Hes  years old and is free to come and go as he pleases. If he doesnt want to be around my in skimpy clothes he doesnt have to be he doesnt live here at home anymore.But you know what maybe Ill really really really amp it up hardcore just for you you simpleton.,incest,d7c67mi,0,t5_2qx19
8912841,0,t3_52cdv3,Seems a bit too rapey for me...,incest,d7j6yoi,21,t5_2qx19
8929149,0,t3_4t6gqq,did you ever check to see if he saved this video?,incest,d7l5hft,1,t5_2qx19
8946327,0,t3_52qhq8,I just love horny women. When they are so horny they break that taboo man that gets me!,incest,d7n7syd,4,t5_2qx19
9013948,0,t3_53ogja,Sounds like everyone ready and willing! Just be sure to update us if anything happens. In full exact detail  ,incest,d7vc46s,2,t5_2qx19
9019682,0,t1_d7w0bc5,well atleast you got around to returning the favor.  points to you,incest,d7w0w5q,3,t5_2qx19
9028541,0,t1_d7x005k,While incest is can be great its sad it cannot continue on and on without major issues. I mean doesnt it sadden you that your own kids cannot experience what you experienced with your sibling?,incest,d7x374p,5,t5_2qx19
9030278,0,t3_53yfp4,uShadowKnight it looks like your post does not contain one of the approved tags. Please click here to view our tagging guidelines and resubmit with the correct tag.I am a bot and this action was performed automatically. Please contact the moderators of this subredditmessagecompose?torincest if you have any questions or concerns.,incest,d7xaozi,1,t5_2qx19
9036990,0,t1_d7y34p8,deleted,incest,d7y3ps6,1,t5_2qx19
9043753,0,t1_d7ya45l,Great advice! Thank You.  We have received a ton of messages in the last couple of days and have decided we will be posting again...  ,incest,d7ywxbf,3,t5_2qx19
9048114,0,t3_546ph6,Most awaited post.  Finally...,incest,d7zfsya,10,t5_2qx19
9074667,0,t1_d7x3lpc,Out of curiosity  do your parents know about your relationship? ,incest,d82mm23,1,t5_2qx19
9082204,0,t3_54kmqx,Nothing wrong with Baby Steps,incest,d83j7q1,2,t5_2qx19
9085696,0,t1_d83y6vh,I defiantly want to go further P But i just dont know how to do that but i know how far i wanna go...,incest,d83ycrl,16,t5_2qx19
9095146,0,t3_54sazf,Allow me to take a less popular position Do not tell your wife ANYTHING about your past with your sister. It will damage her opinion of both of you without aiding this situation in any way. You made a commitment to your wife so honor that by drawing a clear boundary with your sister  siblings only. Good luck friend.,incest,d8539zf,6,t5_2qx19
9125181,0,t3_559lwm,So are these thoughts just yours or does your wife share them now too after the fact?,incest,d88p4z1,6,t5_2qx19
9131173,0,t3_55bxti, Thats the way to do it.,incest,d89fx19,2,t5_2qx19
9139911,0,t3_55fuxy,need those deets as descriptive as possible thanks,incest,d8ajsyb,2,t5_2qx19
9157059,0,t1_d8coxu3,,incest,d8cq2d4,7,t5_2qx19
9168929,0,t1_d87dmdf,You like anal huh?,incest,d8e8a0a,1,t5_2qx19
9180883,0,t3_562jcw,It appears that youve made an advice post in rincest. We recommend reading the following submissions for more general incestbased advice General Tips on Seduction of Family Members Common Questions amp Outcomes to ConsiderIf you would prefer serious responses only then you may find your post is better suited to rIncestRelationships.I am a bot and this action was performed automatically. Please contact the moderators of this subredditmessagecompose?torincest if you have any questions or concerns.,incest,d8fqsy1,1,t5_2qx19
9194788,0,t3_569n9p,Youre an example of where patience and understanding creates the optimal outcome.  No it didnt produce hot sex stories but it did end with two happy people and thats what really counts.,incest,d8hi9oo,75,t5_2qx19
9236807,0,t1_d8mdspr,I have been trying to figure out a way to do something similar to what you suggested. I actually like your idea. I kind of want to do it in a way that is less serious and more flippant or playful. I dont want to put too much weight on it. Id rather get the point across but make it seem more lighthearted so theres less riding on her response.Youre probably right about the first part though. Its been a solid month and half since I began having these feelings and we hang out multiple times per week. Its highly unlikely that I havent given her a glance or something along those lines that makes her wonder.I know the chances of us ever having sex are pretty nonexistent. To be honest I dont even know if I would want to even if she wanted to. I mean I would want to but I wouldnt want to if you know what I mean. But if she knows I find her attractive and isnt outright repulsed by it I guess thats something positive.,incest,d8mu03h,5,t5_2qx19
9245282,0,t1_d8ntcrc,deleted,incest,d8nwnne,1,t5_2qx19
9249913,0,t3_5723dx,Dont knock anything before trying it. Cuckolding breast milk and pegging are kinda hot. Pegging is like the new high five man. ,incest,d8ohsl8,4,t5_2qx19
9258043,1,t1_d8ph4fd,Man girls like to take their time getting everything just right let the lady do her thing.,incest,d8piv4y,5,t5_2qx19
9277287,0,t1_d8rkhr8,Wow does she dress differently then befor ? And has the t still been going on ? ,incest,d8ryny1,1,t5_2qx19
9280415,0,t1_d8sbxjw,Idk gifs are being deleted by mod power. I may be the only one allowed to gif.,incest,d8scy8g,4,t5_2qx19
9281043,0,t1_d8sbaxh,Wow you gave me some good advice there thank you!I will try my best to do some of these things in the near future.Best regardsDerek ,incest,d8sftla,2,t5_2qx19
9290086,0,t3_57be5o,Im loving this a lot! Thanks for the update and best wishes amp kisses. xx,incest,d8tl2k6,2,t5_2qx19
9290705,0,t1_d8s3wd2,I will keep you all updated. I dont know if I should write an update today since not much happened even though were going to sleep in  hours that might change. Shes still away until tomorrow and while we talked about that drunk pic I dont know if its worth to read.Is lame update is better than no update?,incest,d8tnw93,14,t5_2qx19
9308208,0,t1_d8v5059,he should just kik his mom from the bathroom stall,incest,d8vvsl9,8,t5_2qx19
9314727,0,t3_580kgr,Are you going to say something eventually? Isnt it kinda odd that she does this with everyone in town sent you scared you might catch something,incest,d8wpl3p,5,t5_2qx19
9331012,0,t1_d8yhvh2,Awww holding oneself back from fapping is the ultimate compliment. Thanks for the support and will do.Zee,incest,d8yrve7,2,t5_2qx19
9337087,0,t3_5891zp,My answer is multifaceted. Ive dated many different women with strong incest fantasies. Im always very willing to try new things and this was always exciting  especially when your partner gets extremely worked up and excited. The first girl I was young she started by calling me daddy asking me to be stern and punish her.. it always ended with filling her with my daddyseed. She was so fucking hot and crazy sexy I would have done anything with her. As I got to know her better I found out that she had been a victim of pretty extreme sexual abuse. At first it was disturbing to think about how we had played but I came to understand what she needed and she needed me to give her a safe space to explore her needs.  I learned a lot about the difference between fantasy and reality and consent.  Now I can tell which women will be into it. Fast forward many years I have a young adult stepdaughter that has been teasing me flaunting her sexy body towards me. I dont have a plan to consummate the fantasy but it sure has me noticing young women again. My stepdaughter figured out I had been hooking up with a girl just a year older than her and got very jealous Im not with her mother anymore. All of it turns me on. Fd Ms and to a lesser extent siblings or cousins,incest,d8zjlg9,3,t5_2qx19
9355832,0,t3_58l3a2,To me It is obvious that your father wants to have sex with you because as you said he chose a girl about your age and took her to straight to your room but the real question is what do you want?,incest,d91x3lw,2,t5_2qx19
9390954,0,t3_586pn9,It looks like youre starting an AMA. Please make sure your post includes general background details and some information for users to base their questions on. AMAtype posts that lack detail or consist of too few sentences will be removed at the moderators discretion.I am a bot and this action was performed automatically. Please contact the moderators of this subredditmessagecompose?torincest if you have any questions or concerns.,incest,d96dc47,1,t5_2qx19
9391292,0,t1_d96e2ye,Not a God,incest,d96evmf,1,t5_2qx19
9397743,0,t3_59bvc4,This was honestly it.,incest,d978aeh,16,t5_2qx19
9401618,0,t3_599mad,Lucky boy. Look forward to reading more updates,incest,d97pz16,2,t5_2qx19
9404473,0,t3_59bvc4,I watched my older sister get dressed when we were teenagers. I would sneak put every morning and peek in through her window through the crease in her blinds and saw her naked. ,incest,d9830kb,9,t5_2qx19
9406472,0,t3_59gnow,i cant wait for the update and gosh i am already as horny as a rabbit,incest,d98c42n,16,t5_2qx19
9414434,0,t1_d98ioiy,Whoa what posting was that?,incest,d99cfsl,0,t5_2qx19
9418859,0,t1_d99v2ue,deleted,incest,d99wm00,9,t5_2qx19
9448548,0,t3_59z0eg,What anime did you watch?,incest,d9do495,1,t5_2qx19
9454442,0,t1_d9ec1pt,I agree. Thank you ,incest,d9ef1k6,1,t5_2qx19
9513132,0,t3_5a4i6a,what did the comment say?,incest,d9lp2je,1,t5_2qx19
9523297,0,t1_d8q4iwz,tbh im not gonna do anything about it i dont rly like him as a person haha. hes too weak and pathetic and i dont have time for him,incest,d9my5bi,1,t5_2qx19
9523658,0,t1_d97v5mo,And this is great for now  do you have any longterm plans for both of you? Is she interested in you sexually only? Are you ok with that? Does she thinks of the normal LTR? How will you manage your neighbours and all the normal family stuff in that case? ...and a sidenote  youre both happy and this is awesome. Thank you for letting her decide and accepting new side of your loved one. ,incest,d9mzqwq,2,t5_2qx19
