,controversiality,parent_id,body,subreddit,id,score,subreddit_id
9598354,0,t1_d9w6570,ReichenSteuer? Das momentane System ist nicht sozial genug. Wir brauchen einen hheren Maximalsteuersatz fr sehr Reiche ab .. Jahreseinkommen um  erhhen. Im Gegenzug wird der Steuerfreibetrag um bis zu  erhht. Kalkulation steht noch aus. Unternehmensbesteuerung ist ein schwieriges Thema wegen dem potentiellen Verlust von Arbeitspltzen. Ich finde aber man knnte mal ber die EEG Umlage muss allerdings zu gunsten der privaten Haushalte und zu lasten der Unternehmen gehen.Edit Genauere definition.,E_4,d9w6yzd,21,t5_3hhz0
9598454,0,t1_d9w70om,Wie willst du ersteres durchsetzen?  und  top!,E_4,d9w7eza,1,t5_3hhz0
9600573,0,t1_d9w9nz8,Da hast du vollkommen recht und ich bin vielleicht Teil des Problems. Insgesamt wird es jedoch schwer darauf zu achten nicht einfach alles zu berfinanzieren. Gibt ne Menge gute Sachen die man frdern will da kann schonmal das Geld knapp werden D.,E_4,d9wgtfm,1,t5_3hhz0
9609953,0,t3_5cl9nd, Mnnlich  Berlin  DiplInf.  Deutschpole seit  Jahren in DeutschlandBerufserfahrung IT Manager aktuell  Jahr im Mittelstand IT Consultant  Jahre im Internationalen Umfeld Selbststndig eigene GbR Cocktailbar betrieben mit  Mitarbeitern  Jahre. Freundin studierte Politikwissenschaftlerin und arbeitet in sozialen Projekten also auch von privaten aus groes Interesse an nderungen und Beteiligung ist vorhanden.Wo kannwill ich mich einbringen? IT und Integrationspolitik. berall wo Teams verknpft und geleitet werden mssen. Ich bin ein Teamplayer und arbeite gerne mit unterschiedlichen Personen zusammen. Ich denke IT wird schon stark besetzt sein bei uns wre auch machbar dass ich mich bei anderen Themen stark mache.,E_4,d9xmfqv,3,t5_3hhz0
9615660,0,t3_5cpial,Sicherheit,E_4,d9ybtd3,3,t5_3hhz0
9615674,0,t1_d9ybsi1,Orientierung an den USA,E_4,d9ybvlp,-8,t5_3hhz0
9615781,0,t1_d9ybszp,Bildung strker einbinden. Deutschkurse verpflichtend anbieten.,E_4,d9yccpc,37,t5_3hhz0
9639416,0,t1_da18sij,Die Ausrichtung der Partei steht noch nicht fest und ich sage meine Meinung zu diesem Thema. Wenn die Mehrheit das anders sieht dann ist das halt so.Ausserdem hat anscheinend niemand mal das Parteiprogramm der AfD gelesen da steht nmlich neben Mll Frhsexualisierung etc auch gutes Zeug drin wie ich gerade gemerkt habe habs eben mal grob berflogen werd ich fr alle anderen Parteien auch noch machen vor der NRWLandtagswahl und der Bundestagswahl. Es ist demgegenber notwendig zwischen politisch Verfolgten und Kriegs Flchtlingen die unmittelbar vor ihrer Einreise echten kriegsbedingten Gefahren ausgesetzt waren einerseits und irregulren Migranten andererseits zu unterscheiden. Echte Flchtlinge will auch die AfD schtzen solange die Fluchtursache im Heimatland andauert. Irregulre Migranten aber die anders als Flchtlinge nicht verfolgt werden knnen keinen Flchtlingsschutz beanspruchen. Entfllt der Fluchtgrund durch Beendigung von Krieg politischer oder religiser Verfolgung im Herkunftsland der Flchtlinge endet deren Aufenthaltserlaubnis. Die betroffenen Flchtlinge mssen Deutschland wieder verlassen. Dazu soll Deutschland im Verbund mit den europischen Partnerlndern Rckkehrhilfen gewhren.Andere Hauptpunkte die ich mir noch nicht im Detail durchgelesen habe insbesondere  Kultur Sprache Identitt und  Einwanderung Asyl vielleicht sind da noch ideologische Bomben auf der bersichtsseiteVolksabstimmungen nach Schweizer VorbildDie Gewaltenteilung gewhrleistenDirektwahl des Bundesprsidenten durch das VolkLobbyismus eindmmenEinfhrung eines Straftatbestandes der  SteuerverschwendungMindestlohn beibehaltenPflege durch Angehrige aufwertenWeisungsfreie Staatsanwlte unabhngige Richter und parteiferne RechnungshfeAngriffe auf Amtspersonen hrter bestrafenLanglebige Produkte statt geplante ObsoleszenzTextilien und Kinderspielzeug auf Schadstoffe prfenWasseraufbereitung modernisieren und verbessernSichere Kommunikation als Standortvorteil und BrgerrechtLebensmittel besser kennzeichnenBargeldnutzung muss uneingeschrnkt erhalten bleibenKinder und Erziehungsleistung bei der Rente bercksichtigenPolizei strken und Strafjustiz verbessernKeine Vollverschleierung im ffentlichen RaumFr eine zeitgeme Medienpolitik Rundfunkbeitrag abschaffenKoranschulen schlieen. Islamkunde in den Ethikunterricht  integrieren,E_4,da198s5,1,t5_3hhz0
9875504,0,t3_5gsln2,Alle Daten gehen vom Volke aus! ,E_4,daususg,3,t5_3hhz0
