,controversiality,parent_id,body,subreddit,id,score,subreddit_id
9905498,0,t1_daypbxr,Le singe mange une orange?,ImperialSim,daypk34,1,t5_3hvau
10020907,0,t1_dbdpofs,And surrender it to the Brits? Never.,ImperialSim,dbdr30i,1,t5_3hvau
10046438,0,t1_dbh2iyf,What else is there to do?,ImperialSim,dbh2rn0,1,t5_3hvau
10051388,0,t3_5jis43,The Kingdom of Spain is strictly against the Argentinian pamphlets. Argentina is no longer a colony of Spain and thus Spain has no obligation to send Spanish citizens anywhere besides Spanish territories. If any of these pamphlets are found in Spain the distributors will be arrested. Argentinian propaganda is banned from Spanish soil.,ImperialSim,dbhpz78,1,t5_3hvau
10095103,0,t3_5kexa8,uoddmanout,ImperialSim,dbnenw3,1,t5_3hvau
10163578,0,t3_5lj29m,Argentina agress to purchase  Danish Artillery pieces for the lump sum of  USD. We will send  USD to Copenhagen as a deposit on the weapons. The remainder will be paid upon the completed dilivery. We thank Denmark for this opertunity and look forward to future trade deals.,ImperialSim,dbw3j4t,1,t5_3hvau
10167763,0,t1_dbwkk61,PaellaulichSwedistanuSirBrendanSpartiuIrishBall,ImperialSim,dbwkli2,1,t5_3hvau
10214075,0,t3_5m9gnm,uhighlyoffensiveuser ulich usirbrendan,ImperialSim,dc1tn9c,1,t5_3hvau
10229745,0,t3_5mhc7b,d Votes for Historical Left  to win uRollme,ImperialSim,dc3lkdy,1,t5_3hvau
11138876,0,t3_5z1py3,upsychiko uguyfromvault upilotpenlyfe ,ImperialSim,deukwld,1,t5_3hvau
11180296,0,t1_deynfcs,it can change though just try to check every once and a while,ImperialSim,dez9vi8,1,t5_3hvau
11327991,0,t3_61nv8o,Portugal will buy the Jason and the Nahant to serve in the Portuguese East Indies for the afforementioned k dollars.,ImperialSim,dfg0bxg,1,t5_3hvau
11393655,0,t1_dfng29j,Nah otherwise I get wrecked. I prefer wrecking Montenegro. Also what you just said sounds like something that legit could happen. I mean I doubt it would take long for a war to break out. I also dont really know what else I could do because I gave him a second chance. I really have no Idea what else I could do.,ImperialSim,dfngdqd,1,t5_3hvau
11629090,0,t3_65t4iz,Great Qing,ImperialSim,dge64j9,2,t5_3hvau
