,controversiality,parent_id,body,subreddit,id,score,subreddit_id
9217634,0,t3_56m5fg,Hi uemmesbz your post was removed because the title did not include one of the required tags.Server tags currently supported are NA EUW EUNE OCE BR TR RU KR JP LAN LAS SEA CHN PBEInclude the tag somewhere in your title you can find your server by clicking hereexample NA Looking for friends NA Looking for friends Wanna duo? EUW etc.If your server is one of these Taiwan TW Singapore  Malaysia SGMY Thailand TH Indonesia ID Philippines PH and Vietnam VN please use the tag SEA.ampnbsp General Add this tag to LoL related discussions or topics.example General Need some jungling tips General Should Fiora be nerfed? etc.ampnbspWarning  Any type of advertisements must go in our Weekly Community Promotion Thread.Warning  Dont announce your gender in posts.Please get familiar with our subreddit rulesrleagueconnectwrules before posting again.I am a bot and this action was performed automatically. Please contact the moderators of this subredditmessagecompose?torLeagueConnect if you have any questions or concerns.,LeagueConnect,d8keini,1,t5_30v2b
9219018,0,t3_55feze,i added u crazy kego ,LeagueConnect,d8kktg9,1,t5_30v2b
9225804,0,t3_56owo9,add jhinnocide,LeagueConnect,d8lfsmp,1,t5_30v2b
9244592,0,t1_d8ntfyp,deleted,LeagueConnect,d8nticu,1,t5_30v2b
9273933,0,t3_57fef5,deleted,LeagueConnect,d8rjco2,1,t5_30v2b
9299279,0,t3_57sa93,IGN Cart,LeagueConnect,d8ur0nn,1,t5_30v2b
9375560,0,t3_58sibf,But your sion stat are so good o,LeagueConnect,d94f301,1,t5_30v2b
9376780,0,t1_d94csu7,Awesome I can play jungle and mid if you wish. I am interested so add me!,LeagueConnect,d94kncs,1,t5_30v2b
9415536,0,t3_595p87,Added you IGN Supp or Feeding Support Main S,LeagueConnect,d99hgnl,1,t5_30v2b
9417145,0,t3_59l018,Hey! Feel free to add me ! Some Yellow Kid,LeagueConnect,d99oso8,1,t5_30v2b
9419333,0,t3_59d2ov,Not home at the moment feel free to add Summoner,LeagueConnect,d99yrrt,1,t5_30v2b
9472803,0,t3_5agfcy,deleted,LeagueConnect,d9gq7g1,1,t5_30v2b
9526764,0,t3_5b4vii,Yo been playing for a long time. Down to play norms.IGN Lunie,LeagueConnect,d9ndidk,1,t5_30v2b
9540952,0,t3_5bk0rf,deleted,LeagueConnect,d9p4ct0,1,t5_30v2b
9554125,0,t3_5bl7mp,A new friendly and active discord server for animemanga fans and casual gamers or anything really D. Come chat with us and listen to some awesome music!,LeagueConnect,d9qqrd5,1,t5_30v2b
9582060,0,t3_5c2k2b,Ign souls,LeagueConnect,d9u6nkn,2,t5_30v2b
9598559,0,t3_5cdmn4,Gunnertaz If youre interested. Im on a lot and tend to be pretty chilled. ,LeagueConnect,d9w7vq6,1,t5_30v2b
9601323,0,t3_5ch95d,Support main ign attackdemage,LeagueConnect,d9wk5d5,1,t5_30v2b
9612731,0,t3_5clmjx,ign o zeca  retard. Everyone has to start somewhere so take it easy. I remember a long time ago when my English was as terrible as yours.,LeagueConnect,d9xys77,1,t5_30v2b
9666415,0,t3_5dhouj,deleted,LeagueConnect,da4l6o3,1,t5_30v2b
9684576,0,t3_5drcue,IGN  Lord Kevin,LeagueConnect,da6turq,1,t5_30v2b
9745996,0,t3_5dmg8z,Hey. I would love to have some fun loving and friendly people to play with and talk to. My IGN is  H Alex  I am  and Diamond ,LeagueConnect,daeen75,1,t5_30v2b
9760902,0,t3_5evn2g,Hey. My girlfriend is looking for an adc to play games with as no one really likes adc in our group. And were Dutch too!  Wanna play with us?,LeagueConnect,dag8z3k,1,t5_30v2b
9765257,0,t3_5f1ma5,Sent you an inv ingame my name is same as here  ,LeagueConnect,dags9pk,1,t5_30v2b
9810542,0,t3_5fo55h,GingerSteave,LeagueConnect,damcy59,1,t5_30v2b
9811611,0,t1_damfpx4,removed,LeagueConnect,damhowi,1,t5_30v2b
9839539,0,t3_5g6itf,added you IGN  Rare Pepe,LeagueConnect,daq45d6,1,t5_30v2b
9895207,0,t1_dax449l,exactly OP might not even know,LeagueConnect,daxdapo,1,t5_30v2b
9912389,0,t1_dazledg,This is true.. but I do have a few hours to kill so yeah. Sorry for the redundant message then!,LeagueConnect,dazlvrv,0,t5_30v2b
9919074,0,t3_5hghvi,hey my ign is  Reckning. Was p in soloduo and gold  in flex before season restarted.,LeagueConnect,db0hb9g,1,t5_30v2b
9921260,0,t3_5hj2rf,deleted,LeagueConnect,db0rjwn,1,t5_30v2b
9929333,0,t1_db1tbj1,awesome! feel free to add me ig. name is Pookiebear,LeagueConnect,db1tfpc,1,t5_30v2b
9934584,0,t3_5hrfd0,Add me if you want! IGN I Composure I,LeagueConnect,db2i2or,1,t5_30v2b
9934594,0,t1_db2i2or,I play mid jungle and support mainly. Planning to support a friend most of the season we both finished p last season. But if we get some games in and youre a good fit I can play elsewhere!,LeagueConnect,db2i4dg,1,t5_30v2b
9963640,0,t3_5fvmx9,Summoner Poopsi Max on NA server. Unranked and looking to be adopted. Currently playing mid BrandAnnie Kennen top maybe. I want to improve my laning and opportunity awareness. Id guess Im low silver at the moment. I get bored playing alone thusly I dont play often. I know Im not too good but confident I can improve Ive had my moments. ,LeagueConnect,db6ae55,1,t5_30v2b
10003398,0,t3_5ivl5n,Please add me seem like the kind of chill guy Id like to play with. Just moved over to EUW from Australia leveling a new account. IGN NungerAnyone else here is welcome to add me too.,LeagueConnect,dbbgzep,1,t5_30v2b
10016005,0,t3_5j2g6k,IGN SpaarkzI play mostly Top and ADC but would love to play if youre interested! ,LeagueConnect,dbd44cy,1,t5_30v2b
10028579,0,t3_5jalia,Hey just curious what your favorite supports are. Im slowly climbing my way back into Gold. I was Plat  in S I didnt play S because I was in Korea and by the time I came back all I could do was play placements and made Gold. This season placed in Bronze  and climbed back to Silver . My favorite ADC are in order Cait  Jinx  Ashe  Varus  Vayne  others. I enjoy playing a fairly farmcentric lane instead of a nonstop killfest but most of the time thats all up to the support anyway. If you like making love at midnight in the memes of the rift Im the love that youve looked for write to me and escape. ,LeagueConnect,dber2e3,1,t5_30v2b
10114526,0,t3_5kj2vh,IGN Venomous SpyroWas Plat  last season,LeagueConnect,dbpxj91,1,t5_30v2b
10134556,0,t3_5ka3ph,Add me! YoshKozSupport main also sitting in bronze  but silver  last season.,LeagueConnect,dbsjcn0,1,t5_30v2b
10150666,0,t3_5lcee1,deleted,LeagueConnect,dbumthg,1,t5_30v2b
10166682,0,t1_dbw8f44,I never said Gold is high but Im just saying that I played for a mere twothree weeks until I hit Gold V for the skin and then stopped playing ranked. Couldve gotten higher had a higher MMR but didnt feel like it. Plenty of people I know that havent been able to get out of Silver are now Gold or Plat because I told them to watch LCS  Streams. If you learn to play like a challenger its better than to learn like a bronzie.,LeagueConnect,dbwg6ts,1,t5_30v2b
10170300,0,t3_5lmv2b,IGN ChewingGumGirl,LeagueConnect,dbwuy6s,1,t5_30v2b
10225952,0,t3_5mccuq,add me attack on sempai,LeagueConnect,dc3638r,1,t5_30v2b
10270992,0,t3_5n1pua,Add me Blair Kai,LeagueConnect,dc89uia,1,t5_30v2b
10301452,0,t1_dcbmnej,awwww c,LeagueConnect,dcbq4a1,1,t5_30v2b
10386531,0,t3_5on7w7,Hey!  Add me on EUW Cart,LeagueConnect,dcldm7j,1,t5_30v2b
10437296,0,t3_5pgx9a,IGN Coolprit,LeagueConnect,dcr519o,1,t5_30v2b
10518826,0,t3_5ql6w6,hi if youd like to play sometime feel free to add me ignfuuka,LeagueConnect,dd0f848,1,t5_30v2b
10519554,0,t3_5qmsqt,add if you want IGN profix,LeagueConnect,dd0i72l,1,t5_30v2b
10523004,0,t3_5qko1t,Hey! IGN BigBearChildCare,LeagueConnect,dd0w9tv,1,t5_30v2b
10533586,0,t3_5h33ou,deleted,LeagueConnect,dd23jr2,1,t5_30v2b
10617694,0,t3_5ry555,Ign kyuubigan I like playing normals for fun  ,LeagueConnect,ddb4v5a,1,t5_30v2b
10640628,0,t3_5sa79h,User?,LeagueConnect,dddhzi1,1,t5_30v2b
10653421,0,t3_5s9id1,added you!! IGN babiishirley,LeagueConnect,ddeth0r,1,t5_30v2b
10662550,0,t3_5sjy5w,Add me! SynisterWolf. Im in S ended S last season and barely missed out on Victorious Maokai but I do need a duo partner so Id be down to play.,LeagueConnect,ddfreb6,1,t5_30v2b
10685911,0,t3_5svq7w,Hi uPaduke your post was removed because the title did not include one of the required tags.Server tags currently supported are NA EUW EUNE OCE BR TR RU KR JP LAN LAS SEA CHN PBEInclude the tag somewhere in your title you can find your server by clicking hereexample NA Looking for friends NA Looking for friends Wanna duo? EUW etc.If your server is one of these Taiwan TW Singapore  Malaysia SGMY Thailand TH Indonesia ID Philippines PH and Vietnam VN please use the tag SEA.ampnbsp General Add this tag to LoL related discussions or topics.example General Need some jungling tips General Should Fiora be nerfed? etc.ampnbspWarning  Any type of advertisements must go in our Weekly Community Promotion Thread.Warning  Dont announce your gender in posts.Please get familiar with our subreddit rulesrleagueconnectwrules before posting again.I am a bot and this action was performed automatically. Please contact the moderators of this subredditmessagecompose?torLeagueConnect if you have any questions or concerns.,LeagueConnect,ddi66nv,1,t5_30v2b
10719996,0,t3_5t9570,Hey! Im not Dutch but I can play a pretty good Fiora and akali if I can say so my self. My ign tangynash ,LeagueConnect,ddloseo,1,t5_30v2b
10775693,0,t3_5u4amu,what level are ya bud? ,LeagueConnect,ddrfo6i,1,t5_30v2b
10828304,0,t3_5utx5w,Hey shoot me an addIGN Nidahlee,LeagueConnect,ddwv2x1,1,t5_30v2b
10838854,0,t3_5uwl8t,ign nicodesu,LeagueConnect,ddxy8sh,1,t5_30v2b
10839498,0,t3_5uw8x1,IGN Dorkyfitzwater ,LeagueConnect,ddy0mxs,1,t5_30v2b
10866250,0,t3_5v7llw,Hey Ghasper Ive added you ingame. Dieseldodger ign ,LeagueConnect,de0ryru,1,t5_30v2b
10878249,0,t3_5vdaaa,hello if you are still on i am down ign luodog,LeagueConnect,de20ilw,1,t5_30v2b
10900911,0,t3_5vrpqz,Im totally down! I have a few games played tbh but I like playing with new friends! Im just a nice guy looking to play with some new friends since my other friends can be a little frustrating at times because theyre ultra competitive. I just want to get away from that yknow? Add me! Ign Youkai Ningen,LeagueConnect,de4cnzp,1,t5_30v2b
10966196,0,t3_5wblyg,Rngr,LeagueConnect,deb33m0,1,t5_30v2b
11014134,0,t3_5x9s47,Just by op.gging you I can tell from your stats youre a smurf if not then youre really fucking good lmao. Currently Silver I but been climbing steadily with  winrate and  win rate on my main champs. IGN  CasualRacism,LeagueConnect,degf63z,2,t5_30v2b
11028892,0,t3_5rj474,deleted,LeagueConnect,dei3ltp,1,t5_30v2b
11030609,0,t3_5xcz6j,legend of daum,LeagueConnect,deialwq,1,t5_30v2b
11042922,0,t3_5xcgts,Hi im up to play casually some normals if you want i added you.,LeagueConnect,dejp27x,1,t5_30v2b
11106507,0,t3_5yl5fc,Hi urodrigoh your post was removed because the title did not include one of the required tags.Server tags currently supported are NA EUW EUNE OCE BR TR RU KR JP LAN LAS SEA CHN PBEInclude the tag somewhere in your title you can find your server by clicking hereexample NA Looking for friends NA Looking for friends Wanna duo? EUW etc.If your server is one of these Taiwan TW Singapore  Malaysia SGMY Thailand TH Indonesia ID Philippines PH and Vietnam VN please use the tag SEA.ampnbsp General Add this tag to LoL related discussions or topics.example General Need some jungling tips General Should Fiora be nerfed? etc.ampnbspWarning  Any type of advertisements must go in our Weekly Community Promotion Thread.Warning  Dont announce your gender in posts.Please get familiar with our subreddit rulesrleagueconnectwrules before posting again.I am a bot and this action was performed automatically. Please contact the moderators of this subredditmessagecompose?torLeagueConnect if you have any questions or concerns.,LeagueConnect,deqwvp2,1,t5_30v2b
11138833,0,t1_deu6g2b,Please keep comments on rLeagueConnect in English so mods are able to moderate without having to use translation tools. Thank you.,LeagueConnect,deukqad,1,t5_30v2b
11138887,0,t1_deujwm1,Please do not post your Discord link in rLeagueConnect  if it is requested by a user do it privately.,LeagueConnect,deuky7o,1,t5_30v2b
11148169,0,t1_devi744,Accepted. D,LeagueConnect,devmsrw,1,t5_30v2b
11243330,0,t3_60g6tg,SoGosu Gold RETARDED ADC Gold ,LeagueConnect,df6ey16,1,t5_30v2b
11244999,0,t3_60f4wa,Kahaluuicehead topmidsup G,LeagueConnect,df6lr1k,1,t5_30v2b
11247685,0,t3_60i7nj,Ign DarkThief,LeagueConnect,df6wpnz,1,t5_30v2b
11279816,0,t3_60ytvs,Im not on EUW but there are  registered users from EUW on Friends of Legends. Search Server Region EUW at  youll find some friends,LeagueConnect,dfaju0n,1,t5_30v2b
11318441,0,t3_61j622,Hey! May I ask what rank you where last season? Id be up for a go if youd like. I took a break from league but was gold  last season! My IGN is Asdfklo.,LeagueConnect,dfexd8g,1,t5_30v2b
11370288,0,t1_dfknnyn,WAT really? Was it in ranked or norms? either way pretty neat to come across each other again.,LeagueConnect,dfkstvd,1,t5_30v2b
11373093,0,t3_62700f,deleted,LeagueConnect,dfl4azk,1,t5_30v2b
11434800,0,t1_dfs2kbl,deleted,LeagueConnect,dfs4g2o,1,t5_30v2b
11435669,0,t1_dfs3aqr,absofuckinglutely,LeagueConnect,dfs7zv8,1,t5_30v2b
11483074,0,t1_dfvuuik,added you ,LeagueConnect,dfxlrop,1,t5_30v2b
11505473,0,t3_63okzp,ktlinkdiamond  in solo gold  in flex.jungle main if interested. I use discord as well,LeagueConnect,dg059lt,1,t5_30v2b
11562447,0,t1_dg5clup,Anything but bot lane.,LeagueConnect,dg6lwix,1,t5_30v2b
11610056,0,t3_65nkp4,I love the post it made me smile along with your IGN. I added you Tank.,LeagueConnect,dgc0dfg,1,t5_30v2b
11621528,0,t3_65txpp,Added ,LeagueConnect,dgdb7lk,1,t5_30v2b
11624636,0,t3_65rajn,my ign is nd im down to join.,LeagueConnect,dgdnx63,1,t5_30v2b
11637204,0,t3_66251m,GingerSteave I play mostly top but Im flexible,LeagueConnect,dgf393k,1,t5_30v2b
11642389,0,t3_6656p3,ign  kadelle,LeagueConnect,dgfofl5,1,t5_30v2b
11673062,0,t3_66jzg1,Add MiwakoChan ,LeagueConnect,dgj5ou8,1,t5_30v2b
11698098,0,t3_66x036,iamjedi,LeagueConnect,dglzxo5,1,t5_30v2b
11738040,0,t3_67e0t1,removed,LeagueConnect,dgqjbyy,1,t5_30v2b
