,controversiality,parent_id,body,subreddit,id,score,subreddit_id
3546194,0,t1_cpwhjpd,effectivement cest carrment un problme.Il existe et  utilis par le parti piratefaut faire de la RampD l dessus et voir si on utilise une plateforme ou si on fait la notre. Dans le long terme il vaux mieux faire la notre. Cest ce que prconise lun des membres ici,RebootFrance,cpwhlt9,1,t5_37lq5
3547206,0,t1_cpwl9s1,Je pense que je vais utiliser le wiki du sub comme secrtariat principal. Ca permettra plus de clart. ,RebootFrance,cpwlr8y,1,t5_37lq5
3547467,0,t1_cpwlbs1,Haha jadore ta rponse! Je la comprends totalement tant moimme pass par l.Oui lcole sert  formater les gens pour les besoins de notre conomie. Ce nest pas un outil de libration dmancipation. Cest en partie d au fait quelle repose sur lautorit et la comptition et pas sur lautonomie et la coopration.Mais justement lide que tout le monde soit son propre patron cest pas du tout libral. Le libralisme cest lexploitation conomique de lhomme par lhomme  travail salariat.Chercher  construire au maximum en fonction de chacun cest lanarchismeCest pas une contradiction ce que tu dis cest juste une autre faon daborder les relations humaines. a fait quelques sicles quon y travaille.Les Pirates dil y a plusieurs sicles par exemple volaient aux tats et aux riches pour construire des communauts antiracistes et antisexistes qui fonctionnaient en dmocratie directe et partageaient les richesses.Ctait un peu de lentrepreneuriat Pirate veut dire aventurier en grec ancien de renier son tat et risquer sa vie pour un idal politique. Mais ctait pas du tout libral Ples Pirates par exemple ont invent la scurit socialeMme encore aujourdhui en France quand tu vois les commerces autogrs boulangeries ou imprimeries etc. Les gens se lancent dans le business pour survivre au systme capitaliste mais a les empche pas de militer au quotidien en parallle pour plus de justice sociale.Et dailleurs leur entreprise se donne un cadre thique  structure cooprative formation de tout le monde  tous les postes peupas de disparits dans les salaires recherche du prix juste et pas du profit tout le monde est pay pour le taf mais ya pas de profit aprs  partager entre des actionnaires.Estce que ce type de commerce est le genre dans lequel tu te reconnais ? Si a tintresse Rue avait publi un article sur une boulangerie autogre en Seine Saint Denis et ce que a donne en pratique cest pas parfait mais dj mieux que  des entreprises D.,RebootFrance,cpwmtuu,1,t5_37lq5
3552105,0,t1_cpwjhu1,Vivement le vote pour choisir le type de vote !,RebootFrance,cpx5w47,1,t5_37lq5
3552423,0,t1_cpwyjmw,a je sais et alors ?,RebootFrance,cpx777b,0,t5_37lq5
3557903,0,t1_cpxt34n,Avec les algorithmes cest pas quelques choses dimpossible. En tout cas cela sera plus utile que les algorithmes imposer par le gouvernement Franais au GAFA pour dcel des comportements terrorismes.,RebootFrance,cpxtq2q,0,t5_37lq5
