,controversiality,parent_id,body,subreddit,id,score,subreddit_id
4897630,0,t1_cubuvyn,You got that Shotty vs Arsnonal on the way ? Hungry for that one,Bootlegrapbattles,cubvvhu,1,t5_37y0o
4903775,0,t1_cucnnxi,Log into your PayPal click send money send money to calvinforhobbesppvgmail.com Thanks for the support bro it means a lot!,Bootlegrapbattles,cucnprr,1,t5_37y0o
4904333,0,t3_3hzz55,Evem though Ars acted like a Dick thats just Ars its to be expected especially when he knows hes getting killed Shotty not only stood his ground he absolutly bodied Ars if anyone doubted shotty they sure wont after seeing this battle!!!,Bootlegrapbattles,cucq8k7,7,t5_37y0o
5084466,0,t1_cuyqye7,Send me a PM and we can sort this out,Bootlegrapbattles,cuyvdl6,1,t5_37y0o
5139110,0,t1_cv3uys2,Gtfoh...cmon..u serious...wtf i miss here? Daylyt in  top tier..not mine but...still.. alot.. E.Farrell ....i cant see right now i must be rlly fucked up....hmm but im not so huh..wtf....i gotta see this go e. Farrell. ..that call out i thought was a fkn JOKE. Yeah! ,Bootlegrapbattles,cv5ge7j,1,t5_37y0o
5220405,0,t1_cvezzwb, got itttttttttttttttt! its lame but for now it will work,Bootlegrapbattles,cvf9183,0,t5_37y0o
5476177,0,t3_3q2xes,can I get a pm with the link? would be much appreciated,Bootlegrapbattles,cwbmsp9,1,t5_37y0o
5678108,0,t3_3svdrh,ty for the link bro keep up the good work!,Bootlegrapbattles,cx0xbmq,1,t5_37y0o
5690809,0,t1_cx2fovv,Thats my favorite bar of the whole event so far. Glad Frescos back,Bootlegrapbattles,cx2i0qo,3,t5_37y0o
5895524,0,t1_cxsfdcv,The event was like  days ago. Deaddddd,Bootlegrapbattles,cxsfr48,1,t5_37y0o
5895582,0,t1_cxsfwbx,PatHollow was official released today. Not sure if the others are getting released but theres some on yt. ,Bootlegrapbattles,cxsg0z7,1,t5_37y0o
6111018,0,t1_cydg2gq,yes what ??,Bootlegrapbattles,cyk9dlk,1,t5_37y0o
6898869,0,t3_49uiaf,Anyone have pass vs bishop link... ,Bootlegrapbattles,d0yb00u,2,t5_37y0o
7206596,0,t1_d1x4ebt,Soul Vs Ness LeeWatch Souls third round there and let me know what you think,Bootlegrapbattles,d1xbzgj,1,t5_37y0o
7614101,0,t1_d37l569,Pm me too please ,Bootlegrapbattles,d37ombm,1,t5_37y0o
8381689,0,t3_4ufh0h,I am also very eager to see this,Bootlegrapbattles,d5p9cn5,1,t5_37y0o
8407959,0,t3_4urz5g,HA GOTEM,Bootlegrapbattles,d5sjgie,1,t5_37y0o
8731703,0,t3_4z6sv0,Took me  whole minutes to understand ShuffleT vs Raptor was like.. the main event people paid to see.Regardless its amazing to see you back homie as always mad props and appreciation to you dude sucks you gotta come back to see all the bullshit people been saying like your ass cant go camping or enjoy the fucking summer.,Bootlegrapbattles,d6x3xew,2,t5_37y0o
11257553,0,t3_60okps,The Video?,Bootlegrapbattles,df80ywq,1,t5_37y0o
11261475,0,t1_df85ei7,Have you tried Vidzi or The Video?,Bootlegrapbattles,df8gzhc,1,t5_37y0o
11516533,0,t3_6494vs,Oh my Yes please bro need need need that!,Bootlegrapbattles,dg1efgh,1,t5_37y0o
