,controversiality,parent_id,body,subreddit,id,score,subreddit_id
2467543,0,t3_2nr6d8,Rent one get one free  TTNMX ,Redbox,cmgos94,0,t5_2rk29
3436881,0,t3_2z1wnq,USE THIS CODEQJZRTR by   p.m,Redbox,cpk1356,1,t5_2rk29
4310644,0,t3_2z1wnq,Expires Sunday June stMMKWZDWMTW,Redbox,csbjb2p,1,t5_2rk29
5104900,0,t1_cv1bajw,There is no misunderstanding the charge didnt go through according to the redbox rep. But the issue is solved ,Redbox,cv1bx6g,1,t5_2rk29
5276906,0,t3_3n83ra,Ill playRedbox Use code V?DH for  off any  discs. Exp pCT.  use onlineat the box. Text STOP to cancel.?  number of vowels in the alphabet not including that silly Y,Redbox,cvm6nzk,1,t5_2rk29
7245554,0,t3_4elrmr,Somebody can use mine URLJ,Redbox,d21rn9q,1,t5_2rk29
9660964,0,t3_5ddhe7,Used.   Thx!,Redbox,da3wzj8,2,t5_2rk29
9832364,0,t3_5g3f7y,Used SNSQKT. Thanks a lot!,Redbox,dap6fuy,1,t5_2rk29
11508325,0,t3_6492j7,they should have cameras on redbox machines like they do on ATMs.email a picture of the person returning the empty box to the credit card holder and say BUSTED,Redbox,dg0gxnt,3,t5_2rk29
11517349,0,t3_64dxuq,Here is another CPAZDHR,Redbox,dg1hrcs,2,t5_2rk29
