,controversiality,parent_id,body,subreddit,id,score,subreddit_id
101159,0,t3_1v8h2c,deleted,EverythingScience,cepy4ul,6,t5_2zlwp
120340,0,t3_1vg5he,This is awesome! Do you make these?,EverythingScience,ces4u8j,1,t5_2zlwp
155932,0,t1_cew6jzn,I disagree.  You can find people anywhere...grocery store coffee shops professional conferences parks.  The fact that he ended up with another UCLA student kinda makes my point.  If he had spent his time going out and doing things instead of holing up in his cubicle he could have met many people esp. on a college campus.,EverythingScience,cew6xel,1,t5_2zlwp
234472,0,t3_1wqjtd,gt its just as much a distortion and misrepresentation of Christianity as it is of science.Yeah this part makes me sad as well. Because no doubt there are a lot of mainstream christians who have no problems reconciling scientific truths with religious beliefs  and theyre getting increasingly marginalized and sidelined in favour of this ultraliteralist way of thinking so much so that previously rational and forward thinking people are being swept up in this charade and slowly have their skepticism and rationality worn down in favour of groupthink and nonsense.,EverythingScience,cf51wp3,9,t5_2zlwp
255535,0,t1_cf78o3a,Yeah its sad. His jokes are really not landing. ,EverythingScience,cf78pg5,272,t5_2zlwp
255758,0,t1_cf79clm,deleted,EverythingScience,cf79jl4,1,t5_2zlwp
255811,0,t1_cf79e5i,Shutup and take my money!,EverythingScience,cf79qrk,1,t5_2zlwp
256181,0,t1_cf7b3w9,now put it back,EverythingScience,cf7b4oj,5,t5_2zlwp
256688,0,t1_cf798gb,deleted,EverythingScience,cf7d10m,0,t5_2zlwp
256692,0,t1_cf7cu0k,It definitely loosened up when they got past the minute presentations. ,EverythingScience,cf7d1ka,2,t5_2zlwp
257015,0,t1_cf7e5hb,That a problem?  But youre not looking hard enough.  Theyre mostly at the bottom.,EverythingScience,cf7e95l,1,t5_2zlwp
257030,1,t3_1wzxeq,Im kind of disappointed Bill Nye is even doing this debate. Things like this polarize both sides and dont foster any deeper understanding in anything. Religion demands science to exist and there is harmony between the two. Where that harmony is should be the focus not pitting one side against the other to flex muscles.,EverythingScience,cf7eb6k,-1,t5_2zlwp
257092,0,t1_cf7e8if,You assume incorrectly. In my opinion a scientist is required to have as open of a mind as possible. If evidence supports the striking down of evolution as the dominant theory as to how we came to have this form then any good scientist should be open to that possibility. Anyone who calls themselves a scientist and denies the possibility of the existence of any piece of evidence regardless of whether it supports their claims or ideas is in my opinion a hypocrite. ,EverythingScience,cf7ejj7,1,t5_2zlwp
257119,0,t1_cf7ejfc,Oh theres that complication too P,EverythingScience,cf7en64,1,t5_2zlwp
257125,0,t1_cf7el40,Dont young earth creationists the one who used their lifetimes to get k years believe in a literal translation of the bible?  These are not mythical people they are real according to the bible.,EverythingScience,cf7enz8,6,t5_2zlwp
257194,0,t1_cf7dtty,Oh! Sorry for the misinterpretation. ,EverythingScience,cf7ex9p,1,t5_2zlwp
257364,0,t1_cf7dwuw,Humans are very rational but they blind themselves for comfort.,EverythingScience,cf7fk6g,1,t5_2zlwp
257369,0,t1_cf7at2y,I really dont know how Bill held it together. Theres no way I couldve handled it so professionally.,EverythingScience,cf7fkup,3,t5_2zlwp
257400,0,t1_cf7c81u,This is why Bill always and frequently referred to Ken Hams Creation Model and not the Biblical Creation Model or the Christian Creation Model in order to keep Hams crazy completely separate from more moderate Christians.,EverythingScience,cf7fp1e,7,t5_2zlwp
257413,0,t1_cf7dac3,deleted,EverythingScience,cf7fqsg,93,t5_2zlwp
257497,0,t1_cf7fh8w,When I say reformists I mean JewsIsrealists who have deviated from or reinterpreted the Torah. People that were warned by a prophet like Moses Ezekiel etc to repent their wicked ways and come back to God that is a fundamentalist view. Inevitably when those in power refused they were hit by plagues a disaster brought on by Gods wrath like at Sodom and Gamorrah or Jericho or a foreign army who won because God wasnt protecting the Isrealists and guaranteeing victory.History is written by the victors and the victors here were conservatives and traditionalists so naturally the reformists were often described as hedonists debauchers lairs traitors and murderers. Naturally these prophesies were written after the fact to fit the events and given as examples as why you shouldnt deviate from a devout and fundamentalist path.,EverythingScience,cf7g24g,1,t5_2zlwp
257577,0,t1_cf7g6vr,To be  honest I hadnt even heard of Ken Ham until a little over a month or so ago when I first heard about the debate. Im a pretty serious atheist but I was genuinely interested in hearing someone halfway decent evidence to support his theory of Young Earth Creationism. Im just a little disappointed. But the more Ive researched Ken Ham the more i realize that hes a moron. ,EverythingScience,cf7gcwn,1,t5_2zlwp
257608,0,t1_cf79o5t,I think he is preventing that. He didnt attempt to question the veracity of the bible. Instead he emphasize that proof and evidences is needed for a theory to stand in scientific world. Like a true man of science he didnt outright said that creationism is false but mentioned that no evidence supports it and all known proof and evidence  shows otherwise. He even mentioned many times that a lot of religious spiritual people that are scientist and believe evolution is the most viable theory now. ,EverythingScience,cf7gh2y,2,t5_2zlwp
257613,0,t1_cf7b423,I dont think he did that. He himself clearly said that there was probably selective pressure from parasites or pathogens which effected eyes. ,EverythingScience,cf7ghr4,1,t5_2zlwp
257643,0,t1_cf7f47z,How is that any less of a cop out answer than what Ham said? Not saying one side is right or wrong but I always hate debates like this because it always comes down to both sides not having all the answers and thinking they won because of it.,EverythingScience,cf7glsu,-11,t5_2zlwp
257647,0,t1_cf7c2vz,Dont touch yourself at night or youll reproduce asexually like some sort of heathen. ,EverythingScience,cf7gmcc,3,t5_2zlwp
257664,0,t1_cf7egai,Dont you see though now its just your word versus his instead of his versus Nyes. If it were you who were debating Nye a Ken Ham would be sitting here saying thats not what Christianity is about ... etc etc. Its this internal contradiction of interpretations that completely rapes the bibles credibility as a source of defining any actual truth.,EverythingScience,cf7gomy,1,t5_2zlwp
257722,0,t1_cf7gryk,Salright glad I could share a bit of my knowledge with the word. I took a semester of Evolution in college and boy those guys have worked just about every related concept tied together into a mathematical framework.,EverythingScience,cf7gwgq,2,t5_2zlwp
257839,0,t3_1x1452,Ham just loves the word hijacking...,EverythingScience,cf7hca0,2,t5_2zlwp
258017,0,t1_cf7e41c,Actually what frightens me even more given how much of my time Ive dedicated to studying North American and European religions and mythologies is how little he actually knows about his own religion he either misquotes misinterprets or misrepresents the bible almost every time he opens his mouth.This frightens me because the last time doing so gained a popular voice was before the last round of witch hunts.,EverythingScience,cf7i0g9,3,t5_2zlwp
258038,0,t1_cf7bz68,You left out an important partgt In continuity with previous twentieth century papal teaching on evolution especially Pope Pius XIIs encyclical Humani Generis  the Holy Fathers message acknowledges that there are several theories of evolution that are materialist reductionist and spiritualist and thus incompatible with the Catholic faith. It follows that the message of Pope John Paul II cannot be read as a blanket approbation of all theories of evolution including those of a neoDarwinian provenance which explicitly deny to divine providence any truly causal role in the development of life in the universe. You do understand dont you that neither the Big Bang nor evolution require the presupposition of a prime mover or engineer as the Catholic church does? ,EverythingScience,cf7i3b5,1,t5_2zlwp
258098,0,t1_cf7g137,You put it far better than I could.,EverythingScience,cf7ibh2,1,t5_2zlwp
258150,0,t3_1x1452,The victor is made obvious when Ham sulks to the back and off the stage and Bill sticks around to shake hands and greet the spectators at the end of the debate.,EverythingScience,cf7iijl,1,t5_2zlwp
258165,0,t1_cf7bc4j,deleted,EverythingScience,cf7ikkn,1,t5_2zlwp
258365,0,t3_1x1452,It hurts listening to Ham attempt to make me dumber.p.s.The whole crowd looks like Creationists. I dont know what that means but they just do. So many fat white bald people,EverythingScience,cf7jbv4,3,t5_2zlwp
258460,0,t3_1x1452,I gotta say if I had to pick a winner it would be Ham and it pains me to say so. The reason being is Ham uses arguments like you werent there so you dont know while we have documentation and It is possible physical laws might have change at some point. There really isnt a good model that says the laws have stayed constant though it seems obvious to me. That and Nye failed to follow up and force Ham to answer questions about the links from Homo erectus onward. Anthropology could have been his greatest tool. I think there are better debaters for the side of evolution than Nye who argue creationists who are not broken records.,EverythingScience,cf7joy1,-3,t5_2zlwp
258819,0,t1_cf7cw4d,Awesome so we can just strike that whole a man who lies with a man thing as no longer relevant.  ,EverythingScience,cf7l2nn,1,t5_2zlwp
259074,0,t3_1x1452,Main point was that Ken Ham wasnt willing to change his viewpoint with new evidence while Bill Nye was. That was the end of the debate game over.,EverythingScience,cf7m1dp,4,t5_2zlwp
259235,0,t1_cf7ldpm,deleted,EverythingScience,cf7mn38,1,t5_2zlwp
259615,0,t1_cf7na2d,I dont disagree the big issue here is that creationist want creationism taught in science class.  If they wanted it taught in religious studies people wouldnt be concerned.  They want to inject their beliefs into a domain where they dont belong. As in the enemy atheist wouldnt be attacking them if they would stay out of the science classroom and out of legislating their beliefs on others. ,EverythingScience,cf7o25j,3,t5_2zlwp
259956,0,t1_cf7ost0,gtassuming Synetics is well versed in particle physicsQuarks and atoms exist.  We have measured them.  We have measured hadrons in our accelerators and measured particles that have certain characteristics which we name quark of various flavors and colors and such.Nobody has proof of the very first quark.  There are no observations of the very first quark to pop into existence as the rapidly expanding universe coalesced into minute subatomic particles.  I would have named the first quark Steve but again I wasnt there to witness it.  Quarks currently exist and we can say with some certainty that if they didnt exist or if they hadnt existed billions of years ago as the universe cooled then things would be much different than they currently are.  We can examine the distribution of stars in the sky how fast they move away from or towards us and measurements of the cosmic background radiation and draw inferences of how the universe arrived at its current state and how long it took to get here.   The thing is the standard model our current understanding of subatomic particles is a theory.  When a scientist says theory they mean a set of rules and principles extrapolated from a large body of measurements which holds up under rigorous analysis.  They do not say it is truth.  They merely say This works for now.  If we get new data we will reevaluate our answer.  They do not mean I guess I think it works this way so thats the answer and it is intransigent and always THE answer.  In fact scientist have identified numerous problems with the standard model such as antimater matter symmetry dark energymatter etc etc.  We know its flawed we accept that but for now it is the best answer we have.  ,EverythingScience,cf7pbz2,2,t5_2zlwp
260072,0,t3_1x1452,The only thing that I found interesting that Ham said was about the Species on the Ark.Bill was trying to put it into perspective.  How could there be that many species male and female on the ark with  zookeepers food etc.Hams explanation was that Bill was confusing Kinds with Species.  For example you have a KIND of dog.  But several different species.I found that interesting ... because Ham is twisting the story from the bible to fit his belief.Hes taking the Bible to be  factual truth ... but twists the stories to fit his Model of Creationism. Or ... am I totally off base?,EverythingScience,cf7prjk,2,t5_2zlwp
260424,0,t1_cf7o25j,On that I completely agree. ,EverythingScience,cf7r2vo,2,t5_2zlwp
261419,0,t1_cf7ufhd,I think you and the people downvoting me are being extremely biased here.  There is no such thing as undeniable proof since any example you offer could conceivably be deceptive or misinterpreted.  If Ken Ham told you that Gd descended in all His glory and told him the world was indeed  years old you would mock him  but you offer that as an example of undeniable proof which you would expect him to accept if it were in favor of your argument?  You arent being intellectually honest here you just like the idea of seeing him squirm because you dislike him and consider his position to be flawed.  Hypothetical questions which are based on illogical concepts like undeniable proof have no place in a scientific debate.,EverythingScience,cf7usm7,0,t5_2zlwp
261569,0,t1_cf7u3qt,All of this gets back to my original assertion that you should be able to draw the same biblical conclusions without using the bible if they were true.,EverythingScience,cf7vcqv,1,t5_2zlwp
264271,0,t1_cf84030,I believe him you dont. In the end the truth of the debate is more important than the truth of Ken Hams beliefs. ,EverythingScience,cf85gdn,1,t5_2zlwp
264431,0,t1_cf85j01,Edens location is indeterminate but we know it lay in the area of the Fertile Crescent. This area stretches from southern turkey to northern Saudi Arabia and from the Mediterranean to the Persian gulf. This area is only around one thousand miles from where the earliest human skeletons are found. However due to the fact that the dry plains of Africa are much better at preserving remains than the moist grounds of a flood plain the only thing we know for sure is that the remains found in Middle Africa or SubSaharan Africa are the earliest human remains. This fact does not prove that these were the first humans.,EverythingScience,cf861wn,2,t5_2zlwp
264884,0,t1_cf851ln,Just have the background music slightly quieter on your video ok?,EverythingScience,cf87qzc,5,t5_2zlwp
267319,0,t1_cf7frpv,As evident by the response to Hams hilarious bible jokes. ,EverythingScience,cf8guhr,1,t5_2zlwp
309272,0,t3_1xmh93,I like to think Bill Nye changed the future complexion of society and Earth that day.,EverythingScience,cfcto4v,2,t5_2zlwp
319676,0,t3_1xr8qp,This is such an amazing story and such a leap for science. I just wish people who dont know what theyre talking about would stop saying that this will be the next Chernobyl pollute the world with radiation etcetera.,EverythingScience,cfdwjsd,2,t5_2zlwp
351189,0,t3_1y3p6g,Shouldnt discussion like this across different fields like this be the whole point of Congress? Or at least some body similar to Congress a body thats a collection of todays fields. Neil DeGrasse Tyson touched on this. Theres no scientist engineers doctors teachers or anything at all in congress. Its just a collection of every states lawyers.,EverythingScience,cfh62h7,56,t5_2zlwp
422775,0,t1_cfokl1d,by the way it WAS called global warming almost exclusively back in the mid s when this hit the public conscience.Al Gores book was actually called  An Inconvenient Truth The Crisis of Global Warming so dont give me your nonsense ,EverythingScience,cfol3i7,-2,t5_2zlwp
423050,0,t3_1ywo9p,gtThe first group The Alarmed is made up  of the public. They believe climate change is an urgent problem but have no clear idea of how to fix it.The second group  is The Concerned. They believe climate change is a problem but think its more about polar bears and tiny islands than a problem that directly affects them.The third group The Cautious  are people on the fence. They havent made up their minds whether global warming is real or if its a manmade problem.The fourth group The Disengaged  doesnt know anything about climate change.The fifth group The Doubtful  do not think climate change is manmade. They think its natural and poses no longterm risk.Leiserowitz says its the sixth group The Dismissives that is the most problematic even though it comprises just  of the public.So  of Americans are disconnected from the science of climate change or deny it? I am pretty sure more than  understand climate change at even a basic scientific level. This is a lowblow.edit formatting ,EverythingScience,cfom4ca,3,t5_2zlwp
443622,0,t3_1z50as,I feel that this should go without saying.  Diabetes kills more people than breast cancer and AIDS combined.  Its affects the lives of more people than likely any other disease out there.  But Im glad you posted it because so so many people dont know this.,EverythingScience,cfqqvmv,2,t5_2zlwp
445348,0,t3_1z5m05,deleted,EverythingScience,cfqxbry,1,t5_2zlwp
496393,0,t1_cfvurhq,Its not that hard to build this type of fusion reactor. Its called a fusor I saw one demonstrated at DragonCon a couple years ago. Make Magazine published instructions recently their November issue I think. The hard part is getting your reactor to produce more energy than it consumes. Nobodys managed that yet and its been proven impossible to do it with fusors.,EverythingScience,cfwoz8e,1,t5_2zlwp
501601,0,t3_1zta4s,One of the most interesting things I found in the article was that the author of the study took the behavior of the cockroach to be possible evidence of the existence of free will.,EverythingScience,cfxaaj6,1,t5_2zlwp
503310,0,t3_1zvxfj,gtThe walls in question would be  metres high and as long as  kilometers.That doesnt seem like a realistic project to me..,EverythingScience,cfxha2m,4,t5_2zlwp
546450,0,t1_cg27msk,Im not sure that its a good thing. Theyre breaking the law punish them accordingly. The job of a police officer is to enforce the law not create it.,EverythingScience,cg2dyyu,4,t5_2zlwp
560385,0,t3_20jq47,Good video but he doesnt seem to like cats. Get the rope.,EverythingScience,cg3z0ed,3,t5_2zlwp
570192,0,t3_20mu9w,deleted,EverythingScience,cg533mi,1,t5_2zlwp
601043,0,t1_cg8jbjd,I think the problem is  along with a lot of philosophy  you seem to conflate the idea of us perceiving that a thing exists  and the thing existing without something to perceive it.  The ideas of what things are in our minds is a construct that minds make to imperfectly match what we think we perceive with what is actually in the world.  We construct our personal impression of reality  but our construction is not a real thing.  Im reading the rest ,EverythingScience,cg8lbmq,1,t5_2zlwp
619802,0,t3_2183lw,this comment section has turned into an aethiest circle jerk fedorabutter churn.People come to the comments for insight. The fish has  legs does that still count as standing?,EverythingScience,cgaq0h8,0,t5_2zlwp
622562,0,t1_cgauyvo,deleted,EverythingScience,cgb1auj,3,t5_2zlwp
678783,0,t1_cgh9nch,Indeed. If it was something like Look at how stupid my fundy aunt is! then Id have a problem. This in itself is fine as far as Im concerned. Hes only posting what he wrote and the screenshot gives context.,EverythingScience,cghff6p,8,t5_2zlwp
715265,0,t3_22c8dt,These images are too large for what they contain.  .mb is too much for something thats basically a little text and lowinfo images.,EverythingScience,cglkuzd,0,t5_2zlwp
723638,0,t3_22fngg,In some cities  Univision is the highest rated channel.  I would be curious to see how accurate their coverage is.,EverythingScience,cgmj4ip,15,t5_2zlwp
732005,0,t3_22jhiu,Autism believed to occur during developmentLack of vaccination has lead to more deaths due to whooping cough In its fortnightly Communicable Disease newsletter PDF Oregon Public Health officials note increasing cases of pertussis whooping cough in infants with  hospitalizations noted in the  year period ending March  and at least  deaths since . Most cases are attributed to lack of vaccination with  of those due to parents declining the vaccine. Most of our cases are occurring in under or unvaccinated children so getting these kids vaccinated seems to the most obvious approach to reducing illness. In principle... pertussis could be eradicated but we have a long way to go.This is my favorite one.  Rub it in his faceAlso tell your friend to look up something known as herd immunity.  Hope this helps.  Everyone can use a little more education.  ,EverythingScience,cgnhe4i,14,t5_2zlwp
736784,0,t1_cgnqq4o,To a person who believes in a vast conspiracy no evidence is sufficient to convince them they are wrong sadly.,EverythingScience,cgo0y9d,3,t5_2zlwp
757287,0,t3_22sk3s,What are they basing this on exactly? Is it somehow relatively more difficult or less accessible for him to interview the same figures on Late Night? Just seems like senseless shitstirring.,EverythingScience,cgqczbf,4,t5_2zlwp
785887,0,t3_234cjp,Here is a more detailed explanation of the replication process with more simplified visualization.,EverythingScience,cgtly5y,5,t5_2zlwp
862341,0,t3_2407lq,Just two minutes but really cool. ,EverythingScience,ch2axxi,1,t5_2zlwp
876144,0,t1_ch3ql63,Do you know any article or more information on this?,EverythingScience,ch3vds5,1,t5_2zlwp
882796,0,t3_248ivc,Will greatly enhance work in largebrained organisms like rats and primates,EverythingScience,ch4ml2f,1,t5_2zlwp
917910,0,t3_24meke,Youtube link to avoid the horrible businessinsider site.,EverythingScience,ch8metn,22,t5_2zlwp
949725,0,t1_chbx8nk,All the money in the world wont get us there that quickly.But if China were to say they were going to be there by  wed kick into gear and be there by . ,EverythingScience,chc8pdg,2,t5_2zlwp
957105,0,t1_chcy17a, Have you heard of CASIS? They dont do exactly what youre describing but they do something similar. I still think you need a plan for programming. I think youre on the road to this however by wanting to do outreach and so on. Again however why would somebody want to donate to your organization? Why impact do you think you could make with their money? Consider looking at Friends of type organizations such as Friends of the Library whereever you live. Those organizations usually exist as a nonprofit whose sole purpose is to support a governmentrun organization. They usually raise money to help the libraries buy books or other materials. You probably have a nonprofit association in your state that would be willing to help you out as a startup nonprofit. I used to work for one and we had startup packets that wed send out to whomever was interested.I hope this is helpful!,EverythingScience,chd2xvu,1,t5_2zlwp
957209,0,t1_chcr6kg,Its quoting carl sagan,EverythingScience,chd3d8s,3,t5_2zlwp
1040978,0,t3_260cvk,It is likely Porfiri says that the drunk fishs uninhibited behavior is perceived as a boldness trait thus imparting a high social status.Sounds like high school.,EverythingScience,chmm3mi,1,t5_2zlwp
1055965,0,t1_chobdgl,All that makes sense as far as it goes.But if a competent human adult is nevertheless a willing test subject by what right is it ethical for anyone else to say No! and impose their personal ethics onto others.,EverythingScience,chobgdn,2,t5_2zlwp
1059891,0,t3_268wxg,Video about searching in a remote valley in Colombia for the elusive and poisonous superfrog. ,EverythingScience,chorijq,1,t5_2zlwp
1060661,0,t1_choc5yc,I work as a discovery scientist for a major pharmaceutical company please dont kill me. Safety issues should have been identified in Phase  thats pretty much the point of phase  studies. The trial was probably ended due to a lack of efficacy. The reason this is weird is because you shouldnt go into phase  if youre unsure of the efficacy thats what phase  is for. This really is an unusual move but Im sure there is a reason. My guess is either they found out about some longer term safety issues or they missed a massive efficacy benchmark they thought they could had already hit. Hopefully not the former but the latter means somebody royally fucked up and cost Merck millions.,EverythingScience,chounwh,7,t5_2zlwp
1253656,0,t1_cialzvz,The post yes. The comment no.,EverythingScience,ciangot,1,t5_2zlwp
