,controversiality,parent_id,body,subreddit,id,score,subreddit_id
1835053,0,t1_ckaakeu,One more! These were the perfect bungees for reinforcing the monkey hut The way it works is that you remove the carabiners from the ends. Hey free carabiners! Then the loops are the right size to fit over the stakes assuming youre using the smoothish cement stakes from HD rather than rebar I dont know how well rebar does or doesnt work havent tried it. So you slip them down over the stakes youve pounded in for the hut then put the PVC over the stakes then once the hut tarp is on throw rope over the top tie to the middle on one side pull a bunch to tighten down and tie on the other side. It made our hut really solid in the wind. A little expensive to get  of them but at least we got carabiners out of it too ,BurningMan,ckabi5p,1,t5_2qj68
1835118,0,t3_2fl0xb,tldr Stole a sign got yelled at.  They really are just like us after all.,BurningMan,ckabsbp,5,t5_2qj68
1842024,0,t1_ckb5ibj,Fuck your burn.,BurningMan,ckb5sce,-14,t5_2qj68
1843073,0,t3_2fom93,I thought this was to appease the people waiting  hours at Will Call?,BurningMan,ckbac15,2,t5_2qj68
1843671,0,t3_2fluad,I had the wonderful opportunity Wednesday ? night while out at the trash fence to meet a man named Timothy. When I asked him how many burns he had been to he just smiled and said I was at the second Burning Man.This being my first Burning Man that idea just blew my mind. Standing before me was a man who experienced Burning Man while it was still on the beach. While it was still an infant. Barely a cohesive idea. Before I could stop myself questions were flying from me. What was it like? How has it changed? Do you like what Burning Man has become?The answer I received surprised me and filled me with joy. Its become more than I could ever imagine and I love it. I expected at least something negative about present day Burning Man. Of all the people I expected jaded snarkiness from it was him. He showered nothing but positives though.Its true that Burning Man has changed. I dont have to be a veteran to figure that one out. Change doesnt have to be a bad thing though. Change is growth. Without growth things become stagnant and die.The opportunity to talk to Timothy stands as one of the highlights of my burn this year.Edit  Apparently Im just easily amused. Oo,BurningMan,ckbcx3z,2,t5_2qj68
1865448,0,t3_2fxh5m,Well shit. ,BurningMan,ckdzbmy,1,t5_2qj68
1870362,0,t1_ckek79g,Ditto ,BurningMan,ckeklpr,1,t5_2qj68
1872727,0,t1_ckercba,Im making a bunch of those shirts for next year. THANK YOU for the idea.Perhaps I should have camped on K.  which is a nice double entendre and also implies Im a billionaire.  XD,BurningMan,ckeuuxy,2,t5_2qj68
1875506,0,t1_ckewtss,Yeah i heard about that story when I dropped by! You guys rock!,BurningMan,ckf6wpk,2,t5_2qj68
1878247,0,t3_2g0rkk,deleted,BurningMan,ckfisu2,1,t5_2qj68
1879634,0,t1_ckfnp2a,First decide how much money you want to put into it. Good shade structures are pricey even if you build it yourself. Plus you need to transport it and store it from year to year. The last time I built a large shade structure was almost  years ago so Im not up on the latest in playa building technology. To start Id recommend checking out photos online until you find one you like. You should be able to get a name to search for. Odds are there is at least one blog covering the care and feeding of that sort of structure. Itll also give you a better sense of what questions youll need answered. ,BurningMan,ckfotcc,1,t5_2qj68
1887538,0,t1_ckgmyjn,No this was near the Last Outpost.gt sort of near the terrifying escaped lab experiment piece,BurningMan,ckgn24r,2,t5_2qj68
1891438,0,t1_ckem03y,probably the nicest picture Ive seen hope you dont mind but I posted it to my Facebook and linked to this link.,BurningMan,ckh3yhx,1,t5_2qj68
1894258,0,t3_2g1sip,The Last Outpost! really awesome for how little funding they got.,BurningMan,ckhg5kx,3,t5_2qj68
1897375,0,t3_2gbty5,Yep. Only requires some fairly basic though highpower laser show equipment. I was a bit intoxicated and wondered all the way to the trash fence before realizing it was on the mountain.,BurningMan,ckhto0s,3,t5_2qj68
1903512,0,t1_ckijbhj,events are listed by genre in the WWW guide? how have i missed this? its been split up by onetime and reoccurring events for so long i guess i havent looked closely in recent years. thanks!,BurningMan,ckik8de,1,t5_2qj68
1907253,0,t3_2gh1mh,I came back feeling very motivated. I have thought about a few things for a long time but never had the motivation to do them. Within a few weeks of getting back I have submitted an offer to buy a house asked for a raise and more time off to spend extra time volunteering at burning man. I started the  item challenge in an effort to ride myself of some material possessions which have been weighing me down for years.I have been thinking about doing these things for a while but I guess I was content enough not too but the work into it. But now I feel like I have to keep making progress if I am going to become a person with something valuable to contribute to the human experience not just burning man.,BurningMan,ckj0fzk,3,t5_2qj68
1908709,0,t1_ckj45e5,deleted,BurningMan,ckj6qz6,1,t5_2qj68
1914204,0,t1_ckjlbpz,And there will be an infinite supply of such people who wont have read up on it and wont predict the inevitable bad time and wider effects on event.So if anyone wants to stop or change this phenomenon more will be required than calling out the sherpas as the engine  complicit..,BurningMan,ckjukl1,8,t5_2qj68
1915439,0,t1_ckjzpem,Im not.  When I read her article there was one picture in it of the sign advertising for her replacement. It named the camp. ,BurningMan,ckjzxez,1,t5_2qj68
1922843,0,t1_ckke2o4,Kalliope was awesome when circled around with the others badass show. The lights were extra bright I think they were like twice as bright as anything else out there. Were they LEDs and were they doubled or tripled up to get that bright?I even stayed through a DnB set just to watch the setup. Congrats.,BurningMan,ckkw0hv,1,t5_2qj68
1941579,0,t3_2gu9nx,I LOVE CHARLIE! I camped with him last year! Such a great guy!,BurningMan,ckn5paa,2,t5_2qj68
1942287,0,t1_ckn0r9a,Aaaah  meetings like this is what makes this family special! ,BurningMan,ckn8tlw,2,t5_2qj68
1946393,0,t3_2gxl1l,Nice! Thank you! ,BurningMan,cknqqql,1,t5_2qj68
1969676,0,t1_ckqjddm,The idea is to transfer energy from the US west coast regions into the international regions. But yeah I doubt it could ever work  just like I doubted the souk would actually happen. ,BurningMan,ckqjp09,1,t5_2qj68
1981013,0,t3_2hdtts,Why not use a vacuum for astroturf cleanup provided it doesnt rain during getaway day?,BurningMan,ckrwvjs,-2,t5_2qj68
1987311,0,t3_2heq2j,It feels like these forprofit turnkey camps are selling what Im trying to gift. Im not doing large art installations to entertain resortgoers and make money for the people running these camps. Im doing it because I want to participate in a noncommercial art festival where its not about making money.Thats a lot of what made Burning Man special. Sure you can be inclusive of people running forprofit playa resorts but that fundamentally changes what Black Rock City is. Its a lot more like Las Vegas... and youll never find me building large art installations to take to the vegas strip for fun and for free.,BurningMan,ckso6s2,10,t5_2qj68
1989720,0,t1_cksawzk,When it rained mud was created under the astroturf and the bottom blades were squished into it. When the playa dried the blades were embedded in it and ripped out of the turf as it was pulled up.Kind of like waxing.,BurningMan,cksymjp,2,t5_2qj68
1995117,0,t1_cktlbhb,Yes please.,BurningMan,cktm1n7,2,t5_2qj68
2000835,0,t1_ck8sh8d,Can we see yours? Im about to make one myself interested in seeing others creations.edit and great stuff btw,BurningMan,ckuat6g,1,t5_2qj68
2021666,0,t1_ckwshsj,Yes that was a french quarter project ,BurningMan,ckwt2oa,2,t5_2qj68
2032792,0,t1_ckxuctc, Names of the only two.Katherine Lampman and Alicia Louise Cipicchio. Real people burners.Look at the names of kids and adults on the website referenced. Its no different.,BurningMan,cky7nsi,0,t5_2qj68
2037543,0,t1_ckyspff, That actually happened more or lessand its  hilarious to revisit!,BurningMan,ckytf31,3,t5_2qj68
2071215,0,t1_cl32xz8,youre a funny guy. ,BurningMan,cl33i27,-1,t5_2qj68
2128169,0,t1_cla7z76,They get worse as the week goes on as passing bikes and foot traffic break up the surface and create more dust.,BurningMan,clac53c,1,t5_2qj68
2190654,0,t1_cli9qa9,Okay Okay. My RES tells me I like the shit out of  of your comments. That has to be a record because my opinions are fickle. So im in. Edit This is going to take some very dualistic reverse engineering. I dont know about all of this. ,BurningMan,cliaaol,5,t5_2qj68
2190817,0,t3_2k5mxi,My neighbor took me to the airport for a ride on his plane and when we got there some random dude was walking around on the airfield.  It was a big deal the airport was shut down for a while and the cops there didnt know what to do with him and they  called the medics.  A blue dot ranger I think that is what he called himself showed up shortly in a ridiculous ranger like costume and the cops did not take him seriously.  The ranger was very professional and convinced them he was the person they called for.  ,BurningMan,clib1i4,2,t5_2qj68
2190909,0,t1_clhvob3,This is taken at the end of the week probably shortly before the man burned. I think a lot of camps are tearing down.,BurningMan,clibgms,1,t5_2qj68
2213384,0,t3_2kgh9y,We had to head to Reno late Sunday night and saw several cabs sitting in line on . Saw a couple that had made it all the way up to the gate as well.,BurningMan,cll6aev,2,t5_2qj68
2237077,0,t3_2kr0v0,Check out the DC Burner Groups via the Man website or through Facebook. Theres events almost every week and they can orient you with the regionals.,BurningMan,clo6pot,1,t5_2qj68
2269404,0,t1_clryf9t,sweet! also was browsing the website and youve been busy making updates! kudos!,BurningMan,cls7v2i,1,t5_2qj68
2387270,0,t1_cm56ekx,I heard this was in there but couldnt find him... where was he?Sees downvotes. Shit son I just got trolled,BurningMan,cm6rw5z,1,t5_2qj68
2420993,0,t1_cmarbc0,Thanks for the helpful info! What do you mean about only requesting ground screws? As in I should request money for ground screws in the grant and nothing else? ,BurningMan,cmaxz0r,2,t5_2qj68
2445747,0,t1_cmdxb4n,Sure was!  Thanks for giving me a smile today.  ,BurningMan,cmdzylb,3,t5_2qj68
2446552,0,t3_2nj5wm,Bad ass I hope I run into you next year!,BurningMan,cme3jtt,2,t5_2qj68
2484772,0,t3_2nypqd,If youre willing to get down to San Diego all night Desert Hearts party is happening on Saturday. edit Which will be awesome! pmam,BurningMan,cmiwc1j,1,t5_2qj68
2497472,0,t1_cmk7of6,You could argue that a graded road is one that is maintained and surveyed.  The vast amounts of water used to maintain the roads in BRC plus the survey makes it a graded road surface.  You could easily drive  mph on the playa.,BurningMan,cmkk3eu,2,t5_2qj68
2620889,0,t1_cn0cfhv,Why dont you do the white label kit and take pictures as you are handing then out and doing your thing. Then afterwards you blog or post in Facebook and your website that you had a great time giving out testing kits at burning man. Show the pictures. SEO and Facebook will do the rest.,BurningMan,cn0os7w,1,t5_2qj68
2622820,0,t1_cn0tscu,deleted,BurningMan,cn0xumo,1,t5_2qj68
2623292,0,t1_cmzs82m,Dude you forgot rereread the survival guide.,BurningMan,cn102eg,2,t5_2qj68
2630761,0,t1_cmyanan,I agree with this comment. The similarities are quite plentiful between Juggalos and burners. ,BurningMan,cn1z3qf,1,t5_2qj68
2641954,0,t3_2q70e5,deleted,BurningMan,cn3fp7p,-1,t5_2qj68
2663149,0,t1_cn5w52v,My understanding is that David Best is pretty burned out.,BurningMan,cn6784j,6,t5_2qj68
2667689,0,t3_2qatw2,Go to a salon and get tight french braids. It worked for me and when I took them out at the end my hair looked amazing.,BurningMan,cn6si5a,2,t5_2qj68
2679735,0,t1_cn8ca6x,I was camped at  amp L during the  burn. There was this art car that drove by our camp and they were playing this song. Then we saw them  more times throughout the week in our neck of woods always playing this song. Twas awesome,BurningMan,cn8d1ou,2,t5_2qj68
2682738,0,t3_2qpnl3,For me its the videos of big projects I helped make remembering the camaraderie of working on something beautiful and insane in sublimely terrible conditions.,BurningMan,cn8r5t2,1,t5_2qj68
2736112,0,t1_cneotml,I read somewhere that you cant volunteer like that your first year though? That its only open to return burners? I could be mistaken,BurningMan,cnf30wb,1,t5_2qj68
2746263,0,t3_2riqjl,I have FOMO dreams all the damn time.,BurningMan,cng8lm0,1,t5_2qj68
2749749,0,t3_2rimzy,Yes.  I want this to happen.  So much yes.,BurningMan,cngmv7d,2,t5_2qj68
2780797,0,t1_cnk4ppq,Set it on fire at the burn and film it while someone plays it. ,BurningMan,cnk612y,1,t5_2qj68
2804261,0,t3_2rtk8c, years ago.  Id just broken up with my girlfriend and was living alone and being boring.  My sister and cousins convinced me at the last minute  i bought a ticket threw some food in a box and have been going every year since.,BurningMan,cnmu2c6,1,t5_2qj68
2832104,0,t1_cnp91kv,they should post a thread saying only Found it,BurningMan,cnq07jq,2,t5_2qj68
2842822,0,t3_2snsdc,. Go here. Apply for a low income ticket.edit my brain. ,BurningMan,cnr86fy,2,t5_2qj68
2842895,0,t3_2sc71l,Thanks for posting!,BurningMan,cnr8h8n,1,t5_2qj68
2860184,0,t1_cnt3yc7,Well as noted Ive taken a Ti since ... I wouldnt want to imply that everything will be fine. Maybe I just got lucky  its in no way billed as a weather resistant camera. But your main issue is dust getting into the camera.  You can tape over the SD card door and the battery door if that makes you feel more comfortable.  Rather than buy a second camera body again Im not responsible! you might want to look into a second hand sturdy prime lens i.e one that isnt going to be expanding and contracting and moving dust through the mechanism.  This year my main prime lens was in for repairs I dropped it on the sidewalk oops.... and I took a mm SuperTakumar ..  Its a somewhatvintage lens.  Its fully manual and it has a slight yellowish cast to it... I did not get the chance to find an ND filter for it and in day time you kinda need one.... If youre into fully manual photography thats one way to go and hopefully everything goes fine and you end up with another lens in your lens collection and at the end of the day lenses are the real addiction.... and note also to factor in that you may or may not have access to power to charge batteries.... buying a second camera body potentially means buying a few spare batteries for that particular camera... ,BurningMan,cnt7d1p,2,t5_2qj68
2890452,0,t1_cnwf1me,Youre bringing a boat? SWEET!!!,BurningMan,cnwnc0v,3,t5_2qj68
2909123,0,t3_2tfjru,Im for the sale. Making an attempt to ensure that  of the population is made up of people who actually build the city is a good idea.   The general sale makes plenty of room for new blood.I dont understand why villages are given a lower proportion of invites.  ,BurningMan,cnyrw5t,8,t5_2qj68
2914313,0,t3_2tgwzn,Where did the name come from?,BurningMan,cnzd5h4,1,t5_2qj68
2942288,0,t1_co1v994,I didnt. I needed to get at the very small buttons on the camera constantly to adjust settings. I kept a micro fiber cloth with me at all times I brought several and used it to keep dust off the lens. A good clear lens filter is extremely important. The camera got dusty BUT the GH has a weather proof sealed body. I did worry when I needed to change lenses but I always did it in my dome as quickly as possible. We also brought two hard drives with phantom power and a laptop to triple back up the footage everyday. Shooting at Burning Man is not for wimps. It was the hardest shoot Ive ever attempted. I know how this sounds but The Playa is gonna make you work for every frame of footage you get. Its not gonna give it up easily. Everything that can go wrong WILL. The weather will not cooperate the citizens of the city will work against you and no one but yourself and your crew will give two shits about what you are trying to do.All that said the footage we got was breathtaking and all worth the very considerable headache.The film is almost done and soon we will be sharing it with the Burning Man Community.In closing I say again  PLAN PLAN PLAN. Because The Playa WILL try to break you. It almost broke me.Good Luck!,BurningMan,co2juu6,1,t5_2qj68
2975025,0,t3_2u927e,,BurningMan,co69y0o,0,t5_2qj68
2982426,0,t1_co5tmqe,next year was better anyways,BurningMan,co748y0,1,t5_2qj68
3002372,0,t1_co91x3x,Buttt are you watching your feet Captain??,BurningMan,co96zjm,2,t5_2qj68
3005323,0,t1_co9hf3t,I guess my question was meant to ask about what you think would be the minimum people you would recommend to make a them camp work? I get that any amount of people could make one but whats the optimal in your opinion?,BurningMan,co9hzza,1,t5_2qj68
3009182,0,t1_co9w0qr,Buy it in advance and transfer it to plastic bottles so you dont have to bring the glass to the playa.,BurningMan,co9we57,2,t5_2qj68
3019812,0,t1_coazsls,see you in the dust be sure to bring your aluminum cans to Recycle Camp!,BurningMan,cob01jf,4,t5_2qj68
3047329,0,t1_coduehp,That sure channeled some SRL action.,BurningMan,codusae,1,t5_2qj68
3074751,0,t3_2vc2xa,How about some discussion on etiquette and getting on these things?  Ive been  years in a row and I think Ive ridden art cars about  times and only once for more than a few blocks.If Im walking with cute female friends Ill get invited on but in those cases weve always been headed elsewhere.  Solo Ive been picked up twice.  Thanks Fish Bus lady and furry taxi dude!Not being a hot girl Ive pretty much given up on asking.  The only time I can get on is one when isnt headed anywhere in the next half hour  and even then Im afraid of getting kicked off to make room for someone whos with the art cars camp.I know Im not the only one who has run into this.,BurningMan,cogp2at,1,t5_2qj68
3083077,0,t1_cohhuws,Oh man yes that!!!  Will call was awful!,BurningMan,cohk596,2,t5_2qj68
3083395,0,t1_cohkvin,,BurningMan,cohlc8w,2,t5_2qj68
3084945,0,t1_cohnf7n,One of my camp mates tickets was lost in the mail. The replacement required will call. We were in early arrival on Friday. Took him  hours to get in.,BurningMan,cohr4dv,3,t5_2qj68
3086102,0,t3_2ve2kh,We also built a generator enclosure using posts into the groundstanding off from the generator by  feet on all sides and rising up  feet then covered the ends but not the top in acoustic drapes made to damp drum rehearsal spaces. Tried hard to be good neighbors...,BurningMan,cohvfqk,1,t5_2qj68
3092150,0,t3_2vkjzi,This terrifies me for next week,BurningMan,coii0e9,2,t5_2qj68
3092656,0,t1_coii2ot,Depending on where you are on the East Coast there may be someone sending a shipping container you can rent space in.,BurningMan,coijwc1,3,t5_2qj68
3096962,0,t1_coiye1q,Assume its closer to . When its almost time to buy tickets you should have the site already open and be watching and refreshing the page until it says youre in the queue.,BurningMan,coizzg4,1,t5_2qj68
3097224,0,t1_coiye1q,Line last about  minutes.If youre not in within  seconds chances are low youll get through the line.STEP is where you sell your ticket back if you dont need it.Read the ticket page on the burning man website.And read the survival guide because it sounds like you need to read up more on the event.,BurningMan,coj0ymi,2,t5_2qj68
3102365,0,t1_cojjz3u,Yep. I loaded it on my laptop and it displays the way it does in your posts. Stinking VPN!,BurningMan,cojk4os,1,t5_2qj68
3107339,0,t3_2vqe4e,IMO by far the best way to do your first time is with no one you know.  If youre really worried about it join a theme camp full of new people.,BurningMan,cok2p4j,5,t5_2qj68
3114840,0,t1_cokuixm,Grumpypants is correct. Our rv is for sleeping and hauling gear. So. Much. Gear. We dont use ac and the toilet is for liquid emergency only. Showers are not a part of our plan. Too much water. Daily wipe down is plenty. ,BurningMan,cokupgq,1,t5_2qj68
3115447,0,t3_2vsjye,This seems like something the LEOs should be making an effort to deal with. Someone drunkenly wielding a powerful laser is putting others in danger or permeant harm surely thats the sort of thing law enforcement would take a dim view of right?It seems a much better use of their time than busting mates sharing a J.,BurningMan,cokwyxu,3,t5_2qj68
3128090,0,t1_colzrer,I dont see how joining a camp is mutuallyexclusive with all the things you mention.  There are some very laid back camps where people dont have any responsibilities but just camp together.  It can be really important to have others look out for your stuff when youre not around as well.I think its also important to have some responsibilities at the burn.  IMO one of the big problems are the independent people who just wander around aimlessly  theyre the ones mostly leaving the moop.  I feel I get much more out of  the event if I volunteer in a camp or on a team.  If youre on the shy side its an especially good way to meet people.  One year I volunteered to deliver papers for the Black Rock Beacon.  It was awesome having a paper route and meeting people along the way.  That being said... is it possible to have a bad experience being part of a camp?  Absofuckinglutely and timesoutof the reason is the person is a lazycreepy selfabsorbed prick that takes away from the community.  If youre the type of person that doesnt clean up after yourself or youre only there to score drugs get laid show up unprepared and mooch off others without helping yes by all means dont join a camp.  Camp by yourself.  But if you are respectful and conscientious being part of a camp can be extrarewarding.,BurningMan,com83f7,1,t5_2qj68
3160074,0,t1_copim7s,this would make an EXCELLENT meme!,BurningMan,copjfwr,0,t5_2qj68
3160376,0,t1_copkbqw,Holy shit it worked! I reclicked the link and got right through!!! Bought  and a vehicle pass. Thank you so much!,BurningMan,copkkjv,1,t5_2qj68
3160493,0,t1_copkxx2,That did not work for me since there wasnt a popup.  It is a redirect rather than a pop up,BurningMan,copl0ak,1,t5_2qj68
3160622,0,t1_copl9i4,Why must they tease us like this?!  Down to min now. ,BurningMan,coplhnv,1,t5_2qj68
3160781,0,t3_2wcfbi,Got  tickets but vehicle passes were sold out.Kudos to the BOrg for always finding a creative way to fuck things up.  Because nothing could go wrong if you sell exactly the number of passes that got used last year.  Theres definitely no way this year could have different demands...,BurningMan,copm31w,5,t5_2qj68
3161076,0,t1_copmxue,I live in the SF bay which makes it easier granted. And I go to burn events around here and surround myself with burner friends. Someone inevitably cant go or bought two tickets only needing one etc. ,BurningMan,copn6rk,1,t5_2qj68
3161342,0,t1_copny97,The game has changed in the last year or two.  BM made an official announcement that ticket registrations more than DOUBLED the amount of tickets available this year.  Less than  chance of getting a ticket these days.,BurningMan,copo6l3,6,t5_2qj68
3161561,0,t3_2wd0qx,A bigger issue is that the queue site was posted plainly in the site source  many people were in queue before  PST. I ended up getting my tickets but just barely it seems ,BurningMan,copozzb,7,t5_2qj68
3162212,0,t3_2wd0qx,Either way it has been a crapshoot for years. I would guess that the majority of the people trying to get tickets clicked in the first five seconds or so. Ticket demand far outpaces ticket supply. There will always be some issue or some trick that worked. But I bet the actually number that got tickets this way if it worked was very small. ,BurningMan,coprfja,2,t5_2qj68
3164730,0,t1_ckvcfq3,Damn that link would have been very useful but its not working. Tried Googling but couldnt find it. ,BurningMan,coq0uby,1,t5_2qj68
3168473,0,t1_coqem8w,Yep. Also the name of the original poster. While that came from a business page it appears to be a one woman business and it took basically no effort to find her full name which all comes a little too close for comfort for me sorry.,BurningMan,coqestp,1,t5_2qj68
3168694,0,t1_coqd76z,My email link was not hotlinked so I had to copypaste it. I had same experience as bcumbers. Link went to promo code accepted with an additional message servers crashed. I waited about minutes copypasted the email link without the promo code into a new window and was immediately taken to buy tickets.I wondered why my email link wasnt hotlinked. Youre telling me the email link was hotlinked with waitingroom code?,BurningMan,coqfmij,1,t5_2qj68
3170414,0,t1_coql23a,Sorry if I hurt your feelings  that wasnt my intention! You should really work on developing more positive energy! Have you tried sacred geometry? Be the change you want to see in the world! lt lt lt The playa will provide lt,BurningMan,coqm1dn,8,t5_2qj68
3175516,0,t1_coqlc2f,Because that had never happened before.  The prior year sold out but very late in the year so it didnt really affect anyone.  No one knew how it was going to work out.,BurningMan,cor53ew,1,t5_2qj68
