,controversiality,parent_id,body,subreddit,id,score,subreddit_id
15224,0,t3_1u9ypr,Perhaps it was JalJeera,IndianFood,ceg61fv,1,t5_2s65y
27418,1,t3_1ufcuf,You did awful. Try posting the recipe next time.,IndianFood,cehjy8o,4,t5_2s65y
151271,0,t3_1vtjru,the yummy green one is likely coriander. the yoghurt one could be raita?,IndianFood,cevnt2d,1,t5_2s65y
164615,0,t1_cex5anb,sorry cardamom seeds and usually I cook the onions just before they start to all brown so they have more room to cook with the chicken. Usually Ill do about lbs of chicken but thats because Im cooking for all my nonveg friends and they dog the hell out of it lol,IndianFood,cex6kfy,2,t5_2s65y
171838,0,t1_cey054k,Excellent I have coriander and turmeric in my spice tin already. I havent managed to pick up asafoetida but I keep hearing about it and need to go look for some. Thanks!!,IndianFood,cey06ry,1,t5_2s65y
230223,0,t1_cf4gp3f,Yes,IndianFood,cf4lzi4,1,t5_2s65y
387458,0,t3_1yixih,I have been cooking Indian food pretty much my whole adult life  more than twenty years now. My family has cooked Indian food for generations as my father is Indian. They and I have always cooked in large batches and frozen leftovers.Ive frozen dhals meat curries poultry curries fish curries vegetable curries biryanis pulaos aloos and breads. All have frozen perfectly. Im not sure whether eggcontaining curries would freeze and reheat well. I have found that the curries tend to reheat better after having been thawed conventionally before going in an oven for twenty minutes or so. Having said that careful reheating from frozen in a microwave by which I mean heat on medium power for  minute stir repeat until piping hot throughout will work too.Good luck!!,IndianFood,cfkxc2l,12,t5_2s65y
541247,0,t1_cg1sgk2,Ive heard that about meat on its bones. However as a proud bachelor and quite the messy cook Ive always thought they were trouble. From what I surmise I should add the meat at the frying stage add the water a little later and cook for longer making sure to check for the doneness of the meat. ,IndianFood,cg1sobe,1,t5_2s65y
940643,0,t1_chb31o6,Whether people eat egg or not depends on belief of people. But whether its considered vegetarian or not doesnt. Its not considered vegetarian by anyone in India.  Anyway I do eat egg and meat but here I am looking for veg recipes.  Tofu isnt that easily available here and it anyway doesnt taste good. And I have never heard of seitan.,IndianFood,chb7gg2,0,t5_2s65y
1984477,0,t3_2hf11e,Its a great map But  cant access anything in the middle!! ,IndianFood,cksbvz7,2,t5_2s65y
2244593,0,t1_clovn5w,I thought curry was a bunch of different spices mixed together? Theres curry leaves???,IndianFood,clp52c2,3,t5_2s65y
2262197,0,t3_2l37qf,Some salmon tikka  but it lacks that thick delicious curry you were asking for though I tried this and it was fantastic.And this one here doesnt look that bad at all And if it you dont mind your dish not being Indianinspired what I do is to actually substitute salmon for chickenbeef in Thai curries and well it works for me just take into account that salmon cooks way faster than chickenbeef.,IndianFood,clrbteo,1,t5_2s65y
2267406,0,t1_clryg7o,Sure!Bengal sweet dhalLemon riceRogan Josh I use beef because lamb is too expensive hereVegetable manchurianIn terms of BIR I make a batch of base gravy from a pot of chopped onions half a pepper half a cabbage carrots bunch of cilantro a chilli or two garlicginger paste  cups of oil and the same of water boiled down for an hour or more. Add tinned tomatoes and blend. Double the quantity with water then add cumin coriander salt tumeric garam masala paprika a little cinnamon and fenugreek.From that Ive been trying to perfect Jalfrezi. I marinade chicken in garlicginger paste tandoori masala garam masala and oil then broil on skewers. Then cook chopped onions and bell pepper add garlic ginger paste then tomato paste and cook. Add methi leaves tandoori masala garam masala salt and chilli powder. Add a ladle of the gravy and bring to the boil. Add cooked chicken and more gravy if necessary. Continue cooking until reduced a little and top with chopped cilantro.Sorry for the vague measurements on those  I tend to just do it by sight.,IndianFood,clryyxe,1,t5_2s65y
2306493,0,t1_clwrggg,Thanks for the recipe.Boydo I miss being able to eat indian food whenever I want.And nowI am going to be unproductive for the rest of the day thinking about thisno thanks to youOP! ,IndianFood,clwss1p,3,t5_2s65y
2433334,0,t1_cmcgphq,Hmm Im not too knowledgeable on those. I had a gujarati friend back in college who used to keep a box of theplas and kakras. The latter stays crisp and fresh forever. The former for a few days if preserved properly.Edit Lets just hope some redittor from the west comes to your rescue.,IndianFood,cmcgsmq,1,t5_2s65y
2483452,0,t1_cmio54l,Do you have a recipe or at least a close approximation of one?,IndianFood,cmiq4mq,1,t5_2s65y
2510294,0,t1_cmly212,Looks amazing! ,IndianFood,cmm8f8z,2,t5_2s65y
2523540,0,t3_2okaod,No recipe against the rules.,IndianFood,cmnypto,9,t5_2s65y
2575095,0,t1_cmune38,Are you sure? Dont nargisi koftas contain meat?,IndianFood,cmupbqz,2,t5_2s65y
2624748,0,t3_2prz5i,Turmeric is also widely used in India for medicinal purposes. For scientific proof go here,IndianFood,cn16w66,2,t5_2s65y
2688409,0,t1_cn9dqdw,Interesting. People really read into stuff when its all in text. All I did was clarify the question. I didnt come here to ask others to do a google search for me that would be a waste of others time.,IndianFood,cn9hthj,1,t5_2s65y
2875963,0,t1_cnutpmr,I live relatively large city in the US and whulw theres  or  Indian restaurants just in my area none if them deliver.,IndianFood,cnuzxqh,4,t5_2s65y
3133352,0,t1_comjwup,Mine are still a little too skinny for that! ,IndianFood,comrpwu,2,t5_2s65y
3525413,0,t1_cpu469m,It was Pataks mango curry sauce.And yeah this tasted damned close.,IndianFood,cpu4eov,1,t5_2s65y
3567203,0,t3_30w57e,The reason I use whole spices is because they keep fresher for longer and they give a more aromatic fragrance to dishes. I tend to grind my own spices as and when I need them too. I think in your case its more important that you look after your personal well being and also make things easy for yourself in the kitchen so its probably better to use ground spices for all the food your prepare. What I would suggest is that if you are able to digest ground spices without any issues that you buy them whole and grind them yourself at home so you get the best of both worlds. ,IndianFood,cpyvyw9,2,t5_2s65y
3633681,0,t3_31z674,My favorite is ekantcookcurry.com Not updated a whole lot but all the recipes ive tried from there have turned out really well.,IndianFood,cq6gtrp,5,t5_2s65y
3681276,0,t1_cqbtou1,Thanks!,IndianFood,cqbw15s,1,t5_2s65y
3860025,0,t1_cqw9qht,So likely if I add more molasses it will be close enough. Makes sense since molasses is yummy.,IndianFood,cqwa01l,2,t5_2s65y
3885902,0,t1_cqz0646,I agree with you.  This looks like its of the indochinese food family once strong in Calcutta and now dispersed and diminished by Nelson Wang et al.  Sub chicken and spring onions for the gobi chuck in some chicken and go easy on the tomato.  Voila  chicken manchurian!  ,IndianFood,cqz85tw,4,t5_2s65y
3926604,0,t3_35f5qt,Sujata,IndianFood,cr3va17,1,t5_2s65y
3967763,0,t1_cr8eb1m,Exactly. Ive never had it nor have I ever seen it noooor do I ever make it without tomato. Hes on crack. ,IndianFood,cr8k4mr,1,t5_2s65y
4475693,0,t1_csudou2,Perfectly legitimate to call this Indian food IMO  in many countries this is what people know the cuisine to be.  A lot of users here want to replicate what they get in their local Indian restauranttakeaway and in doing so will end up discovering lots of new things about Indian food.  This sub isnt just for discussion of traditional subcontinent cuisine surely?  ,IndianFood,csuty3e,5,t5_2s65y
4604815,0,t3_3du3su,Whoa I didnt know you had moved to this subreddit!Question Chopped green chillies for added spice yay or nay?  What about regular onion pakoras? Im looking forward to that recipe with vodka Thanks for sharing!,IndianFood,ctb0u0j,1,t5_2s65y
5014226,0,t1_cuq5cil,You can microwave the batter in a small dish with a loose lid or use a standard metal steamer or bamboo if you have one of those,IndianFood,cuqejl3,1,t5_2s65y
5705570,0,t3_3t95iz,That exact photo has been posted on Yelp with the caption Custom made chicken tikka masala vindalooDid you post it and then forget?,IndianFood,cx4bxx0,11,t5_2s65y
5818408,0,t1_cxiafmh,Maybe some cross posts to rfood and rfoodporn would help.,IndianFood,cxibtgw,4,t5_2s65y
6573769,0,t3_45o2nn,Matar Paneer is usually not creambased. Its cooked in a simple and quick oniontomato base. Shahi Paneer is a slightly more involved recipe wherein a paste of ground cashews soaked in water is used to add texture to the tomato and cream sauce.,IndianFood,czza68w,6,t5_2s65y
6598425,0,t1_d01tueg,Yeah you want to avoid stuff that leaves a residue in burrs. Grinding some rock salt through it a couple of times should get rid of most of the cack and let it work again.,IndianFood,d01txb2,1,t5_2s65y
6770658,0,t1_d0jg22z,One of the best curries I ever had was a goat curry in Philipsburg on the Dutch side of St. Maarten. ,IndianFood,d0jqh7k,1,t5_2s65y
7014426,0,t1_d1a830j,Thank You!,IndianFood,d1bfm2k,1,t5_2s65y
7101787,0,t3_4cpd0p,This is what my mom saysWhisk the yogurt thoroughly before you add it to the curry. Only add the yogurt when the oil separates from the masala. And keep stirring the curry after adding the yogurt or itll split.,IndianFood,d1lcysq,3,t5_2s65y
7104741,0,t1_d1llg0s,Yep. Just invite them over and make them cook it for you by pretending being frustrated with not understanding what to do. ,IndianFood,d1lp1ln,2,t5_2s65y
7119920,0,t1_d1ng5og,deleted,IndianFood,d1ng6ho,2,t5_2s65y
7135431,0,t1_d1oygfj,Thank you!,IndianFood,d1p7xdu,1,t5_2s65y
7168809,0,t3_4dp29w,Sweet dog in the last pic. She looks hyped for dinner. ,IndianFood,d1t0ye9,3,t5_2s65y
7171933,0,t3_4dog9i,My personal favourites are rasgulla kala jamun chum chum jalebi and barfi. Most of them are extremely sweet so if thats not your style then you might not like Indian desserts. If you make them at home you can always tone down the sweetness my parents are diabetic and my mother always makes ladoo and halwa but with far less sugar than you would normally have them.,IndianFood,d1tdqfo,1,t5_2s65y
7172628,0,t1_d1tgf2r,I always went there around  pm. I am not sure if theyre open in the evening Shiva temple but the Sai Baba temple is open until . pm. ,IndianFood,d1tgkx7,2,t5_2s65y
7192931,0,t3_4dy5d7,Yeah this is pretty fantastic.  I gotta try it.,IndianFood,d1vrz3n,1,t5_2s65y
7216430,0,t3_4eaqwj,Cumin Coriander Cardamom Cloves Cayenne Black Pepper Turmeric.Onions! Garlic.Soup can sized cans of diced tomatoes. Indian yogurt.The first thing you should learn to make is Indian chick peas.Books Curries without Worries  Also any cookbook by Madhur Jaffrey. Jaffrey is an Indian actress who writes very well described and tested cookbooks. If you follow her directions and spice blends you can cook like an Indian.,IndianFood,d1ygad4,2,t5_2s65y
7228118,0,t1_d1tbmet,Gotta agree with this. Just make tasty food at home.,IndianFood,d1zs77n,2,t5_2s65y
7242630,0,t3_4ekmtv,I have always made my roti by dusting in flour rolling out and cooking on the tava. I dont put oil in the dough either. But as you say its personal preference.,IndianFood,d21fngj,1,t5_2s65y
7288185,0,t3_4f51r8,Does anyone know what those snacks are called in the banner? The orange green and brown things. Indians at my work bring in boxes of them after their trips to India. I know that one is called Laddu and is made with carrots. Id like to try making them if anyone knows a good recipe P,IndianFood,d26m8xw,2,t5_2s65y
7294585,0,t3_4fb5d3,gaeragrageAEGEAG,IndianFood,d27cfcg,1,t5_2s65y
7295688,0,t1_d27g65h,You are welcome!  ,IndianFood,d27gxpg,9,t5_2s65y
7306800,0,t1_d1wy2q8,Ive been looking for a great Channa Masala recipe thank you!  Ive added some formatting to help me with my shopping list providing it below in case it helps anyone else.Channa Masala RecipeIngredients   can of goya chickpeas I used a small part of that to blend into a smooth mixture.  th cup of diced tomatoes  Half a medium onion well diced   Dried red chili   spoonful of cumin seeds  Garam masala powder  Red chili powder  Cumin powder  Coriander power  Turmeric powder  Cinnamon Bark  Bay leaf  Fennel Seeds  Salt and Pepper  Garlic salt  Olive Oil only kind I had  Light cream  Pinch of brown sugar optionalMethod . Heat up oil and throw in the cumin seeds. . Add the onions in once the seeds start to pop throw in a pinch of garlic salt and brown sugar. . Fry the onions until theyre well brown and then add the tomatoes. . I used a metal spoon to add the spices.  spoonful of garam masala red chili powder cumin powder coriander power and half a spoonful of turmeric powder. I know I explained this part pretty badly but I tasted along the way and made the proper adjustments. . Cook the tomato mixture until it reduces to a gravy. . Add  cup of cream blended chickpeas and chickpeas. . Cook for a good  minutes make sure to taste and add saltsspices accordingly before you finish.Moong Dal RecipeIngredients   cups of dal I had moong and masoor  th cup of diced tomatoes Half a medium onion well diced   Dried red chili   spoonful of cumin seeds  Garam masala powder  Red chili powder  Cumin powder  Coriander power  Turmeric powder  Cinnamon Bark  Cinnamon Bark  Bay leaf  Fennel Seeds  Salt and Pepper  Garlic salt  Olive OilMethod . Soak dal and wash it until the water runs clear.. Boil the dal until it absorbs all the water and it gets mushy. . While youre doing that cook the onions with some oil and cumin seeds. . Fry the onions until well brown and add the tomatoes. . Once the tomato and onions are well cooked add  spoonful of red chili powder and  a spoonful of turmeric along with saltpepper. . Add the mushy dal to the tomato gravy and cook for another  minutes so its extra soft. Make sure to taste along the way and spice it to your liking!!!I made the rotis too but I feel like I dont need to include the recipe to that since its just white flour and water with a little salt.,IndianFood,d28qf23,1,t5_2s65y
7315435,0,t1_d28usjj,I took Madras curry powder to my dorm and boy did it help me out there! Nifty little blend of whatever it is. Definitely distinct from garam masala. I think I actually for reached Madras curry powder more than anything else back then really. ,IndianFood,d29prm3,1,t5_2s65y
7317119,0,t1_d29tmvi,wowww looks amazing! Good job!,IndianFood,d29wnlp,1,t5_2s65y
7328231,0,t1_d2at1xi,Yeah that looks like it. Thanks so much! Ill probably order this and look into the Marsala corn that another comment mentioned because that also sounded like a possibility.Edit looking into it this is most likely what it was. Thanks again!,IndianFood,d2b64qu,1,t5_2s65y
7332298,0,t3_4fstft,logic says yes maybe this sub will say otherwise.,IndianFood,d2bmrjh,3,t5_2s65y
7376419,0,t1_d2gd9rs,gt Carrom seedI am not familiar with them either but a quick look at  gtThey smell almost exactly like thyme because it also contains thymol but is more aromatic and less subtle in taste as well as slightly bitter and pungent. Even a small amount of fruits tend to dominate the flavor of a dishSo they really are worth toasting and tasting  I bet theyd work well toasted and then added to ghee before roasting a butternut squash.,IndianFood,d2gnbj6,1,t5_2s65y
7380973,0,t1_d2h2zd5,As an aside a completely not traditional thing I love to do is to make the vindaloo paste marinate pork chops in it and then BBQ them. Delicious!,IndianFood,d2h5zsk,9,t5_2s65y
7384511,0,t1_d2h83nh,I use jarred garlic or jarred garlic and ginger paste mix or my local indian grocer sells ziplock bags of garlic cloves dehusked. What I do is usually to freeze my ginger root it keeps for months this way and chop off a cm section for a dish then put it back in the freezer and I buy the peeled garlic cloves but the  bowls  shake the hell out of it trick works well too. I have a small food processor ninja that I used to puree my tomatoes and onions. I usually just puree the garlic and frozen ginger with the onions. Works perfect and no hassle. ,IndianFood,d2hkhe3,1,t5_2s65y
7394351,0,t3_4gkggg,Just go to india dude i spent  months there it was awesome,IndianFood,d2iot43,1,t5_2s65y
7410762,0,t1_d2kjg3y,Yeah I skipped the malt vinegar. ,IndianFood,d2kjzmh,2,t5_2s65y
7421819,0,t1_d2lfls4,Im glad you enjoyed it!Well Id like to say Im good at digging up research but I had a term paper last year in a plant science class on the origin of a chosen crop so I had to make it my business to be good at finding research haha. I picked the coconut so that the project would coincide with my interest in South Asian history and tasty food so it does interest me.I have been meaning to get a pressure cooker for a while now but dont want to pick up another thing before I move so I think Ill just wait a bit and get that and then the idli plates. The cooker has more uses than the moulds. Thank you for the advice!,IndianFood,d2lt9co,1,t5_2s65y
7440239,0,t1_d2nfw1i,As uTransFatty mentioned there actually is a difference. I once had sambhar and kootu at someones house and was trying to figure out how they had prepared the food in order to bring out such bright flavours. Turns out they ground their own spices. I dont think they ground it fresh every time but they probably made smaller fresher batches than what you can get at the store.      To be honest I havent ever tried making sambhar myself. I feel like you can get away with decent sambhar using the store bought powder but you wont be able to attain that next level freshness and brightness that grinding your own mixture affords.    Id probably first get used to making sambhar via the store bought mix then transition into making my own sambhar powder mixture as I get more comfortable.  ,IndianFood,d2nwocx,2,t5_2s65y
7461556,0,t3_4hkhlo,Followed the recipe hereIngredients cans chickpeas rinsed and completely dried off with a towel  pro tip use a hair dryer for faster drying! tbsp olive oil tbsp sea salt tsp red chili powder tsp garam masala powder tsp curry powder tsp garlic powderTo MakePreheat oven to . Line a baking sheet with foil.Spread chickpeas in a single layer and roast in the oven for  minutes. Take out of the oven and drizzle with the olive oil and evenly sprinkle the spices over the chickpeas. Shake the pan so the chickpeas get evenly coated in the oil and spices. Put back in oven for another  minutes. Take out shake. Roast for another  minutes but make sure the chickpeas dont burn. If you think they might burn turn the oven off and leave the pan in for the  minutes. Take out of oven and let them cool completely. Stored in an airtight container they will last a couple of weeks.,IndianFood,d2qbzkj,6,t5_2s65y
7465899,0,t1_d2qstpz,You dont need to peel them.,IndianFood,d2qtri4,1,t5_2s65y
7473170,0,t1_d26c5u3,I think this will come with practice and understanding the flavours you enjoy. Start with a basic masala get that under your belt and then experiment.,IndianFood,d2rnlcp,1,t5_2s65y
7548926,0,t3_4ip0eu,Salad so good it can get you high.,IndianFood,d309yu7,6,t5_2s65y
7590354,0,t1_d34smq8,Yes Nirulas and Wimpy. I was very young but I still remember that huge Wimpy in the middle of CP. Fortunately one or two branches of Wimpy still exist in South Delhi. ,IndianFood,d34zi6o,1,t5_2s65y
7597039,0,t3_4jcrmn,This post is automatically removed by the subreddit Automoderator. Please add a formatted recipe see sidebar and contact the moderation team once this is done to reinstate your post. Please add the link to your post in your message when messaging the moderators.,IndianFood,d35qtwc,1,t5_2s65y
7618450,0,t1_d37mxgr,Thats why he said BIR British Indian restaurant. ,IndianFood,d386fd8,2,t5_2s65y
7635582,0,t3_4jw2f6,This is my lunch today! ,IndianFood,d3a4g0k,1,t5_2s65y
7640992,0,t1_d3akqtw,gt Ill make spicy tofu curry with peas to put into sandwichesMany Indians do things like this too. It really is a fun way to eat! Theyll sometimes put bhajissabjissabzis into sandwiches for a more flavourful twist. I had a super tasty sandwich once but alas Ive forgotten what the filling was. Ive also seen some restaurants offer veganized versions of dishes that use tofu e.g. saag tofu.  ,IndianFood,d3aqle7,3,t5_2s65y
7667231,0,t1_d3dpbyu,Ok. I thought you might confused tea as chai a common mistake among nonindian but if you want a loose leaf tea Suggest you to check out on amazon. But you mention that this post includes spices without tea. So nevermind about that haha. ,IndianFood,d3dpxsu,2,t5_2s65y
7697193,0,t3_4knq5s,deleted,IndianFood,d3h4cv9,2,t5_2s65y
7697952,0,t3_4kqxq8,if I was home I would totally do it but Ill see if I can convince my parents to send me pictures.,IndianFood,d3h7gq5,3,t5_2s65y
7714752,0,t3_4kz34p,I didnt see that I was in rindianfood at first so I definitely ready Bhutta like butta in a Paula Deen voice. Saw the picture and thought um.. where is it?? Haha.. but no this light zesty version definitely rivals the butter dipped goodness of my homeland. ,IndianFood,d3j44qh,2,t5_2s65y
7789570,0,t3_4kfmes,Bebinca Vindaloo Surnoli ....I love the Cuisine layers of Goa  Hindu Vegetarian Indian Christian Portuguese influenced and I think there is a Muslim cuisine too is that right? ,IndianFood,d3rlrhy,1,t5_2s65y
7808807,0,t1_d3tr9ek,Thanks! I ended up in Edison so I just picked it up from there. ,IndianFood,d3truot,1,t5_2s65y
7978798,0,t1_d4cktde,,IndianFood,d4cw4i9,1,t5_2s65y
7987839,0,t1_d4c5vno,Is it worth checking out? Whats good there?My thought process is that I dont really feel like paying  for dosa and for the northern stuff I can just drive to India Sweets and Spices...,IndianFood,d4dwqx7,1,t5_2s65y
7990238,0,t3_4omae4,Gingergarlic paste lasts a long while if you keep it in an air tight container the colour will change a bit to greenishblueish tint but thats just the garlic reacting. My mum makes enough paste to last  months. The tandoori paste seems to have acetic acid as well as citric acid it will last a while. But you could always make your own fresh paste every time this one is nothing extra it just has a truckload of redorange colours.,IndianFood,d4e6gd7,2,t5_2s65y
7990334,0,t1_d4e6aln,No. This user just stole the link | ,IndianFood,d4e6ubf,3,t5_2s65y
8007833,0,t3_4ovm8v,Do you use salted or unsalted butter for this? Looks great,IndianFood,d4g5m8k,3,t5_2s65y
8013260,0,t3_4ovm8v,Macros? ,IndianFood,d4grk2c,3,t5_2s65y
8125082,0,t3_4qit75,This showed up over at ricecreamery and I thought it would get a wider audience here. Interesting to hear of the ice cream technique they use and their reliance on the traditional methods versus more modern styles. Thoughts?,IndianFood,d4tbyxq,2,t5_2s65y
8142482,0,t3_4qfuud,Hey OP! Make sure to try the canteens of various Bhavans. Andhra Bhavan  Karnataka Bhavan etc. They are greaat. ,IndianFood,d4vctex,1,t5_2s65y
8147616,0,t3_4qtvej,Mouth is watering,IndianFood,d4vzz33,2,t5_2s65y
8222429,0,t1_d4zs89b,You need equal amounts of self raising flour and fine semolina and a half amount of milk powder. Bind the mixture with luke warm milk and deep fry. The boil water with cardamom powder lots of sugar and lots of strands of saffron. Pour the sugar water over the gulab jamun when cool.. There you have it. ,IndianFood,d55cyt3,1,t5_2s65y
8259554,0,t1_d59rsj5,Cow ghee is aok in moderate quantities DAs long as its from a trustworthy brand and mentions explicitly that it is made of  pure cow ghee. A spoonful on top daily should do no harm as long as the rest of OPs lifestyle is alright. ,IndianFood,d5a02mu,2,t5_2s65y
8287807,0,t1_d5dd86a,Like Thalis. Especially Gujurati ones.,IndianFood,d5dj9jb,1,t5_2s65y
8302947,0,t1_d5ff89x,I have been misled then  sign me up!,IndianFood,d5ffcjc,3,t5_2s65y
8378615,0,t3_4uahhi,I dont think this qualifies as indian but it meets your other  requirements. Cut brussel sprouts in half and saut them in butter for a few minutes. Add a can of coconut milk and a tablespoon of green curry paste and mix it evenly. Once you feel like the sauce has had a chance to soak into the brussel sprouts add Braggs to taste and serve.My dad has hated brussel sprouts his entire life and he loves this recipe. ,IndianFood,d5ovjci,2,t5_2s65y
8435874,0,t3_4v5v8b,I guess everyone has strong opinions about chai. Heres mine. I feel that the typical way of making chai is actually quite bad as it involves boiling the heck out of the tea leaves which makes it bitter.A much better way to make chai is to take watermilk  if whole milk  if skim milk add crushed cardomom ginger and whatever else and let it come to a boil. When it comes to a boil it will start rapidly rising so watch out for it and when it does start rising remove from heat.Having removed it from heat add tea leaves. Vagh Bakri is good for strength but if you want a balance of strength caffeine and aromaflavor then do halfhalf CTC tea and tea leaves. Black Label and Green Label for example or Vagh Bakri and Green Label or an Oolong. You can also find premixed CTC and tea leaves.You actually do not need to bring the pot back to heat now as the watermilk is already hot enough to brew the tea. I guess you could bring it back to the heat for another rapid boil but really dont do it for too long  half a minute or so at most  resist the urge to boil the heck out of the tea to extract the last bit of stuff from it. Stir the tea leaves in with a spoon cover with a lid and let the tea leaves brew in the hot liquid for at least  minutes. This is what brings the true aroma and flavors out.Add sugar filter and serve.,IndianFood,d5w0va5,4,t5_2s65y
