,controversiality,parent_id,body,subreddit,id,score,subreddit_id
2798639,0,t1_cnm2w5u,Similar experience with my Candy s. But a hypothetical  early failure rate would be unacceptably high and consistent with both anecdotes. Unless you see a lot of these like in a shop you dont have that perspective. ,bikewrench,cnm7152,2,t5_2sje0
2830832,0,t1_cnpugv3,Thanks for the quick reply! Ill do a more thorough check of the padsrotors when I get home but my cursory examination showed that the pads were aligned and the rotor is true. What do you mean by a properly adjusted headset?  How do I check for this? Is there a chance that this is just an unfixable problem like my LBS said?,bikewrench,cnpuzwv,1,t5_2sje0
2881140,0,t1_cnviuy2,OK then. So just like any other chain then  just pick a spot. I wouldnt want to screw up my  chain tool! ,bikewrench,cnvl6gs,1,t5_2sje0
2889018,0,t1_cnwe157,Thats a very very common size. It should be easy to find.,bikewrench,cnwhgfb,1,t5_2sje0
2891106,0,t1_cnwgcjz,Hrm okay. Ill either try it myself with your instructions or take it to the LBS thank you. Bottom line though is that it should not be so easy to rotate the handlebars while riding and something needs to be tightened to correct it right?,bikewrench,cnwq0lk,1,t5_2sje0
2912098,0,t1_cnz3ver,Its an early s Specialized Rockhopper pro AI frame. ,bikewrench,cnz43c1,1,t5_2sje0
2925778,0,t1_co0nv93,Cool man. Good luck.,bikewrench,co0o59f,2,t5_2sje0
2927564,0,t3_2toc5j,Havent noticed drag myself? All adjusters are pretty similar internally you just might get a bit more blinggrip on the outside.,bikewrench,co0vhit,1,t5_2sje0
2956624,0,t3_2u0vp1,Test rides are important in some instances. If I replace a chain Ill always make sure that its not skipping under load. Sometimes a cassette can look like its in good shape but it will disagree with the new chain.Dont be suspicious of them test rides are just part of checking the work,bikewrench,co46lch,14,t5_2sje0
2961380,0,t1_co4p4os,Yes. Some aged cheddar on the new bolt before tightening should help guard against future unwindings. That or some blue LocTite.,bikewrench,co4q1w2,4,t5_2sje0
3022270,0,t1_cob6k76,I would hope that I dont have to replace all that Ive barely riden the thing.,bikewrench,cob97k0,1,t5_2sje0
3063479,0,t1_cofij6t,Yeah actually what this guy said.,bikewrench,cofiywu,2,t5_2sje0
3071229,0,t1_codh9wa,I dont have personal contacts at any of the New Jersey bike coops but theres a list of them here It might not be  current though.,bikewrench,cogbvv6,2,t5_2sje0
3080482,0,t1_coh97o7,Turns out the speed  stuff is cheaper and easier to find.  But speed chainring are the same width and should work fine with a speed chain and cassette right?,bikewrench,cohag76,1,t5_2sje0
3099699,0,t3_2vno6q,Find markings on the chain or take a clear picture for us.,bikewrench,coja6e7,3,t5_2sje0
3112555,0,t1_cokl94j,Normally I would be at work on my phone too but I have the day off and I have spent most of it on Reddit lol. Plenty of hubs if you search ebay or google for mm sp hub I suppose it depends on your preference for brands and how many spokes generally the options seem to show up most often as  or  holes but you can get Shimano Tiagra hubs for  or Shimano  hubs for  both of those are searchable on Amazon though I am sure you could find some good deals if you poked around on the interwebs.But basically you can find a ton of hubs that are speed and mm!,bikewrench,cokm5qs,1,t5_2sje0
3129492,0,t1_com9k9q,I had my commuter that had the same problem I finally got it off by attaching the crank removal tool to a bench vise and using the entire frame for leverage. If its really stuck give this a go.,bikewrench,comdbiu,1,t5_2sje0
3143120,0,t1_conrrly,deleted,bikewrench,cons5cl,1,t5_2sje0
3144303,0,t1_conv939,Their sp road groups are actually Exact Actuation. The CX derailleur is compatible with their sp shifters and all of their sp rear derailleurs road and mountain are compatible with the sp road shifters. You just need to match the shifters to the cassette. ,bikewrench,conwk5g,1,t5_2sje0
3151211,0,t3_2w8cxp,sometimes silicone lube like triflow will rejuvenate the rubber seals within the pump itself. but valve heads do have a lifespan and that all depends on how many times its been usedhow oldhow good it was originally.for a decent high pressure pump you should plan on spending  bucks and id go for the park or pedros brand im sure others will chime in with alternatives. it should have a pressure gauge in line and it sure is nice to have a head with both schrader and presta valve capabilities.and im sure you know how to expertly use a pump but ive seen people just mash a pump at random angles and distances so... straight up amp down yea?,bikewrench,coomcbq,0,t5_2sje0
3200395,0,t1_cotnz2x,Boraxo is even better and doesnt turn into cement in your pipes.,bikewrench,cotpy1y,3,t5_2sje0
3231095,0,t1_cowt1u7,deleted,bikewrench,cowwpoe,-3,t5_2sje0
3235769,0,t3_2x5vm7,I totally love the idea of the throwback rigid MTB. I kind of want to get rid of my fixie and build one of these Could potentially be built up with a multi speed hub.,bikewrench,coxe72a,3,t5_2sje0
3264592,0,t1_cp0djs1,Yeah thanks I saw that earlier. That would be great for me except that Im looking to slowly grow in builds from fixed to front to full suspension to lower my barrier pf entry into the bike industry. ,bikewrench,cp0e26u,1,t5_2sje0
3270879,0,t3_2xkp4v,I see a few potential issues nothing impossible but you should know what you might be up against.  Derailleur hanger  cant mount a derailleur without one. The image you posted shows no hanger mounting point. There are addon hangers out there and some lowend derailleurs come with hangers. You could also go with an internally geared hub which leads me to Rear dropout spacing  depending on your bike it may not be possible to fit a geared hub of any sort in the rear dropouts. Measure the distance between their internal faces. Cable routing  if you can put gears back there youll need a cable to operate them. Getting that from your bars to the rear end could take some creative housing work if there are no cable guideshousing stops. You can just run housing all the way but it adds friction and isnt ideal for indexed setups shifting where you have clicks. The workaround here would be to employ friction shifting no clicks you have to manually find the perfect amount of lever movement. Which then leads to Shifters  find ones that mount on your bar or stem depending on personal preferences and mechanical constraints. If you can use indexed shifting youll need shifters that match cable pull ratios. Not everything plays nicely here. Friction shifting again is a good workaround since its YOU doing the adjustments.So there are a bunch of potential issues. Obviously I cant tell you what to do without seeing your bike but in all honesty you could end up spending more money on adding gears than you would on a half decent used bike.,bikewrench,cp13uob,1,t5_2sje0
3272968,0,t1_cp1b6b1,Its near impossible to see but the frame does have a rear derailleur hanger. If it didnt Id look into getting a different frame set for such a build or stick with the IGH. The Tripper uses the same frameset as the Roper and Furley which can take an RD. None the less I appreciate you pointing it out in case I didnt realize such.,bikewrench,cp1cfzw,3,t5_2sje0
3291039,0,t1_cp3e5yl,Out of curiousity why not? Ive never actually done it myself but ever since I saw it its been in my bag of tricks for the one day when it does come up. Is there too much drag on the shift cables or are things just still awkward with the routing?,bikewrench,cp3el9u,1,t5_2sje0
3294230,0,t1_cp2hmp8,gt only several centimetersJesus. Thats a LOT man.Also keep in mind that metal can only be bent so many times.,bikewrench,cp3romk,1,t5_2sje0
3299909,0,t3_2xxpex,Youll have to remove the bar tape and then undo the clamps for the levers.  Remove two cables per unit.  Id replace the cable housing too if theyre old.Ive never replaced an integrated shifter before though.  Should not be too complicated if youre mechanically inclined.,bikewrench,cp4ezle,2,t5_2sje0
3316960,0,t1_cp6c5no,Tighten the rear derailleur cable tension there should be a barrel adjuster on the back of the derailleur. Shifting under heavy load is never going to be smooth. Learn to feel the shift point in your pedal rotation and lighten up for a split second as the pedal engages.,bikewrench,cp6d0u4,1,t5_2sje0
3322342,0,t3_2y7ide,Dont. You could easily fuck up the fork legs in the area where stress is most concentrated. Also its more likely to end up looking like a hacked up mess than anything else. ,bikewrench,cp6z4d9,4,t5_2sje0
3327043,0,t3_2y9b0h,If the shop changed out the cables this could just be cable stretch.In any case it just sounds like indexing on the back and limit settings on the front. I followed these two guides from Park Tool when I was first learning. GCNs got a video for the rear derailleur and front derailleur if youre more of a video person.,bikewrench,cp7idy1,3,t5_2sje0
3373521,0,t1_cpcsej6,OPs pics dont show a top cap. but whether or not heshe is using one itll be hard to get the stem down on top of the headset tightly and everything snugged together. and if you dont then there will be wiggle. add that wiggle to the decreased surface contact of having it clamped over the threads and i would expect it to be very possible that youd have the steering assembly popping right off the top of the steer tube while youre riding. maybe not today maybe not tomorrow but eventually. i dont like that idea one bit. steerer breakage is an issue? i wouldnt think so.. unless its a large person who rides really hard. i mean standing up and torquing hard on the handlebars. i dont think ive ever seen a steel steer tube broken from normal riding even with improvised systems like this. ,bikewrench,cpct187,-2,t5_2sje0
3376181,0,t1_cpd3okd,Youre welcoming me? You know where else I got welcomed? At your moms house. When I fucked her. An aluminum steerer doesnt just make a little difference it makes a massive difference. You just linked to a basically irrelevant video. A steel steerer can be filed a little and its fine. Absolutely fine. You could find a video of an anal prolapse on the Internet but it doesnt mean everyone in rgonewild needs you to give them the link and tell them buttsex is a bad idea. Fucking idiot. ,bikewrench,cpd3yfk,-1,t5_2sje0
3388750,0,t1_cpdlip7,There is no way you are flexing an SWorks Chain ring. Unless we are talking to Chris Hoy.Either your front derailleur is out of adjustment or your chainringchain are worn out. I peaked at your history and you seem to have a fixation on stiffness in parts and frames as well as using a ton of other industry jargon. I see the sales talk every day at work but even our reps make fun of the KoolAid that comes out of marketing.Just be careful with believing the things you read especially from people trying to sell you things. ,bikewrench,cpejlvn,0,t5_2sje0
3406879,0,t1_cpglk3t,The shifter is  years old and probably only around  kmI changed the housing as well sorry should have been more clear about that.No kinks or bends that i can tellMaybe i should also notice that it stopped shifting pretty suddenly while riding but i didnt hear any snap or anything. ,bikewrench,cpgly33,1,t5_2sje0
3427689,0,t1_cpiz1ae,Yeah but what im saying is that you paid them for a service and they didnt do it correctly. They should be willing to fix it without an additional charge. ,bikewrench,cpizd4s,6,t5_2sje0
3448474,0,t3_2zqctm,Theres no adjusting the rotor inboard in your case without basically shaving down the mounting surface for the rotor which you probably shouldnt risk doing. ,bikewrench,cplcp0h,2,t5_2sje0
3459647,0,t3_2zt7up,I am assuming it is an ISIS splined BB. You need a crank puller park tools ccp or cwp probs BB tool Park Tools BBT and an mm hex wrench. Get in there get greasy and replace that BB. Make sure you have the correct width and spindle length. ,bikewrench,cpmmixi,2,t5_2sje0
3475613,0,t1_cpod8xt,Cool thanks for your replay. I will leave it as it is ,bikewrench,cpog1om,1,t5_2sje0
3487898,0,t3_307ceb,A couple of things . There is no BB ultegra crank. There are adapters for bbmm spindle and thats what youll use. Not too hard to do. . I doubt that the wheelset is spd compatible. The freehub body isnt gonna be long enough. Upgrading your wheelset will make a much bigger difference than upgrading the group in my opinion. ,bikewrench,cppug84,6,t5_2sje0
3488755,0,t1_cpo1hhj,This has happened more times than Id like to admit.,bikewrench,cppxyqw,1,t5_2sje0
3489426,0,t3_3083jm,I didnt read the other response because it was too long. My advice get a cheapo toolkit for beginners and replace the tools you use up with nicer ones  . These kits wont have everything but theyll have most of what you need.Regular maintenance in decreasing order of frequency Air up your tires  every week Clean the chain  every  miles or as needed Replace the chain when it wears out  Replace brake pads when they wear out Replace the cables when they stick True wheels when they knock against your brakes Re grease bearings maybe once every  yearsReasonable people disagree over the order and frequency so take these as rules of thumb not canon.   ,bikewrench,cpq0psm,3,t5_2sje0
3516970,0,t1_cpt1kco,Alivio would be a little nicer than acera. Or do spd deore run it with the spd chain for a while and when chain and cassette get worn upgrade to spd with a new shifter. I mean its not necessary but the spd stuff is marginally nicer than spd,bikewrench,cpt5snf,1,t5_2sje0
3521370,0,t1_cpte5tw,Haha I was really confused for a moment there.Question is it not difficult to assemble the cockpit when its not attached to the stem? ,bikewrench,cptnu85,1,t5_2sje0
3522945,0,t1_cptotlg,No this is Patrick.,bikewrench,cptuag6,7,t5_2sje0
3524447,0,t3_30fqxp,Ive only ever really heard bad things about Specialized. Every other company seems to be pretty well liked.,bikewrench,cpu0g8b,1,t5_2sje0
3525305,0,t1_cpu0g8b,Aside from them being in demand and their marketing being a great thing for a shop to hitch on to they are kind of shitty.  Ive ordered parts and been told they go on with normal tools to find out I actually have to order a proprietary tool but I aside from the Gore and Raleigh rep the specialized rep does spend the most time with us even thought its like every  months.  Specialized as a company though really seems to do just about everything to alienate noncompeting customers until lately with their fitness advertisement on YouTube and the kids on bikes promotional.  Speaking of promotions they charged us  one time for a poster and  water bottles.  I dont know how we got suckered into that. ,bikewrench,cpu3yrs,1,t5_2sje0
3536527,0,t3_30qvah,The issue with shorter cranks is loss of leverage and shorter turining radius which wont allow for a full leg extension if you keep the other crank the current length. A pedal pendulum could be a better alternative you get close to normal circle radius full leg extension and reduced leg bending while maintaining a good leverage.I dont know if there are any suppliers for these where youre at but you have an European brand that has these hasebikes.comCheck how the part looks and worksYou can probably get these machined for you locally for cheaper.I fitted these to someone who had an amputation of one of the legs paired with a seat post that move the seat reward emulating a crank forward bike so she was able to reach the ground easier but still pedal with correct leg extension.PM me if you need any other details Id be glad to help you out.,bikewrench,cpvdxnr,4,t5_2sje0
3541726,0,t3_30uebp,A vigorous scrubbing with an old toothbrush sprayed with WD  followed by a blast of compressed or canned air would be my solution.  Repeat as needed.,bikewrench,cpvz9fa,2,t5_2sje0
3542438,0,t3_30uw5n,I was selling Giant bikes ampamp those free hubs gave me much grief. Giant sent us a box ampamp I lubed them with all kinds of different oils injected them with free hub buddies ampamp did everything short of a blood sacrifice to get them to work. All to no avail. If that were my hub Id rebuild it with a genuine Shimano rear hub. Something like this Im not sure if your wheel is  or a  spoke but make sure before you buy. The Shimano hub you can still get parts for anywhere ampamp will be able to for years to come.  You wont even need to change the spokes as they will be the same length for the new hub. Ive done this swap many times. I believe that spending any money on these oddball  free hubs is wasted money. Edit corrected ebay link. ,bikewrench,cpw26tu,5,t5_2sje0
3554942,0,t1_cpxfgrj,Well yeah.,bikewrench,cpxhk0b,0,t5_2sje0
3585159,0,t3_31ewhv,I usually dont blindly tell people to work on their own bikes without experience but this is the best way to get started if youre interested in working on the wrenching side of things. Generally Id say if you can build a bIke well from its boxedshipped state then you are of at least some value as a mechanic. Thats usually what it takes to get hired and then you can learn a LOT from there. Use youtube or the park site to learn things like adjusting derailleurs brakes and bearings hubheadsetbottom bracket. You should understand torque specs how to use them be able to confidently change flats do a simple dishtrue on wheels etc. Working on bikes is not difficult. The parts while they have many different standards and interfaces are not overly complicated. Even tearing apart suspension isnt too bad ifor  youre precise and patient. Being a good bike mechanic comes from your ability to carefully and correctly diagnose the problem while smiling and engaging with the customer. Sales is much the same as any retail position. If you can smile be personable and knowlearn the product youve got a shot. Just focus on whatever your local shop carries and read all about it. Now after all of that... you wont make a lot of money but youll meet some great people involved in the industry and ride great gear. I was a wrench on and off for  years through high school and college. Im convinced my first jobs were way less miserable than a lot of my friends. ,bikewrench,cq0xpwf,9,t5_2sje0
3600240,0,t1_cq2iits,IF it will work youll find it there but they dont list that wheel. They are great to call to ask the dude answers with just hello? and it sounds like hes in a tunnel,bikewrench,cq2nj4l,3,t5_2sje0
3610442,0,t3_31pgug,deleted,bikewrench,cq3tezv,1,t5_2sje0
3623347,0,t1_cq5a6f2,Allrighty!And sorry english isnt my first language that mightve been lost in translation but youre right. How can I fix it then? Its only when going moderately slow it squeaks it goes quiet again once I ride the bike and dont drag it.,bikewrench,cq5ae1p,1,t5_2sje0
3653765,0,t1_cq8mwtk,Just ooking for a little more specificity. Raceface hope  have been mentioned here. Have you tried higher end sram? Specifically some of the stiffer carbon direct drive stuff? ,bikewrench,cq8r79n,2,t5_2sje0
3677279,0,t1_cqbdo95,gt Dont use solvents like WDMeaning solvents of the WD variety not all solvents of which WD is one.  My understanding of the difference between that variety and typical degreaserssolvent degreasers is that WD and its brethren leave behind a very light oil which is too light for most bicycle applications this after the fact being partially what displaces other lubricants.  Perhaps there is some caveat about straight degreasers but barring that my statement should be sound.My statement under the latter assumption was grammatically ambiguous but not in actuality incorrect though I can understand the mixup.  Try not to jump on people so quickly with your newsflashes.,bikewrench,cqbfmmf,3,t5_2sje0
3695587,0,t1_cqdhjcf,Its a very old setup halfstep where adjacent back gears differed by  in the number of teeth and the front gears differed by  in the number of teeth therefore letting you step halfway between the rear gears,bikewrench,cqdis92,3,t5_2sje0
3701808,0,t1_cqdxpne,Yes I meant the top cap.It seems the crown race is missing so I guess I have to order a complete headset and install it from scratch. All the bearings are greased and rotate smoothly.,bikewrench,cqe8beo,1,t5_2sje0
3713238,0,t3_32we3r,If you are worried have a shop drill it out and insert a heli coil which is a threaded insert meant to replace damaged threads.,bikewrench,cqfj9f4,2,t5_2sje0
3768894,0,t3_33i83q,gt The old one is about a links length longer than the new one from stretch.Thats a LOT of wear.  Heres what happens when a chain stretches...  When brand new each tooth on the cassette is being pulled by each link of the chain.  That means the force of you pedaling is spread out over the whole chain wrap worth of teeth.  As the chains rollers and pins wear the chains pitch effectively grows meaning they dont line up perfectly with each tooth anymore.  This means the chain now puts its force onto fewer teeth at a time since the stretched chain cant apply force past the first few teeth it contacts.  This causes increased wear of your cassette.  The increased gaps between teeth do sort of work with the worn chain for awhile because those worn open gaps help accomodate the stretched chain but then when you put on a new chain youre screwed.Proper replacement chain stretch limit is somewhere close to  and youve gone to .  Your cassette is basically gone.,bikewrench,cqlvqpt,2,t5_2sje0
3801791,0,t1_cqplywn,I wouldnt be online questioning the ability of a shop I consider my shop,bikewrench,cqpmuc4,-8,t5_2sje0
3810285,0,t1_cqqle3i,pressing pistons fully into the caliper means to remove the brake pads and use a box end of a wrench to fully push in the piston to reset it.,bikewrench,cqqlpr5,1,t5_2sje0
3824193,0,t3_34639p,The pump gauge is really just reading the air pressure in the pump hose.  Often when you remove a pump hose from a valve the leaking sound is just air escaping from the pump hose not the tire.The tire valve only accepts air when the hose pressure is greater than that of the tire pressure.  The tire valve a springloaded valve that is also forced shut by the air pressure in the tire. Air only enters the tire when the pressure outside the valve e.g. in the pump hose is greater than the pressure inside the tire.  Thus if your tire is at  psi and your pump hose is only at  psi the tire valve is still shut and no air has entered or left the tire.  Only when the pump hose reaches above psi will air from the hose enter the tire. The pressure shown on your pump gauge is merely the highest effective pressure achieved in the pump hose while the tire valve was open. Try pumping your pump really slowly while attached to the valve to get a good measurement of the actual tire pressure.  When you pump quickly nonideal gas characteristics and air fluid viscosity end up distorting the gauge measurement.  Slow pumping gives a more accurate gauge measurement assuming the gauge is accurate for static pressures.,bikewrench,cqs6vi7,1,t5_2sje0
3851517,0,t1_cqv5mmq,Its definitely in the front end. I have the wheel on and apply pressure to the side. Ive tightened the skewer and pulled fork out and greased headset. Its a Campy sealed hub but could it come from that? ,bikewrench,cqvb3u7,1,t5_2sje0
3874269,0,t1_cqxvbd9,This is an entirely appropriate response,bikewrench,cqxwel1,4,t5_2sje0
3884788,0,t1_cqyzwfo,I dont think I have ever seen a bottom bracket that just took a pipe wrench usually its a pin wrench locking tool or one of the bottom bracket cup tools like this,bikewrench,cqz3l38,0,t5_2sje0
3919391,0,t1_cr2p4ew,If Park Tools website would work...Park Tools also has a lot of great technical guides for how to adjust most modern parts from start to finish. Better than Sheldon Brown IMO if youre going to be assembling bikes with new parts. Sheldons info is better for a coop or hobbyist mechanic who deals with lots of old shit. Toeing is adjusting the angle of the brake pad so that the front of the pad from a riders perspective hits ever so slightly before the back of the pad when youre gently squeezing the lever. Were talking like mm gap. Business card gap kinda deal. And yeah lightest touch. You ideally want all of the pad to contact the rim when youre squeezing with normal braking force. The gap is there because having the pads toed makes Vbrakes less squeaky. ,bikewrench,cr31orw,1,t5_2sje0
3930680,0,t1_cr4bdkx,Thanks. Searching in the jagwire website led me to the answer ,bikewrench,cr4c0aa,6,t5_2sje0
3942537,0,t3_35l6og,Thanks for all the replies. I think Ive just about hacked it together. The conelock nut part was more complicated than I realised  I kind of thought it just screwed back on. Anyway  its back on and didnt immediately fall off. Counting that as a win. ,bikewrench,cr5olfk,1,t5_2sje0
3958882,0,t1_cr7f5ud,Integrated headset no cups required. ,bikewrench,cr7jo7c,1,t5_2sje0
3974038,0,t1_cr9933w,Not true.  speed cassettes will fit on the same hub.,bikewrench,cr99v25,1,t5_2sje0
3984952,0,t3_3637yc,I put the bearing retainer in upside down once and it there was a tight spot in the steering I think you would definitely notice. ,bikewrench,craiqef,1,t5_2sje0
3991327,0,t1_crb8hu3,Ahhh external was the word I couldnt come up with. I knew threaded wasnt descriptive enough. ,bikewrench,crb8u9n,1,t5_2sje0
4031648,0,t1_crfesez,That product is not the Sunlite version.,bikewrench,crfu7nc,2,t5_2sje0
