,controversiality,parent_id,body,subreddit,id,score,subreddit_id
2533254,0,t3_2oox4h,This was always my favourite.,Meme_Graveyard,cmp8duh,2,t5_35b24
2544468,0,t3_2ouv6c,Here is what the linked meme says in case it is blocked at your schoolwork or is unavailable for any reasonYoure the man now dog  gtPost Title  YTMND gtTop  YOURE THE MAN  NOW gtBottom  DOG Original Link | Meme Template,Meme_Graveyard,cmqp5yl,1,t5_35b24
2544788,0,t3_2orpdw,Leave Britney Alone meme is now Spoiled Teenager,Meme_Graveyard,cmqqo1a,11,t5_35b24
2548335,0,t3_2owewm,pressing  just gets to the good stuff,Meme_Graveyard,cmr7dbk,2,t5_35b24
2550158,0,t1_cmrfhed,Yeah this is not a serious place.,Meme_Graveyard,cmrfyob,3,t5_35b24
2572907,0,t3_2p8wtw,I had someone pay me for a  transaction   and  in singles ,Meme_Graveyard,cmuf13h,5,t5_35b24
2600433,0,t1_cmy0gyn,I want to turn this into a thing. Im going to mine for another gem tonight.,Meme_Graveyard,cmy0igh,2,t5_35b24
2621367,0,t3_2pwllc,Lets cheer up Keanu by upvoting this post to the frontpage ,Meme_Graveyard,cn0r12m,3,t5_35b24
3101609,0,t3_2vlwna,Id give you  karma for this opinion if I could.,Meme_Graveyard,cojhb1x,2,t5_35b24
3854367,0,t3_34j7ez,Also Baa Baa Black Sheep.,Meme_Graveyard,cqvmtb8,3,t5_35b24
3892702,0,t3_35181t,rip in peace ,Meme_Graveyard,cr0036j,2,t5_35b24
4864047,0,t3_3hglqi,Hahaha literally how I feel everytime I get payed. Then its gone ,Meme_Graveyard,cu7nf34,2,t5_35b24
5277732,0,t3_3n8p5t,donk moo moo,Meme_Graveyard,cvmahbg,2,t5_35b24
10025208,0,t3_5j62uw,Upvot if u cri evertim,Meme_Graveyard,dbeb9af,12,t5_35b24
