,controversiality,parent_id,body,subreddit,id,score,subreddit_id
5775527,0,t3_3u2osr,Really dig it! Quality is on point!,SmallYTChannel,cxd0ay5,1,t5_2wvij
6348321,0,t3_42gpns,Looks like a really fun Garys mod game mode ,SmallYTChannel,czb8eqf,1,t5_2wvij
6971037,0,t3_4ad68r,Steinfield Cloverfield Lane spoof trailer ,SmallYTChannel,d16i5ws,1,t5_2wvij
7294086,0,t1_d242dcm,Thanks for taking the time to have a watch and comment,SmallYTChannel,d27ae1g,1,t5_2wvij
7802780,0,t3_4m6f40,Ah hello again! ,SmallYTChannel,d3t3d9d,0,t5_2wvij
8587153,0,t1_d6eyqj7,If you cant find them then take these girl    www. sexyyoutubers .com lilchiipmunkleakednudespicsvideos DELETE SPACES girl    girl   girl   xcutx. com girlaccidentallyflashesforgettingturnoffcameralivestream   DELETE SPACES ,SmallYTChannel,d6ezdiy,2,t5_2wvij
8682954,0,t3_4ywpv1,EEEEVERYTHING IS AWESOME,SmallYTChannel,d6qzt7x,1,t5_2wvij
9185949,0,t3_565bsh,Could you be any less specific?,SmallYTChannel,d8gdwq1,1,t5_2wvij
9417633,0,t3_59n0vi,Thanks,SmallYTChannel,d99r0qp,1,t5_2wvij
9567149,0,t1_d9mvhjv,Lol thanks man hope you have fun too!,SmallYTChannel,d9schqu,1,t5_2wvij
9608328,0,t3_5ckmcm,Thanks i really wanted to waste  seconds on a illegal video,SmallYTChannel,d9xf8d4,1,t5_2wvij
9848837,0,t3_5gd929,I subbed to your channel. ,SmallYTChannel,darbr8l,1,t5_2wvij
9899636,0,t3_5h70ut,Awesome vid dude interested in exchanging subs? Ill go check your channel out. Looking forward to more vids! Or just watch and see if you like the vid!  ,SmallYTChannel,daxy1wy,1,t5_2wvij
10165799,0,t3_5lk99a,I hope you enjoy!!!,SmallYTChannel,dbwcl4a,1,t5_2wvij
10175766,0,t1_dbxgzgl,Thanks for the feedback! I was thinking of working on an animation of sorts as an intro but that will take time and I have a bad track record with getting art done in a timely fashion so I may make something more simple as a temporary solution. Same goes for an outro screen as you suggested.Im still a bit awkward when it comes to commentary so intros still kind of jar me in a sense  I choke up c but I will definitely work on getting more enthusiasm in there! Thanks again.  I appreciate it!,SmallYTChannel,dbxh9jg,1,t5_2wvij
10460642,0,t1_dctt76s,Thats very fair. As long as you are enjoying what you do keep doing it! What is your channel? same as your user name? I might want to check it out.,SmallYTChannel,dcttixj,1,t5_2wvij
10574188,0,t1_dd6j4g1,No worries hope it all works out!,SmallYTChannel,dd6n7xj,1,t5_2wvij
10662048,0,t3_5sgmyr,That was a great game the way you patrolled C and B helped your team to pull away and win.,SmallYTChannel,ddfpjbj,1,t5_2wvij
10699729,0,t1_ddjk4gk,Lol,SmallYTChannel,ddjliru,1,t5_2wvij
10992442,0,t3_5wyyv1,I love ld! ,SmallYTChannel,dedyimb,2,t5_2wvij
11170549,0,t3_5zhbxr,I really tried to look for one but even inmendham has k subs.,SmallYTChannel,dey64i5,2,t5_2wvij
