,controversiality,parent_id,body,subreddit,id,score,subreddit_id
6713450,0,t1_d0dh6oo,didnt even know that existed haha on my way!,shittyshittyadviceani,d0dq8ax,2,t5_39yu7
6844058,0,t3_49iutx,Here is what the linked meme says in case it is blocked at your schoolwork or is unavailable for any reasonWhats an Aluminum Falcon  gtPost Title  The World would not accept their love. gtTop   gtBottom  HAMMER DOWN Original Link | Meme Template,shittyshittyadviceani,d0s2vvq,2,t5_39yu7
7010601,0,t3_4bohwo,Here is what the linked meme says in case it is blocked at your schoolwork or is unavailable for any reasonSpongeBob Nopants  gtPost Title  Chlamydia gtTop  YOU WILL CATCH A VD gtBottom  IF YOU DONT DO YOUR HOMEWORK! Original Link | Meme Template,shittyshittyadviceani,d1azy15,1,t5_39yu7
7491621,0,t1_d2tr7kt,silly bitch your weapons cannot harm me,shittyshittyadviceani,d2tr929,1,t5_39yu7
7557680,0,t3_4irkbz,no one is to blame,shittyshittyadviceani,d319skd,2,t5_39yu7
8654480,0,t3_4yfwoi,Here is what the linked meme says in case it is blocked at your schoolwork or is unavailable for any reasonoklahoma  gtPost Title  It is natural if it occurs in nature gtTop  HEY BRO gtBottom  WHATS YOUR SAFE WORD? Original Link | Meme Template,shittyshittyadviceani,d6nfall,2,t5_39yu7
