,controversiality,parent_id,body,subreddit,id,score,subreddit_id
1106065,0,t3_26sh69,Histogram  Post Karma   One X  . points.   XXXXXXXXXXXXXXXXXXXXXXXXXXXXXXXXXXXXXXXXXXXXXXXXXXXXXXXXXXXX  uDEATHBYCIRCLEJERK    XXXXXXXXXXXXXXXXXXXXXXXXXXXXXXXXXXXXXXXXXXXXXXX  uhockeyrugby    XXXXXXXXXXXXXXXXXXXXXXXXXXXXXXXXXXXXXXXXXX  utk    XXXXXXXXXXXXXXXXXXXXXXXXXXXXXXXXXXXXXXX  usimpsonsfanhere    XXXXXXXXXXXXXXXXXXXXXXXXXXXXXXXXXXX  ufallsey    XXXXXXXXXXXXXXXXXXX  umigzeh    XXXXXXXXXXXXXXXX  uMistaC    XXXXXXXXXXXXXXX  uRawtashk    XXXXXXXXXXXXX  uTheSlickMachine    XXXXXXXXXXXX  ujavaski    XXXX  upbs    XXX  uCuriousme    XXX  ukubabubba    XXX  ulookwhostalking    XX  ubroadcastterp    X  udannyboy    X  uBlisterBox    X  uryanjrr    X  uhavoc    X  unosoupforyou    X  umscarce    X  uPhoneDojo    X  umikehilton    X  uTheRealIrish    X  ukaiserspike      uDoonesbury      uraconteur      utechemagination      uvalentinsteph      ujpr      uBrogasmic      uplayhandminton      ustarkness      uaanka      uunreal      uDnWeava      umraemistry      uzaphod      uOlympicWeightLifting      ubadfantasyadvice      uBWilks      uTheReckonist      uhemmicw      ujakeodonnell      uOB      ukoomclimb      uCornishPaddy      ukeywhip      uJM      uSqueenis       Histogram  Comment Karma   One X  . points.   XXXXXXXXXXXXXXXXXXXXXXXXXXXXXXXXXXXXXXXXXXXXXXXXXXXXXXXXXXXX  ulathedownsally   XXXXXXXXXXXXXXXXXXXXXXXXXXXXXXXXXXXXXXXXXX  ujared   XXXXXXXXXXXXXXXXXXXXXXXXXXXXXXXXXX  uTroyMcClure   XXXXXXXXXXXXXXXXXXXXXXXXX  uwatercurtaincave   XXXXXXXXXXXXXXXXXXXXXXXX  utenderbranson   XXXXXXXXXXXXXXXXXXXXXX  unailsinch   XXXXXXXXXXXXXXXXXXXXX  uZiggaroll   XXXXXXXXXXXXXXXXXXXX  uTheScruffy   XXXXXXXXXXXXXXXXXXX  uobjectonmydesk   XXXXXXXXXXXXXXXXXXX  u   XXXXXXXXXXXXXXXXX  uhardcorerecondo   XXXXXXXXXXXXXXXX  uHereForTheGangBang   XXXXXXXXXXXXX  uDodgerFan   XXXXXXXXXXXXX  uMisterMichigander   XXXXXXXXXXXXX  udouchetorials   XXXXXXXXXXXXX  uToTheMoon   XXXXXXXXXXXX  uEulogy   XXXXXXXXXXXX  uspeeglevillean   XXXXXXXXXXX  uRawtashk   XXXXXXXXXXX  uthrownaway   XXXXXXXXXXX  ufuchwa   XXXXXXXXXXX  uCompeau   XXXXXXXXXX  udconnorp   XXXXXXXXXX  u   XXXXXXXXXX  uHBonDRUGS   XXXXXXXXX  uBilboBanginz   XXXXXXXXX  uRyanH   XXXXXXXXX  uPKPUofK   XXXXXXXXX  upropperspeling   XXXXXXXXX  uTheKrs   XXXXXXXXX  uiKilledDaPig   XXXXXXXX  uMKUltron   XXXXXXXX  uShadft   XXXXXXXX  uLAshotgun   XXXXXXXX  uSavagebody   XXXXXXXX  uheactuallydoes   XXXXXXXX  usolprose   XXXXXXX  uDiversityisaShip   XXXXXXX  urickysauce   XXXXXXX  udestiny   XXXXXXX  utheheadsage   XXXXXXX  uyeswecatan   XXXXXXX  uMrVanguard   XXXXXXX  unerdface   XXXXXXX  uRunescaper   XXXXXXX  uJJReddit   XXXXXX  uPissYellowSpark   XXXXXX  uVespyre   XXXXXX  ucakescarab   XXXXXX  uRaptorDelta   ,subredditreports,chu0m0t,1,t5_30uy0
1125801,0,t3_270mr2,Histogram  Number of comments per user   One X  . comments.   XXXXXXXXXXXXXXXXXXXXXXXXXXXXXXXXXXXXXXXXXXXXXXXXXXXXXXXXXXXX  ummmasian   XXXXXXXXXXXXXXXXXXXXXXXX  uEklassen   XXXXXXXXXXXXXXXXXXXXXXXX  uTotesbannedx   XXXXXXXXXXXXXXXXXXXXXXX  uBZenMojo   XXXXXXXXXXXXXXXXXXXXX  uMurreey   XXXXXXXXXXXXXXXXXXXXX  umrpopcorn   XXXXXXXXXXXXXXXXXXX  uNornIron   XXXXXXXXXXXXXXXXXXX  uEeZBa   XXXXXXXXXXXXXXXXXXX  uOKfour   XXXXXXXXXXXXXXXXXXX  uJustMadeThisNameUp   XXXXXXXXXXXXXXXXX  uColinMetro   XXXXXXXXXXXXXXXXX  uSaltySteveD   XXXXXXXXXXXXXXXX  uMulderD   XXXXXXXXXXXXXXXX  ufettevr   XXXXXXXXXXXXXXX  uDark   XXXXXXXXXXXXXXX  usudevsen   XXXXXXXXXXXXXXX  uwhitewater   XXXXXXXXXXXXXXX  ucysghost   XXXXXXXXXXXXXXX  uAquamanForever   XXXXXXXXXXXXXX  uNomdeguerre   XXXXXXXXXXXXXX  uMovieMarker   XXXXXXXXXXXXXX  uTheGreatChatsby   XXXXXXXXXXXXXX  ualtoid   XXXXXXXXXXXXXX  uAFishCalledWalter   XXXXXXXXXXXXXX  uAceBricka   XXXXXXXXXXXXXX  uFlynn   XXXXXXXXXXXXX  uDancingCthulhu   XXXXXXXXXXXXX  uisarge   XXXXXXXXXXXXX  u   XXXXXXXXXXXXX  uDaLateDentArthurDent   XXXXXXXXXXXXX  uDollaDillz   XXXXXXXXXXXXX  uPlaneis   XXXXXXXXXXXXX  uZorroMeansFox   XXXXXXXXXXXX  uModsCensorMe   XXXXXXXXXXXX  uYoungCinny   XXXXXXXXXXXX  ujulbull   XXXXXXXXXXXX  uRickonTarg   XXXXXXXXXXX  ucontrarian   XXXXXXXXXXX  umegablast   XXXXXXXXXXX  uChickennWaffles   XXXXXXXXXXX  uRainman   XXXXXXXXXXX  uReggieLeBeau   XXXXXXXXXXX  uRobertoCruzing   XXXXXXXXXXX  uzotquix   XXXXXXXXXX  uBenjaminTalam   XXXXXXXXXX  uDurdensWrath   XXXXXXXXXX  uKJB   XXXXXXXXXX  uTheLadyEve   XXXXXXXXXX  udarkrabbit   XXXXXXXXXX  uBarrySteinfeld      Histogram  Karma per Comment   Considering only the top  commenters   One X  . points.   XXXXXXXXXXXXXXXXXXXXXXXXXXXXXXXXXXXXXXXXXXXXXXXXXXXXXXXXXXXX . uLiteraryBoner   XXXXXXXXXXXXXXXXXXXXXXXXXXXXXXXXXXXXXXXXXXXXXXXXXXXXXXXXXX . uTareXmd   XXXXXXXXXXXXXXXXXXXXXXXXXXXXXXXXXX . uformfett   XXXXXXXXXXXXXXXXXXXXXXXX . uwhitewater   XXXXXXXXXXXXXXXXXXXXXX . ummmasian   XXXXXXXXXXXXXXXXXXXXXX . uKJB   XXXXXXXXXXXXXXXXXXXX . uAFishCalledWalter   XXXXXXXXXXXXXXXXXXX . uTotesbannedx   XXXXXXXXXXXXXXXXXXX . ucysghost   XXXXXXXXXXXXXXXXXXX . umrpopcorn   XXXXXXXXXXXXXXXXXX . ualtoid   XXXXXXXXXXXXXXXXXX . uOKfour   XXXXXXXXXXXXXXXXX . udarkrabbit   XXXXXXXXXXXXXX . uEklassen   XXXXXXXXXXXXX . usaber   XXXXXXXXXXXXX . uachshar   XXXXXXXXXXXX . uTheLadyEve   XXXXXXXXXXXX . uSaltySteveD   XXXXXXXXXXXX . uNornIron   XXXXXXXXXXX . uDollaDillz   XXXXXXXXXXX . ufettevr   XXXXXXXXXX . uMonkeyJunk   XXXXXXXXXX . uRainman   XXXXXXXXXX . u   XXXXXXXXX . uMurreey   XXXXXXXXX . uDaLateDentArthurDent   XXXXXXXX . umadism   XXXXXXXX . uBarrySteinfeld   XXXXXXXX . uBenjaminTalam   XXXXXXXX . uMovieMarker   XXXXXXXX . uCollumMcJingleballs   XXXXXXXX . uTheGreatChatsby   XXXXXXX . uMulderD   XXXXXXX . uBZenMojo   XXXXXXX . uDudeBigalo   XXXXXXX . uZorroMeansFox   XXXXXXX . uisarge   XXXXXXX . uRobertoCruzing   XXXXXXX . uEeZBa   XXXXXXX . uhimynameis   XXXXXX . umostclevernickname   XXXXXX . uzotquix   XXXXXX . uAceBricka   XXXXXX . uReggieLeBeau   XXXXXX . uNomdeguerre   XXXXX . uTheOnionLaddie   XXXXX . uRickonTarg   XXXXX . uignoremeimhigh   XXXXX . uAquamanForever   XXXXX . uEdgarFrogandSam   ,subredditreports,chw9f9q,1,t5_30uy0
1126329,0,t3_270w97,Histogram  Post Karma   One X  . points.   XXXXXXXXXXXXXXXXXXXXXXXXXXXXXXXXXXXXXXXXXXXXXXXXXXXXXXXXXXXX  uTheRealIrish    XXXXXXXXXXXXXXXXXXXXXXXXXXXXXXXXXXXXXXXXXXXXXXXXXXXXXXXXXX  upizzaforeveryone    XXXXXXXXXXXXXXXXXXXXXXXXXXXXXXXXXXXXXXXXXXXXXXXXXXX  ulillyjb    XXXXXXXXXXXXXXXXXXXXXXXXXXXXXXXXXXXXXXXXXXXXXXXXXX  uReginaldMartin    XXXXXXXXXXXXXXXXXXXXXXXXXXXXXXXXXXXXXXXXXXXXXXXXX  udfoolio    XXXXXXXXXXXXXXXXXXXXXXXXXXXXXXXXXXXXXXXXXXXXXX  uSupaZT    XXXXXXXXXXXXXXXXXXXXXXXXXXXXXXXXXXXXXXXXXXXXX  ucrnnut    XXXXXXXXXXXXXXXXXXXXXXXXXXXXXXXXXXXXXXXXXXXX  uTyrannosaurusSloth    XXXXXXXXXXXXXXXXXXXXXXXXXXXXXXXXXXXXXXXXXXX  ufubes    XXXXXXXXXXXXXXXXXXXXXXXXXXXXXXXXXXXXXXXXXX  ulemonboss    XXXXXXXXXXXXXXXXXXXXXXXXXXXXXXXXXXXXXXXXXX  uYesIWasThere    XXXXXXXXXXXXXXXXXXXXXXXXXXXXXXXXXXXXXXX  uifeelluckyharry    XXXXXXXXXXXXXXXXXXXXXXXXXXXXXXXXXXXXXXX  utheoxinator    XXXXXXXXXXXXXXXXXXXXXXXXXXXXXXXXXXXXXXX  uTheBlueScream    XXXXXXXXXXXXXXXXXXXXXXXXXXXXXXXXXXXXX  uIAMARickyBobby    XXXXXXXXXXXXXXXXXXXXXXXXXXXXXXXXXXXXX  utanman    XXXXXXXXXXXXXXXXXXXXXXXXXXXXXXXXXXXX  ucarvedog    XXXXXXXXXXXXXXXXXXXXXXXXXXXXXXXXXXXX  uKumiankka    XXXXXXXXXXXXXXXXXXXXXXXXXXXXXXXXXXX  uJM    XXXXXXXXXXXXXXXXXXXXXXXXXXXXXXXXXX  uImportantRhino    XXXXXXXXXXXXXXXXXXXXXXXXXXXXXXXXXX  uelilanger    XXXXXXXXXXXXXXXXXXXXXXXXXXXXXXXXXX  uButtermiytoast    XXXXXXXXXXXXXXXXXXXXXXXXXXXXXXXXX  uzsreport    XXXXXXXXXXXXXXXXXXXXXXXXXXXXXXXXX  uTechnolog    XXXXXXXXXXXXXXXXXXXXXXXXXXXXXXXX  uaCentauri    XXXXXXXXXXXXXXXXXXXXXXXXXXXXXXX  uBoredAttorney    XXXXXXXXXXXXXXXXXXXXXXXXXXXXXXX  uGpSnyder    XXXXXXXXXXXXXXXXXXXXXXXXXXXXXX  uyepyep    XXXXXXXXXXXXXXXXXXXXXXXXXXXXX  uYimmy    XXXXXXXXXXXXXXXXXXXXXXXXXXXXX  uFlatlinerX    XXXXXXXXXXXXXXXXXXXXXXXXXXXXX  ukcin    XXXXXXXXXXXXXXXXXXXXXXXXXXXXX  uTorinoFermic    XXXXXXXXXXXXXXXXXXXXXXXXXXXXX  uxxkinetikxx    XXXXXXXXXXXXXXXXXXXXXXXXXXXX  uDayz    XXXXXXXXXXXXXXXXXXXXXXXXXXXX  uFlukie    XXXXXXXXXXXXXXXXXXXXXXXXXXXX  uSmartass    XXXXXXXXXXXXXXXXXXXXXXXXXXX  uiamtheonlyirishman    XXXXXXXXXXXXXXXXXXXXXXXXXXX  uUnsettingSun    XXXXXXXXXXXXXXXXXXXXXXXXXX  uSinjako    XXXXXXXXXXXXXXXXXXXXXXXXXX  ufireball    XXXXXXXXXXXXXXXXXXXXXXXXX  uRCam    XXXXXXXXXXXXXXXXXXXXXXXXX  uMyNamesEarle    XXXXXXXXXXXXXXXXXXXXXXXXX  ugiggerman    XXXXXXXXXXXXXXXXXXXXXXXXX  uPianoProdigy    XXXXXXXXXXXXXXXXXXXXXXXXX  umisterlanks    XXXXXXXXXXXXXXXXXXXXXXXXX  ummofan    XXXXXXXXXXXXXXXXXXXXXXXX  ukolalid    XXXXXXXXXXXXXXXXXXXXXXX  ucharleythechoochoo    XXXXXXXXXXXXXXXXXXXXXXX  uYvesSch    XXXXXXXXXXXXXXXXXXXXXXX  ucrockettman       Histogram  Comment Karma   One X  . points.   XXXXXXXXXXXXXXXXXXXXXXXXXXXXXXXXXXXXXXXXXXXXXXXXXXXXXXXXXXXX  uneutlime   XXXXXXXXXXXXXXXXXXXXXXXXXXXXXXXXXXXXXXXXXXXXXXXXXXXXXXXX  uVYJ   XXXXXXXXXXXXXXXXXXXXXXXXXXXXXXXXXXXXXXXXXXXXXXXXXXXXX  ucatchmilo   XXXXXXXXXXXXXXXXXXXXXXXXXXXXXXXXXXXXXXXXXXXXXXXXXXXX  uxisytenin   XXXXXXXXXXXXXXXXXXXXXXXXXXXXXXXXXXXXXXXXXXXXXXXXXX  usexquipoop   XXXXXXXXXXXXXXXXXXXXXXXXXXXXXXXXXXXXXXXXXXXXXXXXX  uj   XXXXXXXXXXXXXXXXXXXXXXXXXXXXXXXXXXXXXXXXXXXXXXX  uLikeABossInc   XXXXXXXXXXXXXXXXXXXXXXXXXXXXXXXXXXXXXXXXXX  utminus   XXXXXXXXXXXXXXXXXXXXXXXXXXXXXXXXXXXXXXXXX  uImportantRhino   XXXXXXXXXXXXXXXXXXXXXXXXXXXXXXXXXXXXXXXXX  uindifferentmeh   XXXXXXXXXXXXXXXXXXXXXXXXXXXXXXXXXXXXXXXXX  uAnInternetPersona   XXXXXXXXXXXXXXXXXXXXXXXXXXXXXXXXXXXXXXXX  uEataBullet   XXXXXXXXXXXXXXXXXXXXXXXXXXXXXXXXXXXXXXXX  uping   XXXXXXXXXXXXXXXXXXXXXXXXXXXXXXXXXXXXXXX  uMANCREEP   XXXXXXXXXXXXXXXXXXXXXXXXXXXXXXXXXXXXXXX  uweuw   XXXXXXXXXXXXXXXXXXXXXXXXXXXXXXXXXXXXX  uTheMusic   XXXXXXXXXXXXXXXXXXXXXXXXXXXXXXXXXXXX  uCBate   XXXXXXXXXXXXXXXXXXXXXXXXXXXXXXXXXXX  uBrbnoo   XXXXXXXXXXXXXXXXXXXXXXXXXXXXXXXXXXX  urediphile   XXXXXXXXXXXXXXXXXXXXXXXXXXXXXXXXXX  ukiseraitpa   XXXXXXXXXXXXXXXXXXXXXXXXXXXXXXXXXX  uIhavetheinternets   XXXXXXXXXXXXXXXXXXXXXXXXXXXXXXXXXX  uposlime   XXXXXXXXXXXXXXXXXXXXXXXXXXXXXXXXXX  unevermindthisrepost   XXXXXXXXXXXXXXXXXXXXXXXXXXXXXXXX  uIseethetruth   XXXXXXXXXXXXXXXXXXXXXXXXXXXXXXXX  uerereaf   XXXXXXXXXXXXXXXXXXXXXXXXXXXXXXX  uhopalongc   XXXXXXXXXXXXXXXXXXXXXXXXXXXXXXX  ubutterflydisses   XXXXXXXXXXXXXXXXXXXXXXXXXXXXXXX  uBrewand   XXXXXXXXXXXXXXXXXXXXXXXXXXXXXXX  uOznog   XXXXXXXXXXXXXXXXXXXXXXXXXXXXXXX  uTHcB   XXXXXXXXXXXXXXXXXXXXXXXXXXXXXX  uExpertTRexHandler   XXXXXXXXXXXXXXXXXXXXXXXXXXXXXX  uDrEagleclaw   XXXXXXXXXXXXXXXXXXXXXXXXXXXXXX  uDarkLeoDude   XXXXXXXXXXXXXXXXXXXXXXXXXXXXXX  uTheBQE   XXXXXXXXXXXXXXXXXXXXXXXXXXXXX  ucallgreenbeans   XXXXXXXXXXXXXXXXXXXXXXXXXXXXX  usaysAverysmallman   XXXXXXXXXXXXXXXXXXXXXXXXXXXXX  uAhhSheQueefed   XXXXXXXXXXXXXXXXXXXXXXXXXXXXX  uhornyfroglife   XXXXXXXXXXXXXXXXXXXXXXXXXXXXX  ubk   XXXXXXXXXXXXXXXXXXXXXXXXXXXXX  uZombieshateninjas   XXXXXXXXXXXXXXXXXXXXXXXXXXXXX  uJHensley   XXXXXXXXXXXXXXXXXXXXXXXXXXXXX  uBunchyRain   XXXXXXXXXXXXXXXXXXXXXXXXXXXX  uminisplit   XXXXXXXXXXXXXXXXXXXXXXXXXXXX  uPirateMud   XXXXXXXXXXXXXXXXXXXXXXXXXXXX  uADonutAMA   XXXXXXXXXXXXXXXXXXXXXXXXXXX  uNoNeedForAName   XXXXXXXXXXXXXXXXXXXXXXXXXX  uiAMtheJoe   XXXXXXXXXXXXXXXXXXXXXXXXXX  uItsapseudonym   XXXXXXXXXXXXXXXXXXXXXXXXXX  uxUbuntu   XXXXXXXXXXXXXXXXXXXXXXXXX  uGoogleOpenLetter   ,subredditreports,chwbkhp,1,t5_30uy0
1129461,0,t3_272815,Histogram  Number of comments per user   One X  . comments.   XXXXXXXXXXXXXXXXXXXXXXXXXXXXXXXXXXXXXXXXXXXXXXXXXXXXXXXXXXXX  uStrazdas   XXXXXXXXXXXXXXXXXXXXXXXXXXXXXXXXXXXXXX  uAutoModerator   XXXXXXXXXXXXXXXXXXXXXXXXXXXXXXXXXXXXX  uDMZDragon   XXXXXXXXXXXXXXXXXXXXXXXXXXXXXXXXXX  uRiffyDivine   XXXXXXXXXXXXXXXXXXXXXXXXXXXXXXXXX  uAdmiralDonut   XXXXXXXXXXXXXXXXXXXXXXXXXXXXXXX  uMrTrator   XXXXXXXXXXXXXXXXXXXXXXXXXXXXX  uDegru   XXXXXXXXXXXXXXXXXXXXXXXXXXXXX  uNBKxSmokey   XXXXXXXXXXXXXXXXXXXXXXXXXXXX  uzang   XXXXXXXXXXXXXXXXXXXXXXX  uAggressionSsb   XXXXXXXXXXXXXXXXXXXXXXX  umasongr   XXXXXXXXXXXXXXXXXXXXXX  uGGPong   XXXXXXXXXXXXXXXXXXXXXX  uredisnotdead   XXXXXXXXXXXXXXXXXXXXXX  uTheBlueGhost   XXXXXXXXXXXXXXXXXXXXXX  uYMCADonations   XXXXXXXXXXXXXXXXXXXXX  uChRoNicBuRrItOs   XXXXXXXXXXXXXXXXXXXXX  uTheCodexx   XXXXXXXXXXXXXXXXXXXX  unamboy   XXXXXXXXXXXXXXXXXXX  uTheAppleFreak   XXXXXXXXXXXXXXXXXXX  uKilleri   XXXXXXXXXXXXXXXXXXX  uskwdward   XXXXXXXXXXXXXXXXXX  uShank   XXXXXXXXXXXXXXXXX  uPTM   XXXXXXXXXXXXXXXXX  uepsilonnought   XXXXXXXXXXXXXXXXX  uTaintedSquirrel   XXXXXXXXXXXXXXXX  ureece   XXXXXXXXXXXXXXXX  uDANNYonPC   XXXXXXXXXXXXXXXX  ufuzzycamel   XXXXXXXXXXXXXXX  uPubstarHero   XXXXXXXXXXXXXXX  uCheese   XXXXXXXXXXXXXXX  uInboardPG   XXXXXXXXXXXXXXX  uMelvar   XXXXXXXXXXXXXXX  uTKoMEaP   XXXXXXXXXXXXXXX  uflipoffaclif   XXXXXXXXXXXXXXX  uzeroaxedzx   XXXXXXXXXXXXXX  uPlebDestroyer   XXXXXXXXXXXXXX  uTheghost   XXXXXXXXXXXXXX  utomcrews   XXXXXXXXXXXXXX  uravenouscraving   XXXXXXXXXXXXXX  usocsa   XXXXXXXXXXXXXX  uGlassToilets   XXXXXXXXXXXXX  uKeksus   XXXXXXXXXXXXX  uunrealeck   XXXXXXXXXXXXX  uBrugWuppi   XXXXXXXXXXXXX  uKahhmezzy   XXXXXXXXXXXXX  uspazturtle   XXXXXXXXXXXX  uJwood   XXXXXXXXXXXX  uPillowTalk   XXXXXXXXXXXX  uSnewpDoge   XXXXXXXXXXXX  udaly      Histogram  Karma per Comment   Considering only the top  commenters   One X  . points.   XXXXXXXXXXXXXXXXXXXXXXXXXXXXXXXXXXXXXXXXXXXXXXXXXXXXXXXXXXXX . upedro   XXXXXXXXXXXXXXXXXXXXXXXXXXXXXXXXXXXXXXXXXXXXXXXX . uMcShizzL   XXXXXXXXXXXXXXXXXXXXXXXXXXXXXXXXXXXXX . uNBKxSmokey   XXXXXXXXXXXXXXXXXXXXXXXXXXXXXXXXXXX . uAdmiralDonut   XXXXXXXXXXXXXXXXXXXXXXXXXXXXXXXXX . uNullAmbitions   XXXXXXXXXXXXXXXXXXXXXXXXXXXXXXXXX . uMelvar   XXXXXXXXXXXXXXXXXXXXXXXXXXXXXXX . uKilleri   XXXXXXXXXXXXXXXXXXXXXXXXXXXXXX . uTaintedSquirrel   XXXXXXXXXXXXXXXXXXXXXXXXXXX . ujoe   XXXXXXXXXXXXXXXXXXXXXXXXXXX . uTheghost   XXXXXXXXXXXXXXXXXXXXXXX . uzang   XXXXXXXXXXXXXXXXXXXXXX . uInboardPG   XXXXXXXXXXXXXXXXXXXXXX . umasongr   XXXXXXXXXXXXXXXXXXXXX . uTheCaveTroll   XXXXXXXXXXXXXXXXXXXX . uunrealeck   XXXXXXXXXXXXXXXXXXX . uflipoffaclif   XXXXXXXXXXXXXXXXXX . uemufood   XXXXXXXXXXXXXXXXXX . uShank   XXXXXXXXXXXXXXXXXX . uspazturtle   XXXXXXXXXXXXXXXXX . ujpwns   XXXXXXXXXXXXXXXXX . uTheAppleFreak   XXXXXXXXXXXXXXXXX . uGlassToilets   XXXXXXXXXXXXXXXXX . uDMZDragon   XXXXXXXXXXXXXXXXX . uzeroaxedzx   XXXXXXXXXXXXXXXXX . uNinjaverkill   XXXXXXXXXXXXXXXX . uwarpchaos   XXXXXXXXXXXXXXXX . uKeksus   XXXXXXXXXXXXXXXX . uepsilonnought   XXXXXXXXXXXXXXX . uphishfd   XXXXXXXXXXXXXXX . uBrugWuppi   XXXXXXXXXXXXXXX . uMrTrator   XXXXXXXXXXXXXXX . uDANNYonPC   XXXXXXXXXXXXX . usocsa   XXXXXXXXXXXXX . uYMCADonations   XXXXXXXXXXXXX . unamboy   XXXXXXXXXXXXX . ufuzzycamel   XXXXXXXXXXXXX . ucadaverco   XXXXXXXXXXXXX . uTKoMEaP   XXXXXXXXXXXX . uJunoh   XXXXXXXXXXXX . uMrPoontang   XXXXXXXXXXXX . uonepennytoomany   XXXXXXXXXXX . uDankTurtle   XXXXXXXXXX . uGGPong   XXXXXXXXXX . uLegtayor   XXXXXXXXXX . uPTM   XXXXXXXXXX . uTheBlueGhost   XXXXXXXXXX . ureece   XXXXXXXXXX . uTheCodexx   XXXXXXXXXX . usolutions   XXXXXXXXX . uRyuuki   ,subredditreports,chwo9py,1,t5_30uy0
1140648,0,t3_276tnb,Gilded Comments   |Ups|Downs|Author|Post Title|Link to comment||||||||||uBlindfoldedNinja|LPT Minimize your wallet and put it in your front pocket! the case against the backpocket wallet.|link|||uizelpii|LPT How to remember something in the short term|link|||ushadmed|LPT REQUEST best way to stay awakealert while driving?|link,subredditreports,chxxmh3,1,t5_30uy0
1155958,0,t3_27d72e,Gilded Comments   |Ups|Downs|Author|Post Title|Link to comment||||||||||uCyberCheese|A flight crew is landing at an unfamiliar airport.|link|||ujdym|Why doesnt Magneto wear his old costume anymore?|link,subredditreports,chzntqu,1,t5_30uy0
1170322,0,t3_27j15m,Most Popular Comments   |Ups|Downs|Author|Post Title|Link to comment||||||||||ubilalhouri|Game of Thrones exposed the science of skull crushing|link|||uCricket|Its time for the US to use the metric system|link|||uesmifra|Neil deGrasse Tyson Explains How Republicans Blew It on Climate Change. The host of Cosmos dishes on our warming planet why science is trending in our culture and the meaning of a groundbreaking science TV experiment.|link|||upnewell|Neil deGrasse Tyson Explains How Republicans Blew It on Climate Change. The host of Cosmos dishes on our warming planet why science is trending in our culture and the meaning of a groundbreaking science TV experiment.|link|||ucoldfusion|Game of Thrones exposed the science of skull crushing|link|||uzombiesonme|Its time for the US to use the metric system|link|||uMagnap|Its time for the US to use the metric system|link|||uJLipari|Its time for the US to use the metric system|link|||uathelard|Its time for the US to use the metric system|link|||usealless|Its time for the US to use the metric system|link|||uOathedsworn|Women Call Other Women Sluts to Guard Their Social Standing|link|||unoen|Neil deGrasse Tyson Explains How Republicans Blew It on Climate Change. The host of Cosmos dishes on our warming planet why science is trending in our culture and the meaning of a groundbreaking science TV experiment.|link|||upooscifer|Women Call Other Women Sluts to Guard Their Social Standing|link|||uPixelpaws|Probability of contracting HIV after having heterosexual vaginal sex with an infected partner n times. I found this surprising. Its apparently never too late to start using condoms. OC|link|||uWhyAmINotStudying|Its time for the US to use the metric system|link|||uKegnaught|Its time for the US to use the metric system|link|||uGiacomoironchef|Its time for the US to use the metric system|link|||upinkmango|Its time for the US to use the metric system|link|||uscienceprose|Neil deGrasse Tyson Explains How Republicans Blew It on Climate Change. The host of Cosmos dishes on our warming planet why science is trending in our culture and the meaning of a groundbreaking science TV experiment.|link|||uarchiesteel|Neil deGrasse Tyson Explains How Republicans Blew It on Climate Change. The host of Cosmos dishes on our warming planet why science is trending in our culture and the meaning of a groundbreaking science TV experiment.|link|||utempusmodicus|Republicans Have It Backwards When It Comes to Science  Climate change alongside income inequality rates as the greatest challenge of our time|link|||urags|Its time for the US to use the metric system|link|||upnewell|Neil deGrasse Tyson Explains How Republicans Blew It on Climate Change. The host of Cosmos dishes on our warming planet why science is trending in our culture and the meaning of a groundbreaking science TV experiment.|link|||upinkmango| lb Ancient Crocodile Discovered Should Be Subject of Next Scyfy Movie|link|||uentab|Its time for the US to use the metric system|link|||uvwermisso|Its time for the US to use the metric system|link|||uGentlemanGreen|Scientists achieve quantum teleportation of data with  accuracy|link|||uleemur|Scientists achieve quantum teleportation of data with  accuracy|link|||uwarpzero|Godfather of ecstasy Sasha Shulgin who introduced MDMA and hundreds of psychoactive substances dies at |link|||uapcyk|Game of Thrones exposed the science of skull crushing|link|||uCompMolNeuro|Congress Tells Scientists IPCC Climate Report Not Science|link|||upnewell|Neil deGrasse Tyson Explains How Republicans Blew It on Climate Change. The host of Cosmos dishes on our warming planet why science is trending in our culture and the meaning of a groundbreaking science TV experiment.|link|||udeeppantsmcgee|Researchers have just discovered that erythritol the main component of the popular sweetener Truvia kills insects.  first discovered by ninth grader who tested the effects of different sugars and sugar substitutes on fly health and longevity for his science fair|link|||urags|Its time for the US to use the metric system|link|||uGodRaine|Its time for the US to use the metric system|link|||uafs|Its time for the US to use the metric system|link|||uTastyPaper|Neil deGrasse Tyson Explains How Republicans Blew It on Climate Change. The host of Cosmos dishes on our warming planet why science is trending in our culture and the meaning of a groundbreaking science TV experiment.|link|||upnewell|Neil deGrasse Tyson Explains How Republicans Blew It on Climate Change. The host of Cosmos dishes on our warming planet why science is trending in our culture and the meaning of a groundbreaking science TV experiment.|link|||uitty|Women Call Other Women Sluts to Guard Their Social Standing|link|||uanmusvox|Scientists achieve quantum teleportation of data with  accuracy|link,subredditreports,ci1a5d1,1,t5_30uy0
1176634,0,t3_27lm6g,Histogram  Post Karma   One X  . points.   XXXXXXXXXXXXXXXXXXXXXXXXXXXXXXXXXXXXXXXXXXXXXXXXXXXXXXXXXXXX  uliekarma    XXXXXX  uDeuceMcStinkle    XXXX  uRoxmore    XX  uferndaleacidscene    XX  uthparallelpodcast    X  udsperad      upunisherx       Histogram  Comment Karma   One X  . points.   XXXXXXXXXXXXXXXXXXXXXXXXXXXXXXXXXXXXXXXXXXXXXXXXXXXXXXXXXXXX  upunisherx   XXXXXXXXXXXXXXXXXXXXXXXXXXXXXXXXXXXXXXXXXXXXXXXXXXX  uliekarma   XXXXXXXXXXXXXXXXXXXXXXXXXXXXXXXXXXXX  usnr   XXXXXXXXXXXXXXXXXXXXXXXX  uTracerBulletth   XXXXXXXXXXXXXXXXXXXXXXXX  ughostdate   XXXXXXXXXXXXXXXXXXXXX  uannesthesia   XXXXXXXXXXXXXXXXXXXXX  ujsl   XXXXXXXXXXXXXXXXXXXXX  uneurofluxation   XXXXXXXXXXXXXXXXXX  ubarkwahlberg   XXXXXXXXXXXXXXXXXX  udsperad   XXXXXXXXXXXXXXX  uMrMiyamoto   XXXXXXXXXXXX  uCosmicPube   XXXXXXXXXXXX  uDeuceMcStinkle   XXXXXXXXX  uBATTLEBEARD   XXXXXXXXX  uHawkman   XXXXXXXXX  uLunarCarnivore   XXXXXXXXX  uPopularIrony   XXXXXXXXX  uSpaekona   XXXXXXXXX  uSunlit   XXXXXXXXX  uelectricpuppy   XXXXXXXXX  uemptyvoices   XXXXXXXXX  upixidusk   XXXXXX  uBathedInDeepFog   XXXXXX  uImidazole   XXXXXX  uhereleezard   XXXXXX  uhypersonicplatypus   XXX  uJosie   XXX  uLesFuries   XXX  uchips   XXX  uferndaleacidscene   XXX  ufirebug   XXX  uwintercane     udamhi     uAmaedoux     usatisfyinghump   ,subredditreports,ci1zp5i,1,t5_30uy0
1183296,0,t3_27o8yu,Most Popular Comments   |Ups|Downs|Author|Post Title|Link to comment||||||||||uFlowersForMegatron|...and  minutes.|link|||uextremx|...and  minutes.|link|||uAfterSpencer|...and  minutes.|link|||udafrimp|...and  minutes.|link|||uhmyscience|xpost from rfunny Graduation card from uMrDaveIsAwesomes dad.|link|||uOrrinH|Star Wars Episode VII Leaked Images|link|||uMcNeese|Inside the Hubble Telescope|link|||usupergalactic|The Evolution of Magnetos Helmet from the XMen Films|link|||uagenthex|xpost from rfunny Graduation card from uMrDaveIsAwesomes dad.|link|||uAfterSpencer|...and  minutes.|link|||ulimicolous|Suddenly I feel there should be a Rocketeer sequel.|link|||uTranquilThought|Best  Page I have ever seen|link|||ucptwolf|The Evolution of Magnetos Helmet from the XMen Films|link|||uPLEASETAGME|...and  minutes.|link|||uannyRAR|...and  minutes.|link|||uBlvck|Streaming Video Accounts for Large Share of Mobile Data|link|||utravio|Suddenly I feel there should be a Rocketeer sequel.|link|||ubobby|The Evolution of Magnetos Helmet from the XMen Films|link|||unotallther|...and  minutes.|link|||uMadeByMonkeys|Bikini season is here!|link|||uwoyteck|The Evolution of Magnetos Helmet from the XMen Films|link|||uNoAirBanding|...and  minutes.|link|||uTigerRei|Star Wars Episode VII Leaked Images|link|||uChocobean|xpost from rfunny Graduation card from uMrDaveIsAwesomes dad.|link|||udinofan|Bikini season is here!|link|||uBowzerman|...and  minutes.|link|||uMisterBigStuff|The Evolution of Magnetos Helmet from the XMen Films|link|||uhardspank|Suddenly I feel there should be a Rocketeer sequel.|link|||uDathadorne|Star Wars Episode VII Leaked Images|link|||uHumanPersonMan|Suddenly I feel there should be a Rocketeer sequel.|link|||uxkcdtranscriber|...and  minutes.|link|||ucreon|Inside the Hubble Telescope|link|||ukenba|The Evolution of Magnetos Helmet from the XMen Films|link|||udarkeststar|The Evolution of Magnetos Helmet from the XMen Films|link|||uanimatorgeek|xpost from rfunny Graduation card from uMrDaveIsAwesomes dad.|link|||ugardobus|...and  minutes.|link|||uCaptMorgan|Best  Page I have ever seen|link|||usoulstealer|Star Wars Episode VII Leaked Images|link|||uScoutSilico|Star Wars Episode VII Leaked Images|link|||uextremx|...and  minutes.|link,subredditreports,ci2qnna,1,t5_30uy0
