,controversiality,parent_id,body,subreddit,id,score,subreddit_id
5221994,0,t1_cvelwck,Ive seen a discussion about Cruella on CollegeHumor that I cant find right now. They said that she was planning on raising the puppies and killing them as adults but she was about to get caught so she decided to just kill the ones she had so far. I assume she adopted as many as she could but you cant adopt  dalmatians.The Stepmother thinking her ugly daughters would get picked over her beautiful step daughter still counts as being stupid.,rational,cvffxid,1,t5_2rdak
5230422,0,t3_3mnc4j,More fun with Orochimaru.,rational,cvgggn9,7,t5_2rdak
5231655,0,t3_3mnc4j,Awesome chapter.  Orochimaru continues to wreck all of the good guys plans and Im loving him for it.  Despite Ankos secret pleasure at Hinatas emigration theres no way that this isnt a crushing blow to their plans.  Orochimaru continues to play one level higher than her and their remaining options just dropped way down.  His utter competence is great.Honestly I would be totally fine if they ended up joining Sound or at least the genin and work with Orochimaru to expand it and save the Elemental Nations from destruction presumably the Republic but the Akatsuki and other related things are huge threats as well. I just want to see more of this guy and the nation hes made.,rational,cvglt3p,9,t5_2rdak
5236384,0,t1_cve6las,And that should be a warning to all humanity.,rational,cvh6ad7,1,t5_2rdak
5245768,0,t3_3mr6uz,Ive mentioned this before but Animorphs and the Ellimist Chronicle put a way of abstract thinking into my brain that I find useful for understanding causality.The Legend of Zelda Links Awakening started me on the path of evaluating just what the nature of life and reality is.,rational,cviaygc,3,t5_2rdak
5250280,0,t1_cviu84n,.,rational,cviuj2i,5,t5_2rdak
5262176,0,t1_crypzq5,gtDo you disagree that the implied contents and results of the red pill advice Red read were idealized as compared with the depths that actual online redpill communities can sink to?You might be taking this too seriously.gtAs the current Pope I suppose I would have to agree with that assessment says Orange. Though as the current UN Secretary General I am disturbed by your fanatical religious literalism.,rational,cvkaur5,1,t5_2rdak
5275369,0,t1_cvlziw7,Friend if Scooby Doo didnt exist Id be a completely different person. ,rational,cvlzl99,5,t5_2rdak
5277663,0,t1_cvm8oid,I can imagine a series where magic does run on a cellular automaton or other formalism but its the beginning of the Enlightenment and the scientific method has just been invented. Until now sorcerors have used magic by sheer trial and error and now they are actually getting to understand the structure. The main characters would be in the position of doing all that research from the ground up given a short time frame on the book this could fit within the authors ability to imagine. Ideally this would be handled something like the  universe where Flint set up the rules and then opened it to other authors so that the history would feel real. He keeps control over the broad strokes of things e.g. theres a master list of uptimers and youre not allowed to make up more but individual authors can go off in their own direction. ,rational,cvma5tz,7,t5_2rdak
5313000,0,t3_3nq1kc,Ive been thinking about Fallout Equestria. Specifically the scene where s Fluttershy demonstrates her first healing megaspell. Not only do I find the idea that those soldiers would rise up to continue fighting to the death implausible given their recent neardeath experience Fluttershy somehow got this secret project to the battlefield without anyone knowing what her ministry had been doing or what she was going to do. Or that Fluttershy herself wouldnt consider that a battlefield is not the best place to test this new technology out or that the megaspell technology wouldnt be used to amplify anything that Fluttershy would maybe be not so okay with. And then I wondered if Fluttershy really wanted peace why would she not plot for peace throughout the entire war and do all she could to ensure that the world would not be destroyed?So basically I want rational Fluttershy to save Equestria. s The Element of XRisk.,rational,cvqsqqe,1,t5_2rdak
5345910,0,t1_cvuwoi9,Same. But in my case it would be mostly because I just want to be as intelligent as possible and Im willing to take the risk.,rational,cvv00m5,1,t5_2rdak
5347628,0,t1_cvv2wsp,If only we had input authentication on these counterfactual scenarios!,rational,cvv7xdz,10,t5_2rdak
5418911,0,t1_cw4a3we,If you click on the title image on any chapter it will take you to the TOC for the story.  There you can find a link to every chapter as well as the glossary and background summation of HPMOR.,rational,cw4bntl,1,t5_2rdak
5420705,0,t1_cw4cwvx,Would it be sad to use a time loop to be the first to post on MoL posts?,rational,cw4jw5a,3,t5_2rdak
5425960,0,t1_cw57eau,With that said if a military has an actual policy of sacrificing civilian lives in order to preserve those of soldiers then one has to ask why its a military at all as opposed to an autonomous combatfocused collective like Akatsuki.,rational,cw580yr,14,t5_2rdak
5434170,0,t1_cw5lhax,Most of the one translated is about the path towards OPness. However not all are made equal.I shall seal the heaven is an example of a great chinese webnovel. Unlike the rest of its peers the MC wasnt shoved with luck like the IET novels e.g. coiling dragon. Nor the MC slaugher its way like in Martial God Ashura maybe? I didnt read itOr you can always find translated proper novels amp some more webnovels in here You can find the translation of Condor Heroes series which is very popular in East asia. So much so that it has its anime. I personally recommend A step into the past by Huang Yi. It is quite rational IMO.In the end though you do need to understand some chinese culture to able to understand some their novels. Rebirthreincarnation is not a common sense in every culture.I think the sheer size of Chinese population overseas Chinese included makes it not as important to promote their novels outside their own region.That is unlike Korea which depend their economy with that culture push.,rational,cw69pwh,2,t5_2rdak
5439578,0,t3_3pjlos,Start up a gold mining company up in the Yukon.,rational,cw6yjph,1,t5_2rdak
5440787,0,t1_cw72y8w,The Tokra have long term memory of ascetic self discipline trying to reacquire their old culture?,rational,cw743kn,5,t5_2rdak
5447738,0,t1_cw7vy21,I think one or both of us are losing track of what were disagreeing about here. My original point visavis AugSphere was that the Leaf military was a real military because if it were a bunch of murderhobos or a de facto dictatorship it would be a very poor one. Are we still arguing about whether the Leaf military is plausibly a selfserving organisation that exerts indirect control over the government to its selfish benefit or is it something else?gtPrimarily from their own ninja village I would think. But why would this be an issue? The Hokage also depends on his own ninja to not kill him. Because the Hokage is trusting his Leaf ninja to serve the interests of Leaf. Under your theory the Daimyo is trusting his Leaf ninja not to serve the interests of Leaf at least where they clash with his own.gtI feel like youre arguing this by looking at the Naruto world and pointing out all the things that are nonsensical while forgetting that you can do the exact same thing with the real world.This is the point that makes me think were talking at crosspurposes. Ive been giving examples why based on Narutoverse canon it is implausible that the ninja are completely selfserving and yet do not choose to assert direct control over the Fire Country government and thus why we have to assume that Leaf is in fact a loyal military. Its not an exercise in pointing out the nonsensical elements of the Narutoverse for its own sake but rather of elements that become nonsensical under the conditions of a certain hypothesis being true.In regard to the Congress example well yes there are nonsensical things aplenty in the real world. But we cant merely say there is nonsense in the real world therefore we should be free to accept a hypothesis that results in nonsense in the Narutoverse.,rational,cw801wx,2,t5_2rdak
5466100,0,t1_cwa5fvj,No this song is liquid happiness.,rational,cwacgnb,3,t5_2rdak
5466795,0,t3_3pwxo5,This week got an amazing idea for a rationalist book that plan to make on Transhumanism but still need to get the time to tackle the challenge. I consider myself below average with words but tend to find trouble getting a plot going without going to extremes if Im enjoying the comedy it ends up as a parody if Im making it about despair it ends up being a hopeless story so want to get the planning right before starting it.Got all the plots done and know how it will end currently need to set aside some time to read about how to make a successful book and perhaps practice with some fanfiction.Also my plan for a rational Madoka Rebellion Story doujin is going well minus the fact I suck at drawing and trying to get it solved. Made my first drawing of the cover but it took lots of time to complete hope to get better at it and work faster.,rational,cwafnne,3,t5_2rdak
5474044,0,t1_cwbaof6,I mean if youre in the setting then you have strong evidence of the memory thing because of resurrection spells and if youre not in that particular setting then the rules are different. Not knowing what the certainly existing afterlife is like is still a reason to put off dying but youll have plenty of intelligent people who decide to bet on the good gods not being douchebags to their followers after death. Granted I only really played . so Im not a Planescape expert.,rational,cwbczka,11,t5_2rdak
5476717,0,t1_cwborge,Its worse by some regards but its always been the one that does NOT have the old age limit in the versions Ive seen. When did they change that?Ive had this discrepancy come up before so now Im curious if anyone knows when this disrepency came into play?Checking around it looks like Im not the only one who remembers reincarnate being the other way.In pathfinder it still says it the way I remember anyone know when this particular nerfing snuck in?,rational,cwbpa1m,1,t5_2rdak
5515509,0,t1_cwgmwiq,OP here. Thanks for the advice but that was another redditor offering me grammar help.,rational,cwgnn9x,1,t5_2rdak
5519004,0,t1_cwgtqzj,Hurt dat ego?,rational,cwh3pnu,1,t5_2rdak
5526892,0,t1_cwi1jgj,gt Why should we posit complicated hypotheses to explain the apparent violation of thermodynamics in canon as really just an elaborate technology when we can go with the perfectly reasonable explanation of Physics as we know it in our universe is subordinate to magic in HPs universe. By what metric are you comparing them? I guarantee you it isnt math. Saying that physics is subordinate is faux simplicity youre using associative intuition to hide the actual complexity of the hypothesis. We have two very elegant descriptions of reality in comparison and many hypotheses that are wellsupported even outside those theories like the second law of thermodynamics and conservation of massenergy. A world of magic does not supersede some natural order because a world of magic has magic written into its physics. Magic is natural. The unifying theory has to account for magic and it has to account for the petabytes of physical data weve gathered.Apparent deviations from things like the second law of thermodynamics have to be explained because without magic and theres no way to know if the observations were actually performed without magic without developing a theory of magic! we have observed massive amounts of evidence for a specific set of worldstates and somehow no data for this massive expansion of configuration space and it is very important that we ascertain that magic reverses entropy or whatever crap youre assuming in your OP. You cannot simply say that magic disregards all of that data you have to verify it. Even if you as a worldbuilder wave your wand of Authorial Fiat over the setting you as a character do not know it to be a fact even if you assume it in the unjustified way youre claiming is justified.gtWhat we see in canon is actually whats happening.Tautologically. That doesnt mean that all that is happening is seen.And if youre bringing up academia in Harry Potter might I point out that you cant actually conjure permanent objects or transfigure food? There is evidence in canon for magics nonworldbreaking properties!,rational,cwi3ya6,1,t5_2rdak
5528063,0,t1_cwi75fz,I mostly agree with both your points howevers Anemone doesnt want too many of her spawn drifting through time and overlapping each others territorial centuries. One assumes her spawn  will reach an equilibrium between intelligence required to survive or risk getting caught. Your second point is also entirely reasonable even if she has laid her eggs many months ago. Lobsters typically carry their eggs with them for months and then lay them to gestate for several months more. I admit it was mostly for plot reasons that she didnt skip a century after she captured Vick. But she does have a psychological terror of running into the original builders which prevents her from jumping into the far future,rational,cwi9bxh,1,t5_2rdak
5530424,0,t3_3quhyp,How do I best word a Divination to find someone who may or may not be dead? I know the guys name and I suspect he is behind the construction of a secret mutant army and a simulacrum of the current king. ,rational,cwik6ln,3,t5_2rdak
5533940,0,t1_cwguujj,gt thats what Im getting from what youre writing.Really? Because if you read again thats not what I was saying.,rational,cwj0cw2,2,t5_2rdak
5543716,0,t1_cwjbhs9,Hahaha thanks. I really didnt think youd bother. Nice hair. Congratulations on becoming invincible.,rational,cwk8z68,3,t5_2rdak
5599512,0,t3_3rtehp,Dont then.If you cant empathize with their goals and think that they are stupid or silly for doing so then spend time thinking about their backstory and why they would ever want to pursue this particular action and see if you can change their reasons even if it amounts to the same thing in the end.If you are trying to write about people acting stupid then  think about what flaws they must have to cause their inability to properly reason about their choices.If youre trying to write about unpleasant individuals then think about what formative events caused their terrible personality. Its easier to relate to someone being a bigot if everyone who hurt them in their childhood was of the same race.Expand their backstories to make them into multidimensional characters.,rational,cwr68ad,34,t5_2rdak
5671419,0,t3_3ssekj,For the last few updates every time I try to read the story I get a page saying Access Denied. Does anyone know of an alternate method of reading it?,rational,cx03gct,2,t5_2rdak
5674106,0,t3_3st1p6,Granted I only watched like  episodes of this but I can hardly call this anime rational. Sure theres some interesting trivia regarding bones. But the show is basically sherlock holmes if he was a youngish woman which instead of actually being a detectivewith knowledge in a very wide set of fields  was a osteologist so needed much more convenient cases so as to give the MC a particular edge.And by episode  they were already resorting to DEUS EX episode s They were babysitting a lost little girl and had no leads to where she came from. and just so happened to stay at a park where a girl from the male MCs school passed by and it turned out she knew the little girl.,rational,cx0fg9m,12,t5_2rdak
5682594,0,t1_cx0mnms,Are you talking about the RWBY fanfic The Games we Play? Because if so the description you provided didnt seem to fit it at all. But you said thanks. So Im confused ,rational,cx1hcb2,3,t5_2rdak
5724752,0,t1_cx6g2ww,Which part of avoid endofmanga spoilers did you not understand?,rational,cx6pmp7,1,t5_2rdak
5793986,0,t1_cxfarls,qntmgt   UTCgt Heres another SCP Tale by me! Its called CASE COLOURLESS GREEN and its the first part of a twoparter This message was created by a botContact creator code,rational,cxfarph,2,t5_2rdak
5824488,0,t3_3uvugg,deleted,rational,cxj4641,1,t5_2rdak
5824727,0,t1_cxj1s0r,The first problem there is that you are imposing your values on everyone else in existence which is morally reprehensible. The second problem is if your value function isnt quite what you think it is. There are lots of things that we want to want and its easy to tell ourselves that we actually want them. Having something show you your true value function might be decidedly unpleasant. ,rational,cxj5asa,11,t5_2rdak
5824969,0,t1_cxj5asa,Everyone wants to fulfill their own values. Thats what values mean. And every action takes effect on other people.,rational,cxj6fze,6,t5_2rdak
5847142,0,t1_cxm2xfj,Id call the rest of the world realistic if not completely rational. Its conceivable that we would act in that manner albeit the book may have exaggerated the worlds response. They seemed a bit too invested in one man.,rational,cxm36z0,4,t5_2rdak
5856083,0,t1_cxn6mi4,Eeeeeeeeeeeeeeeeeeee,rational,cxn9edh,2,t5_2rdak
5873217,0,t1_cxphcyb,Yeah I know that feeling... Kinda been wanting to expand the fandoms I read to stuff like Legend of Zelda and Fire Emblem but theres so few fics for them that its hard to find good ones much less ones thatre either complete or stillupdating.,rational,cxpidz2,1,t5_2rdak
5874916,0,t1_cxppymo,I know. Scifi is still a semireasonable way of getting a few of the likeliest possibilities into the public consciousness or examining a few specific aspects likely to be shared by many of them.,rational,cxpqeh9,1,t5_2rdak
5882777,0,t3_3vtqxk,Caught up.I dont like it. The story feels empty the characters feel empty and each chapter feels like a story in and by itself with no real flow between them.Some changes in characterization like Gaara are very interesting but they are lost in a sea of marionettes.,rational,cxqrjtr,5,t5_2rdak
5885635,0,t1_cxr4tsr,Sand is heavy when it gets wet.,rational,cxr525p,3,t5_2rdak
5892755,0,t3_3vy73t,This is surreal. I remember writing this but I dont feel like I did. For one it doesnt dissolve into crack halfway through.I guess I should clean it up and put it somewhere more readable. And add some crack.,rational,cxs2om8,8,t5_2rdak
5918232,0,t1_cxuyt6e,Wed be glad to have you on board.,rational,cxvetm9,2,t5_2rdak
5926709,0,t1_cxw70ba,I would pay to see the discussion you have when your parents sat you down and asked you why little Tommy and Rachel were discussing the ethics of child rape a la nature vs nurture.,rational,cxwitun,3,t5_2rdak
5929856,0,t1_cxwx1i7,With dependentlyvarying measures of take away yes.,rational,cxwxokb,2,t5_2rdak
5936934,0,t3_3wovoq,ITS HAPPENING!,rational,cxxv26e,2,t5_2rdak
5944205,0,t3_3wsj1u,Ill finally participate in the biweekly challenge this week though Im guessing the DampD theme will draw more submissions than usual.,rational,cxytcw6,3,t5_2rdak
5972735,0,t1_cy2dlft,Author responses seek clarification at your own risk. s Eib dain and hirac are all layers of the same mental architecture which evolved coincidentally with telepathy.  In this AU taking Alloran was the VERY FIRST move of the war meaning that the Andalites were not aware of the Yeerks as a threat at the time.  Hooray base seven this was layered in earlier but is way more obvious when youre inside Axs head.  Hooray taboos.  The Path is more than just military doctrine its a term I made up and isnt part of canon.  Its more an expression of the incredible social pressure that emerges from a telepathic society in which the prevailing belief simply IS the quote truth unquote.  This was previously translated as mustshouldpleasetruthunity in the interlude to show that there are all kinds of shades of meaning but in the absolute its simply the image of a welltrodden paththis is wherehow everyone walks.  Bright nearcertain glow likely shade iffy dark wishful thinking.,rational,cy2k1oa,7,t5_2rdak
5972772,0,t1_cy2dlft,Earlier Elfangor used base two. I suppose its possible that they just use both of them. Sort of like how programmers prefer powers of two when dealing with computers.,rational,cy2k7z3,5,t5_2rdak
5978865,0,t1_cy2qj97,While I agree with the general thrust of what youre saying language is magitech I disagree with your analysis that English would be easier than frenchlatinGerman. The structure you identify in the other languages at least exists in English you have the much less useful scenario where one word may in fact turn out to be  different words depending entirely upon context and the words around it.So if you scan a basic book of grammar rules and then scan active conversations youre likely to learn a lot more than you would with a less structured language like English. If you dont take the first step it might be slightly harder to learn the base words but will still be easier to learn the grammatical rules than in a language like English where theyre only loosely followed and always have exceptions. ,rational,cy3cz1v,2,t5_2rdak
5986106,0,t1_cy2sw55,Its unclear how much damage it is.I dont know if its possible but theoretically a yeerk could spitefully destroy the brain of a host that its being starved out of. Destruction is much easier than control.,rational,cy4b5wg,1,t5_2rdak
5990823,0,t1_cy4x6nj,Woot.  Currently at DC Solstice.  Might try this after the ceremony.,rational,cy4xewl,2,t5_2rdak
5996653,0,t1_cy15p9p,Wonderful  the combination of the Wikipedia table of Orders of Magnitude and the back of the napkin calculations are just what I need to make my story!I agree about the DampD cheapness of certain effects  it is so bizarre to me that illusions and light are so expensive but matter creation and timereversalCure Wounds spells are so cheap.,rational,cy5oxdx,1,t5_2rdak
6017302,0,t1_cy7c2sx,Does anyone know of the science behind speed of adoption of innovations vs costsavings? Eg. is there a law or relationship between magnitude of cost savings vs adoption rate? I remember from my chemistry years that industrial replacement cycles are on the order of gt years   some of the oldest most inefficient methods for H or SO production were on their last factories which surprised me. Id have expected the huge costsavings trough increased effiency to have much faster market adoption. Related to Falcon  Id expect x in cost reduction to lead to  adoption in  build cycles. ,rational,cy8e7fg,1,t5_2rdak
6073900,0,t1_cyf89js,Both views have been found in the EU across the entire ideological spectrum from that there is only one Force  the light  to there is only a dark side a la the Warp. One Sith Lord went as far to say as that the Force was some sort of insidious god and attempted to destroy it. The fact that the player character was heroically obliged to stop her was one of the most difficult times I had convincing myself I wasnt actually being forced by the game to play the villain! The Force being an artificial creation of the EUs most powerful Precursor race has been an idea as well.Essentially with a world as big as the Expanded Universe pretty much every idea about the Force  including its lack of existence  has been thrown around at some point. ,rational,cyfrwu3,3,t5_2rdak
6093765,0,t3_3z0ipd,Great descriptions for the battle and good pacing. Really enjoying this fanfic,rational,cyiaqqr,2,t5_2rdak
6110638,0,t1_cya094g,The exchange rates among wizarding coins are a parody of predecimalisation British money. The ratios between silver and copper and gold and silver are fixed rather than floating ... but theyre prime numbers  and  thus even more inconvenient than the sd system.,rational,cyk7ts9,2,t5_2rdak
6119833,0,t1_cykt6pa,Kabbalism is top underexploited aesthetic. YHWH was Lovecraftian before Lovecraft was a thing look at Ezekiel and Revelations for example. Ive never seen a Revelations fiction that uses the imagery in Revelations literally.There was one short story where s an order of monks made a computer to find the name of God. s It ended with the stars in the sky beginning to vanish. Anyone remember the name?Sumeria is another underexploited aesthetic but we have Snow Crash so its okay.,rational,cyl9fki,3,t5_2rdak
6130782,0,t3_3zhltr,Loved his mini sketches and was very satisfied by the quality of the show. The first episode has a dissection of food drives and feelgood charity efforts that would be better off just recieving money which was so spot on that I also thought this is a very rationalist show.,rational,cymi8ag,11,t5_2rdak
6136935,0,t1_cymxrb5,Put up or shut up punk.,rational,cyn7dyd,1,t5_2rdak
6184573,0,t1_cys6pzs,I dont think theres gonna be another trilogy after this one. That idea seemed to have died on the vine slowly over time. There is some talk of leaving it open for some sort of continuation but it seems as if the coming two books are supposed to be the conclusion.,rational,cysme6g,1,t5_2rdak
6187160,0,t1_cysct66,As a side note Polyhistor Quest requires one to make an account to access the NSFW section of QQ. Without that any attempt to find it will end in failure.,rational,cyswymq,3,t5_2rdak
