,controversiality,parent_id,body,subreddit,id,score,subreddit_id
617791,0,t3_21683m,Do you have the ISBN?,Viking,cgahsfn,3,t5_2qock
6917617,0,t1_d10fnga,We also have several runestones from the area around the Irish Sea and northern Britain which may be due to Scandinavian influence or directly erected by Scandinavian settlersraiderstraders.,Viking,d10fo6y,2,t5_2qock
9690466,0,t1_da7hyoo,It does look like something you would see while experiencing fractals and it is theorized that the Norse indulged in fractal inducing mushroom trips. ,Viking,da7jzsk,1,t5_2qock
9722521,0,t1_dabih2j,Were sorry to combat spam we have implemented a minimum karma and account age check.  If you feel your postcomment was removed in error please message the mods.I am a bot and this action was performed automatically. Please contact the moderators of this subredditmessagecompose?torViking if you have any questions or concerns.,Viking,dabih2u,1,t5_2qock
10721644,0,t1_ddluufe,Just to be more over the top I also have a valknut tattoo on my arm.,Viking,ddluwry,5,t5_2qock
11444536,0,t1_dft27so,Well the guys are just whacking at each other with no regards to Norse battle techniques and theyre using swords that wont be common for about  years after the Viking period.,Viking,dft87qn,2,t5_2qock
