,controversiality,parent_id,body,subreddit,id,score,subreddit_id
5740209,0,t3_3tr9zo,To transition to a forefoot strike the easiest way is to start wearing shoes without any heel cushioning. Personally I like the Vibrams but really any minimalist shoe will do.When switching over be sure to start with runs that are less than half a mile. You can spend every other day running in your old shoes if you need to keep up your endurance...,BarefootRunning,cx8mnft,6,t5_2rp0r
5752542,0,t3_3qah44,The thing is to loosen your feet. When hitting the stone dont try to fight it try to loosen your feet so they melt over the rock. I have hard time when there is gravel on the pavement. The pebbels arent static and the surface is hard.,BarefootRunning,cxa5p26,1,t5_2rp0r
5785475,0,t1_cxddt9f,That is awesome and those times are great! My dream is to do a K under  min. I love my VFFs and happy to hear others are using them to run longer distant races. Thank you for your response.,BarefootRunning,cxe8rrx,1,t5_2rp0r
5787619,0,t1_cxeg1dp,These would be a quick trip to frostbite in snow and slush ,BarefootRunning,cxeibpt,1,t5_2rp0r
5832133,0,t1_cxk47wx,Im not looking for protective clothing whatever that means.Im looking for footwear that will keep my feet warm and somewhat dry in the winter but without being annoyingly stiff and heavy.,BarefootRunning,cxk4bbe,4,t5_2rp0r
6030278,0,t1_cy9o8he,Also no need to buy a new pair every couple months. ,BarefootRunning,cya36e1,3,t5_2rp0r
6137121,0,t1_cymrmqc,I once bought altras and because I had got so used to super light fivefingers and hurraches they felt soooo heavy! Ive been spoiled! Those altras are now just casual shoes for me i cant run in them. Note I have never been able to run in standard shoes either minimalist running is what finally allowed me to run. The weight is a shame as the newer altra Superior . should in theory be perfect!So now I need the impossible of zero drop a little cushion protective for trails but still super super light. Im hoping the new balance MTv might be all of this. It comes out in April. I still have my fivefingers sprydon that work though and Im not fit enough yet to run long enough distance for them to be an issue. So can definitely wait till at least April.,BarefootRunning,cyn85f0,1,t5_2rp0r
6204149,0,t1_cyuto8s,It isnt so much the dress code. I doubt anyone would say anything about the shoes other than maybe  they look different. It is more that I dont think they are professional looking enough. They look more like casual jeans and sports coat shoes than shirt and tie shoes. I know it is my problem but it still is a problem. ,BarefootRunning,cyuugju,3,t5_2rp0r
6368093,0,t1_czde2id,The toe box is pretty narrow. I have wider feet and these shoes unadjusted gave me pretty nasty blisters. However I havent had any issues since I redid the lacing  I skip the first three loops and only have lacing on the upper half of the shoe. ,BarefootRunning,czdhdly,1,t5_2rp0r
6461986,0,t3_445w7f,Like everyone said completely normal. Dont push it. If youre calves feel super sore and you still had more running you wanted to do dont be afraid to bring a pair of sneakers an switch into sneakers half way through a run. Preferably sneakers with zero drop and make sure to keep putting a focus on form,BarefootRunning,cznpo7f,3,t5_2rp0r
6704326,0,t3_47e1dn,I hurt my left foot riding bmx years ago and ever since then my pinky toe does not touch the ground.  I cant exert downward pressure with it.  I can move it side to side but Im essentially  toes when I walk.  Unrelated but I am kinda bummed out.,BarefootRunning,d0csa4x,1,t5_2rp0r
6789042,0,t1_d0l1ezf,No offense but those look really pointy and narrow at the front probably not a wise choice.,BarefootRunning,d0ltqyx,2,t5_2rp0r
7056841,0,t1_d1fufzq,Id definitely give Vivobarefoot a try. My feet are a e width and VB are the only brand that have ever had a toebox wide enough for me.,BarefootRunning,d1g934f,2,t5_2rp0r
7148062,0,t3_4ddckx,gtThe trail  is honestly terrible. Very uncomfortable where the toe box bends stabs down into my toesI have this problem with the Evo IIs. I ended up loosening the front laces and it helped.Ive also got the Ra II. Ive had those for about a year and a bit and the only issue Ive had with them is the laces become frayed far too easily. ,BarefootRunning,d1qnt8d,1,t5_2rp0r
7189297,0,t3_4dy5g9,removed,BarefootRunning,d1vd1dn,1,t5_2rp0r
7356364,0,t1_d2ahb7w,Also walking in a flat flexible shoe most of the time is a must IMO. A few days of wearing shoes and I get way too used to the old familiar rolling sensation,BarefootRunning,d2ed9n3,1,t5_2rp0r
7390890,0,t1_d2f1bau,Im female and tried out a pair of the gobi hightop after my partner male had great success with his gobis. There was definitely not enough room for me to splay comfortably even though the rest of the fit seemed appropriate. He says his fit very comfortably and roomy. I would have tried the next size up but it isnt available and they dont make the mans sizes small enough for my feet. Its very upsetting that it seems like vivo is not creating their products for men and women equally. ,BarefootRunning,d2ialat,2,t5_2rp0r
7402533,0,t1_d2iak4q,Ill keep that brand in mind cheers!,BarefootRunning,d2jmay3,2,t5_2rp0r
7415192,0,t1_d2l0cum,I saw em when I was young theyre WAY better than when I was young but theyre still there when I wear shoes with any form of arch.,BarefootRunning,d2l253n,1,t5_2rp0r
7618592,0,t1_d386r7h,You. Are. Awesome.  Tread easy friend.,BarefootRunning,d3870a9,2,t5_2rp0r
7778745,0,t3_4le6ai,I ran my first half marathon in Altra One .. Nice cushioning ultra light weight room for toes.,BarefootRunning,d3qdnpg,1,t5_2rp0r
8127686,0,t1_d4c7yg0,All participants were habitually shod recreational runners. Footstrike technique i.e. rearfoot or forefoot was not applied as an inclusion or exclusion criteria however none of the participants recruited for this study displayed a forefoot running technique when either shod or barefoot. quote taken from the Methods section of the studyLooks like there are some flaws in the study design. Not only did they not use any barefoot runners but every participant was a heelstriker.,BarefootRunning,d4tmiy0,3,t5_2rp0r
8183100,0,t3_4rcika,This reminds me of one of those foot fetish porn pics.  ,BarefootRunning,d50frme,3,t5_2rp0r
8184062,0,t1_d50jocy,I also own a pair of Boulder Boots but have only worn them for maybe  days. They were the first pair of boots Ive ever owned so I have nothing to compare them too but the ankle restriction was too much for me. Ill give them another go come next winter but I dont expect to get used to it which is unfortunate because it is literally only the ankles that are the problem with those boots for me. Everything else is great.,BarefootRunning,d50k3su,1,t5_2rp0r
8287638,0,t3_4szxip,Ive been wearing the Xero z trail for over a month now. I did about  hikes over that period and a bit of running. Theyre comfortable more reasonably priced than Lunas fairly light and I would recommend them. Only downside is under very heavy use it looks like the top of the sandal wears relatively quickly. I did abuse the shit out of my sandals though.I did  miles of hiking in the last month. ,BarefootRunning,d5dii4c,3,t5_2rp0r
8357953,0,t3_4u2ipm,Just like you shouldnt expect to bench  your first day at the gym you shouldnt expect to run barefoot through the fields right away. Your form is better and your foot strike is softer but youre using a ton of muscles all around your ankles and calves for balance and stability you havent used before.  Keep your volume low to start and youll build strength in those muscles which will increase your stability decrease stress thats causing your soreness and have some seriously ripped calves!,BarefootRunning,d5mao6t,9,t5_2rp0r
8495909,0,t1_d636xsy,gt I bet it is better for your grip.It definitely is.,BarefootRunning,d63jfvt,2,t5_2rp0r
8716195,0,t3_4zdz9i,Check out our CORE or FORM I like these for much of my casual wear around town probably  of my hiking and for much of my trail running. The leather uppers are quite durable and the material will form a bit to how your feet move and are shaped over time becoming a sort of custom fit. ,BarefootRunning,d6v5vmf,1,t5_2rp0r
8865441,0,t3_51o1p9,The reason why you want to start barefoot is because it somewhat forces you to run with okay form heel stomping gravel doesnt feel very good. With VFFs you dont have that feedback to rely on so you need to make a real conscious effort to use proper form.I assume youve done some reading on what proper form should be but dont be afraid to ask any questions.FWIW I have only seen a needle once while running and I just ran around it. I think its mostly a made up concern. Even if you stepped on it it wouldnt go in unless the needle was pointing upright.,BarefootRunning,d7di2ci,4,t5_2rp0r
9071207,0,t3_54g6ql,Zola Buddesque,BarefootRunning,d827nfg,1,t5_2rp0r
9330696,0,t3_587aeq,Just stopping your running will not necessarily solve the pain problem. You need to improve the flexibility of your soleus. If you wore conventional running shoes switching to zero drop can cause some serious stiffness and pain. Here is one video explaining what the problem is and how to address it. Scott adds his own bit of humor to this but its still good information. You dont need to buy his product but it looks like it would work really well. You can use a rolling pin aluminum bottle I found this ideal filled with warm water or a foam roller instead. Foam rollers dont often dig in enough though. Heres another one that addresses calf rolling in relation to the hip.,BarefootRunning,d8yqfhj,2,t5_2rp0r
9333685,0,t3_58b0fk,I would look for a store that carries them and get properly fitted or maybe something like zappos. So you can buy several sizes and return the pairs that dont fit.,BarefootRunning,d8z42jw,3,t5_2rp0r
9344521,0,t3_58egxo,I feel theyre just copies of other better shoes.,BarefootRunning,d90hgun,7,t5_2rp0r
9353230,0,t1_d91l3qn,What VFF do you use? Mine get quite cold quite fast. I heard some good things about the Trek Ascents LR and Insulated. Do you perhaps have any experience with those?,BarefootRunning,d91l7s3,1,t5_2rp0r
9468211,0,t1_d9g4n3f,Wow thats a lot. Is that reasonable? I have no idea what a typical running shoe would handle,BarefootRunning,d9g5uoq,1,t5_2rp0r
9474178,0,t1_d9fyiz4,Im still super impressed and very glad to hear that you came through relatively unscathed! I did fine. Ive been nursing a heel issue for the last couple months. Now that this race is over I can take the time to heal up for next year. Congrats again!,BarefootRunning,d9gwast,2,t5_2rp0r
9502463,0,t3_5awd67,Apparently my feet are weird I tried vibrams and didnt get them to fit properly. I will give softstar a try. Thanks guys.,BarefootRunning,d9kdqcy,2,t5_2rp0r
9853263,0,t3_5gdkft,Same experience I had constant ankle pain when running in my Vibramsoled Merrell shoes.  I dont pronate and I tried training my gait multiple ways but I couldnt make it stop.Ive been running regularly for the last four years.  I havent experienced ankle pain since I switched shoes.  I love my barefoot shoes for hiking camping going to the gym even walking aroundbut I guiltlessly lace up my supportive Asics before a run.,BarefootRunning,darwie9,1,t5_2rp0r
10212151,0,t3_5m82zj,No shit she got hurt.  The author makes no mention of altering her gait the picture shows a really long stride or stretching or going barefoot or simply less shoe in other settings.  There is so much more to this than just slapping on the thinnest thing possible and taking off.  ,BarefootRunning,dc1lsfx,12,t5_2rp0r
10304400,0,t1_dcbw2tl,Oh almost forgot something that could be crucial in case these would be your first pair of Salomons. Making this a new reply to make sure you see itSalomons need to be bought at least one size larger! In my case I typically wear EU  US . and have somewhat narrow feet. My Salomons say theyre EU   US . and fit comfortably with a pair of warm socks.  ,BarefootRunning,dcc24xb,1,t5_2rp0r
10467468,0,t1_dcugbbh,thank you for the link,BarefootRunning,dculen9,4,t5_2rp0r
10608778,0,t3_5rtzp7,If open toe is OK I would recommend Ive also heard good things about wrestling shoes being quite good but I cant verify,BarefootRunning,dda7pvl,1,t5_2rp0r
11330204,0,t1_dfg7411,Thanks for the reply Im not so worried about waterproof as long as they have some traction on wet surfaces.,BarefootRunning,dfg9czl,1,t5_2rp0r
11527142,0,t1_dg2hkyz,Hopefully you are correct!,BarefootRunning,dg2lqaj,1,t5_2rp0r
11622985,0,t1_dgcc72n,I have had the opposite experience with Lem and Vivo shoes.. the Vivos are nice enough looking that I wear them for work whereas Lems look pretty utilitarianugly but I guess thats just personal taste. Ive also not had the best luck on durability or overall quality control with Vivos lately especially given how much they cost. Ive done my regular cotton boulder boots with bees wax sno seal that seems to work well for snow and slush. I usually wear sandals if its warm enough to be raining so I cant speak for super wet conditions in them. ,BarefootRunning,dgdh5w2,2,t5_2rp0r
11724286,0,t1_dgoykul,yeah I dont really do it....I have terrible feet.  But Im surprised you can tell that theres a huge difference?   ,BarefootRunning,dgoz81g,1,t5_2rp0r
11736345,0,t1_dghotk9,Holy shit I didnt realize Inov started making the Bare series again.  Thanks.  My Bare s are so old and need to be replaced desperately.,BarefootRunning,dgqceqn,1,t5_2rp0r
11736764,0,t3_67fx3w,Earth Runners  plus coupon code. All day everyday. For running hiking and daily wear. Here is a link to my race report for a  mile trail run. Here is another race report where it was muddy as hell Here is a picture of me in the snow on top of Mt Diablo. I reviewed the original model a few years ago and have since been running in their hemp model. Its a vibram sole with hemp bedding and lace. Its freakin awesome.,BarefootRunning,dgqe4db,1,t5_2rp0r
11740737,0,t1_dgqm4er,And only those who are unintelligent or incapable have a problem seeing them...,BarefootRunning,dgquc5g,3,t5_2rp0r
