,controversiality,parent_id,body,subreddit,id,score,subreddit_id
3903417,0,t3_354yim,Damn shes amazing ,lynnchu,cr1827u,2,t5_37waa
5590775,0,t3_3pynot,aaand her snapchat would be....,lynnchu,cwq36ne,1,t5_37waa
8250584,0,t3_4se8vs,she really needs to get topless,lynnchu,d58vnvz,6,t5_37waa
11247255,0,t3_60jb0g,Something is a little off with this photo...,lynnchu,df6uyf2,5,t5_37waa
11478537,0,t1_dfwjjhc,Oh yeah i saw her rhinoplasty video where she has no makeup on. If shes a  in real life what number would you give her instagram photos would you have ranked her a  or  if you never met her in person? At that night which models would you say was the hottest there?,lynnchu,dfx3701,2,t5_37waa
