,controversiality,parent_id,body,subreddit,id,score,subreddit_id
5698755,0,t1_cx3hb3c,Nope OP shouldnt get a new bike. Op should get another beater because thatll be most likely the more economic solution. If the area is high theft the used market cant be that bad.,bikewrench,cx3hhqr,1,t5_2sje0
5707598,0,t1_cx4isdx,You are correct in your choice of replacement derailleur in that you need one which has that integrated hanger as opposed to one which screws directly into the frame.What I do not know is what cage length you need.  How many teeth in your largest chainring?  Your smallest?  How many teeth in your largest cog?  Your smallest?,bikewrench,cx4l042,3,t5_2sje0
5733191,0,t1_cx7hf27,Honestly it looks fine to me to. I say ride the damn thing! ,bikewrench,cx7rb24,2,t5_2sje0
5757340,0,t1_cxaqmdv,Those forks have mm nuts on both fork legs on the bottom. Unbolt and clean and regrease.,bikewrench,cxar431,1,t5_2sje0
5757719,0,t1_cxammfv,If the mech is to high the tail of the cage will be pushing the chain rather then the main body which means the chain is getting pushed behind the shifting area on the chainrings This is probably not your problem though but when something doesnt work in an unusual way it is best to start with the basics before considering more exotic causes,bikewrench,cxassya,1,t5_2sje0
5777256,0,t1_cxd5qz3,There should be the tiniest bit of play when the wheel is not in the bike. However that should disappear when the wheel is clamped in the bike. If there is no play before clamping it will be ever so slightly too tight. Not enough to cause serious problems but not perfect.People seem to forget that tightening the skewer puts extra axial load on the system making things a little tighter.,bikewrench,cxd81hz,4,t5_2sje0
5804572,0,t3_3uoud7,Depending on how much weight matters to you an old tube works great for rim tape. Just use an exacto knife and follow the seams in the rubber. It might be slightly heavier but its brutally durable. ,bikewrench,cxgm17p,0,t5_2sje0
5827553,0,t1_cxj2cwp,When I mean they failed the hub stopped generating power. Sorry I didnt make that clear earlier. They were still rideable. The side effect to the failure is a slight noticeable increase in resistance in the hubs. This points to a bearinggenerator issue. Im still riding the second failed hub. The first hub was fixed after a few whacks by the hammer but failed again soon after. The warrantied hub lasted about two months. But the hub has good reviews overall and it will probably work for you perfectly as long as you stay on nice smooth roads. Like I said earlier my towns roads are utterly bombed out which probably did it in.,bikewrench,cxjincj,1,t5_2sje0
5868620,0,t3_3vlifn,when taking out a new tire I will often fold it out put the tube in it and give it a few pumps before it goes on the rim.  This seams to do a good job restoring its shape then release the pressure and proceed.,bikewrench,cxownp2,2,t5_2sje0
5934551,0,t1_cxxcklp,Check out his Facebook page hes a pro downhiller and recently had a wipeout where he sent it off a drop and missed the trail entirely and got his bike stuck in a tree,bikewrench,cxxjtqy,1,t5_2sje0
5943931,0,t1_cxyprea,Me to CUSTOMER I can absolutely build that wheel for you but if youre willing to hear about other options I can save you a lot of money and possibly deliver a more reliable product.,bikewrench,cxys2bm,1,t5_2sje0
5955240,0,t3_3wyj0c,Not sure about the compatibility of that shock but be aware that CTD doesnt technically lock out it just increases compression damping to stiffen the shock when in C mode Climb.Give up half way through the stroke sounds like maybe not enough air pressure?Creaking is rarely the shocks fault at least not the internals.  It will be in the pivots or even elsewhere like BB saddleseatpost etc.,bikewrench,cy09gjx,3,t5_2sje0
5970338,0,t1_cy27ptk,By silly rituals I mean things where the chain is removed and put through some process. Boiling it shaking it about taking it apart etc etc.KMC suggest that chain cleaners are a sure fire way of damaging a chain.Whats wrong with degreasers? I think the problem is if you remove lube from where its needed inside the chain and dont put it back in the process of making the outside of the chain look shiny.,bikewrench,cy28qfy,2,t5_2sje0
6006233,0,t1_cy6vhev,That looks like some weird centering mechanism. Not really sure why that would even be a thing unless it was intended to be used as a cargo bike and needed assistance keeping the front wheel facing forward.,bikewrench,cy6y4va,2,t5_2sje0
6070498,0,t1_cyfb6qh,OP needs a threaded fork not threadless.,bikewrench,cyfbx1h,3,t5_2sje0
6089421,0,t1_cyhs2un,gt youll only have to adjust your front derailleur Solid point the other three of us glossed over.,bikewrench,cyhsu6x,1,t5_2sje0
6112178,0,t1_cyjos14,gt What Im getting at here theres no correct way to break down a bicycle.  But here is a list of correct ways to break down this problem.,bikewrench,cyke476,1,t5_2sje0
6184340,0,t3_409vxz,whats the inside of the steerer look like ,bikewrench,cyslfwh,2,t5_2sje0
6226242,0,t1_cyxcd1n,You need this style pad. ,bikewrench,cyxcts4,1,t5_2sje0
6232996,0,t3_40xrsv,SRAM has to make a linup of shifters and derailleurs that pull  ratio like the shimano ones do.  Then we can substitute them for shimano ones.  I run a full service bike shop out of a retail store and cannot really do business with shimano directly through their business to business portal. Instead I have to deal with  Accell ordering system where they have one warehouse in freaking Kent Wa. and it takes forever to get anything.   We used to deal with J amp B which was awesome because they have  locations and I can get bicycle parts from New York or bicycle parts from Ohio or bicycle parts in PA.  Theres also quality bike parts but I dont think they are equipped to handle my  locations.  So going into the new season of bicycles hopefully beginning of March I dont know where Im going to get my Shimano s from,bikewrench,cyy4gvs,2,t5_2sje0
6233059,0,t3_40nzza,I use an Odyssey Monolever with a Avid BB road brake on my dirt jumper with no issues.,bikewrench,cyy4q6e,1,t5_2sje0
6263787,0,t1_cywt37b,Well yes but to be sure I would like to add that one can destroy the hubs bearing surfaces by riding on improperly adjusted hubs. ,bikewrench,cz1mfdj,3,t5_2sje0
6271130,0,t1_cz2f6e3,Rather than destroy two drill bits you could use two nails.,bikewrench,cz2gh1c,1,t5_2sje0
6277777,0,t1_cz35y6v,Sounds good after a closer look at the area I can see how thatd happen. ,bikewrench,cz37ns2,1,t5_2sje0
6277781,0,t1_cz2nlmv,Thanks Ill take it in to the shop,bikewrench,cz37odd,1,t5_2sje0
6315206,0,t1_cz6mm2r,no issues with braking what so ever most of the flex I feel is in handling. as in the fork is not as responsivecompliant as I might like. I doubt many would notice but Im coming off of two very stiff forks before this one. It just handles like steel forks handle when they ride like steel but Im  and the bike is currently sitting at  pounds I added a frame bag Its  minus bag and cargo.,bikewrench,cz7gwfg,1,t5_2sje0
6331665,0,t3_427wd1,Indeed its cute when a hipster gets a set of Zipp s and then goes out on a windy morning in the city. No joke wind will wrest the bars right out of your hands.,bikewrench,cz9ca3m,2,t5_2sje0
6333361,0,t3_42bzyg,Past C or C Ive found that the biggest problem with the drivetrain is the freehub pawls freezing up and it will refuse to engage at all. Im not sure what you mean by rigid to the point where it lags cycling backwards. If its stiff clean and lube the chain. The only issues Ive had is with the chain and rear derailleur icing over and getting stuck. Make sure that the rear deraileur pulleys are free of ice and snow and well lubricated. The stiff chain usually loosens up after a couple pedal strokes and I can ride like normal.As for suspension theres not a lot you can do there. Depending on the type of fork you have you may be able to put in a lighter weight oil but the low temps can also cause the seals to become stiff and potentially crack. I ride rigid in the winter.  ,bikewrench,cz9j812,3,t5_2sje0
6358983,0,t1_czcetmu,Correct the CAAD is BB not PF.So youre suggesting its less hassle to just stick to a pure BB option rather than a hybrid solution?,bikewrench,czcg1v0,1,t5_2sje0
6358993,0,t1_czcg1v0,deleted,bikewrench,czcg3bs,1,t5_2sje0
6375689,0,t1_cze6dix,In that case theres always timeserts and helicoils. Theyre usually marketed for auto repair purposes. ,bikewrench,czecgy5,2,t5_2sje0
6376626,0,t3_43065m,This is as bad as asking for stories about a black mechanic. ,bikewrench,czegb81,15,t5_2sje0
6416030,0,t1_czix1yc,Awesome thank you very much for your help!,bikewrench,czixrno,1,t5_2sje0
6424948,0,t1_czjujbm,Yeah thats what I thought.... They are perfectly fine so I should be good. But I was worried if maybe I should do it anyway just to make sure all is perfect. Thanks for responding. I guess Ill just check them again after a few rides and go from there. ,bikewrench,czjvkht,1,t5_2sje0
6451385,0,t1_czmkwfp,I mean I regularly clean stanchions and seals and put Teflon lube or slick honey on them but opening up the fork that often feels a bit excessive to me.I also think it depends a lot on what variety of bike youre dealing with. Downhill and long travel stuff I wouldnt feel comfortable suggesting you do anything longer than the suggested intervals  XC stuff that doesnt see much abuse it seems much less urgent.I work in Michigan and its rare to see any suspension failures that couldnt be addressed with a simple rebuild even when the fork never otherwise saw maintenance.,bikewrench,czmm4r1,-1,t5_2sje0
6487587,0,t3_44gv3f,dont bother with eBay you can probably find similar prices if you check all the UK sites like ProBikeKit Chain Reaction Wiggle Ribble Merlin etc,bikewrench,czqd4zt,5,t5_2sje0
6538624,0,t3_456nfb,as has been said you need to figure out what is causing the flats  whether the tube is punctured from the tire side or the rim side or pinch flatting to start you are running very narrow tires and would probably benefit from wider tires id guess the frame will limit how wide a tire you can use but your link says it ships with mm and i would expect you could at least go a little wider reduce the pressure accordingly and reduce the incidence of punctures from road hazards at least this would also make the bike more comfortable its a myth that narrow tires are fasterdid the mechanic say why you need a new wheel? its a little mysterious how it fits with the flatting problem without some context,bikewrench,czvnapp,2,t5_2sje0
6543324,0,t1_czw0r05,Hate to post  replies but how manageable would a complete disassemble and reassemble be for a bike repair novice who is an engineer and decent with tools and building things? I can build a deck but Ive never done any work to my own bikes before.What tools beyond a socket set and some allen wrenches that I already have would I be looking at?,bikewrench,czw4skq,1,t5_2sje0
6547698,0,t1_czwatna,Use the old chain as a chain whip.,bikewrench,czwl365,1,t5_2sje0
6552807,0,t1_czwi0qo,thanks a lot ,bikewrench,czx443d,1,t5_2sje0
6572702,0,t3_45o1c6,Dont know why but I read that title as pooper brakes.,bikewrench,czz674l,2,t5_2sje0
6654783,0,t3_46sxnj,Maybe a stiff link looking first at the quick connector. ,bikewrench,d07nupz,5,t5_2sje0
6709893,0,t1_d0dc0x4,Frame doesnt but of course parts do,bikewrench,d0dczik,3,t5_2sje0
6737343,0,t1_d0g72nx,I have an old frame and some spare parts.. And just wanna try and be a bit handy,bikewrench,d0g771d,2,t5_2sje0
6758325,0,t3_48bpq4,Have you tried an easy out or similar bolt extractor?,bikewrench,d0id8fg,3,t5_2sje0
6771300,0,t1_d0jrt5g,And degreaser. Degrease the old lubricant until chain is spotless and then apply new lube to each individual link. Let it sit for  minutes and wipe off the excess. Also use correct lube if you arent already. ,bikewrench,d0jt3up,4,t5_2sje0
6796862,0,t3_48ur8z,i would do all the rest probably hardest to install is the bottom bracket so do that and the crankset then wheels cassette chain shifters cables brakes amp levers if not integrated with shifters will finish it off racks panniers fenders are easy to add laterthe only reason for hesitation would be to do enough reading to understand your choices first two links in sidebar as well as some google searches for forum posts will get you moving,bikewrench,d0mproz,3,t5_2sje0
6836585,0,t1_d0r1974,Yeah Ill probably end up hacksawing it  thanks!,bikewrench,d0r89fo,1,t5_2sje0
6846602,0,t3_49j0ik,Just get some dual pivot brakes  Tektro Saccon or Alhonga should suffice. Maybe change brake lever to ones that allow hiding brake housings under the wrap  but thats purely cosmetic.Other than that just ride it and replace parts when they fail.,bikewrench,d0sdaiy,2,t5_2sje0
6850186,0,t1_d0srnxb,Hey yeah I put a mm micro spacer in there already didnt have any effect unfortunately,bikewrench,d0sry47,1,t5_2sje0
6888969,0,t3_4a2chg,I was looking for the blue version double cross for awhile but kept finding only the fork. off the top of my head from bad memory i dont have my computer to look at history did you tree fort bikes modern bikes and the like?,bikewrench,d0x6k2p,1,t5_2sje0
6903462,0,t3_4aaaij,Scrape it off with brass wool or a scouring pad back to bare metal and spray some clearcoat over it.Have you been using the bike on a stationary trainer? It looks a bit like sweat corrosion  see here for a particularly bad example,bikewrench,d0ytriy,4,t5_2sje0
6909764,0,t1_d0zj4dp,Hmm good to know! Im in Germany but its good to know that thats an option if all else fails.,bikewrench,d0zjiro,1,t5_2sje0
6917631,0,t1_d0z6i5p,I did do this and it was very easy! I have decided to go with the old cones for the time being though putting the dust cap back on the old cone as after taking the new cone out to fit the dust cap I could see the bearings were riding towards the end of the race rather than the middle as they did with the old cones. See hereNo it didnt. I have decided to go with the old cones as the new ones seem to have the bearings near one side of the race whereas the old cones were more centered. See here for where the new cone and old cones differ.,bikewrench,d10fq8r,1,t5_2sje0
6954277,0,t1_d13tfuf,This is what I do when things are to tight and wont break loose. ,bikewrench,d14lm81,1,t5_2sje0
6982403,0,t1_d17ruj6,Thanks. Its the lower end Kat platform rack. Their racks are great.,bikewrench,d17sm04,2,t5_2sje0
7005269,0,t1_d1ab73r,Agreed. As a last resort you can try another lacing pattern to use your too long spokes. Maybe cross if you were planning cross. That way your spokes may be the right length.,bikewrench,d1ae42c,2,t5_2sje0
7031211,0,t1_d1dbupv,In dollars it was like .,bikewrench,d1dcbxm,5,t5_2sje0
7036597,0,t3_4bzam7,A broom to strap onto your grill and an external loudspeaker so you can play the Jaws theme as you drive behind lone riders.  Make you the most popular person around.,bikewrench,d1dydqk,13,t5_2sje0
7036818,0,t1_d1dydqk,This is genius,bikewrench,d1dza79,1,t5_2sje0
7041271,0,t1_d1eg77z,Thanks for the help. ,bikewrench,d1ehh2g,1,t5_2sje0
7042528,0,t3_4c2j9n,Flat side up.,bikewrench,d1emly0,5,t5_2sje0
7049178,0,t1_d1fc00d,There are a lot of reasons why that isnt the crankset for you. Are you married to the Race Face brand? I ask because there are lots of good cranks out there for this application. You can use a mountain crankset but youll typically have a wider Q factor not necessarily a bad thing and often end up using some adapters to make it work with a mm bottom bracket shell which your bike presumably has.That said there are a lot of good bolt narrowwide chainrings and they are by far the cheapest on the market. So if you can find a  or  BCD crankset cheap and it will work with your bike without a ton of hassle then this isnt a bad way to go.Ill repeat my old advice which is find a decent used road crankset amp bottom bracket and the corresponding chainring. This is the cheapest and easiest way to get started. ,bikewrench,d1fdrq5,2,t5_2sje0
7063684,0,t3_4cbgsv,I use  sets of disc rims as theyre quick to swap  much easier than swapping tires. One pair of wheels is lighter and for road and commuting.  The other hardier for trail riding but cheaper so I wont cry if they get warped from a crash. I use to do the tire swapping thing but swapping Continental GP S II tires is a pain in the behind even if you know all the tricks. ,bikewrench,d1h1398,2,t5_2sje0
7076111,0,t1_d1ic5md,Im going to try this one first  and if that doesnt work Ill give an easy out a shot . I admit Im a little skeptical of drilling anything since its a carbon frame though !,bikewrench,d1ifvzo,1,t5_2sje0
7082221,0,t3_4cl6yh,Try and stand over the top tube  frame of the bike. Roughly if theres like an inch or two gap between the tube and your crotch it should be right.,bikewrench,d1j4vp8,-6,t5_2sje0
7082837,0,t1_d1j67sl,Thanks this was a really helpful response. Ill do this when I get home tonight.,bikewrench,d1j7ein,1,t5_2sje0
7085368,0,t1_d1jgpck,A power meter is the one part that has the potential to make you significantly faster. Dont listen to him.,bikewrench,d1jhrna,2,t5_2sje0
7086870,0,t1_d1ih5a3,This one is .. You might be able to find a bit cheaper.,bikewrench,d1jnx1u,1,t5_2sje0
7088521,0,t3_4clq4i,Looks like you were only able to get  holes at ghole. I would be willing to bet you could get  holes if you did toptube downtube and seattube. That is a Kilo of weight savings.  Pls report back OP.,bikewrench,d1juogc,7,t5_2sje0
7137714,0,t3_4dbr9y,Are you able to photograph for us the discpad interface as it is currently?  Its a tricky photo to pull off.  This impossible point of view of your pads open with the rotor tween would be awesome.  I know you said you did the buisiness card alignment multiple times but Ive seen people to it wrong and I just want to double check the gaps.Assuming the gaps are correct AND assuming you have the right calipers for your levers BB comes in both mountain and road pull variants I think were left believing you have contaminated pads and or rotors.  Unless youre well north of  lbs but I really doubt thats the problem as youre describing the rear working better than the front.,bikewrench,d1phb0c,4,t5_2sje0
7200517,0,t1_d1wmkni,Thanks! Any opinions on the deore hubs?,bikewrench,d1wn31m,1,t5_2sje0
7251623,0,t1_d228weh,Thanks for the info it sounds like the consensus is to leave it on and scrub it. Now that I know what type of wheel it is Ill take another look at Sheldons information. ,bikewrench,d22ghge,1,t5_2sje0
7261067,0,t1_d234trt,Ask your frame builder what he was intending be used. Most of these little blivets are bespoke to manufacturer frame and application. Theres the off chance he had a specific setup in mind or alternatively designed that no grommets should be used.,bikewrench,d23j60p,3,t5_2sje0
7266529,0,t3_4ex4bv,sounds like your headset is worn out. try using a crank puller to loosen the bar tape and replace that stuff,bikewrench,d245jir,-9,t5_2sje0
7270813,0,t1_d24b0nv,Okay I could see that.  Thanks!,bikewrench,d24n4n1,1,t5_2sje0
7294338,0,t3_4f7285,Lets be honest  how many bikes that get ridden hard and for hundreds of hours thousands of miles HAVENT been crashed? Major or minor?Ive crashed every bike I own at one point or another Ive largely been lucky on the damage to bikes and to me.Minor scratches arent an issue  but will reflect in the priceEdit not quite true just realised Ive never binned my TT or my singlespeed. Then again one is new and the other doesnt get big mileage,bikewrench,d27bf21,3,t5_2sje0
7346647,0,t1_d2cwmik,If you dont have a manufacturer warranty on your bike or cant afford a new bike I would see if your lbs has any options aside from scrapping the bike. If they dont then measure the inside diameter of your shell. Take your bearing and that measurement down to a fastener store  something like   and see if they have a bearing that is the same material width inner diameter but has the outer diameter that matches the measurement from your shell. I hope you can understand that run on sentence. I just got off work and am a bit tired. ,bikewrench,d2d9hk0,1,t5_2sje0
7359313,0,t3_4g52sx,No closeup of it but Im worried about that bottom bracket area. Thats the place where water sits if the bikes been put away wet. If thats thin guage tubing there might not be much metal left. Ive seen a lot of steel bikes break right there.  Pull the bottom bracket look inside and get advice before you start pouring money or effort into superficial improvements.,bikewrench,d2epc5j,3,t5_2sje0
7379593,0,t1_d2gzq0g,Yea  groupset although the BB is a Shimano SMBB  ,bikewrench,d2h0bw7,1,t5_2sje0
7382776,0,t1_d2hcxvh,Come to think of it the plastic tab broke off. Maybe Ill replace that and see where things go from there?,bikewrench,d2hddz5,1,t5_2sje0
7458092,0,t3_4hgbdn,fire?,bikewrench,d2pxsc7,1,t5_2sje0
7487225,0,t1_d2t7qox,Im curious how do the chain stays affect chain suck?And yeah. Didnt think about the dropouts. Dont eccentric hubs exist? Could those be used with a belt drive?,bikewrench,d2t99hu,2,t5_2sje0
7503674,0,t3_4hun2c,Thanks for all the advice rbikewrench. I ended up changing to an aluminium seat post based on your advice.,bikewrench,d2v4mzx,1,t5_2sje0
7544648,0,t1_d2zqy83, components costs more than an entire bike that would get stolen in my area. A new set will run you  and that alone will make it the most valuable in most bike racks around here.,bikewrench,d2zsfs5,10,t5_2sje0
7546289,0,t3_4ior1l,you can but if looks awesome as is!,bikewrench,d2zz5mn,3,t5_2sje0
7570268,0,t3_4j01ro,gtThe bike is a week old and I bought it newOk this is very weird then.  One possibility is that the chain is of the old type with no missing link and the closing rivet on the chain was not installed correctly and that link is stiff.  Go through the whole chain with your fingers and bend the chain back and forth to make sure all links are loose.  Also look on the chain or find out the model number to make sure there is no direction issue.  Some newer chains have an inside and an outside.  They are not symmetrical.  It is possible to put them on backwards.Have you tried measuring the chain to see if its stretched?  The specs here say nothing about the chain.I agree with the others that the teeth in your pic look fine.,bikewrench,d32payu,2,t5_2sje0
7574616,0,t1_d336yns,It is the large chainring youre hitting?  Not the FD cage?  And you werent before?You  on all ?,bikewrench,d3373ju,2,t5_2sje0
7588128,0,t1_d34fo71,Sorry...by housing do you mean the guides of the cable or the actual housing of the Derailleur?,bikewrench,d34qefo,1,t5_2sje0
7616894,0,t1_d37vpdk,Thats what touring bikes are for! Crosscountry bike tourmove,bikewrench,d38020x,1,t5_2sje0
7628233,0,t1_d37k5x1,Ive ridden tubeless on my commuter for two years and would never consider going back. Carry on. ,bikewrench,d39aeyh,1,t5_2sje0
7644352,0,t1_d3b2aky,Im having a Sheldon kind of day... Heres a response he made on bikeforums.com in  to someone who asked a similar questionThe stem shouldnt be overtightened. It is normal that if you hold the wheel between your legs and yank hard the stem should move. That doesnt mean it will actually move while youre riding since theres normally very little resistance to rotating the fork in actual riding.Some folks do overtighten the stem but there are a couple of bad consequences to thisIf the bike falls over or crashes theres a greater chance of bending the handlebar or wrecking the brake lever if the stem is totally immoble.With a quill stem there is a risk of deforming the fork steerer causing it to bulge if you overtighten the stem. Sheldon Dont Get Carried Away BrownYoull have to pull the stem out to see if have a wedge or a cone. Google is your friend searching wedge vs. cone expander or head to the wiki page for stems where theres a comparison picture ,bikewrench,d3b4e12,2,t5_2sje0
7648957,0,t1_d3bmdi4,i gotta agree with chockablock. ive used plastidip in a frame before but it was bare aluminum so i dont know how it will effect the paint test it first if your set on doing it but i wouldntthis is a bike that would right at home at something like Eroica,bikewrench,d3bn7ct,1,t5_2sje0
7652447,0,t3_4k3nhe,For the most part with the  axle bolted in tight it should be pretty much straight and centered every time you clamp it down. I have a salsa Horsetheif with split pivot and have never had an issue. Maybe wiggle a flat head inbetween the pads to make sure the piston are pushed all the way out. Make sure you clean the flat head first to reduce the chance of oils getting on the pads.You can always also try loosening the brake bolts on the brake body mounts not the mounts to the frame squeeze the lever so it clamps and settles the brake body in place and tighten the bolts while squeezing the brake lever. See if that helps? ,bikewrench,d3c1h0c,2,t5_2sje0
7656371,0,t1_d3c5lwv,thanks for the reply but I am definitely not trying to buy anything on Amazon ,bikewrench,d3chj85,-1,t5_2sje0
7663025,0,t1_d3d2ko6,I agree. Also a chain checker will tell you the condition of the chain and you can correlate this to cassette wear. There are cog wear tools too but start at the chain. Before any new parts clean. Adjust your bars so the drops are comfy  usually aimed to the rear axle or so works  then set your hoods up so the main hand contact is on a flat plane.  Ride it before you add tape. Housing should only bend one way unless if cant be helped so trim a little bit from your seat stay top tube sectionand add maybe a quarter inch to the Rd loop.  If you get it cut at the bike shop ask for an inch extra.   Measure the handlebar sections with the bar turned fully to one side then the other.,bikewrench,d3d8qen,1,t5_2sje0
