,controversiality,parent_id,body,subreddit,id,score,subreddit_id
4430170,0,t3_3br21q,would a coach such as myself be compensated for helping you achieve your goal?                               lolcoaching.comcoach.php?id,LeagueCoaching,csp4241,1,t5_33d5v
9865203,0,t1_datfawb,Hello! It really depends on your needs! So what division youre currently in and where youd like to be. ,LeagueCoaching,datgiq6,2,t5_33d5v
10600952,0,t3_5rqszm,Do you still play sc?,LeagueCoaching,dd9eo2m,1,t5_33d5v
10742109,0,t3_5tnphn,Hey Register on www.quackstage.com and you will get  basic coachings for free ,LeagueCoaching,ddnytz6,1,t5_33d5v
11089211,0,t1_denwt36,Sweet! Ill schedule a session then!,LeagueCoaching,deoyapl,1,t5_33d5v
11254530,0,t3_60m3fx,Am on EUW. Still possible?,LeagueCoaching,df7omud,1,t5_33d5v
