,controversiality,parent_id,body,subreddit,id,score,subreddit_id
4251634,0,t1_cs4ufmn,Is it actually lagging in game? For me the menus have noticeable mouse lag but the actual gameplay has precise mousing. I play with VSynch on and Hz checked fwiw. Talking about SoC I assume.,stalker,cs4vh5z,1,t5_2r74m
4302199,0,t1_csagsfs,well yes and no. Some gunplay mods are amazing others are just obnoxious thinking insanely annoying and hard equals realistic. Misery is a good mod for CoP buy yea play the game vanilla first. And misery got an excelent gunplay. A bit hardcore but still quite realistic IMO,stalker,csakyw2,2,t5_2r74m
4332098,0,t1_csdxlg8,A Windows . Pro,stalker,csdygbi,1,t5_2r74m
4388857,0,t1_csjyf37,The novel Ive been picking away at is basically cyberpunk with a bit of STALKER thrown in. Multiple Zones throughout the world corporations and governments fighting over control of artifact trade stalkers and runner working together and developing similar cultures...man. Theres so much cool stuff you can do with the STALKER setting.,stalker,cskcznt,2,t5_2r74m
4428716,0,t1_csowlv1,You need to tell us which Stalker youre playing and whether you are using a mod.,stalker,csoxhje,2,t5_2r74m
4447117,0,t1_csqtezf,LOL NOOB GET REKED xDDDDDD,stalker,csr8u0u,3,t5_2r74m
4463654,0,t1_cstbhzo,I know.  I have stories and screenshots but no video yet.,stalker,cstblj5,0,t5_2r74m
4469028,0,t1_cstzh73,if it ever comes out,stalker,cstzv88,1,t5_2r74m
4487557,0,t1_csvu0h3,aha makes sense.,stalker,cswbhyu,1,t5_2r74m
4538596,0,t1_ct2b1nb,Agreed. Admittedly I havent played the latest versions after the . beta but I never really had serious problems with bullet sponge phenomena. Maybe they made a lot of changes since the beta?,stalker,ct2pxpf,5,t5_2r74m
4570312,0,t3_3dmks6,Great animation and nice job referencing the programming thats shown on the side of the Ts but theyre not exactly in Chernobyl but in the area surrounding it.,stalker,ct6p6ni,6,t5_2r74m
4618067,0,t1_ctclpg8,That actually worked thanks a lot!  ,stalker,ctcoobn,1,t5_2r74m
4660718,0,t3_3eseio,Make sure you have enough free space on your drive or which ever storage your temp folder is stored on to complete the process. You probably need just above the size of the mod itself free for the extractioninstallation process in addition to the same size for storing the mod itself.,stalker,cti1g6i,1,t5_2r74m
4662724,0,t1_cti5wcc,Thank you this looks like it will boost reputation gained from missions. Thank you so much did not think they would be in the scripts for the area I was looking at scripts for the factions originally! Edit Spelling mistakeEdit It appears that this did not solve my problem my reputation only increases by a small amount no matter what mission I do.,stalker,ctiaj22,1,t5_2r74m
4672110,0,t1_ct2ps9c,what game is that from?,stalker,ctjgyjo,1,t5_2r74m
4684698,0,t1_ctl1mkr,Dude try it with a VAL with target finding scope. That plus the stopping power of the x is just hillarious. ,stalker,ctl1vcp,1,t5_2r74m
4714653,0,t1_ctothdv,Surprised the game runs at all on Win for you tbh.Your specs are also on the low side for Misery. There probably isnt much you can do to help with the stutter.,stalker,ctotk4s,-3,t5_2r74m
4739839,0,t3_3fsswn,Thats more than you can walk away with.,stalker,cts01st,1,t5_2r74m
4795311,0,t3_3gjv6m,Please let there be a Death Grips faction,stalker,ctyzksh,1,t5_2r74m
4813283,0,t1_cu110cl,Good I thought you had fallen into an anomaly.,stalker,cu1968k,2,t5_2r74m
4819798,0,t1_cu20cvn,yah thats true.But skat vs exo is a matter of helmet.Exo is better as pure armor but skat can hav rd gen night vision or that target finding helmet thingy. Also skat  is free,stalker,cu22psn,1,t5_2r74m
4838621,0,t3_3h2xpa,deleted,stalker,cu4g2t6,1,t5_2r74m
4855594,0,t1_cu6kvng,Yeah I remember them saying that toonow comes the silence modding communities are used to.Speaking of Survenge didnt that come out of the ashes of like two previous UE Stalker games? Cryzone then it like branched into NEYA and now Survenge or something.,stalker,cu6l1ez,1,t5_2r74m
4862996,0,t1_cu7i7re,But what if Im digging my own grave?!,stalker,cu7in7u,1,t5_2r74m
4864304,0,t1_cu7ofa0,It is quite a bit like SGM in terms of playstyle  pretty arcadey as opposed to OMG REALISM youll get plenty of big firepower and fight a ton of shit at once. Id actually say those are a pretty good comparison in gamechanges scope too OL just doesnt add as many quests as SGM at least during the vanilla game. I guess theres a new story arc after the NPP that wasnt present in earlier versions havent gotten that far so I cant comment on them.,stalker,cu7ol63,3,t5_2r74m
4868662,0,t1_cu85cry,Cant you just drop a weapon in front of an NPC to give it to them?,stalker,cu88ctw,1,t5_2r74m
4934738,0,t1_cug1cun,I can confirm this is the proper way to do it which I learned from the ZRP Modifier program. The caminert does effect headbob but also effects other camera movement. Turning it down will make your mouse a bit more responsive and fix that bug where the view swings all over when you wake up but youll lose headbob.,stalker,cugka39,1,t5_2r74m
4941900,0,t3_3ilayw,deleted,stalker,cuhgs2g,1,t5_2r74m
4950966,0,t3_3ilayw,And you better die outside the zone or else you will be haunted by the bandit spirit of cheeki breeki for ever in the afterlife!!!!!,stalker,cuilx62,1,t5_2r74m
4952450,0,t1_cuiorzn,From the FAQgtQ Is AO compatible with misery?gtA No go away.gtQ Is AO compatible with complete sgm shoker mod redux reloaded?gtA No.gtQ What mods is AO compatible with?gtA Atmosfear  and Absolute Nature  with the Atmosfear  Patch included with the mod. Absolute Structures and Caenos HUD mods can also be installed on top of AO.gtQ Will there be a Call of Chernobyl version?gtA Yes when it is officially released.gtQ Will there be a Pripyat Reborn versiongtA Yes.gtQ Will there be an MSO version?gtA No.gtQ Will there be a Wormwood version?gtA To be decided.gtQ What does the multitool do?gtA It is used for removing optics from any weapon. Have the weapon equipt in slot  go into your inventory and select use on the multitool. What ever optic was attached will be removed and now in your inventory.gtQ Are there engine mods?gtA No.So I guess MSO is out.,stalker,cuisoir,1,t5_2r74m
4971464,0,t1_cul4lpd,I bet the Duty did this,stalker,cul6uo4,2,t5_2r74m
4997840,0,t3_3jaf1f,I dont really consider darkness spooky.  ,stalker,cuofd2w,1,t5_2r74m
5022564,0,t1_curef2j,when you type  it just makes the letter go up ,stalker,cures7o,1,t5_2r74m
5061399,0,t3_3kay2x,okay Clown shoes  what you do is install Atmo via its exe without the nanohud  then you just drag the main gamedata folder of AO into your Stalker directory overwrite the files then go to a folder named Absolute pact or something along those lines and then do the same as you did with the AO folder and boom done ,stalker,cuw38vx,2,t5_2r74m
5078461,0,t3_3kjq7m,With  hours played in SoC those labs can still sometimes scare the absolute shit out of me. Get some vodka and a shotgun and hang on.,stalker,cuy5ac1,2,t5_2r74m
5086151,0,t1_cuyvquk,Some of my favorite people have been playing STALKER for a while D,stalker,cuz2oi0,1,t5_2r74m
5088460,0,t3_37x9tz,ORUZIJA UBRAV,stalker,cuzcoew,2,t5_2r74m
5115801,0,t1_cv2c44f,removed,stalker,cv2n8sa,1,t5_2r74m
5132527,0,t3_3la2pb,SOC will always have a special place in my heart and when people say STALKER I will always think of that game first. But CoP does have a few distinct advantages. Its far less buggy for one. The map design does leave something to be desired but its less linear than SoC and in some ways the world does feel bigger. You can actually get lost in Zaton for example if you arent paying attention. I never found myself lost in SoC because in most maps you are only  seconds of sprinting from the nearest level changer.CoP also refined the weapon repairupgrade system from CS in a way that makes it way more fun. I did think the CoP maps were designed a little lazily though. The space between the landmarks seems to be almost autogenerated... so much of the Zaton map is boring boring boring.To me is CoP better? Well maybe in some ways. I cant say which one I like more because all the STALKER games have their merits... even Clear Sky which I found to be incredibly fun after I patched it.Ive been playing CoP MISERY and loving it. I think I found my favorite mod!,stalker,cv4nt4w,4,t5_2r74m
5138911,0,t1_cv5ep7s,Thanks for the shout outs!Im at the point where Im really happy with the mod and am going to just play it for a bit.  AMK .. Autumn Edition . is what Im going to focus on I like all the refinements they did in ...Ive really grown to appreciate the work of the AA guys in doing this merge. They are incredibly detailed and planned everything carefully. For instance they added .xmm NATO ammo to balance the .xmm Russian already in the game.  So theres now powerful NATO rifles in the end game the FN FAL is brutal along with a NATO sniper rifle. Lots of balancing touches and detail like that. .. does similar stuff. For eg it tightens the economy not just in pricing but in which trader handles what. Sakharov the Ecologist will only sell you a basic pistol and xmm ammo so youd best go there with lots of rifle ammo. The Duty and Freedom traders only do Russian and NATO weapons each respectively now. The exception was the Freedom trader having a Russian sniper because there was no NATO sniper in the game. I fixed that with the AA merge.Two of my favorite mods if that isnt clear. ,stalker,cv5fj4l,2,t5_2r74m
5155782,0,t1_cv7gd85,Go right ahead and make yourself feel better and superior by putting down all you want.  Rant away until you feel you have been heard and you judge all that you want to judge.   That is your right.  Just as it is my right to think less of a person that complains but offers nothing themselves has produced nothing themselves and their only major contribution in life is to be a critic.,stalker,cv7gppe,2,t5_2r74m
5167482,0,t1_cv25ppf,Beard is a power top who likes to cuddle. ,stalker,cv8velo,1,t5_2r74m
5181395,0,t1_cva1f7i,For sure man! I remember trying to lure them back to the ATP as otherwise Id always risk one of my quest NPCs near that bonfire north of the tunnel. In general JointPak  taught me the value of knowing the alife boundaries so that important people dont murder each other every other minute in the zone D,stalker,cvajqfp,1,t5_2r74m
5182015,0,t3_3lzd7g,wat,stalker,cvamfam,7,t5_2r74m
5185921,0,t3_3m0arw,Self shadow at ? I dont remember vanilla SoC having that.,stalker,cvb3e9f,2,t5_2r74m
5225259,0,t3_3mgs5j,You can run right up to an armed soldier that has spotted you and you will not be shot until you are literally six inches away from his face. Otherwise excellent mod.,stalker,cvfu2fj,1,t5_2r74m
5231496,0,t1_cvgl1xo,You wouldnt happen to go by the name Michael would you?,stalker,cvgl4bz,2,t5_2r74m
5239381,0,t1_cvhiyo7,A lot of it has to do with my guns being about as accurate as me pissing in the wind during a hurricane while my enemies never seem to miss me or having a problem hitting me no matter whats going on so I frequently end up having to get within several feet with even the AK guns to make any kind of accurate shots even with iron sights which usually ends with whoever it was blowing my brains out before I can hit them enough to down them which kills my mood.I love the game dont get me wrong but when no gun I use can hit anyone unless Im blowjob distance away it grates on my nerves. Its why I have the quicksave button bound to my mouse key.Also what is SRP? I only know of Complete because I only have one friend who plays STALKER and hes the one who told me Complete would fix CS. In his words beating vanilla CS is a Rite of Passage because its the buggiest of all of them.,stalker,cvhja8c,3,t5_2r74m
5264590,0,t1_cvk2rrf,The cube also has triple the size. Still a big problem when you also have to deal with charms and other shit.,stalker,cvklysz,1,t5_2r74m
5283024,0,t1_cvmsfvs,Those articles on Miserys website Forbes and the like were as ill conceived as the project itself but as an official representative you should know that GSC Game World wanted to sue that team.,stalker,cvmyukd,0,t5_2r74m
5287639,0,t1_cvngpct,The Misery Team had a less inspiring deck of cards in another KS campaign.  I wonder if the Misery faithful were happy and content with that one.,stalker,cvnk3nx,2,t5_2r74m
5288399,0,t1_cvnlz88,OGSE is pretty coolI havent tried the latest version yet though.OP if you are outside the alife switch distance they wont die or kill each other. I think stalkersoup makes essential NPCs for quests have absurd amounts of health however this can backfire when you need to kill a quest NPC for a different quest. As for bullets I didnt notice it so bad for me but I remember in stalkersoup having around  or higher bullet protection and still dying in two shots from anything lolEnglish version of fotograf is on the GSC forums SoC mod discussion or download sections.,stalker,cvnnlol,2,t5_2r74m
5291418,0,t3_3nh54p,Thank you both for the help!,stalker,cvo1gv4,2,t5_2r74m
5292246,0,t3_3ngqcg,ok now i really want to watch Equilibrium! ,stalker,cvo59ru,3,t5_2r74m
5293553,0,t3_3ni01r,PsyPseudodogs  Chernobyl Dogs  are featured in the Red Forest in SoC and Clear Sky.  Shooting the phantoms is a waste of ammo.  Always look for the real one standing off in the distance that is controlling the projections.,stalker,cvoba0t,1,t5_2r74m
5295088,0,t1_cvoeko0,  Kind of like DMC or Ultraviolet.,stalker,cvoibtv,2,t5_2r74m
5300253,0,t3_3nh6rb,Just beware if you install a mod that gives you the ability to sleep DO NOT SLEEP or change levels during an Emission. It will mess up your whole game and you will have to go back to an earlier save. I did that... lol,stalker,cvp630p,3,t5_2r74m
5306608,0,t1_cvpv1e8,I dont think Survarium could ever be good. Its a FP game so that means it will purposely worsen the quality of lifecomfort of players in order to force them to do microtransactions and FP also means constant internet connection to play so lag and high ping will be a serious issue.,stalker,cvpzba2,16,t5_2r74m
5306616,0,t1_cvpz8dq,well it IS going to improve gunplay.Ive tracked it extensively and they have hired the same people making for example the halo games.The in game trailer looks realistic with sharp kicks and cearly visible recoil feedback. One interresting elements is that the seen recoil is stronger than the felt recoil so even if you have seemingly a hard time aiming due to strong kicks from individual rounds you still hit pretty okay. But good luck tracking faraway targets you are only able to roughly aim.I really think the gunplay can form a solid base for a stalker reboot.,stalker,cvpzcly,2,t5_2r74m
5314411,0,t1_cvqowfk,Im doing a favor for Alundaio the lead creator of Call of Chernobyl to direct people where he asked me to.  If you dont want to converse directly to the CoC people move along and find some Meme to entertain you.,stalker,cvqz8mm,2,t5_2r74m
5338688,0,t3_3o3kwg,Ahh same way I took mercs out of Rookie Village so their bodies are not ruining the Village environment D,stalker,cvu2rbh,3,t5_2r74m
5353887,0,t3_3ob7r1,Stunning pics! Could you share your graphic settingsadditional mods?,stalker,cvw0pqj,2,t5_2r74m
5369168,0,t1_cvxyyf8,And blowouts that dont corrupt your game I dont think !,stalker,cvxyza6,1,t5_2r74m
5381597,0,t1_cvzjii2,deleted,stalker,cvzk5t5,-1,t5_2r74m
5425064,0,t1_cw53q6u,Mind backing that up with a link to some cold hard evidence? I would freak! ,stalker,cw53wmj,11,t5_2r74m
5432985,0,t3_3pgho0,Oh and as a side question what do you guys think of the STCS weapon pack? I would like to add it but would also prefer not to clutter my zone with a bunch of exotic weapons. If it is any good do I just overwrite all the CoC and OWR stuff with it or should I place STCS first and then OWR?,stalker,cw649yi,1,t5_2r74m
5438943,0,t1_cw6vjcu,Yeah I was playing with STCS originally when I was messing around just exploring the zone though it crashes when I try to remove a scope from the as val or vss vintorez or srm so Im going to look into that myself I enjoy using the val without a scope sometimes. Ill be doing stcs first if I finish before the AO CoC version is finished. Honestly its a bit of a bummer to go back to vanilla weapons after falling in love with the STCS weapons and their placement on screen but I wanted the mod to be as compatible as possible haha. But AO just seems slightly higher quality to me personally.,stalker,cw6vmun,2,t5_2r74m
5440668,0,t1_cw72jmx,Im also wondering if it would make sense to have some of the more faroff factions Clear Sky Renegades possibly have multiple bases. For example itd make sense to have a Monolith base expanding out of Generators or even a Zombie faction that spreads from that point. Generators is such a gnarly map that its a pity to have it as empty as it is in vanilla CoC. Similarly with CS and Renegades starting out just at the Swamps theyre kind of relegated to only that little corner of the map. Perhaps you could station some of them in Darkscape or some of the other new maps that are relatively sterile at the moment? ,stalker,cw73jvw,2,t5_2r74m
5458448,0,t1_cw98egg,I have always been intrested in glitches and engine crashes. I always click more info on thd CTD menu. But i only recieve numbers and weird computer language. ,stalker,cw9d9vv,1,t5_2r74m
5464893,0,t1_cwa6iqn,Well with blue some track pants and combat boots overall you would definitely look very similar to a Stalker bandit.  Screaming out Cheeki Breeki while drunk would help too. ,stalker,cwa6x0z,1,t5_2r74m
5473463,0,t1_cwb8xnl,You are right about that heheh. Plus Solyanka is a more catchy and memorable title than just pizza.,stalker,cwbabef,3,t5_2r74m
5476050,0,t1_cwb6hdr,Yeah it gets included in most mods made for Clear Sky. Current version is . I think new one is in the works.,stalker,cwbm7n9,1,t5_2r74m
5479824,0,t3_3q4q0d,Hehe me and my comrades are trying to take over Limansk and we will DIts Mercs territory.,stalker,cwc3kdn,3,t5_2r74m
5484950,0,t3_3q6v9g,I mean they could really just jump the gun and act like whoosh mega emission...everything changes! and then make up some bullshit about time anomalies shifting buildings and stuff like that.,stalker,cwcr4q8,3,t5_2r74m
5510356,0,t1_cwf5ptq,Is that you jerry?,stalker,cwfzxxb,1,t5_2r74m
5528325,0,t1_cwhetjz,Its good but you really want a song playing that feels like its filling your mind with overwhelming dread like this  Its from the playlist you have there but thats the best one that feels like it digs into my head and is scary.,stalker,cwiaj9i,1,t5_2r74m
5537754,0,t1_cwh7uns,Cant you run it with win compatibility?,stalker,cwjhw97,1,t5_2r74m
5545627,0,t3_3r0gc8,I seriously need to know whats that map,stalker,cwkhich,1,t5_2r74m
5567103,0,t1_cwmtq6v,There is some day. The next game that Metro Devs are making is slated to be open world.,stalker,cwn5esl,5,t5_2r74m
5590740,0,t1_cwpz14d,Yes,stalker,cwq310e,1,t5_2r74m
5594585,0,t1_cwqk1cx,It was a koloblok. Im screwed I tell ya! Atleast strelok will be remembered . opens up pda to all stalkers searching for happiness. Leave the zone. Get back to kiev. There is nothing here but death and radiation and death and cherki breeki. Leave now,stalker,cwqk6xn,8,t5_2r74m
5598918,0,t1_cwqsgvu,Hi its incredible now it works without changing anything! I deleted my iso and files with stalker from pc and I reinstall everithing from my external hard disk. Now the game starts with enb with normal installation. I have only a theory. When i launched antivirus some days ago it found many trojans and I deleted them but maybe they were patches or files of my stalker game in my pc that corrupted my game. Is it possible for you? I cant imagine another explanations,stalker,cwr3ku3,1,t5_2r74m
5604212,0,t1_cwrnmpv,NPC bad aiming  Stalker  No something is wrong. Hope OP find what is going wrong.,stalker,cwrr8t7,1,t5_2r74m
5655462,0,t3_3sh2hx,I like that Radstorms are basically emissions. ,stalker,cwy45ry,4,t5_2r74m
5659879,0,t3_3smq8n, Id like to know that too.,stalker,cwynv3p,6,t5_2r74m
5663404,0,t1_cwyrt8b,Holy shit that looks a lot better than I was expecting before I checked out their videos. Loving the svd with only iron sights and the options for customization.,stalker,cwz3mdu,3,t5_2r74m
5717899,0,t1_cx5towl,gtAgroprom was interesting for me because my friend got the game with a video card on release and we played it up to right before agroprom. I was a kid then I got stuck on the bandits at the entrance to the level changer said i would try again next week and then never played again.gtFast forward to  and I keep seeing STALKER on scariest game lists and I keep thinking That game? did i miss something So i went back and installed it for the first time since release patched it and pushed through to agroprom and right as i almost gave up again I got inside and once I encountered the first bloodsucker I freaked out. Then I encountered the controller and freaked out even harder and ran.gtI have been hooked ever since.You have been kissed by the zone.,stalker,cx5v0tp,3,t5_2r74m
5756094,0,t1_cxag6dp,Ah thats a shame. Good luck for saving up its worth it! Remember that a decent PC doesnt cost that much more than a new console!,stalker,cxaljnf,3,t5_2r74m
5765451,0,t1_cxbqb7u,Well i expected that. Playing on master diffuculity. Do you know a  console command that reduces it? Its ridiculous!,stalker,cxbr9w1,2,t5_2r74m
5834288,0,t1_cxj7801,gt RPSwutOn a side and more serious note core guys behind XRay moved on to make Metro . I remember them completely slamming XRay in one of the interviewsgtDigital Foundry Youve previously worked on S.T.A.L.K.E.R. noted for its own tech. So what exactly is the relationship between the A engine and your previous work in S.T.A.L.K.E.R.?gtOles Shishkovstov Theres no relationship. Back when I was working as lead programmer and technology architect on S.T.A.L.K.E.R. it became apparent that many architectural decisions were great for the time when it was designed but they just dont scale to the present day.gtThe major obstacles to the future of the S.T.A.L.K.E.R. engine were its inherent inability to be multithreaded the weak and errorprone networking model and simply awful resource and memory management which prohibited any kind of streaming or simply keeping the working set small enough for nextgen consoles.gtAnother thing which really worried me was the textbased scripting. Working on S.T.A.L.K.E.R. it became clear that designersscriptwriters want more and more control and when they got it they were lost and needed to think like programmers but they werent programmers! That contributed a lot to the original delays with S.T.A.L.K.E.R.gtSo I started a personal project to establish the future architecture and to explore the possibilities of the design. The project evolved quite well and although it wasnt functional as a game  not even as a demo it didnt have any rendering engine back then  it provided me with clear vision on what to do next.gtWhen A started as an independent studio this work became a foundation of the future engine. Because of the tight timescale weve opted to use a lot of middleware to get things going quickly. Weve selected PhysX for physics PathEngine for AI navigation LUA as a primary development file format not a scripting engine for easy SVN merging RakNet for physical network layer FaceFX for facial animation OGG Vorbis for sound format and many other small things like compression libraries etc.gtThe rendering was hooked up in about three weeks  its easy to do when you work with deferred shading  although it was far from being optimal or featurerich.gtDigital Foundry So to be clear theres no shared code whatsoever between the A and S.T.A.L.K.E.R. XRay engines?gtOles Shishkovstov When the philosophies of the engines are so radically different it is nearly impossible to share the code. For example we dont use basic things such as C standard template library and S.T.A.L.K.E.R. has every second line of code calling some type of STL method. Even the gameplay code in S.T.A.L.K.E.R. was mostly using an updatepoll model while we use a more signalbased model.gtSo the final answer is no we do not have shared code with XRay nor would it be possible to do so.gtDigital Foundry But if you had just done a straight port of the XRay engine how would it have worked out on PS and ?gtOles Shishkovstov That would be extremely difficult. A straight port will not fit into memory even without all the textures all the sounds and all the geometry. And then it will work at around one to three frames per second. But that doesnt matter because without textures and geometry you cannot see those frames! Thats my personal opinion but it would probably be wise for GSC to wait for another generation of consoles.,stalker,cxkehfy,2,t5_2r74m
5844502,0,t1_cxlpscx,I havent encountered many games like Stalker. You could trySkyrim with survival mods. Can get pretty difficult when you have to worry about eating sleeping finding drinking water and not dying from exposure.The Forest  stranded on an island inhabited by cannibals. SP and MP kinda buggy tho.The Long Dark  winter survival. Little to no combat just wild animals.Rust  Havent played it.,stalker,cxlqodx,5,t5_2r74m
5844741,0,t1_cxlp29w,I hated Metro. It was literally onrails for several portions of the game. Theres hardly any weapon choices or customization.,stalker,cxlrtcc,11,t5_2r74m
5870200,0,t1_cwjmubl,If I had to use one gun only it would probably be predator. I love that thing.,stalker,cxp44qc,1,t5_2r74m
5908767,0,t1_cxjbnr3,If that were true it would never crash. ,stalker,cxu67j7,1,t5_2r74m
