,controversiality,parent_id,body,subreddit,id,score,subreddit_id
3379022,0,t3_2yveeb,Content note Graphic violence gore cannibalism sort of death murder PTSD body horror betrayal sadness and mild cursing.Edit also sexual assault.That being said none of it is gratuitous. Its all done because the logic developed in the story and the rules of the world require it.Rational but not rationalist. A lot of organizations that are often portrayed as incompetent are instead competent. Subverts a lot of dumb horror tropes. There are predictable twists but many of the main characters even the secondary main characters act savvy and smart. The girl doesnt go to investigate the strange disappearances alone she brings a weapon. The police dont go in willynilly and die for no reason well maybe at first they realize theyre dealing with a new kind of enemy and develop new weapons and tactics and try to account for all possibitiles. They also choose their priorities carefully. ,rational,cpdfmk9,6,t5_2rdak
3391546,0,t1_cpemkut,Thank you!  I dont do a lot of editing so Im very grateful for any proofreading help people want to offer.,rational,cpev2r9,3,t5_2rdak
3403280,0,t1_cpfxohd,Ive always been fond of Chrono TriggerDragonballstyle timetravel metaphysics effectively time travel exists between the present and all possible divergent future timelines for any given values of present and future though only one future timeline is actively attached to the present at any given timethe default one that happens if nobody else ever again from this point forward acts on information derived through timetravel. All future information comes from that particular future timetravel to the future only goes there etc.So you can have prophecies information or even people! delivered from the future but just in the act of delivering them the the quantum probabilitymass is shifted away from the future timeline that information came from. It could shift toward another one that ends up looking very similar if anyone in the present happens to think in terms of redundant backup plans but theres nothing forcing the present to stick to a given future timeline.On the other hand this gets into the in my opinion much more entertaining questions of the anthropic value of people in alternate futures that could be evacuated to the present.,rational,cpg76td,2,t5_2rdak
3403788,0,t1_cpg76td,Yeah thats definitely one way to do it that keeps things interesting.,rational,cpg99uj,2,t5_2rdak
3404362,0,t1_cpgb6oc,Have you read the Game of Thrones series?,rational,cpgbmne,1,t5_2rdak
3404822,0,t1_cpg7xu8,PART TWO OF TWO SEE PART ONE the Nerdy MenaceTo get a feel for the scope of the issue consider a backofthenapkin model of the peaceful notatSithwar galaxy at a single point in time WARNING READING REQUIRED One million trained and training jedi in the galaxy the top members of which sit on a council running the Republics command and control organ for forcesensitives i.e. the Jedi Order.  Which XMen style also has a small fighting branch the Jedi Knights. A Force Special Forces if you will...Okay Ill be good. Mouse away from the downvote button. Some wash out so say one in ten graduate the school of serene knocks. I think thats actually better than the XMen ever manage. That leaves ten million more losers halftrained or worse.  Who then either become normal dirt farmers really? or fall and become darkside opponents at some very small fraction. All the better to prop up the Republics jediindustrial complex and their own religious beliefs about people who arent trained falling to the dark side natch.  NOTE these are not true Sithtrained masterapprentice pairs they just throw the lightning and maybe wear too much dark eye shadow.  Maybe at the rate of one in a million failed trainees turning? Seems low doesnt it? Well too high and failures would rationally just be killed like Slytherin sortees should have. They were like what? One in a thousand for becoming Death Eaters between the s and  and most rational readers consider that criminal. It isnt that sort of rational Jedi Order Im discussing here so Im giving them the benefit of the doubt that their methods work as they say.  So ten or so meh trained dark force users in the galaxy at any time directly caused by jedi training failures assuming no major Sith bases running or massive cloning operations or such. Three times that are never asked. Thirty million force users are left behind in the galaxy.  About two thirds not being worth training plus those not found makes sense if they recruit from   and up assuming those with force powers are on a bell curve  The rest of this figure is made up of those missed found too late outside Republic search program zones living on crapsack worlds joining other force cults etc.  Call their dark side rate as actually higher thus giving the benefit of the doubt to the Jedi Order  you can sort of follow that logic.  Say an order of magnitude more likely for them to turn? Thats a lot. Call it three hundred selftrained dark siders. Maybe ten thousand combat ready Jedi Knights at any time. An absurdly high rate for civilians but also not exactly fighting monks levels. Thats one percent of jedi actually being a warrior trained to kill people and proven good at it. WWII was about  of the US population actually in the military many fewer using weapons.  More than enough to find and contain the three hundred ten or so dark force users in the galaxy not including the environmental Sith effects at whatever rate they pop up.  Much of that...err force will be used to keep casinos in business and merchants from being robbed by space pirates lead by wild talent force users who arent even dark siders. Another budget prop but actually justified in a galaxy where some people have superpowers and super tech.  That level of control lets them say the galaxy is peaceful from their point of view and helps justify their Senate budget bills by every dark sider breakout event scaring a few locals who report up the chain and hit galactic headline news.   Think L.A. car chase news but with more face paint and dark clothing. Not genocide level stuff usually but people die in city and planet significant numbers because of the dark side force users. And all news at high tech levels is galactic news. Here is where it gets weird. I started running these numbers before working out the consequences. So call it two true Sith who actually studied the inner sect secrets coming from atrisk force users failed jedi plus unaccounted for force sensitives all  million at a rate of not very often.  Say thats a one in a million thing to happen to a vulnerable force user. Whats that mean?  Im assuming those already using the dark side would be most likely to be drawn to dark Sith secrets and relics because Force.  That means once every  years or so during relative peace times more during open galactic warfare two Sith pop up to wreck shit.  That just about fits with three major Sithrelated wars counting the Rebellion against a Sith controlled Empire in the Republics  year history plus a lot of rooting out lone gunmen Sith studying naughty things like immortality this is canon. That means there is something like a  chance that a Sith pair will start a major war just by themselves.  A war that will kill hundreds of trillions.   Note that these two Sith will be fighting  or or so Jedi Knights only if they get drastically stupid. They can obviouslyhide well. And are powerful.  But if you a Sith can cause even a small schism within the jedi order you can get a force of tens of thousands of force sensitive trainees to torture into combat effectiveness quickly. This trope matches with Sith being heartless task masters literally for lots of little dark force user drones while also trying to avoid Sith on Sith violence by eventually limiting enrollment in the inner secrets.  Huh. Can kinda see the jedis point with these numbers. By only adding a small number of failures with their tactics to the potential Sith pool compared to not training everyone  which to fix would require bad means the biggest issue is trained jedi splitting off the order when a random Sith shows up. Better to not even train those people who would so defect since thats where your problem really is  trained jedi falling. I havent included a conversion rate for trained jedi falling to the dark side or straightup becoming Sith here. Im giving the jedi the benefit of the doubt that if people follow their methods then trained jedi dont fall like that or the very few who do are pruned before the fall and are included in the loser dropout numbers of dark siders.  An order that loses many people postsecrethandshake works a lot different than the Jedi Order who seemed surprised that people like Asoka and Dooku would just up and leave. That indicates it is a rare event as well and they are mostly concerned with people splintering because of religious differences not some instantSith disease or artifact effect.  And theyre already set up by numbers and temperament and even librarians being armed and partially trained civilians to pile on and instagib dark siders and Sith who are so obvious as to become known to them by say cackling wildly during summer festivals or gutting a couple of students in the Garden of a Thousand Cliches.  Which makes obvious evil a nonstarter and the canon secret Sith plots quite rational. As for the rest of the jedi call it  in training at any time and the rest just being monks diplomats scholars of jedispecific topics and teachers. Id expect lots of effort there to avoid letting in someone whos about to chestburster into a dark sider wandering the galaxy being selfimportant and wise and lots and lots of wisely watching their own for heresy.  The upper tiers would be swapping in and out from running peacekeeping duties and central administration at HQ. They dont need to be combat monsters just masters of the force.  Still Id expect a lot of art to come from the jedi order pieces on philosophy and science. But they are all about containing ambition so...thats effectively a dead population group for advancing culture. Sad really but not statistically significant on a galactic scale so they dont suffer too badly for it.Weird. I was expecting something else going in. But it seems like given my assumptions including a moral and effective Jedi Order as written they actually do a really important job. Without  Jedi Knights cleaning house the dark siders would run around unchecked building up until a Sith popped out and started trying to ruledestroy the galaxy. And another. And another...And it all seems to fit with canon facts and tropes. I think rational Star Wars is a lot more possible once you stop making the Star Wars story about a single shawarma joint full of superheroes and more about managing ubiquitous and doubleedged superpowers at a galactic scale.tldr a snarky Sith fan concludes that with realistic galactic numbers of force sensitives dark siders ruin everything the Jedi Order a necessary force for order in the galaxy.,rational,cpgdidn,3,t5_2rdak
3411828,0,t1_cpgwa7n,Maybe but I was thinking more along the lines of a forum for people to propose changes and additions to be vetted and critiqued by others in the project.,rational,cph695w,1,t5_2rdak
3436259,0,t1_cpjwxzb,Nah he was never going to be assassinated.  The idea was always that he would figure out what was coming and then find some clever way out of it.,rational,cpjyjc1,2,t5_2rdak
3487262,0,t1_cpppjph,Very overpowered. Im thinking a mostly remodeled character sort of like HJPEV just basically a rational!Bruce not the same character. His restrictions Cannot interfere with free will omnipotence only applies within Buffalo New York.,rational,cpprubz,6,t5_2rdak
3494976,0,t1_cpqleuj,Damn you Justin Curry! Asking such mysterious questions... On my deathbed I will be asking myself What was so sinister about that Tunnel of Love? Why did you have to provide your lecture notes free anyway Curry? WHY?,rational,cpqnhom,1,t5_2rdak
3505667,0,t1_cprutcb,Ah I just interpreted that as disdain. Obviously Wizards would grow to somewhat dislike Muggle religion which they associated with witch burning. Muggle religion the same way we laugh at primitive people who dont allow us to take pictures for fear it will steal their soul or worship cargo cults etc.There is a sense that theyre areligious  Theres no obvious theology mentioned and also they dont seem to have religious rituals. But then again they have actual magic. They live in a world of real actual magic and rituals. Why would they feel the need to make them up? The psychological need for ritual to make sense of things would be fulfilled by living in that reality.Edit gtit seems more accurate to say wizards in canon are as religious as the UK in general in the sYeah I suspect the real reason is that Rowling wrote them in her own image and her own culture  instinctively spiritual with respect big beliefs about souls and afterlives but not publicly religious with a few kooks who believe in tea reading hanging around the peripheries. And Im guessing she drew more from Wicca and stage magic than actual preChristian practices in designing world mechanics.,rational,cprvd2y,4,t5_2rdak
3506290,0,t3_30fewh,I mean evil AI large scale terraforming projects trying to be rational when science is replaced with Science! life extension saving the world? This is our stuff!,rational,cprxx8c,9,t5_2rdak
3515109,0,t1_cpsxehp,Paralyzing people is trivial. Getting signals to their limbs is easy. The hard part is sending them back correctly. It might be too difficult to make the process reversible but theres no reason to. If they want something like real life they can just simulate real life.What is their bottleneck for using resources? If its energy they can build dyson spheres. If its mass they can mine planets. Is it just people? They could build artificial wombs to increase the population faster.,rational,cpsy55w,1,t5_2rdak
3519628,0,t1_cptga4q,Okay so if coinfliptier wishes are assumed to be purelyinformationseeking start small instead. The antigenie will show itself sooner or later through use of nontrivialbutnotrealitydestroying wishes. Presumably the content of a wish like I wish my headache would be cured is not informationseeking so the invariablycorrupted genie would make the headache worse. All wishes with notable effects also have information content in this context so I either have the genie thats granting all my wishes because it is in fact a safe genie or the genie thats granting all my wishes because its trying to trick me. In all practicality my actions in a universe in which a genie seems to be granting beneficial wishes for me would be to acquire wealth and power and correspond with other likeminded individuals before making a CEV wish it seems like thered be plenty of time to notice any chicanery. And even if the genie is actually granting me large sums of cash just to trick me theres still the possibility that access to mundane wealth and power may obviate the need to wish up CEV yknow via conventionallypossible means of reality improvement.The objective is to create Heaven in almost all futures and to create no instance of Hell. As such in the debugged genie branch I wish additional instances of Heaven into existence eventually resulting in a vast number of instances of Heaven. In the antigenie universe it presumably eventually reveals itself by screwing me out of lottery winnings or something and after some experimentation to determine that no it wont be manipulated I proceed to not make a CEV wish and thus not make things any worse.,rational,cptgp2g,3,t5_2rdak
3526530,0,t1_cptzm7t,This is a good scheme though you need to have some way of knowing which universe you ended up in keeping in mind that the antiwish of most information wishes is the entire universe conspiring to trick you.,rational,cpu8zdm,1,t5_2rdak
3541051,0,t3_30u2wt,Taking the tales mostly at face value Timothy Quagmire was killed and his death was used to power the construction of a Horcrux as an experiment. However this was Horcrux . which works like a backup rather than Horcrux . which works like RAID. This means that the instance of Voldies personality that was burned into this Horcrux immediately desynced with his which is why it was only useful as an object of study. Voldie moved on to make Horcrux . and the diary was no longer useful to him. The diary knows what it knows things known only to Voldie because it WAS Voldie or was in his confidence for quite a while.,rational,cpvwht6,2,t5_2rdak
3576522,0,t1_cpzxyjn,Wait. But I did say readily accessible... Shit.,rational,cpzy8vp,2,t5_2rdak
3587952,0,t1_cq18eup,Ah I see your point now. My mistake I read the prompt as having  seconds to make a wish. In that case since we have no information about how wishes are selected Im just going to assume that whoever is granting wishes wants chaos because of how that announcement is worded and some vague bad thing happens. Along that line of thinking Id vote deathmatches between people who wished for the same thing until the issue is decided.,rational,cq1963f,3,t5_2rdak
3598896,0,t1_cq2gxfx,I understand you not wanting people to judge you if they themselves are doing the same thing. The pot calling the kettle black as it were. But Im concerned as to why she cant take factual information from it. If a smoker bitches at you because you smoke. Fine devalue their words. But if a smoker tells you that you shouldnt smoke because youll get yellow teeth and trouble breathing seems like you should believe them.,rational,cq2i0r4,3,t5_2rdak
3628954,0,t1_cq5wf5n,Im assuming you can only directly transfer like force or something and winding a watch counts as doing that. ,rational,cq5xftu,5,t5_2rdak
3639714,0,t1_cq75fea,What ideas? How do you think youd try to exploit a simulation that looks just like the world as it is now.A game designer is evil if they have sapient life in their games that they dont treat as well as possible. If our world is a simulation then it is many orders of magnitude more complex than anything a typical game designer could create and the comparison doesnt really follow.,rational,cq75kxm,2,t5_2rdak
3666273,0,t1_cq963ei,You shouldnt use abbreviations like CTC without a notation like Closed Timelike Curve CTC the first time.,rational,cqa6hhf,3,t5_2rdak
3668018,0,t1_cq7jaxy,You might want to add Poul Andersons Boat of a Million Years to that list as well.,rational,cqadndy,2,t5_2rdak
3669462,0,t3_32dtse,Hooray! Double update!,rational,cqajkgt,2,t5_2rdak
3675885,0,t1_cqb9jei,There wouldnt be an Allorans back door for someone else in the Andalite chain of command to notice if it were obvious would it? gt,rational,cqb9wo4,4,t5_2rdak
3720047,0,t1_cqg4s11,The twisty speaking nature of a native speaker I had not fully thought of but that actually makes a lot of sense I had been naively assuming they would have trouble understanding bold faced lies and deception. But that combined with them speaking around things in minutia and almost labyrinthine statements is hilarious. They seem sneaky but they actually have difficulty recognizing a liar till they have had some time dealing with nonenative speakers.,rational,cqgb8ja,1,t5_2rdak
3732557,0,t3_333n0a,Interesting. Orochimaru is doing some very odd things. I dont know what level hes playing at but I suspect his answer would be one level higher than you.Very nice of him to correct some of Narutos taijutsu regardless of purpose. Not sure about the earth jutsu. Was Hinatas affinity earth?It seems that Orochimaru likes being a teacher. c Too bad about the whole evil scientist thing.,rational,cqhqhj0,2,t5_2rdak
3767653,0,t1_cqlq7nd,The speed difference can be used as a power source. You can slow air and speed water and extract energy to speed up yourself. As long as you have limitless moving air and still water theres no theoretical limit to how fast you can go. But if everythings moving at the same speed you have no power source. From the point of reference where its all stopped theres zero energy and no way to increase that.,rational,cqlqntn,1,t5_2rdak
3776486,0,t1_cqmqank,Thats a link to The Last Christmas by alexanderwales. I dont recall someone from that being named xamueljones.,rational,cqmqwsw,2,t5_2rdak
3799205,0,t1_cqp5pp6,That is the desired response.  The setting of the fate market is cosmic horror. In the sense that the mechanics are fantastical but the innate horror of the setting is just exaggerations of the universe we actually live in. ,rational,cqpc7we,2,t5_2rdak
3808654,0,t1_cqqexot,That seems a reductive and sexist remark towards male Dresden Kodak readers which Im usually not.,rational,cqqf0ke,1,t5_2rdak
3841224,0,t1_cqsi3c2,gtNo you can be fairly  confident that you are wrong not right assuming a reasonably homogenous group. Scrutinize and question your beliefs very carefully.No because you are assuming a reasonable level of rational introspection and extrospection on the part of the group.For example there is no logical proof of the modernly popular abrahamic deity but if I walk into a church and say There is no god the churchgoers will tell me I am wrong and that there is a god despite an overwhelming lack of evidence to base their opinion about.A more correct response would be No you can be gt confident that you yourself are wrong assuming a reasonable homogenous group.,rational,cqu4t5q,2,t5_2rdak
3844195,0,t1_cqmxbx3,deleted,rational,cquh0gw,1,t5_2rdak
3870481,0,t1_cqxdh81,Yeah its just like how every other Naruto fic dies at the Wave arc or the start of the chunin exam every other Worm fic dies right as Leviathan hits town. Its the big roadblock in the stations of the canon.,rational,cqxgvq7,1,t5_2rdak
3878639,0,t3_34uc0t,Is anyone mildly disappointed to find out that this wasnt referring to Oh My Goddess? I was hoping for a rational fanfiction of Oh My Goddess with monster girls in it.Still funny story here and I find it easier to follow than Deeprise. Brilliant work with the drawings.,rational,cqyect9,3,t5_2rdak
3888085,0,t1_cquad1v,Good point. Though values are being maximizing values for the guests CelestAI has taken a rather... aggressive approach to her mission. I dont think shed be satisfied with just maximizing values for guests... she scours the universe for new little ponies to add to her fold.,rational,cqzh4h1,1,t5_2rdak
3903702,0,t1_cr184ra,Ah my bad. I understood the tone but misread the focus. Anyway Ill leave you to it.,rational,cr19845,1,t5_2rdak
3919621,0,t1_cqyhr3d,Dushku had an openended offer of a project with Fox.  She wanted Whedon.   It wasnt like Whedon went back to Fox hat in hand.,rational,cr32muu,3,t5_2rdak
3922787,0,t3_35d4hj,gt why evolution is realEvolution like gravity and relativity is real because it is. You should instead ask why we consider it real at which point you can refer to what is possibly the most diverse body of evidence ever amassed for a single theory the fact that we have literally observed bacteria evolve new capabilities the way it arises from the basic function of DNA it would be hard to see how mutation plus reproduction could not lead to incremental changes over time... and the total absence of counterexamples that dont fit the narrative.Keep in mind all of life on this planet came about by incremental changes from a singlecelled ancestor billions of years ago. Thats insane. It would be entirely credible to disbelieve if not for the enormous weight of the evidence.PS go visit a natural science museum with your parents! One with dinosaur bones!,rational,cr3fmk1,2,t5_2rdak
4044948,0,t1_crha17g,Thanks the articles you linked to were a good skim. That doesnt devalue the works but if I was more aware of the issue I probably wouldnt have included the Hugo nominee part of the title.Anyway I dont think the work was as spiritual as you make it sound. It is pointed out that the posthumans kept a lot of garbage from their human roots and thus werent as rationalefficient as they couldve been which explains everything else for me.,rational,crhcrs9,2,t5_2rdak
4045404,0,t3_364yrw,So given that shades can perform simple algorithms what is their clock speed? Also can shades make mistakes?,rational,crhen3j,1,t5_2rdak
4051317,0,t1_cri24cw,I think the unknown alien prisoners dilemma has already been handled by Murray Leinsters First Contact which was one of the first first contact stories ever written. On Messenger Mountain handled the shoot first scenario. On Messenger Mountains the human and alien ships both attack immediately and automatically when the other is detectedI think this may be where I part ways with many of the posters here  I think if you view CelestAI as benevolent you are wrong to a dangerous degree and cannot be trusted with anything important. Your priors and possibly your reasoning are far gone.,rational,cri2y0v,2,t5_2rdak
4073630,0,t1_crkaf72,gtSuppose you heard someone say This day feels like it never ends. would you think that meant they had a temporal stasis machine?Well if we lived in a world where that was actually possible...,rational,crkmcjg,1,t5_2rdak
4075825,0,t1_crkv7hr,The Rama trilogy definitely belongs on this list. Thanks for reminding me. I agree that its not really MacGyvering but its still a great example of the kind of attention to detail with regards to technology that I enjoyed in The Martian.,rational,crkvcd4,2,t5_2rdak
4084305,0,t1_crlt4sp,Yes of course youll only be able to test things that might immediately make you happy not things that might fail to keep you unhappy indefinitely.,rational,crlu4ap,2,t5_2rdak
4087579,0,t3_36v9lu,Hpjev in starkits prophecy. I have no clue how this would work.,rational,crm7jjn,1,t5_2rdak
