,controversiality,parent_id,body,subreddit,id,score,subreddit_id
8805311,0,t1_d75ta9m,Cip would have to do something against all the botters... Before that Tibia wont be on steam since they have to hit certain goals to be able to be on steam. They dont have any anticheat as it seems like so they would have to make one and if all botters are gone also Cip loses money so thats why I dont think it will be on Steam ever..,TibiaMMO,d76a24r,0,t5_2s3sk
8810241,0,t1_d76v9ux,Wholehartedly agree but the points in that good post also needs to be accuraterelevant otherwise its just as much fluff as the big boldscreaming  yearold.,TibiaMMO,d76vdg1,2,t5_2s3sk
8814585,0,t1_d77bu4t,Got you on a  pic too kek.,TibiaMMO,d77e5y5,2,t5_2s3sk
8859826,0,t1_d7ctk7s,i dont treat people like shit what are u talking about dont tell me it isnt funny a lvl  will retire because he fell for the oldest scam ever xDDDDDDDDD,TibiaMMO,d7ctqqy,-4,t5_2s3sk
8865138,0,t3_51nz4o,Congrats!,TibiaMMO,d7dgr3g,1,t5_2s3sk
8870182,0,t3_51qf5i, or  levels I am a snail when it comes to lvling.,TibiaMMO,d7e2k9m,1,t5_2s3sk
8904873,0,t3_527mr2,Didnt level much.. Im pretty lazy and most spots were full of bots but it was alright.. went from  to  got assassin outfit full D,TibiaMMO,d7i8jf8,1,t5_2s3sk
8914363,0,t3_52d406,I had some guy being racist that was great. not,TibiaMMO,d7jdjcu,1,t5_2s3sk
8914590,0,t3_52cfhl,Went from  with around  hours of playing. Had an exp voucher to use as well as stam bonus. Plus I purchased a  gold exp voucher. Ended up with  bonus exp ,TibiaMMO,d7jeinx,2,t5_2s3sk
8916954,0,t3_52e8og,If yiu played back in  a lot have changed I mean accounts didnt even exist back then. Still antica is the old tibia you played so youre back on the same soil. Head over to rHouseredd and apply if you want to join a pretty active reddit guild there with people from level ,TibiaMMO,d7jor69,1,t5_2s3sk
8928838,0,t3_52kds6,Get used to the new controlshotkeys.Dont be an idiot like me and go to a new hunting place with your brandnew perfect hotkeys. I died like a bitch of course. Doesnt hurt too much cause it was on a low lvl char...but still...,TibiaMMO,d7l4515,6,t5_2s3sk
8931742,0,t3_52jh6j,hmpf bothers my that I cant attack a monster with the AltGr Key anymore anyone found a way to change that? cant find attack target on the hotkey list,TibiaMMO,d7lgp67,1,t5_2s3sk
8941473,0,t3_52qp52,No dominadoAntica no PAantica great communityantica ,TibiaMMO,d7mmt4u,2,t5_2s3sk
8962408,0,t3_531pgv,a h weapon has higher damage but doesnt let you wear a shield so what all the knights say is that you can wear a h weapon when youre blocking more than  monsters anyway because the third up to the th monster wont get blocked by your shield so you might aswell take the higher damage from the weapon and let the shield at home,TibiaMMO,d7p5aau,2,t5_2s3sk
8964115,0,t3_5322h2,Just like how some players love achivements theres always some who love outfits ,TibiaMMO,d7pco6d,1,t5_2s3sk
9003569,0,t3_53kkze,I do use runes on my  pally and it makes my life just better of course i can afford hunting with a lot of runes and i do think its better to use them you get more exp. ,TibiaMMO,d7u37y0,1,t5_2s3sk
9013384,0,t1_d7v83ea,Right? All this maximizing exp buying and selling coins its ridiculous. People just expect minmax at all times and here I am perfectly content hunting Facc areas because its new territory.,TibiaMMO,d7v9o6b,2,t5_2s3sk
9017647,0,t1_d7vnc1q,I think that they still would earn higher profits because of the new people coming from the steam community. ,TibiaMMO,d7vs3vq,2,t5_2s3sk
9026584,0,t1_d7wn9wy,i think lower when i started he was  and i started around .,TibiaMMO,d7wuqok,0,t5_2s3sk
9039981,0,t3_515j12,Oh man I know im late to the party but I just had to say getting this mount was a bitch. Hopefully you have tamed him since this was posted I love how the wolf gives off a little bit of light.,TibiaMMO,d7ygn4m,2,t5_2s3sk
9054782,0,t1_d808h3b,And sorcerers would make death potions.,TibiaMMO,d808nng,3,t5_2s3sk
9070472,0,t1_d823d36,For each level youre missing the weapon loses  attack im not sure about how it works with bows or crossbows tho and you dont get the weapon skill bonus until you reach the required level.,TibiaMMO,d824h01,1,t5_2s3sk
9087285,0,t1_d844ouh,So you go back every  minutes for  hrs? You were getting some quality sleep!,TibiaMMO,d8458e2,5,t5_2s3sk
9098178,0,t1_d85g7r7,Yep i got banished for  days  reason tibia rule b.Its funny when u think of it someone may actually be a hacker and he is getting banned only for  days in other hand D,TibiaMMO,d85gczj,1,t5_2s3sk
9118017,0,t3_553wb8,I am at the same guild as Serantio.Level  ED Ransack.Problem is that I have a Long work shedule at the time.But you can try to msg me if I am online.,TibiaMMO,d87u6b5,1,t5_2s3sk
9119570,0,t3_554fot,For comparing the different types of weapons I always like to look at that table. ,TibiaMMO,d880vnm,1,t5_2s3sk
9138921,0,t1_d8ad4p1,This. Prewzz is very entertaining pvp streamer. Only person who I enjoy just as much would be bubba,TibiaMMO,d8afalz,5,t5_2s3sk
9173585,0,t3_55wei8,Upgrade to Prismatic Armor for that sweet physical bonus. But as someone already said you should do WoTE and get yourself a Royal drake mail since it gives you more physical and it also gives you  shielding.,TibiaMMO,d8etipp,2,t5_2s3sk
9177543,0,t1_d8eosy7,It has always worked like that just before it cost players  dollars a kk and even before that like  dollars a kk lol people are going to spend cash so they can have fun in tibia without the stupid boring grind p,TibiaMMO,d8fbjyf,1,t5_2s3sk
9185038,0,t3_561n4y,Everyone would like their vocation to be buffed in some way. I do have little sympathy for the plight of the Paladin. They are high profit with the ability to hunt anything. Not only that they have always been single target high damage if you want AOE play another vocation...,TibiaMMO,d8g9rbw,2,t5_2s3sk
9210125,0,t1_d8jf6sb,Alright Ill try it out.,TibiaMMO,d8jga70,1,t5_2s3sk
9214071,0,t1_d8j4kp4,Leave it there for decoration wassassin stars however I believe it provides better defense than the rest of the shields available,TibiaMMO,d8jya3l,1,t5_2s3sk
9234598,0,t1_d8miug2,I use an arbalest with prismatic bolts which cost gp same as the crystalline arrows and have one more attack point than the arrows counterpart.  I could get a crystal crossbow which has almost the same specifications as the mycological bow and its cheaper in my server.  So you suggest me to upgrade my weapon? Any argument on why should I use bows? Im lvl  so I can use either of both weapons I prefer crossbows tho.,TibiaMMO,d8mjx10,1,t5_2s3sk
9240451,0,t1_d8n9353,It is kinda usefull if you wanna do lootbags although the number of places with a royal mailbox is quite limited.In general any quest that allows you to travel to new places is worth doing shattered isles yalahar explorer society...,TibiaMMO,d8nalso,1,t5_2s3sk
9241197,0,t1_d8nbgpm,Well it depends. If youre more worried about being headshot than attrition damage necklace of the deep is the better of the two. When I did it on my druid at  with no mana shield I was only worried about getting headshot as I could heal any of the other damage right off.,TibiaMMO,d8ne0bu,1,t5_2s3sk
9274605,0,t1_d8rm26w,Yeah im an ED. Thanks for the tip!,TibiaMMO,d8rmerq,1,t5_2s3sk
9312425,0,t1_d8vjw8d,Bunnyslippas,TibiaMMO,d8wf2jn,1,t5_2s3sk
9329997,0,t3_589t0h,Thanks for sharing that was lol Did the team make it without you?,TibiaMMO,d8yn8fl,2,t5_2s3sk
9336746,0,t3_58dfpr,Kappa,TibiaMMO,d8zi1j1,-1,t5_2s3sk
9341391,0,t3_58exxw,There are a few iron will members that need it as well. ,TibiaMMO,d9037er,2,t5_2s3sk
9346748,0,t3_57o9ju,Focus on whatever the creatures wont walk over whatever atk rune youre using and manas. As you get higher youll start carrying more of a mix of situational runes. Always keep a few SDs on you and hotkeyd in case you get trapped and need to SD your way out of a tight spotcorner.  ED,TibiaMMO,d90rn3s,1,t5_2s3sk
9378722,0,t1_d94syau,dont forget Sio and mass heal!,TibiaMMO,d94tihx,2,t5_2s3sk
9395161,0,t1_d96w733,on the tldr in the post it says this The boss fights are repeatable and aim at players who are able to compete at the Heart of Destruction. Once a boss is defeated the player unlocks the corresponding powerful imbuements. Further information about imbuing will be revealed in a designated teaser.so yeah.. you need to be around  Id say. the monsters that are in these places are much more varying it seems so atleast something for lower levels as well.,TibiaMMO,d96wiae,4,t5_2s3sk
9398796,0,t3_59bvp0,haha before the salt start I got a good laugh out of that ending...LULZ.. So on a serious note I think that being able to add skills elemental dmg and being able to customize your play style is neat however....This opens a can of worms for all the die hardcore players in what is the most or maximum effect I can achieve?  On the other side it allows a very cool way to change things from the normal... who knows tho right? I mean we do remember the self made runes vs the store bought knock offs? with both having different damage modifiers.  Oh wait... those never happened...So with this update it could be really cool....or as stated before friggin CIP will have to play damage control and make the thing a whole mess....ltprepares salt shakergtWith how they have added support to tibia  and with strong changes to the Store which I might add is pretty cool for the most part....I hate to say it boys n girls but I think they will add these effects to the store... with minor differences than the people that do the quest eh all speculation at this point...but they did add XP boost...  All in all I have my saltshaker ready....,TibiaMMO,d97d398,1,t5_2s3sk
9399429,0,t1_d97c51b, he is on point they have been transferring a huge amount of features so should be too long,TibiaMMO,d97fz62,1,t5_2s3sk
9445567,0,t3_5a2x5j,heres mine,TibiaMMO,d9dajfe,4,t5_2s3sk
9469950,0,t3_5agwwx,Can still have fun all old content like orc fort POH are still there just dont expect much past level  as no new high level stuff has been added to fremium areas,TibiaMMO,d9gdksb,4,t5_2s3sk
9482767,0,t3_5altjj,I use the overcharged Crossbow of Mayhem for pvpbosses. Pretty much any situation you would use infernal bolts for. For regular hunting Just use a master umbral bow or a rift crossbow if you cant afford an umbral after buying a crossbow of mayhem,TibiaMMO,d9hyegy,1,t5_2s3sk
9500129,0,t1_d9k2ury,Theres no failure chance if you pay k and a  failure chance if you pay k for the powerful imbuement.,TibiaMMO,d9k3d6f,3,t5_2s3sk
9511682,0,t3_5b3exe,I tried it out a bit last night and as a paladin I think the warsinger bow is the best bow you will be able to enchant which would still be dealing less damage than the overcharged bow of mayhem Im just guessing dont have any statistics. They positive side is that you could get lifemana leech and crit or  in distance but it would cost you a lot more than refilling your bow of mayhem will as prices of gold tokens will keep on dropping.,TibiaMMO,d9lim6s,3,t5_2s3sk
9513133,0,t1_d9lmtmk,If this is tweaked well.. imagine with mana leech this will be a good solution with knights mana potion spamming issues.,TibiaMMO,d9lp2p5,3,t5_2s3sk
9527211,0,t1_d9khupm,Such as?,TibiaMMO,d9nfhy1,1,t5_2s3sk
9584047,0,t3_5c8hax,Ouch. Where are you from?From my city I get  to EU and  to US,TibiaMMO,d9ufgpy,1,t5_2s3sk
9596348,0,t1_d9vrycx,gt If I see a botter I might be mildly annoyed but I honestly dont think other peoples cheating affects my gameplay experience that muchI wish I felt this way botters completely ruin the game for me. Im a loner MMO player too I honestly wish there was a easy way to play the game completely offline. I love the exploration and sheer size of the game would be much more fun for me if it was empty except for me and the enemiesbosses. ,TibiaMMO,d9vy2b2,5,t5_2s3sk
9599581,0,t1_d9wbrft,Watch out at roshamuul the monsters can easily kill you ,TibiaMMO,d9wcezh,2,t5_2s3sk
9624348,0,t3_5ctsrh,Best advice is to save money and get premium so you can offline train and get bonus stamina,TibiaMMO,d9zee23,4,t5_2s3sk
9637760,0,t1_da0f9do,PLOT TWIST!,TibiaMMO,da11wle,1,t5_2s3sk
9654305,0,t3_5dauk9,of course it is in the long run the st day arent THAT important i guess.,TibiaMMO,da33e4t,1,t5_2s3sk
9654999,0,t3_5d5oe1,What is the advantage of using this over using a more reliable platform like Open Broadcasting Software  Twitch.tv?,TibiaMMO,da36h7z,1,t5_2s3sk
9664347,0,t1_da4bcg3,is it possible to carry the gold converter in your bacpack,TibiaMMO,da4bzxr,1,t5_2s3sk
9675023,0,t1_da5mtw7,key word there also.,TibiaMMO,da5ne42,2,t5_2s3sk
9675478,0,t1_da5mxhz,I mean im not good at the game. Already died a lot when theres no kicks... The game is hard by itself man lol,TibiaMMO,da5pewk,1,t5_2s3sk
9677437,0,t1_da5xwlf,ok seems like i do,TibiaMMO,da5y4gt,1,t5_2s3sk
9684123,0,t3_5dpl81, tomorrow is MS time!,TibiaMMO,da6ru7x,1,t5_2s3sk
9701682,0,t3_5dzpoh,None. Every one of them is unplayable. Dont waste your time and money.,TibiaMMO,da8xu46,0,t5_2s3sk
9719497,0,t1_daacdt5,And mine! D,TibiaMMO,dab50ue,1,t5_2s3sk
9727482,0,t3_5ee1w6,happened twice to me even messaged cip no chance they say if the system didnt triger it wasnt a server issue...dont let yourself down keep on going,TibiaMMO,dac4ipx,1,t5_2s3sk
9778506,0,t1_dai3yls,I have heard some rumours on the support forums and on my old server that some of these services clean accounts out to cleaner characters on each server.  Its not out of the realm of possibility that this can happen.  A VPN provider can look through all the traffic that goes through it and look for valuable data.Again these are rumours but its not impossible for them to do that.,TibiaMMO,daiezs4,1,t5_2s3sk
9779924,0,t1_daikixf,Well one way to check would to be analyzing logs sentreceived through NoPing.  However these services arent immune to the kicks themselves.  Its possible they just host their VPN in London too.,TibiaMMO,dail9pn,1,t5_2s3sk
9819870,0,t1_daniwpi,Oh shit! Forgot about that one ,TibiaMMO,danjpzk,1,t5_2s3sk
9843466,0,t1_daqmgn2,Just a minute too late!,TibiaMMO,daqmklk,1,t5_2s3sk
9855439,0,t1_darvgnt,Why demon legs?,TibiaMMO,das6q9v,1,t5_2s3sk
9868867,0,t3_5goywq,They dont give a fuck what we think. This isnt news my friend..,TibiaMMO,datxpo0,2,t5_2s3sk
9894380,0,t1_dax90vg,Guilds leaders have been bugged since the update,TibiaMMO,dax9ewg,1,t5_2s3sk
9928316,0,t3_5hnuod,Where are you playing from? If US try Fidera if EU go to Antica,TibiaMMO,db1onw0,1,t5_2s3sk
9960877,0,t1_db5oseq,Perfect then I will connect on Tuesday if you want to play together im from Spain btw xD,TibiaMMO,db5xf3z,1,t5_2s3sk
9980958,0,t3_5igzzd,Marvelous ,TibiaMMO,db8jpf6,1,t5_2s3sk
9989408,0,t1_db9cfz8,removed,TibiaMMO,db9nbfg,2,t5_2s3sk
10038325,0,t1_dbfuhow,Thank you for the tip! Will continue thursday and Im aiming for atleast  levels by then. Getting those GMPs and new gear will sure help alot,TibiaMMO,dbg0qda,1,t5_2s3sk
10055123,0,t1_dbi6pkn,What level are you?,TibiaMMO,dbi7goh,1,t5_2s3sk
10066268,0,t1_dbjnmxd,Didnt even notice lol. ,TibiaMMO,dbjnozo,2,t5_2s3sk
10066621,0,t1_dbjojms,Yeah definitely. I was level  at the start of today. So I just went Oramond to pg and got level  in  hours. ,TibiaMMO,dbjpcjq,2,t5_2s3sk
10081296,0,t1_dbll2ms,maybe to hustle  when they see a player target they start playing and starts to win big. leaves and hopes you think hmm ok ill play,TibiaMMO,dblm2iv,1,t5_2s3sk
10083924,0,t3_5k7p8f,Congratulations!!!,TibiaMMO,dblyd0u,2,t5_2s3sk
10094726,0,t3_5kd4d1,Oramond Minos Level  gt I think I even ended up making some profit because of pickups from dead minos and market value of certain creature products.,TibiaMMO,dbncwbm,3,t5_2s3sk
10103998,0,t1_dbohtpg,As well as the flash client there is no technical reason that you couldnt run an ELF binary on Android so in theory you could play on Tibia  Linux client. I wouldnt recommend it but it might be an option.Edit to clarify it might need some degree of gaffa tape level hacking to make this work but I dont see why it shouldnt.Further edit It would need a bit chip in order to run so only really topend flagship devices would work.,TibiaMMO,dbok9yt,1,t5_2s3sk
10105189,0,t3_5k9nab,Hey id like to play too. i already have a knight on ishbut id like to start a sorc im lvl  my ign is Need Rice,TibiaMMO,dbopuq9,1,t5_2s3sk
10111531,0,t1_dbojkdx,Were always taking noobies!,TibiaMMO,dbpjj5a,1,t5_2s3sk
10136750,0,t3_5l0lk7,sounds like someone has been spamming potions for hours.this is a rough estimate but without double xp or vouchers its like  hours straight from  to get  ML at ML .ltwaiting for trolls to tell me where my calculatons are wronggt,TibiaMMO,dbstmlw,1,t5_2s3sk
10139741,0,t1_dbspkzm,Theyre the same guild that requires anyone over level  that transfer to Amera to pay a fee or theyre hunted. Also FULL of botters.,TibiaMMO,dbt7nxy,2,t5_2s3sk
10152760,0,t3_5ld04q,There are plenty of older servers too though.I cannot recommend enough Fidera tho. Great community. You can chill hunt and do whatever you find suitable to your playing style and find people to hunt to make your grinding times more enjoyable. I loved playing there during the time that I did so left for the newer SA servers.Also if you like PvP you can go to Antica or one of the more populated RetroPvP servers.Dont give up and watch some of EricPsykik videos they are a great guide to what to do to level up faster and efficiently.,TibiaMMO,dbuvdq7,4,t5_2s3sk
10172725,0,t3_5lmv3i,Sorry I only know profit places for MS lvl . ,TibiaMMO,dbx4unm,1,t5_2s3sk
10175946,0,t3_5lox8s,Antica always have people online especially in English chat if someone skulls on you call for him and help will come very quickly. Dont get demoralised with the deaths in fact you should take the opportunity to learn how to survive against PK,TibiaMMO,dbxhzxw,1,t5_2s3sk
10197282,0,t3_54guk8,Is tibia worth playing ? ,TibiaMMO,dbzx2lw,1,t5_2s3sk
10200296,0,t1_dc0936e,Well Im impressed. ,TibiaMMO,dc09e1d,2,t5_2s3sk
10200856,0,t1_dc0a96f,Sorry we pay for accessing the games premium content. Not for a second do you pay for a lag free h hunting festival with to kicks and ms ping.,TibiaMMO,dc0bock,2,t5_2s3sk
10206762,0,t1_dc0gx3k,This amp Imbuing promotes hunting a wide variety of creatures that are usually overlooked. The old areas could do with a bit of a buff though.  I dont think FACC areas should have the same XP rates as Prem areas but they should still be okay to hunt at least up to level . Sauce Currently revisiting all the old areas on my free account. ,TibiaMMO,dc0zru9,1,t5_2s3sk
10220747,0,t3_5mc4og,What I want to know is why is playing with a proxyVPN based in Europe on a North American server faster than playing with your North American connection. ,TibiaMMO,dc2kuqn,3,t5_2s3sk
10221867,0,t1_dc2p92c,There are plenty of accounts out there with  days,TibiaMMO,dc2pevp,2,t5_2s3sk
10264174,0,t3_5mwtja,yes. just did that on the ice boss last night ugalarzaa was there to laugh at my face,TibiaMMO,dc7i0ez,2,t5_2s3sk
10265691,0,t1_dc7nloy,And the same on Belobra.,TibiaMMO,dc7o7e4,1,t5_2s3sk
10298419,0,t1_dcb5xvi,Well this was the problem in the past aswell. When I started a friend just said that I was gonna be in Rookgaard and hunt rats til I got level  and then I could go main.. I didnt know what the hell that meant but I found rats and I killed them and I got to level  and got to Thais. Then I became a Tibiaaddict.,TibiaMMO,dcbdqt1,5,t5_2s3sk
10299090,0,t3_5ngd3m,Yes my friends who live close to Regensburg did try to visit them only thing u see is a reception where you get told that they only communicate with their customers via mail. So dont waste your money on trying out yourself xD,TibiaMMO,dcbghdf,10,t5_2s3sk
10303113,0,t3_5niu2l,What I noticed is the difference now from a few weeks ago is that you dont just get kicked and reenter the game again but instead I lose connection and have to reconnect to the game. Also it takes longer from the freeze to that I acctually get kicked from the game around  sec sometimes. So if youre hunting youre dead.,TibiaMMO,dcbwvw6,2,t5_2s3sk
10324176,0,t3_5ntv7e,I ran out of pots once and lagged out twas great. Free trip back to town and didnt lose blessings. Thats about the sum of my tibia luck tho ,TibiaMMO,dceawb5,3,t5_2s3sk
10372152,0,t3_5oiakf,My money wasnt hard earned but Im pissd too. ,TibiaMMO,dcjqult,14,t5_2s3sk
10402548,0,t1_dcn0ibe,Thats almost an ammount of xp on my main char.,TibiaMMO,dcn722z,1,t5_2s3sk
10402692,0,t1_dcn6oyn,Exactly! I have the Rival  and I can set  macros on it but i feel like its not enough...,TibiaMMO,dcn7na7,2,t5_2s3sk
10403690,0,t1_dcnbo70,That does make sense thank you!,TibiaMMO,dcnbpzt,1,t5_2s3sk
10407793,0,t3_5ozvkf,Grats.Great quality videoOOOOOOOOOOOthats my favorite part haha,TibiaMMO,dcnshoj,2,t5_2s3sk
10417466,0,t1_dcopn53,Oh no my ping is that high on NA. Never tried South American servers because I hate crowded servers and the overall power abusing disrespectful br community.,TibiaMMO,dcovz6t,1,t5_2s3sk
10432558,0,t1_dcq6if4,Hey I play on Garnera as well. Feel free to hit me up sometime. IGN  Mareeper,TibiaMMO,dcqllrd,2,t5_2s3sk
10439251,0,t3_5pi3yj,I think I did Annih on my RP at like  or  just fine.  Can you SS your gear?,TibiaMMO,dcrd4j1,1,t5_2s3sk
10440311,0,t3_5phiq8,edit  club,TibiaMMO,dcrhiii,1,t5_2s3sk
10447907,0,t3_5pmkmy,Is this some kind of DLC for tibia that Ive been completely oblivious to or something?,TibiaMMO,dcsd014,1,t5_2s3sk
10450076,0,t3_5poi1f,Define what scratch is lol,TibiaMMO,dcsm35d,0,t5_2s3sk
10450450,0,t1_dcsmqrr,Hey i am level  too   Ign  Metaspeaks,TibiaMMO,dcsnn3i,1,t5_2s3sk
10454897,0,t3_5pqn9v,I dont get it. What happened?,TibiaMMO,dct60x6,2,t5_2s3sk
10458280,0,t1_dctfme8,I wish they were that efficient deleting botters xD,TibiaMMO,dctjunu,8,t5_2s3sk
10526003,0,t3_5qo63k,you guys just cant have nice things,TibiaMMO,dd18jlt,1,t5_2s3sk
10538542,0,t3_5qvhie,lol,TibiaMMO,dd2nsi0,1,t5_2s3sk
10543511,0,t3_5qwvyb,not sure about nerana but u can join us on Antica tho my ign Sastfai or just PM any other person from our guild named PandasGood Luck ,TibiaMMO,dd383j4,1,t5_2s3sk
10552190,0,t3_5r3nea,all those eks blocking the dragons facing your team asking for trouble there.,TibiaMMO,dd47jr2,1,t5_2s3sk
10558737,0,t1_dd3c8td,Sadly ,TibiaMMO,dd4yadw,1,t5_2s3sk
10579698,0,t3_5r7s5g,Quaras were quite profitable for me. Calassa is faster for tasking due to weaker and stronger quara being mixed Sunken Quarter being the opposite. Frozen Trench in Svargrond isnt as glamorous.Brimstone bugsmutated bats near Rebel Camp was average. Royal Mailbox courages to lootbag goldother stuff. Beware of getting overwhelmed by the spawn though.Giant spiders... anywhere. Port Hope Malada Plains of Havoc Forbidden Lands... you name it. Easy and profitable.Nightmares in Yalahars cemetery quarter is an easy spawn to reach but they hit hard and arent too profitable. Can hunt giant spiders alongside up in the cathedral.,TibiaMMO,dd77p9h,1,t5_2s3sk
10589581,0,t1_dd6uubd, steps if cip has issues with the movement bug,TibiaMMO,dd88fh6,1,t5_2s3sk
10615488,0,t1_ddav6d2,Thanks for the reply! Thats awesome! I actually started playing in like ish originally. So I lied a bit I did download the client maybe a little less then a year ago but was very disappointed when I logged in. Other then the fact I no longer had my old characters but I did not recognize anything at all when I logged in so I walked around for like  mins and that was it. Im just afraid this is not the Tibia that I used to know and love. That not even the RPG part of the game but also the community and the social aspect of it is what I loved.,TibiaMMO,ddawo9b,1,t5_2s3sk
10622601,0,t3_5s11oz,Yes like you move and you see the movement being done but then you teleport back to the starting tile,TibiaMMO,ddbn2ij,1,t5_2s3sk
10623051,0,t1_ddb9j9y,yeah will do!! what region server would you be on?,TibiaMMO,ddboqm6,2,t5_2s3sk
10662193,0,t1_dderfid,You guys arent supposed to mention OTs in this subreddit. P Lets just be happy CIP finally did it at least.,TibiaMMO,ddfq2of,1,t5_2s3sk
10680727,0,t1_ddhmkiy,tibia coins are like  per coin. cant buy anything with that. and i cant send it cause its another world.EDIT so what do i buy with those  coins?,TibiaMMO,ddhmwqi,1,t5_2s3sk
10689118,0,t1_ddib8lh,i will try it as soon as i hit  will enchant the arbalest with crit life mana or crit dist mana and shove my face in those furry hornies,TibiaMMO,ddii55x,1,t5_2s3sk
10694104,0,t1_ddizuwk,Equipped,TibiaMMO,ddj0n1w,1,t5_2s3sk
10714838,0,t3_5t8rlp,Dominando is part of the game. And also server changes I kind of disagreed but was curious about them at the same time. Because now you can basically free a dominated server by fighting the guild there. But the wars take years until any guild really loses exp or money.As said before the bot is what ruins all this afterall. But its the same as it is in real life.. the powerfull people will abuse the system and have their criminal things go on,TibiaMMO,ddl5m9p,1,t5_2s3sk
10729438,0,t1_ddmngoc,so its pretty much better to just hunt with  ppl a party of ? Since it would be  bonus so  would yield . with normal stamina...,TibiaMMO,ddmntl5,1,t5_2s3sk
10739265,0,t1_ddno17a,On hero cave i would say always use sword yeah the manacrit drain is very nice there you waste less and less chance to get headshot since the defense.,TibiaMMO,ddnoa1u,1,t5_2s3sk
10767551,0,t1_ddqkwnt,Im thinking either PoH or Dark Cathedral,TibiaMMO,ddqld1y,2,t5_2s3sk
10772118,0,t1_ddq4pdj,Thanks for the info ,TibiaMMO,ddr2crm,1,t5_2s3sk
10774721,0,t3_5u3a8k,Isnt that pit open with the Mend Whats Broken part?,TibiaMMO,ddrc27w,1,t5_2s3sk
