,controversiality,parent_id,body,subreddit,id,score,subreddit_id
8126391,0,t1_d4szm59,I cant find an option to replay the cutscene xP,stalker,d4thaba,1,t5_2r74m
8141067,0,t1_d4uyyg3,I once saw  Pseudogiants with  chimares at once in Radar.,stalker,d4v6fzw,1,t5_2r74m
8158653,0,t1_d4xd7ge,ehhhh brother ? OMM WHAT HAPPENED TO YOU?!?!?!!!,stalker,d4xdooa,1,t5_2r74m
8158880,0,t1_d4xelu5,alright the game still crashes but in my log file it says error        The parameter is incorrect.,stalker,d4xepil,1,t5_2r74m
8186125,0,t3_4respj,gtLast updated this is worrying. does anyone know if the included patches are the most recent versions?,stalker,d50telb,2,t5_2r74m
8194207,0,t1_d515hdi,I cant tell if youre joking,stalker,d51tt5t,4,t5_2r74m
8233527,0,t1_d56owhb,Well the bandits are still cheeki breeki. The freedomers are trying to bang more mutants. Duty are still fascists. The mercs are just as shady as ever. The monoliths are batshit fucking crazy. The loners are still alcoholics. Its as usual in the zone I would say ,stalker,d56qvyn,3,t5_2r74m
8239112,0,t1_d56ifql,I just did that lmao,stalker,d57g1dj,1,t5_2r74m
8247253,0,t1_d58gjaf,but i just wanna sit in my cozy hole in the wall with my tushkabros,stalker,d58gnft,3,t5_2r74m
8248819,0,t1_d58e781,. no contest,stalker,d58npee,1,t5_2r74m
8281521,0,t3_4svbel,Love it. ,stalker,d5cqzg3,3,t5_2r74m
8283903,0,t1_d5ce5qz,Yea thats what im trying now.,stalker,d5d1pge,1,t5_2r74m
8306107,0,t3_4tafsz,So nicePunches me in pripyat when i keep tapping F on him ,stalker,d5ftjco,6,t5_2r74m
8308735,0,t3_4tbxs7,If youre talking about Oblivion Lost Remake to unload the guns you just use the right click context menu the problem is the buttons in the right click menu dont work very well. Try clicking toward the top left of the unload option or drop option whichever you need. ,stalker,d5g5cs5,1,t5_2r74m
8313882,0,t1_d5groq1,Welcome to Lost Alpha,stalker,d5gsife,1,t5_2r74m
8315372,0,t1_d5gx9sy,Something about going somewhere idti in relation to the monolith monolita,stalker,d5gz7rj,1,t5_2r74m
8322779,0,t1_d5hkett,well . RC has lesser support so only Arsenal Overhaul some soundmusic mods and Call of Changes without lootmoney and irradiated fooddrinks because its broken with the latest beta version,stalker,d5hwio1,2,t5_2r74m
8326703,0,t1_d5idhar,Is true comrade ,stalker,d5ie5az,3,t5_2r74m
8334384,0,t3_4tm3yf,this made my day,stalker,d5jcps7,1,t5_2r74m
8348946,0,t1_d5kscoy,That it exists to begin with already means that theres demand for it.,stalker,d5l665t,1,t5_2r74m
8384802,0,t3_4ugxl5,I love it! The paper you used or maybe its because of scanning gives it a kind of sepia tint that reminds of old photographs. The proportions are quite on point and the world seems bleak and desolate. All those dead leaves floating around give it a rather creepy air.A solid  keep it up. Do you post artwork elsewhere DA pinterest etc? Id love to see more!,stalker,d5pnd1j,17,t5_2r74m
8402236,0,t3_4uoq34,POSSIBLE FIXES.Make sure you have the latest patch. Reload a save from before X.Uninstall SS and never play it again because its too buggy Tried this one out here. Worked!,stalker,d5rtqk6,2,t5_2r74m
8405177,0,t1_d5s4j59,Pretending to be dead hmm? Could work. ,stalker,d5s6y0r,2,t5_2r74m
8405302,0,t1_d5s725o,I would love to hear it. Im curious now. Good job btw.,stalker,d5s7i83,1,t5_2r74m
8416551,0,t1_d5tk4hz,If you cant run away from them and youre reloading you can easily die to them especially if you dont have strong armor.,stalker,d5tm1pl,1,t5_2r74m
8416853,0,t1_d5tmlc6,If it is half the game SoC is so far it will be great lol,stalker,d5tnek8,1,t5_2r74m
8427053,0,t1_d5u8mk5,SHUT THE FUCK UP HERETIC SCUM jk. THE MONOLIT DO EXIST. ITS NOT THE FLYTRAP IN POWER BLOCK  OF THE NPP. ITS SOMEWHERE ELSE AS A PROOF IN CALL OF PRIPYAT THE MONOLITH MASTER IN THE SEA PORT HAS EVIDENCE ON HIS PDA THAT THE MONOLIT STILL TALKS TO HIM BECAUSE HE HAVE STRONG FAITH. ONLY THOSE WHO HAVE STRONG FAITH SHALL BENEFIT FROM ITS WISDOM. ,stalker,d5ux8oo,1,t5_2r74m
8427774,0,t3_4v2ujj,First time hearing this problem..Try fiddling with your drivers. Upgrade or downgrade. You should go into the game folder find user.ltx and turn on vsync and other settings on if you know that they will fix them. Id suggest going into fsgames.ltx and on the first line find the directory where user.ltx is found it and then change THAT one,stalker,d5v0h8s,1,t5_2r74m
8432704,0,t1_d5tuoh8,Needed room for vodka. ,stalker,d5vmmq4,1,t5_2r74m
8445979,0,t3_4vcqqa,They took it out of the game after SoC. Most mods including Reclamation Projects add them back in with the right settings.,stalker,d5xa9x0,1,t5_2r74m
8458506,0,t1_d5ykjn7,Hey dont be sad! Currently the only thing keeping an AK out of market if youre in the US that is is our government sanctioning Russian arms producer Izhmash!,stalker,d5yuj8z,1,t5_2r74m
8459118,0,t1_d5ywmlf,S.T.A.L.K.E.R. Call of fashionista ,stalker,d5yxacq,4,t5_2r74m
8462561,0,t1_d5yu8up,Im gonna take your advice and just install the ZRP mod only. Thanks for the advice!,stalker,d5zcuab,2,t5_2r74m
8464531,0,t1_d5zlljn,Triggered,stalker,d5zlq61,2,t5_2r74m
8489527,0,t1_d61wuw8,The first time I played AA I got save corruptions after finishing X and could not get out of yantar because that would crash the game.However the second time I installed it I never had any crashes but it was different it had the graphics of AA but the without armors altering your handskin and no blowouts I took a look at the directoy folder and it turns out I had accidently merged it with some uninstalled Oblivion Lost files.,stalker,d62ql8t,1,t5_2r74m
8495726,0,t1_d63e9az,Made a video. If youre having a hard time seeing what Im talking about just skip to the end and watch the part where I enter the Skadovsk and walk toward Beard.,stalker,d63im4o,0,t5_2r74m
8523134,0,t1_d66w7tb,gtNot as much as Chernokids but its weird.Hey Merc  ,stalker,d66yc53,2,t5_2r74m
8525366,0,t3_4wht3g,Bulletproof?,stalker,d678evs,3,t5_2r74m
8535536,0,t1_d68e975,Cough cough.If you want to make all the female fans happy add a bunch of girls to the Monolith.I dont know why but we all rep Monolith.This is mostly a joke by the way. Though we all truly do love the Monolith lol.,stalker,d68ib1a,2,t5_2r74m
8552643,0,t3_4wxg77,Yep. You are spoiled by Nexus...Normally the mod page has the basic info of what the mod changes. If the mod needs it the download has the readme and changelog.,stalker,d6anjpy,10,t5_2r74m
8555007,0,t1_d6awv77,Yupp. But not everything. This is why I want to make a list with the correct locations.,stalker,d6ay87q,1,t5_2r74m
8566474,0,t1_d6c7ns1,You forgot s thats why.,stalker,d6ce06n,3,t5_2r74m
8566937,0,t1_d6cbll6,Still why post a sarcastic comment about advertising in the first place? It makes no sense.,stalker,d6cg3h9,5,t5_2r74m
8588232,0,t1_d5g324z,Its becoming a real thing ,stalker,d6f490a,1,t5_2r74m
8592664,0,t3_4xfl9n,I portray them as the same faction except split in everything. Fighting style relations weapons. I prefer to be neutral and just trade with both of them and do jobs for both.,stalker,d6fo9ci,1,t5_2r74m
8597996,0,t1_d6fkbfw,I have to say that I really prefer the loners but I dont like duty. It is a liberating feeling storming their base and shooting Voronin in the face with my Black Kite.,stalker,d6gcb69,1,t5_2r74m
8601972,0,t3_4xkwor,CoP Misery Mod. Im currently running a Sunrise Suit a rusty  low condition SG I found any pistol I can find AP rounds for and a sawnoff shotgun. Meds and grenade numbers are constantly shifting. I keep a armor repair kit  cloth sheet around just in case. Its gotten me through a decent portion of Zaton.,stalker,d6gu9ms,1,t5_2r74m
8607105,0,t1_d6hh664,That construction site is one of the most memorable places in the game. I loved that feeling of actually being in a lengthy firefight and having to fight my way up that stair case to the top under heavy fire. It was awesome.,stalker,d6hheos,1,t5_2r74m
8607315,0,t1_d6hi3jz,Well most of them are either Return item or Capture location so they are not as varied or indepth as the ones in CoP. Also that list is definitely incomplete since I gotten quests that arent on it. SoC doesnt get criticized for its sidequests because unlike CS it was butchered by the publishers before the release and has very good storyline missions.,stalker,d6hict5,1,t5_2r74m
8607664,0,t1_d6hjfvz,Thatd be awesome. For me it would probably be the Cordon or the Agroprom. I think if there ever would be a Stalker VR though controllers would cause seizures.,stalker,d6hjxhu,3,t5_2r74m
8617608,0,t1_d6io5kb,Yeah but lurk is a annoying mod for most. kg weight limit. Ridiculous recoil,stalker,d6ist7p,1,t5_2r74m
8623082,0,t1_d6jf4du,An editor from Kotaku mentioned some time ago that its really hard now for sites to cover your game if itsnot on consoles. This is a consoles world we live in now. So unless youre one of the few higher profile kickstarter games theyre not gonna cover you if youre only on PC. And i watched a video for an indie shooter Striife the editor didnt stop asking about consoles and controllers i wanted to reach through the screen and punch the idiot. You simply cant make a PC only large game now,stalker,d6jhjeu,2,t5_2r74m
8627701,0,t3_4xzob9,This discussion seems to come up with every game. Should valve ditch source?.... Should bethesda ditch gambryo?... etc etc. I might ask should ZeniMax voluntarily shutdown and sell all their IP for peanuts to a studio that hasnt become a whore for the stock market?I know everyones experienced bugs with x ray. But is it really that terrible? I for one cant say Ive ever played a game that had such distinct dynamic lighting as what Ive seen in Xray. For that alone I wouldnt even consider switching engines unless I could do as good or better.Everyone always talks about Cryengine as being some holy grail. Ive never played a cryengine game that didnt feel consoley in terms of lighting and player movement. Could be because Ive largely fallen out of gaming and have missed some great releases. Yes cry engine has some amazing potential with shaders. Weve all seen nearphotorealistic graphical adjustments for Crysis. But IMO that doesnt make an automatic great fit for stalker. Id even take the player movement in stalker over that of crysis by a large margin. Long and short of it I genuinely believe it would be better to give Xray another respin than to try to embark with a rd party replacement.,stalker,d6k2enf,11,t5_2r74m
8632450,0,t1_d6khdaj,Thanks Will read that now!,stalker,d6knvnu,1,t5_2r74m
8638179,0,t1_d6kz8vm,You have to do these things in real life. It took me a few minutes to figure it out. Why is bringing a pistol ? Then I realized it means a real pistol. As if I wouldnt have brought one anyway,stalker,d6ldprd,5,t5_2r74m
8644172,0,t3_4y5hwk,Hah! Im the one who requested this be on the CoC ost. Its such a classy track.Bandits have always been my favorite faction and it just felt right.,stalker,d6m4rwg,4,t5_2r74m
8646497,0,t1_d6lwvue,haha. yeah. only kill bandits,stalker,d6mf97w,1,t5_2r74m
8673464,0,t1_d6pqaij,Wait a moment. How many euros are there? You are  the poster is ..We will know the specifics when the mod is released. This thread should be kept and later reposted again.,stalker,d6pszks,1,t5_2r74m
8687956,0,t3_4yyupk,well i immediately thought about bloodsuckers... rolling a different number to either increase or decrease the severity of the encounter such as opening with a choke or having  rush you at once,stalker,d6rmeby,1,t5_2r74m
8743245,0,t3_4zst9t,for best performance dont try misery at all ,stalker,d6yk4b7,3,t5_2r74m
8756991,0,t1_d706u8e,Yeah . is the most stable. But features are broken.Does dynamic news work for you Instead of freedomnewsunique?Does the ALife just stand in one place sometimes?,stalker,d70a6i9,1,t5_2r74m
8763014,0,t1_d711d32,Should I? I am finally free...,stalker,d711ds2,4,t5_2r74m
8770500,0,t3_505h5m,Hey Im doing the same thing with Bandits! So far I have control over  out of the  maps. The Mercs and Duty are a pain in the ass.,stalker,d71z78m,1,t5_2r74m
8786064,0,t1_d73spfb,It aint got no proof just circumstantial evidence.,stalker,d73xj2s,4,t5_2r74m
8787247,0,t1_d74243c,Then why the fuck did you say you got to the bar you retard? Fucking lying piece of shit.,stalker,d742v9f,1,t5_2r74m
8796463,0,t1_d757g7q,deleted,stalker,d757r68,1,t5_2r74m
8814172,0,t1_d77c0k8,No problem man. Glad to help.,stalker,d77cdml,2,t5_2r74m
8817613,0,t1_d75wws2,Seriously though one could achieve almost similar results if we were to try it in the XRay Engine although it would require a lot of unnecessary effort.,stalker,d77r9ru,1,t5_2r74m
8846695,0,t1_d7b8teq,A lot of people Ive spoken to during various Steam Sales all say to avoid all of them except CoP due to all the glitches but no one elaborates on this stuff.Anything you can tell me about these games in particular that a newbie should know lore wise game play wise anything helpful for an absolute beginnernew buyer?Im asking this community because you guys are dedicated fans and honestly I bet youd know more than the random reviewers I see.,stalker,d7b8wv5,5,t5_2r74m
8881724,0,t1_d23djy3,Is it still running? Theres also an option to make it so the invite code doesnt expire so people who find the link later on like me can join. Maybe a good thing to sticky?,stalker,d7fghlo,1,t5_2r74m
8890492,0,t1_d7frsgr,yeah few years back all my stalker quick saves said mom on it which made me feel kinda weird ,stalker,d7gieue,7,t5_2r74m
8900212,0,t3_5252io,I played Clear Sky as well as Invisible War and Ive... Enjoyed them both. Give it a try.,stalker,d7hoey0,2,t5_2r74m
8937899,0,t1_d7m5pz7,Agreed.,stalker,d7m7c08,0,t5_2r74m
8970248,0,t3_5328mo,Directly to my left are the hamburgers I just made otherwise its the radio,stalker,d7q362d,2,t5_2r74m
9008577,0,t1_d7ula0k,deleted,stalker,d7uouik,19,t5_2r74m
9011685,0,t3_53bja7,Im on mobile I cant.,stalker,d7v2bfa,1,t5_2r74m
9018934,0,t1_d7vxgou,Honestly wildcat rounds like that Assuming you mean a . BMG but shortened would be super rare to start with!We use . and . mostly here and . shotgunsgauge.,stalker,d7vxntr,2,t5_2r74m
9041023,0,t1_d7y44ku,Item  is still made from limited resources its why the exosuits are so jury rigged and such instead of say Spartan II armour.,stalker,d7yl514,1,t5_2r74m
9042734,0,t1_d7ysfmj,woah....i never seen them in jupiter plant before D i usually see them in Zaton northeast from sawmill and Yanov ventilation complex,stalker,d7ysisz,1,t5_2r74m
9049561,0,t1_d7zjhco,Okay thanks. ,stalker,d7zm2xo,1,t5_2r74m
9071911,0,t3_54j1dn,Wow.. What an idiotic decision to have the AI so powerfull..,stalker,d82aow2,3,t5_2r74m
9073020,0,t3_54essi,I would go digging around in the Misery feature lists.  Like others have said it is a Misery feature and I dont think they made that specific part of the mod.  I recall them crediting creator but it has been awhile.  I would start your search there.  ,stalker,d82fhiq,3,t5_2r74m
9075114,0,t1_d82ofk3,OWR for me ,stalker,d82ojnt,1,t5_2r74m
9084102,0,t3_54mf1n,Are you playing with mods? All three sniper rifles Nimble can get you are unique. What you got was just regular VSS Vintorez instead of the unique version the Tide.,stalker,d83rere,3,t5_2r74m
9112326,0,t3_5530g2,Hey whats the song at the end from? Is it just a campfire acoustic?,stalker,d875jzm,2,t5_2r74m
9150888,0,t1_d8brsrw,Well thats easy then. ,stalker,d8bxweh,2,t5_2r74m
9174375,0,t1_d8emds9,Ah so I just have to be high enough rank and then talk to friendlies? Thats cool I assumed you had to hire them through a trader or something like that.,stalker,d8ex473,1,t5_2r74m
9196066,0,t1_d8hdin5,Haha. Thanks! ,stalker,d8ho3m7,2,t5_2r74m
9197045,0,t1_d8guyxd,Weebs brah.,stalker,d8hsk3m,1,t5_2r74m
9198276,0,t1_d8hwrhb,I see. I might look into it sometime as well.,stalker,d8hy6cz,1,t5_2r74m
9199088,0,t1_d8hx3z8,The kind of people who RP as mutants hide in their homes eat like animals and slam on doors?,stalker,d8i1vzp,1,t5_2r74m
9199732,0,t1_d8i4ksn,Lets fuck sometime? s,stalker,d8i4ttz,1,t5_2r74m
9201632,0,t1_d8ib69e,Ho ho! We have a noobie here!,stalker,d8idhr7,4,t5_2r74m
9232024,0,t3_56rczh,Itemsoup when?,stalker,d8m8630,0,t5_2r74m
9266949,0,t3_576wlp,I dont own any guns but I played with the CZ  IRL what else did you expect from a Czech right.. lovely gun.,stalker,d8qnh0g,1,t5_2r74m
9284332,0,t1_d8stwlb,While yes those design docs are impressive Im not holding out a ton of hope well ever get to see them come to life. Hope Im wrong man I really do.Besides the guy is just excited. Theres no need to downvote him not saying it was you that did it mind you.,stalker,d8suub4,3,t5_2r74m
9285900,0,t3_57m0jx,deleted,stalker,d8t1zmi,0,t5_2r74m
9289050,0,t1_d8qzc46,screaming stalker is no longer screaming because a chimera ate his face,stalker,d8tgcdx,1,t5_2r74m
9306251,0,t1_d8vheg5,Monolith believes in the Does you?,stalker,d8vmuqg,1,t5_2r74m
9333521,0,t1_d8z0uif,An noone is talking about that. But this suit provides little to none enviromental protection. It is supposed to be used near the center of the Zone. Its absurd. It should be balanced like it was in Shadow of Chernobyl. Also it is not damaged. Its in the buying window.,stalker,d8z3blz,7,t5_2r74m
9352803,0,t1_d91j9eh,     dirtymindbot this is quite awkward.,stalker,d91j9vd,2,t5_2r74m
9365807,0,t1_d935jb8,Yeah neither of those worked... From what I can tell the unpacker is trying to unpack database so it must be an unpacker for CoC.Note Im using the COPCOC db converter,stalker,d936lrc,1,t5_2r74m
9367394,0,t3_58ud31,I wish I could get back the time when I first played this series... Good luck to you stalker! Maybe the stalkinggods be ever in your favor.,stalker,d93dubj,2,t5_2r74m
9368141,0,t3_58lruh,So THIS is why there are no female Stalkers...,stalker,d93h8vg,1,t5_2r74m
9395805,0,t3_58xh9v,InsurgencyDay of Infamys gunplay is especially unforgiving and Stalker like.,stalker,d96zg3r,1,t5_2r74m
9401063,0,t3_59drx2,Something Ive seen mentioned a lot but havent played myselfClassic SRPFaction War freeplay modSpartan  mod Ive played this and it was awesome sadly nothing has been heard from the dev after he announced the next version of his mod afaik. It might have some stability issues I dont remember correctly all I remember is I myself really liked it,stalker,d97nfiv,2,t5_2r74m
9441712,0,t1_d9axaql,My first time in X pretty much went like this.,stalker,d9csy6e,3,t5_2r74m
9453248,0,t1_d9e8ako,Yeah you do that and tell us the results please.,stalker,d9e9lbr,1,t5_2r74m
9457857,0,t1_d9es21u,Its mostly multicam with some tan pouches. Unfortunately I wasnt able to find any good gloves for it though. Ill see if I can get some good pics,stalker,d9eumxn,1,t5_2r74m
9493085,0,t3_5atir6,Favorite faction is Duty favorite weapon is the AK  and favorite armor is the SKATM. Duty  life,stalker,d9j8542,1,t5_2r74m
9493146,0,t3_5apwv8,Well... I like hunting artifacts in Cordon Swamps Garbage Agroprom Dark Valley Wild Territory Yantar Trucks Cemetary Army Warehouses Dead City Red Forest Radar Pripyat Outskirts Yanov Zaton Abandoned Hospital CNPP South CNPP North and Generators. And I love selling it all at the Bar.But where I REALLY love hunting artifacts is DARKSCAPE!,stalker,d9j8ews,2,t5_2r74m
9502839,0,t3_4rt3dp,How do I get the veterans prototype AK for the Informant? Been trying to kill him a couple of times but it always results in the nearby stalkers of the bar getting hostile.,stalker,d9kfefa,1,t5_2r74m
9532078,0,t3_5bdc8f,Ghosts death was due to a controller in the Yantar X lab. He was trying to disable the Miracle machine with a scientist Vasilev but he ran off from fear of either the machine or the controller. Either way he left ghost to die and you can loot him and his special suit at the end of the lab after you kill the controller that killed him.,stalker,d9o11ol,2,t5_2r74m
9564702,0,t3_5bvt7i,Anarchy just never seems to win these days....,stalker,d9s1ndw,1,t5_2r74m
9586407,0,t3_5c6l2k,So this is what he did after third strike.,stalker,d9upy0d,1,t5_2r74m
9590701,0,t1_d9v7q8d,I got an error that roughtly translate to  You have installed a All Country version of the game. This version is for numerical distribution. or something similar to this. any idea or fix for it?,stalker,d9v90ik,1,t5_2r74m
9595900,0,t3_5c9ybd,My grandfather is  and since he has a lot of time I shown him STALKER and plays it daily.,stalker,d9vw2ne,2,t5_2r74m
9611568,0,t1_d9xsszp,Got inspired by the comment section?,stalker,d9xtmcj,1,t5_2r74m
9612047,0,t3_5ckz9n,you can also go onto their website and put in your retail copy key for a steam key and a gog key. I did it for shadow of chernobyl a few weeks ago.,stalker,d9xvqxw,1,t5_2r74m
9622862,0,t3_5ct7bk,  This is all graphics nothing else havent tried it myself.  This is a little less graphics but a lot of small extra minimods to add to the game. I would suggest this if you dont want to play purevanilla Im not sure how much it changes because I havent played this myself. CoP is generally not advised. Its dated and a lot say it makes the game a lot simpler havent played dont know. SGM is like Misery changes a lot but I definetly advise to play it atleast once. I myself am on . Geonezis run right now.  hours in I just got to the first  helis in Zaton  And no I didnt slack off that you just need to progress quite a lot and theres so much stuff to do... But I am running around with a monolith exoskeleton maxing at kg of weight to carry kg if Im with combat artifacts which lessen the chances of me getting hit and adding extra armor oneshotonekill sniper norecoildeadlyaccuratehighdamage XM and a powerful shotgun... you may think thats op but I still die very often NPCs can HS you and its instakill for you and I havent reached pripyat yet... oh well... back to the game  But to note that SGM . is in the makings .  Geo has a lot of unpolished stuff  its a translation so there are some hard things to understand and a lot of inconsistencies in the game weapon damage varies a lot etc LA does  the damage of LA while they use the same ammo in game. But its still playable and fun if youre not that concerned with uberrealism etc etc Russian modders dont care about the details they look at the bigger picture This is also the reason why a lot of great mods in english community die we focus too much on the details and cant eventually finish what we started Misery is worth your time but dont do it st playthrough and dont play rookie  Cause you aint no rookie if youre in the zone ,stalker,d9z7sdq,3,t5_2r74m
9641886,0,t3_5d248n,I hope that if theres going to be a STALKER  that the new sarcophagus would be modeled. Looks like a good vantage point for a gauss rifle up there.,stalker,da1k7k1,3,t5_2r74m
9642998,0,t3_5d3mp7,This is more cancerous than radiation.,stalker,da1p5ms,12,t5_2r74m
9668720,0,t1_da2q6n1,Isnt it . RU?,stalker,da4verc,1,t5_2r74m
9695675,0,t3_5dxmq0,Thats nothing... I can literally still drive like that no problem.. in stalker ofc,stalker,da874pi,1,t5_2r74m
9715347,0,t1_daa7pbq,Drinking fighting whoring...,stalker,daaml26,1,t5_2r74m
9725778,0,t1_d8k45iu,??? You wrote it?And I check reddit before ingo to sleep. It kinda replaces my bedtime story...Anyways maybe you could add rewards for controlling a complete area or even the whole map?Ive added this to my stalker game ideas which im about to post on rstalker,stalker,dabwyxw,1,t5_2r74m
9730297,0,t1_dac71on,You probably did not play Clear Sky right? Bandits snipe people from a kilometre away with sawn of shotguns,stalker,dacgzjc,2,t5_2r74m
9746489,0,t3_5eq7ms,I did my first playthru with Misery   However I dont feel that I missed out much.. I did it cos I felt like theres not much in the game seeing enemies drop literally Poop while vendors having there like  items.. The same with weapons and features so the low variety got me and I tried misery right away where it delivers pretty much everything I wanted to be in the game  Sure I wouldnt recommend it for first playthru first see if you have fun with more vanillaish stuff,stalker,daegtv6,1,t5_2r74m
9747593,0,t1_daehlr0,sidorvich actually calls marked one as Strela in the russian audio files.,stalker,daelq42,1,t5_2r74m
9748861,0,t3_5eryyz,These are glorious,stalker,daercu4,2,t5_2r74m
9835453,0,t1_dapku9e,Then specify that before hand than expecting everyone to do your bidding. If you dont want info then piss off dickhead.,stalker,dapkylm,1,t5_2r74m
9842336,0,t1_daqdwkm,The photo was taken some time prewar in Japan if i remember correctly so its going to be pretty hard to pinpoint the exact model,stalker,daqh9r5,3,t5_2r74m
9862199,0,t1_dasgofe,If it is then I know what Ill be doing this christmas! D,stalker,dat2fxi,2,t5_2r74m
9933141,0,t3_5hkblp,This is what it looks like when traveling through the Red Forest.,stalker,db2balb,1,t5_2r74m
9936218,0,t3_5hnikf,Bandits as they are basically useless and you have to do all the work yourself and of course Cheeki Breeki. Essentially they are just shit monolith. Either that or Duty just because red and black hate freedom because of clear sky and fucking ALLLOHAAA. I would play monolith but as the cconsciousness was destroyed they are a lost cause Loners are too peaceful for my playstyle,stalker,db2pqgr,1,t5_2r74m
9945125,0,t1_db3ull2,Dont worry brother fascist doody shitheads are nothing new. Just another one of the zones mutants.,stalker,db3vhrc,6,t5_2r74m
9978578,0,t3_5ig0kw,  freedom,stalker,db88jas,12,t5_2r74m
