,controversiality,parent_id,body,subreddit,id,score,subreddit_id
683387,0,t1_cghy9tf,Yes. I agree. I bet Immortal can get it somehow.,UTTyler,cghyag3,1,t5_316kd
690492,0,t1_cgircr6,Whats the status on the bombs. You have going out? You were a target and I want you to get in an attack before they get you.,UTTyler,cgirem6,2,t5_316kd
696537,0,t1_cgjf0fu,Agreed. Im mobile like  of the time and would miss this.,UTTyler,cgjg5it,1,t5_316kd
711610,0,t1_cgl5sgr,I have a few ideas. ,UTTyler,cgl5vdg,1,t5_316kd
746851,0,t1_cgp650c,I would normally just LOL but those damn postal inspectors are ruthless and malicious intent is a very broad interpretation.,UTTyler,cgp694f,1,t5_316kd
757116,0,t1_cgqc7qu,get in contact with unzulauf He needs a rev,UTTyler,cgqca4q,1,t5_316kd
757718,0,t1_cgqca4q,Im all set with nzalauf got another? ,UTTyler,cgqequ5,1,t5_316kd
778749,0,t3_230jjd,I did  reviews and got no points. Just sent out  bombs so I should be getting some points soon. Just wanted to help out a bit and do reviews but nada,UTTyler,cgssqhm,2,t5_316kd
807339,0,t1_cgw1pi6,IF they were flaired properly message the mods. I know the scores dont get tallied daily.,UTTyler,cgw1rh9,2,t5_316kd
829905,0,t1_cgy7rg1,deleted,UTTyler,cgym1i9,1,t5_316kd
894041,0,t3_24adgm,...and BOOM. Were down by  points now.,UTTyler,ch5wncl,2,t5_316kd
