,controversiality,parent_id,body,subreddit,id,score,subreddit_id
7673820,0,t1_d3egdrd,Yeah those are great wheels for the price. Ive used them on other repairs. However its easy for a mechanic to respace and redish the rear wheel. Id pursue that before doing anything like cold setting the frame.,bikewrench,d3egv4y,2,t5_2sje0
7691981,0,t3_4kn065,You can try building a bearing compression tool out of a threaded rod and some nuts and washers to preload the bearing while you tighten the fastening bolts but the cap does provide a barrier to the crank arm being walked off so I doubt itll be very effective.,bikewrench,d3gj1un,2,t5_2sje0
7707819,0,t3_4kvw23,Most common hangers with one hole that attaches to the frame and another for the derailleur use a chain ring bolt.,bikewrench,d3ibsus,3,t5_2sje0
7744859,0,t3_4ldwrq,Bottom bracket cable guide. They can be model specific.,bikewrench,d3mj8n9,5,t5_2sje0
7758772,0,t3_4lkur4,Are you sure both beads where seated properly. You should have heard two loud pops when inflating,bikewrench,d3o42pf,3,t5_2sje0
7762065,0,t1_d3o8mf0,It came with rim tape and everything it needed for tubeless except the sealant. After looking at howto tutorials on fixing tubeless punctures I realized that this small of a leak should seal up with liquid sealant. And it did for bit but eventually lost pressure overnight.,bikewrench,d3ohik4,1,t5_2sje0
7763681,0,t3_4ln9na,Yup its cross.,bikewrench,d3oo4hv,2,t5_2sje0
7790525,0,t1_d3royw1,Thanks for the suggestion.  Ill check it out!,bikewrench,d3rpmvx,1,t5_2sje0
7798412,0,t3_4m3klm,Your paint picture looks pretty correct the Orange parts will be bare cable. The other person is also correct about the BB cable guides. The Only thing tripping me up is that the paint picture looks like the cable goes below the derailure but it wont. It loops above it and comes in from the top. You probably are aware of that but if not it should save you at least one headache.,bikewrench,d3slodl,1,t5_2sje0
7802232,0,t3_4m522z,I usually buy from eurobritish stores almost always the cheapestwww.ribblecycles.co.ukwww.bike.comwww.wiggle.comwww.merlincycles.comchainreactioncycles.comwww.probikekit.cacheck amazon.ca sometimes you can get good prices there.mec.ca can also have good prices sometimes.ebay.ca is first place i look then canadian sites then euro.,bikewrench,d3t15bl,1,t5_2sje0
7810836,0,t3_4lndig,Uldate I put it on a bike stand and can replicate it now. It makes a grumblingbearing sound. I think it may be the press fit  bottom bracket. Going to take it to my Lbs but Im trying to figure out a suitable replacement.  Does a press fit  BB have bearings because it sounds like a bearing Rumble. Also the bike is a  diamondback podium . The front cranks were replaced by  compact cranks a few years back and the rear cassette and derailleur were recently upgraded to a  medium cage and sram Specs can be found here,bikewrench,d3u03mb,1,t5_2sje0
7826901,0,t1_d3v88u2,Thanks! Im glad I remembered seeing this sub.,bikewrench,d3vt6d2,2,t5_2sje0
7829264,0,t1_d3vpyhb,gt maybe use a  cassette and have some better spread of gears?Thatd be a tighter clustering but I want the very lowest gear I can get.  Ive got a  in the back now and would go with  if I could but the RD I have is only rated up to .,bikewrench,d3w2r5e,1,t5_2sje0
7832940,0,t1_d3w3zay,As long as they back in the limit screw on he front derailleur I dont see why they would need to change shifters. I might be missing something though haha so feel free to correct me. ,bikewrench,d3whnk2,1,t5_2sje0
7859797,0,t1_d3zi5s6,So youre saying a properly maintained machine will work better than a machine that isnt properly maintained? Wow such a revelation...,bikewrench,d3zig1t,-1,t5_2sje0
7875819,0,t1_d415ahy,StaAAaAaAaAanNnNNn MOoOoOOoOoOonsteEEeeer!read in draculia voice,bikewrench,d41bc6h,1,t5_2sje0
7894218,0,t3_4nes6u,What Trek bike is it? ? ? got a photo? It makes some difference if its from  compared to if its from .But if it didnt come with suspension forks when it was new and is from the s unless its a bottom of the range model from the late s it wont be designed to take suspension forks . Its physically possible to fit short travel forks but they will raise up the front of the bike more than its designed  this causes two issues The handling and your riding position on the bike will change  the handling will be less responsive and the whole bike will be tilted backwards a bit It puts more stress on the welds that hold the front of the bike together this can lead to frame failureIn the s some people did put suspension forks on bikes not designed for them and they didnt always regret it but Id bet any of them that still own and ride those bikes today will have put the original rigid forks back on if they still have them.What are you thinking you will gain from putting suspension forks on it?Mountain bikes have changed a lot since your bike was new  mountain bikes from the early and mids are more like hybrid and touring bikes today and thats what they work well as  trying to turn them into something else like a modern mountain bike really just makes them worse bikes overall.Putting suspension forks on them doesnt give you an idea of what a riding a modern hardtail mountain bike is like and wont give you similar capabilities its more like putting a suspension fork on a hybrid bike.Bikes like the Trek  series are renowned as rugged touring bikes commuters and bikes that do well getting from A to B on any terrain and the simple lightweight accurately tracking rigid forks are a part of that. TLDR  I think this would make your bike worse and not achieve what you are hoping. You could get a second bike a hardtail MTB thats OK from around  or so for maybe  on Craigslist and it will have knobbly tires and be set up  for offroad riding  that would be my recommendation for what to do with your money if you want more capability for rugged offroad riding.,bikewrench,d43dtus,5,t5_2sje0
7901060,0,t1_d443n7f,Sorry I actually dont know anything about bottom brackets thats the sort of thing I would pop into my shop to ask about.  ,bikewrench,d445j5b,1,t5_2sje0
7940288,0,t3_4o067e,Id look at Stronglight chainrings or alternatively consider upgrading to a double chainset.,bikewrench,d48k9ix,0,t5_2sje0
7954750,0,t3_4o766s,Id trust that pin more than the little bolt holding mine in.  That pins going to have to be broken or bent to remove my little bolt coukd vibrate itself loose.To remove just straighten the right side with pliers and grab the rounded left side and pull it out.  You can reuse it till it breaks or put a new one in each time.  Id just reuse it only thing that will break it is constant removal and reinstallation.,bikewrench,d4a6ssu,3,t5_2sje0
8007003,0,t3_4ow158,Was the bike new? Did this happen right from when you first got it or developgot worse over time? Has the finish on the post worn to look like it is only being clamped in some spots?gtThe diameter of the seat post is between . and . inches measured with a caliper.Seatposts are sized in mm even in the US that sounds like a .mm. Thats a rare size and choices for new posts are very limited. You might be best off getting a shim so you can run a different sized post if you do change it. But the next size of post up is only .mm bigger its not impossible the bike has the wrong size post if you got it used. Check the specifications for your frame that it should take a .mm post.An upgrade to a carbon post could be a worthwhile upgrade anyway should noticably reduce buzz to the saddle. Youre not really getting the full advantage of a carbon frame if youre running an alu seatpost. But I expect you would need to get a shim as I dont think theres any carbon . posts made.,bikewrench,d4g29pr,2,t5_2sje0
8009849,0,t1_d4eziqp,Hmm now that I looked a little closer the wheel is not centered. It is closer to the drivetrain side. I recently upgraded wheels so maybe the dishing on the new wheel has been off this whole time and I just didnt notice with smaller tired. Do I just need to adjust the dishing on the wheel then? Any concerns with just slightly loosening one side and tightening the other to get it centered? Thanks for the help. I have a . coming just in case.,bikewrench,d4gdrkz,1,t5_2sje0
8015956,0,t1_d4h2b5t,Lift the front end of your bike up by the bars a bit and give them a few good turns side to side. If you feel any indexing kinda like bumpy spots it wants to settle into or grinding or just general unsmoothness its probably shot. And if it is do not try rebuilding it as the damage done will be permanent.Edit The headset not the bike!,bikewrench,d4h2gk1,0,t5_2sje0
8016559,0,t1_d4gnhuc,Cheap posts are about a dime a dozen.  This is an incredibly easy fix about as easy as you sarcastically implied that it was not.,bikewrench,d4h4wbm,0,t5_2sje0
8022801,0,t1_d4htgtf,gt obviously youll need to adjust your chain lengthWhy obviously? Hes going to a smaller cassette so he doesnt have to shorten his chain. In fact if you go from smallest rear to biggest front nothing would have changed.Edit woops I meant smallest to smallest.,bikewrench,d4hu6c5,1,t5_2sje0
8041472,0,t1_d4jhnu9,gt No cables means fewer points of failureIm not so sure about that.  Wireless introduces a lot of additional complexity.  More complex electronics are more prone to failure if all other factors are equal.  And wireless is subject to interference.  I wonder what would happen at a big ride like an MS  with thousands of riders if everyone had eTap.The cables seem like an unlikely failure point anyway.,bikewrench,d4jxql7,4,t5_2sje0
8042629,0,t1_d4jzg7f,Sure! You in the States? Have PayPal?,bikewrench,d4k2fic,2,t5_2sje0
8061507,0,t1_d4m3zcs,Will do,bikewrench,d4m6t5z,1,t5_2sje0
8106118,0,t3_4q7xmi,Keep them away from pool or other corrosive type chemicals.  Keep them out of sunlight or constant fluorescent light.  Dont let them get too hotcold in frequent cycles.  Theyll last for years.,bikewrench,d4r7800,2,t5_2sje0
8110049,0,t3_4q9o2m,I commute on GP  seasons and have never had a puncture in many thousands of miles of riding. Probably just bad luck. ,bikewrench,d4rn53o,1,t5_2sje0
8110505,0,t3_4qbfro,deleted,bikewrench,d4rozlq,1,t5_2sje0
8132548,0,t1_d4sxwlx,Freewheel or cassette? Shimano  is todays Ultegra. My Shogun is  speed Uniglide. If its a cassette youll need a new hub as Uniglide hubs are not compatible with Hyperglide.,bikewrench,d4u66ub,1,t5_2sje0
8162494,0,t1_d4xusfs,The hub could also be the issue though they always break at the head of the spoke Im not a wheel builder anyways Id prefer to just buy a prebuilt wheel,bikewrench,d4xuykj,1,t5_2sje0
8178850,0,t3_4qva5w,They still have the PK they just reconfigured the tools offered to a better mix and changed the name to PK. ,bikewrench,d4zwlw8,1,t5_2sje0
8184944,0,t3_4rf65m,Might have an issue with frame clearance andor brake caliper reach.  Fair warning.Edit Im stoned and couldnt immediately remember which size is larger.  Frame clearance wont be an issue.,bikewrench,d50o2x1,6,t5_2sje0
8187171,0,t1_d50xpg6,I found a frame for super cheap and powder coated it built it myself. ,bikewrench,d50y4kn,1,t5_2sje0
8194288,0,t1_d51nuo1,That repair kit is specifically for broken studs that are not removable.  It doesnt actually replace the stud its just a sleeve that stays in place with a longer bolt.  If you remove the brake the sleeve comes off as well.  They work fine the only alternative is having a frame builder repair the framefork.,bikewrench,d51u6as,2,t5_2sje0
8209260,0,t3_4rmf06,Thanks for all the help everyone! I will run the reynolds pads and let them wear in. I will report back if additional issues arise! ,bikewrench,d53pnol,1,t5_2sje0
8233244,0,t3_4s5tw6,You need a star nut if it is an aluminum steer tube or an expander bolt not sure if this is the correct term if it is carbon. ,bikewrench,d56pm94,5,t5_2sje0
8241806,0,t1_d57ol7c,Ah interesting. I was thinking of the newer ?isoflex? they are building into some of their hardtailsroad bikes but that kindof wraps around the seatpost and the stays go around it there. Havent seen this particular one.IF it looks like it can be taken apart go for it. But all too often these things arent made to be. I would be inclined to spray the heck out of it with a hose JUST that area mind you let it dry out real real good. Then drip some triflow into the seams. Wipe it all down good get any extra out of there.At that point to stop it from happening again Id personally be inclined to run a little bead of silicone around the seam. Wont damage anything and since theres so little movement around there it just might work to keep gunk out in the future.,bikewrench,d57s4zs,1,t5_2sje0
8250681,0,t1_d58sy3c,Pro tip  old hard drives are a good source of brutally strong magnets,bikewrench,d58w3m1,1,t5_2sje0
8255299,0,t3_4shkq7,Just a headsup the TMs often read a bit high mine does and Ive seen this mentioned quite a few times by other people. If you get the chance check it against a calibrated spoke tension meter at your LBS for peace of mind or leave a bit of margin with your spoke tension. I seem to remember that Park Tools recommends not recalibrating the meters but its useful to know if its off and by roughly how much.,bikewrench,d59gw4i,2,t5_2sje0
8268674,0,t1_d5b51gc,deleted,bikewrench,d5b54wl,1,t5_2sje0
8294091,0,t3_4sujzp,Each brand has their own mounting system. The only ones which are compatible are Planet Bike and Portland Design Works as they use the same mount design and their products are manufactured by the same facility. ,bikewrench,d5ebjs4,1,t5_2sje0
8325832,0,t3_4tlek2,P.S. for tightness you want just enough so that the bearings are seated firmly but not so much that youre applying a shearing stress and grinding the bearings down. It doesnt need a lot of force its under minimal load. Make it slightly snug and then use either threadlock or a jam nut if thats included to secure it in place.,bikewrench,d5ia8co,3,t5_2sje0
8378644,0,t3_4udtil,Looks totally dead. The bearing cups are both cracked or pitted. The freehub body and cones could be replaced but there isnt a good way to replace the nondrive side cup which appears to be wasted in your pcs.,bikewrench,d5ovo1l,1,t5_2sje0
8399446,0,t1_d5rh0qc,If I fill the back wheel with air and ride it once and then get ready to ride my bike a week later the wheel will be only half full.,bikewrench,d5rh6yq,1,t5_2sje0
8468532,0,t1_d602y5l,Its a bike designed for Alfine  so the chainline is perfect.,bikewrench,d603t3n,1,t5_2sje0
8481431,0,t1_d61i2du,gt is there a certain trick to it?Ive heard that heat from a hea helps with loctite blue.  But not sure about red.  Also dont melt your jockey wheels.  In the end though it should come off by hand.  Try a longer wrench.,bikewrench,d61q16u,2,t5_2sje0
8483011,0,t1_d61uvj0,But the crankset on eBay says bb?,bikewrench,d61x6ei,1,t5_2sje0
8489880,0,t3_4vzpf5,HelloYour picture is not very clear but you seem to have a standard nonthreaded headset You can follow this guide to clearly identify it.If that is the case yes the top cap is interchangeable just make sure you buy the right diameter there are two main sizes.This guide may help you the Park Tool website in general is a great help.One final note when you buy the the cap they sometimes come with a bolt and a nut The nut is important only if youre installing a headset in your suspensions for the first time. If you look down the top tube of your suspension youll likely see something like this which means you dont need the new nutGood luck and let me know if you need any more help. ,bikewrench,d62s6os,3,t5_2sje0
8527574,0,t1_d67el1g,I can definitely see how it looks like the   stem is a snug fit from my picture. Its definitely too big in reality.,bikewrench,d67idnu,2,t5_2sje0
8529110,0,t3_4wkjav,Yes sounds like a routing issue. You can also choose to use fulllength housing as we do in cyclocross if youre riding in harsh conditions.,bikewrench,d67papv,6,t5_2sje0
8541602,0,t1_d697clv,Thanks thats ecouraging!,bikewrench,d699p6x,1,t5_2sje0
8550292,0,t3_4wvvit,Get a fresh pair of RSs? Cheap as chips and durable. Heavy but depending on how much you ride spending more might just be a waste of money.,bikewrench,d6acxby,3,t5_2sje0
8569126,0,t3_4x5fge,deleted,bikewrench,d6cpzlk,1,t5_2sje0
8571596,0,t1_d6cr1l4,Unfortunately not. Its needlessly and overly complicated.  Here is more information and some tables,bikewrench,d6d14xg,1,t5_2sje0
8584446,0,t3_4xcw89,Those threads have heat activated loctite on them.  If your shop cant fix it they can send directly to specialized for service.,bikewrench,d6en54m,1,t5_2sje0
8600607,0,t1_d6glf1n,Thats correct the jig provides a reference. Ive sometimes been able to get an idea of whats going on by putting the fork in a flat surface and the rocking it slowly and observing how the fork sits when getting to the dropouts. Hard to explain in words but when you try it youll see. Just be aware that if you have a  fork youll have a rough time finding a jig. A frame builder might have one. A quick search indicates that Compass Cycles has a simple tool for checking alignment. It might be all you need.,bikewrench,d6go3jr,1,t5_2sje0
8621287,0,t1_d6iflen,spapoop is right...you need a shifter flush. This stuff works well.,bikewrench,d6j9fuz,1,t5_2sje0
8622278,0,t3_4xxh3g,I dont know what gave you that idea. I have a Roubaix with  thats routed internally.,bikewrench,d6jdww5,3,t5_2sje0
8622440,0,t1_d6j4mkq,Yes  sure about it,bikewrench,d6jen70,1,t5_2sje0
8626432,0,t1_d6jw6n2,Sure ,bikewrench,d6jwo8l,1,t5_2sje0
8654660,0,t3_4yfycl,deleted,bikewrench,d6ng3ta,1,t5_2sje0
8700089,0,t3_4z4yxi,Shimano says no max capacity is t on the front mech. Youd be better off going  or  depending on your low range needs.,bikewrench,d6t55ub,2,t5_2sje0
8702433,0,t1_d6tfiqi,Okay that sounds good. I was thinking of having it sanded and powder coated but it looks like its not cheap,bikewrench,d6tfquq,1,t5_2sje0
8733915,0,t1_d6xdrbj,,bikewrench,d6xdw94,7,t5_2sje0
8737784,0,t1_d6xqiwi,Does the shifting start to feel tighter at the lever toward the top of the cassette?,bikewrench,d6xveps,1,t5_2sje0
8758461,0,t1_d70djll,well my front derailleur shifts very smoothly. My current cassette is showing signs of wear atm.,bikewrench,d70gtno,1,t5_2sje0
8763505,0,t3_500f6m,If your wheel comes out of true due to an impact simply retruing it will always result in poor tension balance.  This is because truing the wheelBy turning spoke nipples is not correcting the condition that caused the wheel to come out of true.The impact didnt suddenly loosentighten a bunch of spokes by turning nipples.  It forcibly bent the rim meaning the relatively even spoke tension you had before now doesnt hold the rim in center because there are new forces involved.  You can see this in the truing stand find a spot where the rim is to one side and note the spokes. Say the rim is now veering to the Non drive side of the wheels centerline. Normally to true a wheel from that condition youd loosen a non drive side spoke and tighten a drive side spoke. But instead your impactbent rim now already had that non drive spoke pretty loose and the drive side spoke higher than normal. Adjusting spoke tension will only make it more extreme.As uncomfortable as it might seem correcting this means hitting it the other direction. Make sure you have a tire installed and pumped up fund the spot on the rim where it seems most it of true hold the wheel sideways at an angle to the floor with that spot lined up but reversed and slap it firmly.  A lot of times Ive done this and it makes the wheel almost perfectly true again but if you get it so it only has a tiny wobble you can then fine tune via spokes. ,bikewrench,d713le7,2,t5_2sje0
8774793,0,t1_d72ib0b,As far as I am aware the shoulder nut on campy chainrings is significantly shorter than those on a conventional chainring. Other than that the thread pitch and diameter are identicle. The difference as far as I can tell  is that the hole of the actual crank is a slightly smaller diameter than the chainring. This picture demonstrates this   where the ridge in the middle is the crank with its smaller diameter.This ridge is the what the shoulder nut is meant to be fkush with as well as the exterior of the chainring.,bikewrench,d72il8x,1,t5_2sje0
8815849,0,t1_d77j45q,gt ground down pointed spokewhats that for?,bikewrench,d77jmwk,2,t5_2sje0
8892012,0,t3_521l6s,A small gear puller will work. Heres a video,bikewrench,d7gozei,5,t5_2sje0
8894521,0,t3_521l6s,Various pullers are mentioned and can work.Ive seen cranks cut with a dremel or similar. Assuming the crank is aluminum go for it and not the BB spindle.  Otherwise a hacksaw on the spindle.,bikewrench,d7gztcf,2,t5_2sje0
8940509,0,t1_d7m3j84,They also protect from chains entering the spokes due to a bent derailleur hanger.Dork discs are not needed ONLY if the low limit is set correctly AND the derailleur alignment is validated before every ride.  Even a poor leans worth of bend can be the downfall.,bikewrench,d7mimre,2,t5_2sje0
8969103,0,t1_d7pv91h,Agreed. I had a set of brifters that looked like that due to crappy clearcoat. ,bikewrench,d7py7ze,1,t5_2sje0
8977411,0,t1_d7qwq58, This is your best bet no reason to hold onto the old bb. A new cartridge is cheap will work better and will be easier to mate with a newer spindlecrankset.,bikewrench,d7qy5m2,3,t5_2sje0
8982427,0,t1_d7qpr04,Awesome this is what I was hoping for. I was going to make sure I have some decent tires beneath me and obviously setting it up to be a little more aggressive. Thanks for the response! ,bikewrench,d7rjtbd,1,t5_2sje0
8995273,0,t1_d7t2vn1,god you gave me a heart attack when i read that first line,bikewrench,d7t3c81,1,t5_2sje0
9018500,0,t1_d7vvkgw,FD initiates shift chain moves to the top of the small chain ring.  Before the shift can complete chain is sucked between small ring and chain stay.Limits are correct on the FD.  In the low trim position theres no chain rub and no way to push the chain off the low ring.Really wonder about the low chain tension with that long cage on there.,bikewrench,d7vvsdi,1,t5_2sje0
9020583,0,t1_d7w3piw,I dont knowthink so.I did ride some trails that were beyond the brakes limit the other day I am wondering if that ride kinda killed em... ,bikewrench,d7w4sgl,1,t5_2sje0
9027349,0,t1_d7wsc2d,right... but you said a  tire is smaller than a  tire.  And they arent.A rim for a  tire is smaller than a rim for a  tire however and thats a distinction with a difference.,bikewrench,d7wy1sn,4,t5_2sje0
9044015,0,t1_d7yukr7,If anyone does attempt to try this  be vary careful that the torque arm length is exactly the same.   Judging based on a  torque wrench and using the same force with a  cone wrench is not going to produce the same torque.  ,bikewrench,d7yy27e,4,t5_2sje0
9061048,0,t1_d7xxtp3,So this would work for example?,bikewrench,d80zqb0,1,t5_2sje0
9098963,0,t3_54wq07,What is your current knowledge level?  ,bikewrench,d85jr37,3,t5_2sje0
9101778,0,t3_54wq07,When building a bike I always buy the best frame I can afford.  Then the most expensive groupset I can afford.   And as each part wears out I make a choice whether to replace it or upgrade it. ,bikewrench,d85vz0i,1,t5_2sje0
9117402,0,t1_d86zrsg,I second this. This one surprised me with how solid it is. I like it much more than my father in laws stand that cost three times as much. ,bikewrench,d87rios,2,t5_2sje0
9126837,0,t3_55a3k3,Im running Shimano rotors with my SRAM hydro. No help with a comparison to SRAM rotors but they have functioned just fine. I had two mechanic friends suggest Shimano over SRAM rotors. ,bikewrench,d88wb1i,3,t5_2sje0
9132027,0,t1_d8902kf,Dang. Id drill out the frame threads but theres no point if theyre not on mm centers. Stuck with an ugly steel bracket that puts IS mounts above the seatstay I guess. ,bikewrench,d89jtbo,2,t5_2sje0
9143460,0,t1_d88lhqt,Wow.  I was afraid to tighten it that much.Went down and tried it out.  Had to tighten the two claw mount bolts as well.  Works better now.  Well see how it goes thx.,bikewrench,d8azz3z,1,t5_2sje0
9207747,0,t1_d8j0rfp,A rubber mallet?  You trying to hit yourself in the face?  A deadblow hammer or leather mallet or metal hammer against a wood board even using a rock from the playground is superior to using a rubber mallet as a metal striking tool!,bikewrench,d8j5ffa,-6,t5_2sje0
9254591,0,t3_573sah,The first part is the wheel sizeThe second is the tire width,bikewrench,d8p33w5,2,t5_2sje0
9279236,0,t1_d8s54p0,Great summary. I will be adding fenders soon for winter bike riding  are you sure they cant be used with the clamp  tray style? The buses around here all have bike racks like that so it would suck to not be able to bring a bike on the bus just because of fenders.,bikewrench,d8s7kjj,1,t5_2sje0
9315664,0,t3_58108n,deleted,bikewrench,d8wtuv1,2,t5_2sje0
9318783,0,t1_d8ww2mb,Well you ride fixed so a deteriorating spoke is the least of your worries...,bikewrench,d8x82dg,2,t5_2sje0
9415385,0,t3_59l6nh,I could be wrong but Im pretty sure that all Cane Creek headsets that arent specifically for Campagnolo Hiddenset are x. Again I could be wrong but I dont think anyone makes x external cup headsets. EDIT Ritchey does at least.You can scroll down to the bottom of this document ,bikewrench,d99grvp,2,t5_2sje0
9425963,0,t1_d9aodnp,Im  now but up until February I was  for a long time.,bikewrench,d9at0nk,1,t5_2sje0
9485706,0,t1_d9i9y3f,Thank you! So obvious when I know what Im looking for! Appreciate that.,bikewrench,d9ibesi,3,t5_2sje0
9488126,0,t1_d9ilv3l,I dont care about your expectations sorry if thats hard to hear.  I care about the presenting problem and how to fix it.  Problem  chain rubs not might rub or could rub.  Solution ?,bikewrench,d9im4sc,1,t5_2sje0
