,controversiality,parent_id,body,subreddit,id,score,subreddit_id
930033,0,t1_ch9ir8u,Mindy Main?,throatpies,ch9zzdf,2,t5_2w7mh
1205790,0,t3_27vcz7,Doin Gods work,throatpies,ci59psp,-2,t5_2w7mh
2063336,0,t1_cl1y8vw,Aha veeery sneeaky stuuff,throatpies,cl23fsk,1,t5_2w7mh
2367274,0,t3_2k7aqa,awesome thanks,throatpies,cm4aydf,1,t5_2w7mh
2417948,0,t3_2myn9b,Backed out a little premature for my tastes. ,throatpies,cmakf78,1,t5_2w7mh
3040046,0,t1_cocx61q,I meant more the roughness not bdsm but some slapping,throatpies,cod3kzh,1,t5_2w7mh
3139640,0,t3_2w2bkp,His twerk game needs work.,throatpies,conf5cz,10,t5_2w7mh
3733453,0,t3_334sij,With special appearance by Donald Duck,throatpies,cqhu680,16,t5_2w7mh
3799227,0,t3_33wbmf,Would have been nice if she was enjoying it. ,throatpies,cqpcb5f,4,t5_2w7mh
3930420,0,t1_cr3mn5t,still working for me...,throatpies,cr4axzd,1,t5_2w7mh
3993582,0,t3_36610l,Stop polluting this sub with shit,throatpies,crbi2mm,1,t5_2w7mh
4445396,0,t3_3bx76s,Source,throatpies,csr10xy,10,t5_2w7mh
4448792,0,t3_367p1w,She is shes soo fucking hotmy dick got hard watching the end of this,throatpies,csrgf64,1,t5_2w7mh
4479789,0,t1_csuucxk,links are down because I took them down. we post official video releases on our pornhub channel  its not personal it is business . This is how we pay servers bills ourselves etc. We dont remove everything posted we often let things stay up for awhile. We are not anti piracy or anything but we do like our vids to be posted in one area we run so we can make sure the vids are watermarked still and not cropped among other reasons.,throatpies,csvcfr5,1,t5_2w7mh
5088091,0,t3_35645j,The video is now asking for a password,throatpies,cuzb2u9,1,t5_2w7mh
5184975,0,t1_cvayf7h,rnotbadpornacting,throatpies,cvazae5,7,t5_2w7mh
6026041,1,t1_cy9hr4o,deleted,throatpies,cy9ja9b,-3,t5_2w7mh
6049148,0,t1_cyboq46,whats the girls name OP?,throatpies,cycjpky,1,t5_2w7mh
6630076,0,t3_46h3mg,We need that sauce,throatpies,d053uwx,8,t5_2w7mh
6670489,0,t3_470n9g,Yeah dont think so...,throatpies,d09ab2a,2,t5_2w7mh
6937518,0,t3_4aozkw,sawce?,throatpies,d12p1ky,2,t5_2w7mh
6938546,0,t3_4anb0s,This is probably the best blowjob that  year old had ever had.,throatpies,d12t9dc,30,t5_2w7mh
7950857,0,t3_4mw8xo,Whos the girl at the minsec mark,throatpies,d49r2o5,1,t5_2w7mh
8604388,0,t1_d6g7sxm,Ive done it before but only while throatfucking. You gotta just keep going.,throatpies,d6h55iz,1,t5_2w7mh
8786788,0,t3_50hhh1,Please use one of the approved sites or click here to suggest this site be added to the whitelist.I am a bot and this action was performed automatically. Please contact the moderators of this subredditmessagecompose?torthroatpies if you have any questions or concerns.,throatpies,d740slm,1,t5_2w7mh
8862814,0,t3_51mosm,Sauce?,throatpies,d7d6ovj,2,t5_2w7mh
9277906,0,t3_57fzi3,Anyone have any ideas on why pornhub stopped working on my iPhone?,throatpies,d8s1i35,9,t5_2w7mh
9479466,0,t1_d9hjhhl,Updated my comment,throatpies,d9hjqzr,3,t5_2w7mh
9488074,0,t3_5ao89z,Gonna have to check this out later,throatpies,d9ilwgt,1,t5_2w7mh
9521000,0,t3_5b3to7,I didnt realize I needed this until now. Dat angle.,throatpies,d9mnyrb,1,t5_2w7mh
9530713,0,t3_5bcswx,THIS is a throat pie,throatpies,d9nv03b,7,t5_2w7mh
9794908,0,t3_5fihba,sauce,throatpies,dakfn44,12,t5_2w7mh
9830464,0,t1_daoxiey,This spank worthy post has been saved to your SpankSafe.com account! OP would be proud.Parent commenter can delete this message to hide from others.How To | Devs | Your SpankSafe,throatpies,daoxivm,1,t5_2w7mh
9924188,0,t3_5hjuth,Throats a loadDefinitely my new favourite combination of words.,throatpies,db15ade,10,t5_2w7mh
9998573,0,t3_5ho79q,Who is the girl  min? Source?,throatpies,dbaucbm,2,t5_2w7mh
11117177,0,t3_5w8fvc,anybody know what happened to nasty  ?,throatpies,des4fp5,1,t5_2w7mh
11127456,0,t3_5yvg8y,No link,throatpies,detad7r,2,t5_2w7mh
11152244,0,t1_devzsjx,Oral creampie,throatpies,dew3fbx,2,t5_2w7mh
11356536,0,t3_61lyb1,Guys are we cool with this?  Seriously?  If folk want to do consensual stuff and video it then Im cool with that. It might not be something I agree with but if everyone agrees to it and theyre happy having it videoed then who am I to argue?But if its videoed and uploaded without someones consent is that acceptable?,throatpies,dfj8qml,2,t5_2w7mh
11725375,0,t3_67b52f,why is there never sauce,throatpies,dgp3o7m,10,t5_2w7mh
