,controversiality,parent_id,body,subreddit,id,score,subreddit_id
9390286,0,t3_5971u9,So she must also give birth through her pee hole too? ,badwomensanatomy,d96aaau,8,t5_2zlzd
9418886,0,t1_d99vgm3,Maybe thats how you can tell if theyre going to grow up to be a bear? ,badwomensanatomy,d99wqfn,24,t5_2zlzd
9425744,0,t1_d9a54dz,I dunno  no matter how I tilt my pelvis mine never looks as small as the lady on the left. ,badwomensanatomy,d9as0ml,3,t5_2zlzd
9431049,0,t3_59tx6d,Yes because men deserve orgasms all the time but women only deserve them when they are humbleselfless women who put their man before themselves.  Because what really matters is that the man is always satisfied.,badwomensanatomy,d9bg7ls,197,t5_2zlzd
9434360,0,t1_d9bjuti,Oh my god I havent thought about Gor in ages. And I hope its ages before I think about it again.,badwomensanatomy,d9bvcvz,14,t5_2zlzd
9434717,0,t1_d9bwb77,Theres a manga similar to that its about a guy and hes cursed with tattoo on his butt that makes anyone who sees it fall in love with him. Its called Kono S o Mi yo! Its pretty good. ,badwomensanatomy,d9bwzm8,7,t5_2zlzd
9435619,0,t1_d9c0dvf,Oh right. If thats what the guy wants. ,badwomensanatomy,d9c13ym,6,t5_2zlzd
9443119,0,t1_d9cuc5p,it still doesnt explain why menstruation is such an alien concept for the other half of the population,badwomensanatomy,d9czdka,6,t5_2zlzd
9472056,0,t1_d9gk5la,deleted,badwomensanatomy,d9gmwc6,16,t5_2zlzd
9474796,0,t1_d9gnss3,I only wore sports bras till about . They gave me cleavage acne. I also had normal face acne and a boys haircut. But yes I was obviously so much hotter then. ,badwomensanatomy,d9gz1hj,37,t5_2zlzd
9484169,0,t3_5amnb4,deleted,badwomensanatomy,d9i4lw3,19,t5_2zlzd
9490426,0,t1_d9iu1s1,They didnt make it up lol but they did work to make it popular. But fake popular.LinkTIL,badwomensanatomy,d9iwc2m,25,t5_2zlzd
9503019,0,t1_d9jpesf,I think they might have meant it in a they had to have sex in order to keep the human race alive not for fun kind of way. As in no hot caveman orgies. Just babies.,badwomensanatomy,d9kg76s,8,t5_2zlzd
9510965,0,t1_d9kpv38,Probably but if you tried to explain the difference between menstruation and estrus theyd just make up more bullshit and ignore you.,badwomensanatomy,d9lffl3,2,t5_2zlzd
9512575,0,t1_d9li43s,Dogs do not. They go through heat  they dont actually menstruate. But sometimes their estrual discharge is bloody so its a common misconception.,badwomensanatomy,d9lmlbb,10,t5_2zlzd
9522377,0,t1_d9mlklc,Really good point.,badwomensanatomy,d9mu2gk,1,t5_2zlzd
9538184,0,t1_d9o5ema,I was a kissless dateless virgin at  too. Then at . I had my first kiss and shortly there after my first sexual encounter. Im also a woman so shrug,badwomensanatomy,d9os2ys,19,t5_2zlzd
9600339,0,t1_d9t6ufg,I do get very nauseous at the beginning so maybe?,badwomensanatomy,d9wfs1h,1,t5_2zlzd
9626936,0,t3_5cvprb,Snapshots. This Post   Error error autoarchiving click to submit it!I am a bot. InforSnapshillBot  Contactmessagecompose?torSnapshillBot,badwomensanatomy,d9zpust,2,t5_2zlzd
9639757,0,t1_da0mi3f,Gotta wonder if he believes the message he sells or whether he just does it for the money. He says so much horrible shit I dont know how he sleeps at night. ,badwomensanatomy,da1ar6b,5,t5_2zlzd
9702927,0,t1_da224xg,I want to be in a band called Final Labia.,badwomensanatomy,da93dqk,2,t5_2zlzd
9708034,0,t3_5e3tie,. Im fairly confident this guy has never spoken to a girl in his life if he thinks they dont have sexual desire.  But thats a given if youre posting on an incel subreddit.. If  of all humans are defective can it really be called a defect at this point?. I really hope most of these guys are like  because these attitudes would be really dangerous in an adult.,badwomensanatomy,da9q266,60,t5_2zlzd
9709428,0,t1_da8vh2c,I started my period at  so I got real familiar with the whole thing early on. ,badwomensanatomy,da9w97h,2,t5_2zlzd
9728942,0,t1_daa8j8w,Bad and dangerous. If there was no std no social stigma and my partners werent basically guaranteed to be stronger than me Id take the risk for bad sex. ,badwomensanatomy,dacazjt,4,t5_2zlzd
9733474,0,t1_dacr327,My philosophy has always been Mankind is capable of great and terrible things often both at once.,badwomensanatomy,dacv2tz,9,t5_2zlzd
9734725,0,t1_dacbdrd,According to Freakonomics the drop in crime rates in the late s throughout America was because people were starting to get abortions. People who dont want their babies or who are not in a position to raise them due to financial stress mental illness lack of social support etc. usually dont provide great homes and are more likely to raise children who will become criminals. ,badwomensanatomy,dad0mi6,19,t5_2zlzd
9735265,0,t1_dacdpn7,Her?,badwomensanatomy,dad30w8,3,t5_2zlzd
9811450,0,t1_damfx4i,My mom always taught me to tuck my labia into my belt.,badwomensanatomy,damgz5x,93,t5_2zlzd
9812455,0,t1_damh8q6,Oh THAT is what they keep fondling in existenz.,badwomensanatomy,damlfjz,5,t5_2zlzd
9832225,0,t3_5fvvx0,removed,badwomensanatomy,dap5scs,1,t5_2zlzd
9834394,0,t1_dap7c9b,Does this get autoposted to every link? Or is it just that every link brings on brigading? ,badwomensanatomy,dapfzky,6,t5_2zlzd
9857533,0,t1_dase1hr,agreed. Ouch. you can purchase cups without stems. Usually they are disposable ones. you should check amazon. They have like so much stuff. ,badwomensanatomy,dasgk4u,65,t5_2zlzd
9862788,0,t1_dat0e0f,HAHAHA OMG this is terrible!,badwomensanatomy,dat573h,3,t5_2zlzd
9879891,0,t3_5gvihh,Wheres the bad womens anatomy here? I agree this is creepy as all hell but the statements about age of menstruation are about accurate no?Edit I misread it but Im leaving the comment here for context.,badwomensanatomy,davdfs3,-79,t5_2zlzd
9881246,0,t3_5gvihh,................,badwomensanatomy,davjsui,69,t5_2zlzd
9885177,0,t1_davukt6,Ive been packing up my moms house and it was so startling to find photos of when I first started being hit on by men old enough to be my dad if theyd had their kids in their early s and beyond. I was so obviously a child. Sure a very tall child but I was clearly around your daughters age maybe add a year or two since I was always a giant among my peers.,badwomensanatomy,daw28tw,27,t5_2zlzd
9890029,0,t1_davqtfj,Well with the way vanity sizing is going you might be able to just wait it out... Make no actual changes and tada! Size .I hate womens clothes.,badwomensanatomy,dawozeo,24,t5_2zlzd
9892045,0,t1_dawvkuw,I guess  but thats the majority of this sub. I dont think its really stolen.,badwomensanatomy,dawygb3,-5,t5_2zlzd
9897432,0,t1_d9a6zbc,I dont envy the position youre in.,badwomensanatomy,daxnqer,2,t5_2zlzd
9901758,0,t1_dawe8ln,Make sure you purchase the air bags filled with glitter. So if you have a blow out youll know IMMEDIATELY something is wrong.,badwomensanatomy,day8051,5,t5_2zlzd
9903282,0,t1_day4cg2,What is most important is whatever hes into Richard Dawkins tendies samurai swords misogyny Mountain Dew Baja Blast the activism of chan WW hatred of welladjusted men Libertarianism etc.What is trifling is whatever shes into popular stuff Beyonc staying away from gross misogynists candles equal rights Oreos politics consensual sex with fun and attractive people etc.,badwomensanatomy,dayf5pc,30,t5_2zlzd
9906617,0,t1_dayum2b,I was talking more the payload delivery mechanism.,badwomensanatomy,dayut5j,64,t5_2zlzd
9907839,0,t1_dayyo6i,Yes yes yes!! This is just too adorable! Yall dont happen to be located in austin Texas do you?,badwomensanatomy,daz0jrd,6,t5_2zlzd
9908894,0,t1_daz3kxc,I agree I suffer from mental health problems and I find it deeply unpleasant that people write people like tru and incels off as mentally ill. No the vast majority are not mentally ill some may well have had bad experiences blown those out of all proportion and defined themselves by them but that does not equate to mental illness. Many of them are also just horrible people. ,badwomensanatomy,daz5hul,37,t5_2zlzd
9909547,0,t3_5hbokg,Kind of like SRSs low hanging fruit thread? Id be down for that as long as it was stickied so it was easily findable.,badwomensanatomy,daz8jym,30,t5_2zlzd
9916647,0,t1_db03f0s,Thanks for the final laugh!,badwomensanatomy,db05w6a,2,t5_2zlzd
9924102,0,t1_db0hvp0,gt Fact Butterflies drink human blood.gt Acktualley...,badwomensanatomy,db14vve,4,t5_2zlzd
9938979,0,t1_db27mkq,Just fleshlights out to steal yout ohsodesirable sperm.,badwomensanatomy,db32oi3,8,t5_2zlzd
9946285,0,t1_db4094d,Yeah I was a  person and best time I ever had was with another  person.Couple times a day if we felt like it. It was just kinda something wed do in transition with other things was really fun.,badwomensanatomy,db40y73,6,t5_2zlzd
9971851,0,t1_db7cpem,So then it doesnt matter what size dildo they use,badwomensanatomy,db7cxu9,29,t5_2zlzd
10033683,0,t3_5je6lj,Its always really sad to hear what straight people think sex between women is like because the abysmal quality of sex the average straight woman is having becomes immediately obvious. ,badwomensanatomy,dbfeywk,267,t5_2zlzd
10039843,0,t1_da89sli,Some porn says asspussyboypussy and mouthpussy. I dont see the point. Its a mouth call it a mouth. ,badwomensanatomy,dbg7um4,1,t5_2zlzd
10054389,0,t1_dbhkuse,Mhhhm ribs. Thanks for making me hungry.,badwomensanatomy,dbi40u7,8,t5_2zlzd
10057126,0,t1_dbi2zwl,A married incel? ,badwomensanatomy,dbiguwh,10,t5_2zlzd
10057592,0,t3_5jn6vp,Love how they use normie as an insult over there.  Youre getting LAID normie you could never understand me!  K..,badwomensanatomy,dbij1if,13,t5_2zlzd
10066846,0,t1_dbjn3yh,Oh youd have to ask a man for the answer to that question because they are the most logical gender. Making ignoring women part of your identity then spending all your time discussing them contains special logic that womanly minds cannot comprehend  ,badwomensanatomy,dbjqehc,38,t5_2zlzd
10071254,0,t1_dbjxg0e,Obviously I havent studied this  its completely new to me  but I cant believe that cultures where its commonplace for young girls to get pregnant have the very best pregnancy advice and medical treatment on hand for those girls. ,badwomensanatomy,dbkb24z,-3,t5_2zlzd
10073791,0,t1_dbjyiof,THOSE ARE FAKE FEMINIST LIES!!!! Check out my website and statsImacreepypedophileandmisogynitandthissupportsmyideathatapenismakesmesmarterthanyou.creep,badwomensanatomy,dbkmy0y,11,t5_2zlzd
10093526,0,t1_dbmhfmd,Im assuming they heard someone say that the clitoris is like a tiny penis and took it too literally.,badwomensanatomy,dbn7af3,13,t5_2zlzd
10134754,0,t1_dbsk2ml,Thats exactly what Im saying...,badwomensanatomy,dbsk9xt,10,t5_2zlzd
10135589,0,t3_5l2lg0,I see this a lot in Region Where I Live still actually. Its not at all a thing how I personally grew up but I am surrounded by friends who were told this bullshit when they were growing up and I felt just really horrible for them. Very obviously excluded from sports and recreation for very obvious reasons  of their lives and it had a chilling isolating effect on them relating to girls outside their culture group who didnt understand why they did what they did. ,badwomensanatomy,dbso6jr,7,t5_2zlzd
10140176,0,t1_dbpjh8w,They showed Garrisons boobs once. Wasnt nice tho.,badwomensanatomy,dbt9pd2,2,t5_2zlzd
10157492,0,t1_dbv1jni,Perhaps they are confusing the cervix for the gspot... still horrible though.The idea that the clit would be serviced is over their heads though as it doesnt fit into the fantasy of their own parts being serviced with nominimal effort.,badwomensanatomy,dbvepd5,26,t5_2zlzd
10161049,0,t1_dbvqqdj,Aww thanks D,badwomensanatomy,dbvt7yf,2,t5_2zlzd
10161880,0,t1_dbvut6f,Hm. TIL.,badwomensanatomy,dbvwlvv,9,t5_2zlzd
10163395,1,t1_dbw2i0c,im not sure but it didnt hurt  one says alumbased. idk what that is. ive read testimonials saying it worked and it didnt. for me it did so idk,badwomensanatomy,dbw2s9k,-10,t5_2zlzd
10182667,0,t3_5lqw4z,|According to science...but dont ask us for sources! Were not that type of site!,badwomensanatomy,dby9fj6,9,t5_2zlzd
10206149,0,t3_5l7kl0,That guy is bonkers I wonder if hes just a troll. Just found out about rMGTOW and I wish I had never done it. ,badwomensanatomy,dc0xa1u,1,t5_2zlzd
10239518,1,t1_dc4ejul,If youre talking to your doctor or a lawyer or whatever be specific. You need to do that regardless of what body part your talking about. If you just having a conversation with someone getting upset or calling it wrong because they use conversational English is just being pedantic and halting the conversation. The point I was arguing is that insisting that getting up in arms because people are using informal language is no help at all.,badwomensanatomy,dc4pg5n,-1,t5_2zlzd
10243451,0,t1_dc4jc3g,Alright where can I get this tshirt?,badwomensanatomy,dc55hes,10,t5_2zlzd
10252841,0,t1_dc5c09s,Oh god if only it had stopped at the  week mark...,badwomensanatomy,dc67s2i,19,t5_2zlzd
10270293,0,t3_5n2kn9,Snapshots. This Post  archive.org megalodon.jp archive.is could not autoarchive click to resubmit it!I am a bot. InforSnapshillBot  Contactmessagecompose?torSnapshillBot,badwomensanatomy,dc86zsn,1,t5_2zlzd
10286017,0,t1_dc9o2df,Carrie Nation was at the forefront of American feminism. She was a terrorist who went from bar to bar with a hatchet and fucking their shit up.,badwomensanatomy,dc9z60c,53,t5_2zlzd
10288544,1,t1_dc9t7h1,Isnt like being oversensitive its very point?,badwomensanatomy,dca9gf9,-1,t5_2zlzd
10292288,0,t3_5na6b0,removed,badwomensanatomy,dcaoq8k,1,t5_2zlzd
10306407,0,t1_dcbf0ff,Learn something new everyday!,badwomensanatomy,dccabqh,1,t5_2zlzd
10306849,0,t1_dccbnfx,One person you asked how to change it. Others responded accordingly. Are you attempting to police opinion or...? Youre really not making any sense. You said we shouldnt worry unless people are hurt or killed and referenced a link in which people were hurt and killed. Then you said we shouldnt attempt to change it but the only parent comment suggesting we should change it in the link you provided was yours. Of course its going to invoke upset feelings when people are hurt and dying. I just dont see the point of this point besides you basically baiting people into giving their honest opinion and then calling them out as if they arent allowed to be upset about it. ,badwomensanatomy,dccc4r9,1,t5_2zlzd
10309327,0,t1_dccfd65,Can I join? Im not real because I dont like shopping for clothes plus all the previously stated reasons and the fact I dont shave my legs. I can feel my beard growing in as I type. ,badwomensanatomy,dccm9en,49,t5_2zlzd
10310429,0,t1_dcco3r8,Mmmmmm... gender rolls are awesome warmed up under the grill with a little butter. Marmalade on top is just gilding the lily imho.,badwomensanatomy,dccqrgu,13,t5_2zlzd
10318169,0,t1_dcdkb42,I actually have no current pictures of it but heres some of the big pieces i have a bunch of other random tattoos I have no pictures of either. I love all of yours! The marge simpson one is fantastic. ,badwomensanatomy,dcdmcfh,3,t5_2zlzd
10321739,0,t1_dce0p46,true my bad lol,badwomensanatomy,dce0xyx,1,t5_2zlzd
10321870,0,t1_dcdwju5,Rad. Congrats on your dick!,badwomensanatomy,dce1h86,24,t5_2zlzd
10322212,0,t1_dcdh0cc,deleted,badwomensanatomy,dce2vhe,1,t5_2zlzd
10323569,0,t1_dce7bdn,I LOVE multi coloured nail polish. The other day I saw a woman wearing this burgundy that shimmered like rubies and Dorothys wizard of oz shoes. And my mum got me this polish that turns from pearlescent to pink in the sun. If Im not drooling over that type of polish my favourite color is Essies Chinchilly for the name as much as the colour,badwomensanatomy,dce8evz,4,t5_2zlzd
10328283,0,t1_dcd82lm,Valid point!,badwomensanatomy,dcerokb,2,t5_2zlzd
10328811,0,t3_5nswns,Jesus Reddit is chock full of pussy sandwiches today.,badwomensanatomy,dcetu85,3,t5_2zlzd
10333543,0,t1_dcecqbb,Of their daughters.,badwomensanatomy,dcfd4yn,34,t5_2zlzd
10346192,0,t3_5o59ip,Thats ... sad.,badwomensanatomy,dcgstbd,40,t5_2zlzd
10349784,0,t1_dch51ev,gt Then it is her choice regarding her body Full stop. Her body her choice. That is the reality in the world.gtThe outcome of an abortion is the woman not being a parent.That is an outcome. The world is not fair here the world is not even and symmetrical. The law reflects the reality in the world.,badwomensanatomy,dch7hyf,4,t5_2zlzd
10350684,0,t1_dcgzbl5,We do the exact same thing. You are not alone. ,badwomensanatomy,dchb6bb,4,t5_2zlzd
10352642,0,t1_dchguyx,Ive read that for some women it is that easy and it ends up being really inconvenient. Their nerves down there are just too sensitive. Though I believe its mostly clitoral and vulvar stimulation that does it for them not necessarily penetration....yep heres the disorder. Though it sounds like it sucks ,badwomensanatomy,dchj6hq,29,t5_2zlzd
10353539,0,t1_dchh04j,Really though a much more practical solution would be to put some decayedbutstillrecognizable clothes on them. ,badwomensanatomy,dchmu8i,35,t5_2zlzd
10355759,0,t1_dcguprp,I just tuck the string in a little,badwomensanatomy,dchvw4j,1,t5_2zlzd
10358354,0,t1_dchys1k,That can add up in tampon costs. ,badwomensanatomy,dci6hqs,1,t5_2zlzd
10362216,0,t1_dcdnenm,Thats kinda shamey. ,badwomensanatomy,dcim9r7,2,t5_2zlzd
10362748,0,t1_dcinxgs,The problem came from the fact that her children were not genetically her offspring. They thought she was trying to commit fraud and get benefits for someone elses kids.A judge even ordered a witness to be present at the birth of her third child so there would be no denying whether it came from her body or not. But blood samples proved she wasnt genetically the mother of that child either. ,badwomensanatomy,dciog5x,6,t5_2zlzd
10363586,0,t3_5ocn9g,removed,badwomensanatomy,dcirvjy,10,t5_2zlzd
10369202,0,t1_dcj0u1u,Why are people like you so stuck in the past? Did you know most women have careers and contribute financially to the household now and alimony is pretty rare? Did you know most men who bother to seek custody get exactly what they ask for? Men who abandon their children in a divorce skew the statistics. Your oppression is imaginary.,badwomensanatomy,dcjet2n,8,t5_2zlzd
10369869,0,t1_dcjhe58,gt I do not know you specifically but you and your group are continually spouting about the failure of marriage So you have no actual point to make? Doesnt that mean youre just bitching for the sake of bitching then which is exactly what you accused me of doing?And that topic as stated in plain English during the start was created by pedophiles. Those comments have been largely deleted. If I were a mod I would have deleted the entire thread as soon as it was posted.And you are right there is no motivation for marriage. Its a scam. Thanks for your input.,badwomensanatomy,dcjhj0y,0,t5_2zlzd
10371971,0,t3_5of73i,Ive definitely had periods bad enough that I thought that I should just sit on the toilet all day because Id destroy hundreds of pads and undies otherwise.,badwomensanatomy,dcjq3zx,6,t5_2zlzd
10395765,0,t1_dclwxz4,I think an easier way to see the issue here is to look at the consequences. Wiping blood on someone whilst gross and arguably assault requires a five minute shower to fix. Punching someone repeatedly so that their nose and eye socket are bruised requires weeks of recovery and possibly surgery if anythings broken. Gender doesnt matter here. If you look at the consequences of the actions theyre completely out of proportion with each other.,badwomensanatomy,dcmfcyw,6,t5_2zlzd
10400528,0,t1_dcmd3r2,Men know this because the more they masturbate the looser they hand gets.  I can barely hold my fork anymore!,badwomensanatomy,dcmyt0r,40,t5_2zlzd
10406823,0,t1_dcl1ulk,Thats what the Telletubbies call a vacuum too. ,badwomensanatomy,dcnoj14,3,t5_2zlzd
10408511,0,t1_dcnt2aq,Yeah they werent great at the whole parenting thing,badwomensanatomy,dcnvf6g,2,t5_2zlzd
10409367,0,t1_dcmuvkz,Some guys think women get sexual joy from tampons like theyre little dildos lol. Same kind of guy thinks gay guys get their jollies from doing a BM,badwomensanatomy,dcnywty,7,t5_2zlzd
10416076,0,t3_5mie51,That was a fun read!,badwomensanatomy,dcoqas9,1,t5_2zlzd
10419108,0,t3_5p5r6y,gt I was so adamant about not having kids as a young man I tried to get my tubes tied at the tender age of .Uh I dont think it works like that.,badwomensanatomy,dcp2oor,69,t5_2zlzd
10425306,0,t1_dcpn193,Gonna be incredibly stupid looking here but...Its not worn outside the body?,badwomensanatomy,dcprzqi,8,t5_2zlzd
10425509,0,t1_dcplelk,His good little Asian girls dont ruin themselves by inserting anything into their vaginas besides senpais penis even menstrual products. Gag.,badwomensanatomy,dcpstiw,30,t5_2zlzd
10428569,0,t3_5pa8x7,I had no idea that vaginas were supposed to have discharge until...I dunno late teens? I might have been in college. But my mom died when I was young and my Dr at the time had a habit of making me feel stupid when I asked obvious questions. I was terrified something was wrong but also too shyembarrassed to say anything.Thankfully Im totally fine.,badwomensanatomy,dcq5b03,20,t5_2zlzd
10432052,0,t1_dcqgtiz,Telling another person what to do with their body is pretty shitty regardless of preferences.,badwomensanatomy,dcqjjh5,67,t5_2zlzd
10435463,0,t1_dcqu11i,Psychic cleansing for your lady parts. Didnt it say something about women using their uteriuses? as psychic trash bins?? Cause putting a rock in your vagina will for sure cure a uterus of its psychological dysfunction. Wtf Gwyneth?,badwomensanatomy,dcqxgyz,21,t5_2zlzd
10438573,0,t1_dcqy5jo,Sorry if this is dumb but is there any way you could just lie about being sexually active? I was pretty sure there was no way to really tell if a woman is a virgin or not by medical exam. ,badwomensanatomy,dcrabk0,7,t5_2zlzd
10440904,0,t1_dcrbwy8,From USA Today gt It is a nickname like my name is G.P. so that is really where it came from. And I wanted it to be a word that means nothing and could mean anything.,badwomensanatomy,dcrjyw4,5,t5_2zlzd
10441057,0,t1_dcrhznd,He comes from a place with little education in sexual matters but Im not saying that excuses him. Were going to have to sit down and have a conversation about it when Im not caught off guard. ,badwomensanatomy,dcrklnr,133,t5_2zlzd
10445156,0,t1_dcpwap9,To be perfectly honest after a brief stint working with OBGYNs I dont think anyone was particularly comfortable with it. We do the best we can to make it painfree with as little awkwardness as possible but its never really a fun thing. Dont let the discomfort stop you from getting medical care when you need it. The good news is pap smears and the like take all of  seconds. ,badwomensanatomy,dcs1k5p,2,t5_2zlzd
10472500,0,t3_5po9kl,Tbh we get actual doctors who say weird as heck shit so the fact that a medical student is saying this doesnt really surprise me. ,badwomensanatomy,dcv5z7u,2,t5_2zlzd
10482220,0,t1_dcbjrlx,Wait...  Period sex can cause pregnancy?!  IS NO CYCLE TIME SAFE FUCK,badwomensanatomy,dcw9nja,1,t5_2zlzd
10483808,0,t3_5q06x7,I got shamed for touching myself. ,badwomensanatomy,dcwg57s,1,t5_2zlzd
10484171,0,t1_dcvdmtz,I grew up in a small town in the Ottawa Valley and had a similar experience to uadminbeast going to a public school. Lots of information and places to go for free condoms and reduced cost birth control so you didnt have to go through your parents insurance.Edit context The being Canadian experience not dads reference to Queen.,badwomensanatomy,dcwhmp0,1,t5_2zlzd
10486391,0,t1_dcva1hl,When I was like  I was convinced naked human sushi table was a viable common career. Thank you my aunts Marie Claire!,badwomensanatomy,dcwqpkl,3,t5_2zlzd
10500924,0,t3_5qdaq1,But ... nobody aborts an entirely separate person. An egg is not a chicken a nut is not a tree.,badwomensanatomy,dcye2r3,164,t5_2zlzd
10508650,0,t1_dcymcj6,Dont forget forced and unintentional orgasms are a thing. Your body and what it does doesnt know youre being RAPED your body does what its supposed to fucking do. So yes sometimes you get wet and sometimes you orgasm but that doesnt mean that you arent being raped. When you say no and they dont stop ITS RAPEunless you doing role play or someshit or have a safeword IT DOESNT MATTER IF YOURE MORE WET THAN THE OCEAN. ITS RAPE AND YOU BODY DOESNT SHUT DOWN,badwomensanatomy,dcz9m3e,5,t5_2zlzd
10513702,0,t1_dczo7c9,In my Utopia Distopia the rich arent stupid enough to pay for it when the government encourages the poor castes to breed excessively so they can be worked in slave conditions for the betterment of the weathly and used the same as any other medical instrument when necessary. Damn it. Now you guys have me building on it. I still have another book Im working on. Damn it!,badwomensanatomy,dczu9il,3,t5_2zlzd
10518331,0,t1_dd08s21,She tried I guess? Bless her heart. ,badwomensanatomy,dd0d7c3,1,t5_2zlzd
10528593,0,t3_5qqm6p,deleted,badwomensanatomy,dd1j43l,5,t5_2zlzd
10530521,0,t3_5qqm6p,Is this the price we pay for being so good at hiding our periods? ,badwomensanatomy,dd1qzxv,12,t5_2zlzd
10542881,1,t3_5qvba1,There really should be a rule in this sub of not linking to incels. Like its pretty much just cheating.,badwomensanatomy,dd35iwu,1,t5_2zlzd
10552549,0,t1_dd3fl99,deleted,badwomensanatomy,dd490kz,1,t5_2zlzd
10568150,0,t1_dd5pkcm,Birth rates are still rising but its on a sloping incline.  They should begin a reversal sometime this century.,badwomensanatomy,dd60pek,1,t5_2zlzd
10569271,0,t1_dd3y3gg,Like the rest of Reddit people here love the downvote button for absolutely anything they dont like.,badwomensanatomy,dd64xyp,-1,t5_2zlzd
10573229,0,t3_5rcssj,The amount of people who have no idea that vibrators and dildos arent the same thing... My god.,badwomensanatomy,dd6jnt6,117,t5_2zlzd
