,controversiality,parent_id,body,subreddit,id,score,subreddit_id
1922359,0,t3_2gmadg,You mean like one person pays for the netflix acc and the other for crunchyroll but both parties can use both services?,Crunchyroll,ckktwtg,2,t5_2sgc7
2657936,0,t3_2qf3at,Sorry didnt mean to put  in title,Crunchyroll,cn5is58,1,t5_2sgc7
2691286,0,t3_2qtetd,What anime is from the link?,Crunchyroll,cn9vcqa,1,t5_2sgc7
2861000,0,t3_2sv7xf,I use an extra wireless mouse for that issue and just leave it by the bed. As far as changing any setting no idea. ,Crunchyroll,cntapjf,1,t5_2sgc7
3736589,0,t3_334wrt,You can find a list of all upcoming episodes and their times here  Youll notice that they are only listed  days out atm. They tend to add the placeholders at about that time. Unless there are some kind of unforeseen delays it would be fair to expect it to air the same time each week.,Crunchyroll,cqi7244,2,t5_2sgc7
5046245,0,t3_3k0avh,deleted,Crunchyroll,cuu9icy,1,t5_2sgc7
5474140,0,t3_3q20jy,  just cancel it where is the problem ?,Crunchyroll,cwbdff2,2,t5_2sgc7
6377150,0,t3_42jz3p,How do people get guest passes? I see a lot of users here have tons of guest passes and was just wondering where they got them.,Crunchyroll,czeigkf,1,t5_2sgc7
6503785,0,t1_czs1959,gt RZTXHXBAFETook this one thanks!,Crunchyroll,czs1gsx,1,t5_2sgc7
6667045,0,t1_d08scuv,What was the deal with Terra Formars then? It was unwatchable because of the censors but people complained enmass and the uncensored version later became available. Was trhe heavily censored version really released that way to tv?,Crunchyroll,d08xhy1,3,t5_2sgc7
6786682,0,t3_488qp0,Looking for a code too ! If someone can pm me one it would be great. Thanks !,Crunchyroll,d0lk3c2,1,t5_2sgc7
6876677,0,t3_49b9o6,Hi can someone give me a guest pass? I want it for digimon,Crunchyroll,d0vs9ln,1,t5_2sgc7
6917788,0,t3_4a9fjm,I just got a new phone so I wanna see how the app works before getting a full subscription.,Crunchyroll,d10gdak,1,t5_2sgc7
7645396,0,t3_4k0uv5,XPost referenced from rmanganews by uTheWalkingTroll  Crunchyroll Adds Space Patrol Luluco Manga    I am a bot made for your convenience Especially for mobile users.  P.S. my negative comments get deleted.  Contact | Code | FAQ,Crunchyroll,d3b8nsq,2,t5_2sgc7
7879777,0,t3_4n82il,hit the dice button on crs site and let RNG be your guide,Crunchyroll,d41rdru,2,t5_2sgc7
7950852,0,t3_4nzofs,First ep was great,Crunchyroll,d49r1xw,1,t5_2sgc7
8352338,0,t1_d5lfxs0,Wow I really appreciate your generousity in giving away a day pass  it was really nice surprise when I claimed this  hours after you posted it. Thank you very much Ill put it to good use this summer!,Crunchyroll,d5llfv8,1,t5_2sgc7
8570826,0,t3_4woqnl,Still ever saddened by the recent change of needing premium for even new chapters within the first week I am without the ability to read my precious As The Gods Will.Someone help please .,Crunchyroll,d6cxo45,1,t5_2sgc7
9070820,0,t1_d8258qv,took PQGZZLGU thank you,Crunchyroll,d825z7h,1,t5_2sgc7
9195930,0,t3_55mdsp,MZAKHSFRWZMSRWJDJQTVURYZFBJTRV,Crunchyroll,d8hnhaf,1,t5_2sgc7
9404972,0,t1_d973j0j,Any chance of that changing sometime??,Crunchyroll,d985aax,1,t5_2sgc7
9422066,0,t3_593279,JETETZYT enjoy!,Crunchyroll,d9ab8i1,1,t5_2sgc7
9628187,0,t1_d9zmvze,Its more of being a teen without a credit card than it is being a freeloader.,Crunchyroll,d9zvebm,3,t5_2sgc7
9693089,0,t3_5dwhhq,Uninstall it then install the latest version.,Crunchyroll,da7vnm5,1,t5_2sgc7
9721426,0,t3_5dze8l,finally worked out email was not required. Have now distributed all my gift passes in links sent via PM. Sorry to those of you who missed out might do this again in future! Hope the lucky recipients enjoy and consider subscribing to CR!,Crunchyroll,dabdlq3,1,t5_2sgc7
9945447,0,t1_db3wpwj,Thats very true. I just cant stand how Java is not supported on mobile and is quite glitchy and crashes a lot on desktop as well,Crunchyroll,db3x08w,1,t5_2sgc7
9981344,0,t3_5hv1ym,,Crunchyroll,db8liik,1,t5_2sgc7
10003604,0,t3_5ivku5,Is it an episode released today? The encode for high settings may not have completed yet.,Crunchyroll,dbbhy5k,3,t5_2sgc7
10245102,0,t1_dc56g9d,Who in Serbia cares about CR?,Crunchyroll,dc5c7y6,2,t5_2sgc7
10352168,0,t3_5o8fem,Its not just you. Everyone is having issues. I have using the Windows  app and my PS and half the videos wouldnt load or sometimes the site wouldnt load at all. If you log into the CR website and go to the help forums  you can see that there are a ton of people posting about similar issues.From what I read in another thread Crunchyroll engineers are aware of the issues and are trying to fix them.,Crunchyroll,dchh8q1,2,t5_2sgc7
10386355,0,t1_dcla9gb,Theres a premium plus level? I was not aware. What additional benefits do you get out of the ?,Crunchyroll,dclcwap,6,t5_2sgc7
10387816,0,t3_5onfsj,I just discovered that i have premium plus. However when i tried the new player it didnt even work.,Crunchyroll,dcliv8k,1,t5_2sgc7
10446072,0,t1_dcm5041,Netflix built its own CDN content delivery network and caches copies all over the country. Crunchyroll seemed to phone that critical infrastructure. With the cloud options available these days there really is no excuse unless theyre flat broke ,Crunchyroll,dcs5cu3,1,t5_2sgc7
10742114,0,t1_ddmc4r5,Yeah I made sure to be careful on getting into some kind of VPN application. Sadly nothing free seems to be very safe to use... CR Unblocker seems to be the safest one Im currently trying out Expressvpn which is awesome. Mainly got it to watch some Amazon Japan content. ,Crunchyroll,ddnyun5,2,t5_2sgc7
10784594,0,t3_5trbrv,ZPMWVZE,Crunchyroll,ddscp1b,1,t5_2sgc7
10843429,0,t1_ddyf2t5,Taken thank you,Crunchyroll,ddyf95d,1,t5_2sgc7
10951990,0,t3_5wf5cj,TY I got the third one,Crunchyroll,de9mbwq,5,t5_2sgc7
10954073,0,t1_de9nlk8,Watching it right now and its been great so far. I second this recommendation D. ,Crunchyroll,de9u27r,2,t5_2sgc7
11035093,0,t3_5xkhsc,Seems they fixed it already. Im watching Dragon Ball Super right now ,Crunchyroll,deiswxg,2,t5_2sgc7
11090408,0,t3_5xrp0k,GGCCYPSUJY,Crunchyroll,dep36p1,1,t5_2sgc7
11249003,0,t3_5z8bum,Must be something with their chrome cast app...use iPhone and PS here no problems. Sometimes quality but thats gotten better lately.,Crunchyroll,df723iv,1,t5_2sgc7
11308969,0,t3_60ewf5,Need guest pass to watch Naruto. Someone PM me please?,Crunchyroll,dfdursn,1,t5_2sgc7
11405450,0,t1_dfgl5oq,gt not the type of person to say things based off of speculationYoure doing exactly that though.,Crunchyroll,dfoskfk,2,t5_2sgc7
11509522,0,t3_649sk6,Yes we have an Apple TV app.,Crunchyroll,dg0ltjs,1,t5_2sgc7
11509642,0,t1_dg0m54w,iPhone s,Crunchyroll,dg0mb6j,3,t5_2sgc7
11510420,0,t1_dg0p7ut,It didnt work when I forced closed the app and opened it again so I deleted the app and tried it again to see if it would work even though it didnt an hour ago but this time it did so I greatly appreciate your help Ill be posting a new  star review thank you so much. And keep making crunchyroll the best anime viewing app out there. ,Crunchyroll,dg0phm2,3,t5_2sgc7
11593252,0,t1_dga2zxt,Why dont you upgrade to Windows ?,Crunchyroll,dga3qc0,2,t5_2sgc7
11610060,0,t3_634yxr,if anyone is feeling godly can I get a pass Pmd pls?,Crunchyroll,dgc0e0k,1,t5_2sgc7
11717107,0,t1_dgo5m4i,Thank you! ,Crunchyroll,dgo5vyr,1,t5_2sgc7
