,controversiality,parent_id,body,subreddit,id,score,subreddit_id
9279157,0,t3_576gef,Wow so many memories to pull from! I started playing when the level cap was  lol. Camping that stupid lion in the components for weeks. Spent a good number of years on Vox in pvp madness and eventually moved to nagafen. I loved castle mistmoore and the next xpack after that still have my rooms and have been debating coming back. Ive played here and there for free since daybreak or whatever took over I just know if I buy a subscription again Ill be sucked right back down the rabbit hole. Lol. ,EQ2,d8s77lj,2,t5_2r4sq
9785599,0,t3_5f88ip,Warden.,EQ2,dajadww,2,t5_2r4sq
10193984,0,t1_dbm442s,Sora was fine I played against him and was then guilded with him for about  months. People were just salty about losing to him.,EQ2,dbzjli8,1,t5_2r4sq
10216740,0,t3_5m1hod,My partner and I play very casually both working adults. We are on Stormhold and our current mains are a ish Templar and ish Shadowknight. We arent incredibly knowledgeable about the game as weve only been playing for about a year or two offandon.Someone friendly and casual to help us kill things faster would always be welcome. Im Aeslynn in game.,EQ2,dc24ig6,1,t5_2r4sq
10328215,0,t1_dceqq50,Hes never shown the players traveling to dungeons in any of the streams its always been a quick teleport. If the travels not being shown I dont think the travels there since its Brads big thing.,EQ2,dcerekp,1,t5_2r4sq
11173185,0,t3_5zijru,Bypass the launcher and run everquest.exe from the game folder.,EQ2,deygv64,2,t5_2r4sq
11665657,0,t1_dghu843,The game is pretty much dead anyways even on the highest populated server. Its quite normal for toxic players to hang around games that have few players left.,EQ2,dgibfoi,2,t5_2r4sq
