,controversiality,parent_id,body,subreddit,id,score,subreddit_id
7714694,0,t3_4kzdoj,gt The bottom line is this... if you find NFP too much of a commitment then Id ask what you think marriage is... or parenthood for that matter.Because checking my mucus and temperature and putting it in a spreadsheet is annoying and a hassle I dont want to deal with I must not understand marriage. I assume marriage also involves checking secretions and temperatures daily and documenting everything in Excel.,badwomensanatomy,d3j3w6k,58,t5_2zlzd
7734041,0,t1_d3l3qqm,I just finished taking medical terminology  and theres a fancy word for babys first poop inside mom and its killing me that I cant remember it right now. ,badwomensanatomy,d3lb0ha,-15,t5_2zlzd
7764946,0,t1_d3opq9m,Not to mention lack of sleep and general increase in work load. Maintaining an infant is hard work.,badwomensanatomy,d3otai3,36,t5_2zlzd
7776151,0,t1_d3q16mf,I tend to assume anything on yahoo answers is these days.,badwomensanatomy,d3q32ri,8,t5_2zlzd
7790246,0,t1_d3rjqes,I guess this sub no longer appreciates sarcastic jokes,badwomensanatomy,d3roi4f,3,t5_2zlzd
7790928,0,t1_d3rpcfn,My microwave actually lets you type in . It just changes to  after you hit the start button.,badwomensanatomy,d3rr9qa,14,t5_2zlzd
7845939,0,t3_4mrtvh,gtthe capstone of an area spawning violent chemical and hormonal eruptionsLol. This is some Victorian nonsense. And men have no hormones of coursethat would be silly. ,badwomensanatomy,d3xyap7,76,t5_2zlzd
7846927,0,t1_d3xuhal,If you apply it to bees and ants hes actually pretty spot on.  Humans not so much...,badwomensanatomy,d3y2aq0,21,t5_2zlzd
7857460,0,t3_4mwi15,I feel gross for upvoting this title,badwomensanatomy,d3z8zlk,11,t5_2zlzd
7858112,0,t1_d3yw2pl,Yeah that was my favorite comment lol. I didnt immediately pick up the sarcasm so I was like you can unravel a clitoris?? then kept reading and thought I see what you did there... ,badwomensanatomy,d3zbmg3,25,t5_2zlzd
7861308,0,t1_d3yzybf,F,badwomensanatomy,d3zok8z,3,t5_2zlzd
7884908,0,t1_d415tpf,Heigh ho the dairyo the vagina stands alone,badwomensanatomy,d42c4gu,4,t5_2zlzd
7907159,0,t3_4nkdc7,I was in that post last night doing my best to answer questions so we wouldnt have more things to submit here. Im not sure why any of the questions are embarrassing but Im glad they are all finding a place to ask and learn.Edit typo,badwomensanatomy,d44u8ku,10,t5_2zlzd
7929055,0,t3_4nut2n,My father has failed me for he allowed those abominations the waist belts to enter his household!  Now I am unfit a puny unpeaked specimen unfit to do naught but bring about the end of the human race!,badwomensanatomy,d47atst,30,t5_2zlzd
7942093,0,t1_d48r1ry,I guess it depends on the plant flowers? Id be okay with it vegetables? Ehh...,badwomensanatomy,d48rk80,10,t5_2zlzd
8001864,0,t1_d4fcqq1,It was deleted before I could read it. I demand compensation preferably pictures of kittens.,badwomensanatomy,d4fhhf1,15,t5_2zlzd
8019203,0,t1_d31l15l,deleted,badwomensanatomy,d4hflxd,1,t5_2zlzd
8019617,0,t3_4ot5j6,PoisonousPlatypus messaged me after they got banned and they are still trying to defend their position. Did anybody else get messaged or did they just go after me for some reason?The title of the message was Muscles definitely stretchgtThis is why people use progressive anal toys as well and also why theres a recovery period after giving birth.At this point Im thinking hoping theyre a troll. ,badwomensanatomy,d4hhaf0,3,t5_2zlzd
8030624,0,t3_4oro15,Sometimes it does seem to stop when Im showering but its by no means a sure thing or some weird deal where I can just sprinkle water on it to stop bleeding on command.,badwomensanatomy,d4ipuiu,1,t5_2zlzd
8067356,0,t1_d4mu7e5,,badwomensanatomy,d4mui7o,1,t5_2zlzd
8080674,0,t1_d4oca9s,Huh? It used to be a sub where people talked about abusing prostitutes. It was a very small sub with very little activity but the reddit activism zeitgeist descended on them anyways.,badwomensanatomy,d4occvi,2,t5_2zlzd
8095921,0,t3_4q4bup,Hearing this stuff from women is far more anger inducing and depressing than hearing it from men. You are worth more than whatever state your genitals are in. ,badwomensanatomy,d4q1yx2,114,t5_2zlzd
8102649,0,t3_4q79q1,Is it generally considered acceptable to share pictoral representations of your childrens genitals?,badwomensanatomy,d4qt78q,69,t5_2zlzd
8106210,0,t1_d4qxz0e,Either an outrage generating troll or outrage generating and poorly done IMO satire. I cannot let myself believe it is real.,badwomensanatomy,d4r7lgv,3,t5_2zlzd
8110775,0,t1_d4rg62e,I was absolutely being sarcastic and such.,badwomensanatomy,d4rq2z1,10,t5_2zlzd
8126526,0,t1_d4th3t2,removed,badwomensanatomy,d4thtyy,3,t5_2zlzd
8145138,0,t3_4qt37m,I dont understand...are you posting this to rbadwomensanatomy because its not just women that have protruding stomachs? Because no one has a stomach that goes in? ,badwomensanatomy,d4vosrf,3,t5_2zlzd
8151619,0,t1_d4whupk,Posting porn in totally inappropriate forums is a fetish now?,badwomensanatomy,d4wi0cq,16,t5_2zlzd
8158874,0,t1_d4xblmu,Attracting Bears.,badwomensanatomy,d4xeojk,42,t5_2zlzd
8159551,0,t1_d4xfbic,D Oh god... My lunch is trying to make an encore showing...,badwomensanatomy,d4xhq5l,3,t5_2zlzd
8165907,0,t1_d4xoy11,removed,badwomensanatomy,d4yad27,1,t5_2zlzd
8190531,0,t1_d50mcgd,Ive also always wondered where this comes from. I know Ive seen a few TV shows where someone walks in on an undressed man and he shouts ITS COLD IN HERE! A la George Constanza. But Ive never actually met a woman or man who makes fun of flaccid penis size. ,badwomensanatomy,d51d94v,6,t5_2zlzd
8210754,0,t1_d53vl03,Our dog came back from escaping knocked up def at least two dads.,badwomensanatomy,d53wdvb,3,t5_2zlzd
8222562,0,t3_4rz256,i like that one of the commenters in a different comment thread on that same image uses the phrase porn culturewould be nice if porn had a wider range of vaginas wouldnt it,badwomensanatomy,d55dkc2,30,t5_2zlzd
8228646,0,t1_d563q9y,I think misogyny does the trick. Its pretty gross no matter the form. ,badwomensanatomy,d564y0d,34,t5_2zlzd
8230766,0,t1_d55jlzp,Lmao. Let me guess if you cleanse extra hard your skin also turns white and your hair turns blonde too. ,badwomensanatomy,d56ehkm,14,t5_2zlzd
8236889,0,t3_4s7nvx,Correct link ,badwomensanatomy,d5760gw,8,t5_2zlzd
8239217,0,t1_d575j4h,Not a doctor. Im a physio. But I work in a hospital and did pathology. So Im not involved in diagnosing anyones medical issues other than my own. Though I do have to know how they happen and their effect etc so I can prevent cross contamination infection etc and manage their physical effects apropriately,badwomensanatomy,d57giei,2,t5_2zlzd
8240557,0,t3_4s8q75,Everyone a PSA DICKS ARE BIGGER THAN SPECULAYou heard it here first.,badwomensanatomy,d57mjd3,15,t5_2zlzd
8248842,0,t1_d58mcdx,Yes women also need to be taught not to rape. Did you see what I said in the last paragraph of the post? I think consent education regarding men would be good for women too because femaleonmale rape rates are higher than commonly presumed amp I think its probably because women are taught to think that all men want to have sex all the time.,badwomensanatomy,d58nt4o,25,t5_2zlzd
8272782,0,t1_d5baamy,We mature earlier. Physically at least. That is puberty in girls tends to star on average a year or two before it starts in boys. Im not sure of exact numbers since its been a awhile since I studied that stuff.,badwomensanatomy,d5bnniv,10,t5_2zlzd
8272879,0,t1_d5bages,gt God forbid men want to be comfortable!Men have to suffer to be real men. ,badwomensanatomy,d5bo373,10,t5_2zlzd
8273622,0,t1_d57td1k,Im really concerned that someone could go through medical training and still not know that though.,badwomensanatomy,d5brfe6,1,t5_2zlzd
8290825,0,t1_d5dvtwp,Mine does chocolate chip cookie dough. ,badwomensanatomy,d5dwub2,16,t5_2zlzd
8291528,0,t1_d5dwub2,deleted,badwomensanatomy,d5e007y,1,t5_2zlzd
8299685,0,t1_d5ezhef,I really want to believe hes a troll...but I dont think he is...,badwomensanatomy,d5f0og1,24,t5_2zlzd
8301576,0,t1_d5dwt43,Ugh. Reading all this makes me feel a little sick to my stomach. ,badwomensanatomy,d5f96nb,3,t5_2zlzd
8315700,0,t1_d5gyb21,Calling her a party favor kind of implies that her birth control is expensive because shes having a lot of sex. Aside from condoms or taking Plan B every time you have sex thats not how birth control works.,badwomensanatomy,d5h0otv,193,t5_2zlzd
8317359,0,t1_d5gz92v,Mine would be month without insurance.  Glad its !  Thanks Obama!!,badwomensanatomy,d5h85l4,10,t5_2zlzd
8324690,1,t1_d5i3l9q,Really? Even if theyre hit extremely hard...does it have all of the effects I listed?,badwomensanatomy,d5i53fc,3,t5_2zlzd
8334139,0,t1_d5il0i4,Was considering a breast reduction but nope nevermind gotta clear that milk! ,badwomensanatomy,d5jbm9u,2,t5_2zlzd
8338038,0,t1_d5jt35l,I suppose I could call shudder Bill Murray to help me out.,badwomensanatomy,d5jt4yz,3,t5_2zlzd
8361629,0,t3_4u4cpf,Is that why I have an insatiable craving for pennies?  Thanks Dr. Wilson.,badwomensanatomy,d5mr7ie,101,t5_2zlzd
8399673,0,t3_4ul71m,Closely related to the Schrodingers Joke  whether or not a comment is intended as a joke is only determinable once the reactions to the comment are observed. Eg you should totally make out with me and tell me if Im a better kisser than your SO...I was only joking!,badwomensanatomy,d5ri7oi,33,t5_2zlzd
8416874,0,t1_d5tlwf2,I didnt read that far into it but that does sound pretty typical.,badwomensanatomy,d5tnhyk,16,t5_2zlzd
8439764,0,t3_4v96w1,On a side note you really need to charge your phone.  battery !!?,badwomensanatomy,d5wicjl,5,t5_2zlzd
8440717,0,t3_4v1d3x,Thats mansplaining with a side of ignorance. Im sorry. ,badwomensanatomy,d5wmmt2,3,t5_2zlzd
8447343,0,t1_d5xb8qy,deleted,badwomensanatomy,d5xgeav,7,t5_2zlzd
8474994,0,t3_4vp7c1,gt Lmao are you serious? Women need their uteri it doesnt tear itself offI dont know about the rest of you but I need as many uteri as I can get,badwomensanatomy,d60wz69,15,t5_2zlzd
8487827,1,t1_d62hivb,Having said that there was a movement in the second wave which has kind of stuck around that were... well frankly misandrists. Dworkin comes to mind as an example saying something about how all PIV is rape.,badwomensanatomy,d62iwyc,-3,t5_2zlzd
8549622,0,t1_d5st711,Hey my boyfriend wears exclusively  jeans as  tend to be too big for his frame and hes far from looking skeletal. His weight is even right in the middle of normal BMI! Are we going to act as if only fat dudes exist?,badwomensanatomy,d6a9wkj,1,t5_2zlzd
8550640,0,t1_d6abt1y,Similar yes. Identical obviously not. Sex involving another person is going to produce a higher total amount of oxytocin mostly because it lasts longer so youve got oxytocin from all the being with another person thats involved in sex plus the oxytocin from any orgasms had. But speaking specifically of the amount of oxytocin released from an orgasm theres not much difference between a sex!orgasm an a masturbation!orgasm.This is why theres two parts to that particular snowball the second being does it only count instances of sex or is it keeping track of orgasms for this tally? Because youre going to get about the same amount of oxytocin from an orgasm whether its from sex or masturbation. But sex involves a lot of other things that also produce oxytocin so which case exactly is the yardstick for this silly persons argument? Im just trying to figure out which path of socalled logic this person is following because both besides being completely wrong are mutually exclusive.If theyre counting instances of sex then they must logically assume that even committed people can only have sex so many times before their pair bond breaks down and none is able to form ever again. Because your brain doesnt differentiate between this is oxytocin from sex with Steve and this is oxytocin from sex with Amanda its the same hormone in all cases so  rolls in the hay with one person is functionally identical to single instances of sex with  different people.If theyre counting orgasms then having more than one orgasm in a single instance of sex would cut a relationship significantly shorter Sorry honey I orgasm twice every time we have sex so we can only do it four more times before I stop loving you or anyone else forever. but any couple or any number of casual partners could have as much sex as they want without the pair bond breaking down so long as neither of them has an orgasm. But better not masturbate more than  times or its all out the window.Now I get that both of these scenarios are completely ridiculous because thats not how oxytocin works obviously it doesnt run out unless you have a pretty significant medical problem involving your pituitary function. But one of them has to be the line of logic being followed in order for the statement sex with more than  partners eliminates your ability to form attachments to people to be internally consistent. The only other option is this idiot thinks oxytocin is a process of magic rather than physiology and is somehow only finite if youre not eternally committed to the first person you ever have sex with.and this reply got super long sorry about that but you can see what I mean by snowballing hilariously.,badwomensanatomy,d6aehw7,21,t5_2zlzd
8554409,0,t1_d6afsnu,deleted,badwomensanatomy,d6avj11,5,t5_2zlzd
8555343,0,t1_d6ayemr,deleted,badwomensanatomy,d6azqw3,43,t5_2zlzd
8563272,0,t1_d6bqkkt,That reminds me of Amy Schumers spoof on  Angry Men where they are all deciding whether or not she is sexy enough to be on television.  ,badwomensanatomy,d6bzjfs,35,t5_2zlzd
8564311,0,t1_d6c33xq,The capslocked words were not attributed to you but I already knew your reading comprehension was lousy. Have a nice life.,badwomensanatomy,d6c48ep,2,t5_2zlzd
8597486,0,t1_d6g7cbl,Clitoral orgasm is like a steep hill that goes up and down fast. G spot for me is like waves and I dunno if I ever finished with it but its a lot better imo,badwomensanatomy,d6ga08h,56,t5_2zlzd
8633251,0,t1_d6kji8r,removed,badwomensanatomy,d6krhw5,-33,t5_2zlzd
8639672,0,t1_d6j1g58,Wait why do pit bulls need to go through a heat cycle?,badwomensanatomy,d6lkgf0,6,t5_2zlzd
8648630,0,t1_d6mgzcm,Incels are red pillers who couldnt master the manipulation and abuse tactics and so couldnt get their prize sex from the super hot ladies that they deserve. Theyre the Elliott Rogers of reddit. Its a vaguely terrifying sub actually. Never really know when one of them will go off the rails and shoot up a school or gym or whatever. Its  an echo chamber full of desperation and loneliness so they keep getting more and more toxic. They need mental help. ,badwomensanatomy,d6movmv,33,t5_2zlzd
8648767,0,t1_d6mmzqv,Oh yeah its pretty bad. The amount of objectification of women that has to happen for them to understand access to another persons body as their right is extremely disturbing. We are literally not people to them. ,badwomensanatomy,d6mphwo,11,t5_2zlzd
8649604,0,t1_d6mrv08,gt  so much hatred and anger at megt you feel the need to start attacking meYeah I think you might be exaggerating. Nobody is attacking you. Not here and not on the posted link. If youve received private threats then Im sorry and you should report them but from what I can see everybody is being fairly reasonable.,badwomensanatomy,d6mt9yf,45,t5_2zlzd
8651538,1,t1_d6my0ts,deleted,badwomensanatomy,d6n20f8,-1,t5_2zlzd
8651743,0,t1_d6n2gbp,I mean my list wasnt even comprehensive. Skateboarding is an Olympic sport now right? Women cant skate as well as men because of...grip? Wut.,badwomensanatomy,d6n2xpf,11,t5_2zlzd
8658709,0,t1_d6ny1p2,Theres no way you could have known no worries dude,badwomensanatomy,d6nyctl,1,t5_2zlzd
8673513,0,t1_d6pragi,Its worth mentioning that men have these hormonal cycles too theyre just less noticeable because they arent gushing blood. Our hormones raise to match theirs while were menstruating but theirs can raise way past that mark. ,badwomensanatomy,d6pt7jq,30,t5_2zlzd
8680415,0,t1_d6ql6mz,Er...more like worried it wont when the baby is born.,badwomensanatomy,d6qochp,2,t5_2zlzd
8703668,0,t1_d6scdlf,Which only helps if its available in your country. So Canadians will continue to be out of luck for the foreseeable future.,badwomensanatomy,d6tlbp9,1,t5_2zlzd
8725335,0,t1_d6ro9lw,My mom didnt get my ears pierced as a baby because of many reasons including my right to my own body prone to infection the possibility of me pulling it out etc. And yet she thought it was fine to get my brother circumcised which is a much bigger procedure and you literally have to have your son wear a dirty diaper with an open wound on his penis. I still dont understand the discrepancy in her logic.I was indifferent to MGM until I saw a video of one being performed on a newborn. I cant understand why anyone would willingly do a cosmetic procedure like that on their newborn baby.,badwomensanatomy,d6wb4pk,3,t5_2zlzd
8736832,0,t1_d6xdv30,Ok but has doc done a pelvic exam? Like a negative hcg urine test does not rule out pregnancy.s,badwomensanatomy,d6xr3k4,29,t5_2zlzd
8738055,0,t1_d6xurfs,If youre describing someone elses body and youre not their doctor using stomach to describe the general area where the uterus should be located is okay in my book. Saying her uterus looks big is not accurately describing what is visible. ,badwomensanatomy,d6xwmv4,4,t5_2zlzd
8748718,0,t1_d6z3z1b,I love this. If you eject semen OR OR OR OR OR if you can cum which you cant then apparently you can but its because youre a slut fucking degenerate penises! You say you came? Must be fucking a handicapped alien! ????,badwomensanatomy,d6z8tl4,13,t5_2zlzd
8776851,0,t1_d72r52l,a porn site ad guess how I found it,badwomensanatomy,d72rw4f,41,t5_2zlzd
8794788,0,t1_d74qhg0,On behalf of my fellow ladies with minimal labia minora,badwomensanatomy,d750j50,4,t5_2zlzd
8826311,0,t1_d78sdi7,Hmm...I know it should be big! Size matters. ,badwomensanatomy,d78stnp,4,t5_2zlzd
8850574,0,t1_d7bllwx,HAVE SEXY FUN TIMES WITH A PHOTOGRAPH STOLEN IN A CLOUD HACK IN YOUR AREA NOOOOOOOW!,badwomensanatomy,d7bpp0g,6,t5_2zlzd
8857262,0,t3_51jvij,oh no! my legs are hairy! guess id better tag along with my mother when she goes in for chemotherapy tomorrow i need to address this lifethreatening body hair problem immediately. maybe there are special cancer razors i should be using. ,badwomensanatomy,d7cinh4,100,t5_2zlzd
8869162,0,t1_d7dtscc,There seems to be a weird stereotype that fat people are stupid.Personally I think people who keep on trotting out tired stereotypes are stupider.,badwomensanatomy,d7dy5sw,19,t5_2zlzd
8871549,0,t1_d7e1h4p,I havent noticed any extra acne. I did notice I am getting more spots than when I was on the Pill. I think this is mainly due to the fact that the Mirena releases less hormones than the pill and as it is already located in its target region so the dose is less and therefore less impact on the spots.  ,badwomensanatomy,d7e8h43,2,t5_2zlzd
8892536,0,t1_d7gqan5,Or just a  year old who made up the part about ever seeing a vagina in real life,badwomensanatomy,d7gr8to,24,t5_2zlzd
8907184,0,t1_d7hhorb,Even if they do... Who the fuck cares?,badwomensanatomy,d7iij1k,1,t5_2zlzd
8911936,0,t1_d7j315f,Never heard of them.  Im going to just guess theyre some kind of goth band?,badwomensanatomy,d7j31rp,1,t5_2zlzd
8937466,0,t1_d7lt5bw,Yesss. I love it too.,badwomensanatomy,d7m5gj1,2,t5_2zlzd
9023116,0,t1_d7wby09,Wasnt trying to imply just saying maybe there was a reason that I didnt have an issue. And me saying that it didnt hurt me isnt sugarcoating it its the honest truth of how it went for me. Curious what the statistics are on it being painful vs. not. ,badwomensanatomy,d7wfr6j,2,t5_2zlzd
9036053,0,t1_d7lsd6s,I want to say its rpicsofmenwiththings. ,badwomensanatomy,d7xzo1z,1,t5_2zlzd
9048584,0,t3_546how,Im pretty sure this one has never seen breasts in real life.,badwomensanatomy,d7zhuds,50,t5_2zlzd
9090935,0,t3_53a49o,Because we all want to have kids right?,badwomensanatomy,d84l0st,1,t5_2zlzd
9108545,0,t1_d86n1kt,You need help. Im not sure what kind but you definitely need it.,badwomensanatomy,d86p7x9,4,t5_2zlzd
9205080,1,t1_d8i36rb,tbh you should have been aborted,badwomensanatomy,d8it9md,-3,t5_2zlzd
9206767,0,t3_56elk9,TIL still didnt have sex with enough jerks bc I look really young for my age. Seems I need to work on it D,badwomensanatomy,d8j0yrx,7,t5_2zlzd
9215774,0,t1_d85926r,Well I can tell you that the balls hang below the vagina thanks Cartman,badwomensanatomy,d8k61o4,1,t5_2zlzd
9220259,0,t1_d8j6xml,Damn that is one fine website ,badwomensanatomy,d8kqhc3,6,t5_2zlzd
9248170,0,t3_571yrg,Reminder If you vote in linked threads you are breaking reddits site wide rules and your account is likely to be suspended. Its pretty clear that this has been happening and if you dont knock it off well be forced to either close or go to screenshot only. I am a bot and this action was performed automatically. Please contact the moderators of this subredditmessagecompose?torbadwomensanatomy if you have any questions or concerns.,badwomensanatomy,d8o9uu9,1,t5_2zlzd
9262435,0,t1_d8q1mvf,That absolutely has to be satire. I refuse to believe it isnt. ,badwomensanatomy,d8q2w7d,51,t5_2zlzd
9268026,0,t3_57c2iv,Hes now claiming its totally just a troll tweet but then calls the women in his mentions bitches. Tells them that they wouldnt call him ignorant to his face. Oh yes I would. We all would. Thats not exactly a hard thing to say to someones face. Also huge shoutout to the random man in the mentions getting angry at other women for not thinking the hilarious joke was funny. We women are simply devoid of humor I guess. ,badwomensanatomy,d8qsdxk,227,t5_2zlzd
9269723,0,t1_d8r03td,Got it men who blame us because we wont instantly beg them for a fuckin.,badwomensanatomy,d8r05hu,62,t5_2zlzd
9270380,0,t1_d8r2goz,I met someone once who spent most of the first day of her first ever period on the toilet thinking she was dying. ,badwomensanatomy,d8r35vm,65,t5_2zlzd
9275461,0,t3_57c2iv,deleted,badwomensanatomy,d8rqbaw,1,t5_2zlzd
9302039,0,t1_d8tt1d1,I had a hysterectomy at  and believe me not having periods ever again is amazing.,badwomensanatomy,d8v3n35,3,t5_2zlzd
9317843,0,t1_d8x3oxr,I would think their official tax classification would be something like taxable. I never heard the term luxury until some politicians started trying to stir up shit.,badwomensanatomy,d8x3s5s,-1,t5_2zlzd
9322278,0,t1_d8xafai,When I was in high school my boyfriend at the time got really angry when I pointed out the pee hole was different from the vagina. He argued with me...about my own anatomy. He wasnt my boyfriend after that day.,badwomensanatomy,d8xo14o,163,t5_2zlzd
9322627,0,t1_d8sc39m,Thats  not how this works. Thats not how any of this works!,badwomensanatomy,d8xpmcy,3,t5_2zlzd
9329438,0,t3_588zog,Well I didnt ask my mom to breastfeed me either. I was just a crying and pooping mess I didnt ask questions.,badwomensanatomy,d8ykonu,139,t5_2zlzd
9340712,0,t1_d8zrekg,Seriously. And more so nobody wants to have a late term abortion. If someone didnt want a baby they arent going to go through the physical pain and exhaustion of growing one for  months. These late term abortions happen to people who wanted this baby and they are absolutely devastating. Just not as devastating as giving birth to a baby who wont survive or dying in childbirth therefore leaving their other children or family behind. Why dont people understand this?!?,badwomensanatomy,d900433,109,t5_2zlzd
9344089,0,t1_d90djoz,If using proper medical terms seems like dehumanizing rhetoric then maybe you have a perception problem. ,badwomensanatomy,d90fhv4,19,t5_2zlzd
9344888,0,t1_d90iylw,Well thankfully I literally cant even remember anything about it to even try and search.  I cant even remember my main characters name it wasnt Mary Sue but it should have been! ,badwomensanatomy,d90j56v,7,t5_2zlzd
9357625,0,t3_58k64e,DANGEROPSIM CRYING,badwomensanatomy,d925a7c,13,t5_2zlzd
9372218,0,t3_58xbnp,Or maybe its because I fucking hate shaving and it irritates my skin.  Also give me one good reason why I should shave.  ,badwomensanatomy,d93zua6,204,t5_2zlzd
9374538,0,t1_d940wks,Sounds like Freudian psychology there. Shits dated as all hell.,badwomensanatomy,d94af48,7,t5_2zlzd
9376387,0,t3_58tmii,gt In it you will learn how to manage your bitches by turning your relationship into a game she plays  winning prizes of intimacy for good behaviour and getting punished with demotion or exile if she fails.Hold the phone they start out this whole thing framing it as a game that men are supposed to do. This manipulation is the proper way for men to engage with women but they think all women are manipulative shit testers what play games just like this with men. Sooo does this mean that men who want learn how to become alpha are taking notes from women the folks who already do this naturally? This is what you get for repeatedly saying all women are like that.  Women are the natural alphas suck on your own logic trp. These misogynists are just jelly over how naturally fierce we are ,badwomensanatomy,d94iuvf,11,t5_2zlzd
9377830,0,t1_d94eepb,Yep can confirm identify as man remove body hair actually want to be woman. in case it isnt obvious Im playing along,badwomensanatomy,d94pfsf,2,t5_2zlzd
9382797,0,t1_d94q0gj,Also if kids dont care about something its not significant obviously. Kids are the ones buying the movie tickets after all!,badwomensanatomy,d95c3i6,27,t5_2zlzd
9389044,0,t3_5971u9,Snapshots. This Post    Error error autoarchiving click to submit it!I am a bot. InforSnapshillBot  Contactmessagecompose?torSnapshillBot,badwomensanatomy,d964lqu,1,t5_2zlzd
