,controversiality,parent_id,body,subreddit,id,score,subreddit_id
965958,0,t1_cg6qeo3,And obviously India has historically been a land where where women simply arent submissive enough.,badwomensanatomy,che379r,12,t5_2zlzd
1304198,0,t1_cigbyho,Well as a woman let me tell you that were wise to that shit and it doesnt work. Whenever guys try negging or any of the other ridiculous redpillPUA tactics my friends make fun of them mercilessly. If you want to get a girlfriend just treat women like people. There isnt a secret code to getting women to like you. Were people and we make up more than half of the population. No one thing is going to work on all women. But I will tell you that most women like most people really resent it when people try to manipulate them or when people talk down to them. And TRP advises doing exactly those things. Just be up front with people. If youre looking for a relationship say that. If youre just looking to hook up say that. But whatever you do dont play games. Dont pretend to be friends with someone or interested in their personality or intelligence or common interests if all you really want is sex. Doing that is hurtful. And women talk. We tell our friends when men do awful shit. If you want to ensure that you have a terrible reputation and make every woman you know hate you go ahead and follow TRP.  Also I was a commuter student all through college and it didnt stop me from meeting someone and having a satisfying healthy relationship. Were now engaged.,badwomensanatomy,cigc7j7,26,t5_2zlzd
1871547,0,t1_ckef1dj,How many dudes can I impregnate with my boobs?,badwomensanatomy,ckepqmq,26,t5_2zlzd
2402877,0,t1_cm7pn7y,This was actually a pretty standard conceptualization of womens anatomy in much of the late medieval and early modern world and only really began to change during the eighteenth centuryHere are a couple of pictures. The one on the left is titled Vagina as Penis from supercool anatomist Andreas Vesalius  book De humani corporis fabrica On the Fabric of the Human Body and the one on the right is Italian surgeon Vidus Vidius understanding of the vagina and uterus from De anatome corporis humani .As a bonus bit of weird anatomy THIS is a  illustration from De mulierum organis generationi inservientibus by a Dutch fellow named Regnier de Graaf. It purports to show the uterus vagina and the ovaries. Although you cant see in the picture the ovaries in the book are actually labelled female testicles.Info is from Thomas Laqueur who published a really interesting book in  called Making Sex which I would really recommend to anybody who is interested in sex gender and history.,badwomensanatomy,cm8pd77,15,t5_2zlzd
2558700,0,t3_2d1w36,Well theres bone and muscle under them...but theyre fat globules held in place by ligaments. That doesnt sound bony to me. ,badwomensanatomy,cmsk5nv,3,t5_2zlzd
3660158,0,t1_cq8r7dp,Lol female orgasm is a lies,badwomensanatomy,cq9hexf,29,t5_2zlzd
3734740,0,t1_cp9cu1j,That was ignorantly beautiful.,badwomensanatomy,cqhzgxy,-1,t5_2zlzd
4104116,0,t1_cro2jbe,I know isnt it just awful?,badwomensanatomy,cro3eao,10,t5_2zlzd
4177787,0,t3_372bqx,God that thread pissed me off. Nothing worse then a guy trying to tell women how their bodies work. Pretentious piece of shit. Ugh. ,badwomensanatomy,crwh0zc,4,t5_2zlzd
4382050,0,t1_csi5cw2,My favorite thing is how people latch on to this one particular facetious detail and think Im actually being literal about it. The irony is people cannot comprehend that when I say we are one singular gender it is the same as when gender ideologues preach about smashing the binary. There is no binary. Gender is a spectrum. I agree.Be gay be straight be a woman be a man be whatever you want its your life. God gave you free will whether you believe this to be the case or notjust accept the nod and move on. If you wanna be a degenerate nontraditional heathen then go forth and defile the land as whatever identity pleases you. Just dont deny me the right to own and have pride in mine as well. Deal? Equality? Hm?,badwomensanatomy,csjld30,-32,t5_2zlzd
4411779,0,t3_3biz3q,gtAlso I am not a moron. I have a very very high IQ and very intelligent and very objective and and am rational enough not to have some antibigot viewpoint so easily and quickly triggered by someone who made an innocent post about some legal questions because his home was wrecked by a homewrecker. I didnt expect to be berated as being a bigot.Adorable.,badwomensanatomy,csmxxel,24,t5_2zlzd
4445271,0,t1_cog8i8y,Dear god HH?  Im a DD and have issues.  How do you support those girls?  I had a friend that size and her back always hurt.  She was a bigger gal and after losing lbs without any reduction in cup size she had to wear corsetts to be comfortable.,badwomensanatomy,csr0gi3,1,t5_2zlzd
4774964,0,t1_ctwcwnk,I wish his hair was running separately I would absolutely vote for it.,badwomensanatomy,ctwfdif,31,t5_2zlzd
5268691,0,t1_cvl4i1r,I got a good laugh out of it here is the original article where I stumbled upon this. ,badwomensanatomy,cvl4ued,27,t5_2zlzd
5441172,0,t1_cw6m1wo,Cognitive dissonance.,badwomensanatomy,cw75vak,26,t5_2zlzd
5617991,0,t1_cwtgb21,Yes! Its just very rare. ,badwomensanatomy,cwtgsky,4,t5_2zlzd
5624376,0,t1_cwu8o4b,Why didnt she say that having soy was a Croatian thing ?,badwomensanatomy,cwu99uu,8,t5_2zlzd
5683613,0,t1_cx15048,More like strawberry jam because sometimes its got big chunks in there.,badwomensanatomy,cx1lvy0,12,t5_2zlzd
5797840,0,t1_cxfrv20,If you look up diagrams labia definitely dont protect the clitoris. No I do have thoughts on that it is not what my comment was about and its pretty obvious that getting into a discussion with you about it would be pointless. ,badwomensanatomy,cxfrzgh,7,t5_2zlzd
5845410,0,t3_3v8ao1,When did virginity go from meaning having sex for the first time to doesnt have an intact hymen? I heard someone say once a newborn baby wasnt a virgin because she was born without a hymen.,badwomensanatomy,cxlv01u,46,t5_2zlzd
5849680,0,t3_3vcpwn,Someone in the comments on riamverysmart  was defending this and saidgtBesides the fact that the vagina isnt part of the digestive tract although it kind of is because you pee out of it what are we making fun of here?,badwomensanatomy,cxmf6o1,112,t5_2zlzd
5860782,0,t3_3vi8a7,This is  true medical science stuff here.  They teach it at doctoring school,badwomensanatomy,cxnvm83,31,t5_2zlzd
6032667,0,t1_cya3fk7,The penis and testes of course!s,badwomensanatomy,cyaedq2,71,t5_2zlzd
6033605,0,t1_cya683q,Wow damned if we are philosophers and if not.,badwomensanatomy,cyais5z,46,t5_2zlzd
6035652,0,t3_3y383c,I sit and think about life the universe and everything often. Does that make me a man?,badwomensanatomy,cyase4u,9,t5_2zlzd
6037352,0,t1_cyaz3y6,No I doesnt even know about galaxies.,badwomensanatomy,cyb0d33,13,t5_2zlzd
6058452,0,t1_cydlt41,What the hell does that even mean?,badwomensanatomy,cydrca5,16,t5_2zlzd
6180362,0,t1_cys2w8q,Doesnt make it not stupid. ,badwomensanatomy,cys55fc,7,t5_2zlzd
6232747,0,t1_cyy394w,You put them in your own mouth son,badwomensanatomy,cyy3g46,6,t5_2zlzd
6288860,0,t1_cz4go32,sending out wound cultures is a thing of the past!,badwomensanatomy,cz4h0r0,8,t5_2zlzd
6339398,0,t1_cz9z9gj,Aw poor thing! Ive heard that Naproxen Sodium Aleve can help with bleeding. Otherwise drink water to help keep muscles hydrated and use a heating pad. I really hope you have some relief later on. ,badwomensanatomy,cza7wcj,3,t5_2zlzd
6348235,0,t1_czb68g8,The anus should rarely be wet Pam.,badwomensanatomy,czb821q,3,t5_2zlzd
6356280,0,t1_czbhrlw,Ive been wanting to do a meal composed entirely of different preparations of potatoes. It sounds really good. ,badwomensanatomy,czc50pr,8,t5_2zlzd
6365212,0,t1_czbu43p,You expect me to believe that Gaming is your hobby. And yet youre willingly aiding and abetting systemic and institutional corruption in the industry serving your hobby.No I dont buy it.,badwomensanatomy,czd5kgr,-6,t5_2zlzd
6391995,0,t1_czf2gll,This is why I cant keep houseplants! And I thought watering them with menstrual blood was the epitome of ecology...,badwomensanatomy,czg7ca6,1,t5_2zlzd
6406153,0,t1_czhrlki,Dont question men omg ur such a manhater!s I will question them. I will also refuse to accept bullshit and lies as an explanation for why men should treat women like shit.,badwomensanatomy,czhtc4b,9,t5_2zlzd
6430964,0,t3_43drtr,I think people see finding posts that express bad ideas about womens anatomy as a kind of goodnatured competitive game.And just like using the throw in Street Fighter II visiting a subreddit like TRP is seen as an easy way to win. ,badwomensanatomy,czki0g5,0,t5_2zlzd
6431450,0,t1_czke5gt,I think we have a different  understanding of what clitoral stimulation with regards to the cause of orgasms. Increased  blood flow is not the stimulation but an effect of the stumulation. If I think sexy thoughts  or have sexy dreams that would be the stimulation. I am however not doing  anything directly to the clitoris to cause those feelings of arousal.,badwomensanatomy,czkjtks,6,t5_2zlzd
6431644,0,t1_czj3lqt,deleted,badwomensanatomy,czkkjkf,1,t5_2zlzd
6435198,0,t1_czd00qc,Okay...So Im a ft woman who weighs about lbs but am also quite curvy in body shape my back has a significant curve my hips are broad and my waist is very small.I physically do not fit into mens trousers. Theyre too big everywhere too long too big in the waist too baggy in the legs they gap at my back regardless of whether they actually fit my waist and hips they are too big. Boys trousers dont fit over the curves of my body theyre too small to fit over my hips or my arse because boys simply do not have the same body shape as either men or women. There is no possible way I could wear mens trousers because trousers like most clothes are usually made to fit the most common size range and for men that really doesnt include ft tall with a in waist and broad hips. Sure there are probably men with those measurements but they are very much the minority. By contrast while I often need to shorten womens trousers they are more commonly designed to fit the measurements of my body. ,badwomensanatomy,czkxret,2,t5_2zlzd
6445611,0,t3_43p3r9,so if the wedding night means breaking the hymen does that mean you just fucked your own marriage too?,badwomensanatomy,czm0lm4,3,t5_2zlzd
6452927,0,t1_czmr5db,To be fair Ive thought of stranger ideas like getting a Super Soaker or pump or something and try to douche out all the blood.,badwomensanatomy,czmrw0p,42,t5_2zlzd
6516913,0,t3_44lk02,Weird misinformation aside that product name makes me cringe. Femmycup why ,badwomensanatomy,cztee48,3,t5_2zlzd
6530986,0,t3_452dw0,And if were talking about the hpv vaccine remember that its just as important to get if youre a man! Not only is hpv linked to throat cancers in men but men can also be carriers possibly causing cervical cancer in women ,badwomensanatomy,czuut83,24,t5_2zlzd
6595022,0,t1_d00nn2e,he wont because hell leave it to a beta orbiter to pay for the kids.,badwomensanatomy,d01h9pb,15,t5_2zlzd
6627771,0,t1_d04cq9x,Logic!,badwomensanatomy,d04va45,2,t5_2zlzd
6640602,0,t1_d060w39,Will learning the basics of womens anatomy teach me how stimulating womens prostates are? I really need to know.,badwomensanatomy,d06725p,116,t5_2zlzd
6645322,0,t3_44gt5u,Bless his heart! I bet this poor man grew up in one of the abstinence only education states and never received any real information in sex ed. I got sex ed in one of those states and boys werent separated from girls after th grade but all they ever taught was diseases and dont have sex. Thank God he did eventually ask though hopefully if he ever has children he can pass on his willingness to learn these things.,badwomensanatomy,d06omxo,1,t5_2zlzd
6647565,0,t1_d04d5kl,Not a med student but youre right. Men are more likely to die due to genetics. Women have two x chromosomes which means if theres a defect on one of them they could still be OK because they have another one. So a lot more baby boys than baby girls die. Other than that theres social conditions men are more likely to drink smoke have risky jobs get into accidents etc. Id also like to point out that if a young person dies this shortens the average life span dramatically. If you look at the life expectancy after the age of  the difference between men and women is much less dramatic. ,badwomensanatomy,d06wzko,3,t5_2zlzd
6651050,0,t1_d071r29,I was thinking the same thing lol.,badwomensanatomy,d079y3f,7,t5_2zlzd
6651233,1,t1_d071i5o,Porn,badwomensanatomy,d07amn8,-1,t5_2zlzd
6679921,0,t3_4750zm,removed,badwomensanatomy,d0a9grg,1,t5_2zlzd
6688309,0,t1_d0ay9f0,Can she press charges for his incompetence? Id personally want the rapist in jail more than Id want money but hes ruined that...,badwomensanatomy,d0b4of6,129,t5_2zlzd
6688925,0,t1_d08uxyj,But come on this is the source cited for that.screenshot in case my computers just being dumb,badwomensanatomy,d0b6z2l,2,t5_2zlzd
6706532,0,t1_d0czuti,Vocabulary   LEVEL UP!,badwomensanatomy,d0d0hhq,19,t5_2zlzd
6760646,0,t1_d0htkv2,Ditto. Honestly I had subbed to this sub because most posts are funny but this one? This post is really just people getting pissed about a bad tasteless joke. It smacks of SRS type manhating. People need to realize some genitals are ugly. And some are more attractive. Those definitions are going to be different for everyone. I think thats an ugly pussy. Does that matter in the long run? Hell no. But neither does someone elses opinion that is beautiful. The guy made a joke. Was it funny? No. Was it offensive? To some yes. But does it matter? Not really. Im sure there are plenty of people in this sub who have commented on the attractiveness or lack thereof of a guys dick with their friends or even on reddit. How is that different than what this? Should they be brigaded? No. Everyone needs to take a step back take a deep breath maybe get some water and move on. Im actually ashamed of this sub.,badwomensanatomy,d0ilvog,-5,t5_2zlzd
6762291,0,t1_d0iq3rv,The clitoris doesnt even have sick combos he might trigger by accident either.,badwomensanatomy,d0is89b,64,t5_2zlzd
6806672,0,t1_d0kr42z,Wait I was taught med school that episiotomies can prevent natural tears into the anal sphincter? Is this wrong?,badwomensanatomy,d0nty7b,1,t5_2zlzd
6849003,0,t1_d0sd9ug,Fruits arent even that healthy relative to vegetables if only because theyre full of sugar. Most people could do with more of both but if I had to pick one Id pick vegetables.,badwomensanatomy,d0sn3yx,43,t5_2zlzd
6865260,0,t1_d0txiy8,Yewwww,badwomensanatomy,d0uhkhv,14,t5_2zlzd
6868121,0,t1_d0usl66,Aaand this is why childfree gets a bad reputation when most of us just dont want kids. Ugh.,badwomensanatomy,d0ut997,56,t5_2zlzd
6873166,0,t1_d0vb3vl,ALA doesnt convert very effectively to DHA at all.Creatine supplementation improves cognitive ability especially in vegetarians which suggests that they arent getting enough normally. And it also helps their musclesCarnosine helps prevent aging. ,badwomensanatomy,d0vdw9q,1,t5_2zlzd
6873861,0,t1_d0vb15h,If you could cite another research paper I would find it very interesting to read.,badwomensanatomy,d0vgqwy,4,t5_2zlzd
6903839,0,t1_d0tzo22,A refreshing treat during the summer!,badwomensanatomy,d0yvb29,10,t5_2zlzd
6904450,0,t1_d0yuhdl,gt sitting in your own messAs opposed to having your own mess inside of you? Its just period blood. Period blood is not dirty. You can relax.Also no they dont really smell I come from a country where every woman I know wears pads and I have never ever not once smelled someone elses period blood.And I hope you wash your vulva once every several hours on your period irrespective of what method you are using.Edit  washcleanwipe your vulva with toilet paper whatever floats your boat. I dont want to opine on which is better it depends on you.,badwomensanatomy,d0yxszp,41,t5_2zlzd
6911981,0,t3_4adytj,Woah his post history is...cringeworthy. ,badwomensanatomy,d0zslgv,10,t5_2zlzd
6972114,0,t1_d16d6se,... fleshlight?,badwomensanatomy,d16mk6b,1,t5_2zlzd
6996857,0,t1_d194xmo,gt girls who dont feel pleasure from sex wants to have more sexTo be fair that does actually apply to genuine sex addicts men too. But there is a big difference between liking a lot of sex and being a sex addict. ,badwomensanatomy,d19fqsp,27,t5_2zlzd
7004190,0,t1_d18h6b3,No its just toxins he need to do a day fast with only water and seeded grapes.,badwomensanatomy,d1a9pnw,47,t5_2zlzd
7006274,0,t1_d1aa1f9,Im not letting my kids go through life clueless. My sons are  amp . They already know age appropriately whats going on. Im raising boys who can easily go to the store amp pick up padstampons if their SO needs some. ,badwomensanatomy,d1ai859,18,t5_2zlzd
7012658,0,t3_4bns1k,Uhh... As a guy Im pretty sure that my wife has some shitty back pain because of her boobs... As the main cause. cause yknow spines and muscles tend to hurt when theres sustained pressurestrain on them... Like every minute shes standing up.,badwomensanatomy,d1b8di9,19,t5_2zlzd
7019864,0,t1_d1bwq2n,The opposite of this is when a guy will refuse to use more than a finger or two. Like please you think your one finger is going to do anything? I use something that big  for  days a month.,badwomensanatomy,d1c1v7h,112,t5_2zlzd
7042458,0,t1_d1e7an5,Why would someone limit their potential partners that way? Small dicks are just as fun to play with as large ones in my experience.,badwomensanatomy,d1embnj,6,t5_2zlzd
7055023,0,t1_d1fzd5o,Wouldnt a nice warm baked potato  feel better? Plus you wont get gonorrhoea. ,badwomensanatomy,d1g1o3d,11,t5_2zlzd
7060949,0,t1_d1gdhyk,Good grief I have absolutely not been wiping the whole area and am honestly stunned that this is a practice so common it has to be explained to grown women!  Yes I can understand it in little kids like the parent in the OP who was having trouble with a fractious four year old but I suppose I assumed kids would work it out for themselves past a certain age.  Three areas three places to wipe seperately.  I honestly never questioned the common senseness of this before today but clearly its a thing after all!Yes honeymoon cystitis I learned all about in my teens.  And to me it made perfect sense what with everything getting squished around and mixed up down there especially if its the first time youre trying stuff.  I assume I learned it all from friends tho its possible I learned it in school but Im pretty sure it wasnt a teacher who pointed out that a firm refusal was in order if a partner wanted to move from anal to vaginal without changing the condom!  Thinking about it this was the s and the height of the AIDS scare.  Perhaps everyone was talking about STDs and infections more openly than at other times?  Im not sure.,badwomensanatomy,d1gpwlu,5,t5_2zlzd
7062995,0,t1_d1gpwlu,I taught my daughter to wipe front to back when she was just learning. But yeah a grown woman can manage to wipe separate areas separately from any angle. Its the idea that non contamination is the goal thats important. Dunno why people think fronttoback is gospel.,badwomensanatomy,d1gy9n2,5,t5_2zlzd
7094543,0,t1_d1ki26x,I think hes assuming the stereotype about Asian men having smaller penises is true. Ergo Asian women havent been stretched out even if theyve had sex. ,badwomensanatomy,d1kjaxk,44,t5_2zlzd
7109181,0,t3_4coryx,Sour pussy bitches you make the rockin world go round!,badwomensanatomy,d1m7dvf,6,t5_2zlzd
7111998,0,t1_d1mfc4j,Ages ago? I have an  year old and occasionally we will consult the website so hes not getting superfrank answers straight from mom.Only occasionally with stuff I would rather not admit to him I know off the top of my head like what a blumpkin is supposed to mean. Plus I figure having someplace he can turn when he doesnt feel comfortable asking me or dad about something is a good idea. Trying to avoid crapatomy in the future.,badwomensanatomy,d1mj97q,2,t5_2zlzd
7145920,0,t1_d1qex9u,Is there a trick to it? Do I only develop the necessary muscles when Im lactating?,badwomensanatomy,d1qezow,7,t5_2zlzd
7161865,0,t1_d1s7ic5,Almost there.,badwomensanatomy,d1s8h6t,12,t5_2zlzd
7176052,0,t1_d1pyyu9,The rest of it goes into your vagina bucket duhhhhh,badwomensanatomy,d1tunkm,7,t5_2zlzd
7180319,0,t1_d1s65z1,that guy was a state senator.,badwomensanatomy,d1uc6z6,5,t5_2zlzd
7221401,0,t1_d1ye5qt,I dont know about that. When Louis CK was a kid he used to think guys lost a testicle whenever they had sex. Thats not sexist its just incorrect. Its not crazy to see why someone who doesnt know that much about vaginas might think that they can be stretched like that but fortunately vaginas remain perfectly fine. I dont think these people have ill intent as much as they dont know how vaginas work,badwomensanatomy,d1z0o98,-5,t5_2zlzd
7264983,0,t1_d23wy7u,gtUrea is present in sweat too and we dont consider that to be our skin peeingMaybe we should! I went for a run yesterday and my skin was pissing like a racehorse!,badwomensanatomy,d23z6xv,63,t5_2zlzd
7266518,0,t1_d240s4f,Ah yes my biggest fantasy. Being picked up like a goddamn bowling ball.,badwomensanatomy,d245hw9,26,t5_2zlzd
7273698,0,t1_d24yo5u,Or I could browse whatever sub I please. ,badwomensanatomy,d24yyl6,-13,t5_2zlzd
7276039,0,t1_d252p3m,You know youre a huge asshole when even the redpill community thinks youre an idiot... ,badwomensanatomy,d258j9x,15,t5_2zlzd
7309664,0,t1_d28fwnf,I never sat down I laid down. Haha! ,badwomensanatomy,d2924w9,2,t5_2zlzd
7381804,0,t1_d2h9by0,Slurpslurp,badwomensanatomy,d2h9enh,47,t5_2zlzd
7384402,0,t3_4gh1xo,good catch. you know what they say  give a man basic anatomical education and hell have a healthy understanding of sex but teach a man a false sense of superiority and hell invent his own narratives. thats a saying right?anyway this video is good for addressing hymen myths and how theyre not just inaccurate theyre harmful.,badwomensanatomy,d2hk1dt,246,t5_2zlzd
7413598,0,t1_d2kqnkm,deleted,badwomensanatomy,d2kvlqw,9,t5_2zlzd
7450092,0,t1_d2ozlur,It was on my th bday back in February. He was mad that I was mad because he was just asking a question and I was being insecure and overreacting paraphrasing him. So no I doubt he even remembers. And honestly its illogical for me to have been as messed up by it as I am because he truly wasnt being mean on purpose and would never ever say I looked fat old unattractive  etc....he was being clueless but not cruel.Feelings arent ethical decisions though and I still feel really shitty about it  months later.,badwomensanatomy,d2p11hk,39,t5_2zlzd
7462754,0,t1_d2qg73v,Paying for the plastic and the branding really.,badwomensanatomy,d2qgw5v,6,t5_2zlzd
7465108,0,t1_d2qqgwv,Yes.,badwomensanatomy,d2qqj3r,4,t5_2zlzd
7504642,0,t1_d2uv9tc,Being wary of an incurable disease you are at risk of contracting and successfully avoiding it is pretty much the opposite of unhealthy actually.,badwomensanatomy,d2v8m86,-44,t5_2zlzd
7536090,0,t1_d2uhqlv,Heels on action characters is the worst for me. A person can fight naked easier than they can fight in heels. ,badwomensanatomy,d2ytesx,10,t5_2zlzd
7572467,0,t1_d329ri4,I came out that way. Oops. My poor mum. ,badwomensanatomy,d32yatd,5,t5_2zlzd
7581864,0,t3_4j569p,Stay in school kids.,badwomensanatomy,d340rcw,11,t5_2zlzd
7597592,0,t1_d35q4w7,Honestly when he called me racist I laughed so hard. His profile had  personal information. ,badwomensanatomy,d35t3mf,19,t5_2zlzd
7600512,0,t1_d35ltn8,it goes it goes it goes it goes....VAGINA BONES....YUH,badwomensanatomy,d3651nf,2,t5_2zlzd
7602546,0,t1_d3601ub,Do women really care about the floppiness of other womens vaginas?  The only people Ive ever seen to care about how tight a vagina is have been male.,badwomensanatomy,d36dcdv,3,t5_2zlzd
7616348,0,t1_d37wyvp,Our vaginas also wouldnt become massively loose with large labia from the miles of penis we would otherwise be having! Wow this idea is sounding better by the second! s incase someone actually believes this.,badwomensanatomy,d37xths,6,t5_2zlzd
7646184,0,t1_d3b9279,I think its a common theme on Reddit or at least subreddits that arent for women like this one and trollx. I may be wrong but thats been my experience. ,badwomensanatomy,d3bbvur,65,t5_2zlzd
7647866,0,t3_4k2c1e,Snapshots. This Post    I am a bot. InforSnapshillBot  Contactmessagecompose?torSnapshillBot,badwomensanatomy,d3biqw1,5,t5_2zlzd
7649512,0,t1_d3ba0ka,This is conjecture but perhaps the urge to pee goes away because its really not nearly as much fluid as would be in a full bladder when someone needs to go. At least for me its not really that much fluid that comes out when squirting. And I bet even if a person felt the urge to squirt but didnt let themselves they probably could pee a bit but dont necessarily need to yet.,badwomensanatomy,d3bpgwn,3,t5_2zlzd
7654993,0,t3_4k2c1e,are we allowing obviously joke posts now?,badwomensanatomy,d3cbw05,30,t5_2zlzd
7659136,0,t3_4k7r8y,Fuck thats not any fun at all. Also not correct at all. Grrr argh. ,badwomensanatomy,d3csthb,48,t5_2zlzd
7690477,0,t1_d3gcag3,Well a callus is specifically a buildup of the layer of dead skin cells caused by repeated frictionpressure on a specific area and mucous membranes dont have that layer.,badwomensanatomy,d3gcw5c,31,t5_2zlzd
7695623,0,t3_4knsg3,This man is a redpiller  in case anyone was wondering,badwomensanatomy,d3gxxrh,13,t5_2zlzd
7705830,0,t1_d3ht2ii,Im confused because the screenshot doesnt show the text thats quoted in the reply. Are we missing an edit?Nevermind its copied further up...with a special bonus from OP himself! ,badwomensanatomy,d3i3o2b,6,t5_2zlzd
