,controversiality,parent_id,body,subreddit,id,score,subreddit_id
8570028,0,t1_d6ctwd1,Nah Ive only got ordinary pink left now man,furry_irl,d6cu2fm,2,t5_3b66u
8642869,0,t3_4y95h9,Me too thanks.,furry_irl,d6lyvzt,7,t5_3b66u
8746158,0,t1_d6yn8ln,A diggity dog dong bong,furry_irl,d6yx9d1,11,t5_3b66u
8746380,0,t1_d6yuuxt,What are we doing,furry_irl,d6yy9gb,2,t5_3b66u
8755570,0,t1_d6zye4g,well i meanfirefox yiff IS pretty hot..,furry_irl,d703rkg,5,t5_3b66u
8854497,0,t1_d7c63vb,Thats actually my life,furry_irl,d7c6ofy,3,t5_3b66u
8993132,0,t3_53f7kh,Literally me right now,furry_irl,d7su2yf,6,t5_3b66u
9025825,0,t1_d7wlzo2,Dont worry Im only half way gay,furry_irl,d7wrgm9,1,t5_3b66u
9027344,0,t1_d7wxylo,lt I wouldnt call you an idiot ,furry_irl,d7wy10o,1,t5_3b66u
9052614,0,t1_d7zyzan,Both of those things. This is what the fandom does to you. It feels pretty great honestly. gt chubby furries attractiveTrufacts. The preference feels p goodgtincluding meOwO INTENSIFIES,furry_irl,d7zza4y,2,t5_3b66u
9052915,0,t3_546qcj,Didya make this yourself or do you have a source? ,furry_irl,d800l0z,7,t5_3b66u
9081092,0,t3_54i93l,Removed because the animal isnt at all obviously anthropomorphic making this more...idk kinda weirdly zoophilic than furry.  xIf Im an idiot and didnt notice something feel free to explain it to me but...yknow... ,furry_irl,d83eegs,1,t5_3b66u
9116560,0,t1_d87cba3,why,furry_irl,d87nvo8,4,t5_3b66u
9179855,0,t1_d8eit9i,If you look closely at the pixels you can see that it says Im a trash can so they cannot be a bee if they are a trash can trash cans are for furries only ,furry_irl,d8fm3ps,1,t5_3b66u
9200315,0,t1_d8i7gjk,uwu,furry_irl,d8i7ho7,16,t5_3b66u
9202032,0,t1_d8ievc9,but I wanted to to uwu ,furry_irl,d8ifbkn,4,t5_3b66u
9214629,0,t1_d8jp663,Bright cyan and neon green. ,furry_irl,d8k0tsn,12,t5_3b66u
9224606,0,t1_d8laar9,Oh,furry_irl,d8lac7g,1,t5_3b66u
9252213,0,t1_d8os8x2,gtKitsune  Yiff Yiff Yiff gt LapfoxUnofficial in Musicgt views since Oct bot info,furry_irl,d8os9jz,3,t5_3b66u
9259486,0,t1_d8pnl4j,No clue. I think a year or two somebody posted this on rfurry or rSERGALSERGALSERGAL and I saved it.,furry_irl,d8ppgey,3,t5_3b66u
9324670,0,t3_585w95,Win,furry_irl,d8xyyfb,20,t5_3b66u
9363784,0,t3_58s5gq,Nice knot my furry friend.,furry_irl,d92xd8t,10,t5_3b66u
9429901,0,t1_d9977hl,Yes yes yes your username is finally relevant!,furry_irl,d9baz1e,7,t5_3b66u
9441557,0,t1_d9cl6ld,you can knot tell me what to do,furry_irl,d9cs8op,4,t5_3b66u
9448570,0,t1_d9ccxbw,Same.,furry_irl,d9do7uy,1,t5_3b66u
9485188,0,t1_d9i90mg,Thats not how you prove itYou prove it by tying me down on a bed and fucking my lagomorphic heart out,furry_irl,d9i9484,2,t5_3b66u
9489249,0,t1_d9ir1gn,Then why was this dude implying that youre a wolf,furry_irl,d9ir43z,5,t5_3b66u
9573647,0,t3_5c2hbq,gtHard on the issues Is my butt one of the issues? ,furry_irl,d9t5bdy,71,t5_3b66u
9597311,0,t1_d9w1xqu,I dont really have any ideas sorryBut thanks that means a lot!,furry_irl,d9w2c9c,1,t5_3b66u
9610117,0,t1_d9xmz6j,Cocktorock,furry_irl,d9xn5z5,1,t5_3b66u
9613099,0,t3_5cn81e,On mobile late at light. I was wondering where the post was and then I realized it was this tiny ass strip of white.,furry_irl,d9y0f8z,11,t5_3b66u
9645195,0,t1_da1ykxx,Youre missing something important here.This is the internet. I am right and you are wrong. Now apologize. s,furry_irl,da1yx2i,1,t5_3b66u
9663185,0,t1_da46rpv,I just realized that one point of my comment it says duck a horse I made a typo  Im on my phone,furry_irl,da46ufu,1,t5_3b66u
9664350,0,t3_5dgllr,OwO Whats this?,furry_irl,da4c0f1,11,t5_3b66u
9664533,0,t1_da4b7bt,My mom knows Im a furry so she knew it was supposed to be a representation of myself. Shes pretty chill with the whole thing.,furry_irl,da4ctpf,11,t5_3b66u
9670919,0,t1_da555vp,Im not.,furry_irl,da556f5,8,t5_3b66u
9672388,0,t1_da5bo94,lt,furry_irl,da5bp40,2,t5_3b66u
9672993,0,t1_da553ql,Not all of the first is displayed,furry_irl,da5edum,2,t5_3b66u
9689690,0,t3_5duvvn,Mods are your friend random Google buddy.,furry_irl,da7gjts,23,t5_3b66u
9693420,0,t1_da7uunw,Oh shit ya thats a thing.  ,furry_irl,da7x4eo,2,t5_3b66u
9697233,0,t1_da8bbov,Well its just drawn stuff so i dont have a problem if you font tell me its just that i didnt enjoy it,furry_irl,da8e21l,2,t5_3b66u
9700182,0,t3_5dyl38,Lets be honest though we really only care about trying out that red knot on the bottom row ,furry_irl,da8r60i,27,t5_3b66u
9723580,0,t3_5e9osa,You came in the wrong neighborhood ,furry_irl,dabn6o2,6,t5_3b66u
9728444,0,t1_dac2qiy,Kek,furry_irl,dac8s76,1,t5_3b66u
9731815,0,t1_dac68fw,He had a roast me thread in the main furry sub afew weeks ago and most of the comments were along the lines of I love you too much to roast you. ,furry_irl,dacnpyz,3,t5_3b66u
9743031,0,t1_dae1awd,nope laundry detergent. ,furry_irl,dae1ha3,5,t5_3b66u
9745717,0,t3_5eo2t2,OwU,furry_irl,daede9f,6,t5_3b66u
9834402,0,t3_5fzes3,As long as it doesnt become a regular thing I suppose. ,furry_irl,dapg0xm,1,t5_3b66u
9839262,0,t1_dapwbr1,maybe it was a human twitter account,furry_irl,daq2ujm,24,t5_3b66u
9841285,0,t3_5g7zx6,I dont worship Sea Salt I see him more as a role model someone we all aspire to be. ,furry_irl,daqcc4p,25,t5_3b66u
9860556,0,t3_5cidb4,i just realized that my favorite movie reviewer is also a shitposting piece of furry trash...nice.,furry_irl,dasuqeq,2,t5_3b66u
9879368,0,t1_dava6i8,Np ,furry_irl,davazl0,13,t5_3b66u
9886067,0,t3_5gw2r3,,furry_irl,daw6esl,10,t5_3b66u
9904516,0,t1_dayjfgf,rawr X I like a fiesty one XP,furry_irl,daykyb6,3,t5_3b66u
9943417,0,t3_5hvkw3,What editor is that? I think GIMP has stuff like that but I dont think the UI is like gimp.,furry_irl,db3ngm7,5,t5_3b66u
9949648,0,t1_db4cxt5,I just had to quote that comment from the thread,furry_irl,db4gqw6,4,t5_3b66u
9988460,0,t3_5ijyfr,My man! ,furry_irl,db9ivfx,6,t5_3b66u
9988963,0,t1_db8td1d,Let the menu be a scrollable wolf with a huge dick but let the dick only be seen if you scroll a bit too much downThen yell at them for being rude to the wolf husbando,furry_irl,db9l88t,9,t5_3b66u
9994797,0,t1_dbaa50r,NSFW  and just what I wanted,furry_irl,dbacm6f,7,t5_3b66u
10020155,0,t3_5j4xd9,gtcaring about the sex of the furry on not just if they are cutenot furryirl,furry_irl,dbdnk6y,51,t5_3b66u
10022070,0,t1_dbdwemq,Sauce?,furry_irl,dbdwjek,2,t5_3b66u
10031078,0,t1_dbe9ri4,Likmaid we are just listing things on the box right?,furry_irl,dbf2rkn,9,t5_3b66u
10043652,0,t3_5jk388,This is my fetish.,furry_irl,dbgppag,27,t5_3b66u
10046599,0,t3_5jl9r0,deleted,furry_irl,dbh3iv9,1,t5_3b66u
10063368,0,t1_dbizmpa,enjoy,furry_irl,dbja4c4,5,t5_3b66u
10069057,0,t3_5jy4hw,Maybe I am overthinking this and Im bound to be disappointed but if you have a couple knots here and there in the Christmas tree lights to get a bunch of Christmas tree lights clumped together would it give off a cool mix of different colors? Assuming you have multicolored lights,furry_irl,dbk0rg3,12,t5_3b66u
10070068,0,t1_dbk5h5u,Exactly ,furry_irl,dbk5hwt,17,t5_3b66u
10077831,0,t1_dbl3qr9,Thanks ,furry_irl,dbl5us2,3,t5_3b66u
10109236,0,t1_dbom10b,Shh.,furry_irl,dbp8sut,3,t5_3b66u
10111607,0,t3_5ko3p3,Im not gay because Im furry thank you very muchIm gay because I love cock,furry_irl,dbpjvxa,38,t5_3b66u
10118763,0,t1_dbqf32h,gtcant afford costume or conventions so spend time being depressed and posting memes on Internet forums ,furry_irl,dbqhdjr,18,t5_3b66u
10121210,0,t1_dbp5c0c,Its its one of the guest comics,furry_irl,dbqsuay,5,t5_3b66u
10121285,0,t3_5kq2hl,Same,furry_irl,dbqt6yn,4,t5_3b66u
10137925,0,t1_dbsyvkl,Oh god noooo,furry_irl,dbsz533,9,t5_3b66u
10171132,0,t1_dbw6amk,Thank you.Damn thats an old song and video. I remember seeing that a long time ago,furry_irl,dbwycfw,1,t5_3b66u
10191192,0,t1_dbz8617,I can talk with one but I never suck just one dick you gotta go big or go home,furry_irl,dbz888w,7,t5_3b66u
10210324,0,t3_5m7m7w,Just another rfurry baptism,furry_irl,dc1ebiq,35,t5_3b66u
10212012,0,t1_dc1kzgu,gtand call it good god?,furry_irl,dc1l80d,3,t5_3b66u
10216053,0,t3_5m8qa0,Do not insult me and my culture like that,furry_irl,dc21png,9,t5_3b66u
10236549,0,t3_5ml8jj,Heres the template higher quality than the one in the postand heres the original post from rFellowKids that I shamelessly stole the pic from,furry_irl,dc4dbvj,7,t5_3b66u
10239592,0,t1_dc4fipc,When I was like  I wrote a ff fanfic where red xiii fucked aeris. I had never seen a dog dick before and wasnt aware of furry porn until a few months later.Long story short aeris pulled red fur off her tongue cus red had a hairy fuckin knob. ,furry_irl,dc4pr03,11,t5_3b66u
10242271,0,t1_dc4e6qd,Actually I am straight.Im a girl though so I still like dick so all is right in the world.,furry_irl,dc50o86,13,t5_3b66u
10298965,0,t1_dc6zfzs,Radicate ,furry_irl,dcbfz0p,3,t5_3b66u
10302621,0,t1_dcbp7w0,I feel like owo is a more casual version,furry_irl,dcbuvp4,14,t5_3b66u
10312845,0,t1_dcczsh6,He is a furry ,furry_irl,dcd0mqj,41,t5_3b66u
10320938,0,t1_dccyeb6,There will still be twats saying actually its been around since  and another twat saying actually it was established in  and another twat saying the fandom doesnt exist ,furry_irl,dcdxo80,2,t5_3b66u
10325584,0,t3_5nu0x6,STOP,furry_irl,dcegngq,1,t5_3b66u
10340482,0,t3_5nsk1e,Who would be upset over good deer art though?,furry_irl,dcg5i2t,2,t5_3b66u
10341491,0,t1_dcg3mde,Try living in Europe. Everything thats important is hella expensive.For example graphic cards cost  more than the Dollar price it would be sold in in euroes. And the euro itself is already stronger than the dollar.,furry_irl,dcg9mee,3,t5_3b66u
10346972,0,t1_dcgo7qi,Great ruse to get free porn of your fursona though.,furry_irl,dcgw0be,40,t5_3b66u
10364940,0,t3_5oezmf,c,furry_irl,dcixf2m,27,t5_3b66u
10368582,0,t1_dciyzbm,Praise DuARTe,furry_irl,dcjca3h,3,t5_3b66u
10369583,0,t1_dci7ijt,Me too thanks ,furry_irl,dcjgd0m,2,t5_3b66u
10410077,0,t1_dcnab96,You mean youre also named Kishia?,furry_irl,dco1t4n,2,t5_3b66u
10425754,0,t1_dcps6pn,Last comment was an hour ago RIP,furry_irl,dcpttgn,1,t5_3b66u
10437854,0,t3_5pdg0g,Just a heads up. There is a name above that first picture. Seems like you tried to scrub it out in most places but it isnt quite cut off at the top. ,furry_irl,dcr7cj8,1,t5_3b66u
10453823,0,t1_dcsz5n2,Fack you got me!  I have to take myself out sometimes. Its a garbadge job but someone gotta do it,furry_irl,dct1l9j,3,t5_3b66u
10463479,0,t1_dctxji2,Shit I meant Putin commissioned Trump. XDIm keeping that embarassing typo.,furry_irl,dcu5449,6,t5_3b66u
10482083,0,t1_dcw2qko,That channel was the best for stolen Waluigis,furry_irl,dcw93fi,4,t5_3b66u
10518781,0,t1_dcxy7c1,night mode on anything is way better than this blinding white ,furry_irl,dd0f1id,2,t5_3b66u
10525185,0,t1_dd0mna2,Hes even got a Zoroark on his team come on!,furry_irl,dd1576l,10,t5_3b66u
10530655,0,t1_dd1p6x2,MEDIOCRE!Lackadaisy Good shitTwokindsOzy and MillieFreefallJACK Because FUCK happinessKevin and KellAnd that was off the top of my head!Also I may have been drinking.  Wow does  beer add up fast.  Im going to apologize in advance.,furry_irl,dd1rjnp,5,t5_3b66u
10530827,0,t3_5qsexf,,furry_irl,dd1s8yl,7,t5_3b66u
10536649,0,t1_dd1vdh4,Inshahallah brother.May you live eternal in Paradise and smite many kafirs.,furry_irl,dd2g1x4,3,t5_3b66u
10540125,0,t1_dctuh1p,JRHNBR,furry_irl,dd2u9b4,2,t5_3b66u
10544423,0,t1_dd3bsxf,Beard Mage The defeat of the subscribers have died by now.  neatoranInfo | SubredditrUserSimulator,furry_irl,dd3btf8,1,t5_3b66u
10594044,0,t1_dd1s4e7,eroV,furry_irl,dd8ozhr,1,t5_3b66u
10623919,0,t1_ddbhof5,You could get away with any of them if youre shameless enough.,furry_irl,ddbryi9,9,t5_3b66u
10646287,0,t1_ddcnwn1,This guy gets it,furry_irl,dde2zma,1,t5_3b66u
10677655,0,t3_5sn04t,i never thought about it before but having to worry about what emotions your tail was displaying would cause so much anxiety,furry_irl,ddhbide,6,t5_3b66u
10689987,0,t1_ddid2ui,Its Youtube duh.,furry_irl,ddildai,9,t5_3b66u
10706757,0,t3_5t4v76,First reptile Ive ever seen with an ass like that.,furry_irl,ddkblyn,28,t5_3b66u
10714270,0,t1_ddl3c69,D,furry_irl,ddl3i7k,5,t5_3b66u
10759452,0,t3_5tql6d,Gahoole  lyfe,furry_irl,ddprasq,1,t5_3b66u
10759885,0,t3_5tx6rh,false and homosexual,furry_irl,ddpswng,18,t5_3b66u
10813986,0,t3_5umdq1,Ban vore,furry_irl,ddvdx8c,12,t5_3b66u
10828393,0,t3_5utnsb,Hot,furry_irl,ddwveti,10,t5_3b66u
10836341,0,t3_5un7ed,deleted,furry_irl,ddxox62,1,t5_3b66u
10841704,1,t1_ddy6ih7,I wouldnt mind dying this way,furry_irl,ddy8u5j,-1,t5_3b66u
10849600,0,t3_5v3rzm,Well it IS made of a fuzzy material,furry_irl,ddz25ka,1,t5_3b66u
10862344,0,t3_5v7o83,oh deer,furry_irl,de0dh7m,8,t5_3b66u
10863580,0,t3_5vaarm,Woah NSFW this please,furry_irl,de0i2cc,4,t5_3b66u
10872600,0,t1_de1fi55,,furry_irl,de1fjc4,18,t5_3b66u
10874698,0,t3_5vfha0,Enjoy a small assortment from my collection of cropped yiff. Imgur wont let me upload more than  images but I have a fuck ton so Ill get them up asap,furry_irl,de1nbuh,45,t5_3b66u
10886355,0,t3_5vjx1k,So many people in that thread denying theyre furry andor gay. It warms my heart. Well get them soon. ,furry_irl,de2ulx7,24,t5_3b66u
10892501,0,t1_de3exa9,Well thats gay,furry_irl,de3hfxh,4,t5_3b66u
10898300,0,t3_5vqytk, ,furry_irl,de42z2j,11,t5_3b66u
10899302,0,t1_de20u6e,Trashcans are actually useful thoughWhy cant i be a trashcan and not just trash,furry_irl,de46oxc,2,t5_3b66u
10906668,0,t1_ddyyzq0,i thought it was a trail of grease or cum,furry_irl,de4y1py,1,t5_3b66u
10937664,0,t1_de7xbxx,So not str at all? ,furry_irl,de856a0,4,t5_3b66u
10946702,0,t1_de90l7o,Hell yeah boi,furry_irl,de92pgr,4,t5_3b66u
10947362,0,t1_de91u6z,That must of cost a lot of Good Boy Points.    WincestFTW,furry_irl,de955nk,5,t5_3b66u
10949633,0,t3_5we275,My breath smells like bunny burst most of the time anyway.,furry_irl,de9dl6a,15,t5_3b66u
10952541,0,t1_de9mk3t,gtshould have seen it cummingFTFY,furry_irl,de9odiq,30,t5_3b66u
10956445,0,t3_5whk6j,Hello! Your submissionrfurryirlcommentswhkjfurryirl was removed for the following reasons This post doesnt meet our subreddits standards well enough for what constitutes furry. This rule generally applies to content that  only has nonanthro animals in it. This post has been deemed to not be relatable in the spirit of the irl style. It may just be a picture of a furry thing such as OC or news or it could be totally unrelated to both furry and irl.If you feel this is incorrect and would like to dispute it please feel free to message the mod team.,furry_irl,dea2v5w,1,t5_3b66u
10966630,0,t3_5wlfph,I wish I was that cool,furry_irl,deb4plj,20,t5_3b66u
11019628,0,t1_deh16nh,ah damnit i typed that in first before changing it to paper oh well.,furry_irl,deh1low,3,t5_3b66u
11070639,0,t3_5y26t2,looks like someone already took the username.you better live up to your name KnotMilker.,furry_irl,demuhlf,32,t5_3b66u
11094925,0,t1_depl9br,ltlt,furry_irl,depllzk,8,t5_3b66u
11101002,0,t1_degn95b,And I am uprzemko nice to meet you.,furry_irl,deqaesd,1,t5_3b66u
11103278,0,t1_deq1z7v,gt about inside jokesgt inside jokesgt insideOwO ,furry_irl,deqjpbb,7,t5_3b66u
11104413,0,t1_deqhq51,Someone super into Nickelodeon slime In all seriousness Im pretty sure he said it was like that when he got the house ,furry_irl,deqoc56,3,t5_3b66u
11108008,0,t3_5yjsmu,What is this from? ,furry_irl,der2zxz,4,t5_3b66u
11146850,0,t3_5z54vh,So uh.. Do you always read video game news in incognito tabs?,furry_irl,devhf32,21,t5_3b66u
11170820,0,t3_5zf4ki,Whats the header supposed to say?,furry_irl,dey788h,8,t5_3b66u
11181398,0,t1_dezec7o,No problem  ,furry_irl,dezeda7,5,t5_3b66u
11184984,0,t1_dezfxbl,Sure when and where?,furry_irl,dezsznv,5,t5_3b66u
11189528,0,t3_5zq52b,Oh man its Deerski lt,furry_irl,df0bisb,7,t5_3b66u
11206930,0,t3_5zwwqv,My waifu is the cactusona.,furry_irl,df2ajr4,9,t5_3b66u
11207162,0,t1_df27blj,Two is better than one.Especially when you have both at the same time. One on each end.,furry_irl,df2bhsq,23,t5_3b66u
11208706,0,t1_df2gmnj,thats hillarious. I had my steam name as Zero for several years until I switched it to Sans. Technically I just changed the language.,furry_irl,df2hssl,3,t5_3b66u
11212953,0,t3_601nte,Birb,furry_irl,df2z4bg,11,t5_3b66u
11216059,0,t3_603yef,Or you could take everything else off instead... ,furry_irl,df3brsw,44,t5_3b66u
11220899,0,t3_606mx8,What species is this supposed to be?,furry_irl,df3vi6r,2,t5_3b66u
11226342,0,t3_606x8a,I feel really conflicted whether I should upvote or downvote this.,furry_irl,df4hpej,20,t5_3b66u
11230265,0,t1_df4xl4r,I honest to God didnt notice that.Those fucks even taking over Undertale. ,furry_irl,df4xoy1,34,t5_3b66u
11239974,0,t1_df60huo,Irrelevant.,furry_irl,df619gm,41,t5_3b66u
11249749,0,t1_df6qi20,deleted,furry_irl,df7557y,5,t5_3b66u
11262830,0,t1_df8mgpm,Also can someone who is a vore aficionado please explain tinned why the idea of eating someone else is arousingIm able to understand why most fetishes are hot to some people i.e. I dont like watersports but it makes sense to me why people find it hot but not vore,furry_irl,df8mip8,14,t5_3b66u
11268561,0,t3_60t4aq,Im not gay and now I see it as a challenge.,furry_irl,df99wax,6,t5_3b66u
11273934,0,t1_df9ue8h,    ,furry_irl,df9vu0q,61,t5_3b66u
11296403,0,t1_dfbx8zo,deleted,furry_irl,dfcfifg,2,t5_3b66u
11298122,0,t3_6184o7,needs more jpeg,furry_irl,dfcmikh,7,t5_3b66u
11299189,0,t1_dfcm4z6,on all levels except physical i am an argonian,furry_irl,dfcqvfv,12,t5_3b66u
11306283,0,t1_dfdhwpo,Thoughts? I have terraria and havent ever seen the point of getting another game exactly like it.,furry_irl,dfdjtg0,6,t5_3b66u
11319636,0,t1_dff2291,OwO Seriously though this comic was me after I ordered a thing from BD.,furry_irl,dff28gl,21,t5_3b66u
11328565,0,t1_dfg0khf,,furry_irl,dfg2o6l,7,t5_3b66u
11334342,0,t3_61pwq1,new idea. what if they made a dragon dick water bottle?,furry_irl,dfgq7s6,33,t5_3b66u
11341456,0,t1_dfhhbae,DEPRESSION INTENSIFIES,furry_irl,dfhj8v0,17,t5_3b66u
11350953,0,t1_dfikzo9,Thats how it starts. Krystal is pretty hot. Shes blue and has this whole tribal thing and is often paired with Fox. Then youll start thinking about Foxs cute little twink butt. Then youll start thinking about Fox x Falco bromance. Eventually youll find yourself in a dark alley crying yourself to sleep as cant stop thinking about daddy Wolf ODonnell destroying Foxs tight little virgin butthole.,furry_irl,dfilyfz,31,t5_3b66u
11353434,0,t3_620plo,Whats the legal limit? Longest Ive been knotted for was the entire feature length of WreckitRalph,furry_irl,dfiw2qo,16,t5_3b66u
11356277,0,t3_61qns7,Lol but NV came out way before alt right was huge ,furry_irl,dfj7oit,1,t5_3b66u
11386888,0,t3_62ghgf,gtOne of the reasons why Im scared to buy Bad Dragon  m As someone who has gotten packages for years on a college campus no one cares whats in your package.,furry_irl,dfmonhn,15,t5_3b66u
11389675,0,t3_62j810,are you saying that those fourteen werewolves are only allowed to gangbang me in private?!,furry_irl,dfn01lo,83,t5_3b66u
11391026,0,t1_dflilhg,Yes. I have like  NampL packs,furry_irl,dfn5lm0,1,t5_3b66u
11400281,0,t3_62m50o,Source?,furry_irl,dfo7h74,3,t5_3b66u
11402365,0,t1_dfnsnpr,NeedsMoreJPEG.png,furry_irl,dfofzlj,3,t5_3b66u
11405705,0,t3_62m01d,god help us,furry_irl,dfotlvl,2,t5_3b66u
11407474,0,t1_dfp0uhb,PMd,furry_irl,dfp0uz3,6,t5_3b66u
11418520,0,t3_62z2e2,NSFW,furry_irl,dfqa02n,8,t5_3b66u
11439115,0,t1_dfsgizu,thank,furry_irl,dfsm2qh,11,t5_3b66u
11440944,0,t3_63ax3o,I saw a thing where someone said they turned into an animal while a demon possessed them.  Edit found it skip to ,furry_irl,dfstjno,7,t5_3b66u
11443953,0,t3_6384co,Morenatsu is the shit dawg ,furry_irl,dft5u0q,3,t5_3b66u
11463651,0,t1_dfulnu8,Michael were having a meetingYah but Jessica has that thin white top on today,furry_irl,dfvebxd,5,t5_3b66u
11465650,0,t1_dfvgm7l,Thanks  ,furry_irl,dfvmhyo,1,t5_3b66u
11472179,0,t1_dfvw8o2,Holy shit its real.,furry_irl,dfwd705,3,t5_3b66u
11473949,0,t1_dfw93se,deleted,furry_irl,dfwkflf,2,t5_3b66u
11475060,0,t1_dfwo9qr,Nice thanks dude. Will definitely research it further. Like very far and all.,furry_irl,dfwoz83,15,t5_3b66u
11480490,0,t3_63u33a,Palate Cleanser,furry_irl,dfxb6w3,27,t5_3b66u
11481265,0,t3_63u33a,No please no,furry_irl,dfxed69,5,t5_3b66u
11483160,0,t3_63wdur,Dat Ass ,furry_irl,dfxm4db,78,t5_3b66u
11485683,0,t1_dfwoh1y,Yeah thats how depression has always been for me.  I already have a really bad comfort eating habit basically I eat a yearolds dream diet and the depression makes it worse because while Im eating its one of the few moments that I dont feel shitty.Now Im on antidepressants and its completely killed my appetite and I hardly eat at all.  Whhyyyyy is there no middle ground ,furry_irl,dfxwfgl,2,t5_3b66u
11494382,0,t1_dfydf9f,ah alright nice. Ill look into that. Thank you.,furry_irl,dfyvybh,1,t5_3b66u
11495473,0,t1_dfy4j5f,Im a scaly ,furry_irl,dfz0emy,2,t5_3b66u
11500116,0,t1_dfzavk1,wash your fucking fursuit ,furry_irl,dfzjdkv,28,t5_3b66u
11519561,0,t1_dg1ochr,You monster.,furry_irl,dg1qse0,1,t5_3b66u
11528931,0,t3_64k4dv,Thats not Ronno.,furry_irl,dg2t1bf,4,t5_3b66u
11532740,0,t3_64jon6,no pls,furry_irl,dg38l5i,10,t5_3b66u
11533478,0,t1_dg3acrb,sorry thats udargonlovers job ,furry_irl,dg3blm9,16,t5_3b66u
11548367,0,t3_64t0pq,Not a single square baby  thats right not even the free space    ... why am I even here?,furry_irl,dg50dgy,25,t5_3b66u
11548555,0,t3_64sfp5,Feeling fullSunMaid knows just what I want,furry_irl,dg5155h,10,t5_3b66u
11549894,0,t1_dg541rz,Temeraire  Is a book series that asks the age old question of what if the countries in the napoleon war had an air force of dragons. Supposedly Peter Jackson wanted to do a movie on it but he said that before he started working on the hobbit so Im just hoping that he comes back to it.,furry_irl,dg56m99,3,t5_3b66u
11568009,0,t1_dg777ty,Thirded,furry_irl,dg78mi3,6,t5_3b66u
11568480,0,t1_dg6beln,Thats a shame say are you hungry?,furry_irl,dg7ajqn,22,t5_3b66u
11581278,0,t1_dg871jh,Yee,furry_irl,dg8qtga,1,t5_3b66u
11594015,0,t1_dga4gww,Not a true furry.,furry_irl,dga6uiu,35,t5_3b66u
11597332,0,t3_65gb8p,A large influx of bees ought to put a stop to that!,furry_irl,dgakdys,12,t5_3b66u
11597517,0,t1_dgaai59,gt because furries cant even make a subreddit dedicated to wholesomeness without including a sexual innuendo in the title.Oh come on me making little puns is knot that bad. Theres a certain flare to a dirty pun and furries have such a voreiety of things to work with.,furry_irl,dgal56d,3,t5_3b66u
11599595,0,t1_dgashkz,I think we could make this work...      ,furry_irl,dgatmoj,7,t5_3b66u
11611295,0,t3_65pgk1,Anthropomorphism is giving non humans human traits. So in a technical stance. We are the purest form of anthropomorphism. The term would then be redundent because humans would already have the traits before the term is applied.,furry_irl,dgc5f9j,36,t5_3b66u
11618137,0,t1_dgcwzuk,Oh wow thats what came up with reverse image search but I thought it was another edit haha. Thanks!,furry_irl,dgcxcvw,17,t5_3b66u
11620509,0,t1_dgd6tiw, citation needed  ,furry_irl,dgd71t8,7,t5_3b66u
11625747,0,t1_dgdpl87,Wasnt saying they were offensive I was saying they sounded tonally insulting and unlikely to produce conducive dialog. Which the poster himself freely admitted to. ,furry_irl,dgdsgr2,8,t5_3b66u
11634430,0,t3_660ie5,This is what this sub is supposed to be,furry_irl,dgerx8x,33,t5_3b66u
11644941,0,t3_65zpk2,MFW parents finds furry porn on laptop ,furry_irl,dgfyune,8,t5_3b66u
11687468,0,t1_dgjw6rv,Youre not alone. Probably the most terrifying meme to date.,furry_irl,dgksiz4,12,t5_3b66u
11696533,0,t1_dgltdd9,Mod bless you,furry_irl,dgltjmo,16,t5_3b66u
11719464,0,t1_dgoeuom,People here find super good porn and I dont want to type furry porn on google,furry_irl,dgofhfn,22,t5_3b66u
11720416,0,t3_678gbf,That sexy gurgling stomach acid,furry_irl,dgojd3m,2,t5_3b66u
11723721,0,t1_dgobroe,What about the man who ate another WILLING man? I forget how the story goes but you can google it.Im too lazy.,furry_irl,dgowwzq,3,t5_3b66u
11727596,0,t3_677r6w,So on a scale from normal human to fox how far can this rule be stretched?,furry_irl,dgpcqj0,6,t5_3b66u
11729992,0,t1_dgpmg07,Its really hard coming up with  separate scenarios for how to get your art done in increasingly brutal ways.,furry_irl,dgpmijy,19,t5_3b66u
11738398,0,t1_dgqiody,oof thats a tough one. Dragons and other like well known intelligent creatures will be fine mods will use their discretion on gray areas.,furry_irl,dgqksmk,21,t5_3b66u
11743353,0,t3_67ji81,Hello! Your submission was removed for the following reasons  The mods dont understand the purpose of the upvotedownvote system,furry_irl,dgr50e8,11,t5_3b66u
11750388,0,t1_dgrdwfd,Goodman Grey has joined your party,furry_irl,dgrxpdl,3,t5_3b66u
11754705,0,t1_dgseqlg,Well thats another upside of being a horse.,furry_irl,dgsfbsr,1,t5_3b66u
11758229,0,t3_67oihz,As long as they are red team. ,furry_irl,dgstpqr,1,t5_3b66u
11765908,0,t3_67vuy9,gtgirlHaha wtf is this,furry_irl,dgtp29k,71,t5_3b66u
11778517,0,t1_dguuy82,Username chcks out. However flair doesnt chck out.,furry_irl,dgv4rwk,5,t5_3b66u
11778651,0,t3_682meu,rfurryirlfurryirl,furry_irl,dgv5bl5,24,t5_3b66u
11780089,0,t1_dgv5lr2,Pssh youre not really into vore until you only look up furry hyper same size fatal goo hard CV that only involves your fursonas species and someones made up exotic predator thats been hastily drawn in MS paint.,furry_irl,dgvb75b,11,t5_3b66u
11786102,0,t1_dgvrmt1,Its me lets be friends ,furry_irl,dgvzsdq,14,t5_3b66u
11797725,0,t1_dgvda4w,The fuck is fatigue doing there. Sheen is a cat,furry_irl,dgxb9de,2,t5_3b66u
