,controversiality,parent_id,body,subreddit,id,score,subreddit_id
826461,0,t1_cgy109b,damn,fulltvshowsonvimeo,cgy7xol,1,t5_319kb
835432,0,t3_23n6jw,Thanks for the upload amazing quality. ,fulltvshowsonvimeo,cgz8orc,6,t5_319kb
891058,0,t3_246mvg,Yes yes yes! Thank you a lot!,fulltvshowsonvimeo,ch5kft7,1,t5_319kb
1042491,0,t1_chmf6ua,You are very welcome. ,fulltvshowsonvimeo,chmsapq,1,t5_319kb
1106187,0,t1_chu0o0z,deleted,fulltvshowsonvimeo,chu141v,4,t5_319kb
1108345,0,t3_26svon,The links are dead for me,fulltvshowsonvimeo,chu9yre,1,t5_319kb
1131774,0,t3_27329c,Thanks you so much!,fulltvshowsonvimeo,chwxn6u,3,t5_319kb
1162176,0,t1_cgr1bt2,deleted,fulltvshowsonvimeo,ci0d3uw,3,t5_319kb
1182050,0,t3_27fqxr, and  are the only ones working for me. Am I missing a Plugin maybe?Edit if I download them they play just fine!Thanks,fulltvshowsonvimeo,ci2lmah,4,t5_319kb
1323558,0,t3_27icwh,I was so pissed they canceled this,fulltvshowsonvimeo,ciiimph,2,t5_319kb
1365801,0,t3_27ic09,Interesting to see the difference in direction between the pilot and episode ,fulltvshowsonvimeo,cinhqna,2,t5_319kb
1458079,0,t1_chi5inz,unfortunatly  is a gona ,fulltvshowsonvimeo,ciz1n9l,1,t5_319kb
1655335,0,t3_2d8s7j,Rule  from the sidebar. Rehost to Vimeo or Google Drive please.,fulltvshowsonvimeo,cjnth1t,1,t5_319kb
2326337,0,t3_2j2z9z,Thanks for posting Man God bless u.,fulltvshowsonvimeo,clz8yos,1,t5_319kb
2421609,0,t1_cmb0n86,Can you take a screenshot and post it? I havent seen this error before.,fulltvshowsonvimeo,cmb0piv,1,t5_319kb
3666681,0,t1_cqa7s07,Yes  New leak since yesterday night.,fulltvshowsonvimeo,cqa85p8,2,t5_319kb
3803767,0,t1_cqpu4qw,Old and new,fulltvshowsonvimeo,cqpuyve,9,t5_319kb
4202265,0,t3_38z7c3,deleted,fulltvshowsonvimeo,crz907m,-6,t5_319kb
4668579,0,t3_3eq4bu,I love you so much thank you,fulltvshowsonvimeo,ctj107x,2,t5_319kb
6597245,0,t1_d00ay8m,,fulltvshowsonvimeo,d01pjh6,2,t5_319kb
7128943,0,t3_4c8reu,Its been removed  any way you could fire it back up before the finale tonight?,fulltvshowsonvimeo,d1ohb0m,1,t5_319kb
7292986,0,t1_d26tvlb,Me neither. Thats why i made this request,fulltvshowsonvimeo,d275wey,1,t5_319kb
7761122,0,t1_d3oajnb,No problem.,fulltvshowsonvimeo,d3odo16,1,t5_319kb
7849319,0,t3_4mr1g5,I know youve been thanked already but thank you again for uploading these if it werent for you my job would have made me miss the last two episodes! ,fulltvshowsonvimeo,d3yc04l,1,t5_319kb
9552333,0,t1_d9qduxz,nope its not. they ask you to sign in now.,fulltvshowsonvimeo,d9qithe,2,t5_319kb
9929649,0,t3_5gwrn1,removed,fulltvshowsonvimeo,db1ux1j,1,t5_319kb
10161187,0,t3_5kwsdm,removed,fulltvshowsonvimeo,dbvts7y,1,t5_319kb
10296653,0,t3_5mu8yr,its everywhere already,fulltvshowsonvimeo,dcb6jj5,1,t5_319kb
11514303,0,t1_dg0pt92,Thank you very much for the fanTAStic show but its still only allowing p. Is there something I have to do to make it load p?Edit Now that I think about it theres no way that mb  minute video files could eventually be p. Are you sure you got the right files OP?,fulltvshowsonvimeo,dg15c14,2,t5_319kb
