,controversiality,parent_id,body,subreddit,id,score,subreddit_id
8404898,0,t1_d5s3lkk,Thanks I guess if I stick with the Kindles ill have to just do the update manually from there each time.,YooLotto,d5s5oww,1,t5_3fkdy
8418056,0,t3_4uxxak,Im getting it.  Instead of the annoying big gray play button on Checkpoints amp Perk now I get a little one.  FML,YooLotto,d5tstfu,1,t5_3fkdy
8447498,0,t1_d5xgx8c,I do too the only difference is mine are correct Once you reread what I said  or  times youll see YOUR error and see that Im correct.  Or you wont bother because youre probably a lazy entitled millennial who is never wrong and gets triggered when someone calls you out on your bullshit online.Either way Im done with you youre clearly an idiot.  All doubt of that has been removed.,YooLotto,d5xh3bp,-1,t5_3fkdy
8502664,0,t3_4w5zzw,cripes looks like this one is locked down with Googles Android Device Protection. Basically even doing a factory reset doesnt wipe the google account associated with the device.,YooLotto,d64dx93,0,t5_3fkdy
8541857,0,t3_4wr72n,If youre ever thinking your payment got lost or has been delayed for more than a few days feel free to send me a PM. However do realize that they dont send payments over the weekend. So if you redeem at noon on Friday you wont get paid till MondayTuesday.,YooLotto,d69aumn,5,t5_3fkdy
8693715,0,t1_d6prf51,Im running all Pixi Glitz and pulling in an easy  a day with them right now. ,YooLotto,d6scefz,0,t5_3fkdy
8835794,0,t1_d79xs12,removed,YooLotto,d79xs3r,1,t5_3fkdy
8972847,0,t1_d7pj473,  . on YooLotto      . on RewardableSomeone do the math but I feel that YooLotto still has the upper hand. Even more so that they actually pay their users.... Edit If I mathed right on almost  sleep.... You have to watch  videos on RTV to get . whereas YooLotto is only  to get ..,YooLotto,d7qefbl,2,t5_3fkdy
9090058,0,t3_54s743,Theyve made their money.  Time for them to bail.  They claimed all payments would be resolved by Monday and now we know how good their word is.  ,YooLotto,d84h852,6,t5_3fkdy
9211890,1,t3_56iwfz,deleted,YooLotto,d8jobup,2,t5_3fkdy
9516848,0,t3_5b6mxp,I have upgraded  phones to . and ran them for an hour and with an almost constant stream of ads earned a whole  YooBux. I think you might want to check your update cause there is no way that can be right.,YooLotto,d9m5kax,7,t5_3fkdy
9755335,0,t1_dafh8qu,deleted,YooLotto,dafkanx,1,t5_3fkdy
9757640,0,t1_daemrxg,? youre being generous. as dude below me stated there are people with .money maker for automating is swagbucks though ,YooLotto,dafuiq2,2,t5_3fkdy
9974818,0,t3_5i6t39,My  redemption is still not paid. Not sure what the issue is... ,YooLotto,db7qvcr,2,t5_3fkdy
9994575,0,t3_5ir22p,Norwegian air too.  Theyve taken over all my devices.EDIT  Force closed the app and restarted it and the static ads appear to be gone for now.,YooLotto,dbabkoe,3,t5_3fkdy
10047927,0,t3_5jlu43,fraudulent activity?  Using VM to emulate an Android phone? VPN?,YooLotto,dbh9r30,1,t5_3fkdy
10098611,0,t3_5kdayu,Norwegian air hot wheels dior.These have been showing up for the last two weeks.,YooLotto,dbnv35d,1,t5_3fkdy
10176612,0,t1_dbopyw4,FYI Might want to get the programmer who claims she does best practices to read some documentation before pushing your entire codebase to the world,YooLotto,dbxkppw,2,t5_3fkdy
10412771,0,t3_5oe0fy,Hello urpma are you still experiencing this issue  If so would you send us a screenshot of this to us?,YooLotto,dcocswd,2,t5_3fkdy
10640233,0,t1_ddd0wwu,Well contrary to popular belief YL doesnt get paid any extra for redirect links thats HTML .  If there is a redirect link that goes to a page to purchase a product and someone buys something from that page then there is a commission.  Its called affiliate marketing.  Theres nothing extra for YL just for a redirect alone,YooLotto,dddgims,0,t5_3fkdy
