,controversiality,parent_id,body,subreddit,id,score,subreddit_id
5711,0,t3_1u6wwh,From rwomenofcolorgifs ,WomenOfColour,cef3573,1,t5_2skhs
978673,0,t3_25ae6f,She is what we used to call a fox,WomenOfColour,chfj7uw,2,t5_2skhs
1136720,0,t3_273qq1,I see what you did there,WomenOfColour,chxhp3p,1,t5_2skhs
3141469,0,t3_2w32oh,Yeah we like her. Who is she?,WomenOfColour,conlzcd,2,t5_2skhs
3388380,0,t3_2yyfwk,This beauty have me jungle fever! Any more of her? ,WomenOfColour,cpei3ca,2,t5_2skhs
3787180,0,t3_33r884,Gorgeous!,WomenOfColour,cqnyvp0,1,t5_2skhs
4649801,0,t3_3elvck,Who is she?,WomenOfColour,ctgo49c,3,t5_2skhs
4683996,0,t3_3f3ko7,Xpost from rComplexionExcellence,WomenOfColour,ctkyp30,1,t5_2skhs
4913748,0,t3_3i6w31,NOICE ,WomenOfColour,cudwxrk,1,t5_2skhs
5328628,0,t1_cvs5snz,deleted,WomenOfColour,cvssksi,1,t5_2skhs
5422297,0,t3_3p87c9,lost interest on frontal pics,WomenOfColour,cw4r75w,1,t5_2skhs
5980036,0,t3_3xcitt,Wow who is this girl?,WomenOfColour,cy3iiin,4,t5_2skhs
6385647,0,t3_432mpc,Those arent amazing tits. Especially with the implant scars,WomenOfColour,czfhb5h,1,t5_2skhs
7793084,0,t1_d3rxd47,Her IG is a little better,WomenOfColour,d3s015h,1,t5_2skhs
8072207,0,t1_d4m5med,Whaaaat the hell this sub is the best,WomenOfColour,d4ne4ry,0,t5_2skhs
8990757,0,t3_53bzs2,Because white is a color right?,WomenOfColour,d7sjtye,-2,t5_2skhs
9072028,0,t1_d7ypriz,Thank you very much!,WomenOfColour,d82b71h,1,t5_2skhs
10457756,0,t3_5pqzpq,Little better pic since it shows her twice.,WomenOfColour,dcthpeh,6,t5_2skhs
10720776,0,t3_5tbkx3,This should be a crime dammit thats nice ,WomenOfColour,ddlropo,3,t5_2skhs
11289881,0,t3_612ryn,removed,WomenOfColour,dfbowvk,1,t5_2skhs
11482526,0,t3_63ucgc,Who knew oatmeal could be so fattening?,WomenOfColour,dfxjj04,1,t5_2skhs
11601106,0,t3_65j2gf,Magnificent! ,WomenOfColour,dgazszy,4,t5_2skhs
11647517,0,t3_665o4n,Shes not even in the water. How does she ever expect to get clean like that?,WomenOfColour,dgg9der,1,t5_2skhs
