,controversiality,parent_id,body,subreddit,id,score,subreddit_id
1153851,0,t1_chzf780,I smile lovingly up at you.,HogwartsRP,chzf9h7,1,t5_2ygix
1154085,0,t3_27c3ih,Hey there. Welcome to Hogwarts.,HogwartsRP,chzg7sx,1,t5_2ygix
1156886,0,t1_chzrjju,I know. I love you. You are one of the five I do not despise.,HogwartsRP,chzrlo9,1,t5_2ygix
1163333,0,t1_ci05wmc,There is nothing wrong with that.,HogwartsRP,ci0ht25,1,t5_2ygix
1167454,0,t1_ci0x7dr,That was while I was away I think,HogwartsRP,ci0yitq,1,t5_2ygix
1167836,0,t1_ci0zgn2,I blush.,HogwartsRP,ci102k8,1,t5_2ygix
1173561,0,t1_ci1n5dp,OOC It wont let me play it on mobile.,HogwartsRP,ci1n9dw,1,t5_2ygix
1174130,0,t1_ci1pjh1,Ill meet you there.,HogwartsRP,ci1pkak,1,t5_2ygix
1176036,0,t1_ci1x8oi,he moans slightly and starts talking not even thinking about what hes sayingOh God Em! You are like a goddess!,HogwartsRP,ci1x9zb,1,t5_2ygix
1177291,0,t1_ci22cj1,Amy Pond. Character from a TV show.,HogwartsRP,ci22cup,1,t5_2ygix
1177380,0,t1_ci22mhn,I smile. Glad to hear it.,HogwartsRP,ci22pt0,1,t5_2ygix
1177765,0,t1_ci249km,We could go grab some.,HogwartsRP,ci24a0r,1,t5_2ygix
1177849,0,t1_ci24lvs,Are you sure? Im taking up a lot of the bed.,HogwartsRP,ci24ma2,1,t5_2ygix
1177860,0,t1_ci24fh1,Because it was terrifying,HogwartsRP,ci24nvv,1,t5_2ygix
1178532,0,t1_ci27ced,I say nothing lost in thought and yet wishing I knew something to comfort you.,HogwartsRP,ci27ds6,1,t5_2ygix
1178616,0,t1_ci27ows,Oh? Do enlighten me.,HogwartsRP,ci27q0j,1,t5_2ygix
1185449,0,t1_ci2uw2d,Oh. Why did you leave?,HogwartsRP,ci2zcwk,1,t5_2ygix
1192043,0,t1_ci3q1yh,I follow,HogwartsRP,ci3q274,1,t5_2ygix
1192327,0,t1_ci3r6ti,Oh.,HogwartsRP,ci3r7j4,1,t5_2ygix
1192911,0,t1_ci3tdaq,He nodsYgot that right.,HogwartsRP,ci3tkoy,1,t5_2ygix
1193067,0,t1_ci3u2n3,Thats pretty awesome.,HogwartsRP,ci3u7g1,1,t5_2ygix
1195194,0,t1_ci40sfz,i kiss you lightly and close my eyes,HogwartsRP,ci42teb,1,t5_2ygix
1196953,0,t1_ci49pbc,Ooooh.,HogwartsRP,ci49xj0,1,t5_2ygix
1199840,0,t1_ci4avww,i put my arms around you,HogwartsRP,ci4lmhc,1,t5_2ygix
1204159,0,t1_ci531u2,It IS a mini you! Down to every last detail even your wand. And watch this! I snap my fingers and your mini me climbs up to my shoulder and jumps off parachuting down,HogwartsRP,ci533tp,1,t5_2ygix
1204456,0,t1_ci548zi,Oh alright. Then...yeah Ill consider doing that on top of Quidditch players!,HogwartsRP,ci54b3m,1,t5_2ygix
1205344,0,t1_ci57ux3,Thank you!,HogwartsRP,ci57wmp,1,t5_2ygix
1205951,0,t1_ci5ac1f,Which one...?,HogwartsRP,ci5adbm,1,t5_2ygix
1208754,0,t1_ci5lplo,And a lot of them see Muggles as less than us.,HogwartsRP,ci5lpxn,1,t5_2ygix
1208811,0,t1_ci5lwpp,Cheese curse?,HogwartsRP,ci5ly9g,1,t5_2ygix
1208814,0,t1_ci5lxad,I smile when I see it.,HogwartsRP,ci5lyp6,1,t5_2ygix
1208829,0,t1_ci5lyio,Oh ...,HogwartsRP,ci5m0w2,1,t5_2ygix
1208871,0,t1_ci5m6qe,I am in total shock You understood that!?,HogwartsRP,ci5m70g,1,t5_2ygix
1209178,0,t1_ci5nakk,I roll my eyes and step into the fire.,HogwartsRP,ci5nfs4,1,t5_2ygix
1209253,0,t1_ci5no37,winces a little before peering at you Hmmm?,HogwartsRP,ci5nqpn,1,t5_2ygix
1209281,0,t1_ci5nqej,Why would i not,HogwartsRP,ci5nush,1,t5_2ygix
1209892,0,t1_ci5q5w7,Whispers back I love you too.,HogwartsRP,ci5qbx3,1,t5_2ygix
1211975,0,t1_ci5ynz4,I smile and stop the tickling That sounded like you meant it.,HogwartsRP,ci5yrok,1,t5_2ygix
1219536,0,t1_ci6tcx5,OOC Its such an awful feeling. ,HogwartsRP,ci6te1l,1,t5_2ygix
1220094,0,t1_ci6veu6,Nno? I hug your arm not wanting to move.,HogwartsRP,ci6vncd,1,t5_2ygix
1223980,0,t1_ci7bdgy,I see that laugh. I grin my fingers again slowly dancing along your ribs,HogwartsRP,ci7be1w,1,t5_2ygix
1226721,0,t1_ci7mglg,I try to beat my quota.,HogwartsRP,ci7mhbc,1,t5_2ygix
1231336,0,t1_ci854g1,The...nightmares. ,HogwartsRP,ci8555y,1,t5_2ygix
1232445,0,t1_ci89fzk,I dont let go. What for?,HogwartsRP,ci89mmf,1,t5_2ygix
1232851,0,t1_ci8b5da,He nods and smilesWeve met before Chris. Good to see ya again.,HogwartsRP,ci8b9rd,1,t5_2ygix
1233068,0,t1_ci8c4qc,He smiles and kisses your foreheadI love you Em.,HogwartsRP,ci8c5e5,1,t5_2ygix
1233407,0,t1_ci8dgqn,Because you have a subconscious fear for Emeralds safety or something.,HogwartsRP,ci8diu2,1,t5_2ygix
1237060,0,t1_ci8s8sk,i love you too ill go and take a stroll around then come back,HogwartsRP,ci8sahe,1,t5_2ygix
1238803,0,t1_ci8z7ga,You missed me?,HogwartsRP,ci8zcju,1,t5_2ygix
1238896,0,t1_ci8z0ub,I just ... I dont know how to explain it.,HogwartsRP,ci8zq3v,1,t5_2ygix
1240545,0,t1_ci966ug,I look into yours tears done,HogwartsRP,ci96e8p,1,t5_2ygix
1241461,0,t1_ci99wjd,I am in mine.,HogwartsRP,ci9a3k2,1,t5_2ygix
1242381,0,t1_ci9dncd,Smiles,HogwartsRP,ci9dthq,1,t5_2ygix
1243174,0,t1_ci9gzjb,OOC Eeeeeyup. Was hoping thatd go better XD,HogwartsRP,ci9h15f,1,t5_2ygix
1244967,0,t1_ci9aje9,I keep tickling.,HogwartsRP,ci9oaeu,1,t5_2ygix
1248688,0,t1_cia3aaa,I break the kiss staring into your eyes,HogwartsRP,cia3cwl,1,t5_2ygix
1248798,0,t1_cia3ovj,I never thought that youd see me this way.,HogwartsRP,cia3sx2,1,t5_2ygix
1250111,0,t1_cia8xdu,The reaction is the strongest so far apart drom my feet.,HogwartsRP,cia942h,1,t5_2ygix
1250437,0,t1_ciaa8vi,I tickle even more my hands like blurs over your feet,HogwartsRP,ciaafkl,1,t5_2ygix
1253442,0,t1_ciaml04,Man remember our first date.,HogwartsRP,ciamlj9,1,t5_2ygix
1254363,0,t1_ciaqa3a,Thank you Irvette. I hug you back,HogwartsRP,ciaqbpr,1,t5_2ygix
1261664,0,t1_cibjvom,Before you do Hazel a question for you. I make sure Em is wrapped up in something else motioning for you to come closer,HogwartsRP,cibjwv1,1,t5_2ygix
1263799,0,t1_cibsget,Dont drink dont smoke and youll be good! I laugh And I know how much you love pigtails. ,HogwartsRP,cibskih,1,t5_2ygix
1269956,0,t1_cichicn,squeaks a littlePregnant woman! No bladder!OOC Indeed. Fine Im going to work. BAH.,HogwartsRP,cichjbg,1,t5_2ygix
1280291,0,t1_cidn7s4,Where to?Ooc sorry for inactivity i was on a anime con,HogwartsRP,cidneg9,1,t5_2ygix
1284129,0,t1_cie2tyq,Almost as much as the bracelet.OOC I guessed that from the comments the day before p,HogwartsRP,cie2xi3,1,t5_2ygix
1286207,0,t1_cieb5hg,I nod watching lust flash in your eyes. I chant once more changing your hair to purple. Almost immediately your intense thoughts makes your hair blaze purple,HogwartsRP,ciebc2r,1,t5_2ygix
1290148,0,t1_cier9wb,Hogwarts.,HogwartsRP,cieratp,1,t5_2ygix
1290262,0,t1_cierqo5,Bbut Professor...it wwas sso real...,HogwartsRP,cierrfj,1,t5_2ygix
1293241,0,t1_cif3dby,Im a little surprised but kiss you back.,HogwartsRP,cif3u7q,1,t5_2ygix
1295786,0,t1_cifdwho,I keep kissing you back.,HogwartsRP,cife5e8,1,t5_2ygix
1300452,0,t1_cifwrjb,I place your hands on my waist. So help me dance well?,HogwartsRP,cifx1k1,1,t5_2ygix
1301946,0,t1_cig2ziu,he pulls you closer to himCall me more pet names. I love them.,HogwartsRP,cig3364,1,t5_2ygix
1302609,0,t1_cig51q6,I scramble up quickly.,HogwartsRP,cig5rov,1,t5_2ygix
1302939,0,t1_cig712o,I can guess what purple is i grin,HogwartsRP,cig73re,1,t5_2ygix
1303341,0,t1_cig8ntf,You dont know?,HogwartsRP,cig8qdf,1,t5_2ygix
1303353,0,t1_cig8qr2,What for?,HogwartsRP,cig8s4l,1,t5_2ygix
1305049,0,t1_cifedny,She waves you goodnight and continues her walk feeling a little guilty for rejecting your friendly offer,HogwartsRP,cigfnp6,1,t5_2ygix
1311087,0,t1_cih3hmu,She puts a tray on your lap. Its full of all youe favourite breakfast things. She said I cant tell you.,HogwartsRP,cih43z5,1,t5_2ygix
1314510,0,t1_cihhyhu,John is a soldier and that dude Alan? Alex? Ems ex was crazy dark power guy.,HogwartsRP,cihhz18,1,t5_2ygix
1317436,0,t1_ciht1si,It lacks the ... Intimacy of oneonone sex.,HogwartsRP,cihtu2o,1,t5_2ygix
1319638,0,t1_cii2oz4,I run my hands over your skin the second its revealed.,HogwartsRP,cii2r7p,1,t5_2ygix
1329745,0,t1_cij7ebp,Okay Lord of Dance.,HogwartsRP,cij7p82,1,t5_2ygix
1330053,0,t1_cii21lh,Fair enough. What did you get when you came here?,HogwartsRP,cij8y2k,1,t5_2ygix
1331639,0,t1_cijei5p,i arrive there to keep you company,HogwartsRP,cijfcqq,1,t5_2ygix
1345590,0,t1_cikzn3k,Jills a girls name. And not bad. You?,HogwartsRP,cikztmg,1,t5_2ygix
1346580,0,t1_cil3oo7,I die,HogwartsRP,cil3tyt,1,t5_2ygix
1353731,0,t1_cilza1z,Ill emphasize try.I draw my wandHe didnt do it right.,HogwartsRP,cilzc8p,1,t5_2ygix
1355308,0,t1_cim6cy2,Hey!I laughAnd how would you have felt if I had hit you and not myself with that charm hm?,HogwartsRP,cim6fvb,1,t5_2ygix
1355726,0,t1_cim88j1,Her back arches,HogwartsRP,cim8bqt,1,t5_2ygix
1358841,0,t1_cimmawv,i keep kissing and running my hands over your back,HogwartsRP,cimmd32,1,t5_2ygix
1358844,0,t1_cimly5j,I smile happily. No you shouldnt.,HogwartsRP,cimmdks,1,t5_2ygix
1358856,0,t1_cimm1a1,Always.,HogwartsRP,cimmfj4,1,t5_2ygix
1360398,0,t1_cimt64h,I smile nibbling your collar bone,HogwartsRP,cimtdkb,1,t5_2ygix
1360499,0,t1_cimt52t,I kiss you back hugging you tighter.,HogwartsRP,cimttyu,1,t5_2ygix
1361194,0,t1_cimvsga,No problem although you could have stayed and snuggled with me,HogwartsRP,cimwyse,1,t5_2ygix
1361322,0,t1_cimxabq,Noohoohoohoo!,HogwartsRP,cimxjkd,1,t5_2ygix
1372946,0,t1_ciocwmu,Gryffindor!!!The Gryffindor crest appears on your robes as they outline in red and gold.Welcome to Hogwarts and to Gryffindor House!,HogwartsRP,ciodxba,1,t5_2ygix
1379957,0,t1_cip9egf,Im ssorry...,HogwartsRP,cip9gfl,1,t5_2ygix
1380059,0,t1_cip9gko,I dont drink after the final time letting the blood flow,HogwartsRP,cip9wyu,1,t5_2ygix
1383909,0,t1_cipr0t6,Tack. I will need it.,HogwartsRP,cipr8if,1,t5_2ygix
1384267,0,t1_cipsscc,Why are you with her?,HogwartsRP,cipsuf5,1,t5_2ygix
1386644,0,t1_ciq3cpq,Your constant happiness your laugh how ticklish you are...I grin and slowly begin tickling your ribs,HogwartsRP,ciq3j84,1,t5_2ygix
1387376,0,t1_ciq6jd9,I shrug. Depends. ,HogwartsRP,ciq6txu,1,t5_2ygix
1389974,0,t1_ciqifex,I am glad i am first,HogwartsRP,ciqij8c,1,t5_2ygix
1393098,0,t1_ciqw2s7,Do you think Ill ever find that?,HogwartsRP,ciqwmch,1,t5_2ygix
1394592,0,t1_cir352n,Oh gods...that really tickled.I chuckleLuckily you havent found my worst spots.,HogwartsRP,cir3cw9,1,t5_2ygix
1397901,0,t1_ciri7ce,after a while i move to your thighs making sure to pass all of it from top to the bottom my fingers gently brushing your pussy as i get to the top,HogwartsRP,ciria8o,1,t5_2ygix
1402294,0,t1_cis1odw,Its alright. Youre here now. Even if youre kind of crushing me with this hug. I grin.,HogwartsRP,cis239b,1,t5_2ygix
1406376,0,t1_cisjagp,I stop just teasing with tickling,HogwartsRP,ciski1h,1,t5_2ygix
1408983,0,t1_cisw6x0,Really? How could anybodys parents not accept that?,HogwartsRP,cisw90p,1,t5_2ygix
1421198,0,t1_ciuf96f,Why would i?,HogwartsRP,ciufawu,1,t5_2ygix
1422494,0,t1_ciukzm7,Should I go and get them?,HogwartsRP,ciul5c1,1,t5_2ygix
1422878,0,t1_ciumrqe,I promise it is nothing serious.,HogwartsRP,ciumvs5,1,t5_2ygix
1424680,0,t1_ciuuwgf,And why is that?My smirk stays on my face,HogwartsRP,ciuv090,1,t5_2ygix
1426859,0,t1_civ4sek,Still...I smile taking a bite out of itMm...gods thats good.,HogwartsRP,civ4u84,1,t5_2ygix
1429364,0,t1_civg3m2,I love you so much.,HogwartsRP,civg4s0,1,t5_2ygix
1434518,0,t1_ciw3aa7,Ill find something else.,HogwartsRP,ciw3dma,1,t5_2ygix
1437705,0,t1_ciwgw2p,Not a lot really. Its turning out to be a quiet summer,HogwartsRP,ciwhr76,1,t5_2ygix
1438738,0,t1_ciw4f0c,So.,HogwartsRP,ciwmey4,1,t5_2ygix
1439279,0,t1_ciwokks,Dan? A slytherin?,HogwartsRP,ciwourr,1,t5_2ygix
1441538,0,t1_ciwyzxb,You should be. I smile evilly. Its not nice to talk behind peoples backs.,HogwartsRP,ciwz1cr,1,t5_2ygix
1441696,0,t1_ciwzq6v,He watches her slightly confused.Are you... hungry?,HogwartsRP,ciwzr10,1,t5_2ygix
1442040,0,t1_cix19ow,Good. Anything else? ,HogwartsRP,cix1auw,1,t5_2ygix
1442454,0,t1_cix2z57,she starts following puzzled look on her face,HogwartsRP,cix363g,1,t5_2ygix
1448749,0,t1_cixvj79,For a Ravenclaw youre pretty thick.,HogwartsRP,cixvk5p,1,t5_2ygix
1449553,0,t1_cix40ln,Hufflepuff!!!The Hufflepuff crest dawns on your robes as they outline in black and yellow.Welcome to Hogwarts and to Hufflepuff house!,HogwartsRP,cixz6nz,1,t5_2ygix
1450384,0,t1_ciy2wiv,she take her stuff and starts looking for a comfy spot to last down.,HogwartsRP,ciy2xkm,1,t5_2ygix
1450733,0,t1_ciy48h4,Marriage doesnt hurt your love it helps. It opens doors to new possibilities.,HogwartsRP,ciy4i6i,1,t5_2ygix
1451011,0,t1_ciy5lb3,Anything less and you wouldnt be a good enough trophy.,HogwartsRP,ciy5rc3,1,t5_2ygix
1452260,0,t1_ciyb7eo,I smileSo where would you like to go with your trophy?,HogwartsRP,ciybdxi,1,t5_2ygix
1453269,0,t1_ciyfve0,I whisper in your ear in the deep voiced Italian that just oozes sexTi piace bella? ,HogwartsRP,ciyfxtu,1,t5_2ygix
1457627,0,t1_ciyzhw1,I give another wink. A wave of my wand resummons the ring of ice making it big enough to stretch around both of us. Unfortunately it is too thin and I dont have the mastery to thicken itAlright Em snuggle time.,HogwartsRP,ciyzlu5,1,t5_2ygix
1460090,0,t1_ciz9zcd,looks up. Wow its so pretty!,HogwartsRP,cizaq47,1,t5_2ygix
1460129,0,t1_ciyuk02,I barrel over to where you are. I crash against the gates and though I cant slip through them like you I stand on the other side. Where do you think youre goin without me?,HogwartsRP,cizawih,1,t5_2ygix
1461682,0,t1_cizhswv,No matter what mood Im in youre able to cheer me up. Youre the best youre so sweet to me.,HogwartsRP,cizhx1g,1,t5_2ygix
1466763,0,t1_cj04swb,But odd isnt necessarily synonymous with interesting.,HogwartsRP,cj04ub4,1,t5_2ygix
1466864,0,t1_cj056jz,I cant wait until I figure out that aging potion.,HogwartsRP,cj05aor,1,t5_2ygix
1467032,0,t1_cj05kwi,Whats that look for?,HogwartsRP,cj061y7,1,t5_2ygix
1467484,0,t1_cj07gmc,Dont be.,HogwartsRP,cj083az,1,t5_2ygix
1468315,0,t1_cj0bsua,Not now Dan.,HogwartsRP,cj0buie,1,t5_2ygix
1468330,0,t1_cj0b3ae,Hey there she says with a smile I dont think weve met. Im Indigo.,HogwartsRP,cj0bwyj,1,t5_2ygix
1468629,0,t1_cj0d5e5,OOC Told you Im kinky  Its an electro play toy channels electricity through it but in this case it would work through magic. When placed near the skin it discharges bolts of lightning.,HogwartsRP,cj0d9h0,1,t5_2ygix
1473243,0,t1_cj0x7wq,I grin. Sounds perfect.,HogwartsRP,cj0y2d8,1,t5_2ygix
1476878,0,t1_cj1de65,Grins. I can see that.,HogwartsRP,cj1ehjf,1,t5_2ygix
1479485,0,t1_cj1fnd7,Thank you.,HogwartsRP,cj1q9e8,1,t5_2ygix
1481130,0,t1_cj1xmug,I run a hand through my hairRight right. Sorry...,HogwartsRP,cj1xohc,1,t5_2ygix
1481842,0,t1_cj20nff,Watch a movie? ,HogwartsRP,cj20vy3,1,t5_2ygix
1483085,0,t1_cj24hc0,Is that bad?,HogwartsRP,cj26huz,1,t5_2ygix
1487847,0,t1_cj2rxl8,As I slowly close the gap between us my  frame becomes apparent as do my numerous muscles that though covered look aweinspiringNow why would you say that?,HogwartsRP,cj2ryw8,1,t5_2ygix
1489071,0,t1_cj2xh0o,I shrug and you suddenly find my fingers at your sides and ribs again tickling once more,HogwartsRP,cj2xhh2,1,t5_2ygix
1492782,0,t1_cj3e2mm,Like I told you before youre perfect the way you are. I dont need you any other way.,HogwartsRP,cj3e892,1,t5_2ygix
1494758,0,t1_cj3n2yf,I ran into problems with Julia.I hang my head and sigh,HogwartsRP,cj3n5fo,1,t5_2ygix
1494967,0,t1_cj3o0u8,looks up at you smiling  You know I was joking but I wont complain ,HogwartsRP,cj3o3dy,1,t5_2ygix
1495562,0,t1_cj3qqkc,You took it like an animal.I wait until you finish drinking before I kiss you,HogwartsRP,cj3qs1l,1,t5_2ygix
1495822,0,t1_cj3rg3o,It was?,HogwartsRP,cj3ry9r,1,t5_2ygix
1496221,0,t1_cj3tqef,No. Just...extra on top of what Im going to owe you.,HogwartsRP,cj3tr2f,1,t5_2ygix
1496466,0,t1_cj3uhlm,Mhm,HogwartsRP,cj3uuu5,1,t5_2ygix
1502589,0,t1_cj4mbqb,Its the start of a new day! Its full of potential.,HogwartsRP,cj4mg0a,1,t5_2ygix
1510034,0,t1_cj5j762,You new here or have I just not seen you? Theres been a lot of people from different schools here.,HogwartsRP,cj5k43h,1,t5_2ygix
1514126,0,t1_cj62jou,I keep begging you not to even as I orgasm. For a brief moment my vision goes completely black as my body begins to give in.,HogwartsRP,cj62m4v,1,t5_2ygix
1514237,0,t1_cj631vv,I let out a little moan as you stroke my neck,HogwartsRP,cj6346u,1,t5_2ygix
1516523,0,t1_cj6d0g9,I know quite a bit pervert boy. Just because Im better with equations than people doesnt mean I have no empathy or understanding of the human psyche.,HogwartsRP,cj6dfhp,1,t5_2ygix
1517760,0,t1_cj6iya7,OOC Its not like you have to read it.,HogwartsRP,cj6j0pv,1,t5_2ygix
1518911,0,t1_cj6o3dx,I start to pull your swimming trunks down.,HogwartsRP,cj6o7t8,1,t5_2ygix
1519816,0,t1_cj6s4ck,Oh gods yes...so nice.,HogwartsRP,cj6sb18,1,t5_2ygix
1520094,0,t1_cj6t9lg,He faces the wall but shoots glances every few seconds.,HogwartsRP,cj6tkaw,1,t5_2ygix
1520448,0,t1_cj6v4l1,So youre in first year like me. Cool.,HogwartsRP,cj6v5ti,1,t5_2ygix
1521132,0,t1_cj6y1gf,I yawn.,HogwartsRP,cj6y934,1,t5_2ygix
1521975,0,t1_cj72122,By the way whats your name?,HogwartsRP,cj7222q,1,t5_2ygix
1522070,0,t1_cj72fh7,I might at that. But you would need to earn it.,HogwartsRP,cj72hj5,1,t5_2ygix
1524824,0,t1_cj7etqk,You just like seeing me being abused. What does that say about you? Besides this next one is for you.,HogwartsRP,cj7ewho,1,t5_2ygix
1529877,0,t1_cj81hmt,Thats what a silencing charm is for.,HogwartsRP,cj81pgs,1,t5_2ygix
1530018,0,t1_cj82azd,She high fives him back. Yes! Im like a big kid in a candy shop with a lot of money!!!,HogwartsRP,cj82cdf,1,t5_2ygix
1530810,0,t1_cj85vwv,OOC heh also hes already getting picked on by a Slytherin. She broke his wand and glasses so hes essentially blind.,HogwartsRP,cj85wsz,1,t5_2ygix
1534154,0,t1_cj8kb3f,I keep walking.,HogwartsRP,cj8kz3g,1,t5_2ygix
1536988,0,t1_cj8xpxw,She give the slightest nod.,HogwartsRP,cj8xqgx,1,t5_2ygix
1538065,0,t1_cj92jth,Fufufufu...He laughs again running his finger across the wood the scratchy sound echoing in the otherwise silent library.,HogwartsRP,cj92kuk,1,t5_2ygix
1538086,0,t1_cj921u8,He nods. He taught me how to be a keeper.,HogwartsRP,cj92o9g,1,t5_2ygix
1538917,0,t3_2bv037,Amiera flies into the room ... literally.. and drops herself in the bouncy castle screaming excitedly ... in Portuguese.,HogwartsRP,cj96f5s,1,t5_2ygix
1540672,0,t1_cj9e8zq,he gives you an extremely discerning lookYou hate your mum.,HogwartsRP,cj9eble,1,t5_2ygix
1542409,0,t1_cj9m4q3,Oh? And where do you propose?,HogwartsRP,cj9m5bg,1,t5_2ygix
1542411,0,t1_cj9m35l,Yes...,HogwartsRP,cj9m5n2,1,t5_2ygix
1545500,0,t1_cja01x5,At the feeling of your nails raking up and down my back I let out a moan and fuck you harder and harder my hands on your hips to pull you as close as my muscles will let us be,HogwartsRP,cja031j,1,t5_2ygix
1546249,0,t1_cja3fqe,What would you do...if I did it...again?I continue regaining full control of my breath. My hair is matted down to my head. My wrists and ankles are still tied up,HogwartsRP,cja3gru,1,t5_2ygix
1547057,0,t1_cja71rp,I quickly press it into your hands    Isaac Im going to float you up to the hospital wing ok?,HogwartsRP,cja73yw,1,t5_2ygix
1547322,0,t1_cja89ge,she looks at him Hey Isaac.. are you feeling better today? And thank you. Oliver taught me how! Its so cool. Thats why I always have a pink ponytail. Because of him.,HogwartsRP,cja8ayv,1,t5_2ygix
1549063,0,t1_cjafeny,Huh? I giggle.,HogwartsRP,cjag5pp,1,t5_2ygix
1552452,0,t1_cjav9k1,Always I kiss your cheekOoc if you want to post that they are going do so. Just post that they are going to Croatia seaside and you can add that salty air will be good for aster  ,HogwartsRP,cjavg26,1,t5_2ygix
1552836,0,t1_cjax5qu,You know if you arent hungry now you can just eat later.,HogwartsRP,cjax6eo,1,t5_2ygix
1553010,0,t1_cjaplwd,Again I stop hands dropping ,HogwartsRP,cjaxyra,1,t5_2ygix
1553380,0,t1_cjaza96,I grip my broom handle and smirk. Ready? Pause. Go!,HogwartsRP,cjazmzd,1,t5_2ygix
1554528,0,t1_cjb4rmt,My deeds? Oh you must mean the massive amounts of Austin Powers style promiscuous sex Ive had.,HogwartsRP,cjb4tlz,1,t5_2ygix
1557372,0,t1_cjbhkz5,I wont dont worry.,HogwartsRP,cjbhnhq,1,t5_2ygix
1557834,0,t1_cjbjcrn,I stop and enjoy the view.,HogwartsRP,cjbjqk1,1,t5_2ygix
1558434,0,t1_cjbm6t5,Im sorry you had to go through that...He says quietly looking sad.,HogwartsRP,cjbmfz1,1,t5_2ygix
1558854,0,t1_cjboa7w,I gasp and light giggles mix in with the moans as you kiss my belly button. My back arches a bit as you do so,HogwartsRP,cjboc4c,1,t5_2ygix
1561729,0,t1_cjc19kj,Its fine. Everyone has down times.,HogwartsRP,cjc1ahu,1,t5_2ygix
1563594,0,t1_cjc9h9m,Im nnot llittle! Im super little.,HogwartsRP,cjc9pdu,1,t5_2ygix
1565137,0,t1_cjcgmhp,He brings you to a shallower part of the pool. Shes a first year Ravenclaw. When we were flying on our brooms she fell off twice and I saved her.,HogwartsRP,cjcgod9,1,t5_2ygix
1565427,0,t1_cjchw3t,He puts a hand on your shoulder smiling kindly.Whatd you think? That wasnt so bad was it?,HogwartsRP,cjchzjm,1,t5_2ygix
1565516,0,t1_cjci7cc,me too!! I love pancakes,HogwartsRP,cjcie0o,1,t5_2ygix
1566853,0,t1_cjcoet3,OK good! Im sorry again.,HogwartsRP,cjcofqo,1,t5_2ygix
1569232,0,t1_cjcz53b,Ill show you the classes,HogwartsRP,cjcz653,1,t5_2ygix
1569407,0,t1_cjczrzp,Hey Shaun? Did you ever find out if they make inflatable pancakes?,HogwartsRP,cjczyn9,1,t5_2ygix
1572485,0,t1_cjddquz,Hmm. A good question. Well I have turned  recently and I still havent decided. But my best bet would be for you to play to your strengths.He rubs his arm again.You would make a fine beater. Or Auror. ,HogwartsRP,cjdduzj,1,t5_2ygix
1573429,0,t1_cjdhogv,Chuckles. Track pants are pretty comfortable.,HogwartsRP,cjdi4o9,1,t5_2ygix
1573641,0,t1_cjdiabr,Chuckles. Oh cmon its nothing to be ashamed of.,HogwartsRP,cjdj3cq,1,t5_2ygix
1574124,0,t1_cjdl6ee,Thats the point of Baguazhang its a style that helps your body type.,HogwartsRP,cjdlab8,1,t5_2ygix
1576564,0,t1_cjdwcb2,he stands in front of youBoo.,HogwartsRP,cjdwcm7,1,t5_2ygix
1578576,0,t1_cje5gq1,Their minds are weird and they say stuff like that. I got a couple of ones like it too.,HogwartsRP,cje5i3n,1,t5_2ygix
1581562,0,t1_cjeirqn,I bet!,HogwartsRP,cjej1xf,1,t5_2ygix
1584471,0,t1_cjevx7x,You see me dart from an alley with two black eyes that stand out obviously against my pale skin.,HogwartsRP,cjew88c,1,t5_2ygix
1588023,0,t1_cjfc9qr,she grins So how long does your show usually go on for?,HogwartsRP,cjfcb1r,1,t5_2ygix
1588087,0,t1_cjfcibi,I take a swig out of the bottle.Ah thats good.,HogwartsRP,cjfclif,1,t5_2ygix
1593320,0,t1_cjg096j,Whats it like? Ive always wanted to visit America.He says closing his book an interested look appearing on his face.,HogwartsRP,cjg0b3e,1,t5_2ygix
1593580,0,t1_cjg1awu,I nod quickly.,HogwartsRP,cjg1hg5,1,t5_2ygix
1604957,0,t1_cjhh041,ltWhat a perfect way to end the perfect date!gtShe smiles into the kisses.,HogwartsRP,cjhh1b1,1,t5_2ygix
1606574,0,t1_cjhlj9p,Yyeah! I gasp still a bit startled.,HogwartsRP,cjhocye,1,t5_2ygix
1609052,0,t1_cjhzia3,He chuckles putting an arm around his shoulder keeping him straight.You look like youre having difficulty. Would you like a little help?,HogwartsRP,cjhzlau,1,t5_2ygix
1612781,0,t1_cjigfmw,Not the right time of year.,HogwartsRP,cjighuq,1,t5_2ygix
1620431,0,t1_cjjf0dr,I shake your hand enthusiastically. Irvrtte Blythe. Nice to meet you.,HogwartsRP,cjjf5yy,1,t5_2ygix
1620746,0,t1_cjjgi47,The suit makes me look smart?His eyes glaze over as he rethinks his whole wardrobe.,HogwartsRP,cjjglcy,1,t5_2ygix
1621346,0,t1_cjjja4f,Ah so youre a muggleborn? Or halfblood maybe?,HogwartsRP,cjjjbce,1,t5_2ygix
1622647,0,t1_cjjo5yr,Well see what we need when september comes.,HogwartsRP,cjjp7xl,1,t5_2ygix
1622843,0,t1_cjjq0ln,Yyeah...on purpose.,HogwartsRP,cjjq427,1,t5_2ygix
1624215,0,t1_cjjv3co,I nod. Yyeah.,HogwartsRP,cjjwbxm,1,t5_2ygix
1624377,0,t1_cjjwtx1,Problem Amy?He grins devilishly... Which considering he is the son of Satan is quite scary.,HogwartsRP,cjjx2d8,1,t5_2ygix
1624916,0,t1_cjjzc5t,Not a problem. I think you will be up soon though. If you can jump off the Astronomy Tower and survive you will recover from being bed ridden.,HogwartsRP,cjjzig4,1,t5_2ygix
1625746,0,t1_cjk383c,OOC Nope his dad is.,HogwartsRP,cjk39vc,1,t5_2ygix
1626067,0,t1_cjk4hea,Right. He was nice to me.,HogwartsRP,cjk4q8f,1,t5_2ygix
1626216,0,t1_cjk5cg4,Hello. You must be new yeah?,HogwartsRP,cjk5ei7,2,t5_2ygix
1626718,0,t1_cjk7m3i,she nods and says softly Yeah.. I do. I like his fancy hair.ooc lt also if you get the reference ill love you forever.,HogwartsRP,cjk7oah,1,t5_2ygix
1627203,0,t1_cjjymnd,Well you can always talk to me   I work as a salesman in a kiosk ,HogwartsRP,cjk9vgh,1,t5_2ygix
1628195,0,t1_cjkecw7,Nope. My auto answer is nothing. You cant prove anything.,HogwartsRP,cjked9t,1,t5_2ygix
1630470,0,t1_cjkons1,My surprise.Penrose walks over and gently orders you off of my bed. She slips me a box and tries to give me back the money she didnt use but I let her have the rest,HogwartsRP,cjkop6i,1,t5_2ygix
1630611,0,t1_cjkp77u,Ya its summer.,HogwartsRP,cjkpc8i,1,t5_2ygix
1635502,0,t1_cjlakfy,Nothing specific yet ...,HogwartsRP,cjlbj1w,1,t5_2ygix
1636961,0,t1_cjli3y4,falls over laughing extremely ticklish.,HogwartsRP,cjli56f,1,t5_2ygix
1637906,0,t1_cjlmdl3,Shaun grins like a madman.,HogwartsRP,cjlmfe9,1,t5_2ygix
1638468,0,t1_cjloxn5,he raises an eyebrowI dont control anything or anyone. Control removes freedom which is humanitys unalienable right. Im just giving you a warning pal.,HogwartsRP,cjlozaq,2,t5_2ygix
1640382,0,t1_cjlxlin,What was that about?,HogwartsRP,cjlxo6s,1,t5_2ygix
1640518,0,t1_cjlxs45,he blushes and keeps kissing,HogwartsRP,cjlyacc,1,t5_2ygix
1642617,0,t1_cjm33cq,Oh... Well this is awkward.,HogwartsRP,cjm7ssj,1,t5_2ygix
