,controversiality,parent_id,body,subreddit,id,score,subreddit_id
8367439,0,t1_d5nh7ev,PFFT what members ....you Raas and a few lounge rats...If you want to be left alone you have a very odd way of going about it.And how exactly would HTTPS stop people from trying to log into other peoples accounts ?? clueless LOL,bluelight,d5nhbei,3,t5_2qzin
8524640,0,t1_d66lsch,removed,bluelight,d6754vi,1,t5_2qzin
8565740,0,t3_4w42p1,droppers is director of communication lolol,bluelight,d6caoo9,1,t5_2qzin
8571118,0,t3_4wxxhn,PHR  ,bluelight,d6cyzgp,1,t5_2qzin
9111807,0,t1_d872ivl,Whom said I want nothing to do with him? ,bluelight,d873b69,1,t5_2qzin
9126314,0,t1_d87yn05,I dunno. Just PM captain.heroin on BL. Hes known for his awesome prices.,bluelight,d88u1fv,1,t5_2qzin
9267755,0,t1_d8ml8t1,Qft,bluelight,d8qr5el,1,t5_2qzin
9269506,0,t1_d8qytjv,Tell me more,bluelight,d8qz5i7,1,t5_2qzin
9401586,0,t3_59dsqq,Im sure it will be fine. Its been around long before most of us and will survive. I think that cautionary thread in here is enough for me to quit the site all together. No butt hurt. Its a good site that helped me a lot and I wish it the best. Furthermore this sub is in no way affiliated to that site so this is OT Phro my internets down but I can confirm nacho is clear. Need to get her a title ttytt ,bluelight,d97ptrr,2,t5_2qzin
9461224,0,t1_d9f9czh,countless times bb,bluelight,d9f9zii,1,t5_2qzin
9494737,0,t1_d9j8rq0,hahahahaha thats post of the day lol,bluelight,d9jfgso,1,t5_2qzin
9498956,0,t1_d9jy5ae,The methd out dicksucking might be tho... ,bluelight,d9jy5pn,1,t5_2qzin
9506183,0,t1_d9ktwwr,I actually tolerated faggots though. Unlike Papa,bluelight,d9ku8p6,1,t5_2qzin
9513892,0,t1_d9lr9qu,Idgaf its all the same to me ttytt. Is it the leaves? Ive always wanted to try them over the stinky powder ,bluelight,d9lsg96,1,t5_2qzin
9521834,0,t1_d9mg9r6,deleted,bluelight,d9mrnry,1,t5_2qzin
9536398,0,t1_d9nmzij,That is racist because Boost Mobile and Cricket arent major carriers!,bluelight,d9ok64k,1,t5_2qzin
9544206,0,t1_d9nrnvu,Evey after reading this I kinda wanna bang you,bluelight,d9pirfp,1,t5_2qzin
9549071,0,t1_d9q2kx8,deleted,bluelight,d9q4cdl,1,t5_2qzin
9653765,0,t1_da30wru,Lol no it aint. Its someone taking mick of Consumer but I cant say who sorry x ,bluelight,da30zq2,1,t5_2qzin
9656880,0,t1_da3dt26,dj fakechemicalsmiles,bluelight,da3eu4k,1,t5_2qzin
9699579,0,t1_da8nwpg,Gums this reverse psychology aint working bro ,bluelight,da8ohhj,1,t5_2qzin
9710938,0,t1_daa2nmm,You can delete my other threads if you like.,bluelight,daa2yom,1,t5_2qzin
9712470,0,t1_daa7zj5,Its crazy how they trade those black market seafood muscles to China for the precursors to make qualuuds. ,bluelight,daa9s91,1,t5_2qzin
9718469,0,t1_da9xuk8,whats sammy gs  m?  i got the goooods,bluelight,dab0g8s,1,t5_2qzin
9721267,0,t3_5e6oiw,Not something I can take credit for but a gem none the lessShes now banned me from her subreddit for harassment what total BS I doubt Ive posted there more then a couple of times the last one was just a link to a tumble weed gif FFS. edit  I think it was just the once no text just the gifIf only BL had taken such a hard line on her it would have saved many people a mountain of grief and hassle JFC even Knock said she was a pain in the fukin arse,bluelight,dabcw8y,3,t5_2qzin
9738380,0,t1_dadg4j3,Lol libtards disparaging the god emperor is ridiculous. Hopefully this is banned and you go to jail at some point tbh ,bluelight,dadguvq,1,t5_2qzin
9790843,0,t1_dajv724,I think we need to expand out a bit and get this place a theme other than ex BLers. Obviously we attract the drug crowd. But we need to find a focus. Just not sure what it should be yet. Droppers is helping. ,bluelight,dajxng5,1,t5_2qzin
9823416,0,t1_danr59e,It does suck now. It used to be my favorite forum.,bluelight,dao0f4h,1,t5_2qzin
9852386,0,t1_daqzhax,ya fuckin shitcunt!hows the fuckin babay you fuckin whore!,bluelight,darse92,1,t5_2qzin
9878375,0,t1_dauzv2n,What about the pot? ,bluelight,dav6bki,1,t5_2qzin
9880604,0,t1_davfxnc,Who are you? You dont know what youre talking about so leave me be me. Thanks. ,bluelight,davgs8j,1,t5_2qzin
9898820,0,t1_daxu1s5,This guy is a eveyfag euro not sure who. Dont really care tbh ,bluelight,daxu87y,1,t5_2qzin
9898930,0,t1_daxtp48,I dont give a fuck what you have or have not established you hairless imbred. Would you bang a nigger if she got you a comb four Christmas?,bluelight,daxuqs1,1,t5_2qzin
9949840,0,t1_dazcqui,Yeah Ive noticed a lot of fat guys with very pretty women,bluelight,db4hnc9,1,t5_2qzin
10079521,0,t3_5k4wqp,Lmfao never change Droppers!Merry Christmas all of you xxxx ,bluelight,dbldrmp,1,t5_2qzin
10111659,0,t1_dbo0wo7,removed,bluelight,dbpk4ny,1,t5_2qzin
10121423,0,t3_5krcav,Fuck her. Donate to me,bluelight,dbqtu91,1,t5_2qzin
10127399,0,t1_dbrlch5,Saying No offense before you say something racist or insensitive works too. It totally makes it not racist or insensitive and its a forum rule all over the Internet.,bluelight,dbrltuc,1,t5_2qzin
10152639,0,t1_dbutzaq,I dont think protectionism in that sense works. Capitalism needs to go to the cheapest places to produce goods and thats overseas.What can work is a change in mentality. We need to convince consumers that they need to spend their hard earned money on quality and thats something we can deliver with engineering and highly skilled and payed workers.,bluelight,dbuuvwe,1,t5_2qzin
10155714,0,t3_5ldqa8,Just another  year old living with their parents. I dunno what it is about my generation but they all eventually live with their parents and there are soooo many of them.,bluelight,dbv7g7z,3,t5_2qzin
10180493,0,t1_dbxyl2o,Oh boy and what a plan it was!,bluelight,dby0jw7,1,t5_2qzin
10180724,0,t1_dby17a1,Nah I dont know what those are. Are they Honda Ridgeline related by chance? I bet they would provide a smooth comfortbale and reliable ride over the infidels if I had to guess.,bluelight,dby1hxn,1,t5_2qzin
10194762,0,t1_dbzmg1f,I think they have unmanaged hosting which is extremely cheap but you have to do everything for yourself. I have a server on that plan and it only costs me year but the host does nothing for me. Its not a good thing to have if you dont know what youre doing.,bluelight,dbzmruc,1,t5_2qzin
10204719,0,t1_dc0rd14,Does that whole kentucky area have alot of cocaine?,bluelight,dc0rg79,1,t5_2qzin
10250741,0,t1_dc5yd6w,lol oh thats funny. In the land of outsourcing and cheap labor Filipinos are usually preferred because they arent frauds like the Indians and the Pakistanis. There seems to be a shift towards Serbians for programming too. ,bluelight,dc5z7of,1,t5_2qzin
10331131,0,t3_5nxc4y,deleted,bluelight,dcf3aqq,1,t5_2qzin
10350118,0,t1_dch8ktq,Bwahahahhaahah those fgts are probably happy to do it too ,bluelight,dch8v3n,1,t5_2qzin
10355592,0,t1_dchunxe,You have,bluelight,dchv7m4,1,t5_2qzin
10357451,0,t3_5o68lj,i dont get it,bluelight,dci2sxc,1,t5_2qzin
10396724,0,t1_dcmcphl,More making light of how PC its become and how much of the staff uses their powers to virtue signal ,bluelight,dcmj9qy,2,t5_2qzin
10407522,0,t3_5ott53,They have already been having melt downs ever since Trump won.,bluelight,dcnrdvk,1,t5_2qzin
10435048,0,t1_dcqru9o,Lol no I meant what SKL claims he does for a job working with mental patients in some mental hospital. ,bluelight,dcqvs18,1,t5_2qzin
10438095,0,t1_dcr87g5,So aftet more getting off and smoking all yesterday eveningthis morning its over. I practiced makong some obamas and got high alot. This chicks real easy to get off maybe its just me and im good so to tude n lysis and shes just the right thickness. Shes got like c cups with excellent nipboob ratio,bluelight,dcr8cgo,1,t5_2qzin
10485704,0,t1_dcwhfp7,Jesus lysis you arent helping yourself here. I really love trolling cucks in the gender forum about how there are only  genders they think there are like  bwahahahha ,bluelight,dcwnwhl,1,t5_2qzin
10486890,0,t1_dcwrmj3,If he aint Mexican I dont what Mexican is ,bluelight,dcwsr0a,1,t5_2qzin
10502734,0,t1_dcyl5dd,we pick on the ones we love,bluelight,dcylgyu,1,t5_2qzin
10508532,0,t3_5qhbrk,Search for alasdairm you know that thing he signs every single post with. I wonder what the top result is?,bluelight,dcz94qu,1,t5_2qzin
10515546,0,t1_dczg8tp,We have the bestprettiest tech staff mods dont we folks. ,bluelight,dd01t06,1,t5_2qzin
10517747,0,t1_dd057pc,ahhhh I see. I got banned once cuz I said faggot too much.,bluelight,dd0at6y,1,t5_2qzin
10518091,0,t1_dd0b0ea,Lysis should be able to help u with this. Id say Yes ,bluelight,dd0c809,2,t5_2qzin
10538826,0,t1_dd12bd9,How old is he? ,bluelight,dd2oy8s,1,t5_2qzin
10585925,0,t1_dd7ujbr,Ya you should be banned soon. Ive been banned for talking about dopems weaponized autism. Unfortunately it is the easiest way to explain him but its offensive ,bluelight,dd7uuu1,1,t5_2qzin
10590286,0,t3_5rezl5,That blog incredibly lamehow to be verbally abused by pissedoff marginalized idiots then meekly promise to do better.,bluelight,dd8b1ho,1,t5_2qzin
10591733,0,t3_5rlgux,You go through withdrawal if you stop the magnesia?,bluelight,dd8geq3,1,t5_2qzin
10611567,0,t3_5ruaag,removed,bluelight,ddai3a9,1,t5_2qzin
10620018,0,t1_ddbc2i1,Id honestly like to see what spacegums looks like. i just kinda picture a kmart mannequin or similar.,bluelight,ddbdhvt,2,t5_2qzin
10623811,0,t1_ddbj146,lmao I was going with meth mom on that one. But spacegums is a good guess too. I kinda lump them both in the same category.Both faggots,bluelight,ddbrk2d,1,t5_2qzin
10629882,0,t1_ddcdg3w,Damn you apple you faggots! And my phone gets super slow if l dont update which is really gay imo ,bluelight,ddce3pd,1,t5_2qzin
10630142,0,t3_5s4xrt,Ive had ideas that has later had someone do something very similar.When I worked at the forex firm I made an application that used forex type algorithms to guess peoples popularity. You could bet on someones popularity similar to forex and your stock would rise or fall. It was cheesy but I had some people using it and later Microsoft bought some company that did something similar but with social media popularity I think.The reason I ditched the app was because my ex died and when I just said fuck it to everything. I probably still have the code too. I was regularly getting people playing too.,bluelight,ddcf2ho,1,t5_2qzin
10644097,0,t3_5sb9u5,I may have spoken TWO soon about this game sucking!,bluelight,ddduuy1,1,t5_2qzin
10667451,0,t1_ddg8xm3,Its SEIZING you fucking moron. Maybe if my eboyfriend was a pedophile Id be a big bitch like you too,bluelight,ddg9lve,1,t5_2qzin
10684694,0,t1_ddi1gsn,YOU HAVE BEEN VISITED BY ALASDAIRMS TRUCK OF TOLERANCE| religion of peace || l | |  |||  |  |  | BLUELIGHTERS INFRACTED FOR FAGGOTRY,bluelight,ddi1n4c,1,t5_2qzin
10689315,0,t1_ddihwxe,ford has better seats is what sold me. i get alot of windshield time with my job ,bluelight,ddiivi1,1,t5_2qzin
10690322,0,t1_ddiln3o,i hated that little faggot potato since the day he logged on bluelight.,bluelight,ddimm30,1,t5_2qzin
10695053,0,t1_ddj25rd,nah just an average white chick who does the sports in the morning with a much of black dudes,bluelight,ddj45p3,1,t5_2qzin
10725415,0,t1_ddm8r1p,Hes in the big leagues now baby!,bluelight,ddm8w5f,1,t5_2qzin
10725557,0,t3_5tfw8v,Nah look at OJ Simpson. Those retards were happy that a killer black man beat the system. Theyd vote for him just because hes black and then scream racism about everything.,bluelight,ddm9f3f,2,t5_2qzin
10756175,0,t1_ddpf1sy,Ive got a sick curiosity.,bluelight,ddpf33o,1,t5_2qzin
10756436,0,t1_ddpenfu,Thats ace if he has. ,bluelight,ddpg268,1,t5_2qzin
10765847,0,t3_5tyllh,I truly hate all hallmark made up holidays BlushesSubutai Ill be your valentine ,bluelight,ddqf19l,1,t5_2qzin
10770630,0,t1_ddqpk10,deleted,bluelight,ddqwsx0,1,t5_2qzin
10787581,0,t1_ddslyh1,I did LOL at she wants nothing to do with this place... she gave me this pic to upload to the forum. xD,bluelight,ddsnthn,2,t5_2qzin
10824759,0,t1_ddw0sdf,i heard claire started a go fund me to get this one above  the ground! ,bluelight,ddwhxc0,2,t5_2qzin
10959203,0,t1_deac8ms,The ebay cookie stuffer guy comes to mind. This guy Because of that guy cookie stuffing topics are no longer allowed on blackhatworld but thats the kind of shit you can learn there. I used to post that a majority of the people there are broke losers which is true but the  are smart as shit and friendly in PMs if you show loyalty and trust and all that jazz.,bluelight,dead44w,1,t5_2qzin
10965797,0,t3_5wk6n2,I prefer Adderall or dexies in moderation of course as they last a lot longer than coke are less expensive and the crash is not nearly as bad as coke was for me.  Theyre pharm grade never stepped on as pretty much all coke is unless you are in certain South American countries close to where they make it and I dont crave them or obsess over them like I do with coke.,bluelight,deb1ma6,1,t5_2qzin
11026771,0,t1_dehdumv,removed,bluelight,dehuyea,1,t5_2qzin
11031052,0,t1_dei6z5m,She didnt need a masters degree to get that job she had her dad. Wasted cash.Either way. I was pleased with the outcome in the end.... all that artwork. Can be recycled to death. Check my etsy stats lolllllllllllll,bluelight,deicezf,1,t5_2qzin
11059038,0,t1_deliusb,gtHand Of Doom  Black Sabbath gtgtA verso do lbum original.gt bludeguilherme in Musicgt views since Aug bot inforyoutubefactsbotwikiindex,bluelight,delivej,2,t5_2qzin
11080132,0,t1_den4c77,Ummm probably not. ,bluelight,denx8kq,1,t5_2qzin
11117332,0,t1_des1kz8,Sick again?,bluelight,des52hr,1,t5_2qzin
11119242,0,t1_des792p,lol ty for the gold D,bluelight,descvjv,1,t5_2qzin
11124381,0,t1_desuy5b,Good luck,bluelight,desxtpe,1,t5_2qzin
11128174,0,t3_5ym7dv,youve had my number for quite awhile Im insulted and emotionally scard that u didnt just send the pics on autopilot. so ur a make anigga beg kinda guy???,bluelight,detdam8,1,t5_2qzin
11183312,0,t3_5zgm6q,,bluelight,dezm676,1,t5_2qzin
11257282,0,t3_5zxlcg,kekalso requests considered ill try n consolidate some of the Ace dramai have others toojason you degenerate cockmongering penis vein injecting jewkike junkfag i think i have some content on u too the funny thing is tho mostly i remember skl sticking up for you and the rest of the nigsayers and fagsayers of TL on almost every report. now idk wat his drunk azz is doing but EVEYCOW?LAWD!the fucking CHRIS CHAN of bluelighti am sorely considerin puttin it up on ED or summat but cant rly be fuktALIASDAIR who I dont really have a prob with nor consider him a faggot the bigger faggot or really the worst mod politically or otherwise is SADIE if she ever ADVANCES IN THE RANKS HEAVEN HELP US ALL bitch cares more about other ppls feels than  ALIASDAIRS alto faggot speech doesnt bother me and the bigger faggotry is chimping out about faggot being said would ypu get infacted for saying chimping out on the lounge because nigfags resemble chimps and their awkwarr bucktooth piccanninni offsprings have big heads amp grately enjoy stealing WATERMELONS from the GLORIOUS WHITE RACEbut yeah theres no chimpout like an evey chimpout and here alifag has it  correct that eveycow is just getting milked HARD for the LULZ here and nobody cared about her twat and it is sad she tinks shes got allies up in this bitch SHES JIST A LOLCOW AND A KEKSOW MUNCHING GRAZZ amp HARDILY WORKING PRODUCING LULZ AND KEKSalso ali will NEVAR find out who I am amp I will NEVAR compromise whar is RIGHTEOUSNESS amp GOOD about jewlite but she had a BIG fuckoff hamd in yhe downfall of the whole shit,bluelight,df7zv53,1,t5_2qzin
11547830,0,t1_dg4xtck,whatyou get any nice fountain pens?,bluelight,dg4y6gb,1,t5_2qzin
11604922,0,t1_dfwkrfa,oh i watched soul train.,bluelight,dgbfegj,1,t5_2qzin
