,controversiality,parent_id,body,subreddit,id,score,subreddit_id
9769639,0,t3_5f35lk,Insert joke about Ash being Jewish here,shittyrainbow6,dahboob,9,t5_3h1lw
9788784,0,t1_dajma93,He will never,shittyrainbow6,dajoibo,10,t5_3h1lw
9794237,0,t3_5ffoee, seconds until insertion,shittyrainbow6,dakco96,8,t5_3h1lw
9806065,0,t1_dalfo9w,Wot de fuq,shittyrainbow6,dalt3n9,3,t5_3h1lw
9847418,0,t3_5gbqg4,,shittyrainbow6,dar53iz,13,t5_3h1lw
9849816,1,t1_dar8orn,Life is better when you lighten up a bit and dont worry about other so much. take a break and see how you can improve friend. cuz you need to ,shittyrainbow6,dargcla,0,t5_3h1lw
9959078,0,t1_db5o5s3,And I bought his most expensive headgear ffs. I think I never played him after purchasing it.,shittyrainbow6,db5ozak,5,t5_3h1lw
9977477,0,t1_db83d3c,yo get the updoots,shittyrainbow6,db83d4t,1,t5_3h1lw
9978103,0,t3_5ictij,I wonder what Panky did in a past life to make him deserve Dahdii... Kappa,shittyrainbow6,db86axp,2,t5_3h1lw
9988952,0,t1_db9e1n2,Ayy the first gild in here,shittyrainbow6,db9l6e9,6,t5_3h1lw
10013566,0,t3_5j0fos,Ye fooken danish m me too thanks,shittyrainbow6,dbcsoic,1,t5_3h1lw
10024863,0,t3_5j8khk,Explain? Im out of the loop.,shittyrainbow6,dbe9n28,2,t5_3h1lw
10060977,0,t1_dbiywz0,good dick go dIckI am a bot and this action was performed automatically. Please contact the moderators of this subredditmessagecompose?torshittyrainbow if you have any questions or concerns.,shittyrainbow6,dbiywz8,4,t5_3h1lw
10072847,0,t1_dbki9hn,Hello Dankerator,shittyrainbow6,dbkiiwm,2,t5_3h1lw
10194364,0,t1_dbzhjb8,deleted,shittyrainbow6,dbzl5bh,1,t5_3h1lw
10216970,0,t1_dc1o9v2,ALL COMING IN .,shittyrainbow6,dc25gaf,3,t5_3h1lw
10269435,0,t3_5migdg,Had that with pistols shots fired and percentage.,shittyrainbow6,dc83hol,1,t5_3h1lw
10274108,0,t1_dc8h31b,I would appreciate the joke more if they just used an image of castle as opposed to this raciststereotypical cartoon,shittyrainbow6,dc8mjk6,15,t5_3h1lw
10286158,0,t3_5n7rbg,Was able to help out a bunch of people whos cars wouldnt start in the cold luckily I had  extra car batteries up my ass.,shittyrainbow6,dc9zqon,9,t5_3h1lw
10301049,0,t1_dcazun7,I wouldnt consider these guys actual diamond when theyre just playing casual but you cant see when somebodys last ranked match was. ,shittyrainbow6,dcboh5p,1,t5_3h1lw
10363290,0,t1_dciqo0d,Dankerator greets youampampampI am a bot and this action was performed automatically. Please contact the moderators of this subredditmessagecompose?torshittyrainbow if you have any questions or concerns.,shittyrainbow6,dciqo0g,-2,t5_3h1lw
10393322,0,t3_5oshpx,I dont even play rainbow six and this shit cracks me up,shittyrainbow6,dcm5dur,4,t5_3h1lw
10394684,0,t3_5ouy0f,rRainbow,shittyrainbow6,dcmay9k,1,t5_3h1lw
10476109,0,t3_5pynwj,Not enough meme,shittyrainbow6,dcvkqd7,3,t5_3h1lw
10544882,0,t1_dd3axwc,trying,shittyrainbow6,dd3dos5,7,t5_3h1lw
10560459,0,t3_5r14r8,The most accurate thing here is how sayisfied the Thermite character is with what he has done.,shittyrainbow6,dd55ba0,2,t5_3h1lw
10623266,0,t1_ddbpj7w,yo get the updoots,shittyrainbow6,ddbpjbz,6,t5_3h1lw
10657080,0,t1_ddf2ftd,fucking,shittyrainbow6,ddf72kg,10,t5_3h1lw
10677460,0,t3_5sm5j7,Deploying numba ,shittyrainbow6,ddhasdw,12,t5_3h1lw
10691367,0,t1_ddiqhrb,damn this is dank af boiiiiiiii ampampampI am a bot and this action was performed automatically. Please contact the moderators of this subredditmessagecompose?torshittyrainbow if you have any questions or concerns.,shittyrainbow6,ddiqhrj,1,t5_3h1lw
10697418,0,t3_5nj2tu,Choking hazard. ,shittyrainbow6,ddjcxr4,1,t5_3h1lw
10699613,0,t1_ddj26hb, ,shittyrainbow6,ddjl393,1,t5_3h1lw
10722799,0,t1_ddlz6yt,damn this is dank af boiiiiiiii ampampampI am a bot and this action was performed automatically. Please contact the moderators of this subredditmessagecompose?torshittyrainbow if you have any questions or concerns.,shittyrainbow6,ddlz6yu,2,t5_3h1lw
10724988,0,t1_ddm4o9j,Typical Subreddit mod,shittyrainbow6,ddm7b5e,1,t5_3h1lw
10800239,0,t1_ddtx6tn,Lol that is much better.,shittyrainbow6,ddtyujv,3,t5_3h1lw
10800817,0,t1_ddtp7tz,Go uDM ! Use Mod Abuse!,shittyrainbow6,ddu1067,5,t5_3h1lw
10823069,0,t1_ddvnkq2,Triggered,shittyrainbow6,ddwbnrz,3,t5_3h1lw
10824192,0,t1_ddw329r,Rounds,shittyrainbow6,ddwftmh,2,t5_3h1lw
10835868,0,t3_5uw7gn,Dis a gud mem,shittyrainbow6,ddxn64c,8,t5_3h1lw
10841470,0,t1_ddy6sy8,Terrorist Hunt yes,shittyrainbow6,ddy7yv2,1,t5_3h1lw
10871059,0,t1_de19t7m,damn this is dank af boiiiiiiii ampampampI am a bot and this action was performed automatically. Please contact the moderators of this subredditmessagecompose?torshittyrainbow if you have any questions or concerns.,shittyrainbow6,de19t7r,1,t5_3h1lw
10911061,0,t3_5vvusa,crap forgot to add people who reinforce between bombs,shittyrainbow6,de5ecun,18,t5_3h1lw
10914559,0,t1_de5qn3k,Smurfing in a game is when a high level player creates a fresh account so they can get into games with lower skilllevel players they wouldnt normally be matched up against while using their normal account.,shittyrainbow6,de5rcf4,4,t5_3h1lw
10960804,0,t3_5wf2tc,guess im a faggot rip,shittyrainbow6,deaj2hk,2,t5_3h1lw
10969547,0,t1_debfbmo,Yea but thats the only one. Dont mention meme anywhere,shittyrainbow6,debfjct,1,t5_3h1lw
10969754,0,t1_debgayf,thank,shittyrainbow6,debgazu,1,t5_3h1lw
10975440,0,t1_debxq4j,Im fucking tired of the bots. They need to go,shittyrainbow6,dec2d5z,8,t5_3h1lw
10986028,0,t3_5wusga,But.. Shes from B.C.. ,shittyrainbow6,ded8ca2,6,t5_3h1lw
10986347,0,t1_ded9cdx,Thank you Dank Boot. You have captured my emotions perfectly.,shittyrainbow6,ded9n64,8,t5_3h1lw
10987031,0,t1_dedcfpu,DANK MEME XDDDDDDDD DDDDD HAHAHOMG CANTF STOP LAUFHGING XDXDXD you mustthank  Mr skeltal and comment FOR YOU and gtgtgtgtWHATA             v    vv     v   g meme so much man LE waOHHHHHHH OOOOOOOOHH BABYit let me just gets wipe out smoke some of         that  v      v      v    v     ampampampI am a bot and this action was performed automatically. Please contact the moderators of this subredditmessagecompose?torshittyrainbow if you have any questions or concerns.,shittyrainbow6,dedcfqk,0,t5_3h1lw
11020698,0,t1_deh5z41,ayy lmao thats pretty shittyampampampI am a bot and this action was performed automatically. Please contact the moderators of this subredditmessagecompose?torshittyrainbow if you have any questions or concerns.,shittyrainbow6,deh5z4t,1,t5_3h1lw
11027399,0,t3_5x9dxu,Bet,shittyrainbow6,dehxikv,1,t5_3h1lw
11034176,0,t3_5ic8o7,nice meme,shittyrainbow6,deip64e,2,t5_3h1lw
11042902,0,t3_5xopcw,just press S yo,shittyrainbow6,dejoza2,1,t5_3h1lw
11089906,0,t1_dep14tu,The thing I really like about Planes is that we learn that WWII happened in the Cars universe. Which means there was a Cars Hitler a Cars holocaust a Cars Pacific War a Cars DDay a Cars nuking of Hiroshima and Nagasaki a Cars Rape of Nanking a Cars Battle of Iwo Jima...This leads to so many important questions like were the Cars Little Boy and Fat Man nukes sentient? Was it a suicide mission? Are ALL Cars nuclear weapons sentient? Did Tsar Bomba have a personality?What kind of car was Car Hitler? A VOLKSWAGEN? A forklift?Was there a Cars ? Were the planes hijacked or were the planes themselves radicalized?I could go onEdit I just realized a Cars  gives a whole new layer of meaning to the phrase lets rollampampampI am a bot and this action was performed automatically. Please contact the moderators of this subredditmessagecompose?torshittyrainbow if you have any questions or concerns.,shittyrainbow6,dep14ty,2,t5_3h1lw
11090062,0,t3_5y9hwh,blackbeard isnt a disability hes disabled a better example of a disability would be jager mains,shittyrainbow6,dep1rt4,5,t5_3h1lw
11110315,0,t1_dercclm,well he is programmed to catch specific keywords,shittyrainbow6,dercf63,28,t5_3h1lw
11137999,0,t3_5z0250,im italian and i approve this operator i would be proud to see this in game,shittyrainbow6,deuhbq1,7,t5_3h1lw
11154430,0,t1_devp57z,and then my shots go everywhere even from point blank range,shittyrainbow6,dewccsk,2,t5_3h1lw
11154772,0,t1_dew46i1,The true tachanka,shittyrainbow6,dewdr1z,-1,t5_3h1lw
11166222,0,t3_5zcc43,Its always server in rainbowdelphia,shittyrainbow6,dexoh1v,1,t5_3h1lw
11171305,0,t1_dey2c8f,Well its the law,shittyrainbow6,dey97e1,7,t5_3h1lw
11174739,0,t3_5z9vi7, Ill see your shit post and raise you another ,shittyrainbow6,deyn7b6,1,t5_3h1lw
11177768,0,t3_5zfqed, Armor stim spawn kill squads?Something likeSkip to ,shittyrainbow6,deyzk4l,1,t5_3h1lw
11178353,0,t3_5zlop4,ayy lmao thats pretty shittyampampampI am a bot and this action was performed automatically. Please contact the moderators of this subredditmessagecompose?torshittyrainbow if you have any questions or concerns.,shittyrainbow6,dez1y67,2,t5_3h1lw
11180428,0,t1_deyobcv,Fuk off autistic vampire,shittyrainbow6,dezaew3,6,t5_3h1lw
11181848,0,t3_5zjgrg,REEEEEEEEE,shittyrainbow6,dezg7b2,3,t5_3h1lw
11188676,0,t1_df0479i,I clicked it....,shittyrainbow6,df081nu,13,t5_3h1lw
11237785,0,t3_60cweg,What the fuck did you just fucking say about me you little bitch?,shittyrainbow6,df5scav,3,t5_3h1lw
11286107,0,t1_df9pjiz,memepolice,shittyrainbow6,dfb9i8i,2,t5_3h1lw
11300779,0,t1_dfcxd81,good dick go dIckampampampI am a bot and this action was performed automatically. Please contact the moderators of this subredditmessagecompose?torshittyrainbow if you have any questions or concerns.,shittyrainbow6,dfcxd8c,7,t5_3h1lw
11312009,0,t3_61btnd,Beautiful  ,shittyrainbow6,dfe75v6,2,t5_3h1lw
11321889,0,t1_dffbc2z,yea its kinda stupid. a friend of mine plays csgo and he is like yo dude did you see this new case and im like stop buying the boxes its not going to improve your game. he spend  on csgo. cosmetics dont change if you play better,shittyrainbow6,dffbf6d,1,t5_3h1lw
11324937,0,t1_dffnvio,good dick go dIckampampampI am a bot and this action was performed automatically. Please contact the moderators of this subredditmessagecompose?torshittyrainbow if you have any questions or concerns.,shittyrainbow6,dffnvis,0,t5_3h1lw
11404986,0,t1_dfoqmde,You knew enough to create a x pixel image of an underage childs penis!,shittyrainbow6,dfoqo8p,1,t5_3h1lw
11405826,0,t1_dfoj6sb,As overjoyed as I would be if he became a  Kapkan is plenty viable to me. ,shittyrainbow6,dfou3mh,3,t5_3h1lw
11468172,0,t3_63izt6,You can stop worrying about newborns nowA German Pilot,shittyrainbow6,dfvwt8q,1,t5_3h1lw
11481698,0,t3_63v7vb,This makes me A N G E R Y,shittyrainbow6,dfxg50n,3,t5_3h1lw
11495123,0,t1_dfyxkmo,REEEEEE,shittyrainbow6,dfyyz92,3,t5_3h1lw
11510948,0,t1_dg000kx,deleted,shittyrainbow6,dg0rn85,1,t5_3h1lw
11562839,0,t1_dg6n8wv,small details on all the other oporators match up far better than thermites id ask you to check for yourself.,shittyrainbow6,dg6nia4,1,t5_3h1lw
11578216,1,t3_6591w7,I choose my operator Im jagered...I chose my loadout Im jagered...I choose my spawn Im jagered...I spawn Im jagered...I open a window Im jagered...I shoot a camera Im jagered...I rappel Im jagered...I vault over something Im jagered...I place a breaching charge Im jagered...I turn around a corner Im jagered...I get into the objective Im jagered...I die.........I M .  J A G E R E D tampampampI am a bot and this action was performed automatically. Please contact the moderators of this subredditmessagecompose?torshittyrainbow if you have any questions or concerns.,shittyrainbow6,dg8eazx,-2,t5_3h1lw
11597407,0,t1_dgak0vy,The  reference I figured.,shittyrainbow6,dgakp06,3,t5_3h1lw
11668150,0,t3_66i0cr,o shit we done did it!,shittyrainbow6,dgilmfe,8,t5_3h1lw
11672687,0,t3_66iym7,CaveiraNot a caveiraIts a name ffs.,shittyrainbow6,dgj45rk,-51,t5_3h1lw
11700920,0,t3_66xb48,whats the original,shittyrainbow6,dgmbgj0,7,t5_3h1lw
11717298,0,t1_dgo2ujp,Were smarter than this,shittyrainbow6,dgo6o17,5,t5_3h1lw
11762809,0,t1_dgrudg6,Or dose it?,shittyrainbow6,dgtcdsm,1,t5_3h1lw
11791743,0,t3_6865do,The only thing that bugs me about this is that IQ is a hard counter to Pulse other than that fantastic meme. ,shittyrainbow6,dgwmttv,24,t5_3h1lw
11808398,0,t1_dgyifr9,What do you play on PC? I play Fuze as well and his shield isnt bad on console and his PMM with laser sight has like pinpoint accuracy and with a gun that does something like  damage its great.  damage is a ton and while Im not sure on the PMM theres a Rogue video about silencers and I know for a lot of guns putting a silencer on it doesnt change to shotstokill. And while I run the muzzle break on the gun I remember the recoil before the muzzle break came into the game being quite minimal. Point being maybe he just likes the sound of the silenced gun. Also I run Fuze on hostage but Im diamond so I at least know not to Fuze anywhere near OBJ but if Im going to Fuze Ill Fuze a hallway or a room around but not the OBJ. ,shittyrainbow6,dgyiu12,6,t5_3h1lw
