,controversiality,parent_id,body,subreddit,id,score,subreddit_id
103710,0,t1_ceq7xrt,You got it. I will try and get that up after work.,GuyFeet,ceq8lrs,2,t5_2tcju
182141,0,t3_1w64vs,I love the way your toes curl ,GuyFeet,cez6l7b,1,t5_2tcju
1010761,0,t3_25ob9i,I was pretty excited to find out you had a youtube account! Great vids buddy! Your soles are sublime!,GuyFeet,chj6j31,2,t5_2tcju
1075297,0,t3_26epq0,This is what cultivated my appreciation for fighting games. ,GuyFeet,chqijql,3,t5_2tcju
1257445,0,t3_28h8qc,Absolutely!!! D What size are they?,GuyFeet,cib2sy0,1,t5_2tcju
1262755,0,t1_cibf9ty,deleted,GuyFeet,ciboc38,1,t5_2tcju
2245610,0,t3_2kpjob,WowJust...Wow,GuyFeet,clp9q59,1,t5_2tcju
3967076,0,t3_35vkt3,I totally agree. Very masculine toes and feet,GuyFeet,cr8hb8s,2,t5_2tcju
5119392,0,t3_3l4a62,Wow super cute feet  ,GuyFeet,cv32udo,2,t5_2tcju
5350758,0,t3_3oalxs,glad to see em again man still think theyre perfect!,GuyFeet,cvvmawm,3,t5_2tcju
5504415,0,t1_cwcxyf2,around  or .?,GuyFeet,cwf8o3o,1,t5_2tcju
5586168,0,t1_cwpifza,Damn no cookie for me.,GuyFeet,cwpilf6,2,t5_2tcju
5589196,0,t3_3rmpsn,Your feet look so smooth man! Definitely wouldnt mind seeing those before going to bed. D Those legs too kind of unfair to have so much hot in one pic dontcha think?! ,GuyFeet,cwpw4f6,4,t5_2tcju
5772174,0,t3_3u7xfs,Have some more! Theres plenty where this came from guys  ,GuyFeet,cxclbap,3,t5_2tcju
5976872,0,t1_cy30015,Skipped leg day last week need to make it up P,GuyFeet,cy33l2n,2,t5_2tcju
7021863,0,t1_d1c3ff9,I have zero doubts my friend  ,GuyFeet,d1ca2fg,2,t5_2tcju
7046038,0,t1_d1ezbz4,Tops ,GuyFeet,d1f0ylc,1,t5_2tcju
7055694,0,t3_4c8pep,Hehe walking around barefoot at the beach is fun. Even moreso when you have a tongue to clean your soles and toes afterwards.,GuyFeet,d1g4epq,2,t5_2tcju
7328121,0,t1_d2au79y,P Not too much I dont wear shoes very often.,GuyFeet,d2b5oiz,1,t5_2tcju
7394561,0,t3_4glyxq,deleted,GuyFeet,d2ipo3e,1,t5_2tcju
7559553,0,t3_4ip8j3,Beautiful soles ,GuyFeet,d31hgic,1,t5_2tcju
7890854,0,t1_d42rnam,Perfect! ,GuyFeet,d43072y,2,t5_2tcju
9211429,0,t1_d8jm1i1,Aw thanks. I feel blessed,GuyFeet,d8jm8at,2,t5_2tcju
9753855,0,t1_daf2fgw,Thankyou,GuyFeet,dafdplm,1,t5_2tcju
10118790,0,t3_5kqjs3,Love your toes man!,GuyFeet,dbqhi3f,2,t5_2tcju
10936428,0,t3_5w6o7z,yes please! they look amazing,GuyFeet,de80kqo,3,t5_2tcju
11750041,0,t3_67i3qh,id love to see the tops ,GuyFeet,dgrwacs,2,t5_2tcju
