,controversiality,parent_id,body,subreddit,id,score,subreddit_id
4308574,0,t3_3ac2vp,Youre overthinking it. you dont need to have a sit down talk with him. Maybe a postsex conversation or something is all you need.,incest,csbavun,1,t5_2qx19
4319587,0,t3_3a2cdf,Incredible. You captured that excitement of sexual exploration.  That was beautiful and Im so jealous of your brother.  s  Thank you.,incest,cscjo80,2,t5_2qx19
4322097,0,t3_3ageup,Nice story but for the love of god can someone please explain me why op is using mvie instead of movie? Reading that gives me the need of punching something.,incest,csctv31,43,t5_2qx19
4340438,0,t1_csee0wo,All great advice  on all counts.I would also suggest that most people who are new to the idea of incest are kind of freaked out about it.However some people after thinking about it for a period of time will find the idea to be a turnon.With that in mind it might help to introduce her to the subject of incest in general terms through movies history books anime or manga and perhaps erotic stories.,incest,csewbo0,-5,t5_2qx19
4370502,0,t1_csi9zed,thank you  thats kinda sweet... cant wait to post the rest. ,incest,csiah44,5,t5_2qx19
4375886,0,t3_3b4zy4,ufeliciathrow it looks like your post does not contain one of the approved tags. Please click here to view our tagging guidelines and resubmit with the correct tag.I am a bot and this action was performed automatically. Please contact the moderators of this subredditmessagecompose?torincest if you have any questions or concerns.,incest,csiwcdu,1,t5_2qx19
4386230,0,t1_csk02cq,I hope everything works out for the best.,incest,csk2c6h,1,t5_2qx19
4397918,0,t3_3bbm6i,here you go,incest,csldp0j,2,t5_2qx19
4398707,0,t1_cslg72f,deleted,incest,cslgvym,34,t5_2qx19
4411776,0,t1_csmp9zk,Kind of did want it to be longterm but I guess I havent really thought about other stuff.... ,incest,csmxwyu,3,t5_2qx19
4437008,0,t1_csoca9y,deleted,incest,cspyxf7,0,t5_2qx19
4471045,0,t1_cstwgxp,Im not saying she will allow you to use her body if you tell her. But I think you should tell her without the expectations of sex but rather as a means to open up to her.After all she does love you platonically at the very least. And maybe you can reach a solution without sex.But in the end if your feelings are truly that strong. TELL HER!,incest,csu8z3r,2,t5_2qx19
4504100,0,t3_3crekp,I would clap but one hand is busy! Great story!!! Cant wait for the next one,incest,csye685,35,t5_2qx19
4505111,0,t1_csyhdp5,Thank you dear for taking the time to read it and your advice.  I think youre on point the only solution is to communicate.  My only worry is... what if it isnt a solution?  What if she just pushes me away?  What if she is so deeply ashamed by what we did that shed rather forget about it than have a relationship with me like she used to before we had sex?We still see each other though not much and talk but her reaction on Christmas day and her nonresponse when I texted her asking her to talk about what happened that night is sending me some very confusing signals.  It could be any number of things.  At first I thought it was just weird for her and she needed time to think about things but now more and more often I feel like shed rather just forget about it and worse that she regrets it so much that shed rather abandon our relationship than face it.Im okay if things arent the same after this but Ive been really struggling for months over what happened and its a very conflicted struggle I get horny then sad then horny then sad and really need some closure Id appreciate it if she as my parent made at least a little effort to show me where shes at.,incest,csyiq9r,13,t5_2qx19
4532928,0,t3_3ageup,Great story..looking forward to more updates,incest,ct20cov,3,t5_2qx19
4563032,0,t3_3djor0,deleted,incest,ct5saqi,0,t5_2qx19
4576373,0,t1_ct3zokt,Thats where I stopped too,incest,ct7gjjt,2,t5_2qx19
4576707,0,t3_3dptol,unotguilty it looks like your post does not contain one of the approved tags. Please click here to view our tagging guidelines and resubmit with the correct tag.I am a bot and this action was performed automatically. Please contact the moderators of this subredditmessagecompose?torincest if you have any questions or concerns.,incest,ct7i1qr,1,t5_2qx19
4589970,0,t3_3dw22i,uAlexshazamq it looks like your post does not contain one of the approved tags. Please click here to view our tagging guidelines and resubmit with the correct tag.I am a bot and this action was performed automatically. Please contact the moderators of this subredditmessagecompose?torincest if you have any questions or concerns.,incest,ct95u4b,1,t5_2qx19
4682564,0,t3_3f2ien,Having tried an MFM I can attest that nervousness around another naked dude can keep the erection away. Added plausibility.Should train both women to be openseason subs around the house anytime for you and the FIL any hole anytime. That sounds fairly hot actually especially if you can rope the sister in and keep it a shared secret. Like youre all watching a movie and can just grab one of their heads and start fucking face until they get into it and then maybe swap around some doubleteam both etc. Or make them not wear panties around the house.Things will get interesting once the FIL is OK with you banging the MIL. You could have nights of FILs treat where both women focus on him or s treat where they both focus on you and maybe each other.Or have like a reward system where the first person to say clean out the garage gets an hour of double attention...Please keep us updated esp. after you get more comfy with naked FIL! Im personally not into you and the FIL doing anything with each other but YMMV,incest,ctks7nz,-8,t5_2qx19
4722178,0,t1_ctpqbqa,deleted,incest,ctprq1n,1,t5_2qx19
4731145,0,t3_3fpqki,She definitely raped you. I feel like you should talk to her directly about it leaving out your wife just to get her to understand what she did was wrong and rape.,incest,ctqwidm,6,t5_2qx19
4751119,0,t3_3fxlhv,I would just repeat the same scenario. Disappear to your room leaving the door open again and slowly jerk off. If she is interested the last time will be fresh in her mind and it wont be long before she happens by your doorway again Conversely if shes not interested shell likely give it a wide berth. Either way youll have a better idea of where you stand.  Good luck!,incest,cttf96m,3,t5_2qx19
4751348,0,t1_cttftcr,You will have to do this OP.,incest,cttgaj4,15,t5_2qx19
4779358,0,t3_3g8d3e,gt I mean if a hot girl wants your dick.. who cares if its your sister?Imagine if everyone on earth had this attitude... life be sweet.,incest,ctwz97x,6,t5_2qx19
4787264,0,t3_3gevz5,So happy for you guys. Hope the move gos well amp you two have a wonderful term together. Wishing you both all the best!,incest,ctxz2ea,1,t5_2qx19
4793559,0,t3_3gjii9,Do you think she was really asleep or maybe teasing you?,incest,ctyrmpl,1,t5_2qx19
4795061,0,t3_3gk02r,I remember there was a fiction story here before about a guy going with his girlfriends family to an extensive familial gathering orgy where the young and old all fuck.,incest,ctyyg0f,1,t5_2qx19
4795680,0,t1_ctz16l8,Sorry for some reason I thought this was Ms disregard find a man in her life. She just needs a partner to fill that role for her. ,incest,ctz18vp,1,t5_2qx19
4803662,0,t3_3golpj,This is incredibly hot and sweetened my day. Wish there were more girls like you out there and I hope to hear more from you. ,incest,cu01i6r,10,t5_2qx19
4826012,0,t1_cu2ue2k,Thank you!,incest,cu2uwu5,1,t5_2qx19
4841936,0,t1_cu4sa1p,Minimal back and forth for me it is kind of like watching porn,incest,cu4v35e,1,t5_2qx19
4850488,0,t3_3hbmex,virtually no risk is a gross exaggeration. But the risk IS limited. Do a check about genetic illness in your family as the biggest risk is your children having twice the chances of developing a cardiovascular Defect or whatever of there is history of such things in your family. ,incest,cu5xuiu,13,t5_2qx19
4889522,0,t1_cuaq6fc,deleted,incest,cuav2xw,1,t5_2qx19
4902926,0,t1_cucjs5d,deleted,incest,cucjvnc,0,t5_2qx19
4903208,0,t3_3i1xel,This item has been automatically removed due to receiving a number of reports.I am a bot and this action was performed automatically. Please contact the moderators of this subredditmessagecompose?torincest if you have any questions or concerns.,incest,cucl5ib,1,t5_2qx19
4923784,0,t1_cuf5plb,Yeah. Im guessing youre pretty young but what happened as you described it is a fucking big deal. People arent necessarily thinking the way they normally would when theyre highly aroused among other things and they can end up making super irrational decisions they normally wouldnt even consider. A book called Predictably Irrational goes into this effect in detail. Unfortunately your state of mind in this case wont exempt you from the responsibility of what happened. Again this is big deal and you need to understand that. If youre an American you definitely just committed sexual assault you may want to google how your state handles that charge though Id be surprised if your father decided to go to the police. You couldve irreparably damaged your relationship with your father however but its probably too early to tell. You really need to be more careful because if youre going to be doing adult things you need to be prepared for adult consequences. ,incest,cuf6jpw,1,t5_2qx19
4949365,0,t1_cuh9wdt,Well that wasnt an awkward or weird thing to say at all...,incest,cuieoes,1,t5_2qx19
4957236,0,t1_cujay1p,Good luck!,incest,cujeejd,2,t5_2qx19
4965567,0,t1_cujj32a,being blackmailed into sex may qualify as rape btw. FYI,incest,cukg5d3,1,t5_2qx19
5024371,0,t1_cuqz8ws,To reply to someone you must click the reply button underneath their comment or they will not be notified or aware that is them youre replying to.,incest,curmmc5,1,t5_2qx19
5024468,0,t1_cuq9xqy,I just edited an update ,incest,curn1hk,3,t5_2qx19
5035289,0,t3_3jqvf2,Please!,incest,cusxzf9,1,t5_2qx19
5043444,0,t3_3k15lz,removed,incest,cutxcow,-2,t5_2qx19
5048002,0,t3_3jxqv1,Descriptive titles appropriatetags andlink flairsshould be applied to every post.,incest,cuuh4gh,1,t5_2qx19
5072495,0,t3_3kgpgm,This was such an incredible read! Couple of questions though firstly what were your mums feet like? Did you ever go further then using your hands on them or did she use them on your cock at all? Secondly how long did it properly take you before you thought it was hot what you were doing? Finally do you still have a relationship at all with your mom?Thanks again for posting was a fascinating and severely horny read!,incest,cuxfenm,1,t5_2qx19
5090962,0,t1_cuzn57m,At the time i felt like a monster but with the help of this sub annd my therapist it got easier ,incest,cuznimg,6,t5_2qx19
5099031,1,t3_3kui6z,Is your sister or her half brother married? if theres infidelity issues here itd prolly be the right thing to do to tell their spouse about the cheating.  If theyre both single and just two consenting adults having sex Id tell them to be careful and to think about what theyre doing but I wouldnt rat them out.  What two unmarried and consenting adults do in the bedroom is their own business and nobody elses.  I have several kinks I wouldnt want revealed to my family and if someone found them in my browser history and revealed the contents to my family Id be very upset.This decision will be a big one for you.  It has the potential to either ruin or solidify both your relationship with your sister and her half brother and their relationship with the rest of the family.If you really care about your sister Id keep her secret.  You are allowed to be appalled but the reality is its not your place to reveal it to other people unless there is infidelity involved.,incest,cv0mgfz,-2,t5_2qx19
5113382,0,t1_cv28ury,if your worried abt how to start  just ask her if shes alright. it should be enough.,incest,cv2cqt8,2,t5_2qx19
5126848,0,t1_cv3z18j,You are welcome. You do a great job and more people should tell you that.,incest,cv3z75e,3,t5_2qx19
5139690,0,t1_cv5hv06,Its the fetishists. If this were real life he would acknowledge that just because theyre related doesnt fuckin make this okay. It makes it so much fucking worse! Getting caught he wouldnt be able to say ITS MY SISTER ITS OKAY!Thats why I havent bothered to comment on this shit.Its so obviously just some guy havin a fap with the rest of the sub so I sincerely doubt that anything is actually happening IRL and even if it is not much I would be able to say would make it stop anyway.So.,incest,cv5iwr4,0,t5_2qx19
5154641,0,t1_cv5yivx,I think its cuz she was a minor when it happened tho i think she is about  now.Absolutely loved the story and I think its getting updated periodically cuz it doesnt seem to be complete yet. Ive been looking for that story as well and I didnt save the link. Goddammit. I downloaded the file and inside there is a link to the novelised version but just that.,incest,cv7brkl,1,t5_2qx19
5160377,0,t1_cv7r3ce,This is all past tense,incest,cv80msn,2,t5_2qx19
5170091,0,t1_cv82bq5,No its not like that. Majority of the womens dont really enjoy sex. They only have sex because the men want to. If the men dont they have no issues. Very very very few women enjoy sex Why do you think its like it? Because sex for women is painful and degrading. They literally get penetrated which you mentioned could get them hurt pretty badly. Degrading as they have to bend down and almost be below the man most if not all the time. Why would anyone be male or female want to be degraded like that. No one wants to be. But women have to in sex. Many women fake their enjoyment of sex just to please their man. Many women dont even like how the male sexual organ even looks. How can you say they enjoy sex? Many find it repulsive and unattractive. Men are hardwire to have sex while women are wired to avoid sex. The very very few women who like sex are the ultimate prime women. Those are really hard to come by like the orignal OP mentioned. Its one of the reason why women like to avoid men and be really really picky. They arent in for the sex or anything. Sex comes because they have to if they commit to a man. ,incest,cv96puc,-7,t5_2qx19
5190208,0,t3_3m3g5h,uthrowawayhh it looks like your post does not contain one of the approved tags. Please click here to view our tagging guidelines and resubmit with the correct tag.I am a bot and this action was performed automatically. Please contact the moderators of this subredditmessagecompose?torincest if you have any questions or concerns.,incest,cvbm0xq,1,t5_2qx19
5194793,0,t3_3m1h1e,removed,incest,cvc608s,0,t5_2qx19
5194869,0,t3_3m1h1e,removed,incest,cvc6c47,0,t5_2qx19
5194873,0,t3_3m1h1e,removed,incest,cvc6cqq,0,t5_2qx19
5194898,0,t3_3m1h1e,removed,incest,cvc6gnc,0,t5_2qx19
5211448,0,t3_3mdi2f,I would die of happiness if I were David in that situation lol,incest,cve67ht,1,t5_2qx19
5229219,0,t1_cvg9te7,It does feel like were starting to kind of dare each other to go further...and our toes are in the water but were both afraid to push the other in haha. ,incest,cvgb8uz,10,t5_2qx19
5236004,0,t1_cvh2uon,What? OP never said that. Another user commented that. ,incest,cvh4n6b,2,t5_2qx19
5240765,0,t3_3msdep,unoflyzone it looks like your post does not contain one of the approved tags. Please click here to view our tagging guidelines and resubmit with the correct tag.I am a bot and this action was performed automatically. Please contact the moderators of this subredditmessagecompose?torincest if you have any questions or concerns.,incest,cvhpabl,1,t5_2qx19
5242718,0,t1_cvhvr7g, Do not ask for proof pictures videos or invites to other websites.,incest,cvhxqn2,1,t5_2qx19
5243067,0,t1_cvhipw6,Thats really hard to predict I want to say no at least not to start but I really have no idea ,incest,cvhz900,2,t5_2qx19
5246245,0,t3_3mhftq,deleted,incest,cvid0wd,1,t5_2qx19
5271218,0,t1_cvlcigr,Ill take her to dinner sure but Im pretty sure Im not living in a porno.,incest,cvlgh6p,12,t5_2qx19
5315094,0,t3_3niupa,deleted,incest,cvr2dl2,1,t5_2qx19
5335316,0,t1_cvtjss5,just fantasy. i love my brother. i would never want it in real.,incest,cvtn97c,1,t5_2qx19
5336339,0,t1_cvtrbal,This.,incest,cvtrysc,-1,t5_2qx19
5376542,0,t3_3ojrs1,Dude this is really sad to hear. I mean were happy youre having an awesome time and getting your rocks off real good but you are on a slippery slope! I think you have been warned a lot in your other posts and Im not talking about comments that are like dude just bang her or doesnt matter got laid and that shit. I understand you came here for advice its a good thing to ask for advice. But to ask for advice and get it then not take it is kind of dumb imho. Wish you all the best. ,incest,cvywx70,2,t5_2qx19
5407043,0,t3_3p32wa,Hi cuzthrowawy thanks for submitting to rIncest!However your submission has been removed. This action was taken because it broke the following rules Do not bait users. Ill post more if people are interestedupvote. Asking for upvotes or comments is also not allowed.If you disagree with this action or want further explanation you can message the mods Please include a link to your post to speed things up.,incest,cw2t5zs,2,t5_2qx19
5407935,0,t3_3p40i0,How did your brother react to you finding him? What was the discussion involved before you decided to be a couple before other people?,incest,cw2xa4i,1,t5_2qx19
5447114,0,t1_cw7qx92,gtFor me I got it off my chest and realized that I was talking to the ghost of the girl I had loved. I guess thats good for you as sad as this is. ,incest,cw7x6oj,2,t5_2qx19
5487904,0,t3_3q8q9c,I dont think the mental stress can affect any form of cancer except in the recovery stages. It can if theyre being too rough with you.As long as youre comfortable sex during pregnancy is completely fine.Youd have to ask them on that last one Ive read posts on a different site of people being together until one partner passed away.,incest,cwd4p64,1,t5_2qx19
5497801,0,t1_cwee97k,...to the fuckin ground. lol,incest,cwee9n4,1,t5_2qx19
5501796,0,t1_cwewhpj,Lol I PROMISE were still adorable  just not when intoxicated.And yes mother dearest kicked off so much hell and was the first to discover us. She made us look like atypical uglyAmericans in a foreign hotel.,incest,cwewmld,4,t5_2qx19
5502038,0,t1_cwex3cq,or maybe shes here for the reason you are. That youre into it.,incest,cwexqm2,1,t5_2qx19
5503355,0,t1_cwf2ptj,I think ive learned that blood is an eversoslight thing for me. I guess the taste and violence of it is somewhat alluring. And yeah. Were gross people we spit on each other all the time.,incest,cwf3si1,2,t5_2qx19
5510825,0,t1_cwg15xl,You are right. I dont have delusions that she wants to have sex. I have been trying to figure out how to move forward since I am always going to have those thoughts. Talking about it outright will be awkward and risky but maybe I will be more at peace and it could start a dialog. Maybe I should wait to see if she catches me in the near future and see what she says next time.,incest,cwg23ko,0,t5_2qx19
5517694,0,t1_cwgrf3v,Lol no worries. I wasnt telling you step incest wasnt welcome. Its just my first time commenting on one. Im really glad for you and Im you have someone who truely loves you.,incest,cwgxony,3,t5_2qx19
5522855,0,t1_cwgylwk,Haha I just answered this in another comment.  B,incest,cwhleml,2,t5_2qx19
5531658,0,t1_cwiefbr,Molestation is not sex. Sex is consensual intercourse between two adults. Molestation is the sexual fondling and abuse of a child. I cannot believe that you think sexual abuse of children equals consensual sexual intercourse. I wasnt even conscious during the molestation I was drugged with heavy sleep meds. I feel sick to my stomach to think that you think my tormentor took my virginity when I was a child. Thats absolutely repulsive and a moronic outdated sexist way of thinking that I wouldnt expect from a girl. Internalized misogyny is a very sad thing indeed. Bottom line is that Im a virgin and have never had sex with anyone. ,incest,cwipumr,-1,t5_2qx19
5532691,0,t1_cwisejn,Dont they all I cant drink because of the allergy so its a designated drivers life for me still valiant effort on his part. That alone might make it worth forgiving him.Though now that you say that he deserved it I cant get the picture out of my head where you are at the valiant warrior princess on the shiny steed and Lee is the docile gothic prince in need of rescue. Where that came from dont ask for I dont know myself....,incest,cwiuljt,1,t5_2qx19
5533016,0,t1_cwivyo6,Obviously! It was the turning point of him being lucky as shit to becoming who he was meant to be. The people that disagree are casuals PPlus Dumbledores Army. ,incest,cwiw3eh,1,t5_2qx19
5540965,0,t1_cwjvk10,Sorry ,incest,cwjwnna,1,t5_2qx19
5568249,0,t1_cwn0ane,I have a nagging feeling I should be offended...but I did make a DBZ reference right before so...,incest,cwnaj12,5,t5_2qx19
5572782,0,t1_cwnuju7,Im saying that I am happy this isnt a zone free of judgement.Hurting other people who have some legitimate claim to be upset isnt anything to be ignored or celebrated.People should be called out on their shit if theyre claiming a story is true. If its fantasy whatever.When I say some legitimate claim to be upset what I mean is if they were to get upset with your infidelity I would see it as totally justifiable.It is very different from some random person in society being upset that youre doing something incest that doesnt really impact their life at all.With infidelity there are people directly involved being fucked over.,incest,cwnusqy,6,t5_2qx19
5621361,0,t3_3s3nx9,I agree with the other commenters cheating is cheating and the risk is too high to let some sexual fantasy ruin your life,incest,cwtvtku,3,t5_2qx19
5631279,0,t3_3s5lnc,How did your wife not notice the jizz all over the place?,incest,cwv43bb,3,t5_2qx19
5631618,0,t1_cwv5k7n,Aww thank you. Shit like this makes me even more excited to write. ,incest,cwv5lth,5,t5_2qx19
5632405,0,t1_cwun4a3,Im going to guess that there is some hot hot adoptive cousin makeouts in the next part if it ever comes. ,incest,cwv94eu,1,t5_2qx19
5635011,0,t1_cwuvael,Ive checked out my sister before. I would never do anything with her. ,incest,cwvkruh,7,t5_2qx19
5638299,0,t1_cwvy43j,deleted,incest,cwvzgrf,12,t5_2qx19
5646045,0,t3_3sfsof,gt and I did not want A Talk. I wanted a cock.Now that alone is worthy of an upvote ,incest,cwwy2x0,8,t5_2qx19
5676976,0,t1_cx0ibtp,Obviously havent run into the random women I have. The mere mention of a blowjob triggers the question where?,incest,cx0s9e5,-4,t5_2qx19
5713871,0,t3_3tdt3f,How will he be returning your underwear?,incest,cx5d0xz,2,t5_2qx19
5734401,0,t3_3su9r8,Your such a wonderful and caring daughter! You saw pain in someone you loves eyes and had to help in the most beautiful way possible you should feel good that you love him so much Im sure he loves you just as much. The part of you that wants more should get him drunk and fuck his brains out then hell pass out wake up and think it was a dream and then you can decide if you want to keep going or not!  ,incest,cx7wprx,0,t5_2qx19
5771085,0,t3_3u60z7,The fact that shes off fucking other people while your marriage is in jeopardy tells me something.,incest,cxcgg0g,9,t5_2qx19
5805061,0,t3_3tymwl,whats the update on your relation with sis? anything happened? ,incest,cxgo82z,1,t5_2qx19
5806375,0,t1_cwuvntp,You know that life isnt just about whether your parents love you or not?,incest,cxgu3kr,1,t5_2qx19
5845263,0,t1_cxlq3th,I agree that the joke did sound a little too forward. But what makes you think there is something from his side too?,incest,cxluauw,7,t5_2qx19
5851981,0,t1_cxmpd01,I ask myself if I would remove this if the genders were removed and I really dont know. I do know the users might have reacted differently if it was a father doing this to his daughter though. Overall I agree that it shouldnt be removed. If someone fucks up their life trying this theyre just plain dumb and there wouldnt be much helping them anyway. ,incest,cxmq171,1,t5_2qx19
5881474,0,t3_3vtt29,It should be noted that this is NOT fiction. ,incest,cxqle50,12,t5_2qx19
5932613,0,t3_3wm8ry,Did you tell him that the sales girl thought he was your boyfriend?,incest,cxxao0r,8,t5_2qx19
5935667,0,t1_cxxnxwx,Its my flair. ,incest,cxxp3d9,3,t5_2qx19
5953369,0,t1_cxzzr1x,Can relate again. Was told to stop looking.....Edit dunno why the downvote....didnt say it was the best route that OP should do it or that I wanted to.,incest,cy00mgb,1,t5_2qx19
5962845,0,t3_3x1amz,Stories like this give hope to a lot of us dads. Thank you for sharing and looking forward to your next update. ,incest,cy19d22,1,t5_2qx19
5970052,0,t1_cy26v4u,Yeah I got that  but whats TRP?,incest,cy27dt5,2,t5_2qx19
