,controversiality,parent_id,body,subreddit,id,score,subreddit_id
199645,0,t1_cf16adi,The only thing is that Im sure they can at least incorporate the option of playing with WASD controls into the standalone. Moving with the arrow keys in the standalone is what makes it really weird to play.. for me at least.Also thats some pretty interesting insight with the flash client.,TibiaMMO,cf16jxw,1,t5_2s3sk
329029,0,t3_1xtp4v,Used to play there before the server went to shit...AKA foul souls and before.Ronnar Rage,TibiaMMO,cfevi7s,1,t5_2s3sk
429487,0,t3_1ywubq,Congratulations,TibiaMMO,cfpa50m,1,t5_2s3sk
511077,0,t3_1zd0pq, RP here. I hunted Dragon Lords and Frost Dragons till level  then went to Grim Reapers and had k an hour with bonus staminano voucher. Grims are sill my main PG spot and now I can make about .kk an hour thereno voucher.,TibiaMMO,cfyd1wa,3,t5_2s3sk
633634,0,t1_cgc7rj5,Ive never understood why people disliked it. I was on the first round of beta testing for it and apart from slightly lower fps from like  to  say Ive never had a problem with it.In the c client there was always so much wasted space on my monitor. With the flash one I could fill it all up with all the customisation stuff. I do understand that because it is browser based it gives it more reason to fail I.e. Your PC The browser or flash could crash rather than just your PC or c but I wouldnt really say thats a reason to dislike it. ,TibiaMMO,cgcamed,3,t5_2s3sk
872417,0,t3_23wfz7,MS and RP ED and EKThese are by far the moat fun.,TibiaMMO,ch3g4qf,1,t5_2s3sk
962330,0,t3_253ysl,Whats your char name? I just started here too.,TibiaMMO,chdociq,2,t5_2s3sk
1364683,0,t3_29n1h0,If youre Ed and ek you dont need anyone else ,TibiaMMO,cincp7c,3,t5_2s3sk
1740415,0,t1_cjkl263,u mad,TibiaMMO,cjyjjm4,0,t5_2s3sk
2105133,0,t1_cl7alci,They hit hard and run fast at ... But certainly possible.,TibiaMMO,cl7epdp,1,t5_2s3sk
2126435,0,t3_2javb8,Mortal Shadow Sama,TibiaMMO,cla473c,1,t5_2s3sk
2212529,0,t3_2jwko1,If you miss it so much and feel like playing during the golden days again client . you should check this project out www.faloria.euIts a server based on CipSofts . client all sprites formulas no level req for runes all mlvl based etc. Also they got a great antibot client and a very active staff. You should really check it out. Hit me up if you are interested and would want to try it out and Ill help you get started!Some screenshots ,TibiaMMO,cll2djs,-5,t5_2s3sk
2268926,0,t1_cls4ei9,around  botters,TibiaMMO,cls5qhu,-4,t5_2s3sk
2405123,0,t3_2mzl83,        I have not played in forever.. but if I was going to play I would probably use these..,TibiaMMO,cm8zcvx,2,t5_2s3sk
2411872,0,t1_cm9mtdr,Ohh damm haha you are a redditor too Ill see ya in game p,TibiaMMO,cm9tegs,1,t5_2s3sk
2498393,0,t3_2o7j77,. too much exevo gran mas vis,TibiaMMO,cmkofe2,3,t5_2s3sk
2499436,0,t3_2o7j77,Obviously you UEd after you took level... Mana waste! DCongratz!,TibiaMMO,cmktbnx,2,t5_2s3sk
2691865,0,t1_cn9ximj,US central time. Im on now.,TibiaMMO,cn9y2sz,1,t5_2s3sk
2794644,0,t3_2s2sya,The homeland!! I came from Unitera. I am currently playing on Fidera. Were extremely active all speaking English guild with  members on a normal night we have between  people on on a busy night . I cant guarantee you a spot in the guild but I can guarantee some fun hunts and a big group of English speakers Most of us are from US Im on every night more or less but usually spend  hours hunting per week.,TibiaMMO,cnlqo54,2,t5_2s3sk
2871346,0,t3_2szjgn,Retro Pvp FTW!,TibiaMMO,cnuh15b,1,t5_2s3sk
2879593,0,t1_cnvcej4,deleted,TibiaMMO,cnveu0b,1,t5_2s3sk
2997753,0,t3_2uiexl,Well I got really lucky took me about  hours to eat slime and kill  waves but the mad mage has blessed meImgurlevel  RP  Sold for .kk,TibiaMMO,co8pqsr,4,t5_2s3sk
3134132,0,t3_2w0l8c,You can afford to pay world transfer but not prem? How does that make sense?,TibiaMMO,comumdp,1,t5_2s3sk
3415132,0,t1_cphg9yj,The way that AutoHotkey is being used here I would liken it to providing the same funtion that programs like Razer Synapse . provide. Anyone with a Razer peripheral will be able to use that software to bind the keys on whatever device they had to do many things. I think the line stands at whether or not the application is allowing you to automate game play or actions in any way. Here were simply swapping a key out to send a different key when pressed. The action is still undertaken by us and not automated in anyway. Perfectly understandable if you would prefer not to take the risk as the issue is not directly addressed by CIPsoft. This freedom of bindings is offered in the Flash client should anyone want to have access to it without the use of AutoHotkey.Thanks for your comment! ,TibiaMMO,cphjsd7,2,t5_2s3sk
3426699,0,t1_cpiuh78,Wow that sucks ,TibiaMMO,cpivaq2,2,t5_2s3sk
3516561,0,t1_cpsqcyz,these vids are highlights from my Live stream because I listen to copyrighted music twitch mutes the broadcast so I am not able to share the sound,TibiaMMO,cpt443p,1,t5_2s3sk
3766131,0,t1_cqldbbh,its quite active down here  players atm looking for something to do just lost a lvl killed by a lvl  ... maybe some hunting will do...im still ,TibiaMMO,cqlkfij,1,t5_2s3sk
3837285,0,t3_34dkt0,Aureraaurora is very dead after the removal of x exp but it might be nice to play in a calmer server?,TibiaMMO,cqtomf6,1,t5_2s3sk
3884323,0,t1_cqz163x,Passion for dividing the community?,TibiaMMO,cqz1o5y,4,t5_2s3sk
3884516,0,t1_cqz1o5y,A division of community? thats a bit glass halfempty! To expect an individual to choose one sub available to them or to see one sub as one to negate all others would be illogical!,TibiaMMO,cqz2gso,-6,t5_2s3sk
3918636,0,t3_35bgjp,EKED have the most team utility when it comes to team hunting followed by MS  some people dislike RP at high level because all of the other vocs can do everything they can do only better ...In saying that Im playing a RP but Im unlikely to hit  ,TibiaMMO,cr2yl5o,2,t5_2s3sk
3968159,0,t3_35s3ib,Im a big fan of  utura as it heals you  hp a second up to  hp so it makes it that much easier. handy to counter poison against ancient scarabs for the task. ,TibiaMMO,cr8lr1j,1,t5_2s3sk
4011224,0,t3_36du8p,Avalanches are probably the best way at dls lizards and hffs. deeper banuta if you want to use sd,TibiaMMO,crdidw5,2,t5_2s3sk
4014934,0,t3_36h0s7,Directly from the website since early yesterday  May     Tomorrow May  we need to conduct important maintenance work on our database infrastructure. Thus all game worlds and the website will be offline for a few hours starting at  CEST. We hope all services will be back online in the afternoon.,TibiaMMO,crdxlcv,1,t5_2s3sk
4030143,0,t3_36lcwn,Alchemist quarter is a good place bring energy walls and you can clear everything but demons ,TibiaMMO,crfo0xd,1,t5_2s3sk
4056552,0,t1_crimlxb,What level?  ,TibiaMMO,crioe44,1,t5_2s3sk
4102086,0,t1_crnsb99,I had a similar experience that ended up with me going to Calmera. First character was on Libera I think thats what it is called. Got to mainland as a lvl  sorcerer. Two people approached me and asked me if I wanted super good items. I said hell yeah! and they took me out of town just far enough that no one could see and then killed me lol. I quit and started on Calmera but eventually ended up on Astera. I remember seeing Fleety when I played Calmera though. I think Ingek was another high level.,TibiaMMO,crnv2v1,1,t5_2s3sk
4136136,0,t1_crrjlwr,Ure welcome mate ,TibiaMMO,crrqlmv,1,t5_2s3sk
4167796,0,t1_crv1pis,Im more upset for the fact that you forgot to serve the ham on plates! Savage!,TibiaMMO,crvc4pg,2,t5_2s3sk
4264766,0,t1_cs6cmrz,Oh you shouldnt be discouraged. Start off small one thing at a time. Im stating the true potential of the knight voc but everyone should absolutely play the way the feel like! Bottom line is that Tibia is a huge grind youll only get better and better with practice!,TibiaMMO,cs6cv8q,1,t5_2s3sk
4280392,0,t1_cs82c14,Wrong bots were around and plenty of people used them before GMs were gone. Hell even I used one back then. It was harder to find a safe one though but there were loads of UH farms of level  druids everywhere,TibiaMMO,cs84aya,2,t5_2s3sk
4315028,0,t3_3acfcc,Basically a PVP arena of Tibia on Dota... Sounds a lot like Magicka Wizard wars. But hey if its free and you have the will to make it happen id like to see it.,TibiaMMO,csc14bs,4,t5_2s3sk
4352022,0,t1_csg4t7i,I really hope not,TibiaMMO,csg7en0,1,t5_2s3sk
4369147,0,t1_csi1j1i,there are free account houses?I think Kazordoon Noble Quarter should be fine too or actually every house in Kazordoon ,TibiaMMO,csi4yqu,1,t5_2s3sk
4408854,0,t1_csmj13q,Thanks for help! Sadly Im extremely broke cant even afford promotion so its going to be hard to afford all of this P,TibiaMMO,csmm2ep,1,t5_2s3sk
4426156,0,t1_cshgieo,Posting as reminder both NA and EU server have been decided please check the main post again! ,TibiaMMO,csolx64,1,t5_2s3sk
4532476,0,t1_ct1x1j6,Well then it clearly has a problem I dont know. Maybe you should contact cips support if thats whats happening.,TibiaMMO,ct1ybaw,1,t5_2s3sk
4536143,0,t3_3d6j8a,Astera has a great english community and is one of the more populated servers to boot.,TibiaMMO,ct2ev5q,1,t5_2s3sk
4581328,0,t1_ct7gjfc,For any time youre free.,TibiaMMO,ct82vdr,1,t5_2s3sk
4595111,0,t3_3dxq95,Did you see the hunting and leveling database banner on the right side? There are some suggestions in there the Haunted Treelings area is very good but also very dangerous if youre not careful.Also check out the fifth post in this thread,TibiaMMO,ct9t0bp,2,t5_2s3sk
4595222,0,t1_ct9t7jw,About  avas more then Ive ever gotten there,TibiaMMO,ct9tifc,1,t5_2s3sk
4612143,0,t3_3e6i2w,cyclops until ur  or  then go mutated humans yalahar and do dragons with enchanted spears,TibiaMMO,ctbxx2a,1,t5_2s3sk
4615364,0,t1_ctc80g0, Corym Vanguard Corym Skirmisher Corym Charlatan Wild Warrior Orc Berserker Lizard Sentinel Kongra Werewolf Ancient Scarab Water Elemental Massive Water Elemental Retching Horror Choking Fear Elder Bonelord Waspoid,TibiaMMO,ctccgu2,1,t5_2s3sk
4632446,0,t3_3efs5j,Teamhunt?   D The best think that worked for me so far is dont play too much. I only play  hours a day and whenever I start I am really happy and when I finished I am as well. Perfect balance ,TibiaMMO,ctehmf7,5,t5_2s3sk
4669584,0,t3_3er7ae,Aftermath of h hunting in hero fortress with voucher went from ,TibiaMMO,ctj5jp9,2,t5_2s3sk
4675140,0,t1_ctjuj57,With what skills and runes you guys hunt? Exori? SD? Tell me more.,TibiaMMO,ctjuo7o,1,t5_2s3sk
4706362,0,t1_ctn5mj8,Come join us  We are very active! Lots of team hunting!! ,TibiaMMO,ctnrwh8,1,t5_2s3sk
4750211,0,t1_ctt18j6,Of course  I do it once a day! Figured thats enough! I get  errors if I do to many requests,TibiaMMO,cttb577,1,t5_2s3sk
4755290,0,t3_3g1jsz,Ignore my having full atk D was playing on EK.,TibiaMMO,ctty78y,1,t5_2s3sk
4757977,0,t1_ctu3jtn,New mount you can buy on tibia.com,TibiaMMO,ctuae4m,1,t5_2s3sk
4777523,0,t1_ctw2bw9,I mean for starters I would hunt cyclopolis until level  or something. After that you can try upper Spike in kazordoon from . Follow that up with either helheimtombsbb island.RPs are very versatile when it comes to hunting spots. ,TibiaMMO,ctwqybb,1,t5_2s3sk
4809076,0,t1_cu0ne2o,for chiesel my diesel,TibiaMMO,cu0q2ce,1,t5_2s3sk
4810329,0,t1_cu0u64e,Nah it doesnt double like that. only  per double exp bonus.Base  x exp Voucher  x exp Voucher  x exp  x exp ,TibiaMMO,cu0vr39,3,t5_2s3sk
4814601,0,t1_cu0w9yk,I like it D,TibiaMMO,cu1f4y0,1,t5_2s3sk
4867445,0,t3_3hjrf9,look for rp and ms and go edron new hero cave.I went there voc with lv  and we struggled a bit because the ed failed. but with  we started doing little waste but making kkh with HH and voucher. Once I made  in  minutes there. I stopped going there because it got boring. I see level ish people going there often. So just start there and enjoy!ED and MS bring avas RP loots a bit and attacks EK tanks and loots also  he carries m pots for the ED. ED needs way to much mana potions for healing. But its worth if you want fast level! ,TibiaMMO,cu82u3n,1,t5_2s3sk
4976220,0,t1_culs68e,I didnt know that a few months back I tried it out just for fun and didnt need to make an account that I remember sTheres still plenty of other proxys to choose from though if you make a search or even better maybe someone here could recommend one?,TibiaMMO,culsfmt,1,t5_2s3sk
5039377,0,t3_3jxv9w,Ive tried it others have tried it.  Theres a series of lets plays on youtube of that which is still going if youre interested.,TibiaMMO,cutfpgk,1,t5_2s3sk
5084950,0,t3_3kndmx,id appreciate some eq in nerana  Kappa Prime sent you pm.Thanks man!,TibiaMMO,cuyxh17,1,t5_2s3sk
5137031,0,t1_cv57bls,They can just add another nine sometime inbetween,TibiaMMO,cv57cos,1,t5_2s3sk
5186613,0,t1_cvarpc0,Fireblades were around when I started p  years later and I just hit  lol,TibiaMMO,cvb6dyh,1,t5_2s3sk
5191291,0,t3_3m2iy0,Hello! The only quests with a regenerationreward is World Quests as aksyong mentioned. The quest you found yesterday was probably Devovorge och the current World Quest. ,TibiaMMO,cvbqr5f,1,t5_2s3sk
5208941,0,t1_cvdtrb5,How old is your Calmera char? I played back when it started. Our circle was decent sized and definitely not exclusive. Any old schoolers still around?,TibiaMMO,cvdvbx3,2,t5_2s3sk
5301662,0,t1_cvougvr,Thanks for the heads up. Although its possible he somehow ran into the same royalty free music and decided to pick exactly the same part of it for the intro... I think I somehow inspired this dude which is great ofcourse.It seems a bit cheap indeed but eh cant really be bothered by it. ,TibiaMMO,cvpckgc,1,t5_2s3sk
5328862,0,t1_cvs59si,That happened to me lasts night also,TibiaMMO,cvstnbz,1,t5_2s3sk
5370083,0,t3_3okmjy,This might be the problem with the intergrated OSX hotkeys brightness and volume etc.. Go to your Boot Camp Apple Software that you installed togather with the Windows and thenBootcampControlpanel gt Keyboard gt Turn on the function to use F and other keys as normal keys. There you go the Fkeys now should be fuctional as normal Windowskeys. Now if you need to change volume or brightness press fnkey and then you have acess to OSX Fkeys.Hope it works ,TibiaMMO,cvy36z3,4,t5_2s3sk
5394659,0,t1_cw0qyzu,Tibia is developed. Theyre only now just getting serious about marketing it. Do you realize that they dont advertise? They have a small social media presence. They are taking it slow and steady. I doubt they could handle an influx of  players. If they wanted more players they would be advertising. It seems as of now they are doing all they can to milk the existing player base. ,TibiaMMO,cw187qj,1,t5_2s3sk
5434607,0,t1_cvctj50,Heh i own the house just above this  Edit bought mine like a year ago for kk,TibiaMMO,cw6bq6w,1,t5_2s3sk
5488908,0,t1_cwc89v3,Never had that kind of nightmare blade luck before it was pretty crazy.,TibiaMMO,cwd9bq9,1,t5_2s3sk
5500824,0,t3_3qdyra,Here is the video its pretty much me just sprinting back and forth hoping for best.,TibiaMMO,cwes5ts,1,t5_2s3sk
5530081,0,t3_3quq3p,a Tomb maybe peninsula. Hydras in Port Hope also.,TibiaMMO,cwiilz6,1,t5_2s3sk
5562732,0,t3_3ra854,Just jump back on it mate. Honestly The fun is still there and you canalways judge yourself since no matter what people tells you here and the end of the day is your opinion what mattersI came back from a really big break and made a new char in february. Already  RP and having tons of fun haha,TibiaMMO,cwmlvhx,1,t5_2s3sk
5622817,0,t3_3s48iu,Its not much compared to most of the posts that end up here but I did snag  carrots on a stick while doing my carniphila tasks!,TibiaMMO,cwu2b9a,4,t5_2s3sk
5658346,0,t1_cwxt4cu,My account is  year old and I got invited too,TibiaMMO,cwyh15g,1,t5_2s3sk
5756767,0,t3_3u01rm,congratulations mate! D,TibiaMMO,cxaojx4,1,t5_2s3sk
5757266,0,t3_3u0a3z,What level are you and what server?,TibiaMMO,cxaqs7a,2,t5_2s3sk
5760866,0,t3_3lcfbb,Irmada  rp  ek  ed,TibiaMMO,cxb6te9,2,t5_2s3sk
5770553,0,t3_3lcfbb,Fidera  EK. Name is  A few other Redditors here and lots of nice English speaking people  ,TibiaMMO,cxce2no,2,t5_2s3sk
5915452,0,t1_cxug751,War. I think this was WGO vs Respekt,TibiaMMO,cxv1q6c,3,t5_2s3sk
5937520,0,t1_cxxwp32,Thanks  ,TibiaMMO,cxxxtpk,2,t5_2s3sk
5960629,0,t1_cy0ueox,I hope youre right. He passes on the cash to other characters a few times before they go to one of his main accounts though. I dont know if that is traceable since he could just throw it all on the floor somewhere and pick it up on a character logged in with another IP. Im afraid the botters will win  for now. ,TibiaMMO,cy0ywbw,1,t5_2s3sk
5985692,0,t1_cy457sn,Thank you very much! The remote ones are pretty cool I feel more emerged in the game.,TibiaMMO,cy497rk,1,t5_2s3sk
6027921,0,t1_cy9qsrt,deleted,TibiaMMO,cy9s4k9,1,t5_2s3sk
6040464,0,t1_cyb81es,deleted,TibiaMMO,cybeyvn,1,t5_2s3sk
6043778,0,t1_cybqwxs,First of all Sebrawr I wasnt trying to Impress anyone lol was just having fun with a friend on tibia Isnt that what this game is all about? Isnt that why we all play this game? you shouldnt be such a Grinch   during the Holidays and smile  cheers mate,TibiaMMO,cybuimw,4,t5_2s3sk
6115273,0,t1_cykpooa,Thanks man!,TibiaMMO,cykqrtn,2,t5_2s3sk
6118937,0,t3_3zcyva,deleted,TibiaMMO,cyl5rf8,-8,t5_2s3sk
6120327,0,t1_cyl5rf8,How stupid do you have to be to actually play with them? Do you not clearly see that the only reason they exist is that they have some kind of unfair advantage?,TibiaMMO,cylbgcd,2,t5_2s3sk
6121498,0,t3_3zc5pd,Depends on the level ofc. If youre  as a mage Id say you can level really fast while still making a profit potentially making your money last forever. Hunting City or Inq and such places always yield me a good profit and nice exp.,TibiaMMO,cylg8iy,1,t5_2s3sk
6133544,0,t1_cym5tuy,You actually need to be careful with tags like that in your videos. You can be reported for misleading tags and the misleading description content in some of your older videos. This can get you strikes or even have videos and potentially your channel removed.You definitely are in the realm of enough subscribers and views to not need to do that at all.,TibiaMMO,cymtilt,1,t5_2s3sk
6140064,0,t1_cynjh32,lol I bet  of the players are asking the same thing. Is the guild active again? no? oh I just wont play then... YOU ARE THE REASON ITS NOT ACTIVE.Youre not stuck in traffic you ARE traffic.,TibiaMMO,cynk7dx,2,t5_2s3sk
6142294,0,t3_3zoojg,it depends on what you hunt if the monster hits hard enough the  difference will make the dwarven legs better.,TibiaMMO,cyntc4d,1,t5_2s3sk
6177169,0,t1_cyrrrgm,You could get to  with those days. Vouchers became so OP when they added the ability to pause them.,TibiaMMO,cyrs38n,2,t5_2s3sk
6181667,0,t1_cyrxfi6,Yeah I just got killed there yesterday by two guys I cant complain since its my only death and I got lvl  in three hours with the double xp. ,TibiaMMO,cysahou,2,t5_2s3sk
6193390,0,t3_40bo9f,Nowadays it goes Axe gt Club gt Sword in terms of overall damage obtainability and price. That being said Club is bestest average. Also I just like clubs.,TibiaMMO,cytmfuf,1,t5_2s3sk
6200278,0,t1_cyuclob,Or when you go to the boat with no gold XD,TibiaMMO,cyuelk1,1,t5_2s3sk
6200536,0,t1_cyueejj,Is there any reason to use crossbows? It seems tempting due to being able to make power bolts.,TibiaMMO,cyufnkg,1,t5_2s3sk
6206290,0,t3_40jjq5,Looks neat! By the way what is that outfit youre wearing? I cant seem to find it anywhere,TibiaMMO,cyv37q6,1,t5_2s3sk
6209263,0,t1_cyvews6,Say news to Orockle on Gray Island.,TibiaMMO,cyvfcro,1,t5_2s3sk
6234581,0,t1_cyy7w6u,They have like  employees.and a k euro turnover in . So I doubt its the manpower that is lacking.source ,TibiaMMO,cyyaye8,2,t5_2s3sk
6251630,0,t1_cyzimhc,i blame the sob. he said he was sorry  guess what he didnt make it up by giving me back hours of mlvl. nah....,TibiaMMO,cz08rfj,1,t5_2s3sk
6252974,0,t1_cz0b1fv,If youre a knight or a paladin yeah I definitely would. I only say that because as a Mage you tend to die more hunting and if you lose full bless and arent making a lot of profit hunting itll be hard to get all the blessings back. Its best to get it early on though because then if anyone PKs you they wont get anything which usually prompts them to add you to VIP for more loot since most people bless up. You can still get them as a Mage my friend got to level  just wearing a plate set and carrying supplies in case he got PKed. Good luck!,TibiaMMO,cz0e8yj,1,t5_2s3sk
6267388,1,t3_41fwz4,Flash is unnecessary and very slow for a lot of tasks. People praise it for all the extra features it has but in the end you wont use half of them nor will they make you any better or help you level up. My recommendation would be to stick to the standalone client as its by far a more stable and straightforward gameplay experience.,TibiaMMO,cz216c4,3,t5_2s3sk
6271229,0,t1_cz26y91,I wouldnt chose Aurera. It together with Aurora is a preview server which is mostly abandoned by players. Chose any but those two servers. On the normal servers youll get around kk for .  million is still a lot. Im think I used around  million as a sorcerer power gaming today lvl . If you chose knight or paladin youll get INCREDIBLE far with kk. It can yell your which US server that it good button I heard Amera is good if youre want Open pvp. If you like Hardcore pvp Dolera is your choice youll die a lot on them beginning since there is no limit to pking. ,TibiaMMO,cz2gvlv,2,t5_2s3sk
6272892,0,t1_cz2514l,This. I tried the flash client and it was just kinda laggy I even died once because of it.,TibiaMMO,cz2nnwy,2,t5_2s3sk
6274921,0,t3_41ic18,Got Ron the Rippers Sabre from the Liberty Bay raid.   Been to this raid a couple times and always have bad luck beating others to the bosses so this felt really good!,TibiaMMO,cz2vyvs,3,t5_2s3sk
6317441,0,t3_425kod,First video ever made so take it for what it is.Also music is tribute to Smokeds DL solo movie from  if someone else remembers  ,TibiaMMO,cz7q0p2,4,t5_2s3sk
6317977,0,t3_425kod,Congratulations! You were so close to dying got me all nervous haha,TibiaMMO,cz7s7ua,3,t5_2s3sk
6332545,0,t1_cz9cdyc,They dont. They have the same dmg as crystalline arrows without the hit increase without the atk and without the extra range.The good thing about them is that you can wear a shield while using them but its not comparable dmg wise,TibiaMMO,cz9fvu6,2,t5_2s3sk
6333795,0,t3_42aplt,Another great vid eric! I really wanna check this place out.Do u recommend to have someone come with me when I do some of the quests?And what ml were u? Atm i have ml  but dont think it will do too much dmg,TibiaMMO,cz9l000,1,t5_2s3sk
6337620,0,t3_42fqau,This is sweet. This reminds me about how awesome it would be if they added outfits addons and colors to our dead bodies like how they did with Necromancers Warlocks Priestesses etc. I think battlefields would look a lot more cool and itd be funny to recognize someones dead body by the outfit rather than having to click it. Ive considered making a proposal but I dont think itd really be a priority right now. ,TibiaMMO,cza0mls,5,t5_2s3sk
6355644,0,t1_czc1h09,Desert quest is safe. Barely anyone heads over there. Sent you guys some plate stuff I could find and like k.,TibiaMMO,czc2f3h,1,t5_2s3sk
6361222,0,t1_czcoujt,Disable light effects in advanced settings.,TibiaMMO,czcp7up,4,t5_2s3sk
6379527,0,t1_czdtuft,Using flash and the tibia client is allowed using a third party program to open multiple tibia client isnt,TibiaMMO,czes85b,1,t5_2s3sk
6406859,0,t3_43coup,Omg even though i knew the outcome i was still biting my nails. You were so close!,TibiaMMO,czhw85e,1,t5_2s3sk
6495227,0,t1_czr4zdu,While its a good spawn to hunt the best thing about it is its quick resupply at rebel base so definitely do the mission that allows you to buy supplies aswell as the postman quest as there is a mailbox behind a door in the rebel base.Grab all your cash and live there. ,TibiaMMO,czr5kl3,1,t5_2s3sk
6548766,0,t1_czwogcy,its bageltoe u hoe!  im almost lvl  on my ms,TibiaMMO,czwp2g3,2,t5_2s3sk
6554009,0,t1_czwlve9,Nice to see another poe player in the wild what build you working onplanning to make?,TibiaMMO,czx8kpr,1,t5_2s3sk
6567581,0,t3_45jqqf,The whole thing reads like a poland ball comic between polan and Roosya. Except its between real people and shows real people can be assholes.,TibiaMMO,czyn4pj,3,t5_2s3sk
6587037,0,t1_d00lqws,Thanks topkeks,TibiaMMO,d00nj4g,-2,t5_2s3sk
6593835,0,t1_d00rt4p,Theyll probably update the second before he hits  so people cant floor spy there.,TibiaMMO,d01cuny,2,t5_2s3sk
6634184,0,t1_d053tve,Add me Kingstaz,TibiaMMO,d05j5oi,1,t5_2s3sk
6649623,0,t3_46q0jq,Bots is possible on flash ,TibiaMMO,d074n2p,4,t5_2s3sk
6683323,0,t1_d0aipup,ill try with terra set gill is  lvls ahead c why earth protection? and which mobs should I be killing... and if you dont mind giving me some tips Ill appreciate it,TibiaMMO,d0am481,1,t5_2s3sk
6699526,0,t3_47e9lk,AFAIK you need either the account name or the name of one of your characters to be able to restore your password via the website. Cipsoft should be able to lookup either your account name or one of your characters using your email adress so you might want to email them and ask nicely.,TibiaMMO,d0caeur,1,t5_2s3sk
6721317,0,t1_d0e9j4x,I got a dream matter I was very happyIm also a knight at lvl  so I had no right to be anywhere near that boss.,TibiaMMO,d0ejj10,2,t5_2s3sk
6722170,0,t1_d0em88f,Awesome thanks,TibiaMMO,d0empbi,1,t5_2s3sk
6736332,0,t1_d0g36vn,but the other provides  skill isnt that a lot better than  attack from umbral master h,TibiaMMO,d0g3foa,4,t5_2s3sk
6770089,0,t1_d0jnj1h,Thanks! Were all very happy with it!,TibiaMMO,d0jo5f5,1,t5_2s3sk
