,controversiality,parent_id,body,subreddit,id,score,subreddit_id
7776287,0,t1_d3p8mtt,Long story short it will stop enemies from using skills making them only auto attack and follow you for any distance.,GuildWars,d3q3mqx,1,t5_2quyl
7860503,0,t1_d3yxva8,Thats what Im going to go with,GuildWars,d3zlaw8,1,t5_2quyl
7876555,0,t3_4mw4m9,Gdubs  GWGdubdos  GWboth sound like bad th gen pokemon!,GuildWars,d41ebdr,1,t5_2quyl
7887606,0,t1_d42mopl,It wasnt only me with lag but my friends aswell. Whats the matter then?Also do people play in private servers now?,GuildWars,d42n1ni,1,t5_2quyl
7929643,0,t1_d46g9ut,Funny there seemed to be more people on the Luxon side even though Kurz were winning most of the time because of all the Rits and Monks lol it was healer heaven.,GuildWars,d47d7fn,3,t5_2quyl
8169040,0,t1_d4yobyt,Thanks a lot  I guess I might look for a questing or HoM achievementhunting guild if that exists.,GuildWars,d4yogvr,1,t5_2quyl
8170267,0,t1_d4yrx6i,Good to know. Thanks.Im not looking for a big Guild but one that can offer a close knit community to new returning and veteran players.,GuildWars,d4ytzl7,1,t5_2quyl
8176921,0,t1_d4znl08,Omg Im an idiot tyvm,GuildWars,d4zny54,13,t5_2quyl
8290878,0,t3_4t152t,Depends on what you are looking for. Are you looking for max titles? Then it really doesnt matter. You have to do all dungeons in both modes two books all primary quests in both modes two books and vanquish all areas.Because the only reason to aim for max title is to do a good and then youll most likely do the master of the north as well.If you are looking only for r to have the max pve skills then vanguard sucks the most so I mostly use the NM book for this one.,GuildWars,d5dx2wm,2,t5_2quyl
8344918,0,t1_d5kn3d5,By changing the st rit is zway better than hero or worse? ,GuildWars,d5ko2vb,1,t5_2quyl
8353340,0,t1_d5lhbge,Oh I should have worded it better. I like ST a lot I just didnt agree with the other skills Zway uses in conjunction with it. As for your link its basically the same concept as  hero player support with only minor variants for melee characters so it will definitely work. The only thing I would change is dropping one of the healers or the ST Rit and replace it with a minion bomber or SOGM Rit. You shouldnt need  healers an ST and a hybrid smiter to keep your party alive. If you do have too much healing and not enough damage stuff wont die as quickly and you can get overwhelmed easier if there are large groups. Not to mention having less damage will be slower.,GuildWars,d5lpy68,3,t5_2quyl
8496468,0,t1_d62siui,Not OP but Im at the same point as him and need this quest. Where can I find Zunraa to accept it? The wiki assumes you already have the quest. ,GuildWars,d63lylb,1,t5_2quyl
8531722,0,t1_d680oyo,See ,GuildWars,d6812vc,1,t5_2quyl
8719000,0,t1_d6vhou2,Yeah I go back and replay every year. My first MMO game when I was ,GuildWars,d6vijry,1,t5_2quyl
8735191,0,t1_d6wv5eb,Weapons mainly give spellcasters Max Energy Enchantment Duration Faster Casting or Faster Recharge.Only the Enchantment Duration is vitally important when you need it but all the others can help.For a Spirit Spammer you dont use Enchantments or Spells so you dont really need a weapon at all. Best is a max energy staff  which should be easy to get.If you want to equip your Heroes just get a Enchanting Staff for those that use Enchantments and youll be set.,GuildWars,d6xjo4o,1,t5_2quyl
8749247,0,t1_d6z8uuy,Read your gwscr inbox ty,GuildWars,d6zb7na,2,t5_2quyl
8753268,0,t3_4zysxj,,GuildWars,d6ztdpp,10,t5_2quyl
8869317,0,t1_d7dyg2q,Olias should have Lingering Curse over Suffering if possible its basically the same but much better. Otherwise one of the other decent elites PoD IV SS etc. Suffering is the skill you want to replace the others are decent.You dont want to run Soul Twisting and a minion master  the spirits will be eaten up entirely by the minions which you really dont care about. I would drop the MM for a RoJ monk maybe. This leaves you with the very strong ST support.You dont want two copies of SoS since they will iirc cancel each other change Razahs SoS for a Signet of Ghostly Might communing build for much the same effect as another SoS.,GuildWars,d7dytv8,1,t5_2quyl
8870211,0,t1_d7dyg2q,Dont bring two SoS they dont stack so will kill each other.  If you want  rit team have one of the SoS become Signet of Ghostly Might Communion build that way you can specialize and bring PvE skills by cutting CommunionChanneling.  Olias has no elite for a cursesresoration necro taking Pain of Disenchantment in gemeral or Spiteful spirit in elite areas is a good way to go.  Do not run both a Minion Master and ST minions will end up killing your spirits too fast when there is any AoE.,GuildWars,d7e2os9,1,t5_2quyl
8948228,0,t1_d7nftu4,I dont think so this is the one where you have to escort him to the keep and then defend him from the White Mantle after you kill Dagnar Stonepate,GuildWars,d7ng0on,2,t5_2quyl
9024501,0,t1_d7la0ka,Aunt Flo? shudder,GuildWars,d7wlqo8,1,t5_2quyl
9032101,0,t1_d7x9skk,Although I do completely get what you mean the latest story and this instance in particular was pulled off really damn well. Theyre starting to hearken back to the GW style of storytelling a bit more and using setups ala Great Northern Wall where you actually get overwhelmed by real enemies and take part in it rather than simply showing you in a cutscene.There are still many criticisms to level at GW but this is something I actually think theyre doing right.,GuildWars,d7xikk2,23,t5_2quyl
9079529,0,t3_54n0z4,  There is the UI Style still listed but the links are broken. Maybe youll find a way to contact the maker from there. ,GuildWars,d837n2j,3,t5_2quyl
9087960,0,t3_54qrpu,Get a friend to keep it for you or use try and sell it or get an alt account to hold it for you. Or you could try and recruit yourself a guild roster.,GuildWars,d8485gi,2,t5_2quyl
9132326,0,t1_d87kx7v,Oh yeah btw if you have any questions about heroes or anything else PM me here!,GuildWars,d89l6gh,1,t5_2quyl
9136518,0,t3_55esql,If you are a monk or mesmer you can  or was it  kill him with two monk bonders. I cant remember the exact build off the top of my head though. There is also a solo build that can kill it that I know people use to run to get paid to complete the mission for people.As I did not move all my templates over with getting a new computer sadly I can not help in that department. Come next week I may dig out my old box and see if they are there.,GuildWars,d8a4bwr,1,t5_2quyl
9138883,0,t1_d8af0aw,My Ritualist is Shizuki Iwamoto but I am going to sleep now. Already  o clock here. My sleep rhythm is messed up when I dont have to go to the university.,GuildWars,d8af4di,1,t5_2quyl
9268636,0,t1_d8oyj6d,I checked out a few old ER spots. Mantids close to Nahpui Quarters and Ran Musus Gardens Kappa near Gyala Hatchery and Imps at Talmark and Ice Flow. Ill be posting them once I get the time probably together not one by one. ,GuildWars,d8qv69u,1,t5_2quyl
9277627,0,t1_d8rhx33,Thanks. I did! My merc heroes team comp is now  mesmerparagons pure dps and  necroritualist for healing all decked out with  weapons. OMG! The dmg they put out is unreal! D,GuildWars,d8s080h,2,t5_2quyl
9367662,0,t1_d93dkkc,Its likely slowed down to handle a much larger player base.  So the price doesnt wildly fluctuate throughout the day.  Im sure if they adjusted the rate of increase to the player base there is now it would be a much different story. ,GuildWars,d93f29p,1,t5_2quyl
9382246,0,t3_592yf7,Ive been working on Clearing elite areas with only heroes. Right now I am working on UW if you want to join. PM me for an IGN.,GuildWars,d959lb6,2,t5_2quyl
9440351,0,t1_d9cmnvt,Yes. Vaettirs and raptors will provide plenty of drops that you can sell for a pretty penny. UW Plains will provide ectos which you just sell to the rare material trader for around k a pop depending on market forces.,GuildWars,d9cmq9e,3,t5_2quyl
9465558,0,t1_d9e9jwy,Mine was around k. ,GuildWars,d9ftr25,1,t5_2quyl
9537404,0,t3_5bg41w,Very interesting I wonder if youd notice the same difference by making your interrupt heroes either have a sword and flag them back or give them a rit item spell to hold.,GuildWars,d9oomk8,3,t5_2quyl
9551279,0,t3_5bpnfd,Binding chains psychic instability churning earth and deep freeze all come to mind.Are you microing the RoJ? If youre going full micro then use a combo of the skills above.If you want a challenge use YMLAD epidemic.,GuildWars,d9qe4rg,3,t5_2quyl
9628821,0,t1_d9zy087,Youll need to do the main quest lines eventually as they are one of the sources of skill points in the game. For  bucks Id say the game is worth a try Ive been playing for several months and Ive hardly touched all the content in the base game.  But keep in mind it will eventually be costing month when you get in to it. Of course the sub includes all current and future content while the sub is active and non subs need to buy DLC separately as it comes out. ,GuildWars,d9zy7ml,1,t5_2quyl
9668723,0,t3_5di712,Pretty cool. Im planning on playing through again with my girlfriend whos never played but not for a few months. ,GuildWars,da4vf8l,1,t5_2quyl
9797118,0,t1_dagpxnz,I havent done legendary hero so Ive got a bunch of those sitting in inventory waiting for the right zaishen daysactually playing days.,GuildWars,dakpfu1,1,t5_2quyl
9878199,0,t1_dav5bkp,Just got another reply from the GM.  When they tried to link my GW account with my GW it was already linked to a beta GW account with a different email a yahoo.com address... Ive only ever used yahoo.ca as far as I can remember.  Waiting for another reply in the meantime.Edit Im in!!,GuildWars,dav5hsz,2,t5_2quyl
10001212,0,t3_5irprq,Id like to attend! Ive heard about the Mursaat Rallies a long long time ago but never attended one.,GuildWars,dbb6q21,2,t5_2quyl
10154044,0,t3_5le1kz,no just no you didnt get hacked through guild wars it simply isnt possible. you most likely downloaded something a bot perhaps? and it dumped your account info,GuildWars,dbv0mpu,16,t5_2quyl
10178967,0,t1_dbxu76a,i already had factions added to my accountbut it was sold by amazon directly not usedwarhouse,GuildWars,dbxubpt,1,t5_2quyl
10193483,0,t3_5lvbrw,If you can get ahold of  necro Heros I recommend Discordway. Im sure a lot of old heads will remember breezing through large parts of the game with it.,GuildWars,dbzhjzo,0,t5_2quyl
10195943,0,t1_dbzonen,Yeah I dont think theres anyth ik ng but the official guild wars server ,GuildWars,dbzrlkn,2,t5_2quyl
10279384,0,t1_dc95mgm,deleted,GuildWars,dc983a9,1,t5_2quyl
10303348,0,t1_dc3yay1,Sync teams never work too well unless the players are extremely skilled because A Guild Wars is called build wars for a reason you can easily pick builds that hard counter them in some way and B A lot of the players in RA are good and dedicated so you can always beat sync teams the communication they have is not gonna make a difference.,GuildWars,dcbxuf0,1,t5_2quyl
10320683,0,t3_5nr3b1,If youre planning to start in prophecies the professions that you want to pick wont be available. In Factions Cantha you will have access to Assassin and Ritualist and in Nightfall Elona you will have access to Paragon and Dervish.,GuildWars,dcdwmqh,2,t5_2quyl
10323619,0,t1_dcdra5m,Thanks!,GuildWars,dce8m90,1,t5_2quyl
10338256,0,t1_dcfw9oq,Awesome.  Should have specified I love ranged characters. ,GuildWars,dcfweed,2,t5_2quyl
10368465,0,t3_5of0hw,Make your soul twister rit hero drop shelter before aggroing and use pain inverter once his carapace is down for a fast kill. ,GuildWars,dcjbsx8,1,t5_2quyl
10400735,0,t1_dcmxnbm,No. Consumables make high end PvE easier they arent keeping it alive. High end PvE would still exist without unlimited consumables. If anything having unlimited consumables is dumbing down the high end content removing the need for skill and replacing it with buffs.,GuildWars,dcmznfa,7,t5_2quyl
10436306,0,t1_dcqszzq,AoE interrupts like Panic Psychic Instability and Cry of Frustration are particularly good. With a few of these on your team the enemies are highly unlikely to get any Meteors off.,GuildWars,dcr0wu5,3,t5_2quyl
10490371,0,t3_5q7ja4,Pretty sure the Ritualist was Guild Wars version of an engineer archetype from other games. Theyve stated this before they went to GW iirc. They did such a great job for Ritualists though both aesthetic and mechanic wise. Maybe for Paragon they wanted a tanky party buffer? Im guessing theyre meant to be oneofakind leaders because shouts dont stack. I cant think of another games equivalent currently. Im pretty sure Paragons are based on GrecoRoman spearpilum throwers. More Greek than Roman if you ask me. Their armor reminds me of Greek Hoplites. Add in a little angelic themes too like the spear of destiny and that some angels are depicted wearing ancient GreekRoman armor. In my opinion most unique is the Mesmer. Out of all the games Ive played the only other class match a Mesmers control abilities are the DominatorsControllers of CoHV. GW Mesmers should be ashamed.       ,GuildWars,dcx6zlc,11,t5_2quyl
10492583,0,t1_dcu7jus,it should be around once every  drops. i did it around  times also but i only get polymock pieces. at least im a polygod now,GuildWars,dcxg0dz,1,t5_2quyl
10493312,0,t1_dcwmqor,With enough ingame experience its easy to come up with builds like that. Dont have to be a spreadsheet gaming nerd just need common sense and creativity....  ,GuildWars,dcxizdz,2,t5_2quyl
10603635,0,t1_dd9e62h,Barrage and preparations you say?,GuildWars,dd9on44,2,t5_2quyl
10751015,0,t3_5tovdj,I would say stick with this! I use something almost exactly the same but on the final Nart I run Blood is Power. Its powerful and you can AFK your way through everything. I would personally never run an MM necro when you can have  mesmers. Theyre always more beneficial for shutdown and melee padding is strong enough with EVAS. If youd like to see my exact builds that I use for Caster vs. Melee character feel free to message me in game! ,GuildWars,ddovv2b,1,t5_2quyl
10811536,0,t3_5ulw0j,removed,GuildWars,ddv4tj6,-4,t5_2quyl
10814593,0,t1_dduz1td,Botted to number one then lost your place because other guilds didnt like that lack of ethics.,GuildWars,ddvg6c5,1,t5_2quyl
10838320,0,t1_ddxvz3m,Base Defence,GuildWars,ddxw9hx,1,t5_2quyl
10893326,0,t1_de26jgl,I dont see a great demand for this. How many potential customers have you met?,GuildWars,de3ki7u,1,t5_2quyl
10893876,0,t3_5vfk0c,If you still need help this weekend Ill lend a hand. Red Ruhm ign,GuildWars,de3mjs1,1,t5_2quyl
10898183,0,t1_de41pet,Im pretty sure its all of the events ingame are automatically triggered at specific dates and times throughout the year. Meaning no one has to go press a button to make it Canthan New Year it just happens. Along with the double faction weeks ... etc... .,GuildWars,de42jfd,3,t5_2quyl
10913245,0,t3_5vvtjn,Play mass effect andromeda. Really fills the challenge itch. GW hasnt been the same game since nightfall to be honest. OG Guild Wars was a lot more tactical and slow paced because of the available kits and skills.,GuildWars,de5mgrx,1,t5_2quyl
10914627,0,t1_de5jlz8,When I quit GW competitive PvP I started playing Magic the Gathering. Worked for me!,GuildWars,de5rli7,2,t5_2quyl
11025780,0,t1_dehn7g0,Thank you I will have an look there ,GuildWars,dehqua0,1,t5_2quyl
11080218,0,t1_denv6ro,i already asked for some love in the gw reddit  here is the post but im getting some hate haha. Thanks for the answer love you buddy,GuildWars,denxl82,1,t5_2quyl
11090479,0,t1_dep34x2,id be willing to hop in from time to timeadd Gan D Roid,GuildWars,dep3h5y,1,t5_2quyl
11116128,0,t1_derz8sx,Yeah I watched that but in the comments he talks about the microing with Zenmai and recommends using the spiritsSoH in NM but Im still trying to get it to work. I know others have done it so I was hoping for some of their tipsskillbars as well. I actually managed it once  years ago with my Mesmer but I have no idea now what set up I used and also am using an AW build now.,GuildWars,des05co,1,t5_2quyl
11128228,0,t1_det2io3,Holy shit thats really impressive. ,GuildWars,detdij0,2,t5_2quyl
11185623,0,t1_dezunfb,Perhaps that is the wrong terminology. Players that use bots are at an advantage over players who do not. ,GuildWars,dezvlh3,1,t5_2quyl
11206334,0,t3_5zvim8,sorry to hijack your thread but i am also returning and have similar questions. how do you get heroes like steam mrmoo says to do? and the game is asking me to pick a secondary profession and im panicking about picking the wrong one. im ritualist trying to follow the HOM  guide. does it matter which i pick? do i have to use any of them?,GuildWars,df28318,1,t5_2quyl
11215263,0,t1_df38gaq,Thanks! Yes two staves might be a good idea. I have yet to find a single even decent smiting staff yet though but i will see what shows up. Got any thoughts on the prefix?  health or  armor. Probably doesnt matter that much... I dont know how much damage  armor stops.,GuildWars,df38iwd,1,t5_2quyl
11222925,0,t1_df3o2ni,This person is  correct.  Umlad is essential to winning,GuildWars,df43s2v,1,t5_2quyl
11229295,0,t1_df4sbhz,sure they exist but do people actually use them? If so why are rock prices so high? P,GuildWars,df4tqh4,1,t5_2quyl
11245343,0,t1_df6mlyr,Windows ,GuildWars,df6n5ir,1,t5_2quyl
11247733,0,t3_60jl9a,Youre probably looking for this?pvx.wikia.com hasnt been maintained for a while I think,GuildWars,df6wwpp,6,t5_2quyl
11268381,0,t1_df97utp,A new and easy to implement content would be simply rethinking some of the existing skills cough Motivation cough,GuildWars,df995vn,1,t5_2quyl
11283637,0,t1_dfaypbi,technically speaking yes this is true if you however want the skill for your own skill bar as well you need to have elite profession skill tomes to learn them yourself or unlock them yourself of course,GuildWars,dfazeyu,2,t5_2quyl
11291240,0,t1_dfbua15,are you just saying that to make me feel less shitty? cuz im kinda fed up with this game and i want to quitmhenlo keeps running away from everyone else and engaging a whole group all by himself and of course gets roasted. stupid motherfucker.,GuildWars,dfbugh0,1,t5_2quyl
11332282,0,t1_dffzwhw,Now you too can dmg report and be the coolest kid in town,GuildWars,dfghtqs,1,t5_2quyl
11361455,0,t3_61ttnm,Larry miller is literally a trade bot himself.gtThis one has an extra r in his name though so it might not be the same person.,GuildWars,dfjssw8,1,t5_2quyl
11454805,0,t1_dftlmn0,CUMway uses  mesmers so its not really for people who dont have Razah but you can easily replace it with some other DPS hero or a player.,GuildWars,dfue6rs,2,t5_2quyl
11502787,0,t1_dfyx91i,Yes honeypot.,GuildWars,dfzuaf2,1,t5_2quyl
11524373,0,t1_dfyd5rx,Ahahaha the snowball is picking up momentum. ,GuildWars,dg2afpv,1,t5_2quyl
11549673,0,t1_dg52wak,There are some rit sac skills too  Spirit Light should do the job.,GuildWars,dg55pou,1,t5_2quyl
11609187,0,t1_dgbwqus,You could do it that way if you wanted but if I remember correctly once you get to Lions Arch in the Prophecies campaign youll be able to get quests that will lead you to Factions Nightfall and Eye of the North. Keep in mind that you wont be sent to the very beginning of the other campaigns. Youll be past the starting areas that you can later return to for the first few missions and other quests.,GuildWars,dgbwtqo,1,t5_2quyl
11621169,0,t3_65tp2f,Winds of change are waiting for you.,GuildWars,dgd9qsb,10,t5_2quyl
11644681,0,t1_dgf793m,I had a lot of fun D,GuildWars,dgfxseu,3,t5_2quyl
11714977,0,t1_dgnk75v,Not being a very social gamer I remember being extremely frustrated trying to play with henchmen especially endgame content  try vanquing Old Ascalon with level  henchies.... Nowadays I can play with up to  heroes with fully customizable builds wiki is your friend and theres so much more I can do!,GuildWars,dgnx70r,1,t5_2quyl
11744922,0,t1_dgr3etz,I recently got back into GW for Hall of Monuments related stuff and Im a huge collector.  What kind of price point are you looking at for it?  Assuming youre still looking to part with itOnly one I can really find thats not from a sketchy gold selling site is  bucks on Amazon but thats a little steep for  weapons in a dead game.,GuildWars,dgrbesx,1,t5_2quyl
11759848,0,t1_dgt095f,I played around  hours and traded a lot.,GuildWars,dgt0bgz,4,t5_2quyl
