,controversiality,parent_id,body,subreddit,id,score,subreddit_id
4085148,0,t3_37c31e,It all boils down to what you are aiming to achieve theres a few scenarios that could apply to you.  E.g young teen with lots of time has time to play campaign and unlock skills normally.or someone who doesnt mind a  min grind in between PvE to jump over to PvP and earn some balth faction to convert same applies to imperial to convert to balth to convert to points.  Another possibility is someone who values their time and will measure a cost totime ratio and consider the price of a skill pack. At around  a pop thats just under an hours wage in the UK if you can consistently farm point and gold during that hour to make up the ? Ish skills per hour then farming would be your desired route.,GuildWars,crlxkoz,1,t5_2quyl
4112783,0,t1_crp2qhr,The RitualistBy far more people use the Ritualist than any other profession to solo the UW. Shadowsong being able to blind is one of the best ways to defend against Aatxes Signet of Spirits creates a wall which you can use to bodyblock enemies to keep them away from you Painful Bond nearly doubles the damage of all your spirits and Armor of Unfeeling makes them take half damage. Summon Spirits allow you to heal and reposition your spirits and if one dies you can just summon it again.The Ritualist may be slower than the other builds posted above but it is by far the safest it has no extra requirements and it can clear the chamber safely and effectively by itself.You can easily play a second Ritualist with a modified build to maximize on Painful Bond and get the most out of your Attributes.When I get a group of people together I like to go into UW with many people who all want to solo farm  rits Assassins Rangers anything. The Rits clear the chamber while everyone else either helps out or waits. The Rits then go and farm Lab and the Vale.  person goes to farm Smites sometimes you need to escort them there everyone else runs through mountains and farms poolspitschaos plains. We can pop a BU as well if we need.The advantage to this is the cheaper entry fee and BU Essence of Celerity it lets you keep Shadow Form up without needing to bring extra skills to do it as well as extra drops. When youre solo you get x less drops than if there were  people but normally with  people you get drops reserved for one of you so it balances out. If youre split up your drops cant be reserved for anyone else and you get everything which drops in your area.I can give build templates for any of these but I prefer to do it in game because its easier to just copypaste them in chat there.,GuildWars,crp2zkw,4,t5_2quyl
4166711,0,t1_crv2irs,doesnt help as it is not the target but the closest,GuildWars,crv7orf,1,t5_2quyl
4254657,0,t3_39ostw,Id advise against rit paragon monk and mesmer. As for rit and paragon theyre basically one build professions which are tedious builds but op builds at that. Furthermore the op rit build is called SoS and can be done on any other profession with rit as secondary so its  no point in making a rit.  The reason why I say not to be a monk is because if youre being a healer Im pretty sure that heroes or henchman are better. Mesmers can cast interrupts but again a computer controlled ai is better at timing them. Although if you find a monk  mesmer build that isnt based on healing or interrupts then I guess thats fine but Ive never played those proffs.It also depends on your starting campaign. Factions for assassin and rit Nightfall for Dervish and paragon and everything else is from Prophecies. The last thing is that this website has all meta builds so it may be worth looking at the meta builds and if you like them then pick that as your proff. ,GuildWars,cs57syw,-2,t5_2quyl
4306647,0,t3_3a5j1r,I literally just started the game for the first time While I wait for HoT i thought I would enjoy the first game so if your running a new guild with active players I would be very happy to join! You might have to tell me how to join though haha,GuildWars,csb323o,1,t5_2quyl
4311707,0,t1_csbnbug,I am the leader by virtue of actually logging on somewhat regularly of an old Reddit guild The Narwhal Bacons Occasionally and that whole alliance was Kurzick.If you want I can send an invite your way so you can get your title done. A fair warning though Im probably the most active person there and I play  times a week and I havent seen any guild or alliance chatter in ages. If you want to find a guild thats a bit more active I wont hold it against you. ,GuildWars,csbnmcs,1,t5_2quyl
4343967,0,t3_3aqok1,Ive never seen something like this happen before I wasnt even aware it was possible with the way gw is. Since you have to stop to activate the gate which instantly closes it  I have no idea how you managed this.,GuildWars,csfaoa5,1,t5_2quyl
4361348,0,t3_3ak74k,Yes Ive written one years ago and its been keeping many players very very busy ,GuildWars,csh9aly,1,t5_2quyl
4435029,0,t1_csppv2y,Dunno personally I like to work with hard prices.If I want to buy I advertise my price same if I want to sell.Edit Like I never do the PM me an offer type shit.,GuildWars,csppzwq,2,t5_2quyl
4437917,0,t1_csq0gty,First of all thanks for answering! I started researching but I didnt really get how it worked. I read somewhere I need titles on another website I read that  points   HoM point on another one I read I dont need titles I just need to complete the campaing.. I wasam very confused.But what youre telling me is that I just need to buy prophecies  EotN create an account and its done? Dont I have to like do something with that account? Create a character or something? Just buy it link it and Ill have my  HoM points in GW Heritage skins?,GuildWars,csq31v1,1,t5_2quyl
4518571,0,t1_ct0260i,That was beautiful thank you.,GuildWars,ct07jeo,3,t5_2quyl
4577739,0,t3_3cxsy4,MAT streams will be starting in  hours PM EST  AM PSTI will have no delay in the Swiss but as soon as the Singles start i will have a  minute delay twitch.tvSkittlesOmg ,GuildWars,ct7mp4z,2,t5_2quyl
4596158,0,t1_ct9vawj, hero support worked well for me on all maps except for the ones on Shing Jea island obviously. ,GuildWars,ct9xqu6,2,t5_2quyl
4610010,0,t1_ctbn0n6,Oddly enough I dont care about skins. I dont want to have a bunch of random stuff is all. If I have one green on a hero I want them all to have greens. Im happy with the s from Gertrud because theyre all generic and dont have some theme to them the way some weapons do.Im a little iffy on my resto heroes not having resto s but eh. I out a channeling set on my SoS resto and a curses set on my PoD resto.Also thanks for all of your help and taking the time to answer my questions.,GuildWars,ctboafx,1,t5_2quyl
4711914,0,t3_3fg7db,How do you do the image stuff for Windows .? My craps laggy as all Hell because of the background download  I think . Really would appreciate some help.,GuildWars,ctoh4ki,1,t5_2quyl
4778282,0,t3_3g6r3q,How much do they go for? Im poor but could use to buy some.,GuildWars,ctwudzd,0,t5_2quyl
4786789,0,t3_3ggckm,Do you have anyone on your friend list? If so and if you can contact them out of game they could login and tell you your name Ive done this for a few friends,GuildWars,ctxwwwr,1,t5_2quyl
4880916,0,t1_cu9rw8s,For what I want hom lvl  minis are all I need. The skins I want are thankfully cheap,GuildWars,cu9rzjm,1,t5_2quyl
4904243,0,t1_cucouac,sad ,GuildWars,cucptwg,1,t5_2quyl
5014224,0,t3_3jjnqm,Congrats!,GuildWars,cuqej9w,1,t5_2quyl
5111882,0,t1_cv1k5an,You have to select windowd and then manually size it to your screen. I have heard that alttabbing or minimizing out of gw increases your pinglag for whatever reason so it is generally better to play it windowed. ,GuildWars,cv268rs,1,t5_2quyl
5117238,0,t3_3l30n5,Zaishin bounties and missions are fun and a good way to become familiar with endgame content. If youre a warrior youll most ilkely be asked to tank and it may be a good idea to ask for some tips from others who are good tanks and to read up on it in the wiki and maybe watch some youtube videos. You may also want to roll a few more characters and learn how they play and how their skills work as it will help you understand whats going on when you come up against them.I learned a lot about how not to tank by playing a healer monk in Zaishin bounties and quests. ,GuildWars,cv2thei,1,t5_2quyl
5130339,0,t1_cv3ldo7,Thanks alot! I am getting wiser by every post ,GuildWars,cv4ec89,1,t5_2quyl
5245261,0,t1_cvi20lm,With henchmen you can complete the entire story on normal mode. The elite difficulty hard mode is almost impossible with henchmen. The elite areas postgame content is also really hard with henchmen even on NM. ,GuildWars,cvi8rfm,2,t5_2quyl
5262277,0,t1_cvhvmh4,The thing is that in GW there is nothing like the hardcore content in gw like UW FoW DoA etc. Maybe raids will be a good substitute but as of now Im sticking to gw because I enjoy the more hardcore type of content. Though I must say the combat in gw is absolutely amazing. I think I have never had so much fun in a game as I had leveling my first elementalist in gw. Leveling my dervish in gw comes close though.,GuildWars,cvkbbhf,1,t5_2quyl
5281151,0,t1_cvmphgi,Wrong subreddit then.Edit sorry thought you were OP.,GuildWars,cvmq8lj,3,t5_2quyl
5372590,0,t3_3oji4e,Relena Karanai  ,GuildWars,cvyeqcn,1,t5_2quyl
5375151,0,t3_3oji4e,i Yangpa i   ,GuildWars,cvyqira,1,t5_2quyl
5394509,0,t1_cw14wmm,HoH aint playbable ? That means FoW and UW not doable also ? what generate the economy then ? DoA ?,GuildWars,cw17iuo,1,t5_2quyl
5406443,0,t1_cw2pebm,oh i didnt even know about treasures.well then... i know what im doing.as for farming... ugh i know. ive tried to make a solo paragon build but it just doesnt work. SoS seems to be the best bet but i cant find a good place to farm with it. thats really annoying.i actually dont need money for THAT much anymore. the vabbian armor is going to be my biggest gold dump... i think. i dunno how much the EoTN armors cost mat wise to make.i still have a bunch more campaign stuff to do too so i dont need money... yet. if i have to ill make a new nightfall character to farm with.are monks still good to farm with? i see a lot of assassin builds but i dont really like assassins.EDIT there was something about treasure decreasing in quality. should i be worried about that?,GuildWars,cw2qeon,1,t5_2quyl
5516356,0,t3_3ql9tm,added you all Im  Morphi Nan  Ive only soloed this game  and like I said am looking to start playing with people from the start of character creation to get the full exp.Lets try to shoot sometime on Friday before pm CST.,GuildWars,cwgrj27,1,t5_2quyl
5549523,0,t3_3r54ds,Central Transfer Chamber is so homey. I just go there and hang out and yell at people. Gunnars hold is best town though. Forget Kamadan I chill with my dwarfies.,GuildWars,cwkyx7w,3,t5_2quyl
5800488,0,t3_3thy1t,Hello I solved this problem by installing it with PlayOnLinux.Regards,GuildWars,cxg3tac,1,t5_2quyl
5868959,0,t1_cxnjiq7,Windowed mode is what helped me the most. GW is mainained on virtual servers.  During peak traffic it can be pretty nasty.,GuildWars,cxoy9cj,1,t5_2quyl
5960875,0,t1_cy0z3je,Ah. ,GuildWars,cy10246,1,t5_2quyl
5964179,0,t1_cy1fh6h,Lol how many jokes have you told now? No offense but the only joke here is your post. Based on what I say in my comment history? Like what for example. Better yet do you have nothing better to do than play internet detective to find validity? Why not use QQs forums...oh wait...it all got wiped...If you truly knew GvG history you would know that one of the guilds you mentioned are far superior to QQ and can back it up too.Seriously its indisputably but tell yourself theyre the best fan boy until then wallow in your own ego and enjoy your holidays lol  ,GuildWars,cy1fnu4,-3,t5_2quyl
5989537,0,t1_cy4qvyj,Ethereal Cookie,GuildWars,cy4rckp,1,t5_2quyl
6116674,0,t1_cykmxvz,He was probably the best monk I know top  or  for sure. He helped me with missions that I couldnt finish myself at the time and even some southern shiverpeak vanquishes which he made look easy back in like . I miss playing with the guy.,GuildWars,cykwhyx,2,t5_2quyl
6247818,0,t1_cyzsvvt,You can change professions? Thats awesome. But are you talking about secondary professions?,GuildWars,cyzt5fu,4,t5_2quyl
6289274,0,t1_cyjey66,Thanks for the shoutout! I really appreciate that very kind of you.,GuildWars,cz4iprm,3,t5_2quyl
6395438,0,t3_3yylz0,If youre still looking for people I would be happy to join you. All I have are low level characters because I had to rebuy the game but I would love to play through with you some time. My current in game name is The Greentea Bagger,GuildWars,czglg48,1,t5_2quyl
6424709,0,t3_43p13l,Maybe Dota or league? Deciding what items to buy and when is skilldeck like. ,GuildWars,czjuofe,1,t5_2quyl
6460633,0,t1_czn6f1j,Same here man   lt    |   ,GuildWars,cznkmgw,3,t5_2quyl
6494461,0,t1_czquprg,People are downvoting this lmao,GuildWars,czr2q33,3,t5_2quyl
6626051,0,t3_45nx8d,I use crossover. At first I torrented it to make sure it worked and when it did I bought it. Works like a charm!,GuildWars,d04ovoj,1,t5_2quyl
6669635,0,t3_470eeo,When dealing with the four man areas bar compression becomes important.First of all slot Save Yourselves! onto your bar. This will provide excellent damage reduction and free up precious room on your heroes.Secondly consider not bringing a dedicated healer. Two heroes with Ritualist primary or secondary should be able to keep your team alive provided you are able to keep SY! up properly. Look into the skills Mend Body and Soul Spirit Light and Protective Was Kaolai.Another way of staying alive is to not get hit at all. Bring Ritualist spirits and take some time to set them up before a fight. Careful pulling into a spirit wall is an effective strategy but beware of aoe damage wiping all your spirits! These spirits will of course serve another purpose which brings me to my next pointBuild your damage around your existing strengths. If you are playing as a Warrior take Splinter Weapon! Are you bringing a Necromancer hero? Micromanage Mark of Pain on your targets!Tldr Have your heroes serve multiple roles employ proper pve tactics and play to your strengths. Edit Accidentally a word.,GuildWars,d0974e5,1,t5_2quyl
6809981,0,t3_490cwv,There are lots of active guilds  ... check in Kamadan Lions Arch presearing Ascalon Embark Beach and the Great Temple for recruiters.  You will find one that suits you and that you fit them Im sure.  Then your chat bubble will be full again!  Game is fun and active.  PvP has some limitations but PvE is busy.  GL and see you in game!!!  Those who will remember will speak fondly of the warm morning breeze.,GuildWars,d0o7i8t,3,t5_2quyl
6849174,0,t1_d0snqag,Either that or he treats his opinion as fact and thinks people who disagree with him are stupid. I dont have a problem with people who really enjoy a particular game and I loved Guild Wars  but this sort of attitude is just toxic. People arent stupid for having different tastes sorry.,GuildWars,d0snt61,6,t5_2quyl
6910692,0,t1_d0wt8h4,NCSoft dont publish GW anymore afaik,GuildWars,d0znbj1,1,t5_2quyl
6998955,0,t3_4bji4o,I dont think you have anything to worry about anet arent really monitoring players anymore there has been a banwave every two years lately against some botters and thats it ...Also k isnt that big of a sum nowadays ive seen people giving mats for an obsidian armor for free so really nothing to worry about on your side.,GuildWars,d19obhc,1,t5_2quyl
7005902,0,t1_d1ag4ur,If you already have MOX all you need to do is dedicate him. Another white mini will probably cost about k. Two super easy options for two more points. Enjoy the FDS,GuildWars,d1agp9t,2,t5_2quyl
7026032,0,t3_4btokg,TLDR.   The guide to fast HoM stuff is to the right of this thread.GW is a truly magical game.  It is like no other then or now.  There is no way to know if you will be beguiled and entranced as many of us are unless you try it.  Presearing Prophecies welcoming area is a flawless and wonderful introduction to GW.  The only way for you to know is to buy the games and be born into Prophecies.I recommend Proph because that is the way the game developed and it is good to follow the flow ... Of course you can opt for Quick and Fast if what you want is to hurry up and finish but that wont give you the real GW experience.  Or you can opt for the GetMyHeroesNow choice ... but again. .. that is not the GW flow.  Still many good players recommend that course.It depends on what you want out of GW.  GW is enormous.  I dont mean that in terms of size of maps tho thats big too but in terms of titles and skills and professions and seconds.  It takes most players years to earn GWAMM.  Most! tho there are some amazing players here who earn that ultimate title in what seems like minutes.You will absolutely miss out on a great deal unless you own all  campaigns and the Eye of the North expansion.Your last question about drawbacks  I assume from this that you want your HoM stuff ... your Heritage this and that quickly and without the hassle of earning them the oldfashioned way.  In that I cannot help you at all.  But there is a guide see the title in the panel to the right of this thread.This is an active Reddit for GW which should let you know the game is alive and well.  In no way is GW a ghost town.  There are fewer players than in  certainly.  But it is the rare outpost where there is not at least one group there.  If you do decide to join up find a guild many recruit in the busy towns of Kamadan and Presearing and Lions Arch and are friendly to newcomers and HoM seekers.  Many will help you with missions and such.  Make Wiki your very best friend so you understand the basic game.GW is nothing like GW.  And btw its GW ... not GW.    GL to you.  See you ingame maybe.,GuildWars,d1cr5ee,1,t5_2quyl
7058570,0,t1_d1gd1g3,Thank you again are you from NA?I may be trying to change my ip if I dont get any reply.EDIT My first account is finally unbanned! ,GuildWars,d1gg62w,1,t5_2quyl
7059184,0,t1_d1g9zvx,The splinter shot thing does cause scatter if your attack speed is very high. At least it always did for me. ,GuildWars,d1giomg,1,t5_2quyl
7151305,0,t1_d1r0xn9,gtShadow Form is what makes the game very unique.Thats silly. Take away Shadow Form and you would have a game no less unique than before.gtOf course its a bit over powered but it is not broken. You need to pop pcons to maintain it you need an enchant weapon.I farm Vaettir with it I assure you it is ridiculously broken. Not a bit overpowered.gtBut it has a very important place in the game.So did smite.,GuildWars,d1r15e3,-1,t5_2quyl
7151353,0,t3_4d6dny,Assassin and Ritualist get my vote.PvE is owned by melee DPS and as many buffs as possible. The only PvE only buff which heroes cant bring is amazing Great Dwarf Weapon. Any profession can use it but it lasts longer with Spawning Power and Ritualist is a strong profession in its own right with Signet of Spirits Vampirism and Summon Spirits.Assassin can dish out some of the highest DPS by itself and its only increased more by your allies. If youre not sold on Ritualist if you want to start Nightfall for Dervish you can go Necromancer for Weaken Armor Barbs and Mark of Pain. Necromancers also get Order of Pain but its not worth bringing to buff just one person.Build varietywise Assassin or any melee profession will be stuck in melee DPS Necromancer will be stuck in Curses but has the freedom of any Elite from it or Soul Reaping the buff skills dont dictate the build much. Ritualist as the highest freedom being able to run any build as long as it has GDW.I guess this is more focused on synergy than the others but Smite Monk is also viable if you think you wont get bored of it or its alternate options instantly Strength of Honour being another buff of course which is extremely potent.,GuildWars,d1r1ch3,1,t5_2quyl
7197221,0,t1_d1w31ao,Respect for frugality I know its OT but when I bought this game at  I had saved money from recycling cans over the span of two months.Iirc bmp is more of a distraction than anything. Just story time. Gw beyond is free and will give you content for days.,GuildWars,d1w9kcg,1,t5_2quyl
7215280,0,t1_d1y7mvz,Hey man thanks for the offer! But I wouldnt want to be wasting your time for something that may or may not happen its been a long while at least  years and wed just casually start playing. In any case were not really looking to set SC times wed just like to be able to do it if you know what I mean. Id be going for a paragon this time around but I have every other class and my friend hasnt decided yet.,GuildWars,d1ybkoe,1,t5_2quyl
7235770,0,t1_d20mitt,Just added my ign and pmd you. We just got to senjis corner and are too low to progress.,GuildWars,d20nkqx,1,t5_2quyl
7296600,0,t1_d27k7eo,Strange. Youd think others wouldnt be able to log in if that was the case. Do you think port forwarding will make any difference? Ive yet to do that.Edit Port forwarding didnt help at all.,GuildWars,d27ko00,1,t5_2quyl
7391266,0,t3_4g2bqf,BTW .... when this grand farm doesnt work??? You might check that you do have both rits loaded ... and not just one .....  just sayin!!   Thanks for the vid and the builds and good to see you back.,GuildWars,d2ic4x9,1,t5_2quyl
7400158,0,t1_d2ia172,i think solo and  man are the most interesting though also the most expensive ones usually D,GuildWars,d2jcksg,2,t5_2quyl
7423133,0,t1_d2kpqsl,Thanks i will do it that way.Thanks to the two confirmers as well.,GuildWars,d2lyms0,1,t5_2quyl
7446038,0,t1_d2o4yok,deleted,GuildWars,d2okfix,1,t5_2quyl
7462945,0,t1_d2papl8,The way I look at it is wherever people can use dervs to spike reliably they will. UWSC and DoAsc require the range and mistrust because that will save you time overall.To anyone who hasnt see the video of an NVoS Or just watch any fow vid,GuildWars,d2qhoc6,2,t5_2quyl
7493974,0,t1_d2u0h19,Thanks all seems to be working for me now.It was quite odd though.,GuildWars,d2u0wm0,1,t5_2quyl
7494866,0,t1_d2u31b2,Please explain why you need bots? ,GuildWars,d2u4key,3,t5_2quyl
7497687,0,t1_d2u60bc,KSMod added Unreal Tournament sounds like Doublekill and Godlike!,GuildWars,d2ug58h,1,t5_2quyl
7497794,0,t1_d2u9vkk,Yeah fair call on the smite monk I do notice the use of RoJ is erratic at best but much like a curses necro or NRit healer its really on the bar due to lack of any other decent elites. I tend to bring one more for the extra condi and hex removal especially in EotN content but more importantly as a melee for Strength of Honor. As a dagger spammer Sin SoH  MoP  Splinter Weapon  Death Blossom spam  Get rekt HMI usually have a pretty solid  hero lineup and the th is really overkill hence the smite monk is a welcome addition purely for SoH alone the heals and RoJ is just filler or icing on the cake really.,GuildWars,d2ugl0v,2,t5_2quyl
7506529,0,t1_d2vexg3,Jyriane Lightfall,GuildWars,d2vgcok,1,t5_2quyl
7552756,0,t3_4idwb6,BACK ally is also recruiting. We are very active and friendly. If you would like to join us PM me IGN Rene Renault. Were very active currently hold Cavalon and have Vent. We have no requirements but there are a few basic rules we expect all members to follow. I will explain them when you PM me.We do lots of things including dungeon SCs MQSC JQ ZQuests Deep etc. We also teach MQSC. Most of our guilds here are at full membership and a few are currently rebuildinggrowing. If you want more information feel free to drop a message.,GuildWars,d30pnq3,1,t5_2quyl
7568458,0,t1_d32h5fr,But you are the only one who is salty about this. Botters Traders SCPlayers rich players and poor players. No one cares about the price of the ecto cause its just another currency...,GuildWars,d32hw6r,2,t5_2quyl
7603302,0,t1_d367tc1,look at third party sites you might be able to get it cheaper,GuildWars,d36gfj1,2,t5_2quyl
7605183,0,t3_4jezrc,Its still an amazing game even if there are not other ppl playing. The world and the story lines are fantastic. Now i forget how much you have to do itd be worth googling. If youre getting the trilogy its worth playing i think the rd one for a bit just until you get asccess to Heroes. They are basically like the mercenaries but you can control what weapons and abilities they have. Makes it so youre less reliant on thw mercs end game and makes a huge difference in being able to complete the content.I loved eye of the north i feel like it added so much to the game lore wise. It really helps give some added back story to the lead up to gw. If youre interrested in lore and think you might go on to play gw which is still a pretty great game btw then its worth playing through eotn.,GuildWars,d36o4ft,1,t5_2quyl
7624985,0,t3_4jpfqe,Warrior.Because PROUD WARRIOR RACE.,GuildWars,d38x4q5,2,t5_2quyl
7670873,0,t3_4k8vm8,All Id played before GW in terms of MMOs was some grindy Korean ones. After getting a magazine that had Guild Wars in the cover I just had to buy it. Saved money for a couple of months and finally bought it. Spent the next  years having a blast with it.,GuildWars,d3e4txw,2,t5_2quyl
7686648,0,t3_4kle8d,Its  am  i am casually browsing reddit until i suddenly get some heavy coughs. My Eyes wide open in horror. My brain unable to capture waht it just read.DO YOU EVEN PLAY GUILDWARS?Sorry for being the most toxic gw player but did you just recommend using an Assasin Hero to heal?Did you just ALWAYS recommonend shieldsets for your heroes? Did you just give false information about Weapon requirements? ZZZZ,GuildWars,d3fx9rr,7,t5_2quyl
7691791,0,t3_4kn9d8,Holy fuck I havent seen ecto that low since ?,GuildWars,d3gi9tb,4,t5_2quyl
7773712,0,t3_4lsdml,Msg me in game Dirt Dealer is my IGN.  I have plenty of free ones to give you.,GuildWars,d3pt3rx,2,t5_2quyl
