,controversiality,parent_id,body,subreddit,id,score,subreddit_id
4643543,0,t3_3e6di6,toki ! nimi mi li Pije. mi kin mi kama sona e toki pona. mi kama tan ma Kanse. mi wile toki toki pona poka sina !,tokipona,ctfvubc,2,t5_2s5z5
5507606,0,t3_3qj5u7,  coupon      .  .........,tokipona,cwfnb4a,1,t5_2s5z5
5510941,0,t3_3qjzf8,Lets give this a try  Grasslands  ma kasi anpa   Beach  poka telo  Valley  lupa pi nena tu hole between two mountains?  Desert  ma seli hot land land of heat or ma jaki land of dirt  Savanna  ma kasi anpa suli big grasslands?  Glacier  nena telo lete Ice mountain  Continent  ma suli mute Very big land  Marsh  ma telo jaki land of dirty water or ma telo moli land of dead waters  Volcano  nena seli fire mountain   Cave  ma anpa land of below below earth?    Im not sure on a few of these what do you guys think ?,tokipona,cwg2mr6,3,t5_2s5z5
6445132,0,t3_43tqsq,Thanks for the comments folks. I have some studying to do!,tokipona,czlyte8,1,t5_2s5z5
6513758,0,t3_435mew,For these id sayMagic sewi wawa sewi being used in the sense of superior or religiousWonder alasa sonaSpace sewi pimeja,tokipona,czt2nlc,2,t5_2s5z5
7816654,0,t1_d3uhwsv,wile sina li sama e wile mi.tenpo ni la sina en mi en jan ante li lon. mi mute li pali e seme tawa lipu ni? sina jo ala jo e pilin sin?,tokipona,d3unn6v,2,t5_2s5z5
10939379,0,t1_de8743o,sitelen ni li kepeken e sitelen pona.     ona li sitelen toki pi toki pona jan Sonja li pali e sitelen toki ni.    sina ken lukin e sitelen pi nimi ali lon ni    ,tokipona,de8bj9z,1,t5_2s5z5
11128929,0,t1_detfq4x,deleted,tokipona,detgdb5,1,t5_2s5z5
11803091,0,t3_67875w,Nu Silen li seme lon Inli?,tokipona,dgxx6h3,2,t5_2s5z5
