,controversiality,parent_id,body,subreddit,id,score,subreddit_id
3861488,0,t3_34o0jn,im assuming she is using push ups lately,legendarylea,cqwfzx0,4,t5_323qp
5534778,0,t3_3qwky0,Here you go boys dont amazing but good enough. ,legendarylea,cwj47ld,7,t5_323qp
5801948,0,t3_3ungyq,Bit o bra.,legendarylea,cxgabzv,6,t5_323qp
6148069,0,t3_3zkv4q,Any  vod??,legendarylea,cyogyxb,0,t5_323qp
6239498,0,t3_4115hf,Do you guys know any other subreddits for girl streamers or girl youtubers,legendarylea,cyyv3it,1,t5_323qp
6588063,0,t3_3tr1oz, future investigation ,legendarylea,d00rcr2,1,t5_323qp
6883788,0,t3_49vvcv,lol its just you and i think you analyzing all this stuff is pretty creepy. you are not a psychologist so stop acting like one what if i told you that if you move into a new house you may have other stuff to do than stream  hours a day,legendarylea,d0wldok,-2,t5_323qp
6924280,0,t3_4afn86,whats her snapchat,legendarylea,d116wmc,1,t5_323qp
7215258,0,t1_d1y6axq,It was a morally wrong statement but that is all. If you look at it biologically they are meant to die. You can say that about anyone with a terminal disease. ,legendarylea,d1ybhg4,-17,t5_323qp
7342484,0,t3_4f0n4u,does the girl in the blue dress also streams on twitch? for science you know...,legendarylea,d2csgif,1,t5_323qp
7377583,0,t1_d2grzh3,I feel indifferent. Please see my original statement. I live my life normally as a man should while you guys get mad at women because you dont get your way with them. You more than likely have parental issues and if you self analyze you will see this is the case. ,legendarylea,d2gs2zx,-27,t5_323qp
7401229,0,t3_4gkz86,Do what I say not what I do,legendarylea,d2jgym3,1,t5_323qp
9279849,0,t3_57inqd,Kill yourself. Seriously.,legendarylea,d8sad60,14,t5_323qp
9574876,0,t1_d9t8bl7,i found it in the comments of a Twitch whores post. someone said it is legendary lea and i was thought lea was taller aswell.,legendarylea,d9tarzo,0,t5_323qp
9678323,0,t1_da5uox9,Why should we apply standards to them? Theyre just regular people like us. Its the same with celebrities. We shouldnt hold them to any standards just because they have an audience. Its stupid.,legendarylea,da6227l,3,t5_323qp
