,controversiality,parent_id,body,subreddit,id,score,subreddit_id
263733,0,t1_cf7ypf4,Words can be just as sexy as images I love albums with a bit of a story more than anything. I think were in the right subreddit P,gwbooks,cf83fw4,2,t5_2weji
264341,0,t1_cf7hn4e,Thanks ,gwbooks,cf85pt3,1,t5_2weji
268207,0,t3_1x6orw,Absolutely they count for you gorgeous  ,gwbooks,cf8k5yn,2,t5_2weji
475042,0,t1_cfty7y2,thank you,gwbooks,cfu9ju0,1,t5_2weji
501105,0,t3_1zukgu,Ah Neil gaiman is like one of my favorite authors ,gwbooks,cfx89fp,7,t5_2weji
847728,0,t3_23kw8f,Good to see you.  Nice picture.  Its great to have yourself as your own model.  The freedom you have with your body is great.,gwbooks,ch0n2yi,1,t5_2weji
2920304,0,t1_cnzx7tr,I posted there too thanks! ,gwbooks,co01pzj,1,t5_2weji
3922345,0,t1_cr2v8aa,deleted,gwbooks,cr3dte5,1,t5_2weji
5933047,0,t3_3rosii,i want to read everything there ,gwbooks,cxxcpn7,2,t5_2weji
7855412,0,t1_d3yx0jz,Thank you ,gwbooks,d3z0peu,1,t5_2weji
8235321,0,t3_4rolc6,What a fun picture...Three of my favorite things in one picture! Intelligent women reading and boobs!  ,gwbooks,d56yy6t,1,t5_2weji
10821919,0,t3_5t1n05,for you well count it,gwbooks,ddw7dje,1,t5_2weji
