,controversiality,parent_id,body,subreddit,id,score,subreddit_id
8113465,0,t3_4p5vt1,Are you still available? PC? ,GTA_5_HACK_Online,d4s0z5z,1,t5_34nb6
8493258,0,t1_d636zkh,I swear Ive met modders online but maybe I was wrong,GTA_5_HACK_Online,d637g2u,1,t5_34nb6
9236739,0,t3_55a45t,I approve this deal . Best deal out there . Legit  . Ill ask for money drop again soon.  ,GTA_5_HACK_Online,d8mtow8,2,t5_34nb6
9540021,0,t1_d9n9emr,deleted,GTA_5_HACK_Online,d9p085f,1,t5_34nb6
9553105,0,t3_5bg75b,Hes a scammer. Called out his friend and he deleted his post. Have it all saved for proof. Theyre also faking couches with fake accounts. ,GTA_5_HACK_Online,d9qm8ph,2,t5_34nb6
9553817,0,t1_d9qp6wy,Wtf is discord? ,GTA_5_HACK_Online,d9qpe9q,1,t5_34nb6
9574157,0,t1_d9t6h6i,Look here motherfucker. Ive invited you to talk to both of us on skype. But you rather be a keyboard warrior. So if you arent going to be a man and talk to us hop off my dick please ,GTA_5_HACK_Online,d9t7l03,1,t5_34nb6
9985082,0,t3_5iiedn,Where is a safe place that I can go to get a mod menu for Xbox One,GTA_5_HACK_Online,db931nx,1,t5_34nb6
10231374,0,t3_5mgded,Thank you so much dude D !,GTA_5_HACK_Online,dc3s7v2,3,t5_34nb6
10239395,0,t1_dc4olus,Do you do ps accounts too or know anyone who does and you trust? Also do we get too choose the gamertag?,GTA_5_HACK_Online,dc4oy3u,1,t5_34nb6
10312875,0,t1_dcd0h5v,yeah it sucks,GTA_5_HACK_Online,dcd0r5c,1,t5_34nb6
11127783,0,t3_5yvd9v,I can but not for free. I dont have enough time in my day to give away money so I charge a little bit. If you are interested you can send an email to TheMrCherryPoppergmail.com,GTA_5_HACK_Online,detbp7m,1,t5_34nb6
