,controversiality,parent_id,body,subreddit,id,score,subreddit_id
8428413,0,t1_d5v39bp,I ordered an extra in case you changed your mind if you didnt I was just gonna sell it  if you want plum rain it is all yours! ,Lush_Kitchen,d5v3cnq,1,t5_3ewm6
8514416,0,t1_d65u2v2,Got your order! Make sure to check in on Sunday. Also about Unicorn Horn...it was removed from the menu post on Facebook and the actual menu video. Its entirely possible that Unicorn Horn will be a surprise item that they leaked early but we dont have  confirmation on that. If it becomes confirmed I will definitely be taking orders for it. ,Lush_Kitchen,d65uzkh,1,t5_3ewm6
8669855,0,t3_4yn58x,Hi. Id like to get the following Twilight shower jelly  tramp shower jelly  honey I washed the kids shower jelly  honey I washed the kids solid perfume  rose jam shower jelly  rose jam solid perfume ,Lush_Kitchen,d6pcp08,1,t5_3ewm6
8687666,0,t3_4ywzs7,Dont know if you are going to check here but ,Lush_Kitchen,d6rl3bd,1,t5_3ewm6
8705486,0,t3_4z87er,If its still around at the end of the week I might pick up Dare. Never enough good dark lip colors.,Lush_Kitchen,d6ttj7d,1,t5_3ewm6
9226567,0,t3_56osft,Good luck!!,Lush_Kitchen,d8lja1i,2,t5_3ewm6
9238569,0,t3_56wvf6,Dont understand why this is getting down voted. ,Lush_Kitchen,d8n217w,1,t5_3ewm6
9256064,0,t1_d8oiycj,I was so tempted by the soaps this week but I almost exclusively use gels. That hasnt stopped me from dedicating half a shelf in the bathroom cabinet to soap and soap samples. I think I need to find a Lushie Anonymous to help with my severe hoarding problem.,Lush_Kitchen,d8p9tw9,2,t5_3ewm6
9356926,0,t1_d921fj9,Got it! Make sure to check in on Sunday. ,Lush_Kitchen,d922393,1,t5_3ewm6
9433027,0,t1_d9bo1r8,I could only dig up one review on it and it mentioned that it was similar to Tramp!,Lush_Kitchen,d9bp9e8,3,t5_3ewm6
9607794,0,t1_d9xcoym,sure can! ,Lush_Kitchen,d9xcv6y,1,t5_3ewm6
10226780,0,t3_5mfaqe,Banana! One you snap the whip one sultana of skin and one tiny hands. Thank you so much!! ,Lush_Kitchen,dc39gwd,2,t5_3ewm6
10245021,0,t1_dc5ase8,PMed you!  Thanks a bunch of bananas! ,Lush_Kitchen,dc5bw2j,1,t5_3ewm6
10519601,0,t3_5qmtca,x creamed almond and coconut shower smoothiex java bath bombx lime shower smoothieThanks for holding the order! ,Lush_Kitchen,dd0idzr,1,t5_3ewm6
10610696,0,t3_5rumyu,Can I have... Vanilla fountains All that Jas Thanks! ,Lush_Kitchen,ddaeurk,1,t5_3ewm6
10860378,0,t3_5v8d20,Ooohhh,Lush_Kitchen,de066ik,1,t5_3ewm6
11395815,0,t3_62m74b,Monster!I want  Ghost SG Ghost Shower Jelly Twilight SG Demon In the Dark SGI just wanna get on the list so I will edit and list them ASAP! Lol desperation kicked in,Lush_Kitchen,dfnp7xn,1,t5_3ewm6
11404444,0,t1_dfolzt4,Adjusted.,Lush_Kitchen,dfoogqw,1,t5_3ewm6
