,controversiality,parent_id,body,subreddit,id,score,subreddit_id
127516,0,t3_1vjuxu,Tramp stamp removed?,facedownassup,cesyanz,2,t5_2u27q
183983,0,t3_1w5bgo,Her butthole is at ease.,facedownassup,ceze5eo,1,t5_2u27q
302546,0,t1_cfbm8yc,Pls for great justice! ,facedownassup,cfc4if8,1,t5_2u27q
328872,0,t3_1xv05w,album,facedownassup,cfeux2l,8,t5_2u27q
379027,0,t3_1yf9bv,Looks like she fell off I should check to see if she is okay,facedownassup,cfk1vbc,2,t5_2u27q
449426,0,t3_1z70lh,How many beds does this chick have?,facedownassup,cfrcjc7,2,t5_2u27q
530869,0,t3_2068c3,deleted,facedownassup,cg0m7sq,2,t5_2u27q
855342,0,t3_23xdg3,perfection and gorgeousity ,facedownassup,ch1iabg,1,t5_2u27q
1076467,0,t3_26flis,But that ass fault.,facedownassup,chqnbzz,1,t5_2u27q
1139653,0,t3_275rzr,wtf? Looks like two snipped scrotums. ,facedownassup,chxtljp,1,t5_2u27q
1140576,0,t3_275bxu,Source please. ,facedownassup,chxxbzd,3,t5_2u27q
1208411,0,t1_ci4xikm,go for it ,facedownassup,ci5kbup,2,t5_2u27q
1355380,1,t1_cim12qi,Lol have an upvote ,facedownassup,cim6rk9,2,t5_2u27q
1512615,0,t3_2bh36l,deleted,facedownassup,cj5vsas,4,t5_2u27q
1542655,0,t3_2bs2nm,no shots from the rear?,facedownassup,cj9n9b1,1,t5_2u27q
2290726,0,t3_2lhg7a,Shes cute. ,facedownassup,cluulz7,1,t5_2u27q
2439047,0,t3_2neayq,Holy shit! I would love to have that in front of me. Would do naughty things to her without even thinking about it. ,facedownassup,cmd66zc,1,t5_2u27q
2753710,0,t3_2rlxyc,More gfys from same scene Misha Cross  PornFidelty White Room |  |  |  |  | ,facedownassup,cnh32yi,3,t5_2u27q
2858095,0,t3_2su4zr,Breakfast lunch and dinner. ,facedownassup,cnsysam,3,t5_2u27q
3222548,0,t3_2wzao8,deleted,facedownassup,cow0qct,-4,t5_2u27q
5128094,0,t1_cv3u326,deleted,facedownassup,cv44lou,2,t5_2u27q
5147501,0,t3_3lg3oz,Would be like fucking a stick woman.,facedownassup,cv6gtuj,3,t5_2u27q
5276305,0,t1_cvm3qdr,Holy cow i didnt even notice.,facedownassup,cvm3w9m,1,t5_2u27q
5518923,0,t3_3qm7dg,any idea why i cant see the thumbnail?,facedownassup,cwh3c9c,1,t5_2u27q
5651660,0,t3_3siut0,For the love of god we must find the source!,facedownassup,cwxn6az,4,t5_2u27q
6174705,0,t3_401hmx,Now like right now ,facedownassup,cyri0so,1,t5_2u27q
6358754,0,t3_41j148,Absolutely amazing... Keep posting babe. ,facedownassup,czcf49b,2,t5_2u27q
6374878,0,t1_cze5dsa,i wana know also.. ,facedownassup,cze95bi,4,t5_2u27q
6466970,0,t3_445t3e,deleted,facedownassup,czo8asx,1,t5_2u27q
6477621,0,t3_44d4o2,This submission has been removed. New accounts are restricted to posting to the following sites i.imgur.com gfycat.com. Please note that links to imgur must be direct image links e.g. I am a bot and this action was performed automatically. Please contact the moderators of this subredditmessagecompose?torfacedownassup if you have any questions or concerns.,facedownassup,czpc045,1,t5_2u27q
6942212,0,t3_4aq1zp,nice balloon knot. ,facedownassup,d1389es,1,t5_2u27q
7022908,0,t3_4brz8j,I cant think about anything except the  minutes or however long of discussion and trial and error that led to them setting up for the pose to take this picture,facedownassup,d1cecdn,2,t5_2u27q
7028085,0,t3_4bwbbn,Sexy! Care to submit some anal pics here? ,facedownassup,d1czj5w,1,t5_2u27q
7587531,0,t3_4j7k11,Ah the garden section... now where do I find a hoe? I have seed to plant,facedownassup,d34nyjd,39,t5_2u27q
7588448,1,t1_d34mlnn,Perhaps if you got a permit first,facedownassup,d34rpid,-3,t5_2u27q
7590596,0,t1_d34mlnn,But Im always praying to have sex ,facedownassup,d350hrd,1,t5_2u27q
7670352,0,t3_4kc4jp,source?,facedownassup,d3e2pa5,1,t5_2u27q
7750141,0,t3_4lfrh8,Beautiful presentation... pretty nails ...sexy ,facedownassup,d3n4tku,1,t5_2u27q
7751584,0,t1_d3myp07,cue XFiles theme song,facedownassup,d3napu3,0,t5_2u27q
7770143,0,t3_4lpbse,rKatyaClover ,facedownassup,d3peilm,2,t5_2u27q
8746200,0,t3_4zu330,Perfect. Needs a creampie,facedownassup,d6yxg6f,1,t5_2u27q
8995254,0,t3_53hb9l,she comes with a story i guess ..,facedownassup,d7t3998,2,t5_2u27q
9605271,0,t3_5cf9a6,Eat me,facedownassup,d9x1oen,1,t5_2u27q
9797865,0,t3_5fi6ne,player  would like to join your game ,facedownassup,daksr9x,2,t5_2u27q
9928948,0,t1_db19fzj,slow clap ,facedownassup,db1rmp4,3,t5_2u27q
10101549,0,t1_dbn5ffl,Why? Im heterosexual and I have the ability to look at another guys cock without being disgusted by it.,facedownassup,dbo8toj,1,t5_2u27q
10119480,0,t1_dbqk2e9,Ex gf of mine,facedownassup,dbqkqgh,2,t5_2u27q
10274176,0,t3_5n2wgo,Luda!,facedownassup,dc8mtir,3,t5_2u27q
10306923,0,t3_5n3nq2,Quite the good girl. ,facedownassup,dcccfna,1,t5_2u27q
10366838,0,t3_5o4jll,This post was removed because it is not from the approved domainsrnsfwwikihosts. Please read the link on proper way to post. The currently approved domains are imgur.com gfycat.com .media.tumblr.com images.sex.com img.pornhub.com and i.reddituploads.com.I am a bot and this action was performed automatically. Please contact the moderators of this subredditmessagecompose?torfacedownassup if you have any questions or concerns.,facedownassup,dcj566p,1,t5_2u27q
10366862,0,t3_5ofult,deleted,facedownassup,dcj59ph,2,t5_2u27q
10462546,0,t3_5polpa,Whats her name! ,facedownassup,dcu1b7j,1,t5_2u27q
10499174,0,t3_5qa71d,rlordosis,facedownassup,dcy6xad,7,t5_2u27q
10503037,0,t3_5qa4ak,Idk why but the camera angle made me laugh ,facedownassup,dcympi6,3,t5_2u27q
10557998,0,t3_5r6nme,Your submission was removed because it is not a direct image link.  If you would like to post an image please resubmit using this direct link If you were trying to post a GIF please resubmit using this direct link I am a bot and this action was performed automatically. Please contact the moderators of this subredditmessagecompose?torfacedownassup if you have any questions or concerns.,facedownassup,dd4v9xt,1,t5_2u27q
10587338,0,t1_dd7z1ln,Are you here to post porn or argue semantics about guns?Oh and even the slightest glance at the person you replied to would make it clear they are from New Zealand.,facedownassup,dd803xq,-6,t5_2u27q
10818974,0,t1_ddvsycy,Rope Gang,facedownassup,ddvwfxr,2,t5_2u27q
10926120,0,t3_5w37q6,This post was removed because it is not from the approved domainsrnsfwwikihosts or it is not a direct image link. Please read the link on proper way to post. Please note that albums are not allowed to be posted by new accounts. Also note that new users using imgur need to link directly to the image i.imgur.comabcdefg.png not the html page imgur.comabcdefg.I am a bot and this action was performed automatically. Please contact the moderators of this subredditmessagecompose?torfacedownassup if you have any questions or concerns.,facedownassup,de6ybas,1,t5_2u27q
10930586,0,t3_5w3cfb,Can we start with my face buried in there??,facedownassup,de7evkn,3,t5_2u27q
11108979,0,t3_5ylmlv,GrassyAss amigo!!,facedownassup,der6ynb,2,t5_2u27q
11131564,0,t3_5yx8j5,removed,facedownassup,detr3yi,1,t5_2u27q
11206056,0,t3_5zysxp,You know exactly what Id do. Thing is do you want me to do to you what I want to do to you?,facedownassup,df26xvy,-1,t5_2u27q
11222840,0,t1_df437i7,you probably have and just didnt realize it.,facedownassup,df43fli,2,t5_2u27q
11303755,0,t3_611apn,im impressed,facedownassup,dfd9ibi,1,t5_2u27q
11408998,0,t1_dfp73eg,gtNeeds more jpegThere you go!I am a bot,facedownassup,dfp73hj,2,t5_2u27q
11578682,0,t3_656178,Ok from what I see you look great although Id rather admire you for your face and personality. ,facedownassup,dg8g7ka,-4,t5_2u27q
11585114,0,t1_dg8g2nm,Holy shit its a common reference just go to rsimps.  ,facedownassup,dg96hbm,9,t5_2u27q
