,controversiality,parent_id,body,subreddit,id,score,subreddit_id
5987,0,t1_cef3pcw, Bathhouse  Written as D. Sadie tentacles and ends in pregnancy. The Dragons Surrogate Transplanting eggs pregnancy. Faerie Trap Only vaguely related to pregnancy a sterile girl sticks faeries inside her to pretend to be pregnant. Passed by a Spider Egglaying spider breeding lesbians. Ends poorly for the main character. Thribans Condom Safe sex with a thriban my version of orc using an elf as a condom. Jacob and Sonji  Scifi spiders an older story. Tickler Only loosely related to breeding mostly a giant using a woman to jerk off lots of cum. Puppy Mill Um... there is pregnancy here a lot of fucking. This is my k word serial that I finished last year I can say that now. It deals with a lot of other fetishes amputation high fantasy animated cloaks submissive and puppy girls. Not to mention gods higher powers and a ton of other things. There is a character Fucker who is an insane necromantic breeding machine that does only one thing.These are the bulk of my pregnancyrelated stories. All but one of them are fantasy.,eroticliterature,cef49ud,2,t5_2rsj3
328835,0,t3_1xuzgy,deleted,eroticliterature,cfeus3k,2,t5_2rsj3
654930,0,t3_21krks,Really good. Simple short elegant. Nice writing and I was turned on. ,eroticliterature,cgeprlt,1,t5_2rsj3
1399222,0,t1_cirn0x1,Sorry I meant its too flowery. It tries too hard. So instead of pulling me in it draws attention to itself. For example As I walk past your room a narrow beam of moonlight beckons me in through the narrow passage left in the subtle opening of your door might work better as Moonlight spills from your barely open doorway in a single silver streak. Its still got that same kind of flavor but it doesnt distract as much from the story. Hope that helps.,eroticliterature,ciro8nh,1,t5_2rsj3
1556654,0,t3_2c298p,This is a great story! Ive read the complete piece but this part is really fun.,eroticliterature,cjbeevf,2,t5_2rsj3
2128549,0,t1_cla778i,Thank you!Yes... Ive got more. Some are still in my head but there are lots under Long Sexy Stuff on my blog. Im posting them here as I find the time and as I write new stuff. Thank you for the feedback!,eroticliterature,cladvsl,1,t5_2rsj3
3125576,0,t1_colyqjd,Here is the mobile version of your link,eroticliterature,colyqma,1,t5_2rsj3
3229356,0,t1_coft4ev,I would love to read more this was really hot. Your body is so beautiful and sexy and so is your mind. Massive turn on...,eroticliterature,cowq7j7,1,t5_2rsj3
3842883,0,t1_cqub0b7,Im sure weve never met. Just growing up there with a foreskin would give us a common experience though. ,eroticliterature,cqubmb5,1,t5_2rsj3
7850465,0,t3_4mr5vx,Nice. I like this a lot.,eroticliterature,d3ygnc3,1,t5_2rsj3
9283678,0,t3_55tgj4,Continue it haha,eroticliterature,d8srv0i,2,t5_2rsj3
9486007,0,t3_5amsbn,.... Im eagerly awaiting part two. ,eroticliterature,d9icqs7,1,t5_2rsj3
10055362,0,t3_5j4kvk,Sequel please! I want to read the part where she comes over the next day.,eroticliterature,dbi8l01,1,t5_2rsj3
10874907,0,t3_5veb2l,Anne Rice The Claiming of Sleeping Beauty If you are into BDSM and humiliation ,eroticliterature,de1o3sd,3,t5_2rsj3
11198219,0,t1_df18ii8,Thank you so much!!! ,eroticliterature,df1az69,1,t5_2rsj3
11317987,0,t1_dfefmg3,So do you treat those spells as sexuall assault?,eroticliterature,dfevimx,1,t5_2rsj3
11735317,0,t1_dgq7npw,Still not a cuckold. It could be a domsub threesome thing where the other guy is into being humiliated but a cuck is again by definition the husband of a woman whos cheating on him.Anyway I hope someone can link ya a good story Im just feeling excessively pedantic I guess,eroticliterature,dgq87ql,1,t5_2rsj3
