,controversiality,parent_id,body,subreddit,id,score,subreddit_id
171943,0,t1_cexu86y,Whats the station name?  Is he on krono or recurring?,EQ2,cey0m9b,1,t5_2r4sq
189832,0,t1_cf0059c,EQ Traders Corner used to be the best tradeskill site for EQ I assume the EQ one is probably still good. Theres a link there on the left for Tradeskill Guides which are probably still relevant and correct. In game at the starting area there should be someone with a harvesting quest. That should chain to your home town where someone in the crafting area will do the intro to crafting quest. This will have you make an item from each type of crafting give you some recipes etc. Basically you need a recipe from a book some are purchased some are found then youll need some kind of vendor item fuel like coal or kindling or paper sold at the vendor very cheap and some harvested items stonewoodskinsvegetablesetc. Then you go to the crafting station forge woodworking bench scribing table and find the recipe you want pick the items you want to use in it sometimes you have options of what type of material to use I guess? and start crafting.  When youre crafting there are  bars that matter. The top bar green is Durability. This is how good the item youre making is. This bar starts full and empties over time. You want this to stay as full as possible. Not only to get a better end product but youll fail if it gets too low. The bar right underneath that is Progress Blue I think. That starts empty and fills up as you work. Your goal is to fill the blue Progress bar while keeping the green Durability bar as full as possible. You do this by mashing buttons. Theres six at the bottom and each does something slightly different. The  on the left increase Durability the  on the right increase Progress. As youre crafting the station will pulse every  sec or so making a noise and shooting numbers out of the top. Try to time your buttons to just after this happens because sometimes there will be a complication. Thats the bad icon that appears just above your six buttons. When one of them appears you want to hit one of the two buttons you have that matches it. If you do this so the first skill you use after the complication appears matches then something good happens. If not something bad happens. ,EQ2,cf0285r,1,t5_2r4sq
489718,0,t3_1z7lxg,my personal favorites are Assassin gt Channeler gt Guardian.I love the Assassin I like to get up close and personal like when I kill mobs. Channeler was the first healer in any game that i have actually enjoyed playing.,EQ2,cfvxnci,1,t5_2r4sq
679365,0,t3_21txzj,I decided to come back and level a new character so this is right up my alley! Ill give you guys a poke when I hit . Squeakerella Troubador.,EQ2,cghht2h,1,t5_2r4sq
886544,0,t1_ch518np,I know right?! ,EQ2,ch51xfe,1,t5_2r4sq
887216,0,t1_ch54jz6,As a troub deal with it ,EQ2,ch54ofl,1,t5_2r4sq
888441,0,t1_ch59m5n,gtA more preferable approach would be to figure out other ways of storing things that are currently in your inventory.Is there anything currently in the works toward that end?,EQ2,ch59pbu,1,t5_2r4sq
1347490,0,t3_29ibgc,This is an ongoing issue for many users through the years and happens quite frequently for those that use a wireless keyboard. The quickest way to get out of the spinning is to hit the Windows Key and click back into the game window. Its a keyboard focus issue!,EQ2,cil7ijy,3,t5_2r4sq
1529318,0,t1_cj7z028,Shamans kinda got the shaft this xpac but defiles are better than mystics.Conjy I am not really sure raiding wise most raids I have been in have had a necro over a conjy. I think there is something buggy about them but I cant remember off the top of my head.,EQ2,cj7z6py,2,t5_2r4sq
1886371,0,t1_ckggs09,I nd Rift. It is the friendliest and least limited almost none FP game I can think of.  I played it when i had to drop  on the collectors edition and grabbed a year of service in release day.  It was amazing.  The transition for FP has kept the game exactly as it was when it was pay to play.  Paying a sub now offers a few nice little boosts.  Also... One of the features I with ALL FP games offered. You can pay to have you character capable of doing EVERY crafting and gathering skill!!!! The greatest FP store Item I have ever seen in my opinion.  ,EQ2,ckgi0bb,2,t5_2r4sq
1900304,0,t1_cki3hhp,Thanks for your responses guys as another new player I found them helpful also.,EQ2,cki6c8x,3,t5_2r4sq
2781571,0,t1_cnk7mas,No it was the last fight in raid on uh sunday inquisitor sonogrius maybe And I just went to his outgoing damage on the fight .mil and just saw the top  things were I think pierce and burn at . and . mil dps. Then the next was VC at around k dps.When I wake up in the morning I can post a picture of his outgoing.,EQ2,cnk977u,2,t5_2r4sq
2787562,0,t1_cnkec2a,I look at it often actually. One column says enc dps which is usually a large number and I do not know what to make of it on the VC line. Then there is a Median min and max. I assume that the numbers reflect how many times you used VC during that one encounter?,EQ2,cnkxpjx,2,t5_2r4sq
2807021,0,t3_2pkujv,Very late but I saw this in game today and remembered your post Not sure if this is what you are looking for?,EQ2,cnn5eb1,1,t5_2r4sq
2894101,0,t1_cnw0jyk,Easiest way to get manageable amounts of plat is do your daily quests for loyalty points and trade  of them for p via the loyalty vendor.For larger amounts of plat buy krono from the SOE store and sell it in game for .k plat each.,EQ2,cnx2a0v,2,t5_2r4sq
3120476,0,t1_colehcn,were one of the groups neckbeards PGamers vs Hackersseems like they chose a silly group to attack.,EQ2,colfq2o,1,t5_2r4sq
3209943,0,t1_coukbxu,No silvers not available for purchase any more. Some accounts are still grandfathered silver.,EQ2,coupka3,1,t5_2r4sq
3389728,0,t3_2z0d3z,Its a work in progressWe need devs btw ,EQ2,cpenmf3,3,t5_2r4sq
3623903,0,t1_cq5bvpz,Then why were chanters given  ability that basically doubled their dos overnight? Your statement basically shows you have no idea the current state of this game.  You are tuning bards based on  or  people at the top end which dies nothing for the rest of the community. Can bards get Mimicry?  It wont count towards VC and we can call it a day.Your mantra about support classes is cancerous and if they are truly just supposed to stand there and be buff bots put their abilities on other classes and remove bards altogether.Ill say it again put a cap on VC and give bards a larger boost to abilities so a potency build is a viable option.,EQ2,cq5co5x,-3,t5_2r4sq
3627632,0,t1_cq5690p,You made an unfounded assumption so its DBGs duty to make an announcement to the contrary?,EQ2,cq5s09u,-1,t5_2r4sq
3648314,0,t3_3254qt,Very cool site ,EQ2,cq84vad,2,t5_2r4sq
3649851,0,t1_cq881kp,ha lucky i still have sims  installed then.  ,EQ2,cq8b65u,0,t5_2r4sq
3649995,0,t1_cq6w17l,Some of us just werent interested in yet another thing to deal with ..facebook twitter now reddit and who knows what else.  However given the climate on the forums now I think I will post here instead of at the forums.   ,EQ2,cq8brgj,2,t5_2r4sq
3790641,0,t1_cqo378t,Its not Kool Aid bro its just plain old thinking. Im not defending anyone Im pointing out some possible reasons why theyve decided to look at other options.If it was as easy as snapping their fingers and merging a bunch of servers they probably would have done it already. This is an old game with a bunch of stuff slapped together and layered on top of each other that it is likely a nightmare to do anything of that magnitude.,EQ2,cqod3et,0,t5_2r4sq
3828355,0,t1_cqsnmck,We brute forced most of the names.  What we did with the rat was pulled him and the other guy under one of the vats.  When the humanoid guy forget name put up his whatever it was I ran over and clicked a lever on the pole of the vat.  That dropped liquid down and canceled his buff.  I think it might have buffed the rat as well but we didnt have an issue with him at all.  SK Mystic Necro x Wiz and Illy.,EQ2,cqsnxoy,1,t5_2r4sq
3841032,1,t3_34feop,We remain majorly committed to producing great content for our EQ and EQ players for a long time to come and rest assured there is going to be plenty of content for EQN players as well including raids and all the stuff players have come to know and love in these games.You must not have gotten the rum cellar DLC adventure pack cause its a whopping POS,EQ2,cqu40s3,0,t5_2r4sq
3915303,0,t1_cr2ifum,Correct me if Im wrong but you think that having the players pay for access to a progression server will negate the complexity and effort required to do this?,EQ2,cr2kvwx,2,t5_2r4sq
3933795,0,t1_cr4kvht,Umm Im picking up anon in who all,EQ2,cr4orq4,2,t5_2r4sq
3977429,0,t1_cr9ngap,Glad to hear it! If you end up on Unrest for whatever reason send me a tell on Liou.,EQ2,cr9nsde,1,t5_2r4sq
4019136,0,t1_cre785n,Thanks for the answer Im planning to roll Paladin.  What are your AA?,EQ2,creeuf8,1,t5_2r4sq
4073944,0,t1_crknjbj,EXACTLY!!! Lmao! Ive been quite clear. you need to run from this game and save any cash you can.You however still cant express an independent thought from what Ive read.,EQ2,crknmu5,-5,t5_2r4sq
4074084,0,t1_crko5dz,Oh you make it too easy. have a nice night.,EQ2,crko7hq,-1,t5_2r4sq
4088738,0,t1_crm805i,I was contemplating what you had to say but then you actually used the word lamesauce...,EQ2,crmcabf,1,t5_2r4sq
4216721,0,t1_cs0ijfe,I dont think it absolutely necessary to have blue gear maybe blue gear as I said but Im sure that at least some would help. HH is toward the end of the adv. solo progression so I would think that fully gemmed yellows with some additional doodads would do the trick. You could likely rock the place in refined MC gear.Back in the day there were no adv. solos or plain old solos. You learned heroic zones the hard way with a group and no strat hints ahead of time from the solo stuff. Doesnt seem like that much suck to me. Just a game trying to capture as many styles of play as possible.,EQ2,cs0w1hq,0,t5_2r4sq
4229831,0,t1_cs1r4m5,lol we have the Priest Ethereal for sale on the broker too.,EQ2,cs2dshy,1,t5_2r4sq
4229935,0,t3_37skfb,I quit playing EQ during about the middle of DoV having played since launch. As of about  days ago I came back to the game buying the newest Xpac and Adventure.During my hiatus from the game I played almost every MMO on the market and cant say that there is anything even close to as good as EQ still as sad as that may seem and even though its glory days may be behind it Im enjoying the game more than ever.As for what the loyal long term players voicing what they dont want? I see a large bounty of raid content for me to progress through as well as some old raid zones being revamped for top level gameplay. This might be lazy developing but I love it.Today I also rolled up a new alt and found a casual guild that was founded this week they have about  people that just started playing the game for the first time. We might not have the bustling population we used to and there may be another server merge in a year or so but at this point Ill be playing until the day they drag me off their servers.,EQ2,cs2e873,1,t5_2r4sq
4416585,0,t1_csnavdn,I prefer inq merc due to the verdict and because stamper has far more dps than any other standard priest merc. Also I am not familiar with those mercs sorry. ,EQ2,csnheyp,3,t5_2r4sq
4549926,0,t3_3dar3o,deleted,EQ2,ct45452,1,t5_2r4sq
4868374,0,t1_cu850zb,Then dont raid.  It really isnt that hard.  Because your guild of  people decided not to enjoy the mid tier content does not mean that everyone has to employ a race to the finish.  Id prefer  month expansions personally.,EQ2,cu871qh,6,t5_2r4sq
4903752,0,t1_cucjg9r,Im also new and looking for a class but is there not a single scout class that doesnt require you to use stealth? I want to play a DPS or support class rather not a mage since I like melee combat a lot but all the scouts seem to be equipped with a stealth skill and some stealth attacks. Can i ignore these or do i have to play as a tank if I want melee combat without the stealthy part?,EQ2,cucnm1d,1,t5_2r4sq
4971746,0,t1_cul7dbj,Not for a while no. Unless they change something beastlord wont be available till AoD is released same with chanchan  and ToV,EQ2,cul84q9,1,t5_2r4sq
5054992,0,t3_3k76k4,Amazing. Its like the old days again with all the older zones having a healthy population. You can find groups fairly easy. I havent grouped in some of these zones in  years.,EQ2,cuvbgjl,8,t5_2r4sq
5085565,0,t1_cuyztm5,I understand that but you should still try the Forgot Username option with any email addresses you have even if you are  sure. It will eliminate any other situation you might not be thinking of such as creating an account with another game that was also an SOEDaybreak game with their forums or some other situation that neither of us might be thinking of.gt I usually have the same username for all my accounts but with different numbers at the end. So I tried to log in with different numbers but...You are willing to guess at multiple usernames which means you already considered that you might have forgotten something. Just eliminate the possibility with alternate emails so that if someone else or someone from customer support at Daybreak suggests trying it.Also if you try it with your current email it might reveal a bug of some kind such as more than one account name attached to the email address somehow. Maybe it wont respond at all to your proper email address due to a glitch. Knowing that will make things easier to fix.,EQ2,cuz0516,2,t5_2r4sq
5247479,0,t3_3muy6w,Probably its just a general AOE spell that each class gets. Ive been waiting for a named before and just spammed my AOE. Like on Wizard with the Firestorm. Pally and SK has a good one that I believe was faster casting than wizard. Basically if no targets are in the area there is no cool down timer you can just recast it right away.,EQ2,cviidgu,0,t5_2r4sq
5250615,0,t3_3mg3db,Death toll just got Drunderwaved. The main botter in Freeport just got booted.  accounts gone!,EQ2,cvivzc8,2,t5_2r4sq
5257682,0,t3_3n01wk,Some people say actually turning off multicore support will increase your performance. But as everyone has said unless you can overclock your cpu to like ghz you arent going to get a perfect experience.  It uses almost  gpu unless you have gpu shadows on.,EQ2,cvjqlsu,2,t5_2r4sq
5340067,1,t3_3o5oup,After weeks of attempting Brell and not figuring out why was the contested Avatar of Brell healing sometimes and not healing and after telling Carlos Mora a.k.a. Gninja the developer who designed this encounter that there were workarounds of reviving in this fight we got told that the fight is working as intended and that he wasnt going to put any more time into changing this encounter.Not getting any warnings or told ingame or out that what we were doing is wrong we continued pulling the encounter and getting close to killing it.After members of competing guild Revelations made alternate characters and moved them to Brells platform to spy on us with names like Agiko Xnokrad Mirgom Overpowered and harass us between pulls when they noticed we were getting close to killing it they petitioned Carlos MoraGninja to have us suspended. Carlos Mora complied with Revelations request and gave us all a suspension. Even members of our guild that werent part of the raid but were spectating got suspended.To us its a clear abuse of power specially to paying customers who have diligently and loyally played this game for  years. We have beta tested many of Everquests  expansions and helped all the different developers in whatever way we can to make this game what we considered to be the best MMO in the market. We got banned for doing something that a number of different guilds have also done in the past like Contested Prexus. If zerging was a bannable offense that had serious repercussions somewhere in the Terms of Service or any Developer could have contacted us and given us a warning for doing so.Also for anyone wanting a little bit of context on this encounter and why we were so frustrated with it and with Carlos MoraGninja.. The mob is impossible to kill with  players. You need to bring  or less players to be able to kill him. This got many people upset that they were not allowed to be in raid when normally they would have been able to raid like every other raid encounter due to Brells damaging AoE mechanic.. The mob has two specific emotes that has been in the encounter since its implementation. a. First emote The Avatar gainsregains his connection to underfoot any damage dealt to him will be healed. b. Second emote The Avatar loses his connection to underfoot he can once again be damaged!. With both those emotes it WAS clear to us that theres a red lightgreen light mechanic to this fight. If you attacked him while he had his connection he would get healed. Problem was that sometimes he would get healed and sometimes he didnt. We were wondering why this inconsistency was happening and couldnt figure out why. The problem which was mentioned to Carlos MoraGninja multiple times was that if you actually followed the red lightgreen light script you wouldnt be able to kill Brell in his  minute enrage timer. The damage windows from his Healing Shield being active and inactive were very small and it wouldnt allow any guild to kill him within that timeframe so it was obvious to us that you had to do damage to him while the Healing Shield was active in order to kill him within the  minutes.  . We contacted Carlos Mora via Private Messages about this situation about its inconsistencies and we even showed him video proof about the evidence. He ignored our requests and told us that the fight would remain as is leaving us with the question about why was Brell healing sometimes and other times he wasnt.. Other guilds like Revelations figured out what was exactly causing this mob to heal before anyone else. The managed to get the World Wide first kill on it after figuring out this encounter mechanic and used it to their advantage to kill it first.. After  weeks of trial and error and frustrations we finally managed to figure out what was causing Brell to heal to full health. The different Max Health Debuffs that various classes have were causing Brell to heal while the Healing Shield was activated. If none of the raid members used a Max Health Debuff while the shield was active his health would continually go down. Finally relieved that we figured out this MISLEADING emote of Brell we managed to get him close to killing him.. Eventually Carlos MoraGninja appeared during our raid pull and despawned Brell because we were exploiting and subsequentially had everyone present from Fatality banned even spectators.Moral of the Story? Dont believe what the Developers tell you and certainly dont trust them. They can make rules and policies on the fly to get people banned for something that was perfectly legal ingame for  years. A group of loyal players for  years who have consistently collaborated and donated their free time Beta Testing EQ for many years are suddenly chastised and banned.,EQ2,cvu93k0,0,t5_2r4sq
5364365,0,t1_cvwxsq9,Gninja always watches the first few kills on harder mobs. Especially when said guild bitches at no end that it was broken or some how especially biased against them.Even if no other players were watching they still would have gotten caught.,EQ2,cvxcwrb,1,t5_2r4sq
5723433,0,t1_cx6j12e,Theyre especially tasty in pie. Not so good for cake. ,EQ2,cx6jr8h,1,t5_2r4sq
5792122,0,t3_3uib9q,Mercenaries will let you do pretty much any content on any class. A healer merc will make survivability almost a nonissue on the scouts.,EQ2,cxf2fwa,3,t5_2r4sq
5833142,0,t3_3v24ei, Currently on the second expansion with the third likely to be released in about  weeks. The PVP server is very quiet. A number of guilds are essentially on maintenance mode until the release of the next expansion.  From your post it looks like youre interested in PVP. Deathtoll is MUCH quieter than the PVE server. I would suggest rolling in the evil faction if you do come it has a higher population. Population has gotten better over the last week but is nowhere near what it used to be. There is no PVP gear. It may be introduced in two expansions. Raiding is easier than it was when the servers were live. The reasons for this is that adjustments have been made as the game has progressed some mob scripts were changed and gear was retrospectively improved. This means people outgear content that used to be quite hard making it much easier. There werent as many scripted raid fights in the early days of EQ which makes the easy raid zones trivial. That being said few guilds have cleared the two final instances of the expansion because they involve scriptsmore coordination. All in all the raiding should get progressively harder and there is hope that they will be adjusting the difficult of future raid encounters based on player feedback.The game is rewarding. It has far more class complexity than other MMOs. There is more to do and more to learn. The problem is that the server is in the doldrums until the next expansion but if you want to be of level to enjoy that content youre better off starting now.I would suggest holding off until KoS unless you can find a friend to join you to help you through the earlier content. Its more fun with a friend anyway ,EQ2,cxk92pc,2,t5_2r4sq
5994997,0,t1_cy414ha,Havnt played on live servers since coming back. I last played with RoKlevel  cap and things seemed well balanced then. TLE feels just slightly worse than I was expecting. Much room for improvement but good enough  early levels are easier than they were back in the day but you wont be just cruise controlling through everythingyou probably will in a good  man team but no game can really balance content to both be viable to solo and run  people through it if you mix it up with soloing playing with a few friends and getting those exp grind parties youll have that good MMO levelling experience  endgame raids are fairly lackluster ATM but the devs have said theyre putting in more changes for the next expansioncoming july ,EQ2,cy5h3pq,1,t5_2r4sq
6032357,0,t3_3y02mh,Tree of Savior is a new MMO with a complex class system,EQ2,cyacxd8,1,t5_2r4sq
6054088,0,t3_3yg3ob,Not skyshrine...Either do ALL adv solosolo zones from AoM. Get a healer friend or scout if your a healer and beast them out in a hour.Or get a group together in Brokenskull bay contested,EQ2,cyd6v72,1,t5_2r4sq
6206546,0,t1_cyupajg,Ive been able to solo some hard stuff on a well geared Paladin Skyshrine raid gear some CoE heroic jewelry. Id imagine Shadowknights do well or better. Fury would also be good since their DPS is decent and they can heal quite well. I havent seen anyone burn through stuff quicker than a Berserker though.,EQ2,cyv49br,2,t5_2r4sq
6222451,0,t3_3zzute,What happens to the TLE server once it eventually catches up?  Will people stay there and it becomes a standard server or will they start all over again with level  and do it all over again?To me it makes sense to give members a free transfer and reset it back to once every couple years.  Or do a full merge to one of the low population servers to give it life.,EQ2,cywxbk1,1,t5_2r4sq
6300255,0,t3_41w9b5,Thanks for posting that.Too funny!,EQ2,cz5rncd,4,t5_2r4sq
6687918,0,t3_478gk2,There arent any more armor quests like the T one.  You can do quests that give armor but no more matched sets until you reach T I think and most of those are raid items.You should probably look into crafted gear.  If you can harvest or buy the rare ores you can hire an armorer to make you some pretty decent stuff.  Youll also get some quested items and mob drops as you go along.Theres a reason everyone uses the Appearance gear slots.  Until those were added to the game the people in the best gear looked like thrift store rejects because it was so hard to get good gear that looked good.,EQ2,d0b37z4,1,t5_2r4sq
6845882,0,t3_48mmj9,Agnostics are dreadful rushed slogs for the most part. End game is totally different. People still tend to rush through instanced content but its way more fun and challenging.,EQ2,d0sachy,1,t5_2r4sq
6897787,0,t3_4a4tt4,Is EQ safe?,EQ2,d0y6kxw,3,t5_2r4sq
7014343,0,t1_d19p4u1,Heres the thing for me... I play in top tier raiding guilds and would be someone that the general server population would consider to be a doucheasshole.Thing is if someone is new or has questions or wants to improve I will go out of my way to help them answer questions donate gear or whatever. Its when some smug trash TT player comes along talking about things they have no idea of how they work Ill go off on them. If you dont know just say you dont know. Dont act like you do.,EQ2,d1bf9vl,1,t5_2r4sq
7624751,0,t3_4jr81l,deleted,EQ2,d38w6b6,1,t5_2r4sq
8060790,0,t1_d4lunle,Sweet! I played as a hardcore raider for years on crushbone,EQ2,d4m3wr7,1,t5_2r4sq
8144770,0,t3_4qrz22,Are you sure that wasnt from Neriak in original EQ Third Gate maybe?,EQ2,d4vn4ug,1,t5_2r4sq
8481180,0,t1_d61jjgx,I am unsure what role I am supposed to play.  Have only played solo.,EQ2,d61owcj,1,t5_2r4sq
8713841,0,t1_d6utlsi,yep  free level  heroic character per account that was created before August rd of this year. Can be used on an existing or new character.,EQ2,d6uv8q1,1,t5_2r4sq
