,controversiality,parent_id,body,subreddit,id,score,subreddit_id
9038147,0,t3_4x7kjl,Fantastic body!,Nudes,d7y8pmu,1,t5_2r2mk
9062994,0,t3_54eqvp,Whats kik sis... New here so dont blame me,Nudes,d8184q5,1,t5_2r2mk
9802920,0,t1_dalc3re,What do you mean,Nudes,dalf5v5,1,t5_2r2mk
11375118,0,t3_62bxh3,In order to eliminate spam we require a minimum accountage and commentkarma.  These minimums are to deter spam and are not disclosed.  Please try again after you have acquired more karma.  No exceptions can be made.I am a bot and this action was performed automatically. Please contact the moderators of this subredditmessagecompose?torNudes if you have any questions or concerns.,Nudes,dflcm68,1,t5_2r2mk
11429215,0,t3_635i9h,In order to eliminate spam we require a minimum accountage and commentkarma.  These minimums are to deter spam and are not disclosed.  Please try again after you have acquired more karma.  No exceptions can be made.I am a bot and this action was performed automatically. Please contact the moderators of this subredditmessagecompose?torNudes if you have any questions or concerns.,Nudes,dfrhmii,1,t5_2r2mk
