,controversiality,parent_id,body,subreddit,id,score,subreddit_id
5043,0,t3_1u5qga,deleted,GTAVadventures,cef0etv,1,t5_2z4uc
17139,0,t3_1smyrh,PSN wandaforce SC same,GTAVadventures,cegdv48,1,t5_2z4uc
64345,0,t3_1uu84e,Add me. GT FS Shaffer  ...I will race in a few hours. ,GTAVadventures,celr7gr,2,t5_2z4uc
72892,0,t3_1uwrg8,Yo send me a invite onIm down for whatever  garciavic ,GTAVadventures,cemq7l8,1,t5_2z4uc
76140,0,t3_1uz6li,Could you put XBOX in the title next time thanks ,GTAVadventures,cen3i96,2,t5_2z4uc
84230,0,t3_1v0596,Just added you. ,GTAVadventures,ceo0o72,1,t5_2z4uc
91175,0,t1_ceorpx6,Ya add me,GTAVadventures,ceot5ab,1,t5_2z4uc
97754,0,t1_cepc8h1,Still hidden L,GTAVadventures,cepk4x1,1,t5_2z4uc
118575,0,t1_ceru908,I play in open lobbies. If I start to die a lot then I switch. Im willing to do them with other people. Pm your gt and ill invite you.,GTAVadventures,cerxm6i,1,t5_2z4uc
156171,0,t1_ceunnho,Trocket... what are you doing?.....Nooothing.,GTAVadventures,cew7wro,1,t5_2z4uc
156266,0,t1_cew7xkb,im getting on now send me an invite or ill message ya for one. meet at airport?,GTAVadventures,cew8atr,1,t5_2z4uc
202081,0,t1_cf0tnmd,I was in that lobby bur not for that. I was there when we were trying to line up jets and stuff. After a lot of playing my power supply overheated though. ,GTAVadventures,cf1gkke,2,t5_2z4uc
235146,0,t3_1wt164,Hopping on in a few ,GTAVadventures,cf54f95,1,t5_2z4uc
247591,0,t3_1wxjtk,Gt sphengaly Hit me up,GTAVadventures,cf6eznc,1,t5_2z4uc
449031,0,t3_1z7pvn,GT phatwilly ,GTAVadventures,cfrb26j,1,t5_2z4uc
530881,0,t3_207z8p,Oh man I feel you. I used to have the same problem when I worked the graveyard shift at UPS. Hope you find a few people. ,GTAVadventures,cg0m9kk,1,t5_2z4uc
561054,0,t3_20hul6,Will this be kind of a regular thing? Because if so Im down to come play when ever Im needed p,GTAVadventures,cg41qr3,1,t5_2z4uc
663729,0,t3_21r1jv,inv Burgerfreshh,GTAVadventures,cgfprkx,0,t5_2z4uc
673924,0,t3_21v7wk,Why do you write it with capital letters for Hey Someone Hacks? What was the actual point? Because I thought that might have been the name of a Youtuber you were playing with.,GTAVadventures,cggvimj,-3,t5_2z4uc
681522,0,t1_cghqhus,deleted,GTAVadventures,cghqn12,1,t5_2z4uc
709040,0,t3_22a6fz,full?,GTAVadventures,cgkvdc0,1,t5_2z4uc
848141,0,t1_ch0l3g5,deleted,GTAVadventures,ch0orqq,1,t5_2z4uc
852384,0,t3_23vd0h,I like the song whos the artist? ,GTAVadventures,ch165vr,2,t5_2z4uc
859185,0,t3_23yzth,The most youll get in a Snapmatic photo is  as somebody has to take the picture. ,GTAVadventures,ch1y04d,1,t5_2z4uc
1069212,0,t3_26bqot,They patched this in . or . IIRC. You havent been able to store a Police car for a very long time.,GTAVadventures,chptoae,1,t5_2z4uc
1098551,0,t3_1s5mc8,Hello everyone! PSN  latvian SC  latvianDont hesitate to invite! ,GTAVadventures,cht5rwp,1,t5_2z4uc
1220747,0,t3_282yy6,Perhaps one day we can hope for cross console sessions. Its what gaming is about. ,GTAVadventures,ci6yals,2,t5_2z4uc
1309943,0,t3_28y86q,CHAOSTUNAA,GTAVadventures,cigzh0w,1,t5_2z4uc
1369937,0,t1_cio0bur,nope not any of them.,GTAVadventures,cio0d5p,1,t5_2z4uc
1607798,0,t1_cjhtc0w,Eh the futo is just as disappointing. I prefer the cometfeltZerF for drifting l. The futo or Warrener dont quite have the power I need to properly drift. The other car is the rhapsody FYI!,GTAVadventures,cjhtwqt,1,t5_2z4uc
2378612,0,t3_2mjr6o,Ill add you. I got a mic and Im down for most fun stuff online. GT Android Finale ,GTAVadventures,cm5pe5w,2,t5_2z4uc
3382266,0,t1_cpb4j6o,You got a mic? Because Ive been needing more people to run heists with.,GTAVadventures,cpdsylj,1,t5_2z4uc
10641671,0,t3_5s8odh,Nice!! Thanks ,GTAVadventures,dddlv0d,1,t5_2z4uc
