,controversiality,parent_id,body,subreddit,id,score,subreddit_id
5702805,0,t3_3sz6ex,Isnt this the exact logic used to justify suicide bombing and other terror tactics?,InternetHitlers,cx3zlio,1,t5_3aszm
5969733,0,t3_3x2r2m,We did it reddit xd,InternetHitlers,cy25vpb,2,t5_3aszm
6031824,0,t1_cy9q269,The idea makes me laugh that while everyone in history class is learning how extreme and barbaric the Spartans were there are plenty of little Hitlers who are sitting there thinking Awesome idea!,InternetHitlers,cyaafc3,3,t5_3aszm
6035614,0,t1_cyas45p,Well advocating mass murder for starters. Mass murder has been used throughout history and has been usually historically regarded as a bad thing. ,InternetHitlers,cyas7po,15,t5_3aszm
6063612,0,t3_3yfxfn,deleted,InternetHitlers,cyefl20,1,t5_3aszm
6227954,0,t3_40sqw4,this guy has to be an advanced troll right? I mean hes like the embodiment of Poes law,InternetHitlers,cyxjucn,4,t5_3aszm
6769890,0,t1_d0jm3y6,gtExactly my point! Immigration is a government policy. You just said it yourself. Thus as a policy it can be changed or repealed its completely up to us  not foreigners airline companies globalization colonization the UN... no one but us.As I said governments can try to modify flows of migration but they have no full autonomy over it as migrants are autonmous actors. This is a rough outline of autonomy of migration gt It is thus easy to forget that migrants are acting individuals who develop their own strategies to adapt to the conditions at the borders and that the practices of the border regimes themselves are closely intertwined with these strategies. Indeed while the border regimes may make ostensible attempts to keep the borders shut by criminalizing migration they nevertheless reckon with and even depend on the fact that a certain number of individuals will make their way through. More and more it is the transnational illegal immigrants who are becoming the pawns of the increasingly flexible and globalized economies of Southeast and Western Europe. However at the same time the political and economic selfinterest of these economies provides migrants with certain opportunities to develop tactics of their own and shape their own destines  leading to the unexpected effects of an autonomy of migration which extend beyond the limits of what can be controlled through planning.gt How will immigration raise European birth rates? It wont. Their numbers will continue shrinking while foreigner number continues to go up.Only by a ethnic or racial perspective. Migrants can become citizens and therefore part of the nations population which is an ongoing process. Only an idiot would argue that Zlatan Ibrahimovic is no Swede. Additionally in nations with demographic problems its not necessarily about raising birth rates but keeping the population number steady. ,InternetHitlers,d0jnc39,2,t5_3aszm
6782864,0,t1_d0l4e7c,Yes because people want to do the same to me smartass. Get a fucking quran and read it. We are the infidels for them if you didnt know it yet,InternetHitlers,d0l4g1w,-13,t5_3aszm
7017997,0,t1_d1btyve,woah there buddyhow do you disprove a triple negativecause thats what this isthey got you there didnt they,InternetHitlers,d1bu73x,13,t5_3aszm
7327268,0,t3_4fqd67,Snapshots. This Post    I am a bot. InforSnapshillBot  Contactmessagecompose?torSnapshillBot,InternetHitlers,d2b26nt,2,t5_3aszm
7409835,0,t1_d2jdwfc,Thanks for sharing ,InternetHitlers,d2kg7c5,0,t5_3aszm
7793023,0,t1_d3ruzc3,Enjoy the flair!,InternetHitlers,d3rzs8u,2,t5_3aszm
7793207,0,t1_d3s0f11,Thanks I see it now! But its the chink kind though. Still nice.,InternetHitlers,d3s0j4k,1,t5_3aszm
7864535,0,t3_4n01ir,What did he post originally?,InternetHitlers,d401nni,3,t5_3aszm
8122903,0,t1_d49ngb9,Maybe because he knows that they would long knived him. ,InternetHitlers,d4t35bd,1,t5_3aszm
9137516,0,t1_d8a06hf,Thanks for the archive shot ,InternetHitlers,d8a8w2m,3,t5_3aszm
9616362,0,t1_d9n6t0k,Oh you silly past human....,InternetHitlers,d9yexg0,3,t5_3aszm
9646958,0,t3_5d6pc8,Snapshots. This Post    I am a bot. InforSnapshillBot  Contactmessagecompose?torSnapshillBot,InternetHitlers,da26ri3,1,t5_3aszm
11136804,0,t3_5yvik1,gtShut your filthy jewish mouthjews arent innocent martyrstheyve been kicked from  nations  times . Your cocksucker rabbis suck the blood of circumsized chilldrenThis is spammed  times in a row.,InternetHitlers,deucgaq,3,t5_3aszm
11640497,0,t3_65zowq,Ive seen a lot of people fully buy into JTs Im not racist Im just a bad debater excuse. Its fucking infuriating. Im a bad debater and I can assure you that doesnt mean hes saying things he doesnt believe. And if you have shit beliefs being well spoken doesnt make them less shit.,InternetHitlers,dgfgpdq,17,t5_3aszm
