,controversiality,parent_id,body,subreddit,id,score,subreddit_id
4939844,0,t3_3ikgej,Most Popular Comments   |Score|Author|Post Title|Link to comment||||||||uSSSS|A girl shared this on my Facebook. I am very proud of her.|link||uGottlobFrege|A girl shared this on my Facebook. I am very proud of her.|link||uAvgGuy|Feminist Karen DeCrow on Male Reproductive Rights|link||uLesFuries|Two underage boys and an underage girl were caught filming themselves having sex in my city by police officers. Theres nothing to suggest that it wasnt consensual but the two boys will now be prosecuted heavily by the law while the girl gets off scotfree.|link||uthrway|Feminist Karen DeCrow on Male Reproductive Rights|link||ustimzor|A girl shared this on my Facebook. I am very proud of her.|link||udavidrexs|Mom admits to killing  young sons so that her daughter could have more attention  despite the previous deaths a judge had returned the third son to her custody just  days before he was killed|link||uDaneWhitman|Mom admits to killing  young sons so that her daughter could have more attention  despite the previous deaths a judge had returned the third son to her custody just  days before he was killed|link||uxynomaster|As a father of two girls and one boy this set me off this morning on FB.|link||uldgj|Mom admits to killing  young sons so that her daughter could have more attention  despite the previous deaths a judge had returned the third son to her custody just  days before he was killed|link||uBloodQueefMcOral|A girl shared this on my Facebook. I am very proud of her.|link||uJaytDude|Two underage boys and an underage girl were caught filming themselves having sex in my city by police officers. Theres nothing to suggest that it wasnt consensual but the two boys will now be prosecuted heavily by the law while the girl gets off scotfree.|link||uAnnoyingFaecbookGirl|Two underage boys and an underage girl were caught filming themselves having sex in my city by police officers. Theres nothing to suggest that it wasnt consensual but the two boys will now be prosecuted heavily by the law while the girl gets off scotfree.|link||uwilliamisme|Feminist Karen DeCrow on Male Reproductive Rights|link||uDemonspawn|As a father of two girls and one boy this set me off this morning on FB.|link||uStripes|This is how Mary P. Koss one of the most prominent feminist researchers in the field of sexual violence in the United States feels about male rape victims.|link||ujvardrake|As a father of two girls and one boy this set me off this morning on FB.|link||uPerniciousOne|Mom admits to killing  young sons so that her daughter could have more attention  despite the previous deaths a judge had returned the third son to her custody just  days before he was killed|link||uSSSS|A girl shared this on my Facebook. I am very proud of her.|link||uScimitar|Woman used sperm from oral sex to get pregnant and successfully sues for child support.|link||uMen|Feminist Karen DeCrow on Male Reproductive Rights|link||uUpTheButtJesus|A girl shared this on my Facebook. I am very proud of her.|link||uSpaceDog|A girl shared this on my Facebook. I am very proud of her.|link||urKremlin|Mom admits to killing  young sons so that her daughter could have more attention  despite the previous deaths a judge had returned the third son to her custody just  days before he was killed|link||uxynomaster|Mom admits to killing  young sons so that her daughter could have more attention  despite the previous deaths a judge had returned the third son to her custody just  days before he was killed|link||uArakin|Men are much more stressed about their bodies than five years ago  A new survey has found that only  of men are happy with their physique|link||uDavidByron|Two underage boys and an underage girl were caught filming themselves having sex in my city by police officers. Theres nothing to suggest that it wasnt consensual but the two boys will now be prosecuted heavily by the law while the girl gets off scotfree.|link||uiDryShaveMyBalls|A girl shared this on my Facebook. I am very proud of her.|link||ugood|Feminist Karen DeCrow on Male Reproductive Rights|link||uTheDude|Mom admits to killing  young sons so that her daughter could have more attention  despite the previous deaths a judge had returned the third son to her custody just  days before he was killed|link||uDorkJedi|As a father of two girls and one boy this set me off this morning on FB.|link||usillymod|A girl shared this on my Facebook. I am very proud of her.|link||unahog|Two underage boys and an underage girl were caught filming themselves having sex in my city by police officers. Theres nothing to suggest that it wasnt consensual but the two boys will now be prosecuted heavily by the law while the girl gets off scotfree.|link||uEvo|Feminist Karen DeCrow on Male Reproductive Rights|link||uUpTheButtJesus|A girl shared this on my Facebook. I am very proud of her.|link||uwaxwick|As a father of two girls and one boy this set me off this morning on FB.|link||udingo|Two Female Teachers Busted On A Threesome With A YearOld Male Student Prosecutors Still Cannot Make Up Their Minds Whether They Will Face Charges|link||uobviouslythrowaday|Feminist Karen DeCrow on Male Reproductive Rights|link,subredditreports,cuh7ghs,1,t5_30uy0
4958376,0,t3_3itnyn,Histogram  Number of comments per user   One X  . comments.   XXXXXXXXXXXXXXXXXXXXXXXXXXXXXXXXXXXXXXXXXXXXXXXXXXXXXXXXXXXX  uYourDumb   XXXXXXXXXXXXXXXXXXXXXXXXXXXXXXXXXX  uInquisitor   XXXXXXXXXXXXXXXXXXXXXXXXXXXXXXXXX  uMongolPerson   XXXXXXXXXXXXXXXXXXXXXX  uDagonGreyjoy   XXXXXXXXXXXXXXXX  ugenYESide   XXXXXXXXXXXXXXXX  uPercentSaltIntake   XXXXXXXXXXXXXXXX  uCantstop   XXXXXXXXXXXXXXX  uGwydion   XXXXXXXXXXXXXX  uAlCohol   XXXXXXXXXXXXXX  uLeviathan   XXXXXXXXXXXXXX  uNiederweit   XXXXXXXXXXXXX  ulunainculta   XXXXXXXXXXXXX  uEvilwhiteoppressor   XXXXXXXXXXXXX  utrafalgarian   XXXXXXXXXXXXX  umcctaggart   XXXXXXXXXXXX  uYosiema   XXXXXXXXXXXX  uCedragus   XXXXXXXXXXX  uCuckBoy   XXXXXXXXXXX  umillionlampshades   XXXXXXXXXX  uRamblinRambo   XXXXXXXXX  uCAPSFUN   XXXXXXXXX  uGeneralPetrov   XXXXXXXXX  ulalaxyyz   XXXXXXXX  uAlCohol   XXXXXXX  uEuropeWillWin   XXXXXXX  uGanymede   XXXXXXX  uAndyJackson   XXXXXX  uthelasian   XXXXXX  uvladskandermagne   XXXXXX  uqdegtjulo   XXXXXX  uAugustoFranco   XXXXXX  uEnochFarage   XXXXXX  uBIGGUYFORYOU   XXXXX  uDivideEtImpera   XXXXX  uShekelBanker   XXXXX  uhurricaneivan   XXXXX  uBUAnoBAS   XXXXX  utonistoraro   XXXXX  uauntieaggie   XXXXX  uTheelout   XXXX  uBokstavligenHitler   XXXX  uALBKenshiro   XXXX  ufrawaurhtamma   XXXX  ukohalikpagan   XXXX  uKernes   XXXX  uLvBixNood   XXXX  uVercingetorix   XXXX  upctmoreistimes   XXXX  uLordoftheBanter   XXXX  ubritishbideshi      Histogram  Karma per Comment   Considering only the top  commenters   One X  . points.   XXXXXXXXXXXXXXXXXXXXXXXXXXXXXXXXXXXXXXXXXXXXXXXXXXXXXXXXXXXX . ushade   XXXXXXXXXXXXXXXXXXXXXXXXXXXXXXXXXXXXXXXXXXXXXXXXXXXXXXXXXX . uAndyJackson   XXXXXXXXXXXXXXXXXXXXXXXXXXXXXXXXXXXXXXXXXXXX . uItalmustardrace   XXXXXXXXXXXXXXXXXXXXXXXXXXXXXXXXXXXXXXXXXX . uFLAMEJKPERMBAN   XXXXXXXXXXXXXXXXXXXXXXXXXXXXXXXXXXXXXXXX . uneutrolgreek   XXXXXXXXXXXXXXXXXXXXXXXXXXXXXXXXXXXXXXXX . ulunainculta   XXXXXXXXXXXXXXXXXXXXXXXXXXXXXXXXXXXXXXX . uEviloresLeftEar   XXXXXXXXXXXXXXXXXXXXXXXXXXXXXXXXXXXXXX . uEvilwhiteoppressor   XXXXXXXXXXXXXXXXXXXXXXXXXXXXXXXXXXXXX . uferoslav   XXXXXXXXXXXXXXXXXXXXXXXXXXXXXXXXX . uKernes   XXXXXXXXXXXXXXXXXXXXXXXXXXXXXXXX . uPopeOfEurope   XXXXXXXXXXXXXXXXXXXXXXXXXXXXXXXX . uYourDumb   XXXXXXXXXXXXXXXXXXXXXXXXXXXXXXXX . uristorilsm   XXXXXXXXXXXXXXXXXXXXXXXXXXXXXXX . uBladeStrikes   XXXXXXXXXXXXXXXXXXXXXXXXXXXXXXX . uMullerReus   XXXXXXXXXXXXXXXXXXXXXXXXXXXXXX . uEuropeWillWin   XXXXXXXXXXXXXXXXXXXXXXXXXXXXXX . uBUAnoBAS   XXXXXXXXXXXXXXXXXXXXXXXXXXXXX . uCAPSFUN   XXXXXXXXXXXXXXXXXXXXXXXXXXXXX . uluckinator   XXXXXXXXXXXXXXXXXXXXXXXXXXXXX . uBIGGUYFORYOU   XXXXXXXXXXXXXXXXXXXXXXXXXXXXX . uAlCohol   XXXXXXXXXXXXXXXXXXXXXXXXXXXXX . uYosiema   XXXXXXXXXXXXXXXXXXXXXXXXXXXX . uauntieaggie   XXXXXXXXXXXXXXXXXXXXXXXXXXXX . uPercentSaltIntake   XXXXXXXXXXXXXXXXXXXXXXXXXXXX . uEnochFarage   XXXXXXXXXXXXXXXXXXXXXXXXXXXX . umcctaggart   XXXXXXXXXXXXXXXXXXXXXXXXXXXX . uAugustoFranco   XXXXXXXXXXXXXXXXXXXXXXXXXXXX . uLvBixNood   XXXXXXXXXXXXXXXXXXXXXXXXXXXX . uAlCohol   XXXXXXXXXXXXXXXXXXXXXXXXXXX . uhurricaneivan   XXXXXXXXXXXXXXXXXXXXXXXXXXX . uEuropaIrredenta   XXXXXXXXXXXXXXXXXXXXXXXXXXX . uTroubleshooter   XXXXXXXXXXXXXXXXXXXXXXXXXXX . uRacersmajls   XXXXXXXXXXXXXXXXXXXXXXXXXXX . uWidmerBeer   XXXXXXXXXXXXXXXXXXXXXXXXXX . uMongolPerson   XXXXXXXXXXXXXXXXXXXXXXXXX . usulopejur   XXXXXXXXXXXXXXXXXXXXXXXX . ubritishbideshi   XXXXXXXXXXXXXXXXXXXXXXXX . uGackt   XXXXXXXXXXXXXXXXXXXXXXXX . uLeonisius   XXXXXXXXXXXXXXXXXXXXXXX . uBokstavligenHitler   XXXXXXXXXXXXXXXXXXXXXXX . uLeviathan   XXXXXXXXXXXXXXXXXXXXXXX . uGlennznl   XXXXXXXXXXXXXXXXXXXXXX . upissedcanadian   XXXXXXXXXXXXXXXXXXXXXX . uNiederweit   XXXXXXXXXXXXXXXXXXXXX . umillionlampshades   XXXXXXXXXXXXXXXXXXXXX . uVercingetorix   XXXXXXXXXXXXXXXXXXXXX . ucurious   XXXXXXXXXXXXXXXXXXXXX . uCedragus   XXXXXXXXXXXXXXXXXXXXX . uALBKenshiro   XXXXXXXXXXXXXXXXXXXX . unumberkremlinshill   ,subredditreports,cujjker,1,t5_30uy0
4965756,0,t3_3ixd5c,Histogram  Number of comments per user   One X  . comments.   XXXXXXXXXXXXXXXXXXXXXXXXXXXXXXXXXXXXXXXXXXXXXXXXXXXXXXXXXXXX  uFatalExcursion   XXXXXXXXXXXXXXXXXXXXXXXXXXXXXXXXXXXXXXXXXXXXXXXXXXXXXXXXXX  uOfficialDubfire   XXXXXXXXXXXXXXXXXXXXXXXXXXXXXXXXXXXXXXXXXXX  uVIOLENTPOOP   XXXXXXXXXXXXXXXXXXXXXXXX  uDrspaghetti   XXXXXXXXXXXXXXXXXXXXXXXX  uwoflcopter   XXXXXXXXXXXXXXXXXXXXXX  uMariaLaGuerta   XXXXXXXXXXXXXXXXXXXX  uChiefZimbabwe   XXXXXXXXXXXXXXXXXXXX  uRedrot   XXXXXXXXXXXXXXXXXXXX  ulambeo   XXXXXXXXXXXXXXXXXX  uAutoModerator   XXXXXXXXXXXXXXXXXX  uKmlkmljkl   XXXXXXXXXXXXXXXXXX  uPastamannffc   XXXXXXXXXXXXXXXXXX  ulucisferis   XXXXXXXXXXXXXXXX  uIronBitters   XXXXXXXXXXXXXXXX  uPleaseNoEDM   XXXXXXXXXXXXXXXX  uTraxOnDaRocks   XXXXXXXXXXXXXXXX  ubattlemusic   XXXXXXXXXXXXXXXX  udonkeybrolic   XXXXXXXXXXXXXXXX  un   XXXXXXXXXXXXXXXX  uvulkkid   XXXXXXXXXXXXXXX  uchristfromtacobell   XXXXXXXXXXXXXXX  ucrazyflashpie   XXXXXXXXXXXXXXX  ueatingcarbs   XXXXXXXXXXXXXXX  umoveonever   XXXXXXXXXXXXXXX  unikoma   XXXXXXXXXXXXXXX  utheintention   XXXXXXXXXXXXXXX  uxachhill   XXXXXXXXXXXXX  uNegativeZero   XXXXXXXXXXXXX  udolantello   XXXXXXXXXXXXX  uCottonturtle   XXXXXXXXXXXXX  uDJSullyz   XXXXXXXXXXXXX  uFiktiv   XXXXXXXXXXXXX  uRITOIAM   XXXXXXXXXXXXX  ueuthlogo   XXXXXXXXXXXXX  unoodleface   XXXXXXXXXXXXX  uunoleian   XXXXXXXXXXXXX  uurbanuprising   XXXXXXXXXXXXX  uyngwin   XXXXXXXXXXX  uBrotestTheHero   XXXXXXXXXXX  uCantuccini   XXXXXXXXXXX  uChiafriend   XXXXXXXXXXX  uConfirmedSFW   XXXXXXXXXXX  uTomatoland   XXXXXXXXXXX  uamaanster   XXXXXXXXXXX  uksweet   XXXXXXXXX  uGlassLeg   XXXXXXXXX  uPgSubsecDPgrph   XXXXXXXXX  uRenral   XXXXXXXXX  uSterlingclass   XXXXXXXXX  uTweetPoster      Histogram  Karma per Comment   Considering only the top  commenters   One X  . points.   XXXXXXXXXXXXXXXXXXXXXXXXXXXXXXXXXXXXXXXXXXXXXXXXXXXXXXXXXXXX . uactualscientist   XXXXXXXXXXXXXXXXXXXXXXXXXXXXXXXXXXXXXXXXXX . uCottonturtle   XXXXXXXXXXXXXXXXXXXXXXXXXXXXXXXXXXXXXXXXXX . ulolroflqwerty   XXXXXXXXXXXXXXXXXXXXXXXXXXXXXXXXXXXXXXXXX . uChiefZimbabwe   XXXXXXXXXXXXXXXXXXXXXXXXXXXXXXXXXXXXXXXX . udnytm   XXXXXXXXXXXXXXXXXXXXXXXXXXXXXXXXXXXXXX . uxachhill   XXXXXXXXXXXXXXXXXXXXXXXXXXXXXXXXXXXXXX . uTheKcrimsonking   XXXXXXXXXXXXXXXXXXXXXXXXXXXXXXXXXXX . uGlassLeg   XXXXXXXXXXXXXXXXXXXXXXXXXXXXXXXXXX . ucrazyflashpie   XXXXXXXXXXXXXXXXXXXXXXXXXXXXXXXX . uksweet   XXXXXXXXXXXXXXXXXXXXXXXXXXXXX . uTomatoland   XXXXXXXXXXXXXXXXXXXXXXXXXXXX . uRaiderFist   XXXXXXXXXXXXXXXXXXXXXXXXX . udonkeybrolic   XXXXXXXXXXXXXXXXXXXXXXXXX . udolantello   XXXXXXXXXXXXXXXXXXXXXXX . utheintention   XXXXXXXXXXXXXXXXXXXXXXX . ubattlemusic   XXXXXXXXXXXXXXXXXXXXXX . uMariaLaGuerta   XXXXXXXXXXXXXXXXXXXXXX . uamaanster   XXXXXXXXXXXXXXXXXXXX . unoodleface   XXXXXXXXXXXXXXXXXXXX . uTweetPoster   XXXXXXXXXXXXXXXXXXX . uRedrot   XXXXXXXXXXXXXXXXXXX . uchristfromtacobell   XXXXXXXXXXXXXXXXXXX . ujepyang   XXXXXXXXXXXXXXXXXXX . uOfficialDubfire   XXXXXXXXXXXXXXXXXX . ueuthlogo   XXXXXXXXXXXXXXXXXX . ulambeo   XXXXXXXXXXXXXXXXXX . uwoflcopter   XXXXXXXXXXXXXXXXX . uFatalExcursion   XXXXXXXXXXXXXXXXX . ulucisferis   XXXXXXXXXXXXXXXXX . un   XXXXXXXXXXXXXXXXX . uVIOLENTPOOP   XXXXXXXXXXXXXXX . uKearkeeth   XXXXXXXXXXXXXXX . uDJSullyz   XXXXXXXXXXXXXX . uunoleian   XXXXXXXXXXXXX . upappA   XXXXXXXXXXXXX . uTraxOnDaRocks   XXXXXXXXXXXXX . uRITOIAM   XXXXXXXXXXXX . uBadhamPanorama   XXXXXXXXXXXX . uCountCritic   XXXXXXXXXXXX . uIronBitters   XXXXXXXXXXXX . uSenorToucan   XXXXXXXXXXX . uredflag   XXXXXXXXXXX . uDysphoriography   XXXXXXXXXXX . ueternalexodus   XXXXXXXXXXX . uNegativeZero   XXXXXXXXXXX . uBackwerdsMan   XXXXXXXXXXX . uvulkkid   XXXXXXXXXX . uSchleprok   XXXXXXXXXX . uaquinoguh   XXXXXXXXX . u   ,subredditreports,cukh06w,1,t5_30uy0
4974891,0,t3_3j2644,Gilded Posts   |Score|Author|Post Title|||||||upeoplma|How to reach consensus   Gilded Comments   |Ups|Author|Post Title|Link to comment||||||||uMortuusBestia| major players support BIP |link||uNLNico|August   Block Size and Hard Fork Dialog|link||ujinti|Its that time again!|link||uhumansdotgeti|American Teen Sentenced to  Years for Helping ISIS with Bitcoin|link||uBlockchainOfFools|David Jerry What if all core devs had a constitution to abide by? wp.mepyJLgz  Articles of Bitcoin Constitution A Genesis Block of Governance with initial approval by Adam Back Ph.D. Computer Science amp Distributed Systems|link||ubelcher|August   Block Size and Hard Fork Dialog|link||uBrainlessTales|Its that time again!|link||ucypherdoc|The Gold collapsing. Bitcoin UP thread returns!|link,subredditreports,culmerd,1,t5_30uy0
4992906,0,t3_3jbcpm,Histogram  Post Karma   One X  . points.   XXXXXXXXXXXXXXXXXXXXXXXXXXXXXXXXXXXXXXXXXXXXXXXXXXXXXXXXXXXX  uPMMEYOURDADBELLY    XXXXXXXXXXXXXXXXXXXXXXXXXXXXXXXXXXXXX  ushpongolian    XXXXXXXXXXXXXXXXXXXXXXXXXXXXXXXXXXXX  ujordansideas    XXXXXXXXXXXXXXXXXXXXXXXXXXXXXXX  udalonelybaptist    XXXXXXXXXXXXXXXXXXXXXXXXXXXXX  uMorlock    XXXXXXXXXXXXXXXXXXXXXXX  uMudokon    XXXXXXXXXXXXXXXXXXXXXX  usamlev    XXXXXXXXXXXXXXXXXXXXXX  uxsvietx    XXXXXXXXXXXXXXXXXXXXX  uTelemac    XXXXXXXXXXXXXXXXXXXX  uspankadoodle    XXXXXXXXXXXXXXXXXXX  umonomach    XXXXXXXXXXXXXXXXXX  ukevcube    XXXXXXXXXXXXXXXXX  uJakeJulian    XXXXXXXXXXXXXXXXX  uRafbys    XXXXXXXXXXXXXXXXX  ureallifeted    XXXXXXXXXXXXXXX  uFang    XXXXXXXXXXXXXX  uamazonv    XXXXXXXXXXXXX  uSynectar    XXXXXXXXXXXX  uDubandubs    XXXXXXXXXXXX  useanbrockest    XXXXXXXXXXX  uaxcho    XXXXXXXXXXX  urchrdcrg    XXXXXXXXXX  ugoblindoto    XXXXXXXX  uBeantil    XXXXXXXX  uMudHimmel    XXXXXXXX  udrmcfluffy    XXXXXXXX  ughost    XXXXXXXX  uiRoygbiv    XXXXXXXX  upythonhalp    XXXXXXXX  uunitofmass    XXXXXXXX  uNewyauchcity    XXXXXXX  ublamsberg    XXXXXX  uArtefact    XXXXXX  uJohnnyRockets    XXXXXX  urawriorr    XXXXX  uDoingCountyTime    XXXXX  uNCEMTP    XXXXX  utlk    XXXX  uIAmAWizardAMA    XXXX  utudirweh    XXXX  uKurtRussellTerrier    XXXX  ubertrandbio    XXXX  usaejan    XXX  uSoylentBulkPurchase    XXX  ucntrational    XX  uBankuptHandcuff    XX  uLouiecat    XX  uLozoo    XX  uhandamputation    XX  uneverending       Histogram  Comment Karma   One X  . points.   XXXXXXXXXXXXXXXXXXXXXXXXXXXXXXXXXXXXXXXXXXXXXXXXXXXXXXXXXXXX  uenglish   XXXXXXXXXXXXXXXXXXXXXXXXXXXXXXXXXXXXXXXX  uJamesHolFood   XXXXXXXXXXXXXXXXXXXXXXXXXXXXXXXXXXXXX  uMelloRed   XXXXXXXXXXXXXXXXXXXXXXXXXXXXXXXX  uChefGuru   XXXXXXXXXXXXXXXXXXXXXXXXXXXXXXXX  uryanmercer   XXXXXXXXXXXXXXXXXXXXXXXXXXXXX  umabd   XXXXXXXXXXXXXXXXXXXXXXXXXXXX  uJackalyst   XXXXXXXXXXXXXXXXXXXXXXXXX  uchrisbair   XXXXXXXXXXXXXXXXXXXXXXXX  ualficles   XXXXXXXXXXXXXXXXXXXXXXX  useanbrockest   XXXXXXXXXXXXXXXXXXXXX  uMudHimmel   XXXXXXXXXXXXXXXXXXXX  uMrPendent   XXXXXXXXXXXXXXXXXX  uclassicschmosby   XXXXXXXXXXXXXXXXXX  uMorlock   XXXXXXXXXXXXXXXXX  ukuppajava   XXXXXXXXXXXXXXXX  uPMMEYOURDADBELLY   XXXXXXXXXXXXXXXX  uSynectar   XXXXXXXXXXXXXXX  uSeaBas   XXXXXXXXXXXXXX  uSparklingLimeade   XXXXXXXXXXXXXX  uilovetofu   XXXXXXXXXXXXX  uRyJones   XXXXXXXXXXXX  uTrekkieTechie   XXXXXXXXXXXX  uthapol   XXXXXXXXXXXX  uJohnnyRockets   XXXXXXXXXXXX  uSecondVariety   XXXXXXXXXXXX  umaxuel   XXXXXXXXXXX  ubeardeddragonborn   XXXXXXXXXXX  uswilson   XXXXXXXXXX  urhill   XXXXXXXXXX  uxsvietx   XXXXXXXXXX  uDoingCountyTime   XXXXXXXXXX  ubossoftheplains   XXXXXXXXXX  unmrk   XXXXXXXXX  uBlacklaw   XXXXXXXXX  uHairyCheeks   XXXXXXXXX  umonomach   XXXXXXXXX  ushpongolian   XXXXXXXXX  uIceJava   XXXXXXXXX  ufilez   XXXXXXXXX  utreacheriesarchitect   XXXXXXXX  uAntalMarius   XXXXXXXX  uMudokon   XXXXXXXX  uNaviersStoked   XXXXXXXX  umasonjam   XXXXXXX  uaxcho   XXXXXXX  uChronoraven   XXXXXXX  uFiveDogNight   XXXXXXX  uNoDiggityNoDoubt   XXXXXXX  ubluecado   XXXXXXX  urealdreamer   ,subredditreports,cunty1o,1,t5_30uy0
5021411,0,t3_3jpmle,Most Popular Comments   |Score|Author|Post Title|Link to comment||||||||uPanKing|its either this is shopped or this is the best airline there is|link||uRonald|its either this is shopped or this is the best airline there is|link||usAstronaut|its either this is shopped or this is the best airline there is|link||utryingnottotouchmyse|its either this is shopped or this is the best airline there is|link||ucallmeWia|its either this is shopped or this is the best airline there is|link||ubutitsanalpha|Wet|link||uzcloud|Inked|link||uHustlerPornabc|Perfect hourglass figure|link||udickneedsass|Handbra|link||udhruvangrup|Bestie Dahye  more in comments|link||ufapfactor|Japanese Honey in Throes|link||ualliknowis|Perfect hourglass figure|link||uStormyDLoA|Perfect hourglass figure|link||ubobroberts|Perfect Breasts|link||uLovannie|Grabbing the sheets|link||udieterpaleo|what a beauty|link||ulecheroushump|Amateur Asian and Hungry for Cum|link||uMoralBlackHole|Japanese Honey in Throes|link||ulecheroushump|leiaways magnificent rack|link||uUpsetMisogynist|Perfect Breasts|link||uPanKing|Perfect hourglass figure|link||udidsomeonesaydonuts|Inked|link||udealin|Japanese Honey in Throes|link||uspanielrage|Japanese Honey in Throes|link||ulhim|She looks fun|link||uAWSman|Perfect Breasts|link||uPaplooTheEwok|Wet|link||ustabu|Grabbing the sheets|link||ufuransowa|Grabbing the sheets|link||uFatMansPants|The best kind of asian tits|link||uPMMEURRUBBERDUCK|Inked|link||umaniacalwombat|Inked|link||uPanKing|Perfect hourglass figure|link||uWolfjack|its either this is shopped or this is the best airline there is|link||udhruvangrup|Bestie Dahye  more in comments|link||usnowyyy|Inked|link||usensualtendency|Cant be contained|link||uPyrelord|Perfect hourglass figure|link||urounderdave|Smiling|link||uPentacat|Asian Cuteness|link,subredditreports,cur9snq,1,t5_30uy0
5029005,0,t3_3jtn51,Most Popular Comments   |Score|Author|Post Title|Link to comment||||||||uSpartyOn|Did I ruin my bacon?|link||uWakenstein|saw this on the web and HAD to make it.|link||usaxon|I present to you Future Bacon!|link||uMahigan|Bacon wrapped grilled anaheim peppers stuffed with cream cheese spuces and cilantro. Burger guac giant portobella.|link||usjvmi|Did I ruin my bacon?|link||uhamilted|Did I ruin my bacon?|link||uDEADBF|saw this on the web and HAD to make it.|link||uCherried|saw this on the web and HAD to make it.|link||uJAshkin|saw this on the web and HAD to make it.|link||umikkelhoegh|saw this on the web and HAD to make it.|link||ubradentucky|rBacon was the first thing I saw on Reddit. It has been six years.|link||uTheMellowestyellow|Cured for  days and maple smoked for . hrs.|link||uPockyBum|I present to you Future Bacon!|link||uTallGear|I present to you Future Bacon!|link||uiheartbaconsalt|Bacon wrapped grilled anaheim peppers stuffed with cream cheese spuces and cilantro. Burger guac giant portobella.|link||uchefanubis|Bacon wrapped grilled anaheim peppers stuffed with cream cheese spuces and cilantro. Burger guac giant portobella.|link||udogten|Look at this beauty|link||uPlasmaRoar|Did I ruin my bacon?|link||urootboyslim|Req for outlandishish recipe|link||userenity|Bacon Wrapped Grill Sandwich with Recipe|link||umuhaski|Bacon Wrapped Grill Sandwich with Recipe|link||uiheartbaconsalt|Bacon Wrapped Grill Sandwich with Recipe|link||uiheartbaconsalt|New phrase the bacon of X  The most excellent or most satisfying example of something. Added August  |link||ujchabotte|saw this on the web and HAD to make it.|link||uholisticholes|saw this on the web and HAD to make it.|link||uohhbacon|saw this on the web and HAD to make it.|link||ushotgunrose|saw this on the web and HAD to make it.|link||uTheMellowestyellow|rBacon was the first thing I saw on Reddit. It has been six years.|link||ustratford|Cured for  days and maple smoked for . hrs.|link||uMTweedJ|Cured for  days and maple smoked for . hrs.|link||uFrownsyndrum|I present to you Future Bacon!|link||uSDr|I present to you Future Bacon!|link||uBizzMHK|I present to you Future Bacon!|link||uBamaFan|Bacon wrapped grilled anaheim peppers stuffed with cream cheese spuces and cilantro. Burger guac giant portobella.|link||uchefanubis|Bacon wrapped grilled anaheim peppers stuffed with cream cheese spuces and cilantro. Burger guac giant portobella.|link||uBamaFan|Bacon wrapped grilled anaheim peppers stuffed with cream cheese spuces and cilantro. Burger guac giant portobella.|link||uchefanubis|Bacon wrapped grilled anaheim peppers stuffed with cream cheese spuces and cilantro. Burger guac giant portobella.|link||uBamaFan|Bacon wrapped grilled anaheim peppers stuffed with cream cheese spuces and cilantro. Burger guac giant portobella.|link||uchefanubis|Bacon wrapped grilled anaheim peppers stuffed with cream cheese spuces and cilantro. Burger guac giant portobella.|link||uBamaFan|Bacon wrapped grilled anaheim peppers stuffed with cream cheese spuces and cilantro. Burger guac giant portobella.|link,subredditreports,cus6qin,1,t5_30uy0
5045064,0,t3_3k1z1r,Most Popular Comments   |Score|Author|Post Title|Link to comment||||||||uCitizenSnipsReturned|how the falling dollar is effecting raustralia|link||uInnerCityTrendy|how the falling dollar is effecting raustralia|link||uElBarno|BUZZFEED We discover  things about fuck Tony Abbott! Post this as news for Karma!|link||uMattDobson|Serious I hurled my poo at my parents because they left an LDP brochure on the table. Now theyre kicking me out of the basement. Is this grounds to seek asylum in Norway?|link||uVelocicaptcha|Im an expert. AMA!|link||ujudasjerk|JERK CHAT LEAKS MEGATHREAD|link||uChunkeeguy|RIP whytiederp|link||uEdwardFordTheSecond|Whytiederp Shadowbanning Transparency Report|link||uWhytiederp|Whytiederp Shadowbanning Transparency Report|link||uDoggieO|Whytiederp Shadowbanning Transparency Report|link||uChunkeeguy|Serious I hurled my poo at my parents because they left an LDP brochure on the table. Now theyre kicking me out of the basement. Is this grounds to seek asylum in Norway?|link||uvmaet|how the falling dollar is effecting raustralia|link||uSeniorAutismo|Vote  on Saturday for the Model Senate  xhes our only hope!!!|link||uvmaet|tfw managing to burn through  internet points on the mothership in a few hours|link||uTheGherkinJerk|Whytiederp Shadowbanning Transparency Report|link||uSophieJ|Whytiederp Shadowbanning Transparency Report|link||umakesyoumoist|ss CJA is important. Its not just a joke subreddit.|link||uElBarno|ss CJA is important. Its not just a joke subreddit.|link||uElBarno|Attention CJA members! Tell me what song you want posted in your honour at moistland when you get shaddowbanned.|link||uvmaet|I was feeling a bit brave so....|link||uCitizenSnipsReturned|JERK CHAT LEAKS MEGATHREAD|link||uvmaet|DAE think we should take at least somewhere between  and  billion refugees this year? Its not like we dont have the room...|link||usennais|BUZZFEED We discover  things about fuck Tony Abbott! Post this as news for Karma!|link||uTheGherkinJerk|Whytiederp Shadowbanning Transparency Report|link||uTheGherkinJerk|Whytiederp Shadowbanning Transparency Report|link||uvmaet|We are on the way guys|link||uWhytiederp|ss CJA is important. Its not just a joke subreddit.|link||utermtony|Im an expert. AMA!|link||uSlimePrime|how the falling dollar is effecting raustralia|link||uLlaine|tfw managing to burn through  internet points on the mothership in a few hours|link||uChunkeeguy|BUZZFEED We discover  things about fuck Tony Abbott! Post this as news for Karma!|link||uMadGallah|Systematic corruption in Australias Parliament It was only  months ago when disgraced PM doggie resigned but now hes the Honourable Justice of the High Court|link||uElBarno|RIP whytiederp|link||umakesyoumoist|RIP whytiederp|link||uThunderCuntAU|RIP whytiederp|link||uSophieJ|Whytiederp Shadowbanning Transparency Report|link||uTheGherkinJerk|Whytiederp Shadowbanning Transparency Report|link||unoongah|Whytiederp Shadowbanning Transparency Report|link||uTheGherkinJerk|TIL the Liberal party was founded in |link||uMattDobson|ELEVEN...ELEVEN...ELEVEN...ELEVEN...ELEVEN...ELEVEN...ELEVEN...ELEVEN...ELEVEN...ELEVEN...ELEVEN...ELEVEN...ELEVEN...ELEVEN...ELEVEN...CUNTS|link,subredditreports,cuu4ecf,1,t5_30uy0
