,controversiality,parent_id,body,subreddit,id,score,subreddit_id
56682,0,t1_cekv6ny,Ya I hear ya hes also an auto mechanic so he has pretty good competency with stuff and has fixed up and tuned up my bike when I first got it,bikewrench,cekvtaj,0,t5_2sje0
88722,0,t1_ceoioa5,Seconded its  of the time a better idea to just sell current bike and buy a new bike. Youll get an idea for how frustrating all the different component size standards there are. Bottom brackets seat post amp clamp handlebars headsets cranksets Front derailleurs... ,bikewrench,ceoj33l,3,t5_2sje0
97944,0,t3_1v7yun,You could take it inside and clean it in warmer spot on newspapers or towels.I mean its  bicycle.  Should be easy!,bikewrench,cepkwye,2,t5_2sje0
99184,0,t3_1v878x,Crank Bros. Speed Lever,bikewrench,cepq0jx,2,t5_2sje0
139573,0,t3_1vo0oj,Also should chime in about north shore billet. Even nicer hangers than the wheels mfg billet ones. ,bikewrench,ceubsfv,3,t5_2sje0
170556,0,t1_cexlrhq,Just want a better fork which is air Isnt the trek   a mm fork though? ,bikewrench,cexuxt7,1,t5_2sje0
180493,0,t1_ceyrpc1,I thought a mullet was when you put a larger wheel in back than in front. The disccaliper brake set up I thought was called fucking quit it.,bikewrench,ceyzsy2,1,t5_2sje0
217300,0,t3_1wlsek,Friction shifters? Just pick up something you like the look of. I like SRAM derailleurs for friction shifters as the action is lighter due to the  cable pull ratio. Even with a  speed freewheel on shifters meant for  speed and a SRAM derailleur I still had more than enough travel on the shifter to cover the whole freewheel..,bikewrench,cf3719b,5,t5_2sje0
217420,0,t1_cf372o4,Youll have to remove the axle to see it and then youll be able to remove the freehub body and cassette along with it with a mm hex. ,bikewrench,cf37j2b,1,t5_2sje0
222302,0,t1_cf3qycg,Electrical engineering student...if I hear angular frequency or velocity one more time Im going to start drinking again.,bikewrench,cf3rkij,5,t5_2sje0
222358,0,t1_cf3qsp1,It was a full bearing kit for the frame which included  dropout bearings  BB bearings  seatstay bearings and  frame bearings.Only the dropout bears should be normal bearings and the rest should have been full compliment but every bearing on the frame were caged.,bikewrench,cf3rsrq,1,t5_2sje0
253195,0,t1_cf6zsoz,Materials and workmanship mostly. The actual mechanism might be simple but it takes a surprising amount of time to forge machine finish and assemble a high end derailleur. Especially if CF is involved.,bikewrench,cf6zxwv,8,t5_2sje0
256375,0,t1_cf6vs66,You pretty just described our NoBS rim which we developed in part for the polo market. Fixcraft in particular has been ordering a bunch of h wheels in  amp  lately. Its a pretty solid rim.The thing about wheels its not as clear cut as more spokes  stronger wheel. More spokes also means more spoke holes in the rim therefore less material in the rim and a shorter distance between spoke holes so therefore less bracing. There are good arguments either way over the strength of high spoke count wheels. My unscientific instinct is that the wheel overall may be stronger but the rim itself is weaker. In high spoke count wheels especially smaller diameter ones Ive seen failures along the inner web which Ive not really seen on any other type of rim. Anyway thats just my unscientific unsanctioned opinion.,bikewrench,cf7butw,2,t5_2sje0
273960,0,t3_1x8qw5,No worries just swap to the  bb. Remember that the drive side is reverse threaded. But if youre gonna have a shop do it... no worries. And how is a shop tryin to charge you  for a groupset swap? Not including any parts? ,bikewrench,cf95p51,1,t5_2sje0
277167,0,t1_cf9gp35,Yeah I have an old tube wrapped around the chainstay but it still seemed excessive. I would definitely prefer slap to the chattering its doing now though.,bikewrench,cf9hotv,1,t5_2sje0
312991,0,t1_cfd7e58,Theres var stuff floating around all  shops Ive worked at specifically wheel building stuff no clue where it came from but I know it can be had,bikewrench,cfd7l6y,1,t5_2sje0
330589,0,t1_cfeno3p,Bingo. I have a light bicycle hookless carbon rim and did not know the trick about the central channel. I spent quite a bit of time trying to get the tire mounted until I figured it out by trial and error absolutely impossible. All my concerns over hookless have been relieved there is no chance in hell that tire is coming off. ,bikewrench,cff1bug,3,t5_2sje0
333877,0,t1_cfetn2n,That puts you on the right track though from your initial description of the problem Id target the drailleur for cleaning not the shifter.Obviously you have enough hand strength to shift the shifter regardless of if its current condition is factoryfresh or not but the problem appears to lie in the transmission of said shift through to cable and to the drailleur.  Dragging cables andor stiff drailleur would cause this.,bikewrench,cffdkmn,1,t5_2sje0
349579,0,t1_cfgzx9i,No not a stem cap which is the part which screws into the star nut if Im not mistaken? but the seal that protected the interface between the fork and the frame from debris and the environment in general. It sat right above my bearings having a groove to stay with the bearings.  edit the bike in question is a  GT Avalanche .,bikewrench,cfh02fb,1,t5_2sje0
356451,0,t1_cfhp4kv,Assuming there is enough material left in the NDS adapter for it to not flex and creak. Im seriously tempted to find an old pre era threaded frame which worked just fine for decades and never creaked.I wonder if these neverending revisions to BBs for the sake of stiffness are really just a marketing exercise. I mean at some point the BB is gonna be stiff enough unless you can churn out  Watts. Edit typo,bikewrench,cfhpntn,1,t5_2sje0
364131,0,t1_cfihi23,Honestly with a double and speed chain crosschaining just isnt the problem it used to be.  obviously partially dependent on chainstay length.  Im a strong fan of picking my large chainring to match my T cog and my realistic spinout speed and minimizing front shifts.  IMHO one of the largest problems with the way many many bicycles ship today isnt in the cassette range but rather oversized front chainrings.  Not MTB but very few people benefit from  or even  and the stock equipment simply creates unused wasted ratios for many.,bikewrench,cfiiaef,3,t5_2sje0
370628,0,t3_1ybnbn,you mainly need custom because the prebuilt and wheelset that are available generally do not fit the parameters you need. i would go with  or  double butted spokes. rim weight should be around g. for a hub get one with a steel or titanium freehub body to prevent cassette dig in. for inexpensive shimano is good. let me know if you need a recommendation and your budget,bikewrench,cfj6iwn,1,t5_2sje0
384006,0,t3_1yhe39,just get long reach brakes,bikewrench,cfkkfr8,0,t5_2sje0
399374,0,t1_cfm2xyu,gt but thats mostly because the chain just picks up that slack in the first place.Id love to see a video but Im pretty sure I dont agree with that conclusion.,bikewrench,cfm5sp1,1,t5_2sje0
414656,0,t3_1yty19,Eh unless you have your old chain and can measure it with a chain wear tool to know if it was past  theres no good way to know. Is this the first time the chain has been replaced? If not do you know about the chains before the one that just came off?Theres one thing you can do to see if you get any skipping. Find a big hill. Put the front shifter in the small ring. Then go up the hill in each individual rear gear. If the chain skips in any of them replace cassette. If you only have a mild hill do it in the middle ring up front. Basically you want to put as much torque as possible into the drivetrain to see if the chain will ride up on any worn cogs in the rear causing the chain to skip forward.,bikewrench,cfnqtkz,1,t5_2sje0
416569,0,t1_cfngmok,I couldnt rotate my tire too easilly in the first place but Ill try building up the rim profile some more with some rim tape. I have almost an entire roll of VeloTape left and I love the stretching as of it so Ill add more layers of that. I weigh anywhere from  depending on what camelback Im wearing sometimes I do long adventure rides so I carry ML of water with me,bikewrench,cfnxyts,1,t5_2sje0
452743,0,t3_1z9md9,Cant you just get like big rubber mat or something? Maybe even get some vinyl flooring cut to size so you can roll it up whenever you need to remove it.,bikewrench,cfrq4y0,3,t5_2sje0
453101,0,t1_cfrr09t,Oh yea I totally hear you about the unsupported spindle length but my thinking was that there isnt much difference between unsupported spindle paired to a straightish crank arm and supported spindle paired to a cantilevered crank arm.  But yea FSA said no outside my curiosity as to why Id go with them.,bikewrench,cfrrlp1,1,t5_2sje0
481783,0,t3_1zlonp,You need a longer nut they are dime a dozen brand doesnt matter and the LBS should have one,bikewrench,cfv15os,0,t5_2sje0
487955,0,t1_cfvmzem,I work in the industry and think that numbers  and  are everything that is wrong with the bike industry. It exemplifies then snobbery around bikes and makes cycling more inaccessible. In my shop the work stations are on the floor and people watch staff work and ask questions and we love it. We work in the industry because we love bikes and we should be willing to share. With the advent of online shopping and the downturn in LBS revenue as a result. I suggest shops adapt to the times...or risk shutting their doors. I do admit there are problems with running your workshop in full view of customers but if everything is done above board then I cant really see a problem. EDIT OP I will send some photos tomorrow afternoon after I have gone into the shop,bikewrench,cfvqfpg,5,t5_2sje0
513250,0,t1_cfvqfpg,Theres a shop in Albuquerque the bike coop with a workspace right at the front door where they do simple stuff and a workspace towards the back where they appear to do more complex repairs. The front workspace is in no way separated from the sales floor. People get to stand there and see how to actually change a tube or adjust their shifters. Its great. It also helps that the mechanic up front is usually this ridiculous cute girl that I have an enormous crush on. This is also why I go there for parts before amazon. ,bikewrench,cfylye2,2,t5_2sje0
541514,0,t1_cg1bw0v,Ok thanks for the link. Those are the instructions I received. This is the first BB setup I have worked with. I have been just working with threaded BBs.Maybe you could tell me or provide another link what is the difference between a bb and a bbia? I am guessing spindle length? The quarq did come a preload spacer on the nondrive side.There is a SRAM Red crankset in the frame now. Would I be able to just swap the two cranks out ?,bikewrench,cg1troa,1,t5_2sje0
587936,0,t1_cg6p2a0,drip oil and solvent in the crack. just spin the freehub and you will see where the  parts rotate,bikewrench,cg73p3d,1,t5_2sje0
590181,0,t3_20v3ze,Are you running a freehub rear end with a single cog and spacers or are you running a dedicated singlespeed hub?If a freehub your options for high tooth count cogs are much broader and less expensive than a single speed hub.  Who besides White Industries makes a nonBMX T?Point Im reaching for is that if you have a freehub you can inexpensively play with ratio  if not Il consider downsizing my chainring to get into the less expensive   T options.Im basing all this off the assumption that youre capped in experiment money or else you would have already tried a  or .,bikewrench,cg7cvnw,1,t5_2sje0
590309,0,t1_cg50om1,Ok here is whats in my hubs. Rear on drive side has pits in the race cup?And The rest of the hubs look smooth Heres a look at a cone. They all look like this Seems to be a worn ring in them. Ive repacked the hubs with new bearings and grease. Adjusting the rear was a pain because I could feel the friction of the pits I assume. I got it to just where I felt no grinding but there is now a very slight iota of play in it. I plan to ride it and see how it feels unless that play is going to destroy the hub or something else. One more thing I noticed damage to the spokes from when the chain jumped off the cassette last year  but that hasnt caused an issue in riding yet so Im guessing its ok. ,bikewrench,cg7dei3,1,t5_2sje0
594478,0,t3_20wli9,Its the bicycle equivalent of Vics Vaporub. Enjoy the vision quest.,bikewrench,cg7uh07,1,t5_2sje0
597632,0,t3_20zglx,Thats the dropout not the seatstay to start. The replaceable derailleur hanger should be pretty trivial to find The bent to hell dropout might be trickier theres probably a  seatofthepants chance that itll snap if you bend it back and it looks like the hanger mounting hole is pretty screwed up too.You have a couple options Bend that sucker back and possibly break it probably weakening it. Take it to a Specialized dealer and ask them if Specialized might give you a crash replacement discount on a new framerear triangle. Might be tough if they dont keep triangles from  in stock. Have a new dropout added by a pro framebuilder probably too expensive to be worthwhile.I would recommend taking it to a Specialized dealer to be honest.,bikewrench,cg87d9k,10,t5_2sje0
610170,0,t3_210zq7,CAD amp laser cutters may not be necessary. There are some pretty nice examples of home brewed stands that wouldnt require much more than a saw and a drill.,bikewrench,cg9mnbj,2,t5_2sje0
641239,0,t1_cgcz8jh,ahhh makes sense.  thanks.,bikewrench,cgd5qyb,1,t5_2sje0
651305,0,t1_cgea7d8,I figured the answer would be something like this   Thanks though,bikewrench,cgeaxjs,1,t5_2sje0
685316,0,t1_cgi5jki,you could put some bolt on shifter bosses and use friction shifters on them. possible solution? ,bikewrench,cgi66ug,2,t5_2sje0
699073,0,t3_225iiv,My first recommendation is to get some good measurements when you have the frame for the rear hub.  Distance between dropouts should be pretty close.    steerer on the fork looks threadless.  Brake mounts on chainstay is likely a cantilever mount. They are Ubrakes. BB looks to be installed.  Square taper... should just need crank arms.I envision a slightly flashier than this retro MTB gravel cruiser build.  Pick your wacky shaped bars source up an sp drivetrain depending on that hub size of course etc.  It would be awesome as a towniegravel shredder but as CJ mentioned earlier youd have a rough hah time on any technical trails.  Good luck!,bikewrench,cgjqjrr,1,t5_2sje0
738255,0,t1_cgo6fd1,I think thats the problem... I am into cars! And remote control goodies electronics and audiovisual toys Im a consultant in this area woodworking and so on down the line... Though she doesnt complain about arduino controlled LED hula hoops.Shes just glad this is one of the hobbies that would keep me outside D  ,bikewrench,cgo6zl1,1,t5_2sje0
746578,0,t3_22pm33,Having run them on mountain bikea forever and never had a problem i dont think its an issue. Working in a shop the last ten years literally the only time it happens is when people put chain lube on the rotors and pads usually intentionally finger oil doesnt do it though many are convinced it does and neither will road grimeAs for why more power better modulation better in the wet easier to fix flats can ride an untrue rim without risking pad into tire,bikewrench,cgp54we,6,t5_2sje0
832194,0,t1_cgyq73i,And adding to that Chris King and Campy both make compatible external BBs. ,bikewrench,cgyvfk9,1,t5_2sje0
851272,0,t1_ch11360,deleted,bikewrench,ch11lqd,1,t5_2sje0
895216,0,t1_ch60rzj,Definitely a valid concern but it looks like an easy fix from the photo.,bikewrench,ch61gl2,1,t5_2sje0
896047,0,t1_ch5xh3l,Both of these tools may be helpful after the dropout is opened back up as it may have been tweaked in another direction as well. However it still needs to be pried open first. Any shop should have these and can do all this work as well ,bikewrench,ch64v8j,2,t5_2sje0
898003,0,t3_24eiu3,Could the tire possibly have been damaged while you transported the bike or tampered with while it was parked somewhere? Sounds unlikely but it seems even less likely that this happened on the road if you didnt skid.,bikewrench,ch6cw0a,2,t5_2sje0
912756,0,t1_ch7zcb0,Try wrapping in foil.,bikewrench,ch81bcf,2,t5_2sje0
914639,0,t1_ch87koz,cool. just wanted to make sure it wasnt something tiny that you were over looking. ,bikewrench,ch8913x,1,t5_2sje0
930227,0,t3_24rb77,When you say you replaced the pedal two months ago do you mean just the part your foot goes on or the entire crank arm? There should be no space at the outside of your bottom bracket spindle as youve pointed out. Is there any looseness between the crank arm and spindle? ,bikewrench,cha0rx0,1,t5_2sje0
957750,0,t1_chd4y9e,Thank you!,bikewrench,chd5l42,1,t5_2sje0
961335,0,t3_253d0f,Personally Id wait and try to find one with tapered its what the frame is designed for. Sure you can an adapter headset and the bike will still be sweet but it will never be quite as stiff or as strong as it would be with the tapered fork. The front of the bike can also end up looking a bit weird running a straight steerer as the crown of the fork is usually a fair bit smaller than the frame so the head tube overlaps the fork.Can you order from eBay? I live in NZ was in the same situation and was about to order via eBay from the States or direct from TaiwanChina a lot of good deals but just as I was about to give up and do that the perfect fork appeared on the local auction site for a very good price.That said I recently bought a Giant MTB with OD which makes tapered forks look simple to get hold of for that I ended up getting a standard tapered fork which needs a top race adpater.,bikewrench,chdk9qp,1,t5_2sje0
965685,0,t1_che21vk,If the rear tire skids making things a bit squirrelly than were not at the theoretical point discussed by Sheldon.And when the rear tire skids making things squirrelly its because the resistance to movement is now equal in all directions whereas before it favored forward.  If we brake the front at the theoretical limit discussed by Sheldon the same is true as wo weight on a still rotating rear tire there can be no preference for forward movement.,bikewrench,che22z0,3,t5_2sje0
974986,0,t1_cherdge,would this be an acceptable option at ,bikewrench,chf45hm,1,t5_2sje0
987738,0,t1_chgji5a,A double edged sword however! Im a big fan of boesheild as a cable chain lube but as with triflow be sure to get the excess off or in this case dont hose or out with boesheild. Wax based lubes can be quite a dirt attractant and cause dragstiction  if over applied.,bikewrench,chgkajw,2,t5_2sje0
989341,0,t1_chgm1y0,Good to know.,bikewrench,chgqu7x,1,t5_2sje0
992978,0,t1_chgy0cj,Heya thanks for the reply. There is actually NO space between the chain and the FD closest to the frame. The chain is rubbing into the FD quite a bit when Im at the lowlow combination. I have looked at the top screw and tinkered with it there is no L marker. It isnt adjusting it though.I took some photos if that helps.  ,bikewrench,chh5q9o,1,t5_2sje0
1028706,0,t1_chl7ond,Yes and its completely different. I doubt youll even get c tyres under those brakes.,bikewrench,chl7x2x,3,t5_2sje0
1030934,0,t1_chlgyef,True.,bikewrench,chlh0pg,1,t5_2sje0
1031220,0,t3_25wckk,Does your lbs have a qbp account? Of course they do everyone does. Qbp has handspan wheels for a very reasonable cost. They have a pavement series that I think is the best value. You should be able to find something double walled for about . They also have shimano lx touring hub laced to mavic rim for under . Ask your lbs they should be able to get you a better price quote and availability information. ,bikewrench,chli6sj,3,t5_2sje0
1041207,0,t3_260lob,Here are some pics for reference.Its got street tires on it which I prefer but Ive also just bought some tires for my cruiser that would fit as well. I thought about putting the original tires back on the cruiser and trying to sell it. Id like to keep both bikes but I wouldnt have the space.,bikewrench,chmn1dl,1,t5_2sje0
1083650,0,t1_chrgkx9,Thanks! Im hoping these ones stay put!,bikewrench,chrgovb,1,t5_2sje0
1091428,0,t3_26macn,Correct but you need to add that the cantis dont have a straight pull. The cantis are pulling up instead of across and in line with the pads. ,bikewrench,chsckd8,1,t5_2sje0
1124325,0,t3_26zut8,tire failing ,bikewrench,chw3g2v,-1,t5_2sje0
1132681,0,t3_271yid,The merlin cycles also had the  in black Ive got the   and I love it.  To me its really been build set and forget.  Only maintenance Ive done is on the chain and grease points.  It shifts beautifully nice and quiet and reliable.  ,bikewrench,chx1b7z,1,t5_2sje0
1159677,0,t3_27ehut,Is the shifter releasing cable?  If so adjust the lower limit or cable tension.  If the indexing is working right on the other two rings Id try backing out the lower limit screw  turn at a time until you get a downshift.Are you clicking the shifter and not seeing any cable slack develop between the exposed cable runs?  Lubricate your cable and housings between the shifter and first run of exposed cable.  This means that the cable is jamming in the housing and not indexing.  Chances are if its a newer bike you are dealing with a limitcable tension issue since there has not been enough time to corrode the shifter housing and cable to the point that the front derailleur spring cannot overcome cable friction.  EDIT  I thought you meant the bike wasnt downshifting into the smallest chainring on a triple.  Going to leave the top response since its good to know if you have trouble shifting the front ever.  You probably need a little more cable tension.  Get the bike in a stand and slowly crank up the barrel adjuster tension until your upshifts slow down.  I like to run my cables as tight as I can before compromising upshift quality as this makes downshifts snappier and allows for a longer service interval.  Depending on how old the shifters are the ratchet mechanism could be gunked up or there could be a crack somewhere in the shifter allowing the ratchet to not hold position under a large amount of cable tension has the bike ever been droppedwrecked on that shifter?.  ,bikewrench,ci02y8y,1,t5_2sje0
1185463,0,t3_27p2pw,So the brake is hitting the tire and locking up?  Or the brake is hitting the wheel and locking up?For reference the wheel is the metal part that is supposed to make contact with the rim brakes.  The tire is the black rubber part that rolls on the ground.  You true a wheel not a tire.  Your post is kind of confusing since you are mixing up the two.  I imagine theres either more to this story or your mechanic isnt that good at working on older bikes.,bikewrench,ci2zexw,6,t5_2sje0
1189598,0,t1_ci3ezwa,deleted,bikewrench,ci3g5q9,2,t5_2sje0
1198205,0,t1_ci3un2d,If it is a matter of a slipped cable your suggestion would maybe fix it but not properly especially on a triple. The cable tension needs to be balanced so the chain doesnt rub on the derailleur. Pulling the cable tight and calling it fixed will most likely not accomplish that,bikewrench,ci4f04w,1,t5_2sje0
1222866,0,t1_ci76ug9,Rounded file will make quick work of any obstructions. No worries doing that at all.,bikewrench,ci76vsc,3,t5_2sje0
1253634,0,t1_cian1r8,It could well be salt marks as I first noticed them appearing after cycling late winter time where we have a lot of road salt around. I have washed the bike several times since then so would salt being on the frame be an issue?,bikewrench,ciandhh,1,t5_2sje0
1255646,0,t1_ciattv8,Yess! Exactly all I wanted to know thanks a thousand times!,bikewrench,ciavin4,1,t5_2sje0
1261206,0,t1_cibfwwv,You can see by the way its slipping he is turning it the correct way. ,bikewrench,cibi1ys,7,t5_2sje0
1267056,0,t1_cic5ptu,deleted,bikewrench,cic5rnv,1,t5_2sje0
1295398,0,t1_cifcj4q,The cross thread was my first thought when I inspected it closely so I removed it inspected and reinstalled it. No cross thread... something is just bent badly.,bikewrench,cifckrl,1,t5_2sje0
1297485,0,t1_cifgdqz,yep noticed that. I plan on getting that fixed at the LBS... I hear fixing those spokes are a paaaiin. ,bikewrench,cifl13w,1,t5_2sje0
1303476,0,t1_cig5w47,Just the pedal part it self? Like that spins at the very end?  Or all the way down to the crank?  I know I sound dumb but Ive never worked on a bicycle before and want to make sure.,bikewrench,cig9a3t,1,t5_2sje0
1314724,0,t3_294daz,I rode for a while on a broken spoke I didnt know was broken. The wheel wasis fine but over the next couple months I broke two more at different times. So if you go get extras just in case. Rear wheel of a fixie. ,bikewrench,cihiuea,1,t5_2sje0
1323949,0,t3_298rkb,I had this happen on one of my old Ritchey Vantage  hole rims on my mountain bike. I carefully bent it back out with an adjustable cresent wrench and sanded the outer part smooth to get the rim brakes working properly.You may also need to true it up as well.Aside Rims can take a lot of abuse. I took a nail in my rear tire one of those ring nails and it actually went COMPLETELY THROUGH both walls to the inside. I pulled it out replaced the tube and kept going.,bikewrench,ciik7t6,1,t5_2sje0
1324807,0,t3_2997wi,Try holding tension on the cable and shifting. I dont have an official explanation but their mechanism doesnt really work properly without cable tension. ,bikewrench,ciinov1,5,t5_2sje0
1332048,0,t3_29c0ll,Check that both cables are moving freely and that they are quite slack in their bottom position. You adjust the tension by turning small barrels on each cable and lock them in place with a knurled locknut. Newer versions had black clips holding the cables to the indicator spindles the little chain that disappears into the hub. These are adjusted by holding in the little brass spring on the clip and sliding the clip back or forth.,bikewrench,cijh09e,1,t5_2sje0
