,controversiality,parent_id,body,subreddit,id,score,subreddit_id
542068,0,t3_20bg76,so cute!,r4rplus,cg1w17a,1,t5_2sngk
1456091,0,t1_ciyknnq,Hi i just saw your message so sorry for taking so long to reply. Would love to chat aswell if your still interested,r4rplus,ciysob5,1,t5_2sngk
1459584,0,t1_ciyspng,Yeah for sure!,r4rplus,ciz8fod,1,t5_2sngk
1494660,0,t3_2b9fn4,Sure! Ill warn you first. I tend to talk nonstop.,r4rplus,cj3mpib,0,t5_2sngk
1597825,0,t1_cjgf1nn,I use animewaffles which sounds ... a little dorkier than I intended. I just found it on there so Im going to have to watch it today! It looks fun.,r4rplus,cjgkpf2,1,t5_2sngk
2030535,0,t3_2gylex,Are you going to be back in town?,r4rplus,ckxxbqm,1,t5_2sngk
2256683,0,t1_clqn29k,Im not looking for something involving a casual sex relationship. I have had my fill of those. If thats what youre looking for then...sorry,r4rplus,clqnbam,2,t5_2sngk
2363889,0,t3_2mf1kh,What games do you play on ? ,r4rplus,cm3vxex,1,t5_2sngk
2870018,0,t1_cnttf05,Too far from home lol,r4rplus,cnubljv,1,t5_2sngk
3291952,0,t3_2v207i,Do you happen to still be looking?,r4rplus,cp3ic8a,1,t5_2sngk
4107987,0,t3_2yiebn,My kik is AudioGeek. Im in Spring NW Houston. Im uncertain how to post pics here in the reply but I do have them if youd like. Ive only been on reddit a few months and havent had the chance to familiarize myself with it. ,r4rplus,crojbcf,1,t5_2sngk
4751459,0,t1_cttabf1,deleted,r4rplus,cttgso8,1,t5_2sngk
5519878,0,t3_3qj25e,Im surprised no one wished you a happy birthday so I will  happy birthday to you happy birthday to you.....crap I forgot the rest of the words.  Oh well!  Hope your birthday was amazing,r4rplus,cwh7qg7,1,t5_2sngk
5903319,0,t1_cxtg7i1,hah to be honest neither one p im not into sports. pls dont kill me!,r4rplus,cxtgj7u,1,t5_2sngk
5903961,0,t1_cxtjfy0,ahaha well now im embarrassed.  isnt that old though,r4rplus,cxtjkba,1,t5_2sngk
5928555,0,t1_cxwgcz2,I like it when youre on top ,r4rplus,cxwrjip,1,t5_2sngk
6342623,0,t1_cz3hvo1,Its the fat girl subreddit dude. If he wants a girl whos comfortable being fat and being with a guy who likes fat this is a pretty good place to find her.,r4rplus,czal3pk,1,t5_2sngk
7195961,0,t3_4d3vnz,I also did not now about Ryan Adams but thank God I read your post! He is indeed very good. I would love if you could educate me further . If I may bring a great artist and singer songwriter to your attention of our time Newton Faulkner. Het is from the UK aswell and I really love his music . Give it a try is all that I ask ,r4rplus,d1w4e85,1,t5_2sngk
7744043,0,t1_d3men1v,I had a boyfriend who was a lot like that. I was friends with him at first. He didnt have much selfesteem. He thought everything was wrong with him. He didnt feel he was handsome he was shy he was afraid to even talk to most people because hed been called stupid so much. He dreamed of being loved. And eventually he got his wish. I loved him.I worked very hard to build him up to coax him out of his shell to try to help him believe in himself. I have the bad habit of trying to play cheerleaderfixer for people. And I saw this hard work pay off too. He started succeeding. He started getting downright cocky in some aspects of his life and I was super proud.But in the end he did not treat me well. He hurt me very much. The things people used to do to him he started doing to me. And it is all tame compared to the abuse Ive gone through in the past.But my trust is shot. Im apprehensive to be in a relationship with anyone. Its part of my baggage. And yet I want it very much at the same time. I dont give a damn about looks. I never have. I learned the lesson early that looks arent everything and sometimes the prettiest of people can be the nastiest.,r4rplus,d3mfweq,1,t5_2sngk
8165267,0,t3_4qe39l,deleted,r4rplus,d4y7h6y,1,t5_2sngk
9067678,0,t3_54gj8e,Pmed  ,r4rplus,d81sdum,1,t5_2sngk
9106920,0,t1_d86bo9h,You love Archer WD and with that face photo...definitely a loss for me,r4rplus,d86i7jb,1,t5_2sngk
10122573,0,t3_5kuv7g,What games you into? Would love to chat D,r4rplus,dbqz7y3,2,t5_2sngk
11512446,0,t3_63kzvr,deleted,r4rplus,dg0xrj3,1,t5_2sngk
