,controversiality,parent_id,body,subreddit,id,score,subreddit_id
932539,0,t3_24srfp,Hi book your safari in Kruger online now!,Safari,chaa8y3,1,t5_2remx
4132230,0,t3_37zycy,YouTube Center is awesome very configurable and I believe it can do what youre asking. It certainly simplifies and improves YouTube.,Safari,crraqra,1,t5_2remx
4654925,0,t1_cthb6qo,When I drag the tab to the left of the screen the tab opens up in a new Safari window. I must be doing it wrong.,Safari,cthb9l1,1,t5_2remx
6628280,0,t3_44sifr,Not sure what you mean but you can assign keyboard shortcuts such as if you type cb it will change it to CloudtoButt. SettingsgtKeyboardgtText and theres a list you can add to.,Safari,d04x69k,1,t5_2remx
6867705,0,t1_d0ujjy9,Im gonna save this comment if the issue happens again but it was resolved by restarting my modem. So it was probably DNS related.,Safari,d0urk1o,1,t5_2remx
7863502,0,t1_d3zxfzn,removed,Safari,d3zxgqh,1,t5_2remx
10162895,0,t3_5jq49x,Anyone know an answer to this?,Safari,dbw0qxu,1,t5_2remx
10287588,0,t3_5nbjc7,removed,Safari,dca5k7p,1,t5_2remx
