,controversiality,parent_id,body,subreddit,id,score,subreddit_id
6561719,0,t1_czvkeb0,Snitzs dad is locked in a basement somewhere. ,RoversMorningGlory,czy1bgc,2,t5_31h09
6562254,0,t1_czy21n2,They usually find a way.,RoversMorningGlory,czy3b6e,1,t5_31h09
6601821,0,t1_d01vhqb,My response wasnt meant to be as much defending her as it was about people giving him way too much credit. He got himself into the situation he is in and now he is doing just enough to get by. We dont need to pat him on the back for that.,RoversMorningGlory,d026l59,3,t5_31h09
6627103,0,t3_45ew31,Bring me solo and the wookie  Jeffie the Butt,RoversMorningGlory,d04sso9,1,t5_31h09
6671606,0,t1_d09b8hr,Why should he?  Everyone is an unmitigated asshole him to every single day.  I dont know of too many people who would look forward to their job I dont care whether its in the entertainment industry or not if every single day was nonstop harassment putdowns insults and prying.  Heres a newsflash no one else on the show would put up with it.  Dieter lost his mind when Charlie called him a name and ran into the fartbox in a rage and probably came close to losing his job.  Duji breaks down in tears if it gets intense or goes on too long.  Charlie and Rover get defensive and eventually end the conversation before things get too personal or heated.  Jeffrey is forced to take it for longer in a more intense form and from everyone in the studio in a way that no one else could.  Why should he give a shit about the show or the people on it besides what itthey can do for him?,RoversMorningGlory,d09egvl,7,t5_31h09
6690886,0,t1_d0bd2bu, I have been listening every day since  for the most part.  Stopped listening religiously the last few months.  The show has become blaaah lately. Rover Puts no effort into it and they havent really created anything entertaining.   I have been listening stern more its hard to go back to rover who refuses to evolve.  Keeps taking advantage of Jeffrey and they are not very honest with the audience. I.e dieter and his girlfriend. ,RoversMorningGlory,d0be9zr,1,t5_31h09
6721677,0,t1_d0ejb5o,Yeah Kevin Smith was the Hemp Knight,RoversMorningGlory,d0ekva5,1,t5_31h09
6727703,0,t1_d0exvus,At this stage in the game I think that all wouldve been kind of transparent in a bad way.  Think about if your employee did this for the sake of appearances with you.  Youd likely not have a positive impression of that kind of overt attempt to impress you.,RoversMorningGlory,d0f7br6,1,t5_31h09
6757554,0,t1_d0i853q,Is it that or is he giving a shoutout to Alan Cox? I think youre right but I have hopes its for Alan Cox,RoversMorningGlory,d0iad73,-4,t5_31h09
6780891,0,t1_d0k9ddf,The most oversold exaggerated phrase in radio history.,RoversMorningGlory,d0kwcxo,3,t5_31h09
6791245,0,t1_d0m2kq5,I agree. He may be reading the paragraphs and I understand why Rover doesnt want that specifically but if you stop Carmen and ask him more details about the story that arent in the paragraph he knows them. And thats the difference between Duji and Carmen.,RoversMorningGlory,d0m2r98,6,t5_31h09
6808182,0,t3_48je8v,I found it accidently back in like  on Iheart while at work. I listened and then left for awhile. I got back into it about three years ago but recently stopped listening. The show was starting to get stale and really wasnt keeping my attention minus the Jeffrey bits. I really was hoping that the chaos about renewing contracts wasnt a sham so the show could get a shakeup. I wont stop listening completely but I wont listen every day. I havent listened since they came back from break and I dont feel that bad. ,RoversMorningGlory,d0o059r,1,t5_31h09
6812318,0,t1_d0o6vak,gotemLook at how badly I shut his bitch ass down in the back and forth.... Rubbed my dick while doing it,RoversMorningGlory,d0oh1ua,1,t5_31h09
6855599,0,t1_d0tdz7d,How u know the police where called?,RoversMorningGlory,d0te2dh,-1,t5_31h09
6867023,0,t3_49t0cd,I would let someone stab me with an AIDS needle for  mil. Deters questions are hilariously bad.,RoversMorningGlory,d0uoric,4,t5_31h09
6904516,0,t3_4ab2vv,Maybe hes just really doesnt like robots that are sent to Mars.,RoversMorningGlory,d0yy2p9,5,t5_31h09
6909572,0,t1_d0ziih7,I thought Brotha ADX was going to go on a huge rant when Building  was brought up but he really didnt go that crazy,RoversMorningGlory,d0ziqhi,1,t5_31h09
6921957,0,t3_4ajqnr,it was something about his uncle or grandpa that was in the military and that is what pilots would yell if they were having plane troubles,RoversMorningGlory,d10xero,2,t5_31h09
6930000,0,t3_4an9as,deleted,RoversMorningGlory,d11u9xb,1,t5_31h09
6936669,0,t3_4am5ni,ask JLR hell give you an incorrect date but it should be within a few days of the actual show,RoversMorningGlory,d12lk9t,3,t5_31h09
6953203,0,t1_d14g9pd,fuck off with this,RoversMorningGlory,d14h7lv,2,t5_31h09
6973861,0,t3_4b7md4,You make heads way too small,RoversMorningGlory,d16toyz,1,t5_31h09
7023956,0,t1_d1ci5mh,Plus posts about the history of WMMS are probably more likely to show up on rCleveland than a sub with a picture of Cory Maria and Poundcake at the top of the page. ,RoversMorningGlory,d1cin0i,1,t5_31h09
7071098,0,t1_d1hjkx4,If I was JLRNadz or Charlie and I fubared something on the show and Rover gave me a so called punishment like the one on Friday I wouldnt do it anymore. It has to be the same for the whole show. If Duji doesnt get punished then no one else does either. We all know Duji is holding something over Rovers bald ass head. Or else the bitch would of or should of been gone a long time ago. ,RoversMorningGlory,d1hvenp,3,t5_31h09
7081383,1,t3_4ck9yy,Ohhh boyyy here we go with cuckboy rover. ,RoversMorningGlory,d1j1g0l,-2,t5_31h09
7084562,0,t1_d1jc8o2,Isnt it Charlie who is responsible for putting up the podcasts?  The guy has a lot of responsibilities it seems.  Would be a nice job for Hadz to pick up or for Dieter... but I guess Dieter has a full slate cutting up the  minute replay to start the day.,RoversMorningGlory,d1jegtq,1,t5_31h09
7104720,0,t3_4cv370,Aww come on Nadz! At least give dieter a little bit of a challenge!,RoversMorningGlory,d1loyi8,5,t5_31h09
7157683,0,t1_d1rraa5, Additional mirror. TopLaugh.tpl   Sending an email you should too.,RoversMorningGlory,d1rrc48,3,t5_31h09
7295553,0,t3_4fajn9,Are people really surprised hes a Hilary supporter? Hes openly bashed Trump and Bernie quite a bit.,RoversMorningGlory,d27gdt7,3,t5_31h09
7323543,0,t1_d2alqb8,Rover said that the main reason JLR couldnt sit in studio is because of the cameras and viewing angles. He made a deal that if JLR would give Rover  for a new camera then he could sit in studio from now on. He also had to agree to lie less and not be a sourpuss. I think its great because the more JLR the better.,RoversMorningGlory,d2amxck,1,t5_31h09
7332110,0,t1_d29caym,Honestly that would be their bet.  Would probably make JLR a little more happier around the place if he had his own little podcast. Probably better content than the regular show too.,RoversMorningGlory,d2blzu6,1,t5_31h09
7356043,0,t3_4g3p75,Where the hell is he doing this a high school?,RoversMorningGlory,d2ebydj,2,t5_31h09
7410808,0,t1_d2kk26p,I have heard about the begging before and I agree to some extent sisters car. But a ford excursion is hardly living outside her means.,RoversMorningGlory,d2kk6ef,-4,t5_31h09
7411155,0,t1_d2klfkq,Yeah.,RoversMorningGlory,d2kllew,-4,t5_31h09
7485036,0,t1_d2swb9z,Thanks,RoversMorningGlory,d2t0a2x,1,t5_31h09
7487656,0,t1_d2st5hf,Its disgusting that he uses his radio show to pump his personal political beliefs.but Im not surprised hes been on the Clinton bandwagon for wayyyy too long. So anything he says about them is subject to scrutiny.Hes a fanboy if Ive ever seen one.Clevescene   Rover unleashed  when Hillary Clinton was in town to promote her autobiography Rover sent picketers with signs reading Cheat on Bill With Rover.,RoversMorningGlory,d2tb14q,1,t5_31h09
7491124,0,t3_4hzemw,Who is todays guest and what the heck did he do? After  mins of listening its still a mystery,RoversMorningGlory,d2tp7tl,0,t5_31h09
7560061,0,t1_d319au6,I have to admit I agree. The spinning around in a circle and the arms over his head were a little much. Hang in there Nadz.,RoversMorningGlory,d31jjdc,0,t5_31h09
7567101,0,t1_d32bhrv,So your saying theres a chance!?,RoversMorningGlory,d32ccm1,1,t5_31h09
7570416,0,t3_4j050s,Scott Taylor is too professional for RMG. I feel bad for the guy. Hes killing his job and he has to work for that stupid cunt whore bitch Duji. The guy can work circles around Duji and yet he has to listen to her. SMFH.,RoversMorningGlory,d32pwr5,14,t5_31h09
7570849,0,t3_4j050s,I am loving this Scott Taylor Snitz feud that is going on right now on the aftermath. This is hilarious. Scott is really pushing snitzers buttons right now. ,RoversMorningGlory,d32roif,5,t5_31h09
7583255,0,t1_d341w6v,Duh. that was never in question...,RoversMorningGlory,d346gia,1,t5_31h09
7624860,0,t1_d38efq9,Thats why they tried to make the wtam guy look so bad when they had him read the news,RoversMorningGlory,d38wmcd,4,t5_31h09
7630111,0,t1_d38y2eh,But... but... but I do just love rockstars....   O.o,RoversMorningGlory,d39i3ot,2,t5_31h09
7638770,0,t1_d3a2nsn,Yes people do but obviously there are cops and undercovers there too. So just dont be a moron. ,RoversMorningGlory,d3ahhk6,2,t5_31h09
7641037,0,t1_d3a9y89,I like the band searches. Everything else sucks.,RoversMorningGlory,d3aqs10,3,t5_31h09
7655363,0,t1_d3cb7rv,oh shit,RoversMorningGlory,d3cdeo2,3,t5_31h09
7714640,0,t3_4kywzl,Rover is being such a crotch bitching about how to mix EmergenC.,RoversMorningGlory,d3j3o7v,5,t5_31h09
7715677,0,t1_d3j7spt,Now that is some forward thinking! ,RoversMorningGlory,d3j7x2p,1,t5_31h09
7791323,0,t1_d3rspsp,Brake lines?,RoversMorningGlory,d3rsvkp,1,t5_31h09
7859677,0,t3_4mybeg,i could listen to duji talk about the differences between lutherans and catholics all day. holy shit. ,RoversMorningGlory,d3zhyky,2,t5_31h09
7873399,0,t1_d4118j1,Its actually a reddit rule not ours. Its considered Doxxing.we really dont care what you post here as long as it follows our guidelines on the sidebar and reddit rules.,RoversMorningGlory,d411jka,3,t5_31h09
7885904,0,t1_d426cb7,Lmao!,RoversMorningGlory,d42g5mn,1,t5_31h09
7897203,0,t3_4nfmdu,Im really disappointed in the job STFMTaylor did with the punishment. He should have been babysitting them closely not letting them on their phones starting a really loud Warriors chant  really bringing a bunch of negative attention to them. He really dropped the ball out of his own selfishness!,RoversMorningGlory,d43pwck,3,t5_31h09
7933851,0,t3_4nx95w,well then fuck off you whiny faggot. the sub has grown continuously so suck it.,RoversMorningGlory,d47u8fg,1,t5_31h09
7941630,0,t1_d48p7ko,From a tyrannical government with nukes,RoversMorningGlory,d48posj,1,t5_31h09
7971488,0,t1_d4c1adg,And were talking about the guy that puts makeup on his face to make sure he looks okay for RMGTV. I dont think hes going to want to be screenshotted shirtless AND covered in piss.,RoversMorningGlory,d4c2jur,2,t5_31h09
8037286,0,t1_d4jg9e6,I dont see how he let Rover down. If anything Rover let HIM down.,RoversMorningGlory,d4jgsiy,2,t5_31h09
8047634,0,t3_4pfzlp,The JLR one is not a theoretical....all fact.,RoversMorningGlory,d4kmoiw,3,t5_31h09
8049066,0,t1_d4ksbeg,Not really. Just that he went to jail.,RoversMorningGlory,d4ksgw6,1,t5_31h09
8049347,0,t1_d4krgvw,Hanging with his long time girlfriend...,RoversMorningGlory,d4ktlrv,3,t5_31h09
8095162,0,t1_d4pydoy,Good point  now that I think about it he wouldnt have actually purchased it unless his contract was done.,RoversMorningGlory,d4pywe7,2,t5_31h09
8105707,0,t3_4q8ol5,Rover sounded  years old when he was talking about Justin Timberlake using tho...  Charlie and Nadz were trying to explain it to him and he wouldnt even listen to them.  Grumpy Old Man level unlocked!,RoversMorningGlory,d4r5k0d,11,t5_31h09
8130095,0,t1_d4tuppt,Ha Snitzer def not putting the weight up on this one. ,RoversMorningGlory,d4tw99i,2,t5_31h09
8134425,0,t1_d4udcq0,I think youve missed the point of this thread lol.,RoversMorningGlory,d4udsox,5,t5_31h09
8145597,0,t1_d4vmzv7,Nice Butt Buddies of RMG Reddit.,RoversMorningGlory,d4vqv96,2,t5_31h09
8190707,0,t1_d517mv7,he might be there but get off your skidmarked ass JLR.... he really is a fenceman that does parttime radio now,RoversMorningGlory,d51e1mi,7,t5_31h09
8243500,0,t3_4sa6nx,I cant take Rover serious when he talks about politics.,RoversMorningGlory,d57zrb7,3,t5_31h09
8256904,0,t1_d58trnt,Valid point. ,RoversMorningGlory,d59o4g6,1,t5_31h09
8285119,0,t1_d5c6muj,Have you heard him call in on the first of the month? Sounds like a  year old to me. ,RoversMorningGlory,d5d75u1,1,t5_31h09
8286547,0,t1_d5d9mm3,did she really?,RoversMorningGlory,d5ddl3x,2,t5_31h09
8315974,0,t1_d5gxs1p,IF he had to do that cut audio when an unsigned band played then that would be too much work. If they all sign the waiver then he streams it. Its simple. Theres not an ulterior motive when hes done it in previous years and every year leading up to it he says hes not sure about streaming because hes waiting for waivers.,RoversMorningGlory,d5h1xap,2,t5_31h09
8335783,0,t3_4tn3a2,The only thing worse than politics on the show is politics on here. Cant wait for the election cycle to be over ffs.,RoversMorningGlory,d5jj00q,6,t5_31h09
8365337,0,t3_4u6dm3,The fact that people email the show and come on here EVERY day and have for  years saying how much they hate Duji proves she is indeed not useless.  ,RoversMorningGlory,d5n7vme,4,t5_31h09
8386107,0,t1_d5pt1hu,Why would this get downvoted? ,RoversMorningGlory,d5pt7wv,1,t5_31h09
8425874,0,t1_d5urvpj,Wasnt that the intern girl?  Did she win boobs too?,RoversMorningGlory,d5urxqr,2,t5_31h09
8436525,0,t1_d5w3bix,Thank you very much!,RoversMorningGlory,d5w3snp,2,t5_31h09
8437430,0,t1_d5vyupu,Doubt they bring in that much advertising money. Most goes to Rover and thus why he makes a bunch off this thing and doesnt barely break even like he wants people to think. You will find out tomorrow who is really about the fans. Rover will pop into the autograph tent for a few and the rest of the crew will hang with the fans. Thus why I enjoy Nadz JLR Charlie and Snitz....they understand the fans provide them a job. RoverDuji just sees the fans as ,RoversMorningGlory,d5w7v74,1,t5_31h09
8448783,0,t1_d5xmrrz,Im sure they do but only people in the first three rows can tell.  Not the most well thought out of things.,RoversMorningGlory,d5xmv43,1,t5_31h09
8449330,0,t3_4vd4ye,Are those people getting kicked out for crowd surfing?,RoversMorningGlory,d5xpbjn,1,t5_31h09
8454897,0,t3_4vh5h7,He didnt see any nudity?  Is he blind?,RoversMorningGlory,d5yebbi,3,t5_31h09
8583038,0,t1_d6eg7we,why are you such a Dick?,RoversMorningGlory,d6egrtp,0,t5_31h09
8648313,0,t3_4ybg3b,You dont take your girlfriend to dinner with your family and not say I love you. Says the guy who allegedly got engaged without ever saying I love you,RoversMorningGlory,d6mng4v,12,t5_31h09
8661797,0,t1_d6o9fqg,Yep. I noticed that Dudes on Dudes was also taken down. Those had been up for a while as far as I know.,RoversMorningGlory,d6ocbq4,1,t5_31h09
8712964,0,t1_d6uqj3s,I dont have something from a source like dogs.com or something but yes I could show quotes from dog behavior specialists. I suppose they would be considered to be experts would that be sufficient as an source? I dont mean that to come off condescending some people find certain sources more acceptable then others and I dont want to waste your time or mine finding them if you dont find it to be a reputable source.,RoversMorningGlory,d6ura0j,2,t5_31h09
8823039,0,t1_d76p88r,I didnt hear this what happened,RoversMorningGlory,d78eotv,2,t5_31h09
8859008,0,t1_d7cpfwx,removed,RoversMorningGlory,d7cq7b4,1,t5_31h09
8863193,0,t1_d7d74gl,no prob,RoversMorningGlory,d7d8byn,1,t5_31h09
8939026,0,t1_d7ma1ra,I dont know how up to date this is but hereits a playlist with all of the rejoin songs,RoversMorningGlory,d7mc7kb,2,t5_31h09
8964727,0,t1_d7obtdj,Hes on the radio and like B she wanted to date someone from the show. It didnt matter who just someone from the show. Look at Dumb Charlie and Rover all have women way out of their league thanks to the show. JLR even gets decent women for him approaching him and making out with him because of the show. ,RoversMorningGlory,d7pfbh4,0,t5_31h09
8965206,0,t1_d7phadd,She came on the show Monday I think when they were talking about JLR asking her to go bang on the elevator,RoversMorningGlory,d7phdzb,1,t5_31h09
8977486,0,t3_5345os,The plasti slabs rap was awful,RoversMorningGlory,d7qyh9z,-2,t5_31h09
9002406,0,t1_d7twumq,lol Im so sorry. I glanced over the post for typos but I guess the title looked good enough that I didnt catch the Ballard. I feel like such an asshole.,RoversMorningGlory,d7ty710,2,t5_31h09
9020176,0,t1_d7vxpd2,Then Im a weakminded person. Im  years clean now. I went through a time in my life where I just didnt care any more and experimented with everything. Found something that I liked too much ruined my life and cleaned myself up. Im not saying we should fund recovery for addicts but Im just saying Rover has no idea what hes talking about when it comes to drugs or addiction.,RoversMorningGlory,d7w311j,6,t5_31h09
9042444,0,t3_543zzq,Favorite call ever right now. Little Douche Bag sidekick,RoversMorningGlory,d7yr9ps,3,t5_31h09
9153390,0,t1_d8c8kol,Trump is just as corrupt as everyone in the current government Hillary included.,RoversMorningGlory,d8c9b4a,8,t5_31h09
9180907,0,t3_55yr0l,Whoever uploads the podcasts needs to get their shit together.,RoversMorningGlory,d8fqwx6,3,t5_31h09
9185790,0,t1_d8gc7mg,removed,RoversMorningGlory,d8gd6n3,1,t5_31h09
9188862,0,t1_d8gijk6,Lame as Fuck like usual. The show keeps going downhill. Whats their excuse now? Its not Roverfest time.,RoversMorningGlory,d8gr7pi,4,t5_31h09
9260578,0,t1_d8pqbu4,Yeah I know but it was sort of like a bit after. Its just a funny quote anyway P,RoversMorningGlory,d8pufsm,2,t5_31h09
9278357,0,t1_d8rrsty,Dont forget sleeping and pooping patterns.,RoversMorningGlory,d8s3k6m,3,t5_31h09
9383537,0,t3_593qjr,So now Im a communistshittwinkletoed cocksucker?? Wait till I stop by his house and bang his wife lol,RoversMorningGlory,d95fgp8,5,t5_31h09
9390410,0,t1_d965ibo,See it really does.  Because Im sitting here poking a ton of holes in your little theory here and when I ask you how you know that a sexual relationship ensued between a mentally disabled brother and sister and then CPS LETS THEM LIVE TOGETHER AGAIN WITH TWO PARENTS WHO ARE ALSO MENTALLY DISABLED yeah it matters.,RoversMorningGlory,d96auoy,1,t5_31h09
9396158,0,t1_d970xj3,My husband and I were texting back and forth. A good  minutes before the guy called in we said Lakewood Park under a bench. Wish we lived in the area! Haha.Edit Cliff Lee was not what he was referencing it fit though! ,RoversMorningGlory,d97120g,1,t5_31h09
9424637,0,t1_d9amo9u,Hook up,RoversMorningGlory,d9amysu,2,t5_31h09
9473532,0,t3_5ai99e,I hope they just leave this guy in the back to do his job. ,RoversMorningGlory,d9gtfqm,3,t5_31h09
9513142,0,t1_d9lmehh,Mmm Grizzlebees,RoversMorningGlory,d9lp44x,2,t5_31h09
9540182,0,t1_d9m88iv,This worked. Her boobs look too big for her. Theyre nice but you can see the fakeboob ripples ,RoversMorningGlory,d9p0xuu,2,t5_31h09
9570401,0,t1_d9sqmh0,Theyre extra salty today lol,RoversMorningGlory,d9sqwhp,3,t5_31h09
9571395,0,t3_5c08wf,Ted Nugent is great this is entertaining. ,RoversMorningGlory,d9svbe2,2,t5_31h09
9627802,0,t3_5cn4k6,shes still lookin pretty good,RoversMorningGlory,d9ztowr,2,t5_31h09
9808597,0,t3_5foubh,I remember when Ronald Reagan was elected....when I was ,RoversMorningGlory,dam4bkk,10,t5_31h09
9808632,0,t3_5foubh,I think I have been listening for too long. I cant take these guests anymore. Ive heard them all so many times ,RoversMorningGlory,dam4h5r,11,t5_31h09
9809455,0,t1_dam0smc,How do you know he doesnt work?,RoversMorningGlory,dam84mv,2,t5_31h09
9848929,0,t1_dapq9c3,Ok whatever you say Rover,RoversMorningGlory,darc6rj,6,t5_31h09
9882003,0,t1_davizda,. Mobile gt.gt. That doesnt show anything just a link to the shows website. Theres nothing on there that would hint to why is offEDIT you fixed it you hero you,RoversMorningGlory,davncwe,1,t5_31h09
9965922,0,t1_db4avkg,Without a doubt.The guy put a GoFundMe together with  knowledge of the situation so he could be the first to do it.  He didnt know if Rob had insurance medicare COBRA anything... but Rover wanted to be the first.  Then Rover had the bawls to get pissed at Rob for saying he was going to use it to pay off his debt or start a college fund for Ben.I would agree its a dick move for Rob to not use it on health costs but if the health costs are paid for then what is he supposed to do?  Its a GoFundMe.,RoversMorningGlory,db6l3fn,1,t5_31h09
10047261,0,t3_5jj5pv,It bothers me that people call Rover a Howard Stern ripoff in such a negative manner.  Is he a ripoff because hes a shock jock in radio?  Thats like saying Barry Bonds is a ripoff of Hank Aaron because they both were home run hitters in baseball.  Even if that were the case why is it such a bad thing?  Im not saying Rover is super original or anything but you cant tell me Howard Stern was the first person to ever want to swear on radio or put naked chicks in the studio or talk about farts and penises.  Do you truly think you or me wouldnt have come up with a penis measuring contest if we had our own radio shows?  Is Howard Stern SO creative or was he just the first famous radio personality to do things that everyone else including Rover would have come up with on their own?  All Im saying is theres no need to hate on Rover for being a shock jock because if youre so sickened about him being a Howard ripoff then theres this little knob on your radio you can turn that just instantly shuts Rover up and you can go on about your day instead of feeling the need to come on an online forum to call Rover a copycat.,RoversMorningGlory,dbh6mrj,2,t5_31h09
10221516,0,t1_dc29rod,Terrible Sean Connery movie? Blasphemy!,RoversMorningGlory,dc2nzet,1,t5_31h09
10223096,0,t3_5mct8d,They keep saying Dieters secret wife. We all know theyre not married. But by saying wife they can deny everything.Also does anyone else think Duji looks like she had some work done over the break? It looks like she got some botox.,RoversMorningGlory,dc2uff6,15,t5_31h09
10225451,0,t1_dc2vu3f,let me watch that in slow motion rover after every fucking video,RoversMorningGlory,dc341nx,4,t5_31h09
10304179,0,t1_dcbzfxy,fuck trump so hard but yeah CNN is absolute shit. this is like the third time they just started wildfires for no reason and the second in recent memory where they didnt even fact check their own sources. remember when they had to apologize for airing porn for ten minutes? that literally never happened. it was some twitter user and then other shitty new sites ran with it and CNN apologized without even going yo dude that never happened. ,RoversMorningGlory,dcc18h9,0,t5_31h09
10318149,0,t1_dcdjrff,Six JOs in  hours is very doable. Especially while drunk which youre no doubt going to be. ,RoversMorningGlory,dcdm9hq,1,t5_31h09
10318906,0,t1_dcdn15v,To be honest Ive assumed the same thin he turns  in like a month or two believe it or not. Shes been asking that kid if he wants to kiss so lets not pretend that those hormones arent there. Plus Jeffreys admitted he doesnt talk to them about sex Ed so you know they wouldnt use protection or anything,RoversMorningGlory,dcdpd7c,5,t5_31h09
10322787,0,t1_dcdwwa4,Id like to be CCed on this.,RoversMorningGlory,dce57yy,4,t5_31h09
10411972,0,t3_5p33ic,This show is the best antidrug campaign Ive ever heard. Replace D.A.R.E. in schools and just listen to this episode. ,RoversMorningGlory,dco9jdt,6,t5_31h09
10467365,0,t1_dcuk0j9,Its called Duji and Nannh babying her to no end. ,RoversMorningGlory,dcukzho,4,t5_31h09
10469595,1,t1_dcuqtnf,You couldnt pay me to listen to that show. ,RoversMorningGlory,dcuu3mc,1,t5_31h09
10560837,0,t1_dd5615k,I dont want to get into a big tax argument but the top  pay very little in taxes. If you have that much money a lot of your income is coming from capital gains etc not taxed very much. Its the upper middle class about  to mil per year should most of the tax burden.,RoversMorningGlory,dd56us7,2,t5_31h09
10561943,0,t1_dd5b025,Haha. Love it. My husband recently lost a bunch of weight and hes been wearing some clothes we found from when we were in highschool so hes been rocking some Aero shirts and pajama pants lately. ,RoversMorningGlory,dd5bdcx,3,t5_31h09
10567928,0,t3_5ral4g,Someone needs to call tomorrow and ask. Straight bullshit. Maybe the client shouldnt have dicked over an autistic guy. I refuse to believe that they didnt see Jeffrey and lick their fucking lips at the sight of a sucker they could fuck over. ,RoversMorningGlory,dd5zste,10,t5_31h09
10572238,0,t1_dd6bdxe,Same! I havent missed an episode in years this is bullshit. ,RoversMorningGlory,dd6fz9r,3,t5_31h09
10578480,1,t1_dd6pw7s,Liberals know how to spell rogue though. So they have that going for them...,RoversMorningGlory,dd736cw,0,t5_31h09
10591489,0,t1_dd8e4jn,People probably dont even know what were talking about. Im now going to continue talking about it.,RoversMorningGlory,dd8fi4m,8,t5_31h09
10593806,0,t1_dd8ekw0,Theres a difference between guys like Hoppe who are thirsty themselves and like to go out compared someone like Shane who is in codependent relationships and doesnt leave the house.,RoversMorningGlory,dd8o3o2,4,t5_31h09
10608325,0,t3_5rt3pw,Dieter telling a different version of that slapping story ,RoversMorningGlory,dda61b2,4,t5_31h09
