,controversiality,parent_id,body,subreddit,id,score,subreddit_id
8054,0,t1_cefcls7,Good luck with it all. ,incest,cefcq4y,1,t5_2qx19
8513,0,t3_1u7w85,When you are alone with her hold up a Viagra between your thumb and index finger and say So... any plans for tonight?Shell get it.,incest,cefeljp,0,t5_2qx19
13575,0,t1_cefhbb8,I completely agree.  You need to get your wife involved now!  She is going to be able to help you fend her off.  Even though you feel an attraction to your niece she is young and you need to make the adult decision!,incest,cefza5w,2,t5_2qx19
14680,0,t1_ceft37l,Nothing! What happens in Vegas stays in... s    Edit guessinghoping it continues. Im vicarious but not bicurious.,incest,ceg3t7o,3,t5_2qx19
19269,0,t1_cegmhal,i totally agree  anyway it was just a first time that i feel that way and i thought i share it with the pros here  thanks all for the comments!,incest,cegmkt6,0,t5_2qx19
22598,0,t3_1udolz,Next time you Skype with her ask her to try on some lingerie so you can make an educated decision lol,incest,ceh08cu,4,t5_2qx19
25530,0,t1_ceh3hhe,Could be the whole keep your friends close and your enemies closer idea,incest,cehc7yr,1,t5_2qx19
26040,0,t1_ceh14mo,Thank you  as well. My thoughts exactly.. ,incest,ceheb2a,2,t5_2qx19
27167,0,t1_cehgoew,I think it may be just general modesty but that certainly may be possible too I guess.,incest,cehix64,3,t5_2qx19
32046,0,t1_ceeg95j,I actually wrote a few posts here about it. First one can be found here ,incest,cei2w5z,1,t5_2qx19
32430,0,t3_1uchv3,Mod from the catroom here. Sorry to tell you folks it was fake. It was just the same user as some months ago...,incest,cei4goz,2,t5_2qx19
32761,0,t1_cei182h,thank you!,incest,cei5tgm,1,t5_2qx19
37041,0,t1_cegfq43,Because this is the most relevant subreddit I could post in.,incest,ceincvt,1,t5_2qx19
52335,0,t3_1uo5cy,Nice story but I would believe it more if reality made you define your cock in real inches  Im not saying I have the biggest dick in the world but I am a good nine inches long...Yea wish we all were...and all women have DDs.  Sorry but ....,incest,ceke00d,7,t5_2qx19
70935,0,t1_cemhy27,No ones  straight or  gay. All men and women have homosexual thoughts at some point in their lives. I had some for this guy that I went to school with. It went along the lines in my mind of Hey his name is just a good looking guy. Some just repress that shit because for males the worst thing that you could be is gay.Well maybe a gay pedophile but thats off topic.,incest,cemi6sb,2,t5_2qx19
74488,0,t1_cel7a9t,Did you finish your session after your sister left?,incest,cemwrd4,4,t5_2qx19
76353,0,t3_1uxs5q,Great job!,incest,cen4don,6,t5_2qx19
80997,0,t1_cenmcpj,Guess that made me the lucky minority then. ,incest,cennffi,2,t5_2qx19
83761,0,t3_1v09nc,Yeah thanks but all of them are step son and step daughter scenarios. Sorry but thats not even incest. Its like me hooking up with my dads or brothers girlfriend..not even close to incest.Instant boner killer. ,incest,cenyqvy,5,t5_2qx19
86841,0,t1_ceob9fr,Remind me to make you cookies sometime.,incest,ceobdsm,2,t5_2qx19
98489,0,t1_cepn3lr,deleted,incest,cepn5hn,1,t5_2qx19
105669,0,t3_1va4cl,gt  ONLY.,incest,ceqgmp3,3,t5_2qx19
112671,0,t3_1vdw5e,Your post has been automatically removed because it appears youre looking for roleplay. You may want to visit rIncestPersonals and rIncestRoleplay.I am a botrAutoModeratorcommentsqpuwhatisautomoderator and this action was performed automatically. Please contact the moderators of this subredditmessagecompose?toFrFincest if you have any questions or concerns.,incest,cer9dg0,1,t5_2qx19
117536,0,t1_cer5v9q,I think OP is going to have to quote questions that werent addressed in the sub in order for his comment to be taken seriously.Edit Grammar,incest,certd04,1,t5_2qx19
125922,0,t1_cesp7mq,this is prob fake just throwing it out there like the story though,incest,cesrra4,8,t5_2qx19
129552,0,t1_cet6cec,Younger sister?! Well buddy now we are getting somewhere. Maybe since your older sister is obviously DTF you could have sex with her and then the two of you could work on adding the younger sister in a threesome. Or not I guess Im just a dreamer.,incest,cet6nqs,29,t5_2qx19
133246,0,t1_cetl4n9,Oh yes,incest,cetlu8t,13,t5_2qx19
138969,0,t1_cetmxrf,Thanks for saying so. I cant wait until she reads all thee comments. ,incest,ceu9bcc,4,t5_2qx19
143861,0,t1_ceuor16,Technically crazy slid herself over dick,incest,ceuteqm,5,t5_2qx19
187202,0,t1_cezr8c4,It all started when I messaged her on facebook and flat out told her I was attracted to her she said she already knew and she was too. We sexted back and forth sent videos and pics met up and fucked. That was about two weeks ago now she is coming up again this weekend. Weve had phone sex nearly every day since then. Were both bisexual and both selfdiagnosed sex addicts.,incest,cezrew4,4,t5_2qx19
187417,0,t3_1w83lc,Came here looking for fap material. instead found teary eyes good on you mate.you lucky bastard,incest,cezsao8,2,t5_2qx19
189209,0,t1_ceybjax,deleted,incest,cezzo6g,1,t5_2qx19
193182,0,t1_cf0a5rh,No it doesnt surprise me it was shared all over the place including Facebook.I was just confused by you saying it was on  facebook I realize now that you meant you saw it posted by a friend. Sorry for the confusion. ,incest,cf0fzke,1,t5_2qx19
203104,0,t1_cf1kfrm,deleted,incest,cf1ks6i,1,t5_2qx19
208433,0,t1_cf26drf,Thats the plan ,incest,cf26mov,1,t5_2qx19
221626,0,t1_cf3n8wk,gtOwing to the general lack of ability to verify content all stories should be assumed to be fictional unless proven otherwise.Just enjoy the story for what it is.,incest,cf3ossv,17,t5_2qx19
221675,0,t1_cf30680, Seriously.  Im more interested in what happens between throwawayDF and her daddy than I am in the game OR the commercials.,incest,cf3p013,5,t5_2qx19
233802,0,t1_cf4zd6r,deleted,incest,cf4zeiv,1,t5_2qx19
233850,0,t1_cf4zkdv,deleted,incest,cf4zl09,1,t5_2qx19
235213,0,t3_1ws9vg,yOU SHOULD BE ABLE TO CUSTOMIZE YOUR CHARACTER!!!!,incest,cf54o8i,1,t5_2qx19
250312,0,t1_cf6lwib,I can confirm this will work. It worked on me.,incest,cf6p6hm,5,t5_2qx19
253739,0,t3_1x09d7,ltYou know I love this.,incest,cf71z3p,4,t5_2qx19
257243,0,t1_cf09g71,Dude thats freaky mine has been doing the same.,incest,cf7f3ut,2,t5_2qx19
259527,0,t3_1x2boc,I think incest fantasies exist regardless of whether or not the members of your family are attractiveHowever the desire to make those fantasies into reality could be stronger if they are also very very attractive.,incest,cf7nqb1,4,t5_2qx19
292235,0,t1_cf9kovx,deleted,incest,cfb1zeg,2,t5_2qx19
297429,0,t1_cfb84tm,Actually he does care. He encourages me to pursue my father. Even helps me get ready.Edit You are correct. Anyone else and hed be furious.,incest,cfbleqc,1,t5_2qx19
300944,0,t3_1x47qi,That is totally weird and would freak me out too. I suggest calling her doctor who prescribed her the meds and telling himher about her behavior. ,incest,cfbyix5,1,t5_2qx19
301702,0,t3_1xj8uf,Have you put it in her ass? ,incest,cfc1cw8,19,t5_2qx19
323299,0,t3_1xs6a2,deleted,incest,cfea3yz,3,t5_2qx19
335410,0,t3_1xxah9,How old are you two and has there been contact etc before this?,incest,cffja90,5,t5_2qx19
339934,0,t1_cfg00xs,Not exactly giving general advice about an incestous relationship is okay though. Dont worry about it were keeping an eye on things.,incest,cfg05xe,2,t5_2qx19
359635,1,t3_1y7dyd,deleted,incest,cfi1j8f,0,t5_2qx19
369282,1,t1_cfj0d4l, buzzkillington ,incest,cfj1ia2,3,t5_2qx19
374043,0,t3_1ycpqd,deleted,incest,cfjj96h,1,t5_2qx19
398539,0,t1_cfm1bsz,She got out of the shower and walked out of the bathroom naked right in front of me! My jaw hit the floor  she looked back over her shoulder and had turned beet red but she saw me staring and smiled. Not sure what to do now...,incest,cfm2opv,0,t5_2qx19
433964,0,t1_cfpqrnw,I dont know. The admins didnt mention that his account had been shadowbanned so its likely he could easily make a new one if he wants.,incest,cfpqu54,3,t5_2qx19
458885,0,t1_cfrukea,Im generally pretty nice on this sub but youre an idiot. Thats not even close to what uGayGiles said. He said Youre gay and we like you here but they also like you over in rgayincest . So post there too for maximum coverage.,incest,cfsfar3,2,t5_2qx19
463801,0,t1_cfsv9yc,Poop. Did she prepare every time before anal?,incest,cfszhqr,2,t5_2qx19
472505,0,t3_1zgxrs,I know its mostly BS so far and that theres a request for Fd and Ms etc but I found this one on rsex to be quite an interesting read...My  yo sister just asked me M to take her virginity. Not sure how I feel about this..    bSThere was an update post but the rsex mods removed it here is a screenshot of it sent to another rincest user as a PM Part Update Some bits have questionable plausibility but to me it reads as true and I can totally see that scenario playing out for real.Theres also my close encounter with my sister during a some with her friendMy older sister and I shared her female best friend    bSIts not the greatest story because I basically only fingered her a little but its true. And even though I have no interest in her now remembering it still makes me warm.. PAfter rereading the main post I just realised that the format of these posts may not fit what Tixcy wanted by stories. Oh well theyre good reads anyhow.,incest,cftz5po,1,t5_2qx19
497006,0,t3_1zszes,What items did she put into google search?,incest,cfwrhi6,1,t5_2qx19
524312,0,t1_cfziwoa,So long? There was just one last week I believe where the daughter made her own thread. Did you catch it?,incest,cfzvbv9,2,t5_2qx19
543752,0,t1_cg22s5g,woohoo!,incest,cg22xid,1,t5_2qx19
551097,0,t1_cg2wy2f,I cant ask him when he wants to keep it hidden. He will shake it off like nothing happened if I just ask him.. he is still a guy. Lol No offence.,incest,cg2wzly,1,t5_2qx19
556588,0,t3_20d629,deleted,incest,cg3jgvl,1,t5_2qx19
557208,0,t3_20hpqc,deleted,incest,cg3m0b7,1,t5_2qx19
559657,0,t1_cg3lb0u,I hope this other girl will be my sisterI have no idea how to talk to girls anymoreAwkward social ineptness GO,incest,cg3w1bb,1,t5_2qx19
574508,0,t1_cg54e6e,deleted,incest,cg5kr5d,2,t5_2qx19
579284,0,t3_20ricx,Wow great story! Please let us know what happens next! Sounds exciting ,incest,cg64ame,1,t5_2qx19
587736,0,t1_cg6y0sw,Its not going to be as hard as you think. Might take a little bit of getting to know someone since just putting out ads for this for random strangers is not likely going to go well but trust me if youre a young gal and at all decent looking you wont have trouble finding a guy into this and willing.,incest,cg72vnf,1,t5_2qx19
597500,0,t1_cg82hqt,Thanks !,incest,cg86tsm,1,t5_2qx19
623569,0,t3_219y2a,When you guys meet have an expression of blissful surprise on your face! Let her see that you are VERY glad to see her. Her first instinct will be to give you a kiss on the lips. Be ready and kiss her like you really miss her. Make it a fun evening take her on a date. Slide an adult compliment her way. Give her a random kiss later on. She will have this look of surprise and ask what that was all about. Thats your chance to tell her that you love her and miss her. When you are sneaking in a random kiss do a little pat on her butt and snicker. If she snickers back its on. If she doesnt just apologize and keep having a good visit.  ,incest,cgb5f77,17,t5_2qx19
627563,0,t1_cgbht73,Give it a shot. Itll probably suck at first everybody sucks at first but it cant be any worse than some of the erotica Ive read on the Internet. And if you enjoy it enough to keep at it youll get better over time.,incest,cgblsfk,7,t5_2qx19
628684,0,t3_21cdo2,well done and nice job adding a link to the original! Love the stories and you are a pretty good storyteller. Keep em coming! or cumming,incest,cgbqdgv,3,t5_2qx19
645921,0,t3_21jqnz,It looks like your post does not contain a tag. rIncest requires all posts to include a tag at the beginning of the title. Please click here to view our tagging guidelines. Please resubmit your post with the appropriate tags. Thanks!I am a botrAutoModeratorcommentsqpuwhatisautomoderator and this action was performed automatically. Please contact the moderators of this subredditmessagecompose?toFrFincest if you have any questions or concerns.,incest,cgdowem,1,t5_2qx19
654925,0,t3_21iwor,Damn. Its too blurry for me to read,incest,cgepqve,3,t5_2qx19
666808,1,t1_cgg25e2,Thank you for the personal attack. And it has been for the past  years right after she got a new job new friends and decided that her work was more important than her family. Why stay married? He had a kid and wanted to stay there for me when I was younger. Otherwise I would be left basically alone.,incest,cgg2cwv,10,t5_2qx19
697616,0,t1_cgj5nfc,deleted,incest,cgjkktd,2,t5_2qx19
726331,0,t1_cgm27o9,Ill be checking back for this. Part .,incest,cgmu5ua,1,t5_2qx19
729735,1,t1_cgn8103,drink wine with her...offer shoulder and back rub.get her to console you when you are upset and just naturally let a kiss happenim not just coming up with shit....ive lived all this love,incest,cgn83kx,0,t5_2qx19
747954,0,t3_22q7hb,It appears youre looking forrequesting a story you might find what youre looking for on our Stories List on the rincest wiki.I am a botrAutoModeratorcommentsqpuwhatisautomoderator and this action was performed automatically. Please contact the moderators of this subredditmessagecompose?toFrFincest if you have any questions or concerns.,incest,cgparmx,-11,t5_2qx19
774584,0,t1_cgs881x,same.,incest,cgsbozz,2,t5_2qx19
782586,0,t1_cgt8837,Actually on second thought youre banned.,incest,cgt8fha,1,t5_2qx19
815126,0,t1_cgwwrjr,True or not its a fascinating account.  I understand your reluctance to accept it as true.  For the time being I will reserve judgement but Im leaning toward true with some enhancements.,incest,cgwxlwy,3,t5_2qx19
828878,0,t3_23m1ry,Are you close together ? As you were distant in the past I dont think you should risk ruin everything by try to fuck her. You are not a bad dad you just love your daughter never got the Westermarck effect and see her naked  yo often. Every man would be in your situation.But you can focus on building a closer deeper relation with her. If you cant tap that ass for the moment make that platonic love. And then she may be the one making a move one day.,incest,cgyhu4m,1,t5_2qx19
830853,0,t1_cgypwb2,yea I was over my issues by the time he was  now mostly look back on it fondly,incest,cgypxam,2,t5_2qx19
834173,0,t1_cgz39a8,I do fear that if you make her choose she either might choose him or choose you and still do him on the side.,incest,cgz3j18,3,t5_2qx19
834751,0,t3_23oja9,Vibrations,incest,cgz5wbn,7,t5_2qx19
845911,0,t1_ch0euya,deleted,incest,ch0fmz5,1,t5_2qx19
848590,0,t3_23u4y2,good story,incest,ch0qlw0,3,t5_2qx19
857498,0,t3_23ycqp,deleted,incest,ch1r3nk,0,t5_2qx19
860196,0,t3_23xfo3,Im not usually into MS stuff but this one got me ,incest,ch2259w,2,t5_2qx19
896630,0,t1_ch66xng,You can just click on my page and find the other  parts.,incest,ch6798y,2,t5_2qx19
918424,1,t1_ch8oihw,Its a lot not alot ya dingus!,incest,ch8oijs,4,t5_2qx19
937439,1,t1_chauak8,We didnt ever talk about that. It didnt really make sense to honestly. I felt like he was mine and I was his. So it was weird when he told me about her. Im not sure if I feel like I was cheated on I guess because our relationship was complicated but I carry the same painful emotions as if he did. ,incest,chaubol,0,t5_2qx19
960192,0,t1_ch9vs1n,rwhathappened,incest,chdflb1,2,t5_2qx19
992570,0,t1_chh406r,ok thanks who are the mods? ,incest,chh424z,1,t5_2qx19
992589,0,t1_chh424z,deleted,incest,chh44xr,1,t5_2qx19
1003509,0,t1_chicqns,Hmm.. Id be very much surprised if they did not ban vpn ips as well you would be surprised to see how far their ban list goes.. even very little unknown weirdo websites with  visitors per year are banned due to the possibility of being able to be used to bypass the banns..Ill look into that site now. I am already surprised to see that I have access to that site as seeing that it contains proxy in its url.. xD,incest,chicuwr,2,t5_2qx19
1008080,0,t3_25n7es,deleted,incest,chivk7c,-2,t5_2qx19
1008871,0,t1_chiya3p,i think i can wait a little longer d,incest,chiysu3,1,t5_2qx19
1031312,0,t1_chlhn3i,Just for details some of the flirting I think Ive witnessed.A few weeks ago she made it a point to tell me that I smelled nice she did it multiple times at the same occasion this could just be her being nice or just noticing something. Like I said its probably mostly wishful thinking on my part.She also got a tattoo recently. Its on her side and when she showed it to me she kind of pulled her pants down a little too far and I saw her panties pulled to the side. It was in the presence of other people though so it was probably just a mistake.I saw her recently at a family event and she made it a point to tell me that I didnt kiss her hello i didnt she was busy when I came in. She sounded disappointed so I laughed and gave her a kiss on the cheek and a hug. Again wishful thinking I would say.This is really it besides long stares at family functions and some smiles. It would be absolutely INSANE if this happened god damn.,incest,chlikas,2,t5_2qx19
1046595,0,t3_261t6x,i swear to god. i will find u and ur family. i will watch u guys years and years until ur son find another rich girl then i am gonna wait. wait until his wedding. i swear i will kill him at his wedding he will die in your arms and then maybe u can understand what i feel now.,incest,chn93se,8,t5_2qx19
1061316,0,t3_2620te,Just because she didnt scream or yell doesnt mean anything. She might just be one of those people who are good at controlling their reactions. If it was me I would just apologize for forgetting to lock the door and ask her to knock in the future if she doesnt want a repeat of the incident. If she does want a repeat she wont knock.,incest,choxcp2,3,t5_2qx19
1068272,0,t3_26cd82,deleted,incest,chpptk2,4,t5_2qx19
1083331,0,t1_chraquo,Beats me lol D,incest,chrfdze,0,t5_2qx19
1099186,0,t1_cht8boc,Shaved isnt bad at all. Im a bush man myself. Gotta have all my girls hairy ,incest,cht8do6,2,t5_2qx19
1105410,0,t1_chtuaxe,Check out the other stories by the same authorAhabscribe if u liked this one he is my favorite author in literotica ,incest,chtxxca,1,t5_2qx19
1117376,0,t3_26unfk,Definitely one of the most wellwritten incest stories Ive ever read. If youre carrying on I look forward to the next part.,incest,chvb0ji,4,t5_2qx19
1124148,0,t3_26xpe5,Im more surprised by those who feel absolutely no guilt. Its taboo and society continually reminds us that incest is wrong. So enjoying it or having memories of enjoying it is bound to lead to feelings of guilt. Anyway good on ya for having such fun memories of your half brother  cherish them.,incest,chw2qae,1,t5_2qx19
1138064,0,t1_chxm3rj,When it comes to making him stop you can divide approaches into three categories I thinkIndirect e.g. locking doors...Though I think England doesnt have locks on the doors that arent bathrooms. But you could lock the bathroom door and take your underwear in with you. I assume this is the most desirable approach if you want to make him stop rather than subtly remove the desire. Minimal awkwardnessSemidirect i.e. He knows that you know but you dont talk to him directly about it e.g. by wedging your door closed. sounds good but might result in permanent awkwardnessDirect You speak to him. things might get awkward but still perfectly acceptable as a mother and though itll always be remembered over the next few years the awkwardness would perhaps entirely fadeI was going to type some more but all this is irrelevant until you decide how you feel P I tend to type a lot when sleepy...I should sleep,incest,chxn5j7,2,t5_2qx19
1140475,0,t1_chxwvb9,I thought about that... Theres a strong chance that I could just beat him but I dont want to unless she tells me it was rape then Ill go,incest,chxwx8m,1,t5_2qx19
1141656,0,t1_chxy69k,gt I dont see a problem with planting little seeds in her that daddy loves her in a special wayWow thats exactly what you shouldnt do manipulate ayour child into your pedophile fantasies.,incest,chy1ppt,11,t5_2qx19
1148816,0,t1_chyuqlm,Why did you remove the post?,incest,chyus7r,2,t5_2qx19
1155100,0,t1_chzk96z,If she does ill be surprised the only problem is she might be leaving soon,incest,chzkcgs,1,t5_2qx19
1156332,0,t3_27ddke,It looks like youre starting an AMA. Your post should include general background details and some information for users to base their questions on. If your post does not meet this criteria please edit your submission so that it does. AMAtype posts that lack any details or consist of two sentences or less will be removed. If this is a mistake please ignore the comment.I am a botrAutoModeratorcommentsqpuwhatisautomoderator and this action was performed automatically. Please contact the moderators of this subredditmessagecompose?toFrFincest if you have any questions or concerns.,incest,chzpce6,1,t5_2qx19
1156715,0,t3_27ddke,deleted,incest,chzqwix,3,t5_2qx19
1160984,0,t3_27d923,Dude its been sooooo long! Thanks for finally updating!,incest,ci0898f,3,t5_2qx19
1176057,0,t3_27lco4,Its a stupid idea with terrible long term effects.Grooming is fucked up.Essentially ruining your childrens future relationships because of dumb sexual desires is fucked up and selfish.,incest,ci1xd1e,38,t5_2qx19
1198121,0,t3_27u649,you are being abused...,incest,ci4envj,111,t5_2qx19
1199348,0,t3_27umqr,GTFO,incest,ci4jmss,1,t5_2qx19
1199382,0,t1_ci3qtql,As long as you are not having thoughts about  year olds now. Dont stress many here wish they were in your shoes. We are all deviants. ,incest,ci4jrrb,2,t5_2qx19
1265534,0,t1_cibe3wg,deleted,incest,cibzlka,1,t5_2qx19
1279051,0,t3_28nq2p,deleted,incest,cididy7,1,t5_2qx19
1285775,0,t1_cie92zl,Probably about the rd or th time we were together. It was the first time I think we all felt  comfortable and knew nothing was going to offend anyone. Like for a while my parents were soooo slow with moving forward sexually because they were afraid they would hurt or offend me. But the third or fourth time we actually had sex all the walls were kind of broken down and we just fucked like lovers. It was also the first time my mom went down on me and the first time I was on top of my dad. Everyone was out of the house and we started playing in the living room instead of the bedroom. My dad actually fucked my mom for a while while I watched and played with the two of them. I got crazy turned on and after my mom came my dad started fucking me. He fucked me missionary and then from behind. I came once then got on top of him which was new. He was on the floor while my mom was sitting up against the couch playing with her self. She totally let the two of us go without really being a part of it which was also new. So I rode him the best i could...and I guess from already fucking my mom for  minutes or so and fucking me for a while he didnt last long. About  or  minutes in he came inside of me. My mom had been furiously playing with herself. I was crazy turned on still and usually I at least like to come twice during sex. So without saying more than a couple words my mom crept over and got between my legs. She ate me out and licked his cum out of me. She licked and licked until I came hard again. It was really hot and dirty. And while my mom had definitely been into it the other times this was the first time she stopped trying to protect me and play the mom role and really just went for it and fucked me. Very hot. ,incest,cie9l5s,83,t5_2qx19
1286868,0,t1_cieds0a,Good times would be had Im sure.,incest,ciee0ez,6,t5_2qx19
1287258,0,t3_28t7rz,When you have threesomes with your parents? what usually happens? Do you all make out with each other? Do you undress each other? Thanks for sharing all this by the way ,incest,ciefla3,1,t5_2qx19
1288691,0,t1_cielbpb,If you read the post about how it all started my mom had a bad accident at work when I was . Its sort of complicated to explain what exactly happened and how her job works and stuff.Bottom line is she was in the hospital for three weeks and had multiple surgeries. She required a six month recovery  four months or so of which were very intense. ,incest,cieleoi,5,t5_2qx19
1289954,0,t1_cieqex5,No I dont really. I think it adds a little for them that Im their daughter and they love me and this is something we can share that really builds on that love. But I dont think they want to take me out in dates or like keep me as part of a relationship in any way. ,incest,cieqila,2,t5_2qx19
1290334,0,t3_28rxc0,You twice mention that your boyfriend says he thinks shes playing coy.  She might be!  However you must absolutely acquire her consent before moving on her.  So far shes consented to the guiding you business.  So thats safe.  You can do that.  If either or both of you want to do more youre going to have to talk it out.If she wants more but wont say it then the best thing to do right now might be to call her bluff.  Let her guide you but make no motions in her direction.If thats really all shes comfortable with then shell be satisfied with the one time or only want to go that far in the future.  If she really wants more shell move for more next time.Just dont take things further than shes expressed comfort with.  Its bad news for everyone if your assumptions are incorrect.,incest,cies1y4,1,t5_2qx19
1291476,0,t1_ciecdrl,Chainsaw accident! ,incest,ciewoon,1,t5_2qx19
1296460,0,t1_ciffwcr,I do know that and love that monologue. I even did it as a speech contest in high school.,incest,cifgvq5,6,t5_2qx19
1308525,0,t1_cidgq0k,Wow thats pretty hot I need to find me a wife like you.,incest,cigtqbn,1,t5_2qx19
