,controversiality,parent_id,body,subreddit,id,score,subreddit_id
9609352,0,t1_d9xipb8,Yeah maybe adjust some stuff that doesnt feel right look for stuff within universe... Holy crap Seto screwing with the Omega  relay thats our in. Ok I figured out how we are intercepting the Nexus A defense mechanism on the Omega  relay Its a long range relay not a normal one its the only one left and I have a theory about the Arc ships and Nexus also basically being relays at all..... itll be a problem if they arent really and theres a craptonn of random chance if they arent. but if he is working on the Omega  relay and it shoots either his ship or the Tesleya way out into dark space they could find the Nexus in route.Ill let you decide which option works better in universe.,MassEffect_Nomad,d9xjrst,1,t5_3hi8b
9678103,0,t1_da60snk,What about your mother? Did she like you following in your fathers footsteps?,MassEffect_Nomad,da61327,1,t5_3hi8b
9699894,0,t1_da8nw1i,she reaches up with her other hand and holds the pistol with both hands her aim steadies more the shaking reduces and she fires again hitting all but the last shot the rest closer to the center.Hows that?,MassEffect_Nomad,da8pvva,1,t5_3hi8b
9723252,0,t1_dabl9ky,Many of my fellow slaves did similar things for favor with the owners. I could not resent them for trying to make their own lives easier. Please continue.,MassEffect_Nomad,dablq39,1,t5_3hi8b
9733465,0,t1_dacu3qc,Yeah I got that. ... I guess I was just in the wrong place at the wrong time.So what are you working on? Anything I could help with?MLol they couldnt see her blush.,MassEffect_Nomad,dacv1e5,1,t5_3hi8b
9746204,0,t1_daefb1x,Roshet its the staple of quarian cuisine. Its a plant that grows underground. Apparently it tastes like a potato if youre familiar with that from human cuisine.,MassEffect_Nomad,daefkf8,1,t5_3hi8b
9755374,0,t1_dafjo01,Thanks. Im a pretty quick study and Ive been doing it for over  years.,MassEffect_Nomad,dafkgvq,1,t5_3hi8b
9759281,0,t1_dag1okf,He talks quickly Im sorry about coming around so late. Ive been busy today and time flew by. Meant to drop by this morning after I knew what could occur no... will occur. Stupid of me... no selfish didnt want to confront. He sounds and looks exhausted. It appears the only thing keeping him standing is his hand on the door frame.,MassEffect_Nomad,dag1sxb,1,t5_3hi8b
9767301,0,t1_dagyk8c,Just my head. It should pass soon. Water could help. You said something about trouble? I can remember feeling paranoid last night but I dont know why.,MassEffect_Nomad,dah1bun,1,t5_3hi8b
9768756,0,t1_dah7r7g,Nno.... It ststill hhurts to ththink about its,MassEffect_Nomad,dah7rz4,1,t5_3hi8b
9768785,0,t1_dah7v1f,Nazs eyes widenNno... Nnot rready yet.... Ssorry. ,MassEffect_Nomad,dah7wlm,1,t5_3hi8b
9777837,0,t1_daibvbc,the hostage is now encased in a sheet of green light. Keelah stands facing halfway between the stairs and one of the doorways,MassEffect_Nomad,daic14k,1,t5_3hi8b
9790074,0,t1_dajtz9e,He gets a confused look on his face. Yeah actually. He draws a blade from a hidden holster in his pants. Why?,MassEffect_Nomad,daju89a,1,t5_3hi8b
9792731,0,t1_dak5msl,Im sure it will. He says squeezing her hand.,MassEffect_Nomad,dak6062,1,t5_3hi8b
9803566,0,t1_dalhzkc,So what vehicles do they have for people to learn?,MassEffect_Nomad,dali10v,1,t5_3hi8b
9810425,0,t1_damc1qj,Yes the scarring is good. Well there could be pieces of shrapnel still under the skin. This can cause an inflammatory response in the body leading to the pain youre feeling  can you rate the pain from ?  being an annoyance and  being the worst pain imaginable. It also all depends on when this injury occurred. Have you noticed the area is warmer than usual? Any new warts moles or spreading of the scar?Im also going to book an imaging study to see if those combat docs  missed anything in there. Raphael hates cleaning other peoples messes,MassEffect_Nomad,damcfg7,1,t5_3hi8b
9825316,0,t1_dao8sez,Ja. Was meant to meet in Las Angeless. Where now are we? ,MassEffect_Nomad,dao9cql,1,t5_3hi8b
9846116,0,t1_daqvr3g,Do ,MassEffect_Nomad,daqyzsw,1,t5_3hi8b
9848570,0,t1_darabzr,Well I guess youve been eating paste your whole life and Ive eaten solid all of mine.,MassEffect_Nomad,darai55,1,t5_3hi8b
9852779,0,t1_daru7oi,she holds her and kisses her on the lips,MassEffect_Nomad,daru8mx,1,t5_3hi8b
9861763,0,t1_dat0bkh,He grins sitting up to kiss her softly. He pulls away.Its great Key. He wraps his arms around her pulling her over so hes on top. He locks lips with her and begins thrusting.,MassEffect_Nomad,dat0e8k,1,t5_3hi8b
9871609,0,t1_dauagk3,Hey man how yah doing?He sets his towel and water bottle on a bench.,MassEffect_Nomad,dauallh,1,t5_3hi8b
9894560,0,t1_daxa5xv,he sighsNo. And it wasnt just her.... She was the only one we managed to save. ,MassEffect_Nomad,daxa9bn,1,t5_3hi8b
9925133,0,t1_db19km5,Naz nods and sips her water in silence for a bit then she looks upOk.... I jjust wwanna apologize in advance if I gget eemotional..............,MassEffect_Nomad,db19puk,1,t5_3hi8b
9939121,0,t1_db33bdi,Well.... I did. ,MassEffect_Nomad,db33cg4,1,t5_3hi8b
9956013,0,t1_db5aha6,I see is that who it was with then?,MassEffect_Nomad,db5aksv,1,t5_3hi8b
9960958,0,t1_db5xovi,We do actually have a suitably retro scope in stock.Is that all!,MassEffect_Nomad,db5xssf,1,t5_3hi8b
10011300,0,t1_dbchrwx,looks at him.... I dont believe in things that cant be fixed. .... I know we can fix this.... And we have a week to do so.  Vir... Im not going to let you go through that. Ok?,MassEffect_Nomad,dbci1w3,1,t5_3hi8b
10016339,0,t1_dbd5kh2,she whimpers with pleasure fuck... harder... please...,MassEffect_Nomad,dbd5oq3,1,t5_3hi8b
10016340,0,t1_dbd5l0b,Perfect!,MassEffect_Nomad,dbd5ow5,1,t5_3hi8b
10028017,0,t1_dbeocdz,Max laughs at her enthusiasm. I think we need to take a break to let me recoup. The simulation the drinking the hangover and our entire day of escapades has worn me out. He pulls her over to lie down on his chest.,MassEffect_Nomad,dbeoffi,1,t5_3hi8b
10037386,0,t1_dbfw4jx,No... did something happen?,MassEffect_Nomad,dbfwbxh,1,t5_3hi8b
10057838,0,t1_dbiirmm,Thanks.  pulls the suit out and sets it on the bed What is worn underneath? Quarian underware turns out has very few useful extranet search results.... and a disturbing amount of fan fiction.,MassEffect_Nomad,dbik702,1,t5_3hi8b
10058069,0,t1_dbik702,He seems confused. You can wear whatever you want underneath. If someone is looking under your suit your cover is already blown. He shakes his head Are you sure youre up for this?,MassEffect_Nomad,dbil9zt,1,t5_3hi8b
10061866,0,t1_dbj2uv5,Max laughs. Oh yeah. Max finishes up his breakfast.,MassEffect_Nomad,dbj3318,1,t5_3hi8b
10082020,0,t1_dblpewh,my services were only required for the milky way phase of the project. once they set off Im free to return home she sighs,MassEffect_Nomad,dblpgiz,1,t5_3hi8b
10088708,0,t1_dbmkkkg,Max is wearing a tight grey sweater that helps showcase his physique.,MassEffect_Nomad,dbmkqkg,1,t5_3hi8b
10091193,0,t1_dbmwcet,she gently presses her against the shower wall and kisses her way down her back,MassEffect_Nomad,dbmwdcc,1,t5_3hi8b
10097862,0,t1_dbnrcaw,He smiles at her looking down at a sudden notification on his Omnitool. The message about Vir plays.Oh Vir what the fuck did you do..... He says listening.,MassEffect_Nomad,dbnrkyn,1,t5_3hi8b
10109763,0,t1_dbpaxiv,He laughs along with her.Oh come on well make you into the best shot on this station! Besides me of course.He nudges her with an elbow still laughing.,MassEffect_Nomad,dbpb9kt,1,t5_3hi8b
10110567,0,t1_dbpezco,Max teases the nipple shes not licking. Love the way your nipple tastes?,MassEffect_Nomad,dbpf0yl,1,t5_3hi8b
10132909,0,t1_dbsbk68,They reach the outer door and she stops to catch her breath before charging out to the nearest tree and crouching behind it Which way from here?,MassEffect_Nomad,dbsbni5,1,t5_3hi8b
10133280,0,t1_dbsd5t7,she screams with pleasure as the dildo is now deep in her ass,MassEffect_Nomad,dbsde15,1,t5_3hi8b
10133377,0,t1_dbsdtcu,she does as she asks and moans much louder fuck! thats better ,MassEffect_Nomad,dbsducr,1,t5_3hi8b
10133552,0,t1_dbsel3a,Fucking Christ... He mumbles with a smile and starts climbing following not far behind Tes.,MassEffect_Nomad,dbsentw,1,t5_3hi8b
10144147,0,t1_dbts4rs,I just... She grabs her upper arm with her opposite hand and continues to shift her weight back and forth I wasnt exactly truthful when I told you Id never been out of my suit before... its just that... last time wasnt... safe,MassEffect_Nomad,dbtsbce,1,t5_3hi8b
10144641,0,t1_dbtulog,Max guides his finger around the edges of her asshole. It feels so nice. Makes me want to stick my tongue deep inside again.,MassEffect_Nomad,dbtumjn,1,t5_3hi8b
10151707,0,t1_dbuqomh,Ill bet it was beautiful though. She says dreamily,MassEffect_Nomad,dbur2m3,1,t5_3hi8b
10162063,0,t1_dbvx2y2,Thats correct. I guess the galaxy is dominated by NonMammals. ,MassEffect_Nomad,dbvxcst,1,t5_3hi8b
10164321,0,t1_dbw6aua,No... everyone has a reason for being the way they are... Its just that... She turns looking up at the celing You see me... before I came here people just saw.. what I am.. what I could do.. ,MassEffect_Nomad,dbw6ka4,1,t5_3hi8b
10165538,0,t1_dbwbcnm,Old human belief good in concept not in practice. Lots of people died its a bad time. Not sure why he believes in it I mean hes a nice guy but still. He toys with his eggs.,MassEffect_Nomad,dbwbiu9,1,t5_3hi8b
10177011,0,t1_dbxm9qa,Max crosses his legs and places his hand on top of the bench and leans down into it. Looks like Ill be rolling in those credits in Andromeda then.        uJakeElyrn,MassEffect_Nomad,dbxmccx,1,t5_3hi8b
10188246,0,t1_dbyvl6z,Max wraps his hand around the back of her head and pulls her in closer. He lets her tongue taste all the juices from his and reaches down to finger her trying to see if shell squirt that quickly again.,MassEffect_Nomad,dbyw76x,1,t5_3hi8b
10191631,0,t1_dbz9zep,Mmm.... There isnt one here. Lets go across the street I know a place. You can grope me on the way. You better. ,MassEffect_Nomad,dbza0lk,1,t5_3hi8b
10201231,0,t1_dc0d1p7,Zoe clenches her abdomen and silently climaxes grasping for Leas hand for support. Nazra climaxes... Significantly more loudly,MassEffect_Nomad,dc0d7d8,1,t5_3hi8b
10202330,0,t1_dc0hk88,as they kiss she invites Zoe to join,MassEffect_Nomad,dc0how8,1,t5_3hi8b
10218770,0,t1_dc2bvqr,Brings him a glass and sets one of her own a mixed dring of brandy and hot chocolate next to her bowl So tell me more about yourself She asks removing her mask and setting it on the table,MassEffect_Nomad,dc2css1,1,t5_3hi8b
10229638,0,t1_dc3kyyo,Thanks. Youre cool.,MassEffect_Nomad,dc3l4nr,1,t5_3hi8b
10233364,0,t1_dc40aez,Max places his hands on her hips helping her bounce on is cock with the dildo in her ass.,MassEffect_Nomad,dc40cbs,1,t5_3hi8b
10280202,0,t1_dc9ao1c,Heh I didnt think the grocery store was THAT bad.,MassEffect_Nomad,dc9bfid,1,t5_3hi8b
10310764,0,t1_dccrqun,She grins I think he likes it. Ill go pack up the rest of this. I have a that lab equipment training on Thursday. ,MassEffect_Nomad,dccs4rw,1,t5_3hi8b
10314825,0,t1_dcd8nax,Max moans with a smile on his face as he climbs up his knees. He slides his cock in between her ass cheeks and places a few finger on top of it to keep it in place. He starts rubbing his shaft on her asshole teasing her. Is your asshole hungry for my cock? His balls gently come in contact with her pussy.,MassEffect_Nomad,dcd8poq,1,t5_3hi8b
10324892,0,t1_dcedr9m,Still holding him tight Im sorry.. Ive been an idiot. I should have known better,MassEffect_Nomad,dcedtnb,1,t5_3hi8b
10328349,0,t1_dcerr01,I lo Im.. glad She pulls away and nuzzles his cheek Ill see you tomorrow. I cant imagine what a mess my place is after a week of neglect,MassEffect_Nomad,dcerya4,1,t5_3hi8b
10334182,0,t1_dcff7hs,She sets the cat down and walks over to the table Did I keep you up last night?,MassEffect_Nomad,dcffqzg,1,t5_3hi8b
10351814,0,t1_dchfodi,She wipes her eyes and shakes her headYyeah... Thats what I kkeep tellibg myself.,MassEffect_Nomad,dchfski,1,t5_3hi8b
10376071,0,t1_dck61zy,She begins building a second rifle identical to the first but removes the handles and stocks building instead a bracket that can hold both and installing a small Mass effect field generator and kenetic dampening systemSometimes people who arent as strong need more gun in their gun too.  The field generator should lighten it up enough for me to actually aim.,MassEffect_Nomad,dck6w0m,1,t5_3hi8b
10441649,0,t1_dcrmccz,It works against shields? How? Do the bullets shatter before hitting the target? Something like that could overwhelm barriers extremely easy.,MassEffect_Nomad,dcrn1q9,1,t5_3hi8b
10552298,0,t1_dd46cdh,Yeah theyre all good people. Hard workers most of them have been working overtime alongside me.,MassEffect_Nomad,dd47znb,1,t5_3hi8b
10589177,0,t1_dd86rkp,Ill find other things to shoot then. He says with a smile.,MassEffect_Nomad,dd86xn7,1,t5_3hi8b
10618374,0,t1_ddb6e51,Not yet.,MassEffect_Nomad,ddb7e2a,1,t5_3hi8b
10689943,0,t1_ddig2ld,That shes a total pain in my ass and she likes art. Is there a point to this?,MassEffect_Nomad,ddil7f6,1,t5_3hi8b
10703532,0,t1_ddjynpt,she reluctantly complies,MassEffect_Nomad,ddjzn35,1,t5_3hi8b
10704330,0,t1_ddk2k4b,Thy appear to me made of solid ivory,MassEffect_Nomad,ddk2lrc,1,t5_3hi8b
10734360,0,t1_ddn5yg5,Aside from the pain from keeping my points down defiantly human.  No one has once just expected me to be a biotic. or treated me like Im disabled. I can just.. be who I am without ... well... being handled like Im going to break if I fall over.,MassEffect_Nomad,ddn6316,1,t5_3hi8b
10760401,0,t1_ddpldt7,continues eatingSo how has everything else been?,MassEffect_Nomad,ddputol,1,t5_3hi8b
10813845,0,t1_dduvcis,Kazuma Kuwabara?,MassEffect_Nomad,ddvdecz,1,t5_3hi8b
10906393,0,t1_de3aede,She returns home after stoping in at the lab for a few hours,MassEffect_Nomad,de4x0zg,1,t5_3hi8b
10951143,0,t1_de9elxb,I guess. Took them a long time to get to space though.,MassEffect_Nomad,de9j6v8,1,t5_3hi8b
11033951,0,t1_deinhv1,She grins One of the benifits of walking on the equivelant of my toes all the time. She lifts one foot and rotates it back and forth Smaller targets,MassEffect_Nomad,deio901,1,t5_3hi8b
11360044,0,t1_dfjmxf8,Naz is protected by her own barrier. She smiles at Keelah urging her to keep going.M Keelah has some kind of undersuit on right? ,MassEffect_Nomad,dfjn205,1,t5_3hi8b
11411918,0,t1_dfpitui,I.. suppose you could say that ,MassEffect_Nomad,dfpj2df,1,t5_3hi8b
11471106,0,t1_dfw8ipf,M Water just broke. Wont be able to respond much,MassEffect_Nomad,dfw8t09,1,t5_3hi8b
11521929,0,t1_dg1zzto,It is. The doctors are doing all the complex stuff. Im mostly just keeping everyone as comfortable as I can. ,MassEffect_Nomad,dg20gjq,1,t5_3hi8b
11522052,0,t3_645nem,Vir messages FarrauFarraGenjis I have about an hour till I have to get back to work. You busy?,MassEffect_Nomad,dg20ymc,1,t5_3hi8b
11579064,0,t1_dg8hlzm,M Dont fuck with an ExSerial Killer lol,MassEffect_Nomad,dg8hrsx,1,t5_3hi8b
11730587,0,t1_dgoe6le,Just fine. Better than most here if Im being honest. Leg healing well?M yup,MassEffect_Nomad,dgpoxve,1,t5_3hi8b
11758897,0,t1_dgsvjlt,As he presses the button at first nothing happens after about fifteen seconds backup generators begin to spin up enough for him to hear. slowly the lights come on status reports come up and the air begins to cycle from stale to fresh. Status report pannel powers on followed by other pannels one by one One of them shows an alert for power irregularity from one of the cargo bays. this cargo bay is near where the external power cables were pulled in from the Nexus,MassEffect_Nomad,dgswfrs,1,t5_3hi8b
11759926,0,t1_dgt0hn9,Cool.,MassEffect_Nomad,dgt0mwt,1,t5_3hi8b
11760525,0,t1_dgt2zqu,He finds the ship it is powered on but not moving. There is an air lock and a shuttle bay the shuttle bay is closed but the air lock can be accessed.,MassEffect_Nomad,dgt32s1,1,t5_3hi8b
11775220,0,t1_dgur5mm,Just do what they say. Leadership is all talk no bite.,MassEffect_Nomad,dgur8v0,1,t5_3hi8b
11788539,0,t1_dgw9l3w,Looks at their size.....Selects a pair of smaller pistolsOk haha now Im ready. ... and I meant that as when youre ready to talk about it.,MassEffect_Nomad,dgw9qqu,1,t5_3hi8b
11790076,0,t1_dgwfjx8,M oh... I thought they were.... pretty sure its even said in game,MassEffect_Nomad,dgwg0u1,1,t5_3hi8b
11790307,0,t1_dgwfwzc,After the meeting looks for uZuliCurah to talk,MassEffect_Nomad,dgwgyst,1,t5_3hi8b
