,controversiality,parent_id,body,subreddit,id,score,subreddit_id
6046077,0,t3_3ybupa,ZRP is the way to go first time. Its a sort of community bugfix that doesnt change the core gameplay only fixes glitches bugs and oversights left in the vanilla game. Its the standard firsttime recommendation of rstalker SoC  ZRP. You can also throw in Absolute Nature and Absolute Structures to update the graphics a bit but those are entirely optional and left to your personal preferences.We dont like to recommend for new players to use mods that alter the core gameplay because since its your first time you wont know what is a standard feature and what is a new feature brought in by the mod and it can lead to a lot of confusion. OGSE makes changes to the fundamental core gameplay enough that it would be better to save that for a later playthrough. Playing with ZRP allows you to get the best possible taste of the original game. ,stalker,cyc5am7,6,t5_2r74m
6055851,0,t1_cydcdm3,The only thing you seem to grasp is your own elevated sense of self importance and worth. You must spend many long hours admiring yourself in the mirror.  Youre doing nothing more than just moving around the resources of someone elses work.  Youve thought of nothing new created nothing new youre just a hack that imagines youre an artist while all the art has already been created.  See the number  there?  That is where you put the red.,stalker,cydf510,0,t5_2r74m
6056519,0,t3_3ygtfo,Get in the SEVA Streilok!,stalker,cydi9us,7,t5_2r74m
6127537,0,t3_3zepdc,I cant prove it but I think I speak for all of us who have played CoP in several difficulties that in CoP the enemies just die easier in higher difficulties and you also take more damage. With easier difficulties pistols are completely useless guns but when playing with the highest difficulty pistols are very effective. I use Colt  a lot and it kill with two shots to chest even at long ranges. I dont know if range affects damage though.So I have no proof but its crystal clear that its easier to kill enemies with higher difficulties. The trade off is that you also die VERY easily. One good hit from shotgun and you are done one bullet from AK and my health goes down to about  with Sunrise suit upgraded to tier .,stalker,cym4ycg,1,t5_2r74m
6157081,0,t1_cypct8k,Actually if the weapons were more accurate Id probably be fine with . In the Metro games on the higher difficulties where ammo is very scarce I always get by just fine because the weapons are dead accurate. Kind of miss that in Stalker always need at least  shots for  guy because most of them dont even hit.,stalker,cyphuuy,1,t5_2r74m
6217320,0,t3_40pw5d,I can sure feel the anxiety knowing that damn Controller is going to spawn behind me as soon as I walk through that doorway...,stalker,cywcchd,8,t5_2r74m
6219070,0,t1_cywbmby,Freedom were the gotoguys when it came to anarchy in Shadow of Chernobyl but in Clear Sky I just feel sympathetic to them and their reasons.LONG LIVE FREEDOM !door opensWhait I didnt meant to...BANG...BANGBANG,stalker,cywjhic,1,t5_2r74m
6222826,0,t1_cywxm1w,Seems more like SoCs Agropom Underground walkthrough. Just tell me answer one question Is it THAT boss at the end?NO NO NO dont spoil it just tell me...if its THAT one ! ,stalker,cywyusi,1,t5_2r74m
6229602,0,t3_40wjas,Yes,stalker,cyxqkqu,1,t5_2r74m
6231905,0,t1_cyxzy1q,no theres some way you can have for example gstalkerchernobylgstalkerchernobyl ...... etc etc you just copy the game install files or else install it several timesi forget the steps I just remember I had  installs on the go at the one time and was super excited about the fact,stalker,cyxzzuv,2,t5_2r74m
6236766,0,t3_40yvxl,SOC has the highest frequency of Cheeki Breeki. If you dont have enough of it just spend some time in garbage repeling endless waves of bandits atacking from agro. Cheeki breeki sound file is detour.ogg so it was meant as expression for bandits who are flanking you. And thats exactly where they use it! So Youre unlikely to hear it in narrow corridors of agro underground no room to flank or when passing by bandit camps  assaulting them yourself.  You hear it often if bandits are attacking position and you are defending it. There are  versions of it.. My favorite is is from ...humanbanditfightdetour... folder. It the one with longest ah nuuuuuuuu part. The one in human is muffled cheeki breeki. and human is fast AnaCheekiBreeki.. iv domke version,stalker,cyyjwn5,3,t5_2r74m
6237560,0,t3_40w7bc,For reals though are these the little green men in Ukraine?,stalker,cyyn5sv,1,t5_2r74m
6239325,0,t1_cyyucvm,Gravy artifact only increased carry capacity in Clear Sky and Call of Pripyatgamedataconfigsmisctrade any trader . Then edit buyitemconditionfactor. Its very interesting to see how locations changed since the RMB attack is made to work with .ftl files.  chocohexInfo | SubredditrUserSimulator,stalker,cyyue2d,4,t5_2r74m
6243988,0,t1_cyzcrto,Indeed.,stalker,cyzdgik,1,t5_2r74m
6303709,0,t3_41x9as,Vsync is basically a FPS cap of .Anyway from what i understand you played the game for a long time with a computer that was barely able to handle it.So i recomment you to get used to it. The game is not really fast just not a slideshow anymore ,stalker,cz65sxu,1,t5_2r74m
6305470,0,t3_41wsh6,Smoke weed and drink vodka with freedom and probably get killed trying to shag a bloodsucker or something,stalker,cz6d0cy,4,t5_2r74m
6314145,0,t1_cz6bdrc,Ah.  Gotcha.  Aight thanks for the advice guys.  Ill check out ZRP.,stalker,cz7cjvs,1,t5_2r74m
6332439,0,t1_cz96bke,Its like Im wearing nothing at all!Stupid sexy stalker.,stalker,cz9fg8c,7,t5_2r74m
6387416,0,t1_czf7oe0,I used to use the vanilla look in some of my older videos but the new textures from AA look so much better on video from a dark location. If I could I would still use the vanilla stuff.,stalker,czfol58,1,t5_2r74m
6391977,0,t3_434pmz,deleted,stalker,czg79nc,1,t5_2r74m
6397820,0,t1_czgv1bx,Wait it works!?,stalker,czgv77n,1,t5_2r74m
6398317,0,t1_czgwen5,Yep I noticed that it didnt work at all lol. Now the interesting part is I found the repair kits for SRP it doesnt work too even with clean install and new game. It just doesnt show up in inventory. ,stalker,czgx8gd,1,t5_2r74m
6406523,0,t3_43fq6h,I put in about  hours yesterday and it feels good man.  ,stalker,czhuun2,4,t5_2r74m
6444602,0,t1_czlwgbe,You are quite welcome! Good hunting stalker.,stalker,czlwu6k,3,t5_2r74m
6446972,0,t1_czm3q2y,Ask for the Zone to shrink and you would grow giant and die when the  CNPP collapses on you. Ask for the Zone to grow and you will shrink into nothingness.,stalker,czm5ntu,9,t5_2r74m
6464320,0,t1_cznxfto,Thank you.,stalker,cznyeej,3,t5_2r74m
6487714,0,t1_czqdev7,Heh Id say Ashinjuka does a lot more than me though.,stalker,czqdm1u,1,t5_2r74m
6498173,0,t3_44nsmb,Taking a break from my Fallout stuff and before I started making models based on the Elder Scrolls series I decided to recreate the S.T.A.L.K.E.R. setting in a wargaming scale. ,stalker,czrgk3q,12,t5_2r74m
6499577,0,t1_czrlppp,Exactly my thoughts. ,stalker,czrlsr8,3,t5_2r74m
6536078,0,t3_4552r2,God help anyone who faces the Chimera. It is truly a creature of nightmares.gtgoes to clean pants,stalker,czvdsol,4,t5_2r74m
6578675,0,t1_czzkytz,Yeah the games voice acting is entirely in Russian. Although a lot of the actors themselves are Ukrainian such as Grigoriy Hermann the voice of bandits. There have been a few unofficial patches that added Ukrainian voices but they are pretty meh.,stalker,czzsen5,3,t5_2r74m
6579725,0,t1_czzurxp,Wow seriously? ,stalker,czzwb8y,2,t5_2r74m
6643362,0,t1_d06h7ds,No problem. ,stalker,d06hbw2,1,t5_2r74m
6644029,0,t1_d067jdu,Yeah its obviously fan made but they did a very good job. Only flaw I noticed was the guns are too new but thats understandable.,stalker,d06jtco,1,t5_2r74m
6660729,0,t1_d0896cn,Would you recommend it after I complete the game vanilla or install it for first play through?,stalker,d089yvc,1,t5_2r74m
6662158,0,t3_46uf84,Seems to be missing what mod,stalker,d08fa9v,2,t5_2r74m
6663625,0,t1_d08kji3,Star wars?...is that...a vodka brand? Damn this weed is good. ,stalker,d08kr0m,2,t5_2r74m
6664399,0,t1_d08luz1,Really no one in Stalker speaks ukrainian? Not even the soldiers? I thought that rookies speak it becouse they say oruzhye ubral  and russians dont have H letter.,stalker,d08nmz1,1,t5_2r74m
6672280,0,t3_470nay,Getting a scoped rifle is a must because AI aimbots like crazy. The most annoying thing is that the shotguns are so op that bandit with the sawed off can snipe you from a mile away but so can you.I didint really have a problem with is as i tried OP before stalkersoup and the AI aimbots even more there. So much so that the difficulty on the second easiest is the same as master on stalkersoup and playing on master is like trying to play multiplayer fps where the enemy is aimbotting and wallhacking.,stalker,d09gz9e,2,t5_2r74m
6687178,0,t3_46xtf8,So many Adidas ,stalker,d0b0gq8,1,t5_2r74m
6694452,0,t3_47bkzp,Theyre the masochistic games of their genre.   STALKER is the masochistic Survival FPS RPG as opposed to Fallout andor Borderlands      Dark Souls is the masochistic RPG as opposed to the Elder Scrolls series.    ,stalker,d0brj5z,25,t5_2r74m
6735226,0,t1_d0fz3ol,Yeah the HK is the one. I bought it on a whim when I realized I had  rubles. My current goal is to collect one of every gun and armor and upgrade it. I figure thatll make for a good money sink.I totally get what you mean about being chained along by corpses. Just yesterday I was leaving Zaton heading south. Well I heard gunfire behind me and lo and behold a lone bandit. I drop him like a bad habit and of course go over to take his precious stuff. But then I see a couple more bandits atop the hill so down they go and then up I go for the good stuff. That leads to a skirmish with a couple bloodsuckers followed by a Mono squad all taking me in the opposite direction I want to go.Sometimes getting around in the Zone is not like simply going from A to B yes? ,stalker,d0fzbs0,2,t5_2r74m
6740508,0,t1_d0gciu2,If the mod is as good as it potentially could be it will get translated either by Russians or someone else.Having more player population is a huge incentive to make an English version.Now stop being such a buzzkill and watch episode ,stalker,d0giylz,1,t5_2r74m
6747459,0,t1_d0h1yuz,Same here plated duty freedom loner kill everything avoid confrontation every ending. Still need to get around to my pistols only playthrough. As if shotguns only wasnt bad enough. At least with pistols Ill be able to carry lots of ammo.,stalker,d0h8se8,1,t5_2r74m
6748041,0,t1_d0h5gf4,I am kinda stuck at the moment and think it would be wise to just move on.To give context I am playing the Misery mod for CoP. Now I need to move to the last map and to do that I have to go through Jupiters administrative buildings buuuuut I still have to check the last crash site in Jupiter itself.Now I fought chimeras before. I fought izloms and burers as well as zombies. After the whole moment where I emerged victorious from  controllers a pack of dogs izloms zombies and bloodsuckers I never thought I would be going against odds as silly as that again. And it turns out I was really REALLY wrong. Jupiter plant had quite the surprise waiting for me. First time I went there I had to fight  chimeras at the same time and I somehow managed to kill them. Bear in mind this is Master difficulty the hardest there is. And so because I basically ran out of ammo for both my rifle and shotgun fighting these beasts I went back to Yanov to gear up and try again.And here I am on my second time around and I just killed  burers that came after me all at once not to mention a zombie patrol never underestimate zombies. Now I need to fight  more chimeras. I have used a lot of grenades trying to get rid of the burers and clearing out zombie patrols and wasted quite a bit of ammo on the burers themselves.I swear the Zone wants me dead. Either that or it wants me to succeed and I will be damned if I give up now. ,stalker,d0hayd1,2,t5_2r74m
6749927,0,t1_d0hhya3,Okay will check. Arma  looks great compared to Arma .,stalker,d0hhza7,1,t5_2r74m
6753637,0,t3_488rzq,My favorite is the unique Combat Chaser from SoC. A really good shotgun to own.,stalker,d0hvstf,2,t5_2r74m
6755422,0,t1_d0h2d97,They learn what they need to learn by dying in the game...   ,stalker,d0i2fhd,1,t5_2r74m
6879261,0,t1_d0w2hvd,LOL true unless Russia takes it over first. But yeah the Zone would only be accessible to non military people if the artifacts there dont have much value. Like if the best artifact from the Zone just glows or sparkles then nobody would really give a fuck about the Zone. ,stalker,d0w2u6q,2,t5_2r74m
6879689,0,t3_49ybnr,The only way to truly be a Monolith soldier is to go through their brainwashing program. In COC you shouldnt be able to just go to their HQ and ask to join then voila. That totally goes against Stalker lore.   ,stalker,d0w4lkz,1,t5_2r74m
6883894,0,t1_d0whg11,I havent even gotten to that point. I still havent found a bloody Stone Flower in the Cordon. Where did you find yours?,stalker,d0wltau,1,t5_2r74m
6911339,0,t1_d0zpvw1,Random number generator aka dice roll,stalker,d0zpyqw,2,t5_2r74m
6921175,0,t1_d0zo009,Wild Teritory  Yantar is my favorite area of the game. ,stalker,d10u7np,1,t5_2r74m
6922381,0,t1_d10z1ac,Where did you get the others?Edit The doll thing says to look in the Garbage,stalker,d10z54k,2,t5_2r74m
6936711,0,t1_d11thps,Sakarov ended up selling one to me. Try sleeping until a new day if he doesnt have one yet.,stalker,d12lqgt,1,t5_2r74m
6942043,0,t1_d12xx5i,What old man? The one in Cordon has nothing to say,stalker,d137kjk,1,t5_2r74m
6945620,0,t1_d13kb4r,Ill vouch for that. Clear sky complete touched on everything it needed to while still being basically the vanilla game.,stalker,d13m788,1,t5_2r74m
6966021,0,t3_4b3zxp,According to ufercyful in this threadgt gt fromgt I cant speak for the present health of it but this is how I downloaded OGSE and it worked well for me when I did.,stalker,d15xn43,3,t5_2r74m
6967558,0,t3_4ayd2u,Looks absolutely gorgeous!,stalker,d163x7k,1,t5_2r74m
6977403,0,t3_488rzq,Knife.,stalker,d178678,1,t5_2r74m
6992954,0,t1_d18zmzt,Makes it more fun.,stalker,d18zsgq,2,t5_2r74m
6993078,0,t1_d18zwb8,I was able to play it with a controller without any problems. I just cant aim but it has nothing to do with Stalker. Im not good in FPS games with a controller.,stalker,d190aqc,2,t5_2r74m
7028269,0,t3_4budxr,Moments like this are some of the greatest in any game. ,stalker,d1d0a9t,1,t5_2r74m
7032138,0,t3_4buzpe,God! I am addicted to this drink!,stalker,d1dg4ji,1,t5_2r74m
7040026,0,t3_4a93lp,Wheres the wolf dynamite? Carelessly read the quest dialogs and apparently he gives a hint where it might be. ,stalker,d1ecdqc,1,t5_2r74m
7072881,0,t3_4cgre6,You should have shot them in the back when they expected it the least. They will eventually try to kill you. Monolith scum!,stalker,d1i2oop,1,t5_2r74m
7072896,0,t3_4cgvr4,Old post by unknown redditor i have been pissing my pants last night when i stumbled into this xD ,stalker,d1i2qwa,6,t5_2r74m
7078588,0,t3_4ci41p,Welcome to the series Stalker! Dont worry too much about the order you play em in. You got to Pripyat Underpass in just a few hours it looks like thats pretty damn good.,stalker,d1iq188,2,t5_2r74m
7086041,0,t1_d1jcehs,Running Windows ,stalker,d1jkiw8,1,t5_2r74m
7109928,0,t1_d1lvqm2,Hah haha hah.... l                     P,stalker,d1maiut,1,t5_2r74m
7112953,0,t3_4cy5kr,What the fuck!? Never a dull moment in the Zone... For a goddamn video game it sure seems like anything and everything can happen.,stalker,d1mna7r,2,t5_2r74m
7141893,0,t1_d1py5qe,Now hold on a second merc! Put the kalash down....erm you see....eh..oh! Look! A flash artifact over there!,stalker,d1pygqj,1,t5_2r74m
7145893,1,t3_4de18a,The planet needs to be saved from Duty. P,stalker,d1qevp2,2,t5_2r74m
7152113,0,t1_d1r2ndn,you want to create an anomlay? cuz thats how you create an anomaly.,stalker,d1r4gpi,2,t5_2r74m
7161743,0,t1_d1s6fh0,Go to X and talk to the dead stalker about it.,stalker,d1s7z4y,1,t5_2r74m
7164231,0,t3_4a93lp,their is a mission called help pyscho but i bought to him to yantar the doc refused to help and than he suicide and it says task failed ? is the right or am i missing something ,stalker,d1si6b2,1,t5_2r74m
7172437,0,t3_4dqmk0,Gotta love the Sigerous on the other hand why are you carrying pharmacy truck weight of medicine?,stalker,d1tfsq4,13,t5_2r74m
7179796,0,t1_d1u9tnj,I bet you itll still turn out to be stalker  and gsc world will be mad..,stalker,d1ua1e9,2,t5_2r74m
7213639,0,t3_4e9797,Its a fridge right? Damn it Sergiei! I told you no more fridges! Ok so what you need to do is knife the living fuck out of it.,stalker,d1y4uxy,6,t5_2r74m
7227522,0,t1_d1zpiih,Looks like Priboi Story judging from the gloves and the look of the HUD.,stalker,d1zprdi,1,t5_2r74m
7235415,0,t3_4ej86s,One of the things I liked about Clear Sky is that all armors are weak in their own ways. You must always sacrifice a stat for a different one. Armors with heavy protections hardly have any artifact slots which are immensely useful and armors with heavy anomaly protections dont have enough stopping power to negate bullet damage.My favorite armor is CS which is also a in some localizations. It does a decent job at protecting the player from anomalies and bullets alike I prefer chosing the armor upgrade tree. The base suit only costs k RU and can be purchased in the first location of the game. Another suit thats good at all stats is the SEVA but it loses in bulletproof cap by  points its  as good as CS but wins in anomaly protection by x in any upgrade tree anomaly protection tree grants  damage negation from anomalies awesome!.However a heavy drawback is that you can only fully upgrade the suit by bringing the bandit mechanic flash drives. This means you have to stay neutral with bandits and run around collecting flash drives which is time consuming and expensive.,stalker,d20m4cq,1,t5_2r74m
7258256,0,t1_d233i8v,deleted,stalker,d237ndp,-2,t5_2r74m
7281196,0,t1_d20a29g,How low can you go stalker!? ,stalker,d25tnmt,2,t5_2r74m
7285212,0,t1_d2598vw,gtnice memetips fe NO,stalker,d26a31s,1,t5_2r74m
7309357,0,t1_d28x7x9,nyet blin  was not me then.  ,stalker,d290vny,1,t5_2r74m
7380853,0,t3_4gehx1,wow! Thanks for sharing GreenyLFC. I hope we can explore without the VR hardware to expensive here. Went to the Zone in  and since then I have a melancholic feel for be there again this will be a nice possibility to do that in some way! ,stalker,d2h5i2d,1,t5_2r74m
7423137,0,t1_d2kezmt,So why does it costs so muchis so rare in video games?,stalker,d2lynd7,1,t5_2r74m
7435926,0,t1_d2ner44,Pretty big words the original  Doom by iD Software begs to differ.Come on this is modding .,stalker,d2nf0y3,6,t5_2r74m
7496726,0,t3_4i1oul,Neat this reminds me of Invisible Inc. Except in real time of course. Although their vision distance seems far too small at least for how bright it looks. What do you think about making them see much farther but with more blind spots?,stalker,d2uc7bm,6,t5_2r74m
7496805,0,t1_d2ucf04,you are talking about the AI characters enemies right? I.e. if you hide behind a crate they wont see you?,stalker,d2ucizy,1,t5_2r74m
7514137,0,t1_d2qeaf4,The faction war just counts all of the faction flairs in this subreddit and shows differences from the last count.,stalker,d2wbj1l,3,t5_2r74m
7645124,0,t1_d3b7crw,oh so new stories? theres one i downloaded recently called Chernobyl chronicles that someone else pointed out.havent played much but it looks interesting so far.,stalker,d3b7jr7,2,t5_2r74m
7651828,0,t1_d3bj6yh,True.,stalker,d3byxz7,1,t5_2r74m
7687540,0,t1_d3fz3vz,I am only using the Zone Reclam mod otherwise its vanilla. Ill work on getting the crash log but in some cases it crashes and I have to restart the PC in order for it to work again.,stalker,d3g0wu7,1,t5_2r74m
7750031,0,t3_4l9wl7,for OGSE you can literally disable the camera shakeflashes when you first open the launcher.Minimap isnt really something youre gonna need much tbh i want to find a way to remove it.Save the guy near the helicopter in the first missions and the rookies arent hostile.Youll need some sort of detector to be able to hear the anomalies. this one is a bit annoying but its a thing.,stalker,d3n4ddc,2,t5_2r74m
7753628,0,t1_d3ne9sr,At least we Dutiers have a sense of honor and brotherhood. What do you have? A pet rock?,stalker,d3nj2o2,7,t5_2r74m
7760323,0,t1_d3o9u00,.. it seems while SRP is in .. right now. There has been quite a list of new fixes in that time might want to check it out if youre planning to replay CS.,stalker,d3oaen4,1,t5_2r74m
7762063,0,t1_d3oh4jn,Its just an ergonomic pistol grip  I happened to have which was more comfortable than the standard P but yes very similar.  And to a Upg  grip think thats what theyre called anyway ,stalker,d3ohi9l,4,t5_2r74m
7764265,0,t1_d3ooo7r,Serbian,stalker,d3oqicd,2,t5_2r74m
7771281,0,t3_4lr5s7,Ah Oblivion Lost Remake. A lot of things in that mod can make the player go WTF in just a split second.,stalker,d3pj62k,2,t5_2r74m
7771345,0,t1_d3pjcz6,yeah i had a playthrough of AA but i experienced an annoying crash and had to drop it. Economy was a bit tougher but it was fair overall.Im also interested in Amk Autumn edition. ive heard that .. has a somewhat tougher economy so maybe that would be a good fit.,stalker,d3pjfhh,1,t5_2r74m
7779925,0,t1_d3q4mf5,EDIT i fucked up the link unknowingly heres the real one,stalker,d3qihby,1,t5_2r74m
7783865,0,t3_4lw9py,Throw a bolt at it.,stalker,d3qyl8c,2,t5_2r74m
7802658,0,t1_d3t2t0b,Hehe its alright I know what the variable do with their name implications. I just could not find it in the heaps of text so thank you for guiding me ,stalker,d3t2vgq,2,t5_2r74m
7808711,0,t1_d3pfr9c,Yup thats the ZRP message you get after the game has ended and you can now freeroam if you want to. Or start over. Or play another mod. Or another one of the series. So many possibilities in the Zone.,stalker,d3trgm9,2,t5_2r74m
7821725,0,t3_4mee7h,Wait until you come across an izlom man.Then youll get even worse talkings to!,stalker,d3v87y3,1,t5_2r74m
7837894,0,t3_4m3c26,Noosphere change is a HOAX!,stalker,d3x1p30,1,t5_2r74m
7842586,0,t1_d3xhxyz,my current ZoA playthrough has made me an expert at finding workarounds to crashes.Lucky for me i only experienced the corrupt save once and it was a quicksave. other than the crashes its a great mod.,stalker,d3xkpk5,1,t5_2r74m
7847494,0,t3_4moibj,Call of Pripyat because it excels where Shadow of Chernobyl did and also adds some mechanics which improve the overall gameplay.You should however start with Shadow of Chernobyl though. There are things like the lack of repair kits throughout the game which will make it a pain to return at once youre done with CSCoP. Hope you dont get this in your head as you play the game good luck.,stalker,d3y4lpg,1,t5_2r74m
7852995,0,t3_4msvno,Stupid freedom always high never bring dog to the zone!All dogs in the zone are a danger! Help duty rid the zone of dangerous mutants!,stalker,d3yqwah,3,t5_2r74m
7872588,0,t1_d40ls49,Nuclear Winter mod for HalfLife?,stalker,d40y95e,1,t5_2r74m
7901486,0,t3_4nhed5,I was in lab X Joint Pak  I had finally cornered the pyrogeist that had been blasting me for the past ten minutes it was a dead end with a ladder. Then whoosh Houdoni the pyrogeist escapes into the sunset.,stalker,d4479hy,3,t5_2r74m
7920229,0,t3_4nrejb,Do you take milk and sugar?,stalker,d46b46a,4,t5_2r74m
7957646,0,t1_d4aecbp,I actually like the hey bro! and whats upbro?,stalker,d4aij5h,2,t5_2r74m
7965351,0,t1_d4b0g8s,the faction war system not only gets in the way and breaks the atmosphere with its repeated quests but its also badly implemented with squads being in one part of the map and all of the sudden they walked a  Km and are attacking your outposts the only reason i won the lonersbandits war loners side of course is that i aplied russian counter strike player logic and as soon as both entrences to the garbage where captured i rushed the depot base myself alone and waited  minutes for a friendly squad to get to me.,stalker,d4bdqda,1,t5_2r74m
7965472,0,t1_d4be0i5,Maybe its possible now with the open xray engine which CoC is based on but prior to that many have tried and with some success but yes a whole rewrite is required. ,stalker,d4be7y0,1,t5_2r74m
7969020,0,t3_4o9a92,LOL!  ,stalker,d4bsknm,1,t5_2r74m
7971874,0,t1_d4bq7uz,It should be possible with enough skill. ,stalker,d4c443c,1,t5_2r74m
7983182,0,t1_d4d1cm5,deleted,stalker,d4ddvh5,1,t5_2r74m
7991228,0,t1_d4e5a2w,I can give you the name but that would make you check it out and by God you dont want that,stalker,d4eagam,2,t5_2r74m
7994370,0,t3_4opqww,wat,stalker,d4en5v8,1,t5_2r74m
8001321,0,t1_d4ff0pz,it seems like it does although the optionals it does have are more like those in ZRP so not really interesting still its better than vanilla thank you a lot for the tip stalker,stalker,d4ffafj,2,t5_2r74m
8023499,0,t3_4p4b90,There is no such thing as Clear Sky running smooth. What you got there is pretty good actually. You can handle lag spikes every few seconds. Just let it be. And I doubt there are any other options.,stalker,d4hx00r,-3,t5_2r74m
8052607,0,t3_4phlyj,Get out of the water Stalker!,stalker,d4l6sxr,9,t5_2r74m
8063567,0,t1_d4lw5ks,You spelled it right. Good hunting STALKER!,stalker,d4mf5xf,2,t5_2r74m
8075365,0,t1_d4nqs4u,Yep same engine. Its probably the weirdest Stalker game. They tried to basically add this faction war to it where each map you pick a side and help that side take over the area.,stalker,d4nqwa5,2,t5_2r74m
8081596,0,t1_d4o33rp,Oh! Best npc in game. Just make sure you arent running or he will be hostile.,stalker,d4og2pr,5,t5_2r74m
