,controversiality,parent_id,body,subreddit,id,score,subreddit_id
2472104,0,t1_cmh8xxy,I literally made the subreddit two hours ago. I saw CGP Greys tweet and got the idea.,cgpgreymemes,cmh91d9,4,t5_31scv
2472363,0,t1_cmha3ye,Hey baby I like the size of your freedomtm,cgpgreymemes,cmha6ss,5,t5_31scv
2738803,0,t3_2rfl8j,Here is what the linked meme says in case it is blocked at your schoolwork or is unavailable for any reasonGreys Window  gtPost Title  H.I.  Greys Window gtTop  I HAVE A WINDOW gtBottom  FOR MY SPONTANEITY Original Link | Meme Template,cgpgreymemes,cnfe220,1,t5_31scv
4125357,0,t1_crpbs7r, glad you like it.,cgpgreymemes,crqikw5,1,t5_31scv
4240718,0,t1_cs3gjdy,Ah sometimes android bugs out and itll keep playing or when the cable isnt fully out and the connection is loose itll also play on the speaker.,cgpgreymemes,cs3mu9x,1,t5_31scv
6181693,0,t3_408qt9,Here is what the linked meme says in case it is blocked at your schoolwork or is unavailable for any reasonCGP Grey  gtPost Title  Releasing a new video gtTop  OH BOY gtBottom  IM WHIPPING AWAY  THE VEIL OF SECRECY Original Link | Meme Template,cgpgreymemes,cysalip,2,t5_31scv
6675746,0,t3_473d20,Here is what the linked meme says in case it is blocked at your schoolwork or is unavailable for any reasoncgpgrey  gtPost Title  Beacon of hope gtTop  I AM A BEACON OF HOPE FOR THE SMARTLY LAZY gtBottom  SHINING A LIGHT ACROSS AN ENDLESS SEA OF SLOTH AND WORKAHOLISM Original Link | Meme Template,cgpgreymemes,d09tw8p,1,t5_31scv
9821437,0,t3_5fwb8e,Needs more jpg!,cgpgreymemes,danr3fj,6,t5_31scv
