,controversiality,parent_id,body,subreddit,id,score,subreddit_id
7025660,0,t3_4bt4wr,Super cute really won me over lately. ,kpics,d1cpmhm,2,t5_2u4ls
7025771,0,t1_d1cppo9,Yeah. I hope she comes back someday.I miss her and Yooara.,kpics,d1cq2w1,3,t5_2u4ls
7075165,0,t3_4cgn7l,deleted,kpics,d1ic0nj,0,t5_2u4ls
7110660,0,t3_4cyn4k,Source Lets Dance OH MY GIRL  LIAR LIAR,kpics,d1mdm31,1,t5_2u4ls
7114413,0,t3_4d0jtf,Honestly speaking I didnt want to include the butt part but I really didnt want to cut out the last bit Hani looks so good there x.x,kpics,d1mteur,4,t5_2u4ls
7120130,0,t3_4d15ik,adorable rabbit!,kpics,d1nh1kw,2,t5_2u4ls
7150154,0,t3_4dg0x1,lt that hair,kpics,d1qweya,5,t5_2u4ls
7183444,0,t3_4dutyq,I remember when Sana posts would barely get  upvotes and hit the front page. When the hell did this sub start liking her so much? Lol I mean Im not complaining tho.,kpics,d1up0sm,5,t5_2u4ls
7300172,0,t1_d27x3f6,On it,kpics,d27zabj,40,t5_2u4ls
7314212,0,t3_4fi9if,We dem boys,kpics,d29kr6g,3,t5_2u4ls
7346582,0,t3_4fx7hk,Phenomenal. ,kpics,d2d97ym,2,t5_2u4ls
7350580,0,t3_4fz83z,deleted,kpics,d2dplhp,2,t5_2u4ls
7352574,0,t1_d2dxcve,Screenshots regardless of quality are prohibitted on this sub. If screenshots are the only images available to you at work we suggest you post them on rkscreencaps and come back to post here when you have access to other sources ,kpics,d2dxrek,1,t5_2u4ls
7395335,0,t1_d2htbjz,deleted,kpics,d2isubf,1,t5_2u4ls
7437003,0,t3_4h4uh0,My Favorite member and part of the song lt,kpics,d2njfcn,5,t5_2u4ls
7439527,0,t3_4h50gp,She looms good blonde.,kpics,d2ntr7i,3,t5_2u4ls
7449021,0,t3_4h8abq,   ,kpics,d2ownds,1,t5_2u4ls
7466033,0,t3_4hlhrf,the overlooked beauties. ,kpics,d2qub8r,4,t5_2u4ls
7477987,0,t3_4hti79,Im dead,kpics,d2s7d1x,2,t5_2u4ls
7496251,0,t3_4i0617,does someone have the image in same quality but without the stupid faceblurring? ,kpics,d2ua959,2,t5_2u4ls
7499427,0,t3_4i35gd,God bless my wife.,kpics,d2un9vj,5,t5_2u4ls
7499548,0,t3_4i2mp1,Thank you for posting! Unfortunately your post has been removed for the following reasons This submission does not comply with our quality guidelines. Please refer to the Submission Rules in the sidebar for more info.,kpics,d2unrrc,1,t5_2u4ls
7500426,0,t1_d2uq7bh,cuz the photographer doesnt took pictures of chungha  u can see more photos at ,kpics,d2urczl,1,t5_2u4ls
7514211,0,t3_4i7axy,I would get in her van anytime.,kpics,d2wbty8,1,t5_2u4ls
7526817,0,t3_4ig2dx,Thank you for posting! Unfortunately your post has been removed for the following reasons Image has been recently posted ,kpics,d2xrftf,1,t5_2u4ls
7533585,0,t1_d2yhh48,tis but a scratch,kpics,d2yj56k,11,t5_2u4ls
7537676,0,t3_4ild9x,source,kpics,d2yzwl0,3,t5_2u4ls
7577407,0,t1_d33i7b3,,kpics,d33ijmm,6,t5_2u4ls
7589858,0,t3_4j9zcv,source,kpics,d34xh4t,2,t5_2u4ls
7596229,0,t3_4jd8qu,Source,kpics,d35nihm,4,t5_2u4ls
7628712,0,t3_4jsq1l,perfection,kpics,d39cdlw,3,t5_2u4ls
7641602,0,t3_4jz0d6,Thank you for submitting! Unfortunately your submission has been removed for the following reasons The image you posted does not comply with our quality guidelinesvjgr.,kpics,d3at3ft,1,t5_2u4ls
7659172,0,t3_4k7r83,BLEP,kpics,d3csyrz,2,t5_2u4ls
7660287,0,t1_d3cx9eh,Ill allow it  moreatrkpopgfys,kpics,d3cxj3s,8,t5_2u4ls
7684731,0,t1_d3flpjf,Idk about you but that chicken is pretty good looking,kpics,d3fpg24,6,t5_2u4ls
7751166,0,t1_d3n89ts,sounds cool. i will give it a try.,kpics,d3n90ct,1,t5_2u4ls
7754287,0,t3_4lgn3z,I guess Ill have to get used to having a bleeding nose for the rest of my days.,kpics,d3nlrnb,3,t5_2u4ls
7759232,0,t1_d3o5vqp,gonna spazz a little. but would calling myself a fan of yours be weird? have always liked your posts on Reddit!,kpics,d3o5yaf,3,t5_2u4ls
7764855,0,t1_d3oswlo,r u ok randall,kpics,d3osx45,5,t5_2u4ls
7765115,0,t1_d3os5ue,Yeah and I didnt expect it but she totally flaunted it a few sec later when the others werent listening to her lol,kpics,d3otzcz,3,t5_2u4ls
7768487,0,t3_4lptxi,Joy addict D,kpics,d3p7qvu,2,t5_2u4ls
7811608,0,t3_4m82mg,If she did that nd image thing at me Id  JUST DIE gtlt ,kpics,d3u3893,1,t5_2u4ls
7831798,0,t1_d3wbf69,Oh ,kpics,d3wd10n,1,t5_2u4ls
7862958,0,t3_4mzzk1,at first wasnt sure about losing the red hair but i have come to adore her current hair,kpics,d3zv981,4,t5_2u4ls
7901049,0,t3_4nh21q,Something something take me Choa Im yours!,kpics,d445hjl,2,t5_2u4ls
7909738,0,t3_4nlltg,Goddamnit Momo,kpics,d454o39,3,t5_2u4ls
7982184,0,t3_4okbaf,Source,kpics,d4d9tyy,1,t5_2u4ls
8141592,0,t3_4qoqjx,She cant be prettier.,kpics,d4v8szq,1,t5_2u4ls
8141601,0,t1_d4umrjb,Sowon is my.. No room for the other members. ,kpics,d4v8ug4,1,t5_2u4ls
8159480,0,t1_d4xg28e,Girls Day,kpics,d4xheon,4,t5_2u4ls
8177697,0,t3_4rbl55,She was pretty hot in the video with Psy!,kpics,d4zrfof,2,t5_2u4ls
8187972,0,t3_4rfv0f,Take this kiss upon the brow!And in parting from you nowThus much let me avowWithout Sana life will fadeMay it be an empty charade?You are not wrong who deemThat my days have been a dreamYet if hope has flown awayIn a night or in a dayIn a vision or in noneIs it therefore the less gone?All that we see or seemIs but a dream within a dream. Edgar Allan Poe,kpics,d511qzq,7,t5_2u4ls
8208362,0,t1_d534e7l,Heechul is the female perfect version of Heechul though,kpics,d53lm2t,15,t5_2u4ls
8247697,0,t1_d58hfz5,Wait... is Sana in episode ???,kpics,d58ine3,2,t5_2u4ls
8263287,0,t3_4smt6d,Bonus outfit colors ,kpics,d5agvj8,7,t5_2u4ls
8273389,0,t3_4ssalh,Fancam from same stage ,kpics,d5bqdoj,1,t5_2u4ls
8293079,0,t1_d5e6ojp,Lmao oops,kpics,d5e700m,1,t5_2u4ls
8328756,0,t3_4tmv6p,Boner,kpics,d5ined2,0,t5_2u4ls
8332641,0,t3_4tna7u,we need source UU,kpics,d5j4vyl,2,t5_2u4ls
8384815,0,t3_4ug8al,hank you for submitting! Unfortunately your submission has been removed for the following reasons The image you posted does not comply with our quality guidelines. Please check the sidebar.If you have any questions send us a modmailmessagecompose?toFrFkpics.,kpics,d5pnf5a,1,t5_2u4ls
8393578,0,t3_4ufcdg,Honest question rather than a single banner for each month why not have a rotating bunch of banners that can be added to? I wouldnt mind seeing different groupsartists represented whenever I visit the sub. The kpop sub does it nicely with album artwork and MV stills.,kpics,d5qqt59,11,t5_2u4ls
8400527,0,t3_4uo4nv,Round spectacles Taeng and now Irene. Bless ,kpics,d5rm1ui,2,t5_2u4ls
8415547,0,t3_4uukzw,,kpics,d5thj8k,2,t5_2u4ls
8470610,0,t3_4vnkn5,So I met Twice at KCON and did the high five thing with them. They looked great... about what I expected... except for Sana. More beautiful in person. Especially when she looks at you her eyes have a powerful intensity.,kpics,d60d74n,11,t5_2u4ls
8524150,0,t3_4whugd,,kpics,d672xb6,2,t5_2u4ls
8530116,0,t3_4wki7x,Do you remember the first time you stayed over at a friends house and you missed your mom or dad? Do you remember the joy it gave you to see them the next day or after the weekend?That is what it feels like to see Sana. A rush of infinite joy and security that encapsulates the heart and reminds you that love is eternal. That there is hope. That without Sana there is no life...,kpics,d67ttzs,3,t5_2u4ls
8559032,0,t1_d653j4t,Links are down. Does she have a personal account or were these from IOIs?,kpics,d6bgezw,1,t5_2u4ls
8570240,0,t3_4x3xj4,just minathe OTHER mina needs to call herself something else,kpics,d6cv0vm,8,t5_2u4ls
8613900,0,t1_d6ibmyj,,kpics,d6ic2eh,12,t5_2u4ls
8675657,0,t3_4ypr8i,More of thissource would be appreciated that outfit is great,kpics,d6q2w89,2,t5_2u4ls
8682838,0,t3_4yt2qp,heart stops,kpics,d6qzad7,3,t5_2u4ls
8777085,0,t3_50bx3h,Thank you for posting! Unfortunately your post has been removed for the following reasons Photoshoots should be posted as a whole set.We are aware this is not in the current rule set but this is to reduce the clutter and oversaturation of single idolsgroups when photoshoots occur.,kpics,d72sy71,1,t5_2u4ls
8802679,0,t3_50naqf,Cant wait to see her performance once ISAC comes out lt,kpics,d75ynm7,2,t5_2u4ls
8807056,0,t3_50p3al,removed,kpics,d76hlkt,1,t5_2u4ls
8816104,0,t3_50ws6b,Im ready,kpics,d77kqq0,7,t5_2u4ls
8826177,0,t1_d78rxy1,The point is that this subs feed is always being overlysaturated with that and youre knowingly contributing on top of you purposely getting my post deleted. ,kpics,d78s8qq,-8,t5_2u4ls
8857919,0,t3_51jp0a,Wooo Apink comeback at last! love the sub header btw ,kpics,d7clhpy,4,t5_2u4ls
8862624,0,t3_51lsce,If this doesnt become the subs Top Post there is no justice.,kpics,d7d5vaw,10,t5_2u4ls
8863313,0,t3_51lsce,Are these scans from the photobook that came with her album?,kpics,d7d8umv,2,t5_2u4ls
8868219,0,t3_51poju,deleted,kpics,d7du371,1,t5_2u4ls
8885088,0,t3_51yh7z,S,kpics,d7fv1r8,2,t5_2u4ls
8905704,0,t3_527ov7,god bless,kpics,d7ic4o9,2,t5_2u4ls
8933970,0,t1_d7kzxs2,Word.The boys are hot too. And yes Im a guy D.,kpics,d7lqbwy,1,t5_2u4ls
8938131,0,t1_d7lt8w6,Nope shes in the outfit for DIAs latest comeback so it cant be Sunmi. ,kpics,d7m8c54,1,t5_2u4ls
8946818,0,t1_d7n9t7a,,kpics,d7n9xg9,6,t5_2u4ls
8952815,0,t3_52wxsu,god bless,kpics,d7nztpf,10,t5_2u4ls
8956309,0,t3_52wnga,Eunha is so cute she makes a baby deer look like a pile of shit.,kpics,d7oex58,8,t5_2u4ls
8963668,0,t3_53104v,She stopped all of her momentum before throwing the ball.,kpics,d7paqhn,11,t5_2u4ls
8963765,0,t3_52zjdd,A .,kpics,d7pb5n6,3,t5_2u4ls
9006307,0,t1_d7u84tn,I believe thats Doyoung another Main Vocalist of NCT. ,kpics,d7uf17h,1,t5_2u4ls
9006994,0,t3_53l8a3,I wanna try it too. ,kpics,d7uhzws,1,t5_2u4ls
9017348,0,t3_53rpmv,lt,kpics,d7vqtg6,1,t5_2u4ls
9168500,0,t3_55w64b,source source ,kpics,d8e6b1u,2,t5_2u4ls
9198904,0,t3_56a2nc,Day is complete,kpics,d8i11r7,3,t5_2u4ls
9249533,0,t3_572fzw,Yes I missed you,kpics,d8og2ci,4,t5_2u4ls
9279111,0,t1_d8r5m41,Rice Cake to a westerner usually implies a very different snack. To me before my exposure to kpop and Korea in general it meant a dry crispy flavorless disc.,kpics,d8s701c,1,t5_2u4ls
9312041,0,t3_5807jl,Thank you for submitting! Unfortunately your submission has been removed for the following reasons All images must have at least  pixels width  height. Single images must be directly linked. No imgur album links for single imagesPlease read the submission rules in the sidebar before you post again.If you have any questions send us a modmailmessagecompose?toFrFkpics.,kpics,d8wdber,1,t5_2u4ls
9317086,0,t3_582ydp,Finally Sana is gaining weight around her face.,kpics,d8x0c0i,9,t5_2u4ls
9342885,0,t3_58fpte,wrinkly upper ankle wouldnt bang,kpics,d90a09j,-7,t5_2u4ls
9345031,0,t3_58fpte,source?,kpics,d90jspf,5,t5_2u4ls
9372131,0,t3_58eemh,The  second limit is really suitable here...but probably wouldnt fly at rHighQualityGifs or similar subs for example.,kpics,d93zg1q,3,t5_2u4ls
9382733,0,t1_d95bslu,Ups missed it. Going to post  today.,kpics,d95bt0f,1,t5_2u4ls
9383979,0,t3_5948r0,Your submission was automatically removed because your account is less than  days old. This was put in place to prevent spam. You are free to return and post once your account is  days old.I am a bot and this action was performed automatically. Please contact the moderators of this subredditmessagecompose?torkpics if you have any questions or concerns.,kpics,d95hh6u,1,t5_2u4ls
9404719,0,t3_59fnar,Thank you for submitting! Unfortunately your submission has been removed for the following reasons The image you posted does not comply with our quality guidelines  vjgr  rnap.,kpics,d9844v8,1,t5_2u4ls
9430538,0,t3_59tr9c,I have a surfboard with more curves ,kpics,d9bdvop,-21,t5_2u4ls
9454692,0,t3_5a67fb,Minarrrr,kpics,d9eg6mt,3,t5_2u4ls
9461772,0,t3_5ac86j,,kpics,d9fchdw,6,t5_2u4ls
9473794,0,t3_5aj3ow,Thank you for submitting! Unfortunately your submission has been removed for the following reasons All images must have at least  pixels width  height.However I found a higher resolution of this picture that meets our requirements that you can post. Source  Link ,kpics,d9gulip,1,t5_2u4ls
9602773,0,t1_d9vfcf3,AMG INORITE,kpics,d9wql3c,2,t5_2u4ls
9611845,0,t3_5clxle,deleted,kpics,d9xuunn,1,t5_2u4ls
9651688,0,t3_5d9l5p,,kpics,da2rr66,1,t5_2u4ls
9665678,0,t3_5dgmi8,Girls Day comeback when? lt,kpics,da4hwxn,16,t5_2u4ls
9847271,0,t3_5gadyi,This is my favorite concept. The long skirts are so elegant and beautiful. Very sneaky having those transparent straps around the heels.,kpics,dar4epy,5,t5_2u4ls
9911318,0,t3_5hdsno,Thank you for submitting! Unfortunately your submission has been removed for the following reasons This is a screenshot of an Instagram Story video.There are saved versions of this video that fans have downloaded. Heres one I found You should be able to download one of those and post a gfy.,kpics,dazgumh,1,t5_2u4ls
9920958,0,t3_5hjqp0,Stunned by her own beauty,kpics,db0q526,2,t5_2u4ls
9932691,0,t3_5hqjca,Thank you for submitting! Unfortunately your submission has been removed for the following reasons Videos should have a framerate of gt  FPS.If you know the source of this gfy we can help you to make a better version.,kpics,db296h8,1,t5_2u4ls
9947527,0,t3_5hzmz9,Her instagram,kpics,db46s5f,2,t5_2u4ls
9948099,0,t1_db42hbg,...the rest of the set ,kpics,db49gw6,2,t5_2u4ls
9959875,0,t1_db3gvku,Hey do you think you could change the title of my most recent post on rkpics? I didnt know the word Inkigayo would get cut off. Could you change it to BLACKPINK Lisa Inkigayo? Thanks!,kpics,db5sq1b,1,t5_2u4ls
10158505,0,t3_5lgg14,Thank you for submitting! Unfortunately your submission has been removed for the following reasons Dont be gross.While MV footage is fine the parts that cut into the end magnified and slowed down are unnecessary.,kpics,dbviubs,1,t5_2u4ls
10166142,0,t1_dbwbhqj,You are absolutely correct I dont know why I put it as abs LOL.,kpics,dbwdzgq,2,t5_2u4ls
10168040,0,t3_5lkrgn,lt,kpics,dbwlq5v,2,t5_2u4ls
10188074,0,t3_5lvpsy,god bless,kpics,dbyvhuu,3,t5_2u4ls
10270321,0,t3_5mv2vv,I dont get the dog vid.... what does it mean with the flashes?,kpics,dc873ws,1,t5_2u4ls
10287614,0,t3_5naw0k,Thank you for submitting! Unfortunately your submission has been removed for the following reasons This image was posted  days agomqp.,kpics,dca5o0x,1,t5_2u4ls
10325766,0,t3_5nsqs8,Whos the one to her right?,kpics,dcehe88,2,t5_2u4ls
10405954,0,t1_dcnjjly,Being sorta far away helped. It helped for that entire concert. ,kpics,dcnkz35,1,t5_2u4ls
10426790,0,t3_5pajgn,Moon Hyuna best Hyuna!,kpics,dcpy1j8,9,t5_2u4ls
10433067,0,t1_dcqi3f7,uSaveOurSeouls gave a solid list. Just wanted to add CLC  Hobgoblin,kpics,dcqnok4,5,t5_2u4ls
10464408,0,t3_5puysz,I suddenly want a sprite ,kpics,dcu8wje,7,t5_2u4ls
10646510,0,t3_5rvdnw,Chorong cant go wrong,kpics,dde3tcl,1,t5_2u4ls
10669912,0,t3_5sksp7,Rawr.,kpics,ddgir1z,1,t5_2u4ls
10675033,0,t1_ddfx338,Could you make an album for Jun Hyosung if youre taking requests?,kpics,ddh1ryo,1,t5_2u4ls
10691773,0,t3_5ss4u0,God bless,kpics,ddis026,1,t5_2u4ls
10706111,0,t3_5szn5n,pretty,kpics,ddk97lp,1,t5_2u4ls
10759069,0,t3_5tvryp,That heart attempt,kpics,ddppvll,2,t5_2u4ls
10779561,0,t3_5tx1j6,PINKY,kpics,ddru0hx,1,t5_2u4ls
10816448,0,t3_5uom1j,Those eyes are so beautiful.,kpics,ddvn28z,4,t5_2u4ls
10838266,0,t3_5uytpp,Someone photoshop this to be seethrough trousers JYP.,kpics,ddxw29q,20,t5_2u4ls
10877574,0,t3_5vdthx,Damn they did a fine job styling her after the atrocity that was Russian Roulette.,kpics,de1y0b2,0,t5_2u4ls
11049011,0,t3_5xpj0i,Can i marry her?,kpics,dekdx5w,1,t5_2u4ls
11070027,0,t1_demqcm4,Seolhyun.,kpics,demrzmu,5,t5_2u4ls
11117575,1,t1_des46uu,deleted,kpics,des626q,0,t5_2u4ls
11197817,0,t3_5zuxss,god bless,kpics,df19c3h,3,t5_2u4ls
11200490,0,t3_5zrgdg,Love the dance break!  ,kpics,df1k8ak,1,t5_2u4ls
11237844,0,t3_609pmc,Best body waves Ive seen in a while.,kpics,df5skye,1,t5_2u4ls
11238165,0,t3_60dbk1,What a rebel.,kpics,df5tw04,3,t5_2u4ls
11282326,0,t3_610zsd,Your submission was automatically removed because media.giphy.com is not an approved host. Please use a suggested hostrkpicswikisuggestedhosts instead.I am a bot and this action was performed automatically. Please contact the moderators of this subredditmessagecompose?torkpics if you have any questions or concerns.,kpics,dfau2if,1,t5_2u4ls
11285779,0,t1_dfb7rgy,on another day this may have been my reply to that  xD,kpics,dfb85ww,2,t5_2u4ls
11306792,0,t1_dfdj2mr,Huh funny that you say that because it just did ,kpics,dfdlw58,2,t5_2u4ls
11315188,0,t3_61h2di,deleted,kpics,dfek45m,1,t5_2u4ls
11424873,0,t3_633e7y,she recorded the entire episode in the costume as punishment,kpics,dfqzxor,10,t5_2u4ls
11498594,0,t3_642hab,where is this from?,kpics,dfzd5up,2,t5_2u4ls
11535900,0,t3_64jkos,Forgot to button her pants,kpics,dg3lhg6,2,t5_2u4ls
11551190,0,t3_64spkl,Mina pls,kpics,dg5bwu7,6,t5_2u4ls
11553167,0,t3_64m083,Camera flash looks like Navi.,kpics,dg5jzrh,1,t5_2u4ls
11579934,0,t3_654tv3,Dear god,kpics,dg8lboh,2,t5_2u4ls
11594320,0,t1_dga0v34,Ah i see. Thanks!,kpics,dga83kj,2,t5_2u4ls
11602050,0,t1_dgaurns,Theyre  dollars. Pretty much a steal for designer shoes.,kpics,dgb3nvl,5,t5_2u4ls
11616488,0,t1_dgcqh1u,Could you please link the image? It has been working for the majority of the time,kpics,dgcqmcc,2,t5_2u4ls
11660128,0,t3_66clba,,kpics,dghouz7,1,t5_2u4ls
11670860,0,t1_dgiwi9d,I give you  you ask for . smh. ,kpics,dgiwowb,1,t5_2u4ls
11678989,0,t3_66jd3x,Awesome but why?,kpics,dgjtw49,1,t5_2u4ls
11731021,0,t3_677b5b,she looks unreal,kpics,dgpqpmm,2,t5_2u4ls
11745326,0,t3_67k4iq,The outfit reminds me of Selphie from FFVIII,kpics,dgrd230,7,t5_2u4ls
