,controversiality,parent_id,body,subreddit,id,score,subreddit_id
4643894,0,t1_ct8ok01,Wednesday I can begin my scientific analysis on this episode...,Shimoseka,ctfxfcq,2,t5_36yaj
4833690,0,t3_3h367r,Everything is going according to plan...,Shimoseka,cu3tqej,19,t5_36yaj
4845076,0,t1_ctgqp95,You were right Shimoneta is definitely getting more traffic regardless of the inactive admin that created it..,Shimoseka,cu59b1m,1,t5_36yaj
4937455,0,t3_3ihpwx,If were talking sexually favorite? Kosuri for me she hit a button when she told Tanu to lick her feet. Otherwise Otome. I connect with her. Gotta draw ALL the dirty things. Just wish I could draw.,Shimoseka,cugwm5y,3,t5_36yaj
5087835,0,t3_3kornu,Its about time god dammit.I now eagerly await the next episode in hopes of a smooch to seal the deal. ,Shimoseka,cuz9yxm,23,t5_36yaj
5155838,0,t3_3lkzpi,Haha that combat thigh grapple though..,Shimoseka,cv7gygp,3,t5_36yaj
6401602,0,t1_czgqrn3,I always thought she was doing that to make her hand look like a clitoris.,Shimoseka,czhapz9,1,t5_36yaj
10842353,0,t1_ddxy112,I think its from one of the manga covers,Shimoseka,ddyb907,1,t5_36yaj
11558005,0,t1_dg5q3rs,Thanks i will check,Shimoseka,dg63r9s,2,t5_36yaj
