,controversiality,parent_id,body,subreddit,id,score,subreddit_id
53491,0,t1_cekigac,In my involvement in local burner community Ive heard people use the principles to defend bad behavior in a variety of ways and a number of times especially radical inclusion where they are not contributing anything but a dissenting voice without action and yet want to be included in the most minute details of planning things. Ive quit that activity so Ive kind of gotten a bit nostalgic for the bullshit and wanted to share. ,BurningMan,cekiqdj,2,t5_2qj68
59939,0,t1_cel6fm6,Beautifully written and I agree wholeheartedly ,BurningMan,cel96ed,3,t5_2qj68
87065,0,t3_1v1eqh,This is such an amazing idea.  I cant wait to check it out on the playa!  Keep us posted!Also maybe during the day you can put a H filter on it or else project onto a screen for sunspot viewing.  It would be pretty rad to see how the sunspots move throughout the week.,BurningMan,ceocasy,3,t5_2qj68
91008,0,t3_1v49r7,spend at least one full day by yourself,BurningMan,ceosgjs,19,t5_2qj68
112079,0,t1_ceqx3hh,Awesome thanks for the reply! ,BurningMan,cer6ycg,1,t5_2qj68
208311,0,t1_cf25ziq,Thanks yayj!,BurningMan,cf264n6,1,t5_2qj68
208832,1,t1_cf287l8,No.  And fuck no.  If your sole impression of burning man is that everyone is riddled with drugs at all time get fucked and stay away.,BurningMan,cf289qn,0,t5_2qj68
224026,1,t1_cf3szq9,deleted,BurningMan,cf3ymv5,2,t5_2qj68
264698,0,t1_cf86ucy,Im just worried about the amount of stuff i have to bring and flying and taking the busi feel like i would take too much stuff  Im just really kind of confused thats why i thought driving would be a better idea ,BurningMan,cf871yc,2,t5_2qj68
323343,0,t1_cfd74jn,glad im not the ONLY person that thought this lol. makes me feel a little better lol,BurningMan,cfea9vz,1,t5_2qj68
356087,0,t1_cfhc9c1,They would have made tens if not hundreds of thousands because YouTube shares advertising revenue with popular videos.,BurningMan,cfhob1g,2,t5_2qj68
374325,0,t1_cfjjcck,Its a possibility. I dont know why this even got as much attention as it got.Apparently it just requires a signed and dated letter from the parents.Why not be safe instead of risking being turned back for something so little.OP didnt mention anything about hisher parents not wanting himher to go. So it really shouldnt be a problem.,BurningMan,cfjkb3s,4,t5_2qj68
382349,0,t1_cfkaxj3,Im aware  thanks for your advice! I know of a trail that is right up against Yellowstones petrified forest and there is a creek where a ton of petrified wood collects thats just off the national land and my moms friend said its legal to take from there.  ,BurningMan,cfke961,1,t5_2qj68
384118,0,t1_cfkk57v,gt Do you have any evidence of that or are you just repeating what the Org said?In  my entire network of friends got tickets at or below face value few through individual sale mostly through directed group sale through STEP or resale. Nobody was unable to go because they couldnt get a ticket sample size  burners. In  I didnt get lottery somewhere around half our group got tickets but many people paid as much as .STEP works. Directed Group sale works. Burner profiles work it at least gives the Org the opportunity to kick out known scalpers and prevents the DDoS effect some when ticketing opens. Buying tickets for an event like this is never going to be a fun and pleasant experience so I am all for the leastbad system.,BurningMan,cfkkuui,3,t5_2qj68
420047,0,t3_1ytb6e,There was soooo much stupid on that page I couldnt stop laughing.  I took away from it that BLM are actually the bad guys and fucked up the burn .  But I got that from that article so Im sure thats crap too.  Im not surprised. ,BurningMan,cfoaxnt,2,t5_2qj68
421514,0,t1_cfo4w8t,The thing is too.... even if you set up camp by yourself you end up meeting the folks next to you. Im not advocating either way Im just saying its a friendly place. When you arrive to put up your stuff say hi to the folks next to you before unloading. See what theyre up to to get a good idea of what youll be next to all week. not that youre guaranteed peace and quiet anywhere but still. I bet that anyone who was next to you who realized you were there for the first time and by yourself would be friendly as hell.  Thats sort of the ideal of burner culture at any rate and I find that most people are into it. ,BurningMan,cfogeit,2,t5_2qj68
430892,0,t1_cfpf7k5,I know probably half a dozen people who didnt figure it out. They generally missed the registration window or didnt understand that creating a profile wasnt the same as registering. Theyre not all flakey artists either  engineers social workers etc.I agree that its hard to imagine but I have seen it with my own eyes.,BurningMan,cfpfdmk,-2,t5_2qj68
430964,0,t3_1z0p70,I was done inside of  minutes!  Newwww Record,BurningMan,cfpfnb0,1,t5_2qj68
431075,0,t3_1z0om2,NYC. hit the button right at . ,BurningMan,cfpg269,1,t5_2qj68
438328,0,t3_1z1zfm,I had zero problems. Preregged created a ticket fly account matching burner profile email  had tix at . ,BurningMan,cfq74q2,1,t5_2qj68
439289,0,t1_cfq029z,And my pitchfork...,BurningMan,cfqapmr,2,t5_2qj68
439649,0,t1_cfpihaa,Not frowned Sell them to me!,BurningMan,cfqc1xc,1,t5_2qj68
439842,0,t1_cfpla5a,The problem with doing that is even if you report the ticket and they void it they can still sell it to another person who will then have said ticket show up to the gate and be turned around.  Good way to ruin someones entire summer by doing that.  You dont end up fucking the ticket seller they still get their money.  The Burner is the one who eats shit in the end.I could not even imagine driving  states away with a  rented vehicle and  worth of supplies to be turned away at the front gate.... ,BurningMan,cfqcrre,5,t5_2qj68
442650,0,t1_cfq9hpl,This is not exactly true. There is a tower with real flight control. The strip is well prepared. Commercial flights go in and out and they are professionals. However it is a dirt strip there is a lot of traffic and it is Burning Man so it is not risk free.,BurningMan,cfqn8z8,3,t5_2qj68
449390,0,t1_cfqsl00,also was just chatting with someone who has even more experience with hauling things out there and it seems that this ticket for driver thing is actually relatively new. they actually used to just have the driver leave a credit card or other collateral so my question is why the change  mr mctosserson if you are so in the know,BurningMan,cfrcehr,1,t5_2qj68
467265,0,t1_cfsqoi7,gt There is no where else on earth where a  year old kid can safely drive a car for several miles. They have been highly assisted but loved the experience.Are you talking about art cars? Im pretty sure its illegal for a kid to be driving one. Art car drivers must have a valid drivers license. Sure you can probably get away with it without getting caught but you could probably get away with your kid driving around an empty parking lot too. I hope the entire art car crew consents to the risk of impoundment that youre subjecting them to. Burner parents have a reputation of putting their own and their childrens enjoyment above the common good. Youre not helping dispel that stereotype.,BurningMan,cftdoae,3,t5_2qj68
472121,0,t1_cftwq0w,Try going to  and search for the trademark Burning Man.,BurningMan,cftxl49,2,t5_2qj68
477363,0,t3_1zji1p,Last year I was concerned a little bit about theft but nothing happened.    The best advice about bikes is to add a BIG obvious marking on your bike. I didnt and it sometimes took be almost an hour to find my bike in a sea of parked bikes.,BurningMan,cfuj1yu,1,t5_2qj68
489841,0,t1_cfvsifq,,BurningMan,cfvy5hs,1,t5_2qj68
507565,0,t3_1zsnlh,Whats it take to be part of their camp do they take pilots. Some day I will have AFF certs,BurningMan,cfxyoe0,1,t5_2qj68
508907,0,t1_cfy43ca,Fuck off.,BurningMan,cfy466v,4,t5_2qj68
520197,0,t1_cfz7rb9,If you click the link that leavesandsmoke posted it said that itd be okay to show up with valid will call confirmation.,BurningMan,cfzefne,1,t5_2qj68
542448,0,t3_20cj4u,Wait why dont traditional walkietalkies work?  I was planning on using them for my virgin burn.,BurningMan,cg1xl5p,2,t5_2qj68
547545,0,t1_cg2amca,what kinda preservativeass food do you eat?,BurningMan,cg2igcf,1,t5_2qj68
565980,0,t3_20kmfy,A couple years ago I had one where the playa was offlimits so everyone decided to hold Burning Man in the parking lot of a strip mall. It was very disappointing but we all managed to get some entertainment out of breaking into a chiropractors office after hours and running up and down the stair a bunch.,BurningMan,cg4lvlh,2,t5_2qj68
575718,0,t1_cg5loyh,Possible. But it will be last minute. Its just too early right now. ,BurningMan,cg5ppcc,1,t5_2qj68
601474,0,t3_210xds,Make your own using glow in the dark paint and if you want to go really crazy add a little elwire or UV Leds. UV makes glow paint go nuts.,BurningMan,cg8n35s,0,t5_2qj68
607960,0,t1_cg9dg5s,Did you read my request for discussion or just take it as a complaint and kneejerk start reacting?,BurningMan,cg9dm2o,2,t5_2qj68
612233,0,t3_210xds,Easy way to test if this would work get some retroreflective tape such as by stealing a traffic sign take it out to the playa and see if its bright enough. Itd probably be about as bright as Lumicord  dont believe everything you see on Kickstarter.,BurningMan,cg9v2np,1,t5_2qj68
622705,0,t1_cgax53o,When I was eating sugar I really loved vitalyte for electrolytes. I found it to be by far the best. And their fake grape flavor is fabulous! Ive used it during marathon training too,BurningMan,cgb1vxi,2,t5_2qj68
657251,0,t1_cgbgyns, oz nalgene. My first year I brought a stainless steel camping cup with no lid  which I attached to the outside of my pack with a caribeaner. It was a sticky mess of mud and hell every time I left the tiniest quartersip of cocktail in the cup which apparently Im prone to do. Now I am a big believer in the tiny nalgene.  or  oz. Lid stays tight so you can take drinks to go and the bottle is basically indestructible so you dont have to worry about it breaking or spilling. ,BurningMan,cgez9b9,2,t5_2qj68
676831,0,t3_21uzxa,x L or similar sized water bottles with carabiners on my belt or in bike rackbag.  I also have a L Camelbak HAWG NV but I rarely use it.  Last year I had a cheap spring top water bottle because I liked the one handed open amp drink but the drinking nozzle was small.  I recently got one of these and it is the best!  I plan on getting a few more.Thermos Intak Hydration Bottle      Also for my Bar cup I have a Camelbak Better Bottle Classic .L with carabiner onto my belt.  ,BurningMan,cgh7fdm,1,t5_2qj68
678604,0,t3_21a4gh,Haha great replies from everyone! Mostly I am hoping to go have fun  I was just told by many in the Valley that there was a lot of stuff at BM which would be relevant.Thanks for the feedbackS,BurningMan,cgheord,1,t5_2qj68
682910,0,t1_cghw2h4,It is a rum label dude.  It is cool.,BurningMan,cghwc4n,2,t5_2qj68
688471,0,t1_cgij0sp,So they should have just forgone the event and then made a kickstarter to Support the XXX Fire Enclave and Camp Zooms Blahblahblah Project. Then itd be totally cool right? Sure seems like thats the gist of things around here. Begging for money on rburningman is fine but dont you dare throw an event with money involved! noooooooo!,BurningMan,cgij44q,1,t5_2qj68
688994,0,t1_cgii0sh,Man you really hate fundraising dont you?,BurningMan,cgil978,1,t5_2qj68
696208,0,t1_cgist2t,There was AmA with him not too long ago,BurningMan,cgjeszm,1,t5_2qj68
696875,0,t1_cgjfg6h,I have been reading the feedback.  And I appreciate it Ill bring this conversation and perspective to the crew for discussion.I appreciate you being able to offer an adult criticism also using reason and personal perspective.  It is important for us to take a look at the community and how our fundraising efforts may effect it.  So again thank you for using your words.,BurningMan,cgjhjdc,2,t5_2qj68
704465,0,t3_2289dn,If you dont find anyone to go with you should still go! You will find so many new friends once you get there.,BurningMan,cgkcmpd,1,t5_2qj68
704946,0,t1_cgisvk9,Thanks. Shes not even a year old yet so ultimately I think my best plan is to go with my wife or a few friends and take the little one in a few years if I enjoy the experience. As a new dad its just hard to imagine going anywhere without my daughter...,BurningMan,cgkelrc,1,t5_2qj68
705657,0,t3_228ekb,I have a shit ton of sunglasses I have rescued from work lost and found Im giving away in my give and take box ,BurningMan,cgkhitn,3,t5_2qj68
709069,0,t3_22adg4,I believe all of us outside of Silicon Valley might disagree that Silicon Valley is Burning Man.,BurningMan,cgkvhlp,15,t5_2qj68
712288,0,t1_cgkjxzb,Nice. Where do you get bulk chain that isnt super flimsy feeling? I also make shiny things out of metal and am thinking of taking some to the playa but had mostly resigned myself to cord for fear of the chain breaking and mooping my hard work...,BurningMan,cgl8nd4,1,t5_2qj68
714085,0,t1_cgl41jr,actually beer is better for hydration then straight water  ,BurningMan,cglg166,2,t5_2qj68
721323,0,t3_22ffiu,No one has heard yet any day now.,BurningMan,cgm9ndl,3,t5_2qj68
724549,0,t3_22gfaq,I would urge against buying any structure like this without seeing the quality of the poles in person. I bought a x  years ago from Harbor Freight and it had flimsy and weak poles without any snapping mechanism. Brought it to the playa anyways but we had to reinforce every connection with tons of duct tape. It held up but that was a mild year.The costco barns are just the defacto thing to get... but you can try big box hardware stores as well to see what they might have.,BurningMan,cgmmus2,2,t5_2qj68
725389,0,t1_cgmputr,I  disagree about the temple and think DPW should play freebird more often. I got shushed at the temple by a group of people while bawling hysterically about a friend that passed that year while it burned. Fuck those people if youre letting go of something and grieving you get to do that allyall be  quiet types not saying thats you can go fuck yourselves. Ill use the temple spiritually however I want to and NONE of my temple experience requires quiet.,BurningMan,cgmqaqg,4,t5_2qj68
746450,0,t3_218oq7,It really depends on what kind of lady friend you have.  If shes just your special lady friend bring a tent.,BurningMan,cgp4m2k,1,t5_2qj68
751148,0,t3_22q1tb,Disorient calls these a Low Shade,BurningMan,cgpnuax,3,t5_2qj68
798933,0,t3_23aita,Pretty spiffy! really cool towards the end when the music is goign and the room is dark. ,BurningMan,cgv3b31,2,t5_2qj68
802402,0,t3_23axcd,deleted,BurningMan,cgvhj08,2,t5_2qj68
821425,0,t1_cgxky5j,deleted,BurningMan,cgxnc7q,2,t5_2qj68
826101,0,t3_23kwmf,A LOT of them seem to rent cars. But this year the Burner bus sounds like a better idea. I might do it myself instead of making the  hour drive from Texas. Reno is a  hour flight.,BurningMan,cgy6gm2,3,t5_2qj68
842352,0,t3_23qnym,This is a trigger question for Burners. I dont really care but I think the vocal participants dont want any recording going on. Its a shame its turned out that way in my very humble opinion. Some of us may remember The Grateful Dead which not only allowed recording of their concerts but the sale of the bootleg tapes this was in the day of tapes. People sold their tapes in the parking lots outside the concerts. It was a cottage industry that supported some of the concertgoers and fostered a community of deadheads.I think its impractical to think people arent going to record things at Burning Man. People record everything in all of their lives. Expecting to prevent people from recording the events at a Burn is doomed to disappointment. If he wants to wear it its a free country. My recommendation would be a sign or some other readable note that tells people to smile and wave at his camera which takes pictures every  seconds. People who care can move or cover their faces those of us who dont care can ignore him or happily pose for the picture. That this camera is disguised gives people a legitimate beef again in my humble opinion.Just letting people know its going on seems to me to be a courtesy some would appreciate.If I were going to do this Id get a GoPro or similar camera with a second timer and an LCD that shows the photo taken so people could see pose and appreciate whats going on. Make it public art instead of surreptitious. But to each his own.,BurningMan,ch010v9,8,t5_2qj68
843628,0,t3_23s7bq,Plan only having your wedding on playa avoid bringing art pieces etc.Friend of mine brought art last year and it was not complete and was never really completed. They are a great artist but their attention was on their wedding and their art didnt look great installed and ended up falling apart on day one.,BurningMan,ch069oi,5,t5_2qj68
876528,0,t3_245uzs,For me the very best thing is a oz bottle of water with an electrolyte tab dissolved in it I use these  As well as a high protein food. Luna bars work great for me to throw in my bag and take with me. However dont get the ones with icing on them some of the chocolate flavors have this because that melts easily.As far as healthy brain function and positive mood are concerned you could try the supplement HTP. Unfortunately for me it makes me super nauseous even if I take it with food. This is a common side effect  so you will absolutely want to try this supplement at home before bringing it to the playa!,BurningMan,ch3wydm,2,t5_2qj68
882059,0,t3_247haz,Unless you have someone with early entry staking out a camp any plans on specific areas is doomed. Youll have to just drive around a general area of the city and find space.The only quiet area of Burning Man is Hushville. The rest is open season on noise at all hours of the daynight. Art cars will drive around at am blasting very loud music maybe stopping right next to where you are sleeping for an hour. Generators will be running everywhere people partying playing music walking by yelling etc. Burning Man is very noisy.The furthest reaches of the city will be your best bet for low noise but that is all relative. Generally its not very loud all the time but it will be random when it is loud.My suggestion would be to get central going out to  or  will put you way away from the other side of the city. Also the  and  radials are where all the huge sound camps are so noise will be ever present . They can be very very loud on the level of large outdoor rock concerts. Somewhere between  would get you away from that  being dead center and the furthest away from massive sound systems you can get. Except for the roving art cars that drive up and down the streets.Also generator noise is all relative. A good quiet Honda genny is vastly quieter than a cheap unmuffled monster. I run my Honda  hours a day out there and I can sleep  feet away from it.,BurningMan,ch4jkk3,4,t5_2qj68
889645,0,t1_ch5e4ak,I assumed that was comparing to music festivals but good to know. ,BurningMan,ch5en0s,1,t5_2qj68
900778,0,t1_ch6o77f,Well...at this point I work both events. Have you been to BM.  Just want to know if I should relate it to that or what?,BurningMan,ch6o95p,2,t5_2qj68
905523,0,t1_ch3xxpd, nothing either,BurningMan,ch77p2h,1,t5_2qj68
930092,0,t1_cfsqmiy,No advice except to check with the NHP.,BurningMan,cha0823,1,t5_2qj68
937915,0,t1_chaor0l,People swim in lakes that contain run off from cow grazing land. I know of numerous hot springs where people soak all day in water thats come from cow grazing land. People doing it day after day without experiencing illness. Unless youre swimming in a chlorinated pool there will be something alive in the water. Just dont drink it.I suspect the biggest danger in showering behind a water truck is slipping and falling. Or distracting the driver. Could you pick up something breathing in the spray as the truck goes by? If the water was really nasty the department of health wouldnt let them use it.It would be interesting to see data on water that comes directly from the trucks. Or see stats on actual illnesses. I bet the datas out there somewhere. ,BurningMan,chaw9x2,2,t5_2qj68
959499,0,t1_chc2649,Im signing up for  transcendence sessions on the playa... just in case it takes more than one.Ill launch my kickstarter for k to manifest the support I need for it next week!,BurningMan,chdcr7q,1,t5_2qj68
967072,0,t3_2568ku,Is there a link to ask to work on the temple? Chuck worked on both the  and  temple crews and wants to do it again.,BurningMan,che7ry1,6,t5_2qj68
983656,0,t3_25c9xh,It seems like with everything I read my position on giant art gets stronger.Look it doesnt have to be that fucking big.  Huge multihundredthousand dollar temples are BEAUTIFUL!  If you can pull that off BEAUTIFUL!But it doesnt have to that.  I said in another thread that Id love to see a temple that was a  foot tall post in the middle of the playa with absolutely nothing on it.When people end up expecting art to be absolutely huge it puts artists in a bad spot.  It seems like Ross really wants to build a gigantic structure on playa.  Awesome dude I hope you do that someday but part of doing that is insuring it getting it there paying for it etc.  If you cant do that then thats okay!  I hope someday you can.In the meantime make something small with your friends and Ill come out and give you a hug next to it.,BurningMan,chg3lh6,4,t5_2qj68
985220,1,t3_25e5qt,Still working through the page but it all screams to me as either someone didnt read the contract or thought he was special so he could get the contract changed down the line.I get that the agreement might not be perfect but come on. If you dont think that your structure is going to be secure enough for everyone to use that you need someone else to help to insure it the cost of insurance isnt the issue. Edit It gets worse and worse and more flowery as you go on. I just picture someone with a Chong voice screaming You cant own art man. And theres another point he makes about intellectual theft without proper attribution. Like somehow the BOrg is going to get away with claiming that Larry Harvey designed and built the thing without any help.,BurningMan,chg9zqr,-3,t5_2qj68
999798,0,t3_24wr4n,There are several motels around the Flipside campsite. ,BurningMan,chhxnvq,1,t5_2qj68
1001223,0,t3_25k87f,FYI this post is probably going to get savaged by this community for offering exclusionary onplaya perksgt We will host a private disc golf tournament for you and ten friends on the playa! Caddies provided to bring you aiming juice!We dont cotton to that around here.,BurningMan,chi3hzq,8,t5_2qj68
1006528,0,t1_chgac0t,The Temple was definitely one of the main things that hooked me. My SO was going through some heavy stuff and she left items there to be burned. It helped. Every year I feel an almost overwhelming urge to cry. The only way I found to fight that was to volunteer on building the thing. I did  years I worked on Flux and I found balance.,BurningMan,chip7o1,2,t5_2qj68
1010702,0,t1_chiml93,Great idea. But if people use their phones as cameras its not too difficult for people to burn through those too.,BurningMan,chj6aee,2,t5_2qj68
1057039,0,t1_choemoh,Thank you.I have posted a few more details to this account on our website.Slightly edited for languageAs for...The schism due to disagreements too complex to delve into on my phone mentioned by Frankie Benjamin...The ugly truth is that women were approaching me about being raped by a man who showed up on the scene of one Burner Group in Vancouver. They turned to me for help and I asked for my peers to respect their privacy and just watch the guy.But there was little accountability because we were not a formal organisation.He was a genuine asshole.This was all confirmed to me by Police who later contacted me for assistance in an investigation involving a child and allegations of inappropriate sexual behaviour around that child. I connected them with the people hed assaulted they were terrified of him.I could not in good conscience contribute my good will that people trusted and respected at that time to anything he was involved in. He was using that trust to take advantage of very good women and new people who felt on the fringe of this thing that was becoming a scene.So Burn BC was formed to offer accountability.But some people who this fellow had embedded himself with could not participate with Burn BC.I think that might explain this ugly period of our Vancouver History that I have long since put behind me with a clear conscience.Peace.Napalm Dragon  ,BurningMan,chofuhs,2,t5_2qj68
1059986,0,t3_1z0vsn,How do I find my local community?,BurningMan,chorwjh,1,t5_2qj68
1093835,0,t1_chsl1zc,I precook my bacon. Pounds and pounds of it. People mock me until  am and they have the postacid munchies.,BurningMan,chsmfsu,11,t5_2qj68
1099835,0,t3_26pqo1,I havent been to the main burn but it was kind of disappointing leaving PDF this past weekend. Everyone at a burn is so welcoming and awesome.,BurningMan,chtb1ht,7,t5_2qj68
1135088,0,t1_chvy0hm,I am man. Got a drink and a smoke in my hand now.,BurningMan,chxb2sp,0,t5_2qj68
1147827,0,t1_chynpv0,Up in Oregon alas but thanks for the offer! ,BurningMan,chyqrtc,1,t5_2qj68
1161052,0,t1_ci07z9f,,BurningMan,ci08j5u,3,t5_2qj68
1168112,0,t1_ci0thf2,Eh... While we can administer albuterolAtrovent for an allergic reaction its way down the list. Diphenhydramine and epinephrine are the first line for allergic reactions. But no the rescue puffers arent really meant for allergic reactions. My point was that if she grabbed her inhaler and it worked its not a systemic allergic reaction and is most likely respiratory in nature.Either way playa dust isnt going to trigger a shellfish allergy.,BurningMan,ci116tj,5,t5_2qj68
1176320,0,t1_ci1hv01,deleted,BurningMan,ci1yfcl,1,t5_2qj68
