,controversiality,parent_id,body,subreddit,id,score,subreddit_id
8194526,0,t3_4riwlf,So I am thinking about transdimensional travel mechanics. Specifically I am looking for general inexploitability.It has to be something that is difficult to build not so easy that eventually a car factory cant simply build and mass produce yet built by shipyards. It also should not be easy to mount an invasion or use it as a poors man teleporter and so on.One thing I did think of is to have the transdimensional machines navigational capability tied to the main protagonist as a unique ability. Only individuals like him can travel to anywhere in the multiverse at any distance in any dimension or use it as a poors man teleporter.To some extent he could show others how to travel the multiverse even building technological devices to allow navigation but its either impossible or required a really long time to unlock all of his secrets as a person with transdimensional travel. The other approach I have is that the TD drive only cross the dimension next to it. If it open a gate on Earth to another universe like our its going to open up where Earth would be.  Though I supposed you could open up to a universe where there is no Earth. I wonder what effects it would be? I suspect it will be exploited for all its worth.Then theres the cost of building a TDM. I dont want it to be too casual to the point that people can just buy a car off a parking lot and use it to travel to other realities like nobodys business. It should cost about ten million dollars the price of a container ship or is at least as expensive as an Abram tank. million dollars per unit.  There may be other methods of transdimensional travel that isnt so expensive but at no point that people should be able to casually explore new universes. This also make it easy for me to write stories since I dont have to worry about contacting new civilization all the time.Limitations is also a good way to add complexity and plot tension. Maybe there should be chokepoints that allow easy point of entrance for transdimensional travelers but its otherwise difficult to travel there otherwise? ,rational,d51v8y8,1,t5_2rdak
8338466,0,t3_4tqjmh,deleted,rational,d5jv2ag,1,t5_2rdak
8339616,0,t1_d5jzmk6,Yeah thats what I thought too,rational,d5k08em,1,t5_2rdak
8348096,0,t1_d5l0jpi,gt Except why would Red Robe let Zach humiliate him at the start of every month?A smart one probably would to hide in plain sight. It would also be a good way to test Zachs progress while holding back in fight so that in the real world Zach loses on day . ,rational,d5l2cha,2,t5_2rdak
8358884,0,t3_4u36se,Anyone here following the Alderamin anime?I have been finding it surprisingly good it started with the pattern of a knowitall womanizing MC but the quality of the production have been surprising and the female MC has shown some promise.Moreover episode  I think had some of the most nuanced and neutral representations of warfare.So hopefully it will keep to these aspects instead of focusing on the typical approaches such animes take..,rational,d5meuz0,2,t5_2rdak
8361078,0,t1_d5mi0pv,gtA comic about the dangers of tribalism and identity politicsSomething thats been making the rounds recently is how political identity ties into dating the gist of it is that people are unlikely to try dating people with different political beliefsI could see how this would affect online dating if you see in someones profile that theyre a Trump supporter thats a semantic stopsign to cease being interested in them.In person though is tribalism anywhere near as strong? I cant remember the last time someones political beliefs actually shifted my opinion of them strongly most people defend their beliefs logically and I dont end up respecting them less. If anything for the last couple people Ive met who had very different political beliefs but were of similar age etc. digging into their embedded beliefs made me more interested in them and afterwards I had a stronger connection than I believe I would have otherwise.,rational,d5moqc5,3,t5_2rdak
8437028,0,t1_d5w4c9b,gt Im interested to know what are some of your favorite comedy movies and books? How would you compare them?I bother to seek out neither literature nor video thats focused on humor since Ive had such lackluster experiences with the genre. Off the top of my head I remember finding particularly funny the Harry the Hufflepuff series Harry Potter and the Natural  and Seventh Horcrux as well as a few short Friendship Is Magic crackfics in literature and House many The Three Stooges short films and some Laurel and Hardy short films in video. Out of that list Id very tentatively estimate that the The Three Stooges films are the funniest and Seventh Horcrux is the secondmostfunny.,rational,d5w624b,1,t5_2rdak
8491731,0,t1_d627hip,Youre right but Im still happy I posted this.,rational,d630jqv,1,t5_2rdak
8500713,0,t1_d63kv7r,Ive had a fair amount of time to develop them since then. gt,rational,d6453zt,1,t5_2rdak
8519329,0,t1_d65jjzo,Its a lot of fun  but for me the best experience has been The Night Cafe exploring Van Gogh from an otherwise impossible perspective.Or The Brookhaven Experiment which is on an entirely different level to any horror movie... making for seriously useful training to keep a cool calm detached mindset in any real situation.,rational,d66h6cu,2,t5_2rdak
8523414,0,t1_d6624lb,So I hear you guys like UNSONG,rational,d66zlnb,3,t5_2rdak
8534210,0,t1_d68blw3,Or never went anywhere,rational,d68cb96,3,t5_2rdak
8739421,0,t3_4zp1g2,Recently Ive been going through Catharine Asaros Skolian Empire books. Ive got mixed feelings that can be summed up as . These books are not rational in any way or fashion. The books are predominantly romances. I think the genre it falls into is probably closest to Romantic Fantasy as defined in this Tumblr post It feels like an evolution of the sort of things that Mercedes Lackey or especially Anne McCaffrey were doing. Its much better than McCaffreys stuff... but thats sort of damning with faint praise. Theres a bunch of reversing gender roles stuff in her work in various ways but its mostly not done in a particularly interestingcleverplausibleunique way  Ancillary Justice for example was way better for this kind of thing and many other authors have done gender role reversal stuff in better ways than Asaro.The Skolian Empire books were advertised as a hard sci fi setting in the place I originally saw the recommendation for them and also are so advertised on Wikipedia in a few places but I feel like thats mostly a lie. It feels like the majority of it is just using some trappings and names of sciencey things without really thinking about them or considering them in much or any detail. Its full of soft scifi conventions and devices and the occasional hard scifi detail doesnt really make it feel super plausible. I like hard scifi and I like soft scifi but this mixture of the two is less appealing in some respects. Looking at the authors background I would have thought that most of the issues I had with the books science background stuff would be things she would specifically have a ton of background and experience so I just dont even know. In a few of the books there is actually quite interesting and cool science fiction stuff at least loosely based on actual science that is unique and interesting but in a ton of it theres just a lot of space magic with the occasional sciencey sounding word. I feel like Asaro underuses a few of her space magic plot devices really poorly too in ways that would take a really long essay to go into for example she completely failed to sell me on the vital utility of the telepathpowered instantaneous FTL comms communication system that so much of her worldbuilding and society was pinned on.Relatedly there are a number of really weird retcons and totally unnecessary plot holes that happen in the books that overall annoy me. I think the books were probably not written with the expectation that someone would marathon them in a row sequentially and read more than a dozen of them in a week. For one example that wont spoil much in one of the novels a big deal is repeatedly made of how for a barbarian society from a world devolved to primitism that has no axial tilt and a very regular orbit they had lost all notion of years and didnt use them at all to gauge maturity and in spite of the main character coming from a society which retained them they were never able to think in years or really understand the point of years. Then a couple books later still on this yearless world the same barbarian character and everyone else in their barbarian society is constantly using years and thinkingtalking in years when justifying that another character is too young to leave home and attend a military academy or old enough to wed someone or whatever. Its not rare for details to feel majorly inconsistent between books.A more vital irritation with the books is that they were written with a nonchronological order in such a way that reading in publication order you get spoiled for the ending and conclusion of one book by the other books fairly often. Youll read a page summary of how X met Y and fell in love or whatever in book Z and then have an entire book of it happening later on as book Zn. This is less a concern in the romance genre than in many other genres but it feels like a really odd decision  a couple of these review history of some side character books are sort of OK in their own right but add basically nothing to the overall plot and I spent much of them less interested  they were just filling in the details when other books already let the reader know how everything came out in the end which feels sort of pointless.A huge amount of the books backstory and background make very little sense to me and it feels like the social history the economic history and the political history of the various polities in the books make very little sense. It feels like the author did a very halfassed job of the background history in these books. ,rational,d6y2tc4,2,t5_2rdak
8741053,0,t1_d6xrd5s,Why would you ever care about things you hear on LessWrong when its basically a personality cult for a guy who wants to talk about AI but has no idea what hes talking about?,rational,d6ya7bc,-5,t5_2rdak
8741527,0,t1_d6ybkcz,I disagree. Everywhere except the inside of the fountain is flooded is not a random extra its a valid interpretation one of many of the opposite of a fountain.,rational,d6yccjo,8,t5_2rdak
8799441,0,t1_d74eftn,deleted,rational,d75kmul,1,t5_2rdak
8865731,0,t1_d7b4ra3,deleted,rational,d7djbk1,1,t5_2rdak
8922315,0,t3_52hctq,that was amazing and inspiring. i now have the urge to go write something and I have no idea what i want to write so it probably wont get anywhere but damn that was a very enjoyable read.,rational,d7kbxxb,9,t5_2rdak
8970533,0,t3_52a0c5,This was quite good! Im looking forward to more.,rational,d7q4egm,1,t5_2rdak
8998251,0,t1_d7te7vg,gtWe see a variation of twenty points at most when we already know that IQ varies heavily due to stuff like nutrition education and financial situation. The statistics are true but there isnt nearly enough longterm data to conclude the difference is because of race and not some confounding factor.Just to be clear you dont have any issues with the findings that there are significant differences for mean IQ between racial groups just dispute that the root cause or main cause is genetic? Edit Because I think thats a safe conclusion but the issue the author was addressing was that even that conclusion isnt considered safe to discuss. Ive encountered one or two scattered papers on the topic but this aggressive post is probably the best discussion on the topic Ive seen unfortunately.,rational,d7tg7za,3,t5_2rdak
9001538,0,t1_d7trv2d,Roger. Ill look for the comic then.,rational,d7tufyt,1,t5_2rdak
9050381,0,t1_d7zjtuj,For me it becomes a lot less enjoyable to watch a series if all my favorite characters die leaving behind the ones whose stories Im not that interested in. I had the same problem with Death Note Game of Thrones and Telltales The Walking Dead. Sure the deaths provide drama. But once the drama is over there has to be something else driving the story.,rational,d7zpmr9,3,t5_2rdak
9055786,0,t1_d80bk9v,I hadnt though I really should have. ,rational,d80czsy,2,t5_2rdak
9057695,0,t1_d80l1di,gtWriting a book series on creationism for children doesnt exactly qualify as a pursuit of truth by my standards. Im sorry did I say somewhere that a scientist must devote all of his actions to the pursuit of truth? If so youre right to rebut me and I apologize.gtI mean I would certainly judge the person by his actual professional scientific achievements as far as deciding if theyre worthy of the title scientist if I knew of any. Oh okay. So you admit that you do not know anything about this mans work. He could be a leader of his field and you would not know it and would still slander him for his completely unrelated beliefs. gtBut in the absence of actual scientific results to be used for that purpose him writing books on creationism certainly doesnt inspire confidence.Its quite a leap from This guy believes something which I think is stupid! Maybe he is stupid!! My confidence has not been inspired by this fact! to gthe is not what Id qualify of being a REAL scientist.Oh an unrelated note lets return togtI mean I would certainly judge the person by his actual professional scientific achievements as far as deciding if theyre worthy of the title scientist if I knew of any. Pretending even that what youre doing isnt some tribal status dance who the exactly are you and why do you compelled to decide if theyre worthy of the title scientist ?,rational,d80l8ps,2,t5_2rdak
9070121,0,t1_d822irv,Maybe that the staffscepter ol Quatach carries was also one of them?,rational,d822yaz,10,t5_2rdak
9084183,0,t1_d82pcsv,I have a couple of different songs I have used for the alarm on my iPhone so when I hear them I think of waking up.  I would pick one of them to play up the idea to myself that I what I went through was no different than sleep just on a longer and more extreme scale...  Hopefully this would alleviate the sensation that the original me died and I am a pieced together simulacrum more designed by the algorithms that revived me than what originally organically developed.,rational,d83rrcz,2,t5_2rdak
9128520,0,t3_55auro,In the cartoon chi was brought up a lot. Chi is an energy thats projected as the elements AirWaterEarth and Fire. And their seems to be sub elements as fire benders can also bend lightning if their good enough. Maybe everyone has chi but some are actually able to use it to project it as a element. And the avatar is the only one who can project chi as all the elements. As for uses for bending their are many uses for air. For one theirs sound manipulation or Sound distortion Air benders could create compression waves to distort sound. One could create a sonic boom to stop opponents. Air benders could also alter the ambient pressure very useful for stealth. Air benders could also create shock waves by manipulating the air. By compressing air very densely you could create a bomb and depending on the circumstances fire bend.Earth could be used for sand bending. I figure a very talented earth bending can bend metal not anything about their being earth in metal or grains of sand could be out in metal.Fire could be augumented for more power. Its sub elementlightning could be used for magnetic fields running electricity through electromagnetics. With electromagnetism one could generate shock waves at best stun an opponent or fuck their eardrums.Water benders could vaporize their water and humidify the area soak or saturate it with enough moisture like a water defense where a water bender can compress the water to change its state of matter. The monks could prefer thinking more not so much about spiritually. Concepts such as mathematics science etc will be concepts that Aang will be taught.  Sokka could be shikamarulike just more eccentric. Spirits could be extradimensional alien entities or even extraterrestrial.,rational,d893tcp,1,t5_2rdak
9179617,0,t1_d8fj04t,I highly recommend reading The Righteous Mind since it does give insight into how nonrationalists think about morality and why many of them cant think about it rationally. That has huge implications for what human values really are.,rational,d8fl0l2,1,t5_2rdak
9287325,0,t1_d8s81cl,Im not sure what you mean but I think EYs point was not about whether or not the arguments of n players seem reasonable absolutely but whether they both seem equally reasonableunreasonable.His point was that if you cant distinguish a n player from a n player then you will be confused when people tell you in strong terms that the n? player is obviously better than the n? player. From your point of view both players are very smartsensibleincompetentcorrupt so you think that anyone who strongly prefers one over the other is probably engaging in confirmation bias or something because you assume that they can only see what you see.,rational,d8t8he8,1,t5_2rdak
9294976,0,t1_d8u6wo0,Agreed on all counts!For a slightly faster pace starfox is notable for very wellwritten depictions of a wizarding civil war in The Dark Lord Never Died complete Malfoy faked Voldemorts survival and used  as a checklist.  Hermione is a squad leader of the Special Police and lead investigator into corruption in the mudblood rescue squad... in Divided and Entwined ongoing Hermione is not the only muggleborn to have read history  and the writing on the wall.  A threesided civil war ensues with people making hard decisions... or easy but bad ones.  If you only read one read this  theres a clear technical improvement in the writing and arguably in characterisation.Hmm maybe Im just a sucker for reluctantbutresolved Dumbledore and competent Hermione...,rational,d8u7dpk,2,t5_2rdak
9298352,0,t3_57qc5q,An interesting read though I find it a bit contrived when a fanfic tries to solve every problem from the  books in just a few chapters.I also second the recommendation on The Arithmancer from the same author though as others have pointed out it is somewhat slow paced. ,rational,d8umsgg,7,t5_2rdak
9315450,0,t1_d8wibb2,Just go work with your mom and get a psychiatrist.,rational,d8wsvr5,2,t5_2rdak
9320693,0,t1_d8x4a48,CoCoSci or CoNeuSci?,rational,d8xgsol,1,t5_2rdak
9333872,0,t1_d8xef9j,I think you need to pad that scene out more there is a lot of Telling not Showing there when it comes to how he teaches with passion or in a way that makes you pay attention even though its the same information Iruka would have taught.,rational,d8z4xca,2,t5_2rdak
9360532,0,t1_d92i4kg,yes plz ,rational,d92ijvh,1,t5_2rdak
9375402,0,t1_d94eag2,Eh fair point.,rational,d94eczh,3,t5_2rdak
9385647,0,t1_d95blyd,gtIn Chapter  it states that the academy says they are an elite institution thanks to the excellent quality of its teaching staff so it doesnt seem weird to me.You have the choice between someone who has spent their entire life as a battle mage fighting in combat day in day out working closely with other mages to combine spells and work in coordination perfectly.Or you can have someone who teaches students at a secondary schooluniversity and has barely no experience in combat against equivalent foes by comparison has never worked in combat with large battle groups and oh wait never mind hes better than every battle mage and hes perfect for Zorian.gtAlso this is a fantasy world full of magic. As far as Im concerned some random granny of the street might turn out to be really strong and it wouldnt be to unreasonable.Strong because of having large mana reserves fine. Strong in combat? No the granny would not be capable of coordinating with others because she has no experience in a combat environment.gtIts not like all the strong talented people are going to choose the military life. I mean why should they? If Xvim wants to be a teacher even if he is better a combat then teaching that is his business.People who are good at combat go into the combat life people who dont want combat become teachers so they can rest their feet.gtWhy are some people in this world better at combat magic? Maybe because they had the right teachers were born with better talentpotential andor are more dedicated. Their is no reason why all battle mages need to be a supper skilled arch mages like Xvim.Yes of course if Im paying for an army Id hope itd be beaten by teachers from the enemy nation.gtOne thing to consider Xvim is willing to dedicate vast amounts of time to shaping exercises that most people would consider extremely boring. I imagine not many people would have that dedication.Ah well if its boring then I guess the army would never train people to do boring stuff.,rational,d95p3aa,-2,t5_2rdak
9437374,0,t1_d9bw1io,Ive hear many good things about the first book  but whats your opinion about the sequels? Are they worth reading or should I just pretend there were no followup books written?,rational,d9c94sh,1,t5_2rdak
9480141,0,t1_d9hh57x,Every second of quibbling is another dead babyIm making that my flair,rational,d9hmr1j,10,t5_2rdak
9525340,0,t1_d9n5hiq,How prominent is school in the whole thing? Id prefer a level similar to RWBY or lower dont care much for the magic school trope right now with few exceptions.,rational,d9n776f,2,t5_2rdak
9532031,0,t3_5b7in9,removed,rational,d9o0u6t,1,t5_2rdak
9534377,0,t1_d9oaunk,gt Like if we lived in a world where you could buy automatic haircut machines they would drive down the price of humancut hair until they reached equilibrium with autocut hair which we could then use as information about how much it cost to create the automatic hair cutter or at least how much it was being sold for which in a competitive market should be only slightly higher than the build cost.Or alternatively having your hair cut by a human would become a status signal and the price would go up but only rich people would be doing it and everyone else would be using automatic hair cutting machines. Or humans would stop cutting hair and change to more rewarding jobs. probably both.I guess Im mostly finding it unlikely that theres still wizards competing with house elves for menial households jobs.,rational,d9ob7o3,9,t5_2rdak
9551600,0,t1_d9q2sjr,I think you could reasonably add dancing to that list. It combines many of the benefits of physical exercise and artistic pursuits.I might be biased though. ,rational,d9qfk57,2,t5_2rdak
9589523,0,t1_d9v2sf1,The enemy is ofc also smart.As the hero is now not omniscient its possible that enemy has something he doesnt know.As the hero cant now simulate worlds in a nanosecond as a hyperbole he can have limited time to prepare.Its not about if superintelligent superheroes can do more than I allow them to. Its about if author allows them to know everything there is no story there and they could probably save everything by building a time machine and moving a pebble somewhere in the past.If the hero knows everything his nemesis has and is going to do and has already prepared for everything he has won already.,rational,d9v3rxn,3,t5_2rdak
9593511,0,t1_d9us4c2,As I understood it the community always had a lot of almostcrazy people in it from both ends of the political spectrum that the big posters kinda kept in check. Remember all the people getting angry at EY even before HPMOR was finished because they didnt think his female characters were feminist enough? That was some dumb shit. When EY and others stopped sitting around on the site all the time and started trying to actually accomplish some of the things everyone had been talking about the almostcrazies from different sides of the aisles couldnt tolerate each other and people quickly started leaving. Ive seen it in other fringe culture communities. People get hypersensitive. Emotions run high and arent controlled by normal maturity. The thing breaks up because weird people get along with other weird people even worse than normal people get along with each other.,rational,d9vlhs8,5,t5_2rdak
