,controversiality,parent_id,body,subreddit,id,score,subreddit_id
1012382,0,t1_chjcwzv,Great thanks! Yeah Borneo is not too far for me to travel to beside the orangutan sanctuary is next door too  must be so awesome for you to be involved with elephants and bears Im envious!,bears,chjd5jh,1,t5_2qmqq
1260592,1,t3_28ea4n,If you watch Some Kind Of Monster James discusses how he shot a hibernating bear in Russia fuck him and fuck his used to be awesome but now totally retarded band.,bears,cibfkfv,2,t5_2qmqq
1621847,0,t1_cjjg8qz,Thank you so much!!! It was very tense and made me very stress at times it was difficult to watch but I learned so much because in less than a months time I will be there I didnt see the footage from the video which I made the gif from another episode maybe? You wouldnt have the link would you? Thanks in advance!,bears,cjjll6h,2,t5_2qmqq
1809753,0,t1_ck78gpe,That in turn reminds me of this video,bears,ck78zu3,3,t5_2qmqq
1810569,0,t1_ck75pwb,deleted,bears,ck7ckeu,1,t5_2qmqq
3456869,0,t1_cpm6jeq,It appears that PolarGrizzly hybrids arent sterile and have even been found to breed in the wild I suppose it helps that Grizzlies and Polar Bears are much more closely related than horses and donkeys or tigers and lions diverging genetically only   years ago.,bears,cpmb4ns,4,t5_2qmqq
3526857,0,t3_30o8f2,Poor bear imagine someone ripping out all your fingernails. Fingers cross for Cholita.,bears,cpuabme,5,t5_2qmqq
3790658,0,t3_33u1ab,The moderated webcam is nice.  Similar to the Decorah Eagles Webcam.,bears,cqod5y9,1,t5_2qmqq
4426770,0,t1_csom5bf,I was there last September  was one of the bears I was hoping to see but she didnt turn up till later that month. I miss that place it was magical part of me never really left. Please share more photos!,bears,csoooyt,3,t5_2qmqq
4448650,0,t1_csrer99,I like Josie! She looks like a Josie.,bears,csrfs18,2,t5_2qmqq
4823735,0,t1_cu2cuyx,Better hurry! I think theyre only open for a few more weeks this year.,bears,cu2kkp5,2,t5_2qmqq
5042524,0,t1_cumwo5v,So crowded too!,bears,cuttcvn,1,t5_2qmqq
6111136,0,t1_cyk6wib,In Sweden now cant guarantee to see a bear in a bear watching hut! Not many bears here estimated about   but fair enough still more than Germanys  bear  RIP Bruno.,bears,cyk9uy0,5,t5_2qmqq
6170068,0,t3_402qbm,Your submission has been removed because your account needs to have more interaction with the community before posting. Youre welcome to try again once your account have accumulated more than  comment karma. Thank you!I am a bot and this action was performed automatically. Please contact the moderators of this subredditmessagecompose?torbears if you have any questions or concerns.,bears,cyqz16m,1,t5_2qmqq
6559053,0,t1_czxbzqk,Based on the Imgur comments possibly Gatlinburg TN?,bears,czxrdu0,3,t5_2qmqq
6580664,0,t3_45tc2g,Your submission has been removed because your account needs to have more interaction with the community before posting. Youre welcome to try again once your account is more than  days old and have accumulated more than  comment karma. Thank you!I am a bot and this action was performed automatically. Please contact the moderators of this subredditmessagecompose?torbears if you have any questions or concerns.,bears,czzzt40,1,t5_2qmqq
6681820,0,t3_474yet,The picture with the little blep just kills me ,bears,d0agiyv,2,t5_2qmqq
6767230,0,t3_48go7f,Your submission has been removed because your account needs to have more interaction with the community before posting. Youre welcome to try again once your account is more than  days old and have accumulated more than  comment karma. Thank you!I am a bot and this action was performed automatically. Please contact the moderators of this subredditmessagecompose?torbears if you have any questions or concerns.,bears,d0jcg1f,1,t5_2qmqq
7346068,0,t3_4fywt2,Upvoted because image.,bears,d2d744x,3,t5_2qmqq
9351165,0,t3_58krpn,Great to see but just a couple of corrections sorry for being a pedant! Theres a lot of racism towards Asia in terms of animal welfare standards so I think its important to mention its not just China which uses bear bile and many of them are not idiots or evil they just may not know the background or the all facts. The active ingredient in bear bile from the gall bladder not the liver UDCA is actually used in medicine so to say it does nothing is arguable. But as the article kind of mentions it can be easily synthesised so there is no need for bile farming to obtain it. Its important to get our arguments right and distinguish between other things such as rhino horn which has been shown to have no medicinal qualities.Otherwise great stuff and lovely video love to see such enthusiasm for the bears!,bears,d91btag,4,t5_2qmqq
9585025,0,t3_5c69gc,This is so precious the bear is just laying there like a big baby ,bears,d9ujt1r,6,t5_2qmqq
10295569,0,t1_dcapa58,At the end he explained the other photographer had been looking for bears to film,bears,dcb24gx,2,t5_2qmqq
