,controversiality,parent_id,body,subreddit,id,score,subreddit_id
10779300,0,t1_ddrsxan,maybe that is in addition. i speak from experience when i say that battleye bans people for cheating. they banned k accounts in raibow six within  weeks of launchOr maybe they can override that system and wont ban people idk. Just hope they will also ban those accounts.,TibiaMMO,ddrt1oi,2,t5_2s3sk
10783804,0,t3_5u87iy,Lol I remember Braindead and watching it as a kid yo. on VHS.,TibiaMMO,dds9re8,1,t5_2s3sk
10858984,0,t3_5v6z3i,I didnt even know this place existed! O is the upper floors with scouts a good place for a lowlevel?,TibiaMMO,de0109e,2,t5_2s3sk
10869567,0,t1_de0xxxh,its painful tasks in general are boring I think because I end up watching the numbers too much and it makes the hunt slower.,TibiaMMO,de149vr,1,t5_2s3sk
10870750,0,t3_5vdmma,Yes its possible but it will took like  min to kill it  its rly hard to  finish him when he is running away  lure him into corner and use energy bomb  to make dmg. The best tip is... just dont cancel any auto attack and make full combo arrrowexori san every round,TibiaMMO,de18nxe,2,t5_2s3sk
10906133,0,t3_5vu1ru,If u want to go to a sponsored fansite and you dont know the link go trough tibia.comgtcommunitygtfansites,TibiaMMO,de4w28d,7,t5_2s3sk
10911558,0,t1_de15nhl,I REALLY hope this means they will be working on the steam client more. I have no idea why they seemed to have given up on that it would be an absolutely massive boost to the game. ,TibiaMMO,de5g7f7,2,t5_2s3sk
10912110,0,t1_de5h5p4,thx,TibiaMMO,de5i943,1,t5_2s3sk
10924276,0,t3_5w1ri4,Old tibia was really grindy you had to kill the same monsters sometimes for weeks to be able to get to the next monster then you died because internet  years ago was shitty as hell and you lost  week of progress. The game was more solo hunting oriented being in a guild was more of a feudal system where you went together to protect you from the others. Nowadays the game is still a grind based game but you have more freedom of which monsters to hunt there are way many places and the best exp you can get are from team hunting. Death nowadays means like  hours on higher lvl of hunting when you die to monsters dying in pvp on normal pvp servers isnt almost no issue except for a bit of cash and the exp is at most  hour of lvling. Retro pvps are way more harsher than you die and lose the same things as a pve death usually the hardcore players there want to rule with ironfist the server which is harder in pvp serverI would say tibia is way more fun nowadays than in the old days the old grinding was way too mindless and boring. The pvp in tibia is something you wont find in other games the sandbox style of the game really help the player interaction in good and bad ways but it makes things way more interesting for me. Tibia has real politics where the strong get the best and try to monopolize resources enough to have much but to let something for the others so they dont riot. Being in a guild that challanges the leading guild is really a fucking cool experience you met so many cool people the leaders are usually admirable too how they mantain everybody together and plan their strategies to get your guild to be the leading guild. So many people in tibia just play to war and win the servers and then they just wait for the next war. Sorry but my post is ideas thrown together but tibia is a really unique game try picking a server with a good population and see if you like it dont judge it only on the graphics. Also for me pvp and hardcore pvp servers pvp isnt really enjoyable the real good pvp is on retros servers. Pvp servers are way too hard on pks meanwhile on hardcore pvps there is no restriction for a high lvl to kill every low lvl and empty the server. Meanwhile retro pvp servers have enough rules to protect low lvls to be killed over and over again but is hard enough to get people to be afraid of pvp death,TibiaMMO,de6rh5b,19,t5_2s3sk
10929734,0,t1_de6rh5b,You couldnt have explained better,TibiaMMO,de7bpvi,1,t5_2s3sk
10939429,0,t3_5w40h7,kkkkkkkk,TibiaMMO,de8bpxu,1,t5_2s3sk
10958572,0,t1_dea8tm5,Im guessing saying Im a mere  paladins will help reccomending tasks for me running bones will get me killed pretty quick.thanks for the quick and full response!,TibiaMMO,deaarqn,2,t5_2s3sk
10971226,0,t1_debl9ci,its rowana i didnt know it has nothing to do with it,TibiaMMO,deblrjr,3,t5_2s3sk
10976190,0,t3_5wpe91,I would go with RP overall legit solo class and they do serious work in teamhunts and a good RP is very valued,TibiaMMO,dec55rn,1,t5_2s3sk
11018893,0,t1_degxiop,Thx!,TibiaMMO,degylpf,1,t5_2s3sk
11029553,0,t1_dei5suo,oh well i hunt them by that might explain it. So you use GFBs and mas san?,TibiaMMO,dei6avz,1,t5_2s3sk
11030878,0,t3_5xhhlc,At first I actually laughed thinking that you meant the DP. ,TibiaMMO,deibpgi,12,t5_2s3sk
11092791,0,t1_dep5i46,What does that stand for?,TibiaMMO,depcw6z,1,t5_2s3sk
11106427,0,t1_deqogv2,New pally is awesome ,TibiaMMO,deqwjxk,1,t5_2s3sk
11107927,0,t1_der0blx,Also I have been playing with no lagskicks on a South American server after a season of kicks,TibiaMMO,der2o2c,4,t5_2s3sk
11122547,0,t3_5yt7nh,Theyre just very different. EK is closer to mage spell rotations and aoehuntingstyle. RPs deal a ton of single target damage and will most likely outdps any other vocation on singletarget.,TibiaMMO,desqcki,1,t5_2s3sk
11123521,0,t3_5ysgmy,nothing you can do its routing through a very long route to the server causing a large ping increase. ,TibiaMMO,desubhq,3,t5_2s3sk
11139228,0,t1_deukxna,You can buy using the market in your depot. What server are you on?,TibiaMMO,deumcar,2,t5_2s3sk
11162487,0,t3_5zdp6n,There is an ornament in the wall across from the small room with a teleport just click use on the sqm of this wall a bit under it,TibiaMMO,dex987b,4,t5_2s3sk
11180992,0,t1_dezcaq5,Were getting away from my main point but to continue yours As a rule of thumb its nearly exactly .x avas per strong ice wave. Meaning when you can use ice wave ideally you can save . turns on the monsters hit great for finishing off monsters rather than several turns of avalanching. My main point is that its ridiculous that sorcs dont have an equivalent spell to this. Example Level  ED with  ML does  average damage per ava and  average damage per strong ice wave. I dont see how you can who does not think a spell that can save a turn and a half when used ideally has a very strong place in a druids arsenal and it is balanced that druids have a spell like this in addition to all their other spells that make their vocation distinct but sorcerers lack an equivalent. YES the energy wave is better a lot of the time but what Im saying is that its not so much better than everything else druids have that their vocation is equally balanced to druids!,TibiaMMO,dezcppz,1,t5_2s3sk
11214197,0,t1_df2ky49,I used it before but I just dont wanna spend money on a third party program to be able to play a game I also pay for...its ridiculous,TibiaMMO,df346oa,1,t5_2s3sk
11227403,0,t1_df3iy28,Hm that I dont know.,TibiaMMO,df4m0tw,2,t5_2s3sk
11227854,0,t3_609qso,Typical nostalgic boy thinking that clunky gameplaycontrols of the old days was the best thing ever...Everything you say about the fear of dying being hunted fighting strong monsters is due to being a noob and also younger back then. It wont come back in the same scale not even close.... Even if you play on some  . OT belive me I tried.What was really good and will also never come back is the overall mentality of ppl playing the game more relaxed and community focused. But thats the way it is. Even if CIP let you stay doing the same old school hunting until today grinding dragons all day like you said you would still get tired of this game like so many did. And maybe come back after a pause or not like so many still do.,TibiaMMO,df4nv05,34,t5_2s3sk
11232443,0,t3_609qso,I wish CIPSoft would start experimenting with different servertypes. For example a permadeath server an old spell formula with manual aiming server slow leveling server with a lower exp coefficient and so on. There are SO many servers with barely anyone playing them. They could merge a lot of them and use the existing hardware infrastructure to host these kind of servers instead.,TibiaMMO,df56kpf,2,t5_2s3sk
11252966,0,t1_df7b6i6,Then explain it to me dad.,TibiaMMO,df7i9h7,0,t5_2s3sk
11253533,0,t1_df7j396,The guys milking it to the best of his ability. Plays adds  on his stream. Super annoying.,TibiaMMO,df7kkke,6,t5_2s3sk
11255144,0,t3_60mwmj,Well you can still add life leech OR distance imbuenments making warsinger even better with a cost for sure.I myself would rather pay more and kill things faster crit  mana  distance. The difference in profit is not gonna be that huge and killing more stuff will probably make up for it most of the time...specially if you are using prey,TibiaMMO,df7r518,1,t5_2s3sk
11266713,0,t3_60s5cd,I cant play tibia at work anymore  Installing BattlEye Service... Failed to install BattlEye Service.,TibiaMMO,df92d7z,1,t5_2s3sk
11299359,0,t3_61372q,I would choose the skill the with the best three imbuement slot weapon they are absolute king now,TibiaMMO,dfcrkg4,1,t5_2s3sk
11312429,0,t1_dfe5ger,I was getting this error as well on . I clicked on manage clients then relaunched through there and it worked ,TibiaMMO,dfe8vfm,1,t5_2s3sk
11321073,0,t3_5qh0qx,Did he ever reach his goal?,TibiaMMO,dff83jc,1,t5_2s3sk
11339738,0,t1_dfhb7u2,gtYoure shitting on the client saying its unusable when you havent used it. Thats my point.I also just want to point out that most of the people on this thread that are defending CIPs ineptitude have probably not had the chance to use a modified OTclient.Seriously people. It performs MUCH better. Im not just saying that to be a jerk it is just better period. ,TibiaMMO,dfhc8gl,1,t5_2s3sk
11352974,0,t3_620z4x,Generally EDs are more valuable for PvP mostly because of the Paralyze rune.But for MS they are valuable for Team Hunting with a full team even a  voc team because MSs spells usually cost less mana have more range and deal more damage.The dmg difference might not see very impress because EDs usually gets Magic Levels faster than a MS due to constant Sioing the EK but if u compare the dmg on a ED and a MS on the same lvl range and same ML there will be a good difference,TibiaMMO,dfiu76j,1,t5_2s3sk
11356183,0,t1_dfj6dmy,OptionsGraphicsStatusOwn character in game windowChange style from classic to HUD.,TibiaMMO,dfj7aq3,1,t5_2s3sk
11356861,0,t1_dfj59ju,Theres no way to tell if the monster loot is generated when it spawns or when it dies. However the latter makes more sense.,TibiaMMO,dfja2dh,2,t5_2s3sk
11363145,0,t3_625t89,Probably Postman Quest the length of it in itself is fucking awesome!,TibiaMMO,dfjzol7,3,t5_2s3sk
11370550,0,t3_6280wc,Haha i remember i tried this  year ago on my ipad mini  woth photon web browser usually just used it to offline train my lvl  rp and check market. But yeah  fps works,TibiaMMO,dfktwir,1,t5_2s3sk
11382666,0,t1_dfm603r,Any paladin that is not hunting with crit is kind of robbing himself in my opinion. Minimum damage on arrowbolt crits are the bees knees yo,TibiaMMO,dfm7f9s,3,t5_2s3sk
11409988,0,t3_62ueun,Well Tibia  is built using the Qt framework   which is supported on multiple platforms. I guess they chose that framework to be able to release clients for Mac and Linux. However the question is if BattlEye is working on mac and Linux. I cant see Cipsoft releasing a client for Mac or Linux if BattlEye isnt supported there. That would defeat the whole purpose of BattlEye.,TibiaMMO,dfpb5dw,1,t5_2s3sk
11430905,0,t3_635jq6,Yes we can read the Tibia front page. No need to just copy paste it into here.,TibiaMMO,dfroj39,-14,t5_2s3sk
11433866,0,t3_62yrpt,cause i always felt i could achieve so much more than i always do  thats why i am always drawn to it  every so often i take a break but i always come back cause i wanna do good ,TibiaMMO,dfs0mnv,1,t5_2s3sk
11460784,0,t1_dfv0h43,Agree everyone is expecting it to be something big. Kharsek has been followed  when he got the required level and people said he has entered the teleport only once for like  min and then left. Since then no benefit was noticed that Kharsek had been using since he entered there so I think it has to be a cool collectible item or just a message to congratulate him for achieving this goal.Just my  cents! ,TibiaMMO,dfv2md5,4,t5_2s3sk
11461879,0,t1_dfv4ajv,Thats for me the best tibia video of all time,TibiaMMO,dfv73eg,2,t5_2s3sk
11473645,0,t1_dfwiazf,Rp ,TibiaMMO,dfwj6ww,1,t5_2s3sk
11474509,0,t1_dfwlf4g,Well what u need to add if you are going to use imbuements than...If u are making more dmg but miss chance is higher than u will profit less than hitting more constant with less dmg.. thats the main pros of using bows in my opinion.,TibiaMMO,dfwmq21,1,t5_2s3sk
11498483,0,t3_643zol,I agree it needs a revision. It should regenerate while logged in but instead of being per character stamina should be account wide and much lower so literal no lifes dont die sitting at their compter irl.,TibiaMMO,dfzcpih,-2,t5_2s3sk
11498764,0,t3_62x3av,Used up  horns so far and still no mount hope my luck turns around soon!,TibiaMMO,dfzduwk,1,t5_2s3sk
11508760,0,t3_647g3z,I do have a level  rp with  distance on Antica..... ,TibiaMMO,dg0ipmg,8,t5_2s3sk
11525161,0,t3_64i3e6,,TibiaMMO,dg2dnji,1,t5_2s3sk
11525416,0,t1_dg0mmtn,Botting in  LUL,TibiaMMO,dg2eoww,1,t5_2s3sk
11528464,0,t3_64jwbe,INTERN CEO lt,TibiaMMO,dg2r4q6,35,t5_2s3sk
11530502,0,t1_dg2ymkz,I liked it. Do you mind explain why do you think that?,TibiaMMO,dg2zg8h,2,t5_2s3sk
11537977,0,t1_dg3mzoa,What the heck did I just read?,TibiaMMO,dg3tylf,4,t5_2s3sk
11543150,0,t3_64pw1u,I will be a happy camper if litterly all they do is hey yes battleye still working but guess what! now we made the movement good again.but for reals new quests fun quests! I like bosses but good ol fashioned quests get me going aswell doing gravedigger of darefia for  hours for a mount I only used for a few weeks was totally worth it lock backpacks will also be amazing I love having so many bps open BUT it takes a while for me a lazy bum,TibiaMMO,dg4f1pq,1,t5_2s3sk
11552817,0,t1_dg54dhl,yeah if u get premimum Grimvale is your friend..Im making about k profit depends on luck per hour there..Lets calculate real quick  scenario when u play  h per day  h more in weekends.. that gives us k  k per weekk x   kk after  weeks and than u have rest of gold to Yourself.. also i pretty much average the profit to k it goes much more sometimes. Add market trading to this and baaam   month of pacc gives u  next! Maybe u should start thinking about it as a job if your salary is so low? ,TibiaMMO,dg5ikb0,1,t5_2s3sk
11556837,0,t1_dg5xevk,Why not DH over Elite Draken? Just a question since I use it but also have an EDH.T Mana  T Distance   armor makes it better than draken.Currently I have T Mana helm.bow and T life armorbow. But its because Im trying to rush lvl .Maybe after  Ill change to T and dist over life to safe a few bucks and profit more.,TibiaMMO,dg5yzcq,1,t5_2s3sk
11584222,0,t1_dg90zku,gtSo the towns are just empty now and theres no community? no just come to Antica and you will see.,TibiaMMO,dg92u58,1,t5_2s3sk
11588191,0,t1_dg8x0ya,Its literally the last frontier in Tibia. You must be fun at parties.,TibiaMMO,dg9j1o2,3,t5_2s3sk
11591304,0,t3_65fq9p,Not very nice of you guys Kappa. My friend and I wanted to kill a bot or two on our  pallys on Antica server died and we cant even log on our other characters now lol.,TibiaMMO,dg9vs31,2,t5_2s3sk
11604309,0,t1_dgawoof,I doubt thats hardware issues. There used to be  people online on each of the  servers or so several years ago they dont have worse servers than they had back then. Besides a reset to a backup means either some data is getting extremely corrupted OR more likely they actually fucking save the state only on daily server reset which is just plain wrong. All in all mitigating these issues should be pretty trivial but they apparently have a very good reason not to.,TibiaMMO,dgbcwaj,1,t5_2s3sk
11619771,0,t3_65pcn8,Just FYI Feedbag gt Pillow Backpack! pOtherwise I enjoyed it gave me the good old photobuckettibia.de feel. Maybe I should put all of mine in an album.. Mostly bosses tho.,TibiaMMO,dgd41c8,1,t5_2s3sk
11621130,0,t1_dgd0b5p,worlds are full not because of bots but because its a new world its gonna be this way on this worlds also. ,TibiaMMO,dgd9l23,3,t5_2s3sk
11627189,0,t3_656uio,Hey I came across this thread a bit late but I would like to add some food for thought.There are some special corpses in Tibia which do not decay like the normal ones. These are most commonly seen in house decorations and such and are obtained from daily respawns after each server save.You can obtain both a ghoul this corpse shall rise from the grave and a ghost this corpse shall break the shackles of life from the Oasis tomb which is also north of Ankhramun making it somehow related to the tower. Theres also a skeleton corpse in Edron rotworms which can also be related to the second line.What if the other corpses also need to be special undecaying ones since in theory they would need to be dragged from far away into the empty spaces? What other known monsters fit the description in these lines?,TibiaMMO,dgdyd0d,1,t5_2s3sk
11635951,0,t1_dgexm01,yeah I forgot that ,TibiaMMO,dgey4u6,2,t5_2s3sk
11649885,0,t3_668l4v,www.tibiamaps.io  supported fansite go to the Downloads section and see what suits youYoure welcome.,TibiaMMO,dggj1cn,3,t5_2s3sk
11653612,0,t3_66a04t,Morta Ive started there from complete  experience in this game and not regret any second of it. You are BR based or jsut speak BR?,TibiaMMO,dggy9e5,1,t5_2s3sk
11672710,0,t1_dgj39ap,Yeah but rested lasts for a certain  of exp and does not have a time limit. Green stamina docks  minutes any time you enter combat even if its  shotting a wolf.,TibiaMMO,dgj4953,5,t5_2s3sk
11686837,0,t1_dgk3y57,Vita reminds me of Playstation Vita.,TibiaMMO,dgkpy5y,1,t5_2s3sk
11690435,0,t1_dgkbuhl, is fairly new,TibiaMMO,dgl4n8u,0,t5_2s3sk
11695335,0,t1_dglocwe,deleted,TibiaMMO,dglonmc,1,t5_2s3sk
11714400,0,t3_674p2f,Hey bro I think you could try Hellspawns in Yalahar same logic but with energy walls a little bit more dangerous tho. The new giant spider cave at Port Hope slowly hunting in Hero Fortress Okolnir Frost Dragons probably waste RamoaLich Hell and various others spawns...,TibiaMMO,dgnuudi,3,t5_2s3sk
11724846,0,t3_67b0rc,Not sure if its possible at your level but look into Professor Maxxen Area as well as the lower Spike for new hunting spots.  You could also try running Draken walls using avas but its a little risky.,TibiaMMO,dgp1ifl,3,t5_2s3sk
11733869,0,t1_dgq0i2v,Yet they were all horny and wet when PewDiePie made that video. They even posted a comment like We dont agree with what he did but hey! Its PewDiePie! on their Facebook in reference to this video in which he says he scammed people and botted.,TibiaMMO,dgq2b7g,4,t5_2s3sk
11740475,0,t1_dgqpyf8,removing or fixing the spell would be a start my friend they would still need to tweak a few things here and there like taking out the online characters list or giving permission to add to vip like the permission to inspect other players.Maybe you have never experienced this in the game so I understand your lack of empathy me and my friends were hunted because we started killing the forgotten knowledge bosses simple as that.They wanted a payment of kk each and a promise to never set foot on the bosses again or we would be hunted again on top of that spawns like roshamuul lizard city and most of the quests were blocked trying anything there would make you go to their shit listI agree with you that the attitude is root of the problem but you cant really have a discussion or even negotiate with these people since they play the game as a business where they sell characters money and bot keys for rl money,TibiaMMO,dgqt9oe,3,t5_2s3sk
11746925,0,t3_67mbub,I would say this goes under Hotkey Profile when you press CtrlK.I still need to confirm it though.,TibiaMMO,dgrjkud,3,t5_2s3sk
11749226,0,t1_dgrouk3,You do realize that flash is completely different from coding in c right? They cant just copy paste features over. Id say its just a matter of time. I would rather see a stable version released instead of them doing a halfassed work filled with bugs.,TibiaMMO,dgrsyiw,3,t5_2s3sk
11749978,0,t3_67o0t6,If you find this please inform me dont think there is such thing tho,TibiaMMO,dgrw13k,2,t5_2s3sk
11753959,0,t1_dgsbwgy,I think the summons are supposed to help with ppl who like to solo things since team hunt seems to have taken over the PG. I took a break for like  years and just started playing  weeks ago so im not the most insightful person on the issue tho,TibiaMMO,dgsc9z4,1,t5_2s3sk
11778098,0,t1_dgu8kv8,That can hardly be the case Windbot hasnt been able to bypass battleye by their own admission and xenobot hasnt even made the effort to update to Tibia  and those are the big  to my knowledge. Perhaps people are lying?,TibiaMMO,dgv32cn,4,t5_2s3sk
11786865,0,t1_dgvefxv,Search on this subreddit for Paladin guide and one should appear. Dont have the specifik link,TibiaMMO,dgw2wkm,1,t5_2s3sk
11802565,0,t3_68e6e0,Wont be so lowkey now .,TibiaMMO,dgxv166,3,t5_2s3sk
