,controversiality,parent_id,body,subreddit,id,score,subreddit_id
267462,0,t3_1x4yp9,So... Whats your address and what time will you be out of the house this weekend?,TheDearHunter,cf8hdq5,3,t5_2st9u
646943,0,t1_cgdq15l,Thank you so much! That really means a lot coming from someone who not only was hesitant to listen but is clearly a fan of the band.  ,TheDearHunter,cgdt33s,2,t5_2st9u
1107450,0,t3_26t14x,deleted,TheDearHunter,chu6alp,1,t5_2st9u
1287080,0,t3_28tudh,The regular vinyl and physical CDs are shipping the th so I think thats when ours will come as well.,TheDearHunter,cieevb7,2,t5_2st9u
1304732,0,t1_cigbc1z,I am.  Quite soon too and Ill definitely share it here.  ,TheDearHunter,cigeddv,2,t5_2st9u
1576583,0,t1_cjdofxx,deleted,TheDearHunter,cjdwfq9,1,t5_2st9u
1580634,0,t1_cjeea59,Agreed its a cool idea but not very realistic. Im just looking forward to Acts IVVI being released let alone performed!,TheDearHunter,cjeeu9f,2,t5_2st9u
1600500,0,t1_cjecdlc,Yeah. They could maybe split it up.  or  shows focusing on  to  acts each.,TheDearHunter,cjgwuge,1,t5_2st9u
1818464,0,t3_2ectpa,Sounds great man,TheDearHunter,ck8b52c,2,t5_2st9u
3085153,0,t3_2vhew6,Caseys talked about being inspired by The Beatles before. I think The Color Spectrum is a pretty solid crosssection of who inspires him like a lot of the s rock and early indie stuff.,TheDearHunter,cohrwa0,2,t5_2st9u
3618919,0,t3_31td5h,Id have to go with either Evicted or Poison Woman. So psyched! ,TheDearHunter,cq4s7db,2,t5_2st9u
3901386,0,t1_cr0yhic,I heard my name being called out in the aether and rushed to respond.Hey buddy.,TheDearHunter,cr0zqhi,1,t5_2st9u
4412271,0,t3_3bhow6,Oh and a question  did you guys write songs with the guests in mind?  The instrumental even reminds of a dear hunter song.  Did Casey have a hand in writing the song at all?  Am I going to be hearing some Fall of Troy sounding song with Thomas Erak?  ,TheDearHunter,csmzxaf,5,t5_2st9u
4590974,0,t3_3ahwup,deleted,TheDearHunter,ct9acwd,1,t5_2st9u
4690792,0,t3_3f52tw,Greed has been a theme the entire time via The Pimp and The Priest! ,TheDearHunter,ctltf0j,5,t5_2st9u
4726892,0,t1_ctq7640,Maybe because it isnt out yet....?,TheDearHunter,ctqd5di,0,t5_2st9u
4759498,0,t3_3g0i1u,Came in the first few seconds.,TheDearHunter,ctuhak4,1,t5_2st9u
4962016,0,t3_3iuy41,I can wait a week to hear the whole thing.  I want to be surprised with the album with the exception of A Night on The Town Waves and Wait,TheDearHunter,cuk01mu,1,t5_2st9u
5016829,0,t1_cuqk4cf,Great work both of you. Ive been working my brain trying figure this track out. Ill be back to get your insight on the rest of the album.,TheDearHunter,cuqpv6z,1,t5_2st9u
5017614,0,t3_3jns0u,There are a lot of obvious ones but one I really thought was really amazing and subtle was at the end of The Old Haunt. You can hear a dissonanttwisted version of the otherwise happy sounding intro theme of The Lake and the River. It fits perfectly with the story of returning to the hometown which is in ruins.,TheDearHunter,cuqta9b,2,t5_2st9u
5017905,0,t3_3jnma4,Its definitely curse. There are typos in lyric books all of the time.,TheDearHunter,cuqujto,1,t5_2st9u
5021748,0,t1_cur8kkc,Yea I shouldve read further into the posts before I posted I saw a lot of people were having the same exact issues. Good excuse to get the CD I wanted it anyway haha,TheDearHunter,curb96y,1,t5_2st9u
5034163,0,t3_3jvs8x,Here is a great list of many of the callbacks and reprises,TheDearHunter,cust3jk,6,t5_2st9u
5067833,0,t1_cuwv08q,haha! Isnt what youre describing a million dollar studio? no?annnnnnnd thank you!,TheDearHunter,cuwv5rr,3,t5_2st9u
5113688,0,t3_3l1kqp,I think its still gotta be In Cauda Venenum  Though A Night On The Town is  really up there now.,TheDearHunter,cv2e2mu,13,t5_2st9u
5125274,0,t1_cv3sbqa,Awesome choices,TheDearHunter,cv3sder,1,t5_2st9u
5145479,0,t1_cv66cdb,if your ticket is not at the will call and you cant get in tonight message me on here,TheDearHunter,cv681l7,1,t5_2st9u
5180081,0,t1_cv9aids,I prefer Act II to all of them.  I play drums and theres just something about the fillin drummers grooves.  Nick is amazing but the other guy just gets me.  Also Im bias Millencolin came out with my favorite album of the year so far ACTIV close behind.,TheDearHunter,cvae19q,2,t5_2st9u
5188442,0,t3_3m2laz,I felt this way when they were in Cologne a few weeks ago. I think it has to do with them being the opening act so the sound isnt as optimal? ,TheDearHunter,cvbebi0,2,t5_2st9u
5212093,0,t3_3m6e4i,I got my vinyl today although it does have significantly less damage because it came with the Leaf Tshirt but the back of the sleeve is still slightly bent but my records work flawlessly so Im not that fussed. There was also the glue problem with the production of the Act  amp  records which caused glue to then be stuck to my Act III record and permanently damage it Ill never be able to listen to The Poison Woman in full again....,TheDearHunter,cve90mq,1,t5_2st9u
5225925,0,t3_3mk23o,Im going to have nightmares after seeing this.,TheDearHunter,cvfwyg2,2,t5_2st9u
5265109,0,t1_cvk0xqm,Im not sure what the plan is with releasing them. I think there will be  volumes though.,TheDearHunter,cvkocr4,1,t5_2st9u
5402580,0,t1_cw26an2,next show Im either going right up to the barrier to be as close to the band as possible or going to the back to enjoy from the balcony with a beer because the crowd doesnt vibe at all saw them at Gramercy in NYC a few years back too same deal no movement,TheDearHunter,cw28mnz,1,t5_2st9u
5459119,0,t1_cw9et1y,No I didnt leave early why would I ever do that... guess I should have edited it to say preencore closer. Sorry uMrFusionHER for the confusion ,TheDearHunter,cw9gd3d,1,t5_2st9u
5703411,0,t3_3t8fyg,Praise be to Casey!  Just kidding. But seriously. ,TheDearHunter,cx42b2y,6,t5_2st9u
5779268,0,t1_cxdgu6l,And thats why I didnt recommend King of Swords in my first post. The song is catchy as hell but if I was introducing somebody to them that would not be one of my first choices. EDIT Also thanks a ton for doing the individual track discussion. Somebody tried it in the BTBAM subreddit and it fell flat after the first album and a half.EDIT  And its the eve of Thanks. Im drunk. Im going through all of the Acts right now and I think we can all agree that this is some good shit.,TheDearHunter,cxdh0ym,3,t5_2st9u
5823799,0,t1_cxitvtb,I just dont ,TheDearHunter,cxj0wtu,1,t5_2st9u
6088646,0,t3_3y81na,So...I was doing some google searches for reviews of Act IV and not only do I discover a TDH subreddit but I discover more Mew fans! We are like unicorns! Love your lists OP. Youve got great taste in music!  Here are my top  albums of the year.  SUFJAN STEVENS  CARRIE amp LOWELL .  MEW .  UNKNOWN MORTAL ORCHESTRA  MULTILOVE.  TAME IMPALA  CURRENTS.  CARIBOU  OUR LOVE.  PANDA BEAR  PANDA BEAR MEETS THE GRIM REAPER.  BEIRUT  NO NO NO.  JAMIE XX  IN COLOUR.  DAYWAVE  HEADCASE.  LONE BELLOW  THEN CAME THE MORNINGNotice Act IV is not on my list. This is due to the fact that I just discovered it TODAY. I discovered TDH when Act III was released and fell in love with their sound. But since I listen to SO much music on Spotify I just forgot to follow them since Migrant was released. I was just notified by a friend that they had one of the best albums of the year and I couldnt believe I had let it slip thru the cracks. It is living up to all expectations so far and will quickly be moving up my best of the year albums list. Also glad I discovered this sub!,TheDearHunter,cyhp6x2,2,t5_2st9u
6498032,0,t1_cx3gv5g,Online lyrics in general are pretty awful...I have seen some absurdly inaccurate lyrics before.,TheDearHunter,czrg16e,1,t5_2st9u
6931291,0,t1_d10kftw,eeeeeeeeeexactly. ,TheDearHunter,d11zjtz,1,t5_2st9u
6947167,0,t1_d13l84j,Can I dislike him in a nonpolitical manner because The Apprentice sucked?,TheDearHunter,d13sj0g,1,t5_2st9u
6959739,0,t1_d14moql,I listened to this album for the first time a couple of days ago and Ive really become addicted to it. soOooO good,TheDearHunter,d157z9p,1,t5_2st9u
7344313,0,t3_4fyd7x,They also have breakdowns for the rest of the Acts starting with Act I,TheDearHunter,d2czxdd,3,t5_2st9u
7521615,0,t1_d2waqpi,Yessss. Thats what I love about TDH. Engaging complex story but it by no means carries the music.,TheDearHunter,d2x65qf,3,t5_2st9u
7741489,0,t3_4kuynp,Oh hey I have the same one! Yours Looks great!,TheDearHunter,d3m5g7r,1,t5_2st9u
8036944,0,t1_d4jfd73,It almost sounds like he sings Enya before Gloria........but Im pretty sure thats not right.,TheDearHunter,d4jfens,2,t5_2st9u
8041616,0,t3_4pbqo8,deleted,TheDearHunter,d4jybku,2,t5_2st9u
8047845,0,t3_4pbnoy,Long time theory Ive had since about  and its looking very possible. So as we all know the flame is gone the fire remains as used in act  represents the boys father leaving him and Ms Terry him being the flame the boy being the fire. Now I predict that the Boys life will begin to mirror his fathers and that before he left for the war Ms Leading got pregnant with his child. Then the boy leaves he becomes the Flame and his son is now the Fire. They meet again in act V after an untimely demise of Ms Leading and I think the Boys son will eventually lead to his death the same way the Boy killed his own father,TheDearHunter,d4knj66,3,t5_2st9u
8061930,0,t3_4piygq,I dont have any tattoos because I never had any I felt confident in getting. I love that design and would get that tattoo. Please post an update. How big will it be? Are you keeping those shading lines in along the mask?,TheDearHunter,d4m8ird,1,t5_2st9u
8084737,0,t1_d4o69bi,This is great but I like doing the opposite as well depending on my mood. I did White VIBGYOR Black at work yesterday. I prefer the latter because I imagine white light emanating from somewhere then dissipating into black as the wavelengths get longer.,TheDearHunter,d4osr3j,2,t5_2st9u
8103306,0,t1_d4qvj4j,gtPlease what happened to the flame?gtIt burned down the sidesOh...,TheDearHunter,d4qvuwj,6,t5_2st9u
8145309,0,t1_d4vm9w3,There are a few videos of Casey performing this song live on YouTube. Id recommend you check them out! Cant wait to hear the studio verison for this one,TheDearHunter,d4vpkjf,1,t5_2st9u
8159896,0,t3_4r1cxi,This is what Im talking about this. You are a life saver now I dont have to do this myself though I may make a few that you can just upload to the channel Ill keep in touch with you.,TheDearHunter,d4xj9us,2,t5_2st9u
8166340,0,t3_4r2d8j,It was The Inquiry of Ms. Terri for me. I always thought it was just okay but then during one listen the reprise! two times! the dime! burn it to the ground! suddenly sounded way more powerful than I could remember. I really love it now!,TheDearHunter,d4ycbbr,3,t5_2st9u
8188382,0,t1_d50u7g5,Do it,TheDearHunter,d513ldn,2,t5_2st9u
8389166,0,t1_d5pcurp,Wow I had never heard this song before because its not on the Spotify version of Migrant. Listening now and enjoying it very much thank you!,TheDearHunter,d5q6yz9,4,t5_2st9u
8401855,0,t3_4ufdu8,Black Sandy Beaches and His Hands Matched His Tongue,TheDearHunter,d5rs0vk,2,t5_2st9u
8602458,0,t3_4xiyof,This actually isnt too out there for TDH. They do a lot of pretty neat stuff in terms of music theory. Two of my favorite moments in Act IV are here where the deceptive cadence goes to a VI instead of the usual vi of a deceptive cadence G Maj to E Maj rather than E min and at the end of Ouroboros where they end the record on a half cadence that leads into the first chord heard in the track.,TheDearHunter,d6gwge6,3,t5_2st9u
8747979,0,t1_d6z4zd2,I dunno Wake Up is kinda romantic.,TheDearHunter,d6z5hfj,2,t5_2st9u
8780588,0,t3_5092bz,Ill be at the one in Cleveland. Skipping my  year high school reunion lol for this show.,TheDearHunter,d738sls,2,t5_2st9u
8806953,0,t1_d76h051,I wonder why Casey refers to it as an apothecary then. Surely one could be both a plague doctor and an apothecary which is really just someone who sells medicine? And yes its because the PampP is fat. That said it is just album art so there is probably artistic liberty going on.,TheDearHunter,d76h5kv,2,t5_2st9u
8842377,0,t3_51bf7j,Awesome thanks for the answers guys!,TheDearHunter,d7aq860,1,t5_2st9u
8854970,0,t1_d7c5dms,deleted,TheDearHunter,d7c8q5y,1,t5_2st9u
8860463,0,t1_d7cw741,Id have it go directly to the charity so people can get that sweet sweet tax writeoff  And then Id be able to track it more easily. Plus then you dont have to worry about me being some shady dude who is saying he is doing something good for charity but is really just pocketing it.,TheDearHunter,d7cwi62,3,t5_2st9u
8862197,0,t3_51lj6z,Oh boy I cannot wait,TheDearHunter,d7d40o9,1,t5_2st9u
8868780,0,t3_51lolq,So much yes!,TheDearHunter,d7dwiez,1,t5_2st9u
8872159,0,t1_d7eaw11,Awesome! Thank you so much. Also as a side note the entries portion of it is broken P thats what happens when you put a site together in a few hours.,TheDearHunter,d7eb43o,2,t5_2st9u
8875572,0,t1_d7enenb,Personally Ive heard those questions asked and answered in interviews so much and Ive even asked him a couple about that topic so Im more interested in the specifics of this fictional universe he created. Im right there with you on your second point though its pretty intimidating and nerve wracking trying to keep your cool and not say something overly gushy or otherwise make a fool of yourself.,TheDearHunter,d7epvr4,1,t5_2st9u
8882627,0,t1_d7fk1vv,I saw the email and my hopes got raised and immediately ruinedAlso sucks that they waited until after the release date to let us know nothing shipped yet since my order has a flask in it c,TheDearHunter,d7fkdy7,5,t5_2st9u
8882665,0,t1_d7fketa,You will still receive the full album download via email on the release date,TheDearHunter,d7fkjuy,5,t5_2st9u
8887155,0,t1_d7g3suw,Oh ok thanks. This makes the email I sent to them sound much more whiny...,TheDearHunter,d7g3zii,2,t5_2st9u
8890264,0,t1_d7gdod3,That has always been one of my favorite lyrics.Its so foreboding even on its own.,TheDearHunter,d7ghfbr,2,t5_2st9u
8890356,0,t1_d7ge2rv,I do know of it but havent even touched those EPs yet.,TheDearHunter,d7ghtnr,1,t5_2st9u
8891337,0,t3_51yxlw,the he said he had a storyouroboros reprise in who am i...oh my god i lost my mind,TheDearHunter,d7gm2cm,2,t5_2st9u
8898661,0,t3_524csz,Oh shit this is a throwback,TheDearHunter,d7hhphj,2,t5_2st9u
8901794,0,t1_d7hv3ug,deleted,TheDearHunter,d7hv93d,1,t5_2st9u
8903806,0,t1_d7htpob,What a genius business move on the record companys behalf. I didnt preorder because I assumed Id just stream it but nope. They got my ten bucks and Im glad they did.,TheDearHunter,d7i3xl6,6,t5_2st9u
8909388,0,t1_d7irsmj,Same. Act I is a complete mystery to my story wise. Are the comics meant to be released one Act at a time?,TheDearHunter,d7is1pn,3,t5_2st9u
8909584,0,t1_d7iomcj,Right? Like holy shit this album is just fantastic,TheDearHunter,d7isw5u,6,t5_2st9u
8919780,0,t1_d7jzscb,Im not sure that they are.  I couldnt open them yet.,TheDearHunter,d7k0ziy,1,t5_2st9u
8924442,0,t3_52il24,I think it is Mr. Usher as well. The TPP has previously had verses from his POV but it was never a different voice or duet.,TheDearHunter,d7kl53i,2,t5_2st9u
8924718,0,t1_d7kj38t,From the portuguese Wikipedia Melpomene is the muse of tragedy despite her happy singing. Maybe we should rethink the cheerful and calm tone of the song.Edit Also from the german Wikipedia she sings to bring strength to the human minds afflicted by unhappiness and pain.,TheDearHunter,d7kmc8e,2,t5_2st9u
8935451,0,t3_52odku,Battesimo was the first thing i listened to after act V. All the strain of hearing it and puzzling what the heck was going on all melted away finally.,TheDearHunter,d7lwqmq,3,t5_2st9u
8935805,0,t3_52ncmg,I heard it as Merry to Malice but I guess both work,TheDearHunter,d7ly9tn,1,t5_2st9u
8946295,0,t3_52tpu2,Is it The Decemberists  Wont Want for Love? Or that entire album really. Its also got a bit of a Carolina Low feel to it towards the beginning. Mostly because of the DropD acoustic sound.,TheDearHunter,d7n7nzf,3,t5_2st9u
8947015,0,t3_52tz16,Thank you.,TheDearHunter,d7nas3u,5,t5_2st9u
8949011,0,t1_d7mkgdw,Dont forget he sees the apparition in mustard gas. Potentially. They did throw it up in that music video.,TheDearHunter,d7nje8t,1,t5_2st9u
8960492,0,t3_530ans,Im having the same issues. Really frustrating. Some songs like Blood work for me but most dont. Although it does work for me on the web player.,TheDearHunter,d7ox0dm,2,t5_2st9u
8963710,0,t1_d7orsz8,I recorded audio from the Seattle storytime and it came out surprisingly clear.  If I have time Ill transcribe the important stuff and share it once the tour has concluded.,TheDearHunter,d7pax21,1,t5_2st9u
8969582,0,t3_52xgpk,deleted,TheDearHunter,d7q0ahd,1,t5_2st9u
8994991,0,t3_53a9x1,For me it was Mustard Gas. I was going through a kick of sweepingly melodicorchestral rock and mentioned that to a friend. He said Have you ever heard Mustard Gas by the Dear Hunter? I checked it out and  was immediately hooked. He also recommended I next listen to The Tank. From there I just went back and listened to the entirety of all the Acts.EDIT I was late enough to the party to have discovered them just after Act IV so this was my first new TDH release. Couldnt have been more blown away.,TheDearHunter,d7t248c,2,t5_2st9u
9006163,0,t1_d7uds5i,I wasnt  sure but I thought there as some sort of similarity. Thanks for clearing things up. I would write it off as a coincidence too with the amount of content this band has produced its not unreasonable that some of it would sound familiar.,TheDearHunter,d7ueevb,2,t5_2st9u
9021900,0,t1_d7w2qsz,Exactly! The song itself is so rapturous and my interpretation is that he is finally reunited with her after so long.,TheDearHunter,d7wahni,1,t5_2st9u
9022054,0,t3_53ub59,Major bummer. Ill be there tonight in Chicago. But I wouldnt want him to do anything to cause any serious harm.,TheDearHunter,d7wb5nu,10,t5_2st9u
9043779,0,t1_d7ywqge,The one you originally showed me had an option for saturday delivery. its like  extra but i had a gift card and its pay day so why the hell not!  Edit just got the confirmation email set to arrive Saturday September th ,TheDearHunter,d7yx1ds,1,t5_2st9u
9060476,0,t3_54dclk,Act I His Hands Matched His TongueRunner up  The Inquiry of Ms. TerriAct II Where the Road PartsRunner up  Vital Vessels VindicateAct III This Beautiful LifeRunner up  Life and DeathAct IV OuroborosRunner up  Bitter Suite VI AbandonAct V The March.Runner up  The Fire Remains,TheDearHunter,d80x9ci,3,t5_2st9u
9077962,0,t3_54lffm,if you want another huge story Arjen lucassens musical project Ayreon has a scifi story that spans  albums. its much more proggy but its cool because every character on every album is played by a different singer including many of the alltime greats. Porcupine tree is another choice try the albums in absentia or deadwing. last pick is seventh wonder a bit heavier but singing is poppy and upbeat like TDH. try the album mercy falls.,TheDearHunter,d830v62,3,t5_2st9u
9103025,0,t1_d85zpss,god dammit,TheDearHunter,d861d25,4,t5_2st9u
9137743,0,t3_55cfin,removed,TheDearHunter,d8a9xe2,1,t5_2st9u
9139491,0,t3_55gm9a,Youre doing a great service for alot of people by doing this. Im thankful to have gotten a copy for cheaper like  years ago off Amazon. Im sure alot of people would rather pay the band for official copies I find it ludicrous that rd party website would sell it for those high amounts. Maybe if the money went directly into the bands pockets sure. ,TheDearHunter,d8ahw45,3,t5_2st9u
9153705,0,t1_d8c9s3u,I agree . Totally a Rollercoaster of emotion.  I also heard Casey mention that each movement is a different love interest. ,TheDearHunter,d8caqvq,2,t5_2st9u
9197485,0,t3_56bb1e,congrats! D,TheDearHunter,d8huk9u,3,t5_2st9u
9210610,0,t1_d8iw79o,That had to be removed. It was there but then someone sued the graph maker because they never wanted their name up in bright lights.,TheDearHunter,d8jii07,4,t5_2st9u
9213973,0,t3_56ikyp,Wow Portnoy has fantastic taste. Wide range of genres on there too,TheDearHunter,d8jxtzs,1,t5_2st9u
9236629,0,t1_d8mocgl,Bromance confirmed.,TheDearHunter,d8mt6u5,2,t5_2st9u
9272720,0,t1_d8qxalv,Damn you Olivia! How dare you get our hopes up only to have Brittany stomp them down.,TheDearHunter,d8rdtyj,2,t5_2st9u
9283429,1,t3_57kgl5,Better than wearing a tshirt of the band youre there to see.,TheDearHunter,d8sqq2j,2,t5_2st9u
9287023,0,t1_d8sx5i4,Nothing inherently. I just dont care to do it myself. Seems tacky to me. Did not realize I touched a nerve haha.,TheDearHunter,d8t73vp,2,t5_2st9u
9310124,0,t3_57z63s,What exactly are you looking for that you arent getting thats making you say they better have something figured out? They told you when to show up for the VIP portion of it so show up at  PM for the VIP portion.What other information do you need...?,TheDearHunter,d8w4k8h,1,t5_2st9u
9313595,0,t3_580mnn,Still havent gotten any merch from them. No idea what the hell is going on. ,TheDearHunter,d8wkf02,2,t5_2st9u
9348015,0,t3_58iwn8,Man I love this band logo.,TheDearHunter,d90xfeb,3,t5_2st9u
9358695,0,t3_58o7cu,I was pretty bummed when I heard they sold out of the Most Cursed of Hands posters so Id love to be considered for this. Thanks so much for your generosity!,TheDearHunter,d92a61f,1,t5_2st9u
9367704,0,t1_d939qoj,I loooove The Flame,TheDearHunter,d93f95n,6,t5_2st9u
9367819,0,t3_58tjfw,THE SMILING SWINEno but really The March,TheDearHunter,d93fs13,1,t5_2st9u
9374970,0,t1_d92my1q,Then who is this aboutgt Just look at that charlatan steeped in deceit  gt A threat to the young  gt To the old and the meek  gt Dont you wander what made him  gt So vicious so sick?  gt So far out of balance?  gt So cruel and so callous?  gt So married to malice?   I thought it was Hunter thinking about TPP.,TheDearHunter,d94ce0r,1,t5_2st9u
9380403,0,t3_591vj1,These have been fun over at rthefence but yeah also super hard.,TheDearHunter,d9516yh,4,t5_2st9u
9383366,0,t1_d91vyd0,Ive been listening to Closure in Moscow after your recommendation and they are spectacular. They sound a lot like Circa Survive which I love because they are one of my favorites. All of the others Ill listen to soon because you named a bunch haha.The funny thing about Art By Numbers is that I just found them out the day before this post and I really like their stuff too. Their album says that its a musical but I havent figured out the story yet if there is even one.Okay I dont know what youve already reviewedlistened to but here are some suggestions anyway no particular order Dear and the Headlights  I love them to death and they probably are in my top . In the only two albums theyve made I have yet to find a song with a flaw. The lyrics are great and the acoustic feel makes it accessible to everyone imo. If you liked Yellow and Green from TCS you would definitely like them. Dont expect any more from them though they broke up years ago sadly The Decemberists  Youve probably heard of them by now if you constantly go on this sub and for good reason. Their music has such a unique feel from most folk artists today due to the singers voice and the musical accompaniment of accordions strings and brass. Most of their songs contain their own uncorrelated story which you would enjoy if you like story driven songs like from TDH. Take a gander at Picaresque my fav album from them Picturesque  If you like ABN you might enjoy these guys. Picturesque has a Pierce the VeilSleeping With Sirens vibe but I find the singer more pleasing. Paper Rival SelfTitled Album  A combo of DATH and As Tall As Lions. Their selftitled album is probably my favorite from them. Panic! At the Disco A Fever You Cant Sweat Out  This recommendation might be a stretch because of the genre change. These guys are fairly poppunk but their first album had a very burlesques Victorian vibe to it which I found amazing. They are also very theatrical much like Act II in a way. Theyre one of my favorites but I dont know if you would like their most recent stuff because it is fairly popy. If you like it I would also recommend their next album Pretty. Odd. Beatles vibes from this one. Death Cab for Cutie  Pretty solid moody sound. Great for long car rides whilst staring out the window. Modest Mouse  Dont know how to describe them. They mustve been on drugs but most of their stuff I found to be pretty good. Try listening to The Best Room one of my favorites from them. Portugal. The Man  Psyyychadeliiicc. Theyre basically really mellow and I mean really mellow. Popy but enjoyable I believe.Really sorry about that I cant really condense my thoughts well haha! Hope you find some enjoyment from these and thanks for your suggestions. ,TheDearHunter,d95eoou,1,t5_2st9u
9428804,0,t3_59s9kp,They usually end around  pm. The last two times Ive seen them anyway.,TheDearHunter,d9b5z0x,1,t5_2st9u
9428913,0,t3_56shrj,definitely interested!! Id greatly like to have a read,TheDearHunter,d9b6gwg,1,t5_2st9u
9463966,0,t3_5ad6k7,Thanks so much for getting Waves Ohs and all! Been looking for a good quality vid of that.,TheDearHunter,d9fmhi8,5,t5_2st9u
9496654,0,t1_d9jmktm,His name was confirmed to be Hunter by Casey himself.,TheDearHunter,d9jnxxw,10,t5_2st9u
9504036,0,t1_d9kfswj,Well I guess I shouldnt say hes normally into prog as much as experimental music which I feel like falls in a similar category as prog.,TheDearHunter,d9kkpkp,1,t5_2st9u
