,controversiality,parent_id,body,subreddit,id,score,subreddit_id
2959078,0,t1_co4gk98,Oh jeez. Ive been there. Im glad youll be okay. Rest up lt,RAofLittleness,co4gmns,1,t5_361e4
3014922,0,t1_co8i4tt,Ack! I was always grateful my parents werent super strict about things... but then again I could disappear for  days and not be missed Duuuude losing games suuuucks. Had a guy steal my gameboy at school once. I was so mad ,RAofLittleness,coahtyu,1,t5_361e4
3070855,0,t3_2vc213, I think this counts! Baymax is from San Fransokyo!x  My favorite Japanese thing is nakano broadway and gotcha gotcha machienes and pokemon!!,RAofLittleness,cogahji,2,t5_361e4
3090545,0,t3_2vc213,Ouran High School Host Club Logo Mug I absolutely love Ouran and it was the very first anime I watched. Its my favorite and I got daddy to watch it and NOW ITS HIS FAVORITE TOO!! I wanna get him the kumachan mug to match. We drink coffee all the time!Im so sorry its a little over ten but if you need it to be cheaper there are other options on Amazon for it!! PEdit the link posted twice!,RAofLittleness,coic0j5,2,t5_361e4
3245993,0,t3_2xa3zi,deleted,RAofLittleness,coygeig,2,t5_361e4
3468888,0,t1_cp78t7b,Ooh ooh this stuff is SO yummy!! ,RAofLittleness,cpnofi1,1,t5_361e4
3501789,0,t1_cprfax6,Damn I was going to say that this is the second dose. But you win. As if it was a contest? Lol,RAofLittleness,cprfg1f,3,t5_361e4
3505007,0,t3_30c7kv,You know hermit crabs are one of the few normal pets that I havent had... My little sister would kill me though because my mom told her like two years ago that if she kept her room clean for a month she could have hermit crabs and she still hasnt earned any. ,RAofLittleness,cprsnfb,1,t5_361e4
3514134,0,t1_cpstopp,Its these ones if you want it on your wishlist! The cheaper one is the  bows.,RAofLittleness,cpsu4wj,1,t5_361e4
3548950,0,t1_cpwrh2l,one I color or of the book?  ,RAofLittleness,cpwsxag,1,t5_361e4
3562325,0,t1_cpx4m5f,Thanks! And nice too meet yas.... just call me Cat ,RAofLittleness,cpybxgk,1,t5_361e4
3651375,0,t1_cq7jv5w,deleted,RAofLittleness,cq8hf3f,1,t5_361e4
3681052,0,t3_32jll7,deleted,RAofLittleness,cqbv42k,1,t5_361e4
3682446,0,t3_32jll7,EDIT You can also enter via PM for a private entry if you wanna keep your poemwriting private ,RAofLittleness,cqc0ugd,1,t5_361e4
