,controversiality,parent_id,body,subreddit,id,score,subreddit_id
3522376,0,t3_30kpls,Oh hey this again.,rule34_ass,cptryl2,2,t5_342g5
4749272,0,t3_3fy09p,Shadman does just wonderful art.,rule34_ass,ctt6vxc,2,t5_342g5
6713715,0,t3_47icqz,Not loading on mobile,rule34_ass,d0dr7t0,0,t5_342g5
6928303,0,t3_4ame1k,From HF,rule34_ass,d11ncpz,1,t5_342g5
7207634,0,t1_d1xb73p,I love Blizzards new pose for Tracer.Not only is it debatable that its more sexy its also paying homage to vintage pinup girls.,rule34_ass,d1xg8p6,4,t5_342g5
8296942,0,t3_4t5ak7,From HF,rule34_ass,d5eochx,1,t5_342g5
9326404,0,t1_d8y6my7,sauce because I forgot,rule34_ass,d8y6v4l,1,t5_342g5
9935563,0,t3_5hp20t,Now THIS is wallpaper worthy! Thanks!,rule34_ass,db2mnx5,3,t5_342g5
