,controversiality,parent_id,body,subreddit,id,score,subreddit_id
4497555,0,t3_3cn1rm,You rock for doing this! Thank you. . Signed in right at noon but my que was too far behind to get a ticket and have not heard back from the STEP program yet.. Since it was my first year last year I can now focus not so much on survival but how to bring and contribute more to the playa! I did boozy snow cones last year with my camp and plan to do that again. I also began helping out with the Carny Corral which will be at the Midway this year. I just did my first videochat to discuss how to get more involvedI want  to help with decorationsvolunteering if I go fundraising. My camp crew is also devising a plan to create a mobile silent disco with LED lights wireless headphones and armflailing dancing. . Oh man. Im thinking an art piece thats like a carnival rideZeus would be the large center figure with his scepter shooting fire. The cars you get into circulate around it are different Greek Gods Hercules Hermes etc on clouds. It would work like The Scrambler.  . Because pugs. . Pinky swear! . I was one of the lead organizers for food for our camp of  last year and am already planning that again! We premake vacuum seal and freeze our meals and then boil it there which is delicious but also takes a lot of planning. Im also starting to make my gifts making outfits and creating packing lists. Have a great burn! ,BurningMan,csxkmje,1,t5_2qj68
4499602,0,t3_3cl1kw,Apparently I can get a little bossy during build week.. someone referred to me as Overlord and it just kinda stuck.,BurningMan,csxtv0k,1,t5_2qj68
4507887,0,t1_csyuxef,deleted,BurningMan,csyvagt,1,t5_2qj68
4508426,0,t3_3cteob,I picked up mine at will call. I just went told them the address it was supposed to be delivered to and showed them my ID.,BurningMan,csyxq18,1,t5_2qj68
4540660,0,t3_3d990s,deleted,BurningMan,ct2z90z,0,t5_2qj68
4544746,0,t1_ct3f5qu,Any tips on where or how to cut the chain links for lag bolts?Ill be in Reno for a week before the burn and need to get about  or two link chain sets made but as I have no workshop access Im wondering where to do this. ,BurningMan,ct3hpp2,1,t5_2qj68
4546477,1,t1_ct3pewv,A community will have local guidelines. Its easy to act brave on the Internet but take a megaphone into Hushville one night and let us know how it went.,BurningMan,ct3pje4,1,t5_2qj68
4552398,0,t1_ct46oqs,Hmm care to share your spreadsheet with me? Im a first timer and just got a ticket so havent really prepared. I know about radical self reliance but would appreciate the help to get started!,BurningMan,ct4gac2,1,t5_2qj68
4564345,0,t3_3diwrd,Looks awesome Mark,BurningMan,ct5y8ah,1,t5_2qj68
4564932,0,t3_3dki42,Whoa.  Homemade?I super love the chaises and the low rectangular tables.  Any chance you might release the plans?,BurningMan,ct60vxu,2,t5_2qj68
4572900,0,t1_ct6m2iq,Have all the lovely people you meet at the burn sign it. You sign it too. ,BurningMan,ct70v25,3,t5_2qj68
4576162,0,t1_ct7f509, Best OClock,BurningMan,ct7flc7,3,t5_2qj68
4587151,0,t1_crvo3ff,Just talked with her now going to go out later this week. She said she definitively has things that should work for me. And she said to tell you thank you for referring me!,BurningMan,ct8t4j0,1,t5_2qj68
4588639,0,t3_3dslt1,My camp has setup a shower with a drain that goes to a water pump that recirculates the water back to the top and is encased in tarps. Just pour some water into the drain when you start showering and drain into the bucket when you are done. This unit has been used a few times each year though most of us forgo the shower as its a lot of hassle. I can get together the parts list if anyone is interested in building one. My buddy Volunteer Tom built this particular model.,BurningMan,ct8ztvc,1,t5_2qj68
4602377,0,t3_3e0qjq,ahaha this is brilliant. extremely dank content. its insane how people like pop music like this when they can listen to some real music like  straight hours of breaks and tech house,BurningMan,ctapu0v,2,t5_2qj68
4604959,0,t1_ctb0nvk,deleted,BurningMan,ctb1hf2,-1,t5_2qj68
4607486,0,t1_ctbcjeg,Yeah itll be fine. Not a lot of people have grinders to put an edge on it. The ground would break enough to drive the rebar into the ground. Its just a bit harder.Thats why I love my sledge hammer.,BurningMan,ctbcvr9,2,t5_2qj68
4609118,0,t1_ct8rk9h,Invite is to join the camp as I understand it ,BurningMan,ctbk9c6,1,t5_2qj68
4619555,0,t3_3e7gr9,Wanted   Ticket amp  Vehicle PassDanke,BurningMan,ctcveew,1,t5_2qj68
4620902,0,t1_ctcj0xe,So I have been to a lot of parties around the world. I have yet to find one as amazing as some of the parties at BM. It is just that simple. ,BurningMan,ctd1h8g,2,t5_2qj68
4623213,0,t3_3e4q9p,This has been going on for many years.  It is absolutely nothing new.I love electronic music and am an event promoter and a DJ myself.  Personally I feel like this is just ego stroking by the camp organizers.,BurningMan,ctdbwh1,1,t5_2qj68
4626124,0,t1_ctdmvx4,deleted,BurningMan,ctdp1p3,1,t5_2qj68
4634639,0,t1_ctemj6t,dae lsd?!,BurningMan,cterk4r,-1,t5_2qj68
4665970,0,t1_ctinn7r,a little ointment will help keep dust from getting under the bandage and into your skin.  bacitracin neosporin if youre worried about an infection or some sterile vaseline jelly.,BurningMan,ctip7zd,2,t5_2qj68
4690096,0,t3_3f4jb0,I was there very early last year with my Org team in our camp on D. Placement folks were making the rounds looking for renegade camps during the entire build week and would simply ask folks to move. I cant verify whether passes were cancelled unfortunately.,BurningMan,ctlq9ve,4,t5_2qj68
4695961,0,t1_ctme3vh,With luck it weighs slightly lighter than the feather of truth.,BurningMan,ctmgsx8,1,t5_2qj68
4699412,0,t1_ctmr3ln,Until the end of the week when you drink your water.But I really want to make a tent kite now.,BurningMan,ctmwexz,1,t5_2qj68
4701606,0,t1_ctn5aur,Youve also really got the wrong idea you need a lot more than a book bag and carry on for Burning Man. You really need to do a bunch of research.,BurningMan,ctn6c8q,1,t5_2qj68
4720993,0,t1_ctp1azk,Time to Burn is also great because it includes the music guide and has a lot more character. They also seem to have a good portapotty finder although I havent used it myself. I bring both apps with me. Some of our differentiating features would be realtime fulltext search of all of the listings zoomable map tiles instead of a static image and we geocode all of the listings so we can show things nearby. We also estimate how long it will take to walkbike to stuff from your current location. Ive heard there are a lot of rangers  emergency services people who use iBurn because of the offline GPS functionality.iBurn is fully open source on GitHub and we welcome contributions however we havent had any yet. Its mainly just a fun project for us to try out new ideas. This will be our third Burn so each year we have a better idea of what will be helpful to people. After last years Burn I had an idea to use Bluetooth LE to create an offline mesh chat network but I dont think it will make it in there until next year and I definitely would want to somehow prevent people from becoming absorbed in their phone.,BurningMan,ctpmcjz,1,t5_2qj68
4731594,0,t3_3fnwwf,My worst moment was at my last burn.  I do shrooms about once a year and that is at Burning Man.  My last burn  the guy camping next to me offered some and I took what I thought would be a small dose.  Within a half hour I was basically catatonic.  A guy at the camp next door noticed and dragged me to his RV.At first I mumbled that I was okay but he was like No you arent.  He fed me electrolytes and stuck me in his bed.  I was dressed as a pirate that day.  All day long people popped into his RV yelling his name and looking at me with a blank stare saying you arent undisclosed buddy.  Then going off to tell him that he had a fucked up pirate in his RV.I kept telling him that I could just go back to my camp and be a piece of shit there and he just said Hey man I have been there.  Sit tight and we will take care of you.I personally think that he really enjoyed all of the people who searched for him to tell him that there was a fucked up pirate in his RV. I had a few conversations with the roof of his RV.  He and his wife checked in on me every half hour or so.  I am camping with them this year.  ,BurningMan,ctqyjml,18,t5_2qj68
4733146,0,t1_ctqspki,Thats what I used. I was able to actually purchase  for significantly cheaper and since two bolts could fit into one link of chain I figured it was good. I used  bolts per link at BM last year and a single one per link at E Utahs Regional where there were very high winds. Both times everything worked great.,BurningMan,ctr5llp,1,t5_2qj68
4741615,0,t1_ctqhd71,A  passenger van usually has removable seats. It will fit  easily along with all your stuff. I used one for  years. ,BurningMan,cts83zr,1,t5_2qj68
4742662,0,t1_cts7b1y,Valid but its often hard to locate a single person controlling a drone at night at Burningman or anywhere. Just recognize that even if your drone is not filming it is still making people uncomfortable with its presence alone.,BurningMan,ctscvdc,4,t5_2qj68
4747320,0,t1_ctsxf1h,Hey!  Can we share Facebook links?  Get a little familiar with each other?? Wed love to meet up on playa. Sorry Ive been a little busy on vaca right now but excited to get organized for the playa in the following weeks.  ,BurningMan,ctsy0rx,1,t5_2qj68
4747727,0,t1_ctsp2r0,Plus you always use more than you think you will best to have a buttload...,BurningMan,ctszvey,2,t5_2qj68
4753794,0,t3_3fyco4,SO MUCH good stuff from here to spruce up outfits.its so cheap my GF went overboard.,BurningMan,cttrer6,2,t5_2qj68
4764254,0,t3_3fzp9f,If you get caught definitely call on Saul Goodman   I hear he got it so a guy without a ticket could stay onsite pending review.,BurningMan,ctv2u45,2,t5_2qj68
4764746,0,t1_ctv4gux,Thanks Saul!,BurningMan,ctv52bh,3,t5_2qj68
4770588,0,t3_3g7r3d,deleted,BurningMan,ctvvj3j,2,t5_2qj68
4782232,0,t1_ctwezlg,Not a dumb question at all  it requires taking off the inside panels near the taillights as if youre changing the tail light bulbs and tapping into the wiring. You will have to cut wires that go to your taillights and its scary!!  Im not very proficient with cars but I found some instructions online and used twiston wire connectors to insert it in line with the tail light power. Unfortunately Im having trouble finding the instructions now. ,BurningMan,ctxc9s5,1,t5_2qj68
4792818,0,t3_3gj3dj,What day is your EAP for?,BurningMan,ctyo9ky,1,t5_2qj68
4794101,0,t3_3gjzb7,gt Wondering how far I can stretch  yard. About a yard.  Depends how you plan to use it.  If youre cutting tassels and whatnot make sure they wont get bound up in the spokes.,BurningMan,ctyu3a6,2,t5_2qj68
4800890,0,t1_ctzopdj,yay!,BurningMan,ctzox4l,1,t5_2qj68
4802174,0,t3_3gmuka,So I take it the handkerchief wont cut it? ,BurningMan,ctzuqwb,3,t5_2qj68
4811832,0,t1_cu11ptx,Have fun with your border crossing if youre willing to be that standoffish with the guard. ,BurningMan,cu12kxr,2,t5_2qj68
4825247,0,t1_cu2r2bl,True thanks.,BurningMan,cu2rfg4,1,t5_2qj68
4838729,0,t3_3h4sld,People bring helium every year for the lighted string of balloons art pieces. I dont know if they have to do anything special for that though.,BurningMan,cu4gkgs,2,t5_2qj68
4840171,0,t1_cty9s8e,well you wouldnt want anything abrupt....,BurningMan,cu4n3rj,1,t5_2qj68
4843267,0,t3_3h6lzs,I made a list my first year and did none of it. So now I just kind of freestyle except for my scheduled shifts. Once I finish those however I just do whatever I want. I dont like the pressure of I want to see... I just like meandering and finding. Sometimes Ill see something midweek that I want to find like a burn but even then I usually miss the thing I wanted to see in favor of the thing in front of me. ,BurningMan,cu513wu,2,t5_2qj68
4844382,0,t3_3h8cnr,Last year was my first burn and went into it not knowing anything about Burning Man other than it being a large gathering in the desert and was told  by my camp to put aside X amount of dollars for supplies including food and water and to bring a bike or be miserable without one and like you hadnt rode a bike in a few years. Thats basically the only training I had and got by just fine without having to train my mind and body. Then again Im fine with going to sleep at AM whilst listening to pounding dance music for a week straight and waking up in an oven for a tent at AM. For some that might be a problem. ,BurningMan,cu565q7,2,t5_2qj68
4845369,0,t1_cu5aiv2,I never joke about bacon.It might work better if you make a quest to infiltrate the meeting of the occult redditors and feed them all the enchanted bacon. I wont be too hard to find. Ill probably be the asshole with a mister.,BurningMan,cu5amum,2,t5_2qj68
4846933,0,t1_cu5atst,Im in San Diego and have been remarkably accepting of the heat soley because I leave for the Playa in a week and dont mind a little warm up. Pun not intended but happily used.,BurningMan,cu5hq5i,1,t5_2qj68
4848826,0,t1_cu592ip,Umm why would the price change?  Im not here to profit off of anyone or I wouldve been selling hard.  Who Im willing to sell to has certainly changedAnd yall are the reason.  Good job.,BurningMan,cu5qayc,1,t5_2qj68
4851501,0,t1_ct245kd,Keep a small notebook with you its handy for things like this.,BurningMan,cu62g7m,1,t5_2qj68
4852630,0,t3_3hccqb,I have had an Ikea foam mattress for years and love it.  I roll it up for transport.  Totally transformed camping for me.,BurningMan,cu67ko9,1,t5_2qj68
4853649,0,t1_cu6bmpr,I mean I prefer eating ginger over any of the other things I listed so I hear you. ,BurningMan,cu6c78x,1,t5_2qj68
4853676,0,t1_cu598n8,Ask for Lolo  Ill have something for you!,BurningMan,cu6cbo8,1,t5_2qj68
4853924,0,t3_3hcchi,deleted,BurningMan,cu6dg72,1,t5_2qj68
4856506,0,t3_3hdw8l,WANT,BurningMan,cu6p6kq,2,t5_2qj68
4865597,0,t3_3hj4zm,deleted,BurningMan,cu7ugoc,1,t5_2qj68
4866344,0,t3_3hj8uw,im doing this too!so you split the  feet pipes into  feet pipes? why?,BurningMan,cu7xung,2,t5_2qj68
4870311,0,t1_cu8fsut,Sometimes its actually past the trash fence to keep it exclusive. Just jump over the fence and keep walking towards the lights you see way off in the distance. ,BurningMan,cu8fuja,5,t5_2qj68
4871280,0,t3_3hlxbx,I volunteer. ,BurningMan,cu8k8zr,2,t5_2qj68
4873877,0,t1_cu7dqdj,They dont like purple right? Tell me they dont like purple!,BurningMan,cu8w2bl,1,t5_2qj68
4881296,0,t1_cu9p7d0,its also credited on the actual site and map as the Big Rig Jig by Mike Ross  ,BurningMan,cu9tpox,1,t5_2qj68
4883274,0,t1_cua0i9b,Nobody is even talking the scorpions who are probably on the verge of a population explosion after theyve been gorging on bugs all week,BurningMan,cua2pa1,6,t5_2qj68
4883690,0,t1_cua3rlm,Fuck yes. that rocks!,BurningMan,cua4lc5,2,t5_2qj68
4884339,0,t1_cu9t1p2,Burner Redditors apparently dont like Starship Troopers. Should make for a nice boring reddit meet up on playa.,BurningMan,cua7jof,1,t5_2qj68
4884763,0,t3_3hiv3v,to be fair  has all those other problems toowhere is my fucking time machine already,BurningMan,cua9h3w,1,t5_2qj68
4888786,0,t3_3ht63s,LEOs are there during EA in full force. Maybe more than during the normal event because the LEOs are fresh and there are fewer burners per LEO.  Be on good behavior the whole time. ,BurningMan,cuarqk8,2,t5_2qj68
4893425,0,t3_3hvzvh,Did the frozen burritos  and doing them again this year. They work fine and are a lifesaver. Highly recommend with Cholula hot sauce.,BurningMan,cubct2l,2,t5_2qj68
4893481,0,t1_cub9ckq,Well I think whats been happening I stress that I consider myself a newbie still  first burn in  is that its SLOWLY amp gradually being commodified year over year and that if a very strong amp vehement backlash doesnt happen its going to continue in this direction.So I think very vocal and strong opinions delineating this online inperson and so forth are more than welcome in my book. . cheers,BurningMan,cubd285,3,t5_2qj68
4897655,0,t1_cubvqpd,Youre right there isnt. Its why Ive said above that I dont see any use or point in reporting it.However youre wrong on the idea that Burning Man is about freedom to do what you want without judgment. There are many rules there and many social mores. Its not freeforall anarchy.,BurningMan,cubvzkv,1,t5_2qj68
4898249,0,t1_cubxljx,Actually it is. The few answers he got before making that edit were direct and to the point. Trying to break the news to him gently that what he was considering wasnt going to work would absolutely have required more effort. Im not even sure how we could have done that. The fact of the matter is the answers he got were helpful. There isnt anywhere you can just leave your car safely out there and the finding somewhere to park within  miles does completely fly in the face of what the Borg is trying to do with the VPs. We answered his question simply and quickly. Being dicks would have been saying yeah sure no worries that sounds like a brilliant plan or not bothering to answer at all. ,BurningMan,cubyoj4,1,t5_2qj68
4902061,0,t3_3hxvzc,Foot powder on a whim. Never used it for my feet ever at any point in my life. Ended up saving my butt. Literally. No underwear during build week led to some major chaffage.,BurningMan,cucfyks,1,t5_2qj68
4902266,0,t1_cubvvv1,Didnt see this before I wrote my comment. But I have the exact same problem. I wake up to a nice spritz and enjoy some throughout the day until things get cool enough that I drink too much to remember self preservation.,BurningMan,cucgw2l,1,t5_2qj68
4903527,0,t1_cucm8o8,Whos working burn night grave with me? BEST SHIFT IS CRAZY SHIFT!!!,BurningMan,cucmlfs,6,t5_2qj68
4905050,0,t3_3i24sq,gtMy favorite piece appeared on NBC.com. It used the same set of quotes and attributed them to Burning Man organizer John Curley. Burning Man organizer! Hey I should get a raise!Lol...,BurningMan,cucthda,1,t5_2qj68
4909883,0,t3_3i583r,I could totally see Barack Obama going to burning man once he is out of office.  My guess is hed only come for a day or two  fly in fly out but I still think that would be awesome to see him out on the playa.Dennis Kucinich went last year  he drove right up to gate in a Toyota Prius.,BurningMan,cudfeil,1,t5_2qj68
4911352,0,t3_3i5on6,I have a similar coleman tent. Took me about an hour to cut up a thrift store bed sheet and hot glue over the mesh. Not the neatest finished product but the fly covers it up anyways. ,BurningMan,cudm2mp,1,t5_2qj68
4911371,0,t1_cudg6u8,I dont know why I cant stop laughing at this exchange. Im starting to lose my grip. ,BurningMan,cudm5qf,2,t5_2qj68
4911456,0,t3_3i5xnp,Not to hijack but Ive seen a lot of these posts as well  I just got a new to me truck  still has dealer plates... Obviously there isnt anything illegal about dealer plates but anyone think Im lookin to get hassled with dealer plates?,BurningMan,cudmjlx,2,t5_2qj68
4911839,0,t3_3i5hos,deleted,BurningMan,cudo9zd,1,t5_2qj68
4914802,0,t1_cudxjmu,Thanks for the offer I think Im going to be fine. Just did the walls and still on the first roll. Im in Tucson anyway. ,BurningMan,cue1qu1,1,t5_2qj68
4918378,0,t1_cuegx0h,. gallons per day per person,BurningMan,cuei04h,16,t5_2qj68
4919122,0,t1_cuel78b,slave on friday night was nice ,BurningMan,cuelduu,1,t5_2qj68
4921384,0,t1_cueuejf,deleted,BurningMan,cuevnc3,1,t5_2qj68
4925447,0,t1_cufdx2x,it worked its down,BurningMan,cufe3lu,1,t5_2qj68
4927218,0,t3_3idvmz,I believe you need ID,BurningMan,cufm5a4,1,t5_2qj68
4927740,0,t1_cufoh55,Yup this is what I do.,BurningMan,cufoip1,1,t5_2qj68
4928492,0,t3_3ieq62,Well... she does call herself a DJ these days.  I wonder... heh.  Something tells me its an inside joke or someone else using her name for fun and profit,BurningMan,cufrxne,3,t5_2qj68
4928627,0,t1_cufpagf,ControlF lets the computer do the searching for you.,BurningMan,cufsjq3,4,t5_2qj68
4931117,0,t1_cug3s6j,a fucking bear coat! too big at the neck and the arms part. Can something this even be altered?,BurningMan,cug3ty2,0,t5_2qj68
4931329,0,t3_3ifn5z,Your friend will be treated like a stowaway when he tries to come in Wednesday. Gate has seen every type of scam.,BurningMan,cug4sm3,1,t5_2qj68
4932401,0,t3_3ie6dw,dont go Justin martin. ,BurningMan,cug9o5o,2,t5_2qj68
4933726,0,t3_3igtl1,Who knows maybe this new badgejockey will run into a disgruntled exTV reporter with a hardon amp a gun.  lol ,BurningMan,cugfoo2,-13,t5_2qj68
4937837,0,t3_3ii0ir,bring long underwear tops and bottoms. that usually makes whatever else your wearing enough. coming from Denver so we are not pussies about cold,BurningMan,cugycms,2,t5_2qj68
4939618,0,t3_3i3nq4,Small ass camp.  and d. We like chill stuff and have a setup. Have a cuppa and chat.,BurningMan,cuh6fpr,1,t5_2qj68
4939937,0,t1_cuh73f6,Oh fuck.So heres the thing my cup is a oz bubba keg.  I love my cup.  My cup almost got me killed last year when some joker filled it  full of really good long island iced tea.  I didnt actually realize what was going on until about  hours later when I was ripped to the tits dehydrated no alternate cup for water pissed as hell and still drinking that goddamned long island.  I could leave that behind this year...  Heres the catch however I bought an emergency backup princessbedecked cup it matches my outfits! and its already packed in the communal camp bins.  Leaving my primary cup behind just feels like cheating now ,BurningMan,cuh7vm7,1,t5_2qj68
4943205,0,t1_cuhgcmp,The year I didnt go I plotted our then new theme camp. It was a better mental exercise than pouting. ,BurningMan,cuhmpeg,2,t5_2qj68
4943868,0,t3_3imjqv,might be a little difficult to get existing and aux speakers to play simultaneously but you could use a headphone jack splitter and TWO sets of auxiliary speakers... although your overall output will diminish if your speakers arent powered.is it like one of these or one of these?,BurningMan,cuhppwc,1,t5_2qj68
4945370,0,t1_cuhwcv6,Battery operated? Where did you get it?,BurningMan,cuhwjmg,1,t5_2qj68
4946001,0,t1_cuhz2x2,true i thought most of you would already have been there by now sorry.,BurningMan,cuhzesr,1,t5_2qj68
4946777,0,t1_cuhwppf,I havent had issues even without it lit but of course ive never had a cop behind me out there. Gonna play it safe this year. Thanks for the reply,BurningMan,cui2xn6,1,t5_2qj68
4952502,0,t1_cui0vbu,Right.  The timeline is very loose and the plan is to enjoy getting there and not be in a rush.  Thanks.,BurningMan,cuisx0u,1,t5_2qj68
4956948,0,t3_3isxd0,Be safe mudclub! Conditions on playa are nice but might be stormy tonight. No bugs yippie!,BurningMan,cujd3i6,2,t5_2qj68
4984259,0,t1_cumlm2o,No this is BS media trying to insert themselves into the conversation.,BurningMan,cumsdgb,1,t5_2qj68
4995399,0,t3_3j6x9g,You are in Nevada in the middle of the worst drought in recent history. All the wells from The last exit in California to Gerlach are nearly dry. One in our neighborhood upstream from Burning Man with a treatment plant in between had ecoli!!!Be careful with the water here.,BurningMan,cuo4r3h,2,t5_2qj68
5029310,0,t3_3jp9jy,Played this during the burn and it was perfect ,BurningMan,cus82a9,2,t5_2qj68
5044547,0,t1_cuu2338,Ah okay  makes sense. I thought I was missing something. I definitely wandered around it wondering what was different. Can you give word on what it was or is it still meant to be unknown to return another year?,BurningMan,cuu25i0,1,t5_2qj68
5050082,0,t3_3k4fuu,If youre in the first  streets the only relief from noise you should expect is from earplugs,BurningMan,cuuq5h6,7,t5_2qj68
5051428,0,t3_3k2nhb,Yes! That dude was amazing  my favourite dancer by miles.,BurningMan,cuuvzxw,1,t5_2qj68
5054899,0,t3_3k4u5e, Yeah give it up for burning man !Beats AntiqueIdk why. Just pissed me off.,BurningMan,cuvb22g,17,t5_2qj68
5056196,0,t3_3jygyb,I agree. It was my first burn and I was so disappointed with the amount of phones I saw out. People in the coffee lines staring at their phones. I feel like it took away from my experience. Live in the moment people!! Its only one week you can do it humans!! ,BurningMan,cuvgnz8,1,t5_2qj68
5058659,0,t3_3k9j1f,deleted,BurningMan,cuvrces,1,t5_2qj68
