,controversiality,parent_id,body,subreddit,id,score,subreddit_id
2290298,0,t3_2lfmt5,Holy crap the hype on this thing. Im not swept away in it but Im still really excited. Hard to get excited about something when your head feels like a meteor and your throat feels like literally rocks.,beeandpuppycat,cluspj2,2,t5_2xrdy
2309443,0,t1_clx4kkj,yes she shouldve know that all her dreams would come true and then did lower quality work so you specifically would not be annoyed with the change in artstyle,beeandpuppycat,clx5w51,-5,t5_2xrdy
2460698,0,t3_2n1dgg,Seems like there behind schedule with finishing animating the entire series. They might as well waited till Dec to start airing them rather than having this waiting period for new eps to start coming out. ,beeandpuppycat,cmfue01,3,t5_2xrdy
2550630,0,t1_cmqo5bh,Whats crazy is that even though its only six minutes theres still quite a bit of character development! Bee and Puppycats relationship has changed drastically from Episode  to .,beeandpuppycat,cmri6ib,1,t5_2xrdy
2790165,0,t1_cnk7a7h,Yeah its a pretty small room but we tried to maximize the space,beeandpuppycat,cnl8csd,1,t5_2xrdy
2874746,0,t3_2s6476,I dont think that a poll would be a good way to guage this. As of right now there are about  votes but the latest episode has  likes. When the end of Season  rolls around theyll probably start up another Kickstarter just because of how popular it is. I didnt donate the first time but Id love to now that I have a job.,beeandpuppycat,cnuuxp0,3,t5_2xrdy
8057690,0,t1_d4lqwkk,Thank you!,beeandpuppycat,d4lrdza,1,t5_2xrdy
8138947,0,t1_d4b5h48,Maybe thats what they think people in their early s are like. Or maybe thats the kind of person Allegri sees herself as Bee as selfinsert and all that which should raise even more questions.,beeandpuppycat,d4uwwqi,3,t5_2xrdy
9800464,0,t3_5fibg3,Heyyy you wouldnt happen to have Birthday Game as well would you? ,beeandpuppycat,dal49wd,1,t5_2xrdy
10305032,0,t1_dcb61xg,ujimmyjrg just posted a dropbox link to the entire soundtrack!!! check it out!,beeandpuppycat,dcc4pst,2,t5_2xrdy
10756814,0,t3_5tjd1r,Downloaded goes amazingly with my crystal blue DS. Thank you kindly!,beeandpuppycat,ddphh47,2,t5_2xrdy
11792245,0,t1_dgwej0h,I hope they make another Kickstarter. I think enough people would still be interested. ,beeandpuppycat,dgwovlo,2,t5_2xrdy
