,controversiality,parent_id,body,subreddit,id,score,subreddit_id
6163346,0,t3_3zu5hv,I love that you have kept your garments! Never miss a photo op.,exmormon_nsfw,cyq7jk6,2,t5_2y7rz
7599440,0,t3_4j8lt1,Very nice. Thongs are so sexy to me. My wife will not  wear them.,exmormon_nsfw,d360o1r,1,t5_2y7rz
7616106,0,t3_4jloai,Its definitely happier now! Thanks!,exmormon_nsfw,d37wtt7,2,t5_2y7rz
7656826,0,t3_4j1e8p,Ayyyyye Sactown represent,exmormon_nsfw,d3cje7i,1,t5_2y7rz
7825757,0,t1_d3vhbf3,That sucks!  It only takes one idiot to ruin it for everyone.,exmormon_nsfw,d3vojok,2,t5_2y7rz
7904888,0,t3_4mh2vs,Im sad I missed the show ltsighgt.  Sorry they abused your trustgoodwill. ,exmormon_nsfw,d44l2g7,1,t5_2y7rz
8564669,0,t1_d69fpbb,I really dont get why so many Mormons are on Tinder.. I see it all the time out her in CA. . Just bogles the mind... I mean they do understand that its a hookup app right? haha,exmormon_nsfw,d6c5un1,0,t5_2y7rz
9110163,0,t1_d86lcpd,Thanks,exmormon_nsfw,d86w7fb,1,t5_2y7rz
10104021,0,t3_5k1y6w,Provo,exmormon_nsfw,dbokdu8,1,t5_2y7rz
10232889,0,t1_dc3ohuf,It blows my mind how the milf label gets thrown around. Youre sexy and I love your posts ,exmormon_nsfw,dc3yema,1,t5_2y7rz
10236875,0,t3_5mgcj1,Im just happy you are back. ,exmormon_nsfw,dc4enpa,2,t5_2y7rz
