,controversiality,parent_id,body,subreddit,id,score,subreddit_id
83647,0,t3_1v2335,Argh seems like I need to claim another house now that Nick officially claimed the one I claimed. Edit I request that this house be registered under my name. Theres also space for another player to move in.,GrishinoTown,cenya01,2,t5_2zqgx
85759,0,t1_ceo3rrw,Just on the edge of town.  Figured one person would not take off with  pairs of pants.,GrishinoTown,ceo6xxu,2,t5_2zqgx
89460,0,t1_ceo9m2f,Yeah... RIP in peace good buddy,GrishinoTown,ceom3zy,1,t5_2zqgx
92654,0,t3_1v5sij,Just remember folks its a game and not to take it too seriously.That aside the Glorious Grishino will crush the Republic scum!,GrishinoTown,ceoz831,6,t5_2zqgx
109246,0,t3_1vcfzo,Fine by me.,GrishinoTown,ceqvbvx,2,t5_2zqgx
112734,0,t1_cer75di,deleted,GrishinoTown,cer9mq2,1,t5_2zqgx
121328,0,t3_1vh83k,if you need help to reach grishino I am in cherno dude i can escort you to Kabanino and help you gear up.Survive on ,GrishinoTown,ces8wb1,1,t5_2zqgx
161255,0,t3_1vvknh,BWAAAAAAAAAAHAHHAHAHAHAHAHAHA.... Approved. ,GrishinoTown,cewst3r,1,t5_2zqgx
174169,0,t3_1w36dj,Little messed up but its not the final so thats ok,GrishinoTown,cey9rmz,3,t5_2zqgx
228558,0,t1_cf485du,Im not even going to grace this with a response. ,GrishinoTown,cf4frr9,-2,t5_2zqgx
