,controversiality,parent_id,body,subreddit,id,score,subreddit_id
8941803,0,t1_d7mn7ft,One way to follow up with the company is to say Dear XX Thank you again for taking the time to consider me for this position.  I am really excited about the opportunity and would love to be a part of XX team.  I currently have an offer from another organization and was wondering what the timeline is for this position. While Id prefer to work for xx company I do need to get back with a decision soon to the other organization. or something along those lines.,GetEmployed,d7mo8lx,2,t5_2uagc
9063742,0,t3_54d6gr,deleted,GetEmployed,d81bd3v,2,t5_2uagc
9350430,0,t1_d9181sl,Im from london,GetEmployed,d918gne,1,t5_2uagc
9385598,0,t1_d95hcs0,Within my company its much less pay. The only other option is Amazon and its even less.While I wouldnt mind a pay downgrade I make runs on the regular to my companys warehouse and its full of people Id hate to work with.,GetEmployed,d95ov80,1,t5_2uagc
9947592,0,t3_5hw63m,You can always try the generic dear Hiring Manager or a similar title but in many cases you can call or emailcontact us on the companys website and simply say  Hi my name is  and Im interested in applying to a position at your company. I was wondering to whom I should address my cover letter and  times out of  theyll hook you up with the persons name which will show that person you took the initiative to find out whos in charge which looks good on you.,GetEmployed,db4734z,1,t5_2uagc
10110736,0,t1_dbpfceh,As an actuary you need to pass actuarial exams provided by the SOA or CAS. Companies will not even look at you without one.Edit These exams are notoriously difficult even amongst math majors. At a minimum you need to have calculus  under your belt. Beyond that the exams are based on statistics and probability. To become an ASA you must pass  exams. ,GetEmployed,dbpftfg,2,t5_2uagc
10139929,0,t3_5l4syl,Im going to let you in on a horrible truth. Its not what you know its who you know. You could be the greatest graphic designer known to the gods themselves. Photoshop trembles with anticipation at your touch. Mac computers gird their loins when youre near. However Jim whose got a kid whose is a great lad really he went to a nice college for the course hes going to get the job. As Jim works with Linda who hires everyone. If they got it get them a poke on the Linked in. Past that its all hope. If its something youre really after phone them. Be polite. Hello Im glasswr Im wondering if I could talk to someone about your graphic designer position. I say it was recently readversited and wanted to get more details on the listing Something like that. Worst they can say is no. Or go into the place if its that local. Wear something decent. ,GetEmployed,dbt8jn8,7,t5_2uagc
10216485,0,t3_5m28u2,UPDATE I start Monday.,GetEmployed,dc23h0j,10,t5_2uagc
10264080,0,t3_5mz6ph,Temp services fast food state employment service? ,GetEmployed,dc7hmle,3,t5_2uagc
10452566,0,t3_5pm90a,im at the point where im blatantly lying on my applications...and its getting me interviews left and right. just lie. if they catch you on it bring up Donald Trump being president and how you dont need experience. ,GetEmployed,dcswecx,5,t5_2uagc
10523115,0,t1_dd05xeo,deleted,GetEmployed,dd0wq4o,1,t5_2uagc
10681488,0,t3_5spv0z,Its very tough to make big changes like the ones youre makingcompared to the ones youve mentioned getting a job will be easy as pie as long as you try hey rhyme.I have one piece of advice for youwhatever job you go for remember that the employer doesnt need to know your life story. They dont need to know about the  coupon or how many times youve switched majors. They dont even need to know you have any employment history. Theyre also not allowed to ask your age but if they did  is pretty young and I dont think think theyd be judging you for a lack of work history. It takes time for a lot of people to figure out what they want to do in lifeeven when they graduate or get a good job and dont find it satisfying. Theres really no shame in trying different things or taking a break from school. Youre doing just fine.I guess I have another piece of advicewhoever youre comparing yourself to stop. Maybe you know a few people your age who seem to have it all figured outtheyre lucky. Im sure there are things you have that they dont. I only say this because you mention feeling like a failuretheres clearly a standard youre comparing yourself to. From where I sit youre really young resilient and thoughtful and you have plenty of time to figure things out. A job is a good next step because you will learn what you want and dont want out of your next one.,GetEmployed,ddhpqkh,2,t5_2uagc
11126188,0,t1_det2a18,how the fuck do multiyear unemployed people have significant others but I havent boned in years with a steady job,GetEmployed,det56z2,1,t5_2uagc
11177601,0,t1_deyytqc,You say that like Im not already doing that haha.  Trust me Ive taken all those steps and then some.,GetEmployed,deyyvkp,4,t5_2uagc
11244428,0,t1_df61n4k,I see your point. It feels like a kick in my back but I get it.,GetEmployed,df6jf8y,1,t5_2uagc
11272527,0,t3_60uh42,Id say its definitely a red flag. If you take the job and they do end runs around you in the future can you be surprised? If they will do this thing that is very out of the norm will they do other outofthenorm activities in the future out of a similar disregard for how it impacts you...for example asking you to work late off the clock or something else equally shady?While youre interviewing if you tell them they were out of line you may not get the job. Youll at the very least put them off so maybe they offer you less money. So you may not want to weaken your footing. If the red flag is big enough and you have other equally good prospects you may want to tell them theyre out of line that youre out and that if they dont want to chase off top talent they need to get it together. If you really needwant this job I wouldnt say anything until after theyve made the offer with terms attached salary vacation etc....then Id say Ill take it but I need to know that you trust me from now on so this was out of line and I need to know that youre not going to be looking over my shoulder every  seconds.,GetEmployed,df9q3a4,3,t5_2uagc
11459380,0,t3_63jo92,Just putPrince Gumball And underneath it in italics Special Events. And I hope you are using a business card service that helps you design and print. Moo.com is great. And if you really want to kick ass amp take names go to wix.com and just do a  page cv on yourself. Youcan add that URL to your business card.,GetEmployed,dfuwvsk,2,t5_2uagc
