,controversiality,parent_id,body,subreddit,id,score,subreddit_id
786707,0,t1_cgtj8po,To be fair the metal acclimation at Warped has been going along for quite a while. Warped crowds have been exposed to extreme metalmusic over the years and personally Im a little surprised that it took so long. Not to say Im not stoked I LOVE the fact they had such a good response. It just shows how truly versatile they are. They seriously cover all the bases under the giant umbrella of metal. Intermittently they are thrashy technical brutal grindy epic groovy etc seriously there are a ton of adjectives I could use here and because they are all of these things they can transcend peoples metal tastes.They are the modern aggregate of what makes metal fucking awesome. ,TheBlackDahliaMurder,cgtpb40,5,t5_2xj6i
1114552,0,t3_210efb,My favorite is the Mexico tour shirt.,TheBlackDahliaMurder,chuzeza,1,t5_2xj6i
1309598,0,t3_292cas,Whered you get the prints?,TheBlackDahliaMurder,cigy2p7,1,t5_2xj6i
2455248,0,t3_2nn99h,Did my Instagram but forgot to post here haha. I suck. There are also two different pressings at the A site,TheBlackDahliaMurder,cmf65qi,2,t5_2xj6i
4390712,0,t1_csjsr3p,Awesome thanks,TheBlackDahliaMurder,cskki1d,1,t5_2xj6i
5206589,0,t1_cvdjjpi,Oh okay thatd be great! Ill remind you.,TheBlackDahliaMurder,cvdl4b9,1,t5_2xj6i
8022543,0,t1_d4haezk,Did they just stop printing and selling it or why is it so difficult to get hold of it?,TheBlackDahliaMurder,d4ht4tx,1,t5_2xj6i
8898475,0,t1_d7hdef9,Well seeing as how it fits more with the album theme I would go with green.,TheBlackDahliaMurder,d7hgwjh,1,t5_2xj6i
