,controversiality,parent_id,body,subreddit,id,score,subreddit_id
2103288,0,t3_2iyu95,Bonus pic ,TaylorSwiftPictures,cl769d0,8,t5_2wqat
3093530,0,t1_coin1ph,I couldnt find a source just tumblr links.,TaylorSwiftPictures,coin5ol,1,t5_2wqat
3268616,0,t1_cp0lorf,Literally perfect ,TaylorSwiftPictures,cp0ukmk,3,t5_2wqat
3369562,0,t1_cpcatbv,From the photographers site...,TaylorSwiftPictures,cpccsky,8,t5_2wqat
4103395,0,t3_37g4zg,The cat is actually taking its Taylor out for a walk,TaylorSwiftPictures,cro0g12,2,t5_2wqat
4324277,0,t3_3aj3eb,Higher res? Someone please? ,TaylorSwiftPictures,csd2peu,4,t5_2wqat
5060543,0,t3_3k9ua1,Ive seen this a lot but what is it from?,TaylorSwiftPictures,cuvzj3k,2,t5_2wqat
5856044,0,t3_3vez22,Her eyes are such an amazing shade of blue,TaylorSwiftPictures,cxn97rc,7,t5_2wqat
5946401,0,t1_cxys78r,If she ever disappears under suspicious circumstances Im pointing the FBI in your direction.,TaylorSwiftPictures,cxz3q8n,6,t5_2wqat
5996867,0,t3_3xl800,Heres the full size because shes wearing cool shoes ,TaylorSwiftPictures,cy5pxr5,7,t5_2wqat
6230196,0,t3_40ubqm,Id lick those thighs.  Even if she didnt wash.,TaylorSwiftPictures,cyxszyg,-1,t5_2wqat
6230600,0,t3_40ubqm,I like Taylor with a pale lip ALOT,TaylorSwiftPictures,cyxung7,3,t5_2wqat
6258782,0,t1_cz0wrd0,Subbed.,TaylorSwiftPictures,cz11zid,2,t5_2wqat
6484673,0,t3_44eexx,I love her hair. Its on point. The shape and style. P,TaylorSwiftPictures,czq2ac2,1,t5_2wqat
6885757,0,t3_4a0qul,Im interested in seeing the whole outfit ,TaylorSwiftPictures,d0wtflr,2,t5_2wqat
6928604,0,t3_4alaz3,removed,TaylorSwiftPictures,d11okx1,-2,t5_2wqat
7748116,0,t3_4l98bv,Oh more like that. ,TaylorSwiftPictures,d3mwjr0,2,t5_2wqat
7806400,0,t3_4lwk0u,This picture is iconic.,TaylorSwiftPictures,d3ti2cv,2,t5_2wqat
7991748,0,t3_4ooos3,,TaylorSwiftPictures,d4ecjzq,2,t5_2wqat
8018394,0,t1_d4hbihx,Ugh these puns are so bad. Now go stand in the corner and think about what you did.,TaylorSwiftPictures,d4hcbt3,6,t5_2wqat
9612769,0,t1_d9xuuk0,You have to admit shed make an excellent flapper though.,TaylorSwiftPictures,d9xyya5,2,t5_2wqat
11637522,0,t1_dgbg5l0,Your stamina is impressive but not something we want to have on this subreddit,TaylorSwiftPictures,dgf4jve,1,t5_2wqat
11689442,0,t1_dgj2lab,I am insanely jealous this look was one of my favorites of hers.,TaylorSwiftPictures,dgl0lcr,2,t5_2wqat
