,controversiality,parent_id,body,subreddit,id,score,subreddit_id
10019869,0,t3_5ij7xr,Well done mate! ,No_Fap,dbdm7zs,2,t5_3go0e
10058492,0,t1_dbgxfh9,Cheers brother it can be hard Im travelling right noe and I find my days are boring and stressed. I ended up relapsing last night but I accepted and moved on its just having a clear mindset and getting through it. I want to stop to improve my mentality and sex life ,No_Fap,dbin9e0,1,t5_3go0e
10243392,0,t1_dc54rmr,Yeah working out seems to really balance myself out in all honesty. I need a job got a lot of extra energy. How do you let stuff go?,No_Fap,dc558qz,1,t5_3go0e
10330352,0,t3_5nxbk1,Good job,No_Fap,dcf04ei,1,t5_3go0e
10456068,0,t3_5pm3uz,Thanks for the link seems like a good read. Will take a look at it. Ive already started feeling urges and trying to overcome them ,No_Fap,dctat4d,1,t5_3go0e
10949263,0,t1_ddz8h4f,Of course u not gonna find it hard to stop not fapping!....ur a girl!....smh....anyway Im not gonna waste my energy....I already done explained eveything dat needed to be explained.,No_Fap,de9c7qu,1,t5_3go0e
11055626,0,t1_del4gl6,Yeah but still though Im addicted to porn Im pretty sure. So the addicts symptoms that affect people addicted to cocaine and meth are happening to people addicted to porn. It rewires the brain so that you crave porn and fapping like how crack heads crave crack etc. So I have in the past  years have thought Ive been Depressed bipolar etc and Im just now realizing that Im addicted to porn. So my anxiety low energy wanting to fap just to feel normal and so on is from me fapping everyday for the past  years. So Ya now Im gonna post in the NoFap reddit page that Im gonna do the NoFap challenge. I thought maybe I would explain a little about myself and things related to this topic in my life. Rant ,No_Fap,del4xhi,2,t5_3go0e
11392386,0,t3_62kuvy,PMO means porn masturbation orgasm.,No_Fap,dfnb6m2,1,t5_3go0e
11809273,0,t1_dgx3icp,yo what up man  days is no joke !!! not sure how you feel about it but yeah you should feel good and maybe try another  days haha i havent been able to go that long in  years ,No_Fap,dgymemx,1,t5_3go0e
