,controversiality,parent_id,body,subreddit,id,score,subreddit_id
341480,0,t3_1y03s6,deleted,FootFetish,cfg5x3v,8,t5_2qofz
1229861,0,t3_285srw,California awesome. ,FootFetish,ci7z6kq,2,t5_2qofz
2043607,0,t3_2i5gog,Got the video?,FootFetish,ckzl5zi,2,t5_2qofz
2377538,0,t1_cm5kj1t,It sounds like he has a good knowledge of the layout of the house! Ha well if he is down there that much I suspect he will be moving in in the near future.  tongue piercings!! Ive never seen that many!! Wow. Yeah I am sure that would have an amazing feeling on a guy and on a female....holy cow she would be in heaven. Shed want to marry you! ,FootFetish,cm5km89,1,t5_2qofz
3796453,0,t1_cqoybbl,deleted,FootFetish,cqp0xx7,1,t5_2qofz
3953927,0,t3_35phhd,holy fuck,FootFetish,cr6zc2l,0,t5_2qofz
4620605,0,t1_ctcznx2,I actually just gave it a shot but unfortunately Im a public figure and need major discretion. It might not work for me.,FootFetish,ctd04ze,1,t5_2qofz
4939467,0,t3_3iikaj,Amazing. I wish I could suck on your toes.,FootFetish,cuh5r3y,2,t5_2qofz
5108991,0,t3_3geubw,Still posting those gross disgusting feet. I cant believe people pay for this crap. Its such hard work she says hahahahaha! I can do what I what girl power yay.,FootFetish,cv1tphs,-5,t5_2qofz
5334729,0,t1_cvswukn,try looking up full nelson,FootFetish,cvtkk0q,1,t5_2qofz
5644562,0,t3_3seif0,..... yes Domina!!!! pet is sorry Maam.... ,FootFetish,cwwrggw,2,t5_2qofz
6051633,0,t3_3yemup,Your feet are so beautiful,FootFetish,cycvcwl,3,t5_2qofz
6282823,0,t1_cz3aw7w,Red or a dark blue,FootFetish,cz3sbgu,1,t5_2qofz
6953151,0,t3_4arord,Those soles need work!,FootFetish,d14gzyz,1,t5_2qofz
6989561,0,t3_4bf0mw,Lovely indeed. Might want to try posting on rfeet as well much larger community over there.,FootFetish,d18lwx5,1,t5_2qofz
8111379,0,t3_4mnhx7,deleted,FootFetish,d4rsizx,1,t5_2qofz
8138695,0,t3_4q9kqv,The only people who wanna pay for shit on the NSFW part of reddit are on rsexsells now scram.,FootFetish,d4uvrw7,1,t5_2qofz
9063284,0,t1_d7ev0s1,she does in fact like it when i give her a foot rub or pedicure  however when things turn sexual shes really not comfortable with the fact of worship or footjob  but every once a year she grants me a footjob even if i can see its against her will . ,FootFetish,d819dvt,1,t5_2qofz
9239307,0,t3_56wobs,Shell get used to it. My last girl was the same way. She made it all the way go licking and sucking. Just had to do it enough times to get over it.,FootFetish,d8n5e52,1,t5_2qofz
9416380,0,t1_d99g5dn,I enjoy all the foot rubs I get .... more guys should be open about it I love it. ,FootFetish,d99lb65,3,t5_2qofz
10087640,0,t3_5ka0fh,I dont live in nyc but Id definitely go. Just to see... for science.,FootFetish,dbmfqp4,1,t5_2qofz
10186026,0,t1_dbnmqcy,Mmmh come here then ,FootFetish,dbyn4sq,1,t5_2qofz
10536061,0,t3_5qurem,so cute ,FootFetish,dd2dnh1,1,t5_2qofz
10848572,0,t3_5uzait,Oh. My. God.,FootFetish,ddyycid,2,t5_2qofz
11382313,0,t3_62f65n,deleted,FootFetish,dfm5zey,1,t5_2qofz
11386799,0,t3_62hoaw,Gorgeous. So lickable. ,FootFetish,dfmoafj,1,t5_2qofz
11394586,0,t3_627ar0,May I worship them ,FootFetish,dfnk6wg,1,t5_2qofz
11507127,0,t3_640tpn, I like her pedicure a lot . Especially that color right there . If her toenail polish was candy coated  I would eat it off of her . ,FootFetish,dg0c17h,2,t5_2qofz
11531075,0,t1_dg2pbt9,Maybe Ill do more outside shoots come summer ,FootFetish,dg31sii,1,t5_2qofz
11600539,0,t1_dgarfpk,Since seven ,FootFetish,dgaxhml,2,t5_2qofz
11642964,0,t1_dgfqofu,Once it happens its great. Especially if its with a significant other. Then you get it to partake a decent bit!,FootFetish,dgfqs49,2,t5_2qofz
