,controversiality,parent_id,body,subreddit,id,score,subreddit_id
1052834,0,t3_264c90,We really need to change the sidebar pic.,KylieJenner,chnyn4c,1,t5_2too7
3214275,0,t1_courihc,deleted,KylieJenner,cov5szg,-3,t5_2too7
4601256,0,t3_3dvrcq,deleted,KylieJenner,ctaks5o,1,t5_2too7
4821832,0,t1_cu29vqw,deleted,KylieJenner,cu2by6o,1,t5_2too7
4881352,0,t1_cu9s3cw,People who do the porn deals have no money.  Kylie is already worth millions.  The only way this happens is if Tyga records something and sells it. ,KylieJenner,cu9tyun,2,t5_2too7
4948520,0,t3_3in5pi,The one on the right was a guy before.,KylieJenner,cuiausk,6,t5_2too7
5250880,0,t3_3mwfmk,The Transformation to A Kardashing is almost Complete !!!   ,KylieJenner,cvix4oj,3,t5_2too7
5895142,0,t3_3vyvac,Must smell like heaven,KylieJenner,cxsdy97,5,t5_2too7
5917804,1,t3_3wdrwf,,KylieJenner,cxvcsyr,2,t5_2too7
6281097,0,t3_41lrv1,It looks like she did her own lip challenge,KylieJenner,cz3l9mp,1,t5_2too7
6332290,0,t1_cz9eia7,Thanks! ,KylieJenner,cz9eub2,3,t5_2too7
7015153,0,t3_4bq7l8,Shes a pretty girl. A little plastic but still pretty.,KylieJenner,d1bikue,11,t5_2too7
8414749,0,t3_4urz8j,   ,KylieJenner,d5tdy5d,2,t5_2too7
8800095,0,t3_50nx6h,deleted,KylieJenner,d75ngy1,1,t5_2too7
9006569,0,t3_53kccu,God Damn,KylieJenner,d7ug5wv,1,t5_2too7
9170144,0,t3_55vera,Safe to say Kylie has the best ass in the family?,KylieJenner,d8edu2o,6,t5_2too7
9216273,0,t1_d8k26yv,I wouldnt be even able to slide it in without cumming ,KylieJenner,d8k8bip,13,t5_2too7
9491534,0,t3_5as0uz,I would give my left nut to tap that!,KylieJenner,d9j191i,3,t5_2too7
9730280,0,t3_5efpxb,I also hate all this photoshop and Instagram filter shit. Also I posted the pic on it here.,KylieJenner,dacgwtz,7,t5_2too7
9870316,0,t1_dau0lt9,,KylieJenner,dau4igm,173,t5_2too7
9933255,0,t3_5hpubm,Girl behind Kylie looks like a monster from a found footage film,KylieJenner,db2btuf,6,t5_2too7
9999031,0,t3_5iswoc,That last one. Goddamn i wanna eat her ass,KylieJenner,dbawhrd,28,t5_2too7
10018027,0,t3_5j421p,Thats a pretty aggressive title,KylieJenner,dbddldm,6,t5_2too7
10188969,0,t3_5lvsyc,I always wanted to see her bending over like that... now I can die a happy man,KylieJenner,dbyz5j3,4,t5_2too7
10197306,0,t1_dbwsyr7,removed,KylieJenner,dbzx65f,2,t5_2too7
10207448,0,t3_5m1hk6,Uhhh what picture was this? Its killing me to know,KylieJenner,dc12kju,1,t5_2too7
10219607,0,t1_dc2fanf,No offence..you cant tell me Tyga is apex when Blac Chyna didnt even want him. Tyga took advantage of a good situation. Thats what it was. Its not that she likes black dick. He made the investment. It paid off.,KylieJenner,dc2g7mz,13,t5_2too7
10535714,0,t3_5qv95l,thank god! she deleted it..,KylieJenner,dd2c8eq,1,t5_2too7
10630431,0,t3_5rkd0v,That is a juicy mound right there,KylieJenner,ddcg542,2,t5_2too7
10717533,0,t3_5t2ng1,Whos the girl ,KylieJenner,ddlfmyg,1,t5_2too7
10755798,0,t3_5tsmg2,Dammmmmmmnnnnnn she THICC ,KylieJenner,ddpdoi6,12,t5_2too7
10889773,0,t1_de0zoml,Just one? I wont be done that quickly.,KylieJenner,de37azy,6,t5_2too7
11000731,0,t3_5wyxer,Them Implants are really popping.,KylieJenner,deewf8f,6,t5_2too7
11171326,0,t1_dey94ue,You just comment  post pictures of fake celebrity ass all day? ,KylieJenner,dey9agq,-14,t5_2too7
11737200,0,t3_676fgc,deleted,KylieJenner,dgqfwix,0,t5_2too7
