,controversiality,parent_id,body,subreddit,id,score,subreddit_id
7894,0,t3_1u7htf,Actually someone who knows the position and speed of every given smallest particle that there is can predict the future.The problem is that we dont know how to do that yet at least without altering the position and speed of what we want to observe.,blowit,cefc2la,1,t5_2z3ek
10043,0,t3_1u7udm,I prefer to think of the B as the underboob view because underboob view gt overboob view.NSFW,blowit,cefku48,4,t5_2z3ek
13144,0,t1_cefh9ko,,blowit,cefxim5,3,t5_2z3ek
16987,0,t1_ceg1lwy,No because Australia is so much bigger.,blowit,cegd8rj,3,t5_2z3ek
27575,0,t1_cehkhf2,I think they need to be one sentence long.,blowit,cehklf1,1,t5_2z3ek
39925,0,t1_ceho36m,Some sort of proof is required for this to be counted as a submission.,blowit,ceiz5nj,1,t5_2z3ek
66499,0,t1_celyee7,But that is not what the title says is it?,blowit,cem01d3,2,t5_2z3ek
199397,0,t3_1wdvxq,The turning oxygen into red crystals was interesting to me as well.,blowit,cf15jcj,2,t5_2z3ek
213186,0,t3_1wi7xz,Faster than what rain? Surely wind has a huge effect on the speed of rain this is like saying light travels  million times faster than a walking human,blowit,cf2q661,2,t5_2z3ek
348781,0,t3_1y2hua,I did not beat my wife,blowit,cfgx3cg,8,t5_2z3ek
419764,0,t1_cfnq4k0,Ha looks like the mathematician forgot to check his work.  is BS.,blowit,cfo9vny,2,t5_2z3ek
424666,0,t1_cfo9vny,Only problem the formula I used is only meant to work for integers P,blowit,cfos5cz,1,t5_2z3ek
533169,0,t3_208fi3,Challenge accepted?,blowit,cg0vmgt,4,t5_2z3ek
950016,0,t1_chaly22,Approximately   minute songs in MP format.,blowit,chc9wbv,2,t5_2z3ek
990125,0,t1_chgtzwl,When I read that last line in the shitter yesterday and then looked at the eyes in the picture I fucking lost it.,blowit,chgu1qg,3,t5_2z3ek
1003016,0,t1_chg67hc,You should just shave your head. I bet youll look a thousand times sexier,blowit,chiauai,1,t5_2z3ek
1024037,1,t3_25tijd,This just isnt true.  Germany declared war on Poland Norway Denmark Belgium Luxembourg the Netherlands just to name a few.,blowit,chkotvj,-3,t5_2z3ek
1324067,0,t1_ciifnwr,Nt really. Everything object in the universe has a gravitational effect on every other object in the universe technically you have a gravitational effect on gold bars in a reserve and vice versa. Think of an objects weight as the sum total of the gravitational effects of every object in the universe with bigger and closer objects having more of an effect.For that gold bar in a reserve the Earth is the biggest closest object so its going to have the greatest effect on the weight.,blowit,ciikp0e,1,t5_2z3ek
1420576,0,t3_2adsvp,Say what you will about their human and labour rights but they sure want to build impossible stuff and I am absolutely hyped their build fest is basically pushing the limits of engineering past the current that cant be done.This if built would serve as a test bed for so many new techs we could use in future cities everywhere!,blowit,ciuci6e,6,t5_2z3ek
1477346,0,t3_2b12xa,A cannon blast sounded above her head and there projected against the sky was the familiar freckled face. Ferguson was dead. There was nothing Clarissa could do about it. And if she was going find water before nightfall shed have to keep moving. Shed mourn Fergwad when she wasnt fighting for her life.Coming over the ridge she spotted the burgershaped structure about a mile northeast. Her father had died after designing the arena food stations for the Capitol she remember his drunken complaints about how the innocent designs were to be littered with deadly traps.Hurrying through the underbrush Clarissa heard running water and saw a rushing rapid separating her from the food station. Then a clattering cacophony of tiny teeth snapping. Hundreds of baby caimans patrolled the waters. The Gamemaster had stolen the last thing she left behind in District  Elvis.,blowit,cj1gm59,5,t5_2z3ek
2480614,0,t3_2hjocx,Yah like in genesis go bbible checkmate athetits! ,blowit,cmicrsy,0,t5_2z3ek
2645845,0,t3_2q853p,If an atom was the size of an orange than an orange would be about the size of earth ,blowit,cn3xzz4,1,t5_2z3ek
4547942,0,t1_ct3w4un,So close!,blowit,ct3w5i6,3,t5_2z3ek
4548338,0,t3_3d9gif,If youre into this you should check out ,blowit,ct3xxxt,1,t5_2z3ek
4549472,0,t1_cp1zkk6,Time off doesnt affect wellbeing? Are you being serious? ,blowit,ct4326n,1,t5_2z3ek
4598655,0,t3_3e00ln,rinterestingasfuck,blowit,cta90vx,0,t5_2z3ek
4674612,0,t1_ctjpayc,Actually yea you can look at pictures pretty quickly. Whats the rate?,blowit,ctjsa8o,6,t5_2z3ek
4769505,0,t1_ctvpu85,The known universe I suppose. Ill find an article for you.,blowit,ctvqmjv,2,t5_2z3ek
4882988,0,t3_3hrct3,This is so frustrating. ,blowit,cua1ei4,3,t5_2z3ek
5222771,0,t3_3mji5n,So much untamed wilderness and wilditude... ,blowit,cvfjarc,2,t5_2z3ek
5433753,0,t3_3nx92w,I cant stop reading the sentence now..,blowit,cw67swb,1,t5_2z3ek
8577506,0,t3_4x7hhe,Most of it today. Fucking christ its hot in NY.,blowit,d6drsnz,1,t5_2z3ek
8732122,0,t1_d26kgzd,What if hes a retarded Jedi?,blowit,d6x5ti7,2,t5_2z3ek
11128812,0,t3_5yvsn4,What??,blowit,detfw4z,27,t5_2z3ek
11459764,0,t3_63j6yh,I thought I had heard somewhere that in a fiat money supply money is virtually created via credit. A credit company invents money by making a credit line.    Is that what they mean?,blowit,dfuygc5,2,t5_2z3ek
