,controversiality,parent_id,body,subreddit,id,score,subreddit_id
4291200,0,t1_cs91p2x,Okay so unpopular opinion time hunt didnt day anything wrong. Not PC? Yes but not wrong. He gave an anecdote about his own difficulties in the lab and stated that women cry more. The former is ill advised but maybe he has had difficulties with interpersonal relations in the lab. It can be a distraction in any office though the solution is not to segregate. As for the latter women cry more. Culturally maybe but also hormonally men have a harder time producing tears See below Not proven.I mean he didnt say anything about women being bad scientists. He just said hes had problems in mixed gender labs and given his difficulty with PR Im gonna bet hes not the worlds greatest diplomat. Im not surprised hes had problems.,EverythingScience,cs9c8q6,13,t5_2zlwp
4292580,0,t1_cs8tbfj,deleted,EverythingScience,cs9hu6q,1,t5_2zlwp
4304863,0,t1_csal5f3,Good question. never thought about it before.,EverythingScience,csavt28,1,t5_2zlwp
4313648,0,t3_3ac95s,Imagine what muzzling er I meen moderating commentors on rscience does for the trust of the Army of Science!,EverythingScience,csbvhpg,1,t5_2zlwp
4314970,0,t3_3acfwj,Watch as NASA suddenly gets more funding.,EverythingScience,csc0vta,0,t5_2zlwp
4344881,0,t3_3aqifn,What are those lights?,EverythingScience,csfee1q,1,t5_2zlwp
4347975,0,t3_3at2iz,Why is this tagged as physics?,EverythingScience,csfqyte,0,t5_2zlwp
4366870,0,t3_3azv22,I feel like this would be more convincing if the data covered more than  years. ,EverythingScience,cshvqn5,-11,t5_2zlwp
4377957,0,t1_csiz99c,People dont realize what their doing till its done.,EverythingScience,csj4qmb,1,t5_2zlwp
4379412,0,t3_3b51rp,This is the way to do it. Make more women in science packs and more men in shoppingcastleridingetc.. OR just give wigs for both genders in the packs. suddenly it doesnt matter,EverythingScience,csjaml7,11,t5_2zlwp
4447796,0,t1_csraosk,Id laugh but I too have cottonmouth,EverythingScience,csrbwph,7,t5_2zlwp
4448479,0,t1_csr1ams,I think that depends on the mass of HD .,EverythingScience,csrf05f,1,t5_2zlwp
4454555,0,t3_3c3oxd,Is there a subreddit for unexpected adorableness? Because that is absolutely adorable.,EverythingScience,css6hfr,4,t5_2zlwp
4471276,0,t3_3c9v6a,deleted,EverythingScience,csua0me,1,t5_2zlwp
4486335,0,t3_3cjf6z,deleted,EverythingScience,csw5z2s,4,t5_2zlwp
4504196,0,t3_3cqlbb,To Summarize It may or may not end the drought  but probably not since we need consistent rain over a few years for that.  But actually we need snowfall more than rain anyway so the real question is will it lead to snow? And again the answer is we dont know. ,EverythingScience,csyelso,5,t5_2zlwp
4520842,0,t1_ct08lgs,Its a silly argument from a religious perspective but dont mistake also exhibit types of behavior with equally advanced. They quoted Darwin saying the differences between us and our closest cousins are matters of degree which I think weve all known for some time. But its also worth noting that those degrees are vast. On that bit your friend was quite correct. ,EverythingScience,ct0hsaf,4,t5_2zlwp
4543120,0,t1_ct31hb2,In fleshlight? I know Bad Dragon has it but Fleshlight?,EverythingScience,ct3acvk,1,t5_2zlwp
4565742,0,t1_ct63j5j,NO! BAD!,EverythingScience,ct64jt7,3,t5_2zlwp
4566057,0,t3_3dl0ky,It was bound to be somewhere.,EverythingScience,ct65z31,1,t5_2zlwp
4586324,0,t3_3dtzds,Link is broken...,EverythingScience,ct8pef5,2,t5_2zlwp
4616388,0,t1_ctc1lld,I dont see it as being a concentrated effort so much as like attracting like. Friend of mine who had a degree in theology talked a bit about how the Puritans were not nice folk. And as much as several of the founding fathers of America were a bit ahead of their time with progressive thinking that Puritan ideal of faith is all you need was still in the background. So you have people elected to office pandering to those ideals which in turn reinforces the ideals amongst the people who elect them which means the next guy who runs for office has to tow the party line and on and on.This is a very jaundiced explanation but I find it a bit easier to believe than the idea of an Illuminati working behind the scenes to keep us dumb. Puts to much onus on an unknown other rather than face up to the fact that this is something we do to ourselves.,EverythingScience,ctch3an,2,t5_2zlwp
4630678,0,t1_cte7f4t,This video gives a lot of good data on how much radiation is harmful.  ,EverythingScience,cte9n4w,1,t5_2zlwp
4642040,0,t3_3ejw95,Not just college students everyone. And they should see it again every couple of years.,EverythingScience,ctfp1ki,88,t5_2zlwp
4642907,0,t1_cten89k,I get that but steepness is the change in y over the change in x. Thus by going away from  degrees youre at a lesser slope just the other way.,EverythingScience,ctfsyqg,1,t5_2zlwp
4657832,0,t1_cthk3ng,Yeah all I am saying is you gotta be careful about it.   I mean we steady do it a lot. Look at Iowa that only really fried corn and beans.   Dont get me wrong Im s fan of GMOs because I think their usefulness outweighs the majority of the cons but we also need to worry about the bees because without them we get pretty ducked pretty quickly ,EverythingScience,cthoear,0,t5_2zlwp
4726175,0,t1_ctq9a2f,I wasnt aware that I did that. But its an easy accusation to make particularly if one hasnt as you yourself stated entirely understood what the other party was saying.,EverythingScience,ctq9w66,1,t5_2zlwp
4731756,0,t1_ctqrbo1,deleted,EverythingScience,ctqza3p,1,t5_2zlwp
4787925,0,t1_ctxyw5m,The picture with the circles showed the localized fogging over the reactors.  The heat and offgassing from spent fuel pools might be increasing the fog in those areas or just become more visible in those atmospheric conditions.  Those pics were taken during the fuel handling crane removal when TEPCO complained that fog hampered their efforts.  For the last three months the fogging grew so dense at times there was zero visibility on the TEPCO cameras.  Dense fog seen on one camera but not the other was not like the normal fog that usually affects both cameras the same.  The dense fogging coincided with peaks of  gamma sparks an hour.  The more gamma sparks the more fog.  I was only counting  an hour on August st .  That has dropped down to about  an hour since the crane removal.  ,EverythingScience,cty229j,1,t5_2zlwp
4794631,0,t3_3gj079,Headlines like these have  effect on me because there is no way we can actually accurately gauge how much energy in the entire existence of everything is being produced. ,EverythingScience,ctywhtk,-1,t5_2zlwp
4820349,0,t3_3gvkm5,This question will ask you several questions to help estimate the age of the patient in the above photograph  A question that asks several questions...then theres only  question.EDIT I realized after the first round that if you choose equal as the first option for age  it stops the line of age questioning there. Still needs to be edited though.,EverythingScience,cu257to,1,t5_2zlwp
4833722,0,t3_3h0pxf,They never directly said. Is a void just an area of space with noalmost no particles in it? Or it is like the empty space between star systems just super amplified where there is stuff its just really spread out and this is a remarkable area where there is just not very much stuff?,EverythingScience,cu3tvm7,1,t5_2zlwp
4853817,0,t3_3hd1i7,Have you ever seen a bromance more exquisite than this? ,EverythingScience,cu6cypn,13,t5_2zlwp
4864976,0,t1_cu7jdop,Not sure about FDA studies but there are human double blinds out there Aspartame sensitivity? A randomized doubleblind crossover studyAspartame and Susceptibility to HeadacheAspartame is no more likely than placebo to cause urticariaangioedema Results of a multicenter randomized doubleblind placebocontrolled crossover studyDOUBLEBLIND CHALLENGE STUDIES OF BEHAVIORAL AND COGNITIVE EFFECTS OF SUCROSEASPARTAME INGESTION IN NORMAL CHILDREN forgive the capsFind more with this Google Scholar search link A few show opposite results but they tend not to be very rigorous N lt .,EverythingScience,cu7rn3v,1,t5_2zlwp
4868978,0,t1_cu87l1d,If we all had to be experts to say anything the world would be a quiet place. ,EverythingScience,cu89sh9,4,t5_2zlwp
4887178,0,t1_cuai86m,theres a subreddit dedicated to stuff like this  a lot of people have had a great experience getting it through modafinilcat.com.,EverythingScience,cuakf8c,3,t5_2zlwp
4891052,1,t3_3hvidc,First of all this article is not new  despite its timestamp. Its talking about research that was published a year or two ago. Second of all if you actually go read the primary source it doesnt say they proved NCGS doesnt exist. They just said its much rarer than they had reported previously.Uggh bad science reporting is the worst.,EverythingScience,cub213y,16,t5_2zlwp
4896359,0,t1_cubp26x,This is one way of looking at it  alternatively the increase in popularity  demand by fad dieters has profoundly expanded the opportunities for people with Celiac to buy order and generally enjoy a more convenient and full range of foods. I know a number of people with nonCeliac bowel sensitivity who feel indirectly much healthier when exercising a gluten free diet  including resolution of flareups of psoriasis etc.Meanwhile the selfdiagnosed woo people arent doing you any harm. You can find their request in lieu of a gluten epitopespecific immunological response irritating but for people trying to deal with other types of often poorly diagnosed or specified bowel irritability gluten free options offer many anything between a placebo comfort to an indirect health benefit by contributing to reduction of FODMAPs etc. I still believe preciousness about people having a sufficiently real reason to avoid gluten and the apparent vindictive response some have hurts those with bowel disorders a lot more than it hurts you or I to humour them. It certainly makes people with Celiac nervous and ill when people openly dismiss and fail to meet their requests and specifications in public.,EverythingScience,cubq3wm,1,t5_2zlwp
4910585,0,t3_3i3aga,I think its a nation that carries around too much manipulation and subconcious ice creamsixtiesmissvietnam ads,EverythingScience,cudil9w,1,t5_2zlwp
4969163,1,t1_cukvvw5,Good on you  Im glad it worked for you. I would be interested to know honestly how much use Psychology is in AI as opposed to brain physiology.However I have to point out I did  years with multiple lecturers is psychology and statistics and I only dropped out around Xmas in the last year. I was doing a combined honours course with Computing Science as it was called in the s and Psychology and I was unfortunate in that my college didnt have a single honours degree for me to switch to at the time or I would have been able get a degree.Finally I was merely expressing my opinion and my reasons for dropping out as I felt that this article vindicated it. Theres just no possibility of accurate controls in Psychology tolerances are often way too loose assumptions are made and proved by cherry picking data and reliable repeats are few and far between. ,EverythingScience,cukweze,-3,t5_2zlwp
4980915,0,t3_3j4hth,deleted,EverythingScience,cumdr7h,1,t5_2zlwp
5058011,0,t1_cuvhtry,Well thats because theyre just different formulations of the same hormones. This is a totally new procedure.And Im sorry but the FDA will not approve this as a reversible form of birth control without data on its longterm effects on fertility. It just wont. I dont know what else to tell you.,EverythingScience,cuvoj75,1,t5_2zlwp
5060797,0,t1_cuvzyvo,You will never see this. Its company secret. They made cash with it. Sad but true this is how it works. So open source is still important for everything that has to do with open accessibility and fundamentals of transport.,EverythingScience,cuw0msu,1,t5_2zlwp
5063192,0,t1_cuwagbb,No it isnt. And of course as everyone knows if you can show one example to the contrary that totally proves that Fox is completely fair and balanced in all its other shows.,EverythingScience,cuwb1es,4,t5_2zlwp
5066609,0,t3_3kdaiw,deleted,EverythingScience,cuwpuld,1,t5_2zlwp
5074895,0,t3_3ke7eu,lol,EverythingScience,cuxpt2q,1,t5_2zlwp
5082616,0,t1_cuylzgl,Heh same on the loudness question.,EverythingScience,cuynct6,1,t5_2zlwp
5082891,0,t3_3klhdy,To keep reading sing in with emailNO,EverythingScience,cuyojuc,6,t5_2zlwp
5088088,0,t3_3ko1n1,Heh no they dont.,EverythingScience,cuzb2dh,-6,t5_2zlwp
5091013,0,t1_cuz5ef9,Mormon capital of the world,EverythingScience,cuznqjx,0,t5_2zlwp
5113372,0,t3_3l1o58,Oh no I got a  error when I tried to view my results. ,EverythingScience,cv2cp8w,9,t5_2zlwp
5115549,0,t3_3l1o58, for not reading the last question all the way through.  The study of planets and their movement...  ASTRONOMY!  ...and their affect on human lives.    Fucking Astrology gt,EverythingScience,cv2m5ea,4,t5_2zlwp
5118107,0,t1_cv2v5vd,Ive got two cookies in here somewhere...,EverythingScience,cv2x9al,1,t5_2zlwp
5118944,0,t1_cv2nr76,The easiest way is to remember why it decreases with altitude.When you are at sea level you have all of the atmosphere pushing down on the water in the pot.  All that weight makes it difficult for the water to escape.  If you do the same experiment in Denver there is less of the atmosphere pushing down on the water so the molecules can escape more easily thus boil at a lower temperature.,EverythingScience,cv30w8y,16,t5_2zlwp
5181232,0,t3_3lx6h1,Climate deniers are probably rightwing fundamentalists who hate Catholics for their own religious related reasons.  ,EverythingScience,cvaj0yz,6,t5_2zlwp
5193226,0,t1_cvbooai,An igNobel doesnt have to be bad science just amusing ,EverythingScience,cvbz762,6,t5_2zlwp
5212215,0,t1_cve6l7b,Californian here youre literally just making things up. ,EverythingScience,cve9joo,3,t5_2zlwp
5221215,0,t3_3mgoj4,I wonder if this is in any way related to colony collapse disorder Its not mentioned in the article.,EverythingScience,cvfcjng,2,t5_2zlwp
5233101,0,t3_3mm1p4,Holy shit what? Kinnekulle is an ancient remnant of an asteroid impact? I grew up in its vicinity and could always see it from a distance. When we were kids we always thought it was a dormant volcano since it was the biggest hill in an otherwise incredibly flat landscape for miles. Picture,EverythingScience,cvgs24y,4,t5_2zlwp
5259488,0,t1_cvjqo1e,I have that very same question for everything they showed in the video but Im having trouble finding sources...Heres the event they were promoting  ,EverythingScience,cvjyhpd,3,t5_2zlwp
5327428,0,t3_3nx5u5,deleted,EverythingScience,cvsn2js,1,t5_2zlwp
5357282,0,t1_cvwg1c6,removed,EverythingScience,cvwgc6l,1,t5_2zlwp
5357452,0,t1_cvwem31,removed,EverythingScience,cvwh48q,1,t5_2zlwp
5359982,0,t1_cvwch92,I cant help but wonder whether the current situation isnt the way it is because of regulatory capture and the legislation behind the current laws having been written by the industry itself.,EverythingScience,cvwsqsg,1,t5_2zlwp
5360825,0,t1_cvwruws,I have to correct you. Having a complete understanding of the human digestive system is not a requirement for producing and eating natural food.Our digestive systems have had millions of years to cope and adapt with natural genetic changes in our food that have occurred over the same length of time. GMO violates this premise. ,EverythingScience,cvwwmio,-1,t5_2zlwp
5360903,0,t1_cvwqzpz,They do.  In fact I grantee youve been eating GMOs for years.  Everyone has.  Ever had an apple?  Same concept only not nearly as accurate as what the gmo companies do.  Theres also at least one plant that is ONLY GMO grown because disease wiped it out years ago...Ill have to ask my husband.  Cant remember the name of it now gtltBut if you think people havent been eating GMOs for decades you are very misinformed.,EverythingScience,cvwwzgq,1,t5_2zlwp
5361385,0,t3_3oglb3,For everyone who thinks the MB is any good read this. It is garbage. ,EverythingScience,cvwz7ax,1,t5_2zlwp
5378501,0,t1_cvz5spp,deleted,EverythingScience,cvz5wv7,1,t5_2zlwp
5382717,0,t1_cvzo239,Im not sure how to feel about this after reading the first little bit.... The oranges are dying and Monsanto will make Frankenstein oranges to save them. ,EverythingScience,cvzpb9p,2,t5_2zlwp
5412969,0,t3_3p3vot,Am I missing something or does anyone else see these failures to replicate as with psychology previously as growing pains of sorts for what are relatively young fields of science? That combined with the complexity of the systems studied as well as the lack of nonoutcome related measures would suggest that a low replication rate is not all too surprising. I think that while we should seek reliability through clever methods and tools at some point we have to recognize that the solution may be more about the quantity of data and not quality.,EverythingScience,cw3kdvi,4,t5_2zlwp
5436760,0,t1_cw6f6ao,Pills dont kill people people kill people.,EverythingScience,cw6lmew,2,t5_2zlwp
5452551,0,t1_cw8dq2r,There is no way to get the precision necessary based on the density of water.  How do you get exactly  cubic centimeter of water?  How do you ensure it is precisely at  deg C?  How do you ensure it is pure water?  Also there are a number of factors you are not considering.  What is the pressure the number you cited is valid only at standard atmospheric pressure of   Pa?  Also what is the ratio of isotopes of oxygen and hydrogen in the water?  It is all heavy water or is is representative of the water you would find in the oceans?  Put all these together and there is not way you get an accuracy you are looking for which is on the order of micrograms.The best measurement we have for the density of pure water with isotopic composition representative is the isotopes of water found in the ocean at standard atmospheric pressure at . deg C the real maximum density point is .  kgL.  Close to  but not close enough.Also the pints a pound the world around saying is only an approximation used for cooking and such.  Ignoring that almost all scientific calculations in the US are done in SI units anyway the official definition of a US pound is exactly .   kg.,EverythingScience,cw8m63r,1,t5_2zlwp
5504157,0,t1_cwf3lro,As Michael Scott would say Boomroasted,EverythingScience,cwf7haa,13,t5_2zlwp
5532026,0,t1_cwikxn3,To this day I have an irrational dislike of towels because I saw a documentary of a guy who in the Amazon got a parasite from his towel into his dick and it fucked up his junk.Obviously I dont live in the Amazon but it still scares me,EverythingScience,cwirjh6,5,t5_2zlwp
5540126,0,t1_cwjse51,Here in Britain it isnt much better our research budget is less than . GDP compared to Germany and the US which are each about .. To make things worse there is a growing antiscience culture over here with more and more people hopping on the Climate change is a liberal conspiracy! bandwagon.The fact that science funding has to be defended in this day and age is absolutely pathetic.,EverythingScience,cwjssoy,1,t5_2zlwp
5570999,0,t3_3rf1d2,The msm has become the main purveyor of bullshit hype when it comes to science lately. How about yahoo finance sticks to finance instead of embellishing on science developments?,EverythingScience,cwnmts4,-1,t5_2zlwp
5573224,0,t1_cwnlget,NASA with a Big announcement on Friday about the IMPOSSIBLE EM drive.,EverythingScience,cwnwrox,2,t5_2zlwp
5575055,0,t1_cwo1vho,Seriously the sensationalism here is absurd.,EverythingScience,cwo4y85,3,t5_2zlwp
5594797,0,t3_3rqupc,Yup by any definition its a crime...just like most of the rest of what they do. ,EverythingScience,cwql539,-8,t5_2zlwp
5626521,0,t1_cwugy1d,Try data science specialization on Coursera. Got me on my way quite well. If you want a certificate its paid though.    Ofcourse  nows a nice moment to jump into Python. Im going to start learning the basics. I wanted to for a while and now this made the call. ,EverythingScience,cwuiuxb,2,t5_2zlwp
5638138,0,t3_3s9pte,removed,EverythingScience,cwvyqut,1,t5_2zlwp
5641059,0,t3_3sbv90,Crap dont say who she is...,EverythingScience,cwwbsyd,2,t5_2zlwp
5654954,0,t1_cwxy49b,Thats more of a general problem with mono culture and all herbicides not RoundUp specifically or colony collapse disorder. If we want farming done differently wed probably have to start by paying farmers fairer prices.,EverythingScience,cwy1w4z,0,t5_2zlwp
5696944,0,t3_3t4ozd,Charlie Sheens cureall tonic!If it helped me unwatch that final season I would invest..,EverythingScience,cx39e59,3,t5_2zlwp
5723896,0,t1_cx6gpd7,Yeah that work thing really gets in the way sometimes.,EverythingScience,cx6lthn,2,t5_2zlwp
5779649,0,t1_cxd5xdx,But thats red matter. ,EverythingScience,cxdiq6r,1,t5_2zlwp
5804997,0,t3_3untsp,Carbon capture and sequestration is incredibly INefficient.. Not efficient. in the article text. ,EverythingScience,cxgnxrp,2,t5_2zlwp
5815013,0,t3_3uun6b,Why are they all dead at the end?,EverythingScience,cxhwn4l,2,t5_2zlwp
5820146,0,t1_cxibtuz,Yes. I would also eat whale dolphin or chimpanzee. If its not human and its meat isnt somehow poisonous I dont see any reason you shouldnt eat it.,EverythingScience,cxijnro,0,t5_2zlwp
5820651,0,t3_3uwwng,This survey needs work  the questions are often poorly worded repetitive and inapplicable based on other answers. ,EverythingScience,cxim1vl,1,t5_2zlwp
5821726,0,t1_cxipr43,Its still a problem if you cant explain it to the nonexpert.,EverythingScience,cxir4p3,1,t5_2zlwp
5822602,0,t3_3uwz3w,Full videoAn article,EverythingScience,cxiv9i8,1,t5_2zlwp
5862435,0,t3_3vixqa,Thanks for the title Buzzfeed,EverythingScience,cxo3fyc,2,t5_2zlwp
5865353,0,t3_3vjici,Of topic here. But we should move all of the please give  a month to build a well people to Antarctica with  of the worlds fresh water they would have a win and it would probably be cheeper in the long run instead of a drawn out subscription we have going on now....,EverythingScience,cxoh8nb,1,t5_2zlwp
5878258,0,t3_3voxw1,Ive always wondered about attaching severed parts like this they show a super simplified picture but arent nerves just constantly forking and spreading?  Do they just accept sensitivity loss and probably blood flow issues around the seam when they reattach something?  Its always seemed like side kind if wizardry given just how many tiny tubes pipes and wires we have within us.Also is rejection an issue in this case?  that would be pretty horrifying and a serious drawback given the impact to the immune system.,EverythingScience,cxq66sb,3,t5_2zlwp
5880792,0,t1_cxq95fu,People are quite selective about which parts they believe and which parts they just say they believe.You dont have to go full retard to appreciate Jesus.,EverythingScience,cxqi63m,3,t5_2zlwp
5931497,0,t3_3wjbck,removed,EverythingScience,cxx5esd,3,t5_2zlwp
5947977,0,t1_cxz4v3r,Just say the word. ,EverythingScience,cxzb6e0,-1,t5_2zlwp
6000170,0,t3_3xlskc,deleted,EverythingScience,cy65iie,1,t5_2zlwp
6017767,0,t1_cy877zf,Why are analogies so bad? I wouldnt ever get my parents to understand anything without them. Like a domain name is like a  BUY FOOD kind of number that keeps you from having to memorize digits. Am I making further learning more difficult for them? honestly wondering...,EverythingScience,cy8ge96,1,t5_2zlwp
6031830,0,t3_3y3nck,I do hope this works for real. ,EverythingScience,cyaagcl,2,t5_2zlwp
6060126,0,t1_cydpg0v,removed,EverythingScience,cydz7co,8,t5_2zlwp
6091503,0,t1_cyhwd3u,Perhaps Yukawium after Hideki Yukawa.,EverythingScience,cyi1h3j,3,t5_2zlwp
6147351,0,t3_3zqbif,What does her being black have to do with anything?,EverythingScience,cyoe13j,72,t5_2zlwp
6153321,0,t1_cyp2c2o,I guess I agree with what youre being sarcastic about.Colorblindness was progressive for people whose parents were outright racist. These days I mostly see it used for people to ignore the problems faced by minorities.,EverythingScience,cyp2hac,3,t5_2zlwp
6157669,1,t1_cypgfml,gt I thought it came out with pee.Americas sex ed is so spectacularly bad,EverythingScience,cypka1v,2,t5_2zlwp
6160495,0,t1_cypc4xz,deleted,EverythingScience,cypvv5g,5,t5_2zlwp
6182736,0,t1_cysdvsu,Social circles are not society. You and your friends do not constitute a society. Society lives under a set of rules enforced by the government. Without the government it would be might makes right as it is in much of central Africa. Sure if you want to live under fundamentalist Christian warlords instituting Christian Sharia Law I guess you could hope for anarchy in the US.Government exists because of taxes. Without taxes there would be no army to threaten violence. Also you cant say government exists because of something they do. Thats kinda bassackwards.Again war is not the only thing the government does. Theyre the reason you can walk outside and take a deep breath that you have decent roads to drive over when you want cross large distances the reason we have electricity over much or the rural US.Im not asking quesitons Im trying to dispel your juvenile delusions. It doesnt seem to be working so Ill reiterate I hope you outgrow this phase of yours otherwise youll be in for a rude awakening once you move out on your own. This is my last response to you. Have a good evening.,EverythingScience,cysevf1,1,t5_2zlwp
6210781,0,t1_cyvgz6m,Forbes?  This is on Telegraph. UK Am I missing something? ,EverythingScience,cyvlkh9,1,t5_2zlwp
6223789,0,t3_40snnf,gt They believe that getting a nastylooking hook stuck in the mouth doesnt hurt fish. Fishing enthusiasts insist the nervous system of the aquatic creatures is far too primitive for them to feel real pain.Angler here. We dont actually believe that. We just say that when people whine about the fish getting hurt. We know it hurts the fish. We dont care. ,EverythingScience,cyx2si1,2,t5_2zlwp
