,controversiality,parent_id,body,subreddit,id,score,subreddit_id
8792,0,t3_1u7we5,This is the best day ever on kpics,kpics,ceffqhs,8,t5_2u4ls
28658,0,t1_cehmhst,I get this reference. Its time to put down reddit for the night.,kpics,cehp137,2,t5_2u4ls
29351,0,t1_cehr8lh,How so?,kpics,cehrv9r,2,t5_2u4ls
29544,0,t1_cehsitb,Wait cant you just post pictures of her as being the maknae of Orange Caramel? Or is that what you asked Softie about?,kpics,cehsnmw,2,t5_2u4ls
50468,0,t1_cek5s59,deleted,kpics,cek6cju,-10,t5_2u4ls
70961,0,t1_cemgd04,I did a typo and missed the e im sorry.,kpics,cemiam3,1,t5_2u4ls
85612,0,t3_1v0rjh,she still looks good thoughshould change title to taeyeoff,kpics,ceo6c8h,3,t5_2u4ls
115617,0,t3_1vexgc,I love watching their Fiestar show on LEONENT youtube. Cao Lu is so funny its too bad she isnt as noticed as the other members.,kpics,cerlgtu,6,t5_2u4ls
141332,0,t1_ceui3n3,Probably the eye makeup.,kpics,ceuj0el,3,t5_2u4ls
150440,0,t1_cevk4mn,deleted,kpics,cevkdyw,1,t5_2u4ls
154955,0,t1_cevs3z1,Is anyone subbing star king? AT doesnt have it and I dont think Kshow does it,kpics,cew2x9e,1,t5_2u4ls
217052,0,t3_1wkekj,deleted,kpics,cf360lt,1,t5_2u4ls
250247,0,t1_cf5ilh7,thanks enjoy the picture.,kpics,cf6oxqc,2,t5_2u4ls
343477,0,t3_1y0sru,I dont think anything will beat this for me.,kpics,cfgdcy1,7,t5_2u4ls
349935,1,t1_cfgyjrv,The  Eunjis dont appear to have been counted as separate entities based on the number of posts. The same thing is happening for Hyuna. Damn  Muses and their copied names ,kpics,cfh1e92,0,t5_2u4ls
357062,0,t3_1y4f7b,is there a source for this?,kpics,cfhrxr5,2,t5_2u4ls
378004,0,t1_cfjviyg,Indeed it is!,kpics,cfjy20e,1,t5_2u4ls
389970,0,t1_cfl3hml,This was during the MBC Idol Star Athletic Championships . I dont have a link to the actual video source unfortunately.,kpics,cfl6pq4,2,t5_2u4ls
393761,0,t3_1ya4r0,this entire episode was so sad,kpics,cflkvam,1,t5_2u4ls
399421,0,t1_cfm59hz,At least this one has clear definition. Aegyo week was full of posts that couldnt even be considered aegyo by a lot of people winner post included.,kpics,cfm5z05,9,t5_2u4ls
477916,0,t3_1zfjvw,Looks like too much face makeup in places but love the outfits. Cant wait to see which ones they go with in the live performances hoping dude suits and hats. ,kpics,cfulbkl,1,t5_2u4ls
480280,0,t3_1zktmg,She looks much better with her longer hair.,kpics,cfuv057,1,t5_2u4ls
494640,0,t3_1zpxza,poke pokeSTOP IT YOU!,kpics,cfwht9z,1,t5_2u4ls
502462,0,t1_cfxcsaf,deleted,kpics,cfxdt82,1,t5_2u4ls
506386,0,t3_1zxfdf,You want to win this week again.,kpics,cfxtupe,3,t5_2u4ls
554961,0,t1_cg3cngn,There are other members?,kpics,cg3ct8y,-9,t5_2u4ls
570498,0,t3_20njmd,since someone was bound to link this..,kpics,cg54cny,11,t5_2u4ls
571258,0,t1_cg4vwpd,No shit what else would it mean.,kpics,cg57gkh,4,t5_2u4ls
608142,0,t3_214208,Removed no videos please. Only pictures or gifs.,kpics,cg9ecug,1,t5_2u4ls
654483,0,t1_cgenpgz,...oh...goddamit.,kpics,cgenxmt,1,t5_2u4ls
729914,0,t3_22i6bp,The first Korean star I know the name of. Of course its because of Running Man. Of course shes already .,kpics,cgn8u02,1,t5_2u4ls
735567,0,t1_cgnvbcj,he was on episode  too if thats what you mean,kpics,cgnvz1f,1,t5_2u4ls
770281,0,t3_22y65s,Naeuns wrists ,kpics,cgru394,-1,t5_2u4ls
793326,0,t3_238dfv, What dees it mean? Is this this some kind of Korean insult?,kpics,cgugdrr,5,t5_2u4ls
804049,0,t3_23cnou,This belongs in rkpopslumberparty.,kpics,cgvo9o9,2,t5_2u4ls
824706,0,t1_cgxrmxi,Thank you ,kpics,cgy0r7t,1,t5_2u4ls
880629,0,t3_2477tc,Shes stunning.,kpics,ch4dpvy,2,t5_2u4ls
892004,0,t3_24amd3,And this is the first thing I see on my fancy new phones screen. I am pleased with this. You never disappoint OP.,kpics,ch5obd2,1,t5_2u4ls
898941,0,t3_24egmz,Please be sure to always use Google Reverse Image Search to find the best quality.Here is the same picture but better quality,kpics,ch6gqbt,10,t5_2u4ls
921889,0,t3_24o2q9,If I was senpai I would notice her.,kpics,ch92oyp,9,t5_2u4ls
939174,0,t1_chalxob,You might want to check out rtranspassing even if you are a cis male. A lot of the ladies there are preop and do an amazing job at dressing themselves styling their hair doing makeup etc.Also rmakeupaddiction and rfancyfollicles are both super helpful subreddits!,kpics,chb1frp,1,t5_2u4ls
1030293,0,t3_25w63x,Its strange how the reflection looks like a different person personality wise from that angle,kpics,chleeia,13,t5_2u4ls
1039909,0,t3_260kyr,One More!,kpics,chmhq3g,5,t5_2u4ls
1046588,0,t3_26213s,Defcons facial expressions are killer XD,kpics,chn92rd,1,t5_2u4ls
1073638,0,t1_cho30vl,  is better ,kpics,chqbrlj,1,t5_2u4ls
1079818,0,t3_26gdg8,What group is she a part of?,kpics,chr1111,1,t5_2u4ls
1083821,0,t3_26ht4v,Marry to me!,kpics,chrhdzq,3,t5_2u4ls
1093884,0,t1_chs9vf7,It looks like Sojin and Yura have both been flipped horizontally. If you compare this shot to the previously released shots of all the girls together Sojin and Yura both have their bracelets on their right wrist in this scene but on their left in the natural shots. If you flip this scene horizontally Sojin and Yura look a lot more normal.,kpics,chsmn1p,1,t5_2u4ls
1114486,0,t1_chtxqbj,sorry for the delay..in my head i see Tyrion Daenerys Catelyn Theon Taeyeon Tywin Shae Talisa ... ,kpics,chuz58k,-1,t5_2u4ls
1115225,0,t3_26vdxy,The best of Yura,kpics,chv26eo,1,t5_2u4ls
1124517,0,t3_26rpkx,lol! D,kpics,chw481k,1,t5_2u4ls
1139220,0,t3_2766bf,The caption with the image is    THE SHOW  !!Meaning something like Todays afternoon pm is The Show broadcasting!! Keep in mind that she is the new host of SBS MTVs The Show All About KPOP The Show starting June  at pm KST.,kpics,chxruej,5,t5_2u4ls
1164027,0,t3_27f3li,Oh my god I miss her interactions with Sera...,kpics,ci0km5k,3,t5_2u4ls
1197254,0,t3_27toqj,Jessica Rabbit,kpics,ci4b5fk,2,t5_2u4ls
1205873,0,t1_ci57qr6,Agree with you she had put in a lot of hard work and all the judges were very impressed. Not sure why she didnt get the final first place inspite of being on top on previous episodes.,kpics,ci5a1xj,0,t5_2u4ls
1220989,0,t3_282b2t,Damn those legs,kpics,ci6z9x0,3,t5_2u4ls
1229399,0,t1_ci7wa9p,From this clip with Tiffany and Seohyun Full episode is Strong Heart ep ,kpics,ci7xbe7,2,t5_2u4ls
1232422,0,t3_287njc,I think I may just leave this on in another window...,kpics,ci89j9v,3,t5_2u4ls
1292391,0,t3_28v70m,my goddess!,kpics,cif0e93,1,t5_2u4ls
1306698,0,t3_291v7y,Source,kpics,cigmc35,1,t5_2u4ls
1363687,0,t1_cin85vu,Thank you! ,kpics,cin87fd,2,t5_2u4ls
1439983,0,t3_2altc9,Link to video please?,kpics,ciws177,1,t5_2u4ls
1457108,0,t1_ciyugsh,Taking the picture maybe ,kpics,ciyx9i1,1,t5_2u4ls
1508623,0,t3_2bhl6r,Source,kpics,cj5dqd3,1,t5_2u4ls
1525624,0,t1_cj7h4m0,Yea she did still beautiful ,kpics,cj7iin6,2,t5_2u4ls
1526420,0,t3_2bok82,deleted,kpics,cj7m40i,1,t5_2u4ls
1540156,0,t3_2bv3pt,Erin looking fiiiiine.,kpics,cj9bzzm,7,t5_2u4ls
1595968,0,t3_2cje5z,I want her kicks,kpics,cjgcaue,1,t5_2u4ls
1601439,0,t3_2cmo9p,I love Naeun and think she is really cute...but that being said. Is her smile always forced? In a lot of photos and even in their MV for Crystal she looks like she is being forced to smile and not enjoying it.,kpics,cjh13ru,3,t5_2u4ls
1619902,0,t3_2cuhqd,Her brown bangs lt,kpics,cjjcrqt,1,t5_2u4ls
1645638,0,t1_cjmlcn1,Do you not get it? It was a simple observation. If you dont understand Im not going to explain it a third time. ,kpics,cjmlhbb,-1,t5_2u4ls
1673433,0,t3_2djp52,Full collection found here,kpics,cjq3jo4,1,t5_2u4ls
1681932,0,t1_cjp659s,God I love these. Shes basically looking right at you. Seems like her skirt was the shortest among everyone at KCON. Really shows off her awesome thighs!,kpics,cjr6594,1,t5_2u4ls
1775468,0,t3_2etwa5,daebak! ,kpics,ck2yath,2,t5_2u4ls
1784972,0,t3_2ex9rp,The name Sojin is magical,kpics,ck45dm0,3,t5_2u4ls
1785258,0,t3_2exjrn,The dance and the song is just so sexy.,kpics,ck46o7b,1,t5_2u4ls
1854036,0,t3_2fswp1,shes beautiful but i want my queen ,kpics,ckclumv,-1,t5_2u4ls
1854307,0,t3_2ftjln,Perfection has been achieved.,kpics,ckcn0v8,2,t5_2u4ls
1863650,0,t3_2fxx7h,one of the last photos of the whole group R.I.P EunB and Rise courage AshleyZuny and Sojung,kpics,ckdrj2s,5,t5_2u4ls
1866147,0,t3_2fyn7z,forever one of the best outfits that Afterschool has worn,kpics,cke2co6,2,t5_2u4ls
1885208,0,t1_ckg5123,Im aware ,kpics,ckgcyy5,-1,t5_2u4ls
1894386,0,t3_2ga1gv,Nasty... Why?,kpics,ckhgpj8,2,t5_2u4ls
1897760,0,t1_ckhirlh,hayoung chorong bomi,kpics,ckhvbw0,1,t5_2u4ls
2069091,0,t1_cl2t0zw,these are all the pictures i found minus a few more that were small and low quality,kpics,cl2ts42,2,t5_2u4ls
2094821,0,t3_2iv8ms,deleted,kpics,cl63jcv,-7,t5_2u4ls
2115064,0,t1_cl8m560,RoBom,kpics,cl8o5cj,1,t5_2u4ls
2132512,0,t1_clavz07,deleted,kpics,claw0rc,-8,t5_2u4ls
2132894,0,t1_clavx72,deleted,kpics,claxrkm,-1,t5_2u4ls
2132956,0,t3_2jbdcx,deleted,kpics,clay1ra,1,t5_2u4ls
2166465,0,t3_2jsj2l,Pictures on Minah always make me smile. ,kpics,clf7i37,1,t5_2u4ls
2175092,0,t1_clfylai,how original! ,kpics,clgb21b,5,t5_2u4ls
2231079,0,t3_2kp639,Heres the tweet he got it from.,kpics,clnf93n,2,t5_2u4ls
2250272,0,t3_2kyoco,Post titles must include the name of the person or the group.,kpics,clputcr,1,t5_2u4ls
2270468,0,t1_clsbf5m,I hope so!,kpics,clsclce,7,t5_2u4ls
2273844,0,t3_2l8uo1,Heres a link to when it starts ,kpics,clsrl5j,1,t5_2u4ls
2336722,0,t1_cm0gy9f,Damn comparing ZN to Suzy. Disgusting. Great job posting ZN btw.,kpics,cm0j588,1,t5_2u4ls
2388206,0,t3_2mpcl8,Shes underrated.,kpics,cm6w1ff,3,t5_2u4ls
2448101,0,t3_2njkyz,We all have idols we love but lets try not to spam them...,kpics,cmeafp2,-12,t5_2u4ls
2492288,0,t1_cmjvj8k,Shes . Shes looked  for six years its incredible.,kpics,cmjvopb,1,t5_2u4ls
2522611,0,t3_2oi9xh,the thigh gap though,kpics,cmnucmi,2,t5_2u4ls
2640625,0,t1_cn38c95,Hrnnggg curse her for thinking about the skirt during the last part of the bonus gif.,kpics,cn39fgh,3,t5_2u4ls
2648030,0,t1_cn45qia,Because its Christmas. ,kpics,cn489fr,3,t5_2u4ls
2649684,0,t3_2q8ljr,What remix of catallena is that?,kpics,cn4g15y,1,t5_2u4ls
2691491,0,t3_2qtauo,Based Hyerim,kpics,cn9wbgp,1,t5_2u4ls
2708417,0,t3_2r0qru,Hanis smile...lawd have mercy!,kpics,cnbxq3l,2,t5_2u4ls
2807769,0,t3_2s70w4,SOURCE?!,kpics,cnn8grv,2,t5_2u4ls
2817771,0,t3_2sc9eb,Even blurred Seulgi is a scenestealer. Is there any more?,kpics,cnodgnn,3,t5_2u4ls
2837958,0,t1_cnqnamr,tonedme,kpics,cnqo7t5,1,t5_2u4ls
2839787,0,t3_2slxfs,This girl could get me into Trot,kpics,cnqvp1f,3,t5_2u4ls
2895380,0,t1_cnuh04n,thank you D,kpics,cnx7irn,1,t5_2u4ls
2941327,0,t3_2tu8sx,thankyoumoreplease,kpics,co2fwzy,1,t5_2u4ls
2986481,0,t3_2udne0,Isnt this the infamous picture where someone showed it was photoshopped and their legs were made to be longer?,kpics,co7jo0r,1,t5_2u4ls
3009327,0,t3_2un99v,Much better with sauce,kpics,co9wxn5,3,t5_2u4ls
3064349,0,t1_cof4p2g,K sub big? probably not but kk subs? Probably.This sub is called kpics but I dont really view it just as a place to post pictures of kpop singers and celebrities. These are genuinely goodlooking women and the occasional guy T.O.P. represent and that will always attract people,kpics,cofm7w0,-1,t5_2u4ls
3137867,0,t3_2w35x2,Simple and sexy.,kpics,con8ixo,1,t5_2u4ls
3187045,0,t3_2wmzit,Thank you for submitting! However your submission has been removed for the following reasons All GIFs  videos must be rehosted through Gfycat.If you have any questions regarding the rules here on rkpics please refer to our latest set of rulesFeel free to post one of them after you rehost it there.,kpics,cosc5v8,1,t5_2u4ls
3210112,0,t1_couojz6,Luckily you have both!,kpics,couq72z,2,t5_2u4ls
3257445,0,t3_2xefja,Jazz hands on fleek,kpics,cozn8s7,3,t5_2u4ls
3277739,0,t3_2xntzd,So beautiful,kpics,cp1w038,4,t5_2u4ls
3385591,0,t3_2yx9gd,I finally get to see her perform in person in May at KTMF in Los Angeles lt Garden box seats D,kpics,cpe6mt2,2,t5_2u4ls
3504324,0,t1_cpqtfzs,It was designed by the brand of the fashion event that she attended.,kpics,cprpuku,1,t5_2u4ls
3537878,0,t1_cpv7n9l,I dont know if he has a personal blog but he posted on AOA dcinside link   link   link   link ,kpics,cpvjh17,1,t5_2u4ls
3538825,0,t3_30oym5,soyul bedroom eyes,kpics,cpvncvp,1,t5_2u4ls
3553458,0,t1_cpxbe6f,CHECK AGAIN BAKA,kpics,cpxbg95,2,t5_2u4ls
3594098,0,t1_cq1qqdo,Well its the performance from  if you find any Jimin focused fancams youre set! The one I saw was Choa focused. ,kpics,cq1ycwh,3,t5_2u4ls
3599597,0,t1_cq2ko9x,Shes becoming just as underrated as Luna is. Thats a sad thing.,kpics,cq2kw57,2,t5_2u4ls
3693248,0,t1_cqd8jgc,Wrong subreddit lad. ,kpics,cqd96e0,7,t5_2u4ls
3760363,0,t1_cqksthh,gtimpress anyoneI dont believe thats what this is about no idea why youre taking it so personally. The guy only pointed out a flaw that is present in the cutest part of the webm. Would be kinda nice to have that fixed at least to a certain degree.,kpics,cqkwqv7,1,t5_2u4ls
3801431,0,t3_33xalk,Source? ,kpics,cqpld6f,1,t5_2u4ls
3996972,0,t1_crbv2qc,Must be just me then. Its the other way around for me.,kpics,crbvye4,1,t5_2u4ls
4007197,0,t1_crd1pjk,Oh I didnt know thats where it was from. Thats not where I got it from.,kpics,crd1ucx,2,t5_2u4ls
4007282,0,t3_36dt5p,deleted,kpics,crd26x7,1,t5_2u4ls
4064173,0,t1_criqwuj,Source?,kpics,crjjm9n,1,t5_2u4ls
4094443,0,t3_37grsi,Thanks for the gold stranger!,kpics,crmzpvf,4,t5_2u4ls
4098494,0,t3_37jkqg, arms for  weight? cmon hyeri,kpics,crngccn,2,t5_2u4ls
4129365,0,t3_37z791,Source,kpics,crqyzm6,2,t5_2u4ls
4200965,0,t3_38yfpb,I wanna take seductive photos of Choa ,kpics,crz3pp7,5,t5_2u4ls
4215371,0,t1_crz5wje,Yea whenever she is brought up the word Pretty is bound to show up.  Ive seen some fancammers showing strong support for her too such as the one who took these photos.  On top of all that she is ranked pretty high in the polls Note she was nd place last week with . percent of the total votes only . percent behind Jungyeon.  ,kpics,cs0qin2,1,t5_2u4ls
4294238,0,t3_3a4nvu,Irene is Bae.,kpics,cs9olay,6,t5_2u4ls
4312114,0,t3_3adxi6,BoRamgt  UTCgt  pic.twitter.com ImgurMistake? leave above link unaltered.SuggestionFAQCodeIssues,kpics,csbp9kx,1,t5_2u4ls
4326801,0,t3_3aj83v,Thats an awesome shirt too,kpics,csdcy7v,2,t5_2u4ls
4336687,0,t3_3aoesl,Source MV SISTAR  SHAKE IT,kpics,cseh38y,5,t5_2u4ls
4356764,0,t3_3awvpb,   Cant you just add a border or something??,kpics,csgqo1n,-4,t5_2u4ls
4364398,0,t3_3ay8x6,Which Weekly Idol episode is this? ,kpics,cshlp1h,2,t5_2u4ls
4401272,0,t3_3bel1s,I miss Nicole hosting variety shows and being so refreshingly weird.,kpics,cslrajr,1,t5_2u4ls
4411468,0,t1_csmhkr0,holy moly ,kpics,csmwnza,1,t5_2u4ls
4471354,0,t1_csu9rhi,Aww you shouldnt have!,kpics,csuad93,1,t5_2u4ls
4476209,0,t3_3cdxiw,I guess shes all grown up now ,kpics,csuw9ya,1,t5_2u4ls
4495859,0,t3_3co6dc,udragnzlyr,kpics,csxcz95,2,t5_2u4ls
4517150,0,t1_cszptdq,Well other than this picture I agree. I dislike most of SNSD other than tiffany. Just something off about most of them.EDIT To keep the unpopular train going the one I dislike most from a looks standpoint is Yoona she just seems really sad in every picture. I just dont think she ever wanted to be a pop star at least going by her mood. I just get this really fake vibe overall from Yoona specifically. ,kpics,ct0143a,-8,t5_2u4ls
4537126,0,t3_3d695p,Seolhyun smile D,kpics,ct2jaxh,2,t5_2u4ls
4545479,0,t3_3d8nd8,KJK BEST HYUNG,kpics,ct3l11g,1,t5_2u4ls
4600150,0,t3_3e0t9h,XPost Subreddit Link rSNSD Original post ,kpics,ctafs3b,2,t5_2u4ls
4619830,0,t3_3e9xw6,Full song,kpics,ctcwn4i,5,t5_2u4ls
4628763,0,t3_3ecfva,Mamamoo slaying acoustically and visually....,kpics,cte0z1q,3,t5_2u4ls
4633317,0,t1_cteleal,Yeah Chanmi has both the rbf and bangs nowadays. Devastating combo. ,kpics,ctelk9p,2,t5_2u4ls
4635264,0,t1_ctep6tx,What butt?,kpics,cteudy9,8,t5_2u4ls
4643855,0,t1_ctfwu6w,Haha I was just wondering about that. All the comments in this thread keep getting downvoted. Like someones just camping out to downvote everyone. Its not cute.,kpics,ctfx905,3,t5_2u4ls
4652411,0,t1_ctgv0ch,Based on their Music Bank performance those issues have been resolved no longer blonde at all.,kpics,ctgzwk4,3,t5_2u4ls
4727946,0,t1_ctpnaiz,,kpics,ctqhxv4,1,t5_2u4ls
4768093,0,t3_3g6hk8,Mina pls,kpics,ctvk8ad,7,t5_2u4ls
4777269,0,t3_3gbqza,Thank you for submitting! Unfortunately your submission has been removed for the following reasons The image you posted does not comply with our quality guidelinesbtcaj. Rule . All images should aim for a total number of gt  pixels width  height where any dimension must be at least gt  pixels.  Yours was x.,kpics,ctwpt06,1,t5_2u4ls
4834497,0,t3_3h3bsu,ah the no cable cdj player and pro scratch at the end. classic,kpics,cu3xe4f,7,t5_2u4ls
4899104,1,t3_3i002l,More like ARed eh? ,kpics,cuc2k73,0,t5_2u4ls
4911331,0,t1_cudh8e5,Milf  would bang. ,kpics,cudlz76,-5,t5_2u4ls
4934919,0,t3_3ih8yr,Literal Perfection,kpics,cugl3ms,2,t5_2u4ls
4962380,0,t3_3ivlts,I remember her saying she doesnt think shes sexy. Talk about not knowing yourself! ,kpics,cuk1p60,8,t5_2u4ls
4979286,0,t1_cum3tev,Yes aka Lee Jieun.But yea its a crappy title since obviously the person who is associated with that name is Secrets Song Jieun.,kpics,cum6d6p,8,t5_2u4ls
4994237,1,t1_cunowbs,No hate here just the truth Chanmi is the bottom for sure tho.,kpics,cunzpgs,0,t5_2u4ls
5035293,0,t1_cussxux,Try this one.,kpics,cusy01q,2,t5_2u4ls
5058243,0,t3_3k9azx,Source    More Seolhyun on Hanbam                  Beware strong aegyo with audio  ,kpics,cuvpjez,35,t5_2u4ls
5079923,0,t3_3kky8b,Ill admit that Ive done this,kpics,cuybn1i,8,t5_2u4ls
5086256,0,t3_3kof49,Source,kpics,cuz34vk,2,t5_2u4ls
5111366,0,t3_3l0e48,MRW Bubbles,kpics,cv240ej,1,t5_2u4ls
5130078,0,t3_3l7nol,gulp,kpics,cv4d7ip,3,t5_2u4ls
5143498,0,t1_cv5y13g,Because shes IU,kpics,cv5zfr2,7,t5_2u4ls
5145958,0,t1_cv5z9d3,Style. Start. Sbenu,kpics,cv6a4gk,4,t5_2u4ls
5191785,0,t3_3m3680,I always wonder how Jessicas departure from SNSD has affected their relationships.  Does Krystal still interact with SNSD? And if Krystal wants to do anything with Jessica does SM not allow it because of the publicity issues?,kpics,cvbswpo,3,t5_2u4ls
5237393,0,t3_3movzm,That last pic though x.x,kpics,cvhanv5,4,t5_2u4ls
5253741,0,t3_3myjow,Dong Dong pls,kpics,cvj9inm,5,t5_2u4ls
5293778,0,t3_3nibf8,deleted,kpics,cvocb9d,1,t5_2u4ls
5313366,0,t3_3nseoo,Source,kpics,cvqufeg,2,t5_2u4ls
5332010,0,t3_3nzdww,QUICK! SOMEONE GILD THIS MAN!,kpics,cvt82rx,5,t5_2u4ls
5362599,0,t3_3ogboz,oo,kpics,cvx4shm,13,t5_2u4ls
5405086,0,t3_3p0adm,Ok be honest guys how many of you fapped to her?,kpics,cw2k63p,7,t5_2u4ls
5410828,0,t3_3p4t2q,Hi im sarah mclachlan.. For only  cents a day you can...,kpics,cw3ak2i,-1,t5_2u4ls
5423914,0,t3_3pbtq7,Roommate season  anyone?,kpics,cw4ymah,10,t5_2u4ls
5426125,0,t3_3pb5tk,Anyone know where to buy the outline black and white top shes wearing in the first outfit?,kpics,cw58s88,2,t5_2u4ls
5445971,0,t3_3pnjt4,And the others,kpics,cw7rx08,5,t5_2u4ls
5461662,0,t1_cw9k7q1,Her bodytype is considered extremely attractive in lots of places,kpics,cw9s23q,3,t5_2u4ls
5481767,0,t3_3q5lnh,Dude you cant post something this cute and not post a source! ,kpics,cwcci8x,1,t5_2u4ls
5496032,0,t3_3qcmtm,Its really happening,kpics,cwe64wg,1,t5_2u4ls
5500823,0,t3_3qfuvp,Special Kei is my favorite ,kpics,cwes5nt,5,t5_2u4ls
5514609,0,t1_cwgjgpa,To be fair almost every picture of Seulgi features eye game. She has to be doing it intentionally. ,kpics,cwgjii5,9,t5_2u4ls
5588645,0,t3_3robu4,Also IU walking with her ducks,kpics,cwptnqs,6,t5_2u4ls
5593769,0,t3_3rqgya,She looks twice as beautiful as I expected ,kpics,cwqgjru,3,t5_2u4ls
5594336,0,t1_cwqe90q,Its ok fam... well get thru this together,kpics,cwqj2rv,2,t5_2u4ls
5626844,0,t3_3s5lz0,Another average looking Asian. Fucking nerds,kpics,cwukavc,-15,t5_2u4ls
5633659,0,t3_3s84zn,might have to make rkpopblep,kpics,cwveq6e,1,t5_2u4ls
5637746,0,t3_3sarh2, Hype!! ,kpics,cwvwzqr,2,t5_2u4ls
5677366,0,t3_3svibr,Totes adorbs ,kpics,cx0u079,2,t5_2u4ls
5693737,0,t1_cx2t9eo,Instagram direct links are allowed,kpics,cx2v3eq,1,t5_2u4ls
5696390,0,t3_3t47q5,The yuna fan group is called the Yunabombers just to let you guys know,kpics,cx36x0t,-14,t5_2u4ls
5699946,0,t3_3t70it,Whoever downvoted this Is going to get stabbed ,kpics,cx3mtga,4,t5_2u4ls
5701192,0,t1_cx3rc56,It is known.,kpics,cx3sdth,1,t5_2u4ls
5701617,0,t1_cx3u4i6,Sojin is hotter then the sun,kpics,cx3ua67,5,t5_2u4ls
5746675,0,t1_cx9eol5,Gulp x,kpics,cx9fj0q,2,t5_2u4ls
5759130,0,t3_3u02nx,What the hell we gonna need a new Seolhyun now? oAlso cruel title,kpics,cxaz3aa,2,t5_2u4ls
5779337,0,t3_3u7mke,Chewys not impressed.,kpics,cxdhc1s,1,t5_2u4ls
5788701,0,t3_3ufhq3,Stacks,kpics,cxen5it,2,t5_2u4ls
5803128,0,t3_3umdka,deleted,kpics,cxgfllp,1,t5_2u4ls
5812878,0,t3_3uqmsn,Momo O,kpics,cxhn4gs,1,t5_2u4ls
5817852,0,t1_cxi33yu,What the actual fuck.,kpics,cxi9bzf,15,t5_2u4ls
5822688,1,t1_cxivklh,Walnut Ill mash your nuts onto a wall you faggot leggo.,kpics,cxivo54,0,t5_2u4ls
5838173,0,t3_3v6vcv,CHICKEN MANYAAA!,kpics,cxkwtnl,5,t5_2u4ls
5869368,0,t3_3vn31j,Canadian blep,kpics,cxp06sw,5,t5_2u4ls
5898160,0,t1_cxsrzza,Well it stormed most of today in Sydney...tomorrows a bit of a breather before another scorcher on Friday.,kpics,cxss6hf,1,t5_2u4ls
5917482,0,t1_cxvb6q2,See thats what Im saying. Nobody understands my love for Chorongs voice   even though its not the best singing voice  its definitely the most adorable one! lt ,kpics,cxvbaai,8,t5_2u4ls
5927844,0,t3_3wjacj,so damn pretty..,kpics,cxwo6qx,2,t5_2u4ls
5962507,0,t3_3x253z,Thanks for the gold anonymous benefactor!,kpics,cy17rgx,1,t5_2u4ls
5990449,0,t3_3xic62,Chorong combining bangs and a rolled up plaid shirt. Im done.,kpics,cy4vncf,8,t5_2u4ls
6027107,0,t1_cy9l3aj,That actually looks kinda relaxing lol,kpics,cy9oav4,2,t5_2u4ls
6048747,0,t3_3ybhsl,She touched the butt,kpics,cychtwc,1,t5_2u4ls
6177150,0,t3_403crd,She has one of the more attainably adorable faces...know what I mean? Like she is beautiful but not supernaturally so.,kpics,cyrs0fy,2,t5_2u4ls
6184043,0,t1_cysik6s,lol nice. How do you come by such bts stories?,kpics,cysk83y,1,t5_2u4ls
6184507,0,t3_409rwu,Was this taken recently?,kpics,cysm4h1,1,t5_2u4ls
6229635,0,t3_40wd1v,send help,kpics,cyxqpli,5,t5_2u4ls
6264876,0,t3_41e8ck,Shes so pretty ,kpics,cz1qvwg,3,t5_2u4ls
6280372,0,t3_41ml51,sourcei recommend watching the whole video though. subin was on fire in both dancing and hilarity in this episode of lets dance.edit messed up and forgot the timestamp in the link. heres the point where the gif is taken from.,kpics,cz3iary,2,t5_2u4ls
6296133,0,t3_41ui2z,she looks great in a hanbok,kpics,cz5aruz,3,t5_2u4ls
6329712,0,t1_cz92tqe,Are there any of the whole AOA Like a cat crew? I need a new wallpaper. ,kpics,cz94aa2,3,t5_2u4ls
6333419,0,t1_cz99gbn,You should watch some Running Man then.,kpics,cz9jgks,4,t5_2u4ls
6349325,0,t3_42lajl,but minah ,kpics,czbciwh,18,t5_2u4ls
6355017,0,t3_42nqom,fuck,kpics,czbzuob,5,t5_2u4ls
6356425,0,t3_42msww,The dream,kpics,czc5m1a,1,t5_2u4ls
6369477,0,t3_42uqau,so we already are getting spoilers about who wins the idol athletics stuff? ,kpics,czdn1lr,2,t5_2u4ls
6369964,0,t3_42snns,BoPeepBoPeep or Like A Cat?,kpics,czdp11j,2,t5_2u4ls
6383298,0,t3_4330xi,Thank you for submitting! Unfortunately your submission has been removed for the following reasons This image or the album it originates from has already been posted.,kpics,czf7np2,1,t5_2u4ls
6418540,0,t3_43k7o6,everyone says seolhyun but i get nana vibes,kpics,czj7p2h,7,t5_2u4ls
6418959,0,t3_43k88i,More,kpics,czj9986,3,t5_2u4ls
6459031,0,t3_444s18,Source ,kpics,cznentt,3,t5_2u4ls
6471404,0,t3_449750,Ponytails  GOAT hairstyle,kpics,czoot31,2,t5_2u4ls
6503035,0,t1_czqf9yl,Lmao,kpics,czryofb,1,t5_2u4ls
6527662,0,t1_czudlmp,Seriously?,kpics,czuigbl,4,t5_2u4ls
6530434,0,t3_452obh,,kpics,czusr7f,2,t5_2u4ls
6562066,0,t1_czy2k2o,If hes cool like Gary with Jihyo then it shouldnt be a problem,kpics,czy2m04,3,t5_2u4ls
6574434,0,t3_45mr46,GG,kpics,czzcn75,1,t5_2u4ls
6611428,0,t3_467uao,brilliant dress,kpics,d036eh6,13,t5_2u4ls
6657669,0,t1_d07yk8b,Theyre all the best Happy now?,kpics,d07yld9,1,t5_2u4ls
6662503,0,t3_46wuen,Fool promo season.  Massively underrated.,kpics,d08gkjn,2,t5_2u4ls
6667987,0,t1_d08ypyw,Hyoeun is more sexy though xD,kpics,d091039,1,t5_2u4ls
6681604,0,t3_4750uv,minaangghhh,kpics,d0afq35,5,t5_2u4ls
6686251,0,t1_d0awlh8,tbh I was thinking the exact same thing so I deserve to be banned too D ,kpics,d0ax0gr,1,t5_2u4ls
6712071,0,t3_47kerk,Swoona pls,kpics,d0dl3e0,2,t5_2u4ls
6742061,0,t1_d0gocnm,Search YouTube for   Candy Boy  I on mobile now,kpics,d0goqem,1,t5_2u4ls
6786087,0,t3_48mfqe,damn you Alex ,kpics,d0lhnic,3,t5_2u4ls
6810449,0,t1_d0nbdiq,LOL,kpics,d0o9f5v,2,t5_2u4ls
6843128,0,t3_49gbsh,Gesundheit random dude at gym.,kpics,d0rz2s7,1,t5_2u4ls
6853792,0,t3_49j7cx,her selcas are often quite seriouslooking contrary to her actual playful personality ,kpics,d0t6ovn,1,t5_2u4ls
6862268,0,t3_49q1y4,Load remaining  imagesMy body wasnt ready.,kpics,d0u5c3b,6,t5_2u4ls
6863977,0,t3_49p5nq,Thank you for submitting! Unfortunately your submission has been removed for the following reasons This image or the album it originates from has already been posted.,kpics,d0ucble,1,t5_2u4ls
6865891,0,t3_49ssp7,So much cute in one picture I cant handle it ,kpics,d0uk51y,6,t5_2u4ls
6874753,0,t3_49wg62,I ship it,kpics,d0vkek2,6,t5_2u4ls
6895338,0,t3_4a71ig,Source ,kpics,d0xwl8r,3,t5_2u4ls
6903144,0,t3_4a9dke,She looks like a mix of RVs Yeri and WGs Yeeun,kpics,d0ysgnj,2,t5_2u4ls
6992287,0,t3_4bg3ui,rd pic Seuldy lt,kpics,d18x2ge,2,t5_2u4ls
