,controversiality,parent_id,body,subreddit,id,score,subreddit_id
9653404,0,t1_da2xg36,Glorious? Bunny raises an eyebrow. Lets not get ahead of ourselves...,KowzHOF,da2zduy,2,t5_3hhke
9658537,0,t1_da3hlmx,Im not sure as to their value but uou obtain extras by taking them from the dead bodies of those you kill...,KowzHOF,da3m7o9,1,t5_3hhke
9760418,0,t3_5e8y66,deleted,KowzHOF,dag6u0u,1,t5_3hhke
9917928,0,t3_5hht6k,DAY  CHAIN,KowzHOF,db0bxdz,1,t5_3hhke
10627180,0,t1_ddc3xxs,Abbey frantically waves her hands.No no no no no no Zhou! Youuuu caaaant saaaay kiiiids areee hooot!!!,KowzHOF,ddc429u,8,t5_3hhke
10628620,0,t1_ddc7knx,I hope so senhor Zhou. You are very good at the English. If you keep trying you will succeed. Ido smiles.,KowzHOF,ddc9f32,7,t5_3hhke
10630178,0,t1_ddcf1v9,Senhor Zhou... Ido grins that smug grin. You must be making jokes too arent you?,KowzHOF,ddcf7b2,6,t5_3hhke
10630992,0,t1_ddcdwpp,The kitchen? Oh yesssssssssss there are some things I want from the kitchen... A gleam enters her eyes as her hands come together.,KowzHOF,ddci84t,8,t5_3hhke
10637270,0,t1_ddclgwu,Zhou looks as though he missed something not being able to make out what Eventide muttered Hm what say?,KowzHOF,ddd5ii7,2,t5_3hhke
10641758,0,t1_dddg2xd,From behind Kame where only Shinji can see Eventine mimes sucking off her thumb.,KowzHOF,dddm6mu,6,t5_3hhke
10654279,0,t3_5sg74y,Chris stumbles into the room in a way that says I didnt sleep enough so Im not all with it  but we both know its sexy as hell.I dont think I saw them yesterday. Hey they look just like me! Fuckin long lost twin or something???? I should say hi.. like not gonna lie.. Id tap that.Chris is looking at a mirror.,KowzHOF,ddewnsa,6,t5_3hhke
10656738,0,t1_ddf5lu5,You could see it as a trade for that rejuvenating massage. I think itd be a crime to throw this cake away if someone would happily make use of it. Its all yours. Jack says with an unpracticed smile.,KowzHOF,ddf5spp,6,t5_3hhke
10715805,0,t1_ddl8c54,Death my Ass.Carlos glares at Tide looking annoyed.,KowzHOF,ddl97wt,4,t5_3hhke
10729250,0,t1_ddmn2cf,Ooops sorry! I just got carried away by people shouting names!She jumps back and yells Abbey is an Antagonist! Wohooo! Feaaarr meee!,KowzHOF,ddmn4f1,6,t5_3hhke
