,controversiality,parent_id,body,subreddit,id,score,subreddit_id
3683670,0,t3_32j7qw,Yeah I woulda hit him with that babality but the input is hard and Im kind of broke so....,Kappa,cqc5veg,3,t5_2tjsd
3684270,0,t3_32j0no,Mkx is dead,Kappa,cqc8bzg,1,t5_2tjsd
3684827,0,t1_cqc9t3y,redditor for  minutes.,Kappa,cqcamco,3,t5_2tjsd
3689109,0,t1_cqcry7q,Are you retarded? ,Kappa,cqcs72i,2,t5_2tjsd
3695176,0,t1_cqdc5jl,That overhead is ? Im used to it being  in s damn.,Kappa,cqdh3ji,1,t5_2tjsd
3696177,0,t1_cqdkq6v,KoF zombie status on that TenCent money right now,Kappa,cqdl7h9,4,t5_2tjsd
3699743,0,t3_32reb6,Im surprised you guys didnt use the Kazunoko smirk for the back of the shirt instead of another Yun.,Kappa,cqdzuae,3,t5_2tjsd
3701545,0,t1_cqe6tko,Thank you !!! ,Kappa,cqe78ku,1,t5_2tjsd
3701670,0,t3_32rtth,                                                                                        ,Kappa,cqe7r19,2,t5_2tjsd
3702158,0,t3_32r5l4,Now get this guy streaming,Kappa,cqe9r3g,-2,t5_2tjsd
3707004,0,t3_32utcv,hahahh rofl lmao holy fuck kappaprime youve done it again with your timely and topical ironic shitpost metacommentary,Kappa,cqeto20,8,t5_2tjsd
3708628,0,t1_cqewq9t,In MKX Im always playing in the neutral but thats cause I fail at life too much to actually do combos,Kappa,cqf0c0t,1,t5_2tjsd
3711496,0,t1_cqdyaci,Floe wanted to leave EG.,Kappa,cqfc3q2,1,t5_2tjsd
3714203,0,t1_cqfjphg,I play USF on  so it didnt matter for me anyway.,Kappa,cqfn8i0,-8,t5_2tjsd
3714665,0,t3_32y2ky,Consider suicide if you think thats funny,Kappa,cqfp4ug,3,t5_2tjsd
3715892,0,t3_32y606,I dunno if it happens more in MK or not. What i do know is i played MK a lot on launch.  I knew like two Sonya combos and a basic ass mix up in the corner using her command grab and won  matches in a row at one point. Keep in mind i am total trash at MK and all fighters.Anyway the amount of dudebro anger i got was awesome. i shit you not i got msgs at least ten times if not more about me spamming blockI think its mainly cause a lot of people who only buy madden and COD every year also buy MK. The game has a huge super casual base.,Kappa,cqfu6hc,13,t5_2tjsd
3717361,0,t1_cqfzuhr,I want to be offended but somewhere between fashion goddess and the misplaced semicolonthings just kind of got funny.Not sure if intentionaleither way you have a gift. Sidenote I think the graphics are pretty sharp.,Kappa,cqg07o9,1,t5_2tjsd
3720293,0,t1_cqgc6jo,Juri seems like she gets around her feet are probably the only clean place left,Kappa,cqgc8u5,6,t5_2tjsd
3720622,0,t1_cqgd81s,Yuropoor here. BibleThumpAfter reloading the page a trillion times it works now but it skips and loads all the time. Theres no quality setting either which I would have liked. And theres ads playing on top of the people playing...,Kappa,cqgdld7,3,t5_2tjsd
3723002,0,t1_cqgaij7,RIP Nightwolf.,Kappa,cqgncoi,1,t5_2tjsd
3726329,0,t3_332y86,The documentary King of Chinatown is good place to start. It revolves around Justin Wong EMP and Triforce. ,Kappa,cqh0z57,16,t5_2tjsd
3727665,0,t3_331utt,this game is awful lmao,Kappa,cqh6g1z,-3,t5_2tjsd
3734196,0,t3_335zhp,Wow fanatiq still a thing? This makes me wonder about what happened to Jago. Havent heard of that guy for ages.,Kappa,cqhx87f,5,t5_2tjsd
3734700,0,t1_cqhx7p2,Well he has to because streaming is his gig now. Get the most out of MKX until the viewers start dropping and when the next CPT qualifier comes around. Kappatalism at its finest!,Kappa,cqhzb1a,2,t5_2tjsd
3736525,0,t3_3376em,Because PL is relevant in SF Kappa,Kappa,cqi6snt,21,t5_2tjsd
3737082,0,t1_cqi908e,Sonicfox already beats PL at most majors I wont be surprise to see PL lose to Sonicfox. Besides PL just mad that no one remembers he is a two time Evo in an irrelevant game Kappa,Kappa,cqi92s0,9,t5_2tjsd
3737249,0,t3_335gpl,Breaking news a dude shows up to his job on time. Good content OP!,Kappa,cqi9rc7,20,t5_2tjsd
3737862,0,t3_337kr5,Jokes on you MK players cant read,Kappa,cqic9j0,55,t5_2tjsd
3741018,0,t1_cqikthp,Smash finally got some collusion going on?,Kappa,cqip8dp,10,t5_2tjsd
3741253,0,t1_cqiilz6,deleted,Kappa,cqiq749,1,t5_2tjsd
3754599,0,t3_33ehzz,I think women are all born secretaries with no interest in playing games who exist for me and the rest of the community to ogleBtw please apply for this job,Kappa,cqk92fw,25,t5_2tjsd
3756729,0,t3_33ea8i,People really fall for this shit.,Kappa,cqkhtlp,2,t5_2tjsd
3757847,0,t1_cqka68b,You realize that change was unintentional right? It was just supposed to give the AA U priority if the commands overlap not give you a  screen AA ultra that you can charge in  frames while moving and charging her other back charge moves. Oh and its also safe on whiff no blocking it unless they have something like Ryus super,Kappa,cqkmel4,0,t5_2tjsd
3759630,0,t1_cqkt27y,Im pretty sure the consensus around here is that SF is pretty wack by the way capcom handles it.,Kappa,cqktq8c,11,t5_2tjsd
3766922,1,t3_33k3aq,not fucking st fuck me,Kappa,cqlno80,1,t5_2tjsd
3767696,0,t1_cqlqtc4,i kno right?,Kappa,cqlqu6e,-15,t5_2tjsd
3768546,0,t3_33knqt,DansGame nigga cant even spell GCS properllyz n its shorten already three letters how you mix them up yo,Kappa,cqlubdv,0,t5_2tjsd
3768717,0,t3_33kcyo,Were all alt accounts.,Kappa,cqlv0lj,16,t5_2tjsd
3769840,0,t1_cqlxmu0,Not only that but the fucking comments literally full of begging thirsty fuccbois.rgonewildaudio is more tolerable to an extent though its just audio ,Kappa,cqlzmh2,6,t5_2tjsd
3769989,0,t1_cqltojp,When I attended last year the front desk were attractive WASP women. When I read Andersons request on the NW Majors Facebook page this week I just assumed he wasnt kidding because I didnt see a single male working the front last year,Kappa,cqm08ju,5,t5_2tjsd
3770058,0,t3_33lcy0,Poongko is that you under that wig?,Kappa,cqm0irk,5,t5_2tjsd
3771689,0,t3_33m18t,I remember when rkappa didnt have attention whores shitposting constantly Head,Kappa,cqm77rr,2,t5_2tjsd
3774902,0,t3_33m6dd,Always fabulous family man.,Kappa,cqmkepw,3,t5_2tjsd
3776915,0,t3_33nx5b,. Why the fuck should I give my minimum wage paycheques to General Mills? Marshmallow Mateys is just as good as that Cuckold Charms shit. . Yes. That old white guy around the corner will pay you for blowjobs. The crusty old crackhead will give blowjobs for alcohol. That shady Croatian motherfucker upstairs will take food to offload his bootleg vodka. EBT buys food. You do the math. . Ive purchased  copies and have sold them all. . FUNgineer. Click Here,Kappa,cqmso7r,13,t5_2tjsd
3777998,0,t1_cqmd0yf,Ive literally never been on that website lol.Regardless Im not saying her ban was unjustified but if she cant go to KiT why is Noel Brown allowed at CEO? There is no way to justify it without being a massive hypocrite.,Kappa,cqmx3z8,0,t5_2tjsd
3778708,0,t1_cqmkf70,Infiltration is going and will rock the rKappa tag as well D,Kappa,cqn00fg,3,t5_2tjsd
3781765,0,t1_cqmuunn,lol ,Kappa,cqnclad,2,t5_2tjsd
3790398,0,t3_33txu0,I bet it has better netcode than MKX TriHard,Kappa,cqoc373,21,t5_2tjsd
3793581,0,t1_cqo7kvm,the potato likes carrotsIYKWIS DAWGGGG,Kappa,cqop5sh,2,t5_2tjsd
3798214,0,t3_33wfq7,deleted,Kappa,cqp85k4,1,t5_2tjsd
3799944,1,t3_33y1xl,isnt he quitting,Kappa,cqpf8xv,3,t5_2tjsd
3799984,0,t1_cqpfbtp,DansGame so youre saying the wig should have been stolen instead of the joystick? ,Kappa,cqpfew6,3,t5_2tjsd
3800406,0,t3_33y1xl,I didnt know Razer made a ps stick ,Kappa,cqph5lv,3,t5_2tjsd
3801590,0,t1_cqplqck,If they gonna drop links on mainstage they deserve to eat an u. If someone is prone to spamming u in combos just bait it and kill them for the round.,Kappa,cqpm0mq,8,t5_2tjsd
3804012,0,t3_33zodh,What majors are you talking about?,Kappa,cqpvz6d,6,t5_2tjsd
3804576,0,t3_33zukc,DansGame I HOPE EBI BRINGS HYPE TO STUNFEST OR RKAPPA IS A FAIL,Kappa,cqpyahq,1,t5_2tjsd
3804773,1,t1_cqpz2h9,deleted,Kappa,cqpz3lc,-3,t5_2tjsd
3805374,0,t3_3404r3,Wow I didnt even know this was a thing.  This is a really innovative way to show off highlights even if some of the highlights are eh the system you used is badass. This looks like it takes a lot of work and adaptation on the fly yet I hope others adopt it.  Good stuff.,Kappa,cqq1k89,21,t5_2tjsd
3808887,0,t3_340x74,Tampa BisonBJ Unchained Snake EyezI mean we keep sending Asians to the US to take our candy I say we return the favor. ,Kappa,cqqfz11,6,t5_2tjsd
3811758,0,t3_342zym,It was in a paid parking spot so there should be cameras.Stay tuned as next week Markman announces he knows exactly who the perpetrators are and theyd better come forward and return it all...or theyll be sorry. Kappa,Kappa,cqqrrrn,99,t5_2tjsd
3812185,0,t1_cqpxto5,Im really glad he won something again but NWM wasnt exactly a stacked tournament. I mean LPN managed to get out of pools and make top . V,Kappa,cqqtiw2,1,t5_2tjsd
3813787,0,t3_343tx9,Do you know his insurance deductible?,Kappa,cqr03sd,6,t5_2tjsd
3820732,0,t1_cqrpfz4,Looking at the big sponsors a lot of the big esports teams are pulling in I dont think are dependent upon something like TV exposure. Just because fighting games are still more niche other games dont have the same problems. AlsoI remember spooky talking about twitch having comparablesometimes even bigger numbers than most tv stations. Even a comparebly smaller channel like him,Kappa,cqrsmk8,0,t5_2tjsd
3821554,0,t3_3475vp, ChrisG Some west coast Ken player Filipinomanbaby NerdjoshHead,Kappa,cqrw0lh,49,t5_2tjsd
3826593,0,t1_cqs4xml,maybe u feel like a moron cuz u R a moron???,Kappa,cqsgpjh,0,t5_2tjsd
3827883,1,t3_349x45,Im  pound so im embarrased to take off my clothes i shower with the lights off,Kappa,cqslzv1,2,t5_2tjsd
3835474,0,t3_34csq4,Stop giving him attention. FailFish ,Kappa,cqth77n,9,t5_2tjsd
3836588,0,t3_34bpdz,will KVO be on Twitch?,Kappa,cqtlrm7,3,t5_2tjsd
3836763,0,t1_cqqg7l8,Instead of more suggestions could you conider removing some asian players? Like fagUnoko for example. If the ticket is  usd remove poongko too he can achieve that with donations on his stream on a week so not a problem for him. Same for Infil.,Kappa,cqtmhgo,0,t5_2tjsd
3840047,1,t1_cqtzy0j,No Im a virgin ,Kappa,cqtzz60,-2,t5_2tjsd
3840441,0,t1_cqu1ccr,Hi Im Marvel. When we doing this? TriHard,Kappa,cqu1lbx,25,t5_2tjsd
3849861,1,t1_cqv39jz,Its stupid because this new super arcade will eventually fail too because fat fuck Watson cant run a business.  Im sure his wife and kids think its ok tho TriHard,Kappa,cqv4as6,-1,t5_2tjsd
3853227,0,t1_cqveytg,Out of the  matches Ive played only  havent had a disconnect.,Kappa,cqvi4kc,3,t5_2tjsd
3854250,0,t3_34kov1,suck brick kid,Kappa,cqvmc0q,14,t5_2tjsd
3855418,0,t3_34krvs,nahh fuck that if he wanted to he could tag in JAHA and use him as a ringer with abs.chunkyboyz  eva,Kappa,cqvr4kz,3,t5_2tjsd
3856528,0,t3_34lsjy,Not the first time Viscant has had a hard on for kids BTW.,Kappa,cqvvoix,10,t5_2tjsd
3860774,0,t1_cqvrxeg,Thick Asian Thursday,Kappa,cqwd2kp,1,t5_2tjsd
3869151,0,t3_34r027,Other link?,Kappa,cqxbeyd,1,t5_2tjsd
3873232,0,t1_cqxrzg7,Yeah but Makoto is broken tier so thats logical.,Kappa,cqxs59n,-12,t5_2tjsd
3874066,1,t3_34rnym,This wasnt free. Good matches,Kappa,cqxvkhs,-2,t5_2tjsd
3874202,0,t1_cqxuu3t,fity centz?,Kappa,cqxw4nr,1,t5_2tjsd
3874277,0,t3_34r112,Mayweather is just Balrog and Yun put together. Just turtle in the corner and then Kara command grab. ,Kappa,cqxwfsi,2,t5_2tjsd
3874932,0,t3_34tssd,uadremeaux Took  dollars from a donation drive and claimed it was an accounting fee if that counts. He then demodded himself after someone posted a picture of poop but we all know it was a clever ruse. ,Kappa,cqxz4rp,2,t5_2tjsd
3877290,0,t3_34urpc,Asias very own Mexicans.,Kappa,cqy8tcm,8,t5_2tjsd
3877737,0,t1_cqya54p,All the fake hype that the players have been putting onto MKX just died instantly.,Kappa,cqyangp,25,t5_2tjsd
3878954,0,t3_34v5hx,Now I can get the Taco Bell shits earlier in the day than usual TriHard ,Kappa,cqyfngl,10,t5_2tjsd
3880016,0,t3_34vv7v,gt Hitler also thought what he did was rightHahaha this motherfucker basically set the trap and mk dived right in. I like Leffen,Kappa,cqyk0je,131,t5_2tjsd
3880894,0,t3_34w6e7,kindevu,Kappa,cqynlym,4,t5_2tjsd
3882804,0,t3_34wwdu,The cursor was a nice touch.,Kappa,cqyvfyn,5,t5_2tjsd
3884769,0,t1_cqz30sv,hes a mad man who will stop him!?,Kappa,cqz3i9r,7,t5_2tjsd
3887188,0,t1_cqzaxss,A U T I S M B O Y SEditHoly shit. I got home and noticed I replied to the wrong thing. Either my phone or me had a fuck up.,Kappa,cqzdg05,4,t5_2tjsd
3893481,0,t3_3515de,hey thanks for the reminder bud,Kappa,cr03a06,4,t5_2tjsd
3901113,0,t1_cr0oyw1,Nemo knocked Matsuri into the lower bracket though so he is forever a heathen.Kappa,Kappa,cr0ym5x,3,t5_2tjsd
3901605,0,t3_353qzn,Infiltration Nemo  we going full DeKappa. ,Kappa,cr10myk,4,t5_2tjsd
3905838,0,t1_cr1h3m4,Ofc she is and Masturi will be the rpreasnt RKappa army. ,Kappa,cr1i07z,0,t5_2tjsd
3908574,0,t1_cr1t32v,its mad jealousy. ive never watched max but ive seen some of Justin. He  just comes off like he really enjoys streaming and doing stuff for his viewers. who knew having fun and enjoying things works!,Kappa,cr1t97q,9,t5_2tjsd
3911708,0,t1_cr25h1b,Yeah youre right prison showers would be way to welcoming,Kappa,cr264ys,5,t5_2tjsd
3911900,0,t1_cr2669j,er and up alert,Kappa,cr26xf0,8,t5_2tjsd
3913192,1,t1_cr29up4,Dude not cool there are legit women who cant have kids either.,Kappa,cr2c7wf,4,t5_2tjsd
3916584,0,t1_cr2pdi2,When was Mahvel? Kappa,Kappa,cr2q5uc,-29,t5_2tjsd
3918971,0,t3_35c0bc,Matsuri,Kappa,cr2zyoa,6,t5_2tjsd
3919062,0,t3_35c0bc,Nemo,Kappa,cr30c47,8,t5_2tjsd
3920347,0,t3_35c0bc,EX PugeraWith Infil and Poongko at the top of the nonqualified point chart we need to bump up the next available player. Shout outs to USA CPT winner pipe dreams.,Kappa,cr35m36,4,t5_2tjsd
3923226,0,t3_35dqmj,Kai oh police? The fuck does that even mean?,Kappa,cr3hfat,2,t5_2tjsd
3925895,0,t1_cr3rwii,deleted,Kappa,cr3sdgi,-4,t5_2tjsd
3926218,0,t3_35f4bz,Should be pretty cheap to ship an urn out to asia,Kappa,cr3tp3y,2,t5_2tjsd
3928869,0,t1_cr445qq,Persia and Nercromina. And SuperYan.And didnt razer sponsor another socal one too?,Kappa,cr44kfg,4,t5_2tjsd
3928940,0,t1_cr44r0o,Hey you do you.  Im just on teamvocationalabstinence,Kappa,cr44v1c,5,t5_2tjsd
3929031,0,t1_cr45280,Sorry. Im not really into men.,Kappa,cr458kn,5,t5_2tjsd
3932283,0,t1_cr37mmz,Id take magus over ski. Not by much though,Kappa,cr4iki4,1,t5_2tjsd
3934663,0,t3_35c0bc,Matsuri,Kappa,cr4sbxu,2,t5_2tjsd
3936738,0,t3_35jkin,Hey guys anyone here know of this one super underrated and unknown Japanese player called Daigo? Hes won so many tournaments but nobody knows who he is because he doesnt stream! lol what an idiot right? Every pro player should stream.  TriHard,Kappa,cr50tym,86,t5_2tjsd
3937653,0,t3_35k1p0,Ultra came out in ? Didnt know that ,Kappa,cr54kv9,22,t5_2tjsd
3937976,0,t1_cr558ea,Theres a reason why kbrad put snake above himself on the overrated list.,Kappa,cr55wdv,21,t5_2tjsd
3940318,0,t1_cr5azs0,so.. affordable?,Kappa,cr5fhn2,9,t5_2tjsd
3946923,0,t3_35nu86,god yes video game fight matches between semianonymous individuals gives me the raging boner,Kappa,cr66m94,17,t5_2tjsd
3949972,0,t3_35ophc,Setting the goal till we get to Marq Teddy will look a little bit sketchy on the fundraiser websiteit will add A LOT. Any sollutions for that ?,Kappa,cr6j46q,2,t5_2tjsd
3953739,0,t1_cr6f4eq,And thats the risk you take. I live in a small town and even we have signs not to leave stuff visible in your car. ,Kappa,cr6ykbq,3,t5_2tjsd
3955776,0,t1_cr5m19y,Time for someone to hang.,Kappa,cr76xem,1,t5_2tjsd
3962879,0,t1_cr7yjhn,Yeah that fucking ending though had me yelling as much as them. long live mahvel,Kappa,cr802js,7,t5_2tjsd
3964384,0,t1_cr863d0,k,Kappa,cr868tu,8,t5_2tjsd
3964939,0,t1_cr88io5,tyty,Kappa,cr88j5f,1,t5_2tjsd
3968374,0,t1_cr8gien,Its not simple. Its pretty much guarenteed to fail. Its why there are no more fucking arcades anymore. He blew it. You cant get a permit for an arcade in SoCal. Police dont want to deal with it. When I see that permit I will happily print out my words and eat them. But until then he lost the only location that had a grandfathered permit and this place will be shut down because I bet hes running it without a permit. Because hes a fucking idiot. ,Kappa,cr8mmt0,9,t5_2tjsd
3970054,0,t1_cr8qt4y,Maybe you shouldnt drop your combos then. have you ever even watched a game of MK? full screen specials with super armor and plus on block all over the place. totally not scrubby right.,Kappa,cr8ti7d,16,t5_2tjsd
3970517,0,t1_cr8uv1n,In mkx pretty much every EX move has armor. So everyone just does them on wakeup,Kappa,cr8vej2,1,t5_2tjsd
3978488,0,t3_35z2a8, others have noted that Reddit was instrumental in organizing the GamerGate movement a group of video game enthusiasts  predominantly male  who were said to have systematically aimed at and harassed outspoken female critics of the video game industry across multiple sites.  Reddit confirmed for having been handed over to NWO.  edit  ResidentSleeper,Kappa,cr9s4l7,2,t5_2tjsd
3979143,0,t3_35w7bu,Some of us contributed a lot more than  cents... I dont know why I ever give money to Kickstarters anymore. Oh well at least its been entertaining and a few new arcades have opened up recently in the area that have their shit together. Sounds more like hes opening a WWE spinoff than an arcade at this point.,Kappa,cr9ut2w,1,t5_2tjsd
3980993,0,t3_3606u1,can i get more drumsticks though ? ,Kappa,cra2f00,1,t5_2tjsd
3981389,0,t1_cr95pph,It doesnt matter because all games except the original MVC verify SOCD. Would be no different on a pad holding left on the analog and right on the DPad which you could also do in MVC.,Kappa,cra428y,2,t5_2tjsd
3981505,0,t3_360spq,you guys should get trollcoin to sponsor your weeklies. total synergy. They did a pot bonus for a recent fightcade online tourney. ,Kappa,cra4jkd,2,t5_2tjsd
3984674,0,t1_cradbyg,its that ec swag. even justin was loud... one time he was yelling Mongolians at the gate!!! during a s tournament after the infamous too easy no fun by pyrolee,Kappa,crahlat,2,t5_2tjsd
3985702,0,t3_364blg,Rickys male facial structure just isnt feminine. Thats going to be his downfall.,Kappa,cralt6d,9,t5_2tjsd
3996118,0,t3_368vhx, Kreygasm Wish I took gym with her in high school tho.,Kappa,crbsgtw,4,t5_2tjsd
3999369,0,t3_361dg2,If there is a Vatista nerf Ill be sad.,Kappa,crc5rhu,1,t5_2tjsd
4000705,0,t1_crcb4zy,deleted,Kappa,crcb8ir,0,t5_2tjsd
4004707,0,t3_36bt73,Does he activate XFactor by tilting the controller up? PogChamp,Kappa,crcrn47,26,t5_2tjsd
4011161,0,t1_crd167e,Not even sure why he would think it was funny Justin is an east coast killer who used to steal Valle and his crews money for years upon years.,Kappa,crdi4lh,-1,t5_2tjsd
4014702,0,t1_crdwaix,,Kappa,crdwn76,3,t5_2tjsd
4017287,0,t1_cre4wt1,Well see multiple at E.,Kappa,cre7911,8,t5_2tjsd
4021620,0,t3_36hqog, years old and still kicking ass like ,Kappa,crep1dd,3,t5_2tjsd
4022728,0,t3_36ksxd,Real Fucking Talk What da fuck is wrong with all these spam  quadruple post bullshit today?,Kappa,cretktx,0,t5_2tjsd
4024939,0,t1_crezpft,Jim there is no need to insult others because you are special.,Kappa,crf2mrs,1,t5_2tjsd
4027493,1,t1_crfcwdp,performed well Kappa.  Its hard to get used to not being the best right.,Kappa,crfd49o,-2,t5_2tjsd
4030945,0,t1_crfqhrv,Damn thats sick. Shouldve known spike drew that himself. he did a good job and you made a good request    now I wonder if your next commission will also show up on rkappa,Kappa,crfrblc,3,t5_2tjsd
4034549,0,t1_crg2853,That school life... I think? Not sure about his school schedule but i could see that rKappa|PIE Smug. Get past some of the haters and who knows maybe hell just become a full time                           rKappa|DuffMan ,Kappa,crg63q4,2,t5_2tjsd
4036435,0,t1_crgdj4f,gtboth of which appeal to the fuqqboi inside of meLewd OpieOP,Kappa,crgdu49,27,t5_2tjsd
4038830,0,t3_36qsut,This slut would get it against her will!,Kappa,crgno3f,-7,t5_2tjsd
4040477,0,t3_36t4wa,With or without consent that bitch vampy would get it raw!,Kappa,crgufga,-33,t5_2tjsd
4041446,0,t3_36t80x,This isnt sf..... ,Kappa,crgyevp,0,t5_2tjsd
4048705,0,t1_crhgqsf,ers who just learned bout him,Kappa,crhs804,-2,t5_2tjsd
4049394,0,t1_crhuqer,i forgot my password to my other account,Kappa,crhv1sj,-11,t5_2tjsd
4049597,0,t3_36xarb,Can you stop making so many shit blogposts? You are an awful poster. Fucc off.,Kappa,crhvvt7,2,t5_2tjsd
4052482,0,t1_crh0rjz,If you had multiple choice questions in physics it wasnt a real physics course.,Kappa,cri7q9g,1,t5_2tjsd
4054237,0,t3_36zjy7,the USF team tournament is not part of the CPT tour.,Kappa,criewlm,7,t5_2tjsd
4055365,0,t1_criemui,its a ballsack cameltoe,Kappa,crijiwm,3,t5_2tjsd
4056252,0,t3_2nly1y,Hello Im new to mac but I just downloaded fightcade for my mac having a couple issues.  . How do I get my fightstick to run on a mac? .  When I open a game I dont have a the menu access for Game video audio misc.  Its just not there.  The games are opening in a different window with vine.  Help!?! Thank you.,Kappa,crin5tz,0,t5_2tjsd
4057114,0,t3_370li7,WAYSUF ,Kappa,criqp42,2,t5_2tjsd
4057140,0,t3_370sv2,If you missed it!rKappa Shrimp vs rKappa Kebab,Kappa,criqsyd,6,t5_2tjsd
4058301,0,t1_criuvo4,r u offendid?edit oh nobody likes you,Kappa,crivkfg,-1,t5_2tjsd
4058351,0,t1_crinrl2,Probably but iduno how cam sites work. Do they keep a percentage of the money you make?Or is it like paypal you get to keep ?,Kappa,crivrt7,1,t5_2tjsd
4062574,0,t1_crjbdjo,OH MY DAYS,Kappa,crjd2dw,25,t5_2tjsd
4063210,0,t1_crjfb0y,ukakugeseven danke,Kappa,crjfo5f,3,t5_2tjsd
4063410,0,t1_crjd8w9,Only Daigo. GOD DAMN.,Kappa,crjghnj,7,t5_2tjsd
4064268,0,t3_3749bw,thank you based daigo,Kappa,crjk090,39,t5_2tjsd
4065352,0,t1_crjnpsb,It all depends on the SLA the Hotel agreed to when signing the contract. Normally its  hours for anything that isnt DSL.Source I work at an ISP that deals exclusively with businesses.,Kappa,crjog0u,17,t5_2tjsd
4066107,0,t1_crjp6aa,Random  rough I suppose,Kappa,crjrjjh,1,t5_2tjsd
4066503,0,t1_crjslyi,The cutoff point will be  points this year as opposed to the something last year.Would take an incredible meltdown for him not to reach that now but winning in Germany means he can seal his place in May.,Kappa,crjt626,3,t5_2tjsd
4066758,0,t1_crjtwcs,WELCOME TO AMERICA,Kappa,crju7si,9,t5_2tjsd
4067247,0,t3_375ktk,okizami,Kappa,crjw7uz,-5,t5_2tjsd
4067876,0,t3_3750wt,I think this is what hes trying to do  Kappa,Kappa,crjysqb,3,t5_2tjsd
4069787,0,t3_375kxl,Yo pass that blunt spooky!?,Kappa,crk6m5x,1,t5_2tjsd
4075891,0,t3_379xhw,Mizzimiegt  UTCgtEspeon teaser. Taken by regineanne gtD pic.twitter.com ImgurMistake? leave above link unaltered.SuggestionFAQCodeIssues,Kappa,crkvm3n,0,t5_2tjsd
4076820,0,t1_crklm9r,Could have sworn i read somewhere that it was around  but thanks for the correction,Kappa,crkzf44,0,t5_2tjsd
4077053,0,t1_crkyvzj,gtgtusing emp taggtnot empandersonsilvagtnot empotosanitwontfit,Kappa,crl0dha,12,t5_2tjsd
4077585,0,t3_379sfw,Damn man if this was going to happen we maybe should have pulled a fundraiser from one of the more recent events.CEO is one of the best majors of the year and someone with a Kappa tag placing at Evo would piss some people off real good.  Really tough decision.  Doing both would be optimal.  I pick Evo for the salt factor though.EVO,Kappa,crl2jx8,2,t5_2tjsd
4078588,0,t3_379sfw,CEOEveryone is pretty much guaranteed to go to Evo so I want to make CEO better.,Kappa,crl6nn3,2,t5_2tjsd
4080006,0,t1_crl43o2,lol SBBLs question has a lot more going for itself than it looks at first sight yet you guys apparently stopped reading when you understood his post as just shittalking about justin.,Kappa,crlch98,-1,t5_2tjsd
4082283,0,t1_crlkt0r,Mike Z doin the lords work.,Kappa,crlltla,14,t5_2tjsd
4083084,0,t1_crlov3u,no worries.  i always try to mix my snark with actual advicesomeone from the streetfighter thread actually linked to uuglints comment in this thread loli dont have a ps so i dont really understand what the touchpad button is.  im looking at a picture of the hrap kai  is it the options button?  this is going to be a nightmare for tournaments,Kappa,crlp3wm,5,t5_2tjsd
4084521,0,t3_37dyvl,kahikusugt  UTCgtUSF Ps  decapres tp nerfed !!  Slow and less distance !! Alioune JehSan NYCPoeM Hurricane vine.coMistake? leave above link unaltered.SuggestionFAQCodeIssues,Kappa,crlv04s,6,t5_2tjsd
4084939,0,t1_crlw539,Its an impersonator Whats crazy is they went to all the trouble to make believable posts prior to this.,Kappa,crlwpuz,6,t5_2tjsd
4085479,0,t3_37edqe,rtechsupport,Kappa,crlyxh4,14,t5_2tjsd
4086313,0,t3_37eqpa,JayViscantgt  UTCgtHey guys just remember you dont have to worry about bad ports of Marvel at Evo or weird patches. Marvels as good as it ever was!Mistake? leave above link unaltered.SuggestionFAQCodeIssues,Kappa,crm2cmt,2,t5_2tjsd
4087649,0,t1_crm310n,Ill watch that shit,Kappa,crm7tuy,7,t5_2tjsd
4087949,0,t3_37evuo,Art is annoying. ,Kappa,crm924y,9,t5_2tjsd
4089185,0,t3_37fvgm,TheGoldphishIm gonna be there anyways so give me money for Popeyes and Ill place in the top  of any game.  Its still a better investment than Myers.,Kappa,crme47s,1,t5_2tjsd
4089732,0,t1_crmgalj,Bailey Jay is from Richmond Virginia United States. HeShe is an American trans woman who is a pornographic actress adult model and podcaster. Curently Baily has an O Ring strech of about cm.,Kappa,crmgd11,11,t5_2tjsd
